Wed Nov 07 23:04:23 +0000 2018,By one estimate  less than 4% of the world’s seamounts have been directly sampled. Before mining begins  more resea… https://t.co/c58VozMKUx,1
Wed Nov 07 23:04:00 +0000 2018,By one estimate  less than 4% of the world’s seamounts have been directly sampled. Before mining begins  more resea… https://t.co/c58VozMKUx,1
Wed Nov 07 22:17:55 +0000 2018,How should investors approach the challenges that come with mining? #Invest4Tomorrow https://t.co/JDfIRrf8Si,0
Wed Nov 07 22:00:50 +0000 2018,Poland's JSW eyes controlling stake in Prairie Mining -CEO https://t.co/EUcR7z5cvJ,0
Wed Nov 07 21:34:42 +0000 2018,The economy saw job gains in crucial sectors...  +32 000 in Manufacturing  +30 000 in Construction   +25 000 in Tra… https://t.co/JJJOqyRWyf,227
Wed Nov 07 21:34:12 +0000 2018,Venezuelan lawyer and @GWUIDS alumna Maria is working towards gender equality in mining  oil and gas policy at… https://t.co/ARaH0oenZf,0
Wed Nov 07 21:26:11 +0000 2018,The economy saw job gains in crucial sectors...  +32 000 in Manufacturing  +30 000 in Construction   +25 000 in Tra… https://t.co/JJJOqyRWyf,227
Wed Nov 07 20:49:52 +0000 2018,Groundbreaking research shows that #silver can be used to kill serious infections in the brain. Get the full story… https://t.co/spsCnkjyyD,1
Wed Nov 07 20:25:00 +0000 2018,“AI will be deployed in almost every sector of the economy—companies in #mining  agriculture  healthcare […] are al… https://t.co/nlW8ka8hfm,0
Wed Nov 07 20:20:13 +0000 2018,Groundbreaking research shows that #silver can be used to kill serious infections in the brain. Get the full story… https://t.co/spsCnkjyyD,1
Wed Nov 07 20:10:00 +0000 2018,ICYMI: The U.S. Supreme Court heard arguments about Virginia's ban on #uranium mining  which companies and the Trum… https://t.co/bjSDDBTUe9,0
Wed Nov 07 20:01:37 +0000 2018,A risk management plan is the backbone to running safe #mining operations. Develop a plan here: https://t.co/5XwjACrYYA,0
Wed Nov 07 20:00:48 +0000 2018,Indonesia hauling ban could paralyse South Sumatra coal mining – Assoc https://t.co/fT6qqV2Rvm,0
Wed Nov 07 19:40:12 +0000 2018,Want to dive into federal civil rights data but don't know where to begin? Our recent webinar with @AnnieWaldman an… https://t.co/sOURp2s7TW,0
Wed Nov 07 18:28:42 +0000 2018,#DYK that U.S. minerals #mining supports more than 1.2 million jobs? Minerals are the bedrock of our economy  and i… https://t.co/KMoXamrYKe,7
Wed Nov 07 17:27:03 +0000 2018,A report was just published on the energy and carbon costs for cryptomining. Elite Mining uses sustainable energy i… https://t.co/doxLHqU9vA,4
Wed Nov 07 17:19:48 +0000 2018,@BeauJangles97 @AGallcobhair @TheReal_Ikrani @GOPChairwoman @realDonaldTrump What's your suggestion when that's Con… https://t.co/aWdRMz3eLH,0
Wed Nov 07 17:00:51 +0000 2018,Mining bitcoin takes 3 times more energy than extracting gold or copper  new research says https://t.co/4nX9wT8e7v https://t.co/4nX9wT8e7v,0
Wed Nov 07 16:55:13 +0000 2018,#DYK: @USAID partners to develop commercially viable  conflict-free supply chains for gold &amp; support economic livel… https://t.co/HxBD1r55g2,0
Wed Nov 07 16:50:00 +0000 2018,Mining bitcoin is 3 times more expensive than mining gold  research paper finds https://t.co/4NzE0GBxQC,0
