Tue Sep 19 23:33:44 +0000 2017,#RRN https://t.co/D8g2KvJww3 The price of bitcoin has a 91% correlation with Google searches for bitcoin,0
Tue Sep 19 23:28:35 +0000 2017,@superat169 So idk anything about bitcoin but my barber was talking about it yesterday and it made me think of you lol.,0
Tue Sep 19 23:10:48 +0000 2017,South African Pick n Pay is Testing Bitcoin Payments https://t.co/YycWFKyGsR,0
Tue Sep 19 23:10:45 +0000 2017,Bitcoin  The Millennial Retirement Nest Egg https://t.co/jj6oO2woRp,0
Tue Sep 19 22:19:27 +0000 2017,Aliant Payment Systems Aims To Take Bitcoin Mainstream - Aliant has now teamed up with Bitpay to bring Bitcoin mai… https://t.co/NVY50Yf1qk,0
Tue Sep 19 22:11:27 +0000 2017,Pick n Pay Double Take? The Supermarket Chain Isn't Accepting Bitcoin  It Tested It https://t.co/NkGuTyGZ5p,0
Tue Sep 19 21:52:36 +0000 2017,blockchainfreed Bitcoin Price Analysis: Amid Continuing China Rumors  BTC Fails to Break Key Resistance https://t.co/AhrtKizBM0,0
Tue Sep 19 21:51:40 +0000 2017,Bitcoin Price Analysis: Amid Continuing China Rumors  BTC Fails to Break Key Resistance https://t.co/XZgUrHUzMQ,0
Tue Sep 19 21:33:37 +0000 2017,bitcoin atm machine in kansas city missouri - how to get free bitcoins  Watch Now 👉https://t.co/kUndG4EJVE https://t.co/FqZTgvpuRn,0
Tue Sep 19 21:16:29 +0000 2017,Use BTC or DASH to trade Forex  crypto  and more at @whaleclubco. 200x leverage. $1B+ traded every month. #bitcoin https://t.co/ujJpX2LiL5,0
Tue Sep 19 21:08:23 +0000 2017,Transforming the Social Sector: Bitcoin and Blockchain for Good https://t.co/fLVRQDw8vu,0
Tue Sep 19 20:39:12 +0000 2017,Bitcoin will hit $10 000 and even $1 million. Experts predict https://t.co/tE7vsvtr5M,0
Tue Sep 19 20:15:44 +0000 2017,World's Largest Hedge Fund Founder: Bitcoin is a 'Bubble' https://t.co/F5f756JrCr,0
Tue Sep 19 20:00:02 +0000 2017,@kyoto_bitcoin 奇遇ですね。私も5日前に携帯無くして今復旧しました笑っ焦りますよねー。無事で何事もないことを祈ります^^；,0
Tue Sep 19 19:45:45 +0000 2017,Bitcoin's wild ride shows the truth - it is probably worth zero - says Wall Street Journal https://t.co/0d8864tqKx,0
Tue Sep 19 19:42:45 +0000 2017,No matter which way you look at it. Bitcoin is going to dominate our industry for years. Not focusing on bitcoin re… https://t.co/o7R0cHx9tN,0
Tue Sep 19 19:05:37 +0000 2017,Is now the right time for higher Bitcoin fees? https://t.co/tXLWZ2gV9O,1
Tue Sep 19 19:05:11 +0000 2017,My latest article  "Lesser known reasons to keep blocks small  in the words of Bitcoin Core developers"  https://t.co/NzeTjD06Sj,11
Tue Sep 19 19:05:01 +0000 2017,My latest article on why hard forks will preserve Bitcoin's essential properties: https://t.co/FVQqgQQOmf,5
Tue Sep 19 19:04:07 +0000 2017,1/ Large transaction fee spikes are an inherent side effect of Bitcoin's current low transaction throughput / block size,3
Tue Sep 19 19:04:05 +0000 2017,2/ The demand curve for Bitcoin transactions bends down/left  like this: https://t.co/uzXJsMIgBz,1
Tue Sep 19 18:35:05 +0000 2017,This is why you shouldn’t use texts for two-factor authentication https://t.co/CDIbKlaWnf via @Verge #tech https://t.co/VJ5wkodPBn,0
Tue Sep 19 18:01:53 +0000 2017,Luno raises $9M to bring its bitcoin wallet  exchange and services to Europe https://t.co/8iXKzTxSUH,0
Tue Sep 19 17:59:38 +0000 2017,Luno raises $9M to bring its bitcoin wallet  exchange and services to Europe https://t.co/dBLMyCnD7O #crossnw,0
Tue Sep 19 17:59:03 +0000 2017,Luno raises $9M to bring its bitcoin wallet  exchange and services to Europe https://t.co/8ubi8WUoUS,0
Tue Sep 19 17:48:55 +0000 2017,I want you all to: - Look into China's current credit bubble  - Think about the implications of it popping - Buy Bitcoin bc BTC = no debt $,0
Tue Sep 19 17:41:33 +0000 2017,How #Bitcoin's decentralized record technology could exponentially impact today’s technology platforms @WestMonroe https://t.co/2ogOEEvu3V,0
Tue Sep 19 17:08:08 +0000 2017,Bull Signal? Bitcoin's Price Breaks Above 50-Day Moving Average https://t.co/hMQiMpBsvs,0
Tue Sep 19 17:00:26 +0000 2017,Understanding Bitcoin and cryptocurrencies https://t.co/oszr7wG7SY,0
Tue Sep 19 16:59:09 +0000 2017,Bitcoin Surpasses $5 000 For Brief Time Before Retreating https://t.co/tMOcKUQQ7o,0
Tue Sep 19 16:22:25 +0000 2017,and here comes #Mexico...  The article reads (pardon my poor translation)  "Mexico will not recognize #bitcoin as le…https://t.co/bPBInHe3fX,1
Tue Sep 19 16:20:25 +0000 2017,My Crypto Portfolio Revealed: 10 CryptoCurrencies I Truly Believe In for the Long Term https://t.co/IdIM1KTzGP,0
Tue Sep 19 16:20:20 +0000 2017,My Crypto Portfolio Revealed: 10 CryptoCurrencies I Truly Believe In for the Long Term https://t.co/jl7t3cMILb,0
Tue Sep 19 16:18:58 +0000 2017,and here comes #Mexico...  The article reads (pardon my poor translation)  "Mexico will not recognize #bitcoin as le…https://t.co/bPBInHe3fX,1
Tue Sep 19 16:08:24 +0000 2017,Ray Dalio Calls Bitcoin a Bubble and a Highly Speculative Market https://t.co/MNfAMk5czC,0
Tue Sep 19 15:43:55 +0000 2017,Going Bearish on Bitcoin: Cryptocurrencies are the tulip mania of the 21st century - https://t.co/vzWN8dSLI0,0
Tue Sep 19 15:41:51 +0000 2017,From Blockchains To Mooncakes: Two Chinese Crypto Founders On The ICO And Bitcoin Exchanges Ban https://t.co/TTilAEL7av,0
Tue Sep 19 15:05:20 +0000 2017,Would you invest in Bitcoin or Ether? Why? https://t.co/GfMMOqeHTf,0
Tue Sep 19 14:51:49 +0000 2017,David Knight talks to McAfee about Bitcoin and Chase CEO Dimon comments https://t.co/NrtshkQgKz,0
Tue Sep 19 14:27:48 +0000 2017,Bitcoin ATM How To  My experience in Los Angeles so far  and the next BIG crypto.  Watch Now 👉… https://t.co/0TGx1HNSKT,0
Tue Sep 19 14:24:25 +0000 2017,The CEO of https://t.co/ozZzwp6lsm (Which Accepted Bitcoin) Had A Message For The CEO Of Chase. https://t.co/6JMZS2Y0CI,0
Tue Sep 19 13:20:56 +0000 2017,Katrina Talks About Bitcoin https://t.co/hbUE4ddBXk https://t.co/X1rMPCMjDL,5
Tue Sep 19 12:38:39 +0000 2017,DOJ probes Equifax; China bitcoin ban broadens https://t.co/wpYHEFDvWz,0
Tue Sep 19 11:37:38 +0000 2017,Where there's a will  there's a way. Fearing a ban  Chinese #bitcoin traders simply moved their trades to Japan. Ba… https://t.co/nSZghEbqxr,2
Tue Sep 19 11:17:00 +0000 2017,@steemit @HustleFundBaby #Bitcoin yeeeeeaaaaahhh those don't do the same thing...,0
Tue Sep 19 09:10:31 +0000 2017,The Economic Case for Conservative Bitcoin Development https://t.co/pbzfNL9QAh,0
Tue Sep 19 08:05:32 +0000 2017,$9 Million: Bitcoin Startup Luno Completes Series B Funding https://t.co/2pFYtYGyW1,0
Tue Sep 19 07:12:17 +0000 2017,[Garrubot] With the power of bitcoin  I purchase pants,0
Tue Sep 19 05:56:45 +0000 2017,Where there's a will  there's a way. Fearing a ban  Chinese #bitcoin traders simply moved their trades to Japan. Ba… https://t.co/nSZghEbqxr,2
Tue Sep 19 05:56:44 +0000 2017,All That's Needed To Hack Gmail And Rob Bitcoin: A Name And A Phone Number via @forbes https://t.co/meyG4Cd8j9,0
Tue Sep 19 05:27:34 +0000 2017,Katrina Talks About Bitcoin https://t.co/hbUE4ddBXk https://t.co/X1rMPCMjDL,5
Tue Sep 19 05:20:01 +0000 2017,India Considering Launching Its Own Bitcoin-Like Cryptocurrency https://t.co/I0KhADSrmO,0
Tue Sep 19 05:12:01 +0000 2017,Katrina Talks About Bitcoin https://t.co/hbUE4ddBXk https://t.co/X1rMPCMjDL,5
Tue Sep 19 04:26:37 +0000 2017,Katrina Talks About Bitcoin https://t.co/hbUE4ddBXk https://t.co/X1rMPCMjDL,5
Tue Sep 19 04:06:00 +0000 2017,Katrina Talks About Bitcoin https://t.co/hbUE4ddBXk https://t.co/X1rMPCMjDL,5
Tue Sep 19 03:58:14 +0000 2017,Katrina Talks About Bitcoin https://t.co/hbUE4ddBXk https://t.co/X1rMPCMjDL,5
Tue Sep 19 03:53:35 +0000 2017,Thankfully I saw this coming and cashed in my Jeffrey bucks for Bitcoin a year ago. #wokeinvesting @ReformedBroker https://t.co/drlRdzFiI5,0
Tue Sep 19 03:51:39 +0000 2017,Bitcoin fees are getting high. Should @OpenBazaar support multiple crypto currencies? See more here https://t.co/ZVV4AcASXD,35
Tue Sep 19 03:45:25 +0000 2017,@hashflare keep in mind  buy #BTC ur USD/Fiat grows. Invest in mining BTC n ur Bitcoin grows! use link for 10% bonus https://t.co/YnlPBVH0wr,0
Tue Sep 19 03:41:37 +0000 2017,JPMorgan Helps Clients Buy Bitcoin Despite CEO Calling Bitcoin 'a Fraud' - FORTUNE https://t.co/qUHaWCtlO6,0
Tue Sep 19 03:25:03 +0000 2017,Bitcoin: Way to the future or a path to financial ruin? https://t.co/G7f4eEgiaD https://t.co/CWue7mg23p,0
Tue Sep 19 03:19:20 +0000 2017,Bitcoin Exchange bitFlyer Hopes to Win Big With the Japanese Bankers Association https://t.co/3DwEIX9Uba,0
Tue Sep 19 02:47:18 +0000 2017,China Widens Bitcoin Crackdown Beyond Commercial Trading https://t.co/7l0KHAHEOh,0
Tue Sep 19 02:47:17 +0000 2017,Watch This "Hacker" Pickpocket a Bitcoin Wallet in Less Than 3 Minutes https://t.co/CmgRvV8e2h,0
Tue Sep 19 02:38:31 +0000 2017,Yes! | Opinion | What Jamie Dimon Got Wrong About Bitcoin and Tulips - Bloomberg https://t.co/DCSqxReYqF https://t.co/oygptHmOQC,2
Tue Sep 19 02:12:26 +0000 2017,Asking a bank CEO what he thinks of bitcoin is like asking the head of the post office what he thinks of e-mail.,0
Tue Sep 19 02:00:07 +0000 2017,"Streetlight effect": 1141 views/day  12% complete. https://t.co/gF4AXx6E5n #bitcoin https://t.co/hCaDawZObX,0
Tue Sep 19 01:42:07 +0000 2017,Bitcoin  hailed in some quarters as the future of currency  is having a rough period  with a flurry of rumors... https://t.co/4Ro5TpNUmR,0
Tue Sep 19 01:19:06 +0000 2017,James Mackintosh of @WSJ says Bitcoin is probably worth $0: https://t.co/FTJGsg52WC,0
Tue Sep 19 00:54:48 +0000 2017,What is Bitcoin? https://t.co/LwuCGwjs5j,0
Tue Sep 19 00:52:14 +0000 2017,@jakeadelstein Bitcoin’s Wild Ride Shows The Truth - The Wall Street Journal "Too freaking risky!" https://t.co/Lu3qH4M0yf,0
Tue Sep 19 00:50:04 +0000 2017,Bitcoin: Way to the future or a path to financial ruin? https://t.co/F4Ce1eeAHx https://t.co/yEvhvUe03s,0
Tue Sep 19 00:40:23 +0000 2017,Get A #Crypto Debit Card With @Cryptopay Today! https://t.co/W6HtGve1yG #Bitcoin #Ethereum #Litecoin https://t.co/W6HtGve1yG,28
Tue Sep 19 00:40:07 +0000 2017,Start Gambling with #Bitcoin  #Litecoin  #Ethereum  and #Burstcoin Today! @ https://t.co/EIuRft0Zji! #Gambling #RT https://t.co/sRswdhlPAv,70
