Sat May 12 23:54:01 +0000 2018,The author of this article gives his pros and cons of cryptocurrency index fund for self-directed IRAs. via @forbes… https://t.co/KfUOtuzRdK,0
Sat May 12 23:42:59 +0000 2018,Heuristic to determine the most valuable cryptocurrency:  Whichever took the most work to create.,1
Sat May 12 23:20:02 +0000 2018,Speaking in a bit at #svief full house! #Blockchain #cryptocurrency https://t.co/gSbkgIzxoD,0
Sat May 12 23:00:07 +0000 2018,China Gov’t Will Publish Cryptocurrency Analysis Amid ‘Lack Of Independent Ratings’ Are you curious about the resul… https://t.co/rgMrPdTTD4,0
Sat May 12 22:50:04 +0000 2018,First Regulated Ethereum Futures Launch On Cryptocurrency Platform: https://t.co/3LLIM3nELt By @DelRayMan https://t.co/Eo5psrUP6K,0
Sat May 12 22:49:41 +0000 2018,How cryptocurrency has transformed Silvergate Bank of San Diego from a tiny operation to a sizable firm. https://t.co/nd02ikJVFI,1
Sat May 12 22:49:33 +0000 2018,Six Alternatives to Telegram for Cryptocurrency Communities https://t.co/ByRINwiQlW https://t.co/k2iclvpGg9,1
Sat May 12 22:37:17 +0000 2018,Ingredients in the recipe of "what makes cryptocurrency interesting":  - Scarce - Global - Programmable - Interoper… https://t.co/nY2Hy7PFwD,34
Sat May 12 22:34:07 +0000 2018,How To Buy #CindicatorCND - April 2018 - https://t.co/TtFCUDj8yd #BuyingGuides #Cryptocurrency #Crypto #altcoin… https://t.co/1h46I1XoGV,0
Sat May 12 22:30:53 +0000 2018,Ingredients in the recipe of "what makes cryptocurrency interesting":  - Scarce - Global - Programmable - Interoper… https://t.co/nY2Hy7PFwD,34
Sat May 12 22:28:06 +0000 2018,BlockChannel:Bitcoin Magazine’s Week in Review For May 12: Markets  Miners and Conferences https://t.co/N8PqfMEP8J… https://t.co/3ppbo8pGqj,0
Sat May 12 22:22:20 +0000 2018,#Ether is currently considered a commodity but there’s “flexibility” for the #SEC to choose either direction going… https://t.co/gFSAr905EK,5
Sat May 12 22:16:57 +0000 2018,@AltOne_Crypto @LisaNEdwards @flopthenutz @xunairxaman YOU ALREADY EXITED and left us in the scary water for the wh… https://t.co/V7TEFw9O2p,0
Sat May 12 22:16:01 +0000 2018,Six Alternatives to Telegram for Cryptocurrency Communities https://t.co/ByRINwiQlW https://t.co/k2iclvpGg9,1
Sat May 12 22:10:59 +0000 2018,Blockchain-Powered Beer Vending Machine Set to Debut at Consensus 2018 https://t.co/x6NAJ8gW2v #bitcoin #bitcoinnews #btc #cryptocurrency,0
Sat May 12 22:09:56 +0000 2018,Facebook Is Reportedly “Serious” About Launching a Cryptocurrency https://t.co/Ar3WG12wny,0
Sat May 12 22:08:46 +0000 2018,Congressional Candidate Vows to Gauge Voter Sentiment With Blockchain https://t.co/QD777ZbHv1 #bitcoin #bitcoinnews #btc #cryptocurrency,0
Sat May 12 22:08:44 +0000 2018,A Daily Show Comedian Showed Up to Roast an Ethereum Conference https://t.co/XkYfwXoX3K #bitcoin #bitcoinnews #btc #cryptocurrency,0
Sat May 12 22:05:03 +0000 2018,How cryptocurrency has transformed Silvergate Bank of San Diego from a tiny operation to a sizable firm. https://t.co/nd02ikJVFI,1
Sat May 12 22:04:04 +0000 2018,#altcoins  #Decoin #DTEP This platform is a prime example of what a future crypto-world might look like. In order f… https://t.co/GLUWK3Yvbh,0
Sat May 12 22:01:10 +0000 2018,I'm starting a new stealth initiative running the biggest #blockchain experiment across colleges. Looking for ambas… https://t.co/xMzxKEemSa,1
Sat May 12 21:55:22 +0000 2018,What Is Aphelion Cryptocurrency? https://t.co/E45jI2361N,4
Sat May 12 21:47:02 +0000 2018,What will happen to Ethereum in 2018? https://t.co/0Ll9sbI5OA #coinbase #kraken #bitcoin #gemini #litecoin… https://t.co/8jKwsTT6jE,0
Sat May 12 21:46:04 +0000 2018,Facecoin? Facetherium? Zuckbux? https://t.co/ofMUIxDi7s,14
Sat May 12 21:40:25 +0000 2018,Korean prosecutors have conducted search and seizure against the nation’s largest cryptocurrency exchange  UPbit  o… https://t.co/v9x8rto1B0,0
Sat May 12 21:37:30 +0000 2018,The project has great prospects.certainly at the moment I believe that this is the best project in the cryptocurren… https://t.co/QpoXafc6SJ,0
Sat May 12 21:34:58 +0000 2018,At the moment  such a situation that weak projects go  and the strong remain.  And this is just one of the stronges… https://t.co/dfqBAneQ7P,0
Sat May 12 21:34:37 +0000 2018,#swftc $swftc #crypto #cryptocurrency #bitcoin #btc #Bitcoin #altcoins #eth #blockchain https://t.co/9iFTClrxtI https://t.co/ZLaXZKORC5,0
Sat May 12 21:33:37 +0000 2018,Flash PolI... I feel that the direction of the crypto market over the next 6 months will be... ?  #cryptocurrency… https://t.co/0eE4CyyRA9,0
Sat May 12 21:12:36 +0000 2018,The FEAR continues...  Crypto Fear and Greed Index... what emotion is driving the market today?... FEAR… https://t.co/Qpa03oAnj5,0
Sat May 12 21:00:51 +0000 2018,Yumerium is a utility token. We are developing a platform on the blockchain network to optimize the virtual economi… https://t.co/7CnaDPRQMM,70
Sat May 12 20:52:35 +0000 2018,When IRS guys see you 😏 RT if it makes you laugh 😂 🤣  #cryptocurrency #cryptotrading #cryptocrash #irs #cryptotax… https://t.co/nv38mka3zZ,0
Sat May 12 20:40:51 +0000 2018,How emerging solutions are striving to find ways to combat disparaging financial management data via @Inc… https://t.co/oHSVg8iN4w,300
Sat May 12 20:39:00 +0000 2018,Yes Sweden is launching a national #Cryptocurrency  but its not Kryptonex. via @buge44 https://t.co/qEZ9I2AKkE https://t.co/pF8ddn8BAa,2
Sat May 12 20:32:07 +0000 2018,20-30M users in the crypto space. Remember this number and today's date  because in a few years we'll bring the fir… https://t.co/Wfo5XDJLep,79
Sat May 12 20:31:59 +0000 2018,How emerging solutions are striving to find ways to combat disparaging financial management data via @Inc… https://t.co/oHSVg8iN4w,300
Sat May 12 20:30:30 +0000 2018,Cybersecurity Ventures predicts that by 2021 more than 70% of all cryptocurrency transactions annually will be for… https://t.co/2rdXBi1s1Q,2
Sat May 12 20:28:57 +0000 2018,When your social network growth looks like Bitcoin's big boom!  #Viral #Community #Decibels #Marketing… https://t.co/Eoj5hpkaKC,1327
Sat May 12 20:28:15 +0000 2018,Have you gotten to meet the team yet?  Let's start with our awesome Advisor and Non-Executive Chairman of Board Mic… https://t.co/pfEfPkeESs,1436
Sat May 12 20:27:46 +0000 2018,Are you all ready for the final round of the Decibels Bounty Program?  We are excited for the upcoming contests and… https://t.co/pte7CxdG2N,2041
Sat May 12 20:27:32 +0000 2018,Some key points from @g20org held in Argentina. It had a very innovative outlook on cryptocurrency. ICO's are here… https://t.co/cWcskgDfcR,2619
Sat May 12 20:21:02 +0000 2018,Bitcoin Cash (BCH.X): price analysis and prediction https://t.co/GrTKKiBUVN Bitcoin Cash (BCH.X) is widely touted i… https://t.co/9b2zvH9gri,0
Sat May 12 20:18:55 +0000 2018,Bitcoin Shows Some Resilience in the Midst of Widespread Crypto Price https://t.co/oeB5eY89JC #bitcoin #bitcoinnews #btc #cryptocurrency,1
Sat May 12 20:09:28 +0000 2018,Bitcoin Shows Some Resilience in the Midst of Widespread Crypto Price https://t.co/oeB5eY89JC #bitcoin #bitcoinnews #btc #cryptocurrency,1
Sat May 12 20:07:48 +0000 2018,Facebook Cryptocurrency? – Yeh. We Saw This Coming! https://t.co/TaLXkuldxr https://t.co/RNClCuUzaL,7
Sat May 12 20:04:15 +0000 2018,What Is Aphelion Cryptocurrency? https://t.co/AirHehnSUN,0
Sat May 12 20:02:30 +0000 2018,Sam Altman considers the possibilities for a national digital currency - https://t.co/lSkghF4K1M,0
Sat May 12 20:00:24 +0000 2018,Lol  women are welcome come into cryptocurrency when they can figure out that the internet consists of more than in… https://t.co/4hIkIKfZ3U,0
Sat May 12 20:00:06 +0000 2018,【過去記事】  仮想通貨ブログがお金になる仕組み！  https://t.co/OklRxn94SL,0
Sat May 12 19:59:14 +0000 2018,Happy Friday! Time for our weekly dev update! Come see what we've been up to!   https://t.co/hrA4jGAZhk  #cryptocurrency #blockchain $TAU,24
Sat May 12 19:51:27 +0000 2018,As long as any single cryptocurrency can be mined  and any single crypto currency is private  then Distributed Exch… https://t.co/HvYhUrv1Lz,145
Sat May 12 19:42:38 +0000 2018,What Is Aphelion Cryptocurrency? https://t.co/E45jI2361N,4
Sat May 12 19:41:16 +0000 2018,First Regulated Ethereum Futures Launch On Cryptocurrency Platform: https://t.co/3LLIM3nELt By @DelRayMan https://t.co/Eo5psrUP6K,0
Sat May 12 19:40:35 +0000 2018,As someone presently attending a conference on zero-knowledge proofs  @CodaProtocol is one of the more interesting… https://t.co/B1hy86Xlfb,22
Sat May 12 19:39:58 +0000 2018,Hey look it’s Ethereum.. looooooolz! #adoption #bitcoin #reality #ethereum #cryptocurrency #blockchain #altcoins… https://t.co/LcJb3JCeLZ,1
Sat May 12 19:39:33 +0000 2018,Decentralize and widely distribute our more abundant future. Leave nobody behind. #cryptocurrency #blockchain… https://t.co/o3Wrjy1etZ,0
Sat May 12 19:39:01 +0000 2018,"The Point-Of-Sale devices will be delivered to retailers in countries including Korea  Japan  Singapore and Switze… https://t.co/ZkHpBTGnbz,0
Sat May 12 19:34:57 +0000 2018,#HODL-ing your $BENJA while we develop  and want to track it alongside your other #crypto holdings? @BenjaCoin is n… https://t.co/h0IjnuoYRG,3
Sat May 12 19:34:07 +0000 2018,Best GPU Configurations for #Mining #MoneroXMR: April 2018 - https://t.co/pHBqviSyrl #Cryptocurrency #Crypto… https://t.co/xScHOOrc5I,0
Sat May 12 19:27:32 +0000 2018,What Is Aphelion Cryptocurrency? https://t.co/E45jI2361N,4
Sat May 12 19:27:31 +0000 2018,What Is Aphelion Cryptocurrency? https://t.co/E45jI2361N,4
Sat May 12 19:24:32 +0000 2018,CBS Gives Cryptocurrency YouTuber His Own Bitcoin Show https://t.co/pF1rMuhtlr,4
Sat May 12 19:23:59 +0000 2018,How emerging solutions are striving to find ways to combat disparaging financial management data via @Inc… https://t.co/oHSVg8iN4w,300
Sat May 12 19:17:20 +0000 2018,Waterloo startup cashing in on cryptocurrency https://t.co/a3fvuvB9l4,0
Sat May 12 19:07:02 +0000 2018,How emerging solutions are striving to find ways to combat disparaging financial management data via @Inc… https://t.co/oHSVg8iN4w,300
Sat May 12 19:06:41 +0000 2018,What Is Aphelion Cryptocurrency? https://t.co/E45jI2361N,4
Sat May 12 19:03:21 +0000 2018,Ingredients in the recipe of "what makes cryptocurrency interesting":  - Scarce - Global - Programmable - Interoper… https://t.co/nY2Hy7PFwD,34
Sat May 12 19:00:26 +0000 2018,Meet the San Diego bank handling most of the cryptocurrency industry https://t.co/nd02ikJVFI,0
Sat May 12 19:00:07 +0000 2018,Facebook ‘Exploring’ Making Its Own Cryptocurrency  Media Report Facebook coin? https://t.co/OKDbbHBd0n Join our… https://t.co/jK1wGxJv6e,0
Sat May 12 18:40:58 +0000 2018,CBS Gives Cryptocurrency YouTuber His Own Bitcoin Show https://t.co/pF1rMuhtlr,4
Sat May 12 18:37:53 +0000 2018,Yumerium is a utility token. We are developing a platform on the blockchain network to optimize the virtual economi… https://t.co/7CnaDPRQMM,70
Sat May 12 18:37:43 +0000 2018,Yumerium is a utility token. We are developing a platform on the blockchain network to optimize the virtual economi… https://t.co/VHdD7cf9Df,54
Sat May 12 18:30:49 +0000 2018,CBS Gives Cryptocurrency YouTuber His Own Bitcoin Show https://t.co/pF1rMuhtlr,4
Sat May 12 18:27:15 +0000 2018,Millennials show an 80% interest in the tokenization of  virtual assets. They are seeking more security  control  a… https://t.co/AFRJ2SwMFm,39
Sat May 12 18:27:11 +0000 2018,Want to know more about @yumeriumtoken and how we are enhancing virtual goods in the gaming industry? Come and chat… https://t.co/F5f3sucJnF,39
Sat May 12 18:26:37 +0000 2018,Where are my real gamers? Maybe we like blockchain technology so much because we use to play with blocks to create… https://t.co/QvIkZGXQOU,34
Sat May 12 18:15:47 +0000 2018,How emerging solutions are striving to find ways to combat disparaging financial management data via @Inc… https://t.co/oHSVg8iN4w,300
Sat May 12 18:11:27 +0000 2018,Ex-JP Morgan Blockchain Lead Hints at Stealth Startup Vision https://t.co/GrezvA5ARn #bitcoin #bitcoinnews #btc #cryptocurrency,0
Sat May 12 18:09:39 +0000 2018,CBS Gives Cryptocurrency YouTuber His Own Bitcoin Show https://t.co/pF1rMuhtlr,4
Sat May 12 18:07:39 +0000 2018,I'm starting a new stealth initiative running the biggest #blockchain experiment across colleges. Looking for ambas… https://t.co/xMzxKEemSa,1
Sat May 12 18:06:18 +0000 2018,CBS Gives Cryptocurrency YouTuber His Own Bitcoin Show https://t.co/pF1rMuhtlr,4
Sat May 12 18:06:13 +0000 2018,For Those Who ‘HEDL’ – The New Cryptomatic Watch Inspired By the Bitcoin Ho https://t.co/HflWsLIgOb #bitcoin… https://t.co/1ngGeDQBbg,0
Sat May 12 17:51:35 +0000 2018,Have you gotten to meet the team yet?  Let's start with our awesome Advisor and Non-Executive Chairman of Board Mic… https://t.co/pfEfPkeESs,1436
Sat May 12 17:51:12 +0000 2018,When your social network growth looks like Bitcoin's big boom!  #Viral #Community #Decibels #Marketing… https://t.co/Eoj5hpkaKC,1327
Sat May 12 17:50:57 +0000 2018,Are you all ready for the final round of the Decibels Bounty Program?  We are excited for the upcoming contests and… https://t.co/pte7CxdG2N,2041
Sat May 12 17:50:46 +0000 2018,Some key points from @g20org held in Argentina. It had a very innovative outlook on cryptocurrency. ICO's are here… https://t.co/cWcskgDfcR,2619
Sat May 12 17:44:49 +0000 2018,Ingredients in the recipe of "what makes cryptocurrency interesting":  - Scarce - Global - Programmable - Interoper… https://t.co/nY2Hy7PFwD,34
Sat May 12 17:32:19 +0000 2018,How emerging solutions are striving to find ways to combat disparaging financial management data via @Inc… https://t.co/oHSVg8iN4w,300
Sat May 12 17:26:29 +0000 2018,Everything you need to know about Cryptocurrency's &amp; Blockchain❗ John Oliver's surprisingly clear  accurate and hil… https://t.co/DpRQlsyoPb,0
Sat May 12 17:26:03 +0000 2018,Facebook reportedly plans to launch its own cryptocurrency https://t.co/HtqvrqHf0q,3
Sat May 12 17:26:03 +0000 2018,Bitcoin has been around since 2008  but which countries are the biggest users? Reuters put together this article ex… https://t.co/QOantJOWJn,23
Sat May 12 17:10:20 +0000 2018,How emerging solutions are striving to find ways to combat disparaging financial management data via @Inc… https://t.co/oHSVg8iN4w,300
Sat May 12 17:07:11 +0000 2018,Stay fierce. - #truth #quotes #original #business #success #influencer #blog #vlog #podcast #meditation… https://t.co/0gfrR7cQDJ,0
Sat May 12 16:50:24 +0000 2018,Facebook Cryptocurrency? – Yeh. We Saw This Coming! https://t.co/TaLXkuldxr https://t.co/RNClCuUzaL,7
Sat May 12 16:49:25 +0000 2018,Facebook Cryptocurrency? – Yeh. We Saw This Coming! https://t.co/TaLXkuldxr https://t.co/RNClCuUzaL,7
Sat May 12 16:44:58 +0000 2018,Ingredients in the recipe of "what makes cryptocurrency interesting":  - Scarce - Global - Programmable - Interoper… https://t.co/nY2Hy7PFwD,34
Sat May 12 16:42:27 +0000 2018,Some key points from @g20org held in Argentina. It had a very innovative outlook on cryptocurrency. ICO's are here… https://t.co/cWcskgDfcR,2619
Sat May 12 16:39:38 +0000 2018,Ingredients in the recipe of "what makes cryptocurrency interesting":  - Scarce - Global - Programmable - Interoper… https://t.co/nY2Hy7PFwD,34
Sat May 12 16:39:08 +0000 2018,Facebook rumored to be working on its own cryptocurrency. What should they call it?  https://t.co/XBG3StxhZ4,17
Sat May 12 16:36:04 +0000 2018,Facebook Cryptocurrency? – Yeh. We Saw This Coming! https://t.co/TaLXkuldxr https://t.co/RNClCuUzaL,7
Sat May 12 16:34:32 +0000 2018,Facebook Cryptocurrency? – Yeh. We Saw This Coming! https://t.co/TaLXkuldxr https://t.co/RNClCuUzaL,7
Sat May 12 16:34:29 +0000 2018,Facebook Cryptocurrency? – Yeh. We Saw This Coming! https://t.co/TaLXkuldxr https://t.co/RNClCuUzaL,7
Sat May 12 16:34:27 +0000 2018,Facebook Cryptocurrency? – Yeh. We Saw This Coming! https://t.co/TaLXkuldxr https://t.co/RNClCuUzaL,7
Sat May 12 16:34:06 +0000 2018,How To Buy #CindicatorCND - April 2018 - https://t.co/TtFCUDj8yd #BuyingGuides #Cryptocurrency #Crypto #altcoin… https://t.co/4k3yhfVSZv,0
Sat May 12 16:33:02 +0000 2018,Facebook Cryptocurrency? – Yeh. We Saw This Coming! https://t.co/TaLXkuldxr https://t.co/RNClCuUzaL,7
Sat May 12 16:30:43 +0000 2018,RT @zerohedge: FACEBOOK IS SAID TO MULL CREATING OWN CRYPTOCURRENCY: CHEDDAR,0
Sat May 12 16:28:03 +0000 2018,#hashcard #ico #bitcoin #cryptocurrency @hashcard #ICO “Your every positive action in your life will increase your… https://t.co/Vm7FyXYapm,1
Sat May 12 16:24:33 +0000 2018,Facebook may launch its own cryptocurrency  https://t.co/ByKv93Acu7,0
Sat May 12 16:23:44 +0000 2018,BlockChannel:China Takes Another Step Forward in Promoting Blockchain Innovation https://t.co/hGxw0DqAbP #fintech… https://t.co/Y8LnS9L7zc,1
Sat May 12 16:18:32 +0000 2018,"The blockchain and the new possibilities it provides (immutable ledger  smart contract  and cryptocurrency) introd… https://t.co/zwlWkedzSS,405
Sat May 12 16:08:13 +0000 2018,Reminder: Only a few days left to register for our #Blockchain &amp; #Fintech Meetup in Dubai: https://t.co/e3BYwUPMax… https://t.co/wLoD2deUPK,116
Sat May 12 16:07:22 +0000 2018,At Ethereal Summit  A Human Face On A High-Tech Future https://t.co/SvwnS5kfPX #bitcoin #bitcoinnews #btc #cryptocurrency,0
Sat May 12 16:06:30 +0000 2018,MakerDAO and Blockshipping Collaborate to Transform the Global Container https://t.co/JHZ8DPYGbN #bitcoin #bitcoinnews #btc #cryptocurrency,0
Sat May 12 15:59:06 +0000 2018,Cryptocurrency in brief: Stellar leads the potential market recovery and more $ETH https://t.co/Na8Iy0Xv8z,0
Sat May 12 15:56:23 +0000 2018,#hashcard #ico #bitcoin #cryptocurrency @hashcard #ICO “Your every positive action in your life will increase your… https://t.co/Vm7FyXYapm,1
Sat May 12 15:53:07 +0000 2018,Should bitcoin move over and make way for these more promising cryptocurrencies? https://t.co/4zpUwVeRSi https://t.co/rQUzZEtlGw,0
Sat May 12 15:49:32 +0000 2018,#GigTricks #GigTricksICO #ICO #Cryptocurrency #Blockchain https://t.co/u87Yo8buL0,0
Sat May 12 15:48:56 +0000 2018,#Decoin #bitcoin #cryptocurrency #altcoins #ethereum #ico #tge https://t.co/vykVFQ9ax9,0
Sat May 12 15:45:01 +0000 2018,#hashcard #ico #bitcoin #cryptocurrency @hashcard #ICO https://t.co/AJfZLft7SL,0
Sat May 12 15:44:17 +0000 2018,#ViValid #ViValidservice #cryptocurrency #ICO https://t.co/tvB03K4fJ3,0
Sat May 12 15:43:23 +0000 2018,#TOKPIE #Cryptocurrency #CryptoTrading #CryptoExchange https://t.co/AYRnDwREfh,0
Sat May 12 15:43:04 +0000 2018,#TOKPIE #Cryptocurrency #CryptoTrading #CryptoExchange https://t.co/jfN9g1O0R9,0
Sat May 12 15:39:30 +0000 2018,#XYO #geolocation #Crypto #Blockchain #ether #ethereum #bitcoin #cryptocurrency #ICO #tokensale https://t.co/FfsCe2pYGO,0
Sat May 12 15:38:18 +0000 2018,As long as any single cryptocurrency can be mined  and any single crypto currency is private  then Distributed Exch… https://t.co/HvYhUrv1Lz,145
Sat May 12 15:32:12 +0000 2018,Legends Cryptocurrency $LGD crossed 10-day low (0.00006334 BTC  -30.73% change). https://t.co/2TNBvJZ6Br,0
Sat May 12 15:28:23 +0000 2018,BlockChannel:Bitcoin Magazine’s Week in Review: Markets  Miners and Conferences https://t.co/N8PqfMEP8J #bitcoin… https://t.co/COd14auAY4,0
Sat May 12 15:26:21 +0000 2018,How emerging solutions are striving to find ways to combat disparaging financial management data via @Inc… https://t.co/oHSVg8iN4w,300
Sat May 12 15:12:58 +0000 2018,#GlobalREIT   ready to change  #cryptocurrency   https://t.co/76a5fd6eQD,0
Sat May 12 15:09:02 +0000 2018,Facebook Reportedly ‘Very Serious’ About Creating Its Own Cryptocurrency  W https://t.co/NztK4jLJ9c #bitcoin… https://t.co/qDrh7MA5g6,1
Sat May 12 15:08:05 +0000 2018,Facebook Reportedly ‘Very Serious’ About Creating Its Own Cryptocurrency  W https://t.co/NztK4jLJ9c #bitcoin… https://t.co/qDrh7MA5g6,1
Sat May 12 15:05:55 +0000 2018,How emerging solutions are striving to find ways to combat disparaging financial management data via @Inc… https://t.co/oHSVg8iN4w,300
Sat May 12 15:04:46 +0000 2018,As someone presently attending a conference on zero-knowledge proofs  @CodaProtocol is one of the more interesting… https://t.co/B1hy86Xlfb,22
Sat May 12 15:03:04 +0000 2018,What Is Haven Cryptocurrency? https://t.co/wMtZAv8hsp https://t.co/3wjI6AzeTb,0
Sat May 12 15:02:50 +0000 2018,Ethereum futures to start trading today: https://t.co/FRgieg2o6P By @DelRayMan #EtherealSummit https://t.co/1NzZWaw9xc,3
Sat May 12 14:58:54 +0000 2018,Ingredients in the recipe of "what makes cryptocurrency interesting":  - Scarce - Global - Programmable - Interoper… https://t.co/nY2Hy7PFwD,34
Sat May 12 14:58:53 +0000 2018,AC3 was featured in @Forbes this week as the top #Blockchain project CMOs need to know about!  #crypto #education… https://t.co/nH9TPwcZjx,7
Sat May 12 14:54:37 +0000 2018,As long as any single cryptocurrency can be mined  and any single crypto currency is private  then Distributed Exch… https://t.co/HvYhUrv1Lz,145
Sat May 12 14:52:47 +0000 2018,Cybersecurity Ventures predicts that by 2021 more than 70% of all cryptocurrency transactions annually will be for… https://t.co/2rdXBi1s1Q,2
Sat May 12 14:49:24 +0000 2018,What Is Nexo Cryptocurrency? https://t.co/bPL2vgW8hr,52
Sat May 12 14:43:44 +0000 2018,Ethereum futures to start trading today: https://t.co/FRgieg2o6P By @DelRayMan #EtherealSummit https://t.co/1NzZWaw9xc,3
Sat May 12 14:39:46 +0000 2018,A screenshot of Superset  notifying a new user that their account is still going through the KYC/AML process (… https://t.co/OwP86zuPdM,90
Sat May 12 14:38:28 +0000 2018,BlockChannel:China Takes Another Step Forward in Promoting Blockchain Innovation https://t.co/hGxw0DqAbP #fintech… https://t.co/Y8LnS9L7zc,1
Sat May 12 14:30:38 +0000 2018,RT @themerklenews: EOS Price Loses 20% Overnight as Cryptocurrency Carnage Worsens https://t.co/Cx7BuJDMv6,0
Sat May 12 14:26:48 +0000 2018,New #Blockchain fund backed by Winklevoss twins targets @facebook business model https://t.co/LaRRLp4Sq5… https://t.co/11akjiQ8Wc,2
Sat May 12 14:24:57 +0000 2018,Ethereum futures to start trading today: https://t.co/FRgieg2o6P By @DelRayMan #EtherealSummit https://t.co/1NzZWaw9xc,3
Sat May 12 14:24:04 +0000 2018,Cryptocurrency This Week: Delhi Police Raids Ethereum Mining Unit  Bitcoin Exchange Bitxoxo Closes Pre-Sale ICO  An… https://t.co/qggpqsK1ff,0
Sat May 12 14:16:57 +0000 2018,Ingredients in the recipe of "what makes cryptocurrency interesting":  - Scarce - Global - Programmable - Interoper… https://t.co/nY2Hy7PFwD,34
Sat May 12 14:11:16 +0000 2018,Blockchain Security Takes Spotlight At NYC Innovation Summit https://t.co/LXrAGwMYDo #bitcoin #bitcoinnews #btc #cryptocurrency,0
Sat May 12 14:09:33 +0000 2018,#hashcard #ico #bitcoin #cryptocurrency @hashcard #ICO “Growing older doesn't mean that you are more mature than ev… https://t.co/zByFGQdURr,0
Sat May 12 14:00:25 +0000 2018,#GigTricks #GigTricksICO #ICO #Cryptocurrency #Blockchain https://t.co/4sIj5fWIyG,0
Sat May 12 13:59:50 +0000 2018,#Decoin #bitcoin #cryptocurrency #altcoins #ethereum #ico #tge https://t.co/UMSL45p3Lu,0
Sat May 12 13:55:06 +0000 2018,#hashcard #ico #bitcoin #cryptocurrency @hashcard #ICO https://t.co/Ze8heScbfK,0
Sat May 12 13:54:12 +0000 2018,#ViValid #ViValidservice #cryptocurrency #ICO https://t.co/kDm0oP6EGJ,0
Sat May 12 13:53:40 +0000 2018,#TOKPIE #Cryptocurrency #CryptoTrading #CryptoExchange https://t.co/K6w2Gwe4eD,0
Sat May 12 13:53:31 +0000 2018,#TOKPIE #Cryptocurrency #CryptoTrading #CryptoExchange https://t.co/U4rEOD1AnC,0
Sat May 12 13:53:01 +0000 2018,How emerging solutions are striving to find ways to combat disparaging financial management data via @Inc… https://t.co/oHSVg8iN4w,300
Sat May 12 13:50:17 +0000 2018,#XYO #geolocation #Crypto #Blockchain #ether #ethereum #bitcoin #cryptocurrency #ICO #tokensale https://t.co/50pw3pfyrg,0
Sat May 12 13:36:35 +0000 2018,#hashcard #ico #bitcoin #cryptocurrency @hashcard #ICO“Going into business without a business plan is like going on… https://t.co/Ln6kes2SWG,0
Sat May 12 13:33:13 +0000 2018,BlockChannel:How Japan Is Creating a Template for Cryptocurrency Regulation https://t.co/rEwc5Gp76f #bitcoin… https://t.co/so3E4AT27W,0
Sat May 12 13:28:14 +0000 2018,#GigTricks #GigTricksICO #ICO #Cryptocurrency #Blockchain https://t.co/LEYLXgirCi,0
Sat May 12 13:27:37 +0000 2018,#Decoin #bitcoin #cryptocurrency #altcoins #ethereum #ico #tge https://t.co/GihQpRj8gk,0
Sat May 12 13:24:09 +0000 2018,How emerging solutions are striving to find ways to combat disparaging financial management data via @Inc… https://t.co/oHSVg8iN4w,300
Sat May 12 13:23:24 +0000 2018,#hashcard #ico #bitcoin #cryptocurrency @hashcard #ICO https://t.co/pbuXnONyVs,0
Sat May 12 13:23:07 +0000 2018,How emerging solutions are striving to find ways to combat disparaging financial management data via @Inc… https://t.co/oHSVg8iN4w,300
Sat May 12 13:22:36 +0000 2018,#ViValid #ViValidservice #cryptocurrency #ICO https://t.co/tFZRLWZKa2,0
Sat May 12 13:22:02 +0000 2018,#TOKPIE #Cryptocurrency #CryptoTrading #CryptoExchange https://t.co/gyzcWvYlT7,0
Sat May 12 13:21:50 +0000 2018,#TOKPIE #Cryptocurrency #CryptoTrading #CryptoExchange https://t.co/j7aJWUZQVO,0
Sat May 12 13:17:43 +0000 2018,#XYO #geolocation #Crypto #Blockchain #ether #ethereum #bitcoin #cryptocurrency #ICO #tokensale https://t.co/yiz4uXAZQS,0
Sat May 12 13:13:45 +0000 2018,How emerging solutions are striving to find ways to combat disparaging financial management data via @Inc… https://t.co/oHSVg8iN4w,300
