Sun May 27 23:39:14 +0000 2018,#TRON #TRX will be listed on @IDAX11 the first Mongolian licensed Exchange  which already obtained the authorizatio… https://t.co/1v2UHxxnPG,381
Sun May 27 23:31:16 +0000 2018,We just published our weekly #community #update recapping the week  including hiring a new #COO  impressions from o… https://t.co/OMygSRS1jx,3
Sun May 27 23:30:51 +0000 2018,We just published our weekly #community #update recapping the week  including hiring a new #COO  impressions from o… https://t.co/OMygSRS1jx,3
Sun May 27 23:28:00 +0000 2018,Now that’s an awesome talk! #VC @TimDraper ‘s reply to What’s the future of #blockchain  #crypto #cryptocurrency… https://t.co/zZgTmsGUoA,1
Sun May 27 23:10:43 +0000 2018,HODL $BIX  https://t.co/MeGMUK4SGv  #BIX #bonus #bounty #cryptocurrency #altcoins #blockchain  #HODL https://t.co/U4b1stEVpE,0
Sun May 27 23:05:57 +0000 2018,What Is FuzeX Cryptocurrency? https://t.co/W73b63OFJf,0
Sun May 27 22:49:26 +0000 2018,South Korea Will Focus ‘Positive Aspects’ of Cryptocurrency  Soften Policy https://t.co/TYYsZKgKuj https://t.co/N2hlWZBsH1,3
Sun May 27 22:33:47 +0000 2018,Cryptocurrency continues to make strides and prove to naysayers what so many of us have known for years that the bl… https://t.co/w7tg76wq9G,128
Sun May 27 22:23:58 +0000 2018,We just launched NAS Nano  the official Nebulas cryptocurrency wallet  on Android and iOS. This provides an easy so… https://t.co/uIQmL2yeIi,96
Sun May 27 22:18:14 +0000 2018,South Korea Will Focus ‘Positive Aspects’ of Cryptocurrency  Soften Policy https://t.co/TYYsZKgKuj https://t.co/N2hlWZBsH1,3
Sun May 27 22:17:04 +0000 2018,South Korea Will Focus ‘Positive Aspects’ of Cryptocurrency  Soften Policy https://t.co/TYYsZKgKuj https://t.co/N2hlWZBsH1,3
Sun May 27 22:16:35 +0000 2018,Mark Carney: Bank of England Open to Idea of Central Bank Issued Digital https://t.co/A1Y4IMrPNK #bitcoin #bitcoinnews #btc #cryptocurrency,0
Sun May 27 22:16:04 +0000 2018,South Korea Will Focus ‘Positive Aspects’ of Cryptocurrency  Soften Policy https://t.co/TYYsZKgKuj https://t.co/N2hlWZBsH1,3
Sun May 27 22:15:07 +0000 2018,FYI: decades from now  anyone that invested in cryptocurrency in 2018 will still be seen as an "early investor." Th… https://t.co/E0iS9WUAAQ,66
Sun May 27 22:11:30 +0000 2018,What Is FuzeX Cryptocurrency? https://t.co/znypCqhEEk,2
Sun May 27 22:10:59 +0000 2018,We just launched NAS Nano  the official Nebulas cryptocurrency wallet  on Android and iOS. This provides an easy so… https://t.co/uIQmL2yeIi,96
Sun May 27 22:10:12 +0000 2018,Are you interested in learning about the marketing benefits of #Cryptocurrency? Watch my Q&amp;A with @AdeldMeyer https://t.co/IL3rLEeTJw,3
Sun May 27 22:07:36 +0000 2018,All verified users that login to Superset are given Ethereum addresses to use with Superset now #cryptocurrency… https://t.co/HvBS4DbZwk,70
Sun May 27 21:41:13 +0000 2018,Most important hubs for cryptocurrency outside the US:  1) Berlin 2) Singapore 3) Switzerland 4) Buenos Aires 5) Lo… https://t.co/RNIQ5x6ODQ,64
Sun May 27 21:40:27 +0000 2018,Lol  women are welcome come into cryptocurrency when they can figure out that the internet consists of more than in… https://t.co/4hIkIKfZ3U,0
Sun May 27 21:31:17 +0000 2018,Well this IS good news.. Florida County to Accept Tax Payments in Cryptocurrency https://t.co/ETuqJyJVCu https://t.co/3lOwjQ2awI,0
Sun May 27 21:26:13 +0000 2018,Firefox v63 will protect against site-based cryptocurrency miners - https://t.co/MTu5k57tdU,0
Sun May 27 21:24:55 +0000 2018,Join airdrop worth 488$  Follow this link https://t.co/WXUAiFCqxo and check posts  #Airdrop #live #Token #Ethereum… https://t.co/PPgU2CVTIC,0
Sun May 27 21:12:29 +0000 2018,countinghouse website https://t.co/Wllq87c0Op  #cryptocurrency  #ICO  #tokensale,0
Sun May 27 20:58:03 +0000 2018,What Is Bitcoin Incognito Cryptocurrency? https://t.co/daQbaxPXzh,2
Sun May 27 20:51:32 +0000 2018,Most important hubs for cryptocurrency outside the US:  1) Berlin 2) Singapore 3) Switzerland 4) Buenos Aires 5) Lo… https://t.co/RNIQ5x6ODQ,64
Sun May 27 20:46:41 +0000 2018,Cryptocurrency thief uses "double-spend attack" to steal up to $18M - https://t.co/sWqKGgJzg2,0
Sun May 27 20:34:44 +0000 2018,#TRON #TRX will be listed on @IDAX11 the first Mongolian licensed Exchange  which already obtained the authorizatio… https://t.co/1v2UHxxnPG,381
Sun May 27 20:33:49 +0000 2018,Are you interested in learning about the marketing benefits of #Cryptocurrency? Watch my Q&amp;A with @AdeldMeyer https://t.co/IL3rLEeTJw,3
Sun May 27 20:32:07 +0000 2018,Breaking: @coinbase has acquired @ParadexIO  congrats!  https://t.co/CprQQg8Wpy,901
Sun May 27 20:30:57 +0000 2018,#TRON #TRX will be listed on @IDAX11 the first Mongolian licensed Exchange  which already obtained the authorizatio… https://t.co/1v2UHxxnPG,381
Sun May 27 20:29:29 +0000 2018,Are you interested in learning about the marketing benefits of #Cryptocurrency? Watch my Q&amp;A with @AdeldMeyer https://t.co/IL3rLEeTJw,3
Sun May 27 20:15:44 +0000 2018,Are you interested in learning about the marketing benefits of #Cryptocurrency? Watch my Q&amp;A with @AdeldMeyer https://t.co/IL3rLEeTJw,3
Sun May 27 20:06:17 +0000 2018,Cryptocurrency-Based Hiring Scheme That Pays Workers in Real Time https://t.co/ToHdmHADlf,0
Sun May 27 20:06:02 +0000 2018,What Is Bitcoin Incognito Cryptocurrency? https://t.co/daQbaxPXzh,2
Sun May 27 19:50:32 +0000 2018,Talk about eating your own dogfood. Check out this screenshot of a Superset smart contract that handles signing up… https://t.co/1kCP8BL1Nd,95
Sun May 27 19:50:17 +0000 2018,Bitcoin has been around since 2008  but which countries are the biggest users? Reuters put together this article ex… https://t.co/QOantJOWJn,23
Sun May 27 19:23:02 +0000 2018,Coming to grips with compliance and regulation for cryptocurrency traders https://t.co/eXQWz9qFWs via @VentureBeat… https://t.co/IG9O0h8Net,0
Sun May 27 19:18:38 +0000 2018,👋Hey Guys  Please have a look at this video that tells you the step by step procedure to get yourself Whitelisted f… https://t.co/EoJ6113gUg,16
Sun May 27 19:11:13 +0000 2018,#TRON #TRX will be listed on @IDAX11 the first Mongolian licensed Exchange  which already obtained the authorizatio… https://t.co/1v2UHxxnPG,381
Sun May 27 19:07:02 +0000 2018,‘Bitcoin Is The Future  Blockchain Is Bullshit’: Andreas Antonopoulos Pre https://t.co/JQcXHYfnxZ #bitcoin #bitcoinnews #btc #cryptocurrency,0
Sun May 27 18:48:27 +0000 2018,The time is now for decentralized virtual asset exchanges in the  game economy. Learn more  ...www.yumerium.com---&gt;… https://t.co/8uckOQIfXn,39
Sun May 27 18:48:16 +0000 2018,Yumerium is a utility token. We are developing a platform on the blockchain network to optimize the virtual economi… https://t.co/VHdD7cf9Df,73
Sun May 27 18:39:29 +0000 2018,@alistairmilne Most of people don't even know what is cryptocurrency. and  believe "Bitcoin is a virtual currency. "",0
Sun May 27 18:38:09 +0000 2018,Top 5 Reasons dideo just released for why we at #CryptoMusic think that @scidexofficial is the most promising… https://t.co/yRAkJdrnBB,3
Sun May 27 18:23:40 +0000 2018,CRYPTOCURRENCY CONTINUES DECLINE  Grand Nagus Zek’s predictions have come true as crypto coins have continued to de… https://t.co/u9aXyxzWNI,3
Sun May 27 18:18:39 +0000 2018,Most important hubs for cryptocurrency outside the US:  1) Berlin 2) Singapore 3) Switzerland 4) Buenos Aires 5) Lo… https://t.co/RNIQ5x6ODQ,64
Sun May 27 18:05:08 +0000 2018,A Fast Cryptocurrency for Micro Payments  0.9.8 released https://t.co/SM7H5Mhv8z #Ruby #TeX #Shell #Gherkin #Makefile,0
Sun May 27 18:02:31 +0000 2018,Will a Facebook coin be available in the future? The company is said to be exploring plans to create its own crypto… https://t.co/FefQAdUuyU,8
Sun May 27 17:54:08 +0000 2018,By many accounts  the #BitLicense has been a spectacular failure. However  the need for #regulation of the… https://t.co/dcKqQhLzz1,3
Sun May 27 17:50:58 +0000 2018,join our telegram communty : https://t.co/MK0n9zY5B6       #cryptocurrency #btc,0
Sun May 27 17:49:21 +0000 2018,Join our Telegram channel for airdrops and instruction  Link https://t.co/vlxDLhonDZ  Join us now! Share this post… https://t.co/232lcEMfj4,1
Sun May 27 17:42:53 +0000 2018,We made a spotlight video of our favorite supply chain project - @origin_trail! https://t.co/LaAUwJ1Yp9 Would love… https://t.co/2KdxIOMqDK,0
Sun May 27 17:41:41 +0000 2018,A Fast Cryptocurrency for Micro Payments  0.9.7 released https://t.co/SM7H5Mhv8z #Ruby #TeX #Shell #Gherkin #Makefile,0
Sun May 27 17:40:16 +0000 2018,CryptoPriceAlerts – App for Live Cryptocurrency Prices - Trading Alert https://t.co/puxWW8omqP https://t.co/sVoB5eNnS7,0
Sun May 27 17:26:06 +0000 2018,Yumerium is a utility token. We are developing a platform on the blockchain network to optimize the virtual economi… https://t.co/qCgg49dPlG,32
Sun May 27 17:25:48 +0000 2018,Happy International Women's Day! Our global team here at Yumerium is comprised of the most intelligent  ambitious … https://t.co/LnWfNn77b6,32
Sun May 27 17:23:25 +0000 2018,Join our Telegram channel for airdrops and instruction  Link https://t.co/vlxDLhonDZ  Join us now! Share this post… https://t.co/232lcEMfj4,1
Sun May 27 17:20:31 +0000 2018,Reminder: POS is not new  nor is it a panacea.  Proof-of-Work is perhaps bitcoin's greatest innovation. It's a sign… https://t.co/AaC9yg4peY,23
Sun May 27 17:11:49 +0000 2018,#TRON #TRX will be listed on @IDAX11 the first Mongolian licensed Exchange  which already obtained the authorizatio… https://t.co/1v2UHxxnPG,381
Sun May 27 17:07:00 +0000 2018,3 Cryptocurrencies and an ICO with Major Events in June (ETC  EOS  ONT) https://t.co/Mn2MYsXTU1 #bitcoin #bitcoinnews #btc #cryptocurrency,0
Sun May 27 16:55:36 +0000 2018,My latest #cryptomusic video for the #top #science #bigdata #disrupter #2018 #ICO has really been picking up steam… https://t.co/WTyIE4VFLv,0
Sun May 27 16:53:54 +0000 2018,Talk about eating your own dogfood. Check out this screenshot of a Superset smart contract that handles signing up… https://t.co/1kCP8BL1Nd,95
Sun May 27 16:50:06 +0000 2018,RT @YEC: 4 Important Cryptocurrency Facts Business Owners Should Be Aware Of https://t.co/MvLkWZMIyR,0
Sun May 27 16:45:02 +0000 2018,Follow @Wrexler_518 for the latest news in #Cryptocurrency,0
Sun May 27 16:37:43 +0000 2018,#TRON #TRX will be listed on @IDAX11 the first Mongolian licensed Exchange  which already obtained the authorizatio… https://t.co/1v2UHxxnPG,381
Sun May 27 16:22:46 +0000 2018,One awful part about tweeting or sharing anything related to cryptocurrency is random people start following me who… https://t.co/ze9yD0h9lh,0
Sun May 27 16:18:52 +0000 2018,Hello guys! 👋 👉Follow the link and read our new blog " Empowering the Content Ecosystem with PEP Network " 👉… https://t.co/J8c5ouknGK,50
Sun May 27 16:10:09 +0000 2018,#GlobalREIT    website  https://t.co/yS6Wv2udhN  #cryptocurrency,0
Sun May 27 16:07:11 +0000 2018,A Fast Cryptocurrency for Micro Payments  0.9.6 released https://t.co/SM7H5Mhv8z #Ruby #TeX #Shell #Gherkin #Makefile,1
Sun May 27 15:52:53 +0000 2018,A Fast Cryptocurrency for Micro Payments  0.9.6 released https://t.co/SM7H5Mhv8z #Ruby #TeX #Shell #Gherkin #Makefile,1
Sun May 27 15:50:00 +0000 2018,#TRON #TRX will be listed on @IDAX11 the first Mongolian licensed Exchange  which already obtained the authorizatio… https://t.co/1v2UHxxnPG,381
Sun May 27 15:43:41 +0000 2018,#TRON #TRX will be listed on @IDAX11 the first Mongolian licensed Exchange  which already obtained the authorizatio… https://t.co/1v2UHxxnPG,381
