Sat May 12 13:07:41 +0000 2018,Millennials Are Buying Cryptocurrencies to Save For Retirement https://t.co/gW7e317uWe #bitcoin #bitcoinnews #btc #cryptocurrency,0
Sat May 12 13:04:06 +0000 2018,How to Buy #MoneroXMR - April 2018 - https://t.co/xeL6R068My #BuyingGuides #Cryptocurrency #Crypto #altcoin… https://t.co/ci6mMTGn1u,0
Sat May 12 13:00:02 +0000 2018,Ingredients in the recipe of "what makes cryptocurrency interesting":  - Scarce - Global - Programmable - Interoper… https://t.co/nY2Hy7PFwD,34
Sat May 12 12:49:47 +0000 2018,What Is Daneel Cryptocurrency? https://t.co/xa0Q2c1OzR https://t.co/DlvF9gU2Sa,1
Sat May 12 12:37:24 +0000 2018,As someone presently attending a conference on zero-knowledge proofs  @CodaProtocol is one of the more interesting… https://t.co/B1hy86Xlfb,22
Sat May 12 12:35:28 +0000 2018,How emerging solutions are striving to find ways to combat disparaging financial management data via @Inc… https://t.co/oHSVg8iN4w,300
Sat May 12 12:31:22 +0000 2018,Ethereum futures to start trading today: https://t.co/FRgieg2o6P By @DelRayMan #EtherealSummit https://t.co/1NzZWaw9xc,3
Sat May 12 12:28:45 +0000 2018,Yumerium is a utility token. We are developing a platform on the blockchain network to optimize the virtual economi… https://t.co/l44oLQOqnl,15
Sat May 12 12:18:49 +0000 2018,How emerging solutions are striving to find ways to combat disparaging financial management data via @Inc… https://t.co/oHSVg8iN4w,300
Sat May 12 12:16:01 +0000 2018,What Is Daneel Cryptocurrency? https://t.co/xa0Q2c1OzR https://t.co/DlvF9gU2Sa,1
Sat May 12 12:09:30 +0000 2018,Millennials show an 80% interest in the tokenization of  virtual assets. They are seeking more security  control  a… https://t.co/AFRJ2SwMFm,39
Sat May 12 12:04:56 +0000 2018,$ADE:GR - Press Release - of Cryptocurrency and Blockchain. Bitcoin Group SE holds 100% of the shares in Bitcoin De… https://t.co/IEjNIa8xka,0
Sat May 12 12:04:55 +0000 2018,$ADE:GR - Press Release - well in excess of the forecast of EUR 1 billion at EUR 1.2 billion - for the cryptocurren… https://t.co/rCn6TiIpCO,0
Sat May 12 12:04:55 +0000 2018,$ADE:GR - Press Release - quarter of 2017  amounted to around EUR 250 million. The strong rise in the price of the… https://t.co/YITsuzajT4,0
Sat May 12 11:59:10 +0000 2018,#GlobalREIT telegram group : https://t.co/MK0n9zY5B6  #cryptocurrency #btc,0
Sat May 12 11:59:02 +0000 2018,#Crypto #XYO telegram group  https://t.co/5dzqfaoTcg      #ethereum #bitcoin #cryptocurrency,0
Sat May 12 11:38:52 +0000 2018,Wemark got covered on @adorama! "The applications for this technology seem endless — from the now well-known Bitcoi… https://t.co/KN4puWPNSg,60
Sat May 12 11:34:13 +0000 2018,Happy Friday! Time for our weekly dev update! Come see what we've been up to!   https://t.co/hrA4jGAZhk  #cryptocurrency #blockchain $TAU,24
Sat May 12 11:11:29 +0000 2018,@el33th4xor @Nouriel This is correct &gt; https://t.co/fKdGnaczjH,2
Sat May 12 11:09:12 +0000 2018,Crypto-Friendly App Robinhood Now Has More Users Than E*Trade https://t.co/wn3qVks1Ni #bitcoin #bitcoinnews #btc #cryptocurrency,0
Sat May 12 11:01:30 +0000 2018,Yumerium is a utility token. We are developing a platform on the blockchain network to optimize the virtual economi… https://t.co/qCgg49dPlG,24
Sat May 12 11:01:29 +0000 2018,Happy International Women's Day! Our global team here at Yumerium is comprised of the most intelligent  ambitious … https://t.co/LnWfNn77b6,23
Sat May 12 10:47:10 +0000 2018,As someone presently attending a conference on zero-knowledge proofs  @CodaProtocol is one of the more interesting… https://t.co/B1hy86Xlfb,22
Sat May 12 10:38:14 +0000 2018,What Is Nexo Cryptocurrency? https://t.co/bPL2vgW8hr,52
Sat May 12 10:27:19 +0000 2018,Ingredients in the recipe of "what makes cryptocurrency interesting":  - Scarce - Global - Programmable - Interoper… https://t.co/nY2Hy7PFwD,34
Sat May 12 10:25:23 +0000 2018,Great/Crazy awesome news from over the pond in London  @marketsinsider sharing that @LBXSocial is now supporting 2… https://t.co/bpc80TPKwv,31
