Mon Apr 30 23:08:38 +0000 2018,[NEW POST]: Cardano makes prove-of-stake algorithm security Breakthrough! + https://t.co/zVpEPtkmrE #cryptocurrency #crypto,0
Mon Apr 30 21:52:03 +0000 2018,Security Audit Firm Discovers Critical Vulnerability in #EOS #SmartContract System | Cryptocoin Spy… https://t.co/7twYANhwTb,1
Mon Apr 30 21:06:26 +0000 2018,Running With Cardano (ADA) $ADABTC https://t.co/272eDkbuzQ,0
Mon Apr 30 17:46:38 +0000 2018,Cardano (ADA) \u2026 $ADAUSD https://t.co/Kzc1ene5Hc,0
Mon Apr 30 15:58:46 +0000 2018,Cardano Price Technical Analysis – ADA/USD Surging Higher - https://t.co/YGYrZLtYtr https://t.co/r5ViQ7eDzT,0
Mon Apr 30 13:40:01 +0000 2018,Cardano  ADA/BTC Ready for The Nex\u2026 $ADABTC https://t.co/s01Uz1yc9y,1
Mon Apr 30 13:37:04 +0000 2018,Cardano  ADA/BTC Ready for The Nex\u2026 $ADABTC https://t.co/s01Uz1yc9y,1
