Wed Jan 17 22:17:06 +0000 2018,Bitcoin Cash BCH Current Price: $1780.78 1 Hour: 8.31 % | 24 Hours: 3.37 % | 7 Days: -35.46 % #bch #bitcoin cash,0
Wed Jan 17 22:11:39 +0000 2018,戻ってきたやん。 全緑(BCH以外)。 https://t.co/oZg4jXLcBk,0
Wed Jan 17 22:01:30 +0000 2018,@PropyInc $PRO is the answer to our problems in #realestate --- https://t.co/srxE4zPIPJ . . . $BTC $XRP $ETH $BCH… https://t.co/rxK8XK6Zb5,0
Wed Jan 17 21:59:21 +0000 2018,And the GREEN numbers are back #btc #xrp #eth #bch #ada #xem #xlm #neo #ltc #miota  Track live price updates… https://t.co/fQkHJqLqfx,0
Wed Jan 17 21:40:26 +0000 2018,So crypto fights back? I see green here on market index - https://t.co/rD7Ovb9dsp and I'm setting price alerts to k… https://t.co/46horZyckC,1
Wed Jan 17 21:37:12 +0000 2018,So crypto fights back? I see green here on market index - https://t.co/rD7Ovb9dsp and I'm setting price alerts to k… https://t.co/46horZyckC,1
Wed Jan 17 21:17:06 +0000 2018,Bitcoin Cash BCH Current Price: $1642.19 1 Hour: 3.57 % | 24 Hours: -8.86 % | 7 Days: -40.74 % #bch #bitcoin cash,0
Wed Jan 17 21:15:30 +0000 2018,#BTC #ETH# #BCH #LTC https://t.co/CmdI5WNMsS,0
Wed Jan 17 21:14:52 +0000 2018,$BTC $ETH $LTC $BCH https://t.co/lv0WJa0WY9,0
Wed Jan 17 21:06:15 +0000 2018,RT "  This is a good time to #buy #bitcoin &amp; #Cryptocurrencies because once it bounces back up everyone is going to… https://t.co/WZtlj5NjU9,0
Wed Jan 17 21:04:33 +0000 2018,#BCH is real Bitcoin  $BTC $ETH $XRP $LTC $NEO $ADA $BCH $DASH $XLM $EOS #BTC #ETH #XRP #LTC #NEO #ADA #DASH #XLM… https://t.co/qmjEGh30m4,2
Wed Jan 17 21:04:15 +0000 2018,Hodlrs be like.....   $BTC $ETH $BCH $LTC $TRX https://t.co/kyBxPNItWO,0
Wed Jan 17 20:56:36 +0000 2018,#BCH is real Bitcoin  $BTC $ETH $XRP $LTC $NEO $ADA $BCH $DASH $XLM $EOS #BTC #ETH #XRP #LTC #NEO #ADA #DASH #XLM… https://t.co/qmjEGh30m4,2
Wed Jan 17 20:55:31 +0000 2018,#BCH is real Bitcoin  $BTC $ETH $XRP $LTC $NEO $ADA $BCH $DASH $XLM $EOS #BTC #ETH #XRP #LTC #NEO #ADA #DASH #XLM… https://t.co/qmjEGh30m4,2
Wed Jan 17 20:52:48 +0000 2018,BitConnect single handedly prevented BTrash from using ticker BCC  hopefully BCH will switch over and go the same w… https://t.co/A2JVZJHlIe,0
Wed Jan 17 20:46:37 +0000 2018,@Bitcoin @bitinfocharts BCH = Bitconnect,0
Wed Jan 17 20:35:29 +0000 2018,More than $125 million worth of BTC is currently unspendable  thanks to massive fee inflation on the Bitcoin Core c… https://t.co/HsbnYxtCJW,0
Wed Jan 17 20:17:05 +0000 2018,Bitcoin Cash BCH Current Price: $1585.14 1 Hour: 4.37 % | 24 Hours: -15.14 % | 7 Days: -42.49 % #bch #bitcoin cash,0
Wed Jan 17 20:16:42 +0000 2018,@perplextus Yeah I think that's a terrible idea and not what ln was designed for. The paper I read suggested leavin… https://t.co/iddZZCMSIi,0
Wed Jan 17 19:45:49 +0000 2018,What could kill the Bitcoin boom? U.S. Treasury sees virtual currencies as "evolving threat " undersecretary says… https://t.co/CUJKnt0KpO,0
Wed Jan 17 19:42:24 +0000 2018,U.S. Treasury sees virtual currencies as "evolving threat " undersecretary says  #Crypto #bitcoin #BTC #BCH #ETH… https://t.co/d47BH3xv92,0
Wed Jan 17 19:17:05 +0000 2018,Bitcoin Cash BCH Current Price: $1524.51 1 Hour: -0.06 % | 24 Hours: -19.7 % | 7 Days: -44.25 % #bch #bitcoin cash,0
Wed Jan 17 19:04:18 +0000 2018,Watching the snow fall  and also the #crypto.  Thought there'd be more excitement when #GDAX opened the #BTC/#BCH m… https://t.co/TKJyQqJ305,0
Wed Jan 17 18:39:25 +0000 2018,#Blockfolio #btc #bitcoin #ltc #litecoin #BCH #XRP #ripple #tron #XVG $xvg #vergecurrency #ada #cardano #Binance… https://t.co/xgvbPPcaJo,1
Wed Jan 17 18:34:13 +0000 2018,Amazing job @stlouisfed on the #cryptocurreny primer #bitcoin #bitcoinCash #bch https://t.co/rEFcnhBZL2,0
Wed Jan 17 18:17:04 +0000 2018,Bitcoin Cash BCH Current Price: $1541.29 1 Hour: -1.91 % | 24 Hours: -20.08 % | 7 Days: -42.87 % #bch #bitcoin cash,0
Wed Jan 17 18:10:07 +0000 2018,Remember how Bitcoin couldn’t possibly be dethroned?!? Remember when LTC bumped  ETH stirred (will again)  BCH was… https://t.co/rCVIECkQFh,1
Wed Jan 17 18:00:59 +0000 2018,Gdax went from 2 failed attempts with hour long+ post-only pre-launches to literally adding the menu items to the U… https://t.co/Jf3hTBRLWb,0
Wed Jan 17 17:17:04 +0000 2018,Bitcoin Cash BCH Current Price: $1578.97 1 Hour: 8.3 % | 24 Hours: -19.97 % | 7 Days: -40.69 % #bch #bitcoin cash,0
Wed Jan 17 17:12:06 +0000 2018,Ok I'm officially accepting donations. If I raise 10k in the next 20 days  my grandma &amp; I will make a "Bitcoin Cash… https://t.co/zFHsymLUyd,25
Wed Jan 17 17:10:14 +0000 2018,#Blockfolio #btc #bitcoin #ltc #litecoin #BCH #XRP #ripple #tron #XVG $xvg #vergecurrency #ada #cardano #Binance… https://t.co/xgvbPPcaJo,1
Wed Jan 17 16:53:01 +0000 2018,I fell well short of my lofty 10k in BCH ambitions  so a “[bitcoin] cash rules everything around me” inspired pic w… https://t.co/VAjd4BTU1F,0
Wed Jan 17 16:48:38 +0000 2018,All of you talking about #HODL yall know you stressed the fuck out 😄 imma still #hodl my investments tho its almost… https://t.co/TLQ17y35gz,0
Wed Jan 17 16:47:16 +0000 2018,Added modestly across the board this morning in cryptos..most in Bitcoin then Litecoin then Bitcoin Cash/Ethereum (… https://t.co/6NsjSrc8JK,0
Wed Jan 17 16:17:04 +0000 2018,Bitcoin Cash BCH Current Price: $1486.6 1 Hour: 4.33 % | 24 Hours: -25.66 % | 7 Days: -43.35 % #bch #bitcoin cash,0
Wed Jan 17 16:05:33 +0000 2018,Crypto_Cokehead Well  of the two main versions of Bitcoin (BCH &amp; BTC)  only one is increasing in utility and adopti… https://t.co/YIofaQFefr,0
Wed Jan 17 15:20:50 +0000 2018,The First Blockchain ETFs Have Launched on the Nasdaq Exchange https://t.co/L5ZzYoWJPp https://t.co/nBJQG8S0cB,570
Wed Jan 17 15:17:04 +0000 2018,Bitcoin Cash BCH Current Price: $1409.6 1 Hour: -9.21 % | 24 Hours: -28.93 % | 7 Days: -45.57 % #bch #bitcoin cash,0
Wed Jan 17 15:14:59 +0000 2018,Survival of the fittest they say?! #Crypto #Bloodbath #ICO #Bitcoin $BTC $ETH $XRP $BCH $ADA $LTC $XEM $NEO https://t.co/pXkKMz0DLO,1
Wed Jan 17 15:10:42 +0000 2018,仮想通貨オススメ海外取引所  今、注目度no 1のQASH取引きなら!! QUOINEX 各種手数料無料でスプレッドも狭い QASHをはじめBTC ETH　BCH　などなど https://t.co/Cia4s41BiZ #仮想通貨　#海外FX　#QASH #BITCOIN,0
Wed Jan 17 15:05:21 +0000 2018,The First Blockchain ETFs Have Launched on the Nasdaq Exchange https://t.co/L5ZzYoWJPp https://t.co/nBJQG8S0cB,570
Wed Jan 17 15:02:45 +0000 2018,@sashandiggers @Bitfinexed $BTC is $BTC. $BCH is $BCH. Bitcoin is a Peer-to-Peer Electronic Cash System. BTC != bitcoin,0
Wed Jan 17 15:02:36 +0000 2018,UPDATE:  7d Returns:  $BTC -30% $ETH -37% $XRP -49% $BCH -41% $ADA -35% $LTC -36% $NEM -48%  $290 billion lost so f… https://t.co/4WmuKwGDZq,1
Wed Jan 17 14:41:33 +0000 2018,UPDATE:  7d Returns:  $BTC -30% $ETH -37% $XRP -49% $BCH -41% $ADA -35% $LTC -36% $NEM -48%  $290 billion lost so f… https://t.co/4WmuKwGDZq,1
Wed Jan 17 14:37:44 +0000 2018,The top 10 #cryptocurrencies incurring massive losses #btc #xrp #eth #bch #ada #xem #xlm #neo #ltc #miota  Track li… https://t.co/Y9BgNz5PXR,0
Wed Jan 17 14:35:42 +0000 2018,Why do all the coins have to hold hands and all fall down together 🤔 🤣😭  $BTC $LTC $ETH $BCH $NEO $ZEC $XRP $XVG… https://t.co/oLzliIXM58,0
Wed Jan 17 14:21:52 +0000 2018,Would it be crazy for #BCH to trade down back to $300 very soon? No  not crazy at all.,0
Wed Jan 17 14:17:04 +0000 2018,Bitcoin Cash BCH Current Price: $1560.38 1 Hour: -4.62 % | 24 Hours: -20.86 % | 7 Days: -39.03 % #bch #bitcoin cash,0
Wed Jan 17 13:18:02 +0000 2018,Short volume percent for $BBD on 2018-01-16 is 59%. https://t.co/bolKnM70B7 $BCH 64% $BBVA 36% $MTU 70% $HSBC 82%,0
Wed Jan 17 13:17:04 +0000 2018,Bitcoin Cash BCH Current Price: $1621.79 1 Hour: 0.42 % | 24 Hours: -18.31 % | 7 Days: -36.12 % #bch #bitcoin cash,0
Wed Jan 17 12:31:42 +0000 2018,@Ludovic_Bch @tunes_you Mdr au moins y'en à qui ont le sens de l'humour.  Allez,0
Wed Jan 17 12:24:26 +0000 2018,https://t.co/xpTCbMXUFe #cryptocurrency #bitcoin #bitcoinfutures #bitcoinbubble #ethereum #ripple #litecoin… https://t.co/Gl8g1Z4SWB,1
Wed Jan 17 12:17:03 +0000 2018,Bitcoin Cash BCH Current Price: $1591.14 1 Hour: -1.04 % | 24 Hours: -20.14 % | 7 Days: -36.83 % #bch #bitcoin cash,0
Wed Jan 17 12:15:39 +0000 2018,https://t.co/xpTCbMXUFe #cryptocurrency #bitcoin #bitcoinfutures #bitcoinbubble #ethereum #ripple #litecoin… https://t.co/Gl8g1Z4SWB,1
Wed Jan 17 12:08:47 +0000 2018,So while BTC zealots are complaining about fictional spam attacks on their unscalable network  BCH devs are purpose… https://t.co/DnLxT9kgIe,22
Wed Jan 17 11:55:32 +0000 2018,GREAT EXCHANGE !!! #Binance Now Open For New Customers  Sign up -&gt; https://t.co/fi7JpRnKvr  ( -50% fee )   $BTC… https://t.co/ql4nsxbxzH,1
Wed Jan 17 11:55:23 +0000 2018,GREAT EXCHANGE !!! #Binance Now Open For New Customers  Sign up -&gt; https://t.co/fi7JpRnKvr  ( -50% fee )   $BTC… https://t.co/ql4nsxbxzH,1
Wed Jan 17 11:51:20 +0000 2018,@binance_2017 GREAT EXCHANGE !!! #Binance Now Open For New Customers 🚀🍾📈🤑   Sign up -&gt; https://t.co/fi7JpRnKvr… https://t.co/WYznAVAJaP,1
Wed Jan 17 11:17:03 +0000 2018,Bitcoin Cash BCH Current Price: $1637.85 1 Hour: -0.9 % | 24 Hours: -16.62 % | 7 Days: -34.64 % #bch #bitcoin cash,0
Wed Jan 17 10:54:06 +0000 2018,Bitcoin’s recent wobbles have given fresh urgency to a question that’s gripped market observers #bubbles  #Crypro… https://t.co/woWVNDC4Wf,0
Wed Jan 17 10:39:48 +0000 2018,The Future of the #BlockChain &amp; Crypto  Beyond the Bitcoin Bubble https://t.co/Gqw00WOSdJ #Blockchain #Crypro #bitcoin #BTC #BCH #ETH #LTC,1
Wed Jan 17 10:38:52 +0000 2018,The Future of the #BlockChain &amp; Crypto  Beyond the Bitcoin Bubble https://t.co/Gqw00WOSdJ #Blockchain #Crypro #bitcoin #BTC #BCH #ETH #LTC,1
Wed Jan 17 10:30:42 +0000 2018,Cryptocurrencies are crashing  resume their slide as bitcoin tumbles to its lowest since December  #Crypro #bitcoin… https://t.co/ht53GfBbVF,0
Wed Jan 17 10:17:03 +0000 2018,Bitcoin Cash BCH Current Price: $1678.73 1 Hour: -4.92 % | 24 Hours: -13.75 % | 7 Days: -32.52 % #bch #bitcoin cash,0
Wed Jan 17 10:16:38 +0000 2018,BitConnect Closes Exchange as States Warn of Unregulated Sales #BitConnect  #Crypro #bitcoin #BTC #BCH #ETH #LTC… https://t.co/tI2l1RlvYY,0
Wed Jan 17 10:05:51 +0000 2018,@AzhellTom I saw that you posted a comment on your wall letting people know  I presume that's why people sent me BC… https://t.co/QoSh4rpujc,0
Wed Jan 17 10:02:55 +0000 2018,#CryptoCurrency transaction speed vs. #Visa &amp; #Paypal. #Crypto still has a long ways to go. Fingers crossed for the… https://t.co/CvTMIokqkk,7
Wed Jan 17 10:01:12 +0000 2018,@AzhellTom Oh hai! Well on account of discovering I have a bunch more BCH in my wallet  I'd have to say overwhelmingly positive.... 😍☺️,0
Wed Jan 17 09:36:33 +0000 2018,@CasPoLinhNguyen @rogerkver Bao giờ thì #bch thay thế vị trí #btc đc A ? ^^,0
Wed Jan 17 09:17:03 +0000 2018,Bitcoin Cash BCH Current Price: $1749.41 1 Hour: -2.99 % | 24 Hours: -11.88 % | 7 Days: -29.01 % #bch #bitcoin cash,0
Wed Jan 17 08:47:37 +0000 2018,cryptocryan rdar1999 BittrexExchange Egon_01 rogerkver BKBrianKelly BitcoinCashFans BitcoinCashFund I'm not sure wh… https://t.co/GIQtLRcXY9,1
Wed Jan 17 08:33:52 +0000 2018,@SheriUcar Welcome any liquidity channel to make value transfer between BTC to BCH easier. May the best chain win.,0
Wed Jan 17 08:30:29 +0000 2018,cryptocryan rdar1999 BittrexExchange Egon_01 rogerkver BKBrianKelly BitcoinCashFans BitcoinCashFund I'm not sure wh… https://t.co/GIQtLRcXY9,1
Wed Jan 17 08:17:03 +0000 2018,Bitcoin Cash BCH Current Price: $1823.02 1 Hour: -0.98 % | 24 Hours: -13.91 % | 7 Days: -25.53 % #bch #bitcoin cash,0
Wed Jan 17 07:17:02 +0000 2018,Bitcoin Cash BCH Current Price: $1837.97 1 Hour: 6.08 % | 24 Hours: -17.52 % | 7 Days: -24.56 % #bch #bitcoin cash,0
Wed Jan 17 06:37:23 +0000 2018,Bought the fuck out that dip. Up 10% so far. Still licking my wounds. $btc $mco $xvg $trx $eth $xlm $bch $xrp,0
