Fri Dec 21 20:28:27 +0000 2018,michael_test_mp4 https://t.co/zGJg1f4iwa,1951
Fri Dec 21 19:43:07 +0000 2018,DAI  GNT  MKR  and ZIL order books will soon enter transfer-only mode. We will accept inbound transfers in the regi… https://t.co/b34ZBIM4Nk,387
Fri Dec 21 18:39:05 +0000 2018,Trading on the DAI  GNT and ZIL order books is about to start.These order books will now enter post-only mode. Cust… https://t.co/59wr9mc50D,54
Fri Dec 21 08:17:58 +0000 2018,@mgs3soupeater that reminds me  I need to revise my golem outfit for next Purim. gotta get some better clay-colored… https://t.co/zN1XlY0znb,0
Fri Dec 21 08:12:21 +0000 2018,the replies to this tweet are making my inner golem itchy https://t.co/vUc2bntOQy,0
Fri Dec 21 06:53:05 +0000 2018,Inbound transfers for DAI  GNT  MKR  and ZIL are now available in the regions where trading is supported. Traders c… https://t.co/DtnKfVyTjx,108
Fri Dec 21 04:40:26 +0000 2018,DAI  GNT  MKR  and ZIL order books will soon enter transfer-only mode. We will accept inbound transfers in the regi… https://t.co/b34ZBIM4Nk,387
Fri Dec 21 02:55:26 +0000 2018,@cnni Stephen miller loves pissing people off. He wants you to make fun of his hair. You do that while he is writin… https://t.co/fyMWVhdm8Z,0
