Thu Jul 13 23:57:54 +0000 2017,DoNormaal - Gold Rooster - Third Daughter (2017),1
Thu Jul 13 23:54:10 +0000 2017,Performance preview: Wide-open  freestyle show 'Sh*t Gold' is magical for artists and audience alike.… https://t.co/hTxmjWmZTv,0
Thu Jul 13 23:48:14 +0000 2017,Gold Digger- Kanye West https://t.co/3zQ1m6ILm7,0
Thu Jul 13 23:38:34 +0000 2017,The new @UW West Campus Utility Plant has received an @ISIenvision Gold sustainability award!… https://t.co/enRz6u0xdB,4
Thu Jul 13 23:38:01 +0000 2017,This museum is gold. https://t.co/USh2G6NrLc,0
Thu Jul 13 23:37:22 +0000 2017,This thread is gold #docker #devops #devoops https://t.co/Epv8EBQSw6 by #geowarin,0
Thu Jul 13 23:33:54 +0000 2017,@trashcanhan The finale is GOLD,0
Thu Jul 13 23:22:46 +0000 2017,I'm not sayin he's a gold digger  but he is pretty excited about sifting dirt. https://t.co/5FK6gtnrqM,0
Thu Jul 13 23:15:33 +0000 2017,have yall ever had a pillow fight with your stepkid but u forgot to take all the gold from your pillow cuz u dont trust the banks with them?,0
Thu Jul 13 23:11:59 +0000 2017,@simon_is_gold Yo. Just heard your track. Nice stuff. I'd want to help promote it. Start today: https://t.co/oovtNyychB,0
Thu Jul 13 23:11:01 +0000 2017,"I think you're gold" #dead,0
Thu Jul 13 23:03:59 +0000 2017,@DannyGaminGnC DM me for my Twitch Prime loot for Overwatch. It's a legendary gold loot box as well as 10 regular boxes! Don't play so yea,0
Thu Jul 13 23:03:34 +0000 2017,Went to see Napoleon's tomb today. So much classy marble  but not enough gold! Many people don't know he had big  strong hands! Like Trump!,0
Thu Jul 13 23:03:16 +0000 2017,Second Front In The Gold World https://t.co/2IeVLHXWX6,0
Thu Jul 13 23:01:29 +0000 2017,Springbrook National Park - the GREEN behind the Gold: https://t.co/1Wc9nv3yU8 Queensland VisitGoldCoast https://t.co/T9kOGoApb3,0
Thu Jul 13 23:00:12 +0000 2017,Gold  lasers  and antifreeze help reanimate deep-frozen fish https://t.co/dcD5QprSHo,0
Thu Jul 13 22:56:41 +0000 2017,The new @UW West Campus Utility Plant has received an @ISIenvision Gold sustainability award!… https://t.co/enRz6u0xdB,4
Thu Jul 13 22:54:55 +0000 2017,@sadysonellars Mady  that is god damn gold right there...Until Mr. Oizo retweets one of our tweets...,0
Thu Jul 13 22:53:21 +0000 2017,Gold 🤙 https://t.co/sn0HlOQ2Nc,0
Thu Jul 13 22:40:12 +0000 2017,Download Dynasty Tycoon - AUTOMATICALLY FIND THE BEST GOLD STRATEGIES IN THE GAME IN SECONDS https://t.co/AjleYOHApK #WoW,0
Thu Jul 13 22:23:56 +0000 2017,Seriously. Score a brace in a Gold Cup group-stage match  and you get everyone’s pillows?  It must be nice.,0
Thu Jul 13 22:19:21 +0000 2017,@_jakemuir Solid gold right here.,0
Thu Jul 13 22:17:27 +0000 2017,The new @UW West Campus Utility Plant has received an @ISIenvision Gold sustainability award!… https://t.co/enRz6u0xdB,4
Thu Jul 13 22:09:40 +0000 2017,@104rog Period piece comedic gold 😂,0
Thu Jul 13 21:54:44 +0000 2017,#sounders #soundersfc #mls Mexico vs. Jamaica: Gold Cup Group C time  TV channel  and how to watch online https://t.co/gR4BSwdVyh #GoSound…,0
Thu Jul 13 21:48:25 +0000 2017,Tonnier Genuine Leather Band Analog Digital LED Dual Time Display Mens Watch  Brown&amp;Gold… https://t.co/n376g3EHBT https://t.co/pj6EDbWbcF,5
Thu Jul 13 21:40:59 +0000 2017,this thread is gold thank you so much https://t.co/UdrxJEqjsW,0
Thu Jul 13 21:40:52 +0000 2017,@H4YZEL then i would be paying 100 a year for "gold" or w/e,0
Thu Jul 13 21:35:26 +0000 2017,“It's important to give back to the younger generation.” @jewellloyd on her Gold Mamba Striker Series camps.  READ… https://t.co/xOER70jNtH,7
Thu Jul 13 21:32:40 +0000 2017,Mexico vs. Jamaica: Gold Cup Group C time  TV channel  and how to watch online https://t.co/q6W6sQMmEj https://t.co/JxVlQFxFO4,0
Thu Jul 13 21:32:23 +0000 2017,gold https://t.co/7xoy0C7IRi,0
Thu Jul 13 21:30:26 +0000 2017,Gold 👌🏼 https://t.co/O78TdDqkr9,0
Thu Jul 13 21:28:10 +0000 2017,I liked a @YouTube video https://t.co/9L4JEYwNEf TONS OF GOLD !!! Biggest Clean Up EVER !!!!! ask Jeff Williams,0
Thu Jul 13 21:22:56 +0000 2017,Sponsored messages are gold. You can now use them on Linkedin  Google  and Facebook.  Have you used them?  #PPC,0
Thu Jul 13 21:20:17 +0000 2017,#Mexico vs #Jamaica Gold Cup Group C time TV channel and how to watch online | Sounder At Heart https://t.co/cI2bmDKkeE,0
Thu Jul 13 21:14:49 +0000 2017,Congratulations to Gold Nugget GRAND AWARD Winner Seattle's BNB West for Marion West  in the U District. The... https://t.co/xKBWw5wgPY,0
Thu Jul 13 21:14:38 +0000 2017,MAJESTIC Silver &amp; Copper or 14k Gold Filled // Men's Weddi… https://t.co/jXilere7Cf #weddingrings #WomensWeddingBand https://t.co/tXgZ342sp2,0
Thu Jul 13 21:04:54 +0000 2017,soundersbuzztap: sounderatheart​.com &gt;&gt; Mexico vs. Jamaica: Gold Cup Group C time  TV channel  and how to watch online …,0
Thu Jul 13 21:01:12 +0000 2017,sounderatheart​.com &gt;&gt; Mexico vs. Jamaica: Gold Cup Group C time  TV channel  and how to watch online https://t.co/a12l7gNXcr,0
Thu Jul 13 21:00:50 +0000 2017,@dr_pete @ClaraJeffery You can't make this stuff up. This is pure gold. Real LOL type stuff.,0
Thu Jul 13 21:00:13 +0000 2017,Oniel Fisher is playing in the game more Americans will watch than the #USMNT win. Watch #MEXvJAM with us. https://t.co/bQv3j0sYKS,1
Thu Jul 13 21:00:12 +0000 2017,The Gold Cup resumes tonight in Denver with US Soccer fans adopting Jamaica for the night. https://t.co/1txsLXofFJ https://t.co/OqoYuIteRO,0
Thu Jul 13 20:58:42 +0000 2017,@MarkLeibovich on @MSNBC  Trump "hasn't drained the swamp so much as he's refashioned it into a gold plated hot tub." Sir  you are a genius!,0
Thu Jul 13 20:58:37 +0000 2017,This is GOLD https://t.co/rKrHwyr5LU,0
Thu Jul 13 20:55:09 +0000 2017,The swamp feels anything but drained; more like remodeled into a gold-plated hot tub." https://t.co/W2XYjFDYK3 via @MarkLeibovich,47
Thu Jul 13 20:54:32 +0000 2017,The swamp feels anything but drained; more like remodeled into a gold-plated hot tub." https://t.co/W2XYjFDYK3 via @MarkLeibovich,47
Thu Jul 13 20:37:28 +0000 2017,With @C3IoT  Software Billionaire @TomSiebel Looks To Strike Gold A Second Time https://t.co/nB8duDobP7 #IoT #analytics,2
Thu Jul 13 20:35:58 +0000 2017,Tonnier Genuine Leather Band Analog Digital LED Dual Time Display Mens Watch  Brown&amp;Gold… https://t.co/n376g3EHBT https://t.co/pj6EDbWbcF,5
Thu Jul 13 20:27:51 +0000 2017,Also if you call "Medina" "Bellevue" rich-people will literally throw gold bricks through their windows because of the outrage,1
Thu Jul 13 20:27:15 +0000 2017,Also if you call "Medina" "Bellevue" rich-people will literally throw gold bricks through their windows because of the outrage,1
Thu Jul 13 20:24:08 +0000 2017,Lightning Deal! $899.99 - 2 CT SI2-I1 AGS Certified Diamond Bracelet 14K White Gold https://t.co/PX12Hkp3KU,0
Thu Jul 13 20:15:05 +0000 2017,With @C3IoT  Software Billionaire @TomSiebel Looks To Strike Gold A Second Time https://t.co/nB8duDobP7 #IoT #analytics,2
Thu Jul 13 19:56:05 +0000 2017,Tonnier Genuine Leather Band Analog Digital LED Dual Time Display Mens Watch  Brown&amp;Gold… https://t.co/n376g3EHBT https://t.co/pj6EDbWbcF,5
Thu Jul 13 19:55:23 +0000 2017,LoanLux offers loans up to $670 for similar items #Ring #Lapis #18kgold... https://t.co/axyh3xJH1j,0
Thu Jul 13 19:54:27 +0000 2017,LoanLux offers loans up to $670 for similar items #Ring #Lapis #18kgold https://t.co/3UiQZz6AnG https://t.co/eFyDnygEbf,0
Thu Jul 13 19:53:46 +0000 2017,ConsignLux Offer of the Day for Thursday July 13  2017 #Ring #Lapis #18kgold... https://t.co/TSgEZPNQ8J,0
Thu Jul 13 19:48:59 +0000 2017,Hey does anyone have a few sheets of gold metal leaf? Really need some for the Buddha carving. Thanks very much!👍,0
Thu Jul 13 19:41:44 +0000 2017,*meanwhile at a daycare* (snorts a line of crushed gold fish crackers &amp; cracks knuckles) Okay kid  best 3 out of 5 of tic tac toe...,7
Thu Jul 13 19:30:16 +0000 2017,Interview Jordan Morris on brace vs Martinique in 2017 Gold Cup | Seattle Sounders FC https://t.co/ERwR3WPdAy,0
Thu Jul 13 19:24:07 +0000 2017,soundersbuzztap: soundersfc​.com &gt;&gt; Interview: Jordan Morris on brace vs Martinique in 2017 Gold Cup https://t.co/0mkyjAB6fC #GoSounders,0
Thu Jul 13 19:19:56 +0000 2017,soundersfc​.com &gt;&gt; Interview: Jordan Morris on brace vs Martinique in 2017 Gold Cup https://t.co/Lr3v33zO5k,0
Thu Jul 13 19:17:49 +0000 2017,Getting climb outside with my new rose gold shoes of my dreams made by @soill 👟👟😍 https://t.co/bMfKAjzYVD https://t.co/4JD5e5PP33,0
Thu Jul 13 19:12:00 +0000 2017,Sad to see SoundCloud coming to an end.  I discovered some gold from that platform.,0
Thu Jul 13 19:05:45 +0000 2017,WATCH (again and again and again): @JmoSmooth13's double leads @ussoccer past Martinique. #USAvMTQ  ➡️… https://t.co/vGXDA40FQj,18
Thu Jul 13 19:03:55 +0000 2017,@PatrickKindlon HERE COME THE GOLD https://t.co/ibGv3rS9kv,0
Thu Jul 13 19:00:23 +0000 2017,Gold Sags on Rise in Bond Yields  Silver Plunges on Volume Spike https://t.co/yC1HScUZrT @business,0
Thu Jul 13 18:54:22 +0000 2017,Tonnier Genuine Leather Band Analog Digital LED Dual Time Display Mens Watch  Brown&amp;Gold… https://t.co/n376g3EHBT https://t.co/pj6EDbWbcF,5
Thu Jul 13 18:53:08 +0000 2017,Why Unrest is Gold for #Creatives   #inspiration https://t.co/s5EkeDYzvY,0
Thu Jul 13 18:45:47 +0000 2017,So proud and pleased with the work @iam8bit did with @MateriaColl's Hero of Time vinyl. Gold discs? Yes please  I'l… https://t.co/VuR24RO4q9,3
Thu Jul 13 18:34:15 +0000 2017,Someone give this man Reddit Gold https://t.co/pBMQ8F4EeM,0
Thu Jul 13 18:20:29 +0000 2017,If you want your day fucking made....Read this thread. Gold. Gold i tell you. https://t.co/bMj3GGnHqX,31
Thu Jul 13 18:10:06 +0000 2017,Thanks to Seattle Wine Awards for the gold!  We'll be pouring the Malbec at POUR on August 12th at The Factory... https://t.co/cEOnpRb8hp,0
Thu Jul 13 17:57:29 +0000 2017,Berlin SWAT raids yield arrests in theft of manhole-sized gold coin https://t.co/Vgr0mNL5yN,0
Thu Jul 13 17:30:04 +0000 2017,@_Queen_Phoenix_ @TheEliCarlson Gingerdead man vs evil bong was cinema gold,0
Thu Jul 13 17:24:50 +0000 2017,#Metallica Detroit Poster - Super Gold Edition  https://t.co/VVooyJuTuU #WorldWired #Metallica https://t.co/xBJy07LeS9,0
Thu Jul 13 17:18:13 +0000 2017,@rabcyr that's retweetable gold,0
Thu Jul 13 17:14:30 +0000 2017,RUSTIC Silver &amp; Brass (not 14k gold) 6.5 mm// Men's Wedding R… https://t.co/vPKHuKUdlw #weddingbands #WomensGoldBand https://t.co/E3r2YOc4pF,0
Thu Jul 13 17:03:05 +0000 2017,Gold Cup Group C  where I attempt to NOT make fun of Mexico’s manager for 500 words https://t.co/Rw92ViJb95 https://t.co/pGuyc2molo,2
Thu Jul 13 16:57:04 +0000 2017,Jordan Morris leads USA with 2 goals in Gold Cup match https://t.co/lM5VRCnyfy via @seattlesoccer,0
Thu Jul 13 16:55:09 +0000 2017,The Doctor used to disable Cybermen by blowing gold dust into their respiratory systems  until he found a much more… https://t.co/0MZ0c62EQE,0
Thu Jul 13 16:35:58 +0000 2017,Copper canyon tin house gold butthole,0
Thu Jul 13 16:21:24 +0000 2017,People experiencing very serious  account-losing issues when linking their Bungie accounts to Blizzard  BE CAREFUL: https://t.co/c5TQbGDm1x,343
Thu Jul 13 16:15:18 +0000 2017,#NFL Wire: Mexico vs. Jamaica live stream info  TV channel: How to watch Gold Cup online https://t.co/mQSCDkaIBq https://t.co/QosnBOfn8i,0
Thu Jul 13 16:01:16 +0000 2017,To me when I hear that shit. One thing pops in my mind gold digging hoe,0
Thu Jul 13 15:26:40 +0000 2017,WATCH (again and again and again): @JmoSmooth13's double leads @ussoccer past Martinique. #USAvMTQ  ➡️… https://t.co/vGXDA40FQj,18
Thu Jul 13 15:04:12 +0000 2017,#tbt -I am delinquent in getting this hat remade. https://t.co/LMjpak8nuY,0
Thu Jul 13 15:00:08 +0000 2017,@BernieSanders @BenJealous @CannabisCulture ...Lets Make America GOLD Again.🤔@SenateGOP @SenateDems @SenAngusKing… https://t.co/B3iOOKPoxC,0
Thu Jul 13 14:53:41 +0000 2017,rose gold or jet black or black?,0
Thu Jul 13 14:50:17 +0000 2017,The swamp feels anything but drained; more like remodeled into a gold-plated hot tub." https://t.co/W2XYjFDYK3 via @MarkLeibovich,47
Thu Jul 13 14:49:26 +0000 2017,@OmniGroup In fact  OG 3 sounds like it is rocking big gold chains and hella swag.,0
