Mon Sep 11 23:58:09 +0000 2017,Gold Tiger Iron Marra Mamba Womans Pendant Necklace Wire Wrapped Jewelry Han… https://t.co/WSAa0zbbNT #etsy #jewelry https://t.co/Q6y5JZ5R8y,3
Mon Sep 11 23:57:05 +0000 2017,Gear up for the season with the new KISW Purple and Gold shirt and hoodie! https://t.co/qI1iQA8Myr,2
Mon Sep 11 23:48:42 +0000 2017,Gear up for the season with the new KISW Purple and Gold shirt and hoodie! https://t.co/qI1iQA8Myr,2
Mon Sep 11 23:47:13 +0000 2017,Men Bragged About Slaughtering Humans While Hunting For Gold https://t.co/0g9OR8TIIS https://t.co/QhttRytEGq,0
Mon Sep 11 23:28:40 +0000 2017,Gold Tiger Iron Marra Mamba Womans Pendant Necklace Wire Wrapped Jewelry Han… https://t.co/WSAa0zbbNT #etsy #jewelry https://t.co/Q6y5JZ5R8y,3
Mon Sep 11 23:12:12 +0000 2017,4pc 10k Gold Grill w/2 flooded in #rubies.  💦 Now available @… https://t.co/3mRD8O7msp,0
Mon Sep 11 23:10:12 +0000 2017,@bgold1711 @ReneJHerrera GOLD  have you not been paying attention at all??  Ep 3 aired last night  Ep 1: https://t.co/PHVwoWDSK1,0
Mon Sep 11 22:58:54 +0000 2017,This custom leaf pendant is a perfect blend of sparkle and grunge. I made this by bleeding green gold over the sil…… https://t.co/Ob945Tuanh,0
Mon Sep 11 22:42:20 +0000 2017,Eldorado Gold threatens to freeze Greek operations https://t.co/8mMNiH6lE8 via @FT,0
Mon Sep 11 22:41:15 +0000 2017,A yellow and gold ribbed #glasspumpkin from this years #glasspumpkinpatch https://t.co/0j5igNq772,1
Mon Sep 11 22:40:59 +0000 2017,@duranduran "Only In Dreams" etherial  smokey vibes intersecting with Simon's liquid vocals  building to a crescend… https://t.co/uewdNcm3vE,0
Mon Sep 11 22:39:23 +0000 2017,It's natural for one asset type (gold  stocks  housing  tulips  etc.) to be more sensitive to this over-investment and start rising in price,0
Mon Sep 11 22:38:38 +0000 2017,@AJKandy @shoobe01 This thread is gold  thank you both! :),0
Mon Sep 11 22:21:13 +0000 2017,Why Unrest is Gold for #Creatives   #inspiration https://t.co/s5EkeDYzvY,0
Mon Sep 11 22:19:59 +0000 2017,I feel you  vending machine  I feel you. https://t.co/FlwDGkp61K,47190
Mon Sep 11 22:17:22 +0000 2017,Took a cycling team to gold in the Olympics. Just a micro change a day is much more doable than setting a huge... https://t.co/vNXyhj8OLF,0
Mon Sep 11 22:15:40 +0000 2017,If u gonna get gold  get real gold 💸,0
Mon Sep 11 22:13:22 +0000 2017,https://t.co/ig5C2hWU0P basically the entire killers discography is gold but god i fucking love this song. i dont care its not christmas,0
Mon Sep 11 22:10:08 +0000 2017,There are 52 000 tonnes of minable gold still in the ground worth US$2 trillion. https://t.co/I4auVgasnG,0
Mon Sep 11 21:53:09 +0000 2017,@_Queen_Phoenix_ She'll see the truth bout him eventually  I'm sure she alrdy is. Just focus on takin the gold  he ain't worth the stress,0
Mon Sep 11 21:51:59 +0000 2017,Proud to be the 933rd backer on @BackerKit for Kickstarter Gold: Good Night ... | Thx @TimbuktuMag! https://t.co/VyKQRkEBBV,0
Mon Sep 11 21:51:00 +0000 2017,@foundrmag is always full of gold. 💰 From their podcast to courses. Their @instagram Masterclass webinar was no dif… https://t.co/NGElTHvSLL,0
Mon Sep 11 21:48:37 +0000 2017,How long do you wait for someone who's late?  In meantime  do you approach girl sitting next to you w a simple gold band around finger?,0
Mon Sep 11 21:47:57 +0000 2017,I just added White Gold to my library! https://t.co/5D5qCKVPW8 #tvtime https://t.co/7SqvX0kAyF,0
Mon Sep 11 21:44:35 +0000 2017,Uncontacted Tribe Allegedly Massacred By Gold Miners In Brazil https://t.co/AyS65k6ATJ,0
Mon Sep 11 21:43:50 +0000 2017,Two things I did not know humans could still do: Murder indigenous folk Be a gold miner https://t.co/3uPRHLLu3l,0
Mon Sep 11 21:09:12 +0000 2017,Uncontacted Tribe Allegedly Killed By Gold Miners In Brazil | HuffPost https://t.co/nIOaACPKIA,0
Mon Sep 11 21:01:37 +0000 2017,@mooogs_ I'm sorry David but I laughed so hard at that. Comedy gold  ilu.,0
Mon Sep 11 21:01:02 +0000 2017,Proud to be the 286th backer on @BackerKit for Kickstarter Gold: Good Night ... | Thx @TimbuktuMag! https://t.co/OEVSuEJRlc,0
Mon Sep 11 21:00:44 +0000 2017,The newest from New York Times! "Retrieving Gold  and More  From Wastewater" by C. CLAIBORNE RAY https://t.co/IyKzcyPiOY,0
Mon Sep 11 20:58:15 +0000 2017,WE REALLY THOUGHT THIS ENTIRE THING WAS COMEDIC GOLD https://t.co/4kWRYwMEna,0
Mon Sep 11 20:45:29 +0000 2017,Confirmed Short-term Signal: Gold Market Cycle Analysis https://t.co/OtvCo78sll,0
Mon Sep 11 20:41:11 +0000 2017,I'll try on 14 different pairs of earrings and still end up leaving with gold hoops on,2
Mon Sep 11 20:37:19 +0000 2017,She wanted to know about Gold  and I explain to her that Au was cool cause it has WAY more "little parts" around it… https://t.co/o4bRCOkSxY,0
Mon Sep 11 20:23:15 +0000 2017,🎉GOLD MERMAID JANET🎉  * 1주년 기념 이벤트. * 아스가르드 바닷가에서 사는 Gold flying fish Mermaid 자넷. * #NewProfilePic : © 2017.… https://t.co/VQY5mDuGt1,7
Mon Sep 11 20:10:54 +0000 2017,This alligator leather clutch  was made in 1960 by Judith Leiber. The stunning gold-plated frame is studded with se… https://t.co/WqNYWAuWBF,0
Mon Sep 11 20:04:05 +0000 2017,Gold Tiger Iron Marra Mamba Womans Pendant Necklace Wire Wrapped Jewelry Han… https://t.co/WSAa0zbbNT #etsy #jewelry https://t.co/Q6y5JZ5R8y,3
Mon Sep 11 20:03:12 +0000 2017,Amazon Tribe Members “Killed And Chopped Up” By Gold Miners https://t.co/wyXJysr5Hv via @,0
Mon Sep 11 20:00:49 +0000 2017,Wear now  wear later https://t.co/pR2wSrKnXq https://t.co/rL8H5xpW2K,0
Mon Sep 11 19:41:09 +0000 2017,Mr Eazi was humble until he became rich by association. Imagine if he was the son of Otedola   he'd tell us Ghana colonized Nigeria.,3146
Mon Sep 11 19:36:30 +0000 2017,@IvoryGazelle *starts sneaking into your house at night and planting conquistador gold in litter box*,0
Mon Sep 11 19:33:26 +0000 2017,@AlecPloof we low key might have sold it I hear it's worth its weight in gold,0
Mon Sep 11 19:30:04 +0000 2017,Fill the fridge with Mens Room Gold - this seasonal delight won't be around much longer... https://t.co/KNcQIpHv4e https://t.co/BSwT9br32A,0
Mon Sep 11 19:22:16 +0000 2017,Sock it to me! Enter for a chance to win 52 pairs of socks from @themanualguide &amp; @GOLDTOE. https://t.co/Taxl30B5Re,0
Mon Sep 11 19:10:35 +0000 2017,Astute history https://t.co/X01ZdfwXMh,0
Mon Sep 11 18:42:18 +0000 2017,@moosecat_ @Tsepish @serephita @stephnoob I think Gold 76 is the only one they announced as "con exclusive" at SDCC… https://t.co/DQSV8KCOAB,0
Mon Sep 11 18:33:21 +0000 2017,all I need is my brothers wearing maroon and gold,6
Mon Sep 11 18:07:22 +0000 2017,Gold. https://t.co/LP0Q8IQjS0,0
Mon Sep 11 18:06:48 +0000 2017,Again he should be a 5 ⭐️. I keep telling @kyler_gordon purple and gold looks best on him tho. #dawgs #uw… https://t.co/qCktFZcL9C,3
Mon Sep 11 18:05:47 +0000 2017,Volatility of 10-2 US Yield Spread Signals 'Sell' Gold  'Buy' | Accumulate Bitcoin. $GLD $GDX $BTC https://t.co/3mOg4mb9Zt,1
Mon Sep 11 18:01:48 +0000 2017,@jwarminsky i hope you've already copyrighted all this stuff - you can't just throw gold out there like this and ex… https://t.co/p5H0vWLmPE,0
Mon Sep 11 17:48:17 +0000 2017,#RRN https://t.co/Ashlx6druK Uncontacted Tribe Allegedly Massacred By Gold Miners In Brazil,0
Mon Sep 11 17:44:08 +0000 2017,@sakibatch Oh man that antique gold is gorgeousss,0
Mon Sep 11 17:42:49 +0000 2017,Again he should be a 5 ⭐️. I keep telling @kyler_gordon purple and gold looks best on him tho. #dawgs #uw… https://t.co/qCktFZcL9C,3
Mon Sep 11 17:38:37 +0000 2017,Again he should be a 5 ⭐️. I keep telling @kyler_gordon purple and gold looks best on him tho. #dawgs #uw… https://t.co/qCktFZcL9C,3
Mon Sep 11 17:22:04 +0000 2017,@AshleyKMayo Gold Mountain in Bremerton  WA. Where Spieth and Greller met.,0
Mon Sep 11 17:11:53 +0000 2017,My dad sold my N64 and Gold version of OoT for coke https://t.co/KyUeTbarOz,0
Mon Sep 11 17:09:09 +0000 2017,Succulents  rose gold  and print templates galore! // #TheSnapBar #succulents #rosegold https://t.co/klVvwAsklR,0
Mon Sep 11 17:07:43 +0000 2017,Again he should be a 5 ⭐️. I keep telling @kyler_gordon purple and gold looks best on him tho. #dawgs #uw… https://t.co/qCktFZcL9C,3
Mon Sep 11 16:33:39 +0000 2017,Alamos Gold anuncia la adquisición amistosa de Richmont Mines - refuerza la posición como un productor de oro inte… https://t.co/XrJ5fBA1ZL,0
Mon Sep 11 16:21:03 +0000 2017,Check out 2017 Cooper Kupp Rated Rookie Lot Donruss Gold Standard Relic #'d /199 Rams RC https://t.co/aVhKAXtqin @eBay,0
Mon Sep 11 16:20:21 +0000 2017,@OldHossRadbourn GOLD!,0
Mon Sep 11 16:12:41 +0000 2017,Russia Blocks Crypto Exchange Debut Ahead Of Anti Gold Rush Regulations https://t.co/5KoRR08YjW,0
Mon Sep 11 16:00:06 +0000 2017,Dead Rising 4 is free for Gold in next 4 hours or just play 4 hours https://t.co/47uCJoxffH https://t.co/J1LEy67CKL,0
Mon Sep 11 15:43:11 +0000 2017,@TimTimah Booooooo. lol I know I have the gold to buy game time  I dont want to spend $$ on it just yet.,0
Mon Sep 11 15:13:25 +0000 2017,@joannlizabeth Black sweatshirt gold chain?,0
Mon Sep 11 15:10:44 +0000 2017,The Stone Roses - Fools Gold 4.15 - Fools Gold ’95 (1995),0
Mon Sep 11 14:57:23 +0000 2017,So  you can buy WoW time with gold  but how do you do that if you can't log in? Is there a pop up? I havent tried so  no clue. lol,0
Mon Sep 11 14:45:05 +0000 2017,Uncontacted tribe allegedly massacred by gold miners in Brazil https://t.co/AyuspdUvxi via @HuffPost,0
Mon Sep 11 14:38:56 +0000 2017,RT if ur 19 years or younger and know not to abuse and hit woman https://t.co/o63Je4mCyh,56973
Mon Sep 11 14:36:14 +0000 2017,i also can't help but slather him with gold jewelry lmao he's so fun to draw what the HELL,0
Mon Sep 11 14:30:46 +0000 2017,Rose gold Ferrari &amp; blacked out Range Rover ?????? https://t.co/f9whgnTMgC,3
Mon Sep 11 14:23:53 +0000 2017,Fiancé told me he doesn't want any gold in the wedding because it's "overdone" 😂 #goldiseverything https://t.co/nb2GS1Tl73,0
Mon Sep 11 14:16:23 +0000 2017,Angel Taz Tasmanian Devil Gold covered Pewter Pinback Lapel Pin Tie Tack Angel Wings &amp; Halo Warner Brothers by Thri… https://t.co/tnkppjarW4,0
Mon Sep 11 14:15:20 +0000 2017,5 Great Outdoor Adventures from Gold Bar to Wenatchee! Waterfalls to Glacier Views @WVChamber @wastateparks @leavenworth_wa @IcicleVillage,0
Mon Sep 11 14:12:45 +0000 2017,Nome  Alaska  struggles with hard-drinking Gold Rush legacy  https://t.co/662PSMDxH2 ➜ https://t.co/gPTA9SNUSQ https://t.co/33AxzVbhDI,0
Mon Sep 11 14:06:51 +0000 2017,RT if you want this Black &amp; Gold Bugatti https://t.co/XYaUrFN4xO,3
Mon Sep 11 14:04:09 +0000 2017,It's tea  time in Amazon's Gold Box. https://t.co/5w81Vzl0iQ https://t.co/YE4ZAfhARh,0
Mon Sep 11 14:02:21 +0000 2017,🎉GOLD MERMAID JANET🎉  * 1주년 기념 이벤트. * 아스가르드 바닷가에서 사는 Gold flying fish Mermaid 자넷. * #NewProfilePic : © 2017.… https://t.co/VQY5mDuGt1,7
Mon Sep 11 14:01:19 +0000 2017,Your new favorite necklace. https://t.co/bFxxbhmaDU #goldheartlocket https://t.co/yam45yYqJs,0
Mon Sep 11 13:43:26 +0000 2017,One more thing... New iPod discovered in iOS 11 Gold Master code? https://t.co/i6KjM9ZtAy @slideme https://t.co/lbTxkPoxmq,0
Mon Sep 11 13:42:14 +0000 2017,Did @tylerthecreator Just Turn That Zebra Into A BMX Bike 😂🔥 https://t.co/6M46DhOspC,86
Mon Sep 11 13:36:12 +0000 2017,If more of us valued food and cheer and song above hoarded gold  it would be a merrier world. - J.R.R. Tolkien… https://t.co/gyadpbb60U,0
Mon Sep 11 13:23:57 +0000 2017,@hiziri_pro "A crown of gold" ha! Love it!,0
Mon Sep 11 13:22:05 +0000 2017,RT if you want this Black &amp; Gold Bugatti https://t.co/XYaUrFN4xO,3
Mon Sep 11 13:18:49 +0000 2017,Blue and Gold Quilled Circle Necklace https://t.co/9RrZRfg7ua via @Etsy,0
Mon Sep 11 13:13:07 +0000 2017,RT if you want this Black &amp; Gold Bugatti https://t.co/XYaUrFN4xO,3
Mon Sep 11 12:19:31 +0000 2017,@Black24Mamba8 @PFF Three fucking tackles. Let's break out the gold jacket.,0
Mon Sep 11 12:15:17 +0000 2017,RUSTIC Silver &amp; Brass (not 14k gold) 6.5 mm// Men's Weddi… https://t.co/vPKHuKUdlw #weddingbands #SterlingSilverBand https://t.co/SS7GLi5dKf,0
Mon Sep 11 11:54:22 +0000 2017,crush kaayo nako tung gold na casio watch 😭 hays. kailan ba ulit ako magkakaayos na relo,0
Mon Sep 11 11:38:14 +0000 2017,The Agreement That Shifts the Paradigm of Gold-Backed Tokens https://t.co/hJbceCQQne,0
Mon Sep 11 11:03:29 +0000 2017,Alamos Gold Announces Friendly Acquisition of Richmont Mines - Solidifies Position as a Leading Intermediate Gold … https://t.co/3NSl9FfwQN,0
Mon Sep 11 11:03:28 +0000 2017,Richmont Mines Enters into Definitive Agreement with Monarques Gold for Non-Core Québec Assets https://t.co/zbluOtXAWB,0
Mon Sep 11 11:03:28 +0000 2017,Monarques Gold Enters Into a Definitive Agreement to Acquire All the Mining Assets of Richmont Mines in the Provin… https://t.co/JJMjCEY8q4,0
Mon Sep 11 11:03:27 +0000 2017,Richmont Mines llega a un acuerdo definitivo con Monarques Gold para los activos no centrales de Quebec https://t.co/JPtUyhw2ht,0
