Tue Jan 01 21:51:57 +0000 2019,Ppl ask me what I think my biggest contribution to the @sternshow is. It's not any of my prank calls. It's me hooki… https://t.co/TCF5ZzFll0,0
Tue Jan 01 21:08:47 +0000 2019,Greetings to .@italianjewmom from all of us  your #Fans &amp; #FRIENDS in our new #2019 time bubble... #follow this Ste… https://t.co/HXe3hS7WmW,0
Tue Jan 01 20:47:58 +0000 2019,HAPPY NEW YEAR!  We are kicking off 2010 so excited to be starting some amazing new projects  plus a few secrets we… https://t.co/KxmRU5FRWg,0
Tue Jan 01 18:47:34 +0000 2019,Flyers and Hurricanes doing a stellar job putting everyone to sleep so they are well and rested for midnight.,2
Tue Jan 01 17:30:35 +0000 2019,Happy New Year from the 2019 AYF Sr. Olympics hosts...Chicago! Pour the bubbly and raise a glass because our Resolu… https://t.co/4XqhVUBI7S,0
Tue Jan 01 14:11:40 +0000 2019,Here’s To A Stellar 2019! https://t.co/SkF9NYjs5T https://t.co/s9kzxpzwjR,0
Tue Jan 01 13:45:05 +0000 2019,Stellar jazz? Check. Powerful message? Check. Holiday week plans made? Check. Join us Dec. 30 at the Phila Episcopa… https://t.co/jaaOXQR8YP,3
Tue Jan 01 08:57:08 +0000 2019,あけましておめでとうございます!! Happy New Year!!!!~ (*ﾟ∇ﾟ)ﾉ https://t.co/KMkv11iQ98,2777
Tue Jan 01 04:39:57 +0000 2019,I am very excited to be apart of this stellar group of wrestling minds! I've heard nothing but "rave" reviews from… https://t.co/rZFZqKRjyw,2
Tue Jan 01 00:23:15 +0000 2019,Flyers and Hurricanes doing a stellar job putting everyone to sleep so they are well and rested for midnight.,2
