Sat Feb 24 23:14:03 +0000 2018,Partner and Chief Investment Officer of our Dallas-Fort Worth office  @TheJoshuaWilson  breaks down the vulnerabili… https://t.co/AOUOpyRhKP,2
Sat Feb 24 23:05:04 +0000 2018,Partner and Chief Investment Officer of our Dallas-Fort Worth office  @TheJoshuaWilson  breaks down the vulnerabili… https://t.co/AOUOpyRhKP,2
Sat Feb 24 23:00:02 +0000 2018,“Surviving a failure allows you more self-confidence. Failing is a great learning tool  but it must be kept to an a… https://t.co/S0OcfiIQWT,0
Sat Feb 24 22:25:06 +0000 2018,Investment Opportunity:  Greenfield Dr Office Buildings:  Two buildings on large lot  100% leased or rear... https://t.co/QmOIf5wFvW,0
Sat Feb 24 22:25:03 +0000 2018,Investment Opportunity:  Greenfield Dr Office Buildings:  Two buildings on large lot  100% leased or rear building… https://t.co/9RL9d6OGzK,0
Sat Feb 24 21:48:44 +0000 2018,Barca needs to be patient with Dembele. We don’t need him to be great now  but when Messi is no longer the main man. This is an investment.,0
Sat Feb 24 21:06:01 +0000 2018,How Israel financial tech is boosting the investment world by using AI-  https://t.co/IIQTNmdsUB via @i_know_first @yaron_gol #ai #fintech,0
Sat Feb 24 21:01:34 +0000 2018,8 Reasons You Shouldn't Manage Your Own Investment Properties -... https://t.co/8JxCODiUKi,0
Sat Feb 24 21:01:28 +0000 2018,8 Reasons You Shouldn't Manage Your Own Investment Properties -https://t.co/yZyUKlphB4 https://t.co/fyRuAekPZ4,0
Sat Feb 24 21:01:15 +0000 2018,8 Reasons You Shouldn't Manage Your Own Investment Properties -https://t.co/Lwbt4yJ7Ir https://t.co/cX4t4ERelh,0
Sat Feb 24 21:01:15 +0000 2018,8 Reasons You Shouldn't Manage Your Own Investment Properties -... https://t.co/V34pLb0GaS,0
Sat Feb 24 21:00:37 +0000 2018,8 Reasons You Shouldn't Manage Your Own Investment Properties -https://t.co/zoO9GWQWNl https://t.co/jpO7up19NK,0
Sat Feb 24 17:51:14 +0000 2018,@NickInfoSec That sounds like a great book and a great investment of time. My sed and awk skills could definitely u… https://t.co/uBAi3MFKQ1,0
Sat Feb 24 17:30:45 +0000 2018,Another successful client/investment.. If you 100% ready to do business DM me ASAP. Please don't waste my time 🙏🏼💋 https://t.co/cd31hikkxg,1
Sat Feb 24 17:15:08 +0000 2018,YES! @omarpassons the #GreenBond challenge remains ability 2 scale up climate-smart investments bringing new financ… https://t.co/rYUjhXCgoz,1
Sat Feb 24 17:05:39 +0000 2018,YES! @omarpassons the #GreenBond challenge remains ability 2 scale up climate-smart investments bringing new financ… https://t.co/rYUjhXCgoz,1
Sat Feb 24 16:57:58 +0000 2018,I have this beautiful idea that I’ve been birthing for a few years. All I need is the right investment so I can   H… https://t.co/ejFYZaaeyy,0
Sat Feb 24 16:52:22 +0000 2018,@GregMcElroy Its harder to do in football though. An "investment" in a basketball player pays off sooner and has less risk involved.,0
Sat Feb 24 16:51:48 +0000 2018,Excited to announce another great real estate investment opportunity in San Diego! I just listed an impeccable ... https://t.co/Q4LgSJCyXV,0
Sat Feb 24 16:21:04 +0000 2018,#OpenHouse Saturday and Sunday 1-4 These are the ONLY showings!  3996 Gamma San Diego  Great Investment... https://t.co/06BmSQ9Kzb,0
Sat Feb 24 16:14:23 +0000 2018,#OpenHouse 1-4  ONLY showings! 3996 Gamma San Diego Great Investment opportunity. 2 seperate homes on 1 lot  2/1 ba… https://t.co/aUy8L0txeo,0
Sat Feb 24 14:59:53 +0000 2018,You and I can’t stop doing business with our own government @wizkidgriff  but foreign investors will.  They see tha… https://t.co/BRYGES29Au,3
Sat Feb 24 14:50:10 +0000 2018,You and I can’t stop doing business with our own government @wizkidgriff  but foreign investors will.  They see tha… https://t.co/BRYGES29Au,3
Sat Feb 24 10:12:04 +0000 2018,@businessinsider I can only imagine the maintenance it would require in the long run! bad investment but clever idea.,0
Sat Feb 24 10:06:16 +0000 2018,How two Goldman Sachs investment bankers quit their jobs and raised £5 million to cook meals for the dogs of celebr… https://t.co/pW2p5H0fAZ,0
Sat Feb 24 09:37:51 +0000 2018,At a conference in Bangalore The best hope from India is amazing  let's join this project. !!Streamity services inc… https://t.co/nkrRwOC1ML,0
Sat Feb 24 09:13:19 +0000 2018,The latest Investment Real Estate Daily! https://t.co/2BvW4fc2Tq #realtor #realestate #sandiego #investing,0
Sat Feb 24 08:09:31 +0000 2018,https://t.co/T3MiRoKSDF : YouTube reportedly plans to spend 'hundreds of millions' on Red originals https://t.co/zTxaxEb0wv,0
Sat Feb 24 08:06:16 +0000 2018,easyJet's billionaire founder Sir Stelios Haji-Ioannou gets into fintech with new online investment platform https://t.co/Tgeu6G9um0,0
Sat Feb 24 07:43:22 +0000 2018,Watch: Update on the state of mining markets in 2018. Join me with @jamesgrickards @ttmygh and others at the Sprott… https://t.co/iAbsOfjkgQ,7
Sat Feb 24 06:18:07 +0000 2018,Watch: Update on the state of mining markets in 2018. Join me with @jamesgrickards @ttmygh and others at the Sprott… https://t.co/iAbsOfjkgQ,7
Sat Feb 24 06:10:41 +0000 2018,Doug Applegate is a retired Marine Colonel who supports MedicareForAll  a $15 min. wage  investment in renewable en… https://t.co/ENXroUekD3,139
Sat Feb 24 05:16:30 +0000 2018,“If you’re changing the world  you’re working on important things. You’re excited to get up in the morning.” -- Lar… https://t.co/gaLUuWUuPm,1
Sat Feb 24 04:57:59 +0000 2018,Have you ever seen a Wall Street investment firm that pays profits from the sale of assets and charges no fees? Nev… https://t.co/KobIA2ygSd,1
Sat Feb 24 04:50:27 +0000 2018,You and I can’t stop doing business with our own government @wizkidgriff  but foreign investors will.  They see tha… https://t.co/BRYGES29Au,3
Sat Feb 24 04:39:01 +0000 2018,On February 12  2018  the SEC issued a press release announcing the Share Class Selection Disclosure Initiative to… https://t.co/AgkFB4RZX4,0
Sat Feb 24 03:20:22 +0000 2018,You and I can’t stop doing business with our own government @wizkidgriff  but foreign investors will.  They see tha… https://t.co/BRYGES29Au,3
Sat Feb 24 02:25:03 +0000 2018,"After vowing to cancel them if elected  Mexico’s leftist presidential candidate #AMLO appears to be having a chang… https://t.co/Ox0utGeRkf,0
Sat Feb 24 02:24:26 +0000 2018,Doug Applegate is a retired Marine Colonel who supports MedicareForAll  a $15 min. wage  investment in renewable en… https://t.co/ENXroUekD3,139
Sat Feb 24 01:14:51 +0000 2018,Are you willing to invest in yourself? ❤️ this post by @eatsandretreats on why #travel is an investment in yourself… https://t.co/SxSoZqlLid,2
Sat Feb 24 01:11:13 +0000 2018,Are you willing to invest in yourself? ❤️ this post by @eatsandretreats on why #travel is an investment in yourself… https://t.co/SxSoZqlLid,2
Sat Feb 24 01:10:13 +0000 2018,Are you willing to invest in yourself? ❤️ this post by @eatsandretreats on why #travel is an investment in yourself… https://t.co/SxSoZqlLid,2
Sat Feb 24 00:47:58 +0000 2018,Tech/Law~ San Francisco: Building Community Broadband to Protect Net Neutrality and Online Privacy - Like many citi… https://t.co/lwgAxp53wZ,0
Sat Feb 24 00:43:13 +0000 2018,Hi my name is Ms Jaime C. I am a newbie real estate investor I am the CEO of Sissy Investment Group VIP List https://t.co/lMCj0VW6V2,0
Sat Feb 24 00:13:04 +0000 2018,Home buyers have a way to fund the down payment on a home purchase  and this doesn't require borrowing more. The Ri… https://t.co/6cqHNT8xWn,0
