Thu Mar 15 23:53:31 +0000 2018,Join the Wells Fargo team! See our latest #job opening here: https://t.co/BR8O5eCYjj #InvestmentBanking #SanDiego  CA #Hiring #CareerArc,0
Thu Mar 15 23:42:45 +0000 2018,Hi my name is Ms Jaime C. I am a newbie real estate investor I am the CEO of Sissy Investment Group VIP List https://t.co/lMCj0VEvws,0
Thu Mar 15 23:09:16 +0000 2018,BW &amp; BW on your radio dial right now! @BrentWilsey in-studio with Brett Winterble @WinterbleShow @760kfmb now talki… https://t.co/ihFpfpXj7c,0
Thu Mar 15 22:53:37 +0000 2018,Spending $1 on a Spongebob ringtone was the best investment I’ve ever made,0
Thu Mar 15 22:50:07 +0000 2018,6 Upgrades That Add Top Value to Your Commercial Investment Property:https://t.co/WhlwpSXRSq,0
Thu Mar 15 22:33:21 +0000 2018,Are you ready to sell your investment property? In my experience  it never hurts to follow a proven system. https://t.co/l5mouTolYn,1
Thu Mar 15 22:27:12 +0000 2018,https://t.co/QDwdCpq53X,0
Thu Mar 15 22:03:04 +0000 2018,"3 signs your money has outgrown your investment advisor"  I assure you  you are barking up the wrong tree here,1
Thu Mar 15 22:02:06 +0000 2018,Are you ready to sell your investment property? In my experience  it never hurts to follow a proven system. https://t.co/l5mouTolYn,1
Thu Mar 15 21:58:09 +0000 2018,"3 signs your money has outgrown your investment advisor"  I assure you  you are barking up the wrong tree here,1
Thu Mar 15 21:43:07 +0000 2018,#SanDiego Closes 2017 With Record Sales Volumes  @cbrecapitalmkts expert Scott Peterson talks to @GlobeStcom about… https://t.co/qvMbzm84LI,0
Thu Mar 15 21:25:04 +0000 2018,Simple is best. Dirt Cheap Demolition. Lic. 686879. "We are honored to destroy your investment!" Support local lice… https://t.co/xj7vyiZbDN,0
Thu Mar 15 21:24:14 +0000 2018,@nbcsandiego For shop #2  maybe protect your investment with some insurance.,0
Thu Mar 15 21:07:57 +0000 2018,Pedestrian #bridgeCollapse would be a good reminder that US infrastructure needs massive investment and rebuilding … https://t.co/RWFSIBQ8wX,0
Thu Mar 15 21:02:01 +0000 2018,Let's be honest  there's more than one way to sell an investment property... If you don't have a system that works… https://t.co/xYLhRVBG4t,0
Thu Mar 15 20:45:07 +0000 2018,Are you curious about what home improvement project has the highest return on investment? https://t.co/VTHqur9aIZ https://t.co/ENwm7RCFZF,0
Thu Mar 15 20:13:03 +0000 2018,Youth disconnection rates is a national issue. To lower the rates  it will take bold leaders with innovative soluti… https://t.co/cDHZCoo74B,0
Thu Mar 15 19:46:58 +0000 2018,Dowling &amp; Yahnke Ranked on InvestmentNews’ Largest Fee-Only Registered Investment Advisors https://t.co/tMCc8YaZ0m,0
Thu Mar 15 19:42:30 +0000 2018,14 million Nice investment! Not! RIP to the victims. Hugs to the families. 😢 No word from @realDonaldTrump  BIG sur… https://t.co/4T6AqNxGoL,0
Thu Mar 15 19:31:03 +0000 2018,Investment and feasibility studies: For an investor  making an investment is not an easy task. It requires detailed… https://t.co/gCBp02lHxg,0
Thu Mar 15 19:16:08 +0000 2018,Where is Money Being Spent in Broadcast Industry (and why)? Top CTOs to Discuss Tech Investment Plans at Devoncroft… https://t.co/vtSSxyqAh8,23
Thu Mar 15 19:07:28 +0000 2018,Investor alleges Allegis Investment Advisors and former broker Brandon Curt Stimpson put him in unsuitable investme… https://t.co/AtqEF0q1xZ,1
Thu Mar 15 18:35:57 +0000 2018,We loved hosting @FukuyamaFrancis last month at our seventh annual Sokwanlok Distinguish Lecture Series  sponsored… https://t.co/S9PlFX6KoN,1
Thu Mar 15 18:15:27 +0000 2018,Investor alleges Allegis Investment Advisors and former broker Brandon Curt Stimpson put him in unsuitable investme… https://t.co/AtqEF0q1xZ,1
Thu Mar 15 17:37:29 +0000 2018,Doug Applegate is a retired Marine Colonel who supports MedicareForAll  a $15 min. wage  investment in renewable en… https://t.co/ENXroUekD3,166
Thu Mar 15 17:30:22 +0000 2018,We loved hosting @FukuyamaFrancis last month at our seventh annual Sokwanlok Distinguish Lecture Series  sponsored… https://t.co/S9PlFX6KoN,1
Thu Mar 15 17:19:55 +0000 2018,A promising project with a good team and great views on the future.  Favorable conditions for investment in the ear… https://t.co/sw7pwztGe6,0
Thu Mar 15 17:18:08 +0000 2018,As far as I'm concerned   truly great Realtors are an investment in and of themselves. Like if you agree. https://t.co/u8sQa6B2B4,1
Thu Mar 15 17:01:43 +0000 2018,@krassenstein Putin is smiling 😀...his investment in #CadetBoneSpurs has paid off Bigly!,0
Thu Mar 15 16:35:20 +0000 2018,Good insights from our chief investment strategist. https://t.co/LL4HvL1UGd,0
Thu Mar 15 16:24:06 +0000 2018,The rising stars of marijuana's investment scene that people from Wall Street to Silicon Valley should know https://t.co/GNvHcjVAvs,0
Thu Mar 15 16:23:13 +0000 2018,You don’t need cash  just time. If you don’t have the time  that’s where I come in 😏 https://t.co/FpKuCJWR89  #business #socialmedia #forbes,0
Thu Mar 15 16:05:18 +0000 2018,One #investment that may actually be very wise  as you're planning your #wealth strategy  is #LifeInsurance! Howeve… https://t.co/5QHaEYtXgA,0
Thu Mar 15 16:02:36 +0000 2018,As far as I'm concerned   truly great Realtors are an investment in and of themselves. Like if you agree. https://t.co/u8sQa6B2B4,1
Thu Mar 15 15:54:36 +0000 2018,Do you know anyone looking for a great investment in the heart of UTC for UCSD students or just a wonderful... https://t.co/bQUTCIvFLk,0
Thu Mar 15 15:39:26 +0000 2018,Strategic thinking about water. https://t.co/mwo7itM6yr,0
Thu Mar 15 15:36:40 +0000 2018,Where is Money Being Spent in Broadcast Industry (and why)? Top CTOs to Discuss Tech Investment Plans at Devoncroft… https://t.co/vtSSxyqAh8,23
Thu Mar 15 15:19:23 +0000 2018,Are you keeping your teams and technologies siloed away from each other? #compliance https://t.co/gbIIBost0e,0
Thu Mar 15 15:00:55 +0000 2018,Why #Traveling the World Is the Best Investment in Yourself https://t.co/fISjGr97k3 via @successmagazine #selfhelp,0
Thu Mar 15 14:38:53 +0000 2018,@MikeKlis I'd hope a tackle is on the way.  Watching Keenum suffer the way Siemian and Lynch has wouldn't be a good investment.,0
Thu Mar 15 14:30:32 +0000 2018,The individual investor should act consistently as an investor and not as a speculator. -Ben Graham #investment #money,0
Thu Mar 15 14:10:17 +0000 2018,Where is Money Being Spent in Broadcast Industry (and why)? Top CTOs to Discuss Tech Investment Plans at Devoncroft… https://t.co/vtSSxyqAh8,23
Thu Mar 15 11:51:14 +0000 2018,Where is Money Being Spent in Broadcast Industry (and why)? Top CTOs to Discuss Tech Investment Plans at Devoncroft… https://t.co/vtSSxyqAh8,23
Thu Mar 15 10:46:26 +0000 2018,Where is Money Being Spent in Broadcast Industry (and why)? Top CTOs to Discuss Tech Investment Plans at Devoncroft… https://t.co/vtSSxyqAh8,23
Thu Mar 15 10:45:04 +0000 2018,Oh how I love data.  Interesting analysis on optimal VC board involvement by @CoatsDavid at @CorrelationVC here --&gt;… https://t.co/yAdEbtAcnZ,2
Thu Mar 15 10:44:49 +0000 2018,Where is Money Being Spent in Broadcast Industry (and why)? Top CTOs to Discuss Tech Investment Plans at Devoncroft… https://t.co/vtSSxyqAh8,23
Thu Mar 15 09:13:21 +0000 2018,The latest Investment Real Estate Daily! https://t.co/TnALtMsD7s #realtor #realestate #sandiego #investing,0
Thu Mar 15 08:34:16 +0000 2018,Guys  do not forget that now ICO which is very interesting in terms of investment project: #Photochain #ico #ethereum #bitcoin,0
Thu Mar 15 08:30:27 +0000 2018,The best way for investments in cryptocurrency. Join Pre-sale and get 50% for your success investment. #Toplancer… https://t.co/kCj1ctv04T,1
Thu Mar 15 07:30:03 +0000 2018,The goal is to enable a transparent management and capital escalation for as many people as possible. The intention… https://t.co/RX3Xno2utR,0
Thu Mar 15 06:03:29 +0000 2018,@cryptodog13 @CryptoBully buy it on Kucoin but keep it on a ledger  yes once it is listed on a bigger exchange..BOO… https://t.co/uyNTqKaob2,0
Thu Mar 15 05:00:32 +0000 2018,New post (As Seen on TV Exercise Equipment - Is it Worth Your Time and Investment?) has been published on Spencer K… https://t.co/r7FyM60IbM,0
Thu Mar 15 04:41:24 +0000 2018,@funder is the GOP trying to steal our investment in Social Security and Medicare to pay for the Tax Cut for Billio… https://t.co/pQcJMBHxBu,0
Thu Mar 15 04:12:06 +0000 2018,Billionaire Investor Alan Howard Makes "Sizable Investment" In Cryptocurrencies - https://t.co/oem0lWhQcg  #crypto #coin #blockchain,1
Thu Mar 15 04:11:45 +0000 2018,"We spend so much on health care because we're mopping up for our lack of investment in education  housing and othe… https://t.co/5k49p8ysWU,2
Thu Mar 15 04:05:00 +0000 2018,Billionaire Investor Alan Howard Makes "Sizable Investment" In Cryptocurrencies - https://t.co/oem0lWhQcg  #crypto #coin #blockchain,1
Thu Mar 15 03:50:46 +0000 2018,Where is Money Being Spent in Broadcast Industry (and why)? Top CTOs to Discuss Tech Investment Plans at Devoncroft… https://t.co/vtSSxyqAh8,23
Thu Mar 15 03:42:38 +0000 2018,6/ Represented an attorney in a criminal tax investigation relating to the POINT (Personally Optimized Investment T… https://t.co/lUv97UGY4P,0
Thu Mar 15 03:39:08 +0000 2018,@MrFilmkritik @Jorja001 Shifting of wealth ? I have billions in assets “cash  property  equities”. And the price of… https://t.co/tw8Ea6e654,0
Thu Mar 15 02:42:42 +0000 2018,Doug Applegate is a retired Marine Colonel who supports MedicareForAll  a $15 min. wage  investment in renewable en… https://t.co/ENXroUekD3,166
Thu Mar 15 02:41:30 +0000 2018,@ChargersLegion But that $$$$$$$ tho. 🤷‍♂️ perhaps a better investment should go to a front 7 guy. I mean I'm not n… https://t.co/CbfCkOQGzz,0
Thu Mar 15 02:26:47 +0000 2018,@kane_mason10 @cathynewman It seems to shock people that performers are paid based on their ability to garner a ret… https://t.co/SSQq6DjcPX,0
Thu Mar 15 02:07:47 +0000 2018,Awww tired of the #HODL?  Because you're doing it all wrong. Stop losing your damn initial investment and read this… https://t.co/ESZCYMEdiD,0
Thu Mar 15 01:43:32 +0000 2018,And remember! Go solar and support CAC! 🌞For every system purchased using CAC as a reference  @SullivanSolar will m… https://t.co/GjmV1b17TU,2
Thu Mar 15 01:00:34 +0000 2018,Properly Sizing Your Target Market is Essential to Securing Outside Investment  Learn how do do that successfully h… https://t.co/67yuy7d4nE,0
Thu Mar 15 00:41:43 +0000 2018,https://t.co/4m5w82OocF #Valorlendinggroup #prideinlending #RealEstate #RealEstateAgent #Mortgage #Mortgages… https://t.co/7wrNVNpRD5,0
Thu Mar 15 00:31:00 +0000 2018,@rtyson82 @TomSteyer get on this. Better investment than your boring TV commercials and would be more effective,0
Thu Mar 15 00:23:49 +0000 2018,'Equity Residences Managing Directors speak on advantages of investing in luxury vacation residences' https://t.co/l0atTF74AR,0
Thu Mar 15 00:21:29 +0000 2018,https://t.co/PVo17Vl3xz the Best investment for any metropolitan city. #OFO,0
Thu Mar 15 00:00:27 +0000 2018,Investment 101 #cryptocurrency $BTC 🤪😜 https://t.co/rGNGgSIYGj,11
