Wed Aug 22 23:43:18 +0000 2018,ATTENTION ALL REAL ESTATE BIRD DOGS.  BWD Investment Group &amp; ?Tessa Group&amp;#8482;?  We will pay you $1000 for sendin… https://t.co/GSKWlMj5bL,0
Wed Aug 22 23:43:04 +0000 2018,Hi my name is Ms Jaime C. I am a newbie real estate investor I am the CEO of Sissy Investment Group VIP List https://t.co/lMCj0VW6V2,0
Wed Aug 22 22:42:39 +0000 2018,Check out these snazzy new #EVARC in the making! Stay tuned to find out where they're going. #EnvisionSolar #EVSI… https://t.co/3aD7Ieotwg,2
Wed Aug 22 22:39:16 +0000 2018,Make Money Fast | Referral Program | Bird Dogs - BWD Investment Group &amp; ?Tessa Group&amp;#8482;?  We will pay you $1000… https://t.co/0NBjFWEaOo,0
Wed Aug 22 22:35:43 +0000 2018,@legndofphoenix Semi precious stones are always a good investment  in case the economy collapses?,0
Wed Aug 22 22:08:58 +0000 2018,Check out these snazzy new #EVARC in the making! Stay tuned to find out where they're going. #EnvisionSolar #EVSI… https://t.co/3aD7Ieotwg,2
Wed Aug 22 22:08:00 +0000 2018,Check out these snazzy new #EVARC in the making! Stay tuned to find out where they're going. #EnvisionSolar #EVSI… https://t.co/3aD7Ieotwg,2
Wed Aug 22 21:47:21 +0000 2018,Watch this quick video explaining  #stock market basics and the investor psychology cycle.  #Investing… https://t.co/JT8PWaQiKT,1
Wed Aug 22 21:42:08 +0000 2018,@FrugalMoneyMan Unconventional Success by David Swensen is the best investment book I've ever read.,0
Wed Aug 22 21:39:56 +0000 2018,Make Money Fast | Referral Program | Bird Dogs - BWD Investment Group &amp; Jai Buys Houses  llc... We will pay you $10… https://t.co/feNOYlopXt,0
Wed Aug 22 21:12:03 +0000 2018,Is @WalmartLabs #tech investment in San Diego a sign of bigger things to come? We think so! Read the @sdut article… https://t.co/2E26YSPiOg,0
Wed Aug 22 21:10:05 +0000 2018,An investment in our teachers and schools is an investment for our country's future.  Think of it as R&amp;D for long-t… https://t.co/agb1KLmoiq,0
Wed Aug 22 21:06:11 +0000 2018,Say every home had a friendly #robot. What would some of its functionalities be? And more importantly  what would y… https://t.co/vTRt7f4luD,0
Wed Aug 22 20:28:34 +0000 2018,Watch this quick video explaining  #stock market basics and the investor psychology cycle.  #Investing… https://t.co/JT8PWaQiKT,1
Wed Aug 22 20:01:51 +0000 2018,This turn-key beach condo stays light and bright all day long and features ocean views from the front patio + kitch… https://t.co/aAX5VOBb4K,0
Wed Aug 22 19:49:49 +0000 2018,@Bc1906Trader @ThoughtsOfTony @realDonaldTrump Aging Americans  that’s can’t be helped with the tax cuts for both c… https://t.co/Qv7iqbrj0C,0
Wed Aug 22 19:49:22 +0000 2018,@AstarQC @tkeela13 @Im_Classic @MyFuturePapi @6Creamo you’re not thinking broadly enough. 22 mill is plausible  the… https://t.co/nCtcooUwGa,0
Wed Aug 22 19:40:56 +0000 2018,New triple-play ICO investment:  #coldfusion  transmuting elements  and #cryptocurrency. New application of “synerg… https://t.co/mJoOJ5wJqR,0
Wed Aug 22 19:40:05 +0000 2018,How a #smallbusiness can compete with corporate funded  mega-sized companies. "Investment Killed the Internet Star"… https://t.co/scsqhuHZML,0
Wed Aug 22 19:36:19 +0000 2018,Let me find the best loan for your new home or investment property: Conventional Loans – Purchase  Refinance  and 3… https://t.co/d5JPJIvOSc,0
Wed Aug 22 19:32:12 +0000 2018,@DavidBarnettMVP Wouldn't call him a "steal" but I'd say he's provided the value he's being paid for. Solid return on investment.,0
Wed Aug 22 19:14:51 +0000 2018,I don’t get it ... when u show no interest or initiative in going on a date or doing something other than chillin i… https://t.co/FqfeWcbATI,0
Wed Aug 22 18:34:29 +0000 2018,@LibertyHacking @katelynveronica @et3rnal30 @PatNColl @RealJamesWoods 3. 2014Q1 (-1.0%) - Primary driver: polar vor… https://t.co/9OAXqSqKY9,0
Wed Aug 22 18:29:45 +0000 2018,"I am a man from Japan  #Yudi #Takahashi - CCO - #SuzukiCoin  we are an investment company where you can earn at le… https://t.co/Q1MUiJSfB8,0
Wed Aug 22 17:51:48 +0000 2018,#Putin's LNG empire #Yamal 1 &amp; 2 to destroy #climate with #methane  doesn't need #SaudiAriabia investment. So… https://t.co/yzoJaUmjPe,0
Wed Aug 22 17:30:27 +0000 2018,Top 4 Home Renovations For Maximum ROI - Whether you're selling your home  or investing  there is value in knowing… https://t.co/OvqDqkgCVr,4
Wed Aug 22 17:30:26 +0000 2018,Chilean President Sebastian Pinera said that his overhaul of the country’s tax structure would “modernize” Chile’s… https://t.co/T93BwOYbEH,0
Wed Aug 22 17:21:25 +0000 2018,@MebFaber @farnamstreet Can you expand on the reasoning behind #2? If a dividend yield is a consistent 10%  isn't t… https://t.co/Q4t7cv3997,0
Wed Aug 22 16:57:53 +0000 2018,Investing in people within your organization can have positive long-term results. Find out why “people” can be one… https://t.co/6y529k75Vs,1
Wed Aug 22 16:56:04 +0000 2018,@MargBouse Hi Marg  forgive us for the delayed response. You can visit https://t.co/6dQtk2NenQ for FAQs and if you… https://t.co/Mep1Ycpq2I,0
Wed Aug 22 16:55:16 +0000 2018,Investing in people within your organization can have positive long-term results. Find out why “people” can be one… https://t.co/6y529k75Vs,1
Wed Aug 22 16:30:28 +0000 2018,@AirspaceTech raises $8M series A led by @DefyVentures  making this the fund's second SD investment after… https://t.co/r3M6NVxHpn,0
Wed Aug 22 16:05:11 +0000 2018,@BillWinterberg @Rick_Ferri @alphaarchitect @MichaelKitces @ReformedBroker @eric_freckman @TDAmeritrade Part 1-The… https://t.co/PpxggYqwks,0
Wed Aug 22 15:45:04 +0000 2018,Change Management Consultant that generates a Return on Investment Candidate - Cockeysville  MD 21030: Throughout m… https://t.co/hvVtrClj8U,0
Wed Aug 22 15:42:35 +0000 2018,Is @Walmart's tech investment in #SanDiego a sign of bigger things to come? https://t.co/dzFPwPYX93 via @physorg_com #datascience #AI,1
Wed Aug 22 15:40:19 +0000 2018,A modern Trans-Am drag car package that's possibly worth the investment   https://t.co/FbSQwpcEJj https://t.co/yPpFrrroXO,0
Wed Aug 22 15:37:33 +0000 2018,Is @Walmart's tech investment in #SanDiego a sign of bigger things to come? https://t.co/dzFPwPYX93 via @physorg_com #datascience #AI,1
Wed Aug 22 15:16:21 +0000 2018,@Just_Investment - thanks for the follow Just  &amp; have a great Wednesday!,0
Wed Aug 22 15:12:57 +0000 2018,https://t.co/d79PjgvFMA https://t.co/zFt1fzfjOR,0
Wed Aug 22 15:05:02 +0000 2018,Renters for a Weekend or a While: What’s the Best Use of Your Investment Property? The... https://t.co/kAjJQG6VDU https://t.co/U9j7L0AGZm,0
Wed Aug 22 14:55:53 +0000 2018,It's been quite the ride these last few month. Between being named a top 50 company by @RoboticsBusiness  as well a… https://t.co/FPj09gi3ro,1
Wed Aug 22 14:42:42 +0000 2018,We are excited to announce that BVAccel has taken a majority investment from @AugustSpark  a New York-based family… https://t.co/xmIQ5gn9tW,1
Wed Aug 22 14:41:26 +0000 2018,"The quarter’s strong sales represent years of investment in product development  education  consumer awareness and… https://t.co/RH2ARZQ60S,9
Wed Aug 22 14:27:25 +0000 2018,We are excited to announce that BVAccel has taken a majority investment from @AugustSpark  a New York-based family… https://t.co/xmIQ5gn9tW,1
Wed Aug 22 14:08:40 +0000 2018,But anyway I think buying at a high &amp; watching your investment fall in price is actually a really good lesson in in… https://t.co/MxuiTUs72t,0
Wed Aug 22 14:00:08 +0000 2018,First impressions last. That’s why many homes and real estate professionals put extra time and investment in improv… https://t.co/HODp1CALKf,0
Wed Aug 22 13:57:05 +0000 2018,If you buy an investment you shouldn't be expecting any returns for at least 5-10years. That's how investing works.… https://t.co/HC3MOY2DFo,0
Wed Aug 22 13:54:37 +0000 2018,Any investment you buy should be a LONG. 99% of people are too dumb to short the market. If you aren't trading with… https://t.co/Aroe86Dkzy,0
Wed Aug 22 13:45:27 +0000 2018,Are you a frustrated investor tired of putting out money on things that do not work?? WELL STOP  FOLLOW… https://t.co/czkynEB3t1,0
Wed Aug 22 13:39:36 +0000 2018,Check us out on @businessinsider this morning! Stay tuned for more info  coming soon. #eCommerce #digitalagency… https://t.co/sDKFFtrFwf,0
Wed Aug 22 13:03:01 +0000 2018,Assess Your IT Investment with Microsoft 365's Usage Analytics Reports  https://t.co/F3bFJJygbx https://t.co/WEeY0oI0jT,0
Wed Aug 22 12:49:48 +0000 2018,@CNN THIS is why people are putting up with a slimeball like Trump. GOP is now the party of Trump.  The party for t… https://t.co/Noh3dYosDN,0
Wed Aug 22 11:05:08 +0000 2018,Wave of Investment Has Life Sciences Swimming in Cash https://t.co/IrKATTBKmu Get Found -&gt; https://t.co/xlk8n0G7pj https://t.co/R4G3D1WyCH,0
Wed Aug 22 09:25:33 +0000 2018,Deal-hungry investment bankers walk Tesla tightrope https://t.co/YX7MH7xvbf https://t.co/WghROCzS7c,0
Wed Aug 22 05:30:07 +0000 2018,my idea of a smart investment,0
Wed Aug 22 04:42:56 +0000 2018,What is a property scout?? Someone who finds investment properties and presents them to investors for a finder's fe… https://t.co/1dcECxkMPF,0
Wed Aug 22 03:43:51 +0000 2018,@AndreaMarie13 See it's a wise investment already,0
Wed Aug 22 03:19:00 +0000 2018,@MattBruenig @ebruenig And in this universe  who is shorting the unviable firms? The moment you concede that gov ow… https://t.co/8F4wHRxmSO,0
Wed Aug 22 01:56:52 +0000 2018,Just Sold. 20 783 sf single-tenant industrial investment in North County San Diego. #industrialRE https://t.co/DDmO38rGJv,0
Wed Aug 22 01:37:30 +0000 2018,best investment is YOURSELF.,4
Wed Aug 22 00:38:47 +0000 2018,It’s open! Congratulations to @SDFD on the new Fire Station 5 in #Hillcrest. Finally a facility worthy of the heroe… https://t.co/qXZOPDSf33,6
