Fri Nov 09 23:54:39 +0000 2018,We need to secure a system that garuntees Americans freedom of choice in medicine. Our taxes should be an investmen… https://t.co/fIMWAPAriT,0
Fri Nov 09 23:41:36 +0000 2018,Join McCullough's co-owner and Principal #Architect  David McCullough for his talk at @BisNowSD's State of San Dieg… https://t.co/SbWhrBrkLz,0
Fri Nov 09 23:41:09 +0000 2018,Behind the scenes in CA50  our #Indivisible independent expenditure group’s love  labor &amp; investment boosted a tigh… https://t.co/o4f3crTad4,6
Fri Nov 09 23:01:10 +0000 2018,Are you prepared to meet your lender? https://t.co/RsJPPeg80d #loans #smb #smallbusiness,0
Fri Nov 09 22:47:39 +0000 2018,Arizona City AZ - Prized Corner Lot  Underground Utilities  Near Golf Course  Great Investment!: https://t.co/tGSlMZfJkM via @YouTube,0
Fri Nov 09 22:27:24 +0000 2018,We operate to earn your business for life  and nurture the investment that serves as the setting for many of life’s… https://t.co/ArFHuBNm4Y,1
Fri Nov 09 22:15:01 +0000 2018,Concerned about recent market volatility and its effects on portfolio positioning? Investment Management’s Andrew S… https://t.co/ILUtynUe6r,0
Fri Nov 09 20:59:53 +0000 2018,Investment Sales Rise in the Third Quarter  Full-Year Volume May Beat 2017 Numbers https://t.co/K98OZagvk8 via NREI #cre #finance,0
Fri Nov 09 20:57:00 +0000 2018,Behind the scenes in CA50  our #Indivisible independent expenditure group’s love  labor &amp; investment boosted a tigh… https://t.co/o4f3crTad4,6
Fri Nov 09 20:49:31 +0000 2018,Behind the scenes in CA50  our #Indivisible independent expenditure group’s love  labor &amp; investment boosted a tigh… https://t.co/o4f3crTad4,6
Fri Nov 09 20:48:36 +0000 2018,Behind the scenes in CA50  our #Indivisible independent expenditure group’s love  labor &amp; investment boosted a tigh… https://t.co/o4f3crTad4,6
Fri Nov 09 20:04:44 +0000 2018,My parents are talking to me about making an investment  purchase a condo... I can barely afford organic bread...,0
Fri Nov 09 20:00:04 +0000 2018,@sleepybvby Yes! They have a specific line of slip resistant shoes for industry workers that are just supposed to b… https://t.co/li5tPh6ApS,0
Fri Nov 09 19:23:51 +0000 2018,It ended in 1767  yet this experiment (of investment in education) is still linked to higher incomes and education… https://t.co/LEwnzEqSB9,0
Fri Nov 09 19:06:53 +0000 2018,LATEST FROM THE SEC: https://t.co/LPhhacEHwr https://t.co/bEAkrUf0uU,0
Fri Nov 09 19:01:44 +0000 2018,Do you know the   right questions to ask? https://t.co/RsJPPeg80d #smb #smallbusinessloan,0
Fri Nov 09 19:00:51 +0000 2018,"HotDocs has streamlined our entire process and we are delighted with results and return on investment in terms of… https://t.co/ZHT3ReokRs,0
Fri Nov 09 18:54:07 +0000 2018,Introduce the latest next-generation sequencing technology into your lab for fixed monthly payments and without upf… https://t.co/kkFFL1KQ6s,3
Fri Nov 09 18:40:22 +0000 2018,San Diego #MultiFamily Investment Activity Exceeds $1 Billion YTD – Market Vacancy Hits below 4.0% &gt;&gt;… https://t.co/UeGxTVfy9c,1
Fri Nov 09 18:30:18 +0000 2018,Your employees are by far your biggest investment. What if there were operational changes you could make that incre… https://t.co/OFm9Dd9LP3,0
Fri Nov 09 18:10:35 +0000 2018,A New $5M Investment Fund for Higher-Ed Startups Launches—With Strings Attached - EdSurge News https://t.co/QAh8b4hBCL #highered,0
Fri Nov 09 17:42:02 +0000 2018,. @zoom_us  an SF-based video conferencing company with investment from @QualcommVenture  prepares for IPO… https://t.co/qji8paV55O,0
Fri Nov 09 17:35:16 +0000 2018,VR friends  can you educate me on what prevents us from having the incredibly beautiful scenes we have in modern ga… https://t.co/r26Y6TIT7I,0
Fri Nov 09 17:08:04 +0000 2018,Everything you need to know about the Investment Operations Certificate (IOC)  the benchmark qualification for fina… https://t.co/lLrLAaR5tl,0
Fri Nov 09 16:46:42 +0000 2018,Behind the scenes in CA50  our #Indivisible independent expenditure group’s love  labor &amp; investment boosted a tigh… https://t.co/o4f3crTad4,6
Fri Nov 09 16:46:17 +0000 2018,Don't be your own worst enemy!   https://t.co/uPw0EPPNgV,0
Fri Nov 09 16:24:00 +0000 2018,Behind the scenes in CA50  our #Indivisible independent expenditure group’s love  labor &amp; investment boosted a tigh… https://t.co/o4f3crTad4,6
Fri Nov 09 15:35:05 +0000 2018,East LA is heating up!  #larealestate #commercialrealestate #investment,0
Fri Nov 09 15:19:54 +0000 2018,Accel leads $25 million investment in team whiteboarding platform RealtimeBoard https://t.co/MbjOg9ASk6,0
Fri Nov 09 15:13:01 +0000 2018,We operate to earn your business for life  and nurture the investment that serves as the setting for many of life’s… https://t.co/ArFHuBNm4Y,1
Fri Nov 09 15:05:09 +0000 2018,CRE Markets Continue to Perform Well: Investment Returns Remain Steady https://t.co/ghruu02V8N #CRE https://t.co/lFpXuJArrc,1
Fri Nov 09 14:41:02 +0000 2018,NEWS: TCA Provides Large Investment to SD Startup - OC Startups Now https://t.co/6JhbMhieZ4 #tcasandiego #acefund… https://t.co/0TlUa1RnlE,1
Fri Nov 09 14:09:26 +0000 2018,LightSpeed Innovations ran a speed investment dating forum a year ago and it resulted in several companies meeting… https://t.co/MSUK1hnpFM,1
Fri Nov 09 13:04:02 +0000 2018,Are your habits preventing you from becoming rich? https://t.co/IsAIl90c50 #finance #money #business #success… https://t.co/3SIyEijGCB,0
Fri Nov 09 11:45:42 +0000 2018,Smart Investing  even on a very small scale  remains a tried and true means of building an individual's cash flow a… https://t.co/y6kYUT20uF,0
Fri Nov 09 11:11:00 +0000 2018,LightSpeed Innovations ran a speed investment dating forum a year ago and it resulted in several companies meeting… https://t.co/MSUK1hnpFM,1
Fri Nov 09 10:32:58 +0000 2018,Behind the scenes in CA50  our #Indivisible independent expenditure group’s love  labor &amp; investment boosted a tigh… https://t.co/o4f3crTad4,6
Fri Nov 09 10:26:00 +0000 2018,Interview with Orichal Partners: Cryptocurrency Investment and Blockchain Advisory Firm. https://t.co/Czc6cUiZFm… https://t.co/DLBSEjSFRE,0
Fri Nov 09 08:41:21 +0000 2018,@christineliuart I'm not sure if that's really the best investment of time and energy when it comes to upward mobil… https://t.co/2aiP8TKA9c,0
Fri Nov 09 06:59:21 +0000 2018,Some helpful links &amp; contacts to have: 🚀 Purchase XY Equity - https://t.co/99thewrGUJ 🚀 XYO Mining Kits -… https://t.co/JUXY1eZvwH,8
Fri Nov 09 06:49:55 +0000 2018,#Repost nsdcecilia  ・・・ Personal Growth. It’s worth the investment. Working on the best version of myself and very… https://t.co/IHXjQ0aYv1,0
Fri Nov 09 06:44:21 +0000 2018,Introduce the latest next-generation sequencing technology into your lab for fixed monthly payments and without upf… https://t.co/vXfK3dtCqi,1
Fri Nov 09 06:29:24 +0000 2018,At @OrganicConsumers  we view our work as so much more than a job. We see it as an honor  and as an investment in t… https://t.co/MA3Aup9zET,0
Fri Nov 09 06:18:58 +0000 2018,@vosdscott Thanks Scott  I voted yes on G and in the simplist terms thought that the plans for that space should ha… https://t.co/VdAuua9uvW,0
Fri Nov 09 03:30:26 +0000 2018,Giffords Bad investment in Florida. https://t.co/yUoCg3fDYb,0
Fri Nov 09 03:30:24 +0000 2018,Giffords Bad investment in Florida. https://t.co/BNu5CnQPZk,0
Fri Nov 09 03:20:43 +0000 2018,Over the last two centuries  about 90% of the world’s millionaires have been created by investing in real estate.… https://t.co/atBwrIjser,0
Fri Nov 09 01:30:11 +0000 2018,How does CID and HOA impact my investment? https://t.co/L2KShzSdnU https://t.co/ievn9nOzVk,0
Fri Nov 09 00:00:34 +0000 2018,Wanna make cash on Kindle  but the whole book creation process is holding you back? No more! Here's a brand-new too… https://t.co/eUOIGhdoO8,0
