Mon May 21 23:59:19 +0000 2018,Congratulations to Essie Orozco for completing SDSU Noyce Fellowship Master Teaching Program!  5 years  but great i… https://t.co/mAxFJTc98x,1
Mon May 21 23:43:38 +0000 2018,Hi my name is Ms Jaime C. I am a newbie real estate investor I am the CEO of Sissy Investment Group VIP List https://t.co/lMCj0VW6V2,0
Mon May 21 23:41:34 +0000 2018,ATTENTION ALL REAL ESTATE BIRD DOGS.  BWD Investment Group &amp; ?Tessa Group&amp;#8482;?  We will pay you $1000 for sendin… https://t.co/NTwmBKc2qO,0
Mon May 21 23:15:42 +0000 2018,Changing perspective can be the greatest Investment in self-care. Let go of your ego. Embrace yourself without cond… https://t.co/U8IUgFa3sx,0
Mon May 21 22:52:02 +0000 2018,You #maga kids like swampy joes? They made em EXTRA swampy for ya!  https://t.co/yxTGrCmClJ,0
Mon May 21 22:39:46 +0000 2018,Make Money Fast | Referral Program | Bird Dogs - BWD Investment Group &amp; ?Tessa Group&amp;#8482;?  We will pay you $1000… https://t.co/4F7vrKBVoz,0
Mon May 21 22:05:03 +0000 2018,Finding the Money: How to Finance Your First Investment Property https://t.co/YC216Ef1JN #wisemountproperty #webuyhouses #investors,1
Mon May 21 21:56:52 +0000 2018,Should #investors be concerned about rising gas prices? Find out what Wells Fargo Investment Institute thinks. https://t.co/SO7Uf3OIMW,0
Mon May 21 21:47:51 +0000 2018,@AlaskaAir hey guys.... how much of an investment would be a bottle of febreeze? Flight 769 here!,0
Mon May 21 21:39:28 +0000 2018,Make Money Fast | Referral Program | Bird Dogs - BWD Investment Group &amp; Jai Buys Houses  llc... We will pay you $10… https://t.co/7msgju6f3M,0
Mon May 21 20:18:12 +0000 2018,Residential Remodeling Index Reaches All-Time High In Q1 https://t.co/E9GQr6Dm7a According to FBS Property  AMO rea… https://t.co/M5BJgblRe0,0
Mon May 21 20:03:04 +0000 2018,Regulators crack down on suspicious cryptocurrency investment schemes https://t.co/AgLCbshsrl https://t.co/1uCtB2CN3v,0
Mon May 21 20:01:04 +0000 2018,Regulators crack down on suspicious cryptocurrency investment schemes https://t.co/QG8XB2q94e https://t.co/N9jaGA1UCu,0
Mon May 21 19:56:06 +0000 2018,⚡️ “PierCap Partners talks about investment banking @BISTalkRadio on ESPN”  https://t.co/TwaWyNPWa6,0
Mon May 21 19:55:11 +0000 2018,Hey Twitter  we can't wait to share our work with you! Here's a #BMW M5 we just finished for Sterling Investment Gr… https://t.co/tvXpVQgFey,0
Mon May 21 18:59:39 +0000 2018,This user base is larger than the total population of the Northeast region in the United States. While I think Micr… https://t.co/DZhnjZxRMs,0
Mon May 21 18:44:17 +0000 2018,A7 There are time limitations but just like most things in business... You have to ask yourself is this collaborati… https://t.co/rgabz4OiAF,1
Mon May 21 18:43:22 +0000 2018,A7 There are time limitations but just like most things in business... You have to ask yourself is this collaborati… https://t.co/rgabz4OiAF,1
Mon May 21 18:21:20 +0000 2018,@sdut The city has no obligation to make a poor investment in a losing battle. Natural disasters destroy homes all… https://t.co/ST74FAUMF6,0
Mon May 21 18:15:03 +0000 2018,#Fact In the Q4 of 2017  82% of all paid social advertising investment was spent on Facebook. #digitalmarketing… https://t.co/0dyp4PpBNL,0
Mon May 21 18:00:52 +0000 2018,Check-out this interview for some unique insights and perspectives about raising early capital to launch and build… https://t.co/xNplRf8iBm,0
Mon May 21 17:44:28 +0000 2018,Clayburn Griffin's platform is focused on modernizing the economy in southern New Mexico  renewed investment in pub… https://t.co/e5xUArIw6e,1
Mon May 21 17:26:27 +0000 2018,Scheduling a short technique-focused block is a worthy time investment  and now is the best time to make it happen. https://t.co/ykZnqlLrlG,5
Mon May 21 17:16:02 +0000 2018,Leadership development can be a considerable investment in time and money.  There is often a temptation to extend t… https://t.co/mbW4nt16Gs,0
Mon May 21 16:33:22 +0000 2018,Scheduling a short technique-focused block is a worthy time investment  and now is the best time to make it happen. https://t.co/ykZnqlLrlG,5
Mon May 21 16:25:18 +0000 2018,Man I’m so glad I went into Finance. All these insurance  tax  and investment problems are seriously difficult to approach.,0
Mon May 21 16:13:04 +0000 2018,#TechBudgets - Study: 70% of #CIOs do not plan to increase IT spending this year...Big execution mistake...the #CIO… https://t.co/4ZWEOpmXwA,0
Mon May 21 16:03:08 +0000 2018,Arlan Hamilton Keynote Speaker San Diego Startup Week 2018. Managing Partner Backstage Capital  a seed-stage invest… https://t.co/RIGnA4qV0m,1
Mon May 21 15:24:10 +0000 2018,Has anyone grown an avocado tree from a seed? Feels like a good investment 😋,0
Mon May 21 15:20:25 +0000 2018,Scheduling a short technique-focused block is a worthy time investment  and now is the best time to make it happen. https://t.co/ykZnqlLrlG,5
Mon May 21 14:55:03 +0000 2018,In a recent study of 13 different verticals  the insurance industry invested more on artificial intelligence #AI th… https://t.co/PaVAnYzy14,0
Mon May 21 14:47:28 +0000 2018,Scheduling a short technique-focused block is a worthy time investment  and now is the best time to make it happen. https://t.co/ykZnqlLrlG,5
Mon May 21 14:13:09 +0000 2018,Scheduling a short technique-focused block is a worthy time investment  and now is the best time to make it happen. https://t.co/ykZnqlLrlG,5
Mon May 21 13:45:16 +0000 2018,Are you a frustrated investor tired of putting out money on things that do not work?? WELL STOP  FOLLOW… https://t.co/d6CQze8awY,0
Mon May 21 11:23:59 +0000 2018,FTSE 100 hits fresh high as US and China put trade war 'on hold' https://t.co/gPDI0V5GwX,0
Mon May 21 10:08:21 +0000 2018,Wall Street’s top fund manager reveals the last 2 stocks he fell in love with — and breaks down why he expects them… https://t.co/XaACcP7JYi,0
Mon May 21 07:26:21 +0000 2018,Why You Should Hire an #InvestmentManager or #FinancialPlanner | @tomasvargasharv   See More:… https://t.co/wK1w57Bp86,0
Mon May 21 06:51:45 +0000 2018,Bain Capital Ventures taps Facebook  Quora veteran Sarah Smith as first female investment partner: https://t.co/XW3ogN2MFd,0
Mon May 21 05:36:28 +0000 2018,Great investment opportunity! Contact me for more info https://t.co/KN0qGZIsmv,0
Mon May 21 05:32:18 +0000 2018,Great investment opportunity coming very soon! https://t.co/1IxP7JASeA,0
Mon May 21 05:10:32 +0000 2018,Investment 101 #cryptocurrency $BTC 🤪😜 https://t.co/rGNGgSIYGj,13
Mon May 21 04:43:14 +0000 2018,What is a property scout?? Someone who finds investment properties and presents them to investors for a finder's fe… https://t.co/bZEuO9vUPi,0
Mon May 21 03:17:31 +0000 2018,Reduce! $839 000. Perfect rental investment opportunity. https://t.co/4P117TFvyS,0
Mon May 21 02:43:58 +0000 2018,@VimHomeless Also Fanart of a character that doesn't belong to the artist you're "aiming" for  is not "giftart" eit… https://t.co/6TxXCNN8fL,0
Mon May 21 01:51:39 +0000 2018,@MrMaksimize Step 1 (of 1) do not make investment decisions while drinking craft beer. Anywhere.,0
Mon May 21 01:40:25 +0000 2018,Top investment fund manager for George Soros 'raped and beat women' https://t.co/Z7EN8ZTbwf via @MailOnline,0
Mon May 21 01:08:28 +0000 2018,Michael Cohen payments put spotlight on New York investment firm linked to Russian billionaire… https://t.co/IUSSLoHug3,2
