Wed Apr 04 23:42:55 +0000 2018,Hi my name is Ms Jaime C. I am a newbie real estate investor I am the CEO of Sissy Investment Group VIP List https://t.co/lMCj0VW6V2,0
Wed Apr 04 23:42:29 +0000 2018,ATTENTION ALL REAL ESTATE BIRD DOGS.  BWD Investment Group &amp; ?Tessa Group&amp;#8482;?  We will pay you $1000 for sendin… https://t.co/r8U7dNiCx8,0
Wed Apr 04 22:40:58 +0000 2018,Make Money Fast | Referral Program | Bird Dogs - BWD Investment Group &amp; ?Tessa Group&amp;#8482;?  We will pay you $1000… https://t.co/yYnce8mZdB,0
Wed Apr 04 22:22:02 +0000 2018,Op-Ed: South Africa needs more investment in biophysics and structural biology - Daily Maverick… https://t.co/RaKJhvxOzC,0
Wed Apr 04 22:19:00 +0000 2018,Doug Applegate is a retired Marine Colonel who supports MedicareForAll  a $15 min. wage  investment in renewable en… https://t.co/ENXroUekD3,190
Wed Apr 04 22:06:01 +0000 2018,Scheduling a short technique-focused block is a worthy time investment  and now is the best time to make it happen. https://t.co/ykZnqltQu8,2
Wed Apr 04 22:04:00 +0000 2018,Scheduling a short technique-focused block is a worthy time investment  and now is the best time to make it happen. https://t.co/ykZnqltQu8,2
Wed Apr 04 22:00:29 +0000 2018,Industrial &amp; Infrastructure Fund Investment Corpor : Notice Concerning New Debt Financing and Refinancing（338.4KB）… https://t.co/UYYxrqEhwp,0
Wed Apr 04 21:38:58 +0000 2018,Make Money Fast | Referral Program | Bird Dogs - BWD Investment Group &amp; Jai Buys Houses  llc... We will pay you $10… https://t.co/JBVuVzHy4s,0
Wed Apr 04 21:37:51 +0000 2018,Another wine firm gets sold to an investment firm. Accolade Brands sold to Carlyle Group for $1 billion.,0
Wed Apr 04 20:48:52 +0000 2018,Why have the markets been so volatile recently? Here are four possible reasons for the return of market volatility https://t.co/IQS8pwqd34,0
Wed Apr 04 20:13:27 +0000 2018,This is a Premier gathering of sophisticated private equity Investors  Institutional Investors  Angel Investors  VC… https://t.co/rdyEPldHvH,0
Wed Apr 04 20:01:31 +0000 2018,Year-to-date SD Market Analysis -- Office Construction Far Short of Last Cycle https://t.co/E9aPKqXkcj   Fundamenta… https://t.co/f3apfYSdKS,2
Wed Apr 04 20:01:03 +0000 2018,Making the most of a real estate investment is heavily centered on the investors - https://t.co/AM65SFH9Se https://t.co/iLLYJ0VEDB,0
Wed Apr 04 20:00:02 +0000 2018,$17.8 Billion in Business Investment Expected in AR and VR This Year  Is Your Business Ready?… https://t.co/0GuT6LNa7O,0
Wed Apr 04 19:39:11 +0000 2018,Howard University President Breaks $1M in Compensation as School Bond Rating Hangs Onto "Investment Grade" by a Thr… https://t.co/tWWl6qfl0Y,2
Wed Apr 04 19:03:14 +0000 2018,Making Vacation Rentals Work For Your Investment Portfolio https://t.co/iKctyGwaSZ,0
Wed Apr 04 18:41:40 +0000 2018,If this buyout on a biotech company I’m invested in goes through I’ll make 500% on my investment😅🤑 #makemoneyworkforyou,0
Wed Apr 04 18:37:03 +0000 2018,Year-to-date SD Market Analysis -- Office Construction Far Short of Last Cycle https://t.co/E9aPKqXkcj   Fundamenta… https://t.co/f3apfYSdKS,2
Wed Apr 04 18:34:16 +0000 2018,Howard University President Breaks $1M in Compensation as School Bond Rating Hangs Onto "Investment Grade" by a Thr… https://t.co/tWWl6qfl0Y,2
Wed Apr 04 18:26:15 +0000 2018,Howard University President Breaks $1M in Compensation as School Bond Rating Hangs Onto "Investment Grade" by a Thr… https://t.co/tWWl6qfl0Y,2
Wed Apr 04 18:22:39 +0000 2018,Year-to-date SD Market Analysis -- Office Construction Far Short of Last Cycle https://t.co/E9aPKqXkcj   Fundamenta… https://t.co/f3apfYSdKS,2
Wed Apr 04 18:07:28 +0000 2018,Tbh i be designing shit then seeing these high end designers do the same thing.. &amp; i just be like damn if only i had the investment,0
Wed Apr 04 18:05:59 +0000 2018,@sdbeertalk @ThreeBZine @thefullpint @CraftBeerIn_SD @BeerAdvocate @WestCoasterSD @GreenFlashBeer and if the McIlhe… https://t.co/FxAR8Js0It,0
Wed Apr 04 18:02:22 +0000 2018,damn boi spending money on my own home-gym equipment has proven to be a fantastic investment,0
Wed Apr 04 18:00:44 +0000 2018,Industrial &amp; Infrastructure Fund Investment Corpor : Notice Concerning New Debt Financing and Refinancing（338.4KB）… https://t.co/1WaeDLjIBh,0
Wed Apr 04 17:58:37 +0000 2018,@sdbeertalk @ThreeBZine @thefullpint @CraftBeerIn_SD @BeerAdvocate @WestCoasterSD @GreenFlashBeer true  we don't kn… https://t.co/A5euCaxKJc,0
Wed Apr 04 17:35:32 +0000 2018,'This time things really are different' — A $150 billion investment chief explains why he's so nervous about the 'w… https://t.co/RBMD6Dc9q2,0
Wed Apr 04 17:31:18 +0000 2018,@RJellyman - Green Flash Brewery in BK.  Sold to investment firm.,0
Wed Apr 04 17:30:17 +0000 2018,New hire alert: Brian Harrison  SVP/Sr. Relationship Mgr. – 25 years in banking + CFO &amp; investment banking experien… https://t.co/MON0MGfPlZ,0
Wed Apr 04 17:27:16 +0000 2018,Looking forward to hearing new ideas from top investors at the one and only Sohn Investment Conference on April 23… https://t.co/3sepGgWsEX,3
Wed Apr 04 17:17:20 +0000 2018,Learn what to look for when buying investment real estate now by listening to the latest Your Money Your Wealth pod… https://t.co/7DyvOpRxes,0
Wed Apr 04 17:05:21 +0000 2018,Looking forward to hearing new ideas from top investors at the one and only Sohn Investment Conference on April 23… https://t.co/3sepGgWsEX,3
Wed Apr 04 17:03:16 +0000 2018,Looking forward to hearing new ideas from top investors at the one and only Sohn Investment Conference on April 23… https://t.co/3sepGgWsEX,3
Wed Apr 04 17:03:10 +0000 2018,Partner Bob Brown recently represented San Diego #realestate investment firm @StrataEquity in a $302-million acquis… https://t.co/sdKKoXzopQ,0
Wed Apr 04 16:58:05 +0000 2018,Looking forward to hearing new ideas from top investors at the one and only Sohn Investment Conference on April 23… https://t.co/3sepGgWsEX,3
Wed Apr 04 16:50:15 +0000 2018,A $165 billion investment chief identifies the 'single winner' in a market that's made a drastic U-turn from last y… https://t.co/7KxbxoJJMo,0
Wed Apr 04 16:22:01 +0000 2018,Investment in chip startups is at an all time high. Many of these startups are focusing on chips designed for "edge… https://t.co/cqpHlMJKXI,0
Wed Apr 04 16:10:02 +0000 2018,If you have coordinated financial and investment plans  market fluctuations are just noise.,0
Wed Apr 04 16:04:08 +0000 2018,#SanDiego is a dynamic  thriving market and we are seeing the region advance as a top target for #CRE investment be… https://t.co/Y2S5S8epOR,1
Wed Apr 04 16:03:50 +0000 2018,@robertoeruiz @SoccerCitySD @GoAztecs Sure way to know when someone is lying in a real estate/development transacti… https://t.co/ufLrwoYA8Q,0
Wed Apr 04 16:02:11 +0000 2018,#SanDiego is a dynamic  thriving market and we are seeing the region advance as a top target for #CRE investment be… https://t.co/Y2S5S8epOR,1
Wed Apr 04 15:15:57 +0000 2018,If you take this opportunity to rethink your business and your strategic imperatives first  your subsequent investm… https://t.co/68D19LcbqU,0
Wed Apr 04 14:56:11 +0000 2018,https://t.co/UnWHCqUjdR - Green Flash  awash in debt  is sold to investment firm  #What??,0
Wed Apr 04 14:43:58 +0000 2018,Zacks Investment Ideas feature highlights: Fiat Chrysler  General Motors and Tesla Motors https://t.co/XhOF9q1FVv,0
Wed Apr 04 14:27:46 +0000 2018,Rents continue to skyrocket.  Is it time for you to purchase an investment property? https://t.co/QTEpoOcZZv,0
Wed Apr 04 13:45:20 +0000 2018,Are you a frustrated investor tired of putting out money on things that do not work?? WELL STOP  FOLLOW… https://t.co/zDvNYKd0U8,0
Wed Apr 04 13:21:30 +0000 2018,Swiss Re CEO Manages Shareholder Expectations on SoftBank Investment: Opinion https://t.co/BcbXfdAgy2,0
Wed Apr 04 12:59:24 +0000 2018,@DanielH31701411 @jimpjorps @washingtonpost Lol did you read the fucking article? In our sick  greedy  selfish soci… https://t.co/15ipoETbxU,0
Wed Apr 04 10:05:25 +0000 2018,@hblodget Dude - this is not “less-fun” this is the result of foolish people believing the hype that the Tech Press… https://t.co/xDwyLZoBC3,0
Wed Apr 04 04:57:33 +0000 2018,@CoolStoory_Bruh @SUPREME_SALEZ $180 investment for $5 return economics 101,0
Wed Apr 04 04:43:03 +0000 2018,What is a property scout?? Someone who finds investment properties and presents them to investors for a finder's fe… https://t.co/D3ynGHDweV,0
Wed Apr 04 04:10:19 +0000 2018,More incredible support for STEM education with Verizon doubling its investment in US-schools to $400m for programs… https://t.co/SW2tMiXAeC,0
Wed Apr 04 04:05:32 +0000 2018,@nataliesurely Nope. Taxes are collected at the point of a gun. This is voluntary investment where the investor's v… https://t.co/e5ANzVDQbm,0
Wed Apr 04 03:48:08 +0000 2018,@SandblastedEyes @leroyjo65459240 @CNNPR @realDonaldTrump @CNN So your suggestion is to "use common sense" to deter… https://t.co/sXfArk51tC,0
Wed Apr 04 03:14:03 +0000 2018,Setting goals is the first step in turning the invisible into the visible . . . #Tuesdaytips #realestate #sandiego… https://t.co/Qz9ayS6Qnl,0
Wed Apr 04 02:47:23 +0000 2018,@ErikVoorhees Crypto investment is a marathon not a sprint. It's frustrating the markets are so influenced by these… https://t.co/tmjmd5vk80,0
Wed Apr 04 02:44:16 +0000 2018,Piscotty seems worth the investment so far,0
Wed Apr 04 02:17:48 +0000 2018,You can’t be mad at $RMGN because you made a poor investment. I gambled on them for a few months  a year or so ago … https://t.co/MS0IJgFXrR,0
Wed Apr 04 00:28:59 +0000 2018,@RyanAFournier @LindaSuhler It's called an investment. One that pays for itself for generations to come!,0
Wed Apr 04 00:18:15 +0000 2018,@thebradfordfile It's an investment that will pay for itself - over and over again. Generation after generation. Period! #BuildTheWall,0
