Thu Sep 06 22:00:17 +0000 2018,Bitcoin  Ethereum  Ripple  Bitcoin Cash  EOS  Stellar  Litecoin  Cardano  Monero  IOTA: Price Analysis  September 5… https://t.co/spC16q5f1s,0
Thu Sep 06 18:20:37 +0000 2018,Free lifetime newsletter subscriptions to everyone who signs up before September 30th! https://t.co/kSRtOwlv6s… https://t.co/gcjKoiMxH4,0
Thu Sep 06 09:40:12 +0000 2018,Bitcoin  NEO  Cardano  EOS Ready to Bounce After Drop: Crypto Price Analysis  Sept. 6  2018  Bitcoin  NEO  Cardano … https://t.co/29e7g6u2HL,0
Thu Sep 06 08:30:36 +0000 2018,@IOHK_Charles https://t.co/nT0cueVqVk article on future of cardano (ADA) #cardano #ADA,0
Thu Sep 06 05:27:59 +0000 2018,Bitcoin  Ethereum  Ripple  Bitcoin Cash  EOS  Stellar  Litecoin  Cardano  Monero  IOTA: Price Analysis  September 4… https://t.co/8hnWRr83Vw,2
Thu Sep 06 04:17:55 +0000 2018,In the not so distant future a lot of tweets like this will show up but for the blockchain industry. Peer review sh… https://t.co/D9kfWZTLrw,2
Thu Sep 06 02:23:09 +0000 2018,@TheCryptoDog I don’t know what value shorting and futures added to the world.  An assets worth should just be decided by buying and selling,1
Thu Sep 06 00:45:01 +0000 2018,Cardano (ADA) and Tron (TRX) make it to the Abra wallet crypto list | Source: @Coin_Report https://t.co/SjtXBtABXH,0
