Tue Sep 19 23:57:47 +0000 2017,this song is gold @JackAndJack https://t.co/6Ta1BKyrN5,0
Tue Sep 19 23:57:13 +0000 2017,PreciousMetalPrice NewYorkClose 9-19 #Gold$1310.70⬆ #Silver$17.27⬆ #Platinum$951⏬ #Pd$901⏬ #Rh$1050 #Oil$49.80⬆ $1=€0.83=Bs25237 DOW🏭22370⏫,1
Tue Sep 19 23:56:57 +0000 2017,PreciousMetalPrice NewYorkClose 9-19 #Gold$1310.70⬆ #Silver$17.27⬆ #Platinum$951⏬ #Pd$901⏬ #Rh$1050 #Oil$49.80⬆ $1=€0.83=Bs25237 DOW🏭22370⏫,1
Tue Sep 19 23:50:05 +0000 2017,@apoc_reg @CanyonUK An Olympic gold and few world titles later  Canyon may honor your warranty. Just keep the possibility in mind,0
Tue Sep 19 23:49:15 +0000 2017,@Gyo_b4 Yass that car is sexy. I said Ima drive with my rose gold phone outta the case just to feel reckless and sexy😂🤤,0
Tue Sep 19 23:33:35 +0000 2017,This accounting class is pure gold,0
Tue Sep 19 23:30:21 +0000 2017,Look back at it 👀 AP Brick is a brick of GOLD. https://t.co/R49i2h3Xpe,0
Tue Sep 19 23:09:41 +0000 2017,@Ronnie2K My vc still hasn't shown up and just realized that I also lost all the shaq stuff that I paid for when I bought gold,0
Tue Sep 19 22:50:40 +0000 2017,I remember when people used to make fun of black/Latina girls when they wore gold designed name necklaces. Now girl… https://t.co/0wlMliuClK,8217
Tue Sep 19 22:46:12 +0000 2017,Vote for my song 'Good as Gold ' on #Coast2Coast Mixtape #Pop Edition Vol. 19! https://t.co/quhi4CbZAD https://t.co/2Mn2Jox6GX,3
Tue Sep 19 22:46:08 +0000 2017,#Travel - The hostel on Australia's Gold Coast that's made from SAND  Ever wanted a hote... https://t.co/hPp9DTf1hu https://t.co/7Dbnq7akBZ,2
Tue Sep 19 22:45:04 +0000 2017,#Travel - The hostel on Australia's Gold Coast that's made from SAND  Ever wanted a hote... https://t.co/hPp9DTf1hu https://t.co/7Dbnq7akBZ,2
Tue Sep 19 22:34:45 +0000 2017,Vote for my song 'Good as Gold ' on #Coast2Coast Mixtape #Pop Edition Vol. 19! https://t.co/quhi4CbZAD https://t.co/2Mn2Jox6GX,3
Tue Sep 19 22:34:15 +0000 2017,#NowPlaying Fool's Gold by Aaron Carter listen at https://t.co/RecWx8StXi https://t.co/IIWMdDelDZ,1
Tue Sep 19 22:33:53 +0000 2017,#NowPlaying Fool's Gold by Aaron Carter listen at https://t.co/RecWx8StXi https://t.co/IIWMdDelDZ,1
Tue Sep 19 22:29:44 +0000 2017,14 K White Gold Red Garnet and Diamond Ring is a must have. It doesn't get any sweeter than this. https://t.co/2HxiEJKWvw,0
Tue Sep 19 22:27:51 +0000 2017,The perfect wedding band. Available in Yellow and white gold. https://t.co/Xbsi0t85rP,0
Tue Sep 19 22:27:49 +0000 2017,When I first saw the app I said ain't even going to try it because a chappy in spanish means gold digger 🙄😂 yet I'v… https://t.co/u61HGDSeDY,0
Tue Sep 19 22:25:26 +0000 2017,Vote for my song 'Good as Gold ' on #Coast2Coast Mixtape #Pop Edition Vol. 19! https://t.co/quhi4CbZAD https://t.co/2Mn2Jox6GX,3
Tue Sep 19 22:25:10 +0000 2017,Introducing 14k Rose gold Diamond earrings. https://t.co/YzblO7trn6,0
Tue Sep 19 21:54:19 +0000 2017,Restless. 🙇🏽 Midnight snacking should do the trick. 🍓Her hands made of Gold  🙌🏽 holding the… https://t.co/7m6iwpHBeB,0
Tue Sep 19 21:34:42 +0000 2017,Various - 15. Keita Sano - Gold,0
Tue Sep 19 21:33:57 +0000 2017,#wedding#love#engagement#whitegold#diamond#men#band https://t.co/lOjufN0F99 https://t.co/9E5hiEGrkQ,0
Tue Sep 19 21:33:52 +0000 2017,where yall be finding these grimy ass friends https://t.co/cWQStQIWKY,4
Tue Sep 19 21:31:34 +0000 2017,RT McClellanOsc: If the US federal deficit continues to rise  that's bullish for gold. https://t.co/yuVBZij2HV https://t.co/feVyqBd9mH,0
Tue Sep 19 21:28:52 +0000 2017,I will work hard til I sweat glitter and gold ✨,3
Tue Sep 19 21:19:19 +0000 2017,I will work hard til I sweat glitter and gold ✨,3
Tue Sep 19 21:16:43 +0000 2017,"Why God need gold ceilings to talk to me??!!!"🤔,0
Tue Sep 19 21:14:34 +0000 2017,@XylariaVG It's still about 15k's worth of gold down the drain though. :P,0
Tue Sep 19 21:12:11 +0000 2017,#LocoEnamorado de @AbrahamMateo es todo un éxito. Conoce los detalles en &gt;&gt; https://t.co/aF5oR09TJd https://t.co/5x2gQ8Vkp8,455
Tue Sep 19 21:10:06 +0000 2017,URGENTE | VIDEO - Momentos en que cae un edifico en la Ciudad de México  tras el fuerte sismo de 7.1 escala de Rich… https://t.co/PTNJe97nYY,24056
Tue Sep 19 21:02:44 +0000 2017,So someone got a stack of fucking 68 tomes of tranquil mind for 130 gold :/ fucking. FUCK.,0
Tue Sep 19 20:58:07 +0000 2017,I will work hard til I sweat glitter and gold ✨,3
Tue Sep 19 20:54:30 +0000 2017,@m_gold_fl Don't know for sure  but it's unlikely there were sustained winds over 70 mph.  Possibly some gusts to h… https://t.co/96CxAVRrWp,0
Tue Sep 19 20:52:06 +0000 2017,Can u imagine the  gold that they are creating 😱!? ...... YUP ME EITHER BITCH ! https://t.co/027Bg2qJBA,0
Tue Sep 19 20:49:03 +0000 2017,I just added this to my closet on Poshmark: American Rag Sparkly Gold Rose top. https://t.co/zBPu5OMKdZ via @poshmarkapp #shopmycloset,0
Tue Sep 19 20:48:22 +0000 2017,I just added this to my closet on Poshmark: New Sale‼️ Black/Gold shirt. https://t.co/QtlBj4XCgT via @poshmarkapp #shopmycloset,0
Tue Sep 19 20:45:15 +0000 2017,#LocoEnamorado de @AbrahamMateo es todo un éxito. Conoce los detalles en &gt;&gt; https://t.co/aF5oR09TJd https://t.co/5x2gQ8Vkp8,455
Tue Sep 19 20:41:57 +0000 2017,#NowPlaying Fool's Gold by Aaron Carter listen at https://t.co/RecWx8StXi https://t.co/XZdtem4pIt,0
Tue Sep 19 20:41:48 +0000 2017,We couldn’t be more proud of Taurus Team Captain Jessie for earning the silver individually &amp; gold as a team at the… https://t.co/K0JO7USL7F,2
Tue Sep 19 20:41:25 +0000 2017,I used to love diamonds in my jewelry... now I invest in gold... gold give more "buy back" value,0
Tue Sep 19 20:40:02 +0000 2017,We couldn’t be more proud of Taurus Team Captain Jessie for earning the silver individually &amp; gold as a team at the… https://t.co/K0JO7USL7F,2
Tue Sep 19 20:37:20 +0000 2017,This is gold. https://t.co/W2t1aNqnpP,0
Tue Sep 19 20:36:28 +0000 2017,https://t.co/UoT8PlpURi should pick up after Jewish holidays,0
Tue Sep 19 20:32:45 +0000 2017,"Gold Lamps" Trending in HOLLYWOOD Over 1000 Designs @ https://t.co/y1HWe7z6sT .. https://t.co/dKQcG5Xnrh,0
Tue Sep 19 20:32:30 +0000 2017,Kids' Stay Gold Fitness &amp; Athletics Spartan Race Team tee's are in.  This little dude is going… https://t.co/u1UX3sZYoT,0
Tue Sep 19 20:28:57 +0000 2017,Trump's UN Speech Photos Are Like A Bottomless Pot Of Gold – Huffington Post https://t.co/tXMh07cVTe https://t.co/7n4k6j32aQ,0
Tue Sep 19 20:28:26 +0000 2017,I remember when people used to make fun of black/Latina girls when they wore gold designed name necklaces. Now girl… https://t.co/0wlMliuClK,8217
Tue Sep 19 20:19:19 +0000 2017,Winning the Gold in Paris! America wins The Mentor – Best Emerging Talent with Josh DeMarco! &gt;&gt;&gt;… https://t.co/aHv253FV0N,1
Tue Sep 19 20:18:46 +0000 2017,Winning the Gold in Paris! America wins The Mentor – Best Emerging Talent with Josh DeMarco! &gt;&gt;&gt;… https://t.co/84ZnvmE96A,0
Tue Sep 19 20:11:15 +0000 2017,gold like my heart ✨💕✨ https://t.co/wsKfJeYpU7,0
Tue Sep 19 20:10:23 +0000 2017,@KhanOSK120 @officialpes I'm pressing after counting 10 gold balls  after 10 agents I got 7 golds and 3 silvers.,0
Tue Sep 19 20:07:25 +0000 2017,Dutch cyclist who broke her back in horrific Rio Olympics crash returns to win world gold https://t.co/tCRshCLHDU,0
Tue Sep 19 19:57:32 +0000 2017,14 K Yellow Gold Band with round diamonds made in USA. | eBay https://t.co/7DFdB7lSjx,0
Tue Sep 19 19:52:57 +0000 2017,This is gold https://t.co/ZCWtIIs9rL,0
Tue Sep 19 19:49:05 +0000 2017,Lindsay cyclist wins Pan Am Team Pursuit gold - https://t.co/NmaMq7PoME https://t.co/H5al9UPDIB https://t.co/yosSzrhK7D,0
Tue Sep 19 19:45:08 +0000 2017,Fame &amp; gold=not impressed--with fame on both sides of my family it's never been my dream/goal. Storytellers with stories  that I revere...,0
Tue Sep 19 19:41:17 +0000 2017,I remember when people used to make fun of black/Latina girls when they wore gold designed name necklaces. Now girl… https://t.co/0wlMliuClK,8217
Tue Sep 19 19:40:05 +0000 2017,ight I've been holding this in for a while and it's hard for me to admit this but...  I'm dehydrated  my piss solid gold bro I need help,283
Tue Sep 19 19:32:49 +0000 2017,how come Naruto can talk Sasuke out of ever getting punished for his crimes but I cant talk to women,42
Tue Sep 19 19:29:50 +0000 2017,Nexus Gold Signs Definitive Agreement to Acquire Rakounga Gold Concession  250-sq km Contiguous to the Company's Bou…https://t.co/KpBQGMgXF8,0
Tue Sep 19 19:27:47 +0000 2017,The Darklab 90 Degree RCA Cord with gold-plated terminals for improved connectivity. #fkirons 🖤 https://t.co/kViZ5RPyf2,0
Tue Sep 19 19:24:11 +0000 2017,Northern Vertex Provides Construction Update from its 100% Owned Moss Gold/Silver Mine in NW Arizona https://t.co/m3qAj0EsjN,0
Tue Sep 19 19:01:25 +0000 2017,I added a video to a @YouTube playlist https://t.co/OHf9R1prAr Concrete and Gold,0
Tue Sep 19 19:00:31 +0000 2017,PreciousMetalPrices LondonPMFix 9-19 #Gold$1309.60⬆ #Silver$17.15⬆ #Platinum$951⏬ #Palladium$901⏬ #Rhodium$1050 #Oil$49.54⬇ $1=€0.83=Bs25237,0
Tue Sep 19 18:53:34 +0000 2017,I remember when people used to make fun of black/Latina girls when they wore gold designed name necklaces. Now girl… https://t.co/0wlMliuClK,8217
Tue Sep 19 18:45:10 +0000 2017,if no one knows what I am talking about  here is a recap of reality televison GOLD lmao https://t.co/fmB3UAfxB1,0
Tue Sep 19 18:43:03 +0000 2017,I remember when people used to make fun of black/Latina girls when they wore gold designed name necklaces. Now girl… https://t.co/0wlMliuClK,8217
Tue Sep 19 18:14:17 +0000 2017,Extensive  strong  accurate words from Trump against the dictatorial communist and socialist brutal regimes of Venezuela and Cuba. Good!!,687
Tue Sep 19 18:13:46 +0000 2017,The gold four loko tastes like rusty redbull https://t.co/PcjOJ4f1f3,0
Tue Sep 19 18:05:38 +0000 2017,Struck gold https://t.co/VS7fAEakdf,0
Tue Sep 19 18:04:34 +0000 2017,@jajajavi75 ok  im totally stalking the mother of 🐉. Her ins is GOLD emilia_clarke's video https://t.co/hLQBOQuXXr,0
Tue Sep 19 17:59:29 +0000 2017,Vote for my song 'Good as Gold ' on #Coast2Coast Mixtape #Pop Edition Vol. 19! https://t.co/quhi4CbZAD https://t.co/2Mn2Jox6GX,3
Tue Sep 19 17:49:16 +0000 2017,It’s a shame my nigga Nas can’t see Nicki digging for gold💆🏾‍♂️ Same shit the Kardashians built their wealth off of… https://t.co/XAED1YHgVt,0
Tue Sep 19 17:46:58 +0000 2017,I remember when people used to make fun of black/Latina girls when they wore gold designed name necklaces. Now girl… https://t.co/0wlMliuClK,8217
Tue Sep 19 17:45:40 +0000 2017,Do not speak about West Indian culture if you don't know West Indian culture. Stop slut shamming my masqueraders.,1058
Tue Sep 19 17:45:12 +0000 2017,Eveready Gold AA/AAA Alkaline Batteries https://t.co/9sdtHzkyAn,0
Tue Sep 19 17:42:05 +0000 2017,I will work hard til I sweat glitter and gold ✨,3
Tue Sep 19 17:40:33 +0000 2017,"Gold Lamp" Trending in Hollywood @ https://t.co/s8aPlnYrF8 5 000 Products On Line https://t.co/0BGgKvlKUD,0
Tue Sep 19 17:31:14 +0000 2017,@Mr2ooNice One of my cousins from NY  but she live in Fayetteville lol Im like life cant be that bad to turn to Bac… https://t.co/zINv5nHvfe,0
Tue Sep 19 17:21:09 +0000 2017,@x_dejaaaaa Lol the gold one right?,0
Tue Sep 19 17:14:44 +0000 2017,Two Miami men convicted of laundering billions in Amazon gold; agree to cooperate against others in conspiracy https://t.co/ySwR9rm0G9,1
Tue Sep 19 17:06:37 +0000 2017,Bonk_Breaker: RT PerformUnite: Thanks you to Bonk_Breaker for keeping SarahHammer fueled to the gold-standard! We … https://t.co/5178MrXkD0,0
Tue Sep 19 17:05:01 +0000 2017,I remember when people used to make fun of black/Latina girls when they wore gold designed name necklaces. Now girl… https://t.co/0wlMliuClK,8217
Tue Sep 19 16:52:30 +0000 2017,Please adjust the TOTW packs. Just please! Make them like gold premium  normal Gold &amp; elite Pull rates then add two team of the week slots,2
Tue Sep 19 16:46:54 +0000 2017,Please adjust the TOTW packs. Just please! Make them like gold premium  normal Gold &amp; elite Pull rates then add two team of the week slots,2
Tue Sep 19 16:46:24 +0000 2017,Please adjust the TOTW packs. Just please! Make them like gold premium  normal Gold &amp; elite Pull rates then add two team of the week slots,2
Tue Sep 19 16:43:55 +0000 2017,Treasure the love you receive above all. It will survive long after your gold and good health have vanished.💯,2
Tue Sep 19 16:33:01 +0000 2017,Popular on 500px : Bleed Gold by rcphotog https://t.co/cXJ2MQMJGG,0
Tue Sep 19 16:24:56 +0000 2017,@brit_esco Omg this is gold,0
Tue Sep 19 16:20:04 +0000 2017,Man on disability discovers gold mine in family heirloom https://t.co/cBdrTS67tP,0
Tue Sep 19 16:19:01 +0000 2017,This is gold 😂😂😂 https://t.co/ZmncMw5H4a,10340
Tue Sep 19 16:18:09 +0000 2017,Treasure the love you receive above all. It will survive long after your gold and good health have vanished.💯,2
Tue Sep 19 16:03:39 +0000 2017,"Gold Pineapple" Coolers Trending in HOLLYWOOD at: https://t.co/YXhmiYvjav #TREND https://t.co/9SptPpkoJA,0
Tue Sep 19 15:59:16 +0000 2017,#FUTURES #SPREAD #TRADE - BUY 2 Jan. #Platinum  $PLF18  SELL 1 Dec. #Gold  $GCZ17 @ market ($-358)  1st target -$272 vs. a -$379 stop loss.,0
Tue Sep 19 15:43:21 +0000 2017,I been watching dis over and over 😂😂 https://t.co/cEO63iTLJ6,12484
Tue Sep 19 15:39:13 +0000 2017,New post added at  BiasKnife - This week's Deals with Gold take you back to the Stone Age https://t.co/psWqvVA5EB,0
Tue Sep 19 15:38:45 +0000 2017,#LocoEnamorado de @AbrahamMateo es todo un éxito. Conoce los detalles en &gt;&gt; https://t.co/aF5oR09TJd https://t.co/5x2gQ8Vkp8,455
Tue Sep 19 15:36:51 +0000 2017,@WitnessCalles im still halfway to gold once i get that and posterizer hof with hustle rebounder gold say goodbye,0
Tue Sep 19 15:29:52 +0000 2017,QTMY 15 Feet 3x2x0.6mm Gold Plated Round Cable Unfinished Chain for Jewelry Making https://t.co/qlG2Nu6N6X,0
Tue Sep 19 15:27:13 +0000 2017,I been watching dis over and over 😂😂 https://t.co/cEO63iTLJ6,12484
Tue Sep 19 15:15:30 +0000 2017,I remember when people used to make fun of black/Latina girls when they wore gold designed name necklaces. Now girl… https://t.co/0wlMliuClK,8217
Tue Sep 19 15:03:42 +0000 2017,2016 US Mint 1/4 oz Gold American Eagle $10 Coin BU  #USMint https://t.co/hDvB6qZQU4  On @eBay,0
Tue Sep 19 15:00:55 +0000 2017,#nowplaying Liquid Gold - Substitute on https://t.co/Foft5GQ1uC #disco #radio https://t.co/P3t8Y6zOZP,1
Tue Sep 19 14:53:47 +0000 2017,Congratulations  John. See any tigers? Find gold and diamonds? https://t.co/ATxoqBFYHP,0
Tue Sep 19 14:30:50 +0000 2017,@sprad3s Right!! They have super techno black &amp; gold ones too but I just decided to get these for now,0
Tue Sep 19 14:25:33 +0000 2017,Teething whitening or gold grill 🤔,0
Tue Sep 19 14:19:27 +0000 2017,Treasure the love you receive above all. It will survive long after your gold and good health have vanished.💯,2
Tue Sep 19 14:02:38 +0000 2017,Money Hungry Gold Digger Prank - VideoVidzz - https://t.co/xEttJgm4hJ https://t.co/sNH52i0Jhw,0
Tue Sep 19 13:18:50 +0000 2017,I remember when people used to make fun of black/Latina girls when they wore gold designed name necklaces. Now girl… https://t.co/0wlMliuClK,8217
Tue Sep 19 13:16:01 +0000 2017,I remember when people used to make fun of black/Latina girls when they wore gold designed name necklaces. Now girl… https://t.co/0wlMliuClK,8217
Tue Sep 19 13:11:38 +0000 2017,I remember when people used to make fun of black/Latina girls when they wore gold designed name necklaces. Now girl… https://t.co/0wlMliuClK,8217
Tue Sep 19 12:56:36 +0000 2017,Brass gold plated black onyx earring. Available for sale. Price is 18 $ for one. Shipping world… https://t.co/iwY57BLfBj,2
Tue Sep 19 12:46:36 +0000 2017,I remember when people used to make fun of black/Latina girls when they wore gold designed name necklaces. Now girl… https://t.co/0wlMliuClK,8217
Tue Sep 19 12:42:34 +0000 2017,ight I've been holding this in for a while and it's hard for me to admit this but...  I'm dehydrated  my piss solid gold bro I need help,283
Tue Sep 19 12:29:48 +0000 2017,I remember when people used to make fun of black/Latina girls when they wore gold designed name necklaces. Now girl… https://t.co/0wlMliuClK,8217
Tue Sep 19 12:02:57 +0000 2017,Everything in glitter ain't gold,0
Tue Sep 19 12:02:01 +0000 2017,Kevin Hart made a family-friendly mobile game https://t.co/Oke6B2KfgY,0
Tue Sep 19 12:01:03 +0000 2017,Throw some gold on that 🍯 Yellow Gold Sub $22 500 Two-Tone Sub $10 500 https://t.co/0RizOwWKwB,2
Tue Sep 19 11:25:18 +0000 2017,lovin' how that gold sit on yo neck honey,0
Tue Sep 19 11:25:02 +0000 2017,@Keepcoolibio1 Bro! This is a gold digger song lmfao what do you listen to ???,0
Tue Sep 19 10:56:14 +0000 2017,#citrine #citrinering #bydesignjewelers #jewelry #diamonds #gold #ring #earrings #necklace… https://t.co/fE7MKDCufU,0
Tue Sep 19 10:43:52 +0000 2017,@emilio_gold R U Long or Short?,0
Tue Sep 19 10:02:45 +0000 2017,THE ORIGINAL ICE GOLD GREEN  - PAINT VS POWDER Invades Miami  GLOW… https://t.co/2AH2bA4729,0
Tue Sep 19 10:01:33 +0000 2017,Not the best Roster  but we will get the Gold.⭐️⭐️ #OneNation #usa 🇺🇸🇺🇸 https://t.co/0Sen5Q9V0V,2
Tue Sep 19 08:38:27 +0000 2017,I remember when people used to make fun of black/Latina girls when they wore gold designed name necklaces. Now girl… https://t.co/0wlMliuClK,8217
Tue Sep 19 08:23:12 +0000 2017,Man on disability discovers gold mine in family heirloom https://t.co/GcRWwbkE39,0
Tue Sep 19 08:05:58 +0000 2017,https://t.co/l50cM6y95m,0
Tue Sep 19 07:22:41 +0000 2017,I been watching dis over and over 😂😂 https://t.co/cEO63iTLJ6,12484
Tue Sep 19 07:12:35 +0000 2017,@mrisco22 @_MosesV15 Thanks so much mate you don't know how useful this is for daily fantasy. GOLD,0
Tue Sep 19 07:01:44 +0000 2017,Shoutout to @r_o_d_n_ey__ ❗️ Enjoy your new Yellow Gold Rolex Submariner 👊 https://t.co/7rYvg3l1GA,0
Tue Sep 19 06:40:29 +0000 2017,I remember when people used to make fun of black/Latina girls when they wore gold designed name necklaces. Now girl… https://t.co/0wlMliuClK,8217
Tue Sep 19 06:35:49 +0000 2017,I remember when people used to make fun of black/Latina girls when they wore gold designed name necklaces. Now girl… https://t.co/0wlMliuClK,8217
Tue Sep 19 06:17:01 +0000 2017,I remember when people used to make fun of black/Latina girls when they wore gold designed name necklaces. Now girl… https://t.co/0wlMliuClK,8217
Tue Sep 19 05:53:29 +0000 2017,I want to dip that ass in gold,0
Tue Sep 19 05:50:41 +0000 2017,Party Balloons Banner PomPom Decoration 100 Pack 12 Inches Ultra Thickness Gold &amp; Pink &amp; White Balloons Tissue… https://t.co/lrtZwpiiWg,0
Tue Sep 19 05:41:41 +0000 2017,SOTOGO 15 Pieces Gold Confetti Balloons 12 Inches Party Balloons With Golden Paper Confetti Dots (Confetti Has Been… https://t.co/zDnV6FoIvX,0
Tue Sep 19 04:54:23 +0000 2017,Just watched my lil cousin's snap &amp; she pulled out a bottle of Bacardi Gold. Life can't be that bad cuzzo 😰 need an intervention,0
Tue Sep 19 04:47:01 +0000 2017,Agradecido con todos ustedes 🙏🏼❤️ #queva #gold #riaacertified @ Miami  Florida https://t.co/VU8wxUPrm7,1
Tue Sep 19 04:41:10 +0000 2017,This is gold 😂😂😂 https://t.co/ZmncMw5H4a,10340
Tue Sep 19 04:11:19 +0000 2017,I just added this to my closet on Poshmark: Christina Trendy Glam Sequin Gold  dress. https://t.co/pHWD0ptI7z via @poshmarkapp #shopmycloset,0
Tue Sep 19 03:35:13 +0000 2017,When you finna start wildin at a party and ya girl walk in 😂😭 https://t.co/7Jf9AhVfi9,11620
Tue Sep 19 03:06:55 +0000 2017,@jacojejewelry Was considering this in a 22' length but having 2nd thoughts after watching ur vid  what do i do 😩 https://t.co/PwiOPF1j0x,0
Tue Sep 19 03:02:15 +0000 2017,2016 US Mint 1/4 oz Gold American Eagle $10 Coin BU  #USMint https://t.co/hDvB6qZQU4  On @eBay,0
Tue Sep 19 02:49:03 +0000 2017,#Femail - Newlywed couple have their pig Piggy Smalls as flower girl  A Gold Coast husba... https://t.co/JtpRd8Gr2K https://t.co/lH6PQXqhPJ,0
Tue Sep 19 02:41:06 +0000 2017,My mouth is a human gold mineeeeeeee,0
Tue Sep 19 02:31:55 +0000 2017,I'm a #paulheyman guy(fan)  get this guy into the #WWE Hall of Fame. Pure gold on the mic as a manager and commentator. Father Of ECW! #RAW,0
Tue Sep 19 02:29:21 +0000 2017,@SofiaRuozzi Nothing. Because I'm a sweet beautiful angel with a heart of gold. I'll pray for u lil demon child.,0
Tue Sep 19 02:16:06 +0000 2017,GOLD! https://t.co/DqXs8AGvFl,18
Tue Sep 19 02:15:40 +0000 2017,Yall go fuck wit my dawg @JackieStreetz for em gold teeth she got good prices u diggg🔥🔥,2
Tue Sep 19 02:13:27 +0000 2017,Yall go fuck wit my dawg @JackieStreetz for em gold teeth she got good prices u diggg🔥🔥,2
Tue Sep 19 02:09:17 +0000 2017,Yall go fuck wit my dawg @JackieStreetz for em gold teeth she got good prices u diggg🔥🔥,2
Tue Sep 19 02:04:45 +0000 2017,GOLD! https://t.co/DqXs8AGvFl,18
Tue Sep 19 02:04:16 +0000 2017,I found the full version!!!! https://t.co/xOBQRFuPlY,14256
Tue Sep 19 02:00:17 +0000 2017,This GMT comes alive at night 🌃 Yellow Gold $24 500 https://t.co/UVEX9kIPTZ,0
Tue Sep 19 01:55:32 +0000 2017,PreciousMetalPrice NewYorkClose 9-18 #Gold$1307.10⏬ #Silver$17.17⬇ #Platinum$960⬇ #Pl$928⏫ #Rd$1050 #Oil$50.03⬆ $1=€0.84=Bs24431 DOW🏭22331⏫,1
Tue Sep 19 01:55:03 +0000 2017,PreciousMetalPrice NewYorkClose 9-18 #Gold$1307.10⏬ #Silver$17.17⬇ #Platinum$960⬇ #Pl$928⏫ #Rd$1050 #Oil$50.03⬆ $1=€0.84=Bs24431 DOW🏭22331⏫,1
Tue Sep 19 01:23:19 +0000 2017,Gold https://t.co/r2HCOVwdko,0
Tue Sep 19 01:11:15 +0000 2017,@JoyTaylorTalks I wish there was still a Zaslow &amp; Joy Show. The segment on this would've been gold.,0
Tue Sep 19 01:10:21 +0000 2017,@SixAmazingWord @grilcode Now everybody wanna have the gold shit like fenty,0
Tue Sep 19 01:08:34 +0000 2017,@joyfuljaj Not sure if the dancers names  but the song is Black and Gold.,0
Tue Sep 19 01:04:30 +0000 2017,@toycollectorapp here is one of the glams of Mariners pop  there is another away version and a gold version. I'll t… https://t.co/TxGnHFxLqP,0
Tue Sep 19 01:03:40 +0000 2017,@ChildhoodCancer  Making sure  kids facing a cancer diagnosis can realize their dreams!Light up gold to honor all c… https://t.co/eDIoBjFKpc,0
Tue Sep 19 00:43:33 +0000 2017,I remember when people used to make fun of black/Latina girls when they wore gold designed name necklaces. Now girl… https://t.co/0wlMliuClK,8217
Tue Sep 19 00:37:29 +0000 2017,#News via #ESPN 📷 OBJ rocks pair of custom gold Supreme cleats in pregame warmups (ESPN) https://t.co/4pluuPFgk5,8
Tue Sep 19 00:35:11 +0000 2017,😭💀gold https://t.co/sLRrxa9Bdu,0
Tue Sep 19 00:34:25 +0000 2017,When you finna start wildin at a party and ya girl walk in 😂😭 https://t.co/7Jf9AhVfi9,11620
Tue Sep 19 00:33:17 +0000 2017,Guilty pleasures: Jordans  Gold  Orange chicken  watermelon  dark chocolate  tattoos  and Snapbacks.,0
Tue Sep 19 00:32:29 +0000 2017,#News via #ESPN 📷 OBJ rocks pair of custom gold Supreme cleats in pregame warmups (ESPN) https://t.co/4pluuPFgk5,8
Tue Sep 19 00:32:00 +0000 2017,#News via #ESPN 📷 OBJ rocks pair of custom gold Supreme cleats in pregame warmups (ESPN) https://t.co/4pluuPFgk5,8
Tue Sep 19 00:27:56 +0000 2017,#News via #ESPN 📷 OBJ rocks pair of custom gold Supreme cleats in pregame warmups (ESPN) https://t.co/4pluuPFgk5,8
Tue Sep 19 00:26:37 +0000 2017,#News via #ESPN 📷 OBJ rocks pair of custom gold Supreme cleats in pregame warmups (ESPN) https://t.co/4pluuPFgk5,8
Tue Sep 19 00:25:02 +0000 2017,#Science - Self-assembling gold nanoparticles created at Imperial  Researchers at Imper... https://t.co/nEcawMcQhY https://t.co/YwvklptWbb,0
Tue Sep 19 00:23:50 +0000 2017,#News via #ESPN 📷 OBJ rocks pair of custom gold Supreme cleats in pregame warmups (ESPN) https://t.co/4pluuPFgk5,8
Tue Sep 19 00:22:20 +0000 2017,2k18 gring for gold ankle breaker: https://t.co/AjctgOdECA a través de @YouTube,0
Tue Sep 19 00:21:12 +0000 2017,#News via #ESPN 📷 OBJ rocks pair of custom gold Supreme cleats in pregame warmups (ESPN) https://t.co/4pluuPFgk5,8
Tue Sep 19 00:21:04 +0000 2017,#Femail - Gold Coast MegaCheer Legends age is no barrier  These Gold Coast mothers and d... https://t.co/LSaGilphiX https://t.co/umHuF0kTDs,0
Tue Sep 19 00:20:48 +0000 2017,#News via #ESPN 📷 OBJ rocks pair of custom gold Supreme cleats in pregame warmups (ESPN) https://t.co/4pluuPFgk5,8
Tue Sep 19 00:19:43 +0000 2017,#News via #ESPN 📷 OBJ rocks pair of custom gold Supreme cleats in pregame warmups (ESPN) https://t.co/4pluuPFgk5,8
Tue Sep 19 00:19:37 +0000 2017,Fool's Gold. AMC. Now!,2
Tue Sep 19 00:19:24 +0000 2017,📷 OBJ rocks pair of custom gold Supreme cleats in pregame warmups (ESPN) https://t.co/arYbs51JWn,0
Tue Sep 19 00:18:05 +0000 2017,1956 Ford Thunderbird CTCI GOLD WINNER  INCREDIBLE RESTORATION  BOTH TOPS  PS  PB  PW  P SEATS  AC  A+: $71 995.00…… https://t.co/5pZcI5EXVS,0
Tue Sep 19 00:16:12 +0000 2017,Man on disability discovers gold mine in family heirloom https://t.co/YXAhoDgWG5,0
Tue Sep 19 00:08:37 +0000 2017,A gold blazer on top of a unitard? Sure  why not? #fashiondisaster,0
Tue Sep 19 00:07:42 +0000 2017,The Incredible Chateau de Brissac #France   #travel #photography #Adventure #travelphotography… https://t.co/Hp4J1cPMVO,37
Tue Sep 19 00:03:17 +0000 2017,Golden Roasted Potatoes - What could be wrong with double the gold. golden potatoes &amp; golden mustard bbq sauce ... https://t.co/2NHYW7r0Zj,0
Tue Sep 19 00:02:00 +0000 2017,GOLD! https://t.co/DqXs8AGvFl,18
