Tue Apr 03 23:33:32 +0000 2018,"Another question that was put forth by many users was regarding Abra’s move to implement Litecoin based smart-cont… https://t.co/t7X8YPm3nF,1
Tue Apr 03 23:18:56 +0000 2018,Litecoin LTC ship is about to sail.. Don’t miss out – Crypto Recorder $LTC | CheapHotAlts https://t.co/oKdaYc1PHK,0
Tue Apr 03 20:49:23 +0000 2018,"Another question that was put forth by many users was regarding Abra’s move to implement Litecoin based smart-cont… https://t.co/t7X8YPm3nF,1
Tue Apr 03 19:35:32 +0000 2018,Litecoin surges after the CEO of an American Express-backed crypto startup explains why it's moving away from Bitco… https://t.co/GMReGs0Rxs,0
Tue Apr 03 17:35:12 +0000 2018,CRYPTO INSIDER: JPMorgan's head of blockchain departs https://t.co/Y1EhHBqb93 #tech #business #success https://t.co/RA1WunE7Z7,0
Tue Apr 03 16:28:55 +0000 2018,#Virtual : The Digital Silver – Litecoin and its Advantages over Bitcoin  ... details at https://t.co/yn2jiokrQO https://t.co/CBLSx7XYos,0
Tue Apr 03 06:50:30 +0000 2018,@LandM_Marius All roads lead to the same place  the whales also have confidants. The goal is the same 142 $  #trx… https://t.co/W3cGlyCq3m,0
Tue Apr 03 06:50:14 +0000 2018,@LandM_Marius All roads lead to the same place  the whales also have confidants. The goal is the same 142 $  #trx… https://t.co/mGSElpZo3A,0
Tue Apr 03 03:44:34 +0000 2018,Trying to predict the future of the West by reading about Japan in recent decades is like trying to figure out the… https://t.co/QKrSrAl2V3,2
Tue Apr 03 03:35:50 +0000 2018,Trying to predict the future of the West by reading about Japan in recent decades is like trying to figure out the… https://t.co/QKrSrAl2V3,2
Tue Apr 03 03:12:38 +0000 2018,Trying to predict the future of the West by reading about Japan in recent decades is like trying to figure out the… https://t.co/QKrSrAl2V3,2
Tue Apr 03 01:59:28 +0000 2018,@LitecoinQueen Remember I'm raffling 0.1 ltc to everyone who FOLLOWS I know that I can spread my message to the wor… https://t.co/6SdFQB4bMF,0
Tue Apr 03 01:39:05 +0000 2018,All roads lead to the same place  the whales also have confidants. The goal is the same 142 $  #trx #btc #eth #rpx… https://t.co/zsQRmT89iX,1
