Sat May 26 23:35:20 +0000 2018,I’m living in a generation where a MF will choose a 2002 Mercedes Benz with 900k miles with every light on the dash… https://t.co/9PECin9jmH,1
Sat May 26 23:14:24 +0000 2018,@bakerlovespibb Yes,0
Sat May 26 23:08:35 +0000 2018,@Dash_Q_Dash Yeah hoe why you laughin,0
Sat May 26 22:15:58 +0000 2018,I’m living in a generation where a MF will choose a 2002 Mercedes Benz with 900k miles with every light on the dash… https://t.co/9PECin9jmH,1
Sat May 26 21:55:55 +0000 2018,@Onitaset Dame Dash,0
Sat May 26 21:46:21 +0000 2018,@Dash_Q_Dash Me af,0
Sat May 26 20:40:42 +0000 2018,Just gotta Hang On #cryptocurrencies #bitcoin #ethereum #btc #litecoin #ltc #eth #binance #blockchain #altcoins… https://t.co/0TMZBEtayG,0
Sat May 26 20:39:56 +0000 2018,Today is Saturday and that means I’m 90% dry shampoo  with a dash of sass. 🤙🏻 https://t.co/CSJymWvIZD,0
Sat May 26 18:40:15 +0000 2018,On this day  six years ago  @SDiDuro cast me as Lilac in Freedom Planet.  Thanks for all the fun and for giving me… https://t.co/zOKH4TSmsG,46
Sat May 26 18:27:17 +0000 2018,The whole video is 6:29  but all you need is the first 10 seconds: https://t.co/7Ob732Apc8,4
Sat May 26 18:20:46 +0000 2018,Speaking of working out. I went running... outside...willingly... for the first time in LIFE. Soccer and softball h… https://t.co/9fj3GwjQRz,0
Sat May 26 18:15:00 +0000 2018,Add a dash of #stevia to your beverages for a sweet and refreshing drink this #weekend at your #MemorialDay #BBQ. https://t.co/FX1oucGPhb,0
Sat May 26 15:44:50 +0000 2018,I got Ex niggas looking at me like “ damn she only get more fine &amp; better “,153
Sat May 26 15:37:00 +0000 2018,DA U13:  1-0 vs Houston Dash. Goal by Madison Stormberg assist by Alyssa Patterson.,1
Sat May 26 15:33:18 +0000 2018,MIAMI   FLORIDA  The Latin House Grill  Accepts #cryptocurrency  #ROADTRIP #Florida ! 🍺🍺  #acceptscrypto ( top 25 !… https://t.co/9KmggwuAdk,28
Sat May 26 14:50:10 +0000 2018,Both Chelsea Francis and Latessa Johnson return to the track at 9:55 pm to take on the first round of the 200-meter… https://t.co/BDBISXRfqE,1
Sat May 26 14:24:37 +0000 2018,Diddy and Dame Dash get ALL of my respect. Hands down  I understand things 100x clearer just watching and listening.,0
Sat May 26 13:44:29 +0000 2018,I like naps and you.,5375
Sat May 26 12:43:20 +0000 2018,The whole video is 6:29  but all you need is the first 10 seconds: https://t.co/7Ob732Apc8,4
Sat May 26 12:14:45 +0000 2018,Can we just rewind back to 2015 when everyone wasn’t getting offended by everything and life was a little bit simpl… https://t.co/ZAPaJONg0t,0
Sat May 26 11:50:58 +0000 2018,DCE dash finalists! What a great sister stepping in for her brother and one of my learners. Great job all grade lev… https://t.co/hf2k7hqJrt,1
Sat May 26 05:57:39 +0000 2018,dress it up and go to NASA 200 miles on the dash https://t.co/7OTk9aTGdH,0
Sat May 26 05:06:08 +0000 2018,@Shadow_stallion I've never been compared to a unicorn before  I feel special now.,0
Sat May 26 05:01:42 +0000 2018,@Dash_Coyote Not so much from me  at least. I like coyotes  they're very unique in a way. Kinda like horses and unicorns.,0
Sat May 26 04:52:48 +0000 2018,@Shadow_stallion No we love to meet new people  yall just keep running away screaming!,0
Sat May 26 04:40:42 +0000 2018,@Dash_Coyote Isn't it the coyote way to be reclusive and hard to get to know?,0
Sat May 26 03:59:10 +0000 2018,Have you ever had social anxiety so bad  you pretended you couldn't speak English?,0
Sat May 26 03:52:38 +0000 2018,@CoyoteMyp How did I not know this omfg,0
Sat May 26 03:06:20 +0000 2018,We need a crypto Boost! #cryptocurrencies #bitcoin #ethereum #btc #litecoin #ltc #eth #binance #blockchain… https://t.co/swzflOMkoS,1
Sat May 26 03:05:44 +0000 2018,We need a crypto Boost! #cryptocurrencies #bitcoin #ethereum #btc #litecoin #ltc #eth #binance #blockchain… https://t.co/swzflOMkoS,1
Sat May 26 03:04:16 +0000 2018,@CoyoteMyp Do you realize that you have magical powers,0
Sat May 26 02:23:37 +0000 2018,DCE dash finalists! What a great sister stepping in for her brother and one of my learners. Great job all grade lev… https://t.co/hf2k7hqJrt,1
Sat May 26 02:08:46 +0000 2018,More commissions getting done! :3 Behold  a ref sheet for my buddy @theyifficus https://t.co/wTCcUYiR2e,0
Sat May 26 01:29:42 +0000 2018,Both Chelsea Francis and Latessa Johnson return to the track at 9:55 pm to take on the first round of the 200-meter… https://t.co/BDBISXRfqE,1
Sat May 26 01:00:00 +0000 2018,Quarterfinals of the 100-meter dash are just 15 minutes away!  Heat 1 - Chelsea Francis Heat 3 - Latessa Johnson  📈… https://t.co/oMTCMVyOPG,0
Sat May 26 00:39:36 +0000 2018,I did the digital dash,0
