Thu Apr 19 21:43:25 +0000 2018,@binance is going to start offering XVG and XRP to USD fiat pairing. @coinbase you will soon become a thing of the… https://t.co/N7aVbhPaxJ,1
Thu Apr 19 21:39:03 +0000 2018,@binance is going to start offering XVG and XRP to USD fiat pairing. @coinbase you will soon become a thing of the… https://t.co/N7aVbhPaxJ,1
Thu Apr 19 14:00:02 +0000 2018,Is cryptocurrency on the horizon of Amazon while exploring new tech-centric markets? https://t.co/me8OQkaUfw,0
Thu Apr 19 11:58:02 +0000 2018,RT @kuriharan: Check. New York launches a fact-finding inquiry into #Coinbase  #Binance and other exchanges… https://t.co/pg8uuFHYwG,0
Thu Apr 19 08:39:15 +0000 2018,Coinbase’s newest startup acquisition - What should users expect? https://t.co/R0HiohwTaI,0
Thu Apr 19 06:38:33 +0000 2018,Coinbase: Get Verge on Coinbase - Sign the Petition! https://t.co/BFiPb2s3F5 via @Change,1
Thu Apr 19 03:46:54 +0000 2018,Coinbase: Get Verge on Coinbase - Sign the Petition! https://t.co/BFiPb2s3F5 via @Change,1
Thu Apr 19 03:04:15 +0000 2018,Coinbase Acquisitions | Wall Street Moving to Crypto | Exchanges Moving Countries: https://t.co/EgDSpFGv34 via @YouTube,0
Thu Apr 19 02:39:12 +0000 2018,@CryptoRekt @coinbase @coinbase,0
