Tue Jul 03 22:48:07 +0000 2018,I have a feeling we'll soon see direct buy for #Lindacoin on the new VPS service. #btc #crypto #altcoins. Watch out coinbase!,5
Tue Jul 03 22:41:15 +0000 2018,I have a feeling we'll soon see direct buy for #Lindacoin on the new VPS service. #btc #crypto #altcoins. Watch out coinbase!,5
Tue Jul 03 20:54:08 +0000 2018,Coinbase says its problem days are over. Better Business Bureau disagrees. https://t.co/dStLDlYotT https://t.co/yfwVXdKnb3,0
Tue Jul 03 18:50:23 +0000 2018,I have a feeling we'll soon see direct buy for #Lindacoin on the new VPS service. #btc #crypto #altcoins. Watch out coinbase!,5
Tue Jul 03 18:46:40 +0000 2018,I have a feeling we'll soon see direct buy for #Lindacoin on the new VPS service. #btc #crypto #altcoins. Watch out coinbase!,5
Tue Jul 03 16:27:19 +0000 2018,https://t.co/7GtAzwjSfq,0
Tue Jul 03 16:07:03 +0000 2018,The more I think about this rumor of FB buying @coinbase the more I love it:  - 2.2B users - Countless integration… https://t.co/hGCopE052R,56
Tue Jul 03 14:46:13 +0000 2018,In my recent keynote speech  one of the key components I mention for institutional money to move into #crypto marke… https://t.co/AUHvtasBIY,0
Tue Jul 03 11:04:19 +0000 2018,Institutional Crypto Space Develops as Coinbase Launches Custody Service  https://t.co/7F6TrELVI4,0
Tue Jul 03 10:26:59 +0000 2018,@lopp Coinbase executives will be convicted of racketeering by 2022. Save this tweet.  RICO by 2022.,0
Tue Jul 03 05:40:32 +0000 2018,Check out the Case Study on Coinbase - a digital currency exchange that brokers exchanges of Bitcoin  Bitcoin Cash … https://t.co/5fhQNgLYeH,2
Tue Jul 03 02:36:13 +0000 2018,The more I think about this rumor of FB buying @coinbase the more I love it:  - 2.2B users - Countless integration… https://t.co/hGCopE052R,56
