Fri May 18 23:16:00 +0000 2018,@NewAlinssite I know it’s owned by Coinbase. But I’ve had good experiences with it.,0
Fri May 18 21:01:25 +0000 2018,@coinbase Etoro and Nasdaq coming hurry already! Xrp and Trx!,0
Fri May 18 18:57:44 +0000 2018,Coinbase Payments API updates https://t.co/kJHZaA1d2y,2
Fri May 18 11:23:59 +0000 2018,Coinbase Invests in Startup ‘Compound’ That Lets User Earn Interest on Cryptocurrencies https://t.co/bdMMmwkjEj,0
Fri May 18 03:51:33 +0000 2018,Coinbase Payments API updates https://t.co/kJHZaA1d2y,2
Fri May 18 01:53:17 +0000 2018,This Coinbase-backed Startup Lets You Earn Interest on Your Cryptocurrency Holdings https://t.co/w77g6E7SPP,0
