Wed Dec 05 23:54:42 +0000 2018,https://t.co/YyD0XLlsId  BLOCKCHAIN A.I CBD TOKEN ICO 2019  MALTA  What Is Optical Computing (Computing At The Spee… https://t.co/ru2MdYKDnW,0
Wed Dec 05 23:13:23 +0000 2018,@ico_dog And then breathe a sigh of relief: we got your back!  https://t.co/of9mDbKzQx,0
Wed Dec 05 23:12:54 +0000 2018,THO is a global  open source and decentralized supercomputer which anyone can access. Secured  Trusted and Fast exp… https://t.co/NKjPHhgVc8,0
Wed Dec 05 22:31:15 +0000 2018,https://t.co/YyD0XLlsId ICO MALTA  4-4  2019 Watch Elon Musk Reveal SpaceX's Most Detailed Plans To Colonize Mars… https://t.co/kAuxHr2KGJ,0
Wed Dec 05 21:46:47 +0000 2018,Last 25 days! ICO ends 30th December!! Great news is coming to us in 2019 👉Register https://t.co/msxyb7lLGq  BUY… https://t.co/EyV3AKyZGs,5
Wed Dec 05 21:19:23 +0000 2018,Can we start referring to last year's ICO market as the vaporwave?,15
Wed Dec 05 21:07:33 +0000 2018,It took less than 10 months for companies to change their recruiting emails from "we are building the future of ___… https://t.co/tFPTv65Tmc,2
Wed Dec 05 20:57:05 +0000 2018,It took less than 10 months for companies to change their recruiting emails from "we are building the future of ___… https://t.co/tFPTv65Tmc,2
Wed Dec 05 19:35:38 +0000 2018,Перспективная децентрализованная платформа для электронной коммерции #buying_com нацелена на то  чтобы стать главны… https://t.co/t481bBAG4p,0
Wed Dec 05 19:30:21 +0000 2018,SEC Offers Possible Path to Compliance for ICO Issuers https://t.co/PNpLlOrqUA from @Paul_Hastings,0
Wed Dec 05 18:46:14 +0000 2018,Mike Judge  creator of @SiliconHBO talking about how keeping up with tech is difficult even in a fictional world. W… https://t.co/FNld3sAciO,162
Wed Dec 05 18:23:31 +0000 2018,Whether you are doing an #ICO or an #STO  the most crucial part of your plan should be #tokenomics.  @giacomoarcaro… https://t.co/enqxlQRDgZ,1
Wed Dec 05 18:10:00 +0000 2018,New episode from "The ICO Alert Podcast: Cryptocurrency  blockchain  and ICO interviews.": Roundtable #26: Growing.. https://t.co/YDMUPtEpW9,0
Wed Dec 05 17:59:59 +0000 2018,It took less than 10 months for companies to change their recruiting emails from "we are building the future of ___… https://t.co/tFPTv65Tmc,2
Wed Dec 05 17:46:35 +0000 2018,Searching for ICO info?   Not. So. Much.  https://t.co/Uuyd0Yu3Aj https://t.co/tiyrO46hBz,5
Wed Dec 05 17:40:51 +0000 2018,Searching for ICO info?   Not. So. Much.  https://t.co/Uuyd0Yu3Aj https://t.co/tiyrO46hBz,5
Wed Dec 05 17:37:39 +0000 2018,X-Block is proud to announce that we will be pitching to investors at Crypto Invest Summit next month! 👏👏 #ICO… https://t.co/ow3Pc0QA4B,292
Wed Dec 05 17:13:28 +0000 2018,Searching for ICO info?   Not. So. Much.  https://t.co/Uuyd0Yu3Aj https://t.co/tiyrO46hBz,5
Wed Dec 05 17:08:33 +0000 2018,Rough set of months for noted classic Playstation game “Ico” https://t.co/iC9F4GlFHu,0
Wed Dec 05 17:07:16 +0000 2018,Searching for ICO info?   Not. So. Much.  https://t.co/Uuyd0Yu3Aj https://t.co/tiyrO46hBz,5
Wed Dec 05 17:07:01 +0000 2018,Searching for ICO info?   Not. So. Much.  https://t.co/Uuyd0Yu3Aj https://t.co/tiyrO46hBz,5
Wed Dec 05 17:02:10 +0000 2018,L’Autorité des normes comptables tranche le cas des #ico #itespresso https://t.co/kUjO7Uzk0g #tokens https://t.co/qCEsFTwaJg,0
Wed Dec 05 16:38:31 +0000 2018,If you follow the US crypto market regulation   maybe even think it’s a shhhh show  we’re getting closer to resolut… https://t.co/bCHisMF4Sw,1
Wed Dec 05 15:36:38 +0000 2018,If you follow the US crypto market regulation   maybe even think it’s a shhhh show  we’re getting closer to resolut… https://t.co/bCHisMF4Sw,1
Wed Dec 05 14:50:42 +0000 2018,@hamrickisms Dude  Hamcoin is SO boss. I'll watch for the ICO (mind the SEC  tho...).,0
Wed Dec 05 14:23:15 +0000 2018,Check out what we had to say about one of our biggest roadshows yet! We met amazing people from the fintech industr… https://t.co/evduhjaXqi,234
Wed Dec 05 13:36:29 +0000 2018,Check out what we had to say about one of our biggest roadshows yet! We met amazing people from the fintech industr… https://t.co/evduhjaXqi,234
Wed Dec 05 13:36:10 +0000 2018,Check out what we had to say about one of our biggest roadshows yet! We met amazing people from the fintech industr… https://t.co/evduhjaXqi,234
Wed Dec 05 13:24:00 +0000 2018,Alleged Naked Technology ICO Scam Results in Founders’ Arrest Warrant https://t.co/GhZsGoxSQN #bitcoin #bitcoinnews #btc #cryptocurrency,0
Wed Dec 05 10:33:24 +0000 2018,PARQ tokens can be bought with fiat currency via bank transfer  Paypal  creditcards and both ETH and BTC. During th… https://t.co/OBqc9kTT4f,0
Wed Dec 05 10:31:00 +0000 2018,Tom Chebib reasons that the lack of innovation in the financial sector has impacted the birth of emerging technolog… https://t.co/TDq7guJ660,0
Wed Dec 05 08:33:39 +0000 2018,Mike Judge  creator of @SiliconHBO talking about how keeping up with tech is difficult even in a fictional world. W… https://t.co/FNld3sAciO,162
Wed Dec 05 07:49:19 +0000 2018,X-Block is proud to announce that we will be pitching to investors at Crypto Invest Summit next month! 👏👏 #ICO… https://t.co/ow3Pc0QA4B,292
Wed Dec 05 05:31:28 +0000 2018,We have received 8.6 / 10 from @ICO_marks  Check it out if you missed our presale series A. https://t.co/oHqRQNXO74,242
Wed Dec 05 05:23:54 +0000 2018,Don't miss https://t.co/5DFZP5NEa2 ICO! Highly recommended!!! #ICO #W12 #ICO #Crowdsale #Bitcoin #Blockchain #Token… https://t.co/OjayIuKcQs,0
Wed Dec 05 05:23:28 +0000 2018,#W12 #ICO #Crowdsale #Bitcoin #Blockchain #Token #ETH #Ethereum #TokenSale https://t.co/Az32zrwvoX,0
Wed Dec 05 05:23:14 +0000 2018,#W12 #ICO #Crowdsale #Bitcoin #Blockchain #Token #ETH #Ethereum #TokenSale https://t.co/SINAlSoPD5,0
Wed Dec 05 05:22:25 +0000 2018,#eLYQD #ico #crowdsale #fundraising https://t.co/DUaMp6GHPG,0
Wed Dec 05 05:17:11 +0000 2018,Last 25 days! ICO ends 30th December!! Great news is coming to us in 2019 👉Register https://t.co/msxyb7lLGq  BUY… https://t.co/EyV3AKyZGs,5
Wed Dec 05 05:14:14 +0000 2018,At this stage of my acquaintance with the project I can say that I was surprised by the idea of a global expansion… https://t.co/UoFRmAP3Wj,0
Wed Dec 05 05:13:59 +0000 2018,#ICO #REMCO #REMITTANCE https://t.co/ST04qZXRHp,0
Wed Dec 05 05:10:24 +0000 2018,The Future Energy project is developing rapidly  and this shYould be a big reason for investment. More about the co… https://t.co/uFX340qJwM,0
Wed Dec 05 05:09:14 +0000 2018,#FutureEnergy #ICO #marketplace #cryptocurrency https://t.co/K8O3FQDE6T,0
Wed Dec 05 05:07:13 +0000 2018,#NOVAM #CyberSecurity #ICO #NOVAMIntl https://t.co/qBQ7R5nPJk,0
Wed Dec 05 05:01:14 +0000 2018,What can make a person happy? I know. This is new knowledge and new possibilities! Learn about the promising and su… https://t.co/owD6op6EFc,0
Wed Dec 05 04:51:33 +0000 2018,Hurry up! Now You still have a chance to join awesome ! This project are future of crypto knowledge market! @aqua_intel #ICO,0
Wed Dec 05 04:51:14 +0000 2018,@aqua_intel #ICO https://t.co/DdLNm9Muz1,0
Wed Dec 05 04:43:29 +0000 2018,#TANZO #Social #Marketplace #handmade #ICO #Blockchain https://t.co/dqpCdChZ7a,0
Wed Dec 05 04:40:24 +0000 2018,Last 25 days! ICO ends 30th December!! Great news is coming to us in 2019 👉Register https://t.co/msxyb7lLGq  BUY… https://t.co/EyV3AKyZGs,5
Wed Dec 05 02:13:32 +0000 2018,X-Block is proud to announce that we will be pitching to investors at Crypto Invest Summit next month! 👏👏 #ICO… https://t.co/ow3Pc0QA4B,292
Wed Dec 05 01:45:42 +0000 2018,BlockChannel:RT AaronvanW: Bitcoin only. You understand I'll have to get used to our new direction!  Moving forward… https://t.co/K1xpozGpEk,0
Wed Dec 05 01:09:18 +0000 2018,sometimes my straightforward communication style makes people uncomfortable. today in one meeting i said "so they'v… https://t.co/eeZcnFgSSt,0
