Sat Sep 23 23:59:45 +0000 2017,@realDonaldTrump @FLOTUS The very epitome of Gold Digging Whore but hey  who has standards these days anyway.. #maga,0
Sat Sep 23 23:59:39 +0000 2017,okay i really don’t get the obsession with putting gold flakes in all these viral expensive foods 😭,0
Sat Sep 23 23:59:24 +0000 2017,Gold Filled Chain Herringbone Chain 14KT Gold Filled Size 17.5" Lo… https://t.co/dQaQLb4cV5 #goldfilled #BeadedChain https://t.co/bwLidy7XBi,0
Sat Sep 23 23:58:06 +0000 2017,Today Only! 50% OFF this item.  Follow us to see Daily Deals. Buy now: https://t.co/tfG6lQJJrY https://t.co/j2Hszdh46N,0
Sat Sep 23 23:57:25 +0000 2017,Behold: the many sides of #BTS! #Army  ya'll know this video is GOLD for those BTS memes https://t.co/fWxaoV65jE… https://t.co/u5cvfqcpDA,3734
Sat Sep 23 23:55:56 +0000 2017,@RSquaredx3 Better save some money for that Purple &amp; Gold James jersey,0
Sat Sep 23 23:52:03 +0000 2017,SOMEONE PLEASE GET ME ROSE GOLD EARS ILL PAY YOU BACK I NEED TO BE A BASIC BITCH,0
Sat Sep 23 23:48:13 +0000 2017,Don't forget the part about Trump shitting on a gold toilet his entire adult life. https://t.co/lNbledjcUJ,1
Sat Sep 23 23:47:25 +0000 2017,Earned 3 PSN trophies (1 gold  1 silver and 1 bronze) in √Letter - https://t.co/L19uLZ4o8h,0
Sat Sep 23 23:46:57 +0000 2017,Congrats to #WHRADIO pass guest @Brodyxking @DouglasJamesPro on winning titles last night also to @Heatherisme on w… https://t.co/Sm5WEIP7ZY,3
Sat Sep 23 23:46:46 +0000 2017,@Dr_V_tweet #RealLove NEVER Play w/a person's Pure Loving Heart- If so  you will lose something more precious than… https://t.co/KymkuTgGci,0
Sat Sep 23 23:46:15 +0000 2017,Grab a pair of my signature @glassysunhaters and hate the ☀️ this weekend. Click the link for 10% off.… https://t.co/R4JjSumcIB,2
Sat Sep 23 23:45:58 +0000 2017,Nike Zoom KD10  Finals MVP PE Celebration Blue/Gold 897815-403 Size 9.5AUTHENTIC https://t.co/yRLvyvsSyA,0
Sat Sep 23 23:45:56 +0000 2017,Nike Air Jordan 11 Low Retro Gold "Closing Ceremony" SZ 10.5 DS  BIN 194.99 https://t.co/nO7AnKUFbd,0
Sat Sep 23 23:45:12 +0000 2017,@QueenSugarOWN @ava Rebel - Rebel - Cassini Cat - Saturn Spin - Nova Gold - Ava Shore - Compton Roar,0
Sat Sep 23 23:44:07 +0000 2017,Need #TheEssentials cocktail for #TreasureOfTheSierraMadre @tcm tonite? A Gold Rush  natch! https://t.co/6kwBdIjT5C… https://t.co/90ZXvfqxOD,2
Sat Sep 23 23:41:42 +0000 2017,Behold: the many sides of #BTS! #Army  ya'll know this video is GOLD for those BTS memes https://t.co/fWxaoV65jE… https://t.co/u5cvfqcpDA,3734
Sat Sep 23 23:41:11 +0000 2017,Just posted a photo @ Mecca of Bodybuilding...Gold's https://t.co/xWvWFXIcb2,1
Sat Sep 23 23:40:54 +0000 2017,Silver or gold ... or gold...or silver ... maybe both - Pura Vida's Wave ring - available at… https://t.co/PSr91Zznu6,0
Sat Sep 23 23:39:47 +0000 2017,@JaysonVorheez I just saw it! Thank you so much!!!!! Welcome to the Gold Skull Squad!,0
Sat Sep 23 23:35:47 +0000 2017,Nike Air Force 1 Low limited edition Cork  Gold Flecks  Size 12 Jordan LeBron https://t.co/W6d5w5pArx,0
Sat Sep 23 23:35:28 +0000 2017,Your the piece of gold that flashes On my soul Pt. 3 #air #playgroundlove #cover #piano #singer #mood #love... https://t.co/qphMVHjUpD,0
Sat Sep 23 23:33:50 +0000 2017,Are ‘Gold Standard’ Treatments Passe?  https://t.co/WJMjES0Gt5,0
Sat Sep 23 23:33:36 +0000 2017,Your the piece of gold that flashes On my soul Pt. 3 #air #playgroundlove #cover #piano #singer… https://t.co/u6KOroK6VZ,0
Sat Sep 23 23:32:36 +0000 2017,The real question is would I fuck y'all? HELL TF NO 🤷🏽‍♀️ https://t.co/WcTPYvhczo,41921
Sat Sep 23 23:30:33 +0000 2017,RARE Adidas Samba Light Scarlet Red Hemp White Gold Sz 10.5 Hemp https://t.co/XIFWJ4GZ1E,0
Sat Sep 23 23:29:25 +0000 2017,@BBHEAUXX I got Cheech this jacket and I want her in ASAP! https://t.co/dl5RURLxoq,0
Sat Sep 23 23:29:08 +0000 2017,Solid 14K White Gold Top Canines Fully Iced Out With White Diamonds. Custom made to order 💎 #Grillz #CustomJewelry… https://t.co/cXhW1TMnPI,6
Sat Sep 23 23:26:07 +0000 2017,Black and Gold R8 👌🏼 https://t.co/RP4I1wQUF1,41
Sat Sep 23 23:25:30 +0000 2017,Solid 14K White Gold Top Canines Fully Iced Out With White Diamonds. Custom made to order 💎 #Grillz #CustomJewelry… https://t.co/cXhW1TMnPI,6
Sat Sep 23 23:25:12 +0000 2017,Behold: the many sides of #BTS! #Army  ya'll know this video is GOLD for those BTS memes https://t.co/fWxaoV65jE… https://t.co/u5cvfqcpDA,3734
Sat Sep 23 23:24:32 +0000 2017,Solid 14K White Gold Top Canines Fully Iced Out With White Diamonds. Custom made to order 💎 #Grillz #CustomJewelry… https://t.co/cXhW1TMnPI,6
Sat Sep 23 23:24:21 +0000 2017,Adios has been certified GOLD in the U.K. by @bpi_music 📀🇬🇧🏆 https://t.co/NlNG5Oyrwe,51
Sat Sep 23 23:23:14 +0000 2017,Behold: the many sides of #BTS! #Army  ya'll know this video is GOLD for those BTS memes https://t.co/fWxaoV65jE… https://t.co/u5cvfqcpDA,3734
Sat Sep 23 23:21:55 +0000 2017,Psyduck! Those gold accents are on every single one of his feathers https://t.co/z4Tp08brfV,1
Sat Sep 23 23:21:26 +0000 2017,Pt 2 "playground love" by air  #air #playgroundlove #cover #piano #singer #indie #gold #gucci #mfw #pfw #fashion... https://t.co/kXOl1Xb3BY,0
Sat Sep 23 23:21:10 +0000 2017,Behold: the many sides of #BTS! #Army  ya'll know this video is GOLD for those BTS memes https://t.co/fWxaoV65jE… https://t.co/u5cvfqcpDA,3734
Sat Sep 23 23:20:53 +0000 2017,Pt 2 "playground love" by air  #air #playgroundlove #cover #piano #singer #indie #gold #gucci… https://t.co/EmZ303roAJ,0
Sat Sep 23 23:20:39 +0000 2017,Behold: the many sides of #BTS! #Army  ya'll know this video is GOLD for those BTS memes https://t.co/fWxaoV65jE… https://t.co/u5cvfqcpDA,3734
Sat Sep 23 23:20:00 +0000 2017,Solid 14K White Gold Top Canines Fully Iced Out With White Diamonds. Custom made to order 💎 #Grillz #CustomJewelry… https://t.co/cXhW1TMnPI,6
Sat Sep 23 23:19:43 +0000 2017,Order on Amazon Today https://t.co/CPdQurWpLt Gold Standard 100% Whey Protein - Perfect to Help Kickstart... https://t.co/GE4Mgmstj6,0
Sat Sep 23 23:19:26 +0000 2017,Solid 14K White Gold Top Canines Fully Iced Out With White Diamonds. Custom made to order 💎 #Grillz #CustomJewelry… https://t.co/cXhW1TMnPI,6
Sat Sep 23 23:18:13 +0000 2017,Behold: the many sides of #BTS! #Army  ya'll know this video is GOLD for those BTS memes https://t.co/fWxaoV65jE… https://t.co/u5cvfqcpDA,3734
Sat Sep 23 23:17:24 +0000 2017,Black &amp; gold Rolex 😫 https://t.co/YW1P1ddeyX,47
Sat Sep 23 23:15:59 +0000 2017,Black and Gold R8 👌🏼 https://t.co/RP4I1wQUF1,41
Sat Sep 23 23:15:00 +0000 2017,Nariguera Columpio #necklace in #950finesilver &amp; 24K Gold Plated. https://t.co/VxtB3cm3EB… https://t.co/EGAsRHRQiQ,0
Sat Sep 23 23:13:51 +0000 2017,Behold: the many sides of #BTS! #Army  ya'll know this video is GOLD for those BTS memes https://t.co/fWxaoV65jE… https://t.co/u5cvfqcpDA,3734
Sat Sep 23 23:08:23 +0000 2017,@RealFPJr @joshwolfcomedy I bleed purple &amp; gold too so that's awesome man!,0
Sat Sep 23 23:07:06 +0000 2017,Our silver #bladerunner #unicorns are sold out  but we still have gold ones in our little shop! Thanks to everyone… https://t.co/RAg5I123KU,0
Sat Sep 23 23:05:55 +0000 2017,real life is make believe  all that glitters isn't gold to me,0
Sat Sep 23 23:04:50 +0000 2017,Behold: the many sides of #BTS! #Army  ya'll know this video is GOLD for those BTS memes https://t.co/fWxaoV65jE… https://t.co/u5cvfqcpDA,3734
Sat Sep 23 23:04:46 +0000 2017,@realHonestPepe @mrJUSTINMARTIN If you're dumb enough to think this gold gilded idiot is "the best president in dec… https://t.co/vyAQ4aBtaX,0
Sat Sep 23 23:04:46 +0000 2017,Rising Tensions On Korean Peninsula Lift Gold - Tangible Investments https://t.co/KjrLrKfaXd,0
Sat Sep 23 23:04:27 +0000 2017,just tried to get into my twitter archives for an article and they're gone. I have some gold that came about in 2014 @Twitter whats the deal,0
Sat Sep 23 23:01:58 +0000 2017,Behold: the many sides of #BTS! #Army  ya'll know this video is GOLD for those BTS memes https://t.co/fWxaoV65jE… https://t.co/u5cvfqcpDA,3734
Sat Sep 23 23:01:49 +0000 2017,Odaingeroous Gold Jacket #wardrobecult #wardrobestylist #ootd #fashionstylist #nofastfashion $0.00 ➤… https://t.co/mObJAQOzwm,0
Sat Sep 23 23:01:39 +0000 2017,Behold: the many sides of #BTS! #Army  ya'll know this video is GOLD for those BTS memes https://t.co/fWxaoV65jE… https://t.co/u5cvfqcpDA,3734
Sat Sep 23 23:00:39 +0000 2017,YT Gold Chain and 100k belt buckle. I had no friends in high school. https://t.co/GxbgUS6z7H,336
Sat Sep 23 22:59:30 +0000 2017,I listened to you guys in the comments section  so I swapped out the silver button with the gold 🙌🏻 https://t.co/0cLyK35ypF,23
Sat Sep 23 22:59:07 +0000 2017,Behold: the many sides of #BTS! #Army  ya'll know this video is GOLD for those BTS memes https://t.co/fWxaoV65jE… https://t.co/u5cvfqcpDA,3734
Sat Sep 23 22:59:01 +0000 2017,Blazo - Fragile Gold - Colors of Jazz,0
Sat Sep 23 22:58:11 +0000 2017,Behold: the many sides of #BTS! #Army  ya'll know this video is GOLD for those BTS memes https://t.co/fWxaoV65jE… https://t.co/u5cvfqcpDA,3734
Sat Sep 23 22:57:27 +0000 2017,The only thing Jesus loves more than being crucified is the reenactment dipped in gold and sold at incredibly reaso… https://t.co/t6uR2np1SY,2
Sat Sep 23 22:56:22 +0000 2017,The new season of @broadcity is GOLD,0
Sat Sep 23 22:54:51 +0000 2017,Behold: the many sides of #BTS! #Army  ya'll know this video is GOLD for those BTS memes https://t.co/fWxaoV65jE… https://t.co/u5cvfqcpDA,3734
Sat Sep 23 22:53:11 +0000 2017,Our 18k Gold Ankh Cross Rope Chain Necklace is Now 60% Off 💎 https://t.co/OHytHjCcWn,71
Sat Sep 23 22:53:00 +0000 2017,Best way to value $TWTR is SOTP. You need to value the gold mine and clown car separately to get a better feel for the asset.,16
Sat Sep 23 22:51:54 +0000 2017,Behold: the many sides of #BTS! #Army  ya'll know this video is GOLD for those BTS memes https://t.co/fWxaoV65jE… https://t.co/u5cvfqcpDA,3734
Sat Sep 23 22:51:06 +0000 2017,My pal Lance. #moaningfetish #moaning https://t.co/nVkLYRoWa0 https://t.co/8upQBj6mp9,7
Sat Sep 23 22:51:01 +0000 2017,Behold: the many sides of #BTS! #Army  ya'll know this video is GOLD for those BTS memes https://t.co/fWxaoV65jE… https://t.co/u5cvfqcpDA,3734
Sat Sep 23 22:47:54 +0000 2017,Behold: the many sides of #BTS! #Army  ya'll know this video is GOLD for those BTS memes https://t.co/fWxaoV65jE… https://t.co/u5cvfqcpDA,3734
Sat Sep 23 22:46:10 +0000 2017,ALZKFKXOSOD I KNOW THIS ISNT LOUIS BUT NIALL WKDKOSOD i still can’t believe i’m seeing Niall next month wOW https://t.co/slqnexyRi5,13
Sat Sep 23 22:45:22 +0000 2017,Behold: the many sides of #BTS! #Army  ya'll know this video is GOLD for those BTS memes https://t.co/fWxaoV65jE… https://t.co/u5cvfqcpDA,3734
Sat Sep 23 22:44:45 +0000 2017,I liked a @YouTube video https://t.co/2nN3zGQ6QA Dating a Gold Digger | Anwar Jibawi,0
Sat Sep 23 22:44:03 +0000 2017,Our 18k Gold Ankh Cross Rope Chain Necklace is Now 60% Off 💎 https://t.co/OHytHjCcWn,71
Sat Sep 23 22:43:33 +0000 2017,Gold-painted Shirley Eaton on the set of "Goldfinger" in 1964. Please do not try this at home :/. https://t.co/PDe8Dh4c6h,2
Sat Sep 23 22:43:30 +0000 2017,Our 18k Gold Ankh Cross Rope Chain Necklace is Now 60% Off 💎 https://t.co/OHytHjCcWn,71
Sat Sep 23 22:43:27 +0000 2017,Adios has been certified GOLD in the U.K. by @bpi_music 📀🇬🇧🏆 https://t.co/NlNG5Oyrwe,51
Sat Sep 23 22:43:15 +0000 2017,Team Australia are going for gold at Prince Harry's Invictus Games in #Toronto. @LizziePearl #9News https://t.co/sgLXuKckiV,12
Sat Sep 23 22:40:45 +0000 2017,The only thing Jesus loves more than being crucified is the reenactment dipped in gold and sold at incredibly reaso… https://t.co/t6uR2np1SY,2
Sat Sep 23 22:39:11 +0000 2017,Behold: the many sides of #BTS! #Army  ya'll know this video is GOLD for those BTS memes https://t.co/fWxaoV65jE… https://t.co/u5cvfqcpDA,3734
Sat Sep 23 22:38:19 +0000 2017,Gold Deco 7: One in a series of Art Deco designs that make quiet statements. #InteriorDesign https://t.co/kakomlnXcS https://t.co/RnIpT8t3Px,0
Sat Sep 23 22:38:19 +0000 2017,Gold Deco 7: One in a series of Art Deco designs that make quiet statements. #InteriorDesign https://t.co/9kEK9lB3yf https://t.co/sXLsBTJ9Zf,0
Sat Sep 23 22:37:57 +0000 2017,#OnAir Handful Of Gold by CAZZETTE JONES #listen On Web https://t.co/kYfs1fvIjN 🔝💯🎶 https://t.co/R59FSGhVrM,0
Sat Sep 23 22:36:22 +0000 2017,Adios has been certified GOLD in the U.K. by @bpi_music 📀🇬🇧🏆 https://t.co/NlNG5Oyrwe,51
Sat Sep 23 22:35:24 +0000 2017,My twitter feed is actually made of gold rn.😂😩😂,0
Sat Sep 23 22:35:05 +0000 2017,When you mad the cool kids don't want to come to your party https://t.co/rQXri2F7cR,30052
Sat Sep 23 22:34:59 +0000 2017,We’re the colours of the rainbow yeah yeah Lets share our pot of gold,0
Sat Sep 23 22:32:47 +0000 2017,Behold: the many sides of #BTS! #Army  ya'll know this video is GOLD for those BTS memes https://t.co/fWxaoV65jE… https://t.co/u5cvfqcpDA,3734
Sat Sep 23 22:30:48 +0000 2017,Working On myself  By myself  For myself.,8768
Sat Sep 23 22:30:10 +0000 2017,Stay gold. Wear gold. Shop link in bio. https://t.co/vgBuvSgYsv,1
Sat Sep 23 22:29:26 +0000 2017,Armenia's gold medalist wrestler Artur Aleksanyan's training gym in Gyumri. #Olympics https://t.co/g9pbbj03vV https://t.co/PPUfYXMeln,212
Sat Sep 23 22:28:31 +0000 2017,📹| Niall olhando pro Louis enquanto cantava Fool’s Gold. 💕 (21/09) -Yas https://t.co/8jkskd1pdM,4
Sat Sep 23 22:27:45 +0000 2017,Behold: the many sides of #BTS! #Army  ya'll know this video is GOLD for those BTS memes https://t.co/fWxaoV65jE… https://t.co/u5cvfqcpDA,3734
Sat Sep 23 22:27:14 +0000 2017,Behold: the many sides of #BTS! #Army  ya'll know this video is GOLD for those BTS memes https://t.co/fWxaoV65jE… https://t.co/u5cvfqcpDA,3734
Sat Sep 23 22:26:02 +0000 2017,Graham Cassidy: terrible healthcare bill  great name for a folk singer.,1558
Sat Sep 23 22:25:34 +0000 2017,Weekend vibes. Get my @Fabletics #Demi4Fabletics outfit right here 💗 https://t.co/heQbb5xscf https://t.co/nPy6WgaykA,3261
Sat Sep 23 22:24:31 +0000 2017,Alicia finally returns in tomorrow’s new #FearTWD. Here’s the trailer: https://t.co/EuRHZt9W1f https://t.co/0jsIBEieWj,170
Sat Sep 23 22:24:13 +0000 2017,Twitter is wild guys. Thanks @BuzzFeed for teaching me about #ThirstTweets 😂💦 https://t.co/a2mBVpHpY9,825
Sat Sep 23 22:23:29 +0000 2017,@DonnaWR8 @realDonaldTrump @FLOTUS WORST 1ST 'lady' EVER  FORMER PORN MODEL WORKED HERE ILLEGALLY GOLD-DIGGER LIED… https://t.co/FxXbHP8GYf,0
Sat Sep 23 22:21:14 +0000 2017,Next Week: Bogota  Colombia - Sep 30 at Teen Festival https://t.co/7F7ycahPUB,77
Sat Sep 23 22:20:17 +0000 2017,Behold: the many sides of #BTS! #Army  ya'll know this video is GOLD for those BTS memes https://t.co/fWxaoV65jE… https://t.co/u5cvfqcpDA,3734
Sat Sep 23 22:19:57 +0000 2017,Behold: the many sides of #BTS! #Army  ya'll know this video is GOLD for those BTS memes https://t.co/fWxaoV65jE… https://t.co/u5cvfqcpDA,3734
Sat Sep 23 22:19:34 +0000 2017,The worst return in The Acquirers Multiple Canada All TSX Screen this week was TGZ.TO Teranga Gold Corp down -6.9 percent to CAD 1.23,0
Sat Sep 23 22:19:01 +0000 2017,@CoachRumph16 gold boxing gloves? Michael Jackson diamond glove?,0
Sat Sep 23 22:18:49 +0000 2017,YT Gold Chain and 100k belt buckle. I had no friends in high school. https://t.co/GxbgUS6z7H,336
Sat Sep 23 22:18:06 +0000 2017,Behold: the many sides of #BTS! #Army  ya'll know this video is GOLD for those BTS memes https://t.co/fWxaoV65jE… https://t.co/u5cvfqcpDA,3734
Sat Sep 23 22:17:38 +0000 2017,Behold: the many sides of #BTS! #Army  ya'll know this video is GOLD for those BTS memes https://t.co/fWxaoV65jE… https://t.co/u5cvfqcpDA,3734
Sat Sep 23 22:17:05 +0000 2017,@waggles111 @davidf4444 @billy4ever9 @MAGr8A_ @CraigChermside @budb66 @DotLolly @AlexanderArch3r @MSPOA @bgoodwinft… https://t.co/SKGgRHZuFO,0
Sat Sep 23 22:15:31 +0000 2017,What do YOU think of December’s cover of #TheWalkingDead? Check it our and discuss: https://t.co/eg9aQPGQ9Q https://t.co/oajBFvFulr,53
Sat Sep 23 22:14:18 +0000 2017,Gold https://t.co/GyQrMgtmMa,0
Sat Sep 23 22:14:14 +0000 2017,Gold In Them Hills - @RonSexsmith Music to Grieve to #playlist https://t.co/HzBYdAfaYP #ithurts #memoir #petloss… https://t.co/yAOLD3Q4lI,0
Sat Sep 23 22:11:55 +0000 2017,whew https://t.co/lsM8vCEjuK,538
Sat Sep 23 22:11:37 +0000 2017,@rotobuzzguy So many TE's get in the "running" for these trades bc  so much fools gold.. Remember two years ago Bar… https://t.co/zBHcU67tMC,0
Sat Sep 23 22:11:14 +0000 2017,#GagaFiveFootTwo was inspirational! What a powerful  talented  incredibly strong &amp; beautiful woman! Love always xx,415
Sat Sep 23 22:11:13 +0000 2017,@realDonaldTrump Are you tweeting this from inside your Gold Cart at your resort ? https://t.co/M6xfbLubKV,0
Sat Sep 23 22:11:01 +0000 2017,How Food Waste is Gold #goodisthenewcool,0
Sat Sep 23 22:09:17 +0000 2017,@billygil announcer for Wake Forest App State game is pure gold.  #uselesssoundoftheday he sounds like the coach from Water Boy.,0
Sat Sep 23 22:08:58 +0000 2017,Black and Gold R8 👌🏼 https://t.co/RP4I1wQUF1,41
Sat Sep 23 22:07:31 +0000 2017,The only thing Jesus loves more than being crucified is the reenactment dipped in gold and sold at incredibly reaso… https://t.co/t6uR2np1SY,2
Sat Sep 23 22:04:33 +0000 2017,Gold-painted Shirley Eaton on the set of "Goldfinger" in 1964. Please do not try this at home :/. https://t.co/PDe8Dh4c6h,2
Sat Sep 23 22:01:14 +0000 2017,Matte rose gold G Wagon 🙏🏽 https://t.co/g1cwWdm6r3,375
Sat Sep 23 22:00:51 +0000 2017,Message! No time like the present. @diddy https://t.co/XZudO6sKAN,9396
Sat Sep 23 22:00:46 +0000 2017,@CorbanfordNBA @forumbluegold Yessir. If you're interested  read this post &amp; hit us up w/what Darius is asking for… https://t.co/OofTDsIX1e,0
Sat Sep 23 22:00:06 +0000 2017,Choosing one person who RT's to be next videos shoutout!  New vid is up! Like and subscribe!  https://t.co/VxesR5oQFR,12919
Sat Sep 23 21:59:25 +0000 2017,2.25mm Gold Filled Chain 18K GFC013 Sold by Foot https://t.co/VIdB5yHLL8 #BeadsFindingDepot #WholesaleChain https://t.co/jjs4BLTDS7,0
Sat Sep 23 21:59:17 +0000 2017,Today Only! 50% OFF this item.  Follow us to see Daily Deals. Buy now: https://t.co/O7PqoUF8Q1 https://t.co/rDw9osBDW3,0
Sat Sep 23 21:57:46 +0000 2017,#MUSIC ~ viaUrl=https://t.co/kwf9X4uqJC  ~ message=Gold Guns Girls [Official Music Video]--METRIC,0
Sat Sep 23 21:57:40 +0000 2017,@JRayM5 Ok and to get the seats in 104 would be bronze  correct?  Do you think the Gold would be worth it?,0
Sat Sep 23 21:57:23 +0000 2017,Behold: the many sides of #BTS! #Army  ya'll know this video is GOLD for those BTS memes https://t.co/fWxaoV65jE… https://t.co/u5cvfqcpDA,3734
Sat Sep 23 21:56:01 +0000 2017,🎥 | Louis smiling during Fools Gold ❤️ https://t.co/kGCY18TdO1,802
Sat Sep 23 21:55:53 +0000 2017,Turmeric—the living gold from the Earth that we should be consuming. One of the best anti-inflammatory herbs. Offer… https://t.co/rMOqTv67Bz,182
Sat Sep 23 21:54:55 +0000 2017,Growing up in the good ol days... https://t.co/ya5feg9dVl,786
Sat Sep 23 21:53:24 +0000 2017,You're saying people have paid the gold price instead of the iron price. I don't find this to be true in all cases. https://t.co/GZSXJDHvNU,0
Sat Sep 23 21:53:14 +0000 2017,@JRayM5 Wait VIP bronze or gold 350?,0
Sat Sep 23 21:53:00 +0000 2017,THIS MAN SPEAKS PURE GOLD ! I FUCKS W. YOU MICHAEL! https://t.co/mmFNiNYvaU,0
Sat Sep 23 21:51:48 +0000 2017,My chain  new gold watch made in China. We play ping pong ball made in China,0
Sat Sep 23 21:51:47 +0000 2017,Lmaooooooo https://t.co/1ZJA9VPY2A,54
Sat Sep 23 21:51:31 +0000 2017,🎥| Louis souriant pendant Fool’s Gold au concert de Niall  hier à LA   ©begsforyou  https://t.co/mZdnK83Nbc,48
Sat Sep 23 21:50:34 +0000 2017,Just got The Big Break by @TheGilCunha - a must-read for aspiring comedy writers! So far chap 1 w/ @thebryanpaulk is gold! H/T @jessiestwats,0
Sat Sep 23 21:49:16 +0000 2017,Behold: the many sides of #BTS! #Army  ya'll know this video is GOLD for those BTS memes https://t.co/fWxaoV65jE… https://t.co/u5cvfqcpDA,3734
Sat Sep 23 21:49:02 +0000 2017,Ain’t the world supposed to end today? 🤔,643
Sat Sep 23 21:48:40 +0000 2017,Behold: the many sides of #BTS! #Army  ya'll know this video is GOLD for those BTS memes https://t.co/fWxaoV65jE… https://t.co/u5cvfqcpDA,3734
Sat Sep 23 21:48:07 +0000 2017,Black and Gold R8 👌🏼 https://t.co/RP4I1wQUF1,41
Sat Sep 23 21:47:23 +0000 2017,Behold: the many sides of #BTS! #Army  ya'll know this video is GOLD for those BTS memes https://t.co/fWxaoV65jE… https://t.co/u5cvfqcpDA,3734
Sat Sep 23 21:43:54 +0000 2017,Behold: the many sides of #BTS! #Army  ya'll know this video is GOLD for those BTS memes https://t.co/fWxaoV65jE… https://t.co/u5cvfqcpDA,3734
Sat Sep 23 21:43:12 +0000 2017,Behold: the many sides of #BTS! #Army  ya'll know this video is GOLD for those BTS memes https://t.co/fWxaoV65jE… https://t.co/u5cvfqcpDA,3734
Sat Sep 23 21:41:56 +0000 2017,Trump: "Your invitation is withdrawn."  Steph: "Well that's fine w-"  Riley: "WE AINT NEVER WANT YA DUSTY INVITATIO… https://t.co/gz9DbUSVFa,26630
Sat Sep 23 21:41:30 +0000 2017,Behold: the many sides of #BTS! #Army  ya'll know this video is GOLD for those BTS memes https://t.co/fWxaoV65jE… https://t.co/u5cvfqcpDA,3734
Sat Sep 23 21:41:23 +0000 2017,Behold: the many sides of #BTS! #Army  ya'll know this video is GOLD for those BTS memes https://t.co/fWxaoV65jE… https://t.co/u5cvfqcpDA,3734
Sat Sep 23 21:39:53 +0000 2017,Behold: the many sides of #BTS! #Army  ya'll know this video is GOLD for those BTS memes https://t.co/fWxaoV65jE… https://t.co/u5cvfqcpDA,3734
Sat Sep 23 21:38:45 +0000 2017,The wheel keeps turning . And Maya the cat fears nothing. Cause he see's the gold. #poetry,0
Sat Sep 23 21:38:35 +0000 2017,Check out Gangsters and Gold Diggers: Old New York  the Jazz Age... NEW FREE SHIPPING!  https://t.co/A0sc210EdV via @eBay,1
Sat Sep 23 21:38:29 +0000 2017,Sunday ❤️ #TOMSshoes Shop Tiny TOMS: https://t.co/FA73ZcbnvI https://t.co/GFZhlm3IL6,55
Sat Sep 23 21:36:07 +0000 2017,Her heart is amazing and made out of gold 💚😍 she's been my everything through it all 😪🙌🏼💍💚,1
Sat Sep 23 21:34:53 +0000 2017,Best way to value $TWTR is SOTP. You need to value the gold mine and clown car separately to get a better feel for the asset.,16
Sat Sep 23 21:34:21 +0000 2017,@Weasle37417140 @realDonaldTrump @FLOTUS Gold plated like everything else  in that horrible penthouse.,0
Sat Sep 23 21:34:16 +0000 2017,🎥 | Louis smiling during Fools Gold ❤️ https://t.co/kGCY18TdO1,802
Sat Sep 23 21:34:09 +0000 2017,Behold: the many sides of #BTS! #Army  ya'll know this video is GOLD for those BTS memes https://t.co/fWxaoV65jE… https://t.co/u5cvfqcpDA,3734
Sat Sep 23 21:32:48 +0000 2017,"Yet it chills me to the bone  knowing how I'm not alone. And that you can have a dark soul with a heart of gold." https://t.co/Va920w2hvy,0
Sat Sep 23 21:31:18 +0000 2017,Behold: the many sides of #BTS! #Army  ya'll know this video is GOLD for those BTS memes https://t.co/fWxaoV65jE… https://t.co/u5cvfqcpDA,3734
Sat Sep 23 21:31:03 +0000 2017,@SouthPark's latest season is fucking gold 😂,0
Sat Sep 23 21:31:01 +0000 2017,Team Australia are going for gold at Prince Harry's Invictus Games in #Toronto. @LizziePearl #9News https://t.co/sgLXuKckiV,12
Sat Sep 23 21:30:48 +0000 2017,Help me win this cool Rose Gold Dice Gift Pack From @easyrollerdice https://t.co/3yObB0YE6p,0
Sat Sep 23 21:29:49 +0000 2017,Behold: the many sides of #BTS! #Army  ya'll know this video is GOLD for those BTS memes https://t.co/fWxaoV65jE… https://t.co/u5cvfqcpDA,3734
Sat Sep 23 21:29:45 +0000 2017,Behold: the many sides of #BTS! #Army  ya'll know this video is GOLD for those BTS memes https://t.co/fWxaoV65jE… https://t.co/u5cvfqcpDA,3734
Sat Sep 23 21:29:34 +0000 2017,i miss monday :( i cry cause Nick was putting on his seatbelt and i told him "NICK YOU PAY ME GOLD" and he went to hug me so fast😭😂,0
Sat Sep 23 21:28:38 +0000 2017,Deep breaths are like little love notes to your body. #breathe #smile https://t.co/pmyWPonaQ9,133
Sat Sep 23 21:28:04 +0000 2017,FRRR @nickmara SHOW ME SOME LUV I TOLD YOU  YOU PAYED ME GOLD BUT I LIED ZION DOES🤷‍♀️😂 https://t.co/c64ScLKfVV,1
Sat Sep 23 21:27:14 +0000 2017,FRRR @nickmara SHOW ME SOME LUV I TOLD YOU  YOU PAYED ME GOLD BUT I LIED ZION DOES🤷‍♀️😂 https://t.co/c64ScLKfVV,1
Sat Sep 23 21:26:10 +0000 2017,2017 $50 Gold American Eagle 1 oz. Brilliant Uncirculated https://t.co/RyobWtWydJ,0
Sat Sep 23 21:25:31 +0000 2017,Our Rose Criss Cross #Blouse and Black String #Necklace with Gold Pendant Use Code FS923 to get 15% off… https://t.co/7m0tWDHo4T,0
Sat Sep 23 21:25:30 +0000 2017,100 DAMN DOLLARS FOR A DONUT THAT HAS EDIBLE GOLD FOIL ??!??? https://t.co/q5jyBA3UY3,0
Sat Sep 23 21:25:20 +0000 2017,Watch "In your city's sewage: millions in gold  silver" on YouTube - https://t.co/FN4fl9kEaH,0
Sat Sep 23 21:24:45 +0000 2017,Behold: the many sides of #BTS! #Army  ya'll know this video is GOLD for those BTS memes https://t.co/fWxaoV65jE… https://t.co/u5cvfqcpDA,3734
Sat Sep 23 21:24:42 +0000 2017,The Illuminati​ Talisman necklace is now plated in real  breathtaking gold. http://t.co/jocVccpGns ▲ http://t.co/q4jsaaRShS,117
Sat Sep 23 21:24:00 +0000 2017,$20.00 #Unique Vintage #Handbag #Caddy #Purse #Holder #Cupid #Angels #Gold #Porcelain #Inlay… https://t.co/VuuAO5JXus,2
