Sat Jul 29 23:57:50 +0000 2017,Check out this new photograph that I uploaded to https://t.co/00rjKMNLC8! https://t.co/HsNIKxSERj,0
Sat Jul 29 23:56:50 +0000 2017,Follow the GOLD Life 🍾🍾 @LOK_LA #GoldlokUSA #Goldloksupremevodka #TBE #TheBetterEntertainment.com https://t.co/KKX8BuV0zB,0
Sat Jul 29 23:52:32 +0000 2017,Wow when a legend calls u a legend https://t.co/oEXRM5Pidn,729
Sat Jul 29 23:51:43 +0000 2017,@astVintageSpace You hear about this yet  Amy? https://t.co/22WmMCX4OF,0
Sat Jul 29 23:49:32 +0000 2017,Brenda Avila in the mix at the Pizza Beer and Wings spot on First st. across the gold line She's on at 7 😬,0
Sat Jul 29 23:49:15 +0000 2017,@TheValerieJune @ladygunn Jazzy June - Capricorn -Cosmic Cat - Astral Ace -Slam'n Space - Sagan Spin - Blaze'n Blue… https://t.co/S81UtsZTCs,0
Sat Jul 29 23:46:42 +0000 2017,Nike Kyrie 3 Black Metallic Gold https://t.co/jweEi3J1kc,0
Sat Jul 29 23:46:13 +0000 2017,@ladygunn  Jazzy June -Cosmic Cat -Capricorn -Sagan Spin -Ziggy Dust -Blaze'n Blues - Voyage Gold - Bella Sun - Memphis Splash - Organic Orb,0
Sat Jul 29 23:44:28 +0000 2017,RT MakeupsDIY: gold detailing https://t.co/nZjcAoDpeP,0
Sat Jul 29 23:42:44 +0000 2017,Declassified Emails Reveal NATO Killed Gaddafi to Stop Libyan Creation of Gold-Backed Currency https://t.co/OFgw2VIHXO,0
Sat Jul 29 23:42:27 +0000 2017,@__ashleeey_____ AHH thank you so much baby I love you so much this picture is GOLD I miss those days 😭💞,1
Sat Jul 29 23:37:10 +0000 2017,@Dodgers @YasielPuig Gold glove for Puig. He has done well this year.,1
Sat Jul 29 23:36:02 +0000 2017,The Blue &amp; Gold's next front page story? Bughead is dating IRL: https://t.co/cf9eiuKb7H https://t.co/iw15kRqroK,27
Sat Jul 29 23:33:53 +0000 2017,PREVIEW: X-Men: Gold #9 by @mguggenheim &amp; @ledkilla  https://t.co/bMGuWIkn3U https://t.co/uVNEQPuyHJ,10
Sat Jul 29 23:33:40 +0000 2017,The Blue &amp; Gold's next front page story? Bughead is dating IRL: https://t.co/cf9eiuKb7H https://t.co/iw15kRqroK,27
Sat Jul 29 23:33:27 +0000 2017,PREVIEW: X-Men: Gold #9 by @mguggenheim &amp; @ledkilla  https://t.co/bMGuWIkn3U https://t.co/uVNEQPuyHJ,10
Sat Jul 29 23:32:28 +0000 2017,Even though the #USMNT was expected to win the #GoldCup2017  it’s a victory to celebrate all the same https://t.co/Id9aXks6Ec,0
Sat Jul 29 23:32:00 +0000 2017,I wanna hold onto the belief that Trump wakes up every morning and looks at himself in some shitty gaudy gold mirro… https://t.co/r2uaWZiSIy,245
Sat Jul 29 23:31:58 +0000 2017,GOP: The healing potion is 5 000 gold pieces. PC:  But we don't have that much gold. GOP: No  but you have ACCESS to health potions. #GOPDnD,890
Sat Jul 29 23:30:06 +0000 2017,#CandleHolder #Stand #Venetian #Gold #Mask Set #Masquerade | #eBay #mardigra #candleholder https://t.co/0t0z6wBFYm? https://t.co/QseJr8l3rw,0
Sat Jul 29 23:30:01 +0000 2017,The pretty reckless 🌿 @Jennalyyy  #fashion #accessories #sunnies   https://t.co/ZQFUUKaCD0 https://t.co/HsKYs67FHF,4
Sat Jul 29 23:29:12 +0000 2017,@TopDrawerSoccer @JozyAltidore As insane as it is tho  many USMNT fans still fail to appreciate him  even after Gol… https://t.co/bPnDyepinn,0
Sat Jul 29 23:29:09 +0000 2017,Everyone is talking about the #USMNT roster changes  so we got @AlexiLalas to break down all the moves. #GoldCup2017 https://t.co/ZB1pCi6Eeo,93
Sat Jul 29 23:25:59 +0000 2017,Satirist-in-Chief: Anthony Atamanuik mines Trump's darkness for comedic gold https://t.co/p5UH8v68fa via @HuffPostEnt,0
Sat Jul 29 23:25:06 +0000 2017,California's post-drought snowmelt has sparked a new gold rush https://t.co/loi2dQPBCm https://t.co/bdp05fPfiV,61
Sat Jul 29 23:23:29 +0000 2017,Should I do pink or rose gold?,0
Sat Jul 29 23:20:17 +0000 2017,@SantaMonicaPier Jazzy June - Cosmic Cat - Capricorn - Sagan Spin - Ziggy Dust - Blaze'n Blues - Voyage Gold - Bell… https://t.co/S6DesLOEIu,0
Sat Jul 29 23:18:01 +0000 2017,@KJAZZ881   Jazzy June - Cosmic Cat - Capricorn -Sagan Spin -Ziggy Dust -Blaze'n Blues -Voyage Gold -Bella Sun -Memphis Splash - Organic Orb,0
Sat Jul 29 23:17:35 +0000 2017,Give Mitchy two bags the gold glove now. His name can be upgraded to Mitchy two golden bags.,0
Sat Jul 29 23:17:27 +0000 2017,Interview of Marian Gold by The Chicago Concert Reviews!... https://t.co/gcQ7bKk4GZ,0
Sat Jul 29 23:16:30 +0000 2017,♫Cherry Blossom [Ben Gold Remix] by Marcel Woods  from #SoundHound https://t.co/iPDHEKT2jx,0
Sat Jul 29 23:16:24 +0000 2017,#10 Megadalia Gold hits thecwinner circle for PTSI horse bettors at 10/1 to break the maiden The Candy Man takes care of biz @DelMarRacing,0
Sat Jul 29 23:16:23 +0000 2017,Fitness friends are like gold... Rare  valuable  and not afraid of dirt. @TheAthElite #quote https://t.co/zZWiViDSfI,0
Sat Jul 29 23:12:37 +0000 2017,Listen to [TGS Exclusive] Gortex - Gold Rate (Original Mix) by TGS DubStep #np on #SoundCloud https://t.co/3EQMVQT1mj,0
Sat Jul 29 23:11:11 +0000 2017,Now trending: Gold Filled Religious Pendant  Gold filled  Size 12mm  Sold by 1 pcs 2.1 grams https://t.co/ibJYaqNmyV https://t.co/1JfEzwgmWZ,0
Sat Jul 29 23:07:47 +0000 2017,PREVIEW: X-Men: Gold #9 by @mguggenheim &amp; @ledkilla  https://t.co/bMGuWIkn3U https://t.co/uVNEQPuyHJ,10
Sat Jul 29 23:07:30 +0000 2017,Is this why the Gold Line is so packed every morning and evening? https://t.co/KXBask0B2Y,0
Sat Jul 29 23:06:52 +0000 2017,THAT DREAM ABOUT MY BEACH BABE MADE ME SAD DOOD I WANT MY BEACH BABE WHAT IS THIS BULLSHIT THAT IS 5 GOLD jahdbdnjw,0
Sat Jul 29 23:06:49 +0000 2017,The Blue &amp; Gold's next front page story? Bughead is dating IRL: https://t.co/cf9eiuKb7H https://t.co/iw15kRqroK,27
Sat Jul 29 23:06:13 +0000 2017,The Blue &amp; Gold's next front page story? Bughead is dating IRL: https://t.co/cf9eiuKb7H https://t.co/iw15kRqroK,27
Sat Jul 29 23:05:45 +0000 2017,A woman came to Chester's memorial in NYC last night all the way from Brazil,0
Sat Jul 29 23:05:41 +0000 2017,This cartoon is pure gold wym? https://t.co/S8GpOJjy6i,0
Sat Jul 29 23:05:33 +0000 2017,The Cat in the Hat movie with Mike Meyers is pure gold,7
Sat Jul 29 23:05:06 +0000 2017,Satirist-in-Chief: Anthony Atamanuik mines Trump's darkness for comedic gold https://t.co/8g5V6xRxyU # via @HuffPostEnt LOL,0
Sat Jul 29 23:03:07 +0000 2017,A tug-of-war between Metro  Metrolink intensifies as thousands switch to cheaper Gold Line https://t.co/jO7zA05MU1 https://t.co/uLa9lKh9ku,1
Sat Jul 29 23:02:50 +0000 2017,Lifetime has greenlit a biopic about Olympic gold medalist @Simone_Biles https://t.co/j3zUyCucJF https://t.co/mfHvKBt6l5,25
Sat Jul 29 23:02:39 +0000 2017,@SplashJavi Why are they booing him ? They're probably blaming him for the loss to Jamaica in the gold cup,0
Sat Jul 29 23:02:24 +0000 2017,The Blue &amp; Gold's next front page story? Bughead is dating IRL: https://t.co/cf9eiuKb7H https://t.co/iw15kRqroK,27
Sat Jul 29 23:01:52 +0000 2017,Your start date sets specific goals for your film team: On a no-to-low budget film this is PURE GOLD. https://t.co/xMJIBXXuXA @nofilmschool,0
Sat Jul 29 23:01:02 +0000 2017,The city dressed in jewels and gold  fine linen  Myrrh and pearls Her plagues will come all at once as her mourners watch her burn,0
Sat Jul 29 22:59:51 +0000 2017,The Blue &amp; Gold's next front page story? Bughead is dating IRL: https://t.co/cf9eiuKb7H https://t.co/iw15kRqroK,27
Sat Jul 29 22:59:42 +0000 2017,This shining city built of gold  a far cry from innocence There's more than meets the eye round here look to the waters of the deep,0
Sat Jul 29 22:59:21 +0000 2017,enews : The Blue &amp; Gold's next front page story? Bughead is dating IRL: https://t.co/IgyivwvhRL …… https://t.co/kuUCko1vVO,0
Sat Jul 29 22:57:40 +0000 2017,The Associated Press: Gold lunar module stolen from Neil Armstrong museum in Ohio. https://t.co/maxWIoUNQg,0
Sat Jul 29 22:56:57 +0000 2017,Gold Glove Your Friend,5
Sat Jul 29 22:56:37 +0000 2017,Beautiful And  Flawless Vintage Pink &amp; Gold Iridescent https://t.co/gdfPGWzVwj via @Etsy,0
Sat Jul 29 22:56:21 +0000 2017,@angexla looks so gorgeous in our Underground gold bullet 💄All lip products are $7 today only for… https://t.co/xV55YJTuCs,0
Sat Jul 29 22:56:17 +0000 2017,Swimming in gold and rich colors  this dreamy digital work combines elegance with allure. https://t.co/BqITjNXeDt https://t.co/bY0AcAJhDD,104
Sat Jul 29 22:56:13 +0000 2017,The Blue &amp; Gold's next front page story? Bughead is dating IRL: https://t.co/cf9eiuKb7H https://t.co/iw15kRqroK,27
Sat Jul 29 22:56:10 +0000 2017,The Blue &amp; Gold's next front page story? Bughead is dating IRL: https://t.co/cf9eiuKb7H https://t.co/iw15kRqroK,27
Sat Jul 29 22:55:21 +0000 2017,The Blue &amp; Gold's next front page story? Bughead is dating IRL: https://t.co/cf9eiuKb7H https://t.co/iw15kRqroK,27
Sat Jul 29 22:55:06 +0000 2017,The Blue &amp; Gold's next front page story? Bughead is dating IRL: https://t.co/cf9eiuKb7H https://t.co/iw15kRqroK,27
Sat Jul 29 22:54:56 +0000 2017,Solid gold around those who are gold plated ✨ https://t.co/jEIUkagQBv,38
Sat Jul 29 22:54:37 +0000 2017,Cosmetics companies are missing out on a gold mine with @ChakaKhan! Those lips &amp; that face are ICONIC!!!… https://t.co/VTIN2zDXQR,2
Sat Jul 29 22:54:30 +0000 2017,GET YO GOLD LAUNDRY WEAR goldlaundryhouse EVERYBODY HAVE A BEAUTIFUL SATURDAY 🙏🏾 #fredkelly… https://t.co/8GEudhWQ7R,0
Sat Jul 29 22:53:51 +0000 2017,Citizen Men’s ‘Eco-Drive’ Quartz Stainless Steel Casual Watch  Color:Gold-Toned… https://t.co/qX7NKo97ZK https://t.co/Ehv9oMHCt0,0
Sat Jul 29 22:52:56 +0000 2017,Solid gold around those who are gold plated ✨ https://t.co/jEIUkagQBv,38
Sat Jul 29 22:51:41 +0000 2017,Alex and Ani Kingston Wrap Russian-Gold Expandable Bracelet https://t.co/B56HwQDExb https://t.co/g9HAk9Vpio,0
Sat Jul 29 22:49:11 +0000 2017,@mellamoyanna @Chombaaa Haha I'm a horrible sales person 😭 pero somebody gotta pick that idea up cuz it's GOLd.,0
Sat Jul 29 22:48:26 +0000 2017,#OnAir Gold by @KIIARA #listen On Web https://t.co/kYfs1fvIjN 🔝💯🎶 https://t.co/XwjdADLtXP,0
Sat Jul 29 22:47:32 +0000 2017,I don't think people really know what the definition of gold digger really is. 🤦🏻‍♀️,0
Sat Jul 29 22:47:11 +0000 2017,Let's two-step baby.. on the living room floor -@sevyn I can hear just that line over and over your voice is like liquid gold bihhh 😭😭😭😍,0
Sat Jul 29 22:41:29 +0000 2017,.@Cardale7_ will wear # 5️⃣.  Can't wait to see him in the blue and gold⚡️,189
Sat Jul 29 22:41:07 +0000 2017,PREVIEW: X-Men: Gold #9 by @mguggenheim &amp; @ledkilla  https://t.co/bMGuWIkn3U https://t.co/uVNEQPuyHJ,10
Sat Jul 29 22:40:34 +0000 2017,This show was gold https://t.co/K4FRN1OBHU,0
Sat Jul 29 22:39:54 +0000 2017,Four characters in search of riches @latimes. It's Gold Fever in the Sierra. @niemanstory @DRUDGE_REPORT @Longreads https://t.co/gbBrOrCmLX,6
Sat Jul 29 22:38:20 +0000 2017,#NBA Wire: U.S. swimmer Caeleb Dressel makes history with three-gold night at worlds https://t.co/2izQCkjIaW https://t.co/CDEWCbiRez #lak…,0
Sat Jul 29 22:37:11 +0000 2017,#MLB Wire: U.S. swimmer Caeleb Dressel makes history with three-gold night at worlds https://t.co/bGumC3NOjp https://t.co/hfdg2VNgCJ,0
Sat Jul 29 22:37:10 +0000 2017,#MLB Wire: U.S. swimmer Caeleb Dressel makes history with three-gold night at worlds https://t.co/EWr8pPDPTL https://t.co/kiiMPd0P20,0
Sat Jul 29 22:36:21 +0000 2017,NPR: For professional jokesters  President Trump is either gold to mine or a grenade to avoid. Sometimes he's both… https://t.co/d9AABqA6D7,0
Sat Jul 29 22:36:11 +0000 2017,PREVIEW: X-Men: Gold #9 by @mguggenheim &amp; @ledkilla  https://t.co/bMGuWIkn3U https://t.co/uVNEQPuyHJ,10
Sat Jul 29 22:36:08 +0000 2017,#NBA Wire: U.S. swimmer Caeleb Dressel makes history with three-gold night at worlds https://t.co/lJGG8QqD9x https://t.co/hbwvjVFe26,0
Sat Jul 29 22:36:05 +0000 2017,#NBA Wire: U.S. swimmer Caeleb Dressel makes history with three-gold night at worlds https://t.co/O2YP7OoDrI https://t.co/iYPjcSZ1vM,0
Sat Jul 29 22:33:30 +0000 2017,gold grillz 😋 available at ● https://t.co/uNy5PnB101 ● https://t.co/MzLnrCqWKX,164
Sat Jul 29 22:32:55 +0000 2017,.@Cardale7_ will wear # 5️⃣.  Can't wait to see him in the blue and gold⚡️,189
Sat Jul 29 22:31:54 +0000 2017,@eramsodoiseuros Those low plats may have lower MMR if they're being paired up with you. Sounds like the avg MMR could be in mid Gold?,0
Sat Jul 29 22:30:39 +0000 2017,Here is the first look at the Balmain and L’Oreal collab  and it’s a rose gold dream https://t.co/haJ1RgWJRY https://t.co/zmDlGfmFs2,1
Sat Jul 29 22:30:16 +0000 2017,PREVIEW: X-Men: Gold #9 by @mguggenheim &amp; @ledkilla  https://t.co/bMGuWIkn3U https://t.co/uVNEQPuyHJ,10
Sat Jul 29 22:30:01 +0000 2017,PREVIEW: X-Men: Gold #9 by @mguggenheim &amp; @ledkilla  https://t.co/bMGuWIkn3U https://t.co/uVNEQPuyHJ,10
Sat Jul 29 22:29:39 +0000 2017,Solid gold around those who are gold plated ✨ https://t.co/jEIUkagQBv,38
Sat Jul 29 22:26:43 +0000 2017,It will be quite a contrast to see #politicon2017 attendees leaving and Metallica fans arriving at the Pasadena Metro Gold Line station.,0
Sat Jul 29 22:25:09 +0000 2017,The Last Tycoon premiere! Now streaming on @amazonvideo @ Harmony Gold Theater https://t.co/pQJJvLWclx,225
Sat Jul 29 22:23:05 +0000 2017,Awesome Gold Cup win 2017 by team USA !!! Congratulations !!! https://t.co/onezxn9ceS,95
Sat Jul 29 22:22:33 +0000 2017,old is gold 💛💛  @PMarizzle https://t.co/GaQPMqJ45q,0
Sat Jul 29 22:21:38 +0000 2017,Bronze with gold glitters. ???? https://t.co/QfrSJe1LjD,0
Sat Jul 29 22:20:49 +0000 2017,JINYOON went from SILVER &amp; GOLD to LEMON &amp; TANGERINE. https://t.co/vDdKh0oiiD,5
Sat Jul 29 22:20:43 +0000 2017,Custom Bangle Bracelet-Made of 18k White &amp; Yellow Gold w/ Amethyst and Diamond #bracelet #custom #bangle… https://t.co/O4uBIasUzQ,0
Sat Jul 29 22:19:03 +0000 2017,Shouts to my official gym videographer seanminkwanjeon @ Gold's Gym SoCal https://t.co/ivUJLzstaz,0
Sat Jul 29 22:17:34 +0000 2017,I checked in at Gold's Gym Hollywood on #Yelp https://t.co/VSOcc2bSMD,0
Sat Jul 29 22:16:36 +0000 2017,Just remember...All that glitters is gold✨ https://t.co/D8LQnCgPcA,2
Sat Jul 29 22:15:48 +0000 2017,ICYMI from #AngelsWeekly: Olympic gold medalist @NastiaLiukin throws out the most acrobatic first pitch you'll ever… https://t.co/2ExR1XIdIz,10
Sat Jul 29 22:12:50 +0000 2017,EXTRA DISCOUNT on #iHerb California Gold Nut. SPORT Protein Bar $13.00 OFF - Now $16 99 #RT Discount applied in car… https://t.co/ZxZ5FqP0RR,0
Sat Jul 29 22:12:07 +0000 2017,Solid-gold replica of lunar module stolen from Neil Armstrong museum in Ohio https://t.co/d8tqlPZHyw https://t.co/6a8U3GPW47,42
Sat Jul 29 22:10:33 +0000 2017,I thought he liked gold??,1
Sat Jul 29 22:10:13 +0000 2017,GOLD https://t.co/iO9IIVOOp6,0
Sat Jul 29 22:05:52 +0000 2017,Solid gold around those who are gold plated ✨ https://t.co/jEIUkagQBv,38
Sat Jul 29 22:05:30 +0000 2017,I wanna hold onto the belief that Trump wakes up every morning and looks at himself in some shitty gaudy gold mirro… https://t.co/r2uaWZiSIy,245
Sat Jul 29 22:03:32 +0000 2017,Gold member 🏆 https://t.co/7ahfhqlcLZ,3296
Sat Jul 29 22:03:17 +0000 2017,@scotthoying Omg,300
Sat Jul 29 22:02:15 +0000 2017,A new gold rush is on  sparked by California's post-drought snowmelt https://t.co/vQVZosGeHg,0
Sat Jul 29 22:01:11 +0000 2017,I added a video to a @YouTube playlist https://t.co/nyyOKWCHIO Copper Gold Smokey Eye | Makeup Tutorial | Ashley Brady ♡,0
Sat Jul 29 22:00:36 +0000 2017,A MIGHTY HAPPY BIRTHDAY to the queen  @misty_flores; THE gold standard in friends. Love you lady  hope you have a r… https://t.co/sPB6zuYULW,2
Sat Jul 29 21:59:58 +0000 2017,Pinky Gold Filled Crimpable Chain 18KT Gold Filled Size 17" Long 1.5mm Thic… https://t.co/ygrekCVzpI #gold #GoldTone https://t.co/m7lnCHAOwT,0
Sat Jul 29 21:59:23 +0000 2017,🎶TWO GOLD DOUBLOOOONS!🎶 https://t.co/oRVMj1t0nJ,0
Sat Jul 29 21:59:16 +0000 2017,I'm not at all religious  but I do sincerely believe that wearing a gold chain with a cross on it would be a good look for me.,4
Sat Jul 29 21:57:37 +0000 2017,#ICYMI  watch our NEWEST VIDEO for #VACATION on @YouTube! https://t.co/0aAwiCxsGA #FUTUREFRIENDS https://t.co/5xS82BGGTb,248
Sat Jul 29 21:57:28 +0000 2017,JINYOON went from SILVER &amp; GOLD to LEMON &amp; TANGERINE. https://t.co/vDdKh0oiiD,5
Sat Jul 29 21:55:25 +0000 2017,In April  Trump issued an executive order calling for a review of 27 monuments. Gold Butte is one of them. https://t.co/JV0rt7T8Up,0
Sat Jul 29 21:54:21 +0000 2017,@dangainor Loved your arcticle. Comedy gold.,0
Sat Jul 29 21:52:00 +0000 2017,I need more ppl to get into the comedy gold that is @BridgetandEamon (US check it out in @amazon) so that I can make “choppy-changey” jokes,5
Sat Jul 29 21:51:50 +0000 2017,Check out Lot of Vintage 14K Yellow Gold Earrings  Nuggets  New  Estate Jewelry https://t.co/jlazu8QEyk @eBay,0
Sat Jul 29 21:49:01 +0000 2017,Doomfist's default is gold so is getting his gold weapon even worth,0
Sat Jul 29 21:48:31 +0000 2017,Cosmic Cat - Capricorn - Astral Ace - Jazzy June - Blaze’n Blues - Sagan Spin - Voyage Gold - Memphis Splash... https://t.co/hHoWqrpcAG,0
Sat Jul 29 21:46:48 +0000 2017,Puig. Gold Glove. Has to happen.,6
Sat Jul 29 21:45:17 +0000 2017,Solid-gold replica of lunar module stolen from Neil Armstrong museum in Ohio https://t.co/d8tqlPZHyw https://t.co/6a8U3GPW47,42
Sat Jul 29 21:43:44 +0000 2017,@Barrettbladexxx This thread is like gold   getting some lube and napkins now !!!! 💦💦💦😂😂😂😂,0
Sat Jul 29 21:41:58 +0000 2017,Just remember...All that glitters is gold✨ https://t.co/D8LQnCgPcA,2
Sat Jul 29 21:39:19 +0000 2017,Apparently this is called ROSE GOLD because of course it is. I've never gotten my hair dyed professionally (💸💸💸) but it's very pretty✨,0
Sat Jul 29 21:38:48 +0000 2017,Just remember...All that glitters is gold✨ https://t.co/D8LQnCgPcA,2
Sat Jul 29 21:38:29 +0000 2017,"Don't switch on me I got big plans  we need to forward to the islands and get you gold no spray tans" 🙌🏼👑,56
Sat Jul 29 21:38:03 +0000 2017,...will see #Gold topping $2 200 an ounce within 18 months. https://t.co/h3tZheh4AH,0
Sat Jul 29 21:37:14 +0000 2017,Awesome Gold Cup win 2017 by team USA !!! Congratulations !!! https://t.co/onezxn9ceS,95
Sat Jul 29 21:36:53 +0000 2017,Legends Of Chamberlain Heights is gold man 🤣😂😂😂... you not living if you aint watching it!!,1
Sat Jul 29 21:36:12 +0000 2017,#NowPlaying on @LocalAstronauts ill Camille Black Gold https://t.co/kKZwxj1vx9,0
Sat Jul 29 21:35:55 +0000 2017,NASA  Synthesizers  video-game magic  be all up in this timeline  new information hitting you like a landmine  a beer-fueled rant gold mine!,0
Sat Jul 29 21:35:15 +0000 2017,Dude In The Back 💀 This Is Gold https://t.co/H8jGKWpvvB,0
Sat Jul 29 21:35:04 +0000 2017,@BradIsMyLight Rosde gold? 🌚,0
Sat Jul 29 21:35:00 +0000 2017,Signal boost. This thread is gold! https://t.co/qgzrxT64US,0
Sat Jul 29 21:33:26 +0000 2017,Blacc Gold drops off new video for “Ready” https://t.co/XpqQQfanAJ https://t.co/SLB07WbkKV,6
Sat Jul 29 21:29:17 +0000 2017,Gold Custom Yeezy 2's https://t.co/0o2h1wbne4,0
Sat Jul 29 21:27:13 +0000 2017,USA's Caeleb Dressel became the first swimmer to win three gold medals on a single night at the world championship… https://t.co/XNUe1zFkwG,0
Sat Jul 29 21:25:57 +0000 2017,I wanna hold onto the belief that Trump wakes up every morning and looks at himself in some shitty gaudy gold mirro… https://t.co/r2uaWZiSIy,245
Sat Jul 29 21:25:44 +0000 2017,Anyone in need of a bedtime story? Let me lull you to sleep with this soporific Sleep Story I recorded for @Calm https://t.co/5AYW2S2SJ9,424
Sat Jul 29 21:25:14 +0000 2017,Stephen A. Smith providing more information on the Kyrie &amp; LeBron drama. https://t.co/zLDj4cutG7,50
Sat Jul 29 21:24:59 +0000 2017,The new helmet looks dope af but I still don't understand why they kept the gold on the jerseys. Makes it kind of p… https://t.co/aDHn7i9JjT,0
Sat Jul 29 21:23:53 +0000 2017,Chocolate  gold and chrome by Melbourne-based tech getbuffednails. ✨#NAILPRO https://t.co/ONcjr8OsyY,0
Sat Jul 29 21:23:43 +0000 2017,Four characters in search of riches @latimes. It's Gold Fever in the Sierra. @niemanstory @DRUDGE_REPORT @Longreads https://t.co/gbBrOrCmLX,6
Sat Jul 29 21:23:09 +0000 2017,Radio interview with Marian Gold from NYC!!! https://t.co/OPLA3AG5Kv #WHPC... https://t.co/1ihcjRQRaH,0
Sat Jul 29 21:22:54 +0000 2017,let the waters kiss and transmutate these leaden grudges into gold,0
Sat Jul 29 21:21:27 +0000 2017,Solid gold around those who are gold plated ✨ https://t.co/jEIUkagQBv,38
Sat Jul 29 21:20:27 +0000 2017,Bleed Cardinal and Gold. #FightOn https://t.co/tGZL1Ab56J,191
Sat Jul 29 21:16:11 +0000 2017,Solid-gold replica of lunar module stolen from Neil Armstrong museum in Ohio https://t.co/d8tqlPZHyw https://t.co/6a8U3GPW47,42
Sat Jul 29 21:15:14 +0000 2017,@Momma_Hayes_ hi momma Hayes! Devin is such a blessing! I know he's obsessed w/ fidget spinners so would he like a gold one?💙,0
Sat Jul 29 21:12:38 +0000 2017,This garland made of flowers and greenery beautifully complemented the gold decor  and made for a timeless affair!…… https://t.co/lXISUbJhWC,1
Sat Jul 29 21:12:01 +0000 2017,Solid-gold replica of lunar module stolen from Neil Armstrong museum in Ohio https://t.co/d8tqlPZHyw https://t.co/6a8U3GPW47,42
Sat Jul 29 21:10:48 +0000 2017,Solid gold around those who are gold plated ✨ https://t.co/jEIUkagQBv,38
Sat Jul 29 21:10:21 +0000 2017,Solid-gold replica of lunar module stolen from Neil Armstrong museum in Ohio https://t.co/d8tqlPZHyw https://t.co/6a8U3GPW47,42
Sat Jul 29 21:10:13 +0000 2017,@maruti_bitamin queen 🙌🏽 your homemade gold is the absolute prettiest,0
Sat Jul 29 21:10:08 +0000 2017,ICYMI from #AngelsWeekly: Olympic gold medalist @NastiaLiukin throws out the most acrobatic first pitch you'll ever… https://t.co/2ExR1XIdIz,10
Sat Jul 29 21:08:54 +0000 2017,GOLD_GLOVE_PUIG @ Blue Heaven on Earth https://t.co/yVQCh71tvD,0
Sat Jul 29 21:07:42 +0000 2017,I think Hobbit 3 missed a wonderful chance for another dwarf song when Thorin could have sung about how much he loved gold in the LSD scene.,16
Sat Jul 29 21:07:10 +0000 2017,Solid-gold replica of lunar module stolen from Neil Armstrong museum in Ohio https://t.co/d8tqlPZHyw https://t.co/6a8U3GPW47,42
Sat Jul 29 21:07:02 +0000 2017,Getting her CA Gold Ribbon make up. #Goldribbonschool 🔵🐶🔴#distinguished school,0
Sat Jul 29 21:06:51 +0000 2017,Gold Glove Your Friend,5
Sat Jul 29 21:06:43 +0000 2017,Puig and Turner definitely deserve gold gloves this season... I can see Puig getting one but Turner should be considered too,0
Sat Jul 29 21:05:06 +0000 2017,Solid gold around those who are gold plated ✨ https://t.co/jEIUkagQBv,38
Sat Jul 29 21:03:49 +0000 2017,Late-night writers find Trump era &amp;apos;exhausting&amp;apos; comedy gold https://t.co/mfHjG3fVkF https://t.co/RgDMkpsT9Y,0
Sat Jul 29 21:02:56 +0000 2017,ICYMI from #AngelsWeekly: Olympic gold medalist @NastiaLiukin throws out the most acrobatic first pitch you'll ever… https://t.co/2ExR1XIdIz,10
Sat Jul 29 21:02:41 +0000 2017,Jaden smith in pothole is pure gold,0
Sat Jul 29 21:02:15 +0000 2017,@TwinklesDC @Khay_Gold Should be learn to forgive rude people.. Ignoring means you pity their existence. We are here to love.,0
Sat Jul 29 21:02:05 +0000 2017,What it's like to be a comedy writer during the Trump era https://t.co/Ar4FtHVvN8,0
Sat Jul 29 21:01:43 +0000 2017,3rd map against kids competing for their first gold. they are trying VERY hard https://t.co/cZUNbXoc0i,0
Sat Jul 29 21:01:35 +0000 2017,Ireland's Sarah Healy Wins 1500m Gold At Euro Youth Olymics  phenomenal performance leading from 600 + PB!  https://t.co/cuJrPhwUU7,0
Sat Jul 29 21:01:26 +0000 2017,If a spoon were made of gold would it still be considered silverware?,0
Sat Jul 29 21:00:21 +0000 2017,Everything that shines ain't always gonna be gold. It could be a brown  a rainbow  a brook https://t.co/aBnHwFhnT7… https://t.co/Zqq2RiFGcE,0
Sat Jul 29 21:00:12 +0000 2017,Happiness resides not in possessions  and not in gold  happiness dwells in the soul. #actorsflowlife #actorsgoal… https://t.co/M2lipWkuyW,0
Sat Jul 29 20:59:59 +0000 2017,18k Gold Filled Micro Pave Beads Size 8x6mm with Clear CZ Cubic Zircon … https://t.co/zWcJfaixTW #gold #DiamondBeads https://t.co/fTnnyixnac,0
Sat Jul 29 20:59:15 +0000 2017,This outspoken firecracker with a heart of gold left us too soon.  #PatsyCline #Vinyl #music… https://t.co/fV1mIEpzzL,0
Sat Jul 29 20:58:26 +0000 2017,California's post-drought snowmelt has sparked a new gold rush https://t.co/loi2dQPBCm https://t.co/bdp05fPfiV,61
Sat Jul 29 20:57:04 +0000 2017,Solid-gold replica of lunar module stolen from Neil Armstrong museum in Ohio https://t.co/uezd9vc2fI,0
Sat Jul 29 20:56:22 +0000 2017,Clip on Earring Finding 18K Gold Filled Size 19x15x9mm to make your ow… https://t.co/f61i8W1Cfa #goldfilled #Clip-On https://t.co/rC1qjvatD9,1
Sat Jul 29 20:55:59 +0000 2017,Send us your Gold tracks and we'll send them back Platinum. | https://t.co/rM4eWFhzaE #MixMasterMyTracks https://t.co/lzR5DQfyTP,0
Sat Jul 29 20:53:11 +0000 2017,Zodwa WaBantu’s Zimbabwean Twin Strikes Gold - Companies Start Sponsoring Her Read more at https://t.co/nOy7vXr7nz,0
Sat Jul 29 20:52:46 +0000 2017,I just added this to my closet on Poshmark: ✨18KT GOLD PLATED CRYSTAL RING✨. https://t.co/J4lKoh09x3 via @poshmarkapp #shopmycloset,0
Sat Jul 29 20:52:12 +0000 2017,Solid-gold replica of lunar module stolen from Neil Armstrong museum in Ohio https://t.co/d8tqlPZHyw https://t.co/6a8U3GPW47,42
Sat Jul 29 20:50:33 +0000 2017,Solid-gold replica of lunar module stolen from Neil Armstrong museum in Ohio - LA Times https://t.co/9QVBsA9tPf,0
