Sat Jul 29 16:22:39 +0000 2017,California's post-drought snowmelt has sparked a new gold rush https://t.co/loi2dQPBCm https://t.co/bdp05fPfiV,61
Sat Jul 29 16:22:06 +0000 2017,People have started literally eating gold and I've never wanted the dollar to collapse so badly. https://t.co/1VZYuUGHro,471
Sat Jul 29 16:21:55 +0000 2017,@realDonaldTrump Is it true that the first 1 000 to sign up for #Trumpcare get a faux gold plated rectal thermometer w/ your photo on it?,0
Sat Jul 29 16:21:03 +0000 2017,I wanna hold onto the belief that Trump wakes up every morning and looks at himself in some shitty gaudy gold mirro… https://t.co/r2uaWZiSIy,245
Sat Jul 29 16:19:33 +0000 2017,I drew the line at ten eye-crossings halfway through the tweet.  What the hell do we need here - a giant  gold INSA… https://t.co/9ITbpGIaqx,5
Sat Jul 29 16:18:53 +0000 2017,AHAHAHAHHA I JUST LAUGHED OUT LOUD ON THE PLANE AND EVERYONE LOOKED AT ME OMG THIS IS GOLD https://t.co/0baMcpQfLF,156
Sat Jul 29 16:18:30 +0000 2017,@RoseClexa @amyordman Start the second season first. Then go back and watch season one. Trust me. Season two is next level. It's gold,0
Sat Jul 29 16:16:17 +0000 2017,@devinlopezz Asap,0
Sat Jul 29 16:16:12 +0000 2017,90 casino free spins at Club Gold Casino Bet  Htags: #casinonamegenerator #casinowifetumblr ... https://t.co/nflw4LHlLu,0
Sat Jul 29 16:15:59 +0000 2017,Gold chain,0
Sat Jul 29 16:15:05 +0000 2017,I wanna hold onto the belief that Trump wakes up every morning and looks at himself in some shitty gaudy gold mirro… https://t.co/r2uaWZiSIy,245
Sat Jul 29 16:14:59 +0000 2017,I wanna hold onto the belief that Trump wakes up every morning and looks at himself in some shitty gaudy gold mirro… https://t.co/r2uaWZiSIy,245
Sat Jul 29 16:14:29 +0000 2017,California's post-drought snowmelt has sparked a new gold rush https://t.co/loi2dQPBCm https://t.co/bdp05fPfiV,61
Sat Jul 29 16:13:33 +0000 2017,California's post-drought snowmelt has sparked a new gold rush https://t.co/loi2dQPBCm https://t.co/bdp05fPfiV,61
Sat Jul 29 16:11:42 +0000 2017,if these walls could talk  i can feel your reign when it cries gold lives inside of you,2
Sat Jul 29 16:11:36 +0000 2017,California's post-drought snowmelt has sparked a new gold rush https://t.co/loi2dQPBCm https://t.co/bdp05fPfiV,61
Sat Jul 29 16:11:19 +0000 2017,📷 #Vintage #Gold #Sequins Purse #Chain #Handle Clutch Evening #Handbag #clutch ❤Faith❤❁DarlingDarla... https://t.co/MN74rwJYHi,11
Sat Jul 29 16:10:13 +0000 2017,California's post-drought snowmelt has sparked a new gold rush https://t.co/loi2dQPBCm https://t.co/bdp05fPfiV,61
Sat Jul 29 16:10:10 +0000 2017,if these walls could talk  i can feel your reign when it cries gold lives inside of you,2
Sat Jul 29 16:10:06 +0000 2017,Easy to find the dirt in people  be the person who finds the gold 👐🏼 https://t.co/Tcg539rSjC,0
Sat Jul 29 16:08:18 +0000 2017,EUR 265 free no deposit at Club Gold Gambling Casino  Htags: #onlinecasinogame ... https://t.co/kAd6gHDbOe,0
Sat Jul 29 16:07:59 +0000 2017,We're excited to announce our MYBAT TUFF Hybrid Galaxy On7 Case - Rose Gold/Black at https://t.co/9LPOeNxL6J Sale i… https://t.co/Wxmcs4SXTr,0
Sat Jul 29 16:06:55 +0000 2017,California's post-drought snowmelt has sparked a new gold rush https://t.co/loi2dQPBCm https://t.co/bdp05fPfiV,61
Sat Jul 29 16:05:37 +0000 2017,Last week's order: Pink &amp; Gold Baby Shower Treats.  I used a pre-mix candyfetti sprinkles and… https://t.co/Zjizof4o0l,0
Sat Jul 29 16:05:02 +0000 2017,📷 #Vintage #Gold #Sequins Purse #Chain #Handle Clutch Evening #Handbag #clutch ❤Faith❤❁DarlingDarla... https://t.co/MN74rwJYHi,11
Sat Jul 29 16:04:44 +0000 2017,📷 #Vintage #Gold #Sequins Purse #Chain #Handle Clutch Evening #Handbag #clutch ❤Faith❤❁DarlingDarla... https://t.co/MN74rwJYHi,11
Sat Jul 29 16:03:30 +0000 2017,Solid 14K Yellow Gold "Bling Bling Boy" Pendant Partially Iced Out In VS+ Diamonds. Custom made for… https://t.co/luNT1OqsGw,1099
Sat Jul 29 16:03:19 +0000 2017,California's post-drought snowmelt has sparked a new gold rush https://t.co/loi2dQPBCm https://t.co/bdp05fPfiV,61
Sat Jul 29 16:03:13 +0000 2017,@lifeasce Or you just paid the medicines cost AND bought a new gold iwatch,0
Sat Jul 29 16:03:08 +0000 2017,Now I ain't saying she a gold digger  but she did move west to California in 1849  so....,4
Sat Jul 29 16:02:51 +0000 2017,Rose gold Wedding Rings  Diamond Wedding Band  Rose Gold Wedding… by BridalRings via @Etsy https://t.co/hkXathOD2x,0
Sat Jul 29 16:02:45 +0000 2017,People of Genovia: It looks like Princess Mia Thermopolis may have room in her diary for one more chapter:… https://t.co/byoKAtVeDd,21339
Sat Jul 29 16:02:35 +0000 2017,Vintage Gold Sequins Purse Chain Handle Clutch Evening Handbag #clutch ❤Faith❤❁DarlingDarla Paris❀✿… https://t.co/Ww7CvDVLKW,1
Sat Jul 29 16:02:04 +0000 2017,California's post-drought snowmelt has sparked a new gold rush https://t.co/loi2dQPBCm https://t.co/bdp05fPfiV,61
Sat Jul 29 16:01:28 +0000 2017,https://t.co/Ov4ATKlKw6    4 tier 4 flavored cake with gold diamond ribbon on the bottom. Finished with... https://t.co/HIFmuj2RlP,0
Sat Jul 29 15:59:58 +0000 2017,18K Rose Gold Filled Chain 23" Inch CG75 https://t.co/O9aPJnan7h #gold #NecklaceChain https://t.co/gQUkCM5GNV,1
Sat Jul 29 15:59:45 +0000 2017,Follow us on Twitter to see new products &amp; sales. Check out our products: https://t.co/QH9XBLAaUr #etsy #etsyseller… https://t.co/9v5so5uzCC,0
Sat Jul 29 15:59:44 +0000 2017,Kim Viera - "Gold Lining" https://t.co/jfc3lmdG48 https://t.co/2Z5qDEUhdF,0
Sat Jul 29 15:57:06 +0000 2017,❤Faith❤❁DarlingDarla Paris❀✿ Vintage Gold Sequins Purse Chain Handle Clutch Evening Handbag #Clutch https://t.co/q91KSRDv11 via @eBay,1
Sat Jul 29 15:55:25 +0000 2017,I added a video to a @YouTube playlist https://t.co/d1bVGTcTfI TALKING TOM GOLD RUN NEW COWBOY ANGELA FULL SCREEN GAMEPLAY,0
Sat Jul 29 15:53:21 +0000 2017,Black Gold Out Now!!!!!!!!!! 😳😳😳😳😳😳✊🏿✊🏿✊🏿💯💯💯🔥🔥🔥With the release of SAID's 5th project  he hopes… https://t.co/ARFjr0CrKQ,3
Sat Jul 29 15:53:06 +0000 2017,Is there gold✨on this?   @sugarbloomla #chocolate #hazelnut #croissant 🥐#😋 @ Alfred Coffee… https://t.co/GsYMatCj1F,1
Sat Jul 29 15:50:32 +0000 2017,Adorable Vintage Crystal Towel Jewelry Holder Brass Gold Plated 9" | eBay  https://t.co/fhYPqwYdiu (Tweeted via… https://t.co/C44JR1IKSa,4
Sat Jul 29 15:49:42 +0000 2017,España cae con EEUU y se queda con plata mundial en waterpolo femenil #USA - Congrats to the US #WomensChampion… https://t.co/gkT8miGsEl,0
Sat Jul 29 15:49:19 +0000 2017,Lifetime has greenlit a biopic about Olympic gold medalist @Simone_Biles https://t.co/j3zUyCucJF https://t.co/mfHvKBt6l5,25
Sat Jul 29 15:45:28 +0000 2017,Most Girls is now certified gold in Australia!! 🇦🇺 Congratulations 🎉@HaileeSteinfeld ❤️👑 https://t.co/okHbgSC6g7,1
Sat Jul 29 15:43:54 +0000 2017,Good morning! Did anyone sleep last night? Living that feeds gold life!! #BB19 #BBLF https://t.co/HjRYbVPsXf,0
Sat Jul 29 15:43:38 +0000 2017,Oh yes we did! ✨NEW ITEM✨ clear quartz permanently infused with 24K gold (yes  real gold) these pieces ✨BLING BLOW✨… https://t.co/OAmwobmFot,35
Sat Jul 29 15:40:45 +0000 2017,This is gold. Happy birthday Lil KD @Brendon_BDavis https://t.co/A7g6GmSgk2,0
Sat Jul 29 15:40:33 +0000 2017,Gold at key juncture. Pushed above 200 day moving average recently  and the 50 and 100 today. Coiling just below 5 year downtrend line  too.,145
Sat Jul 29 15:39:37 +0000 2017,@Scaramucci Open mic night is Monday but your tweets are comedy gold any day of the week #swampdweller,0
Sat Jul 29 15:39:07 +0000 2017,I wanna hold onto the belief that Trump wakes up every morning and looks at himself in some shitty gaudy gold mirro… https://t.co/r2uaWZiSIy,245
Sat Jul 29 15:37:21 +0000 2017,"Don't switch on me I got big plans  we need to forward to the islands and get you gold no spray tans" 🙌🏼👑,56
Sat Jul 29 15:36:59 +0000 2017,Check out X &amp; O DIAMOND TENNIS BRACELET GOLD OVER STERLING https://t.co/2gIHa3VtPW @eBay,0
Sat Jul 29 15:36:59 +0000 2017,Looking for a best deal? It's a good time to check our MYBAT TUFF Hybrid Galaxy On7 Case - Phoenix Flower/2D Rose G… https://t.co/zejdmzUz2E,0
Sat Jul 29 15:36:41 +0000 2017,Check out 1927 VINTAGE ART DECO 18K WHITE GOLD BAND RING BELAISE ORNATE RIMS SIZE 7 1/2 -8 https://t.co/wQZ2THjbxG @eBay,0
Sat Jul 29 15:36:07 +0000 2017,Check out  Vintage Gold Sequins Purse Chain Handle Clutch Evening Handbag #Unbranded #Clutch https://t.co/q91KSRDv11 via @eBay,1
Sat Jul 29 15:35:35 +0000 2017,I know. I heard Versace getting credit  but that is not true. MJ designed the gold suit. Thompson-Bush made it. https://t.co/j0ib2QPNe5,16
Sat Jul 29 15:34:44 +0000 2017,Fleetwood Mac - Gold Dust Woman. Because Fleetwood Mac and this song  are perfection. Source by foxface412 Famous... https://t.co/czngailzoD,0
Sat Jul 29 15:33:31 +0000 2017,California's post-drought snowmelt has sparked a new gold rush https://t.co/loi2dQPBCm https://t.co/bdp05fPfiV,61
Sat Jul 29 15:32:56 +0000 2017,“@BradBurke_: @jeremypiven please tell me your like Ari Gold in real life..would break my heart if you weren't"  sorry to break your heart.,36
Sat Jul 29 15:32:02 +0000 2017,Rose Gold Giveaway https://t.co/nd8eVbA8QW,0
Sat Jul 29 15:31:42 +0000 2017,Dehasse - Reaction (Alex Gold Adam K &amp; Soha Bringing It #NowPlaying https://t.co/ubb0Tw97QF,0
Sat Jul 29 15:31:16 +0000 2017,I know. I heard Versace getting credit  but that is not true. MJ designed the gold suit. Thompson-Bush made it. https://t.co/j0ib2QPNe5,16
Sat Jul 29 15:31:01 +0000 2017,look how happy my rose gold princess looks!! seeing you happy &amp; smiling means a lot to me😢💗 @gabcake https://t.co/7MHYNrVk8B,0
Sat Jul 29 15:30:30 +0000 2017,@justCeed Es sind nur 2 gute Teams dabei  shun dbann rehlentful und das andere shawty zkanacke und j7lez oder so  W… https://t.co/kxwmEoX44K,0
Sat Jul 29 15:30:01 +0000 2017,WEEKEND SALE ALERT ‼️ Get free US shipping all weekend by using our code: FREEWKND   https://t.co/9HpjIEq2g7 https://t.co/JMjD9GcEQx,0
Sat Jul 29 15:28:38 +0000 2017,Check out RUBY HEART PENDANT GOLD OVER STERLING https://t.co/yoFc5tndLa @eBay,0
Sat Jul 29 15:28:29 +0000 2017,Check out PRETTY HEART SHAPED CZ PENDANT gold over sterling https://t.co/VL3XMsadLF @eBay,0
Sat Jul 29 15:28:02 +0000 2017,Check out GOLD CROSS PENDANT ON CHAIN https://t.co/Hev4pOzxiv @eBay,0
Sat Jul 29 15:26:29 +0000 2017,Nike Kyrie 3 Black Metallic Gold https://t.co/ShY68WISRQ,0
Sat Jul 29 15:26:23 +0000 2017,Check out GOLD KEY PENDANT https://t.co/PULmy1BeUu @eBay,0
Sat Jul 29 15:25:07 +0000 2017,King Throne Royal Gold PSD Template: https://t.co/hVDiPsRE5Z  #Template #CoverTemplate #Cover #beatmaker https://t.co/mj4rPFffJ6,0
Sat Jul 29 15:25:03 +0000 2017,[ 18% OFF ] https://t.co/CHOWfskkKL Mukun Luxury Women Dubai Gold-Color Jewelry Sets Fashion Nigerian Wedding Afric… https://t.co/LREYWFFzga,0
Sat Jul 29 15:24:40 +0000 2017,Narrator Voice: A dangerous gamma radiation leak on TV Hill turned this mild mannered anchor into the Gold Captain … https://t.co/pg7h84rKqd,0
Sat Jul 29 15:23:13 +0000 2017,Ich sag entweder heute Gold oder first round hahaha,0
Sat Jul 29 15:22:42 +0000 2017,KOBE BRYANT NATIONAL TREASURES 3 COLOR PATCH GOLD /25.. SWEET..! https://t.co/YdxE5dslPd,0
Sat Jul 29 15:22:19 +0000 2017,what in the name of Phoenix Wright https://t.co/NNxs3ONQnu,954
Sat Jul 29 15:21:31 +0000 2017,Beautiful 10 1/4 Hand Decorated Embossed Gold-Trimmed https://t.co/kSSflVfdVF via @Etsy,0
Sat Jul 29 15:20:24 +0000 2017,@realDonaldTrump Gold Backed Currency. You say you are a doer then do it. Or you are like all the others,0
Sat Jul 29 15:16:19 +0000 2017,man i just wanna go flex gold on my teeth and on my neck 🤙💪,0
Sat Jul 29 15:16:02 +0000 2017,This man's mind is gold https://t.co/LplHCVf2Wk,0
Sat Jul 29 15:16:02 +0000 2017,[ 46 $ OFF ] https://t.co/wcXTo7WS4T #Polished Wholesale Promotion Premium Luxurious Gold Three Holes Basin Mixer T… https://t.co/V16ZtQwl6m,0
Sat Jul 29 15:12:53 +0000 2017,if these walls could talk  i can feel your reign when it cries gold lives inside of you,2
Sat Jul 29 15:12:43 +0000 2017,Hoses are gold chrysantemums are darkcyan sugar is sweet and so on,0
Sat Jul 29 15:10:43 +0000 2017,I wanna hold onto the belief that Trump wakes up every morning and looks at himself in some shitty gaudy gold mirro… https://t.co/r2uaWZiSIy,245
Sat Jul 29 15:08:41 +0000 2017,Baby be my diamonds &amp; gold,1
Sat Jul 29 15:07:31 +0000 2017,Lifetime has greenlit a biopic about Olympic gold medalist @Simone_Biles https://t.co/0Td5AZIhyl #JKMETROMEDIATALENT,0
Sat Jul 29 15:06:51 +0000 2017,RT THIS TWEET &amp; FOLLOW ME to win this Gold iPad Pro!🙌🏼 Ends 3/1/16   Info/video here: https://t.co/14rBG1D5fK https://t.co/PoxGANYKH2,24635
Sat Jul 29 15:06:00 +0000 2017,Brand new MYBAT TUFF Hybrid Galaxy On7 Case - Lace Flowers/2D Rose Gold is now available at our store. Hurry up  an… https://t.co/WPg04WUdJA,0
Sat Jul 29 15:03:21 +0000 2017,@DraftTulsi No one has asked Bernie or Tulsi this question because many that are "still Democrats" won't let go of… https://t.co/HBouRf3qxv,0
Sat Jul 29 15:00:40 +0000 2017,Rose Gold is currently trending! This rose gold solitaire bezel set diamond ring adds the perfect minimal and daint… https://t.co/W6Tvn9MdV1,0
Sat Jul 29 15:00:02 +0000 2017,404 Not Found https://t.co/hY0kyc2cqy,0
Sat Jul 29 14:59:59 +0000 2017,★ ★ ★ ★ ★  When we first https://t.co/1g9WJ6mokZ,0
Sat Jul 29 14:58:30 +0000 2017,I drew the line at ten eye-crossings halfway through the tweet.  What the hell do we need here - a giant  gold INSA… https://t.co/9ITbpGIaqx,5
Sat Jul 29 14:54:50 +0000 2017,@TrueFactsStated @AGSchneiderman Sounds about right from Mr. Grab em by the Pussy  gold medalist in water sports.,0
Sat Jul 29 14:54:07 +0000 2017,RT @kendricklamar: LOYALTY. https://t.co/4qDTrnoUIC !!,45
Sat Jul 29 14:52:44 +0000 2017,Don't know @NicolaAdamsOBE ? you should #boxing #women #excerpt https://t.co/xEH6NxqIo8,6
Sat Jul 29 14:52:02 +0000 2017,[ 71 $ OFF ] https://t.co/X2RnTLr1St #Faucets Wholesale Premium Solid Brass Luxurious Exposed Gold Bathroom Shower… https://t.co/lpdhTGuSz0,0
Sat Jul 29 14:51:59 +0000 2017,https://t.co/gyKMP5e7GF,0
Sat Jul 29 14:48:54 +0000 2017,Quit Callin Women ✨Gold Diggers✨✋ Yall dont even be having no money 👀💯😂,0
Sat Jul 29 14:47:46 +0000 2017,Black Gold Out Now!!!!!!!!!! 😳😳😳😳😳😳✊🏿✊🏿✊🏿💯💯💯🔥🔥🔥With the release of SAID's 5th project  he hopes… https://t.co/ARFjr0CrKQ,3
Sat Jul 29 14:45:56 +0000 2017,Lifetime has greenlit a biopic about Olympic gold medalist @Simone_Biles https://t.co/j3zUyCucJF https://t.co/mfHvKBt6l5,25
Sat Jul 29 14:44:37 +0000 2017,Lifetime has greenlit a biopic about Olympic gold medalist @Simone_Biles https://t.co/j3zUyCucJF https://t.co/mfHvKBt6l5,25
Sat Jul 29 14:43:57 +0000 2017,I drew the line at ten eye-crossings halfway through the tweet.  What the hell do we need here - a giant  gold INSA… https://t.co/9ITbpGIaqx,5
Sat Jul 29 14:43:01 +0000 2017,Hand out gold stars like they're going out of style ⭐️⭐️⭐️ #edtech #earlyed #edchat https://t.co/QaK6PXKtoi,0
Sat Jul 29 14:41:52 +0000 2017,A new gold rush is on  sparked by California’s post-drought snowmelt - Los Angeles Times https://t.co/74DJZD0IsA,0
Sat Jul 29 14:41:37 +0000 2017,I drew the line at ten eye-crossings halfway through the tweet.  What the hell do we need here - a giant  gold INSA… https://t.co/9ITbpGIaqx,5
Sat Jul 29 14:40:47 +0000 2017,I drew the line at ten eye-crossings halfway through the tweet.  What the hell do we need here - a giant  gold INSA… https://t.co/9ITbpGIaqx,5
Sat Jul 29 14:36:11 +0000 2017,I think it's the new currency for the one world order. Everything electronic now. I prefer gold coins. https://t.co/az3vfpjHF6,0
Sat Jul 29 14:36:09 +0000 2017,Follow spree?☺️ Anyone? Rt😏,3471
Sat Jul 29 14:34:46 +0000 2017,I wanna hold onto the belief that Trump wakes up every morning and looks at himself in some shitty gaudy gold mirro… https://t.co/r2uaWZiSIy,245
Sat Jul 29 14:33:31 +0000 2017,Swimming in gold and rich colors  this dreamy digital work combines elegance with allure. https://t.co/BqITjNXeDt https://t.co/bY0AcAJhDD,104
Sat Jul 29 14:30:56 +0000 2017,Earned 4 PSN trophies (1 gold and 3 bronze) in Bridge Constructor - https://t.co/L19uLZ4o8h,0
Sat Jul 29 14:28:28 +0000 2017,California's post-drought snowmelt has sparked a new gold rush https://t.co/loi2dQPBCm https://t.co/bdp05fPfiV,61
Sat Jul 29 14:25:32 +0000 2017,Someone behind me is mirin.  📸: @nedimvrabacgym 🙏🏻 #beavisionary #workfuckingharder @ Gold's Gym https://t.co/41FnAbVt0J,0
Sat Jul 29 14:23:48 +0000 2017,New Video up! Here's my cover of Fields Of Gold by @OfficialSting. Love this song so much &lt;3 https://t.co/HMl1Vo47UN https://t.co/df0UlYFHIE,26
Sat Jul 29 14:21:07 +0000 2017,Lifetime has greenlit a biopic about Olympic gold medalist @Simone_Biles https://t.co/j3zUyCucJF https://t.co/mfHvKBt6l5,25
Sat Jul 29 14:20:42 +0000 2017,Personalized Bar Bracelet Dainty Bracelet Gold Bar Bracelet Bridesmaid gifts Anniversary… https://t.co/QBCWLArroO https://t.co/QPQGn3QwqK,0
Sat Jul 29 14:19:55 +0000 2017,Over 500 000 albums sold in Central America! Congrats @juanes on going GOLD! 📀#misplanessonamarte https://t.co/oPQnTbPUSa,4
Sat Jul 29 14:19:11 +0000 2017,.@Cardale7_ will wear # 5️⃣.  Can't wait to see him in the blue and gold⚡️,189
Sat Jul 29 14:17:16 +0000 2017,Essential California: A new gold rush is on  sparked by California’s post-drought snowmelt https://t.co/o3O8leH2Bk https://t.co/tUu1fW7BA9,0
Sat Jul 29 14:16:00 +0000 2017,Trying to give @ira his cake but @jonlovett won't shut up https://t.co/SuiDoS7mA3,23
Sat Jul 29 14:11:12 +0000 2017,me explaining to North Korea why i should live:  https://t.co/TS76F2c7BK,1987
Sat Jul 29 14:07:28 +0000 2017,Painted gold by edtheartist http://t.co/3zDZpyvKLF,127
Sat Jul 29 14:05:58 +0000 2017,Comedians at the Just for Laughs comedy festival are mixed on the value of mocking President Trump.#fcimages.net ... https://t.co/TLTNrGmNqa,0
Sat Jul 29 14:05:20 +0000 2017,California's post-drought snowmelt has sparked a new gold rush https://t.co/loi2dQPBCm https://t.co/bdp05fPfiV,61
Sat Jul 29 14:04:18 +0000 2017,@DearAuntCrabby @funder @DarkMission1 @realDonaldTrump No matter how much gold or money you stick on this man  he'l… https://t.co/svd2Zx2VcV,0
Sat Jul 29 14:04:13 +0000 2017,Dogeared Reminders-“Guardian Ange” Gold Dipped Sterling Silver Angel Wings Charm Necklace … https://t.co/4J6kPvB2mO https://t.co/0Z9oAkOqpd,0
Sat Jul 29 14:00:29 +0000 2017,Satirist-In-Chief: Anthony Atamanuik Mines Trump's Darkness For Comedic Gold https://t.co/1YWLvjtVs0,0
Sat Jul 29 13:59:30 +0000 2017,me when my man is laying down https://t.co/ZpSZRzZpxQ,8
Sat Jul 29 13:59:20 +0000 2017,Dropping sz 9.5 10.5 Nike AM97 Gold from cart now https://t.co/nPCf0V6OaT,0
Sat Jul 29 13:57:03 +0000 2017,It's an understatement to say these rose gold J.Crew pieces are pretty https://t.co/zEtN6FQqQ3,5
Sat Jul 29 13:56:37 +0000 2017,fields of gold 🌾🌾🌾🌾🌾 https://t.co/ZgpTuq6Wax,18
Sat Jul 29 13:56:33 +0000 2017,HILL ST. 14k Yellow Gold Classic Engagement or Wedding Ring https://t.co/0jV2aiHnKn via @Etsy,0
Sat Jul 29 13:55:46 +0000 2017,Vintage Style 18k Yellow Gold Classic Engagement or Wedding https://t.co/Vxwb06BnCp via @Etsy,0
Sat Jul 29 13:53:32 +0000 2017,QUEEN  14k Rose Gold Antique Engagement or Wedding Ring with https://t.co/gcNJ3Qxdz3 via @Etsy,0
Sat Jul 29 13:53:12 +0000 2017,14k Rose Gold-Stud Earrings with Diamond and Pink Sapphire https://t.co/IbjpOoW97R via @Etsy,0
Sat Jul 29 13:51:43 +0000 2017,Black Caviar-14k Rose Gold Classic Engagement or Wedding Band https://t.co/QhUiOrPReQ via @Etsy,0
Sat Jul 29 13:50:23 +0000 2017,Rolls Royce Dawn ⚪️⚫️ GFG Wheels • FM911 • Rose Gold 🔥 #giovannawheels #giovanna #rollsroyce… https://t.co/q5IrJUMeaP,0
Sat Jul 29 13:48:59 +0000 2017,Trap Gun Gold CD Mixtape Cover PSD Template:  https://t.co/M1FZqWni3n  #Template  #CoverTemplate  #beatmaker https://t.co/pUihwYt2E4,1
Sat Jul 29 13:46:50 +0000 2017,Awesome Gold Cup win 2017 by team USA !!! Congratulations !!! https://t.co/onezxn9ceS,95
Sat Jul 29 13:41:29 +0000 2017,@Amplifyde_ I said "hes going top gold" &amp; it woke him up😂 he was like "babeeee im sleeping what are you doing" 😂,0
Sat Jul 29 13:32:02 +0000 2017,Trap Gun Gold CD Mixtape Cover PSD Template:  https://t.co/M1FZqWni3n  #Template  #CoverTemplate  #beatmaker https://t.co/pUihwYt2E4,1
Sat Jul 29 13:29:51 +0000 2017,I wanna hold onto the belief that Trump wakes up every morning and looks at himself in some shitty gaudy gold mirro… https://t.co/r2uaWZiSIy,245
Sat Jul 29 13:29:20 +0000 2017,#Bracelets #Flakes #Orb #Rose #Statement-Cuff #Yellow #jewellery https://t.co/KjH3X8vaO1 #Gold #Globe #Resin Statement Cuff #Sun ...,0
Sat Jul 29 13:29:02 +0000 2017,This Pollyseeds album is incredible. @terracemartin turns everything he touches in to gold. That man is blessed.,2
Sat Jul 29 13:28:01 +0000 2017,@SouthieJack Was he playing a gold fiddle with Charlie Daniels?,0
Sat Jul 29 13:24:56 +0000 2017,I wanna hold onto the belief that Trump wakes up every morning and looks at himself in some shitty gaudy gold mirro… https://t.co/r2uaWZiSIy,245
Sat Jul 29 13:20:49 +0000 2017,Most Girls is now certified gold in Australia!! 🇦🇺 Congratulations 🎉@HaileeSteinfeld ❤️👑 https://t.co/okHbgSC6g7,1
Sat Jul 29 13:17:34 +0000 2017,California's post-drought snowmelt has sparked a new gold rush https://t.co/loi2dQPBCm https://t.co/bdp05fPfiV,61
Sat Jul 29 13:16:19 +0000 2017,Watch Caeleb Dressel's American Record  100 Free Gold  In Budapest (Race Video) https://t.co/H2jowCbrFu,3
Sat Jul 29 13:15:21 +0000 2017,Essential California: A new gold rush is on  sparked by California’s post-drought snowmelt https://t.co/70RgSJsct2,0
Sat Jul 29 13:11:43 +0000 2017,Essential California: A new gold rush is on  sparked by California's post-drought snowmelt #LATimes https://t.co/MdrLFCD4GV,0
Sat Jul 29 13:08:30 +0000 2017,Essential California: A new gold rush is on  sparked by California’s post-drought snowmelt https://t.co/6Y6055UwxL,0
Sat Jul 29 13:08:05 +0000 2017,I wanna hold onto the belief that Trump wakes up every morning and looks at himself in some shitty gaudy gold mirro… https://t.co/r2uaWZiSIy,245
Sat Jul 29 13:08:00 +0000 2017,Exclusive Preview | Marvel's 'X-Men Gold' # 9 https://t.co/WQcKjHyydK,58
Sat Jul 29 13:04:27 +0000 2017,California's post-drought snowmelt has sparked a new gold rush https://t.co/loi2dQPBCm https://t.co/bdp05fPfiV,61
Sat Jul 29 13:03:03 +0000 2017,GOLD PINK BLACK WHITE .,0
Sat Jul 29 13:02:28 +0000 2017,Smokey gold eye makeup. ?? https://t.co/uddHcJsfkS,0
Sat Jul 29 13:01:57 +0000 2017,Looking for a best deal? It's a good time to check our MYBAT TUFF Holster Combo Galaxy On7 Case - Rose Gold/Rose Go… https://t.co/89SjmYOeby,0
Sat Jul 29 13:01:37 +0000 2017,I wanna hold onto the belief that Trump wakes up every morning and looks at himself in some shitty gaudy gold mirro… https://t.co/r2uaWZiSIy,245
Sat Jul 29 13:00:16 +0000 2017,@realDonaldTrump "Yes chief its true  as far as I can tell Trump has an extremely small penis made of Russian gold.… https://t.co/yCD84O5fsm,0
Sat Jul 29 13:00:06 +0000 2017,#gold prices rose as Federal Reserve lowered expectations of an interest rate hike lowering US dollar #WeekInReview https://t.co/tCNkL31fQY,0
Sat Jul 29 13:00:04 +0000 2017,How to beautify skin  hair  nails eyelashes. ¡¡¡ERASE 10 YEARS!!! https://t.co/LbgEVL8frv #healt #Salud https://t.co/V19pUFmg6v,0
Sat Jul 29 12:59:58 +0000 2017,1.5mm Gold Filled Chain 18K GFC011 Sold by Foot https://t.co/k3vb1qHNP3 #goldfilled #18kGold https://t.co/XsahrfY8VI,0
Sat Jul 29 12:58:32 +0000 2017,Jozy Altidore! 😱  The #USMNT has the halftime lead thanks to this wonderful free kick. @ModeloUSA #ModeloSoccer https://t.co/yyVCQ1sdXr,1118
Sat Jul 29 12:54:40 +0000 2017,Sure she's strong. Gold diggers must be tough to mine through his crap and withstand the tedious rants of a man bab… https://t.co/0D7cJM5idI,2
Sat Jul 29 12:53:16 +0000 2017,California's post-drought snowmelt has sparked a new gold rush https://t.co/VBbomYHRtu,0
Sat Jul 29 12:45:15 +0000 2017,Essential California: A new gold rush is on  sparked by California’s post-drought snowmelt https://t.co/sgKWaRmytb https://t.co/y37Yq1V9ga,0
Sat Jul 29 12:45:10 +0000 2017,Essential California: A new gold rush is on  sparked by California’s post-drought snowmelt https://t.co/n4ISjJeALD,0
Sat Jul 29 12:44:57 +0000 2017,I wanna hold onto the belief that Trump wakes up every morning and looks at himself in some shitty gaudy gold mirro… https://t.co/r2uaWZiSIy,245
Sat Jul 29 12:43:15 +0000 2017,California's post-drought snowmelt has sparked a new gold rush https://t.co/loi2dQPBCm https://t.co/bdp05fPfiV,61
Sat Jul 29 12:42:52 +0000 2017,Sure she's strong. Gold diggers must be tough to mine through his crap and withstand the tedious rants of a man bab… https://t.co/0D7cJM5idI,2
Sat Jul 29 12:39:31 +0000 2017,This is fucking Gold lmao. I need to show my dad lmaolll https://t.co/ITG660HCgc,0
Sat Jul 29 12:39:08 +0000 2017,Essential California: A new gold rush is on  sparked by California’s post-drought snowmelt https://t.co/4WbNqtoQEY,0
Sat Jul 29 12:38:20 +0000 2017,Oh yes we did! ✨NEW ITEM✨ clear quartz permanently infused with 24K gold (yes  real gold) these pieces ✨BLING BLOW✨… https://t.co/OAmwobmFot,35
Sat Jul 29 12:34:53 +0000 2017,California's post-drought snowmelt has sparked a new gold rush https://t.co/loi2dQPBCm https://t.co/bdp05fPfiV,61
