Thu Aug 16 23:09:20 +0000 2018,2018年　8月5日　世界ビール・デー　リップルの動向　どうなった？　億り人への道のり　Ripple：XRP https://t.co/u6UQbhARUj,0
Thu Aug 16 21:47:58 +0000 2018,All the difference a day makes.  The sun has started to shine on the crypto market.  Green abounds!… https://t.co/Mt1AiZ5Se2,6
Thu Aug 16 20:57:27 +0000 2018,@omise_go @gatesfoundation Half of the engineers on this project are from ripple labs.,0
Thu Aug 16 14:55:02 +0000 2018,Is this the best news we’ve heard for the #XRP community? I think so! #ripplenews https://t.co/yfG9d3CbW1,0
Thu Aug 16 12:40:23 +0000 2018,@itsmeTONYV Good Q! Not enough characters for specifics but “Life” brotha and the lesson is still in session! It’s… https://t.co/vc6qoOht9u,0
Thu Aug 16 10:33:10 +0000 2018,Ichimoku Long Signal just arrived - BTC  NANO  XLM  XRP https://t.co/qshmTs6FPM #btc #nano #xlm #xrp #ripple #crypto #cryptopredictions,0
