Mon Apr 16 22:47:05 +0000 2018,Coinbase Just Bought One of Bitcoin's Best-Funded Firms https://t.co/Mw1g8jMvId,0
Mon Apr 16 21:51:38 +0000 2018,Coinbase is adding other cryptocurrencies including $xrp #ripple they are working on changing the structure of the company. @coinbase,1
Mon Apr 16 21:39:21 +0000 2018,Coinbase is adding other cryptocurrencies including $xrp #ripple they are working on changing the structure of the company. @coinbase,1
Mon Apr 16 20:43:28 +0000 2018,Very exciting times! https://t.co/K14VZ9nTiG https://t.co/r6iFBBf2Nz,0
Mon Apr 16 16:37:08 +0000 2018,Coinbase confirms acquisition of https://t.co/vMYzG96teY  which lets users earn bitcoin by replying to emails and c… https://t.co/ODllFodc2o,0
Mon Apr 16 16:14:53 +0000 2018,Coinbase's initiatives in venture is a great way of showing they are serious about capital allocation. The most imp… https://t.co/NmhDx6jBe9,0
