Mon Dec 03 12:26:46 +0000 2018,Bitcoin Price Falls to $3 900 After Poor Weekend  Crypto Market Loses $12 Billion 👉👉 https://t.co/g69YRwAFBZ   /By… https://t.co/kSB9UXObib,0
Mon Dec 03 12:23:18 +0000 2018,Tom Lee Sticks By $15 000 BTC Prediction By Years End 👉👉 https://t.co/zEF7UCJzGn  /By  Adrian Barkley  This would m… https://t.co/dRhJJ7iq2m,0
Mon Dec 03 12:19:47 +0000 2018,Director of Enforcement at the Texas State Securities Board Talks Bitcoin  Cryptocurrencies  ICOs and Cybersecurity… https://t.co/afhUHvncwk,0
Mon Dec 03 12:16:13 +0000 2018,Coinbase Adds Free PayPal Withdrawals for Fiat Currencies 👉👉 https://t.co/E1ZEmONT5R  /By Viraj Shah  The US-based… https://t.co/NvCT9Jl91m,0
Mon Dec 03 12:05:44 +0000 2018,Trading Bitcoin - Would Love to See a $4 200 Weekly Close      With @ToneVays   #BlockChainNews  #BTC #BCH #LTC… https://t.co/SudPiyKqc5,0
Mon Dec 03 12:00:17 +0000 2018,Greg Maxwell on why Ethereum is a scam:  👉👉 https://t.co/JBblnpA3mg  #BlockChainNews  #BTC #BCH #LTC #ETH #XLM #EOS… https://t.co/hvWbDqbLcS,0
