Tue May 08 19:52:35 +0000 2018,Startup Raises $3 Million to Build 'Proof-of-Space-Time' Blockchains  👉 https://t.co/yIYUmAwPUw  Spacemesh aims to… https://t.co/eoZZACf0dU,1
Tue May 08 19:34:51 +0000 2018,Bitcoin touched a high of almost $20 000 per Bitcoin in mid-December and fell by nearly 70% to its low in February… https://t.co/ZCn5Dtj0VL,0
Tue May 08 19:20:20 +0000 2018,Warren Buffett And Bill Gates Denounce Bitcoin  👉 https://t.co/gTIUsPpHKS  A few billionaire buddies were asked for… https://t.co/ohqXVR1hLX,1
Tue May 08 19:19:37 +0000 2018,Warren Buffett And Bill Gates Denounce Bitcoin  👉 https://t.co/gTIUsPpHKS  A few billionaire buddies were asked for… https://t.co/ohqXVR1hLX,1
Tue May 08 18:49:23 +0000 2018,Did you ever hear a person without wealth tied up into fiat  say #Bitcoin can't work? The fall of the Roman Empire… https://t.co/DvsFF4PLoc,0
Tue May 08 18:41:17 +0000 2018,Plenty of analysts echo Strajnar's belief that #Bitcoin is set to jump  though. Tim Draper predicts a price of $250… https://t.co/oW73a3ocqO,0
Tue May 08 18:36:38 +0000 2018,Something interesting has happened over the past month. After this roughly 70% tumble in cryptocurrency market cap … https://t.co/9BhuafaHoH,0
Tue May 08 17:52:19 +0000 2018,A New Global Cryptocurrency Coming?  👉  https://t.co/LCkqRS4yAx  Gary Cohn expects the digital coin of the future w… https://t.co/mMTvigimlj,1
Tue May 08 17:37:48 +0000 2018,The Economics of Ethereum's Coming Consensus Change Are Taking Shape  👉 https://t.co/gXXldlF5SQ  Called Casper FFG … https://t.co/edy10MdBIg,1
Tue May 08 17:28:07 +0000 2018,🔴     John McAfee Changes Bitcoin Prediction  Talks Facebook Privacy &amp; FBI Director Comey            #Blockchain Ne… https://t.co/JacjWiEd1u,0
Tue May 08 17:23:43 +0000 2018,#Blockchain News #BTC #BCH #LTC #ETH #GNT #EOS #BAT #DASH #XRP #ETC #OMG  @ToneVays @DougPolkPoker https://t.co/nJBlqGkvMN,0
Tue May 08 17:20:06 +0000 2018,A New Global Cryptocurrency Coming?  👉  https://t.co/LCkqRS4yAx  Gary Cohn expects the digital coin of the future w… https://t.co/mMTvigimlj,1
Tue May 08 16:49:11 +0000 2018,$10 000 Bitcoin Bet With Tone Vays!        with @ToneVays @DougPolkPoker         #Blockchain News #BTC #BCH #LTC… https://t.co/XrOxx5fhFt,0
Tue May 08 16:39:29 +0000 2018,The Bitcoin Gospel - VPRO documentary - 2015  Originally broadcasted by VPRO in 2015. © VPRO Backlight November 201… https://t.co/qeQwLRw9i0,0
Tue May 08 16:20:51 +0000 2018,U.S. Markets Regulator Considers Buyouts  Extension of Hiring Freeze    👉 https://t.co/BbLY3NPAZ9  The @CFTC has be… https://t.co/LvYwJ1SmQ0,0
Tue May 08 16:13:49 +0000 2018,Bitcoin Price Is Correlated To Stocks  👉 https://t.co/XZDbSCzo1G  It has been noted before that #Bitcoin seems to b… https://t.co/I6r0r2PIov,0
Tue May 08 16:02:12 +0000 2018,The sudden resignation of New York Attorney General Eric Schneiderman on Monday night doesn't appear to have impact… https://t.co/7xtEKnxKcC,1
Tue May 08 16:01:24 +0000 2018,The sudden resignation of New York Attorney General Eric Schneiderman on Monday night doesn't appear to have impact… https://t.co/7xtEKnxKcC,1
Tue May 08 16:01:23 +0000 2018,Crypto Exchange Probe 'Continues' Despite New York AG's Resignation   👉 https://t.co/gkOA19mgv6  Last month  the Ne… https://t.co/D9DZtgoUKR,0
Tue May 08 15:39:57 +0000 2018,Why the SEC Should Give Amnesty to Illegal ICOs    👉 https://t.co/tiZLSsnm8F  The @SEC_Enforcement and ICO particip… https://t.co/Qfw01PnOw9,0
Tue May 08 15:36:13 +0000 2018,The Economics of Ethereum's Coming Consensus Change Are Taking Shape  👉 https://t.co/gXXldlF5SQ  Called Casper FFG … https://t.co/edy10MdBIg,1
Tue May 08 15:30:54 +0000 2018,Startup Raises $3 Million to Build 'Proof-of-Space-Time' Blockchains  👉 https://t.co/yIYUmAwPUw  Spacemesh aims to… https://t.co/eoZZACf0dU,1
Tue May 08 15:21:19 +0000 2018,Bitcoin Morning Brief - Proof of Space-Time  BTC Futures  Binance  Wall Street       with @ToneVays @JimmySomg… https://t.co/aieUZY6Gj1,0
Tue May 08 08:00:10 +0000 2018,Stanford University: Deep Learning Comes Full Circle      👉 https://t.co/mxUKV1ADTQ  #Blockchain News #BTC #BCH… https://t.co/reyhNjiQf3,1
Tue May 08 07:51:41 +0000 2018,Stanford University: Deep Learning Comes Full Circle      👉 https://t.co/mxUKV1ADTQ  #Blockchain News #BTC #BCH… https://t.co/reyhNjiQf3,1
Tue May 08 02:25:31 +0000 2018,With Schinderman Gone  Does That Help #Bitcoin  Keiser Report: New Era of #Cryptocurrency   #Blockchain News #BTC… https://t.co/s1hWO3U7xl,0
Tue May 08 02:12:24 +0000 2018,Tim Draper’s Bitcoin Bets  The Great Engineers Are Working on Bitcoin and Crypto  not Fiat  #Blockchain News #BTC… https://t.co/C7DPQUIhlQ,0
Tue May 08 01:15:02 +0000 2018,Bitcoin Sees Wall Street Warm to Trading Virtual Currency   👉🏼 https://t.co/siTe5wyc6y  Traders at the New York Sto… https://t.co/WMmPY7t67b,0
Tue May 08 00:30:48 +0000 2018,The Great Engineers Are Working on Bitcoin and Crypto  Not Fiat  👉https://t.co/9nlEfjPYMW  "We're looking for a cry… https://t.co/C7HssK2nmZ,0
Tue May 08 00:18:22 +0000 2018,Why the JPMorgan Blockchain Patent Application Is Not Really News      👉 https://t.co/UTzugBAvsM  The @JPMorgan Blo… https://t.co/MO3IppYXKs,2
Tue May 08 00:14:43 +0000 2018,Why the JPMorgan Blockchain Patent Application Is Not Really News      👉 https://t.co/UTzugBAvsM  The @JPMorgan Blo… https://t.co/MO3IppYXKs,2
Tue May 08 00:14:25 +0000 2018,Why the JPMorgan Blockchain Patent Application Is Not Really News      👉 https://t.co/UTzugBAvsM  The @JPMorgan Blo… https://t.co/MO3IppYXKs,2
Tue May 08 00:09:30 +0000 2018,"Most investors/traders are already intimidated by bitcoin. So  to have them jump through hoops to trade on a decen… https://t.co/LPjWZQesCq,0
Tue May 08 00:09:29 +0000 2018,The Next Generation of Crypto Exchanges Has One Big Missing Piece  👉 https://t.co/w4sMonnxZD  Liquidity...… https://t.co/Aer6ZJNKhx,0
Tue May 08 00:02:44 +0000 2018,What to Expect When Congress Talks Blockchain Tomorrow      👉 https://t.co/wc9g9iiuAT  The event on Tuesday will ho… https://t.co/416wIwadTs,0
