Wed Jan 02 14:06:53 +0000 2019,Is Bitcoin Spiraling Down to a New Bottom? 👉👉 https://t.co/fZeSpkA2J7  /By @iBankCrypto1  #BlockChainNews #BTC #BCH… https://t.co/Wvyt3xjvBN,0
Wed Jan 02 13:57:54 +0000 2019,Coinbase Sends 5% of Bitcoin’s Supply to Another Secure Wallet 👉👉 https://t.co/MbTm23vdvd   /By Carlos Terenzi… https://t.co/YXR7vpDFg4,0
Wed Jan 02 13:49:56 +0000 2019,Bitcoin Lightning Network Reaches Record 510 BTC Capacity 👉👉 https://t.co/qhydzwfFOm  /By Carlos Terenzi… https://t.co/x6HgYRvScb,0
Wed Jan 02 13:39:17 +0000 2019,BTC Mining Difficulty Adjusts 10% Upwards  Breaks Away From Months-long Downwards Trend  👉👉 https://t.co/QMbNinPebu… https://t.co/ahCRVwigic,0
Wed Jan 02 13:15:17 +0000 2019,Ripple Slips Into 3rd Position As Whales Move Around $755 Million Worth Of XRP  👉👉 https://t.co/CtHlcj8Myh   /By Ya… https://t.co/6NKPIs28fX,0
Wed Jan 02 13:08:00 +0000 2019,Top 5 Worst Bitcoin Price Predictions of 2018 👉👉 https://t.co/X76P6ZDSOS  /By Mark Emem  #BlockChainNews #BTC #BCH… https://t.co/Vh0jJhYKJ0,0
Wed Jan 02 13:04:21 +0000 2019,How Did Ethereum Take Over Ripple With 80% Gain in One Month? 👉👉 https://t.co/NOUqAZ9tN9  /By Joseph Young  Over th… https://t.co/e99MosSA05,1
Wed Jan 02 13:04:04 +0000 2019,How Did Ethereum Take Over Ripple With 80% Gain in One Month? 👉👉 https://t.co/NOUqAZ9tN9  /By Joseph Young  Over th… https://t.co/e99MosSA05,1
Wed Jan 02 12:59:55 +0000 2019,Hacker Group: Pay Bitcoin Ransom or We’ll Release 9/11 Papers 👉👉 https://t.co/aVxYwWdP7Z  /By Jimmy Aki… https://t.co/WmdMdcCBji,0
Wed Jan 02 12:56:20 +0000 2019,Ethereum Retakes Second Position 👉👉 https://t.co/DNd5lAZaly   /By https://t.co/dx1G0OauU9  #BlockChainNews #BTC… https://t.co/mNmlzKiJpd,0
