Sat Apr 07 22:08:23 +0000 2018,In Honor of #theMasters  revisiting one of my all-time favorite commercials: @NikeGolf “Ripple” https://t.co/PhldCBLhBZ,0
Sat Apr 07 18:37:46 +0000 2018,HUGE thank you to @Ripple for fully funding our @DonorsChoose project! My jaw dropped! A million thank yous to this… https://t.co/UQOISAMUmu,3
Sat Apr 07 17:47:34 +0000 2018,HUGE thank you to @Ripple for fully funding our @DonorsChoose project! My jaw dropped! A million thank yous to this… https://t.co/UQOISAMUmu,3
Sat Apr 07 17:46:53 +0000 2018,HUGE thank you to @Ripple for fully funding our @DonorsChoose project! My jaw dropped! A million thank yous to this… https://t.co/UQOISAMUmu,3
Sat Apr 07 17:25:16 +0000 2018,@RealSpectre_ @TurtleStud @insomniacgames Look at his arms and legs even his back has the ripple effect,0
Sat Apr 07 14:14:18 +0000 2018,https://t.co/K32WYhEhkj,0
Sat Apr 07 13:43:15 +0000 2018,Lots of these kids have billeted with one or two families in addition to their own.  This kind of tragedy will ripp… https://t.co/aOBd87Qd9y,0
Sat Apr 07 07:47:09 +0000 2018,Bitcoin vs Ripple  #IoT #bigdata #fintech #blockchain #infosec #disruption #CyberSecurity #cryptocurrency… https://t.co/5qKhKfYkwa,21
Sat Apr 07 05:53:10 +0000 2018,Bitcoin  Ethereum  Ripple’s XRP Price: What's Happening To #Cryptocurrency ? - https://t.co/iXdp1eqNtD   #Bitcoin… https://t.co/amduoNYW2Y,7
Sat Apr 07 05:08:19 +0000 2018,@AntonioDomingo ¿Seguro? #Ripple no es minable.,0
Sat Apr 07 01:30:46 +0000 2018,Is Ripple Classified as a Security Under U.S. Law? https://t.co/kUjKuAxGc6 via @crypto_slate,0
