Tue Nov 27 13:37:22 +0000 2018,#Criptoactivos continúan bajo presión bajista aunque esta comienza a reducirse. #Bitcoin -1.53% #Ethereum -2.99% #Ripple -2.28%,0
Tue Nov 27 11:12:15 +0000 2018,The rally in Ripple is in 3 waves -- look for a sustainable rally to form just below this week's low near .32 https://t.co/2nIKz8QzoJ,1
Tue Nov 27 10:03:02 +0000 2018,Producer Dr. Donald Boggs shared a behind-the-scenes perspective of the making of his documentary  “A Ripple of Hop… https://t.co/0MiR7tK4wR,3
Tue Nov 27 02:21:39 +0000 2018,@lost_cj @realDonaldTrump Did you read the article?  "as it abandons many of its car models and restructures to foc… https://t.co/Ds0x1PWXnf,0
Tue Nov 27 02:15:39 +0000 2018,But the tv man told me it was a ripple? https://t.co/YfaRl0M4c0,0
Tue Nov 27 00:53:05 +0000 2018,@Golfbang @LeeR912 @Ripple_Me_This @RippleXrpie @RippleAnon Me too! Gotta ask though  what happened here? LOL. https://t.co/mSJy0LwIuR,0
Tue Nov 27 00:10:09 +0000 2018,#SWIFT #India integrates #DLT in the system to improve efficiency https://t.co/4oljETB9ER odd contrast to SWIFT Int… https://t.co/Rdn5CsLWT1,0
Tue Nov 27 00:04:19 +0000 2018,Producer Dr. Donald Boggs shared a behind-the-scenes perspective of the making of his documentary  “A Ripple of Hop… https://t.co/0MiR7tK4wR,3
Tue Nov 27 00:01:57 +0000 2018,Producer Dr. Donald Boggs shared a behind-the-scenes perspective of the making of his documentary  “A Ripple of Hop… https://t.co/0MiR7tK4wR,3
