Mon Sep 24 22:25:31 +0000 2018,Bitcoin  Ethereum  Ripple  Bitcoin Cash  EOS  Stellar  Litecoin  Cardano  Monero  Dash: Price Analysis  September 2… https://t.co/CVpLQEn16s,0
Mon Sep 24 22:24:21 +0000 2018,Bitcoin  Ethereum  Ripple  Bitcoin Cash  EOS  Stellar  Litecoin  Cardano  Monero  Dash: Price Analysis  September 24 https://t.co/zVPcE4eaoH,0
Mon Sep 24 21:07:52 +0000 2018,@digitalassetbuy @Ripple @bgarlinghouse That’s good stuff!,0
Mon Sep 24 20:54:55 +0000 2018,By YouTuber - DataDash  Ripple (XRP) | What's all the buzz about? https://t.co/RhhPKuhGkr,0
Mon Sep 24 20:17:46 +0000 2018,If you all were wondering what that ripple in the global financial community was  I'm transferring 0.0044268 BTC. Hold on everyone. ;),0
Mon Sep 24 20:14:36 +0000 2018,2 hour meeting at #Ripple #headquarter. Happy to have such a great company among our #partners!   #Platio #Smart… https://t.co/FpyG4lTtF0,0
Mon Sep 24 19:25:41 +0000 2018,Often In PRODUCT GOALS the power of the government is used to FORCE a result  which might sound good on a debate st… https://t.co/DAWWvDPL61,0
Mon Sep 24 17:45:39 +0000 2018,If you look at the charts it defiantly looks that way #cryptocurrency #cryptocurrencies #bitcoin #ethereum #btc… https://t.co/kAKE4eYWt8,1
Mon Sep 24 17:36:26 +0000 2018,If you look at the charts it defiantly looks that way #cryptocurrency #cryptocurrencies #bitcoin #ethereum #btc… https://t.co/kAKE4eYWt8,1
Mon Sep 24 16:10:58 +0000 2018,Unpopular hot take I think @Coil does more for the price of #xrp in 2019 then @ripple ever could. #XRPTheStandard #fintech #altcoins,0
Mon Sep 24 14:09:30 +0000 2018,https://t.co/mtUtCtFhGb,0
Mon Sep 24 13:35:20 +0000 2018,Means somebody went back in time and nothing changed in your life by the ripple effect 🤧 https://t.co/TDFj3QdAhN,1
Mon Sep 24 13:30:20 +0000 2018,Means somebody went back in time and nothing changed in your life by the ripple effect 🤧 https://t.co/TDFj3QdAhN,1
Mon Sep 24 13:25:38 +0000 2018,I am faster than bitcoin and have better privacy than monero. Who am I. Do you think you know who I am? Give it a s… https://t.co/XCGqLuHpl1,4
Mon Sep 24 12:20:07 +0000 2018,If Kananaugh isn’t confirmed   does that mean Trump has defaulted on his Deutsche bank loan? You know   that billio… https://t.co/qM4yompYVN,1177
Mon Sep 24 05:11:33 +0000 2018,@RippleXxx @RippleRiddler @Ripple_Me_This @CKJCryptonews @thekungfunerd this guy sold his car to buy XRP! Believe i… https://t.co/xvXECWlPzB,0
Mon Sep 24 04:08:42 +0000 2018,Check out my classroom on @DonorsChoose! I'd love your help to bring my project to life:  https://t.co/UCNS1eve61 Promo code RIPPLE,0
Mon Sep 24 03:28:09 +0000 2018,$70+/year! Brave Browser + Basic Attention Token(BAT) - Ripple XRP News ... https://t.co/ko898BW7dg via @YouTube,0
Mon Sep 24 00:46:18 +0000 2018,Ripple Effect aqua https://t.co/GMRXeIaH0i,0
