Tue Sep 04 23:58:59 +0000 2018,Judging by your azure down page at  https://t.co/plUnuCHXTt the outage in the south region has cause a ripple affec… https://t.co/HVb3xtIii9,0
Tue Sep 04 23:19:30 +0000 2018,Bitcoin  Ethereum  Ripple  Bitcoin Cash  EOS  Stellar  Litecoin  Cardano  Monero  IOTA: Price Analysis  September 4 https://t.co/lxk8j8v81p,0
Tue Sep 04 21:46:41 +0000 2018,PSA: It’s okay to say “No”. People will find another way. We have to stop overextending ourselves &amp; thinking that w… https://t.co/ahxqUnXlZT,33706
Tue Sep 04 21:13:10 +0000 2018,Can we just continue to Riiiiiise. #cryptocurrency #cryptocurrencies #bitcoin #ethereum #btc #eth #binance… https://t.co/BUh5tVUcv0,0
Tue Sep 04 18:24:29 +0000 2018,@LCHS_Patriots Donations up to $50 will be matched with code RIPPLE at checkout!! Here's our makerspace project: https://t.co/wjJhNqlcE6,0
Tue Sep 04 16:32:02 +0000 2018,XRP=Ripple https://t.co/QQ85UdW0x6,0
