Tue Aug 21 22:40:19 +0000 2018,Can Rock  Paper  Scissors Save The Ethereum (ETH) DApp Landscape?  https://t.co/QhRM4e5qWF,0
Tue Aug 21 22:30:16 +0000 2018,NEW Video: Bitcoin Ethereum ETC BNB Technical Analysis Chart 8/21/2018 by https://t.co/hAS8F7bUHL   https://t.co/NRU6j1zHxA,0
Tue Aug 21 21:47:07 +0000 2018,What Vitalik Buterin's tweetstorm means for the future Ethereum blockchain https://t.co/txu96bsujv,0
Tue Aug 21 21:46:00 +0000 2018,What Vitalik Buterin&amp;#039;s tweetstorm means for the future Ethereum &lt;b&gt;blockchain&lt;/b&gt; https://t.co/txu96bsujv sour… https://t.co/9lVPT8SjBg,0
Tue Aug 21 21:03:27 +0000 2018,Trade #Bitcoins  #Litecoins and #Ethereum using your #Platform. Everything You Need to Know to Start Trading the cr… https://t.co/7t4v8818j9,0
Tue Aug 21 20:32:26 +0000 2018,Cryptocurrency Boom Leaves new Investors with Six-Figure Debt BY: Priyeshu Garg  https://t.co/Ucablj1Ybf… https://t.co/mKAGrRr3Lc,0
Tue Aug 21 20:15:17 +0000 2018,Ethereum Scam Swindles Over $40 000 From Unsuspecting Android Users  https://t.co/c0MbYTBx3I,0
Tue Aug 21 19:30:34 +0000 2018,@Crypto_Leo_alt @ethereum @VitalikButerin @helloiconworld @NEO_Blockchain @KomodoPlatform @wavesplatform $ARDR,0
Tue Aug 21 19:05:19 +0000 2018,Join us today  be free of censorship &amp; banning  https://t.co/4ENSIDeaKS  #memocash #memo #socialmedia #bitcoin… https://t.co/Dz0NLFNQTC,0
Tue Aug 21 18:45:05 +0000 2018,Kin User Base Dwarfs All Ethereum DApps’ Activity Combined   https://t.co/ocXFBeR8tv  #CryptoNews #Ethereum #ETH… https://t.co/jQYcaWZYRC,0
Tue Aug 21 16:53:33 +0000 2018,@brianchoffman Ethereum and EOS. Small cap SmartCash @scashofficial,0
Tue Aug 21 14:49:03 +0000 2018,Ethereum: An Altcoin Game Of Hot Potato?  https://t.co/TeGYqDsjlv  #Ethereum #ETH #Blockchain #Cryptocurrency,0
Tue Aug 21 13:15:07 +0000 2018,Discover #Bitcoin  #Ethereum &amp; #Blockchain Guides as well as hundreds of blockchain and #cryptocurrencynews… https://t.co/bAznc9mUC5,1
Tue Aug 21 12:40:37 +0000 2018,Ethereum (ETH) Price Analysis – August 21  https://t.co/nrwWTOwYRG,1
Tue Aug 21 12:40:36 +0000 2018,Ethereum (ETH) Price Analysis – August 21  https://t.co/nrwWTOwYRG,1
Tue Aug 21 12:25:23 +0000 2018,US Government Grants $800K to Blockchain Researchers https://t.co/B7Acqjity5 #bitcoin #btc #blockchain… https://t.co/4FiT7yEkD2,0
Tue Aug 21 11:19:57 +0000 2018,New article on our fork 💪✔!!!  Thank you blockchain reporter for the great article 💪💪.  https://t.co/fiWm0s7Qgc… https://t.co/WUiI52H6xD,39
Tue Aug 21 04:10:03 +0000 2018,Join us today  be free of censorship &amp; banning  https://t.co/4ENSIDeaKS  #memocash #memo #socialmedia #bitcoin… https://t.co/EhrRJR7SQW,0
Tue Aug 21 03:51:03 +0000 2018,Discover #Bitcoin  #Ethereum &amp; #Blockchain Guides as well as hundreds of blockchain and #cryptocurrencynews… https://t.co/bAznc9mUC5,1
Tue Aug 21 02:24:58 +0000 2018,Trade #Bitcoins  #Litecoins and #Ethereum using your #Platform. Everything You Need to Know to Start Trading the cr… https://t.co/P1BNVeZqrz,1
Tue Aug 21 02:14:13 +0000 2018,Trade #Bitcoins  #Litecoins and #Ethereum using your #Platform. Everything You Need to Know to Start Trading the cr… https://t.co/P1BNVeZqrz,1
Tue Aug 21 01:45:25 +0000 2018,Ethereum (ETH) Price Analysis: Triangle Breakout Alert!  https://t.co/QEXepEgDzs,0
Tue Aug 21 01:30:39 +0000 2018,NEW Video: Bitcoin Ethereum Litecoin BCH Technical Analysis Chart 8/20/2018 by https://t.co/hAS8F7bUHL   https://t.co/YRHwamWtoH,0
Tue Aug 21 01:18:03 +0000 2018,New article on our fork 💪✔!!!  Thank you blockchain reporter for the great article 💪💪.  https://t.co/fiWm0s7Qgc… https://t.co/WUiI52H6xD,39
