Sun Jan 21 23:44:04 +0000 2018,We will be giving away Bitcoin Cash soon. Need to continue to spread the word...  @rogerkver @BitcoinCashFund… https://t.co/WLmclrmuko,0
Sun Jan 21 23:43:22 +0000 2018,Get Paid for Exercising! Join our ICO Whitelist at https://t.co/HDvhoZrz2J #ICO #ICOs #TokenSale #Tokens… https://t.co/MUaAL4BEj1,1
Sun Jan 21 23:30:52 +0000 2018,We will be giving away Bitcoin Cash soon. Stay tuned.   #bitcoincash #bitcoin #ethereum #litecoin #crypto #cryptocurrencies #cryptopia,0
Sun Jan 21 23:10:35 +0000 2018,@BitcoinCryptoMM Look into @KomodoPlatform $KMD and their technology. #dICO’s (Decentralized ICOs) and #AtomicSwaps… https://t.co/4FduR2Rrm6,0
Sun Jan 21 23:01:29 +0000 2018,I said it once I’ll say it again  it doesn’t matter if Bitcoin is $50 000 or $1.00  the important thing is that it… https://t.co/V2MgZp7Pbq,0
Sun Jan 21 22:11:57 +0000 2018,#ICOAcornCollective #ACO #acorncollective #ethereum,0
Sun Jan 21 21:06:07 +0000 2018,Ethereum and bitcoin price dropping: 200k sign cryptocurrency petition in South Korea https://t.co/JbZyOyC42y… https://t.co/tphdJxbQrh,0
Sun Jan 21 21:02:26 +0000 2018,The Bull And The Bear Case For Bitcoin  Ethereum  Ripple  Litecoin  And Other #Cryptocurrencies… https://t.co/2bm80bRsoh,0
Sun Jan 21 20:41:42 +0000 2018,$ETHUSD $ETH #Ethereum #Cryptocurrency #Crypto This suggests the bounce is a correction and not the beginning of a… https://t.co/v2MCqmKoIr,1
Sun Jan 21 18:38:12 +0000 2018,Get Paid for Exercising! Join our ICO Whitelist at https://t.co/HDvhoZrz2J #ICO #ICOs #TokenSale #Tokens… https://t.co/MUaAL4BEj1,1
Sun Jan 21 17:58:16 +0000 2018,Thanks Michael Frost for following me! Tell your friends.. #bitcoin and #ethereum in the house! Follow our company… https://t.co/bciGr4uWu7,0
Sun Jan 21 17:39:00 +0000 2018,.@paulkrugman has softened his anti-#Bitcoin position. Is this the surest sign of a top? #bitcoin #cryptocurrency… https://t.co/H2IB7DpoM2,1
Sun Jan 21 17:27:11 +0000 2018,$ETHUSD $ETH #Ethereum #Cryptocurrency #Crypto This suggests the bounce is a correction and not the beginning of a… https://t.co/v2MCqmKoIr,1
Sun Jan 21 17:23:47 +0000 2018,.@paulkrugman has softened his anti-#Bitcoin position. Is this the surest sign of a top? #bitcoin #cryptocurrency… https://t.co/H2IB7DpoM2,1
Sun Jan 21 17:22:55 +0000 2018,I'm getting ready to buy some dips soon. I will have no mercy #bitcoin #cryptocurrency #blockchain #crypto #ico… https://t.co/4DFXhdctw3,0
Sun Jan 21 17:22:25 +0000 2018,Inform yourself about Bitcoin by visiting our getting started page! Here's where to begin. It's easy! #bitcoin… https://t.co/cas39J6Uh6,0
Sun Jan 21 17:19:16 +0000 2018,Forget POW  Blockchain now has POE Proof of Exercise. Mine with your body! Join our ICO at https://t.co/HDvhoZrz2J… https://t.co/ycOWILbE9w,0
Sun Jan 21 16:47:19 +0000 2018,40 million ppl use Bitcoin &amp; Cryptos  estimates r that in just two yrs there’s going to be 300 million ppl using Cr… https://t.co/mNkw9bNLfi,1
Sun Jan 21 16:45:11 +0000 2018,40 million ppl use Bitcoin &amp; Cryptos  estimates r that in just two yrs there’s going to be 300 million ppl using Cr… https://t.co/mNkw9bNLfi,1
Sun Jan 21 16:19:55 +0000 2018,DASH-ing Into The Future – The independent republic https://t.co/XuvthAEw4R  #dash #bitcoin #ethereum #crypto #cryptocurrencies #cyptopia,0
Sun Jan 21 16:09:16 +0000 2018,Bitcoin Laundering Less Than One Percent of All Transa... | News | Cointelegraph https://t.co/EqCxyRUskb  #bitcoin… https://t.co/WFL4xACdvh,0
Sun Jan 21 16:06:29 +0000 2018,This is kinda flippin awesome!!! Earn $elf simply by using twitter? Sign me up!!  @aelfblockchain $elf #elf #crypto… https://t.co/l3glVeheml,1
Sun Jan 21 15:45:21 +0000 2018,https://t.co/qsOAJpssRl   $TRX $BTC $LTC $XRP $ETH $XVG $ETC $SC $LINK $FUN $XP $APX $DASH $EVX $ETN $RLC $MTNC… https://t.co/z46GrYmxgh,2
Sun Jan 21 15:03:12 +0000 2018,https://t.co/qsOAJpssRl   $TRX $BTC $LTC $XRP $ETH $XVG $ETC $SC $LINK $FUN $XP $APX $DASH $EVX $ETN $RLC $MTNC… https://t.co/z46GrYmxgh,2
Sun Jan 21 14:53:17 +0000 2018,Thanks Victor Caballero for following me! Tell your friends.. #bitcoin and #ethereum in the house! Follow our compa… https://t.co/lTJAwAbEpr,0
Sun Jan 21 14:28:10 +0000 2018,https://t.co/jRHiYxEhsS It's Time To Profit Off The MASSIVE RISE In Bitcoin  Litecoin  Ethereum…  I Will Show You How You Can  Make Up To,0
Sun Jan 21 14:19:13 +0000 2018,Over 40 million ppl use Bitcoin &amp; Cryptos  estimates r that in just two yrs there’s going to be 300 million ppl usi… https://t.co/qLG6S1jgfD,1
Sun Jan 21 14:18:42 +0000 2018,Really interesting example of diversification- Guy put $200 dollars in 30 different #cryptocoins beginning of 2017.… https://t.co/mGCHPOgEZf,46
Sun Jan 21 14:15:09 +0000 2018,Over 40 million ppl use Bitcoin &amp; Cryptos  estimates r that in just two yrs there’s going to be 300 million ppl usi… https://t.co/qLG6S1jgfD,1
