Tue Sep 04 23:03:11 +0000 2018,#Ethereum $eth daily trend analysis LongTerm Trend is DOWN since 2018-05-23. No breakouts identified and in the pas… https://t.co/YkTr9qFcgy,0
Tue Sep 04 22:46:20 +0000 2018,Próxima actualización de Ethereum podría ser la prueba más grande de Blockchain hasta ahora https://t.co/4LG9ZAcxXk https://t.co/0WPtHLOlPO,22
Tue Sep 04 21:52:46 +0000 2018,Don't panic... Invest today  #black #workfromhome #investors #networkmarketing #crypto #marketing #investinyourself… https://t.co/8YsJzlPRMn,0
Tue Sep 04 21:25:36 +0000 2018,Google ahora ofrece una vista de Big Data de la cadena de bloques de Ethereum https://t.co/W1XBh978tQ https://t.co/UQWwvAMiup,2
Tue Sep 04 20:57:48 +0000 2018,Google ahora ofrece una vista de Big Data de la cadena de bloques de Ethereum https://t.co/W1XBh978tQ https://t.co/w3gROMo658,14
Tue Sep 04 20:49:15 +0000 2018,The Daily: Wirex Adds Ethereum  Deutsche Börse Embraces Blockchain - Bitcoin News https://t.co/2wHjSjqgHT,0
Tue Sep 04 20:33:00 +0000 2018,ETH Futures: Bad for #Ethereum  Good for #Bitcoin  Says @fundstrat - @bitcoinist https://t.co/jSjE0wiffo,0
Tue Sep 04 19:16:49 +0000 2018,#Ethereum $eth Hourly buy &amp; sell levels.  LongTerm Trend is DOWN since 2018-02-10. The last bar was a intermediate… https://t.co/4i0gXnPZq5,0
Tue Sep 04 18:07:54 +0000 2018,The visual focuses on six #cryptos: #bitcoin  #Ethereum  Ethereum classic  #Litecoin  #Ripple  and #Dash |… https://t.co/LmPvdbcrLL,6
Tue Sep 04 14:57:22 +0000 2018,Cryptocurrency ICOs: A Giant Scam or a New Financial Era? https://t.co/O3mzDeuuvL,0
Tue Sep 04 14:09:09 +0000 2018,Google ahora ofrece una vista de Big Data de la cadena de bloques de Ethereum https://t.co/W1XBh978tQ https://t.co/w3gROMo658,14
Tue Sep 04 13:16:18 +0000 2018,Google ahora ofrece una vista de Big Data de la cadena de bloques de Ethereum https://t.co/W1XBh978tQ https://t.co/UQWwvAMiup,2
Tue Sep 04 13:03:28 +0000 2018,#Ethereum $eth trend line and channels The high of the wedge is 363.371 and the low of the wedge is 203.5676. The u… https://t.co/u45VJuSy73,0
Tue Sep 04 12:54:41 +0000 2018,Google ahora ofrece una vista de Big Data de la cadena de bloques de Ethereum https://t.co/W1XBh978tQ https://t.co/w3gROMo658,14
Tue Sep 04 12:41:49 +0000 2018,The Daily: Wirex Adds Ethereum  Deutsche Börse Embraces Blockchain https://t.co/a9olJ2ZGX5 via @BTCTN,0
Tue Sep 04 12:23:40 +0000 2018,advocacy of compliant ICO practices to action. It will offer a cost-effective way to launch an ICO and handle also… https://t.co/CbY8Px2aHl,0
Tue Sep 04 12:18:18 +0000 2018,Strong team with a great project. Love to be a part of this movement and wishing a successful to all team members a… https://t.co/1O7vdkPbfY,0
Tue Sep 04 12:17:59 +0000 2018,#ccin #ICO #Crowdsale #Bitcoin #Blockchain #Token #ETH #Ethereum #TokenSale https://t.co/2xNYpUDTp1,0
Tue Sep 04 12:15:12 +0000 2018,Google ahora ofrece una vista de Big Data de la cadena de bloques de Ethereum https://t.co/W1XBh978tQ https://t.co/UQWwvAMiup,2
Tue Sep 04 12:12:22 +0000 2018,Now this is a cool article   #gaming #gamer #eth #ethereum #crypto #cryptocurrency #bitcoin #blockchain https://t.co/GbCZkR734p,1
Tue Sep 04 12:05:46 +0000 2018,Ethereum Limited project delivers easier smart contracts via its secure and user-friendly platform. #ICO #ETHL #ETHLIMITED,0
Tue Sep 04 10:55:16 +0000 2018,Thanks #Altcoin Devvie for following me! Tell your friends.. #bitcoin and #ethereum in the house! Follow our compan… https://t.co/fGIbJiRacz,0
Tue Sep 04 09:52:21 +0000 2018,Walmart Explores Blockchain for Connecting Automated Delivery Drones https://t.co/9y1E0wsKPt #bitcoin #btc… https://t.co/1a5imqJ4mc,0
Tue Sep 04 07:44:18 +0000 2018,Blockchain 101 Ep 77 – What is Ethereum https://t.co/cIpFimymVr,0
Tue Sep 04 07:43:41 +0000 2018,&lt;b&gt;Blockchain&lt;/b&gt; 101 Ep 77 - What is Ethereum https://t.co/cIpFimymVr source: Block Chain today same now&amp;#013; Eth… https://t.co/SxTluLLJFC,0
Tue Sep 04 07:18:26 +0000 2018,#me.token #ICO #Crowdsale #Bitcoin #Blockchain #Token #ETH #Ethereum #TokenSale https://t.co/R3MLLe51B1,0
Tue Sep 04 07:14:59 +0000 2018,#LipChain | #ICO #Crowdsale #Bitcoin #Blockchain #Token #ETH #Ethereum #TokenSale https://t.co/SUw7zw2Ug4,0
Tue Sep 04 07:10:14 +0000 2018,#Blockchain  #RealEstate  #Publicsale  #Developer  #Ethereum  #Platform. https://t.co/Ybar5OrmMl,0
Tue Sep 04 05:51:02 +0000 2018,Ethereum needs to evolve  https://t.co/yUx33SxJpA  #eth #ether #ethereum #crypto #cryptocurrency #bitcoin,0
Tue Sep 04 04:56:49 +0000 2018,Free Ethereum - Earn $65 free eth in 5 minutes https://t.co/9mAcFpZYYc #ethereum #freeeth #geteth,0
Tue Sep 04 04:30:13 +0000 2018,Free Ethereum  it’s real and helping to spread the word about Ether &amp; Crypto  https://t.co/sqabcEybkV  #eth #ether… https://t.co/h6spJSCzb7,0
Tue Sep 04 04:25:31 +0000 2018,Latest Bitcoin and &lt;b&gt;Blockchain&lt;/b&gt; News From Around the World Today https://t.co/Ajk8O9NupN source: Block Chain t… https://t.co/OQeLdX8Gi2,0
Tue Sep 04 04:13:32 +0000 2018,I liked a @YouTube video https://t.co/IlSqRvPXMP Bitcoin Ethereum Litecoin BCH ETC Technical Analysis Chart 9/3/201… https://t.co/aYlx7vhd8s,0
Tue Sep 04 04:04:56 +0000 2018,Google importing Ethereum blockchain daily for BigQuery analysis https://t.co/n0kiU0nvI1,0
Tue Sep 04 04:04:30 +0000 2018,Google importing Ethereum &lt;b&gt;blockchain&lt;/b&gt; daily for BigQuery analysis https://t.co/n0kiU0nvI1 source: Block Chain… https://t.co/XYFYusMPHS,0
Tue Sep 04 03:02:01 +0000 2018,Google ahora ofrece una vista de Big Data de la cadena de bloques de Ethereum https://t.co/W1XBh978tQ https://t.co/w3gROMo658,14
Tue Sep 04 02:20:30 +0000 2018,Google ahora ofrece una vista de Big Data de la cadena de bloques de Ethereum https://t.co/W1XBh978tQ https://t.co/w3gROMo658,14
Tue Sep 04 00:35:02 +0000 2018,Free Ethereum  it’s real and helping to spread the word about Ether &amp; Crypto  https://t.co/sqabcEybkV  #eth #ether… https://t.co/ynhYAh0nQY,0
