Sat Dec 01 23:25:44 +0000 2018,Programable Money AKA BITCoin / USDCoin #ToTheMoon https://t.co/5F90G5Zx4F,0
Sat Dec 01 22:40:16 +0000 2018,A crypto index fund? https://t.co/JjPkQ7rnGI,1
Sat Dec 01 22:11:02 +0000 2018,https://t.co/PWNIy3rsKY,0
Sat Dec 01 21:13:26 +0000 2018,How Silvergate Became the Leading Bank for Crypto Startups - CoinDesk https://t.co/Q9t8Tmf0FQ,0
Sat Dec 01 20:52:52 +0000 2018,Anyone else have a #coinbase transaction taking forever to send?  Been over 1.5 hours with zero confirmations. #coinbase #coinbasesupport,0
Sat Dec 01 20:25:17 +0000 2018,The current Cryptocurrency market via @coinbase #cryptocurrency #BTC #LTC #ETH #XRP #ZRX #TRX #BCH https://t.co/i8t11hOgoo,0
Sat Dec 01 17:29:58 +0000 2018,Poll of the day: which token would you expect Coinbase Pro to list next?,4
Sat Dec 01 16:31:09 +0000 2018,Where tech  women  and the future of finance converge by @coinbase https://t.co/PejFIYmNuL,1
Sat Dec 01 16:25:29 +0000 2018,Where tech  women  and the future of finance converge by @coinbase https://t.co/PejFIYmNuL,1
Sat Dec 01 16:09:10 +0000 2018,Hi! I've been using Coinbase which makes it really easy and safe to buy  sell  and store digital currency (like Bit… https://t.co/DUQ6d5eUPh,1
Sat Dec 01 15:00:56 +0000 2018,Coinbase agrega retiros gratuitos de Paypal https://t.co/EACvhaz8iB https://t.co/KpF9s1VtDd,0
Sat Dec 01 11:52:59 +0000 2018,shoutout Coinbase processing withdrawals on the 1st to pay rent,0
Sat Dec 01 05:49:45 +0000 2018,Hi! I've been using Coinbase which makes it really easy and safe to buy  sell  and store digital currency (like Bit… https://t.co/PRztZNyg2E,0
Sat Dec 01 02:53:25 +0000 2018,Hi! I've been using Coinbase which makes it really easy and safe to buy  sell  and store digital currency (like Bit… https://t.co/7OLiCOTOtB,5
Sat Dec 01 00:03:20 +0000 2018,Will Blockchain be a $3 Trillon Market? || The #Blockchain Report  #Coinbase Is Launching Over-The-Counter Trading… https://t.co/zvv9TV0Svh,3
