Fri Jun 22 22:50:59 +0000 2018,@TiffyStolich A penny for your thoughts Ryan.. and I mean a penny.. that’s all would be worth.. actually I’d be ove… https://t.co/vMeGECEG16,0
Fri Jun 22 21:58:31 +0000 2018,@Godson719 Smh fam cars are the worst investment but 4sho,0
Fri Jun 22 21:41:38 +0000 2018,Vintage Van really really hates #Patchouli.  #tokerware #Thankful #investment #stoner #investment #workfromhome https://t.co/tsPY4XxS17,1
Fri Jun 22 21:24:42 +0000 2018,Only three? https://t.co/NWJgMYAVcO #401k @FiCommPartners,2
Fri Jun 22 21:10:13 +0000 2018,Vintage Van really really hates #Patchouli.  #tokerware #Thankful #investment #stoner #investment #workfromhome https://t.co/tsPY4XxS17,1
Fri Jun 22 20:55:44 +0000 2018,VC Brian O’Malley jumps from Accel to Forerunner Ventures - https://t.co/MZgghI4w4T O’Malley may be the most-poache… https://t.co/FiYV925Pfh,0
Fri Jun 22 20:41:33 +0000 2018,Investment: @Tommychong invents new weed grinder. #TMO=1  #tokerware #cannabis #wakeandbake #stonedtothebone #NHL https://t.co/XwhuC2Z8R2,1
Fri Jun 22 20:30:07 +0000 2018,**New Listing from Vicky Limpede &amp; Tony Limpede**  This Amazing Condo is a Great Starter Home or Investment Propert… https://t.co/u2S75eJ7sn,0
Fri Jun 22 20:26:00 +0000 2018,AI Investment Rising Significantly Among Early Adopters https://t.co/dB0aV8qGwK by @courtneysato @constellationr @rwang0 #Survey #Research,0
Fri Jun 22 20:06:18 +0000 2018,Investment: @Tommychong invents new weed grinder. #TMO=1  #tokerware #cannabis #wakeandbake #stonedtothebone #NHL https://t.co/XwhuC2Z8R2,1
Fri Jun 22 19:48:00 +0000 2018,Multifamily real estate is proving itself to be a rock-solid investment  and as the economic cards fall in favor of… https://t.co/HVmuVBzAgM,0
Fri Jun 22 19:44:57 +0000 2018,$TWTR this is becoming my greatest investment of all time....,0
Fri Jun 22 19:33:01 +0000 2018,Want to get a return on the investment you have in your yard signs? Learn these #realestatemarketing tips to get li… https://t.co/HhIHcoEXEb,0
Fri Jun 22 18:40:34 +0000 2018,The Downtown Denver Partnership reports that 83 projects have been completed over the past five years or are curren… https://t.co/C2xmivLRVn,0
Fri Jun 22 18:33:01 +0000 2018,Want to get a return on the investment you have in your yard signs? Learn these #realestatemarketing tips to get li… https://t.co/nqSec6IFqS,0
Fri Jun 22 18:18:03 +0000 2018,A gift to Emily Griffith is a solid community investment. #HireEducation #adultedu https://t.co/uYPS7e0NY7 https://t.co/Lp16CSdpup,0
Fri Jun 22 17:56:53 +0000 2018,Can the good ship IPO set sail in constantly shifting markets? #IPO https://t.co/L2CxGDrNAB,0
Fri Jun 22 17:35:44 +0000 2018,When you purchase your #solarpower from Sopris Solar  you also qualify for a Federal Solar Tax Credit and the abili… https://t.co/PQgDvHX6Cf,3
Fri Jun 22 17:29:43 +0000 2018,@staubio @schmangee @StreetsPAC @wutrain I think that would be built into the funding. People want to see a return on their investment.,0
Fri Jun 22 17:27:48 +0000 2018,We knew they would come after social investment programs to fund the #GOPtaxscam that gave tax cuts to millionaires… https://t.co/5hNSJwgNtP,1
Fri Jun 22 17:27:35 +0000 2018,We knew they would come after social investment programs to fund the #GOPtaxscam that gave tax cuts to millionaires… https://t.co/5hNSJwgNtP,1
Fri Jun 22 17:20:22 +0000 2018,When you purchase your #solarpower from Sopris Solar  you also qualify for a Federal Solar Tax Credit and the abili… https://t.co/PQgDvHX6Cf,3
Fri Jun 22 17:19:20 +0000 2018,When you purchase your #solarpower from Sopris Solar  you also qualify for a Federal Solar Tax Credit and the abili… https://t.co/PQgDvHX6Cf,3
Fri Jun 22 17:18:48 +0000 2018,When you purchase your #solarpower from Sopris Solar  you also qualify for a Federal Solar Tax Credit and the abili… https://t.co/PQgDvHX6Cf,3
Fri Jun 22 16:40:09 +0000 2018,Bridging the Confidence Gap https://t.co/kQJwobN0cJ,0
Fri Jun 22 16:04:56 +0000 2018,The reasons to #invest may have nothing to do with your #retirement. Here are four good reasons. https://t.co/pnKyJ2hbxc,0
Fri Jun 22 16:00:04 +0000 2018,West Highland — The Know Neighborhoods | https://t.co/i3JjlG3Kx2 @thknwco @denverpost #Denver #Denverneighborhood… https://t.co/DqlZn4J0P8,0
Fri Jun 22 15:52:23 +0000 2018,Four Tips on How to Rescue a Bankrupt Business - The New York Times https://t.co/RCDz14pHPh,0
Fri Jun 22 15:38:02 +0000 2018,Not Me!!!  Start building you some residual income!!! Ask me HOW!! The best investment I could have ever made was i… https://t.co/M4Y4NJp1X1,0
Fri Jun 22 15:35:10 +0000 2018,"Four Tips on How to Rescue a Bankrupt Business" by PAUL SULLIVAN via NYT https://t.co/MzUCMrDLdA,0
Fri Jun 22 15:06:03 +0000 2018,From yesterday and for your weekend reading consideration:   What I learned about marketing from studying Warren Bu… https://t.co/alXIzbaLXk,0
Fri Jun 22 14:47:04 +0000 2018,It's largely expected to be good news today. PERA notched an 18.1% investment return last year  well above its assu… https://t.co/1SzkcZtOtD,1
Fri Jun 22 14:42:05 +0000 2018,It's largely expected to be good news today. PERA notched an 18.1% investment return last year  well above its assu… https://t.co/1SzkcZtOtD,1
Fri Jun 22 14:39:42 +0000 2018,@EVNewsDaily R #industrial &amp; #technology policies focused on #bEVs in #China are winning the #investment race? If… https://t.co/3rmB9q6YDq,0
Fri Jun 22 14:05:43 +0000 2018,Very interesting perspective on how private money and investment is widening inequities across cities. "The roads a… https://t.co/V3ifaxs5o7,0
Fri Jun 22 13:49:20 +0000 2018,Invest in OHOS! We're revolutionizing the world of performance management. Join over 200 total investors sharing in… https://t.co/kWIwMd1ArG,1
Fri Jun 22 13:41:38 +0000 2018,Chad always knew there would be a drop in Banana futures. #tokerware #investment #cannabis #Trump #DC #legalize https://t.co/Yx5BDFoRv4,1
Fri Jun 22 13:32:12 +0000 2018,The unique bank partnership program of @P2Binvestor is getting a boost with a new $17m investment:… https://t.co/jmE8Qns9EA,0
Fri Jun 22 13:30:27 +0000 2018,European digital bank BNI Europa is becoming a prolific #marketplacelending investor. Their latest is a €50m invest… https://t.co/EZgMKZZeCY,0
Fri Jun 22 13:04:45 +0000 2018,“Truly inclusive and connected cities are ones that prioritize moving people  not just cars. This area has been lon… https://t.co/PL01rUSdoh,5
Fri Jun 22 12:42:13 +0000 2018,Chad always knew there would be a drop in Banana futures. #tokerware #investment #cannabis #Trump #DC #legalize https://t.co/Yx5BDFoRv4,1
Fri Jun 22 12:29:54 +0000 2018,Broomfield-based Ball Corp. is forming a  new joint venture with California investment firm Platinum Equity  which… https://t.co/vWHhnuTl1U,0
Fri Jun 22 12:25:08 +0000 2018,Locally  this translates to a more than 12:1 return on investment for Colorado taxpayers. Read our full report for… https://t.co/TMvXkjHkob,2
Fri Jun 22 12:10:42 +0000 2018,"DFT Officials have a duty to look after taxpayers' money and make best use of scarce resources. The economic geogr… https://t.co/o6GXs2ioco,2
Fri Jun 22 11:50:26 +0000 2018,"DFT Officials have a duty to look after taxpayers' money and make best use of scarce resources. The economic geogr… https://t.co/o6GXs2ioco,2
Fri Jun 22 11:46:06 +0000 2018,"DFT Officials have a duty to look after taxpayers' money and make best use of scarce resources. The economic geogr… https://t.co/o6GXs2ioco,2
Fri Jun 22 10:50:06 +0000 2018,Bae and I have been making great money and I know having two cars is a great investment for us!,0
Fri Jun 22 07:37:15 +0000 2018,#futility #revenue #oneintention #nannystate #society #nakedheart #ranches #voting #newageofreason #onedirection… https://t.co/eGBKQ4i8kN,2
Fri Jun 22 07:16:28 +0000 2018,The European aerospace company Airbus is set to become the first big manufacturer to pull investment from Britain a… https://t.co/EDDXYyVM1C,1
Fri Jun 22 07:12:12 +0000 2018,The European aerospace company Airbus is set to become the first big manufacturer to pull investment from Britain a… https://t.co/EDDXYyVM1C,1
Fri Jun 22 04:17:20 +0000 2018,@Rajon___ @WellFrankIy @jagad5 @mikey_riccio @SenSanders Please  quality? You think somehow the US has better MRI m… https://t.co/bOBG28uxgN,0
Fri Jun 22 03:21:03 +0000 2018,@CrazyJuan77 @Avers_G4GMedia I mean  people make an investment in an ecosystem  and exclusives help them feel like… https://t.co/Lak3sH5bdJ,0
Fri Jun 22 02:39:21 +0000 2018,“Truly inclusive and connected cities are ones that prioritize moving people  not just cars. This area has been lon… https://t.co/PL01rUSdoh,5
Fri Jun 22 02:23:55 +0000 2018,“Truly inclusive and connected cities are ones that prioritize moving people  not just cars. This area has been lon… https://t.co/PL01rUSdoh,5
Fri Jun 22 01:49:37 +0000 2018,New data shows US broadband networks are getting faster; and getting faster faster  thanks to deregulation  investm… https://t.co/Syg2uSHcxw,0
Fri Jun 22 01:40:21 +0000 2018,🏡❤️Even if you’re not selling right now  you may have to make some updates when it comes time to sell. 💰These updat… https://t.co/BWjwkFleW7,0
Fri Jun 22 01:00:50 +0000 2018,**Coming soon**  4 bed  2.5 bath home on a quiet street in Green Valley Ranch! $350k DM me for details.  #Realtor… https://t.co/QP7naOorf2,0
Fri Jun 22 00:25:06 +0000 2018,This #research used an empirical approach to identify the impact of fees on money available to pay for college.… https://t.co/xGnJiC51yE,0
Fri Jun 22 00:02:04 +0000 2018,SoftBank leads $250 million investment in data storage startup Cohesity https://t.co/IJIg3F1uQt via @VentureBeat https://t.co/XTqeJsrCsn,0
