Fri Apr 20 23:13:06 +0000 2018,High house prices mean mortgage lending cannibalises investment in other sectors of the economy… https://t.co/MGJDvevNhU,23
Fri Apr 20 23:10:55 +0000 2018,The homebuying process for a second home or investment property is a little different. Here’s what to expect.… https://t.co/p0QHcBVxtV,0
Fri Apr 20 22:28:19 +0000 2018,@michaelmiraflor I'll believe it when I see it. And I'm on Flickr. Not much investment there for years.,0
Fri Apr 20 22:20:55 +0000 2018,@JKeeTrades @BenjiMax2 So you are telling me you don't do your own due diligence while investing? And bought LPTX b… https://t.co/NheMd8X1Q8,0
Fri Apr 20 21:13:17 +0000 2018,Canadian marijuana company buys up another California cannabis business https://t.co/tGVys9W7Q0,1
Fri Apr 20 19:52:00 +0000 2018,@_Sernie_Banders @HumanProgress you walked into this one....The great foreign investment only happened after Reagan… https://t.co/4qWHgZ5Gmy,0
Fri Apr 20 19:42:01 +0000 2018,This 100% leased office asset which sits on a 5 acre site in the heart of DTC is a great investment. Blended office… https://t.co/P4vI9zBr9B,0
Fri Apr 20 19:40:05 +0000 2018,Fixed income is back to being a producer for the investment banks.  https://t.co/eGTv6FuBLy,0
Fri Apr 20 19:16:37 +0000 2018,Just agreed to monitor "real estate investment trends and practices" at the Handler Thayer Family Office Forum  Jun… https://t.co/CJGUDiWRFG,0
Fri Apr 20 19:07:25 +0000 2018,Main Insights from ULI’s Semi-Annual CRE Forecast https://t.co/g5z53B9xBn by @nreionline,0
Fri Apr 20 19:05:26 +0000 2018,Is your home ready for the spring selling surge? Here are a few ways to make your home stand out during this year’s… https://t.co/Vy0lhDBSaO,0
Fri Apr 20 18:51:27 +0000 2018,Doug Robinson  perhaps best known as Mitt Romney's nephew (also a successful investment banker) cannot be on the GO… https://t.co/9tYstTGk7g,6
Fri Apr 20 18:50:27 +0000 2018,Facebook added housing and rental listings to its Marketplace feature. Marketplace listings are a worthwhile time i… https://t.co/gJN0UvsCN4,0
Fri Apr 20 18:30:35 +0000 2018,Great piece by @NiaInvest #CEO Kristin Hull on putting #feminism into #finance - "Now is the time to invest with a… https://t.co/h8vIJEMNeQ,0
Fri Apr 20 18:30:01 +0000 2018,Different Types of Home Loans: What's Best for You? | https://t.co/UM5MZUajCW @UsajRealty #Denver… https://t.co/W4pqKQwAhm,0
Fri Apr 20 17:29:19 +0000 2018,One of these is not like the other #TheRadicalLeftHatesAmerica  Follow @realErinCruz #ErinCruzLovesUS… https://t.co/5lywS4Q61D,57
Fri Apr 20 17:27:24 +0000 2018,Doug Robinson  perhaps best known as Mitt Romney's nephew (also a successful investment banker) cannot be on the GO… https://t.co/9tYstTGk7g,6
Fri Apr 20 17:26:33 +0000 2018,Doug Robinson  perhaps best known as Mitt Romney's nephew (also a successful investment banker) cannot be on the GO… https://t.co/9tYstTGk7g,6
Fri Apr 20 17:24:27 +0000 2018,Doug Robinson  perhaps best known as Mitt Romney's nephew (also a successful investment banker) cannot be on the GO… https://t.co/9tYstTGk7g,6
Fri Apr 20 17:22:51 +0000 2018,Doug Robinson  perhaps best known as Mitt Romney's nephew (also a successful investment banker) cannot be on the GO… https://t.co/9tYstTGk7g,6
Fri Apr 20 17:20:53 +0000 2018,Doug Robinson  perhaps best known as Mitt Romney's nephew (also a successful investment banker) cannot be on the GO… https://t.co/9tYstTGk7g,6
Fri Apr 20 17:20:04 +0000 2018,Doug Robinson  perhaps best known as Mitt Romney's nephew (also a successful investment banker) cannot be on the GO… https://t.co/9tYstTGk7g,6
Fri Apr 20 17:19:28 +0000 2018,One of these is not like the other #TheRadicalLeftHatesAmerica  Follow @realErinCruz #ErinCruzLovesUS… https://t.co/5lywS4Q61D,57
Fri Apr 20 17:19:01 +0000 2018,One of these is not like the other #TheRadicalLeftHatesAmerica  Follow @realErinCruz #ErinCruzLovesUS… https://t.co/5lywS4Q61D,57
Fri Apr 20 17:17:12 +0000 2018,One of these is not like the other #TheRadicalLeftHatesAmerica  Follow @realErinCruz #ErinCruzLovesUS… https://t.co/5lywS4Q61D,57
Fri Apr 20 17:11:55 +0000 2018,Don't kid yourself: This is also a warning message sent to House Dems that the proposed ballot initiative that they… https://t.co/KfB0AFlT8n,0
Fri Apr 20 16:47:02 +0000 2018,Do you know how much risk you’re comfortable with? Would you rather be reading or skydiving right now? https://t.co/uUpH4jvx1y,0
Fri Apr 20 16:26:26 +0000 2018,@_Sernie_Banders @HumanProgress Ford has shut down over 40 us PLANTS and has spent over $6 billion on new plants in… https://t.co/LXJ32ERvnf,0
Fri Apr 20 15:51:31 +0000 2018,Biogen boosts investment in neurology with $1 bln Ionis deal https://t.co/Aw4JJXWZan,0
Fri Apr 20 15:50:12 +0000 2018,**New Listing from Wendy Ferrell**  Fantastic Investment Opportunity in High-Demand Metro Denver! Two Bedroom  Two… https://t.co/CDHyKOQwWS,0
Fri Apr 20 15:40:50 +0000 2018,Bitcoin: it’s the wild west out there  and there's no sheriff. #Bitcoin https://t.co/Rum6cB1xqC,0
Fri Apr 20 15:32:56 +0000 2018,Apple Music is the best investment,0
Fri Apr 20 15:26:50 +0000 2018,Corporations are taking advantage of  a “pretty hot market” for sale-leaseback transactions - Guy Ponticiello… https://t.co/4VZFsasxy1,2
Fri Apr 20 15:24:19 +0000 2018,@SarcastiCarrie Yes  good point! Giving kids the tools and education to know a good educational investment from a bad one.,0
Fri Apr 20 15:20:18 +0000 2018,RT @BrentBouldin ARE PROGRAMMATIC DISPLAY ADS WORTH THE INVESTMENT? https://t.co/G3F0c7vmVe https://t.co/4oDeSWCP61,0
Fri Apr 20 14:34:50 +0000 2018,Demand for Tax Guard Grows  and Receives Private Equity Investment -  https://t.co/GzmSsJ8v0R,0
Fri Apr 20 14:11:33 +0000 2018,Corporations are taking advantage of  a “pretty hot market” for sale-leaseback transactions - Guy Ponticiello… https://t.co/4VZFsasxy1,2
Fri Apr 20 14:02:00 +0000 2018,Corporations are taking advantage of  a “pretty hot market” for sale-leaseback transactions - Guy Ponticiello… https://t.co/4VZFsasxy1,2
Fri Apr 20 14:00:02 +0000 2018,Become a successful investor: Participate in the RVC Angel Accelerator and learn how to be a SMART Angel and receiv… https://t.co/102jk1pxKC,0
Fri Apr 20 13:40:49 +0000 2018,Interesting thought. My business doesn't need investment  but if I took it what would I spend it on? https://t.co/8RB7yJjwtI,1
Fri Apr 20 13:39:45 +0000 2018,RT @MiningFan "Due to unnecessary hurdles in the U.S. mine #permitting process  it can take between seven to 10 yea… https://t.co/zF2BOCXyBr,4
Fri Apr 20 13:15:43 +0000 2018,Gather compliance disclosures from your Investment Adviser Representatives says Todd Sakoda  a coach in… https://t.co/Chdgr5bgLb,4
Fri Apr 20 12:50:58 +0000 2018,@Ski___10 It’s definitely on my list of goals to accomplish  you need about 250k to start up but the turn around on… https://t.co/DVYU9DNLFa,0
Fri Apr 20 12:45:52 +0000 2018,#Peru will encourage #mining investment  but will not impose projects on communities. https://t.co/aWfVrPwgPA… https://t.co/uO0wSyu1Ld,1
Fri Apr 20 12:45:06 +0000 2018,Would you do me a favor and try out Acorns' spare change investment app?    Deposit $5 today and receive a $5 match… https://t.co/RKZNLWQDfc,0
Fri Apr 20 12:29:09 +0000 2018,Don't say no to free 💰...Join Acorns today with an initial investment of $5 (or more) and start saving for your ret… https://t.co/OXSpPTLiPG,0
Fri Apr 20 12:21:11 +0000 2018,Biogen boosts investment in neurology with $1 billion Ionis deal https://t.co/Rb7QI6NTm9,0
Fri Apr 20 12:10:23 +0000 2018,We would like to help you stay ahead of the curve.   Let us explain how e-commerce and other retail trends are effe… https://t.co/xqRF8FJVtJ,0
Fri Apr 20 03:46:29 +0000 2018,Multiple Great Properties in Fremont County  Colorado--Perfect Investment Opportunity!: https://t.co/FfYJCBy5xA via @YouTube,0
Fri Apr 20 03:00:19 +0000 2018,Buying a home can be a smart and exciting investment in your future. If you’re thinking about homeownership  contac… https://t.co/6C8AVapZ3g,0
Fri Apr 20 02:41:32 +0000 2018,Skull wishes you stop fetishizing it and start a #401k  #tokerware #comedy #content #creative #smart #investment https://t.co/sQ9zbnbhbL,1
Fri Apr 20 02:22:18 +0000 2018,Skull wishes you stop fetishizing it and start a #401k  #tokerware #comedy #content #creative #smart #investment https://t.co/sQ9zbnbhbL,1
Fri Apr 20 01:12:19 +0000 2018,Purchasing your home is one thing  protecting it is a whole new animal. Make sure your investment is burglar proof … https://t.co/lq3ATCXYeH,0
Fri Apr 20 00:41:39 +0000 2018,Chad always knew there would be a drop in Banana futures. #tokerware #investment #cannabis #Trump #DC #legalize https://t.co/XULG6Hxt6J,2
Fri Apr 20 00:23:02 +0000 2018,Chad always knew there would be a drop in Banana futures. #tokerware #investment #cannabis #Trump #DC #legalize https://t.co/XULG6Hxt6J,2
Fri Apr 20 00:19:28 +0000 2018,RT @MiningFan "Due to unnecessary hurdles in the U.S. mine #permitting process  it can take between seven to 10 yea… https://t.co/zF2BOCXyBr,4
Fri Apr 20 00:06:14 +0000 2018,Chad always knew there would be a drop in Banana futures. #tokerware #investment #cannabis #Trump #DC #legalize https://t.co/XULG6Hxt6J,2
