Mon Dec 31 23:45:05 +0000 2018,Value. Growth. Cycles. Underperform. Outperform. Confusing? When was your last Investment IQ test? #ValueInvesting https://t.co/Cat5rHsecK,0
Mon Dec 31 23:33:16 +0000 2018,Buying a home is by far the largest investment most people make  and usually one of the most confusing. @Tennessean… https://t.co/peroKR3HkZ,1
Mon Dec 31 23:21:04 +0000 2018,Buying a home is by far the largest investment most people make  and usually one of the most confusing. @Tennessean… https://t.co/peroKR3HkZ,1
Mon Dec 31 23:15:16 +0000 2018,@MrFroto @realDonaldTrump Correct. I choose to be liberal. But I also try to listen to other ideas. I’ve yet to hea… https://t.co/yWos2cu5lZ,0
Mon Dec 31 23:00:01 +0000 2018,Have you used a junk-drawer approach to manage your investments? #InvestmentStrategy https://t.co/7r8KCPit5w,0
Mon Dec 31 21:46:26 +0000 2018,Stupid part is I can buy it  I can take the loan and pay half down and be good  but that money is for growing a bus… https://t.co/iurCK8CmVZ,0
Mon Dec 31 21:43:16 +0000 2018,New on SI: Fantasy Football 2018 Return On Investment All-Star Team https://t.co/mduKICN1Jd,0
Mon Dec 31 21:08:52 +0000 2018,Thanks to all our employees  customers and partners for a great year. We accomplished a lot in 2018 including openi… https://t.co/1NXhQw2euX,3
Mon Dec 31 20:35:02 +0000 2018,Marguerita Cheng  CEO of Blue Ocean Global Wealth  is one of the best #speakers on #investment and #finance for… https://t.co/Ivbn6fYCFH,0
Mon Dec 31 20:18:40 +0000 2018,Thanks to all our employees  customers and partners for a great year. We accomplished a lot in 2018 including openi… https://t.co/1NXhQw2euX,3
Mon Dec 31 20:06:17 +0000 2018,@MiamiDolphins That’s a start...get rid of Tannenhill and how about spent some money owner!  Take some investment i… https://t.co/SoWrMgM7IM,0
Mon Dec 31 19:19:35 +0000 2018,I added a video to a @YouTube playlist https://t.co/PaNJJnpX5e Top 5 Single Zeta Teams! Great Return on Investment! Star Wars Galaxy,0
Mon Dec 31 18:24:08 +0000 2018,@satanlcmechanlc @PlugInFUD @elonmusk @Tesla Not a sound investment for that much cash flow,0
Mon Dec 31 17:45:18 +0000 2018,@silverguru22 Hey there David.....thought you might enjoy this interview with Jim Cook of Silver Investment Raritie… https://t.co/s0nIbq1AwQ,0
Mon Dec 31 17:33:09 +0000 2018,Jim Cook of Investment Rarities Incorporated digs into what's going on with #silvermanipulation  #TedButler  and… https://t.co/RAmKN4SgJ6,0
Mon Dec 31 17:31:43 +0000 2018,We partnered with @Ecotone_PBC to understand the social return on investment of our peer coaching. See the full rep… https://t.co/L0VDuW2Crp,1
Mon Dec 31 16:34:01 +0000 2018,We partnered with @Ecotone_PBC to understand the social return on investment of our peer coaching. See the full rep… https://t.co/L0VDuW2Crp,1
Mon Dec 31 16:01:11 +0000 2018,This week's rising U.S. "related topics" in Google Trends associated with the term "startup business" included inve… https://t.co/3f1f9gBDRg,0
Mon Dec 31 15:30:14 +0000 2018,I believe God has great things in store this ministry. As 2018 ends  I invite you to make an investment in 2019. Wi… https://t.co/qRSVGzDfBB,0
Mon Dec 31 15:09:56 +0000 2018,The recent volatility in the #markets is a good reminder on the importance of limiting losses. As losses grow  so d… https://t.co/ECxMD7kJr5,1
Mon Dec 31 15:04:00 +0000 2018,Thanks to all our employees  customers and partners for a great year. We accomplished a lot in 2018 including openi… https://t.co/1NXhQw2euX,3
Mon Dec 31 14:44:50 +0000 2018,Learn from @ehorley "Why an Investment in #IPv6 Training Will Pay Off" @Infoblox #IPv6 Center of Excellence blog https://t.co/TowvLY0Zhg,14
Mon Dec 31 14:40:04 +0000 2018,2018 Year-in-Review: CRE’s 10 Most Important Stories: https://t.co/7Vw36eYzOQ,0
Mon Dec 31 13:51:35 +0000 2018,I believe God has great things in store this ministry. As 2018 ends  I invite you to make an investment in 2019. Wi… https://t.co/38nOHlltv8,2
Mon Dec 31 13:09:10 +0000 2018,No Investment Strategies Are Worse Than Cryptocurrencies – Professor of Finance  👉👉 https://t.co/I6UxHMizGH  /By Ch… https://t.co/WMuZtSsOFl,0
Mon Dec 31 13:07:24 +0000 2018,RT @DecentralisedW: Enhance business income https://t.co/GiKzFXQ4Te #investment #finance #business #innovation… https://t.co/u7Qe69AVpl,0
Mon Dec 31 13:07:16 +0000 2018,RT @DecentralisedW: Work from home https://t.co/GiKzFXQ4Te #investment #finance #business #innovation #workfromhome… https://t.co/nVPX2rARMk,0
Mon Dec 31 11:13:01 +0000 2018,@philosophrob @PaulSorrentino3 @USProgressives This is solid work. Thank you for bringing this to light.  There are… https://t.co/pLqzWVX4IA,2
Mon Dec 31 11:07:58 +0000 2018,RT @DecentralisedW: Boost your retirement  https://t.co/GiKzFXQ4Te #investment #finance #business #innovation… https://t.co/g76LaqiEx9,1
Mon Dec 31 11:07:38 +0000 2018,RT @DecentralisedW: Boost your retirement  https://t.co/GiKzFXQ4Te #investment #finance #business #innovation… https://t.co/g76LaqiEx9,1
Mon Dec 31 11:03:22 +0000 2018,Graduate college  get a diploma and most likely a mountain of debt. Your mission is to find a job where you make en… https://t.co/XA6xa2ySfU,2
Mon Dec 31 07:50:01 +0000 2018,Marguerita Cheng  CEO of Blue Ocean Global Wealth  is one of the best speakers on #finance and #investment for… https://t.co/zqxHey86TO,0
Mon Dec 31 06:16:14 +0000 2018,@EricWynalda @BradKonerman Great investment for Stan.  Great  young player + marketable.,0
Mon Dec 31 02:14:10 +0000 2018,Invest  Save  and Learn with the Stash Investment App https://t.co/4cpI7ykCaR,0
Mon Dec 31 01:51:25 +0000 2018,I believe God has great things in store this ministry. As 2018 ends  I invite you to make an investment in 2019. Wi… https://t.co/38nOHlltv8,2
Mon Dec 31 01:38:08 +0000 2018,Graduate college  get a diploma and most likely a mountain of debt. Your mission is to find a job where you make en… https://t.co/XA6xa2ySfU,2
Mon Dec 31 01:37:04 +0000 2018,Graduate college  get a diploma and most likely a mountain of debt. Your mission is to find a job where you make en… https://t.co/XA6xa2ySfU,2
