Wed Aug 22 23:47:20 +0000 2018,I want to integrate #steem #cryptocurrency #blockchain into the all #unitedstates Law enforcement and military bran… https://t.co/B4neIoK0Ma,0
Wed Aug 22 23:08:20 +0000 2018,I liked a @YouTube video https://t.co/YxkuJ90Ap4 Don't Be Fooled - Cryptocurrency Will Make A Lot Of People Very Rich,0
Wed Aug 22 23:02:24 +0000 2018,P2P Cryptocurrency Lending Grows Increasingly Popular in China https://t.co/UPSXgIEdjI https://t.co/1GdjsLIW0c,0
Wed Aug 22 22:27:04 +0000 2018,Don't forget the #SanDiego #Cryptocurrency &amp; Coffee meetup. Join us! https://t.co/0q2myW3GLZ,0
Wed Aug 22 22:15:17 +0000 2018,Entrepreneurs Are Flocking to Europe to Open Cryptocurrency Businesses https://t.co/6I0eSXvChT,4
Wed Aug 22 22:12:23 +0000 2018,Entrepreneurs Are Flocking to Europe to Open Cryptocurrency Businesses https://t.co/6I0eSXvChT,4
Wed Aug 22 21:53:42 +0000 2018,Entrepreneurs Are Flocking to Europe to Open Cryptocurrency Businesses https://t.co/6I0eSXvChT,4
Wed Aug 22 21:39:25 +0000 2018,Are you thinking of investing in crypto currency? https://t.co/TgbpzUAJtS,0
Wed Aug 22 21:37:04 +0000 2018,When you go for a run with the Run2Play GPS app you can earn #cryptocurrency and #feedwithfitness. Let’s run until… https://t.co/06pFaTwEql,0
Wed Aug 22 21:36:47 +0000 2018,What a beautiful event at Blockshow Americas Las Vegas. Truly inspiring seeing so many gems of humans come together… https://t.co/7mYTdH30PE,0
Wed Aug 22 20:49:25 +0000 2018,Entrepreneurs Are Flocking to Europe to Open Cryptocurrency Businesses https://t.co/6I0eSXvChT,4
Wed Aug 22 20:36:31 +0000 2018,@AdvancedHPC offers exceptional pricing and support on the #NVIDIA #TeslaV100 16GB HBM2 Passive Cooling Graphics Ca… https://t.co/Isyzss879r,3
Wed Aug 22 19:40:56 +0000 2018,New triple-play ICO investment:  #coldfusion  transmuting elements  and #cryptocurrency. New application of “synerg… https://t.co/mJoOJ5wJqR,0
Wed Aug 22 18:03:41 +0000 2018,@AdvancedHPC offers exceptional pricing and support on the #NVIDIA #TeslaV100 16GB HBM2 Passive Cooling Graphics Ca… https://t.co/Isyzss879r,3
Wed Aug 22 18:03:19 +0000 2018,@AdvancedHPC offers exceptional pricing and support on the #NVIDIA #TeslaV100 16GB HBM2 Passive Cooling Graphics Ca… https://t.co/Isyzss879r,3
Wed Aug 22 18:02:13 +0000 2018,@AdvancedHPC offers exceptional pricing and support on the #NVIDIA #TeslaV100 16GB HBM2 Passive Cooling Graphics Ca… https://t.co/Isyzss879r,3
Wed Aug 22 15:11:54 +0000 2018,@businessinsider did a great write up about @Dashpay’s success in Venezuela! #dash #blockchain #venezuela https://t.co/pKz5gdAXkE,0
Wed Aug 22 14:13:50 +0000 2018,Hot off the press! The Lunafi Daily is out now  with the latest #cryptocurrency and #blockchain news!… https://t.co/PAAH95IxyU,1
Wed Aug 22 14:02:43 +0000 2018,Hot off the press! The Lunafi Daily is out now  with the latest #cryptocurrency and #blockchain news!… https://t.co/PAAH95IxyU,1
Wed Aug 22 10:04:55 +0000 2018,PR: More Stamps Global Launches – Cryptocurrency Travel Agency Opens Doors to World https://t.co/PuKOuzql3L https://t.co/RMvEN6by3P,0
Wed Aug 22 09:04:37 +0000 2018,Locktrip LOC Is Now Available At KuCoin Cryptocurrency Exchange Platform https://t.co/oavhwmlwKd https://t.co/KZoJQOsrvV,0
Wed Aug 22 07:57:12 +0000 2018,A cryptocurrency is making huge inroads in Venezuela as inflation runs wild — and it's not bitcoin or the Petro https://t.co/0T4cyLdJXJ,0
Wed Aug 22 05:53:56 +0000 2018,https://t.co/hfbCBNCQLX #FlipNpik #Crypto #Blockchain #FNP #Stellar #Bitcoin #Cryptocurrency #BTC #XLM #GoLocal… https://t.co/1qExv0s7XQ,0
Wed Aug 22 05:51:26 +0000 2018,INSCOIN - The KNOX project will be the first insurance company that merges the real world with the digital one usin… https://t.co/eQ52du2WzI,0
Wed Aug 22 05:45:42 +0000 2018,#VIVA #VIVANETWORK @TheVivaNetwork #TokenSale #ICO #bitcoin #ethereum #crypto #cryptocurrency #vivafam https://t.co/fb1nmEdngi,0
Wed Aug 22 05:45:35 +0000 2018,#VIVA #VIVANETWORK @TheVivaNetwork #TokenSale #ICO #bitcoin #ethereum #crypto #cryptocurrency #vivafam https://t.co/uKZ5BxIHpb,0
Wed Aug 22 04:47:39 +0000 2018,I’m done with the Bears 🐻. Lets go Bulls 💪💰 Chega dos ursos 🐻. Vamos torcer pros touros 💪💰 #cryptos #blockchain… https://t.co/HNTvYeTBeC,2
Wed Aug 22 03:13:25 +0000 2018,Entrepreneurs Are Flocking to Europe to Open Cryptocurrency Businesses https://t.co/6I0eSXvChT,4
Wed Aug 22 01:01:57 +0000 2018,CRYPTO: BITCOIN TRAP? CRYPTOCURRENCY LITECOIN ETHEREUM XRP RIPPLE TRON TRX ADA CARDANO EOS BTC NEWS The post CRYPTO… https://t.co/NLXoYNR6tQ,0
