Wed Jul 04 23:58:35 +0000 2018,Behind my hotel in #tonopah ... Leftovers from the boomtown mining  days. Gonna go on a walkabout now...… https://t.co/7ff8SUrtxq,0
Wed Jul 04 23:42:40 +0000 2018,Behind my hotel in #tonopah ... Leftovers from the boomtown mining  days. Gonna go on a walkabout now...… https://t.co/5UUqSbYJC4,0
Wed Jul 04 23:12:06 +0000 2018,#Bytecoin (#BCN) is one of the largest gainers in the digital currency market  Market https://t.co/5O71Yo46nA,38
Wed Jul 04 21:50:02 +0000 2018,Bitcoin Mining To Use 0.5% Of World’s Energy By End Of 2018  Peer-Reviewed Research Shows https://t.co/slrXBDU1ae https://t.co/aiSAN94hrL,0
Wed Jul 04 21:29:31 +0000 2018,“ On July 2  a Japanese district court sentenced to imprisonment a 24-year-old man who was found guilty in a remote… https://t.co/ZSWe6E8F3e,0
Wed Jul 04 21:20:00 +0000 2018,Apple bans crypto-mining apps from App Store to protect your battery life https://t.co/crPKkksz37,0
Wed Jul 04 21:11:54 +0000 2018,Hidden cryptocurrency mining: essence  harm  and ways of protecting https://t.co/dHYDtNDSVh https://t.co/1dhnItClkv,0
Wed Jul 04 20:34:57 +0000 2018,Data Mining fucking scary breh stop dis shit,1
Wed Jul 04 20:21:03 +0000 2018,Bitmain Nears 51% of Network Hash Rate: Why This Matters and Why It Doesn’t https://t.co/pwONZMauV1 #bitcoin #mining,0
Wed Jul 04 20:05:06 +0000 2018,Data Mining fucking scary breh stop dis shit,1
Wed Jul 04 18:43:13 +0000 2018,Start mining for FREE  https://t.co/96Rbup3Foj    #decentralized #miner #mining #cloudminer #bitcoinminer #antminer… https://t.co/9DIeQrj4x8,2
Wed Jul 04 18:40:22 +0000 2018,Start mining for FREE  https://t.co/96Rbup3Foj    #decentralized #miner #mining #cloudminer #bitcoinminer #antminer… https://t.co/9DIeQrj4x8,2
Wed Jul 04 18:39:41 +0000 2018,PASSIVE INCOMING!   https://t.co/cEgedn5Ugd  #airdrop #bounty #coinex #mining #dividend #passiveincome #income… https://t.co/Bt1PtjSMBJ,1
Wed Jul 04 17:44:48 +0000 2018,Start mining for FREE  https://t.co/96Rbup3Foj    #decentralized #miner #mining #cloudminer #bitcoinminer #antminer… https://t.co/9DIeQrj4x8,2
Wed Jul 04 17:27:47 +0000 2018,PASSIVE INCOMING!   https://t.co/cEgedn5Ugd  #airdrop #bounty #coinex #mining #dividend #passiveincome #income… https://t.co/Bt1PtjSMBJ,1
Wed Jul 04 17:24:27 +0000 2018,XIMEN MINING CORP (XXMMF: OTCQB) | Ximen Mining shareholders approve all matters at AGM https://t.co/6Fia1E3SVL,0
Wed Jul 04 17:24:16 +0000 2018,New Age Metals Inc. (NMTLF: OTCQB) | NMTLF Appoints Veteran Mining Engineer to Oversee River Valley PGM Projects Fi… https://t.co/UGiKLQZcA9,0
Wed Jul 04 17:10:24 +0000 2018,#CoreScientific is building #blockchaininfrastructure technology. Headquartered in Bellevue  Wash.  most of its emp… https://t.co/GD0kUh4nOr,0
Wed Jul 04 16:43:17 +0000 2018,@sballister @katemccloudsays @Public_Meltdown The hypocrisy of that statement. You know that it is human beings tha… https://t.co/CqecPhPBYQ,0
Wed Jul 04 16:20:50 +0000 2018,To all those mining crypto  ETN is forking back to CN. So its on again for all the X3 owner's out there. cheers,1
Wed Jul 04 16:12:48 +0000 2018,In three parts  @globalpost and @PRI profile #GoldmanPrize winner Maxima Acuña's ongoing struggle to protect her la… https://t.co/Q6Gq5uhdgc,7
Wed Jul 04 15:18:17 +0000 2018,$FAV.H:CN - Press Release - to achieving peak operational efficiency in industrial scale Bitcoin mining  to ultimat… https://t.co/xZYV1W5CBQ,0
Wed Jul 04 15:18:16 +0000 2018,$FAV.H:CN - Press Release - facility in Washington state which has been in continuous operation since 2014  which s… https://t.co/tKQHYX1GeE,0
Wed Jul 04 14:11:36 +0000 2018,$IQ3:GR - Press Release - reward is gained as a result of mining cryptocurrencies. We are currently mining Bitcoin… https://t.co/pCQ9ctlJUW,0
Wed Jul 04 14:11:36 +0000 2018,$IQ3:GR - Press Release - are operating as planned. Mining reward *2 (Reference) rate as of the end of each month H… https://t.co/SZDy8jpA3a,0
Wed Jul 04 13:33:06 +0000 2018,In three parts  @globalpost and @PRI profile #GoldmanPrize winner Maxima Acuña's ongoing struggle to protect her la… https://t.co/Q6Gq5uhdgc,7
Wed Jul 04 12:41:02 +0000 2018,VLF technology has an important role in better underground safety says Booyco: The application of very low frequenc… https://t.co/70DhhZKdic,0
Wed Jul 04 12:30:34 +0000 2018,Op-Ed: Challenge of Mining Centralization Unveils Bitcoin’s Elegant Design https://t.co/DHn8BZfOgE by @nozomimagine,0
Wed Jul 04 12:20:08 +0000 2018,These are the largest Bitcoin mining farms in the world https://t.co/k9LiIHCHPB https://t.co/b3QmwoMzh2,2
Wed Jul 04 12:19:16 +0000 2018,Trainers  Travel   we still have to analyze the network traffic  do the data mining and  finish decompiling all the… https://t.co/Dx88InoUbp,2
Wed Jul 04 12:16:39 +0000 2018,RT TheHackersNews: Instead of directly injecting #CoinHive JavaScript into hacked websites  cybercriminals have now… https://t.co/hYbFoGx35B,0
Wed Jul 04 12:00:23 +0000 2018,$CUV:CN - Press Release - technologies in the; Online Travel  Vacation Resort  Mobile Apps  Money Remittance  Invoi… https://t.co/uLfQcDKT6X,0
Wed Jul 04 12:00:09 +0000 2018,SWISS ALPS MINING – The Smart Mining Company https://t.co/nkMFka5GDA via @ICOPRESIDENT.COM #icopresident #ICO… https://t.co/2eeG6GnE8T,0
Wed Jul 04 11:55:01 +0000 2018,Anaconda Mining Inc. (ANXGF: OTCQX International) | Anaconda to Increase Offer to Maritime Shareholders to $0.21 Pe… https://t.co/Y6LDaRBdG5,0
Wed Jul 04 11:51:48 +0000 2018,Trainers  The following files have been added and modified in the APK of the new version 0.109.1 of Pokemon GO.  57… https://t.co/V4GIuaQAMb,1
Wed Jul 04 11:18:33 +0000 2018,Trainers  Travel   we still have to analyze the network traffic  do the data mining and  finish decompiling all the… https://t.co/Dx88InoUbp,2
Wed Jul 04 11:11:39 +0000 2018,Founder of Maxthon browser  Jeff Chen creates new non-profit mining browser👍👍 https://t.co/xSTUEYfRzt https://t.co/en2s9gJszn,2
Wed Jul 04 11:11:32 +0000 2018,Watching World Cup wasn't enough for you? Let’s watch game  guess the result and win LVT together!🥂🥂Just click Mini… https://t.co/8SMzFrHCv8,1
Wed Jul 04 10:52:55 +0000 2018,[NEW UPDATE]  Trainers  Pokemon GO is in the process of being updated to the new version 0.109.2 for Android device… https://t.co/mlaTASGCUN,19
Wed Jul 04 10:33:14 +0000 2018,These are the largest Bitcoin mining farms in the world https://t.co/k9LiIHCHPB https://t.co/b3QmwoMzh2,2
Wed Jul 04 10:24:04 +0000 2018,What is #Bitcoin and #Bitcoin Mining? How Does it Work? https://t.co/SpaVJBcTWx,0
Wed Jul 04 10:23:09 +0000 2018,Trainers  Travel   we still have to analyze the network traffic  do the data mining and  finish decompiling all the… https://t.co/Dx88InoUbp,2
Wed Jul 04 10:20:02 +0000 2018,Cases Of Illegal Bitcoin And Cryptocurrency Mining: Chicken Farms And New York https://t.co/2NnlkNUdnq https://t.co/oNztfGTjAv,0
Wed Jul 04 09:12:29 +0000 2018,Global &amp; American Human Rights &amp; Environmental Defenders Take Note &gt; @McKinsey: Productivity across the global mini… https://t.co/SE5rs8ldJE,0
Wed Jul 04 08:26:14 +0000 2018,Instead of directly injecting #CoinHive JavaScript into hacked websites  cybercriminals have now started abusing Co… https://t.co/T8vscETKfp,0
Wed Jul 04 08:15:02 +0000 2018,CoinHive URL Shortener Abused to Secretly Mine #CryptoCurrency Using #hacked Sites https://t.co/OAcyrqcNMq,0
Wed Jul 04 08:05:27 +0000 2018,Data-mining companies use free apps to hook users into giving up access to inboxes without clearly stating what dat… https://t.co/RQAsLU4tIc,21
Wed Jul 04 07:30:05 +0000 2018,These are the largest Bitcoin mining farms in the world https://t.co/k9LiIHCHPB https://t.co/b3QmwoMzh2,2
Wed Jul 04 07:29:07 +0000 2018,#Hadron Beta #Mining is a chance to earn #free #tokens for everyone! Post your #hardware configurations here:… https://t.co/pbQqrz5Jav,0
Wed Jul 04 07:16:24 +0000 2018,Ep. 12 of @TechBuzzChina by @thepandaily @ruima is all about #cryptocurrency. The world's biggest crypto co  Beijin… https://t.co/ih7LZm5xGL,3
Wed Jul 04 06:12:00 +0000 2018,Icelandic foresight is impressive - not replicating what happened during the 2008 financial crisis with current's B… https://t.co/j9zLipXG7h,0
Wed Jul 04 04:57:10 +0000 2018,Are you mining bitcoin on my @lyft app,0
Wed Jul 04 04:11:06 +0000 2018,Ep. 12 is all about #cryptocurrency. The world's biggest crypto co  Beijing's @BITMAINtech  held ~70% of market sha… https://t.co/OW0uSGkmjJ,3
Wed Jul 04 03:48:04 +0000 2018,The Wilderness Society fights mining on the edge of America’s most visited Wilderness area: The Wilderness Society… https://t.co/5HOW7rEgnx,0
Wed Jul 04 03:45:23 +0000 2018,When you pay mining fees  they go to PoW that safeguards against theft  plus R&amp;D that will commoditize mining equip… https://t.co/YgZYotWhVy,75
Wed Jul 04 02:26:15 +0000 2018,When you pay mining fees  they go to PoW that safeguards against theft  plus R&amp;D that will commoditize mining equip… https://t.co/YgZYotWhVy,75
Wed Jul 04 02:12:54 +0000 2018,Bitcoin is the greatest scam in history https://t.co/BiUecR6M5M https://t.co/cmkGg4SkQs,70
Wed Jul 04 02:01:08 +0000 2018,Five people suspected of illegal gold mining in Peru are in custody after indigenous community members used a syste… https://t.co/ZT2hgplWbj,18
Wed Jul 04 01:16:03 +0000 2018,Mining for Bitcoin in a remote Russian outpost https://t.co/xxfM1ul1px https://t.co/CgPfWioa0V,0
Wed Jul 04 01:08:25 +0000 2018,Extreme #BitcoinMining Aids an Unexpected Revolution in Iceland #Datacenter #CloudComputing  https://t.co/cZHgz95qIp,0
Wed Jul 04 00:29:51 +0000 2018,Five people suspected of illegal gold mining in Peru are in custody after indigenous community members used a syste… https://t.co/ZT2hgplWbj,18
Wed Jul 04 00:12:02 +0000 2018,Innovative mining projects share in $7 million: Today the Turnbull Government announced project funding investment… https://t.co/gtgbk2hpJ4,0
