Mon Sep 17 23:30:20 +0000 2018,Email us @ https://t.co/OHHpWvEREN if you are looking for power deals for your #cryptomining operations  #bitcoin … https://t.co/4yDofqD8G0,0
Mon Sep 17 22:49:16 +0000 2018,How will the crypto recipients of the Mt. Gox settlement effect the short-term market? https://t.co/2cltx5vkVu,0
Mon Sep 17 22:03:44 +0000 2018,Bitcoin  Ethereum  Ripple  Bitcoin Cash  EOS  Stellar  Litecoin  Cardano  Monero  IOTA: Price Analysis  September 17 https://t.co/vVatiYwpGJ,0
Mon Sep 17 03:09:30 +0000 2018,Email us @ execsummary@protonmail.ch if you are looking for power deals for your #cryptomining operations  #bitcoin… https://t.co/vgnnJ1ik4i,1
Mon Sep 17 03:06:52 +0000 2018,Email us @ execsummary@protonmail.ch if you are looking for power deals for your #cryptomining operations  #bitcoin… https://t.co/vgnnJ1ik4i,1
Mon Sep 17 00:58:14 +0000 2018,Cardano  EOS  Stellar Lumens  Monero  Litecoin Price Analysis: Exchanges Ramp Up Altcoin Listings  Hints of Market… https://t.co/p1gFkQoqYh,0
