Mon May 28 20:37:53 +0000 2018,Crypto is making its way into the movie plots. #cryptocurrencies #bitcoin #ethereum #btc #litecoin #ltc #eth… https://t.co/DWJRghWHFb,0
Mon May 28 15:55:47 +0000 2018,SAN ANTONIO   TEXAS  DR. Thomas T. Jeneby  Recently named Top Doctor of Texas by Cosmopolitan Magazine… https://t.co/hNoUlBrDBH,26
Mon May 28 15:10:08 +0000 2018,https://t.co/dn0IVaXpd2  For the ones that were inquiring .........heres the website .  This and many others for sa… https://t.co/gzZgrPK8wb,18
Mon May 28 15:06:50 +0000 2018,SAN ANTONIO   TEXAS  DR. Thomas T. Jeneby  Recently named Top Doctor of Texas by Cosmopolitan Magazine… https://t.co/hNoUlBrDBH,26
Mon May 28 13:33:35 +0000 2018,SOUTH KOREA  Travel site to accept 12  #cryptocurrencies for over 50 000 motels ! Adoption and usage is what we nee… https://t.co/hqEkgOvLY1,49
Mon May 28 07:21:09 +0000 2018,#litecoin /  #usd  technical analysis. The downtrends are not just for LTC but quite universal. Litecoin has a long… https://t.co/NaZIxh9mFw,0
Mon May 28 03:40:56 +0000 2018,SAN DIEGO   CALIFORNIA  The Crypto Lawyers     Accepts #Vertcoin                     #litecoin… https://t.co/uFxYV7FFnV,19
