Sat Jun 30 12:21:39 +0000 2018,NSW AUSTRALIA        BILPIN AFIRE Bar &amp; Grill  #acceptslitecoin  2488 Bells Line of Road Bilpin NSW Australia  2758… https://t.co/JodOn2LK4q,20
Sat Jun 30 12:21:35 +0000 2018,PERTH   AUSTRALIA  Perth Plumbers &amp; Gasfitters   #acceptscrypto !!  #litecoin #verge #xrp #bitcoin and #trx  🎯💯🎯… https://t.co/wJyDQojgQN,16
Sat Jun 30 12:21:29 +0000 2018,SLAVANIJA   DELI . in AUSTRALIA  #acceptsLitecoin  #paywithlitecoin  Soon #Litecoin will be so massively adopted i… https://t.co/V0SlmH8DLH,209
Sat Jun 30 12:21:23 +0000 2018,Another beautiful vacation beach town adopting #crypto !!    ‘Digital Currency Town’ in #AgnesWater  #Queensland… https://t.co/pEUEhTLOTw,19
Sat Jun 30 12:21:05 +0000 2018,Now accepting cryptocurrency! 20% off when you pay with LTC #Litecoin #digibyte #DGB   #Dogecoin    Bitcoin (BTC) … https://t.co/y9BjBC1bqS,23
Sat Jun 30 12:20:32 +0000 2018,ROLDE   NETHERLANDS   Brasserie De 3 Heeren Restaurant  #acceptscrypto     The same 6 that i usually see businesses… https://t.co/AGxHM59c0i,19
Sat Jun 30 06:31:45 +0000 2018,Who’s coming or the conference this year? LTC to the moon 🌝  it’s coming faster then you know it with the guy in th… https://t.co/aNEPbLnVFh,0
Sat Jun 30 01:15:00 +0000 2018,ROLDE   NETHERLANDS   Brasserie De 3 Heeren Restaurant  #acceptscrypto     The same 6 that i usually see businesses… https://t.co/AGxHM59c0i,19
Sat Jun 30 00:00:10 +0000 2018,Federal Reserve Bank of #StLouis Adds Four #Crypto coins to their  Database   #Bitcoin #BitcoinCash  #Ethereum and… https://t.co/1HkUwmc9Iu,23
