Sat Jan 20 23:13:23 +0000 2018,RT CEO: Doing a $NEO and $ETH giveaway 🎉 contest ends 2/1/18. 5 winners will be selected &amp; win a choice of $300 NEO… https://t.co/psOviMowV2,3
Sat Jan 20 20:03:12 +0000 2018,RT CEO: Doing a $NEO and $ETH giveaway 🎉 contest ends 2/1/18. 5 winners will be selected &amp; win a choice of $300 NEO… https://t.co/psOviMowV2,3
Sat Jan 20 18:20:25 +0000 2018,RT CEO: Doing a $NEO and $ETH giveaway 🎉 contest ends 2/1/18. 5 winners will be selected &amp; win a choice of $300 NEO… https://t.co/psOviMowV2,3
Sat Jan 20 17:59:10 +0000 2018,RT CEO: Doing a $NEO and $ETH giveaway 🎉 contest ends 2/1/18. 5 winners will be selected &amp; win a choice of $300 NEO… https://t.co/psOviMowV2,3
Sat Jan 20 17:48:58 +0000 2018,@DreadPRoberts2 @Falkvinge Bitcoin BCH is described in this white paper https://t.co/4Vygix1ehR,0
Sat Jan 20 10:57:07 +0000 2018,And I go to bed even later than usual and get less sleep and more stressed and just repeat the process. I’m the wor… https://t.co/R7V1rNMtbt,0
Sat Jan 20 00:09:56 +0000 2018,Anyone on the same boat as me?  #BitcoinCash #BCH @rogerkver @ProfFaustus  @ryanxcharles @Falkvinge @Bitcoin @r0bbot https://t.co/XdHZ1Vh4OA,0
