Sun May 20 22:45:13 +0000 2018,Will #cryptomining overtake #ransomware as the most common #cyberthreat?https://t.co/y3Y6RCLATh https://t.co/b5yCkCt1Je,12
Sun May 20 15:45:40 +0000 2018,Great read on current techniques and algorithms used in acquiring and analyzing large datasets: https://t.co/hXR6NCQRMA,1
Sun May 20 15:06:35 +0000 2018,Great read on current techniques and algorithms used in acquiring and analyzing large datasets: https://t.co/hXR6NCQRMA,1
Sun May 20 14:18:36 +0000 2018,RT @chaingeneration: #mining #bulleon #cloud #cloudmining #app #crypto https://t.co/L6nvHgcyyz,0
Sun May 20 08:32:23 +0000 2018,The latest The Mining Daily! https://t.co/SgnscfOZkh #mining,0
Sun May 20 04:32:07 +0000 2018,The latest The Mining Daily! https://t.co/SgnscfOZkh #futureofmining #mining,0
Sun May 20 01:14:51 +0000 2018,The State of Cryptocurrency Mining - must read from David of Obelisk about Asic manufacturing https://t.co/88hUV6PBu9,12
