Sun Mar 11 21:00:01 +0000 2018,Neutralizing toxic protein deposits that damage beta cells in type 2 #diabetes – via @WhiteheadInst @MIT:… https://t.co/zGPfN3r7tU,0
Sun Mar 11 20:00:02 +0000 2018,New tech @DraperLab amps up production of #CARTcells for #celltherapy:  https://t.co/x01abaflNh #scientificresearch… https://t.co/7NpwshCpAc,0
Sun Mar 11 11:30:01 +0000 2018,These scientists are setting the stage for future therapies that can prevent  reduce or even reverse symptoms of… https://t.co/Na23WgpB2e,0
Sun Mar 11 11:00:01 +0000 2018,Survey: Health app adoption has tripled since 2014 – via @Accenture @MobiHealthNews: https://t.co/h6za3IKqLH https://t.co/A8WaHrkxKL,0
Sun Mar 11 03:37:37 +0000 2018,Gemini Exchange plans to offer bitcoin cash and Litecoin. View article now. #BitcoinCash #Litecoin #BCH #LTC… https://t.co/U1veHQJ96T,0
Sun Mar 11 00:42:14 +0000 2018,Iconic $ICON price: $0.09352  We verified that Binance is accepting new users!💸💵  ➡️ https://t.co/zvLu1i8RAc  $BCF… https://t.co/2WnSXKAnsa,0
