Sat Aug 11 22:22:06 +0000 2018,Bitcoin Cash (BCH) Receives Boost As ‘Bitcoin Jesus’ Joins FinTech Startup https://t.co/jYw6YaaQIv #fintech,2
Sat Aug 11 22:21:14 +0000 2018,Bitcoin Cash (BCH) Receives Boost As ‘Bitcoin Jesus’ Joins FinTech Startup https://t.co/jYw6YaaQIv #fintech,2
Sat Aug 11 20:05:08 +0000 2018,@SIMPeds_BCH @neschulz We will miss you  buddy! Don’t go too far from us. Will tsp you from time to time for one of… https://t.co/5sddB77XTA,0
Sat Aug 11 08:02:33 +0000 2018,BTCUSD trying to push below $6000  as price test key support again. View our analysis now. #ETH #bitcoin #BCHUSD… https://t.co/6fi33ydTHQ,0
Sat Aug 11 03:56:47 +0000 2018,It doesn't matter what people say. The liquidity for https://t.co/qzJ3DPrtUr is getting better every day because pe… https://t.co/goSvurTx4y,2
Sat Aug 11 00:07:37 +0000 2018,Exciting news today from our partner  @BostonChildrens. Patients with epilepsy and inflammatory bowel disease will… https://t.co/YPlgeIVl9h,7
