Wed Jul 11 17:48:33 +0000 2018,Preparation is key when disclosing a medical error. True but how do you prepare? Get research-based insights from D… https://t.co/yHI6eS94Ky,0
Wed Jul 11 15:50:43 +0000 2018,$BTC $BCH Bitcoin  Bitcoin Cash Price Analysis: What’s Happening? https://t.co/Zu9hvTwTGc,1
Wed Jul 11 14:59:52 +0000 2018,The groundbreaking mitochondrial transplantation therapy is "like putting a booster pack on a car battery":… https://t.co/7BOuJ8oC0r,0
Wed Jul 11 13:51:56 +0000 2018,Great list! So cool to watch the growth of Mightier! Congratulations to @jmkahnii  the entire @NeuromotionLabs team… https://t.co/BxFU91NoT4,0
Wed Jul 11 11:59:32 +0000 2018,Mitochondrial transplantation is now a reality for some of Boston's smallest patients: https://t.co/0lUsF0Liq6… https://t.co/1mtsI7CSKA,0
Wed Jul 11 11:22:22 +0000 2018,Morning rounds: Discussion on BWH/BCH Neurosurgery residency program - ‘We are what we continuously do  excellence… https://t.co/qbDs9HFWf6,0
Wed Jul 11 11:10:12 +0000 2018,Join us for book group tomorrow at 7:30am to discuss Fun Home: A Family Tragicomic by Alison Bechdel https://t.co/S3iqbCSTgR,0
Wed Jul 11 09:26:50 +0000 2018,https://t.co/Ai0vxtUHTj,0
