Mon Sep 10 21:59:40 +0000 2018,#NewYorkCoin Development Help Wanted - #NYCoin Info https://t.co/bjIXVz47jw #coding #dev #development #crypto… https://t.co/U6rsbvBEjH,0
Mon Sep 10 21:56:34 +0000 2018,"Valdis Dombrovskis  vice president of the European Commission  said member states are supportive of moves to chart… https://t.co/mS2xWzUmIn,1
Mon Sep 10 21:54:50 +0000 2018,Crypto Daily Episode 9  https://t.co/wq0u9CTMgg  #bitcoin #crypto #cryptocurrency #ethereum #litecoin #stocks #news… https://t.co/uoYYTooNjv,1
Mon Sep 10 21:52:41 +0000 2018,Crypto Daily Episode 9  https://t.co/wq0u9CTMgg  #bitcoin #crypto #cryptocurrency #ethereum #litecoin #stocks #news… https://t.co/uoYYTooNjv,1
Mon Sep 10 21:49:47 +0000 2018,Community  here I leave my most recent publication in Scorum  I hope you enjoy reading about this topic:… https://t.co/DkQGUCDGGh,0
Mon Sep 10 21:46:46 +0000 2018,😍 500 000 SODA GIVEAWAY 😍  ⚡️TOTAL 30 WINNERS ⚡️  ➕DAILY ENTRY POINTS➕  ❣️100 000 SODA (1st Prize) ❣️  🌟PARTICIPATE… https://t.co/aGM3NwxgvB,146
Mon Sep 10 21:45:00 +0000 2018,#Job: #Android Engineer w/ 2+ yrs of exp. Implement new features  optimize performance &amp; maintain cryptocurrency’s… https://t.co/g6oNcoxyPz,0
Mon Sep 10 21:41:49 +0000 2018,New York state approves two dollar-based #cryptocurrency units https://t.co/PBdzwPCkXX via @engadget #cryptocurrencynews #crypto,0
Mon Sep 10 21:40:42 +0000 2018,$XMR MONERO Releases Web-Based Wallet for Tor Browser #Tor #Cryptocurrency #Bitcoin #TechNews  https://t.co/4IKHL3NNYy,0
Mon Sep 10 21:36:50 +0000 2018,BREAKING: Stellar's Jed McCaleb has joined forces with Chain's Adam Ludwin. This acquisition has some big implicati… https://t.co/KoY6XWRNGY,38
Mon Sep 10 21:36:20 +0000 2018,Locked price $429 = 1 ETH !!! Only #Neluns offers you to buy NLS tokens with the locked price of #ETH $429 per 1 ET… https://t.co/Xb9GZmkJs5,378
Mon Sep 10 21:36:19 +0000 2018,https://t.co/Us36ib49YA,15
Mon Sep 10 21:35:24 +0000 2018,Dear bounty campaign participants! The #XTRD post TGE bounty is over. We will provide all the details on bounty tok… https://t.co/tJM6ufc0wS,50
Mon Sep 10 21:33:25 +0000 2018,UAE Approves Plans to Regulate ICO Tokens as Securities Startups wishing to execute an ICO must approach the SCA to… https://t.co/pXquvFtyeo,0
Mon Sep 10 21:26:32 +0000 2018,BREAKING: Stellar's Jed McCaleb has joined forces with Chain's Adam Ludwin. This acquisition has some big implicati… https://t.co/KoY6XWRNGY,38
Mon Sep 10 21:24:46 +0000 2018,Shopin ICO: Decentralized Shopper Profile Built on the Blockchain https://t.co/OqvAykbU0V via @blockonomi  #retail… https://t.co/wQsO9NgAGs,640
Mon Sep 10 21:17:46 +0000 2018,Dear bounty campaign participants! The #XTRD post TGE bounty is over. We will provide all the details on bounty tok… https://t.co/tJM6ufc0wS,50
Mon Sep 10 21:13:17 +0000 2018,Shopin ICO: Decentralized Shopper Profile Built on the Blockchain https://t.co/OqvAykbU0V via @blockonomi  #retail… https://t.co/wQsO9NgAGs,640
Mon Sep 10 21:11:52 +0000 2018,"The crypto universe has spoken: They want a bitcoin ETF and they want it now." via @coindesk… https://t.co/cl3FjitrEq,0
Mon Sep 10 21:09:40 +0000 2018,Shopin ICO: Decentralized Shopper Profile Built on the Blockchain https://t.co/OqvAykbU0V via @blockonomi  #retail… https://t.co/wQsO9NgAGs,640
Mon Sep 10 21:08:37 +0000 2018,If you haven’t heard #TourDeCrypto is going to make #blockchain and #Crypto history. @WorldCryptoCon recently pledg… https://t.co/vMTk7qH0T8,3
Mon Sep 10 21:01:31 +0000 2018,A new research report from a leading independent fintech research firm says that funding for initial coin offerings… https://t.co/MBmOeOjC7H,0
Mon Sep 10 21:00:14 +0000 2018,Lloyd's Jumps Into The Cryptocurrency Market  Insuring Part Of Kingdom Trust's $12 Billion Assets https://t.co/KLZB3UKiK0 By @AKKLawFirm,0
Mon Sep 10 20:59:02 +0000 2018,Germany’s 2nd Largest Exchange Deutsche Borse Launched a Cryptocurrency Trading Platform | @MainBloq… https://t.co/DwUuc6Stuw,0
Mon Sep 10 20:58:28 +0000 2018,Visa-backed blockchain firm embraces stellar cryptocurrency via merger https://t.co/hCzdleVyvU https://t.co/dhy9E07ZFn,16
Mon Sep 10 20:57:25 +0000 2018,Here’s Why Crypto Won’t Solve Inflation Crisis in Developing Countries   Coins without a supply inflation could tac… https://t.co/bqHUZBeAbR,0
Mon Sep 10 20:54:06 +0000 2018,72% of Cryptocurrency Investors Plan to Buy More this Year: Survey https://t.co/9g2sfV2Vf5 https://t.co/a8pJe4ow4E,0
Mon Sep 10 20:53:46 +0000 2018,Ether Crash Continues as SEC Suspends Trading in 2 Cryptocurrency-Related Securities https://t.co/lyEayrCR3L via @josephjett,1
Mon Sep 10 20:52:25 +0000 2018,Bitcoin Dominance Once Again Reaches New High For 2018   Another altcoin season doesn’t seem to be coming anytime s… https://t.co/SreCzGo78R,1
Mon Sep 10 20:51:28 +0000 2018,Global Market 1.09.18 #goodlife #cryptocurrency #cryptolifestyle #bitcoinmining #bitcoin #Crypto #Cryptocurrency… https://t.co/oBdfvNUB0P,0
Mon Sep 10 20:51:03 +0000 2018,We are in need of  Python Developers (Cryptocurrency) - Chicago  Illinois https://t.co/lkhOAkCj1n https://t.co/8nrKeh8maX,0
Mon Sep 10 20:49:11 +0000 2018,Visa-Backed #Blockchain Firm Embraces Stellar #Cryptocurrency Via #Merger via @forbes @DelRayMan https://t.co/rNV9zWobfb,1
Mon Sep 10 20:47:32 +0000 2018,Bitcoin Dominance Once Again Reaches New High For 2018   Another altcoin season doesn’t seem to be coming anytime s… https://t.co/SreCzGo78R,1
Mon Sep 10 20:46:25 +0000 2018,August was not an easy month for crowdfunding. It looks like September will be even worth. A lot of projects alread… https://t.co/4krzS7L3LV,0
Mon Sep 10 20:46:02 +0000 2018,Winklevoss Brothers Introduce World’s First Fully Regulated Stablecoin Gemini Dollar   NYDFS-regulated Gemini Dolla… https://t.co/w7yLkvvceg,2
Mon Sep 10 20:45:06 +0000 2018,"New York regulator approves Winklevoss  Paxos dollar-linked tokens" - https://t.co/A3lbof2o1U,0
Mon Sep 10 20:44:34 +0000 2018,Bitcoin artwork with splash and city theme.  #bitcoin #cryptoart #cryptocurrency #Blockchain https://t.co/fQwVwwgdhC,0
Mon Sep 10 20:43:12 +0000 2018,#LendLedger CEO @givatury engaging the crowd at Crypto-Economy Singapore. Catch us at @BlockchainHQ on August 28 an… https://t.co/0JsYwqOq3H,683
Mon Sep 10 20:40:38 +0000 2018,2017: Dogecoin is a joke. 2018: Dogecoin is making your favorite cryptocurrency look like a joke. -… https://t.co/yNV30bbuvP,0
Mon Sep 10 20:38:39 +0000 2018,Top 10 #cryptocurrency reads this week https://t.co/BS8FTMT7Zz by @davidsmooke and @HackerNoon #Crypto https://t.co/Ym6vEwBtfS,177
Mon Sep 10 20:38:33 +0000 2018,Check out this great #infographic showing instances of hacks whilst also providing tips to increase your… https://t.co/EYoaBi8OLt,201
Mon Sep 10 20:37:07 +0000 2018,While on Bloomberg  Vitalik Buterin has stirred up the cryptocurrency community by saying that there is a ceiling o… https://t.co/fPfCAbroDE,0
Mon Sep 10 20:37:00 +0000 2018,Why #Crypticcoin is the next big thing in #cryptocurrency https://t.co/w3TNPZeLiF #SPV #Crypto https://t.co/mKmhOkLvEy,468
Mon Sep 10 20:36:58 +0000 2018,This #cryptocurrency miner is growing #cryptomatoes' using excess heat from his computer setup… https://t.co/Mq3AyFVszk,569
Mon Sep 10 20:32:58 +0000 2018,@matt_odell It’s really annoying that bureaucrats are being anti-business by adding onerous regulations to cryptocu… https://t.co/cam7um99rH,0
Mon Sep 10 20:32:14 +0000 2018,https://t.co/NfKqBOxmFi,0
Mon Sep 10 20:30:47 +0000 2018,Tron and Neo weren't the only crypto projects interested in acquiring BitTorrent; in fact  CoinDesk has learned  fi… https://t.co/7oaZNjbuZp,99
Mon Sep 10 20:30:18 +0000 2018,‘BitLicense’ Regulator Approves Two USD-Pegged Cryptocurrency Tokens | Source: @cryptocoinsnews https://t.co/6oc4VLktEB,0
Mon Sep 10 20:29:12 +0000 2018,The most advanced cryptocurrency exchange. A smarter option to exchange crypto in a simple &amp; cost-effective way. Ro… https://t.co/Z6bN6puelI,0
Mon Sep 10 20:26:44 +0000 2018,Trending: "Why Ethereum is outpacing Bitcoin" via @VentureBeat   https://t.co/2daXI5V8te   #cryptocurrency… https://t.co/jGjsreGHAT,0
Mon Sep 10 20:25:02 +0000 2018,Cryptocurrency or google "How to launder money." It's 2018 get with the times.,0
Mon Sep 10 20:24:40 +0000 2018,'Wyoming Set to Become Blockchain Capitol' Believe! @ActiveAether CEO @atdotrob testifies at @Wyohackathon Sept 9!… https://t.co/8900LrSH17,1
Mon Sep 10 20:23:29 +0000 2018,How to Teach Kids About Cryptocurrency and Blockchain (when you barely understand it yourself 😒) – @JoinTech2025 (S… https://t.co/GFbggOtT8J,1
Mon Sep 10 20:23:05 +0000 2018,#RentPay : #airdrop #bounty #referrals #cryptocurrency Let https://t.co/gGG0Ovzw97 start saving you money on your… https://t.co/j6zBHsNMAI,0
Mon Sep 10 20:23:02 +0000 2018,#Cryptocurrency and Consumers: Assessing the Impacts Both Seen and Unseen https://t.co/hRidQluQ7q https://t.co/2aqGnjKKPd,0
Mon Sep 10 20:20:40 +0000 2018,Our Token Challenge/bounty campaign is live  https://t.co/EJ0FEooLvC Join our community and unlock rewards #bounty… https://t.co/MW7ZNmlD7w,2974
Mon Sep 10 20:20:25 +0000 2018,Python Developers (Cryptocurrency) - Chicago  Illinois https://t.co/j2Q27JdcHO,0
Mon Sep 10 20:19:44 +0000 2018,BREAKING: Stellar's Jed McCaleb has joined forces with Chain's Adam Ludwin. This acquisition has some big implicati… https://t.co/KoY6XWRNGY,38
Mon Sep 10 20:18:12 +0000 2018,$638 billion erased from crypto-currency market so far this year (since the $704 billion peak on January 7). https://t.co/hkzQacuieW,0
Mon Sep 10 20:14:46 +0000 2018,Tron and Neo weren't the only crypto projects interested in acquiring BitTorrent; in fact  CoinDesk has learned  fi… https://t.co/7oaZNjbuZp,99
Mon Sep 10 20:14:30 +0000 2018,Dear bounty campaign participants! The #XTRD post TGE bounty is over. We will provide all the details on bounty tok… https://t.co/tJM6ufc0wS,50
Mon Sep 10 20:11:37 +0000 2018,The Winklevoss twins aren't letting the SEC or dropping bitcoin prices stop them from launching their own cryptocur… https://t.co/W32udxKb5U,17
Mon Sep 10 20:08:41 +0000 2018,BREAKING: Stellar's Jed McCaleb has joined forces with Chain's Adam Ludwin. This acquisition has some big implicati… https://t.co/KoY6XWRNGY,38
Mon Sep 10 20:01:11 +0000 2018,"The losses have pretty much left me financially ruined." Some crypto investors learned hard lessons from the bitco… https://t.co/TTp0tGm7hs,83
Mon Sep 10 20:01:01 +0000 2018,72% of Cryptocurrency Investors Plan to Buy More this Year: Survey https://t.co/3USPaq88I1,0
Mon Sep 10 20:00:29 +0000 2018,U.S. SEC Suspends Trading for Two Swedish-Based Crypto ETNs - https://t.co/BOamnxD1xe              Two securities … https://t.co/qRp0nrXdlU,0
Mon Sep 10 20:00:24 +0000 2018,Know who is the first #VoIP Provider First to Embrace #Cryptocurrency Payments https://t.co/3atySv0yWO #Fintech https://t.co/BjGecntLVt,0
Mon Sep 10 19:59:28 +0000 2018,This is hilarious!! #Litecoin @SatoshiLite #cryptocurrency https://t.co/0O2jo4DINO,10
Mon Sep 10 19:59:17 +0000 2018,Last Chance to join us at @dezentral_io #conference during #BerlinBlockchainWeek  where our CEO @SerafinLion will a… https://t.co/u73e9UuLsv,18
Mon Sep 10 19:56:52 +0000 2018,“We believe strongly in the viability of #Ethereum and its future” ~@EranEyal  CEO &amp; founder of Shopin.  Great piec… https://t.co/bq58GMmNRR,764
Mon Sep 10 19:56:42 +0000 2018,I would love to see a country just use $BTC as their primary currency. #bitcoin #crypto #cryptocurrency  https://t.co/5talJpA7sZ,4
Mon Sep 10 19:52:51 +0000 2018,Visa-Backed #Blockchain Firm Embraces Stellar #Cryptocurrency Via #Merger via @forbes @DelRayMan https://t.co/rNV9zWobfb,1
Mon Sep 10 19:51:40 +0000 2018,The @SteemMonsters kickstarter campaign is nearly funded  currently at 96% of their 50k goal! Show some love for th… https://t.co/qj8C2KotK8,4
Mon Sep 10 19:49:18 +0000 2018,Dear bounty campaign participants! The #XTRD post TGE bounty is over. We will provide all the details on bounty tok… https://t.co/tJM6ufc0wS,50
Mon Sep 10 19:49:09 +0000 2018,Cryptocurrency Digital Marketing: Staying on the Right Side of a Constantly Shifting Line https://t.co/Ri1A8DzHou,0
Mon Sep 10 19:47:29 +0000 2018,‘BitLicense’ Regulator Approves Two USD-Pegged Cryptocurrency Tokens https://t.co/vFdWFwhrMS,0
Mon Sep 10 19:46:56 +0000 2018,Drop #KNOWLEDGE   not #bombs 🙌 #cryptocurrency https://t.co/KmIRxtlGu6,0
Mon Sep 10 19:43:30 +0000 2018,The Chinese authorities have continued to tighten the loopholes with regards to where the country's citizens can ac… https://t.co/XSFBD3RjmG,0
Mon Sep 10 19:40:04 +0000 2018,Tron and Neo weren't the only crypto projects interested in acquiring BitTorrent; in fact  CoinDesk has learned  fi… https://t.co/7oaZNjbuZp,99
Mon Sep 10 19:34:16 +0000 2018,Chinese Traders Use VPNs and Tether to Circumvent the Crypto Ban #China #Cryptocurrency https://t.co/AVmcgbCvTr,2
Mon Sep 10 19:34:14 +0000 2018,Dear bounty campaign participants! The #XTRD post TGE bounty is over. We will provide all the details on bounty tok… https://t.co/tJM6ufc0wS,50
Mon Sep 10 19:34:02 +0000 2018,Exclusive Traub (leading global retail advisory) release industry report on how #retail can benefit from the… https://t.co/sZTAGV0Grm,90
Mon Sep 10 19:33:00 +0000 2018,The @SEC_News has temporarily suspended #trading in two #cryptocurrency-related securities ➜ #Bitcoin Tracker One… https://t.co/ZhJpWPL9Z5,2
Mon Sep 10 19:32:54 +0000 2018,Exclusive Traub (leading global retail advisory) release industry report on how #retail can benefit from the… https://t.co/sZTAGV0Grm,90
Mon Sep 10 19:32:18 +0000 2018,The @SEC_News has temporarily suspended #trading in two #cryptocurrency-related securities ➜ #Bitcoin Tracker One… https://t.co/ZhJpWPL9Z5,2
Mon Sep 10 19:30:24 +0000 2018,CryptoNewsBreaks – SEC Stops Trading in Two Cryptocurrency Products https://t.co/Jxn3JTbib0,0
Mon Sep 10 19:30:15 +0000 2018,“We believe strongly in the viability of #Ethereum and its future” ~@EranEyal  CEO &amp; founder of Shopin.  Great piec… https://t.co/bq58GMmNRR,764
Mon Sep 10 19:29:56 +0000 2018,XRP Has Stiff Competition in Stellar  IBM - https://t.co/MEoc7XtPHs XRP (XRP)–As cryptocurrency prices continue to… https://t.co/ratBMfWBJk,0
Mon Sep 10 19:29:01 +0000 2018,New York regulator approves Winklevoss  Paxos dollar-linked tokens https://t.co/IErno1LeBZ,0
Mon Sep 10 19:22:08 +0000 2018,Tron and Neo weren't the only crypto projects interested in acquiring BitTorrent; in fact  CoinDesk has learned  fi… https://t.co/7oaZNjbuZp,99
Mon Sep 10 19:21:32 +0000 2018,The #Neluns #Exchange will change the world of #cryptocurrency!🙌🏼 We are creating an innovative solution  eliminati… https://t.co/rAJh2443FJ,398
Mon Sep 10 19:19:53 +0000 2018,Exchanges Roundup: Startup Targets Crypto Micro-Investments  Kraken Denies Halifax Closure -… https://t.co/0AJ7fcBiW5,0
Mon Sep 10 19:19:42 +0000 2018,The @SEC_News has temporarily suspended #trading in two #cryptocurrency-related securities ➜ #Bitcoin Tracker One… https://t.co/ZhJpWPL9Z5,2
Mon Sep 10 19:18:04 +0000 2018,“Cryptocurrency is absolutely the future. The real advantage is the ability to instantly pay anyone  anywhere  near… https://t.co/9a5u53E7Ur,0
Mon Sep 10 19:16:55 +0000 2018,“We believe strongly in the viability of #Ethereum and its future” ~@EranEyal  CEO &amp; founder of Shopin.  Great piec… https://t.co/bq58GMmNRR,764
Mon Sep 10 19:15:53 +0000 2018,Tron and Neo weren't the only crypto projects interested in acquiring BitTorrent; in fact  CoinDesk has learned  fi… https://t.co/7oaZNjbuZp,99
Mon Sep 10 19:14:13 +0000 2018,Bitcoin Retains Bear Bias Despite Recovery From 25-Day Low  https://t.co/ITNoRUPIdu  #cryptocurrency #bitcoin… https://t.co/HYGjmftnEh,2
Mon Sep 10 19:14:00 +0000 2018,Bitcoin Retains Bear Bias Despite Recovery From 25-Day Low  https://t.co/ITNoRUPIdu  #cryptocurrency #bitcoin… https://t.co/HYGjmftnEh,2
Mon Sep 10 19:13:15 +0000 2018,Good new cryptocurrency! Go go go!!! https://t.co/PZ4i7Ghs41 #Masternodes https://t.co/kQJLrdriIW,0
