Sun Sep 10 23:42:26 +0000 2017,I entered two of my sculptures into JerseyFest (Shin Godzilla and The Violator). I won two Gold… https://t.co/ddDFAVsxkI,2
Sun Sep 10 23:25:40 +0000 2017,Had the amazing opportunity to explore @espn today  meet one of the 🐐's Randy Moss and finally get a piece of X-Gam… https://t.co/BdO3NkrCce,5
Sun Sep 10 23:25:27 +0000 2017,Had the amazing opportunity to explore @espn today  meet one of the 🐐's Randy Moss and finally get a piece of X-Gam… https://t.co/BdO3NkrCce,5
Sun Sep 10 23:16:54 +0000 2017,everything that shines ain't always gonna be gold,0
Sun Sep 10 22:31:05 +0000 2017,Invite for wedding says black tie optional so are yoga pants an option because I'm too short for long formal dresses,0
Sun Sep 10 22:29:09 +0000 2017,I need to go through my summer clothes and go get my fall clothes out of storage and https://t.co/LLiNCBF50e,0
Sun Sep 10 22:26:46 +0000 2017,Sheesh 😁😁😁,0
Sun Sep 10 22:25:40 +0000 2017,Ayooo 😭😭😭 https://t.co/SA4j58OWFB,0
Sun Sep 10 22:17:56 +0000 2017,I liked a @YouTube video https://t.co/P0cyGDheDI Five nights at Freddy's anime 1: Bring Gold Freddy to life,0
Sun Sep 10 22:08:07 +0000 2017,I just earned the 'Fields of Gold' badge on @untappd! https://t.co/spuvmztoo4,0
Sun Sep 10 21:57:00 +0000 2017,Everyday I get on twitter and realize that woman hearts are made of pure gold .. they literally will be your backbo… https://t.co/Yu6ilgOhr9,1
Sun Sep 10 21:55:46 +0000 2017,Tenth Amendment Center |   What Can Gold Do for O https://t.co/UxP4oUxc3d,44
Sun Sep 10 21:49:21 +0000 2017,@jsiskoski This is the sweetest video! That guy has nerves of steel and a heart of gold!,0
Sun Sep 10 21:44:08 +0000 2017,@MONTAI_X_GOLD @TrvpVisionary Yess  i noticed that!,0
Sun Sep 10 21:43:31 +0000 2017,@MONTAI_X_GOLD @TrvpVisionary That's for sure,0
Sun Sep 10 21:36:32 +0000 2017,@MONTAI_X_GOLD @TrvpVisionary Any time I've been on a plane I've never noticed a curve  that's for sure &amp; I've flow… https://t.co/vt3QFFvLVO,0
Sun Sep 10 21:27:11 +0000 2017,Everyday I get on twitter and realize that woman hearts are made of pure gold .. they literally will be your backbo… https://t.co/Yu6ilgOhr9,1
Sun Sep 10 21:17:22 +0000 2017,When he got a full beard  dark skin and gold rimmed glasses https://t.co/fxBlkH9ePi,5
Sun Sep 10 21:12:16 +0000 2017,@Mel629_ @steelers You make he black and gold look really good,0
Sun Sep 10 21:03:49 +0000 2017,Gold Executive Membership.  2% cash back (@ Costco) on #Yelp https://t.co/mKTWNdZ2HH,0
Sun Sep 10 21:01:04 +0000 2017,Only the gold boys  only the gold...  We fire you fire  it really is that simple.,0
Sun Sep 10 20:40:19 +0000 2017,Theirs an Adam Sandler channel on XL radio and it is pure gold,0
Sun Sep 10 20:19:13 +0000 2017,Lynch still a problem,0
Sun Sep 10 20:12:08 +0000 2017,@DBlockDeuce_215 😫😫😫,0
Sun Sep 10 20:09:58 +0000 2017,Cowboys time,0
Sun Sep 10 20:06:14 +0000 2017,When he got a full beard  dark skin and gold rimmed glasses https://t.co/fxBlkH9ePi,5
Sun Sep 10 20:04:17 +0000 2017,When he got a full beard  dark skin and gold rimmed glasses https://t.co/fxBlkH9ePi,5
Sun Sep 10 20:02:10 +0000 2017,When he got a full beard  dark skin and gold rimmed glasses https://t.co/fxBlkH9ePi,5
Sun Sep 10 20:00:21 +0000 2017,Clean House in a Flash Using #AmericanMade Scott's Liquid Gold https://t.co/zyxjlSpXBk #LiquidGold4Wood #Cleaning https://t.co/UYhTq7fzPh,0
Sun Sep 10 19:59:55 +0000 2017,That was a bad call,0
Sun Sep 10 19:59:42 +0000 2017,Wow,0
Sun Sep 10 19:58:24 +0000 2017,When he got a full beard  dark skin and gold rimmed glasses https://t.co/fxBlkH9ePi,5
Sun Sep 10 19:55:04 +0000 2017,@Mixedwith_gold what??? 😂😂😂😭 🤦🏿‍♂️🤦🏿‍♂️🤦🏿‍♂️ https://t.co/Kvdf7r4Pnm,0
Sun Sep 10 19:55:00 +0000 2017,I just earned the 'Fields of Gold (Level 6)' badge on @untappd! https://t.co/rspGlTaHfJ,0
Sun Sep 10 19:52:59 +0000 2017,When he got a full beard  dark skin and gold rimmed glasses https://t.co/fxBlkH9ePi,5
Sun Sep 10 19:52:58 +0000 2017,@Mixedwith_gold can I have some chicken lol,0
Sun Sep 10 19:51:00 +0000 2017,That's why we paid Blount  grind this game out. #EaglesTalk #PhiladelphiaEagles,0
Sun Sep 10 19:48:53 +0000 2017,Why they keep running that play 🤔,0
Sun Sep 10 19:45:52 +0000 2017,Gold lame' and sweet moves on lock for Philly.  See you soon  @theafghanwhigs &amp; @MrGregDulli https://t.co/hj4rHpnMih,0
Sun Sep 10 19:31:16 +0000 2017,🤦‍♂️🤦‍♂️🤦‍♂️,0
Sun Sep 10 19:30:33 +0000 2017,Dr. Kellyann Petrucci: The Secret of “Liquid Gold” #BoneBroth – #60 - https://t.co/94pacAahYB,0
Sun Sep 10 19:28:10 +0000 2017,@popsknox @BLUpfront @PoliticsCourage @CarloScagnelli Wow I struck gold with this thread.  😚,0
Sun Sep 10 19:26:29 +0000 2017,Refs wearing burgundy and gold today,0
Sun Sep 10 19:05:11 +0000 2017,HALF BELLY SHIRT/GOLD TEETH SACK ALERT,8
Sun Sep 10 19:02:54 +0000 2017,HALF BELLY SHIRT/GOLD TEETH SACK ALERT,8
Sun Sep 10 19:02:27 +0000 2017,HALF BELLY SHIRT/GOLD TEETH SACK ALERT,8
Sun Sep 10 19:01:39 +0000 2017,HALF BELLY SHIRT/GOLD TEETH SACK ALERT,8
Sun Sep 10 19:01:36 +0000 2017,HALF BELLY SHIRT/GOLD TEETH SACK ALERT,8
Sun Sep 10 19:01:28 +0000 2017,HALF BELLY SHIRT/GOLD TEETH SACK ALERT,8
Sun Sep 10 19:01:21 +0000 2017,HALF BELLY SHIRT/GOLD TEETH SACK ALERT,8
Sun Sep 10 19:01:13 +0000 2017,HALF BELLY SHIRT/GOLD TEETH SACK ALERT,8
Sun Sep 10 19:00:54 +0000 2017,HALF BELLY SHIRT/GOLD TEETH SACK ALERT,8
Sun Sep 10 19:00:15 +0000 2017,Weird Scenes Inside The Gold Mine https://t.co/2sDiAmeaXN,0
Sun Sep 10 18:52:27 +0000 2017,@geesaunders18 This is gold,0
Sun Sep 10 18:47:38 +0000 2017,@iHeartMiko They really going for GOLD with those Mental Gymnastics https://t.co/7CgSIM4SnI,0
Sun Sep 10 18:45:44 +0000 2017,It's still not showing the game man! It's showing U.S. V El Salvador from the Gold Cup. WTTTFF https://t.co/FdW5bUFc4M,0
Sun Sep 10 18:40:44 +0000 2017,The Eagles is hard to watch 🤦‍♂️🤦‍♂️🤦‍♂️,1
Sun Sep 10 18:31:20 +0000 2017,Waiting for this Cowboys game,2
Sun Sep 10 18:30:18 +0000 2017,Gold jacket  green jacket  who gives a shit?,3
Sun Sep 10 18:26:29 +0000 2017,holy crap gold elim as Dva and i was on fire most of the game lmao,0
Sun Sep 10 18:24:55 +0000 2017,😭😭😭,0
Sun Sep 10 18:17:01 +0000 2017,Penn squeezes past Explorers 25-21 despite a late comeback attempt from the Blue and Gold. Match is 2-1 Explorers.,0
Sun Sep 10 17:58:31 +0000 2017,@Gold_Standard17 didn't expect it to start today though,0
Sun Sep 10 17:57:22 +0000 2017,Wow! I just entered for a chance to win "Sumery Gold Fox Alloy Frame Sunglasses Women Glass..." by Sumery. https://t.co/mFeWxElBfh #giveaway,0
Sun Sep 10 17:37:29 +0000 2017,When Wendy's gives you your change and $4 of it is in fucking gold dollars. Like what the fuck why are these even a… https://t.co/jmbiyKcC48,0
Sun Sep 10 17:24:25 +0000 2017,Gold farming gets Venezuelans targeted in old-school Runescape https://t.co/KJU34uHh5T via #Polygon #gaming #notseo,0
Sun Sep 10 17:19:11 +0000 2017,@MallonDan if he dropped that OH man what Radio Gold that would have been this week.,0
Sun Sep 10 17:06:25 +0000 2017,Cmon w the damn 3rd and longs,0
Sun Sep 10 16:55:25 +0000 2017,@Gold_Standard17 Birds margin 4 injuries is very small in more areas as compared to the better half of teams in the league,0
Sun Sep 10 16:51:12 +0000 2017,@eagles1229 Depending on the position obviously  but injuries could derail this team badly in certain areas. But I… https://t.co/LjIMwzqUsg,0
Sun Sep 10 16:49:55 +0000 2017,@Gold_Standard17 and that's with a lot of unforeseen breaks in the coming weeks   I.E. injuries on opponents   weather   etc.,0
Sun Sep 10 16:44:50 +0000 2017,@eagles1229 Agreed,0
Sun Sep 10 16:42:43 +0000 2017,Not in love with the slate today  give me birds -1 and Bears +7.5,0
Sun Sep 10 16:30:20 +0000 2017,Gold Box Deal #AmazonGiveaway #Dealoftheday Bluetooth Headphones  HOPDAY U8 V4.1 Wireless by HOPDAY https://t.co/tHN2YrNU06,0
Sun Sep 10 16:08:07 +0000 2017,@danielpress94 @matthew_d_green Yeah! And discipline the people who put their money in banks! That'll show them for… https://t.co/EhvTT1EuGB,0
Sun Sep 10 16:01:56 +0000 2017,@rell_inglish @Pattymeens24 HAHAHAHA this is gold,0
Sun Sep 10 15:47:19 +0000 2017,@Gold_Standard17 9-7 at best,0
Sun Sep 10 15:45:16 +0000 2017,Maybe I'm not as high on them as others :(   The Gold Standard's Unbiased Philadelphia Eagles Season Preview https://t.co/cdv9TNtQHJ,0
Sun Sep 10 15:27:34 +0000 2017,Michael Vick thinks Carson Wentz will leads the #Eagles to the playoffs #FlyEaglesFly #NFL https://t.co/68ymu28w0Y,44
Sun Sep 10 15:21:12 +0000 2017,as expected  @michellevisage was an angel on earth with a heart of gold 💓 #DragConNYC https://t.co/k5gjksIjtd,0
Sun Sep 10 15:12:18 +0000 2017,I buy legend gold every year  at least 1 million in VC pre ordered Why cant I choose what I want? Its making the game less fun @LD2K @Beluba,1
Sun Sep 10 14:57:44 +0000 2017,I buy legend gold every year  at least 1 million in VC pre ordered Why cant I choose what I want? Its making the game less fun @LD2K @Beluba,1
Sun Sep 10 13:25:35 +0000 2017,The last 2 lines of my will state that I'm to be buried with both middle fingers up &amp; rumors are to be spread that my casket is full of gold,72
Sun Sep 10 12:33:55 +0000 2017,His sports betting information is PURE GOLD! https://t.co/IFSmQvOE7p,1
Sun Sep 10 12:32:14 +0000 2017,His sports betting information is PURE GOLD! https://t.co/IFSmQvOE7p,1
Sun Sep 10 12:29:11 +0000 2017,Folks wouldn't even understand,0
Sun Sep 10 12:28:39 +0000 2017,Sometimes I wish people could see what God allow me to see,0
Sun Sep 10 12:28:11 +0000 2017,NBA 2K18 LEGEND GOLD EDITION FREE GIVEAWAY!!! 😱 *NOT CLICKBAIT*  @OfficialDesiree  https://t.co/lWISGnQYKY,0
Sun Sep 10 12:27:54 +0000 2017,in my high school their was a gang of gay kids that called themselves GNUF (Gay Niggas  Up Front),240
Sun Sep 10 12:16:30 +0000 2017,Druzy pendant necklace drusy pendant necklace 14kt gold plated https://t.co/iTQ3COfJnY via @Etsy,0
Sun Sep 10 12:08:02 +0000 2017,Breakfast is needed,0
Sun Sep 10 11:52:11 +0000 2017,You live and you learn,2
Sun Sep 10 11:46:23 +0000 2017,Things are going to get better,0
Sun Sep 10 11:26:02 +0000 2017,#NowPlaying Kirk Franklin - Silver &amp; Gold on https://t.co/zr1bxvCKD3,0
Sun Sep 10 11:21:57 +0000 2017,@Jlolar_MustDie That's gold  Joel. GOLD!,0
Sun Sep 10 11:21:52 +0000 2017,#BlackDahliaProse 138 Three rubies set in gold Wanted their fortunes told But their meaning was within Deep inside that gilded skin,3
Sun Sep 10 11:20:24 +0000 2017,We need to fwd to the islands &amp; get you gold  no spray tans 😌,0
Sun Sep 10 11:14:01 +0000 2017,Former President of Mexico Vicente Fox is hilarious. This is awesome. https://t.co/UfxUVTYsDU,10492
Sun Sep 10 10:47:17 +0000 2017,Band Of Gold - Freda Payne on Bandstand @iradiophilly - Listen https://t.co/aj0Y8lhKcK #nowplaying,0
Sun Sep 10 09:24:23 +0000 2017,'Resident Evil 7' Gameplay News: Gold Edition and Next DLC Comes in December https://t.co/BFzYO2HP1a,0
Sun Sep 10 09:12:12 +0000 2017,&amp;#039;Resident Evil 7&amp;#039; Gameplay News: Gold Edition and Next DLC Comes in December https://t.co/BFzYO2HP1a,0
Sun Sep 10 07:33:28 +0000 2017,@KKuhnetic yo thank my son picks for clearing nuns a path to a gold you a real G for that shit homie💯💯💯,1
Sun Sep 10 07:32:36 +0000 2017,@KKuhnetic yo thank my son picks for clearing nuns a path to a gold you a real G for that shit homie💯💯💯,1
Sun Sep 10 07:31:08 +0000 2017,Gold and diamond fronts coming soon,0
Sun Sep 10 07:25:28 +0000 2017,Unicorn Gold Birthday Invitation Unicorn Gold Birthday Party Invitation Unicorn Gold... https://t.co/Fhkw9UrJTC… https://t.co/0OI0MT0CJF,0
Sun Sep 10 06:10:48 +0000 2017,Gold jacket  green jacket  who gives a shit?,3
Sun Sep 10 05:44:05 +0000 2017,All that glitters is gold. Don't believe what you've been told.,0
Sun Sep 10 05:26:20 +0000 2017,New post: Tomb Raider I Gold: Unfinished Business (PC) – Level 1 – Return to Egypt (PL) https://t.co/O0ky0yGtBh,0
Sun Sep 10 05:21:53 +0000 2017,One of those nights man,0
Sun Sep 10 05:10:18 +0000 2017,@superCalo Boxing gold medalist at a local YMCA? #UFC215,0
Sun Sep 10 05:03:03 +0000 2017,#BlackDahliaProse 138 Three rubies set in gold Wanted their fortunes told But their meaning was within Deep inside that gilded skin,3
Sun Sep 10 04:47:41 +0000 2017,THE U.S. PETRO DOLLAR BREAKDOWN CONTINUES:  Big Moves In Gold &amp; Silver Ahead https://t.co/wQPqKvFNzT,1
Sun Sep 10 04:46:55 +0000 2017,Gold jacket  green jacket  who gives a shit?,3
Sun Sep 10 04:26:03 +0000 2017,Gold flakes and caviar on my sushi  does it look like I was left off bad and boujee @ Katsuya at… https://t.co/h7Y79GGoQ1,0
Sun Sep 10 04:10:35 +0000 2017,Dollar Bloodbath Continues Across Asia  Gold Tops Election-Night Spike Highs | Zero Hedge https://t.co/InmX8TaTAU,1
Sun Sep 10 04:10:11 +0000 2017,and the ironic thing is people PINE for these  the "gold old days" and forget how wonderboy stunk up shows week in … https://t.co/Yb3FMWCMCc,0
Sun Sep 10 03:59:14 +0000 2017,everybody know the A7 audi (2002 mercury sable) that i drive got a lil bit of gold in it,0
Sun Sep 10 03:58:13 +0000 2017,@neeeenahh this is gold https://t.co/Mf2mqkAf2l,0
Sun Sep 10 03:47:01 +0000 2017,@asamjulian @iMeltSn0wflakes I never want that James Brown wig wearing lunatic to die. She's COMEDY GOLD!,0
Sun Sep 10 03:43:58 +0000 2017,Gold jacket  green jacket  who gives a shit?,3
Sun Sep 10 03:09:08 +0000 2017,I deserve a life where I always get gold flakes sprinkled over the caviar on top of my sushi 😍 I've been so at peace and happy out here 😅,0
Sun Sep 10 03:05:08 +0000 2017,Going For Gold! #EmmyMA winner! @jackielondon @garywatson215 @rkuestnernbc10 @NBCPhiladelphia @EmmyMidAtlantic,3
Sun Sep 10 03:04:11 +0000 2017,Whoever remixed Gold Digger over a reggae beat gotta chill.,0
Sun Sep 10 03:01:30 +0000 2017,Destiny 2 In A Flash (Gold) Complete a Flashpoint. #PS4share https://t.co/hCkgxg0seu https://t.co/SLloo2lyj3,0
Sun Sep 10 02:57:37 +0000 2017,I bought the Fenty lipgloss and Killawat..I need to go back and get the gold highlighter and some foundation..I really tried it @PrettyCharr,0
Sun Sep 10 02:34:06 +0000 2017,I swear everyone thinks they a pro at Call Of Duty or some other game lmao  just because you have 3 gold doesn't make you a pro. nor does..,0
Sun Sep 10 02:01:42 +0000 2017,My one true wish is to have a birthday celebration that includes those giant gold number balloons before I age out of that demo entirely.,0
Sun Sep 10 01:55:08 +0000 2017,Sprinted* home to catch the 2nd half of the @NDFootball game because I'm #Committed.   gold and blue through and through #goirish,0
Sun Sep 10 01:50:26 +0000 2017,Going For Gold! #EmmyMA winner! @jackielondon @garywatson215 @rkuestnernbc10 @NBCPhiladelphia @EmmyMidAtlantic,3
Sun Sep 10 01:31:03 +0000 2017,Congratulations to Dr. William Herring from the @PAradsociety for the 2017 Gold Medallion Award @RadiologyACR https://t.co/Atvqq40AZA,2
Sun Sep 10 01:24:52 +0000 2017,Going For Gold! #EmmyMA winner! @jackielondon @garywatson215 @rkuestnernbc10 @NBCPhiladelphia @EmmyMidAtlantic,3
Sun Sep 10 01:20:14 +0000 2017,#BlackDahliaProse 138 Three rubies set in gold Wanted their fortunes told But their meaning was within Deep inside that gilded skin,3
Sun Sep 10 01:19:59 +0000 2017,Going For Gold! #EmmyMA winner! @jackielondon @garywatson215 @rkuestnernbc10 @NBCPhiladelphia @EmmyMidAtlantic,3
Sun Sep 10 01:04:02 +0000 2017,Gold dripped on your skin,0
Sun Sep 10 01:02:23 +0000 2017,Congratulations to Dr. William Herring from the @PAradsociety for the 2017 Gold Medallion Award @RadiologyACR https://t.co/Atvqq40AZA,2
Sun Sep 10 01:00:16 +0000 2017,Congratulations to Dr. William Herring from the @PAradsociety for the 2017 Gold Medallion Award @RadiologyACR https://t.co/Atvqq40AZA,2
Sun Sep 10 00:57:58 +0000 2017,I got naaji a gold fish he aint care tho 😭🤷🏽‍♀️,0
Sun Sep 10 00:55:56 +0000 2017,@Amandaplzz__ Trade gold in for plastic*,0
Sun Sep 10 00:45:04 +0000 2017,@coffee_minion @nmllalonde @FredHamptoncool @eclecticbrotha @SenWhitehouse That "restructure" was a hedge when she… https://t.co/4YrMwk404H,0
