Mon Oct 02 23:47:04 +0000 2017,@SportsGamingg Yo sports I will pay u $85 if u get me defensive stopper(gold) bruiser(hof)  and rim protector on go… https://t.co/NYkAwfizT1,0
Mon Oct 02 23:44:41 +0000 2017,Love this long custom necklace!  Special orders only. https://t.co/XdtjIYboFP,0
Mon Oct 02 23:38:17 +0000 2017,Russia Gold Rush Sees Record Reserves For Putin Era https://t.co/dQyi3uWs9X via @goldcore,0
Mon Oct 02 23:35:12 +0000 2017,@RBonner_ @rdafor3 I agree there isn't a gold standard for criteria but I want to hear what they learn as the investigation continues.,0
Mon Oct 02 23:24:46 +0000 2017,Lunch break Music by @STSisGOLD #WWW #GOLD  https://t.co/itthd2z1u6,1
Mon Oct 02 23:20:11 +0000 2017,CBS fires VP over her disparaging comments against Las Vegas victims https://t.co/0BTFANUwFR #PhillyBusiness,0
Mon Oct 02 22:49:58 +0000 2017,@annadorado @MondoNews @kayhanley Du Jour means seat belts!,0
Mon Oct 02 22:32:48 +0000 2017,"Everything that glitters ain't gold" type pic😂 https://t.co/T7pplg2v3Q,0
Mon Oct 02 22:24:59 +0000 2017,@Bethenny You Shine From Within!  You have a Heart of Gold &amp; You're a TRUE INSPIRATION #BStrong  https://t.co/jrz91qTkct via @DailyMailCeleb,0
Mon Oct 02 22:08:10 +0000 2017,CHILDHOOD DREAMZ COME TRUE @MondoNews @kayhanley Josie and the Pussycats is the best movie ever (join the army)! https://t.co/NG6jCLdJns,0
Mon Oct 02 22:01:23 +0000 2017,Asking for your advice just to argue what you said,0
Mon Oct 02 21:59:26 +0000 2017,I finally understand now 😫Don't cast your pearls among swine,0
Mon Oct 02 21:40:27 +0000 2017,@jmackin2 @ReformedBroker Good question. I'm not familiar with gold custody. It may be similar. SPDR has a relatively high expense ratio.,0
Mon Oct 02 21:38:45 +0000 2017,CBS issued a statement saying Hayley Geftman-Gold "violated the standards of our company and is no longer an employee of CBS.",16
Mon Oct 02 21:27:48 +0000 2017,Rolex Lady-Datejust 28 Chocolate Dial 18K Everose Gold President Automatic Ladies Watch 279135CHDP https://t.co/iPbPZ9dfeg,0
Mon Oct 02 21:17:09 +0000 2017,Nike Air Foamposite Pro Metallic Gold release on 10/21/2017 for $230 via https://t.co/56iBQGGjJr #KoFapp https://t.co/Ns8573A5ib,0
Mon Oct 02 21:11:09 +0000 2017,I liked a @YouTube video https://t.co/agClTF4xYu Red Dead Redemption: Seth's Gold - Fan Film,0
Mon Oct 02 21:06:00 +0000 2017,This is rose gold announcing https://t.co/QBoiTdxN9S,0
Mon Oct 02 21:04:58 +0000 2017,I really need some boots,0
Mon Oct 02 21:03:21 +0000 2017,Let's talk about the Avatar font sketch from the #SNLPremiere. Those last few seconds? Gold. https://t.co/7PKHZg1ZHf,0
Mon Oct 02 21:02:30 +0000 2017,I remember when timberland boots cost $125  😫😫😫,0
Mon Oct 02 20:35:28 +0000 2017,Never underestimate the power of prayer! God longs for that intimate time with you!,2638
Mon Oct 02 20:24:41 +0000 2017,@JLove_Able18 😂😂😂😂😂😂😂😂😂😂😂😂😂yooooooooo this is gold!!,0
Mon Oct 02 20:24:37 +0000 2017,#RachelReinhardt #DesignerBracelet #GoldPlated #Pink Glass Bead Multi layered https://t.co/dkNojlXeA8 via @Etsy,0
Mon Oct 02 20:22:21 +0000 2017,#GodGotIt #NoWorries https://t.co/J9wOzDfGXj,1
Mon Oct 02 20:21:41 +0000 2017,CBS issued a statement saying Hayley Geftman-Gold "violated the standards of our company and is no longer an employee of CBS.",16
Mon Oct 02 20:19:04 +0000 2017,CBS issued a statement saying Hayley Geftman-Gold "violated the standards of our company and is no longer an employee of CBS.",16
Mon Oct 02 20:17:58 +0000 2017,Idk why people still react or get upset at the stuff that come out President Trump mouth 🤦‍♂️🤦‍♂️🤦‍♂️,1
Mon Oct 02 20:08:49 +0000 2017,CBS Fires Top Exec who Expressed no Sympathy for Las Vegas Victims https://t.co/LaIvH3oBvn,0
Mon Oct 02 19:59:44 +0000 2017,CBS issued a statement saying Hayley Geftman-Gold "violated the standards of our company and is no longer an employee of CBS.",16
Mon Oct 02 19:55:58 +0000 2017,@the9akb Did you know that you can die from being too itchy? @j6m8 told me that.,0
Mon Oct 02 19:53:29 +0000 2017,CBS issued a statement saying Hayley Geftman-Gold "violated the standards of our company and is no longer an employee of CBS.",16
Mon Oct 02 19:53:05 +0000 2017,CBS issued a statement saying Hayley Geftman-Gold "violated the standards of our company and is no longer an employee of CBS.",16
Mon Oct 02 19:51:26 +0000 2017,CBS issued a statement saying Hayley Geftman-Gold "violated the standards of our company and is no longer an employee of CBS.",16
Mon Oct 02 19:48:46 +0000 2017,Lunch break Music by @STSisGOLD #WWW #GOLD  https://t.co/itthd2z1u6,1
Mon Oct 02 19:48:24 +0000 2017,Let me meme it so libtards understand pay attention  HRC   Hayley Geftman-Gold #guncontrol #StephenPaddock… https://t.co/hxmmT4Nz0p,0
Mon Oct 02 19:47:40 +0000 2017,CBS issued a statement saying Hayley Geftman-Gold "violated the standards of our company and is no longer an employee of CBS.",16
Mon Oct 02 19:45:39 +0000 2017,@LeoLikeThatLion i died and came back to life to share this gold lol,0
Mon Oct 02 19:44:41 +0000 2017,Even the losers get lucky sometime. Tom Petty was no loser and he didn’t get lucky. He was pure gold and genius. #RIP,0
Mon Oct 02 19:43:47 +0000 2017,CBS issued a statement saying Hayley Geftman-Gold "violated the standards of our company and is no longer an employee of CBS.",16
Mon Oct 02 19:38:52 +0000 2017,CBS issued a statement saying Hayley Geftman-Gold "violated the standards of our company and is no longer an employee of CBS.",16
Mon Oct 02 19:38:45 +0000 2017,CBS issued a statement saying Hayley Geftman-Gold "violated the standards of our company and is no longer an employee of CBS.",16
Mon Oct 02 19:38:03 +0000 2017,CBS issued a statement saying Hayley Geftman-Gold "violated the standards of our company and is no longer an employee of CBS.",16
Mon Oct 02 19:36:36 +0000 2017,CBS issued a statement saying Hayley Geftman-Gold "violated the standards of our company and is no longer an employee of CBS.",16
Mon Oct 02 19:35:58 +0000 2017,@WaltBink2585 @realprinceblue Can I just say Doug gets an A+++ this week 😁,0
Mon Oct 02 19:35:38 +0000 2017,Hayley Geftman-Gold being anonymously wealthy professional isn't enough so instead of a tantrum on a airplane I'll degrade shooting victims,0
Mon Oct 02 19:35:10 +0000 2017,CBS issued a statement saying Hayley Geftman-Gold "violated the standards of our company and is no longer an employee of CBS.",16
Mon Oct 02 19:16:14 +0000 2017,Islamic book design for the Koran with gold. Pretty neat stuff. #homeSweetSecondHome @ The Art… https://t.co/tR1G4XpziT,0
Mon Oct 02 19:14:07 +0000 2017,UPDATE - CBS bitch got shitcanned. https://t.co/IDFQdMfss4,44
Mon Oct 02 19:07:15 +0000 2017,And not to be outdone by Hillary Clinton here in the left corner we present Hayley Geftman-Gold our CBS Exec "gun toting Republicans",0
Mon Oct 02 18:56:55 +0000 2017,#KING #QUEEN packaging for Boston Vendredi 6 anndan tamboo vin achte #ROSEBLONDE #REDBLONDE #BLONDESHELLE... https://t.co/GlntLEO0nn,4
Mon Oct 02 18:27:28 +0000 2017,@CBS did you fire that mentally disturbed employee Hayley Geftman-Gold yet? #lasvegasstrong #JasonAldean,0
Mon Oct 02 18:04:55 +0000 2017,My team  @SOPAPhilly  #Stars&amp;Stripes took gold @SpecialOlympiPA #EasternSectional nxt stop @VillanovaSpO #FallFestival,1
Mon Oct 02 18:04:26 +0000 2017,Hayley Geftman-Gold is a poor excuse for a human being. How can @CBS keep her on the payroll? She should be at the LV Hospital praying.,0
Mon Oct 02 17:59:41 +0000 2017,@Breaking911 HMMMMMMM GEFTMAN-GOLD... REALLY... MAKES... YA THINK... 🤔,0
Mon Oct 02 17:57:38 +0000 2017,RDGLDGRN ( Red Gold Green ) - Opera feat. Method Man  https://t.co/th1Q9ghIpw,0
Mon Oct 02 17:56:17 +0000 2017,@wedge2424 @MinneapolisAce @RKSportsPro This is gold,0
Mon Oct 02 17:44:10 +0000 2017,Get yourself skin ready liquid gold ready 👌👌 Girls look 👀👀👀👀👀👀 Liquid Gold 🌟🌟🌟🌟🌟 As a… https://t.co/cTjoZ75KwR,0
Mon Oct 02 17:37:01 +0000 2017,you’re worth more than diamond more than gold,1
Mon Oct 02 17:32:13 +0000 2017,you’re worth more than diamond more than gold,1
Mon Oct 02 17:29:21 +0000 2017,Absolute gold https://t.co/1WNxHUJzH8,0
Mon Oct 02 17:20:42 +0000 2017,Saying that it's "not the right time" to talk about #guncontrol after a mass shooting...  is like saying it's not r… https://t.co/psMZo5KO0r,914
Mon Oct 02 16:46:22 +0000 2017,After this week I should be moving from @AmericanAir Gold to Platinum for my first time!,0
Mon Oct 02 16:45:28 +0000 2017,Maybe Puerto Ricans can use that gold cup trophy to drink the current nonexistent drinking water from?,37
Mon Oct 02 16:30:10 +0000 2017,Dear @TMZ  Please rethink your headline: "Stephen Paddock Doesn't Fit Mass Shooter Profile." He DOES fit the profil… https://t.co/Qqi57HuEVQ,2449
Mon Oct 02 16:26:53 +0000 2017,Everything that glitters ain't gold?,0
Mon Oct 02 16:21:55 +0000 2017,@TheMightyEROCK @jerrad_duncan This is Gold,0
Mon Oct 02 16:01:38 +0000 2017,The token offering gold rush is bringing out fruadsters and dumb money  but also lots of smart thinking on hard issues.,2
Mon Oct 02 15:53:08 +0000 2017,The Taming Of The Brew: How Sour Beer Is Driving A Microbial Gold Rush https://t.co/FEqdFBYmCi #STEM https://t.co/uyNDk4Qibf,0
Mon Oct 02 15:45:38 +0000 2017,Welcome #October! Here are your spot prices! #Gold #Silver #Refining #PreciousMetals #Dentist #Jeweler #Pawn… https://t.co/5Q36LyFdXd,0
Mon Oct 02 15:34:55 +0000 2017,Mackenzie Karcher scored three goals for the Blue and Gold https://t.co/akX3rzjF1c,6
Mon Oct 02 15:09:03 +0000 2017,@MG3____ RIP Chris,1
Mon Oct 02 15:00:15 +0000 2017,@MG3____ I remember that Time Coach Brynes was about to put hands nvm 😭😭😭,0
Mon Oct 02 14:57:29 +0000 2017,Mackenzie Karcher scored three goals for the Blue and Gold https://t.co/akX3rzjF1c,6
Mon Oct 02 14:57:00 +0000 2017,@CrazISexiCool69 Drink water that's what the old folks say lol for back pain,0
Mon Oct 02 14:53:17 +0000 2017,@CrazISexiCool69 Water,0
Mon Oct 02 14:48:34 +0000 2017,The Unbelievable Powers of Monatomic Gold https://t.co/3264DsENiP,0
Mon Oct 02 14:47:04 +0000 2017,The Unbelievable Powers of Monatomic Gold https://t.co/Qee1aK54yq via @YouTube,0
Mon Oct 02 14:08:25 +0000 2017,Get to know Hanna Gold  our new landscape designer @AndropogonLtd  in Philadelphia at https://t.co/diypUUYWIa https://t.co/WdkzSPFrBm,1
Mon Oct 02 14:04:19 +0000 2017,I liked a @YouTube video https://t.co/XSHb91WAUC SCW GOLD RUSH 2017,0
Mon Oct 02 14:00:20 +0000 2017,📷 Hanna Gold: new landscape designer in town As you can see  our new landscape designer  Hanna Gold ... https://t.co/IOW5LMdprC,0
Mon Oct 02 13:57:27 +0000 2017,Gold medals aren't made of gold. They're made of sweat  determination &amp; a hard-to-find alloy called guts… https://t.co/tqgqPv0JwS,1
Mon Oct 02 13:54:02 +0000 2017,Start your #Monday with a nice cup of a coffee and enjoy today's liquid gold fact! https://t.co/gHA09NNoKr https://t.co/sU92boeviZ,0
Mon Oct 02 13:53:06 +0000 2017,Monoatomic Gold is the Greatest Discovery of All Time [FULL VIDEO] https://t.co/NQ5es0QZwW,0
Mon Oct 02 13:51:16 +0000 2017,Monoatomic Gold is the Greatest Discovery of All Time [FULL VIDEO] https://t.co/IyrH7QUTF5 via @YouTube,0
Mon Oct 02 13:00:01 +0000 2017,Gold medals aren't made of gold. They're made of sweat  determination &amp; a hard-to-find alloy called guts… https://t.co/tqgqPv0JwS,1
Mon Oct 02 12:43:00 +0000 2017,Blessed!!!,0
Mon Oct 02 12:39:35 +0000 2017,@BeautifulShane_ Hey 👋 👋👋,0
Mon Oct 02 12:16:57 +0000 2017,I just don't have that type of time,0
Mon Oct 02 12:16:41 +0000 2017,Folks still care about who blocked or unfollowed them ??? 🤦‍♂️🙄,0
Mon Oct 02 12:07:45 +0000 2017,The sixers scrimage yesterday was lite 😫😫😫😫,0
Mon Oct 02 11:54:44 +0000 2017,It's never going to be peace in this world,0
Mon Oct 02 11:50:20 +0000 2017,My heart breaks for Las Vegas 😔 #PRAYERSFORVEGAS,0
Mon Oct 02 11:35:59 +0000 2017,These shootings becoming so normal,0
Mon Oct 02 11:33:34 +0000 2017,Good Morning Folks,0
Mon Oct 02 11:22:23 +0000 2017,Kenneth Cole Women's Digital Multi-Function Silver Dial Rose Gold Tone Stainless Steel KC2697 - mens gold watch https://t.co/M2i6J22rRI,0
Mon Oct 02 10:39:36 +0000 2017,Thank you for the faux gold cup  sir  but can you put some water in it? We’re dying here.   #PuertoRicanLivesMatter https://t.co/lyQCAyrHiF,0
Mon Oct 02 09:57:40 +0000 2017,Paint splatter bead bracelet drizzle beads gold yellow https://t.co/oNktFOVuNG via Etsy,0
Mon Oct 02 09:05:12 +0000 2017,White Powder Gold the Ancient Monoatomic Substance Defies Physics [FULL ... https://t.co/g8cmVY0sFM,0
Mon Oct 02 09:04:08 +0000 2017,White Powder Gold the Ancient Monoatomic Substance Defies Physics [FULL ... https://t.co/YgAqUI6KB0 via @YouTube,0
Mon Oct 02 07:29:58 +0000 2017,Be truly grateful for the air that you breathe and turn every part of your life into gold,0
Mon Oct 02 06:40:54 +0000 2017,Only way I know I won’t get hurt 🤷🏽‍♂️ https://t.co/X6KSRWoO6N,6
Mon Oct 02 06:36:47 +0000 2017,@lulu_says2 @rmayemsinger @margaritateresa It's a classic for them. Notice her gold chain and cross? How much you w… https://t.co/HrFLb4bUWa,1
Mon Oct 02 06:26:31 +0000 2017,@lulu_says2 @rmayemsinger @margaritateresa It's a classic for them. Notice her gold chain and cross? How much you w… https://t.co/HrFLb4bUWa,1
Mon Oct 02 06:15:54 +0000 2017,Curb returns with nothing but gold 😂,0
Mon Oct 02 05:32:38 +0000 2017,@LesBowen that was the only way they were going to get any blue and gold in the stands. It was green everywhere else #FlyEaglesFly,0
Mon Oct 02 04:54:50 +0000 2017,you cannot see it. It's for the ladies' eyes only- And even they have to demonstrate that they're within gold medal… https://t.co/8clL2eNxWW,5
Mon Oct 02 04:51:03 +0000 2017,#nowplaying EPMD - GOLD DIGGER CLN on Blazin267,0
Mon Oct 02 04:42:10 +0000 2017,Gold Matches S&amp;P 500 Performance In First 3 Quarters; Up 12% 2017 YTD  https://t.co/IrBhmIgbWc,1
Mon Oct 02 04:04:19 +0000 2017,@chriscarson29 So sorry to see that injury  work hard and get back next year!  You have a bright future! #seahawks,0
Mon Oct 02 03:58:46 +0000 2017,Maybe Puerto Ricans can use that gold cup trophy to drink the current nonexistent drinking water from?,37
Mon Oct 02 03:45:54 +0000 2017,@Savcloud LMAO RISE AND GRIND BABY 24K GOLD SEPTUM RINGS FOR THE WHOLE SQUAD.,0
Mon Oct 02 03:42:42 +0000 2017,Ari Gold is the fucking goat 🐐,2
Mon Oct 02 03:31:30 +0000 2017,Maybe Puerto Ricans can use that gold cup trophy to drink the current nonexistent drinking water from?,37
Mon Oct 02 03:17:03 +0000 2017,@WandaMaximoffff was my old twitter. can't figure out my password to save my life. my old twitter was gold and i'm sad,0
Mon Oct 02 03:10:11 +0000 2017,PHOTOS: Emily Ratajkowski Hits Paris In Jaw-Dropping Gold Slip Dress https://t.co/QxdIYQT7SY via @DailyCaller https://t.co/PHBFfHWPmI,0
Mon Oct 02 03:03:43 +0000 2017,Gold and Silver on 3DS. Yesssss,0
Mon Oct 02 03:02:39 +0000 2017,Seriously Marcus smith 🙄 #SundayNightFootball #SNFonNBC,0
Mon Oct 02 02:48:16 +0000 2017,Jay Cutler Proves Once Again Why He’s NFL Entertainment Gold https://t.co/na3jdHySYV via @DailyCaller https://t.co/V4IH3Vo0m0,0
Mon Oct 02 02:31:32 +0000 2017,I have a heart full of gold and will genuinely help whoever I can,0
Mon Oct 02 02:14:25 +0000 2017,Extremely dumb that Nintendo didn't put Gradius on SNES classic. Wondering when they are going to realize that franchise is gold.,0
Mon Oct 02 02:13:00 +0000 2017,Joey Bosa and Melvin Ingram had 23.5 combined sacks in their last 15 games.   Lane Johnson and Jason Peters held them to zero today. #Eagles,445
Mon Oct 02 02:10:14 +0000 2017,Mackenzie Karcher scored three goals for the Blue and Gold https://t.co/akX3rzjF1c,6
Mon Oct 02 01:58:15 +0000 2017,Checking out "Man caught smuggling $30K of gold in his rectum  airport officia" on 12160 Social Network: https://t.co/r4BJJ7nHmv,1
Mon Oct 02 01:23:24 +0000 2017,Odubel  outside of May  was spectacular all year. He is a gold glove caliber center fielder as well as a very good hitter. Future piece,0
Mon Oct 02 01:21:25 +0000 2017,Freddy played gold glove caliber defense  but his bat was bad even in a career year for OBP (.309),0
Mon Oct 02 01:20:45 +0000 2017,I can't get enough of @TenMinPod right now. The Hulk Hogan commercials are fucking gold. Wulp  I dunno about that brother. @WillSasso goat,0
Mon Oct 02 01:15:41 +0000 2017,Trying not to live tweet  but the scene where Hopper discovers Franklin's body  still in the wheelchair  is comedy gold.,0
Mon Oct 02 01:13:53 +0000 2017,Exactly https://t.co/66hAaJTjCg,1
Mon Oct 02 01:13:01 +0000 2017,@korndiddy's reaction to becky in that gold mask in the ghost story vlog has further confirmed that i have a crush on him (cc: @KeithHabs),0
Mon Oct 02 01:08:53 +0000 2017,All these freak ass fashion trends y’all gonna have gold fish in y’all pants cuff soon,0
Mon Oct 02 01:08:30 +0000 2017,Au take my gold? Ag you took my silver too!,1
Mon Oct 02 01:03:41 +0000 2017,@mcuban I've heard you use the gold digger term before on #sharktank but it seemed a little harsh this time.,0
Mon Oct 02 01:02:12 +0000 2017,You could be that person 1st option but at the same time  that person could just be desperate,0
Mon Oct 02 01:00:58 +0000 2017,Start your day brightly! https://t.co/vcTevvAu1A #decor #colors #retro #showercurtain #society6 #bbmackey #bettymackey #aqua #white #curtain,0
Mon Oct 02 00:52:33 +0000 2017,@princeisawesome first time i've logged in in months. i've been missing out on gold like this!,0
Mon Oct 02 00:44:32 +0000 2017,@spilIinamaretto ‘s gold,0
Mon Oct 02 00:43:58 +0000 2017,Au take my gold? Ag you took my silver too!,1
Mon Oct 02 00:34:19 +0000 2017,@DivisionPost @untitleduser Yeah  his pre-filmed bit in this episode (about the Avatar font) was gold.  Gosling sucks live and he knows it.,0
Mon Oct 02 00:28:22 +0000 2017,New tumblr post: "Playmates reveal what it was really like to live with Hugh: Gold..." https://t.co/F0ZLyWwvcK IFTTT  reddit,0
Mon Oct 02 00:13:29 +0000 2017,The DC gold packs are actually really good.  Every pack I've opened so far has had at least 1 collectible https://t.co/npz2mXZDUJ,0
Mon Oct 02 00:07:28 +0000 2017,LISTEN TO THIS GOLD ON THIS BLESST SUNDAY⚡️⚡️⚡️⚡️⚡️ https://t.co/B6DAVAOdX5,2
Mon Oct 02 00:06:40 +0000 2017,@JimmyKempski I still think with the gold shoes.  You can out kick him. Lol,0
Mon Oct 02 00:00:31 +0000 2017,Maybe Puerto Ricans can use that gold cup trophy to drink the current nonexistent drinking water from?,37
