Fri Jul 21 23:34:56 +0000 2017,Freddie has to win a gold glove,0
Fri Jul 21 23:29:20 +0000 2017,This from @MichaelCBender is gold. https://t.co/smYVTnaynH,0
Fri Jul 21 23:26:34 +0000 2017,Saturday Night Live needs to get Sean Spicer as guest hosts.  Dueling News with Spicer and McCarthy.  Comedy gold!,0
Fri Jul 21 23:26:28 +0000 2017,@mzdbp Everything Prima did is gold IMO,0
Fri Jul 21 23:24:18 +0000 2017,*golf but gold works  too https://t.co/qcDVJp5oXj,0
Fri Jul 21 23:23:47 +0000 2017,It baffles me that Freddy Galvis isn’t generating more rumors. Gold glove defense + .734 OPS,0
Fri Jul 21 23:23:36 +0000 2017,At his Bedminster gold club? https://t.co/X0slop9xQQ,0
Fri Jul 21 23:21:39 +0000 2017,girls on Instagram have the caption "gold   no spray tans " ..are yous just going to recycle each other's captions or ?,2
Fri Jul 21 23:11:14 +0000 2017,Greetings All  Time to start using our ancestor money. Gold   Where's the gold? Get your gold savings account.... https://t.co/ZluBUjlQrk,0
Fri Jul 21 22:56:44 +0000 2017,I Love you soooo much 😩🙏🏽❤️ https://t.co/M6svfwaA4a,18005
Fri Jul 21 22:55:55 +0000 2017,MY PUSSY GLITTER AS GOLD ✨✨✨✨@iamcardib,0
Fri Jul 21 22:46:23 +0000 2017,The ol' 2/3-1/3 blue sky  brick wall  weird gold window reflection trick. @ Royal Izakaya https://t.co/HNphLZVDkI,0
Fri Jul 21 22:37:05 +0000 2017,.@pammustard: These old tweets are comedy gold after yesterday. https://t.co/YnXYMJtgR9  https://t.co/HmFvtMxXb7,0
Fri Jul 21 22:36:23 +0000 2017,The Federal Reserve only has certificates for the gold they have in their possession. Where's the gold?4:39 in to... https://t.co/HC0jLyO7SF,0
Fri Jul 21 22:31:05 +0000 2017,@MartySmithESPN tv gold and comedy from China on the @LeBatardShow this afternoon 😂😂 hope you didnt get sprayed too badly by that guy ahaha,0
Fri Jul 21 22:19:23 +0000 2017,Treasure the love you receive above all. It will survive long after your gold and good health have vanished. - Og Mandino,1
Fri Jul 21 22:05:08 +0000 2017,Why the Gold Price Could Continue Beyond Today’s 4-Week High https://t.co/OrpwH6oXEk,0
Fri Jul 21 22:03:13 +0000 2017,Check out Vintage Disney 14K Yellow Gold Classic Winnie the Pooh 1/2" Pendant Charm #Disney https://t.co/tH7wviqGJn… https://t.co/IVyXVkQ13w,0
Fri Jul 21 21:43:01 +0000 2017,Gold https://t.co/vNCfErKLFt,1
Fri Jul 21 21:36:20 +0000 2017,Flower Boy is solid gold jfc,0
Fri Jul 21 21:22:27 +0000 2017,#Annielane Annie Lane is at the world famous Gold Club tonight #goldclub,0
Fri Jul 21 21:22:27 +0000 2017,#Annielane Annie Lane is at the world famous Gold Club tonight,0
Fri Jul 21 21:19:14 +0000 2017,One. More. Trip. And then I'm gold status @AmericanAir https://t.co/1sbs2G5MGf,0
Fri Jul 21 21:07:59 +0000 2017,It's not what you did it's the past. It's what are you doing for the future. Ijs,0
Fri Jul 21 21:06:12 +0000 2017,I've just unlocked More Gold! achievement in Paradise Island 2! https://t.co/Ee5bWhFiHo #GameInsight #ParadiseIsland2,0
Fri Jul 21 21:01:38 +0000 2017,@LeBatardShow @Stugotz790 The #MartyParty segment from China was tv gold... I was dyin but my gf wasnt.thats ok tho. She doesnt get the show,0
Fri Jul 21 21:00:51 +0000 2017,@thejoshuablack pure liquid gold.,0
Fri Jul 21 20:47:03 +0000 2017,@Hadas_Gold meh  they live for these moments it's hyper news and is in part why they become beat reporters. They even get paid for it!,0
Fri Jul 21 20:40:24 +0000 2017,@Hadas_Gold Turns out Basketball Twitter too.,0
Fri Jul 21 20:33:24 +0000 2017,Popular on 500px : Abandoned Gold by mumtazshamsee https://t.co/ovWFOgwVDB,0
Fri Jul 21 20:00:20 +0000 2017,Clean House in a Flash Using #AmericanMade Scott's Liquid Gold https://t.co/zyxjlSpXBk #LiquidGold4Wood #Cleaning https://t.co/DoQdefS1kj,0
Fri Jul 21 19:51:36 +0000 2017,@FriskyDingo712 Iconic,0
Fri Jul 21 19:40:37 +0000 2017,Enter This Arozzi #Gaming Chair  And #PS4 Gold #Giveaway #SGDQ2017 https://t.co/hzrtW6wI46,1
Fri Jul 21 19:39:51 +0000 2017,Enter This Arozzi #Gaming Chair  And #PS4 Gold #Giveaway #SGDQ2017 https://t.co/hzrtW6wI46,1
Fri Jul 21 19:33:38 +0000 2017,11. Email in Pink Gold Peach.  OH! GET NO SCOPED! #66666666666 #SWAG https://t.co/gTet5gCIH4,0
Fri Jul 21 19:32:13 +0000 2017,girls on Instagram have the caption "gold   no spray tans " ..are yous just going to recycle each other's captions or ?,2
Fri Jul 21 19:22:10 +0000 2017,my pussy glitter is gold  tell that lil bitch play her role,0
Fri Jul 21 19:17:32 +0000 2017,@swatymyers Of course he wore gold chains  I bet he still does,0
Fri Jul 21 19:10:51 +0000 2017,Oscar Pistorius  South African Paralympic Gold Medalist  Hanging Himself In Prison Is A… https://t.co/C6LJ3R3AQ2,0
Fri Jul 21 19:10:21 +0000 2017,Oscar Pistorius  South African Paralympic Gold Medalist  Hanging Himself In Prison Is A… https://t.co/1n6TapguHx,0
Fri Jul 21 19:01:29 +0000 2017,Starbucks: Earn Gold Status for a Year with One Purchase - https://t.co/9OJdNOfosL,0
Fri Jul 21 18:50:19 +0000 2017,@Hadas_Gold @brianstelter Dear Leader...,0
Fri Jul 21 18:40:12 +0000 2017,@Hadas_Gold It's all pretty easy when he doesn't actually have to answer questions about specific things the administration is doing.,0
Fri Jul 21 18:31:03 +0000 2017,"To use a Wall Street expression..." - the new comm director of the gold-plated "populist" president,0
Fri Jul 21 18:08:21 +0000 2017,Should we be impressed that he doesn't like his boss's boss's boss? The guy is more than a hack he's an idiot  gold… https://t.co/yOVHqJsyyJ,0
Fri Jul 21 18:04:02 +0000 2017,Pure gold for interns. Just sent email link to all of mine. https://t.co/mPMyuHg06h,9
Fri Jul 21 18:00:43 +0000 2017,GOLD!! 😊😊😊😊😊 https://t.co/xOkA5MjNYI,0
Fri Jul 21 17:57:04 +0000 2017,@Deadspin Attempted assassination of Reagan  just as the US won its first (?) Olympic gold against the Russians.,0
Fri Jul 21 17:54:32 +0000 2017,This is gold😂😂😂😂😂 https://t.co/BgVdysCx7V,0
Fri Jul 21 17:54:23 +0000 2017,Pure gold for interns. Just sent email link to all of mine. https://t.co/mPMyuHg06h,9
Fri Jul 21 17:54:17 +0000 2017,Happy birthday to the #LegitBoss. The true "gold standard" in the divas division. @SashaBanksWWE,5
Fri Jul 21 16:51:05 +0000 2017,@LuckyLor3nzo I'm thinking either Rose Gold or Red idk tho 😭 but thanks dudes @c_jro24  and @LuckyLor3nzo  gonna ha… https://t.co/9utAkZilZD,0
Fri Jul 21 16:49:56 +0000 2017,@MSNBC All hell breaks loose! @SenJohnMcCain is total gold! Just heard Mark Twain rolled over the reports of McCains...,0
Fri Jul 21 16:38:58 +0000 2017,I haven't posted on here so here is Joan of Arc made of gold on a horse in Philadelphia.… https://t.co/Nv4sQpb5rJ,0
Fri Jul 21 16:35:56 +0000 2017,We patients represent a gold mine of data. Ask us! Only living  breathing pts can inform #personcenteredcare!… https://t.co/1Yayezobkx,0
Fri Jul 21 16:31:08 +0000 2017,Thats gold digging 101 @ The Festival Pier at Penn's Landing https://t.co/LAVq5JdKv8,0
Fri Jul 21 16:30:22 +0000 2017,Laundry room design board presentation today. I love this rustic black and gold tile flooring!,0
Fri Jul 21 16:15:24 +0000 2017,Great week with this group of Future Dragons! Who knows  maybe one day they'll be wearing the Blue &amp; Gold https://t.co/ajMskQql8E,1
Fri Jul 21 16:15:00 +0000 2017,Great week with this group of Future Dragons! Who knows  maybe one day they'll be wearing the Blue &amp; Gold https://t.co/ajMskQql8E,1
Fri Jul 21 16:10:50 +0000 2017,Black as oil worth more than my weight in gold! https://t.co/STFkekwpMi,0
Fri Jul 21 16:04:39 +0000 2017,This gift wrapped necklace by @bulgariofficial is made of 18k pink #gold with yellow green… https://t.co/8000UtSYs9,0
Fri Jul 21 15:58:02 +0000 2017,My d*** is Glittered in Gold 🙊🤣💋 #JefeCold,0
Fri Jul 21 15:53:15 +0000 2017,Pure gold for interns. Just sent email link to all of mine. https://t.co/mPMyuHg06h,9
Fri Jul 21 15:43:59 +0000 2017,@yukan_yoshigift R they really blue? Unusual color blue like it  mine a green with gold flecks  we here would call… https://t.co/frcy1fffGZ,0
Fri Jul 21 15:42:46 +0000 2017,Have a great weekend! #Gold #Silver #Refining #PreciousMetals #Dentist #Jeweler #Pawn #GoldRefinery… https://t.co/Irtd3EdE8U,0
Fri Jul 21 15:39:18 +0000 2017,Ghost better be getting tf out this weekend since they let OJ out 🤷🏽‍♂️,1
Fri Jul 21 15:36:02 +0000 2017,FlashBackFriday to last week! Good Times. Good Vibes. Good Friends - #Repost… https://t.co/c5AFFaVZiN,0
Fri Jul 21 15:35:09 +0000 2017,Custom Necklace in gold and light blue. I have for a long time been a fan of these two colors… https://t.co/2UK0UvO6Ja,0
Fri Jul 21 15:32:15 +0000 2017,Bridal Shower Engagement Invitation in Glitter Hearts theme: https://t.co/bJmc0M5hhh #bride-to-be https://t.co/rlkTCVMtAt,0
Fri Jul 21 15:32:07 +0000 2017,Congrats. Also kinda sucks  but good to see "good guys" making it bigger. Gold standard in draft coverage year round and a cog for research,0
Fri Jul 21 14:52:13 +0000 2017,Pure gold for interns. Just sent email link to all of mine. https://t.co/mPMyuHg06h,9
Fri Jul 21 14:41:41 +0000 2017,Pure gold for interns. Just sent email link to all of mine. https://t.co/mPMyuHg06h,9
Fri Jul 21 14:35:09 +0000 2017,#DavidYurman Silver 14K Yellow Gold 16" Double Row Wheat Chain Buckle Necklace - (Retail $2595) (BellaTutto $1495)… https://t.co/bDaEpqFsZI,0
Fri Jul 21 14:33:09 +0000 2017,Pure gold for interns. Just sent email link to all of mine. https://t.co/mPMyuHg06h,9
Fri Jul 21 14:29:14 +0000 2017,The 666 cut WIC like Newt Gingrich sucks dick / Triple 6 soul  with the gold wiffle bat that I hold &amp; a sickle pole… https://t.co/TFy5WVOh4D,0
Fri Jul 21 14:23:42 +0000 2017,@defbumsin And in general it's harder for foreign fans to get into fansigns and music shows so the gold/silver system makes it harder,0
Fri Jul 21 14:22:06 +0000 2017,@defbumsin They're similar to gold but what ends up happening is that gold members take up all the space for music shows etc.,0
Fri Jul 21 14:19:06 +0000 2017,How would you make the Gold Cup better/matter/interesting beyond USA v. Mexico?,0
Fri Jul 21 14:17:08 +0000 2017,@BrownietheBully ... and his kids  and his wife  he was married 2 that gold digger at the time.U know she knows it'… https://t.co/8zaD7dvtQN,0
Fri Jul 21 14:02:07 +0000 2017,Mom coming through with the gold yet again: https://t.co/uRP9Ki4Fk8,0
Fri Jul 21 13:56:09 +0000 2017,Happy friday! Bump that #GreatFallback from me &amp; @UncleCrim!  https://t.co/0O0nBGbBxc #Philly #HipHop #Soul #Jazz #Samples #Poetry #Groove,0
Fri Jul 21 13:38:31 +0000 2017,Blake  Burke and Reggae Boyz advance to Gold Cup semifinals #PhillyUnion  https://t.co/ItkRNs0cKl https://t.co/tkwvvKEv7K,0
Fri Jul 21 13:34:31 +0000 2017,Well deserved homie jus keep up the #goodWork so that colorway stays PURPLE &amp; GOLD 🙌🏾 #teamLakers @kylekuzma @nikebasketball,0
Fri Jul 21 13:23:34 +0000 2017,This is pure gold. https://t.co/pGl7JUlz9c,0
Fri Jul 21 13:23:13 +0000 2017,Pure gold for interns. Just sent email link to all of mine. https://t.co/mPMyuHg06h,9
Fri Jul 21 13:20:06 +0000 2017,News roundup: Jamaica advances to Gold Cup semis https://t.co/dxMbxCOqcO,0
Fri Jul 21 13:19:24 +0000 2017,philadelphiaunion​.com &gt;&gt; Blake  Burke and Reggae Boyz advance to Gold Cup semifinals https://t.co/yCidWfQ66K,0
Fri Jul 21 13:16:14 +0000 2017,Pure gold for interns. Just sent email link to all of mine. https://t.co/mPMyuHg06h,9
Fri Jul 21 13:15:11 +0000 2017,Pure gold for interns. Just sent email link to all of mine. https://t.co/mPMyuHg06h,9
Fri Jul 21 13:11:19 +0000 2017,@jblumgart @5thSq The outrage on Taking Our South Philadelphia Streets Back are comedy gold.,0
Fri Jul 21 13:09:29 +0000 2017,Pure gold for interns. Just sent email link to all of mine. https://t.co/mPMyuHg06h,9
Fri Jul 21 12:52:29 +0000 2017,As the U.S. dollar fell  gold rose and stock markets made all-time highs https://t.co/zzKTOFaXah,0
Fri Jul 21 12:41:29 +0000 2017,Waxahatchee's "Silver" is gold. @k_crutchfield #music https://t.co/RBg5HJvGk6,0
Fri Jul 21 12:27:07 +0000 2017,This is gold. Ever heard of evolution? https://t.co/uqWuXPQ0Mz,0
Fri Jul 21 12:23:25 +0000 2017,Ranked Season  Gold Division ☺️ https://t.co/TLyhZa2Z5T,0
Fri Jul 21 12:14:17 +0000 2017,@MCUCast #1 MCUscene. Winter S. The Causeway all the way to "Bucky?..... From the second W.S jumps on the car. Everyone is pure gold.,0
Fri Jul 21 12:09:33 +0000 2017,@k8mcgarry I got a push notification from the app saying I was just one visit away from Gold too &amp; I was like damn… https://t.co/SDOcRgCE32,0
Fri Jul 21 12:05:40 +0000 2017,@ColtSTaylor @politico @Hadas_Gold That gif is amazing!,0
Fri Jul 21 11:59:48 +0000 2017,This thread is gold https://t.co/9yeDHD7Sqe,0
Fri Jul 21 11:53:48 +0000 2017,The comment section at Taking Our South Philadelphia Streets back about this is PURE COMEDY GOLD https://t.co/Mqlbg3UX4t,0
Fri Jul 21 11:47:52 +0000 2017,A gold album  a platinum album  and wins and Losses about to go platinum sweetheart. https://t.co/BQRglfZDxU,0
Fri Jul 21 11:27:34 +0000 2017,"there's a gold mine that exists within you..." https://t.co/MbAHvmFyyy,7
Fri Jul 21 10:32:16 +0000 2017,Speaking of the Gold Ink Awards  the third day of judging is currently underway. Stay tuned to see who the winners… https://t.co/PrL6p8adR8,3
Fri Jul 21 10:27:46 +0000 2017,Don't give me Gullivers Travels tho. That  was not worthy of the name Jack Black. His trope of deadbeat with a heart of gold didnt fit.,0
Fri Jul 21 09:45:47 +0000 2017,Boat Movers in Gold Coast | Slipaway #sidejobsnearme,0
Fri Jul 21 09:41:22 +0000 2017,"there's a gold mine that exists within you..." https://t.co/MbAHvmFyyy,7
Fri Jul 21 09:22:17 +0000 2017,Don't forget 7-9pm tn all new @Gold_Standard17 on @wildfire_radio! Give us a follow @surebrett @FDinote @brian_jenks https://t.co/qJR8PdROaD,4
Fri Jul 21 09:09:45 +0000 2017,The Clark Sisters - Pure Gold https://t.co/o7hpXuUezc #gospelmusic,0
Fri Jul 21 08:43:18 +0000 2017,Bridal Shower Who Am I Game in Gold Frame theme: https://t.co/atrbaZ0Db8 #bride-to-be https://t.co/iEqDZuPuNc,1
Fri Jul 21 08:25:42 +0000 2017,Bridal Shower Engagement Party Invitation in Pink And Gold theme: https://t.co/gDBVSy5OgW #bride-to-be https://t.co/XtRzyTSWF9,0
Fri Jul 21 08:25:32 +0000 2017,Bridal Shower Who Am I Game in Gold Frame theme: https://t.co/atrbaZ0Db8 #bride-to-be https://t.co/iEqDZuPuNc,1
Fri Jul 21 06:18:05 +0000 2017,After @SuzannChristine opens for Baby Face &amp; Fantasia's Sold out show  catch her at Plays and Players Theater. TIX: https://t.co/eduSGRpSqU,0
Fri Jul 21 06:17:13 +0000 2017,Mexico will face Jamaica in Gold Cup semifinals https://t.co/cmwmnBFpJ1 via @latimes,0
Fri Jul 21 05:44:33 +0000 2017,Weight lang. @ Gold's Gym https://t.co/9bqqJPrQB4,0
Fri Jul 21 05:11:25 +0000 2017,@A_boogie215 @wesmanchild Dream Hampton is someone who matters to rap culture. So she just woke up one day with a t… https://t.co/KY6BRzhFdK,0
Fri Jul 21 05:06:33 +0000 2017,Bridal Shower Bottle Labels in Flower Bouquet Black Stripes theme: https://t.co/n7Q3RU32EA #bride-to-be https://t.co/4D9OcvVF1l,1
Fri Jul 21 04:59:26 +0000 2017,Bridal Shower Bottle Labels in Flower Bouquet Black Stripes theme: https://t.co/n7Q3RU32EA #bride-to-be https://t.co/4D9OcvVF1l,1
Fri Jul 21 04:46:06 +0000 2017,@_cdiddy It's easy to get distracted by his antics  get past that and it's all gold,0
Fri Jul 21 04:43:17 +0000 2017,GOLD GOLD GOLD! FOR SELL We are local miners from Congo and our offic. #sidejobsfor extramoney,0
Fri Jul 21 04:41:10 +0000 2017,helping my friend find tix for divide tour mnl (pref GA  Silver or Gold) dm me if u know someone thanks ❤️,1
Fri Jul 21 04:04:38 +0000 2017,"there's a gold mine that exists within you..." https://t.co/MbAHvmFyyy,7
Fri Jul 21 03:59:38 +0000 2017,no better feeling than pulling out the gold sparkle santa hat from storage #xmasinjuly @DeadDogSIC,0
Fri Jul 21 03:51:38 +0000 2017,Russia's Largest Bank Makes First Transaction on Shanghai Gold Exchange as Moscow  Beijing Prepare for Trade in Gold https://t.co/axDBBJlZaE,1
Fri Jul 21 03:35:17 +0000 2017,@OAT_Escobar Louis MOVED to Paris!!! And new guy name Steve Gold he used to be a Model and is like the"new threat"… https://t.co/5ODtz02RvN,0
Fri Jul 21 03:30:10 +0000 2017,She's definitely winning in Girls Trip. She is comedy gold. https://t.co/CxOmz0DLeG,0
Fri Jul 21 03:12:55 +0000 2017,Baby Shower Welcome Sign in Blue Stripes theme: https://t.co/LwOkrNC2lD #babyshowerinvites #babyshowersupplies https://t.co/UaAEWLzA8a,0
Fri Jul 21 02:59:19 +0000 2017,Stay single until you meet someone who makes you feel like gold just standing beside them.,0
Fri Jul 21 02:39:53 +0000 2017,It is better—much better—to have wisdom and knowledge than gold and silver. Proverbs 16:16 https://t.co/k6zyARWmmG,2
Fri Jul 21 02:36:00 +0000 2017,"there's a gold mine that exists within you..." https://t.co/MbAHvmFyyy,7
Fri Jul 21 02:27:53 +0000 2017,"there's a gold mine that exists within you..." https://t.co/MbAHvmFyyy,7
Fri Jul 21 02:26:30 +0000 2017,"there's a gold mine that exists within you..." https://t.co/MbAHvmFyyy,7
Fri Jul 21 02:20:05 +0000 2017,2017 Gold Cup match recap: Jamaica 2  Canada 1 https://t.co/oSvVxiEX0X,0
Fri Jul 21 02:19:54 +0000 2017,Harry Fraud be havin a nigga missin exes and wantin to smoke some weed and put a hunnid gold chains on all at once lol,0
Fri Jul 21 02:17:54 +0000 2017,@ellewcee THE. BEST. So many lost gold mines. So many escaped convicts. SO MANY orphans from the depression looking… https://t.co/1zYWvmGSLp,0
Fri Jul 21 02:15:45 +0000 2017,"there's a gold mine that exists within you..." https://t.co/MbAHvmFyyy,7
Fri Jul 21 02:03:29 +0000 2017,Incidentally  the cover of John Harwood’s ‘The Seance’ is gorgeous. Metallic gold offsets the black  deepening it s… https://t.co/dS9eR3iUU5,0
Fri Jul 21 02:02:45 +0000 2017,brotherlygame​.com &gt;&gt; 2017 Gold Cup match recap: Jamaica 2  Canada 1 https://t.co/ofD41MJB6l,0
Fri Jul 21 02:01:42 +0000 2017,Gold steady  on track for second straight weekly gain - Gold held steady early on Friday and was on track for a... https://t.co/V4gAIHah9v,0
Fri Jul 21 01:39:12 +0000 2017,@hardball @DanRather Ya don't hav2 be Dan Rather to figure that one out. Guessing oil deal w/Putin  black gold  Siberian tea...,0
Fri Jul 21 01:37:45 +0000 2017,mlssoccer​.com &gt;&gt; Jamaica 2  Canada 1 | 2017 CONCACAF Gold Cup Match Recap https://t.co/gFXvl0s1vG,0
Fri Jul 21 01:32:52 +0000 2017,@MikulaMatataa natty is liquid gold in a can,0
Fri Jul 21 01:21:40 +0000 2017,It is better—much better—to have wisdom and knowledge than gold and silver. Proverbs 16:16 https://t.co/k6zyARWmmG,2
Fri Jul 21 01:04:43 +0000 2017,I joined a game with a minute left and managed to be gold in objective time and elims.... how,0
Fri Jul 21 00:57:19 +0000 2017,Wizard jawn almost done https://t.co/udaR93EL4n,0
Fri Jul 21 00:40:48 +0000 2017,wild how much #clout i dont have considering every single thing i post on every form of social media is solid fucking gold,0
Fri Jul 21 00:26:29 +0000 2017,Baby Shower Wishes For Baby in Gold Arrows theme: https://t.co/okMRlIiwQa #babyshowerinvites #babyshowersupplies https://t.co/lXWvN0dpTk,0
Fri Jul 21 00:00:10 +0000 2017,It is better—much better—to have wisdom and knowledge than gold and silver. Proverbs 16:16 https://t.co/k6zyARWmmG,2
