Sun Jul 30 23:49:34 +0000 2017,@Nappening i will be ur new friend but it will cost u some gold,0
Sun Jul 30 23:45:00 +0000 2017,Governor Tubby is comedy GOLD!  I hope he never drops out of sight (although Christie "dropping out of sight" may b… https://t.co/9vGXZL8jN0,0
Sun Jul 30 23:36:22 +0000 2017,Gold lunar module replica stolen from Neil Armstrong museum in Ohio.. Related Articles: https://t.co/IQ6paM20oS,0
Sun Jul 30 23:33:52 +0000 2017,Phillies call for Gold Glove after Freddy Galvis’ stellar all-around game https://t.co/CdOTiDTHtv https://t.co/vADqMS5oAb,0
Sun Jul 30 23:31:37 +0000 2017,Galvis had 3 hits  including walk-off. But his daily web gems  Gold Glove-worthy defense dominates the conversation: https://t.co/MYxODaYKBy,5
Sun Jul 30 23:30:39 +0000 2017,Enter This Arozzi #Gaming Chair  And #PS4 Gold #Giveaway #SGDQ2017 https://t.co/hzrtW6OjsG,2
Sun Jul 30 23:13:10 +0000 2017,Come checkout The Gold Gods!  https://t.co/aE6d9VXbt0,0
Sun Jul 30 23:11:09 +0000 2017,@coyote_mischief Lost my gold 5 promos  climbing back up to 100lp,0
Sun Jul 30 23:07:23 +0000 2017,Enter This Arozzi #Gaming Chair  And #PS4 Gold #Giveaway #SGDQ2017 https://t.co/hzrtW6OjsG,2
Sun Jul 30 23:01:22 +0000 2017,A rare gold replica of the lunar space module has been stolen from the Armstrong Air and Space Museum… https://t.co/xL0c63Udn7,3
Sun Jul 30 23:00:07 +0000 2017,Gold replica of lunar module stolen from Neil Armstrong Museum  #GoogleNews (https://t.co/43GD05nW5G),0
Sun Jul 30 22:58:32 +0000 2017,Phillies call for Gold Glove after Freddy Galvis’ stellar all-around game https://t.co/BKffXci0aS,0
Sun Jul 30 22:52:06 +0000 2017,csnphilly​.com &gt;&gt; Phillies call for Gold Glove after Freddy Galvis' stellar all-around game https://t.co/ErTVpsiYah,0
Sun Jul 30 22:38:54 +0000 2017,Freddy Galvis had one heck of a game. Walkoff hit follows Gold Glove defense.,15
Sun Jul 30 22:30:17 +0000 2017,Go ahead... Apply the pressure.... Ppl dont fear men they fear monsters!!! 😈 #yonniebeaubois #Gold https://t.co/pz4bgzUIcH,0
Sun Jul 30 22:13:52 +0000 2017,Freddy Galvis had one heck of a game. Walkoff hit follows Gold Glove defense.,15
Sun Jul 30 22:10:22 +0000 2017,Finally got around to watching this  Pure Gold. Fave part is Anglin in helicopter and /ourgirls/ strip club. https://t.co/UirVBZ7nA9,22
Sun Jul 30 22:06:59 +0000 2017,Freddy Galvis had one heck of a game. Walkoff hit follows Gold Glove defense.,15
Sun Jul 30 22:04:38 +0000 2017,David Tyree catch David Freeze home run Chalmers three Patrick Kane's game winning goal in '10 Michael Phelps 8th G… https://t.co/bYRc6225p5,0
Sun Jul 30 22:03:46 +0000 2017,Gold lunar module stolen from Neil Armstrong Museum: https://t.co/QneUWz5KO6 https://t.co/GwGwYXC2d2,1
Sun Jul 30 21:41:32 +0000 2017,Freddy Galvis had one heck of a game. Walkoff hit follows Gold Glove defense.,15
Sun Jul 30 21:39:20 +0000 2017,I just added this to my closet on Poshmark: Amulet Style Gold Plated Necklace. https://t.co/ukl2eTvZ7R via @poshmarkapp #shopmycloset,0
Sun Jul 30 21:38:19 +0000 2017,@LilChase26 @Phillies I remember that episode. The gold pond made them laser proof lol,0
Sun Jul 30 21:30:15 +0000 2017,After @SuzannChristine  opens for Baby Face &amp; Fantasia's Sold out show  catch her at Plays and Players Theater. TIX: https://t.co/eduSGR8hzm,0
Sun Jul 30 21:22:51 +0000 2017,Freddy Galvis had one heck of a game. Walkoff hit follows Gold Glove defense.,15
Sun Jul 30 21:20:14 +0000 2017,Freddy Galvis had one heck of a game. Walkoff hit follows Gold Glove defense.,15
Sun Jul 30 21:19:35 +0000 2017,Freddy Galvis had one heck of a game. Walkoff hit follows Gold Glove defense.,15
Sun Jul 30 21:15:53 +0000 2017,Freddy Galvis had one heck of a game. Walkoff hit follows Gold Glove defense.,15
Sun Jul 30 21:12:21 +0000 2017,Gold. Glover.,1
Sun Jul 30 21:12:11 +0000 2017,Freddy Galvis had one heck of a game. Walkoff hit follows Gold Glove defense.,15
Sun Jul 30 21:12:00 +0000 2017,I just earned the 'Fields of Gold (Level 4)' badge on @untappd! https://t.co/omLnf8Mdqr,0
Sun Jul 30 21:08:34 +0000 2017,Freddy Galvis had one heck of a game. Walkoff hit follows Gold Glove defense.,15
Sun Jul 30 21:08:34 +0000 2017,Freddy Galvis had one heck of a game. Walkoff hit follows Gold Glove defense.,15
Sun Jul 30 21:07:40 +0000 2017,Freddy Galvis had one heck of a game. Walkoff hit follows Gold Glove defense.,15
Sun Jul 30 21:05:28 +0000 2017,Freddy Galvis had one heck of a game. Walkoff hit follows Gold Glove defense.,15
Sun Jul 30 21:02:47 +0000 2017,I'm a black chef with a black owned catering company in Philadelphia . 1 RT could introduce me to my next client .… https://t.co/xiiMASn49L,1350
Sun Jul 30 20:37:41 +0000 2017,I entered a giveaway for a chance to win "HEARTFEEL 23 pcs Mint Peach Glitter Gold Tissu..." by HEARTFEEL. https://t.co/FnZc7bEuZc #giveaway,0
Sun Jul 30 20:33:57 +0000 2017,Don't miss: ONLY $9.6 for yellow gold promise ring w/ coupon-D9J56AFV &gt; https://t.co/Kix195PZbG https://t.co/0zgNC5P9dS #giveaway,0
Sun Jul 30 20:32:26 +0000 2017,@Pantene  I love the gold series  detangling milk for my daughter hair.     She says it smells like fruity pebbles… https://t.co/IIAGEM1GL9,0
Sun Jul 30 20:31:06 +0000 2017,You Throw  Girl: #ADHD Role Model Wins Gold in Rio #ADHDAwesome #ADHDInspiration @Additudemag https://t.co/SKEJjITAra,0
Sun Jul 30 20:18:03 +0000 2017,❤️❤️RT @Mixedwith_gold: I tell my friends I love Dell all the time ❤️,0
Sun Jul 30 20:06:58 +0000 2017,Clean House in a Flash Using #AmericanMade Scott's Liquid Gold https://t.co/zyxjlSpXBk #LiquidGold4Wood #Cleaning https://t.co/ZsHreNpeXI,1
Sun Jul 30 20:00:26 +0000 2017,Clean House in a Flash Using #AmericanMade Scott's Liquid Gold https://t.co/zyxjlSpXBk #LiquidGold4Wood #Cleaning https://t.co/ZsHreNpeXI,1
Sun Jul 30 19:59:01 +0000 2017,I entered a giveaway for a chance to win "HEARTFEEL 23 pcs Mint Peach Glitter Gold Tissu..." by HEARTFEEL. https://t.co/csWO2SVQ8D #giveaway,0
Sun Jul 30 19:55:25 +0000 2017,🏆⚽️ @USSoccer Wins!  Full #USMNT vs @ItsTheJFF 2017 @CONCACAF Gold Cup Highlights: https://t.co/mTqei6MfWX  All the… https://t.co/1MUGlErsCX,22
Sun Jul 30 19:51:06 +0000 2017,I just earned the 'Fields of Gold' badge on @untappd! https://t.co/5XKmzfFT5G,0
Sun Jul 30 19:43:10 +0000 2017,@alunaj7 @RSportscenter @GritPersonified 10 silver sluggers  2 gold gloves  696 homeruns...  But he's not a hall of… https://t.co/3Qd97DVEL2,0
Sun Jul 30 19:38:35 +0000 2017,Don't miss: ONLY $9.6 for yellow gold promise ring w/ coupon-D9J56AFV &gt; https://t.co/DVC6yAbJEk https://t.co/xJYk9wGupL #giveaway,0
Sun Jul 30 19:37:22 +0000 2017,@A5hunnit Not at all  might have struck gold. But u know ima fck it up lol,0
Sun Jul 30 19:00:03 +0000 2017,#NowPlaying Kirk Franklin - Silver &amp; Gold on https://t.co/zr1bxvCKD3,0
Sun Jul 30 18:57:55 +0000 2017,We took away your suburban dachas  so just take our White House. Oops--Putey already did. Well  clean it out now. T… https://t.co/hID9lxmcN4,0
Sun Jul 30 18:54:15 +0000 2017,Gold glove don't @ me https://t.co/v2rFFMf4gs,0
Sun Jul 30 18:54:03 +0000 2017,With The Drought Over  "#Gold Fever" Grips California | Zero Hedge https://t.co/XJxkiNUhKS,0
Sun Jul 30 18:52:08 +0000 2017,RT  "Happiness  not gold or prestige  is the ultimate currency." -- Tal Ben-Shahar (of happier_tv)  — J.D. Roth (jdroth) July 30  2017,0
Sun Jul 30 18:50:47 +0000 2017,@Discocollective champagne socialism. cocaine socialism. truffle &amp; gold leaf socialism,0
Sun Jul 30 18:43:51 +0000 2017,Don't miss: ONLY $11.99 for Rose Gold Bracelet w/ code- JETOBERT &gt; https://t.co/VGaGj5joU4 @TobertJewelry https://t.co/DtbW9UzLVC #giveaway,0
Sun Jul 30 18:21:24 +0000 2017,@Carpe_DiemRP @Gemstone_RP @SophiaMoreno_RP @E_SilverRP *taking the letter from the boy that had dropped it to us.… https://t.co/5QTwGjQOYt,0
Sun Jul 30 18:14:44 +0000 2017,😭😭😭😭Yoooo Steph drawlin,0
Sun Jul 30 18:09:29 +0000 2017,You know I have been on the Galvis Gold Glove beat for quite awhile. Not sure about this year  but when Phils get g… https://t.co/uZ49CWWx82,0
Sun Jul 30 18:06:30 +0000 2017,Just give the Gold Glove to Galvis already 😳 #GoPhils #PhilliesTalk,0
Sun Jul 30 18:05:45 +0000 2017,jesus if freddy galvis doesn't get a gold glove this season that's robberyo,0
Sun Jul 30 18:05:38 +0000 2017,Gold. Glover.,1
Sun Jul 30 18:05:22 +0000 2017,Someone deserves a gold glove  Freddy #Phillies,0
Sun Jul 30 18:05:20 +0000 2017,Freddy galvis for gold glove,0
Sun Jul 30 18:05:19 +0000 2017,Freddy Galvis is earning his Gold Glove today. #Phillies,1
Sun Jul 30 18:04:54 +0000 2017,Give that man a goddamn Gold Glove award,0
Sun Jul 30 18:03:36 +0000 2017,A rare gold replica of the lunar space module has been stolen from the Armstrong Air and Space Museum… https://t.co/xL0c63Udn7,3
Sun Jul 30 18:01:02 +0000 2017,All that glitters is #gold. Christopher Kennedy:Impalpable Light until Aug. 27 #Gallery #Hours… https://t.co/7qnsqak8Xx,0
Sun Jul 30 17:53:28 +0000 2017,Gold Alert issued for missing Delaware man. https://t.co/Rc8Kn7IWdC https://t.co/UFp3jPiTWY,7
Sun Jul 30 17:19:29 +0000 2017,+98% of public comments submitted support protecting monuments like Gold Butte .@SecretaryZinke! #SaveGoldButte https://t.co/na8jGz6ZoD,0
Sun Jul 30 17:17:03 +0000 2017,Gold Alert issued for missing Delaware man. https://t.co/Rc8Kn7IWdC https://t.co/UFp3jPiTWY,7
Sun Jul 30 17:11:32 +0000 2017,A rare gold replica of the lunar space module has been stolen from the Armstrong Air and Space Museum… https://t.co/xL0c63Udn7,3
Sun Jul 30 17:10:22 +0000 2017,A rare gold replica of the lunar space module has been stolen from the Armstrong Air and Space Museum… https://t.co/xL0c63Udn7,3
Sun Jul 30 17:10:05 +0000 2017,Gold Alert issued for missing Delaware man. https://t.co/KBuaYSrPBk,0
Sun Jul 30 17:06:35 +0000 2017,Bridal Shower Food Tent in Glitter Hearts theme: https://t.co/wyq2biwcCK #bride-to-be https://t.co/SLcaSXGYuD,0
Sun Jul 30 16:58:48 +0000 2017,Don't Miss: 20% Off w/ Coupon - JETOBERT &gt; Rose Gold Hoop Earrings &gt;https://t.co/0qKrZHZmtM @TobertJewelry https://t.co/owZplll2AW #giveaway,0
Sun Jul 30 16:55:00 +0000 2017,CAN YOU SEE THE HEARTS OF GOLD...AND GOD......&lt;3 https://t.co/3f1WrgByCC,0
Sun Jul 30 16:54:17 +0000 2017,Gold Alert issued for missing Delaware man. https://t.co/Rc8Kn7IWdC https://t.co/UFp3jPiTWY,7
Sun Jul 30 16:52:34 +0000 2017,Don't Miss: 20% Off w/ Code - D9J56AFV&gt; Fashion Gold Flower Ring &gt; https://t.co/SlxlQfyMqE @JoGray_Ring https://t.co/cXNY1tTzY0 #giveaway,0
Sun Jul 30 16:50:34 +0000 2017,Gold Alert issued for missing Delaware man. https://t.co/Rc8Kn7IWdC https://t.co/UFp3jPiTWY,7
Sun Jul 30 16:41:59 +0000 2017,Team Jesus Black And Gold Coffee Mug - https://t.co/QJN4ddlDMy https://t.co/RSfwHN4Cyu,0
Sun Jul 30 16:17:42 +0000 2017,@BraydonOlinger Both these are gold😂,0
Sun Jul 30 16:15:52 +0000 2017,I just earned the 'Fields of Gold (Level 3)' badge on @untappd! https://t.co/WY0FMIeZ5e,0
Sun Jul 30 16:13:18 +0000 2017,Don't Miss: 20% Off w/ Coupon - JETOBERT &gt; Rose Gold Hoop Earrings &gt;https://t.co/i4cNsdIX2u @TobertJewelry https://t.co/alG91stl5N #giveaway,0
Sun Jul 30 16:09:59 +0000 2017,The main event at #PartingOfWays: @JuanFDCoronado defends gold against explosive @Missile_Assault! VOD/mp4 up now @… https://t.co/BlKxuVRcCB,2
Sun Jul 30 16:00:42 +0000 2017,Crummels &amp; Defarge and the Rumblebees fight for Gold at #TheLodger! See who wins out  on VOD &amp; MP4 here -… https://t.co/v2ORzxKEap,0
Sun Jul 30 15:41:03 +0000 2017,Make videos and money with this YouTube Mastery Bundle — for only $41  There’s gold in YouTube videos. Sure  you c… https://t.co/pJrD0dN63o,0
Sun Jul 30 15:22:45 +0000 2017,Smh it would be traffic 🤦‍♂️🤦‍♂️🤦‍♂️,0
Sun Jul 30 15:16:00 +0000 2017,Stay gold ✨  https://t.co/dWtcpeGNgg https://t.co/eplEBlli9V,9
Sun Jul 30 15:04:36 +0000 2017,Musicians [live] - Gold Motel on Y-Not Radio @iradiophilly - Listen https://t.co/s3P0SrW1ka,0
Sun Jul 30 14:25:08 +0000 2017,Everything that glitter ain't gold 💯,1
Sun Jul 30 14:13:15 +0000 2017,I just want to say my snap story is GOLD,0
Sun Jul 30 14:02:51 +0000 2017,Everything that glitter ain't gold 💯,1
Sun Jul 30 13:52:28 +0000 2017,@RogerJStoneJr Nixon went to China ... I know - but I know how much U hate the ole ratbastard  Dear Roger. I'm a Li… https://t.co/hwiSvwZEOL,0
Sun Jul 30 13:35:20 +0000 2017,This thread is gold--so important to have different types of people/communication styles on a team! https://t.co/CgfVUV8otw,0
Sun Jul 30 13:00:02 +0000 2017,Check out BLACK GOLD FESTIVAL this afternoon at 4:00pm https://t.co/6brJaasyXM #PHL #Philly,0
Sun Jul 30 12:28:28 +0000 2017,@RealGlenMacnow @GameOfThrones @SportsRadioWIP A CROWN  of gold!!!!! Dave Chapelle skit "keeping it real goes terribly wrong" GOT  style,0
Sun Jul 30 12:16:00 +0000 2017,Check out BLU VIVO 6 4G LTE SIM-Free Smartphone (64 GB and 4 GB RAM) - Gold by BLU https://t.co/8wQJgfIoGJ,0
Sun Jul 30 12:05:21 +0000 2017,I'm not black I'm gold,3
Sun Jul 30 11:20:34 +0000 2017,Breakfast of champions: some gold is stuck in my teeth.,0
Sun Jul 30 10:04:36 +0000 2017,you can't love track if you don't hate it.,2648
Sun Jul 30 09:53:06 +0000 2017,Gold lunar module model stolen from Ohio's Armstrong Air and Space Museum https://t.co/sXFoOOh7w3,0
Sun Jul 30 09:12:17 +0000 2017,Bridal Shower Days Until I Do in Gold Frame theme: https://t.co/M0d0ekcaCL #bride-to-be https://t.co/DEqlz1pMuh,0
Sun Jul 30 08:51:44 +0000 2017,Stay Gold,0
Sun Jul 30 08:14:07 +0000 2017,@PontiacMadeDDG 800K!! #OnTheRoadToAMilli!! W W W W W W W! https://t.co/ZMS5dp83IA,0
Sun Jul 30 08:05:05 +0000 2017,me: *watches Upgrade You music video*  me:  me: wow I can't believe Beyonce invented gold,0
Sun Jul 30 07:55:39 +0000 2017,🏆⚽️ @USSoccer Wins!  Full #USMNT vs @ItsTheJFF 2017 @CONCACAF Gold Cup Highlights: https://t.co/mTqei6MfWX  All the… https://t.co/1MUGlErsCX,22
Sun Jul 30 05:59:23 +0000 2017,Stay gold ✨  https://t.co/dWtcpeGNgg https://t.co/eplEBlli9V,9
Sun Jul 30 05:48:37 +0000 2017,Jon Jones called out Brock Lesnar after defeating Daniel Cormier at #UFC214.   #JonJones #BrockLesnar #UFC https://t.co/V8koOEVath,29
Sun Jul 30 05:46:13 +0000 2017,Wow  I love @Listia! I just won this for free  Gold baby girl shoes https://t.co/ixZEiOW2zB,0
Sun Jul 30 05:00:08 +0000 2017,Beep beep! @Simone_Biles should get another gold for this one: https://t.co/z2GE6UnkAd https://t.co/TO42ey673M,1
Sun Jul 30 04:47:59 +0000 2017,What's up y'all ???,0
Sun Jul 30 04:47:43 +0000 2017,🤔🤔🤔,0
Sun Jul 30 04:24:22 +0000 2017,Gold replica of lunar module swiped from Armstrong museum.. Related Articles: https://t.co/so6tMBPt8s,0
Sun Jul 30 04:14:52 +0000 2017,@MikkellerBeer's Green Gold  #ipa #instagram #cerveza #craftbeer #beer #birra #saturday  #ビール #麦酒… https://t.co/16wkKNCKaE,0
Sun Jul 30 04:05:11 +0000 2017,🏆⚽️ @USSoccer Wins!  Full #USMNT vs @ItsTheJFF 2017 @CONCACAF Gold Cup Highlights: https://t.co/mTqei6MfWX  All the… https://t.co/1MUGlErsCX,22
Sun Jul 30 04:04:16 +0000 2017,Should you buy females  lingerie even if they don't wear it for you ijs,0
Sun Jul 30 03:52:59 +0000 2017,pyrite (fool's gold) - frank ocean&gt;&gt;&gt;,0
Sun Jul 30 03:32:42 +0000 2017,@dgb0711 @mik9703 They did a documentary thing on him few years back &amp; his mom was raising his siblings kids in a d… https://t.co/o534TiXQ3u,0
Sun Jul 30 03:31:46 +0000 2017,"I see you n*ggas having trouble going gold. Turning into some so and so’s that no one knows. Come live all your dr… https://t.co/PDvbZrcQKr,0
Sun Jul 30 03:23:45 +0000 2017,@ButlerBrian285 @lwrncjones @EagleFanProbs + Rollins is a Gold Glove winner.,0
Sun Jul 30 03:15:08 +0000 2017,Baby Shower Thank You Tags in Gold Arrows theme: https://t.co/pAaEMAIN3v #babyshowerinvites #babyshowersupplies https://t.co/I5vI0hjsw8,0
Sun Jul 30 03:10:47 +0000 2017,AB gonna end up fighting Catta for the Gold Coast/Top Gipper Championship on 41st &amp; Lancaster,0
Sun Jul 30 03:08:45 +0000 2017,I'd love to see Cyborg finally win UFC gold  but I'd also love to see Tonya Evinger give her a challenge in the process #UFC145,0
Sun Jul 30 03:06:28 +0000 2017,Here we go!  Cyborgs long awaited return to the octagon will be one cemented with UFC gold.  This will be fun.  #CyborgDivision #UFC214,0
Sun Jul 30 03:04:35 +0000 2017,Terrible swatches but just wow i love Siberian gold😍😍@JeffreeStar https://t.co/G0Q4coS2NI,0
Sun Jul 30 02:43:21 +0000 2017,@omgitsniara dog this is gold 😂😂😂,0
Sun Jul 30 02:28:58 +0000 2017,Lmao @JakeToussaint ya future kid gonna be like "my daddy got a gold tooth",0
Sun Jul 30 02:28:22 +0000 2017,Philly has officially arrived. Margie Carden makes a ridiculous one handed catch to lift #NXT2021 over Yellow Jacke… https://t.co/nRPiQrGHpN,2
Sun Jul 30 02:16:26 +0000 2017,The main event at #PartingOfWays: @JuanFDCoronado defends gold against explosive @Missile_Assault! VOD/mp4 up now @… https://t.co/BlKxuVRcCB,2
Sun Jul 30 02:11:20 +0000 2017,You thought that was your Baron? #DIGLoL secure yet another Baron and take back control of the game! 10k gold lead!… https://t.co/tcmoalDPuk,5
Sun Jul 30 02:00:33 +0000 2017,@AoDespair Fucking hell.  And the president thinks it's like low-rent life insurance as advertised on Fox News betw… https://t.co/3RiuZpwuFT,0
Sun Jul 30 02:00:24 +0000 2017,The main event at #PartingOfWays: @JuanFDCoronado defends gold against explosive @Missile_Assault! VOD/mp4 up now @… https://t.co/BlKxuVRcCB,2
Sun Jul 30 01:53:05 +0000 2017,Beep beep! @Simone_Biles should get another gold for this one: https://t.co/Yah8u1Fm4E https://t.co/DvBSlMGxIj,2
Sun Jul 30 01:43:51 +0000 2017,This game means nothing and worldwide stars are playing harder in BAR-RMA match than MLS guys were in Gold Cup,0
Sun Jul 30 01:38:56 +0000 2017,Could a team use him a super utility player where he can play SS  2B and 3B? Sure  but his value is best as a Gold Glove type SS,1
Sun Jul 30 01:33:09 +0000 2017,@nykeadenae You shouldn't be in the business of giving out gold stars to brands who do what they're supposed to do.… https://t.co/hZs7aPnuUJ,0
Sun Jul 30 01:30:06 +0000 2017,Beep beep! @Simone_Biles should get another gold for this one: https://t.co/Yah8u1Fm4E https://t.co/DvBSlMGxIj,2
Sun Jul 30 01:24:55 +0000 2017,Could a team use him a super utility player where he can play SS  2B and 3B? Sure  but his value is best as a Gold Glove type SS,1
Sun Jul 30 01:06:39 +0000 2017,@kevinabstract yo gold gettin rl close to 1m,0
Sun Jul 30 00:48:46 +0000 2017,@Brwnsknbarbie Girl  I've known you for over 10 years. You've always had a heart of gold!,0
Sun Jul 30 00:45:39 +0000 2017,Shop @ https://t.co/6cq48AM2VM Description: Drop Earrings with Dangling Tibetan Feather Leaf. Size: 2″.Gold/ Dark A… https://t.co/AgsPTIkrVv,0
Sun Jul 30 00:41:50 +0000 2017,You thought that was your Baron? #DIGLoL secure yet another Baron and take back control of the game! 10k gold lead!… https://t.co/tcmoalDPuk,5
Sun Jul 30 00:33:12 +0000 2017,Baby Shower Thank You Tags in Dots theme: https://t.co/REtydXjW0q #babyshowerinvites #babyshowersupplies https://t.co/vB1o8ItL0R,0
Sun Jul 30 00:32:51 +0000 2017,@ExtraLrgPopcorn No no no LeBron belongs in Wine and Gold. #ALLin216 #DefendTheLand #ALLinCLE #Believeland… https://t.co/sI74Mbdwas,0
Sun Jul 30 00:23:03 +0000 2017,News: Discovery’s Bering Sea Gold Season 6 Premieres August 11: The Alaskan gold mining crews of Discovery’s hit… https://t.co/rc0yD8I2RQ,2
Sun Jul 30 00:23:00 +0000 2017,News: Discovery’s Bering Sea Gold Season 6 Premieres August 11: The Alaskan gold mining crews of Discovery’s hit… https://t.co/rc0yD8I2RQ,2
