Wed Dec 06 23:59:13 +0000 2017,Yo #Bitcoin  I heard you like parabolas  so we put a parabola in your parabola... https://t.co/9SVxrs1Jaw,9
Wed Dec 06 23:58:45 +0000 2017,Is Bitcoin the modern day gold rush?,31
Wed Dec 06 23:58:38 +0000 2017,Holy crap  I hadn't noticed the disparity between the Bitcoin market cap and that of the next few coins had gotten… https://t.co/pFjPWPxwH1,0
Wed Dec 06 23:57:46 +0000 2017,People still don't get it.  So bitcoin miners are annualizing at 31 teraWatt hours. To produce gold we consumed 260… https://t.co/QKUk1cZNze,332
Wed Dec 06 23:57:37 +0000 2017,$GAHC Looking good here. (Bitcoin play) https://t.co/iwrrj1bACB,2
Wed Dec 06 23:57:28 +0000 2017,People still don't get it.  So bitcoin miners are annualizing at 31 teraWatt hours. To produce gold we consumed 260… https://t.co/QKUk1cZNze,332
