Wed Nov 29 23:58:43 +0000 2017,Let them sleep on bitcoin bro https://t.co/oCjJsIBA6u,0
Wed Nov 29 23:58:05 +0000 2017,Recode Daily: Bitcoin is having a watershed moment. https://t.co/nPH08vF0Z2,0
Wed Nov 29 23:58:04 +0000 2017,If the price drops too fast  enough people can get liquidated that all the bitcoin being automatically sold pushes… https://t.co/33U4hh2eSQ,20
Wed Nov 29 23:57:48 +0000 2017,Some exchanges allow you to borrow money to buy more bitcoin than you can afford. If the price drops enough  the sy… https://t.co/X8JSLtiD7z,23
Wed Nov 29 23:57:21 +0000 2017,via @haystacktv https://t.co/bDHzfWPF8i,0
Wed Nov 29 23:54:14 +0000 2017,#Japan’s largest #cryptocurrency exchange is putting down roots in America. As #bitcoin surpasses $10 000 and insti… https://t.co/RsjpDyxGua,7
Wed Nov 29 23:54:00 +0000 2017,Bitcoin Crossed $10K for the First Time: Global Validation or Speculative Bubble? https://t.co/XxoOd7OuEp via @bitcoinmagazine,0
Wed Nov 29 23:53:22 +0000 2017,Andreas Antonopoulos - Great speech on Blockchain vs. Bitcoin in front o... https://t.co/sSLUPCQkuX,0
Wed Nov 29 23:52:59 +0000 2017,Every generation has its bubble or two  and this time is no different.  #Bitcoin #cryptocurrency #bubble #finance… https://t.co/RdaNp8n6yL,0
Wed Nov 29 23:52:31 +0000 2017,Bitcoin &amp; The Naysayers https://t.co/4oHNpbMiO1,0
Wed Nov 29 23:52:19 +0000 2017,No matter what happens to Bitcoin: you're watching a story unfold that you will remember for the rest of your life.… https://t.co/AeCV80jUWV,290
Wed Nov 29 23:52:15 +0000 2017,I think this is the part where everyone FOMOs onto the bitcoin $10k+ train  then in the near future some minor even… https://t.co/6IYfHQeNIL,72
Wed Nov 29 23:52:07 +0000 2017,When your homie tells you to put money into bitcoin when it's at $3 000 and now it's at $11 000 https://t.co/09TvjpafFz,30
Wed Nov 29 23:51:59 +0000 2017,if you need a laugh just imagine Trump trying to explain bitcoin while his teleprompter is broken,11
Wed Nov 29 23:50:56 +0000 2017,Bitcoin just hit $10 000 on bitfinex  now it's official!,90
Wed Nov 29 23:50:54 +0000 2017,A year ago I had 2 cents in my Bitcoin wallet. Now im at 1.32$ life's crazy! https://t.co/FbiTYnsa1O,17
Wed Nov 29 23:50:51 +0000 2017,No matter what happens to Bitcoin: you're watching a story unfold that you will remember for the rest of your life.… https://t.co/AeCV80jUWV,290
Wed Nov 29 23:49:08 +0000 2017,invest it in bitcoin https://t.co/SXWFFbGOgq,7
Wed Nov 29 23:48:13 +0000 2017,I heard about Bitcoin in 2010 when the Silkroad was jumpin &amp; something told me to buy some then. I just had to fuck it off ☹️,0
Wed Nov 29 23:48:00 +0000 2017,Bitcoin Rose More Than 1300 Percent This Year. Is This a Bitcoin Bubble? https://t.co/PXyVojCsZu,0
Wed Nov 29 23:47:29 +0000 2017,Anyone know anything about bitcoin? Looking into investing some money into it.,0
Wed Nov 29 23:46:53 +0000 2017,A year ago I had 2 cents in my Bitcoin wallet. Now im at 1.32$ life's crazy! https://t.co/FbiTYnsa1O,17
Wed Nov 29 23:46:26 +0000 2017,A year ago I had 2 cents in my Bitcoin wallet. Now im at 1.32$ life's crazy! https://t.co/FbiTYnsa1O,17
Wed Nov 29 23:46:25 +0000 2017,Weeeelllllll....It’s great to see all the positive Bitcoin posts have far taken over my Facebook feed instead of th… https://t.co/HiqU9YAwqf,0
Wed Nov 29 23:46:14 +0000 2017,I just bought my first digital currency on #Coinbase - try it! https://t.co/9NsyVo2RZa #cryptocurrency #bitcoin… https://t.co/AzFkbnkDi1,2
Wed Nov 29 23:45:51 +0000 2017,lol @ old white men who don't understand bitcoin  $btc #btc #bitcoin $crypto  https://t.co/S98GBiuk7z,1
Wed Nov 29 23:44:46 +0000 2017,Bitcoin exchange Coinbase has more users than stock brokerage Schwab https://t.co/DtCEdgxguh,0
Wed Nov 29 23:44:18 +0000 2017,A year ago I had 2 cents in my Bitcoin wallet. Now im at 1.32$ life's crazy! https://t.co/FbiTYnsa1O,17
Wed Nov 29 23:44:02 +0000 2017,Bitcoin goes mainstream at the Chicago Mercantile Exchange https://t.co/nK1LevEs94 via @NYBizJournal,0
Wed Nov 29 23:43:53 +0000 2017,A year ago I had 2 cents in my Bitcoin wallet. Now im at 1.32$ life's crazy! https://t.co/FbiTYnsa1O,17
Wed Nov 29 23:43:39 +0000 2017,Wall Street jumps on the bitcoin wagon. #Bitcoin10K   Nasdaq plans to launch bitcoin futures in first half 2018… https://t.co/WBbvHdMNJp,0
Wed Nov 29 23:43:00 +0000 2017,Great to see the imminent CME #Bitcoin futures are opening the door for many more derivatives to be launched in 201… https://t.co/aSlHaEnMYp,1
Wed Nov 29 23:42:26 +0000 2017,Bitcoin could of change a generation if you had of got in from the start.,3
Wed Nov 29 23:42:18 +0000 2017,Bitcoin is correcting. As expected. I’m sure people chased the high and are about to see they loss money n panic n… https://t.co/MLsRZdffAS,0
Wed Nov 29 23:41:10 +0000 2017,Amazing quote on the extraordinary lesson #bitcoin teaches us.......  “Bitcoin proves we don’t need politicians  bu… https://t.co/hsuyPVxkNP,1
Wed Nov 29 23:41:02 +0000 2017,alot of sell walls hit around $88 when the Koreans and Chinese wokeup. $LTC #Litecoin #Bitcoin #Ethereum,0
Wed Nov 29 23:40:11 +0000 2017,Amazing quote on the extraordinary lesson #bitcoin teaches us.......  “Bitcoin proves we don’t need politicians  bu… https://t.co/hsuyPVxkNP,1
Wed Nov 29 23:40:04 +0000 2017,Stop saying bitcoin is an answer for wealthy inequality. Nobel Prize-winning economist Joseph Stiglitz said... https://t.co/tBts7XxKgi,8
Wed Nov 29 23:39:58 +0000 2017,#COINBASE LOSES BID TO BLOCK #IRS PROBE OF #BITCOIN GAINS https://t.co/b60RmpWsMy,16
Wed Nov 29 23:39:50 +0000 2017,ICO Mania Has Calmed Down a Bit – And That's Not So Bad https://t.co/cgXJQXx6a5 via @CoinDesk #cryptocurrency #ICO #bitcoin,0
Wed Nov 29 23:39:04 +0000 2017,If you get an email from "omarbhamcrypto@gmail.com" claiming to be me  please report / flag the scammers. I do not… https://t.co/HlRBS4echB,49
Wed Nov 29 23:38:28 +0000 2017,I can't tell if Bitcoin is the plastics of the new millennium or the Enron. SHOULD I GET A BITCOIN BEFORE IT'S WORT… https://t.co/8KEKcmmd4K,2
Wed Nov 29 23:37:21 +0000 2017,My sister tried explaining Bitcoin to me..  "So it's like Apple Pay? No? Is it like The Sims money? Ohhhh it's like… https://t.co/ty2o0lFcuT,0
Wed Nov 29 23:36:36 +0000 2017,Bitcoin reaches an all time high. The largest bitcoin exchange in the U.S. https://t.co/htNF9psxrd https://t.co/fiw7oQnn0H,0
Wed Nov 29 23:36:10 +0000 2017,@Agony Go to https://t.co/Zu4Ts2J1c8 sign up and buy yourself a #bitcoin btw,0
Wed Nov 29 23:35:53 +0000 2017,will suck dick for bitcoin,47
Wed Nov 29 23:33:58 +0000 2017,No matter what happens to Bitcoin: you're watching a story unfold that you will remember for the rest of your life.… https://t.co/AeCV80jUWV,290
Wed Nov 29 23:30:45 +0000 2017,Bitcoin: the other money you don’t have,125
Wed Nov 29 23:30:41 +0000 2017,#COINBASE LOSES BID TO BLOCK #IRS PROBE OF #BITCOIN GAINS https://t.co/b60RmpWsMy,16
Wed Nov 29 23:30:11 +0000 2017,#Japan’s largest #cryptocurrency exchange is putting down roots in America. As #bitcoin surpasses $10 000 and insti… https://t.co/RsjpDyxGua,7
Wed Nov 29 23:29:26 +0000 2017,Don't forget Bitcoin is on sale today. #bitcoin #cyberwednesday,0
Wed Nov 29 23:29:20 +0000 2017,Who created bitcoin?  #ElonMusk #Bitcoin  @elonmusk,0
Wed Nov 29 23:29:11 +0000 2017,Bitcoin,0
Wed Nov 29 23:28:48 +0000 2017,RT @iFXRobotLondon: Cryptocurrency today is similar to the tech boom in 1994; REALLY interesting article via… https://t.co/WkDUJ3aMsk,1
Wed Nov 29 23:27:25 +0000 2017,Bitcoin fans were excited today when it hit a new high of $11K. And remember kids  every time Bitcoin goes up a dol… https://t.co/ic9vzPES6w,0
Wed Nov 29 23:25:34 +0000 2017,When bitcoin crashes  thousands of investors are going to jump out of basement windows,104
Wed Nov 29 23:25:33 +0000 2017,Since I’ve tweeted this you would have doubled your money.   I️ told y’all about bitcoin   Now I️m telling you abou… https://t.co/lXpjkvtjpK,1
Wed Nov 29 23:25:18 +0000 2017,A spoiler for the future - Bitcoin https://t.co/6otR0P29mb by @swardley (Nov 2013) https://t.co/zUj2SCvKuG,0
Wed Nov 29 23:25:07 +0000 2017,Bitcoin Price Tops $10 000 on Korean Exchanges https://t.co/qfxk5f36Nz https://t.co/VU5esSBbDG,0
Wed Nov 29 23:22:05 +0000 2017,If the price drops too fast  enough people can get liquidated that all the bitcoin being automatically sold pushes… https://t.co/33U4hh2eSQ,20
Wed Nov 29 23:22:03 +0000 2017,Some exchanges allow you to borrow money to buy more bitcoin than you can afford. If the price drops enough  the sy… https://t.co/X8JSLtiD7z,23
Wed Nov 29 23:21:23 +0000 2017,Join our Pre-Ico and get extra coins!  #titanium #ico #sale #CyberMonday #bitcoin #Ethereum #blockchain #fintech… https://t.co/hyjoAIrfBe,2
Wed Nov 29 23:20:35 +0000 2017,#COINBASE LOSES BID TO BLOCK #IRS PROBE OF #BITCOIN GAINS https://t.co/b60RmpWsMy,16
Wed Nov 29 23:20:09 +0000 2017,#Bitcoin: Upcoming Hard Forks: - Dec 15th: Super Bitcoin (498888 block) - Dec 23-24: Bitcoin Platinum (500000 block… https://t.co/tribQ24BR5,16
Wed Nov 29 23:17:15 +0000 2017,Excited 2 announce #comedian @theovon joined our cast as 1 of the leads @BitCointhefilm ! 🎬#hollywood #bitcoin… https://t.co/AUFFZ9A4Z7,1
Wed Nov 29 23:17:11 +0000 2017,Just bought $500 in bitcoin. #Bitcoin #CleanSheets #teamvieww,0
