Tue Dec 25 23:43:27 +0000 2018,$NYXBT  $GBTC $BTCUSD #Crypto Bitcoin 2 Years https://t.co/8dorNQ634h,1
Tue Dec 25 23:37:55 +0000 2018,@DougPolkPoker Doug is a capitalist.  Just like most people in crypto.  Front running and exiting once the profits… https://t.co/FtQ7mulR3Z,0
Tue Dec 25 23:28:32 +0000 2018,The Bitcoin Private team has officially confirmed that findings regarding the secret premining of an additional 2 m… https://t.co/SVPMfA1C0H,0
Tue Dec 25 23:04:31 +0000 2018,So much talk of #Bitcoin in Japan here. 🇯🇵  It’s far from dead.,2
Tue Dec 25 22:56:00 +0000 2018,We'd like to wish you all a #MerryChristmas from everyone here at OpenNode. Remember to give back to your loved one… https://t.co/LLEBCAFndb,3
Tue Dec 25 22:53:31 +0000 2018,Deal with XM trading leverage of 888!! ︎ and finally bitcoin transactions now can!! ︎ account is here https://t.co/AkfPx8jkbi ….,0
Tue Dec 25 22:47:39 +0000 2018,@APompliano @SquawkCNBC Additionally  no one knows how the internet works but they know what it enables.  Not knowi… https://t.co/aECBNmZbvr,0
Tue Dec 25 22:38:57 +0000 2018,@lukemburgess @AriDavidPaul Probably because bitcoin  rather than gold  was the gateway for their understanding of… https://t.co/dXyrF3YzUW,0
Tue Dec 25 22:32:33 +0000 2018,Two years ago I put together a year-end crypto-holiday spectacular w/ over 25 very special guests! @TuurDemeester… https://t.co/bZsGAYq4uC,9
Tue Dec 25 22:17:01 +0000 2018,Two years ago I put together a year-end crypto-holiday spectacular w/ over 25 very special guests! @TuurDemeester… https://t.co/bZsGAYq4uC,9
Tue Dec 25 22:12:19 +0000 2018,Two years ago I put together a year-end crypto-holiday spectacular w/ over 25 very special guests! @TuurDemeester… https://t.co/bZsGAYq4uC,9
Tue Dec 25 22:07:46 +0000 2018,Two years ago I put together a year-end crypto-holiday spectacular w/ over 25 very special guests! @TuurDemeester… https://t.co/bZsGAYq4uC,9
Tue Dec 25 22:07:46 +0000 2018,Bitcoin Private Denies Fraud Allegations and Calls for Halt to BTCP Trading https://t.co/Nh87ZZp6Ql,0
Tue Dec 25 22:07:26 +0000 2018,Two years ago I put together a year-end crypto-holiday spectacular w/ over 25 very special guests! @TuurDemeester… https://t.co/bZsGAYq4uC,9
Tue Dec 25 22:04:35 +0000 2018,Two years ago I put together a year-end crypto-holiday spectacular w/ over 25 very special guests! @TuurDemeester… https://t.co/bZsGAYq4uC,9
Tue Dec 25 22:01:03 +0000 2018,Is Bitcoin close to a bottom? Some experts say yes! https://t.co/m365VB2coP #bitcoin #gemstra #gms #token #crypto,1
Tue Dec 25 21:57:55 +0000 2018,Is Bitcoin close to a bottom? Some experts say yes! https://t.co/m365VB2coP #bitcoin #gemstra #gms #token #crypto,1
Tue Dec 25 21:57:00 +0000 2018,Two years ago I put together a year-end crypto-holiday spectacular w/ over 25 very special guests! @TuurDemeester… https://t.co/bZsGAYq4uC,9
Tue Dec 25 21:51:24 +0000 2018,Why criminals can't hide behind Bitcoin https://t.co/BY9c6G0u8v,0
Tue Dec 25 21:41:39 +0000 2018,@APompliano *and Bitcoin lost 78%,0
Tue Dec 25 21:39:18 +0000 2018,@michaelmalice What the media hasn’t told you is that bitcoin is soy  all the blockchain bitcoinyos are soy.  I don… https://t.co/78fUssPAAp,0
Tue Dec 25 21:24:01 +0000 2018,What is Bitcoin? by Mike Cernovich Podcast via #soundcloud https://t.co/b9Xtht1mQf,0
Tue Dec 25 21:23:02 +0000 2018,Why bet on #LoL with #bitcoin? https://t.co/3UCpdjvqLl https://t.co/DrALQDUTIE,0
Tue Dec 25 21:22:49 +0000 2018,Is #Cardano (ADA) the new #bitcoin in #2019? https://t.co/ASJnMnh03S #crypto #cryptocurrency #blockchain #achainofblocks #ada #btc,0
Tue Dec 25 21:22:07 +0000 2018,@Cernovich true freedom is with bitcoin,0
Tue Dec 25 21:21:23 +0000 2018,Two years ago I put together a year-end crypto-holiday spectacular w/ over 25 very special guests! @TuurDemeester… https://t.co/bZsGAYq4uC,9
Tue Dec 25 21:17:02 +0000 2018,GMO Internet Exits Bitcoin Miner Production After Recording ‘Extraordinary Loss’ in Q4 https://t.co/8Hq7zg5dzr,0
Tue Dec 25 21:15:24 +0000 2018,CALL OF BITCOIN LMFAOOO BAN PLS https://t.co/SGu4eUPtS1,0
Tue Dec 25 21:11:11 +0000 2018,Merry Bitcoin Christmas from DCTV and https://t.co/RNxRP08NBq! [2018] https://t.co/y7sDA9bsz3 via @YouTube,0
Tue Dec 25 21:07:09 +0000 2018,Two years ago I put together a year-end crypto-holiday spectacular w/ over 25 very special guests! @TuurDemeester… https://t.co/bZsGAYq4uC,9
Tue Dec 25 21:02:28 +0000 2018,Do what the T-shirts say.  https://t.co/chAg8ICFSL  #bitcoin #cryptocurrency #BLOCKCHAIN #BTC https://t.co/AoZcnoGI60,2
Tue Dec 25 20:56:51 +0000 2018,Do what the T-shirts say.  https://t.co/chAg8ICFSL  #bitcoin #cryptocurrency #BLOCKCHAIN #BTC https://t.co/AoZcnoGI60,2
Tue Dec 25 20:45:22 +0000 2018,Everyone piles on after Donald Trump has unhinged "poor me" moment: https://t.co/GNp4cU8NC7,29
Tue Dec 25 20:40:51 +0000 2018,We'd like to wish you all a #MerryChristmas from everyone here at OpenNode. Remember to give back to your loved one… https://t.co/LLEBCAFndb,3
Tue Dec 25 20:38:11 +0000 2018,We'd like to wish you all a #MerryChristmas from everyone here at OpenNode. Remember to give back to your loved one… https://t.co/LLEBCAFndb,3
Tue Dec 25 20:34:59 +0000 2018,95 #Bitcoin and #Blockchain in this landscape of #Startups &gt;&gt;&gt; @CBinsights via @MikeQuindazzi &gt;&gt;&gt; #Infographics… https://t.co/rpgx9faV1m,35
Tue Dec 25 20:34:30 +0000 2018,95 #Bitcoin and #Blockchain in this landscape of #Startups &gt;&gt;&gt; @CBinsights via @MikeQuindazzi &gt;&gt;&gt; #Infographics… https://t.co/rpgx9faV1m,35
Tue Dec 25 20:00:24 +0000 2018,A very bitcoin Xmas https://t.co/nqzncGQmLz,0
Tue Dec 25 19:47:36 +0000 2018,4 or more to consider #Blockchain a potential solution &gt;&gt;&gt; @MikeQuindazzi &gt;&gt;&gt; #SmartContracts #cryptocurrency… https://t.co/Y5e7JDmgbt,30
Tue Dec 25 19:46:30 +0000 2018,4 or more to consider #Blockchain a potential solution &gt;&gt;&gt; @MikeQuindazzi &gt;&gt;&gt; #SmartContracts #cryptocurrency… https://t.co/Y5e7JDmgbt,30
Tue Dec 25 19:46:09 +0000 2018,What if Bitcoin was a Scam and Most Cryptocurrencies Were Worth Zero? by @Mike_K_Spencer https://t.co/QyLh7LWpks,4
Tue Dec 25 19:43:34 +0000 2018,carbon-fiber Porsche 😵 https://t.co/xM3Bp8voHt,84
Tue Dec 25 19:40:35 +0000 2018,4 or more to consider #Blockchain a potential solution &gt;&gt;&gt; @MikeQuindazzi &gt;&gt;&gt; #SmartContracts #cryptocurrency… https://t.co/Y5e7JDmgbt,30
Tue Dec 25 19:40:35 +0000 2018,Sell your things for #Bitcoin and #Ethereum with the ReceiptChain app. Download ReceiptChain from Android or Apple… https://t.co/SyFLQH2K3M,125
Tue Dec 25 19:25:02 +0000 2018,What if Bitcoin was a Scam and Most Cryptocurrencies Were Worth Zero? by @Mike_K_Spencer https://t.co/QyLh7LWpks,4
Tue Dec 25 19:20:10 +0000 2018,@MustStopMurad @jcho710 @Hanakookie1 @Po89834881 @njsareen @blastoffh @PeterLBrandt @LucidInvestment I doubt you'd… https://t.co/2QrZfcseDo,0
Tue Dec 25 19:12:15 +0000 2018,Do what the T-shirts say.  https://t.co/chAg8ICFSL  #bitcoin #cryptocurrency #BLOCKCHAIN #BTC https://t.co/AoZcnoGI60,2
Tue Dec 25 19:06:40 +0000 2018,Free your money! #bitcoin https://t.co/QxvTlJLj5N,3
Tue Dec 25 19:03:04 +0000 2018,#hacker #HACKING #uruguay #justice #law #lawenforcement #interpol #computerforensics #bitcoin #cybersecurity… https://t.co/HDoWVgvpA8,3
Tue Dec 25 19:02:57 +0000 2018,Free your money! #bitcoin https://t.co/QxvTlJLj5N,3
Tue Dec 25 18:46:51 +0000 2018,https://t.co/BHhTf3rVFh,0
Tue Dec 25 18:37:42 +0000 2018,Cash  Credit  or Bitcoin? Inside the Luxury Market’s Shift to Cryptocurrency https://t.co/HiiPLgHDH1 https://t.co/tW9V8cXEzw,3
Tue Dec 25 18:26:11 +0000 2018,Layoffs Underway Amid 'Adjustments ' Bitcoin Miner Bitmain Confirms - CoinDesk https://t.co/gqLqokQN6a,0
Tue Dec 25 18:26:06 +0000 2018,Bitcoin Price Falls Below $4 000 Again: Is Another Big Drop in Store? https://t.co/CTn4C2lIzA,0
Tue Dec 25 18:24:59 +0000 2018,Bitcoin Cash Price Loses 20% as Bitmain Lays off Entire Team - NullTX https://t.co/feoP7Pby17,0
Tue Dec 25 18:23:36 +0000 2018,4 or more to consider #Blockchain a potential solution &gt;&gt;&gt; @MikeQuindazzi &gt;&gt;&gt; #SmartContracts #cryptocurrency… https://t.co/Y5e7JDmgbt,30
Tue Dec 25 18:22:28 +0000 2018,What if Bitcoin was a Scam and Most Cryptocurrencies Were Worth Zero? by @Mike_K_Spencer https://t.co/QyLh7LWpks,4
Tue Dec 25 18:21:35 +0000 2018,95 #Bitcoin and #Blockchain in this landscape of #Startups &gt;&gt;&gt; @CBinsights via @MikeQuindazzi &gt;&gt;&gt; #Infographics… https://t.co/rpgx9faV1m,35
Tue Dec 25 18:18:00 +0000 2018,EOS and Ethereum still top China's blockchain ranking EOS再次奪魁中國34個區塊鏈項目排名榜 https://t.co/NcPSAceOpP  #EOS #ethereum… https://t.co/qQarM0PgvD,1
Tue Dec 25 18:15:14 +0000 2018,See China's new cryptocurrency ratings: Who holds the top spot? https://t.co/dVCUkir4Cj #bitcoin #gemstra #gms #crypto,8
Tue Dec 25 18:10:52 +0000 2018,So much talk of #Bitcoin in Japan here. 🇯🇵  It’s far from dead.,2
Tue Dec 25 18:08:09 +0000 2018,Bitcoin Cash [BCH]  EOS  and Bitcoin SV [BSV] emerge as the top losers of the wounded market https://t.co/G9rgYgS16C,0
Tue Dec 25 17:44:50 +0000 2018,So much talk of #Bitcoin in Japan here. 🇯🇵  It’s far from dead.,2
Tue Dec 25 17:44:11 +0000 2018,Trump might be setting up a huge bitcoin rally. This is what it was made for... just saying. #crypto is NOT dead.… https://t.co/QtOVUhWxAI,62
Tue Dec 25 17:43:43 +0000 2018,Bitmain: Bitcoin Mining Giant to Sack 50% of Its Workforce https://t.co/R8AYff2oS7,0
Tue Dec 25 17:40:09 +0000 2018,95 #Bitcoin and #Blockchain in this landscape of #Startups &gt;&gt;&gt; @CBinsights via @MikeQuindazzi &gt;&gt;&gt; #Infographics… https://t.co/rpgx9faV1m,35
Tue Dec 25 17:37:57 +0000 2018,i havent written here in a while. so um while we're tweeting lets just state the obvious. if you bought bitcoin 10… https://t.co/KdFbaLwTOF,0
Tue Dec 25 17:30:30 +0000 2018,I remember so clearly this time 1 year ago in #crypto.  Everyone was asking me how to buy #Bitcoin.  We celebrated… https://t.co/f8WJbt1SUO,5
Tue Dec 25 17:29:16 +0000 2018,See China's new cryptocurrency ratings: Who holds the top spot? https://t.co/dVCUkir4Cj #bitcoin #gemstra #gms #crypto,8
Tue Dec 25 17:25:33 +0000 2018,Not bad #growth for a year long bear market....#bullish  . #crypto #Bitcoin https://t.co/7f1zb31dsd,0
Tue Dec 25 17:24:27 +0000 2018,What if Bitcoin was a Scam and Most Cryptocurrencies Were Worth Zero? by @Mike_K_Spencer https://t.co/QyLh7LWpks,4
Tue Dec 25 17:22:47 +0000 2018,#Automation wisdom from #BillGates  #syndicateconsultingagency #fintech #business #blockchain #bitcoin #bigdata… https://t.co/cIWOqFxV1D,1
Tue Dec 25 17:00:46 +0000 2018,#Automation wisdom from #BillGates  #syndicateconsultingagency #fintech #business #blockchain #bitcoin #bigdata… https://t.co/cIWOqFxV1D,1
Tue Dec 25 16:54:43 +0000 2018,Remembering that time I had a beer with Santa.  I asked for a $10k Bitcoin but it looks like I was going n the naug… https://t.co/iUV8g7inxb,0
Tue Dec 25 16:20:00 +0000 2018,New spreads: Bitcoin SV (BSV) 5.14% @BitcoinSVNode https://t.co/3yZnUN3YvG,0
Tue Dec 25 16:18:35 +0000 2018,Bitcoin Equipment Maker Ebang Re-Applies for Hong Kong Listing https://t.co/Vw95sNN0Rz,0
Tue Dec 25 16:09:41 +0000 2018,Coinbase – Buy &amp; Sell Bitcoin  Ethereum  and more with trust https://t.co/TuGK0m7xLE,0
Tue Dec 25 16:08:24 +0000 2018,Bitcoin Price Today USD Live: How much is Bitcoin worth? Latest Price Chart Analysis and Bitcoin Price Prediction 2… https://t.co/TMB7VfeMVY,0
Tue Dec 25 16:04:47 +0000 2018,See China's new cryptocurrency ratings: Who holds the top spot? https://t.co/dVCUkir4Cj #bitcoin #gemstra #gms #crypto,8
Tue Dec 25 15:55:30 +0000 2018,Merry Christmas to all bitcoin miner and forex traders all over the world .....   #forextrader #isengisengthailook… https://t.co/YuqHFbvd88,1
Tue Dec 25 15:53:31 +0000 2018,Bitcoin transactions recommend! Leverage of 500 simplefx https://t.co/nRD2qiule8 … #FX # International FX,0
Tue Dec 25 15:52:10 +0000 2018,Take me shopping  https://t.co/CTSkSiqILX #findom #paypig #bitcoin #dating,1
Tue Dec 25 15:50:58 +0000 2018,Take me shopping  https://t.co/CTSkSiqILX #findom #paypig #bitcoin #dating,1
Tue Dec 25 15:36:46 +0000 2018,Buy me lingerie and get special access to pictures https://t.co/eVJo1RYjHY #findom #paypig #bitcoin #dating,0
Tue Dec 25 15:36:08 +0000 2018,Seems like the perfect time for Jordan Peterson to learn about our saviour  Satoshi Nakamoto.  https://t.co/Y3G5BgNg86  via @GoogleNews,0
Tue Dec 25 15:25:47 +0000 2018,. . . . . #Crypto #cryptocurrency #HODL #holidays #christmas2018 #christmas #family #btc #bitcoin #bch #xrp #eth… https://t.co/YezkcoeOkS,0
Tue Dec 25 15:25:00 +0000 2018,New spreads: Ethereum (ETH) 6.40% @ethereum  Bitcoin (BTC) 6.32%  Ethereum Classic (ETC) 6.18% @eth_classic https://t.co/3yZnUN3YvG,1
Tue Dec 25 15:21:59 +0000 2018,4 or more to consider #Blockchain a potential solution &gt;&gt;&gt; @MikeQuindazzi &gt;&gt;&gt; #SmartContracts #cryptocurrency… https://t.co/Y5e7JDmgbt,30
Tue Dec 25 14:50:45 +0000 2018,President Trump 'Setting Up a Huge Bitcoin Rally'  Plus Ripple and XRP  Tron  Ethereum  Litecoin  Nano: Crypto News… https://t.co/jKm6Lr0jmK,2
Tue Dec 25 14:50:28 +0000 2018,Trump might be setting up a huge bitcoin rally. This is what it was made for... just saying. #crypto is NOT dead.… https://t.co/QtOVUhWxAI,62
Tue Dec 25 14:49:47 +0000 2018,President Trump 'Setting Up a Huge Bitcoin Rally'  Plus Ripple and XRP  Tron  Ethereum  Litecoin  Nano: Crypto News… https://t.co/jKm6Lr0jmK,2
Tue Dec 25 14:48:30 +0000 2018,Bitcoin  XRP  Ethereum swing trading bear market. Paris update. XRP Ripple  BTC  ETH.: https://t.co/EvWKKSuom6 via @YouTube,0
