Fri Jun 29 18:03:56 +0000 2018,Transparency can help deter corruption  promote competition &amp; build trust in government contracting. But can we bri… https://t.co/cJQFPDFj3m,18
Fri Jun 29 17:34:00 +0000 2018,How Your Smart Fridge Might Be Mining Bitcoin For Criminals https://t.co/BGhxLrZVDf,0
Fri Jun 29 15:30:36 +0000 2018,I listened to this album so much in the early years of high school. Day 2 of listening to it this week. https://t.co/O7CHYivvGZ,0
Fri Jun 29 14:57:09 +0000 2018,Help Save The Planet With KWATT Tokenized Electricity.  4NEW is the World's first company to use waste to create en… https://t.co/afmntYQ839,0
Fri Jun 29 08:47:19 +0000 2018,Transparency can help deter corruption  promote competition &amp; build trust in government contracting. But can we bri… https://t.co/cJQFPDFj3m,18
Fri Jun 29 06:03:12 +0000 2018,@dontpanicbjtj @dps1879 @AtyHans @I_mNotAComedian @enochsearth @WayGukIn @southard_craig @jelew311 @harryhamilton99… https://t.co/L1bnhhSIEQ,0
Fri Jun 29 00:29:46 +0000 2018,@altenburg1969 It was certainly a CHALLENGE not to be turned into a KRAITer. I was just MINING my own business ᕕ( ಠ… https://t.co/31T5BOqau9,0
