Sat May 26 21:07:25 +0000 2018,Posted: An Introduction to Smart Contracts and Their Potential and Inherent Limitations  https://t.co/aGKWwPBd7Z by… https://t.co/iEWMUVWf5B,4
Sat May 26 20:06:19 +0000 2018,Posted: An Introduction to Smart Contracts and Their Potential and Inherent Limitations  https://t.co/aGKWwPBd7Z by… https://t.co/iEWMUVWf5B,4
Sat May 26 16:33:47 +0000 2018,Red Pill is a protected digital currency that makes sending and getting installments simple  sheltered and fun. #ico #redpillcoin #rpil #eth,0
Sat May 26 15:42:37 +0000 2018,$SHMP BOUNCED LIKE A BEAST OFF .02 52WKL! A lot of💸can B made here won't B UNKNOWN 4 LONG🔭 #Blockchain #btc #LTC… https://t.co/2DsIHNh7CH,0
Sat May 26 14:03:35 +0000 2018,Posted: An Introduction to Smart Contracts and Their Potential and Inherent Limitations  https://t.co/aGKWwPBd7Z by… https://t.co/iEWMUVWf5B,4
Sat May 26 13:58:30 +0000 2018,Posted: An Introduction to Smart Contracts and Their Potential and Inherent Limitations  https://t.co/aGKWwPBd7Z by… https://t.co/iEWMUVWf5B,4
Sat May 26 13:44:18 +0000 2018,Posted: An Introduction to Smart Contracts and Their Potential and Inherent Limitations  https://t.co/aGKWwPBd7Z by… https://t.co/iEWMUVWf5B,4
Sat May 26 09:10:20 +0000 2018,What do we believe is the lowest #BTC will drop to before rebounding?  FOLLOW me on #TWITCH @… https://t.co/dYJuhIrDog,4
Sat May 26 06:13:36 +0000 2018,$ETH $ETC Ethereum Classic (ETC) Technical Analysis - Bear Flag Developing https://t.co/XUOWFho4AK,3
Sat May 26 03:26:00 +0000 2018,Japan’s SBI to start an exchange for major cryptocurrencies like Bitcoin [BTC]  Ethereum [ETH]  Ripple [XRP] and BCH https://t.co/6xE7Rbrfpx,0
Sat May 26 03:25:47 +0000 2018,TUNE Token is ready to bring blockchain to the music industry. Don't miss out on our first token Airdrop!… https://t.co/ny6PzRf9BV,1751
Sat May 26 02:23:43 +0000 2018,The Sia Weekly Update! https://t.co/FTjoJHGZik https://t.co/lgllwyvvbi,42
