Thu May 17 20:15:58 +0000 2018,Meet #Akari_Pay: The #BCH-Powered Website Payment Platform https://t.co/ssJVgrB1yM https://t.co/6d8KQxaza8,0
Thu May 17 20:00:01 +0000 2018,@KellyinBoulder Thanks for the follow  Kelly. It's great to connect with you!,0
Thu May 17 18:30:00 +0000 2018,Where are you making changes in the upcoming year? #hrchat #hrhappyhour #hrtailgate https://t.co/QUJdNUa7WM,0
Thu May 17 17:00:01 +0000 2018,@HRJazzy Thanks for the follow  Jazmine! It's great to connect with you.,0
Thu May 17 16:30:00 +0000 2018,@HealthITAdvice Thanks for the follow; it's great to connect with you!,0
Thu May 17 15:30:01 +0000 2018,The number of uninsured Americans (especially in Texas) is on the rise. More from @jenny_deam and @HoustonChron:… https://t.co/BQSzgSILUo,0
Thu May 17 13:45:00 +0000 2018,Many of our events qualify for both @SHRM and @HRCertInstitute continuing education. Here's what we have coming up… https://t.co/qb472acO34,0
Thu May 17 03:50:53 +0000 2018,#Bitcoin_Cash Price Watch – BCH/USD Dips Below $1 300 Amid Crypto Selloff https://t.co/4rwvYjWzMI https://t.co/mVG36lU8g6,0
Thu May 17 00:46:55 +0000 2018,#Bitcoin_Cash_News: Roger Ver Still Bullish; Network Updates; BCH Down https://t.co/yVdIcKxhw2 https://t.co/Kl2xHPR4tI,0
