Fri Jun 01 19:15:00 +0000 2018,There are implications when you address obesity as a disease alongside conditions like heart disease  hypertension… https://t.co/dvgQq2Gh70,0
Fri Jun 01 18:00:00 +0000 2018,There's still time to register for our event on June 12 that will discuss better management of these conditions. De… https://t.co/PovyS4ksQD,0
Fri Jun 01 16:45:00 +0000 2018,Interesting look at the value of #mentalhealth as part of #wellbeing programming. https://t.co/ztRfCfWqag,0
Fri Jun 01 14:00:02 +0000 2018,#Wellbeing is trending... What areas should you be keeping in mind? https://t.co/EpHhzkpOfD #wellbeingatwork #hrchat #nextchat,0
Fri Jun 01 06:52:21 +0000 2018,The Federal Reserve Places Bitcoin Cash at $1800– That’s Where We Fix Our Buy Targets: Bitcoin Cash (BCH) Price… https://t.co/vyRxoCHieA,1
Fri Jun 01 06:39:07 +0000 2018,The Federal Reserve Places Bitcoin Cash at $1800– That’s Where We Fix Our Buy Targets: Bitcoin Cash (BCH) Price… https://t.co/vyRxoCHieA,1
