Sat Feb 10 23:16:41 +0000 2018,Stellar (XLM) -The Best Altcoin Of 2018 | #bitcoin #cryptocurrency #business #stocks #blockchain https://t.co/rTLRGULjw4,13
Sat Feb 10 23:16:32 +0000 2018,Stellar (XLM) Expected To Rise: Here Is Why https://t.co/NnXq6tz7Sr via @Crypto Gazette,3
Sat Feb 10 23:13:56 +0000 2018,Purchase Stellar xlm lumens and Graphene stocks and you will become wealthy. IoT wireless will require crypto and graphene sensors.,2
Sat Feb 10 23:11:38 +0000 2018,Central Banks with IBM and Jed McCaleb will issue fiat cryptocurrency on the Stellar Network… https://t.co/gcBV7KVo0V,10
Sat Feb 10 23:09:06 +0000 2018,Here’s Why You’d Be Foolish To Ignore Stellar (XLM) https://t.co/DrAVNmVhrx,1
Sat Feb 10 22:50:54 +0000 2018,Bitcoin May Finally Have a Friend in Washington https://t.co/edp6t2J2gB,0
Sat Feb 10 22:19:51 +0000 2018,@BlackGirlNerds Ooh  I'll be reading this after I watch the film. Gugu is a STELLAR actress and seeing her in all t… https://t.co/aeeFfZrbwO,0
Sat Feb 10 22:11:28 +0000 2018,Stellar (XLM) Expected To Rise: Here Is Why https://t.co/NnXq6tz7Sr via @Crypto Gazette,3
Sat Feb 10 22:05:26 +0000 2018,Stellar (XLM) -The Best Altcoin Of 2018 | #bitcoin #cryptocurrency #business #stocks #blockchain https://t.co/rTLRGULjw4,13
Sat Feb 10 22:01:24 +0000 2018,Stellar (XLM) Expected To Rise: Here Is Why https://t.co/NnXq6tz7Sr via @Crypto Gazette,3
Sat Feb 10 21:28:08 +0000 2018,Stellar (XLM) -The Best Altcoin Of 2018 | #bitcoin #cryptocurrency #business #stocks #blockchain https://t.co/rTLRGULjw4,13
Sat Feb 10 21:24:26 +0000 2018,Stellar (XLM) -The Best Altcoin Of 2018 | #bitcoin #cryptocurrency #business #stocks #blockchain https://t.co/rTLRGULjw4,13
Sat Feb 10 21:16:59 +0000 2018,Stellar (XLM) -The Best Altcoin Of 2018 | #bitcoin #cryptocurrency #business #stocks #blockchain https://t.co/rTLRGULjw4,13
Sat Feb 10 21:12:17 +0000 2018,Stellar (XLM) -The Best Altcoin Of 2018 | #bitcoin #cryptocurrency #business #stocks #blockchain https://t.co/rTLRGULjw4,13
Sat Feb 10 21:10:01 +0000 2018,Stellar (XLM) -The Best Altcoin Of 2018 | #bitcoin #cryptocurrency #business #stocks #blockchain https://t.co/rTLRGULjw4,13
Sat Feb 10 21:07:35 +0000 2018,US Senators believe that cryptocurrency markets could exceed $20 trillion by 2020  that's a 40 times gain in less t… https://t.co/t98WYWuUsJ,3
Sat Feb 10 21:02:44 +0000 2018,Stellar (XLM) -The Best Altcoin Of 2018 | #bitcoin #cryptocurrency #business #stocks #blockchain https://t.co/rTLRGULjw4,13
Sat Feb 10 20:26:55 +0000 2018,Jolted awake just now by this message screaming on my phone at 5:15 a.m. in #PyeongChang. Couldn’t read the Korean … https://t.co/9xdnI0R7Q1,5
Sat Feb 10 20:11:46 +0000 2018,Wilkinson...predicts major ICOs on Stellar in 2018  as well as  further development on other protocols. The chief s… https://t.co/H6fkx4lwCa,0
Sat Feb 10 20:08:52 +0000 2018,#business #cryptocurrency #bitcoin #nasdaq #usd #dollar #blockchain https://t.co/6JsKo6uGGu,2
Sat Feb 10 19:45:00 +0000 2018,Great to see another #quantumcomputing hardware effort funded  a trapped ion approach from a stellar team in Austria https://t.co/O3JKZgv0YT,2
Sat Feb 10 19:00:09 +0000 2018,Auntie Maxine has had a stellar year! Listen to what she says was her favorite moment! (It included our podcast! 👀👀… https://t.co/UBmy0i3hzc,0
Sat Feb 10 17:50:51 +0000 2018,Dennis Rodman would make a stellar White House chief of staff.,0
Sat Feb 10 16:22:20 +0000 2018,After his VP strongly condemned domestic violence and said there’s no tolerance for it  Trump doubles down on his d… https://t.co/aSyIFs78iG,1051
Sat Feb 10 13:50:41 +0000 2018,Cryptocurrency is ultimate investment at this point  guaranteed growth at staggering levels in 2018. Investors are… https://t.co/CxMh9h0Tbk,5
Sat Feb 10 09:35:05 +0000 2018,#StockMarket   Stellar performance in Q4: ACC posts 126% surge in profit  shares up 6.4% One of the best for Long T… https://t.co/8V3aubmUF9,0
Sat Feb 10 08:48:17 +0000 2018,Rand Paul tried to stop my STELLAR budget deal! But he FAILED! New budget makes the military STRONG. Everyone wins! (Except Rand) TOO BAD!,0
Sat Feb 10 07:19:59 +0000 2018,Central Banks with IBM and Jed McCaleb will issue fiat cryptocurrency on the Stellar Network… https://t.co/gcBV7KVo0V,10
Sat Feb 10 06:53:20 +0000 2018,If incarcerated menstruating women in Arizona bleed through the 12 pads (0 tampons) they're allotted each month and… https://t.co/Hg6NnbKqcv,17097
Sat Feb 10 05:21:46 +0000 2018,Full house  stellar show tonight for Jorge Drexler in DC! Love his sweet  magnetic voice and social conscience https://t.co/YDGkH5eZIv,0
Sat Feb 10 04:43:10 +0000 2018,.@kimsmithholmes has long had a profound impact on American policy—and we are thrilled he is continuing his stellar… https://t.co/eCavm6A0ak,12
Sat Feb 10 04:01:24 +0000 2018,Man  Korea put on a stellar opening ceremony! https://t.co/CK1I7CNZUo,0
Sat Feb 10 03:46:57 +0000 2018,@stellar_cs @tconnorscs Helll yeah stell,0
Sat Feb 10 02:53:21 +0000 2018,Cheers to each of these stellar athletes - all 242 who will play their hearts out! 🇺🇸 💙 🇺🇸 https://t.co/K4LVbqNbEN,0
Sat Feb 10 00:28:38 +0000 2018,It has been a stellar experience all around @Phelpsctc! Big thanks to you and the rest of the @canadameetings team!… https://t.co/duiiFbLi9q,0
Sat Feb 10 00:12:44 +0000 2018,@funrama Stellar!,0
