Sat Dec 15 20:31:05 +0000 2018,@roykesey @heraclesmigato @ValeriaLuiselli @lilianacolanzi @sschweblin @ulloadonoso @hayfestival The Days Gone By … https://t.co/eyd21qNFV8,0
Sat Dec 15 20:29:56 +0000 2018,NC State passes to itself (travel) then gets the ball hit off its leg ob (somehow retains possession) sets an illeg… https://t.co/bxHsThhkHX,0
Sat Dec 15 19:46:25 +0000 2018,@MikeWatersSYR “Stuns”? Upset okay  but not as if Cuse has been playing dominating  stellar basketball...,0
Sat Dec 15 19:42:58 +0000 2018,Let the memory live again. The time Ryan Zinke ordered a Park Police helicopter to fly him back to Washington in ti… https://t.co/ChopaU0AWG,24
Sat Dec 15 19:42:46 +0000 2018,A Carbon Tax won't fix climate change.  The marketplace won't take care of an issue that doesn't create massive pro… https://t.co/0K0eRn68vJ,54
Sat Dec 15 19:33:17 +0000 2018,@jkempcpa Good for you. And while you float righteously above the fray the rest of us deal with the real world choi… https://t.co/DLlcBBzXWw,0
Sat Dec 15 19:23:34 +0000 2018,I am genuinely worried about Kanye  but “on Donda” took me out lmaoooooooooooo he serious serious,424
Sat Dec 15 18:41:18 +0000 2018,Holiday Sticker Special!🎄🦖🎊🌵🎊 Raptor and Bird pins come with a matching sticker! 1. both Avium pins get additional… https://t.co/qK9bY6fOoS,9
Sat Dec 15 17:09:56 +0000 2018,Follow @bjlefebvre and @nickjuliano and read this thread summing up their stellar reporting on Ryan Zinke https://t.co/mCGfnGkYEq,1
Sat Dec 15 17:03:38 +0000 2018,@stellar_ram Thank you for sharing!,0
Sat Dec 15 16:54:02 +0000 2018,Follow @bjlefebvre and @nickjuliano and read this thread summing up their stellar reporting on Ryan Zinke https://t.co/mCGfnGkYEq,1
Sat Dec 15 16:03:54 +0000 2018,@kylegriffin1 I just got up and was greeted with the news of Zinke's departure; it's gonna be a STELLAR day! My lat… https://t.co/goUimQJv01,0
Sat Dec 15 15:33:06 +0000 2018,Watching spirit of Christmas on @rosiecip stellar reviews and the intro is everything!!!,0
Sat Dec 15 13:56:19 +0000 2018,The holidays can create a lot of waste - wrapping paper  food  less-than-stellar office gift swap items. Here are s… https://t.co/NkLdKlbYrd,1
Sat Dec 15 12:00:55 +0000 2018,Zebronics Zeb Peace review: Stellar battery life․․․ https://t.co/J3vygy7O6n,0
Sat Dec 15 11:49:04 +0000 2018,Attention! We're hiring a communications associate for the stellar @NewAmericaEd team. Apply now and come join the… https://t.co/OiGxEEJqyj,16
Sat Dec 15 06:59:39 +0000 2018,@LouDobbs @Comey Comey is a stellar and also typical example of US group thinking. The so-called Freedom of Speach"… https://t.co/SMz4X4BeqE,0
Sat Dec 15 06:06:33 +0000 2018,Giuliani on Trump directing the hush-$ payments: “Whether they talked about it or not  their talking about it can’t… https://t.co/8FejDQkDsb,317
Sat Dec 15 04:44:41 +0000 2018,Joe is right. Head to https://t.co/SS87NTsgJt before tomorrow’s deadline. And nice bracelet  by the way. https://t.co/NFy3LxZe3f,31253
Sat Dec 15 04:27:00 +0000 2018,@JBSDC @ezraklein I don’t know how you can possibly draft a law to stand up to bad faith attacks. The point is that… https://t.co/teJh2WonqA,2
Sat Dec 15 04:21:34 +0000 2018,@JBSDC @ezraklein How is that?? We just had elections that were in large part a referendum on this law. It’s very p… https://t.co/zEWKQu9JTU,2
Sat Dec 15 04:06:36 +0000 2018,If this ruling stands  @GOP will be responsible for terminating protections for millions of Americans w/ pre-existi… https://t.co/Aa1TG8jB25,197
Sat Dec 15 03:45:54 +0000 2018,#AGU18 by the numbers: 5 days  1 press pass mangled 88 flights of stairs climbed 68 658 steps walked 14 669 words o… https://t.co/5R2usCFnIr,0
Sat Dec 15 03:35:46 +0000 2018,We had a stellar coalition during Operation Desert Shield and Operation Desert Storm.  @UKinUSA A 7th Armoured Brig… https://t.co/qwPSZGkZze,2
Sat Dec 15 03:34:20 +0000 2018,We had a stellar coalition during Operation Desert Shield and Operation Desert Storm.  @UKinUSA A 7th Armoured Brig… https://t.co/qwPSZGkZze,2
Sat Dec 15 03:33:31 +0000 2018,We had a stellar coalition during Operation Desert Shield and Operation Desert Storm.  @UKinUSA A 7th Armoured Brig… https://t.co/qwPSZGkZze,2
Sat Dec 15 03:16:39 +0000 2018,ACA is still the law of the land.  Open enrollment is still in effect. Sign up now at https://t.co/5LhXrLDQpR and… https://t.co/1kDQgvOcg8,160
Sat Dec 15 02:35:01 +0000 2018,Republicans  Don’t Fool Yourselves — Donald Trump Is in Serious Trouble https://t.co/pyyKJeq5SN,2957
Sat Dec 15 02:34:00 +0000 2018,The fact @SecNielsen blamed her parents for Jakelin’s death in her mothership Trump/Propaganda “news” interview wit… https://t.co/fkFtpjkXDt,227
Sat Dec 15 02:25:35 +0000 2018,We're hiring! Looking for a stellar Content Strategist to join the @HatchAppsHQ team. Any recos? #contentstrategy… https://t.co/fFMBaDaHs7,2
Sat Dec 15 02:23:38 +0000 2018,@realDonaldTrump Hey  great day America. Most of you no longer have healthcare. Another stellar day for the Trump admin.,0
Sat Dec 15 02:13:11 +0000 2018,We're hiring! Looking for a stellar Content Strategist to join the @HatchAppsHQ team. Any recos? #contentstrategy… https://t.co/fFMBaDaHs7,2
Sat Dec 15 02:09:21 +0000 2018,"It was Pelosi who did what the media has not done — interject  fact-check to his face and refuse to allow him to o… https://t.co/OhSsLXYjOn,1090
Sat Dec 15 02:02:32 +0000 2018,Attention! We're hiring a communications associate for the stellar @NewAmericaEd team. Apply now and come join the… https://t.co/OiGxEEJqyj,16
Sat Dec 15 02:00:52 +0000 2018,LRT that's the face shape I want for my Stellar suit!! It's great to see it in person and know it looks that cute,0
Sat Dec 15 01:37:23 +0000 2018,Stellar stuff here from the excellent @ProPublica @WNYC team https://t.co/XctN1KyfrD,1
Sat Dec 15 01:31:58 +0000 2018,Sad that the amazing @GravityView has changed.  Still a game-changing  can't-live-without-it tool but prices have g… https://t.co/e6dx8vjOtB,0
