Tue Sep 04 22:23:16 +0000 2018,Various #RealEstate #Investment Properties Available in the Philly Region. South Jersey - Poconos - Del. County  Ou… https://t.co/hs7mSUDoJk,0
Tue Sep 04 22:00:51 +0000 2018,Buying a rental property on the Outer Banks? Here's what insurance you will need https://t.co/xR4hJ4H9NF #obx,0
Tue Sep 04 21:56:31 +0000 2018,What are Chief Investment Strategist Jeff Saut's insights this week? Read his weekly commentary to find out: https://t.co/Mx0NugYwgp,0
Tue Sep 04 21:45:00 +0000 2018,Amazon Alexa brings Wall Street directly to your home with flash briefings from @MorganStanley Chief Investment Off… https://t.co/CvGKG9BuQm,0
Tue Sep 04 21:42:47 +0000 2018,Group Diversity May Constrain the Most Dangerous Investment Bias: Overconfidence - https://t.co/J07gCJQqEd by… https://t.co/oBKvOaoaFW,2
Tue Sep 04 21:33:30 +0000 2018,What are Chief Investment Strategist Jeff Saut's insights this week? Read his weekly commentary to find out: https://t.co/un19M9fcGs,0
Tue Sep 04 21:05:02 +0000 2018,.@skyuk is expanding its VC investing across Europe and Israel per Anthony Spadafora of @itproportal https://t.co/dos2xs59la,0
Tue Sep 04 20:23:13 +0000 2018,#RealEstate Investors #Recycle houses year round!  #Investment #RealEstate in #Philadelphia. Check it out. Properti… https://t.co/acGugcCKc7,0
Tue Sep 04 20:22:31 +0000 2018,Changes are required to advance water infrastructure. At all levels of government and in conjunction with the priva… https://t.co/7VrFIeQRjS,0
Tue Sep 04 20:07:22 +0000 2018,"People align with movements they can believe in  and it is the human  intellectual  and financial investment in ge… https://t.co/AJx13jtOW8,0
Tue Sep 04 20:00:52 +0000 2018,The biggest pro of turnkey real estate investing is cash flow - https://t.co/IF475mUC0L https://t.co/p2gt8czdfF,0
Tue Sep 04 19:52:10 +0000 2018,as Jill Stein said  'The Federal Reserve could absorb all student debt." I would love a march on Washington D.C.--b… https://t.co/iAWgtQuGKj,0
Tue Sep 04 19:48:06 +0000 2018,Despite Rising Interest Rates  Real Estate Offers Opportunity To Investors https://t.co/NawAgXjb87,0
Tue Sep 04 19:38:01 +0000 2018,Fresh off raising $2B of its own (led by @ToyotaMotorCorp)  Indonesian ride-sharing platform Grab is launching a $2… https://t.co/RWSW0tJKyl,0
Tue Sep 04 19:27:54 +0000 2018,Been seeing lots of these VC investment statements  and they are interesting reading... but they usually boil down… https://t.co/Tb4ZuUZx5F,2
Tue Sep 04 19:27:02 +0000 2018,Amazon Alexa brings Wall Street directly to your home with flash briefings from @MorganStanley Chief Investment Off… https://t.co/dQdgIgPG34,0
Tue Sep 04 19:15:13 +0000 2018,.@bitbox &amp; @LINE_Global investment in  $Link reaches $150 000 Million. The partnership gives the 200 million active… https://t.co/lMFRDprudh,1
Tue Sep 04 19:15:07 +0000 2018,.@bitbox &amp; @LINE_Global investment in  $Link reaches $150 000 Million. The partnership gives the 200 million active… https://t.co/lMFRDprudh,1
Tue Sep 04 18:52:07 +0000 2018,Despite Rising Interest Rates  Real Estate Offers Opportunity To Investors https://t.co/p9FbhDhJOm https://t.co/4y5iuKmORa,0
Tue Sep 04 18:20:20 +0000 2018,Good insights for #ptexp &amp; #adherence. Investment decisions should always be based on customer value. PERIOD.… https://t.co/weVWXZP1F9,1
Tue Sep 04 18:11:52 +0000 2018,Good insights for #ptexp &amp; #adherence. Investment decisions should always be based on customer value. PERIOD.… https://t.co/weVWXZP1F9,1
Tue Sep 04 17:59:48 +0000 2018,Ready to make some real estate investment income?  Ready to be a Landlord?  So consider: $11.7k of  annual  cash fl… https://t.co/PQPx4gzw2Q,0
Tue Sep 04 17:25:53 +0000 2018,Ready to make some real estate investment income?  Ready to be a Landlord?  So consider: $11.7k of  annual  cash fl… https://t.co/PPgzsNS8tb,0
Tue Sep 04 17:18:16 +0000 2018,Ready to make some real estate investment income?   Ready to be a Landlord?   So consider: $11.7k of  annual  cash… https://t.co/3MLvY4eCYN,0
Tue Sep 04 17:10:33 +0000 2018,@DarylUnlost I like the bakers and that's about it. The new hosts lack the heart  charm and investment of Sue and M… https://t.co/zcBTLYqxRL,0
Tue Sep 04 17:07:31 +0000 2018,Changes are required to advance water infrastructure. At all levels of government and in conjunction with the priva… https://t.co/7VrFIeQRjS,0
Tue Sep 04 16:53:04 +0000 2018,How abt not Corp sponsored gestures (been there)..but exposing the #NFL &amp; all sports entities on different levels … https://t.co/cCcSxs6zYl,0
Tue Sep 04 16:45:12 +0000 2018,The only investment you can guarantee a return on in this life is the investment you put into developing yourself. https://t.co/4DqloomGC3,0
Tue Sep 04 16:41:10 +0000 2018,Group Diversity May Constrain the Most Dangerous Investment Bias: Overconfidence - https://t.co/J07gCJQqEd by… https://t.co/oBKvOaoaFW,2
Tue Sep 04 16:23:59 +0000 2018,Yooooooo goooo buy stock rite now this will be the best investment you ever made💯💯💪🏾💯💪🏾💯,0
Tue Sep 04 16:23:18 +0000 2018,Missed Out on the #INVESTMENT PROPERTIES in ELKINS PARK? These Great Flip Opportunities ARE SOLD In This Desirable… https://t.co/f2Pcl5jqYY,0
Tue Sep 04 16:14:47 +0000 2018,Global investment firm sells Raleigh buildings for $56M; grosses $10M https://t.co/pEuLJNqxwc,0
Tue Sep 04 16:14:46 +0000 2018,Local investment company talks strengths of SA's multifamily market https://t.co/TG7GtEkIHf,0
Tue Sep 04 16:08:40 +0000 2018,$MNGA MagneGas to Present at the 20th Annual HC Wainwright Global Investment Conference TOMORROW September 5  2018… https://t.co/Vh5OXJu08l,1
Tue Sep 04 15:53:16 +0000 2018,New post: South Africa is India’s key trade  investment partner: PM Modi – ANI News https://t.co/EvB3VcWXyh,0
Tue Sep 04 15:38:04 +0000 2018,I Squared Raises $7 Billion for Infrastructure Investments https://t.co/7yDj9zwF3G,1
Tue Sep 04 15:33:24 +0000 2018,I Squared Raises $7 Billion for Infrastructure Investments https://t.co/vdrYJFJUHS https://t.co/5SWM58DsIo,0
Tue Sep 04 15:31:07 +0000 2018,Q: How to use analytics to determine #medicare campaign investment? A: Alejandro Machado latest post addresses the… https://t.co/dE0iM6fgAe,2
Tue Sep 04 15:29:59 +0000 2018,Group Diversity May Constrain the Most Dangerous Investment Bias: Overconfidence - https://t.co/J07gCJQqEd by… https://t.co/oBKvOaoaFW,2
Tue Sep 04 15:28:27 +0000 2018,Germantown's @AtticBrewing promises great beer  investor perks  and a 1.5x return on your investment. Click the lin… https://t.co/3UkYn1fmsr,0
Tue Sep 04 15:23:21 +0000 2018,#Investment #RealEstate in #Philadelphia. Check it out. Properties in #Philly - Suburbs  NJ Flips &amp; #Rental   Sign… https://t.co/HL4famYvnz,0
Tue Sep 04 15:07:28 +0000 2018,Q: How to use analytics to determine #medicare campaign investment? A: Alejandro Machado latest post addresses the… https://t.co/dE0iM6fgAe,2
Tue Sep 04 15:05:32 +0000 2018,Q: How to use analytics to determine #medicare campaign investment? A: Alejandro Machado latest post addresses the… https://t.co/dE0iM6fgAe,2
Tue Sep 04 15:05:03 +0000 2018,#JustListed: 🔑 Investment opportunities in one of the hottest zip codes in Philadelphia make us SQUEAL 🐖 w/ excitem… https://t.co/7kxAmYVX2Q,0
Tue Sep 04 12:32:47 +0000 2018,It is up to us to be clear about it’s investment in the system. We must be clear about the inaccessibility and this… https://t.co/EruBDYx4pA,5
Tue Sep 04 12:27:06 +0000 2018,Opportunities in Upper Manhattan Through the Eyes of Venture's New Head of Investment Sales https://t.co/6r12fwxbuV,0
Tue Sep 04 12:26:03 +0000 2018,“while there are important ways in which corporate governance can be improved  the idea that a myopic market forces… https://t.co/dCcmwMlhgh,0
Tue Sep 04 12:04:50 +0000 2018,New to the world of real estate investment? Here are 5 important calculations you need to know to succeed! . . . .… https://t.co/iuwVVtXY4o,0
Tue Sep 04 11:58:07 +0000 2018,Opportunities in Upper Manhattan Through the Eyes of Venture's New Head of Investment Sales https://t.co/qkQcFpLWWf,0
Tue Sep 04 10:52:03 +0000 2018,Good morning!! Working on these Bylaws for the family investment company  going over projects for the creative grou… https://t.co/LICB2ub6kP,0
Tue Sep 04 09:55:51 +0000 2018,I wonder what the future African continent will look like after a century of Chinese and Indian infrastructure inve… https://t.co/aG3GwgCGzY,0
Tue Sep 04 09:44:17 +0000 2018,Make money online with a good investment $1000  you can earn up to $11 250 in a week  looking for where to invest y… https://t.co/1UDUdJtD1J,0
Tue Sep 04 05:54:03 +0000 2018,It is up to us to be clear about it’s investment in the system. We must be clear about the inaccessibility and this… https://t.co/EruBDYx4pA,5
Tue Sep 04 05:42:45 +0000 2018,It is up to us to be clear about it’s investment in the system. We must be clear about the inaccessibility and this… https://t.co/EruBDYx4pA,5
Tue Sep 04 05:02:13 +0000 2018,Been seeing lots of these VC investment statements  and they are interesting reading... but they usually boil down… https://t.co/Tb4ZuUZx5F,2
Tue Sep 04 04:36:18 +0000 2018,Been seeing lots of these VC investment statements  and they are interesting reading... but they usually boil down… https://t.co/Tb4ZuUZx5F,2
Tue Sep 04 04:35:08 +0000 2018,@vixxtype Longer investment since the younger they are  the longer they can promote before enlistment. 😅,0
Tue Sep 04 03:05:13 +0000 2018,@volfixer After 30 years they own it. Do worth congrats. Purchase a house still the biggest investment in most people’s life.,0
Tue Sep 04 03:01:17 +0000 2018,Investment Analyst https://t.co/K23CxfF0tB,0
Tue Sep 04 02:09:28 +0000 2018,If I hear this woman say 20 bands one more time. 🤦🏾‍♀️ Ma  if that’s your life savings  you should’ve put that shit… https://t.co/LD2Hj5Qq9T,1
Tue Sep 04 02:01:13 +0000 2018,If I hear this woman say 20 bands one more time. 🤦🏾‍♀️ Ma  if that’s your life savings  you should’ve put that shit… https://t.co/LD2Hj5Qq9T,1
Tue Sep 04 00:30:44 +0000 2018,You say you always dreamed of having your own OBX beach house to enjoy with friends and family (and maybe earn some… https://t.co/qDgCbi4dnW,0
