Mon Mar 19 22:53:51 +0000 2018,@k2thedubs @mattaf30 Using your reasoning of the rest of the world  where does that happen with a multitude of investment-rich clubs?,0
Mon Mar 19 22:10:40 +0000 2018,#Investment #RealEstate in #Philadelphia &amp; the surrounding region. Properties go fast.  Check it out. Be the first… https://t.co/al9kfs9k4A,0
Mon Mar 19 21:36:11 +0000 2018,The return on investment for a deck addition is strong. #homesellingtips #realestate https://t.co/1llfJhr0mK,0
Mon Mar 19 21:25:40 +0000 2018,@mtsw i know for sure that these things will one day be safe than human drivers so each corpse is just investment in a safer future,0
Mon Mar 19 21:07:53 +0000 2018,Interesting - Ireland has just been used as an example of an effective investment of GDP compared to the US who spe… https://t.co/4tjQJRbWOH,2
Mon Mar 19 21:00:39 +0000 2018,Investment Sales Associate - Barzilay Development - Philadelphia  PA https://t.co/DVA9maO2RR Job Philadelphia,0
Mon Mar 19 20:24:09 +0000 2018,New post: SEYCHELLES / NATIONAL INVESTMENT FORUM / 29 MAY 2014 – 24” IPAD 2 https://t.co/CA2fYzc5FP,0
Mon Mar 19 20:19:09 +0000 2018,@yashar Investment banker to run the CIA? Only the best people....again.,0
Mon Mar 19 20:16:31 +0000 2018,Congratulations to our investment management practice group for being recognized as an Asset Management Group of th… https://t.co/9jPlT2kSZZ,1
Mon Mar 19 20:16:22 +0000 2018,Stradley is excited to welcome two new partners! David Grim  former #SEC Director of Investment Management and Sara… https://t.co/eYNZtWA3j6,1
Mon Mar 19 20:10:17 +0000 2018,Various #RealEstate #Investment Properties Available in the Philly Region. South Jersey - Poconos - Del. County  Ou… https://t.co/ICf7NLb0Gw,0
Mon Mar 19 19:52:49 +0000 2018,New York Life Investment Management CIO  Jae Yoon  believes 3% GDP growth  3% wage inflation and 10-year Treasury y… https://t.co/OyWXzCwPbY,0
Mon Mar 19 19:39:39 +0000 2018,“In Center City for office  it’s the best investment sales climate of any of our careers” - @jkranzel … https://t.co/1eZkgLntDK,3
Mon Mar 19 19:27:57 +0000 2018,Seeing more and more interest on the topic of AI in drug discovery. Shout out to @twoXAR on pulling in those SoftBa… https://t.co/o9owbojixN,4
Mon Mar 19 19:26:03 +0000 2018,“In Center City for office  it’s the best investment sales climate of any of our careers” - @jkranzel … https://t.co/1eZkgLntDK,3
Mon Mar 19 19:26:00 +0000 2018,“In Center City for office  it’s the best investment sales climate of any of our careers” - @jkranzel … https://t.co/1eZkgLntDK,3
Mon Mar 19 19:22:08 +0000 2018,“In Center City for office  it’s the best investment sales climate of any of our careers” - @jkranzel … https://t.co/1eZkgLntDK,3
Mon Mar 19 19:09:05 +0000 2018,Three Dayton-area hotels acquired by investment group for $13.7M https://t.co/vxnH6SP0tZ,0
Mon Mar 19 19:05:16 +0000 2018,#SEC proposes #amendments to its forms designed to improve the #reporting and #disclosure of liquidity information… https://t.co/mkBh5cz6wA,1
Mon Mar 19 19:03:04 +0000 2018,#SEC proposes #amendments to its forms designed to improve the #reporting and #disclosure of liquidity information… https://t.co/mkBh5cz6wA,1
Mon Mar 19 18:48:08 +0000 2018,#StudentHousing has always been a low-risk investment as well as a big part of #Philly real estate.... https://t.co/h07LhfaBRb,0
Mon Mar 19 18:48:00 +0000 2018,Financial planners advise investing at a risk level that you feel comfortable with  regardless of age. https://t.co/hSP32CqViZ,0
Mon Mar 19 18:41:23 +0000 2018,I’m a public school parent. There is no better investment than our children  than education. But  we must look at e… https://t.co/as2eLsaTg2,4
Mon Mar 19 18:35:30 +0000 2018,Stradley is excited to welcome two new partners! David Grim  former #SEC Director of Investment Management and Sara… https://t.co/eYNZtWA3j6,1
Mon Mar 19 18:00:32 +0000 2018,Register for our FREE webinar on 4/12. We will present the analysis required to determine the financial viability o… https://t.co/tansSU8i4C,0
Mon Mar 19 16:49:04 +0000 2018,What is  truly  the most valuable business school in San Francisco? https://t.co/QT42sTJ4wi #MVP #MBA #SF https://t.co/xROkuBM5vF,0
Mon Mar 19 16:33:12 +0000 2018,Should college education be free? @saragoldrickrab says "Yes  such an investment pays off in growth and innovation.… https://t.co/OBFZISNgDF,4
Mon Mar 19 16:15:58 +0000 2018,Agent Jane Bond wants you to know about how bonds help diversify a portfolio. https://t.co/RnX78CPXui,0
Mon Mar 19 16:10:36 +0000 2018,#Investment #RealEstate in #Philadelphia. Check it out. Properties in #Philly - Suburbs  NJ Flips &amp; #Rental   Sign… https://t.co/xoVEcJXwHO,0
Mon Mar 19 15:53:51 +0000 2018,#CHILE Low Growth: A Case of Disinvestment https://t.co/Eahj7dbnBN https://t.co/ImjfRQelBy,1
Mon Mar 19 15:46:02 +0000 2018,Blockchain Platform To Tokenize “Antiquated” Alternative Investments Sector - An established financial services fir… https://t.co/19VCBuZASI,0
Mon Mar 19 15:42:31 +0000 2018,#CHILE Low Growth: A Case of Disinvestment https://t.co/Eahj7dbnBN https://t.co/ImjfRQelBy,1
Mon Mar 19 15:37:44 +0000 2018,Seeing more and more interest on the topic of AI in drug discovery. Shout out to @twoXAR on pulling in those SoftBa… https://t.co/o9owbojixN,4
Mon Mar 19 15:35:56 +0000 2018,The single most greatest investment one can ever have is in self.,7
Mon Mar 19 15:30:29 +0000 2018,HashCash Partners with Investment Evolution Coin Ltd to Enable Global Remittances through HC NET based Blockchain n… https://t.co/BPP8f5sKHx,0
Mon Mar 19 15:28:11 +0000 2018,$IEGH IEG Holdings shareholders are expected to become shareholders of Investment Evolution Coin Ltd April 30  2018… https://t.co/n9pea2Nt30,0
Mon Mar 19 15:26:19 +0000 2018,The single most greatest investment one can ever have is in self.,7
Mon Mar 19 15:19:24 +0000 2018,Why would a multinational corporation conduct a vertical foreign direct investment? https://t.co/9bCe2Yw9Yc https://t.co/iaZPcBUOy3,0
Mon Mar 19 15:09:21 +0000 2018,The single most greatest investment one can ever have is in self.,7
Mon Mar 19 14:56:56 +0000 2018,Want to introduce some diversity in your investment pipeline? Here's one easy step: come to Philly. #PhillyPhilly… https://t.co/zBTSYlQ4WY,3
Mon Mar 19 14:55:36 +0000 2018,Seeing more and more interest on the topic of AI in drug discovery. Shout out to @twoXAR on pulling in those SoftBa… https://t.co/o9owbojixN,4
Mon Mar 19 14:45:34 +0000 2018,+/- 63 400 SF FLEX/WAREHOUSE BUILDING FOR SALE /LEASEBACK INVESTMENT OPPORTUNITY - BURLINGTON  NJ  #SouthJersey… https://t.co/pEfHpMOvgZ,0
Mon Mar 19 14:44:21 +0000 2018,Seeing more and more interest on the topic of AI in drug discovery. Shout out to @twoXAR on pulling in those SoftBa… https://t.co/o9owbojixN,4
Mon Mar 19 14:41:26 +0000 2018,Seeing more and more interest on the topic of AI in drug discovery. Shout out to @twoXAR on pulling in those SoftBa… https://t.co/o9owbojixN,4
Mon Mar 19 14:29:07 +0000 2018,The single most greatest investment one can ever have is in self.,7
Mon Mar 19 14:25:42 +0000 2018,RT SAP_Automotive: RT JimDavisSAPAero: Discover the steps leading cities are taking to ensure they can develop sust… https://t.co/L6fQIveBmU,1
Mon Mar 19 14:25:28 +0000 2018,RT SAP_Automotive: RT JimDavisSAPAero: Discover the steps leading cities are taking to ensure they can develop sust… https://t.co/L6fQIveBmU,1
Mon Mar 19 14:21:13 +0000 2018,The single most greatest investment one can ever have is in self.,7
Mon Mar 19 14:20:09 +0000 2018,The single most greatest investment one can ever have is in self.,7
Mon Mar 19 14:19:01 +0000 2018,China's massive investment in over 30 countries to its west (OBOR  or Road and Belt Initiative  RBI) since 2013 has… https://t.co/qGEyYy3hxj,0
Mon Mar 19 14:15:00 +0000 2018,The single most greatest investment one can ever have is in self.,7
Mon Mar 19 14:13:10 +0000 2018,Breaking Down the TSP Investment Funds https://t.co/MM2iPtyDBW https://t.co/Ggx83sR81l,0
Mon Mar 19 14:11:26 +0000 2018,Should college education be free? @saragoldrickrab says "Yes  such an investment pays off in growth and innovation.… https://t.co/OBFZISNgDF,4
Mon Mar 19 14:03:42 +0000 2018,Should college education be free? @saragoldrickrab says "Yes  such an investment pays off in growth and innovation.… https://t.co/OBFZISNgDF,4
Mon Mar 19 14:03:23 +0000 2018,Should college education be free? @saragoldrickrab says "Yes  such an investment pays off in growth and innovation.… https://t.co/OBFZISNgDF,4
Mon Mar 19 13:53:21 +0000 2018,@solarcollab Thanks for including ‘... the most notable indication towards changing demands is Shell’s increasing i… https://t.co/0H3jJdPV5x,0
Mon Mar 19 13:46:23 +0000 2018,Should college education be free? @saragoldrickrab says "Yes  such an investment pays off in growth and innovation.… https://t.co/OBFZISNgDF,4
Mon Mar 19 13:44:19 +0000 2018,We're saving our money in #2018!  Here's a way to help you start  #5 #money #challenge  #investment #bank… https://t.co/vhMb2IlmV5,1
Mon Mar 19 13:43:52 +0000 2018,@Nathan_w2017 Honestly man  I’d say yeah.  So long as you’re aware (and it sounds like you are) that it’s a higher… https://t.co/V7Im6YcaRA,0
Mon Mar 19 13:36:03 +0000 2018,Large food makers continue the trend of seeking innovation through external partnerships  with Kraft and Mars recen… https://t.co/E3b4BXnQI4,0
Mon Mar 19 13:16:22 +0000 2018,My clients are viewing planning time as in investment in overall productivity. #ADHD #ADHDtip,0
Mon Mar 19 13:10:23 +0000 2018,#Investment #RealEstate throughout the Phila/Delaware Valley area. Right now we have properties in Philly  Delaware… https://t.co/QXoSYBQ7IT,0
Mon Mar 19 13:00:55 +0000 2018,3 Things to Remember When Purchasing Your First Investment Property https://t.co/rt1V0aDnIR #realestate… https://t.co/ZkCQSD6T50,0
Mon Mar 19 12:36:45 +0000 2018,The single most greatest investment one can ever have is in self.,7
Mon Mar 19 12:15:49 +0000 2018,The Super Structure is Officially Down at 2031 Lombard Street– [Before &amp; After Pictures] https://t.co/KruNtdTmR6… https://t.co/tPQFOTt3oJ,1
Mon Mar 19 04:24:34 +0000 2018,As Lempres put it to members of Congress:  "If the U.S. does not provide a clear  thoughtful regulatory environment… https://t.co/AtUiGYvXp8,0
Mon Mar 19 01:57:00 +0000 2018,“How to Properly Identify Your Next Investment Opportunity” by TR Dougherty https://t.co/y6OMOZHyU3,1
Mon Mar 19 01:52:45 +0000 2018,Institutional Capital  New Development Driving MOB Investment https://t.co/r2UBXXbkkD,0
Mon Mar 19 00:29:41 +0000 2018,New post: Portugal looks toward Namibia for investment https://t.co/qx0Mw3k4Fz,0
Mon Mar 19 00:17:09 +0000 2018,RT @barbfriedberg The Best Investment to Keep Pace With Inflation  Guaranteed -Part 1 - Keep Pace With Inflation Wi… https://t.co/yQNqHGduRO,0
