Thu Oct 25 23:56:11 +0000 2018,#Saudi signs #deals worth $50 billion in #OilGasandInfrastructure https://t.co/KsjivmXBlB #ENTRAconsulting #oil… https://t.co/WnyjptzzpE,1
Thu Oct 25 23:41:15 +0000 2018,I voted.  I got a sticker.  Thus ends my emotional investment in the Great American Experiment.,0
Thu Oct 25 23:38:58 +0000 2018,@RyanLostinTX It’s an investment really,0
Thu Oct 25 23:31:13 +0000 2018,@PawnSpicer @GOP I guess you dont understand  Instead of raising the Fed deficit for policies that put more people… https://t.co/WvWcYlM7Rr,0
Thu Oct 25 23:11:52 +0000 2018,@BFreedInA2 @mbs213 By reducing regulations for one. Creating investment worthy environments in Texas.,0
Thu Oct 25 23:01:50 +0000 2018,Michael Jordan Makes First Esports Investment With Axiomatic https://t.co/IYFYDcSH86,0
Thu Oct 25 23:00:08 +0000 2018,Flex/Industrial Investment Requirement https://t.co/Br87CNZNOj https://t.co/CdjCnwzuUA,0
Thu Oct 25 22:01:18 +0000 2018,With more than nine years in a bull market  (source: S&amp;P 500® index) how can you help protect some of your investme… https://t.co/D7kRIR6SEQ,0
Thu Oct 25 20:52:19 +0000 2018,Part of me says I miss those days being able to say “I love you” to someone... then the other part of me says it’s… https://t.co/MOx2z1qdFR,0
Thu Oct 25 20:45:38 +0000 2018,Major cross-resources investment for Saudi Arabia @AccentureChem @AccentureMining @AccentureEnergy  https://t.co/UuhXedUVmQ,0
Thu Oct 25 20:41:50 +0000 2018,The Controller’s Office has been busy today!   Earlier this afternoon we hosted our Quarterly Investment Committee… https://t.co/9bTA7b65se,2
Thu Oct 25 20:23:45 +0000 2018,New legislation focuses on upping multimodal freight investment https://t.co/t5M4D1JXqi,0
Thu Oct 25 20:22:58 +0000 2018,Michael Jordan Leading $26 Million Investment in Esports Group aXiomatic Gaming - Bleacher Report https://t.co/aviCnicpf2,0
Thu Oct 25 20:08:40 +0000 2018,@mfi67 @zerohedge China stock market  housing market are dropping like rocks  money cannot get out (bitcoin is drop… https://t.co/jIwJSeug9z,0
Thu Oct 25 19:50:29 +0000 2018,While most people wait until after they’ve bought their first or second home to begin investing in real estate  you… https://t.co/fAYxtihyl3,0
Thu Oct 25 19:23:20 +0000 2018,@ChronOpinion Which law requires this? I'll wait.  "Paxton allegedly didn’t reveal he was being paid to solicit cli… https://t.co/7SGZDFomx6,0
Thu Oct 25 19:20:43 +0000 2018,CBRE's New Expert Secures Financing For Underserved Hotel Investment Market https://t.co/TvCMzenbBh,2
Thu Oct 25 19:20:38 +0000 2018,CBRE's New Expert Secures Financing For Underserved Hotel Investment Market https://t.co/TvCMzenbBh,2
Thu Oct 25 19:19:27 +0000 2018,CBRE's New Expert Secures Financing For Underserved Hotel Investment Market https://t.co/TvCMzenbBh,2
Thu Oct 25 19:13:29 +0000 2018,Will the current surge in global M&amp;A translate into an uptick in global real estate investment? @RichardJBarkham… https://t.co/qFMt0DEvpM,0
Thu Oct 25 19:00:49 +0000 2018,#Saudi signs #deals worth $50 billion in #OilGasandInfrastructure https://t.co/KsjivmXBlB #ENTRAconsulting #oil… https://t.co/WnyjptzzpE,1
Thu Oct 25 18:51:05 +0000 2018,CBRE's New Expert Secures Financing For Underserved Hotel Investment Market https://t.co/PHTbKh89no,0
Thu Oct 25 18:50:34 +0000 2018,CBRE's New Expert Secures Financing For Underserved Hotel Investment Market https://t.co/bu9AOcbMPs,0
Thu Oct 25 18:35:21 +0000 2018,success is so normalized at cornell that when i hear stuff like "im interning at facebook this summer" or "i have a… https://t.co/DhuI4YOF5n,1
Thu Oct 25 18:21:37 +0000 2018,It’s our money and their jobs at stake. Don’t let them lie about “investment”. https://t.co/J2LhffbK9t,0
Thu Oct 25 18:07:41 +0000 2018,Double up on my investment,0
Thu Oct 25 17:51:30 +0000 2018,Loaded with cash  majors struggle with investment options. Photo: BP. #oilandgas #investment  Read more:… https://t.co/4ra9zChUZl,5
Thu Oct 25 17:39:19 +0000 2018,This tide to go pen is easily the best investment I’ve made in the past 12 months.,0
Thu Oct 25 17:14:06 +0000 2018,success is so normalized at cornell that when i hear stuff like "im interning at facebook this summer" or "i have a… https://t.co/DhuI4YOF5n,1
Thu Oct 25 17:02:12 +0000 2018,@SilentWitIt_1 Self investment he not broke just sustaining,0
Thu Oct 25 16:57:08 +0000 2018,Servando Vasquez REALTOR at The Parodi Team gets another executed contract for his client HNR Investment Group. Gre… https://t.co/mUDjLzY00H,0
Thu Oct 25 16:47:47 +0000 2018,@alecia_valdez #stuco @KleinISD @cadproctor  Thank you Mrs. Valdez for your leadership and investment in our Stuco! https://t.co/c1YqwtO3KU,0
Thu Oct 25 16:32:09 +0000 2018,Congrats HNR investment group on your new home purchase executed a contract. Great job Servando Vasquez REALTOR at… https://t.co/IEu47I7slF,0
Thu Oct 25 15:57:16 +0000 2018,@ForeverHouston @DonaldJTrumpJr @kimguilfoyle @GregForMontana @MattForMontana @realDonaldTrump Freddie Mac and Fann… https://t.co/8kIn0yS37g,3
Thu Oct 25 15:55:00 +0000 2018,We appreciate the coverage from @BisnowHouston on recent Westchase District acquisitions. Our market is strong and… https://t.co/C7bf98dB92,0
Thu Oct 25 15:41:20 +0000 2018,San Francisco tech firm to hire hundreds in Nashville with $3.6M investment https://t.co/P2pQOSRSTa via @nashvillebiz,0
Thu Oct 25 15:36:58 +0000 2018,Loaded with cash  majors struggle with investment options. Photo: BP. #oilandgas #investment  Read more:… https://t.co/4ra9zChUZl,5
Thu Oct 25 15:26:10 +0000 2018,Back to the future: Saudi investor forum saved by old mainstay oil https://t.co/CZl8AKjO7z,0
Thu Oct 25 15:25:06 +0000 2018,Back to the future: Saudi investor forum saved by old mainstay oil https://t.co/hqDKmcxFKb https://t.co/OnQVqjqnSI,0
Thu Oct 25 15:04:41 +0000 2018,Want to know how much your current home value is???  Click here ---  https://t.co/7qSEGLKoSm   #realestate… https://t.co/D3AgfHqYuS,0
Thu Oct 25 14:47:34 +0000 2018,Love is like an investment. Make sure you give it to the right person and that you’re getting it’s worth too.,10
Thu Oct 25 14:47:09 +0000 2018,Watch our video to learn more about potential investment implications of the upcoming U.S. midterm elections.  https://t.co/cdGfNg5jAr,0
Thu Oct 25 14:35:47 +0000 2018,Want to work at Wells Fargo? We're #hiring in #Houston  TX! Click for details: https://t.co/ppAkexF69r #Banking #Job #Jobs #CareerArc,0
Thu Oct 25 14:15:01 +0000 2018,Watch our video to learn more about potential investment implications of the upcoming U.S. midterm elections.  https://t.co/LSETou1Ts0,0
Thu Oct 25 13:46:59 +0000 2018,The dollar flexed its safe-haven status yesterday  reaching a yearly high as U.S. equity markets took a tumble.… https://t.co/ojpO0kUOdH,0
Thu Oct 25 13:22:38 +0000 2018,A wide range of pureed format meals with nutritionally-fortified  for the healthcare and elderly sector  at risk of… https://t.co/neMCCnlZga,0
Thu Oct 25 13:16:08 +0000 2018,I really need a entry level position in investment banking,0
Thu Oct 25 13:01:42 +0000 2018,Provide your employees with the right tools for success. Employees respond better to managers who show a personal i… https://t.co/5v5Gv76GEy,0
Thu Oct 25 13:01:22 +0000 2018,@ENSlaw provides an in-depth look at the potential impact of China's investment on the South African Tax Base.… https://t.co/kh3I7VEMnW,0
Thu Oct 25 12:30:08 +0000 2018,https://t.co/yDp7XjsOgV #ubs #banking #banks #bankingnews #bank #businessnews #markets #marketnews #business… https://t.co/dMBRjdzOUf,0
Thu Oct 25 12:29:11 +0000 2018,#UBS Q3 #Profit Beats On #Investment #Banking https://t.co/iIuv7HkJFl #News #Nigeria #TX #finance #banks #finance,0
Thu Oct 25 11:00:35 +0000 2018,Please email at Jesse - at - https://t.co/ioNudVewLo to discuss how we can help you preserve and grow your wealth i… https://t.co/gmz6HRULZk,5
Thu Oct 25 10:34:09 +0000 2018,Saudi Energy Minister expects SABIC's stake purchase to be... https://t.co/LL3AuJRG3a,0
Thu Oct 25 10:33:09 +0000 2018,Saudi Energy Minister expects SABIC's stake purchase to be finalized in first-half of 2019: al-Ekhbariya TV… https://t.co/5qYtCKwE9S,0
Thu Oct 25 10:30:11 +0000 2018,Saudis trumpet $56 billion deals as conference ends amid partial... https://t.co/esKCkV8XK7,0
Thu Oct 25 10:29:10 +0000 2018,Saudis trumpet $56 billion deals as conference ends amid partial boycott https://t.co/Z1GTIeQABg https://t.co/aeGyzEe9JP,0
Thu Oct 25 09:50:15 +0000 2018,UBS targets American wealth for growth as investment bank shines https://t.co/GGFjRWfYdY,0
Thu Oct 25 09:49:11 +0000 2018,UBS targets American wealth for growth as investment bank shines https://t.co/rtnx5lcDS5 https://t.co/52biZChai8,0
Thu Oct 25 08:45:05 +0000 2018,Finding the Right Mechanic Makes Car Maintenance Easier to Complete https://t.co/GJLksvT7MI,0
Thu Oct 25 08:02:22 +0000 2018,Housing starts are way down. Nothing expresses consumer sentiment better than the housing market  why a big investm… https://t.co/pqhSByxfhA,0
Thu Oct 25 06:20:45 +0000 2018,Buying a Fixer-Upper: What You Need to Look for to Maximize Your Investment | https://t.co/qJdcKWHyjI… https://t.co/LpAEgRUmIB,0
Thu Oct 25 05:52:18 +0000 2018,How To Profit in 72hours bases From  Forex?  Earn good profits everyday  #forex #bitcoin #money #entrepreneur… https://t.co/htxcZLgIS5,0
Thu Oct 25 05:37:09 +0000 2018,@Bornabrit1 @EnriqueMFlores3 Not the first time a US President has covered up murders by the Saudis based on invest… https://t.co/aNIqfPUr3a,1
Thu Oct 25 05:36:54 +0000 2018,@Bornabrit1 @EnriqueMFlores3 Not the first time a US President has covered up murders by the Saudis based on invest… https://t.co/aNIqfPUr3a,1
Thu Oct 25 05:33:58 +0000 2018,@ScottAdamsSays @DennisKulpa Not until democrats retake power and are in a position to make the MSM investment pay… https://t.co/noBB2Ut67y,0
Thu Oct 25 05:21:03 +0000 2018,New way to request a custom quote on my website! Pop on by  if you’re looking for a wedding photographer! https://t.co/LdvjpTynBn,0
Thu Oct 25 05:11:25 +0000 2018,Me: I can’t buy a new mattress bc I need to pay to go back to school.   Jen: You can’t keep going to Jason’s just f… https://t.co/2XWdp5S0Mv,0
Thu Oct 25 04:52:08 +0000 2018,Investment Advisor SEO 2018 | Website Audit | Financier SEO: https://t.co/wJBXe1Il0a via @YouTube,0
Thu Oct 25 02:06:50 +0000 2018,Israel saw the same numbers. So have several other countries. Building a wall will be worth the investment. 🙌🏻🇺🇸 https://t.co/yGAautyUgx,0
Thu Oct 25 01:58:45 +0000 2018,@aeberman12 What is the pdp reserve value pv10 that the industry has to show for a net $3.9 billion investment?,0
Thu Oct 25 01:28:10 +0000 2018,@TodoDynamo Had there been an investment in a quality and deep defense  then yes  I agree the conclusions might wel… https://t.co/emEH2GS2nz,0
Thu Oct 25 01:26:32 +0000 2018,There’s a lot of talk about money and lack of investment in Dynamo lately.  Had the defense been healthy and with a… https://t.co/VoYuxcKWta,2
Thu Oct 25 01:14:51 +0000 2018,Proud to receive #SmallBizDefender Award yesterday from JCN with my good friend @RepKevinBrady at @3brothersbakery… https://t.co/TYlG1PBIwB,7
Thu Oct 25 00:09:09 +0000 2018,Yes!!!!! Love hearing this from Jonathan Thomas about @USMathRecovery  Investment in teachers is an investment in s… https://t.co/e5HLxO5Y85,2
