Tue Jan 09 23:23:42 +0000 2018,@KPMG_US and @LeavittPartners have identified six key disruptors anticipated to continue re-shaping the health care… https://t.co/jxGFnfJcS8,0
Tue Jan 09 23:23:35 +0000 2018,Do you know what the top drivers of M&amp;A activity in the health care and life sciences sector for 2018? Get the late… https://t.co/l73VSGrEHd,0
Tue Jan 09 23:23:30 +0000 2018,Healthcare IT is among one of the hotter investment sectors  according to corporate financial professionals surveye… https://t.co/w5cdshDUlW,0
Tue Jan 09 23:22:36 +0000 2018,Spiraling #semiconductor R&amp;D costs. $400 million new product investment requires $5B mkt &amp; 20% mkt shr w/40% margin… https://t.co/Jd5vQnHVto,1
Tue Jan 09 23:22:25 +0000 2018,Do you know what the top drivers of M&amp;A activity in the health care and life sciences sector for 2018? Get the late… https://t.co/jUKASJUaMv,0
Tue Jan 09 23:22:19 +0000 2018,Do you know what the top drivers of M&amp;A activity in the health care and life sciences sector for 2018? Get the late… https://t.co/r9IIPx4umP,0
Tue Jan 09 23:22:16 +0000 2018,Healthcare IT is among one of the hotter investment sectors  according to corporate financial professionals surveye… https://t.co/22YOdARrtq,0
Tue Jan 09 23:20:30 +0000 2018,A 30 million dollar investment smells terribly like a 30 million dollar bribe. I wonder what the difference is? https://t.co/t9Zzmev6CI,18
Tue Jan 09 22:57:14 +0000 2018,Long-term production gains can be achieved by propping open microfractures in the stimulated areas so that they con… https://t.co/uJ09YxV0n7,0
Tue Jan 09 22:45:06 +0000 2018,Been looking forward to this talk on the impact of disasters on meteorologists from Christina Crowe. Meteorologists… https://t.co/lB708t1Isz,8
Tue Jan 09 22:30:47 +0000 2018,Every day u invest a little bit of urself into ur work; 1 big choice available to u  is where u'll be making that investment -Seth Godin,0
Tue Jan 09 22:23:44 +0000 2018,Been looking forward to this talk on the impact of disasters on meteorologists from Christina Crowe. Meteorologists… https://t.co/lB708t1Isz,8
Tue Jan 09 22:11:10 +0000 2018,So glad to have @AHS_Warranty for my own home...so worth the investment!!! #Realtor #RealEstate #Homeowners,0
Tue Jan 09 22:05:55 +0000 2018,Mark Hulbert: The top-performing investment newsletter of 2017 jumped 47% https://t.co/jHd0oS13sa,0
Tue Jan 09 21:45:46 +0000 2018,Economic boom predicated on massive deregulation  the expectation &amp; then the reality of comprehensive tax reform &amp;… https://t.co/sHCyiNj44B,2
Tue Jan 09 21:41:23 +0000 2018,Been looking forward to this talk on the impact of disasters on meteorologists from Christina Crowe. Meteorologists… https://t.co/lB708t1Isz,8
Tue Jan 09 21:41:19 +0000 2018,Been looking forward to this talk on the impact of disasters on meteorologists from Christina Crowe. Meteorologists… https://t.co/lB708t1Isz,8
Tue Jan 09 21:41:04 +0000 2018,Been looking forward to this talk on the impact of disasters on meteorologists from Christina Crowe. Meteorologists… https://t.co/lB708t1Isz,8
Tue Jan 09 21:40:37 +0000 2018,Been looking forward to this talk on the impact of disasters on meteorologists from Christina Crowe. Meteorologists… https://t.co/lB708t1Isz,8
Tue Jan 09 21:40:04 +0000 2018,Been looking forward to this talk on the impact of disasters on meteorologists from Christina Crowe. Meteorologists… https://t.co/lB708t1Isz,8
Tue Jan 09 21:28:04 +0000 2018,January is School Board Recognition Month! For #HISD Trustee @RHONDAJN1  investing in students is her top priority … https://t.co/Ky51t2fs42,2
Tue Jan 09 21:22:41 +0000 2018,Economic boom predicated on massive deregulation  the expectation &amp; then the reality of comprehensive tax reform &amp;… https://t.co/sHCyiNj44B,2
Tue Jan 09 21:22:11 +0000 2018,Interesting graph showing #VC investment in #Austin #startups 2013-2017 -  https://t.co/dpya7KLfKW,0
Tue Jan 09 21:20:38 +0000 2018,Economic boom predicated on massive deregulation  the expectation &amp; then the reality of comprehensive tax reform &amp;… https://t.co/sHCyiNj44B,2
Tue Jan 09 21:19:59 +0000 2018,@RoKhanna You sure?   investment vehicles (401k  IRA  529) are created to help eliminate pensions and to drive work… https://t.co/KG1Aia4EdE,0
Tue Jan 09 21:18:49 +0000 2018,. @CapitalFactory is coming to @stationhouston on Jan. 10 for its $100 000 Investment Challenge Info Session. Regis… https://t.co/jbbWoFb6lR,9
Tue Jan 09 20:58:04 +0000 2018,January is School Board Recognition Month! For #HISD Trustee @RHONDAJN1  investing in students is her top priority … https://t.co/Ky51t2fs42,2
Tue Jan 09 20:50:04 +0000 2018,Nope thats an investment https://t.co/MsUatxN02x,1
Tue Jan 09 20:49:14 +0000 2018,Nope thats an investment https://t.co/MsUatxN02x,1
Tue Jan 09 20:45:31 +0000 2018,The SEC and CFTC recognizes the risks of Bitcoin and other cryptocurrencies  and warns of investment scams and Ponz… https://t.co/lvpOlH6irZ,1
Tue Jan 09 20:42:05 +0000 2018,The SEC and CFTC recognizes the risks of Bitcoin and other cryptocurrencies  and warns of investment scams and Ponz… https://t.co/lvpOlH6irZ,1
Tue Jan 09 20:35:20 +0000 2018,Investment pouring into Harris County and Texas  research finds https://t.co/jxrVgP4F1e via @houstonchron… https://t.co/h5hZL3Vv2S,0
Tue Jan 09 20:32:33 +0000 2018,Mexico made a historic investment to study and conceive a deeper understanding of the #Gulf of #Mexico's great ecos… https://t.co/ZhacZPGKy8,1
Tue Jan 09 20:25:17 +0000 2018,The most important investment advice for 2018. https://t.co/T2pIbyRv1E,0
Tue Jan 09 20:20:55 +0000 2018,Both #cryptocurrencies I told people to buy at end  of year just had awesome jump.   Always get crap from people wh… https://t.co/XIWs3yJqJQ,0
Tue Jan 09 20:00:53 +0000 2018,If all we ever do in our free time is scroll through the internet or social media  then we lose opportunities to do… https://t.co/Md2Ho46yc7,1
Tue Jan 09 19:48:27 +0000 2018,January is School Board Recognition Month! For #HISD Trustee @RHONDAJN1  investing in students is her top priority … https://t.co/Ky51t2fs42,2
Tue Jan 09 19:37:36 +0000 2018,We're #hiring! Click to apply: Investment Intern - https://t.co/1t1fjX96D4 #internship #Houston  TX #Job #Jobs #CareerArc,1
Tue Jan 09 19:22:47 +0000 2018,You can buy a house  live in it for 30 years have it paid off and possibly get a return on your investment. Or you… https://t.co/NVem4aqxcs,1
Tue Jan 09 19:22:33 +0000 2018,People like to say that a house is an investment. But it depends on what you do with it that determines if it's a good investment or not.,1
Tue Jan 09 19:22:05 +0000 2018,You can buy a house  live in it for 30 years have it paid off and possibly get a return on your investment. Or you… https://t.co/NVem4aqxcs,1
Tue Jan 09 19:21:41 +0000 2018,People like to say that a house is an investment. But it depends on what you do with it that determines if it's a good investment or not.,1
Tue Jan 09 18:57:33 +0000 2018,Investment bankers as you've never seen them ... Tudor Pickering staff performs "Bad and Boujee Office Rap"… https://t.co/Hx1OI6BLKz,0
Tue Jan 09 18:50:12 +0000 2018,An investment in yourself is one of the greatest gifts you could give to the world!,0
Tue Jan 09 18:46:25 +0000 2018,Reduce Your Taxes with These Year-End Investment Moves https://t.co/AW3tzmAxGM,0
Tue Jan 09 18:40:10 +0000 2018,@culturemap Hotel alternate Airbnb and transpo alternates such as Uber and Lyft are carpetbaggers  to use a nice te… https://t.co/UNmekt46X2,0
Tue Jan 09 18:29:52 +0000 2018,Lucid Energy Group agreed to sell Lucid Energy Group II to a JV controlled by Riverstone Global Energy &amp; Power Fund… https://t.co/C09ilWosIx,2
Tue Jan 09 18:29:33 +0000 2018,Lucid Energy Group agreed to sell Lucid Energy Group II to a JV controlled by Riverstone Global Energy &amp; Power Fund… https://t.co/C09ilWosIx,2
Tue Jan 09 18:28:48 +0000 2018,If all we ever do in our free time is scroll through the internet or social media  then we lose opportunities to do… https://t.co/Md2Ho46yc7,1
Tue Jan 09 18:25:02 +0000 2018,Beginning my investment in crypto  Just gonna play a bit at first and learn the ropes before I drop in fully.,0
Tue Jan 09 18:19:08 +0000 2018,AirPods still my best investment ever.,0
Tue Jan 09 18:11:47 +0000 2018,You can be flat dead broke today  &amp; you're one investment away from being wealthy tomorrow.,1
Tue Jan 09 17:49:22 +0000 2018,@HoodStarChantz Right everything doesn't always have to end on bad terms it can still be like a good investment,0
Tue Jan 09 17:40:06 +0000 2018,Protect your investment  call @yourtexasroofer today for a FREE ROOF INSPECTION! https://t.co/82pxqcOYDV,0
Tue Jan 09 17:38:13 +0000 2018,Spiraling #semiconductor R&amp;D costs. $400 million new product investment requires $5B mkt &amp; 20% mkt shr w/40% margin… https://t.co/Bnw6tNXqKk,0
Tue Jan 09 17:35:42 +0000 2018,“‘Value added’ is still the hottest investment objective for apartment properties” - @cbremultifamily… https://t.co/CWa1tSahaA,0
Tue Jan 09 17:34:31 +0000 2018,@BiggerPockets great real estate investment strategies article. Great for any time(s)!  “1. Acquire value-add oppor… https://t.co/HHqh3mxFRX,0
Tue Jan 09 17:22:20 +0000 2018,Sparkle &amp; Shine...add a little of these trends to your daily look!! This dress is on major sell (Runs true to size)… https://t.co/COCKapU142,0
Tue Jan 09 17:00:40 +0000 2018,Mexico made a historic investment to study and conceive a deeper understanding of the #Gulf of #Mexico's great ecos… https://t.co/ZhacZPGKy8,1
Tue Jan 09 16:57:18 +0000 2018,Spiraling #semiconductor R&amp;D costs. $400 million new product investment requires $5B mkt &amp; 20% mkt shr w/40% margin… https://t.co/27Ttl0p5VU,1
Tue Jan 09 16:40:25 +0000 2018,The Wu-Tang Investment Fund  #MakeABandLessInteresting,0
Tue Jan 09 16:17:16 +0000 2018,You can be flat dead broke today  &amp; you're one investment away from being wealthy tomorrow.,1
Tue Jan 09 16:01:40 +0000 2018,Join us for Assemble #Tech Corner this month to learn workflows that are going to help you get the most out of your… https://t.co/2ohIUm9qbv,0
Tue Jan 09 15:28:23 +0000 2018,10 CRE Investment Strategies for 2018 https://t.co/XTRa4zcyEn via @GlobeStcom,0
Tue Jan 09 15:16:14 +0000 2018,Spiraling #semiconductor R&amp;D costs. $400 million new product investment requires $5B mkt &amp; 20% mkt shr w/40% margin… https://t.co/27Ttl0p5VU,1
Tue Jan 09 15:08:53 +0000 2018,"The numbers make sense " said state Sen. Larry Taylor  a Friendswood Republican who has tried for years to get fed… https://t.co/dGwjwhY2Nx,0
Tue Jan 09 14:02:26 +0000 2018,@redbryce1 @rmayemsinger @Oprah The EPA does not protect the environment; it regulates investment. If we all want c… https://t.co/aJ4krr6cF0,0
Tue Jan 09 13:59:16 +0000 2018,$IEGH Zack's Small Cap Research Report: IEG Holdings launches tender offer for up to 4.99% of LendingClub Corp. (LC… https://t.co/jgdfSKhbHJ,0
Tue Jan 09 13:55:08 +0000 2018,We're #hiring! Click to apply: Investment Analyst - https://t.co/KzQVStVfml #InvestmentBanking #Houston  TX #Job #Jobs #CareerArc,0
Tue Jan 09 13:42:02 +0000 2018,@rubikloud scores $37 million investment to bring intelligence to retail industry https://t.co/hD13QM2fNr https://t.co/eb4lzz9Z89,0
Tue Jan 09 13:33:37 +0000 2018,#Lidl #Luton #Brexit Hurrah! https://t.co/R4BIIMJwyV,0
Tue Jan 09 13:10:57 +0000 2018,Learn how a mid-market investment organization made the switch to #IaaS. Pain Points: IT refresh coming up  Small I… https://t.co/A5J7TgFli2,3
Tue Jan 09 13:00:46 +0000 2018,We've got the scoop on what's popular in bathroom designs for 2017. When it comes to resale value  kitchens and bat… https://t.co/8w8oepwThn,0
Tue Jan 09 13:00:43 +0000 2018,This #eSports founder used a brilliant method to land a big #investment from legendary #tech exec Paul Maritz… https://t.co/ffpF7a1yGZ,0
Tue Jan 09 12:44:02 +0000 2018,@ChrisCuomo An education investment has been made in dreamers.  They are well assimilated and at the point to contr… https://t.co/IWgLcObDiO,0
Tue Jan 09 08:59:06 +0000 2018,Troubling Complacency among the World’s Trade Ministers https://t.co/rG6SEMfVZW,0
Tue Jan 09 07:12:08 +0000 2018,Boat ownership is a big responsibility&gt; Learn more about maintaining UR investment https://t.co/e96fvQj9Sc,0
Tue Jan 09 06:54:54 +0000 2018,Policy Instruments Government Uses to Promote Foreign Direct Investment https://t.co/uguZjnDHgx,0
Tue Jan 09 06:54:50 +0000 2018,Horizontal Foreign Direct Investment https://t.co/qFrS7wfIju,0
Tue Jan 09 06:03:36 +0000 2018,The Realty Investment Club of Houston RICH Networking Breakfast  2nd Friday led by Carlos Neto. Start your... https://t.co/nIQXmfFgIE,0
Tue Jan 09 05:54:27 +0000 2018,And schedules and SOS don't matter either  but ESPN's investment to the sec matters a lot. https://t.co/EY8Zr8QVdm,0
Tue Jan 09 05:33:36 +0000 2018,@Rustycagenail @theguyinsandieg Return on investment,0
Tue Jan 09 04:18:49 +0000 2018,A &amp; S INVESTMENT GROUP OF HOUSTON: https://t.co/qBvpwgwLXw via @YouTube,0
Tue Jan 09 03:46:19 +0000 2018,Last May  Jared Kushner accompanied Trump on their first diplomatic trip to Israel.  Shortly before  Kushner Compan… https://t.co/qmsZ2q0XMn,77
Tue Jan 09 03:16:43 +0000 2018,This 4K HD TV was a great investment. The picture was so clear I could see Kendrick’s pores during his halftime performance 😂,0
Tue Jan 09 03:05:03 +0000 2018,This is the biggest purchase and investment of your life  why you should get a home inspection! https://t.co/9i5V3qTvCI,0
Tue Jan 09 03:04:23 +0000 2018,@Mahixk even worse is  this was her response to me telling her I’m not eligible for financial aid this semester. sh… https://t.co/1sMluCUzSB,0
Tue Jan 09 03:01:09 +0000 2018,I love that they don’t mention the resale value on #HGTVHomeTown. It shows that they’re building these homes for th… https://t.co/SPg86Mrt3n,3
Tue Jan 09 02:57:49 +0000 2018,Last May  Jared Kushner accompanied Trump on their first diplomatic trip to Israel.  Shortly before  Kushner Compan… https://t.co/qmsZ2q0XMn,77
Tue Jan 09 02:40:40 +0000 2018,A 30 million dollar investment smells terribly like a 30 million dollar bribe. I wonder what the difference is? https://t.co/t9Zzmev6CI,18
Tue Jan 09 02:38:21 +0000 2018,A 30 million dollar investment smells terribly like a 30 million dollar bribe. I wonder what the difference is? https://t.co/t9Zzmev6CI,18
Tue Jan 09 02:37:29 +0000 2018,A 30 million dollar investment smells terribly like a 30 million dollar bribe. I wonder what the difference is? https://t.co/t9Zzmev6CI,18
Tue Jan 09 02:31:41 +0000 2018,A 30 million dollar investment smells terribly like a 30 million dollar bribe. I wonder what the difference is? https://t.co/t9Zzmev6CI,18
Tue Jan 09 02:31:08 +0000 2018,A 30 million dollar investment smells terribly like a 30 million dollar bribe. I wonder what the difference is? https://t.co/t9Zzmev6CI,18
Tue Jan 09 02:30:59 +0000 2018,A 30 million dollar investment smells terribly like a 30 million dollar bribe. I wonder what the difference is? https://t.co/t9Zzmev6CI,18
Tue Jan 09 02:30:46 +0000 2018,A 30 million dollar investment smells terribly like a 30 million dollar bribe. I wonder what the difference is? https://t.co/t9Zzmev6CI,18
Tue Jan 09 02:22:27 +0000 2018,A 30 million dollar investment smells terribly like a 30 million dollar bribe. I wonder what the difference is? https://t.co/t9Zzmev6CI,18
Tue Jan 09 02:22:06 +0000 2018,A 30 million dollar investment smells terribly like a 30 million dollar bribe. I wonder what the difference is? https://t.co/t9Zzmev6CI,18
Tue Jan 09 02:19:46 +0000 2018,A 30 million dollar investment smells terribly like a 30 million dollar bribe. I wonder what the difference is? https://t.co/t9Zzmev6CI,18
Tue Jan 09 02:19:20 +0000 2018,A 30 million dollar investment smells terribly like a 30 million dollar bribe. I wonder what the difference is? https://t.co/t9Zzmev6CI,18
Tue Jan 09 02:17:11 +0000 2018,A 30 million dollar investment smells terribly like a 30 million dollar bribe. I wonder what the difference is? https://t.co/t9Zzmev6CI,18
Tue Jan 09 02:14:52 +0000 2018,A 30 million dollar investment smells terribly like a 30 million dollar bribe. I wonder what the difference is? https://t.co/t9Zzmev6CI,18
Tue Jan 09 02:14:38 +0000 2018,A 30 million dollar investment smells terribly like a 30 million dollar bribe. I wonder what the difference is? https://t.co/t9Zzmev6CI,18
Tue Jan 09 02:11:14 +0000 2018,A 30 million dollar investment smells terribly like a 30 million dollar bribe. I wonder what the difference is? https://t.co/t9Zzmev6CI,18
Tue Jan 09 02:11:00 +0000 2018,A 30 million dollar investment smells terribly like a 30 million dollar bribe. I wonder what the difference is? https://t.co/t9Zzmev6CI,18
Tue Jan 09 02:10:18 +0000 2018,A 30 million dollar investment smells terribly like a 30 million dollar bribe. I wonder what the difference is? https://t.co/t9Zzmev6CI,18
Tue Jan 09 01:23:04 +0000 2018,@RippedVixen Good investment... You never know when you're going on a high speed chase and the cops try to use spik… https://t.co/x6ajtFbjbs,0
Tue Jan 09 01:14:01 +0000 2018,REAL INVESTMENT REPORT: The market is more overbought  extended and deviated than at just about any other point in… https://t.co/Nej2I9ec25,66
Tue Jan 09 00:35:04 +0000 2018,#ManagedMon If we get a pullback  whacha gonna do? Ride it down? Get out? Tune in for #downmarket #strategies… https://t.co/uo1RCVXIEP,0
Tue Jan 09 00:27:18 +0000 2018,@PatDStat more bad drafts! and terrible investment / evaluation for OL  weak defensive talent outside vontae. and w… https://t.co/RhPWOILp4j,0
Tue Jan 09 00:23:35 +0000 2018,I'm running studio control for the Real Investment Hour with @LanceRoberts and the Joe Walsh show! Tune in 6p-9p on… https://t.co/BekqyHMQFO,0
