Fri May 11 20:37:14 +0000 2018,Now that I got #Bitcoin  #BitcoinCash  #Litecoin  #Ripple and #Ethereum  I can sit back and watch my wealth increas… https://t.co/3EgmHt9eAu,0
Fri May 11 13:12:28 +0000 2018,If you took White House quotes and asked “who said it” between Kremlin bots and the White House there really is no difference.,116
Fri May 11 05:52:52 +0000 2018,Thirty million reasons campaign finance laws are a joke | Analysis by CNN's Gregory Krieg https://t.co/NFwrChrv6u https://t.co/kfVOkK4YQE,50
Fri May 11 05:52:23 +0000 2018,"If he doesn't have anything to hide  he ought to release the 14-15 months worth of bank statements ... they're not… https://t.co/G3mhhOY43M,146
Fri May 11 03:01:23 +0000 2018,Junson Chan - $13 000 USD in profits selling sprouts and 808 coin for bitcoin/litecoin/dogecoin. Plus  Sprouts hard… https://t.co/v9nTjBOCu3,3
Fri May 11 02:39:25 +0000 2018,--is that a UFO or an aggressive #miningmachine @teamevga  #gtx #flex #crypto #cryptocurrency #blockchain #stocks… https://t.co/3zdFnsi7GD,0
Fri May 11 02:01:14 +0000 2018,Which cryptocurrency is your favorite? These five should be on every cryptocurrency trader's radar:  #crypto… https://t.co/5JYBIpZAah,0
