Mon Mar 19 23:17:42 +0000 2018,They’re hired to do pump &amp; dump for stocks and crypto currencies  e.g. a private investor  call him Ivan  rents a b… https://t.co/vT04PeqF0w,43
Mon Mar 19 23:05:32 +0000 2018,They’re hired to do pump &amp; dump for stocks and crypto currencies  e.g. a private investor  call him Ivan  rents a b… https://t.co/vT04PeqF0w,43
Mon Mar 19 23:00:42 +0000 2018,They’re hired to do pump &amp; dump for stocks and crypto currencies  e.g. a private investor  call him Ivan  rents a b… https://t.co/vT04PeqF0w,43
Mon Mar 19 22:05:08 +0000 2018,Here is some perspective  Reposting @thebittimes: A comparison between both market capitals #Bitcoin #bubble #banks… https://t.co/iXyo5MYfDY,0
Mon Mar 19 21:11:59 +0000 2018,@litecoindad Right on my cryptobro! That is really cool of you! Since following you and being apart of the… https://t.co/vPS7f6LjV3,0
Mon Mar 19 20:43:38 +0000 2018,Bitcoin  Ethereum  Bitcoin Cash  Ripple  Stellar  Lite... News #Cointelegraph https://t.co/ROJ12vgpml @cointelegraph https://t.co/ZOdvWCepry,0
Mon Mar 19 20:27:11 +0000 2018,🤔🤔🤔 Bitcoin Cash and Litecoin Futures Might be on the Way https://t.co/FhogCYEYX1 via @coingamma,0
Mon Mar 19 14:08:02 +0000 2018,@FirstFrontierBC @litecoindad Marines love litecoin!,0
Mon Mar 19 11:50:15 +0000 2018,FTC halted the activities of schemes falsely promised that participants could earn large returns by paying cryptocu… https://t.co/DKeMMpR3Qx,0
Mon Mar 19 06:25:14 +0000 2018,They’re hired to do pump &amp; dump for stocks and crypto currencies  e.g. a private investor  call him Ivan  rents a b… https://t.co/vT04PeqF0w,43
Mon Mar 19 00:58:21 +0000 2018,@litecoindad Thanks litecoin dad. You rock!,0
