Fri Sep 22 23:24:27 +0000 2017,Headline of the week: https://t.co/MfLERZQGm8 #nodulldays #bitcoin,1
Fri Sep 22 23:09:35 +0000 2017,In #Bitcoin  :-) https://t.co/VFA6r08jV8,0
Fri Sep 22 22:46:20 +0000 2017,Name five things that you STILL DON'T UNDERSTAND and GO!!  1. Bitcoin (What in the F is this  its like money  but... https://t.co/qAdJOchBNe,0
Fri Sep 22 21:51:22 +0000 2017,#Bitcoin: #power to the #people https://t.co/1jrh1rxb1H #cryptocurrencies #crypto #digital #currencies #blockchain… https://t.co/MQZQL4ho6c,0
Fri Sep 22 21:21:28 +0000 2017,Sen Ed Markey just said North Korea uses bitcoin and that it should be "shut off"...,0
Fri Sep 22 21:13:14 +0000 2017,U.S. government sues over alleged bitcoin Ponzi scheme https://t.co/aWHC4buN3S via @CNNMoney,0
Fri Sep 22 21:12:02 +0000 2017,I'm lucky. Mostly. https://t.co/eqEXQB3xeG. #ethereum #bitcoin,0
Fri Sep 22 21:02:26 +0000 2017,I just saved $39.24 by shopping @PurseIO! #bitcoin $BTC #Bitcoin #amazon #shopping https://t.co/Ut4WrgSYJY,0
Fri Sep 22 20:28:05 +0000 2017,What are you spending your #bitcoin on this weekend? https://t.co/kXlqvTRddi,8
Fri Sep 22 20:05:55 +0000 2017,Are you awake  or still in the #Matrix? Buy #Bitcoins  #HUMAN! https://t.co/Jy2jcZOImW #P2P #HODL #BTC #CRYPTO… https://t.co/qJ6eRM4diC,0
Fri Sep 22 19:34:23 +0000 2017,Congrats to the winners of the crypto trivia who will receive complimentary passes to #GoBlockCon. #SanDiego… https://t.co/Bx5OTCJ8Rv,1
Fri Sep 22 18:59:03 +0000 2017,Despite China Fears  Year’s Good Bitcoin News Outweighs the Bad https://t.co/t1eqvgFqua,1
Fri Sep 22 18:54:38 +0000 2017,jaimeotero_: ECB's Vice President Vitor Constancio says bitcoin isn't a currency  it's a tulip https://t.co/Utyuzo1xuh …,0
Fri Sep 22 18:54:07 +0000 2017,Jamie Dimon said Bitcoin is a fraud recently.  These are the countries with the most interest  according to Google t…https://t.co/rbXuZTRkMK,0
Fri Sep 22 18:40:21 +0000 2017,Despite China Fears  Year’s Good Bitcoin News Outweighs the Bad https://t.co/t1eqvgFqua,1
Fri Sep 22 18:34:32 +0000 2017,jaimeotero_: One currency guru gets his head around bitcoin's capital flow signal https://t.co/7qcqQFz9Zs https://t.co/JvPiJOCqoF RT,0
Fri Sep 22 18:30:36 +0000 2017,Should of offered #bitcoinbananabread #Bitcoin $BTC #cryptocurrency $crypto @chrissyteigen #buybitcoin https://t.co/9ZmLUbkCUt,0
Fri Sep 22 18:27:34 +0000 2017,@S_Mikhailovich and you are 100% correct blockchain will be weaponized by governments eliminating financial privacy… https://t.co/MuguoUFsP8,0
Fri Sep 22 18:26:08 +0000 2017,@S_Mikhailovich Bitcoin is not efficient  its designed to be tamperproof and censorship resistance which is at the… https://t.co/GXIAnEwQu1,0
Fri Sep 22 18:25:08 +0000 2017,@S_Mikhailovich you're 100% correct they wont be SOV and efficiency is boring compared to implications of bitcoin w… https://t.co/52wQ0W5YeU,0
Fri Sep 22 18:11:07 +0000 2017,Scammers gonna scam... whether BTC or USD or Beanie Babies...  https://t.co/LSBgjuNgeO,0
Fri Sep 22 17:54:51 +0000 2017,Don Frye speaks out with his opinion https://t.co/tYRgomMaZ5,8
Fri Sep 22 17:54:05 +0000 2017,@S_Mikhailovich blockchain is a marketing term used by a lot of ppl that don't understand bitcoin or do understand… https://t.co/AbvDsUoueP,0
Fri Sep 22 17:40:58 +0000 2017,@TuurDemeester This will be huge. I have been telling people to create SD IRA'S to store Bitcoin. An ETF will be wa… https://t.co/s52iezNAEa,0
Fri Sep 22 17:36:55 +0000 2017,Bitcoin Opportunity you can't pass up https://t.co/2lwW6GSQE6 #bitcoinfriday#fridayfeeling #flashbackfriday #bitcoin 16btc,0
Fri Sep 22 17:27:19 +0000 2017,If Dimon says bitcoin is worth nothing  he's probably accumulating. https://t.co/cQ4lkZ4EqB,2
Fri Sep 22 17:16:04 +0000 2017,8 applications of #blockchain https://t.co/TdKLWjK7kX by @ThoriumWealth via @BusinessInsider #bitcoin https://t.co/yutzbQp2n6,0
Fri Sep 22 17:15:52 +0000 2017,Do you accept Bitcoin? https://t.co/aVDBd8aVTJ,0
