Thu Mar 01 23:55:19 +0000 2018,New #Bitcoin Rushour series entitled the 7 Habits and Principles of the Crypto Home Gamer.… https://t.co/1qhtLZUViI,0
Thu Mar 01 23:32:04 +0000 2018,#Bitcoin is a hot topic right now! 💰 This is how you too can #invest in the popular #cryptocurrency. Our full guide… https://t.co/tBe8slhkgc,0
Thu Mar 01 23:29:43 +0000 2018,Join Scott Scheper  one of the XYO Network founders  at "Crypto Never Sleeps" Monday night in San Diego. XYO is the… https://t.co/ILuOCUhD3l,4
Thu Mar 01 23:17:35 +0000 2018,New #Bitcoin Rushour series entitled the 7 Habits and Principles of the Crypto Home Gamer.  After one week off... A… https://t.co/9fio4hlHN0,0
Thu Mar 01 23:06:18 +0000 2018,lol at this apology statement 😂😂🤦‍♂️ #makeitraincrypto #cryptomemes #bitcoin #dogecoin #ethereum… https://t.co/P99PvxVCbk,1
Thu Mar 01 22:40:03 +0000 2018,Bitfinex Sues Wells Fargo Over Bank Transfer Freeze - CoinDesk https://t.co/hRtoQNl8Qe,0
Thu Mar 01 22:36:23 +0000 2018,Square Adds Bitcoin Buying for More Cash App Users - CoinDesk https://t.co/8mnk0VArrI,0
Thu Mar 01 22:31:45 +0000 2018,Microsoft Eyes Role for Bitcoin  Ethereum in Decentralized ID - CoinDesk https://t.co/fAhLD1Qz2z,0
Thu Mar 01 22:30:12 +0000 2018,#Bitcoin! #BitcoinATM! | New #BitcoinATMs have been placed in #NewJersey | The rise of any type of #ATM placement m… https://t.co/VDDGyj87dY,0
Thu Mar 01 22:30:00 +0000 2018,#Bitcoin! #BitcoinATM! | New #BitcoinATMs have been placed in #NewJersey | The rise of any type of #ATM placement m… https://t.co/V9WOnJcYI1,0
Thu Mar 01 21:57:24 +0000 2018,@pwuille @cyrilthecypherp @ZeusZissou @rusty_twit @adam3us @peterktodd Are you suggesting Bitcoin can or will becom… https://t.co/6RqdKWMJMx,0
Thu Mar 01 21:45:08 +0000 2018,Krypton Airdrop Alert 📢  Get 60 Free KRT tokens here: https://t.co/KxWNquNgVs  #ico #icos #token #tokens #airdrop… https://t.co/7KjIeCxrAk,0
Thu Mar 01 21:18:38 +0000 2018,Thrive (THRT) Airdrop Alert 📢  Get Free THRT tokens here: https://t.co/JWtZK4RSU8  After you register  click Airdro… https://t.co/YeUarpql6a,0
Thu Mar 01 21:14:28 +0000 2018,Who keeps a running calendar of Gartman's CNBC appearances? In a world filled with Bitcoin mining  someone has to b… https://t.co/r0hoPJDCib,2
Thu Mar 01 21:12:15 +0000 2018,Corbex (CEX) Airdrop Alert 📢  Get FREE 30 #CEX Tokens here:  https://t.co/7nW04XzaqL  #ico #airdrop #freetoken #btc… https://t.co/g7zPTcm6TL,0
Thu Mar 01 21:02:25 +0000 2018,One of the best articles I’ve read on possible implications of cryptocurrencies  distributed ledgers  blockchain https://t.co/3hdSlZ6TnC,1
Thu Mar 01 20:57:43 +0000 2018,Who keeps a running calendar of Gartman's CNBC appearances? In a world filled with Bitcoin mining  someone has to b… https://t.co/r0hoPJDCib,2
Thu Mar 01 20:57:19 +0000 2018,EARN FREE SP TOKENS! 📢  Get your SuchApp Here: https://t.co/SZDp2xVafN  #ico #icos #token #tokens #airdrop… https://t.co/885SrX5B2C,0
Thu Mar 01 20:51:15 +0000 2018,MaxData Airdrop 📢  Get your MaxData Tokens here: https://t.co/pXtVnKfZUx  #ico #icos #token #tokens #airdrop… https://t.co/1be70NmOk3,0
Thu Mar 01 20:24:59 +0000 2018,DCC Finance Airdrop 📢 (Telegram)  Join telegram group and get 70 $DCC tokens ~ 21$  https://t.co/EtHPvB3JoR  #ico… https://t.co/9oRWFBXce2,0
Thu Mar 01 19:55:25 +0000 2018,Bitcoin Cash $BCH price: $1291.68   Binance registration is ONLINE! We JUST checked! 🤔 🙌    ➡️… https://t.co/xrkxL7OKIA,0
Thu Mar 01 19:54:27 +0000 2018,Bitcoin:  Litecoin Booms in February But ‘Golden’ Crypto Takes Price Podium https://t.co/SJullmSDib https://t.co/3SRCl75J2m,7
Thu Mar 01 19:50:14 +0000 2018,At least my kids own Bitcoin while Daddy blew himself up with the Dow ....,3
Thu Mar 01 19:46:56 +0000 2018,#booknews: 11-Year-Old Crypto Prodigy Has Written a Book on Bitcoin https://t.co/7xuP3gTaUV #books #book,0
Thu Mar 01 19:36:25 +0000 2018,At least my kids own Bitcoin while Daddy blew himself up with the Dow ....,3
Thu Mar 01 19:32:35 +0000 2018,At least my kids own Bitcoin while Daddy blew himself up with the Dow ....,3
Thu Mar 01 19:31:15 +0000 2018,At least my kids own Bitcoin while Daddy blew himself up with the Dow ....,3
Thu Mar 01 19:27:47 +0000 2018,Come to join a good project Pumpkin Pay —is now giving free airdrop!! Follow @PumpkinPayTeam  get 100 PPKC first an… https://t.co/A8CHZzQF8S,0
Thu Mar 01 19:27:44 +0000 2018,Las Vegas strip club now accepting Bitcoin https://t.co/pRixLWEmku https://t.co/FPSfqj5TxS,7
Thu Mar 01 19:19:13 +0000 2018,Bitcoin Mining Video - bitclubnetworkbitcoin’s blog https://t.co/OUb0Iwtsid,0
Thu Mar 01 19:04:15 +0000 2018,This Bitcoin-Trading Family Man Faced Years in Prison. Now He’s Telling His Story https://t.co/f8EliPzabM,0
Thu Mar 01 18:47:54 +0000 2018,@MattyyBaee @NickPolom I think you're right cause it's in his bio I was just curious if he was like a bitcoin investor or something,0
Thu Mar 01 18:39:21 +0000 2018,TimeBox Airdrop 📢  The team distributes free $TB tokens to Telegram and Twitter users.  Go to:… https://t.co/5Fn88zwVi2,0
Thu Mar 01 18:36:20 +0000 2018,Goldman Sachs Keeps Criticizing Bitcoin  But There Are Certain Ties https://t.co/ens415j9Uu,0
Thu Mar 01 18:34:03 +0000 2018,#Cryptocurrency #bitcoin is all the craze right now! 💵 Interested in #investing but not sure where to begin? 🤔 Here… https://t.co/7OtiWkCZq8,0
Thu Mar 01 18:29:26 +0000 2018,@S_Mikhailovich You know you want to say bitcoin. https://t.co/nhDOywPjKJ,0
Thu Mar 01 18:12:11 +0000 2018,CRYPTO INSIDER: Overstock stocks up with $100 million ICO https://t.co/nAmTwroW4e,0
Thu Mar 01 18:06:31 +0000 2018,We were asked for a bitcoin address to send donations (I am known to space on obvious stuff sometimes) here it is:… https://t.co/fh7dzWYM6c,3
Thu Mar 01 18:02:24 +0000 2018,I hope everyone is holding onto all those thoughts and prayers they’ve been given. They may be worth something some… https://t.co/gMzDmKmBQi,1
Thu Mar 01 17:57:21 +0000 2018,I hope everyone is holding onto all those thoughts and prayers they’ve been given. They may be worth something some… https://t.co/gMzDmKmBQi,1
Thu Mar 01 17:44:11 +0000 2018,Overwhelmingly positive stories like this now replace the endless bad news and #FUD #crypto endured in January. See… https://t.co/zS1TZ4k49G,0
Thu Mar 01 17:37:12 +0000 2018,CRYPTO INSIDER: Overstock stocks up with $100 million ICO https://t.co/XWDnZuGtIX,0
Thu Mar 01 17:37:12 +0000 2018,Square’s competitors are ‘stuck in the past’ when it comes to bitcoin payments (SQ) https://t.co/RwzrrTm9mG,0
Thu Mar 01 17:33:36 +0000 2018,9 Stocks to Buy Instead of Bitcoin $BTC.X $GBTC https://t.co/GIuGCLS4yF $CAT $LGND $PII $WLK $OMCL $HFC $BCC $CTRL $ABMD,0
Thu Mar 01 17:22:39 +0000 2018,Square’s competitors are ‘stuck in the past’ when it comes to bitcoin payments (SQ) https://t.co/s8QM8BiUUq,0
Thu Mar 01 17:22:38 +0000 2018,NFL superstar Richard Sherman is all-in on cryptocurrencies  but doesn’t think his grandmother should invest https://t.co/vpl3aLR1Vn,0
Thu Mar 01 17:20:28 +0000 2018,https://t.co/8S3RK8OhLN,0
Thu Mar 01 17:17:17 +0000 2018,Good things come with patience in #Bitcoin https://t.co/NUxHDvxX4b,0
Thu Mar 01 17:05:17 +0000 2018,Bitcoin bull Bill Miller says bubbles are ‘necessary to bring capital into the market’ https://t.co/OkxbcUfRxB… https://t.co/OITtchmIhb,0
Thu Mar 01 17:03:22 +0000 2018,A $1 trillion money manager is looking to put crypto into some of its portfolios https://t.co/3Kkdk9MnUY,0
Thu Mar 01 16:59:19 +0000 2018,The ongoing cryptocurrency hype could be a stark reminder of the dot-com days at the end of the last millennium:… https://t.co/uVedvfD4Ow,0
Thu Mar 01 16:53:16 +0000 2018,@sama Or how much #AI progress slowed by sysadmins running bitcoin miners simultaneously with your AI jobs for “ben… https://t.co/SnyHcdVSH6,0
Thu Mar 01 16:40:06 +0000 2018,Z Money “Bitcoin” Official Music Video Shot by @Lvtrtoinne https://t.co/IrqjWJf8mo via @YouTube INEED THIS SHIT ON SOUNDCLOUD,0
Thu Mar 01 16:21:13 +0000 2018,Bitcoin:  Litecoin Booms in February But ‘Golden’ Crypto Takes Price Podium https://t.co/SJullmSDib https://t.co/3SRCl75J2m,7
Thu Mar 01 16:16:39 +0000 2018,Built-in @ShapeShift_io integration  open source  multi-asset support -including all ERC20 tokens  and...  Edge wal… https://t.co/bH6rPdRRS5,135
Thu Mar 01 16:14:59 +0000 2018,Bitcoin:  Litecoin Booms in February But ‘Golden’ Crypto Takes Price Podium https://t.co/SJullmSDib https://t.co/3SRCl75J2m,7
Thu Mar 01 16:14:31 +0000 2018,Scale Your Business With Bitcoin: Is your business Bitcoin-Friendly? If you're not yet accepting Bitcoin payments i… https://t.co/DzVGTg73MG,0
Thu Mar 01 16:03:45 +0000 2018,As society progresses down the #Bitcoin rabbit hole they have to realize an important fact:   The first several hun… https://t.co/SECcfSIZG3,0
Thu Mar 01 15:56:27 +0000 2018,Bitcoin:  Payment Provider Fleetcor to Pilot Ripple's XRP Cryptocurrency https://t.co/hqb4CG0Zcq https://t.co/jSX7mzhQvx,6
Thu Mar 01 15:52:00 +0000 2018,How To Spend Bitcoin in Local Stores With Debit Card @Denaro_io https://t.co/LDPn2kqQNI @TechBullion #Blockchain… https://t.co/FHVYuzgqUk,0
Thu Mar 01 15:52:00 +0000 2018,How To Spend Bitcoin in Local Stores With Debit Card @Denaro_io https://t.co/LDPn2k9fp8 @TechBullion #Blockchain… https://t.co/WEsl95EIA3,0
Thu Mar 01 15:45:46 +0000 2018,How do we get rid of these bears my shibes??? 😠🐻🐕🐕🐕 grrr #cryptomemes #makeitraincrypto #bitcoin… https://t.co/uFGBZ20lMQ,0
Thu Mar 01 15:25:29 +0000 2018,@Altcoinbuzzio 13 Bitcoin Ethereum  Litecoin Ripple Power Ledger Verge Lunyr Simple Token Ethos Wabi TRON Gifto Nuls,0
Thu Mar 01 15:20:46 +0000 2018,Las Vegas strip club now accepting Bitcoin https://t.co/pRixLWEmku https://t.co/FPSfqj5TxS,7
Thu Mar 01 14:37:00 +0000 2018,Las Vegas strip club now accepting Bitcoin https://t.co/pRixLWEmku https://t.co/FPSfqj5TxS,7
Thu Mar 01 14:31:41 +0000 2018,Aitheon at the Miami Bitcoin Conference #AitheonPowered #Ai https://t.co/1XFEDWCfLT by #ashaisbtc,2
Thu Mar 01 13:58:19 +0000 2018,Las Vegas strip club now accepting Bitcoin https://t.co/LdoZG77oNc,0
Thu Mar 01 13:47:36 +0000 2018,Las Vegas strip club now accepting Bitcoin https://t.co/pRixLWEmku https://t.co/FPSfqj5TxS,7
Thu Mar 01 13:43:11 +0000 2018,Las Vegas strip club now accepting Bitcoin https://t.co/pRixLWEmku https://t.co/FPSfqj5TxS,7
Thu Mar 01 13:41:34 +0000 2018,Bitcoin:  Payment Provider Fleetcor to Pilot Ripple's XRP Cryptocurrency https://t.co/hqb4CG0Zcq https://t.co/jSX7mzhQvx,6
Thu Mar 01 13:40:36 +0000 2018,Las Vegas strip club now accepting Bitcoin https://t.co/pRixLWEmku https://t.co/FPSfqj5TxS,7
Thu Mar 01 13:40:00 +0000 2018,Las Vegas strip club now accepting Bitcoin https://t.co/pRixLWEmku https://t.co/FPSfqj5TxS,7
Thu Mar 01 13:17:55 +0000 2018,Bitcoin:  Payment Provider Fleetcor to Pilot Ripple's XRP Cryptocurrency https://t.co/hqb4CG0Zcq https://t.co/jSX7mzhQvx,6
Thu Mar 01 12:50:35 +0000 2018,#IPSX #Crypto #Blockchain #Crowdfunding #ether #ethereum #bitcoin #cryptocurrency #ICO #tokensale #exchange https://t.co/cFoH8NJN3u,0
Thu Mar 01 12:08:11 +0000 2018,Steve Wozniak is a Bitcoin Scam Victim  Lost 7 Bitcoins Worth $75 000 | Finance Magnates https://t.co/ySzIjtvYv8,0
Thu Mar 01 12:04:26 +0000 2018,#IPSX #Crypto #Blockchain #Crowdfunding #ether #ethereum #bitcoin #cryptocurrency #ICO #tokensale #exchange https://t.co/7Rt7EpNm2b,0
Thu Mar 01 12:00:20 +0000 2018,The latest #bitcoin price is $10 663.28. Price is up from $10 314.99.,0
Thu Mar 01 11:58:23 +0000 2018,I liked a @YouTube video https://t.co/JACm2sarUQ Reacting to RiceGum "Bitcoin" OFFICIAL MUSIC VIDEO (Bhad Bhabie Diss),0
Thu Mar 01 11:42:37 +0000 2018,Bitcoin:  Banking Giants Send $30 Million in Securities over DLT Platform https://t.co/EYY4cYl3jJ https://t.co/TV59FbwtWk,4
Thu Mar 01 11:16:06 +0000 2018,Bitcoin:  Banking Giants Send $30 Million in Securities over DLT Platform https://t.co/EYY4cYl3jJ https://t.co/TV59FbwtWk,4
Thu Mar 01 11:14:58 +0000 2018,More You can now find the Obizcoin Whitepaper translated into the following languages: Indonesian  Russian  Spanish… https://t.co/tz5ya1C4JX,1
Thu Mar 01 11:12:09 +0000 2018,More You can now find the Obizcoin Whitepaper translated into the following languages: Indonesian  Russian  Spanish… https://t.co/tz5ya1C4JX,1
Thu Mar 01 10:54:22 +0000 2018,#Thrive - Learn how to be part of a billion dollars business surfing the web !  #ICO #Startup #Blockchain… https://t.co/vlLCDWpGpz,0
Thu Mar 01 10:53:23 +0000 2018,Thrive's Public Sale starts on 10 March 2:00PM UTC  and official guide to participate in has been released. Check i… https://t.co/C1D4VfomWi,0
Thu Mar 01 10:52:40 +0000 2018,Bitcoin Cash $BCH price: $1286.02   We verified that Binance is accepting new users! 🤔 😊    ➡️… https://t.co/Vxz7wgutsl,0
Thu Mar 01 09:53:32 +0000 2018,Bitcoin:  Alibaba's T-Mall Is Moving Cross-Border E-Commerce to Blockchain https://t.co/QOW3UCft0O https://t.co/6LuuAyAfnZ,6
Thu Mar 01 09:50:13 +0000 2018,Lana Del Rey new song is called Bitcoin Baby?,0
Thu Mar 01 09:45:24 +0000 2018,#IPSX #Crypto #Blockchain #Crowdfunding #ether #ethereum #bitcoin #cryptocurrency #ICO #tokensale #exchange https://t.co/fwbKYI2q2S,0
Thu Mar 01 09:39:34 +0000 2018,Bitcoin:  AriseBank ICO Fraud Case May Ensnare Additional Parties https://t.co/gGKJVP9fDs https://t.co/tmxNfAuRF7,4
Thu Mar 01 09:04:56 +0000 2018,So using Bill Gates’ logic  every new technology is bad right??? 😂😂😂 #cryptomeme #bitcoin… https://t.co/LSRWkBb4lj,0
Thu Mar 01 08:58:01 +0000 2018,Bitcoin:  Alibaba's T-Mall Is Moving Cross-Border E-Commerce to Blockchain https://t.co/QOW3UCft0O https://t.co/6LuuAyAfnZ,6
Thu Mar 01 08:16:01 +0000 2018,#IPSX #Crypto #Blockchain #Crowdfunding #ether #ethereum #bitcoin #cryptocurrency #ICO #tokensale #exchange https://t.co/Isrhq5LtbO,0
