Thu Nov 08 12:49:15 +0000 2018,Cardano $ADA price: $0.077965   We verified that Binance is accepting new users! 💸 💎    ➡️ https://t.co/8bxd1YvcGR… https://t.co/h4rIB8UZao,0
Thu Nov 08 09:17:50 +0000 2018,Join and Invest on this ICO  don't miss this big opportunity and become a great supporter of the best project in cr… https://t.co/PCAf4R9Spy,2
Thu Nov 08 09:14:18 +0000 2018,Join and Invest on this ICO  don't miss this big opportunity and become a great supporter of the best project in cr… https://t.co/PCAf4R9Spy,2
Thu Nov 08 09:12:25 +0000 2018,Join and Invest on this ICO  don't miss this big opportunity and become a great supporter of the best project in cr… https://t.co/PCAf4R9Spy,2
Thu Nov 08 09:07:09 +0000 2018,Participate at #ICO to get many benefits with this project  cause its developed by very professional team.… https://t.co/AUbSLLWasu,0
Thu Nov 08 08:09:30 +0000 2018,As we know that there is a huge number of projects  I would like to highlight this one  as participating in it  the… https://t.co/yoGsF6rqWu,0
Thu Nov 08 07:01:46 +0000 2018,Ethereum $ETH price: $213.50   Binance registration is ONLINE! We JUST checked! 🤔 😊    ➡️ https://t.co/8bxd1YvcGR… https://t.co/2xrz71LIDR,0
Thu Nov 08 00:01:55 +0000 2018,Join us as a fund manager https://t.co/hMIonFeyc0 and start trading $ETH $ABT $AE $APPC $BAT $BBO $BLZ $ELEC $ELF… https://t.co/3gewQ117S7,0
