Sat Oct 27 23:37:00 +0000 2018,AcceptS 17 different major cryptocurrencies! Email  info@omg.golf for details!   #TRON  #BITCOIN #ETH   Shopping &amp;… https://t.co/1wnDreotkO,10
Sat Oct 27 20:52:55 +0000 2018,Hey  check this out: [Is Ethereum (ETH) In The Middle Of A Bear Trend? - Crypto Daily™] (via Quarry app) https://t.co/z3tEXntdqX,0
Sat Oct 27 16:23:00 +0000 2018,An amazing song cover of SZA x Garden ( Acapella cover )[Revised]    from a very talented Song artist Eth an @ethqn… https://t.co/PbT2i5THmS,0
Sat Oct 27 08:57:48 +0000 2018,I'm inspired! A very seriYous approach to implementation. A team with highly qualified specialists. Success is immi… https://t.co/qBEBcUlAnv,0
Sat Oct 27 08:33:58 +0000 2018,Powering decentralized #blockchain LESFEX EXCHANGE sharing networks. This is undoubtedly the most excellent project… https://t.co/fIeEkDTcvY,0
Sat Oct 27 08:20:33 +0000 2018,Excellent thoughtful and balanced project soon everything.Great technical solution  great team. Success is imminent… https://t.co/TSxlKiGI83,0
Sat Oct 27 07:45:00 +0000 2018,FINANCEX EXCHANGEis new amazing and very promising project  that will soon give you a huge profit. Do not lose time… https://t.co/M2zi8Egv4v,0
Sat Oct 27 07:43:45 +0000 2018,The project is close to completion!Have time to invest! #FINANCEX #FNX #cryptocurrency #ICO #blockchain #tokensale… https://t.co/1468Si9YUT,0
Sat Oct 27 06:33:51 +0000 2018,#ExcaliburOS #XOS #ETH and link https://t.co/DgZnVkgdAR,0
Sat Oct 27 06:33:45 +0000 2018,#ExcaliburOS #XOS #ETH and link https://t.co/tR4WqIvuXg,0
Sat Oct 27 05:56:43 +0000 2018,#ICO #Blockchain #Ethereum #ETH #SmartContract #Crowdsale #Daico #Cryptotrader #LOLIGO https://t.co/cr2xqB1aBb,0
Sat Oct 27 05:56:37 +0000 2018,#ICO #Blockchain #Ethereum #ETH #SmartContract #Crowdsale #Daico #Cryptotrader #LOLIGO https://t.co/XyGUC0DZ4R,0
Sat Oct 27 01:31:43 +0000 2018,Our team is looking for #crypto and #blockchain projects that are seeking #funding. Please email us @ execusmmary@p… https://t.co/WFFysJQHZp,2
Sat Oct 27 00:51:23 +0000 2018,Our team is looking for #crypto and #blockchain projects that are seeking #funding. Please email us @ execusmmary@p… https://t.co/WFFysJQHZp,2
Sat Oct 27 00:50:02 +0000 2018,@BigMikD1 Ive been posting for a year. I slowed down . I think everyone got tired of hearing about btc/ltc/dgb/eth/etc  Lol,0
Sat Oct 27 00:47:07 +0000 2018,Our team is looking for #crypto and #blockchain projects that are seeking #funding. Please email us @ execusmmary@p… https://t.co/WFFysJQHZp,2
