Tue May 29 21:22:21 +0000 2018,@ProfFaustus Appears SEC is looking at Howey to help define security class for crypto. Has anyone from BCH camp met… https://t.co/Yv3Hh9HLYP,0
Tue May 29 20:22:00 +0000 2018,Amazon Eyes Ethereum (ETH)  Partners With ConsenSys To Simplify Blockchain Access https://t.co/Tzm7snunBQ… https://t.co/fDcfL2EoG7,1
Tue May 29 19:30:10 +0000 2018,Who wants free coins? click here and sign up today https://t.co/MdJwzz0Xs8 #crypticcoin  #tokens  #airdrops  $BTC … https://t.co/HGNVTUUR46,0
Tue May 29 19:28:42 +0000 2018,I little Ethereum Smart Contract info #cryptocurrencies #bitcoin #ethereum #btc #litecoin #ltc #eth #binance… https://t.co/VtD2JcqJtH,0
Tue May 29 19:02:06 +0000 2018,PERUGIA  PG   ITALY  Zenoteca Wine Bar  #acceptslitecoin  #acceptscrypto  14  Via Prospero Podiani  06121… https://t.co/txTN3bp92H,18
Tue May 29 19:00:19 +0000 2018,Check out your favorite #crypto on #TokenTalk https://t.co/Ssc8OYLFwv $LTC  $ETH  $DASH  $BTC  #ICO  #TGE,0
Tue May 29 19:00:13 +0000 2018,Get a live quote on $BTC  $ETH and $LTC https://t.co/Ssc8OYLFwv #ICO  #TokenTalk  #Bitcoin  #Litecoin  #Ether,0
Tue May 29 18:00:28 +0000 2018,#TokenTalk (https://t.co/5eKi0FOJIe) can help you with your #ICO https://t.co/GfFHxmcKnu $BTC  $LTC  $ETH  #Bitcoin  #Litecoin  #ethereum,0
Tue May 29 17:14:25 +0000 2018,@rhyssaxton602 @justicemate @alansilbert @ryanxcharles ETC fans wouldn't want to be referred to as Ethereum as they… https://t.co/UZyToG8mHQ,1
Tue May 29 17:09:43 +0000 2018,https://t.co/JmJ8LrXMMq   #CRYDE #CRD #ICO #Tokensale #ETH #BTC #LTC #WinYourDreamCar #CryptoCarRaffle https://t.co/4DifNF4MRv,0
Tue May 29 16:30:25 +0000 2018,PERUGIA  PG   ITALY  Zenoteca Wine Bar  #acceptslitecoin  #acceptscrypto  14  Via Prospero Podiani  06121… https://t.co/txTN3bp92H,18
Tue May 29 16:25:16 +0000 2018,the future and proven in MB8Coin's success to be the top 10 best ICO in market market #MB8Coin #ICO #BTC #ETH #Youtube,0
Tue May 29 16:00:33 +0000 2018,Move your #CryptoMining operation to #Quebec with https://t.co/NtCFoxAFEA #XMining  #crypto  #China  #Shanghai  #HongKong  $BTC  $ETH  $LTC,0
Tue May 29 15:21:30 +0000 2018,$AION $ETH   https://t.co/7IuzJ7onXT,0
Tue May 29 15:11:18 +0000 2018,PERUGIA  PG   ITALY  Zenoteca Wine Bar  #acceptslitecoin  #acceptscrypto  14  Via Prospero Podiani  06121… https://t.co/txTN3bp92H,18
Tue May 29 15:06:33 +0000 2018,This fantastic chance to be involved in the success and growth of MB8 Coin by purchasing the tokens at a fraction o… https://t.co/4BIRQhFsJG,0
Tue May 29 14:30:07 +0000 2018,Click here and follow the next big #ICO success story https://t.co/tXIuM4TdC9 #tokentalk  $BTC  $LTC  $ETH,0
Tue May 29 13:59:56 +0000 2018,This is ANOTHER HUGE company now #acceptinglitecoin. Just imagine 2 years from now . .....😎😎❤😎😎❤😎😎    #litecoin  … https://t.co/TA47DwbdGc,69
Tue May 29 13:25:11 +0000 2018,Crypto space moves too fast for a one man animation team. 3 weeks for one video. Content = King. Focusing on the wr… https://t.co/uM6aom6GSi,0
Tue May 29 10:57:19 +0000 2018,Are we starting to witness pump for news? If yes  That is positive for #crypto and months of darkness is over… https://t.co/TkgWHIxwi0,0
Tue May 29 08:37:07 +0000 2018,The project is interesting! I tell everyone about You and friends it is very interesting. Join now..#ETH #Blockchain #movi #movitoken,0
Tue May 29 08:33:39 +0000 2018,#Monoreto #ETH I like their product  and I want to give a thanks to all team for the creative idea that has attract… https://t.co/PG50RIdgHh,0
Tue May 29 08:29:40 +0000 2018,#ICO #Crowdsale #Bitcoin #Blockchain #Token #ETH #Ethereum #TokenSale https://t.co/yGpYEn6AvD,0
Tue May 29 08:18:48 +0000 2018,Hi  the project is very good and interesting  the total supply for bounty is also very much  a very promising proje… https://t.co/NRGtZy5Uwq,0
Tue May 29 08:04:15 +0000 2018,VOLT has collected and analyzed variable informaon  including distance  region  date  holidays and weather  for the… https://t.co/GG5noHLTGe,31
Tue May 29 07:55:59 +0000 2018,#ico #volt #volttech #eth https://t.co/4hyLu2jo0u,0
Tue May 29 02:30:12 +0000 2018,#Chinese #CryptoMining companies are coming to #Canada https://t.co/COCkNDKjBA $BTC  $ETH  $LTC  $NEO  $EOS  #Crypto  #Beijing  #Shanghai,0
Tue May 29 01:30:15 +0000 2018,This is a great buy/sell signal service for $BTC  $LTC and $ETH trades - check out this free trial https://t.co/QabacIJuRL,0
Tue May 29 00:02:10 +0000 2018,Join other satisfied #potcoin buyers by clicking here https://t.co/quwMknekRr #cannabis  #weed  #weedfeed  $ETH … https://t.co/sQL5a57l0y,0
