Mon May 28 21:40:59 +0000 2018,What's that you see? It's all your BCH that now appears in your #ios wallet. Take control of your financial future and #beyourownbank today.,0
Mon May 28 21:02:09 +0000 2018,BCH meanwhile has 12% hashrate of BTC while some exchanges credit BCH deposits after 1 conf. This is terribly dange… https://t.co/jABpBXBwTz,51
Mon May 28 20:05:02 +0000 2018,みんなのビットコインキャッシュ(bch) の予想          △上げ予想82%  ▼下げ予想18%  #仮想通貨 #bchjpy #bch #bitcoinchash #ビットコインキャッシュ  仮想通貨予想アプリ… https://t.co/5jlejQo0jb,0
Mon May 28 16:05:03 +0000 2018,みんなのビットコインキャッシュ(bch) の予想          △上げ予想81%  ▼下げ予想19%  #仮想通貨 #bchjpy #bch #bitcoinchash #ビットコインキャッシュ  仮想通貨予想アプリ… https://t.co/dKwSZsbAM0,0
Mon May 28 15:38:53 +0000 2018,Cryptocurrency Price Technical Analysis: Bitcoin Cash (BCH)  Litecoin (LTC) and Ripple (XRP) News Today https://t.co/skvVrWzzWe,0
Mon May 28 15:33:21 +0000 2018,Bitcoin Cash crazy price spikes https://t.co/b3YWfemHsU #blockchain #bitcoin #btc #bitcoin_gold #btg #bitcoin_cash… https://t.co/ywmS3E48tp,3
Mon May 28 12:46:56 +0000 2018,@TeamWinnaar @cryptolomeus @SamouraiWallet @anambroid That's gotta be 1 BTC + 7.77 BCH. If anyone would take the be… https://t.co/dX698q20km,0
Mon May 28 10:05:03 +0000 2018,みんなのビットコインキャッシュ(bch) の予想          △上げ予想35%  ▼下げ予想65%  #仮想通貨 #bchjpy #bch #bitcoinchash #ビットコインキャッシュ  仮想通貨予想アプリ… https://t.co/HG9yFEX9EB,0
Mon May 28 07:55:17 +0000 2018,#freetoken #crypto #altcoin #bitcoin #ethereum #ERC20 #BTC #ETH #LTC #XVG #TRX #ADA #XRP #BCH #EOS #NEO #XLM https://t.co/q4dSw09TrZ,0
Mon May 28 06:23:21 +0000 2018,Use cases for re-enabled op codes | Yours  #BCH https://t.co/Yij8OBPu6h,0
Mon May 28 05:56:34 +0000 2018,accurate analysis of the current crypto market  https://t.co/dXdKBiCIst  #cryptocurrency #bitcoin $BTC $CIVIC $HOLO… https://t.co/XcssKnP8VG,0
Mon May 28 05:06:06 +0000 2018,@nishinokazu 下のほーにありましたw  BTC: 3FxVuKwTJyN7Q79soqjW48tkkL7CFWpC7s BCH: 1GAL9X3JcuNKsCPsSBRHERYgd2NR6HucSG ETH: 0x51… https://t.co/cQfjEZLXuL,0
Mon May 28 03:05:02 +0000 2018,みんなのビットコインキャッシュ(bch) の予想          △上げ予想39%  ▼下げ予想61%  #仮想通貨 #bchjpy #bch #bitcoinchash #ビットコインキャッシュ  仮想通貨予想アプリ… https://t.co/lOM7R4wdCY,0
