Tue Jun 19 21:50:05 +0000 2018,There will be a story out tomorrow  still working on it. https://t.co/8UNdUNPfdR,4
Tue Jun 19 21:45:00 +0000 2018,Your cheatbook to building stellar #TradeShow experiences from scratch. https://t.co/aEwXhaqeDM… https://t.co/QprZRRPdWK,0
Tue Jun 19 19:29:10 +0000 2018,Is anyone complaining to WWE about putting out everywhere about the NXT tag title change that doesn't air until nex… https://t.co/to2jT7OWnz,114
Tue Jun 19 18:24:57 +0000 2018,@rrhoover How do you figure? I use @pocketcasts and it's been absolutely stellar. Unless I'm missing something  doe… https://t.co/iKi3RG7WmK,0
Tue Jun 19 15:46:02 +0000 2018,Yes  it will. But there must be a payoff.   Writing Good Headlines Will Attract Audience Attention https://t.co/JtldJHd3g2,0
Tue Jun 19 00:19:39 +0000 2018,This past weekend was the stuff dreams are made of... multiple successful community events  a stellar comedy show f… https://t.co/pEfSCQ8laK,0
