Tue Dec 18 22:12:08 +0000 2018,#flashbackfriday . two years ago when I #attended the #first ever #fintech #conference held by #SEC in #DC there wa… https://t.co/x1MocTbljC,12
Tue Dec 18 21:00:37 +0000 2018,Before you get together with family over the holidays  prepare yourself to talk about the hot topic of #Blockchain.… https://t.co/YbX7ENpTqD,0
Tue Dec 18 20:50:55 +0000 2018,Imagine a world where @RoadtoRoota and @clif_high have to pay cryptocurrency in order to post their scammy "analysi… https://t.co/pxOVO2yOcq,0
Tue Dec 18 20:44:01 +0000 2018,This is awesome...Atari (@atari) games on the blockchain via partnership with Animoca Brands (@animocabrands)… https://t.co/Je1lI7usBN,0
Tue Dec 18 18:37:22 +0000 2018,.@mikejcasey from @coindesk offers a differing perspective on the potential of cryptocurrency and blockchain techno… https://t.co/xUBjigxZwV,1
Tue Dec 18 18:05:35 +0000 2018,Facebook imposters are trying to swindle users out of bitcoin: https://t.co/g8xXz5Zt0f,0
Tue Dec 18 17:53:48 +0000 2018,Cryptocurrency promoter rains money on poor neighborhood #cryptocurrency https://t.co/Gaa1ExVB9j,0
Tue Dec 18 17:15:03 +0000 2018,Is #cryptocurrency taking off in Europe? Read about European consumers' opinion on #bitcoin and more. https://t.co/jsqZDyzxRY,0
Tue Dec 18 15:55:55 +0000 2018,From Beantown to wherever you call home  we hope you have a Happy Holidays. Thank you for your support as we work t… https://t.co/Adv6GH3cQT,0
Tue Dec 18 15:53:27 +0000 2018,.@mikejcasey from @coindesk offers a differing perspective on the potential of cryptocurrency and blockchain techno… https://t.co/xUBjigxZwV,1
Tue Dec 18 15:05:27 +0000 2018,"America Could Lead the Transition to a Digital Currency Reserve" by BRIAN BROOKS via NYT https://t.co/d63Ifb9NQ9… https://t.co/R2ozE9ObaI,0
Tue Dec 18 12:45:14 +0000 2018,Buy or sell $100 of digital currency or more  you will get $10 of free bitcoin. https://t.co/HovVtHEwOe #bitcoin… https://t.co/n8m27ycDdy,0
Tue Dec 18 10:56:03 +0000 2018,Watch our ICO Review Video for @TradePlaceEx the fastest token exchange on the market.  https://t.co/EYy72tmQdt… https://t.co/1ksh2JQgy2,18
Tue Dec 18 10:44:55 +0000 2018,Watch our ICO Review Video for @TradePlaceEx the fastest token exchange on the market.  https://t.co/EYy72tmQdt… https://t.co/1ksh2JQgy2,18
Tue Dec 18 08:32:05 +0000 2018,How to Diversify Your Crypto Portfolio (+ X Sample Portfolios): You are an investor. You take your cryptocurrency p… https://t.co/HnBnzqHxrS,3
Tue Dec 18 07:24:44 +0000 2018,The cryptocurrency-terrorism connection is too big to ignore https://t.co/ybGCVdBePW,0
Tue Dec 18 07:10:30 +0000 2018,Watch our ICO Review Video for @TradePlaceEx the fastest token exchange on the market.  https://t.co/EYy72tmQdt… https://t.co/1ksh2JQgy2,18
Tue Dec 18 05:48:50 +0000 2018,Watch our ICO Review Video for @TradePlaceEx the fastest token exchange on the market.  https://t.co/EYy72tmQdt… https://t.co/1ksh2JQgy2,18
Tue Dec 18 04:33:52 +0000 2018,BTI Report Revives Allegations of Crypto Wash Trades https://t.co/g37l7mu7vA https://t.co/TS5ctb7Ddl,1
Tue Dec 18 04:26:04 +0000 2018,BTI Report Revives Allegations of Crypto Wash Trades https://t.co/g37l7mu7vA https://t.co/TS5ctb7Ddl,1
Tue Dec 18 03:58:09 +0000 2018,Watch our ICO Review Video for @TradePlaceEx the fastest token exchange on the market.  https://t.co/EYy72tmQdt… https://t.co/1ksh2JQgy2,18
Tue Dec 18 02:33:38 +0000 2018,ht @Fisher85M Copy: @MikeQuindazzi @antgrasso  The #Blockchain Ecosystem Infographic [@evankirstel] MT #fintech… https://t.co/GFP1tHfnc9,2
Tue Dec 18 02:14:45 +0000 2018,ht @Fisher85M Copy: @MikeQuindazzi @antgrasso  The #Blockchain Ecosystem Infographic [@evankirstel] MT #fintech… https://t.co/GFP1tHfnc9,2
Tue Dec 18 02:13:41 +0000 2018,Cryptocurrency is like the Internet  I guess,0
Tue Dec 18 02:13:09 +0000 2018,ht @Fisher85M Copy: @MikeQuindazzi @antgrasso  The #Blockchain Ecosystem Infographic [@evankirstel] MT #fintech… https://t.co/GFP1tHfnc9,2
Tue Dec 18 01:27:33 +0000 2018,Cryptocurrency and vaping fuck https://t.co/eIhqLuHn20,0
Tue Dec 18 00:50:07 +0000 2018,"After threatening to drop below support at the $3000 level twice  for the first time in two weeks  Bitcoin showed… https://t.co/JPJAYsFiZ3,6
Tue Dec 18 00:17:31 +0000 2018,https://t.co/8NF5sY5aNC Lamborghinis  long lines welcome crypto fans at ‘Blockchain Week’ https://t.co/5Ro8aLF0wZ… https://t.co/IouSWP36ub,0
Tue Dec 18 00:14:10 +0000 2018,"After threatening to drop below support at the $3000 level twice  for the first time in two weeks  Bitcoin showed… https://t.co/JPJAYsFiZ3,6
