Fri Jun 29 21:55:51 +0000 2018,netTALK  the FIRST VoIP provider to accept cryptocurrency payments https://t.co/mpL4fHl5xB,0
Fri Jun 29 20:31:56 +0000 2018,Litecoin Price Analysis – June 29  https://t.co/2zLw34vNV2,0
Fri Jun 29 20:05:09 +0000 2018,Bitcoin  Ethereum  Ripple  Bitcoin Cash  EOS  Litecoin  Cardano  Stellar  IOTA  TRX: Price Analysis  June 29  https://t.co/EHZg5nfatK,0
Fri Jun 29 16:34:41 +0000 2018,Why Amazon Might Choose to Adopt Litecoin (LTC) #amazon #litecoin #ltc #cryptocurrency #cryptocurrencynews… https://t.co/LoDafj9gvp,1
Fri Jun 29 16:27:17 +0000 2018,Why Amazon Might Choose to Adopt Litecoin (LTC) #amazon #litecoin #ltc #cryptocurrency #cryptocurrencynews… https://t.co/LoDafj9gvp,1
Fri Jun 29 14:08:42 +0000 2018,The price of Litecoin is $73.19! https://t.co/zC83tpVGKQ   #Litecoin #LTC #BTC #Bitcoin,1
Fri Jun 29 14:02:43 +0000 2018,The price of Litecoin is $73.19! https://t.co/zC83tpVGKQ   #Litecoin #LTC #BTC #Bitcoin,1
Fri Jun 29 08:10:10 +0000 2018,Litecoin Price Analysis: LTC/USD Approaching $70  https://t.co/s4r48CgCDG,0
