Fri Aug 17 20:17:28 +0000 2018,Litecoin (LTC) Price Analysis – August 17  https://t.co/JocNW379gy,1
Fri Aug 17 20:05:06 +0000 2018,Litecoin (LTC) Price Analysis – August 17  https://t.co/JocNW379gy,1
Fri Aug 17 19:46:41 +0000 2018,Bitcoin  Ethereum  Ripple  Bitcoin Cash  EOS  Stellar  Litecoin  Cardano  Monero  ETC: Price Analysis  August 17… https://t.co/hEqtnod8d6,1
Fri Aug 17 19:45:43 +0000 2018,Bitcoin  Ethereum  Ripple  Bitcoin Cash  EOS  Stellar  Litecoin  Cardano  Monero  ETC: Price Analysis  August 17… https://t.co/hEqtnod8d6,1
Fri Aug 17 18:20:33 +0000 2018,Crypto Price Review: Bitcoin  Ethereum and Ripple Are Bullish; Bitcoin Cash and Litecoin Struggle… https://t.co/hueH25EDNm,0
Fri Aug 17 17:51:32 +0000 2018,#Crypto will take over the world the same way #SocialMedia did years ago and look at where we at now with #FB #IG… https://t.co/CtUQrDH7zd,0
Fri Aug 17 17:48:05 +0000 2018,Who is guilty of this?  #btc #bitcoin #eth  #ethereum  #ltc  #litecoin #hodl #cryptocurrency  #cryptotrading… https://t.co/5nZc9oTTOM,0
Fri Aug 17 05:40:10 +0000 2018,Litecoin Price Analysis: LTC/USD Preparing for Next Break  https://t.co/xmgqF7OqBT,0
