Wed Sep 20 22:16:47 +0000 2017,Texas brokerage closes state's first-ever bitcoin home purchase https://t.co/AcuCMqvokU https://t.co/X3uiVvlzWB,0
Wed Sep 20 22:08:13 +0000 2017,Bitcoin Rosh Hashanah  Bitcore crypto-dividend update  Fake Satoshi  broken 2x agreement  https://t.co/yqVAUtOtmz,1
Wed Sep 20 22:08:08 +0000 2017,Bitcoin Rosh Hashanah  Bitcore crypto-dividend update  Fake Satoshi  broken 2x agreement  https://t.co/yqVAUtOtmz,1
Wed Sep 20 21:47:37 +0000 2017,Bitcoin is likely to split again in November  say major players https://t.co/fNIx18XvgL via @technology,0
Wed Sep 20 21:15:44 +0000 2017,#yousayrealestate Texas brokerage closes state's first-ever bitcoin home purchase https://t.co/VSxXE1gkYU,0
Wed Sep 20 20:15:13 +0000 2017,Early #bitcoin investor explains what’s driving the ICO craze https://t.co/FxRNTY95NQ https://t.co/JSNIM5rkTE,0
Wed Sep 20 19:51:14 +0000 2017,FULCRUM is at the Aspen NEXUS Earth 2017 with video coverage this week! Announcements on #Bitcoin satellites  and #ETHEREUM. Stay tuned :),0
Wed Sep 20 18:37:35 +0000 2017,Bitcoin forks https://t.co/NgkJE8R1ly,0
Wed Sep 20 18:21:09 +0000 2017,China Bans Bitcoin Executives From Leaving the Country  Miners “Preparing for the Worst” https://t.co/zKqnVtrWoO,0
Wed Sep 20 17:55:08 +0000 2017,Banks Are Afraid of Bitcoin Says Wealth Advisor | https://t.co/JRNR5bH0vW | #Markets,0
Wed Sep 20 17:53:15 +0000 2017,First Bitcoin-Only Real Estate Transaction Completed in Texas https://t.co/KdBR0YW557 via @Cointelegraph,0
Wed Sep 20 17:44:36 +0000 2017,Australia Ends Double Taxation of Bitcoin  Cryptocurrencies https://t.co/JhJBWeHOtT via @Cointelegraph,2
Wed Sep 20 17:44:22 +0000 2017,Australia Ends Double Taxation of Bitcoin  Cryptocurrencies https://t.co/JhJBWeHOtT via @Cointelegraph,2
Wed Sep 20 17:40:05 +0000 2017,Big bitcoin-friendly companies like Microsoft and Expedia hedge their bet https://t.co/QL6FUxy9Vl via @YahooFinance,0
Wed Sep 20 16:38:46 +0000 2017,@RampCapitalLLC YES!! You can buy them with #bitcoin,0
Wed Sep 20 16:14:51 +0000 2017,New to #Bitcoin and open blockchains?  I have a playlist for you! https://t.co/gHgvkClQlX,1
Wed Sep 20 16:08:55 +0000 2017,New to #Bitcoin and open blockchains?  I have a playlist for you! https://t.co/gHgvkClQlX,1
Wed Sep 20 15:48:51 +0000 2017,Cryptocurrency Concentration - Just 4% Own Over 95% Of Bitcoin | Zero Hedge https://t.co/OSvF0ujBjp,0
Wed Sep 20 15:41:41 +0000 2017,#CryptoCurrency #Crypto #Bitcoin #Ripple #ETHEREUM #VirtualCurrency #Blockchain #BitcoinCash #BTC #ETH #Litecoin   https://t.co/5poEKj2NUH,0
Wed Sep 20 15:40:20 +0000 2017,After consolidating for three days  if Bitcoin breaks out of this resistance zone  we expect it to gain momentum on the upside.,1
Wed Sep 20 15:39:01 +0000 2017,After consolidating for three days  if Bitcoin breaks out of this resistance zone  we expect it to gain momentum on the upside.,1
Wed Sep 20 15:35:24 +0000 2017,Bitcoin  Ethereum  Bitcoin Cash  Ripple  Litecoin: Price Analysis  September 20 https://t.co/adhbzEfxZy via @Cointelegraph,0
Wed Sep 20 15:25:33 +0000 2017,@CRCapitalAdv I never said #bitcoin was suppressing metals.  Ever.  I do say bitcoin is a Ponzi,0
Wed Sep 20 15:22:11 +0000 2017,Could this be the day that I finally understand Bitcoin? @QLTechCon,0
Wed Sep 20 15:14:51 +0000 2017,Here’s How Hackers Can Hijack Your Online Bitcoin Wallets - https://t.co/GDtLfJuodN via @TheHackersNews,0
Wed Sep 20 15:12:59 +0000 2017,#yawn It's amusing to note that people are willing to sell or giveaway #bitcoin.  I don't see high profile sellers… https://t.co/7PEzqENKec,0
Wed Sep 20 15:06:19 +0000 2017,#bitcoin #blockchain #4IR https://t.co/5ku7XbslBD,0
Wed Sep 20 15:00:26 +0000 2017,How #Modern #Pirates talk: "This #torrent is too slow. I need more #seeders." "Do you take #bitcoin?" "I'm the… https://t.co/JpZxY6RiHc,0
Wed Sep 20 13:20:45 +0000 2017,@RampCapitalLLC I got a #bitcoin that says the Dow is up 50 by 10:00 a.m. EST,0
Wed Sep 20 11:52:07 +0000 2017,11 Percent of Americans Think Bitcoin is Illegal But Business | https://t.co/wsRdmeC34z | #Economy,0
Wed Sep 20 10:25:40 +0000 2017,Optimizing Segwit How Bitcoins New Software is Giving Scaling | https://t.co/xsXaBhuBS9 | #Bitcoin,0
Wed Sep 20 10:20:44 +0000 2017,Is Now The Time To Consider #Altcoins? https://t.co/g9pWHiaFnZ #Bitcoin #BTC #CryptoCurrency #Blockchain #Ethereum… https://t.co/q7uFjL1r3k,1
Wed Sep 20 10:02:16 +0000 2017,Is Now The Time To Consider #Altcoins? https://t.co/g9pWHiaFnZ #Bitcoin #BTC #CryptoCurrency #Blockchain #Ethereum… https://t.co/q7uFjL1r3k,1
Wed Sep 20 08:15:14 +0000 2017,US bank CEOs are likely ‘very afraid’ of #bitcoin  says wealth advisor https://t.co/7k84uBOkrt https://t.co/ydvQxsWzuf,0
Wed Sep 20 08:07:06 +0000 2017,Brokerage claims Texas’s first bitcoin home purchase https://t.co/5KGyXnu78f,0
Wed Sep 20 07:57:09 +0000 2017,Then I see these same channels post "Bitcoin Price Endures a Minor Correction  Drops to $3 950 as China Mining Ban Rumors Circulate",0
Wed Sep 20 07:56:14 +0000 2017,Out to them. Spread the word. #Bitcoin #Elevated #ChasingDreams But to my surprise I got a lot of responses from these media companies ---,0
Wed Sep 20 07:21:36 +0000 2017,@Ryan_Browne_ Why did you not include that @jpmorgan bought crypto's after Dimon bashing during alpha on your recent article? #bitcoin,0
Wed Sep 20 06:16:53 +0000 2017,@mattleising @Forbes @laurashin I was surprised by a couple of your defenses  though; Bitcoin transactions ALSO tak… https://t.co/IXCR1YvKye,0
Wed Sep 20 05:38:21 +0000 2017,'Bitcoin Jesus' sees the digital currency splitting again https://t.co/GCvADVKaDj via @technology,0
Wed Sep 20 04:57:10 +0000 2017,If you have questions about bitcoin ask them on /r/btc  /r/bitcoin will only give you a very biased view. #censored https://t.co/M3aU1T8ij3,1
Wed Sep 20 04:41:15 +0000 2017,Last year I took a cab to hotel $65 😣 Uber back to airport $30 😍 I love technology 🕳️ Bring on the #bitcoin ⚖️ https://t.co/YYzJuE9ziv,2
Wed Sep 20 04:38:40 +0000 2017,World’s Largest Central Bank Warns Not to Ignore the Bitcoin Trend https://t.co/wrQiR0RzG6 via @themerklenews,2
Wed Sep 20 04:22:50 +0000 2017,@IKE_DEVJI @ABAJournal You take bitcoin Ike?,0
Wed Sep 20 04:22:22 +0000 2017,Heres Why The Crackdown on Bitcoin In China is Not A Real Problem | https://t.co/SAecLxwyQX | #Finance https://t.co/JWjopS5lGZ,0
Wed Sep 20 04:18:46 +0000 2017,How #Bitcoin's decentralized record technology could exponentially impact today’s technology platforms @WestMonroe https://t.co/CcAt5lxTt3,1
Wed Sep 20 03:59:58 +0000 2017,World’s Largest Central Bank Warns Not to Ignore the Bitcoin Trend https://t.co/wrQiR0RzG6 via @themerklenews,2
Wed Sep 20 03:59:51 +0000 2017,World’s Largest Central Bank Warns Not to Ignore the Bitcoin Trend https://t.co/wrQiR0RzG6 via @themerklenews,2
Wed Sep 20 03:37:56 +0000 2017,Short Squeezes are part of my discussion at @TradeIdeas1 event Sunday October 1st https://t.co/Cx2pddQaE1 https://t.co/v0SBHtTclJ,30
Wed Sep 20 02:59:59 +0000 2017,@dahboo7 Wonder if this will be good for Bitcoin?,0
Wed Sep 20 02:41:09 +0000 2017,China's bitcoin clampdown is likely here to stay  analysts say https://t.co/VsgG8wVd2d,1
Wed Sep 20 02:37:47 +0000 2017,Excellent read: Every buyer of #bitcoin should read this. https://t.co/5R3CCEWpqo,0
Wed Sep 20 02:36:29 +0000 2017,What Jamie Dimon Is Missing About Bitcoin https://t.co/X3hYze1gbD,1
Wed Sep 20 02:28:08 +0000 2017,What Jamie Dimon Is Missing About Bitcoin https://t.co/X3hYze1gbD,1
Wed Sep 20 01:35:14 +0000 2017,On the bright side  I learned how to use bitcoin. Apparently you can only buy a baby cheetah in bitcoin,0
Wed Sep 20 00:18:05 +0000 2017,Hype. Bubble. The price of bitcoin has a 91% correlation with Google searches for bitcoin https://t.co/kMeEuXeI6U via @clusterstock,0
Wed Sep 20 00:08:52 +0000 2017,China's bitcoin clampdown is likely here to stay  analysts say https://t.co/VsgG8wVd2d,1
