Tue Aug 29 22:48:14 +0000 2017,A fascinating conversation with @cboe about @Bitcoin futures: https://t.co/4zlzQ2oHGG #cryptocurrencies,0
Tue Aug 29 22:35:18 +0000 2017,Look what showed up in the mail box.  #bitcoin #blockchains #fortuneMagazine via @JoeManzanares https://t.co/V3XYdiWvuv,0
Tue Aug 29 21:42:45 +0000 2017,Bitcoin cash hit a low of $559.61  its lowest since Aug. 18  before recovering to around $575  according to... https://t.co/4ArxsMwYq0,0
Tue Aug 29 21:40:30 +0000 2017,Bitcoin jumps nearly 70% for August to record high  offshoot 'bitcoin cash' falls to more than one-week low https://t.co/Ea7FFRa2FK,1
Tue Aug 29 21:40:25 +0000 2017,Bitcoin jumps nearly 70% for August to record high  offshoot 'bitcoin cash' falls to more than one-week low https://t.co/Ea7FFRa2FK,1
Tue Aug 29 20:45:24 +0000 2017,Bless the soul of the #bitcoin baby.... Paid!!!!!! #btc https://t.co/UljZt0WA59,4
Tue Aug 29 20:36:20 +0000 2017,Bless the soul of the #bitcoin baby.... Paid!!!!!! #btc https://t.co/UljZt0WA59,4
Tue Aug 29 20:35:28 +0000 2017,Bless the soul of the #bitcoin baby.... Paid!!!!!! #btc https://t.co/UljZt0WA59,4
Tue Aug 29 20:34:35 +0000 2017,Bless the soul of the #bitcoin baby.... Paid!!!!!! #btc https://t.co/UljZt0WA59,4
Tue Aug 29 20:20:01 +0000 2017,@PickUpTrucksFan @VedEnvy @funder bitcoin,0
Tue Aug 29 20:10:30 +0000 2017,Is Harvey driving #bitcoin and other #cryptocurrencies higher? https://t.co/Xk3aUxZGLr via @Joe Manzanares,0
Tue Aug 29 20:01:48 +0000 2017,Bitcoin's Epic Rise Leaves Late-1990s Tech Bubble in the Dust https://t.co/lvzxk9tsiC,0
Tue Aug 29 19:41:49 +0000 2017,Bitcoin's epic rise leaves late-1990s tech bubble in the dust https://t.co/Gyy4BNLh1s via @technology,0
Tue Aug 29 19:40:50 +0000 2017,Bitcoin sets a record at $4 700 as North Korea fires rockets over Japan https://t.co/8ECohSwIsF via @qz,1
Tue Aug 29 19:40:43 +0000 2017,Bitcoin sets a record at $4 700 as North Korea fires rockets over Japan https://t.co/8ECohSwIsF via @qz,1
Tue Aug 29 19:39:50 +0000 2017,The #Bitcoin Band https://t.co/pP76RokFcP via @YouTube,0
Tue Aug 29 19:37:29 +0000 2017,Bitcoin Does It Again New Record High Over 4 700 | https://t.co/B9eCgxtyNu | #FutureSociety,0
Tue Aug 29 19:30:03 +0000 2017,Ronnie Moas Predicts Bitcoin Will Hit $20 000 Within Three Years https://t.co/9phLjMtrsl via @Cointelegraph,1
Tue Aug 29 19:29:57 +0000 2017,Ronnie Moas Predicts Bitcoin Will Hit $20 000 Within Three Years https://t.co/9phLjMtrsl via @Cointelegraph,1
Tue Aug 29 18:51:30 +0000 2017,As bitcoin and rivals surge  so too have complaints to the CFPB  https://t.co/XRzDNpYbgn,1
Tue Aug 29 18:51:26 +0000 2017,As bitcoin and rivals surge  so too have complaints to the CFPB  https://t.co/XRzDNpYbgn,1
Tue Aug 29 18:37:42 +0000 2017,I'm bearish on Bitcoin but this is a terrible chart. % change is so dependent on where you set the baseline. https://t.co/ZbDV2MElb4,0
Tue Aug 29 18:24:27 +0000 2017,New David Seaman Podcast on The Rothschilds https://t.co/xok6S6SqU4 #bitcoin #ClintonCrimes #podcast #rothschild,10
Tue Aug 29 18:03:07 +0000 2017,Coinify Merchants Can Now Accept Bitcoin Cash - https://t.co/x6iuO6Q1SU,1
Tue Aug 29 18:02:48 +0000 2017,Coinify Merchants Can Now Accept Bitcoin Cash - https://t.co/x6iuO6Q1SU,1
Tue Aug 29 17:56:53 +0000 2017,Bitcoin Price Breaks Through $4 700  Showing Sustained Interest In Crypto via @forbes https://t.co/3pBdWdicbd,1
Tue Aug 29 17:56:49 +0000 2017,Bitcoin Price Breaks Through $4 700  Showing Sustained Interest In Crypto via @forbes https://t.co/3pBdWdicbd,1
Tue Aug 29 17:54:23 +0000 2017,Bitcoin  Ethereum  Bitcoin Cash  Ripple  Litecoin: Price Analysis  August 29 https://t.co/1WG7YMRIqS via @Cointelegraph,1
Tue Aug 29 17:54:22 +0000 2017,Bitcoin  Ethereum  Bitcoin Cash  Ripple  Litecoin: Price Analysis  August 29 https://t.co/1WG7YMRIqS via @Cointelegraph,1
Tue Aug 29 17:52:27 +0000 2017,How do I keep up on bitcoin https://t.co/s1VkostONg,1
Tue Aug 29 17:52:23 +0000 2017,How do I keep up on bitcoin https://t.co/s1VkostONg,1
Tue Aug 29 17:42:44 +0000 2017,Liquidated bitcoin for best buy gift card instantly!  https://t.co/FZThttBgDY @ UPS https://t.co/th3a9iTEVW,0
Tue Aug 29 17:40:31 +0000 2017,Danish Saxo Bank Bitcoin ETN may be safest cryptocurrency investment https://t.co/2LqFXsDYMj via @TheStreet,0
Tue Aug 29 17:30:18 +0000 2017,FORTUNE Cover Story: Bitcoin &amp; Ethereum https://t.co/MgX0VzIvJO #bitcoin #ETHEREUM #fortune #news,6
Tue Aug 29 16:58:22 +0000 2017,Did someone come online who could now sell there bitcash and is moving into bitcoin? Could explain recent moves in… https://t.co/yWaXFJVa93,1
Tue Aug 29 16:58:17 +0000 2017,Did someone come online who could now sell there bitcash and is moving into bitcoin? Could explain recent moves in… https://t.co/yWaXFJVa93,1
Tue Aug 29 16:51:46 +0000 2017,Criminals dropping #bitcoin in favor of other digital currencies that are harder for law enforcement to use in trac… https://t.co/pzWmU8BhKh,0
Tue Aug 29 16:41:01 +0000 2017,Dark web finds bitcoin increasingly more of a problem than a help  tries other digital currencies https://t.co/U415VoPChM,0
Tue Aug 29 16:40:22 +0000 2017,Dark web finds bitcoin increasingly more of a problem than a help  tries other digital currencies https://t.co/1RCM774iD2,1
Tue Aug 29 16:40:21 +0000 2017,Dark web finds bitcoin increasingly more of a problem than a help  tries other digital currencies https://t.co/1RCM774iD2,1
Tue Aug 29 16:36:20 +0000 2017,I liked a @YouTube video https://t.co/3z6gZpdlDg Banking On Bitcoin,0
Tue Aug 29 16:33:40 +0000 2017,Banking On Bitcoin https://t.co/vALgdpHCck,1
Tue Aug 29 16:29:56 +0000 2017,In five years  people are going to kick themselves for not doubling up on both bitcoin &amp; bitcash 👍Don't let hindsit… https://t.co/AjsoTmBT7a,1
Tue Aug 29 16:29:42 +0000 2017,In five years  people are going to kick themselves for not doubling up on both bitcoin &amp; bitcash 👍Don't let hindsit… https://t.co/AjsoTmBT7a,1
Tue Aug 29 16:27:40 +0000 2017,#Healthcare #blockchain #cryptocurrency #TokenSale,131
Tue Aug 29 16:21:07 +0000 2017,Shocked by the devastation of #HurricaneHarvey and looking to help? You can donate #bitcoin for relief efforts: https://t.co/DkutdXtBu7,0
Tue Aug 29 16:19:15 +0000 2017,Bitcoin Hits A Record High Above 4 600 | https://t.co/WaVkGZSroz | #Finance https://t.co/m6NukRSupM,0
Tue Aug 29 16:15:13 +0000 2017,Dark web finds #bitcoin increasingly more of a problem than a help  tries other… https://t.co/OBAAmtZ7lL https://t.co/JRP98FIvzC,1
Tue Aug 29 16:14:24 +0000 2017,Why Bitcoin Matters https://t.co/YEJg4i3jhv,0
Tue Aug 29 16:13:18 +0000 2017,Why Bitcoin Matters https://t.co/VTNq8xFcyK via @dealbook,0
Tue Aug 29 16:09:41 +0000 2017,What is bitcoin and how much is it worth? https://t.co/JWsr05bBjc via @MetroUK,1
Tue Aug 29 16:09:37 +0000 2017,What is bitcoin and how much is it worth? https://t.co/JWsr05bBjc via @MetroUK,1
Tue Aug 29 16:08:59 +0000 2017,Is Bitcoin the New Gold? https://t.co/qRhQuqpxS4 via @TheStreet,1
Tue Aug 29 16:08:52 +0000 2017,Is Bitcoin the New Gold? https://t.co/qRhQuqpxS4 via @TheStreet,1
Tue Aug 29 16:02:36 +0000 2017,Bitcoin  Blockchain Splits And What It Means For Business via @forbes https://t.co/9bbkx13uWE,1
Tue Aug 29 16:01:52 +0000 2017,Bitcoin  Blockchain Splits And What It Means For Business via @forbes https://t.co/9bbkx13uWE,1
Tue Aug 29 16:01:35 +0000 2017,Would you like to be able to buy my courses &amp; tools with Bitcoin or Ethereum? I'm currently considering it if... https://t.co/ZpUhPHgCxN,0
Tue Aug 29 16:00:49 +0000 2017,Why Wall Street is going to start mining BitCoin and Bit Cash Money to be made Banks next?    https://t.co/YCrnfthDLV via @mashable,1
Tue Aug 29 16:00:44 +0000 2017,Why Wall Street is going to start mining BitCoin and Bit Cash Money to be made Banks next?    https://t.co/YCrnfthDLV via @mashable,1
Tue Aug 29 16:00:34 +0000 2017,Dark Web Fight Intensifies as Bitcoin's Value Jumps https://t.co/jNomd2jDdM,0
Tue Aug 29 15:52:08 +0000 2017,Bank of Mexico Governor: Bitcoin More Commodity Than Currency https://t.co/n8NKWoKQh2 via @CoinDesk,0
Tue Aug 29 15:51:13 +0000 2017,SegWit's Slow Rollout: Why Bitcoin's Capacity Hasn't Seen a Sudden Boost https://t.co/yQFwAlgE5n via @CoinDesk,0
Tue Aug 29 15:50:15 +0000 2017,Still Don't Get Bitcoin? Here's an Explanation For Five-Year-Olds https://t.co/vFwBzecCAx,0
Tue Aug 29 15:49:35 +0000 2017,Still Don't Get Bitcoin? Here's an Explanation Even a Five-Year-Old Will Understand https://t.co/Uqwq3wqRce via @CoinDesk,1
Tue Aug 29 15:49:33 +0000 2017,Still Don't Get Bitcoin? Here's an Explanation Even a Five-Year-Old Will Understand https://t.co/Uqwq3wqRce via @CoinDesk,1
Tue Aug 29 15:36:41 +0000 2017,Russian govt wants to protect public from bitcoin trading as it resembles ‘financial pyramid' https://t.co/RXYFwIvTpy,1
Tue Aug 29 15:36:40 +0000 2017,Russian govt wants to protect public from bitcoin trading as it resembles ‘financial pyramid' https://t.co/RXYFwIvTpy,1
Tue Aug 29 15:27:28 +0000 2017,connor mcgregor landed more punches on may than anyone. b/c floyd didnt reboot on punch contact I lost 0.045 bitcoin. #MayweatherVsMcGregor,0
Tue Aug 29 15:09:38 +0000 2017,I've got some Bitcoin + Ethereum &amp; Litecoin in my wallet.  But I'm not rich (yet),0
Tue Aug 29 14:51:55 +0000 2017,IRS signs contract to track bitcoin transactions https://t.co/mLTpSme6nH,0
Tue Aug 29 14:37:05 +0000 2017,Bitcoin is all the rage in the news  but the tech that powers it is Blockchain. Come learn everything you need to... https://t.co/TObeLAA2Io,0
Tue Aug 29 14:31:26 +0000 2017,The Bitcoin Price Just Set a New All-Time High Above $4 700 https://t.co/h3z4BOLQw4 via @CoinDesk,0
Tue Aug 29 14:23:43 +0000 2017,#Bitcoin  treasuries  and #gold up as investors shift to safe assets.  European equities are down as the #Euro tops… https://t.co/PO64fzJ7Yj,0
Tue Aug 29 14:12:25 +0000 2017,The New Bitcoin for Buddhists - World Religion News https://t.co/q2wMIICm62,1
Tue Aug 29 14:12:21 +0000 2017,The New Bitcoin for Buddhists - World Religion News https://t.co/q2wMIICm62,1
Tue Aug 29 14:11:36 +0000 2017,A little-known Bitcoin rival has quietly surged nearly 1 400% this year https://t.co/JvygGUA3Q4,1
Tue Aug 29 14:11:31 +0000 2017,A little-known Bitcoin rival has quietly surged nearly 1 400% this year https://t.co/JvygGUA3Q4,1
Tue Aug 29 14:09:42 +0000 2017,Bitcoin Meets Zcash: Developers Test Tool for Trustless Trades https://t.co/hrKV1AhQba via @CoinDesk,1
Tue Aug 29 14:09:39 +0000 2017,Bitcoin Meets Zcash: Developers Test Tool for Trustless Trades https://t.co/hrKV1AhQba via @CoinDesk,1
Tue Aug 29 14:09:09 +0000 2017,Is It Time To Own Gold or Bitcoin? via @forbes https://t.co/5bHMXpwolx,1
Tue Aug 29 14:08:57 +0000 2017,Is It Time To Own Gold or Bitcoin? via @forbes https://t.co/5bHMXpwolx,1
Tue Aug 29 13:57:09 +0000 2017,Bitcoin Meets Zcash Developers Test Tool for Trustless Trades | https://t.co/yYIWn7WtGe | #Bitcoin,0
Tue Aug 29 13:52:24 +0000 2017,Bitcoin Price Just Set A New All Time High Above 4 550 | https://t.co/s4rN4BRKT8 | #Markets,0
Tue Aug 29 13:07:43 +0000 2017,Russian Regulator Bitcoin Should Be Limited To Qualified Investors | https://t.co/HN48JgX0Du | #Regulation,0
Tue Aug 29 12:23:32 +0000 2017,Did you know that #Bitcoin is one of many cryptocurrencies? We see that the growth in number of cryptocurrencies wi… https://t.co/FD4teTyaYh,1
Tue Aug 29 12:08:39 +0000 2017,IRS signs contract to track bitcoin transactions https://t.co/xcdDMhJh2D,0
Tue Aug 29 09:22:33 +0000 2017,Segwits Slow Rollout Why Bitcoins Capacity Hasnt Seen A Sudden | https://t.co/BTK9kA2gjZ | #Bitcoin,0
Tue Aug 29 09:01:13 +0000 2017,Accidentally sent bitcoin to an unsynched wallet  fml,0
Tue Aug 29 06:00:13 +0000 2017,FORTUNE Cover Story: Bitcoin &amp; Ethereum https://t.co/MgX0VzIvJO #bitcoin #ETHEREUM #fortune #news,6
Tue Aug 29 05:46:36 +0000 2017,@WhiteRiceWill Interesting  did bitcoin rocked because US and EU busted many silkroad clones? The two hold 10%+ of… https://t.co/cS17OaNAzQ,0
Tue Aug 29 05:35:18 +0000 2017,Just signed up for WCX  the global digital currency exchange. Sign up &amp; earn 50 WCX tokens. @wcxofficial #bitcoin https://t.co/FMVemMkYX4,0
Tue Aug 29 03:36:19 +0000 2017,FORTUNE Cover Story: Bitcoin &amp; Ethereum https://t.co/MgX0VzIvJO #bitcoin #ETHEREUM #fortune #news,6
Tue Aug 29 03:36:04 +0000 2017,Bitcoin Cash Creates New Tax Headache For Investors - https://t.co/2Z1KhXjaao,0
Tue Aug 29 02:38:03 +0000 2017,Considering a career change  to Bitcoin miming.,0
Tue Aug 29 02:35:12 +0000 2017,@haydentiff @jja0 At current prices I get ~$0.32 per day per user to sustain current price assuming 25MM bitcoin users.,0
Tue Aug 29 01:50:52 +0000 2017,listen online weekdays 5AM to 10AM at https://t.co/x8vArq5HJ8 https://t.co/AcWErbLXpJ,0
Tue Aug 29 01:41:13 +0000 2017,Value of all digital currencies hits record around $160 billion as bitcoin  Ether climb https://t.co/C4Z0hPMmcD,1
Tue Aug 29 01:41:10 +0000 2017,Value of all digital currencies hits record around $160 billion as bitcoin  Ether climb https://t.co/C4Z0hPMmcD,1
Tue Aug 29 00:36:34 +0000 2017,FORTUNE Cover Story: Bitcoin &amp; Ethereum https://t.co/MgX0VzIvJO #bitcoin #ETHEREUM #fortune #news,6
Tue Aug 29 00:20:55 +0000 2017,Worth a read for those interested in Bitcoin and related subjects: https://t.co/t9aqu6WSBj,0
