Thu Dec 14 23:59:28 +0000 2017,A cryptocurrency without a blockchain has been built to outperform bitcoin - via @techreview https://t.co/EphiFHmEFI,0
Thu Dec 14 23:28:51 +0000 2017,Senior VP Says Ebay Seriously Considering Bitcoin Integration | https://t.co/GbcSeVmei1 | #BlockchainInfo https://t.co/uy1YpVSTpn,0
Thu Dec 14 23:17:49 +0000 2017,If you don’t own bitcoin today  when would you buy it?,0
Thu Dec 14 23:11:59 +0000 2017,New Post: My Thoughts on Bitcoin and Sharing my Cryptocurrency Portfolio https://t.co/jtdpvor1zS #fintech #cryptocurrency #bitcoin,2
Thu Dec 14 23:08:47 +0000 2017,Finally copped some bitcoin idk how y’all do that 9-5 shit https://t.co/NXHwKxv2gh,326
Thu Dec 14 23:05:09 +0000 2017,Want to Invest In Bitcoin? Here's What You Need to Know https://t.co/cDE4lF41lt,0
Thu Dec 14 23:05:08 +0000 2017,Missouri Senate candidate Petersen accepting Bitcoin donations https://t.co/thTCzXrSMt,0
Thu Dec 14 23:05:08 +0000 2017,The bitcoin hype is weird. But investors might be right. https://t.co/Nz4FIgVyFg,0
Thu Dec 14 23:02:22 +0000 2017,@readDanwrite You should do a brief segment on #Bitcoin #security using a hardware wallet such as @bitcoinkeepkey,0
Thu Dec 14 23:00:03 +0000 2017,4 Things That Could Send Bitcoin Soaring to $100 000 https://t.co/NCc33te7XI,0
Thu Dec 14 22:59:41 +0000 2017,Tech Is Becoming Emotionally Intelligent  and It's Big Business https://t.co/lvOgmU4chh #IoT #InternetOfThings… https://t.co/poh9MXW2sI,170
Thu Dec 14 22:55:26 +0000 2017,"Bitcoin Billionaire" needs to be the latest perjorative,0
Thu Dec 14 22:53:22 +0000 2017,Tech Is Becoming Emotionally Intelligent  and It's Big Business https://t.co/lvOgmU4chh #IoT #InternetOfThings… https://t.co/poh9MXW2sI,170
Thu Dec 14 22:53:20 +0000 2017,New post: "Can bitcoin see more exponential growth in 2018? Its investors say ‘yes’" https://t.co/ZSgdFL8qnX via digitaltrends,0
Thu Dec 14 22:49:46 +0000 2017,Excellent read! “What You Need to Know About the Future of Bitcoin Technology” by @SubhanNadeem19 https://t.co/WLcwwg8IOG,1
