Wed Feb 28 23:48:10 +0000 2018,⚡️ “The Bullish Case for Bitcoin”   A four part series by Vijay Boyapati @real_vijay  https://t.co/4bVNOR2Of8 https://t.co/kuhk89tdyc,0
Wed Feb 28 23:48:07 +0000 2018,⚡️ “The Bullish Case for Bitcoin”   A four part series by Vijay Boyapati @real_vijay  https://t.co/hjGJQDq3Om,0
Wed Feb 28 23:41:32 +0000 2018,The Bullish Case for #Bitcoin (part 3 of 4)   👉 https://t.co/2G5Bm9w9BY  The Evolution of Money  #BTC #BCH #LTC… https://t.co/JYTbVUonvT,0
Wed Feb 28 22:40:22 +0000 2018,Wall Street's Tom Lee  'Bitcoin Will Double By Midyear'   👉 https://t.co/q44aJ1gENq  On Wednesday  Lee maintained h… https://t.co/l6zTEYT5RV,0
Wed Feb 28 22:23:21 +0000 2018,Tyler Winklevoss: Bitcoin Is Gold  Ether Is Oil  Litecoin Is a Testnet https://t.co/GFaEkalmQJ,0
Wed Feb 28 22:23:19 +0000 2018,Bitcoin Enters Awkward Adolescence https://t.co/U6D9YVQKsP,0
Wed Feb 28 22:23:18 +0000 2018,Can Bitcoin Threaten Market Stability? https://t.co/Ozizcuc9m0,0
Wed Feb 28 22:23:17 +0000 2018,“Bitcoin Core” Is Another Attempt to Discredit Bitcoin Cash https://t.co/hJiS7pS9Eb,0
Wed Feb 28 22:23:16 +0000 2018,Bitcoin  Ripple  Litecoin - Updated Charts and Prices | Webinar https://t.co/yRfuXfYweZ,0
Wed Feb 28 21:27:51 +0000 2018,Bitcoin &amp; Solar Energy Fuel Investment in Japan: Expert Take  👉 https://t.co/gp2YvBeYVd  Nine years after #Bitcoin… https://t.co/yca7JJiByT,0
Wed Feb 28 21:08:51 +0000 2018,I started a new game today called "see how long it takes my IT guy to notice that I'm mining bitcoin on my work computer",0
Wed Feb 28 20:59:46 +0000 2018,#Bitcoin Morning Brief - Bill Gates  Israel  @CBOE Futures &amp; Peter Todd on Lightning      with @ToneVays... https://t.co/KisZQbimwP,0
Wed Feb 28 20:59:42 +0000 2018,#Bitcoin Morning Brief - Bill Gates  Israel  @CBOE Futures &amp; Peter Todd on Lightning      with @ToneVays… https://t.co/UVAoY73OO9,0
Wed Feb 28 20:56:46 +0000 2018,Bitcoin Enters Awkward Adolescence   👉 https://t.co/YvhEXP0HcJ  Derivatives provided greater visibility into opaque… https://t.co/rJKtRFiEeF,0
Wed Feb 28 20:53:42 +0000 2018,Bitcoin?? You ever heard of an @amazon gift card before.,0
Wed Feb 28 20:38:37 +0000 2018,The Buy Lottery Tickets Online - Play Lottery Online Daily is out! https://t.co/27DQGVZJ3D #bitcoin #lotterywinner,81
Wed Feb 28 20:29:07 +0000 2018,Satoshi Nakamoto is turning in Hal Finney’s grave. @BankofAmerica is so concerned their days are numbered they are… https://t.co/qedEZXwdIF,328
Wed Feb 28 20:02:04 +0000 2018,Do we really believe allowing #CFTC employees to invest in #crypto will influence their regulatory agenda? Even whe… https://t.co/UVKnRNLddv,1
Wed Feb 28 19:58:09 +0000 2018,US Regulator @CFTC Allows Staff To Trade #Cryptocurrency #BTC Futures Remain Off Limits  👉https://t.co/wAwBKDJ3gV… https://t.co/4u4BSj2FLX,0
Wed Feb 28 19:53:37 +0000 2018,Bitcoin and Ethereum Are Barely Moving -- Here's Why That's a Good Thing https://t.co/rEscCWV5SF,0
Wed Feb 28 19:53:36 +0000 2018,Here's How Square Sees Bitcoin Fitting Into Company's Future https://t.co/bzKMGP8DkP,0
Wed Feb 28 19:53:35 +0000 2018,Thanks for Nothing: Here Comes Bitcoin Prices of $25000 https://t.co/V2QN6AOd7g,0
Wed Feb 28 19:53:34 +0000 2018,Bitcoin Reaches Major Scaling Milestone as Users Adopt Upgrade https://t.co/pv3Dj1Qr03,0
Wed Feb 28 19:47:26 +0000 2018,Coinbase: Bitcoin Buys And Sells ‘Intermittently Available’   👉 https://t.co/ncQOiRZMiU  Crypto exchange and wallet… https://t.co/pDQWfNgc37,0
Wed Feb 28 19:38:17 +0000 2018,Currently available in 50 US states  Cash App allows its users to carry out instant fiat transactions  free cash-ou… https://t.co/4GFGlT0Dev,0
Wed Feb 28 19:38:17 +0000 2018,“Additionally  customers can now buy and sell Bitcoin in Cash App. We observed that this was a feature our customer… https://t.co/Ve6q9maJXP,0
Wed Feb 28 19:38:16 +0000 2018,Jack Dorsey: Square Will Go Further With #Bitcoin Than Buy/Sell Option  👉 https://t.co/Wv5OnwPia1  “Bitcoin  for us… https://t.co/SzGrW9QRAM,1
Wed Feb 28 19:16:46 +0000 2018,On The Record - Richard Heart is MIA        with @ToneVays and @ChrisDeRose_            #Bitcoin... https://t.co/rQmuKZTQlz,0
Wed Feb 28 19:16:41 +0000 2018,On The Record - Richard Heart is MIA        with @ToneVays and @ChrisDeRose_            #Bitcoin https://t.co/uoDuSDM0tZ,0
