Thu Nov 22 23:40:20 +0000 2018,#3800 #Bitcoin next week calling it now you sore losers https://t.co/GSWhz6xxT6,0
Thu Nov 22 23:18:41 +0000 2018,I made the mistake of doing both of these things this year. I am thankful bitcoin purged both of saps from my life. https://t.co/Ia6DR38Iue,0
Thu Nov 22 23:03:06 +0000 2018,Going to the #Bitcoin &amp; Beer meetup this Tuesday? Details: https://t.co/LBBpOhyo5A,0
Thu Nov 22 22:35:32 +0000 2018,Why Major Crypto Exchanges are Granting Bitcoin Cash With BCH Ticker 👉👉 https://t.co/LIeMUFOSHF  /By Joseph Young… https://t.co/qlOioJFswt,0
Thu Nov 22 22:27:05 +0000 2018,Wealth-building Guru Says #Bitcoin Hodlers Have a ‘Problematic Mindset’ 👉👉 https://t.co/FRXQ0jRRoT  /By David Hunde… https://t.co/VG04PFibml,0
Thu Nov 22 18:48:07 +0000 2018,Everyone thinks they know where the price of #BTC is headed. But who actually called the crash we all experience la… https://t.co/mJ9vD98fVB,3
Thu Nov 22 17:45:15 +0000 2018,Personally  I would love to see Bitcoin at one dollar! Being USD cash heavy (institutional money) would then come i… https://t.co/2SbSBTJbGm,0
Thu Nov 22 17:34:36 +0000 2018,#bitcoin https://t.co/5vGsL0LS5i,0
Thu Nov 22 17:04:01 +0000 2018,What's notable about the decline in crypto prices  esp. Bitcoin  is that it was once touted as an alternative to re… https://t.co/v9fIr5SfEz,0
Thu Nov 22 16:52:51 +0000 2018,Bitcoin: I'm Surprised That You're Surprised 👉👉 https://t.co/mB3DHf077B  /By Hans Hauge  #BlockChainNews #BTC #BCH… https://t.co/uBLUAo6FbG,0
Thu Nov 22 16:22:14 +0000 2018,Happy Thanksgiving from your friends at Bitcoin Lifestyles Club! https://t.co/ICFtRXppNa,0
Thu Nov 22 15:59:00 +0000 2018,Investors in US Market Paid $39 000 to Buy Bitcoin at Peak Using GBTC 👉👉 https://t.co/GaLvMtrx1O  /By Joseph Young… https://t.co/EEq6nBgLDc,0
Thu Nov 22 15:53:27 +0000 2018,The First Bitcoin legal dispute on trial in Singapore 👉👉 https://t.co/FjF7Hk4TUG  /By Ken Chigbo  #BlockChainNews… https://t.co/Tne84wEGAY,0
Thu Nov 22 14:21:06 +0000 2018,@PeterSchiff @YouTube I think  the other reason of the Bitcoin crash is that the world economy is slowing down rapi… https://t.co/rHfkIBxbKw,0
Thu Nov 22 14:07:20 +0000 2018,Intel Core i3-8100 + ASUS PRIME Z370-A - https://t.co/GGrRa1MHsT #bitcoin #cryptocurrency https://t.co/IPoUgttNOK,0
Thu Nov 22 13:34:26 +0000 2018,Strategies:BITCOIN - BTC continues consolidation near its lows... it may bounce up and down in this range for a whi… https://t.co/YKdwkGuuRr,0
Thu Nov 22 13:28:13 +0000 2018,Strategies:BITCOIN - BTC continues consolidation near its lows... it may bounce up and down in this range for a whi… https://t.co/iLZDeoDgmD,0
Thu Nov 22 12:43:23 +0000 2018,Bitcoin Circus 🎪  https://t.co/x0Z0cUxI44,0
Thu Nov 22 12:06:00 +0000 2018,All partners around the world through their subsidiaries are already investing directly in the FAMEONE INVESTMENTS… https://t.co/mkZYosUTKt,0
Thu Nov 22 07:47:39 +0000 2018,Video - ADVANCED BITCOIN MINING! - Gmod DarkRP Life (Base Building  How To Make Money Out Of Bitcoin) -… https://t.co/fwtsYBxDUa,0
Thu Nov 22 04:15:06 +0000 2018,On Monday  join us at the #Denver Crypto Group meetup to learn about Why Should Your Business Accept Bitcoin?: https://t.co/YC7tOO4Vg4,0
Thu Nov 22 03:52:53 +0000 2018,Amended Suit Against Coinbase Details Bitcoin Cash Insider Trading Claims - CoinDesk https://t.co/ErP9hbtGCM,0
Thu Nov 22 03:43:46 +0000 2018,Susquehanna Exec: Bakkt and Fidelity Could Solve Bitcoin’s Liquidity Issue 👉👉 https://t.co/LsXLMsN3H7  /By Joseph Y… https://t.co/broc5yUtSJ,0
Thu Nov 22 03:40:51 +0000 2018,Bitcoin Price Bounces Back — Sustained Recovery or Dead Cat Bounce? 👉👉 https://t.co/IK5q7KbqfL  /By Yashu Gola… https://t.co/JOzvhd0lnQ,0
Thu Nov 22 03:36:00 +0000 2018,The Satoshi Revolution Chapter 2 Part 1: Currency Creates Freedom and Civilization...Or Oppression  https://t.co/klxp9EEr4C,1
Thu Nov 22 03:33:19 +0000 2018,No End in Sight for Bitcoin Cash Hash War 👉👉 https://t.co/OEFrNa0PBp  /By Andrew Buck   #BlockChainNews #BTC #BCH… https://t.co/CM3xF46jDX,0
Thu Nov 22 03:30:40 +0000 2018,This is already a big wow! $SYS #SYS #BTC #Bitcoin https://t.co/kDqRmVoPuo,0
Thu Nov 22 03:28:34 +0000 2018,Crypto bears hit a pause button  Bitcoin  Ethereum  XRP gaining over 4% in recent 24 hours  👉👉… https://t.co/hctMPIvLND,0
Thu Nov 22 03:19:55 +0000 2018,Trading Bitcoin - The Bounce of $4 100 Looking Good       With @ToneVays        #BlockChainNews #BTC #BCH #LTC #ETH… https://t.co/LF7TGtl1DM,0
Thu Nov 22 03:03:33 +0000 2018,However  members of Fameone do not need to be familiar with crypto currencies  as they can pay in addition to the F… https://t.co/Cr890gny83,0
Thu Nov 22 02:54:47 +0000 2018,RT @WorldTrendsInfo: #Blockchain &amp; #Bitcoin   #FinTech #IoT #SmartCity #startups #APIs #Security @Fisher85M… https://t.co/tFaQsI0JY2,5
Thu Nov 22 02:53:43 +0000 2018,@acityinohio @Mtlbitcoinking Could it be done so as to leave those fancy bitcoin satellites 🛰 alone?,0
Thu Nov 22 02:15:45 +0000 2018,Both forked versions of Bitcoin Cash suffer significant problems as circus continues https://t.co/XwrgBVNm0e via #siliconANGLE,0
Thu Nov 22 02:14:50 +0000 2018,@crypto This writer is a troll. How about the fact that bitcoin was only cents in its beginning. From pennies to th… https://t.co/3iMU2Isctb,0
Thu Nov 22 02:04:13 +0000 2018,Instead of saving money  make money!   Black Friday baby!   Get free TCXB with your BTC and ETH deposits.   Go to… https://t.co/P9nIxlTQ14,0
Thu Nov 22 01:03:13 +0000 2018,He must have been renting a calculator and got it repossessed... This is called: LYING Don't take my word...look it… https://t.co/SvEo9km5lc,2
Thu Nov 22 00:46:13 +0000 2018,I’m excited to hear how everyone’s uncles who bought a bunch of bitcoin last Thanksgiving are doing this Thanksgiving.,0
Thu Nov 22 00:23:07 +0000 2018,Tom Lee Sticks by His $15 000 Bitcoin (BTC) Price Prediction Despite Falling Market  👉👉 https://t.co/gnbLUkUVpH  /B… https://t.co/6VItz4CUIs,0
