Fri Aug 10 19:29:01 +0000 2018,Me on the wall of Roblox Mining Simulator. (Devs don't ban me pls I worked hard. Im just letting you know about thi… https://t.co/dPrWLYcj8I,0
Fri Aug 10 16:03:43 +0000 2018,Part II of Cynthia Heider's (@comebackcities) research is up on the APS blog. Now that we have this data on 18th ce… https://t.co/jUPV0pofps,3
Fri Aug 10 15:30:14 +0000 2018,You mining?  You think wanna mine??  You want great deals on mining hardware???  If ya said yes to any of the above… https://t.co/mkpyG1kOXN,0
Fri Aug 10 15:28:40 +0000 2018,More enterprise usage of private permissioned Ethereum coming along https://t.co/Kmk9aN0IeD,1
Fri Aug 10 13:41:45 +0000 2018,More enterprise usage of private permissioned Ethereum coming along https://t.co/Kmk9aN0IeD,1
Fri Aug 10 01:32:08 +0000 2018,@rwmcmahon1 https://t.co/IcoeYCvJ1O,0
