Sat Mar 17 21:08:28 +0000 2018,https://t.co/yIm6jN8C3t,1
Sat Mar 17 20:42:00 +0000 2018,https://t.co/yIm6jN8C3t,1
Sat Mar 17 18:23:11 +0000 2018,Sec. of Interior Zinke's Cynical Plan to Make America's National Parks Dependent on Mining &amp; Drilling - “I challeng… https://t.co/tCIsp1wa8L,0
Sat Mar 17 18:08:42 +0000 2018,Interesting legal question by @brucefenton whether a city ordinance banning crypto mining violates the 1st Amendmen… https://t.co/PYQ8Hp6ymx,3
Sat Mar 17 15:45:49 +0000 2018,Bitmain Announces New Monero-Mining Antminer X3  Crypto’s Devs Say Will ‘Not Work’ - Monero vows to block the minin… https://t.co/48q1YgOSCB,0
Sat Mar 17 15:23:51 +0000 2018,DROP-SHIPPING 2 BUY CRYPTO ( Sell items You don't own) Cloud Mining updates!: https://t.co/Tfj3tSpAY2 via @YouTube,0
Sat Mar 17 15:19:41 +0000 2018,@boztank What assurances are you giving that they won't just form a shell company and come in the back door? Are yo… https://t.co/p6JJutuDKf,0
Sat Mar 17 15:11:37 +0000 2018,Interesting legal question by @brucefenton whether a city ordinance banning crypto mining violates the 1st Amendmen… https://t.co/PYQ8Hp6ymx,3
Sat Mar 17 15:07:45 +0000 2018,Interesting legal question by @brucefenton whether a city ordinance banning crypto mining violates the 1st Amendmen… https://t.co/PYQ8Hp6ymx,3
Sat Mar 17 15:04:00 +0000 2018,Interesting legal question by @brucefenton whether a city ordinance banning crypto mining violates the 1st Amendmen… https://t.co/PYQ8Hp6ymx,3
Sat Mar 17 13:32:56 +0000 2018,I wish national media outlets &amp; prominent journalists spent less time obsessed with the White House's dog and pony… https://t.co/dhZ1eWmeDW,1
Sat Mar 17 13:25:16 +0000 2018,I wish national media outlets &amp; prominent journalists spent less time obsessed with the White House's dog and pony… https://t.co/dhZ1eWmeDW,1
Sat Mar 17 09:33:22 +0000 2018,A New York town just placed a moratorium on crypto mining https://t.co/lny81d2kIC https://t.co/ZrPyJOCaLC,1
Sat Mar 17 00:47:55 +0000 2018,@jefftiedrich Hi. I ran you in a Twitter data mining tool and you have recognized influence! (2/10 US - North Ameri… https://t.co/LJUnVIigJa,1
Sat Mar 17 00:32:23 +0000 2018,@Skywalk25806325 NP. There is a magic concept called &gt;&gt;&gt; diversification. Mining is just a piece of the puzzle.,0
Sat Mar 17 00:08:52 +0000 2018,@jefftiedrich Hi. I ran you in a Twitter data mining tool and you have recognized influence! (2/10 US - North Ameri… https://t.co/LJUnVIigJa,1
