Wed Nov 07 21:09:25 +0000 2018,The #PSB2019 schedule is available on the PSB website at https://t.co/RDYgzx0oye. Our Text Mining and Machine Learn… https://t.co/zc870cSaF4,0
Wed Nov 07 17:13:04 +0000 2018,"Writing is mining your own capacity and then taking out those stones and cutting the diamond."  Read how one @Penn… https://t.co/tYhiE54Gbj,1
Wed Nov 07 17:10:24 +0000 2018,"Writing is mining your own capacity and then taking out those stones and cutting the diamond."  Read how one @Penn… https://t.co/tYhiE54Gbj,1
Wed Nov 07 14:44:54 +0000 2018,@annmichael speaking at #chsconf2018 about Mining Data for Effective Decision-Making https://t.co/vuAkiiPpNm,1
Wed Nov 07 14:37:32 +0000 2018,@annmichael speaking at #chsconf2018 about Mining Data for Effective Decision-Making https://t.co/vuAkiiPpNm,1
Wed Nov 07 12:46:56 +0000 2018,https://t.co/i4yz76ODmD https://t.co/3IddPfBWsS,0
Wed Nov 07 09:05:20 +0000 2018,goddamn i forgot how draining streaming runescape is lul  we will hit 72 mining tomm then start new quest to get my cape back.,0
Wed Nov 07 08:02:32 +0000 2018,Wow mining in RS is awful,0
Wed Nov 07 00:20:54 +0000 2018,"The old children’s classic takes a dark turn. Diamond mining clears the forests that release the carbon that warms… https://t.co/hzTq90C902,3
