Fri May 04 19:26:33 +0000 2018,When your data mining practices depend upon the ignorance of your users  that is a problem. When your terms of serv… https://t.co/WH6EDlaHWq,2
Fri May 04 18:49:07 +0000 2018,I just entered for a chance to bring home the only currency backed by real Oscar Mayer Bacon  and you can too! Try… https://t.co/az8hDeYGkG,0
Fri May 04 18:38:29 +0000 2018,This is why usa mining is a matter of national security.. https://t.co/3KFXpLkVPf https://t.co/HgCd5VNjpK,0
Fri May 04 15:41:21 +0000 2018,Trade Targets  Part I: Mining through the Metro https://t.co/XgvlrY8tp3 https://t.co/yafcJ6Nymt,0
Fri May 04 15:25:29 +0000 2018,Trade Targets  Part I: Mining through the Metro #PhiladelphiaFlyers  https://t.co/rwVaC6ioIr https://t.co/uFpxldQWak,0
Fri May 04 15:03:02 +0000 2018,Dream work is often done with the unconscious theme of “mining” : but what if we met our dreams on equal ground? Wh… https://t.co/TOKxPfHQpw,0
Fri May 04 14:00:02 +0000 2018,A reminder  all 2018 SIAM International Conference on Data Mining (SDM18) Friday session poster presenters must rem… https://t.co/7adfiSjiLI,0
Fri May 04 13:37:14 +0000 2018,@millerak42 @Foulke_David we might have done that when we did a huge data mining exercise for chapters 7/8 or quant… https://t.co/RefyCVoQTc,0
Fri May 04 13:24:50 +0000 2018,@Foulke_David yeah  or data mining. LOL,0
Fri May 04 12:13:53 +0000 2018,-Parasitic Coin Mining Creates Wealth  Destroys Systems https://t.co/4nlQC3CpLe #IAmMcAfee https://t.co/vqOeIua1eY,0
Fri May 04 09:51:13 +0000 2018,Easily find objects in digital photos &amp; vids by using a mining engine &amp; hi-memory Linode: https://t.co/11prtl0C7O https://t.co/qj8PNZgTHx,928
Fri May 04 06:50:18 +0000 2018,Easily find objects in digital photos &amp; vids by using a mining engine &amp; hi-memory Linode: https://t.co/11prtl0C7O https://t.co/qj8PNZgTHx,928
Fri May 04 01:10:09 +0000 2018,Revenues Down  Hashrates Up: 2018 Mining Outlook By The Numbers https://t.co/iP6kN0H7qz,0
