Sun Nov 11 20:18:25 +0000 2018,Caught James de Lemos at #Aha18 with some of our stellar fellows @rohan_khera @davidmcnam https://t.co/7KfYi9a8Nv,4
Sun Nov 11 20:01:54 +0000 2018,Caught James de Lemos at #Aha18 with some of our stellar fellows @rohan_khera @davidmcnam https://t.co/7KfYi9a8Nv,4
Sun Nov 11 17:47:21 +0000 2018,Stellar 2nd year fellow at the #FIT mentorship panel #aha18 #utswheart https://t.co/pjHxn058Mk,0
Sun Nov 11 15:27:27 +0000 2018,Absolutely stellar article. Kinda lengthy but an excellent and informative read https://t.co/PWLJQmlsyc,0
Sun Nov 11 14:58:21 +0000 2018,Free agent wondernings  and why Jurickson Profar is still the top potential Beltre replacement  https://t.co/OKUOf9zyNq,2
Sun Nov 11 14:33:52 +0000 2018,Free agent wondernings  and why Jurickson Profar is still the top potential Beltre replacement  https://t.co/OKUOf9zyNq,2
Sun Nov 11 14:30:13 +0000 2018,Free agent wondernings  and why Jurickson Profar is still the top potential Beltre replacement  https://t.co/OKUOf9zyNq,2
Sun Nov 11 05:46:20 +0000 2018,After stellar 2018  Jurickson Profar is primed for a larger role in 2019 https://t.co/Rmsq2kf6CB https://t.co/xiUgECDG0I,0
Sun Nov 11 05:45:02 +0000 2018,@thevowel I’ve really been wanting to pick that up. I’m wondering how the less than stellar CGI of the sequel holds… https://t.co/h2s0VtObOB,0
Sun Nov 11 03:23:41 +0000 2018,@NatiGame While we know that delays are never fun  we're glad to hear that your Crew was stellar tonight! Thanks fo… https://t.co/oqCGefm8Bw,0
Sun Nov 11 02:13:34 +0000 2018,Caught James de Lemos at #Aha18 with some of our stellar fellows @rohan_khera @davidmcnam https://t.co/7KfYi9a8Nv,4
Sun Nov 11 01:10:40 +0000 2018,It was riveting  emotional  and well done for a film! @ItsRamiMalek was stellar and the supporting cast was equally as great !,0
Sun Nov 11 01:02:23 +0000 2018,I know I'm a small account and probably no one is going to see this  but today I went to a food store called Hiệp T… https://t.co/aDrucgyLQF,597
Sun Nov 11 00:16:43 +0000 2018,Yeah  he really took the next step. He definitely has opened up some eyes. Stellar play in all facets of his game. https://t.co/KjozV5QYWk,0
