Wed Sep 13 11:45:11 +0000 2017,Inca One Gold Announces 124% Increase in YOY Gold Production in July and August 2017 https://t.co/8iH2N2I0Cs,0
Wed Sep 13 11:24:47 +0000 2017,Too many people miss the silver lining because they're expecting gold. -Maurice Setter,35
Wed Sep 13 11:12:20 +0000 2017,Too many people miss the silver lining because they're expecting gold. -Maurice Setter,35
Wed Sep 13 11:08:05 +0000 2017,Too many people miss the silver lining because they're expecting gold. -Maurice Setter,35
Wed Sep 13 11:04:46 +0000 2017,Too many people miss the silver lining because they're expecting gold. -Maurice Setter,35
Wed Sep 13 11:04:44 +0000 2017,Too many people miss the silver lining because they're expecting gold. -Maurice Setter,35
Wed Sep 13 10:56:47 +0000 2017,Too many people miss the silver lining because they're expecting gold. -Maurice Setter,35
Wed Sep 13 10:53:55 +0000 2017,Too many people miss the silver lining because they're expecting gold. -Maurice Setter,35
Wed Sep 13 10:49:48 +0000 2017,Too many people miss the silver lining because they're expecting gold. -Maurice Setter,35
Wed Sep 13 10:45:22 +0000 2017,Too many people miss the silver lining because they're expecting gold. -Maurice Setter,35
Wed Sep 13 10:43:22 +0000 2017,Too many people miss the silver lining because they're expecting gold. -Maurice Setter,35
Wed Sep 13 10:42:26 +0000 2017,Too many people miss the silver lining because they're expecting gold. -Maurice Setter,35
Wed Sep 13 10:42:13 +0000 2017,Too many people miss the silver lining because they're expecting gold. -Maurice Setter,35
Wed Sep 13 10:42:03 +0000 2017,Too many people miss the silver lining because they're expecting gold. -Maurice Setter,35
Wed Sep 13 10:39:45 +0000 2017,Too many people miss the silver lining because they're expecting gold. -Maurice Setter,35
Wed Sep 13 10:38:29 +0000 2017,Too many people miss the silver lining because they're expecting gold. -Maurice Setter,35
Wed Sep 13 10:10:27 +0000 2017,You need to be able to hear God in the midst of anything.   ~ Apostle Tony Ervin,2
Wed Sep 13 10:10:23 +0000 2017,You can miss one season and not hear God because of your flesh and get set back for many years.  ~ Apostle Tony Ervin,1
Wed Sep 13 09:51:04 +0000 2017,Dainty Petite Heart Necklace  in Yellow Gold Filled or Sterling Sil… https://t.co/dgCJPNbRI3 #Etsy #MomDaughterHeart https://t.co/mmJnDymibB,0
Wed Sep 13 09:07:06 +0000 2017,Garnet Earrings  Deep Red Garnet Gemstones  Garnet Gold Earrings … https://t.co/uvatdjqWDe #Etsy #GarnetDropEarrings https://t.co/9QhCiS723F,0
Wed Sep 13 09:06:07 +0000 2017,Selena Gomez Showcases Gold Thong in Partially Nude Instagram Photo  https://t.co/8m5On04wCa https://t.co/H5QXXCGCgt,0
Wed Sep 13 08:29:09 +0000 2017,Now playing Liquid Gold by Simone Alyse! Click link below https://t.co/MIUcppR9OU https://t.co/HuYksBaHkb,0
Wed Sep 13 07:49:44 +0000 2017,JovaniFashions : We can't get enough of Rose Gold. This gown is perfection! #JOVANI #eveningdress #RoseGold …… https://t.co/y5mUdJm0j0,0
Wed Sep 13 07:38:45 +0000 2017,Highway Kids Champions Club has officially launched in the Gold Coast of Australia. So proud of Pastor Caleb &amp; the… https://t.co/3TDXxXU0q8,2
Wed Sep 13 07:38:25 +0000 2017,Highway Kids Champions Club has officially launched in the Gold Coast of Australia. So proud of Pastor Caleb &amp; the… https://t.co/3TDXxXU0q8,2
Wed Sep 13 07:06:40 +0000 2017,If these photos were taken a half-second later they'd be entirely unspectacular. Instead  they're internet gold. https://t.co/vWVr9cZIwV,0
Wed Sep 13 07:06:36 +0000 2017,If these photos were taken a half-second later they'd be entirely unspectacular. Instead  they're internet gold. https://t.co/Hdm3zEKrjk,0
Wed Sep 13 07:05:25 +0000 2017,If these photos were taken a half-second later they'd be entirely unspectacular. Instead  they're internet gold. https://t.co/NA6RIOE5YM,0
Wed Sep 13 06:56:44 +0000 2017,And we liiiike bitches with they own shit . We don like gold diggin💯,0
Wed Sep 13 06:27:51 +0000 2017,Die alone with a dog and gold fish knowing i had my dignity and pride. https://t.co/MehjxdYeqO,0
Wed Sep 13 06:25:19 +0000 2017,18K Gold Diamond Jesus Pendant ➤ Only $65.00 USD  ➤ Shop https://t.co/UtRjyRcUGy + FREE Worldwide Shipping https://t.co/wUxcKCeCet,0
Wed Sep 13 06:08:13 +0000 2017,If these photos were taken a half-second later they'd be entirely unspectacular. Instead  they're internet gold. https://t.co/kM7Op1Lf0r,0
Wed Sep 13 05:49:29 +0000 2017,@Beluba what gold badges does a shot creator primary and a sharp secondary sf have,0
Wed Sep 13 05:36:09 +0000 2017,If these photos were taken a half-second later they'd be entirely unspectacular. Instead  they're internet gold. https://t.co/QhVpaJMcvQ,0
Wed Sep 13 05:14:40 +0000 2017,If I get my girl this bald i better get sucked like a crawfish head all night ! https://t.co/sOt2Miyici,35989
Wed Sep 13 05:10:29 +0000 2017,12 Pack Diamond Dust Design! Visit https://t.co/yZxmEfsXCq to order! #gotgrillz #grillz #grillgang #gold… https://t.co/kcncDQHiEQ,1
Wed Sep 13 04:55:33 +0000 2017,Dude in the gold and black is me at the club off the licka 😂 https://t.co/EVLod8wu2C,1
Wed Sep 13 04:52:28 +0000 2017,@MsCuppyKate Next one will be solid gold and be called the XS,0
Wed Sep 13 04:52:20 +0000 2017,Dude in the gold and black is me at the club off the licka 😂 https://t.co/EVLod8wu2C,1
Wed Sep 13 04:49:11 +0000 2017,8TEEN 💛 https://t.co/M9KR2lV2Qw,15
Wed Sep 13 04:39:20 +0000 2017,Congrats to Lauren Green &amp; Freia Pamintuan recognized at board meeting for being  National Gold Medalists -… https://t.co/ddzlGYlJT2,10
Wed Sep 13 04:35:59 +0000 2017,Congrats to Lauren Green &amp; Freia Pamintuan recognized at board meeting for being  National Gold Medalists -… https://t.co/ddzlGYlJT2,10
Wed Sep 13 04:19:39 +0000 2017,Remember  when things are hardest and seem to be going every way but right  you're three inches from Gold. Keep digging! #PositiveVibes #htx,0
Wed Sep 13 04:10:10 +0000 2017,These are pure gold https://t.co/b1n4f3A36Y,0
Wed Sep 13 04:07:15 +0000 2017,Constantly reminding me that I am worth as much as gold.,0
Wed Sep 13 03:55:35 +0000 2017,Coming soon 👀💕 Matte gold #AppleEvent https://t.co/NQnzGh4SMS,0
Wed Sep 13 03:53:38 +0000 2017,Gold link x Palm trees ❤️,0
Wed Sep 13 03:52:54 +0000 2017,Hi I'm Dustin and I just started Concrete and Gold for the 6th time. https://t.co/KzmwqA9SUL,0
Wed Sep 13 03:51:24 +0000 2017,this matte gold is beautiful,0
Wed Sep 13 03:51:01 +0000 2017,At this point @nytimes et al seem content to be  #alchemists attempting to turn 💩 into gold. #Hillary #media… https://t.co/TbSz1I50Xf,0
Wed Sep 13 03:47:59 +0000 2017,my snapchat story is gold rn,0
Wed Sep 13 03:45:26 +0000 2017,Yo this is gold  this is amazing. https://t.co/4M2fiv1WLh,0
Wed Sep 13 03:43:15 +0000 2017,@Kaepernick7 @jemelehill hahahaha! This is gold!,0
Wed Sep 13 03:41:12 +0000 2017,yall remember when our ONLY problem was the blue/gold dress lmao,0
Wed Sep 13 03:34:48 +0000 2017,@omarjtello Or gold,0
Wed Sep 13 03:31:21 +0000 2017,Ears for the free gold for the free   much thanks,0
Wed Sep 13 03:29:43 +0000 2017,.@kennychesney Creates Hurricane Irma Relief Foundation - He has a heart of gold.  https://t.co/4KG47oL2ie,9
Wed Sep 13 03:27:22 +0000 2017,👏👏👏 Gold! #smsports https://t.co/xd7JCW0mF7,0
Wed Sep 13 03:16:54 +0000 2017,Solid (rose) gold 💛 https://t.co/r7IWVQNAva,0
Wed Sep 13 03:08:31 +0000 2017,I liked a @YouTube video https://t.co/oaCsdmJhoz ANNOUNCING THE WINNER OF THE NBA 2K18 LEGEND GOLD EDITION GIVEAWAY!!! 😱,0
Wed Sep 13 03:08:09 +0000 2017,@Ron_Flair @_dannyphoto_ I low key wish I knew my runescape password... was high level 60's back in middle school w… https://t.co/JifhIwKWS3,0
Wed Sep 13 03:04:07 +0000 2017,Playing in my newest palette! I'm in love with the gold. It's so pigmented and has just the… https://t.co/WrX9XtquSq,0
Wed Sep 13 03:00:14 +0000 2017,Congrats to Lauren Green &amp; Freia Pamintuan recognized at board meeting for being  National Gold Medalists -… https://t.co/ddzlGYlJT2,10
Wed Sep 13 02:54:15 +0000 2017,RSVP here:  https://t.co/aelavd9xXD https://t.co/O0t6Qocvaj,0
Wed Sep 13 02:53:31 +0000 2017,#Win the 52 Free Pairs of Gold Toe #Socks #Giveaway https://t.co/mFMmxm9QPB,0
Wed Sep 13 02:50:33 +0000 2017,@lupitaacam Hey this isn't a Gold fish,0
Wed Sep 13 02:41:55 +0000 2017,Tiffany Blue Dress Soaps with gold glitter ✨ going out to a Baby 👶🏼 Shower! 👏🏽👏🏽👏🏽 https://t.co/hyi8Md7nRU,0
Wed Sep 13 02:32:28 +0000 2017,Congrats to Lauren Green &amp; Freia Pamintuan recognized at board meeting for being  National Gold Medalists -… https://t.co/ddzlGYlJT2,10
Wed Sep 13 02:30:41 +0000 2017,Brazil Probes Reported Massacre of Amazon Tribe by Gold Miners https://t.co/0xsMWvjao1 via @guardian,0
Wed Sep 13 02:30:16 +0000 2017,Congrats to Lauren Green &amp; Freia Pamintuan recognized at board meeting for being  National Gold Medalists -… https://t.co/ddzlGYlJT2,10
Wed Sep 13 02:26:14 +0000 2017,Astonishing Crown that will make you look like a true beauty Queen. Hand crafted and Gold Plated. Make your... https://t.co/pT9UIHrSm7,0
Wed Sep 13 02:20:24 +0000 2017,❦∞ Scoodie Hoodie Hood &amp; Scarf Combined Shades of Greens Gold Autumn Colo... Just For You https://t.co/ne9o5NVDc9 https://t.co/eATLEyIwsk,0
Wed Sep 13 02:07:08 +0000 2017,@johndavidreece6 Great idea and looks amazing!,0
Wed Sep 13 02:06:17 +0000 2017,@iSuccessTV Our bamboo will harvest in 4 years with drip irrigation for the first 2 years.,0
Wed Sep 13 02:05:58 +0000 2017,Baby I'm Gold 🔸,0
Wed Sep 13 01:59:37 +0000 2017,This is gold 😭😭😭 https://t.co/2BH39Hmjtn,0
Wed Sep 13 01:57:31 +0000 2017,@Qwaid I love it!,0
Wed Sep 13 01:54:50 +0000 2017,My heart will remain gold,0
Wed Sep 13 01:54:28 +0000 2017,Labeling Viruses with Gold Nanoclusters through Non-equilibrium Molecular Dynamics Simulations https://t.co/9e7WPuJnxK @ACSPublications,1
Wed Sep 13 01:53:34 +0000 2017,What animal will not eat bamboo?,0
Wed Sep 13 01:41:04 +0000 2017,I paint the planet gold  I swear Im Michelango,0
Wed Sep 13 01:37:24 +0000 2017,Both the wife and I got a little moist-eye reading this full-page ad in this morning's @HoustonChron. Cheers to you… https://t.co/iCIayMJ5v9,14491
Wed Sep 13 01:32:07 +0000 2017,Only 2 1/2 more hours until @ProducerKen and I make radio  gold on #PursuitofHappiness. I wonder if we'll talk about Seattle.,1
Wed Sep 13 01:24:30 +0000 2017,‘Unicorn Store’ Review: Brie Larson’s Directorial Debut Is a Quirky Mess with a Heart of Gold — TIFF https://t.co/i8DWqBwYTr,0
Wed Sep 13 01:22:05 +0000 2017,Labeling Viruses with Gold Nanoclusters through Non-equilibrium Molecular Dynamics Simulations https://t.co/9e7WPuJnxK @ACSPublications,1
Wed Sep 13 01:11:59 +0000 2017,Thinking about a reduction 😥🤔 @ Gold's Gym Park Lakes https://t.co/CFFgQu6roJ,0
Wed Sep 13 01:08:43 +0000 2017,@SPPGIRL3 I can't even begin to imagine how that must feel....he feels like he has a huge heart of gold,0
Wed Sep 13 01:07:06 +0000 2017,Carnelian Gemstone Necklace in Gold  Raw Carnelian  Natur… https://t.co/xHmWopGlJs #CaveGemstones #CarnelianNecklace https://t.co/V4PrzwQ6aB,0
Wed Sep 13 01:05:09 +0000 2017,Dropping Tonight 12pm Central.💸💡〽️ https://t.co/lnOAAna8mV,29
Wed Sep 13 01:04:25 +0000 2017,💪💦 @ Gold's Gym Park Lakes https://t.co/eJJtQ2MgKn,0
Wed Sep 13 00:45:52 +0000 2017,I liked a @YouTube video https://t.co/YieNQjDFrM KSI VS. NETNOBODY (FEATURING THE #1 USED YOUTUBE GOLD DIGGER),0
Wed Sep 13 00:39:47 +0000 2017,Gold alpinas. https://t.co/Y2p5GiTi0S,3
Wed Sep 13 00:39:01 +0000 2017,Big mad the X aint in Gold tho smh 🤦🏽‍♂️,0
Wed Sep 13 00:38:14 +0000 2017,Congrats to Lauren Green &amp; Freia Pamintuan recognized at board meeting for being  National Gold Medalists -… https://t.co/ddzlGYlJT2,10
Wed Sep 13 00:34:43 +0000 2017,Now playing 14 Famous Dex - On Gold by Various! Click link below https://t.co/MIUcppR9OU https://t.co/HuYksBaHkb,0
Wed Sep 13 00:32:16 +0000 2017,pure gold https://t.co/WTMTXdhP2k,0
Wed Sep 13 00:19:09 +0000 2017,Thank you so much to this beautiful heart of gold woman................ #HandInHand https://t.co/SVd5vm7q0e,3
Wed Sep 13 00:07:52 +0000 2017,My next gonna wonder why a nigga so cold cause I found out that everything that glitter ain't gold,7
Wed Sep 13 00:07:07 +0000 2017,I may not have ankles but I've got a heart of gold.,0
Wed Sep 13 00:01:56 +0000 2017,@crasis @Forbes Here's to Harmony Gold losing their asses in court so those toys can be impotred without any shit.,0
