Wed Sep 13 23:49:40 +0000 2017,@MichaelBerrySho and why in the world is dude on the right wearing compression socks and a compression sleeve? Gonna hit Gold's Gym after?,0
Wed Sep 13 23:49:37 +0000 2017,Purple and Gold  I can get em both I don't wanna chooseeeee 🗣💛💜 https://t.co/FYoxBxdOBc,11
Wed Sep 13 23:49:10 +0000 2017,Former UBS Trader Arrested  Charged With Rigging Gold Prices https://t.co/en4dPv7x2A,0
Wed Sep 13 23:41:00 +0000 2017,Guess it's the gold life until people know how to communicate and friends know to just invite me regardless if I'm in a game or not :/,0
Wed Sep 13 23:28:56 +0000 2017,Wtf...... https://t.co/SlblBpJ5jC,0
Wed Sep 13 23:27:42 +0000 2017,Wow memes one way to start twitter is this 😑 https://t.co/KckMjKTU9a,0
Wed Sep 13 23:26:40 +0000 2017,https://t.co/5Qp57k1Tt8,0
Wed Sep 13 23:20:01 +0000 2017,Love how this turned out 😍 #motd#abh#nyx#fentybeauty#gold https://t.co/9dRhw8C4W6,8
Wed Sep 13 23:16:57 +0000 2017,Ms. Flynn says readers don't need to turn into curmudgeons! Read books like they're gold!  #buzzbuzz @Mendel_AISD 🐝 https://t.co/tcszOgd4Km,2
Wed Sep 13 23:02:32 +0000 2017,@SavinTheBees Trash before the gold it seems,0
Wed Sep 13 22:58:44 +0000 2017,Congrats to Lauren Green &amp; Freia Pamintuan recognized at board meeting for being  National Gold Medalists -… https://t.co/ddzlGYlJT2,10
Wed Sep 13 22:49:23 +0000 2017,Drippin Gold https://t.co/9Vme6wY0JE,1
Wed Sep 13 22:48:17 +0000 2017,Drippin Gold https://t.co/9Vme6wY0JE,1
Wed Sep 13 22:46:36 +0000 2017,Free Essay: Factors Affecting Gold Value in USA https://t.co/jmOVS3AaNR,0
Wed Sep 13 22:20:44 +0000 2017,@DesiPerkins @quayaustralia feelin myself in my rose gold high keys 😏✨🙊 https://t.co/4UWYsDSucF,0
Wed Sep 13 22:17:17 +0000 2017,Purple and Gold  I can get em both I don't wanna chooseeeee 🗣💛💜 https://t.co/FYoxBxdOBc,11
Wed Sep 13 22:05:57 +0000 2017,fri.9.15-THE ANNUAL @INDMIX EXCHANGE VIRGO BASH AT  https://t.co/vUnpKX6BLE COCKTAIL DEN&gt;MUSIC BY @IAMSUPASTAR https://t.co/QWxRAE6ark,0
Wed Sep 13 22:05:57 +0000 2017,♡✿ Scoodie Hoodie Hood &amp; Scarf Combined Shades of Greens Gold Autumn Colo... Custom Made https://t.co/ne9o5NVDc9 https://t.co/yzXaotA6R2,0
Wed Sep 13 22:04:25 +0000 2017,♢∞ Scoodie Hoodie Hood &amp; Scarf Combined Shades of Greens Gold Autumn Colo... Pet People https://t.co/ne9o5NVDc9 https://t.co/EhdeZTJ0C9,0
Wed Sep 13 21:47:24 +0000 2017,This one will make you smile...wait for it!! Jamies Hope At the Going Gold event at Texas Children's Hospital in... https://t.co/KBvdnr9UOD,0
Wed Sep 13 21:45:08 +0000 2017,The only #makeup brush you need. #AirbrushMakeup https://t.co/aTluFRcy36 https://t.co/ZyFys35fhL,0
Wed Sep 13 21:43:55 +0000 2017,Too many people miss the silver lining because they're expecting gold. -Maurice Setter,35
Wed Sep 13 21:41:21 +0000 2017,Purple and Gold  I can get em both I don't wanna chooseeeee 🗣💛💜 https://t.co/FYoxBxdOBc,11
Wed Sep 13 21:41:21 +0000 2017,Cushing needs to say what Pettitte said if he wants to go into that locker room again.  -Boob Lord   This dude is GOLD,0
Wed Sep 13 21:40:50 +0000 2017,Purple and Gold  I can get em both I don't wanna chooseeeee 🗣💛💜 https://t.co/FYoxBxdOBc,11
Wed Sep 13 21:39:52 +0000 2017,• The iconic Thierry Mugler gold metal corset (1995)  - Beyoncé wore this in her Sweet Dreams music video (2009) https://t.co/ud8BW8x2SW,9
Wed Sep 13 21:37:59 +0000 2017,Touches my heart to see caretakers I've come to love &amp; dear friends &amp; patients "going gold" in a parade at Tx... https://t.co/Q3F04gFwZ1,0
Wed Sep 13 21:29:34 +0000 2017,Lovin' how that gold sit on your neck  honey 🍯 https://t.co/bPPVUmBOsK,131
Wed Sep 13 21:27:14 +0000 2017,I wanna dip that ass in gold,0
Wed Sep 13 21:24:03 +0000 2017,Love how this turned out 😍 #motd#abh#nyx#fentybeauty#gold https://t.co/9dRhw8C4W6,8
Wed Sep 13 21:21:31 +0000 2017,@rudyfabre @Teddyjradio Once they get that fu*ckin gold jacket they are off limits....trying to reach some guy name Cody Carlson though,1
Wed Sep 13 21:19:43 +0000 2017,all black gold gat ya know opposites attract,0
Wed Sep 13 21:18:43 +0000 2017,I just earned the 'Fields of Gold (Level 5)' badge on @untappd! https://t.co/5hJcRM1puN,0
Wed Sep 13 21:18:10 +0000 2017,@Noralache aye are those all gold van sk8 highs still in stock?,0
Wed Sep 13 21:17:27 +0000 2017,Black Gold with bight gold cuts created by me | https://t.co/2cQGhpY6tO https://t.co/gMVdeUAfay,8
Wed Sep 13 21:17:26 +0000 2017,@amstramdjam Dommage 🤷🏻‍♀️ Passe au Twitter Gold  je vois plus que ça.,0
Wed Sep 13 21:16:54 +0000 2017,@rudyfabre @Teddyjradio Once they get that fu*ckin gold jacket they are off limits....trying to reach some guy name Cody Carlson though,1
Wed Sep 13 21:16:40 +0000 2017,“This book was captivating from the start.” #fantasy #kidlit #middlegrade #magic #IARTG #ChildrensBooks… https://t.co/5YpNccNwk9,1
Wed Sep 13 21:16:03 +0000 2017,“This book was captivating from the start.” #fantasy #kidlit #middlegrade #magic #IARTG #ChildrensBooks… https://t.co/5YpNccNwk9,1
Wed Sep 13 21:11:31 +0000 2017,Can someone donate me a solid gold cuban link pls,0
Wed Sep 13 21:10:45 +0000 2017,@EAMaddenMobile You need to add gold rookie qbs,0
Wed Sep 13 21:08:58 +0000 2017,Thanksgiving Tablecloth 72" x 72" Square Fall Harvest Red Gold Turkey Pumpkins https://t.co/8vy8XiSTRG,0
Wed Sep 13 20:55:32 +0000 2017,Black Gold with bight gold cuts created by me | https://t.co/2cQGhpY6tO https://t.co/gMVdeUAfay,8
Wed Sep 13 20:52:42 +0000 2017,Yesterday Going Gold Texas Children's Cancer Center. https://t.co/0tY11RRHjB,0
Wed Sep 13 20:52:41 +0000 2017,Game Changer! China to Buy Oil with Gold-Back Yuan  Russia's Backdoor Deals https://t.co/5vOWNPhUZJ,0
Wed Sep 13 20:37:33 +0000 2017,I'm happy to announce that @toy_tokyo will have an exclusive Black and Gold 6" Dragonzord Funko Pop only at... https://t.co/WkfXjJAdLL,6
Wed Sep 13 20:34:56 +0000 2017,@greg_doucette They don't count because the flags in the courts had gold fringe on them.,0
Wed Sep 13 20:32:21 +0000 2017,"Gold Lamps" Trending in HOLLYWOOD Over 1000 Designs @ https://t.co/ckNhCNJm5I .. https://t.co/JEgXkgMOjA,0
Wed Sep 13 20:31:16 +0000 2017,@latelateshow @SUP3RFRUIT @Heineken I'M SOO EXCITED!!,0
Wed Sep 13 20:29:47 +0000 2017,"now i ain't sayin she a gold digger " https://t.co/abTN86001o,0
Wed Sep 13 20:25:55 +0000 2017,Love how this turned out 😍 #motd#abh#nyx#fentybeauty#gold https://t.co/9dRhw8C4W6,8
Wed Sep 13 20:24:27 +0000 2017,Love how this turned out 😍 #motd#abh#nyx#fentybeauty#gold https://t.co/9dRhw8C4W6,8
Wed Sep 13 20:15:15 +0000 2017,Love how this turned out 😍 #motd#abh#nyx#fentybeauty#gold https://t.co/9dRhw8C4W6,8
Wed Sep 13 20:09:24 +0000 2017,@NM_NickNocturne I think it was from the topic you did: SCP. That and Creepypastas will get you a gold mine of views :3,0
Wed Sep 13 20:04:03 +0000 2017,Come out and join us at any of our Gold’s Gym Houston locations on Sat 9/30 9AM -12PM  #FitFest #GoldsGymHouston https://t.co/ZkvZiB9DzQ,0
Wed Sep 13 20:03:53 +0000 2017,♦❁ Scoodie Hoodie Hood &amp; Scarf Combined Shades of Greens Gold Autumn Colo... Consider Now https://t.co/ne9o5NVDc9 https://t.co/EPaPu3XGuP,0
Wed Sep 13 20:03:28 +0000 2017,✔⌂ Scoodie Hoodie Hood &amp; Scarf Combined Shades of Greens Gold Autumn Colo... Be Inspired! https://t.co/ne9o5NVDc9 https://t.co/RZoBVfg4U9,0
Wed Sep 13 20:02:27 +0000 2017,♤} Scoodie Hoodie Hood &amp; Scarf Combined Shades of Greens Gold Autumn Colo... Dog Lovers https://t.co/ne9o5NVDc9 https://t.co/vTGvOC2WvF,0
Wed Sep 13 20:00:07 +0000 2017,Free Gold Box from weekly log in bonus in @disneymdice https://t.co/3bibJWXYJC,0
Wed Sep 13 19:58:50 +0000 2017,September is #ChildhoodCancerAwareness month. Our partners at @bcmhouston are going gold in support of those affect… https://t.co/q74q9AoHNF,5
Wed Sep 13 19:58:37 +0000 2017,10 gold chains  wood grain propane https://t.co/tnD04EfoUt,0
Wed Sep 13 19:54:34 +0000 2017,September is #ChildhoodCancerAwareness month. Our partners at @bcmhouston are going gold in support of those affect… https://t.co/q74q9AoHNF,5
Wed Sep 13 19:52:16 +0000 2017,This hunky Florida police selfie during Irma is VIRAL  and the comments are pure gold: https://t.co/pmb7sbpR6Y https://t.co/6hAcMsdIxk,10
Wed Sep 13 19:51:05 +0000 2017,Gold Cross Dangle Earring Stud or Ear Wire  Tiny Gold Cross Earring… https://t.co/JrSkVvi6iJ #Etsy #ReligiousEarring https://t.co/oPvulitntA,0
Wed Sep 13 19:44:26 +0000 2017,Dying my hair Rose Gold . 😍,0
Wed Sep 13 19:43:06 +0000 2017,INSTANT GOLD STATUS is yours when you signup for the #FREE Fuel Rewards Network https://t.co/759j4FluQr … #ad   Save 5 cents per gallon,0
Wed Sep 13 19:40:55 +0000 2017,White and Champagne Headband Gold and Aqua Headband White https://t.co/NaeFcXkEUG via @Etsy,0
Wed Sep 13 19:34:06 +0000 2017,Former UBS Trader Arrested  Charged With Rigging Gold Prices https://t.co/aNklITKZZS,0
Wed Sep 13 19:33:30 +0000 2017,If your hair company selling your hair with black gold or silver bands. It's not 100% virgin hair.,0
Wed Sep 13 19:25:59 +0000 2017,Black Gold with bight gold cuts created by me | https://t.co/2cQGhpY6tO https://t.co/gMVdeUAfay,8
Wed Sep 13 19:22:27 +0000 2017,I'm happy to announce that @toy_tokyo will have an exclusive Black and Gold 6" Dragonzord Funko Pop only at... https://t.co/WkfXjJAdLL,6
Wed Sep 13 19:17:22 +0000 2017,Please tell me Dramatic Readings with Dana Snyder is a permanent feature because that is pure gold. https://t.co/8GnxjKePNk,0
Wed Sep 13 19:17:05 +0000 2017,@JRodgers11 @DosEquis 1. Jags aren't a college team. 2. We don't wear black and gold. It's Teal and Gold. Geesh and… https://t.co/nbt9Pjp6EY,0
Wed Sep 13 19:10:37 +0000 2017,I'm starting a lil business and I need help.  Rose gold or yellow for packaging?,1
Wed Sep 13 19:09:20 +0000 2017,"He must have a ding-a-ling of gold" https://t.co/luPVyImpPO,0
Wed Sep 13 19:08:05 +0000 2017,This GOLD neems https://t.co/X7tJZ5B1oZ,1
Wed Sep 13 19:01:27 +0000 2017,I'm starting a lil business and I need help.  Rose gold or yellow for packaging?,1
Wed Sep 13 18:57:49 +0000 2017,"Anything @rihanna touches turns into Trophy Wife gold." @fentybeauty @Sephora READ HERE: https://t.co/Ujw8Wo7HKJ https://t.co/QwnTcQ7Jdl,1
Wed Sep 13 18:56:47 +0000 2017,Periwinkle had a great time going gold for Childhood Cancer Awareness Month at @TexasChildrens today!… https://t.co/dMgkptJ6yT,1
Wed Sep 13 18:50:24 +0000 2017,@JayMewes Gold.,0
Wed Sep 13 18:49:10 +0000 2017,Black Gold with bight gold cuts created by me | https://t.co/2cQGhpY6tO https://t.co/gMVdeUAfay,8
Wed Sep 13 18:39:58 +0000 2017,@sunnyseeley At level 9  all members of the party had to throw 2k gold and I offered my shortsword of wounding.  Ov… https://t.co/BaTSy1bZgc,0
Wed Sep 13 18:38:54 +0000 2017,It's football time  let's show School Spirit to our football team. Wear your Green and Gold tomorrow. #spiritday… https://t.co/xxi6Tn3jcc,10
Wed Sep 13 18:35:31 +0000 2017,@nelsondemille Enjoyed the first three chapters. Look forward to meeting you in H-Town. Moved here from the Gold Coast.,0
Wed Sep 13 18:34:35 +0000 2017,@pwdbrudog @Hinchtown I only got black and gold stuff  IF I gotta change pls let me know.. I'm not handling this wa… https://t.co/5KigieoSli,0
Wed Sep 13 18:34:06 +0000 2017,Gold Pop  Dollar Drop On "Red Hot" Mueller Social Media Probe Headlines https://t.co/LTWLKwwVgT,0
Wed Sep 13 18:32:08 +0000 2017,Black Gold with bight gold cuts created by me | https://t.co/2cQGhpY6tO https://t.co/gMVdeUAfay,8
Wed Sep 13 18:31:28 +0000 2017,Knowing girls y’all gon pick one and just say ion wanna eat there https://t.co/QdMQhtoYRC,37143
Wed Sep 13 18:30:46 +0000 2017,@DestinyyNOChild Milani tantastic in the shade fantastic gold !,1
Wed Sep 13 18:30:35 +0000 2017,@DestinyyNOChild Milani tantastic in the shade fantastic gold !,1
Wed Sep 13 18:29:53 +0000 2017,@Stonekettle I gold is a good buy...save for the crash!!,0
Wed Sep 13 18:24:24 +0000 2017,Black Gold with bight gold cuts created by me | https://t.co/2cQGhpY6tO https://t.co/gMVdeUAfay,8
Wed Sep 13 18:24:19 +0000 2017,@FerryCorstenCC Did Ferry hear about Marcus recording studio and his gold deck award being stolen looting was happening in Houston too 😢😢😢,0
Wed Sep 13 18:23:01 +0000 2017,I think I'm going back to rose gold,0
Wed Sep 13 18:18:05 +0000 2017,Black Gold with bight gold cuts created by me | https://t.co/2cQGhpY6tO https://t.co/gMVdeUAfay,8
Wed Sep 13 18:17:49 +0000 2017,Black Gold with bight gold cuts created by me | https://t.co/2cQGhpY6tO https://t.co/gMVdeUAfay,8
Wed Sep 13 18:15:23 +0000 2017,Black Gold with bight gold cuts created by me | https://t.co/2cQGhpY6tO https://t.co/gMVdeUAfay,8
Wed Sep 13 18:13:58 +0000 2017,The royal blue/gold MUSICIAN FIRST DRUMMER SECOND tees are available at https://t.co/3L5Lnx5NCD  #beats… https://t.co/44TUWJtwmb,0
Wed Sep 13 18:07:02 +0000 2017,NOTD: Nude &amp; Rose Gold  https://t.co/IAO3wmMCL8 #bbloggers #NOTD #Nails,1
Wed Sep 13 18:06:07 +0000 2017,NOTD: Nude &amp; Rose Gold  https://t.co/IAO3wmMCL8 #bbloggers #NOTD #Nails,1
Wed Sep 13 18:01:57 +0000 2017,♤✿ Scoodie Hoodie Hood &amp; Scarf Combined Shades of Greens Gold Autumn Colo... Take a Look https://t.co/ne9o5NVDc9 https://t.co/QphbXJNLwi,0
Wed Sep 13 18:01:44 +0000 2017,Roberto Coin 18K Yellow Gold Multi Gemstone and Diamond Flower Pendant via @EBTHofficial https://t.co/cwjhnLMi9y #auction #mustsee,0
Wed Sep 13 18:01:03 +0000 2017,♣◕ Scoodie Hoodie Hood &amp; Scarf Combined Shades of Greens Gold Autumn Colo... Handmade https://t.co/ne9o5NVDc9 https://t.co/F1cwbPcrnf,0
Wed Sep 13 17:58:05 +0000 2017,I'm happy to announce that @toy_tokyo will have an exclusive Black and Gold 6" Dragonzord Funko Pop only at... https://t.co/WkfXjJAdLL,6
Wed Sep 13 17:56:28 +0000 2017,Wheel Wednesday  check out the playing on this General with the Rose Gold 😎😎😎😎😎😎  #Repost… https://t.co/0SCckpZ0UJ,0
Wed Sep 13 17:49:41 +0000 2017,I'm happy to announce that @toy_tokyo will have an exclusive Black and Gold 6" Dragonzord Funko Pop only at... https://t.co/WkfXjJAdLL,6
Wed Sep 13 17:46:23 +0000 2017,@Hadas_Gold @yashar Let’s see him appoint women to positions of power instead of positions serving as his mouthpiec… https://t.co/oLkmFzXDKq,0
Wed Sep 13 17:42:17 +0000 2017,@JayoDaDon1 6'5 slasher you don't need the elite dribble moves u got gold ankle breaker and u can body the hell out of people driving in,0
Wed Sep 13 17:40:14 +0000 2017,"Gold Lamp" Trending in Hollywood @ https://t.co/lLszNNlKKO 5 000 Products On Line https://t.co/deC4JUzw6r,0
Wed Sep 13 17:33:16 +0000 2017,Too many people miss the silver lining because they're expecting gold. -Maurice Setter,35
Wed Sep 13 17:32:12 +0000 2017,#AFFILIATE “Szul” at https://t.co/rtcICsGhw8: 15% Off All Gold Hoop Earrings – Use Coupon Code – HOOPS15 - Deals from just $15 with Coupon,0
Wed Sep 13 17:30:15 +0000 2017,10 Ways To Invest In Gold From 7 Experts Read more: https://t.co/P85b6xWbDz #invest https://t.co/nS86GQ3mmF,0
Wed Sep 13 17:23:14 +0000 2017,We got diamonds and gold  ain't no stainless steel. Independent  we ain't take a deal,0
Wed Sep 13 17:15:45 +0000 2017,Too many people miss the silver lining because they're expecting gold. -Maurice Setter,35
Wed Sep 13 17:15:39 +0000 2017,#AFFILIATE “B2C Jewels” at https://t.co/rtcICsGhw8: Fine diamond jewelry and trendy products in gold  pearl &amp; gemstone.,0
Wed Sep 13 17:10:17 +0000 2017,#Omega Automatic 14K Yellow Gold Filled and Leather Wristwatch via @EBTHofficial https://t.co/WHrpkm7uz3 #luxurywatches #vintagewatches,2
Wed Sep 13 17:10:04 +0000 2017,This GOLD neems https://t.co/X7tJZ5B1oZ,1
Wed Sep 13 17:08:06 +0000 2017,Roberto Coin #18K Yellow #Gold Multi Gemstone and #Diamond Flower Pendant via @EBTHofficial https://t.co/cwjhnLMi9y #robertocoin,0
Wed Sep 13 17:07:28 +0000 2017,Rolex 14K Yellow Gold Wristwatch and Tie Clip from Diamond Akali Co. via @EBTHofficial https://t.co/2ueOlHIYbc,1
Wed Sep 13 17:04:40 +0000 2017,I added a video to a @YouTube playlist https://t.co/E8LxTZgLbj Hands of Gold - Ed Sheeran - Peter Hollens (Extended Cover),0
Wed Sep 13 17:02:42 +0000 2017,This hunky Florida police selfie during Irma is VIRAL  and the comments are pure gold: https://t.co/pmb7sbpR6Y https://t.co/6hAcMsdIxk,10
Wed Sep 13 17:02:01 +0000 2017,Too many people miss the silver lining because they're expecting gold. -Maurice Setter,35
Wed Sep 13 17:01:06 +0000 2017,@OtisAppalacia @jimrome Comedy gold,0
Wed Sep 13 17:00:59 +0000 2017,Microsoft Gold ERP Partner @ArcherPointInc Platinum sponsorship for NAVUG Summit #NAVUG #NAVUGSummit #archerpoint… https://t.co/wC92RYfkdr,0
Wed Sep 13 16:58:33 +0000 2017,Idk why this generation glorifies cutting ppl off so much &amp; then thinks they finna be in a marriage that lasts 60 yrs. you can't communicate,25909
Wed Sep 13 16:54:05 +0000 2017,This 24k Gold Mask Is Everything @peterthomasroth #Beauty #Mask #cosmetics #Glow https://t.co/QaCQf65osd,0
Wed Sep 13 16:51:47 +0000 2017,The gold rose so fyeee @samthejeweler 😩 https://t.co/2sn09sXgTO,1
Wed Sep 13 16:44:51 +0000 2017,Too many people miss the silver lining because they're expecting gold. -Maurice Setter,35
Wed Sep 13 16:43:45 +0000 2017,@ohnoNOTFEMINISM Omg I'm screaming. This account is gold 😂😂😂,0
Wed Sep 13 16:43:29 +0000 2017,All NBA Team and he ranked 36? Allstar starter ranked 36? Gold medalist ranked 36? 5th in scoring last year ranked… https://t.co/EAE4yi8xyM,8
Wed Sep 13 16:33:40 +0000 2017,This Friday!! the Premiere of ROSE GOLD FRIDAYs &amp; Indmix Exchange |Dj Supastar + Dj Q-Holic| All… https://t.co/m1Likmle7V,0
Wed Sep 13 16:33:25 +0000 2017,Our rose gold #vapepen https://t.co/nBp4KX0tBT,0
Wed Sep 13 16:27:25 +0000 2017,Too many people miss the silver lining because they're expecting gold. -Maurice Setter,35
Wed Sep 13 16:21:38 +0000 2017,September is #ChildhoodCancerAwareness month. Our partners at @bcmhouston are going gold in support of those affect… https://t.co/q74q9AoHNF,5
Wed Sep 13 16:13:49 +0000 2017,"Now I ain't saying she's a gold digga... but she ain't messing with no broke niggas" https://t.co/BeJM5SLqdc,0
Wed Sep 13 16:13:12 +0000 2017,3 ways to turn online reviews into storytelling gold https://t.co/UthYLlWVI1 https://t.co/IuDiyh1dyy,0
Wed Sep 13 16:03:52 +0000 2017,What females really mean when that pussy gold or ✨🤦🏽‍♂️ help a nigga out .com,0
Wed Sep 13 16:03:37 +0000 2017,"Gold Pineapple" Coolers Trending in HOLLYWOOD at: https://t.co/KTNloWNdaf #TREND https://t.co/iseRvQNGUm,0
Wed Sep 13 16:02:11 +0000 2017,♤❦ Scoodie Hoodie Hood &amp; Scarf Combined Shades of Greens Gold Autumn Colo... Best Ever https://t.co/ne9o5NVDc9 https://t.co/WtgiB7wepU,0
Wed Sep 13 15:39:04 +0000 2017,'The Original Country Gold with Rowdy Yates' welcomes Al Farb as guest host https://t.co/f918MevrgO,0
Wed Sep 13 15:34:42 +0000 2017,Just a small list of what you can do with bamboo! https://t.co/5jnAkkjPBY,0
Wed Sep 13 15:31:25 +0000 2017,Why Canada’s Kinross Gold uses #SAP #SuccessFactors  to coordinate its HR operations across four continents https://t.co/1ouF8bZSZF #HRTech,6
Wed Sep 13 15:28:05 +0000 2017,Gold Drops  USD Pops As Mulvaney/Ryan Signals Tax Plan Coming September 25th https://t.co/JJoNmXcrdM,0
Wed Sep 13 15:25:09 +0000 2017,This hunky Florida police selfie during Irma is VIRAL  and the comments are pure gold: https://t.co/pmb7sbpR6Y https://t.co/6hAcMsdIxk,10
Wed Sep 13 15:18:05 +0000 2017,Too many people miss the silver lining because they're expecting gold. -Maurice Setter,35
Wed Sep 13 15:15:33 +0000 2017,What FentyBeauty's Trophy Wife gold highlighter actually looks like on anyone besides #Rihanna! https://t.co/oBWOYpYvc9,0
Wed Sep 13 15:07:38 +0000 2017,Me realizing that nobody fucks with me https://t.co/Yp6VLIFnoJ,3166
Wed Sep 13 14:59:57 +0000 2017,I ain't shit without my gold on,0
Wed Sep 13 14:56:15 +0000 2017,@TrueFactsStated If you lose gold by a tenth of a second and find out the russian who won was on steroids and growt… https://t.co/HqwfjgjGPY,9
Wed Sep 13 14:51:21 +0000 2017,Highway Kids Champions Club has officially launched in the Gold Coast of Australia. So proud of Pastor Caleb &amp; the… https://t.co/3TDXxXU0q8,2
Wed Sep 13 14:47:06 +0000 2017,September is #ChildhoodCancerAwareness month. Our partners at @bcmhouston are going gold in support of those affect… https://t.co/q74q9AoHNF,5
Wed Sep 13 14:45:16 +0000 2017,Still gold https://t.co/wDqV1hpa6d,1
Wed Sep 13 14:20:26 +0000 2017,Still gold https://t.co/wDqV1hpa6d,1
Wed Sep 13 14:18:23 +0000 2017,This is Gold!!!!! 😂😂😂 https://t.co/1sac15GbsO,0
Wed Sep 13 14:15:49 +0000 2017,Weekend league rewards gonna be crazy for me this Thursday. Gonna get 2 Gold 1 rewards &amp; a Gold 2 reward lol,1
Wed Sep 13 14:15:09 +0000 2017,Idk if I should get the 7 Plus Rose Gold or Black 🤦🏻‍♂️,0
Wed Sep 13 14:14:24 +0000 2017,@Depthify @GGoddessAsh im like gold 2. id win games if i didnt challenge every gun fight,0
Wed Sep 13 14:12:34 +0000 2017,@Depthify @GGoddessAsh im platinum in fives and gold in singles now im a lot better,0
Wed Sep 13 14:06:58 +0000 2017,Ms. Flynn says readers don't need to turn into curmudgeons! Read books like they're gold!  #buzzbuzz @Mendel_AISD 🐝 https://t.co/tcszOgd4Km,2
Wed Sep 13 14:01:15 +0000 2017,Too many people miss the silver lining because they're expecting gold. -Maurice Setter,35
Wed Sep 13 13:50:05 +0000 2017,Too many people miss the silver lining because they're expecting gold. -Maurice Setter,35
Wed Sep 13 13:46:07 +0000 2017,Too many people miss the silver lining because they're expecting gold. -Maurice Setter,35
Wed Sep 13 13:45:30 +0000 2017,September is #ChildhoodCancerAwareness month. Our partners at @bcmhouston are going gold in support of those affect… https://t.co/q74q9AoHNF,5
Wed Sep 13 13:41:08 +0000 2017,@TrueFactsStated If you lose gold by a tenth of a second and find out the russian who won was on steroids and growt… https://t.co/HqwfjgjGPY,9
Wed Sep 13 13:40:28 +0000 2017,This hunky Florida police selfie during Irma is VIRAL  and the comments are pure gold: https://t.co/pmb7sbpR6Y https://t.co/6hAcMsdIxk,10
Wed Sep 13 13:34:20 +0000 2017,This hunky Florida police selfie during Irma is VIRAL  and the comments are pure gold: https://t.co/pmb7sbpR6Y https://t.co/6hAcMsdIxk,10
Wed Sep 13 13:30:52 +0000 2017,"Raging" Seth = RADIO GOLD!  It is quite therapeutic for so many of us listeners as he uncorks the same frustration… https://t.co/JxdDk1Leqd,0
Wed Sep 13 13:21:44 +0000 2017,THIS IS GOLD https://t.co/sAcHv78fdi,0
Wed Sep 13 13:19:03 +0000 2017,Weekend league rewards gonna be crazy for me this Thursday. Gonna get 2 Gold 1 rewards &amp; a Gold 2 reward lol,1
Wed Sep 13 13:14:17 +0000 2017,This hunky Florida police selfie during Irma is VIRAL  and the comments are pure gold https://t.co/LtjbdeICdz,0
Wed Sep 13 13:10:59 +0000 2017,This hunky Florida police selfie during Irma is VIRAL  and the comments are pure gold: https://t.co/pmb7sbpR6Y https://t.co/6hAcMsdIxk,10
Wed Sep 13 13:10:22 +0000 2017,This hunky Florida police selfie during Irma is VIRAL  and the comments are pure gold: https://t.co/pmb7sbpR6Y https://t.co/6hAcMsdIxk,10
Wed Sep 13 13:08:57 +0000 2017,September is #ChildhoodCancerAwareness month. Our partners at @bcmhouston are going gold in support of those affect… https://t.co/q74q9AoHNF,5
Wed Sep 13 13:04:58 +0000 2017,When your coworker brings you gold! 🙌🏼🤗🤗 Thank you  Mrs. Dowda!!!#wearereed #6thgradeELA https://t.co/Os20kt27H9,0
Wed Sep 13 12:49:20 +0000 2017,Congrats to Lauren Green &amp; Freia Pamintuan recognized at board meeting for being  National Gold Medalists -… https://t.co/ddzlGYlJT2,10
Wed Sep 13 12:48:34 +0000 2017,This hunky Florida police selfie during Irma is VIRAL  and the comments are pure gold: https://t.co/pmb7sbpR6Y https://t.co/6hAcMsdIxk,10
Wed Sep 13 12:48:04 +0000 2017,This hunky Florida police selfie during Irma is VIRAL  and the comments are pure gold: https://t.co/pmb7sbpR6Y https://t.co/6hAcMsdIxk,10
Wed Sep 13 12:44:27 +0000 2017,Too many people miss the silver lining because they're expecting gold. -Maurice Setter,35
Wed Sep 13 12:43:12 +0000 2017,Like... he's 11. WTF can he DO FOR YOU BIH? Nada. That's what.   And his response is gold. https://t.co/TlbYB5XSbv,0
Wed Sep 13 12:38:33 +0000 2017,If I get my girl this bald i better get sucked like a crawfish head all night ! https://t.co/sOt2Miyici,35989
Wed Sep 13 12:37:21 +0000 2017,RT @MarriottRewards: The Gold Coast  #Melbourne  #Tasmania—go beyond #Sydney on your adventure in #Australia: … https://t.co/FOg81MnZX8,0
Wed Sep 13 12:36:25 +0000 2017,RT @MarriottRewards: The Gold Coast  #Melbourne  #Tasmania—go beyond #Sydney on your adventure in #Australia: … https://t.co/RhJwfUbyZu,0
Wed Sep 13 12:35:31 +0000 2017,Too many people miss the silver lining because they're expecting gold. -Maurice Setter,35
Wed Sep 13 12:30:32 +0000 2017,RT @MarriottRewards: The Gold Coast  #Melbourne  #Tasmania—go beyond #Sydney on your adventure in #Australia: … https://t.co/wQ3kw1qCj5,0
Wed Sep 13 12:21:05 +0000 2017,Too many people miss the silver lining because they're expecting gold. -Maurice Setter,35
Wed Sep 13 12:20:39 +0000 2017,Too many people miss the silver lining because they're expecting gold. -Maurice Setter,35
Wed Sep 13 11:51:04 +0000 2017,Labradorite Hoop Earrings- Gold Filled Labradorite Hoops… https://t.co/qibzGq28Ow #ShalomJewelry #LabradoriteJewelry https://t.co/1SAVSzJGpj,0
Wed Sep 13 11:49:11 +0000 2017,Metals Stocks: Gold prices snap brief slide  take new aim at one-year highs https://t.co/ftAgC1qwmj,0
Wed Sep 13 11:47:10 +0000 2017,Too many people miss the silver lining because they're expecting gold. -Maurice Setter,35
