Mon Jul 10 23:58:36 +0000 2017,Clear bag policy in effect at BBVA Compass Stadium for Gold Cup doubleheader  https://t.co/o0xzEQ2bpc,0
Mon Jul 10 23:55:06 +0000 2017,Fishing Boat Strikes Eight-Legged Gold | Deadliest Catch https://t.co/bEmZhq3dWp #cutthecable https://t.co/MfWv0eM8IP,0
Mon Jul 10 23:47:29 +0000 2017,@MelanieLawson13 @HerzogWeather @TillmanWeather @abc13houston @TomAbrahams13 😂😂 I wish there was a pot of gold,1
Mon Jul 10 23:43:10 +0000 2017,showing off my new shoes...in my bday suit 😸 rose gold! https://t.co/n1Dg8tvEVB,0
Mon Jul 10 23:40:16 +0000 2017,@jugiearmstrong This is pure gold! Well played Julia!,0
Mon Jul 10 23:36:31 +0000 2017,Boy teeth gold damn near https://t.co/XND9e3YHkT,0
Mon Jul 10 23:34:41 +0000 2017,GO WATCH MY NEW VIDEO!!!!!! Purple gold glitter cut crease!!!!! https://t.co/r761CPageK,1
Mon Jul 10 23:31:12 +0000 2017,@htowngood  + @djmrrogers = "Tuesday at Rose Gold " 🎧 #DjGoodGrief #DjMrRogers #RoseGoldHtx #Houston https://t.co/ZUogFHe4Dg,1
Mon Jul 10 23:20:36 +0000 2017,@RealDonKebinos @B1ackSchefter @khloekardashian @JHarden13 I ain't saying she a gold digger... But she ain't messing with no broke nigga,0
Mon Jul 10 23:08:13 +0000 2017,Listen to ROSE GOLD by Bandit #np on #SoundCloud https://t.co/B44Qh1aRQt,4
Mon Jul 10 23:07:15 +0000 2017,Lmfao gold https://t.co/iCyPRQGTtf,0
Mon Jul 10 23:06:23 +0000 2017,Eldorado finishes Integra Gold acquisition  expands operations in Canada https://t.co/65Y0rCwLtl #mining https://t.co/RtnEG20n1S,1
Mon Jul 10 23:04:04 +0000 2017,This president set the GOLD STANDARD for coolness. https://t.co/Yx7WVia5nF,661
Mon Jul 10 22:41:57 +0000 2017,Law &amp; Order: Special Wigs Unit https://t.co/yNlxTwTbMn,9764
Mon Jul 10 22:23:42 +0000 2017,About to get me some gold hoop earrings,0
Mon Jul 10 22:22:06 +0000 2017,@oadele53 @only2rab @PosiePosie1212 @piotr408 @ramosrebecca11 @Viola_Walewska @BPerrionni @jacques1290 @sammatt012… https://t.co/NaQJdQbRgO,13
Mon Jul 10 22:16:54 +0000 2017,@morganwarstler @xychelsea Hold on let me just reach into my big bag of gold coins with the dollar sign drawn on it,0
Mon Jul 10 22:10:26 +0000 2017,Had to pull out the gold glasses on these boys today. Hide your math problems cuz ama solve em https://t.co/E1BCJDTHfL,8
Mon Jul 10 22:10:17 +0000 2017,GO WATCH MY NEW VIDEO!!!!!! Purple gold glitter cut crease!!!!! https://t.co/r761CPageK,1
Mon Jul 10 22:09:27 +0000 2017,This president set the GOLD STANDARD for coolness. https://t.co/Yx7WVia5nF,661
Mon Jul 10 22:02:11 +0000 2017,Dang this is old but gold 😎 https://t.co/Cg28DywwpR,0
Mon Jul 10 21:55:04 +0000 2017,This president set the GOLD STANDARD for coolness. https://t.co/Yx7WVia5nF,661
Mon Jul 10 21:52:09 +0000 2017,@troytheblackguy @nikuaIe Why'd tf did they even include drake that looks like that gold framing all my old Mexican… https://t.co/35vgo0znUu,0
Mon Jul 10 21:47:53 +0000 2017,Clear bag policy in effect at BBVA Compass Stadium for Gold Cup doublheader #HOUDynamo  https://t.co/2uKjzYZJBd https://t.co/1QmSDSNUpE,1
Mon Jul 10 21:31:27 +0000 2017,&gt;Exquisite Photos From Adekunle Gold's  'One Night Stand' Show In London https://t.co/WuNDiFdaqS,0
Mon Jul 10 21:28:17 +0000 2017,This president set the GOLD STANDARD for coolness. https://t.co/Yx7WVia5nF,661
Mon Jul 10 21:27:54 +0000 2017,Eric Thomas has a heart of gold.. between his conference yesterday and watching him baptize my daddy today  I'm so inspired.,1
Mon Jul 10 21:27:20 +0000 2017,Eric Thomas has a heart of gold.. between his conference yesterday and watching him baptize my daddy today  I'm so inspired.,1
Mon Jul 10 21:27:17 +0000 2017,The Ecstasy of Gold needs to be played at my funeral.  Thanks in advance!,0
Mon Jul 10 21:25:49 +0000 2017,These 4:44 footnotes got some gems...this is Gold,0
Mon Jul 10 21:25:33 +0000 2017,🎉 🎉🎉 A HUGE congratulations to @8thWonderBrew for tying Weihenstephan for GOLD in the US Open Beer Championship! 🎉🎉🎉 https://t.co/2sQ8vhOcmj,9
Mon Jul 10 21:22:47 +0000 2017,VVIX Signals Trouble Ahead Amid Retail Rout  Bond-Buying  &amp; Gold Gains https://t.co/ustJKEq8Eg,0
Mon Jul 10 21:17:56 +0000 2017,Going out on a limb with this one.  I am fairly certain  void of scientific evidence  that Velveeta is NOT liquid gold.,0
Mon Jul 10 21:06:26 +0000 2017,Echo Park Gold Room Rebrands As Expensive Cocktail Bar - https://t.co/0sV9hYwOLu,0
Mon Jul 10 21:05:54 +0000 2017,Where he at tho ? https://t.co/BWB6PIunlu,0
Mon Jul 10 21:03:30 +0000 2017,@sunkissbee @trinhers @jacidgaf @stashhurrikane @kalanichanel_ @ambaiono @WillSinge This is gold,0
Mon Jul 10 21:00:09 +0000 2017,Please note that a clear bag policy will be in place at @BBVACompassStdm tomorrow for our @GoldCup doubleheader:… https://t.co/oZOHEJz4to,3
Mon Jul 10 20:57:38 +0000 2017,Had to pull out the gold glasses on these boys today. Hide your math problems cuz ama solve em https://t.co/E1BCJDTHfL,8
Mon Jul 10 20:53:16 +0000 2017,I have officially given up on my rose gold aesthetic for my room- it will now be Black Pink with Diamonds,0
Mon Jul 10 20:49:21 +0000 2017,I just earned the 'Fields of Gold (Level 3)' badge on @untappd! https://t.co/9nTgr4aVK2,0
Mon Jul 10 20:47:55 +0000 2017,Short $JDST for a day or 2  $GOLD $GLD $GDX $JNUG $JDST $DUST $GLL $NUGT $UGLD $GDXJ $XAUUSD $USDX $DX $DXY $SLV… https://t.co/fjyMhFJXPn,0
Mon Jul 10 20:43:17 +0000 2017,sportspoliticen: MLB: RT WBCBaseball: .ChrisArcher22 rockin’ his Team USA gold. #WBC2017 https://t.co/VSa6CTCoPs,0
Mon Jul 10 20:36:40 +0000 2017,Please note that a clear bag policy will be in place at @BBVACompassStdm tomorrow for our @GoldCup doubleheader:… https://t.co/oZOHEJz4to,3
Mon Jul 10 20:35:17 +0000 2017,You performing? I know it's probably "Weight In Gold" but sneak "Percogesic" in there. https://t.co/Hfe4rOS9oV,0
Mon Jul 10 20:35:10 +0000 2017,Please note that a clear bag policy will be in place at @BBVACompassStdm tomorrow for our @GoldCup doubleheader:… https://t.co/oZOHEJz4to,3
Mon Jul 10 20:31:22 +0000 2017,@TWalkerRivals Do people really care that much about this basketball game? We win gold most of the time. Can't be perfect I guess,0
Mon Jul 10 20:22:11 +0000 2017,This president set the GOLD STANDARD for coolness. https://t.co/Yx7WVia5nF,661
Mon Jul 10 20:20:37 +0000 2017,Golden circles geometric pendant necklace in mommy's ScottsMarketplace shop. #gold #jewelry https://t.co/SO5ifk8Bup,3
Mon Jul 10 20:19:15 +0000 2017,The Last Time Hedge Funds Were This Short Gold  It Rallied 18% In A Month https://t.co/PgF0ihkhHJ,0
Mon Jul 10 20:16:35 +0000 2017,@Sharond702Sj @TMZ Chyna is a gold digging hoe  child please https://t.co/eM94r9wS6n,0
Mon Jul 10 20:14:33 +0000 2017,This president set the GOLD STANDARD for coolness. https://t.co/Yx7WVia5nF,661
Mon Jul 10 20:09:36 +0000 2017,@KayyReal It's the 1st swatch. This gold bottle. It's sooooo pigmented . Looks like liquid gold . https://t.co/5Cp7TPxM4M,1
Mon Jul 10 20:08:01 +0000 2017,@KayyReal It's the 1st swatch. This gold bottle. It's sooooo pigmented . Looks like liquid gold . https://t.co/5Cp7TPxM4M,1
Mon Jul 10 20:06:00 +0000 2017,ABSOLUTE MUST READ: From Pizzagate to Gold Rigging https://t.co/bUCo2GAkvC,0
Mon Jul 10 20:05:34 +0000 2017,#NowPlaying Devil's Gold by The Fifth Firehttp://listen.samcloud.com/w/64683/Reach-Down-Radio,0
Mon Jul 10 20:05:32 +0000 2017,#NowPlaying Devil's Gold by The Fifth Firehttp://listen.samcloud.com/w/64683/Reach-Down-Radiohttp://reachdownradio.com/,0
Mon Jul 10 20:04:17 +0000 2017,◔❣ Oscar de la Renta Mug Gold Swirls on White Coffee Tea Cocoa Cup Contai... Daily Deal https://t.co/CoHi1HyrGG https://t.co/v57dlHQgCR,0
Mon Jul 10 19:54:49 +0000 2017,he's drinking beer in a wine glass https://t.co/WAHrSN5lSj,16504
Mon Jul 10 19:47:55 +0000 2017,A week is a long time to go without ️⚽️!   Catch #HON #CAN #CRC #GUF when @goldcup comes to town t•o•m•o•r•r•o•w… https://t.co/xkJgytT1bs,2
Mon Jul 10 19:47:50 +0000 2017,A week is a long time to go without ️⚽️!   Catch #HON #CAN #CRC #GUF when @goldcup comes to town t•o•m•o•r•r•o•w… https://t.co/xkJgytT1bs,2
Mon Jul 10 19:47:06 +0000 2017,Clear bag policy in effect at BBVA Compass Stadium for Gold Cup doublheader #HOUDynamo  https://t.co/2uKjzYZJBd https://t.co/1QmSDSNUpE,1
Mon Jul 10 19:47:05 +0000 2017,A week is a long time to go without ️⚽️!   Catch #HON #CAN #CRC #GUF when @goldcup comes to town t•o•m•o•r•r•o•w… https://t.co/xkJgytT1bs,2
Mon Jul 10 19:32:30 +0000 2017,When Cardi B was talking about how niggas talk shit about gold diggers.. but niggas be out here living off bitches 🙌🏾👏🏾🤔🤔🤔,0
Mon Jul 10 19:30:08 +0000 2017,♧} 2 Serving Relish Butter Dishes Plates Indiana Carnival Gold Brilliant... Affordable https://t.co/zFjz7NJaf2 https://t.co/0MbVEmJvfE,0
Mon Jul 10 19:28:37 +0000 2017,houstondynamo​.com &gt;&gt; Clear bag policy in effect at BBVA Compass Stadium for Gold Cup doublheader https://t.co/Z7Z8DPBEgn,0
Mon Jul 10 19:16:10 +0000 2017,Had to pull out the gold glasses on these boys today. Hide your math problems cuz ama solve em https://t.co/E1BCJDTHfL,8
Mon Jul 10 19:15:42 +0000 2017,@stevepughcom @Manruss One last question while I have your attention. Who chose Booster Gold for the special? Was that assigned by DC?,0
Mon Jul 10 19:13:58 +0000 2017,🔥$999🔥 10k #gold 2ct #diamonds 3 rows #band Kings location DM for #PayPal invoice  713-748-4554… https://t.co/gg19N8KWuU,0
Mon Jul 10 19:12:11 +0000 2017,🔥$579🔥 10k #gold 1.03ct 3 rows #diamonds #band . Kings location. DM for #PayPal invoice… https://t.co/SOfSogp8Yi,0
Mon Jul 10 19:10:39 +0000 2017,🔥$690🔥 10k #gold #diamond #cross #pendant with #chain Kings location Dm for PayPal invoice… https://t.co/9j4LTeGKTc,0
Mon Jul 10 19:08:29 +0000 2017,🔥$1450🔥 10k #gold 1.6ct #diamonds #cross pendant with gold chain. Kings location. Dm for PayPal… https://t.co/a48WZDjol3,0
Mon Jul 10 19:07:23 +0000 2017,@lightgetsout @ModeratelyOkCos @auzziejlee @Aicosplays @dreamdaddygame Ya golf dad is a good one too if you want dr… https://t.co/P1knmdo0dm,1
Mon Jul 10 19:06:45 +0000 2017,🔥$1250🔥 with gold chain. 10k gold diamond ankh pendant. Kings location. Dm for PayPal invoice… https://t.co/1TwJyDPbNI,0
Mon Jul 10 19:04:26 +0000 2017,@GabeDeArmond This game made me bleed black and gold.  Painful loss.  ZOU fans can't tolerate ALMOST anymore.  Let'… https://t.co/AQHOwBZZJF,0
Mon Jul 10 19:02:20 +0000 2017,thatgirljaycole rockin DBY9 Carrie  Gold on sale $45  Check out   DBY9 2017 Anniversary Sale… https://t.co/aYTnOLm250,0
Mon Jul 10 18:52:28 +0000 2017,Had to pull out the gold glasses on these boys today. Hide your math problems cuz ama solve em https://t.co/E1BCJDTHfL,8
Mon Jul 10 18:49:39 +0000 2017,Had to pull out the gold glasses on these boys today. Hide your math problems cuz ama solve em https://t.co/E1BCJDTHfL,8
Mon Jul 10 18:48:17 +0000 2017,Had to pull out the gold glasses on these boys today. Hide your math problems cuz ama solve em https://t.co/E1BCJDTHfL,8
Mon Jul 10 18:46:38 +0000 2017,Had to pull out the gold glasses on these boys today. Hide your math problems cuz ama solve em https://t.co/E1BCJDTHfL,8
Mon Jul 10 18:41:59 +0000 2017,Got him a PS4 in gold cus duh 😗 https://t.co/KpTNUe3AIq,1
Mon Jul 10 18:37:07 +0000 2017,It's coming bro! Couple more weeks &amp; we dropping it 🔥 https://t.co/eUOvYGAQ7j,1
Mon Jul 10 18:36:28 +0000 2017,Call On Me-Adekunle Gold🎶,0
Mon Jul 10 18:34:44 +0000 2017,🔥$1 490🔥 10k #gold 1.6ct #diamonds #cross #pendant with gold #chain. Kings location. Dm for… https://t.co/2YjXtqZIST,0
Mon Jul 10 18:30:12 +0000 2017,@lightgetsout @ModeratelyOkCos @auzziejlee @Aicosplays @dreamdaddygame Ya golf dad is a good one too if you want dr… https://t.co/P1knmdo0dm,1
Mon Jul 10 18:28:33 +0000 2017,@gold_alpinas You feeeeeel me!!!! Youngin nice big dawg.,1
Mon Jul 10 18:27:14 +0000 2017,@gold_alpinas You feeeeeel me!!!! Youngin nice big dawg.,1
Mon Jul 10 18:26:52 +0000 2017,@inclowds You can go both ways  I've seen you rock both gold and silver.. just switch them out depending on your mood?,0
Mon Jul 10 18:26:13 +0000 2017,Ahmed L. is drinking an Icon Gold (Texas Honey Saison) at Flying Saucer Draught Emporium  https://t.co/Il18qomKr6,0
Mon Jul 10 18:24:00 +0000 2017,Up here we have each other- #1team- working together w/ the ground every day. Here’s my friend &amp; cmdr Fyodor &amp; I wo… https://t.co/wXyA5mPEFd,52
Mon Jul 10 18:21:58 +0000 2017,@meloooduh Gold or silver,0
Mon Jul 10 18:19:01 +0000 2017,This president set the GOLD STANDARD for coolness. https://t.co/Yx7WVia5nF,661
Mon Jul 10 18:16:06 +0000 2017,Scotty A. - That Man (Produced by. Me) 🎯 joint is hard frfr. I don't co-sign BS. https://t.co/LwvkeQ0TRe,1
Mon Jul 10 18:15:23 +0000 2017,That tweet is gold,0
Mon Jul 10 18:11:20 +0000 2017,🎉 🎉🎉 A HUGE congratulations to @8thWonderBrew for tying Weihenstephan for GOLD in the US Open Beer Championship! 🎉🎉🎉 https://t.co/2sQ8vhOcmj,9
