Tue Jan 08 23:58:45 +0000 2019,Very important study led by @_karmacap helping us understand how #LGBTQ teens experience being in health research.… https://t.co/EAJ9PtiK62,4
Tue Jan 08 23:46:54 +0000 2019,fine like a ticket on the dash 🤩 https://t.co/sFxUCM0p8K,2
Tue Jan 08 23:40:14 +0000 2019,@HellcatPerez @Divas_Champion Well  if it's true  at least they have a built-in couple name: Dash-wood.,0
Tue Jan 08 23:35:49 +0000 2019,fine like a ticket on the dash 🤩 https://t.co/sFxUCM0p8K,2
Tue Jan 08 23:33:17 +0000 2019,fine like a ticket on the dash 🤩 https://t.co/sFxUCM0p8K,2
Tue Jan 08 23:27:18 +0000 2019,i know it’s hard to deal with me :/ you gone swallow all these pills with me? i dont mean that drug shit....i mean… https://t.co/yRYjHAtR6u,4
Tue Jan 08 23:07:40 +0000 2019,DANA REALLY GETTIN 10K LIKES OFF MY INSTA CAPTION EYE DASH! https://t.co/xH3k7sEtia,0
Tue Jan 08 23:00:06 +0000 2019,Very important study led by @_karmacap helping us understand how #LGBTQ teens experience being in health research.… https://t.co/EAJ9PtiK62,4
Tue Jan 08 22:56:20 +0000 2019,[NEW]: Kurt Wuckert and Matthew John on Bitcoin Hash War  SV  Dash Adoption  Bear Market Trading +… https://t.co/DdAWgBtHO1,0
Tue Jan 08 22:44:02 +0000 2019,Very important study led by @_karmacap helping us understand how #LGBTQ teens experience being in health research.… https://t.co/EAJ9PtiK62,4
Tue Jan 08 22:43:12 +0000 2019,Very important study led by @_karmacap helping us understand how #LGBTQ teens experience being in health research.… https://t.co/EAJ9PtiK62,4
Tue Jan 08 22:29:06 +0000 2019,Call me an old fashioned but I am bourbon  a dash or two of bitters  and a rather large ice cube,0
Tue Jan 08 22:26:56 +0000 2019,We thank you Nellisa Heath of The Look Chicago  for the blessing of allowing On The SCENE to be your media platform… https://t.co/OyC8ofL7Qs,0
Tue Jan 08 22:16:49 +0000 2019,She the lamest bitch in the industry. Like what’s yo point shorty https://t.co/EONeKUmBsZ,5429
Tue Jan 08 20:59:29 +0000 2019,@ultradavid dash blocking was really fun to do in MK9. Was simple and made movement interesting. I miss it.,0
Tue Jan 08 20:55:23 +0000 2019,A SIMPLE PLAN isn't your typical Sam Raimi movie  and that's why it's his best https://t.co/oHSkvfjUhP via… https://t.co/kBVdN4of06,4
Tue Jan 08 20:40:34 +0000 2019,i know it’s hard to deal with me :/ you gone swallow all these pills with me? i dont mean that drug shit....i mean… https://t.co/yRYjHAtR6u,4
Tue Jan 08 20:27:32 +0000 2019,If I had to seed this:  1/2 - Prime 1/RE4 in some order 3 - Paper Mario TTYD 4 - Wind Waker 5 - SSBM 6 - Kirby Air… https://t.co/3BA5Z4juJh,0
Tue Jan 08 20:25:57 +0000 2019,Roasted with a dash of balsamic vinegar  these crispy #Brusselssprouts are bursting with sweet caramelized flavor.… https://t.co/fUXAO0ZEFu,0
Tue Jan 08 20:04:04 +0000 2019,@HydraSSB meanwhile pikmin 2 vs double dash on the other side of the bracket  I'm HEATED,0
Tue Jan 08 20:03:06 +0000 2019,I liked a @YouTube video https://t.co/C6bjmFIgHj Dame Dash and Nick Cannon Talk About Diet  Business  and Surviving R. Kelly,0
Tue Jan 08 19:50:51 +0000 2019,In today's #HODLtillHomeless  Top 10 worst performing coins of 2018 as per https://t.co/Z3zOmSvnLf  10. $ETC  9.… https://t.co/BZ1byfr8Q4,0
Tue Jan 08 18:34:02 +0000 2019,I hustle for my last name  I don’t hustle for my first.” - Dame Dash  #ladybossenterprise… https://t.co/iCpTcSLOtR,0
Tue Jan 08 18:23:41 +0000 2019,@SharonaBGood93 @93XRT @MaryLDixon @ChrisCwiak looks like my dash,0
Tue Jan 08 17:56:06 +0000 2019,@Edwin_Dash lol nah. I been to lazy to go to dmv,0
Tue Jan 08 17:43:26 +0000 2019,i know it’s hard to deal with me :/ you gone swallow all these pills with me? i dont mean that drug shit....i mean… https://t.co/yRYjHAtR6u,4
Tue Jan 08 17:31:00 +0000 2019,This month's Short Film in Focus is LOST &amp; FOUND  directed by Andrew Goldsmith and Bradley Slabe… https://t.co/J8mQghG9T8,0
Tue Jan 08 17:22:23 +0000 2019,@manilegion @helpeep_ A CARA DA KHLOEKKKKKKKJJ AI EU AMO UMA DASH,0
Tue Jan 08 16:47:48 +0000 2019,@NormalBoots @Toddly_Enough Papaer Mario is probably the best game of all those. But for the best all around defini… https://t.co/w3n94iV3Vo,0
Tue Jan 08 15:48:02 +0000 2019,What's a Pani Poni Dash?!,0
Tue Jan 08 13:15:07 +0000 2019,imagine dragons is mormon limp bizkit,693
Tue Jan 08 12:14:33 +0000 2019,@jlevallois @wellboy DASH  PREDIMED  etc. these all look at diets with “balances” more typical of standard recs. DA… https://t.co/NxHZyNPnsJ,0
Tue Jan 08 11:16:30 +0000 2019,गली-गली में शोर है  माँ-बेटा चोर हैं।   सब ये ट्वीट करो। ☹️,1176
Tue Jan 08 08:29:15 +0000 2019,[NEW]: Blockchain metrics  valuation  reality  manipulation | Example DASH + https://t.co/O0tD02JmTT #cryptocurrency #crypto #blockchain,0
Tue Jan 08 08:12:55 +0000 2019,Dash Cam Video Shows Dallas Police Tasing Black Family After They Called For Help https://t.co/3UKmPrBbg1,0
Tue Jan 08 06:58:34 +0000 2019,i know it’s hard to deal with me :/ you gone swallow all these pills with me? i dont mean that drug shit....i mean… https://t.co/yRYjHAtR6u,4
Tue Jan 08 06:25:12 +0000 2019,if embracing a marvelous NZSB is wrong  then  dash it a…. Wine from @MishasVineyard via @Vivino:… https://t.co/y2gVP81JvK,0
Tue Jan 08 05:59:18 +0000 2019,i know it’s hard to deal with me :/ you gone swallow all these pills with me? i dont mean that drug shit....i mean… https://t.co/yRYjHAtR6u,4
Tue Jan 08 05:17:29 +0000 2019,Damon Dash Says That Jay-Z &amp; R. Kelly's Joint Album Played A Role In Roc-A-Fella's Downfall  "I Know I'm Not F*ckin… https://t.co/piJNWFsKL3,77
Tue Jan 08 05:15:32 +0000 2019,The domination tonight by @ClemsonFB was awesome.  But given the recent failed drug test  I can't help but feel the… https://t.co/zJPLTHpIYP,0
Tue Jan 08 05:11:41 +0000 2019,Remember when Stacey Dash was that gworl?,0
Tue Jan 08 04:50:32 +0000 2019,@RiotMapleNectar His only survivability are his dashes but they get stopped by legit everything since they're coded… https://t.co/qSDJ0ECnuP,0
Tue Jan 08 03:53:45 +0000 2019,2 ingredient banana pancakes.  Have you ever made them?  1 banana 2 eggs and in this case we added a dash of some V… https://t.co/rkdLUg2dpC,0
Tue Jan 08 03:50:58 +0000 2019,LETS GOOO BIG SAD SHIT https://t.co/eC1MdQ82k6,393
Tue Jan 08 03:49:18 +0000 2019,@griffingulledge @CalvaryOakPark Pastor-Theologian folks admittedly overuse the em dash in our writing. I think we… https://t.co/Elfx5w7yuL,0
Tue Jan 08 03:29:23 +0000 2019,@BrookeOnAir Damn! Some people told me they prefer Door Dash because the fees aren’t as high?,0
Tue Jan 08 03:01:50 +0000 2019,So that Brock-Braun segment... I’m going to go back and watch the end of New Years dash.,0
Tue Jan 08 02:58:55 +0000 2019,Ladies 👀 personally your bags are like a portal of sephora and ulta with a dash of wtf is this. No man knows how to… https://t.co/TwRzopuA4e,0
Tue Jan 08 02:55:04 +0000 2019,@GamesDoneQuick This is going to sound really silly  but the parody of it that was in an episode of the Simpsons (D… https://t.co/45Ad6kTe5D,0
Tue Jan 08 02:25:18 +0000 2019,Heavy Machinery gonna be tag champs before Dash and Dawson. They won't have side-plates  just actual pieces of beef… https://t.co/aVq8X17fRl,0
Tue Jan 08 01:44:45 +0000 2019,@echoechoR I am working on a podcast with a friend where we examine the scientific or historical evidence around po… https://t.co/jZpOrnI6xt,0
Tue Jan 08 01:05:48 +0000 2019,I know Twitter is limited to NYC/DC concerns but I can't emphasize enough that this is a *real map* of what El*n M*… https://t.co/2wB1wbqw81,5178
Tue Jan 08 00:47:52 +0000 2019,What's a Pani Poni Dash?!,0
Tue Jan 08 00:41:31 +0000 2019,Raw might actually be good tonight. Will tune in after I catch up on New Years dash.,0
Tue Jan 08 00:33:58 +0000 2019,How to tell when no women were involved in brainstorming a tech idea. https://t.co/SIuQKUWptr,1395
