Fri Oct 26 22:33:08 +0000 2018,Volume changes in last 10 minutes: Binance: $XMR: 6.04% $EOS: 3.75% $DASH: 3.15% Bittrex: $XHV: 3.01% $EXCL: 2.22%… https://t.co/xWttYFjyi7,1
Fri Oct 26 22:24:19 +0000 2018,1/21/09 Keith Luke  Brockton   MA: Luke  a neo-Nazi angry about the inauguration of Barack Obama  kills two and inj… https://t.co/lp0mQp0XIx,667
Fri Oct 26 22:16:49 +0000 2018,Vore Dash Prey right to your door!,0
Fri Oct 26 22:07:29 +0000 2018,They call me Mario Kart Double Dash https://t.co/FbElkg0Cou,0
Fri Oct 26 22:02:26 +0000 2018,Volume changes in last 10 minutes: Binance: $BCD: 19.59% $TNT: 4.93% $DASH: 4.53% Bittrex: $XVG: 3.93% $XHV: 3.65%… https://t.co/0JCfmVJQfD,1
Fri Oct 26 21:35:31 +0000 2018,Me: *posts pic from inside car with the dash visible Boy: "ur check engine light is on"  Me: "I KNOW" DUMBASS BOY: "that ain't good",0
Fri Oct 26 20:59:56 +0000 2018,Genetically predisposed to obesity? Healthy diet like Mediterranean or DASH diet  will definitely help protect you! https://t.co/jBcLcR51fb,0
Fri Oct 26 20:50:59 +0000 2018,Volume changes in last 10 minutes: Binance: $MCO: 44.78% $DASH: 10.85% $WPR: 7.26% Bittrex: $DGB: 1.41% $ADA: 1.31% $SC: 0.51%,0
Fri Oct 26 19:50:06 +0000 2018,@matthew_paul @Alex_The_Gadfly EM DASH FOREVER,0
Fri Oct 26 18:41:21 +0000 2018,Take a sip  lift the curse. ✨ #WitchsBrewFrappuccino (US  Canada  &amp; Mexico  while supplies last) https://t.co/h9deYpNdAG,1737
Fri Oct 26 17:53:03 +0000 2018,I love a good em dash. https://t.co/c7eB2NqAO7,0
Fri Oct 26 17:27:13 +0000 2018,Am I the only one that really would love to see a @CobieSmulders /Maria Hill standalone film? There's been just eno… https://t.co/xJVVJz0FKn,0
Fri Oct 26 17:14:30 +0000 2018,Celeste thought:  With demo dash  it makes Madeline’s hit box smaller.  Can this be applied to when Madeline is using a feather?,0
Fri Oct 26 17:00:37 +0000 2018,tRump is talking to the Young Black Leadership Summit. This is put on by Turning Point  a conservative group. The s… https://t.co/7ep3XnWK1S,0
Fri Oct 26 16:30:02 +0000 2018,Not man enough to admit anything. I want a clear picture of the statues mounted on the dash. https://t.co/5WDB4yMWfq,0
Fri Oct 26 16:17:35 +0000 2018,@suicidalsanura I like it with brown sugar  almond milk  honey (and a dash of peanut butter if I want it thick)… https://t.co/zrykt0XqZA,0
Fri Oct 26 15:21:49 +0000 2018,Lots of lovely happy kindness focused music this morning The Morning Show on KEXP  - and then this awesomeness   "H… https://t.co/5rwccsVQce,0
Fri Oct 26 15:03:16 +0000 2018,Volume changes in last 10 minutes: Binance: $YOYO: 22.16% $XLM: 18.45% $DASH: 8.82% Bittrex: $ADA: 11.21% $XLM: 2.83% $XHV: 2.21%,0
Fri Oct 26 14:26:08 +0000 2018,#10: Smallest Hidden Spy Camera ZTour 1080P Mini Secret HD Nanny Video Camera Recorder with Night Vision and Motion… https://t.co/9ggNEFtJ78,0
Fri Oct 26 14:01:46 +0000 2018,Volume changes in last 10 minutes: Binance: $IOST: 5.26% $XZC: 4.93% $DASH: 4.33% Bittrex: $XVG: 1.76% $LTC: 1.07% $EDR: 0.94%,0
Fri Oct 26 13:50:43 +0000 2018,@SugasHero A dash of Suga A cup of Tae Kookie for dessert The full DNA  A heart so waRM Jin &amp; Chim so sweet We JHop… https://t.co/hUd2afQI8R,48397
Fri Oct 26 13:31:05 +0000 2018,Volume changes in last 10 minutes: Binance: $DASH: 4.94% $ICX: 2.55% $TRX: 2.17% Bittrex: $BCH: 9.38% $BTC: 1.72% $ETC: 1.01%,0
Fri Oct 26 13:10:33 +0000 2018,Volume changes in last 10 minutes: Binance: $ZRX: 6.73% $DASH: 4.93% $NEO: 3.29% Bittrex: $EXCL: 3.83% $PMA: 1.94% $DGB: 0.86%,0
Fri Oct 26 07:08:09 +0000 2018,I like me an em dash — I feel called out. https://t.co/HUYy8fIRYq,0
Fri Oct 26 05:57:19 +0000 2018,@SatpathyLive Don’t you think Kalinga is much more appropriate than odisha ?  and Hind !=Hindi,0
Fri Oct 26 03:26:59 +0000 2018,Volume changes in last 10 minutes: Binance: $DASH: 18.41% $WPR: 9.88% $XMR: 8.34% Bittrex: $HYDRO: 3.29% $RDD: 2.12% $EDR: 1.83%,0
Fri Oct 26 02:12:41 +0000 2018,A little smoked paprika is key here  as is sauteing the onions with a dash of sriracha and balsamic vinegar.,0
Fri Oct 26 00:47:46 +0000 2018,@cemcostello Lol that em dash! @Rachel_Tompa,0
