Sun Oct 21 23:45:39 +0000 2018,@A_J_Hood @manbearkitten These will be apple raisin (with a dash of rum) hand pies https://t.co/S8JfMpaTjS,0
Sun Oct 21 23:33:07 +0000 2018,Good morning friends! It's a cold one in Seattle  but #Toadette's got that #FridayFeeling! I love this character  a… https://t.co/vwfj285huv,0
Sun Oct 21 23:23:37 +0000 2018,A dash of paprika is the secret to amazing mac and cheese https://t.co/7yvS4bIDmD,0
Sun Oct 21 22:12:22 +0000 2018,Rainbow Dash w/Healthy Fall Tips https://t.co/oYCqi8u81f,1
Sun Oct 21 22:12:18 +0000 2018,Rainbow Dash w/Healthy Fall Tips https://t.co/oYCqi8u81f,1
Sun Oct 21 21:47:50 +0000 2018,Volume changes in last 10 minutes: Binance: $ETC: 4.29% $QTUM: 3.80% $DASH: 3.30% Bittrex: $TUSD: 177.02% $BTC: 3.6… https://t.co/GHP14Pusvg,0
Sun Oct 21 19:44:45 +0000 2018,Volume changes in last 10 minutes: Binance: $ENJ: 9.67% $CMT: 8.10% $DASH: 2.75% Bittrex: $ADA: 2.84% $BAT: 1.62%… https://t.co/muJy9BgWn7,0
Sun Oct 21 19:40:15 +0000 2018,@tiny_basic_ DOUBLE DASH,0
Sun Oct 21 17:17:07 +0000 2018,i'd like to see video of that 40-yard dash https://t.co/Zx82mRtfqZ,0
Sun Oct 21 14:37:32 +0000 2018,Volume changes in last 10 minutes: Binance: $AST: 6.42% $ICX: 4.80% $DASH: 1.54% Bittrex: $MFT: 2.88% $ETH: 2.83%… https://t.co/Xx90FAaZpn,0
Sun Oct 21 10:16:29 +0000 2018,@robynkanner A dash of anxiety. A skosh of hard dreams. A smidgen of hunger.,0
Sun Oct 21 06:25:34 +0000 2018,Volume changes in last 10 minutes: Binance: $AE: 42.46% $IOST: 12.76% $DASH: 7.03% Bittrex: $HYDRO: 2.02% $USDT: 1.… https://t.co/2ptgpU1MT7,0
Sun Oct 21 04:14:56 +0000 2018,@Quadrelll Sounds great and all but you know I gotta add my dash of angst.  Winter means feeling real snuggly and c… https://t.co/zAU7cFFZBF,0
Sun Oct 21 03:27:04 +0000 2018,@SugasHero A dash of Suga A cup of Tae Kookie for dessert The full DNA  A heart so waRM Jin &amp; Chim so sweet We JHop… https://t.co/hUd2afQI8R,48430
Sun Oct 21 02:25:01 +0000 2018,Wizard of Oz: Scarecrow  you had a brain all along! And Tinman  why you've always had a heart! Lion  the courage wa… https://t.co/OLwVQywKPv,3532
Sun Oct 21 00:13:12 +0000 2018,@Wendys Enough with the Door Dash spots - I can’t even get delivery in Seattle  even though you advertise here.,0
