Tue Jul 03 21:31:57 +0000 2018,Идея на движение BCH  при ралл\u2026 $BCHUSD https://t.co/6HOp1v0q5N,0
Tue Jul 03 17:43:03 +0000 2018,BCH consolidation ongoing  all good $BCHUSD https://t.co/O4YwK3C3Yd,0
Tue Jul 03 17:02:08 +0000 2018,23 million Japanese customers will begin trading this month $btc $xrp $bch  nobody is talking about this BUT it's l… https://t.co/kZFzYKxr7A,1
Tue Jul 03 11:24:25 +0000 2018,For your eyes only  I'll show you my heart For when you're lonely and forget who you are #TeenChoice #ChoiceFandom… https://t.co/mxtFwtCH3R,16
Tue Jul 03 08:51:21 +0000 2018,BCH/BTC $BCHBTC https://t.co/RQovGBqqOJ,0
Tue Jul 03 08:12:47 +0000 2018,BCH BTC  nice bounce $BCHBTC https://t.co/xmywAuI3Ee,0
Tue Jul 03 05:40:03 +0000 2018,BCH is making a new uptrend line $BCHUSD https://t.co/iwGanW1Ewe,0
Tue Jul 03 02:56:26 +0000 2018,BCH Support and Resistance 7/2 $BCHUSD https://t.co/2Oq3YYu0fp,0
