Thu Apr 05 20:28:56 +0000 2018,@cryptosilix @BLEUTRADE Still waiting for my ethereum withdrawal to go through!!,0
Thu Apr 05 19:22:14 +0000 2018,Swiss Crowdlender Swisspeers to manage SME-Loans on Ethereum-Blockchain https://t.co/y33Kk8ms2I @cointelegraph,0
Thu Apr 05 19:10:04 +0000 2018,Faster transactions can equal less security though. 🤔  “Is Nano really the crypto that changes transactions forever… https://t.co/aZMflNvNbl,0
Thu Apr 05 14:13:12 +0000 2018,Russia's Central Bank Mulls Ethereum System for Pan-Eurasian Payments https://t.co/LU3kKscmlO via @CoinDesk,3
Thu Apr 05 14:12:53 +0000 2018,Russia's Central Bank Mulls Ethereum System for Pan-Eurasian Payments https://t.co/LU3kKscmlO via @CoinDesk,3
Thu Apr 05 13:04:06 +0000 2018,Where to #Ethereum? The Beginner’s Guide to Ethereum’s Roadmap. I recommend this https://t.co/yGRnP9eNO7,0
Thu Apr 05 11:39:32 +0000 2018,Why The Wise Ripple (XRP) HODLers Are Not Panicking  Ethereum World News https://t.co/xIfPKepqwV,0
Thu Apr 05 07:05:25 +0000 2018,The Game Isn't Over Yet For Bitcoin  Ethereum  Ripple  And Litecoin https://t.co/g9x4hfXgek,0
Thu Apr 05 07:00:59 +0000 2018,Looking to Acquire News: "Ethereum Capital Announces Conditional Listing Approval and Filing Statement for Reverse… https://t.co/G6BMxJEFxY,0
Thu Apr 05 05:54:15 +0000 2018,India Searches for Ethereum Over Bitcoin https://t.co/hDkexuB7VM #Bitcoin,2
Thu Apr 05 05:03:18 +0000 2018,India Searches for Ethereum Over Bitcoin https://t.co/hDkexuB7VM #Bitcoin,2
Thu Apr 05 04:55:59 +0000 2018,https://t.co/ILWnKtyO9r The Game Isn't Over Yet For Bitcoin  Ethereum  Ripple  And Litecoin https://t.co/VJGQK5FLxv https://t.co/OVFc3OTj3E,0
Thu Apr 05 04:26:17 +0000 2018,India Searches for Ethereum Over Bitcoin https://t.co/hDkexuB7VM #Bitcoin,2
Thu Apr 05 04:21:14 +0000 2018,India Searches for Ethereum Over Bitcoin https://t.co/uQw36jc4MO #Bitcoin #CryptoCurrency #BlockChain #Tech,0
Thu Apr 05 01:48:59 +0000 2018,https://t.co/ILWnKtyO9r Bitcoin  Ethereum  Bitcoin Cash  Ripple  Stellar  Litecoin  Cardano  NEO  EOS: Price Analys… https://t.co/485ux8P5au,0
