Sun Feb 04 19:14:03 +0000 2018,https://t.co/ILWnKtyO9r Where Will Bitcoin  Ethereum  Ripple  And Other Cryptocurrencies Be Twenty Years From Now?… https://t.co/ViYATF9lbB,0
Sun Feb 04 18:47:35 +0000 2018,BETA platform will be launched in March 2018. The Alpha is available here https://t.co/yEiCNXecPT.  #ICO #Startup… https://t.co/5QVcGMzmFa,376
Sun Feb 04 18:47:28 +0000 2018,Gladius Crypto #3 - How Gladius Works - By Tai Zen  Max Niebylski  Alex Godwin  &amp; Marcelo McAndrew… https://t.co/gE6sTE9Ilk,199
Sun Feb 04 18:47:22 +0000 2018,Gladius Crypto #4 - Difference Between Gladius vs. Akamai  Cloudflare &amp; Amazon - By Tai Zen… https://t.co/E1vKImrcUp,221
Sun Feb 04 18:26:28 +0000 2018,Bitcoin price BOOST: Trader reveals the BIG event THIS WEEK that could make bitcoin SOAR https://t.co/Vu70dIhS7L… https://t.co/68OkL2AESC,0
Sun Feb 04 17:20:33 +0000 2018,Where Will Bitcoin  Ethereum  Ripple  And Other Cryptocurrencies Be Twenty Years From Now? 🤔  https://t.co/ctNsRnuC1U,1
Sun Feb 04 17:17:28 +0000 2018,@daricocoin merges the incredible potential presented by the  two largest #cryptocurrencies #Bitcoin and #Ethereum… https://t.co/VcYy82Okba,0
Sun Feb 04 16:19:22 +0000 2018,How to use solidity assembly to pull out a part of the https://t.co/vuy0oqD8PA? https://t.co/5PPd0zZCC6,0
Sun Feb 04 16:10:31 +0000 2018,The @crypterium Lite crypto wallet is now available for download on the @Google Play store. https://t.co/VES27dVXMo… https://t.co/FiR7MbwjMX,2
Sun Feb 04 14:44:22 +0000 2018,I hate it when that happens.  #bitcoin #bitcoins #altcoins #blockchain #bitcoinmillionaires #fintech #bitcoinnews… https://t.co/7u59yPJEC0,0
Sun Feb 04 14:42:19 +0000 2018,@hichrisfabian @GiulioWolfe @davidgerard @UNICEFinnovate @UNICEF_france The main question (from @GiulioWolfe) was a… https://t.co/NWJbJ5N5jq,0
Sun Feb 04 14:24:20 +0000 2018,Do sidechains require a new set of network nodes? https://t.co/kXxkIaPDA8,0
Sun Feb 04 14:01:35 +0000 2018,Where Will Bitcoin  Ethereum  Ripple  And Other Cryptocurrencies Be Twenty Years From Now? https://t.co/cv3yk5XDcm,0
Sun Feb 04 13:55:16 +0000 2018,When “crypto” (block coin) gets its crypto (cryptography) wrong. #YouHadOneJob cc @AndreaCoravos @Jiraffa… https://t.co/1XpbZHax5H,7
Sun Feb 04 13:43:59 +0000 2018,Top IoT story: Ethereum Classic on Twitter: "ETCDEV's 2018 Ethereum Classic Roa… https://t.co/opvDQwGJRu  see more https://t.co/L9Q7TnCfCT,0
Sun Feb 04 13:24:22 +0000 2018,New bitcoin? Africa to invest MILLIONS in own cryptocurrency nurucoin https://t.co/9wgki5HA13,0
Sun Feb 04 12:49:40 +0000 2018,Bitcoin  Ethereum  Bitcoin Cash  Ripple  Stellar  Litecoin  NEM  Cardano: Price Analysis  Jan. 29 https://t.co/N8tkc9fKJU,0
Sun Feb 04 08:30:09 +0000 2018,How I lost $100 000 in Bitcoin  Litecoin  &amp; Ethereum Lessons Learned: https://t.co/xYiLxIPAQC via @YouTube,0
Sun Feb 04 08:01:15 +0000 2018,Bitcoin is back above $9 000 https://t.co/f1yYvGf3tX,0
Sun Feb 04 07:32:12 +0000 2018,Just 1 cent per token until February 23rd! Start from as little as just $10! Earn dividends from our mining farm ju… https://t.co/SQKVy42h6d,1
Sun Feb 04 07:09:44 +0000 2018,Ledger Nano S Bitcoin Wallet Ethereum Crypto Altcoin Litecoin Ripple With MicroUSB Cable Lanyard &amp; Zeox Stylus Pen… https://t.co/xsCKGqzlOL,0
Sun Feb 04 07:08:03 +0000 2018,Just 1 cent per token until February 23rd! Start from as little as just $10! Earn dividends from our mining farm ju… https://t.co/SQKVy42h6d,1
Sun Feb 04 06:44:17 +0000 2018,@smh Btw ethereum has stayed solid dumbos,0
Sun Feb 04 06:32:21 +0000 2018,Not to say I told so  but I did…  #Cryptocurrency Traders Lose $115 Billion in 24 Hours as the #BitcoinBloodbath Co… https://t.co/hdvMvZ6zFd,2
Sun Feb 04 06:30:54 +0000 2018,Not to say I told so  but I did…  #Cryptocurrency Traders Lose $115 Billion in 24 Hours as the #BitcoinBloodbath Co… https://t.co/hdvMvZ6zFd,2
Sun Feb 04 06:19:00 +0000 2018,@kpak82 https://t.co/qNHyx0CPwK,0
Sun Feb 04 05:45:59 +0000 2018,Not to say I told so  but I did…  #Cryptocurrency Traders Lose $115 Billion in 24 Hours as the #BitcoinBloodbath Co… https://t.co/hdvMvZ6zFd,2
Sun Feb 04 04:40:50 +0000 2018,I see @SIRINLABS's token $SRN hiding at #108 on CMC at 1.53 USD...    A #blockchain smartphone  partner of Google … https://t.co/8VXynuKCDq,2
Sun Feb 04 04:35:22 +0000 2018,Just so everyone is informed. Gladius is not actively pursuing any listings. Gladius tokens are purchased for use i… https://t.co/9AxjVKwIxC,265
Sun Feb 04 03:41:44 +0000 2018,The @crypterium Lite crypto wallet is now available for download on the @Google Play store. https://t.co/VES27dVXMo… https://t.co/FiR7MbwjMX,2
Sun Feb 04 03:23:16 +0000 2018,Ethereum Gold (ETG) Price Hits $0.13 on Major Exchanges https://t.co/GneNon0mQe,0
Sun Feb 04 02:38:33 +0000 2018,#Blockchain: A Very Short History Of #Ethereum Everyone Should Read  https://t.co/oQQ3bR8zZQ,1
Sun Feb 04 02:37:10 +0000 2018,#Blockchain: A Very Short History Of #Ethereum Everyone Should Read  https://t.co/oQQ3bR8zZQ,1
Sun Feb 04 02:34:37 +0000 2018,Programmable blockchains in context: Ethereum’s Future https://t.co/idnSjBcaQp,0
Sun Feb 04 02:19:17 +0000 2018,Bitcoin  Ethereum  Bitcoin Cash  Ripple  Stellar  Litecoin  NEM  NEO  EOS: Price Analysis  February 2  2018 https://t.co/7QyDZemXfz,0
Sun Feb 04 01:35:49 +0000 2018,One Chart Shows Why Ethereum Weathered the Cryptocurrency Crash https://t.co/BkW7grHRgq,0
Sun Feb 04 01:34:24 +0000 2018,The Single Biggest Reason Why Ethereum Is The Best Investment You Can Ever Make In Your Life https://t.co/89Hz43hzei,0
Sun Feb 04 01:33:35 +0000 2018,Cryptocurrency Market Recovers Ethereum Records 15% Gain https://t.co/300qrk8U7G,0
Sun Feb 04 01:26:36 +0000 2018,Ethereum ETH Price Predictions for 2018 https://t.co/7zra8WFH8n,0
Sun Feb 04 01:20:19 +0000 2018,What is Ethereum and how does it work? https://t.co/p9BdHna3ID,0
Sun Feb 04 00:46:12 +0000 2018,OMERS pension giant creates a Ethereum-focused company https://t.co/JpZMKriJkv,0
