Wed Aug 16 23:59:37 +0000 2017,=lightly smacks @ReformedBurglar with a slightly thick gold envelope=,0
Wed Aug 16 23:58:01 +0000 2017,Gold is a buy... but not yet https://t.co/JagLFC7QsJ,0
Wed Aug 16 23:54:09 +0000 2017,can I just say gold is my favorite color? it might actually be my favorite color  like  more than pink,0
Wed Aug 16 23:52:50 +0000 2017,HRose Gold Earrings Iridescent Peacock MOP  Lavender Pearl &amp; Crystal #handmade https://t.co/b9txiSFllB #jetteam https://t.co/r3pStyXauo,27
Wed Aug 16 23:49:25 +0000 2017,@twittlik @reckless When we win Gold.,0
Wed Aug 16 23:42:45 +0000 2017,@ChaseLSZN where do i buy the gold part woah,0
Wed Aug 16 23:40:08 +0000 2017,Seriously man!! WTH is this garbage? It looks like a Democrat!! Always on vacation.with gold lined pockets..Eating… https://t.co/A0sd6lLKZL,2
Wed Aug 16 23:38:34 +0000 2017,Scandalous EPA coverup of Gold King Mine spill 'cannot be ignored' https://t.co/85VaHP8am7,2
Wed Aug 16 23:36:10 +0000 2017,@avischarf @Hadas_Gold Can you post the YouTube link?  Can't find it. Thanks,0
Wed Aug 16 23:35:41 +0000 2017,Black people are Gold.,3
Wed Aug 16 23:35:37 +0000 2017,@Hadas_Gold I can't see the video. Can someone post a YouTube link?,0
Wed Aug 16 23:34:29 +0000 2017,Song of the summer  went certified gold. Congrats GoldLink x Shy x Brent https://t.co/V1f9VAuzk6,13
Wed Aug 16 23:33:39 +0000 2017,@littlecarrotq When the time comes to tear down that 23.7 carat gold statue I'm gonna be for whatever side is for tearing it down,0
Wed Aug 16 23:33:37 +0000 2017,Black people are Gold.,3
Wed Aug 16 23:28:01 +0000 2017,Black people are Gold.,3
Wed Aug 16 23:17:47 +0000 2017,[Mixtape] SIR'SHAHLY - MORE GOLD SH!T @SIRSHAHLY @SIRSHAHLY @Spinrilla » https://t.co/urIz2TW2T4,1
Wed Aug 16 23:17:01 +0000 2017,In the age of Cyber-Terrorism  EVERY investor must own GOLD https://t.co/za3qEwypg3,0
Wed Aug 16 23:10:00 +0000 2017,#TeachersPensions aren’t all that cushy  says one former teacher. https://t.co/yTKw0L5BC3,0
Wed Aug 16 23:09:30 +0000 2017,Glad to be a Gold sponsor of the Crop Residues for Advanced Biofuels Workshop in Sacramento. https://t.co/FxWu6fgfoF,0
Wed Aug 16 23:06:30 +0000 2017,Gold was chemically destined to be money all along  https://t.co/ar9DiXUV6l,3
Wed Aug 16 23:06:00 +0000 2017,Gold was chemically destined to be money all along  https://t.co/ar9DiXUV6l,3
Wed Aug 16 23:04:09 +0000 2017,NEWS: @GoldLink's "Crew" Goes Gold https://t.co/V5mlEnRYLb https://t.co/nUQg6NlAez,0
Wed Aug 16 23:02:02 +0000 2017,Gold is a buy... but not yet https://t.co/VWw80ordol,0
Wed Aug 16 22:59:45 +0000 2017,Song of the summer  went certified gold. Congrats GoldLink x Shy x Brent https://t.co/V1f9VAuzk6,13
Wed Aug 16 22:59:00 +0000 2017,Gold was chemically destined to be money all along  https://t.co/BmerFdrx2P,0
Wed Aug 16 22:58:51 +0000 2017,HRose Gold Earrings Iridescent Peacock MOP  Lavender Pearl &amp; Crystal #handmade https://t.co/b9txiSFllB #jetteam https://t.co/r3pStyXauo,27
Wed Aug 16 22:53:57 +0000 2017,@carvel34 But i had to live the life i lived to kno what i know..i know racism exist and thr is a system designed t… https://t.co/CL6FI2BY0d,0
Wed Aug 16 22:53:51 +0000 2017,HRose Gold Earrings Iridescent Peacock MOP  Lavender Pearl &amp; Crystal #handmade https://t.co/b9txiSFllB #jetteam https://t.co/r3pStyXauo,27
Wed Aug 16 22:51:55 +0000 2017,Today in 1896: Gold is discovered in the Yukon. A 1906 watch made from Alaskan gold: https://t.co/5Y0T73n7Sk Rugged… https://t.co/V86hCSEe0g,28
Wed Aug 16 22:48:12 +0000 2017,08-16 Rolex Ref. 80309 Lady Datejust Pearlmaster Diamond Sapphire and White Gold #ElvisPresley https://t.co/RNsVTVfIEw,0
Wed Aug 16 22:47:50 +0000 2017,Detail of #painting for #interfusionfestival #gold influence from Sana Mirza #sacredgeometryart… https://t.co/NlLSuDFHhL,0
Wed Aug 16 22:42:19 +0000 2017,We're proud to be gold sponsor of Crop Residues for Advanced Biofuels workshop in Sacramento this week. 1/3,1
Wed Aug 16 22:41:51 +0000 2017,HRose Gold Earrings Iridescent Peacock MOP  Lavender Pearl &amp; Crystal #handmade https://t.co/b9txiSFllB #jetteam https://t.co/r3pStyXauo,27
Wed Aug 16 22:41:09 +0000 2017,Seriously man!! WTH is this garbage? It looks like a Democrat!! Always on vacation.with gold lined pockets..Eating… https://t.co/A0sd6lLKZL,2
Wed Aug 16 22:37:02 +0000 2017,We're proud to be gold sponsor of Crop Residues for Advanced Biofuels workshop in Sacramento this week. 1/3,1
Wed Aug 16 22:34:25 +0000 2017,@mrmedina you like purple and gold? https://t.co/JplaKBbjDs,0
Wed Aug 16 22:32:12 +0000 2017,@alwaystheself I don't even know what this is in reference to  but this is rhetorical gold.,0
Wed Aug 16 22:31:51 +0000 2017,HRose Gold Earrings Iridescent Peacock MOP  Lavender Pearl &amp; Crystal #handmade https://t.co/b9txiSFllB #jetteam https://t.co/r3pStyXauo,27
Wed Aug 16 22:30:02 +0000 2017,It's past time for the #EPA to pay claims from the toxic spill it caused in 2015 https://t.co/nM39VxVa86 @abqjournal,0
Wed Aug 16 22:23:41 +0000 2017,As a huge @Pitt_FB and @steelers fan  this jersey is by far my favorite. #SteeIerNation is lucky to have… https://t.co/oaHV4vLTlV,0
Wed Aug 16 22:22:24 +0000 2017,This thread is fucking gold 👏👏 https://t.co/MXCKF4PaTg,0
Wed Aug 16 22:18:14 +0000 2017,People leaking their own words to a free press is so elitist compared to a gold plated penthouse. https://t.co/wPNqX6OJyu,1072
Wed Aug 16 22:12:23 +0000 2017,[EUW][Gold+][Flex 5s] Casual Flex With The Boys You Know How It Is https://t.co/PPYfUJ1IXl,0
Wed Aug 16 22:09:39 +0000 2017,Gold Canyon Candles  https://t.co/2ICBtdHBxm https://t.co/WoH2MuNwhI,0
Wed Aug 16 22:06:02 +0000 2017,Gold was chemically destined to be money all along  https://t.co/DyXNqyaHun,0
Wed Aug 16 22:03:52 +0000 2017,This is for the Burgundy and Gold only #HTTR,0
Wed Aug 16 22:03:04 +0000 2017,Gold is a buy... but not yet https://t.co/Xlmh8oVhmD,0
Wed Aug 16 22:00:44 +0000 2017,Newmont Mining (NEM)  which started the gold miners’ 2Q17 earnings season on July 25  reported earnings ... https://t.co/k9rrrsyKAZ,0
Wed Aug 16 21:56:20 +0000 2017,4.4 ton GAIN of #gold in $GLD,0
Wed Aug 16 21:50:52 +0000 2017,Rose Gold Earrings Iridescent Peacock MOP  Lavender Pearl &amp; Crystal #handmade https://t.co/b9txiSWWKb #jetteam https://t.co/r3pStyXauo,30
Wed Aug 16 21:47:50 +0000 2017,3 Inch King Size Accu-Gold 5.3 Visco Elastic Memory Foam Mattress Topper Made in the USA Check Price:… https://t.co/Kh75X8GpEB,0
Wed Aug 16 21:46:25 +0000 2017,@OldManBeddy Kobe already the 5th best person to wear purple &amp; Gold  when Bron come then kobe going be 6 kobe will… https://t.co/xp1nLhnTWb,1
Wed Aug 16 21:46:01 +0000 2017,@OldManBeddy Kobe already the 5th best person to wear purple &amp; Gold  when Bron come then kobe going be 6 kobe will… https://t.co/xp1nLhnTWb,1
Wed Aug 16 21:43:08 +0000 2017,This is gold!   Great work Chris grosse. #MillennialDay https://t.co/kioehMxjve,0
Wed Aug 16 21:40:16 +0000 2017,Ralph Benko: Cruz is smart to campaign on the gold standard | American Principles Project https://t.co/HOLfMiSRLv,0
Wed Aug 16 21:39:19 +0000 2017,@Hadas_Gold @politico Congrats  Hadas! We'll miss you here.,0
Wed Aug 16 21:38:17 +0000 2017,Gold was chemically destined to be money all along  https://t.co/HQa6stZ4Jt,0
Wed Aug 16 21:37:38 +0000 2017,GOLD Comment for 17.8.2017 https://t.co/pO9m5OQbms  #gold | #goldcomments | #xauusd,0
Wed Aug 16 21:35:13 +0000 2017,If you're wondering what hurts Trump with his base: health care yes  Charlottesville no. (Most recent datapoint is… https://t.co/99BO4SYapV,120
Wed Aug 16 21:33:48 +0000 2017,@Hadas_Gold @politico @morningmoneyben this is so sad... But  I'm rooting for your continued success @Hadas_Gold!,0
Wed Aug 16 21:32:40 +0000 2017,@jackshafer 🍔 Not to mention the Fool's Gold sandwiches  the jet ride  and the whole entourage 🍟!!,0
Wed Aug 16 21:32:31 +0000 2017,@jdawsey1 @Hadas_Gold Am waving my moist hankie from afar!,0
Wed Aug 16 21:31:07 +0000 2017,"Gene what is your proudest journalistic achievement?"  Me: I got WaPo @reddit gold to last us until the 2020 presi… https://t.co/m6PvIaHMph,8
Wed Aug 16 21:30:45 +0000 2017,@Hadas_Gold @politico you did excellent work!,0
Wed Aug 16 21:30:18 +0000 2017,Bespoke Hand Painted Dinner Napkins - Gold and Silver #interiordesign #luxury #home #bespoke #dinnertime… https://t.co/m7EZNv4BwV,0
Wed Aug 16 21:28:35 +0000 2017,Five years and five months. Goodbye @politico. Thank you for the incredible ride. https://t.co/B11Qyuv3EX,19
Wed Aug 16 21:26:45 +0000 2017,Kim Jong Un of North Korea made a very wise and well reasoned decision. The alternative would have been both catastrophic and unacceptable!,25369
Wed Aug 16 21:26:08 +0000 2017,@williamcraddick Look into union banking corporation. Prescott was founder and part owner. Bank was seized for trad… https://t.co/i4ncQJjPym,0
Wed Aug 16 21:25:50 +0000 2017,HRose Gold Earrings Iridescent Peacock MOP  Lavender Pearl &amp; Crystal #handmade https://t.co/b9txiSFllB #jetteam https://t.co/r3pStyXauo,27
Wed Aug 16 21:20:27 +0000 2017,"Gene what is your proudest journalistic achievement?"  Me: I got WaPo @reddit gold to last us until the 2020 presi… https://t.co/m6PvIaHMph,8
Wed Aug 16 21:18:36 +0000 2017,Will Gold Overtake $1 300 - Or Is There More Pain Ahead? https://t.co/m2sZlhWapc $GLD $GDX $GDXJ $NUGT $JNUG,1
Wed Aug 16 21:16:18 +0000 2017,"Gene what is your proudest journalistic achievement?"  Me: I got WaPo @reddit gold to last us until the 2020 presi… https://t.co/m6PvIaHMph,8
Wed Aug 16 21:15:47 +0000 2017,Rose Gold Earrings Iridescent Peacock MOP  Lavender Pearl &amp; Crystal #handmade https://t.co/b9txiSWWKb #jetteam https://t.co/r3pStyXauo,30
Wed Aug 16 21:14:25 +0000 2017,Doll (18") Slumber (Sleeping)  (18" X 9") bag with  gold Suns  by AWondrousPlace  https://t.co/iNXGdCsmn4 via @Etsy,0
Wed Aug 16 21:09:06 +0000 2017,"Gene what is your proudest journalistic achievement?"  Me: I got WaPo @reddit gold to last us until the 2020 presi… https://t.co/m6PvIaHMph,8
Wed Aug 16 21:06:44 +0000 2017,"Gene what is your proudest journalistic achievement?"  Me: I got WaPo @reddit gold to last us until the 2020 presi… https://t.co/m6PvIaHMph,8
Wed Aug 16 21:06:29 +0000 2017,@PA_Megacorp @HollyConrad The dynamic between Strix and Jim is pure gold. @HollyConrad  @cwgabriel can't wait for P… https://t.co/eNZBqRy22i,2
Wed Aug 16 21:05:27 +0000 2017,Will Gold Overtake $1 300 - Or Is There More Pain Ahead? https://t.co/m2sZlhWapc $GLD $GDX $GDXJ $NUGT $JNUG,1
Wed Aug 16 21:04:52 +0000 2017,"Gene what is your proudest journalistic achievement?"  Me: I got WaPo @reddit gold to last us until the 2020 presi… https://t.co/m6PvIaHMph,8
Wed Aug 16 21:04:23 +0000 2017,"Gene what is your proudest journalistic achievement?"  Me: I got WaPo @reddit gold to last us until the 2020 presi… https://t.co/m6PvIaHMph,8
Wed Aug 16 21:04:10 +0000 2017,"Gene what is your proudest journalistic achievement?"  Me: I got WaPo @reddit gold to last us until the 2020 presi… https://t.co/m6PvIaHMph,8
Wed Aug 16 21:03:13 +0000 2017,These stunning landscapes might look like paintings  but are very real https://t.co/lvd7xKemAG,169
Wed Aug 16 21:01:34 +0000 2017,Learn more about how solar eclipses happen  the four types of eclipses  and how to view the sun safely if you're wi… https://t.co/VwRLlsakic,89
Wed Aug 16 20:58:08 +0000 2017,Handmade Gold Post Abalone Dangle Earrings with Pearls and Crystals https://t.co/q1KFRabAW6 https://t.co/Qz3IQMbhTG #jetteam #pottiteam,50
Wed Aug 16 20:57:37 +0000 2017,Before driving over ice  you have to test its thickness. #LifeBelowZero https://t.co/hRnhGHNhru,11
Wed Aug 16 20:56:00 +0000 2017,My latest with @joecguinan on #Brexit  #Lexit &amp; the possibilities for a #neweconomy built up from the ashes of… https://t.co/ru4asYOYis,6
Wed Aug 16 20:54:56 +0000 2017,@PA_Megacorp @HollyConrad The dynamic between Strix and Jim is pure gold. @HollyConrad  @cwgabriel can't wait for P… https://t.co/eNZBqRy22i,2
Wed Aug 16 20:54:07 +0000 2017,Help us spread the word! We're looking for the Executive Director of Women's March.  https://t.co/RODxIVtMQ0 https://t.co/zuo8MpFnzp,237
Wed Aug 16 20:53:12 +0000 2017,#Twitter Advanced Search: 11 Easy Ways To Find #Marketing Gold &gt; https://t.co/rrYNSiGloG  @AskAaronLee #SMTips,1
Wed Aug 16 20:51:53 +0000 2017,@dumbohan holy shit thats gold,0
Wed Aug 16 20:51:31 +0000 2017,Defense stocks are secured by the fears of 122 million US taxpayers. More stable than #Bitcoin  they outperform gold https://t.co/Hcnaju5ZE8,62
Wed Aug 16 20:51:06 +0000 2017,Today's #SignOfResistance is by paigeemery_ https://t.co/XjT9FjSm12,297
Wed Aug 16 20:48:56 +0000 2017,Neiman Marcus vintage gold blazer size M $40 @ Fia's Fabulous Finds https://t.co/6hIgEnyLos,0
Wed Aug 16 20:48:51 +0000 2017,HRose Gold Earrings Iridescent Peacock MOP  Lavender Pearl &amp; Crystal #handmade https://t.co/b9txiSFllB #jetteam https://t.co/r3pStyXauo,27
Wed Aug 16 20:45:50 +0000 2017,HRose Gold Earrings Iridescent Peacock MOP  Lavender Pearl &amp; Crystal #handmade https://t.co/b9txiSFllB #jetteam https://t.co/r3pStyXauo,27
Wed Aug 16 20:44:38 +0000 2017,Trump has now sent more tweets condemning CEO's who quit his business council than he has white supremacists and th… https://t.co/niMQ4tZGu8,10551
Wed Aug 16 20:44:13 +0000 2017,I entered a giveaway for a chance to win "Sumery Gold Fox Alloy Frame Sunglasses Women Glas..." by Sumery. https://t.co/mqVMYfBE3t #giveaway,0
Wed Aug 16 20:39:52 +0000 2017,We’re pleased to announce the release of our Ninja Vuitton Brown/Gold edition / To order: https://t.co/P3XKydHZb5 /… https://t.co/YwOqm4VsTZ,2
Wed Aug 16 20:39:04 +0000 2017,Crisis. Venezuela's currency now worth less than 'World of Warcraft' gold  https://t.co/nlM8WCqrqL https://t.co/u4k27J27e0,4
Wed Aug 16 20:38:12 +0000 2017,"Gene what is your proudest journalistic achievement?"  Me: I got WaPo @reddit gold to last us until the 2020 presi… https://t.co/m6PvIaHMph,8
Wed Aug 16 20:36:25 +0000 2017,Gold Coin Sales Soar as War Tensions Rise - Mike Fuljenz https://t.co/yvcAUYZEf1,0
Wed Aug 16 20:33:08 +0000 2017,"Gold Lamps" Trending in HOLLYWOOD Over 1000 Designs @ https://t.co/xqbcCmju3x .. https://t.co/asrw2YvPiO,0
Wed Aug 16 20:30:24 +0000 2017,Gold digger every where 👀👀,0
Wed Aug 16 20:24:25 +0000 2017,Bush41 on David Duke in '91: “It's inconceivable that someone who endorses Nazism can reasonably aspire to leadership in a free society.”,25
Wed Aug 16 20:20:29 +0000 2017,@PA_Megacorp @HollyConrad The dynamic between Strix and Jim is pure gold. @HollyConrad  @cwgabriel can't wait for P… https://t.co/eNZBqRy22i,2
Wed Aug 16 20:19:19 +0000 2017,GOLD Signal https://t.co/em9lFOtmCN,0
Wed Aug 16 20:16:25 +0000 2017,@TKOkocenko My choices are oil based pink  yellow or metallic gold. What do you think?,0
Wed Aug 16 20:14:01 +0000 2017,Gold fever @KlondikeAKNPS has faded  but amazing views &amp; stories remain #Alaska https://t.co/l1DnipJHbj,304
Wed Aug 16 20:11:16 +0000 2017,This Brandi and Leann friendship is classic A+ housewives GOLD #RHOD,0
Wed Aug 16 20:11:01 +0000 2017,went to storage unit 2find gold treasure! former textbooks/research sources that i get to read for pleasure (not ev… https://t.co/52IKBO48pm,0
Wed Aug 16 20:08:31 +0000 2017,Working as a scribe  using special gold-flake inks  handwriting the most savage tweets,0
Wed Aug 16 20:03:28 +0000 2017,@kbhrchris Nell Painter's "The History of White People" is the gold standard on this,0
Wed Aug 16 20:00:11 +0000 2017,On this day in 1896  George Carmack discovered gold in the Klondike River  which led to the last big gold rush in t… https://t.co/C3iEDblsec,0
Wed Aug 16 20:00:04 +0000 2017,Katy Perry’s Worn Everything From Satin Rompers To Gold Grills At The VMAs https://t.co/2eUYTViB6L,0
Wed Aug 16 19:59:16 +0000 2017,Gold was discovered at Bonanza Creek in the Yukon #OTD in 1896  ushering the Klondike Gold Rush!… https://t.co/X1XAHxIVjZ,11
Wed Aug 16 19:58:19 +0000 2017,Reforming the Federal Bureaucracy: https://t.co/8xUJiZgm7B https://t.co/1eTLnyNQ97,646
Wed Aug 16 19:55:48 +0000 2017,Gold was discovered at Bonanza Creek in the Yukon #OTD in 1896  ushering the Klondike Gold Rush!… https://t.co/X1XAHxIVjZ,11
Wed Aug 16 19:55:45 +0000 2017,The Vice doc has more than 23 million views on Facebook https://t.co/clc2J4L1dA,65
Wed Aug 16 19:52:38 +0000 2017,500 ريال لمن يتوقع نتيجة اياب الكلاسيكو   شروط المسابقة: - رتويت للتغريدة ومتابعة الحساب - لن يقبل اي توقع بفوز مدريد - السحب الكتروني مصور,250
Wed Aug 16 19:51:51 +0000 2017,HRose Gold Earrings Iridescent Peacock MOP  Lavender Pearl &amp; Crystal #handmade https://t.co/b9txiSFllB #jetteam https://t.co/r3pStyXauo,27
Wed Aug 16 19:49:32 +0000 2017,@MsMinotaur With the console on a gold chain around your neck!,0
Wed Aug 16 19:49:30 +0000 2017,Gold was discovered at Bonanza Creek in the Yukon #OTD in 1896  ushering the Klondike Gold Rush!… https://t.co/X1XAHxIVjZ,11
Wed Aug 16 19:47:58 +0000 2017,Gold was discovered at Bonanza Creek in the Yukon #OTD in 1896  ushering the Klondike Gold Rush!… https://t.co/X1XAHxIVjZ,11
Wed Aug 16 19:40:05 +0000 2017,NYT Culture editor Danielle Mattoon is leaving the paper to start a new foundation  per memo https://t.co/NAw2u9rVJ0,4
Wed Aug 16 19:32:25 +0000 2017,Long-term strategy is critical to #BeatPollution w/@minamataMEA. @UNEP writes on how it will #MakeMercuryHistory:… https://t.co/KqQAKCt5Cj,6
Wed Aug 16 19:30:28 +0000 2017,@KristenTaekman @ElvisPresley @VisitGraceland where did you get your #TCB necklace? i would love to find one that's… https://t.co/GsplV9i9OD,0
Wed Aug 16 19:29:07 +0000 2017,Katy Perry’s Worn Everything From Satin Rompers To Gold Grills At The VMAs https://t.co/s3Gaz9JrSj https://t.co/Pxtjmi7ScO,0
Wed Aug 16 19:28:21 +0000 2017,Missing a few hoods here. https://t.co/wSKthTU2uR,22559
Wed Aug 16 19:24:58 +0000 2017,@sean_spicier @TruthFactsKnow There's a statue of a racist in NYC covered in real gold...I'm here for scraping I mean scrapping that one,0
Wed Aug 16 19:21:46 +0000 2017,If you're looking for one of the gold standards of eclipse photography  look no further than Miloslav Druckmüller… https://t.co/8rN2v4wHra,16
Wed Aug 16 19:13:21 +0000 2017,"No one is born hating another person because of the color of his skin or his background or his religion..." https://t.co/InZ58zkoAm,1561165
Wed Aug 16 19:10:03 +0000 2017,#Twitter Advanced Search: 11 Easy Ways To Find #Marketing Gold &gt; https://t.co/YgdbgDHdCF  @AskAaronLee #SMTips,0
Wed Aug 16 19:09:30 +0000 2017,Vintage Original Cigar Label Have a Sweet Brand with Metallic Gold Emb… https://t.co/jlNVKJo0LU #vintage #CigarBrand https://t.co/SruCwB5Rmh,0
Wed Aug 16 19:04:22 +0000 2017,Gold. https://t.co/xxE7FbYrof,2
Wed Aug 16 19:03:33 +0000 2017,lmfao this is gold https://t.co/cpQW22MinF,0
Wed Aug 16 19:03:13 +0000 2017,#Twitter Advanced Search: 11 Easy Ways To Find #Marketing Gold &gt; https://t.co/rrYNSiGloG  @AskAaronLee #SMTips,1
Wed Aug 16 19:02:47 +0000 2017,Rose Gold Earrings Iridescent Peacock MOP  Lavender Pearl &amp; Crystal #handmade https://t.co/b9txiSWWKb #jetteam https://t.co/r3pStyXauo,30
Wed Aug 16 19:00:13 +0000 2017,Gold. https://t.co/xxE7FbYrof,2
Wed Aug 16 19:00:11 +0000 2017,Our WBL team and their coaches at the Gold Gate Bridge in Cali the team had an amazing time! https://t.co/hsLhwesQ8s,2
Wed Aug 16 18:59:14 +0000 2017,Gold. https://t.co/xxE7FbYrof,2
Wed Aug 16 18:55:55 +0000 2017,Soooooo ESPN just did an "auction" sketch 🤔 https://t.co/zvezCItems,4778
Wed Aug 16 18:55:51 +0000 2017,HRose Gold Earrings Iridescent Peacock MOP  Lavender Pearl &amp; Crystal #handmade https://t.co/b9txiSFllB #jetteam https://t.co/r3pStyXauo,27
Wed Aug 16 18:51:49 +0000 2017,LRT- The comments on that tweet are GOLD!,0
Wed Aug 16 18:50:13 +0000 2017,Today in 1896: Gold is discovered in the Yukon. A 1906 watch made from Alaskan gold: https://t.co/5Y0T73n7Sk Rugged… https://t.co/V86hCSEe0g,28
Wed Aug 16 18:49:15 +0000 2017,Watching 'Saving Private Ryan ' a movie about a group of very aggressive alt-left protesters invading a beach without a permit.,14171
Wed Aug 16 18:44:28 +0000 2017,Today in 1896: Gold is discovered in the Yukon. A 1906 watch made from Alaskan gold: https://t.co/5Y0T73n7Sk Rugged… https://t.co/V86hCSEe0g,28
Wed Aug 16 18:43:10 +0000 2017,MmoGah Coupon Codes You heard that! chance to save up to 5% when buying Gold for your games at MmoGah… https://t.co/IBpeOVk0ti,0
Wed Aug 16 18:42:02 +0000 2017,Shop online for jewellery from Gold and Diamond jewellery brands.  Tune in to the latest fashion jewellery trends  https://t.co/K6Jj75iz2R,0
Wed Aug 16 18:40:37 +0000 2017,Old but gold!  #Obama  https://t.co/FWKUubVjb9,0
Wed Aug 16 18:38:08 +0000 2017,This is unprecedented. #FBI lied to us &amp; is now reopening our case into the Clinton/Lynch meeting. Big win. #JayLive https://t.co/bHeSBKM99x,4737
Wed Aug 16 18:38:06 +0000 2017,"No one is born hating another person because of the color of his skin or his background or his religion..." https://t.co/InZ58zkoAm,1561165
Wed Aug 16 18:36:31 +0000 2017,Last night  someone said I looked like a cross b/t Lou Reed &amp; Elvis  and I almost peed my gold sparkle jumpsuit out… https://t.co/ipaBGgAgSF,1
Wed Aug 16 18:36:17 +0000 2017,Scandalous EPA coverup of Gold King Mine spill 'cannot be ignored' https://t.co/85VaHP8am7,2
Wed Aug 16 18:36:01 +0000 2017,Today in 1896: Gold is discovered in the Yukon. A 1906 watch made from Alaskan gold: https://t.co/5Y0T73n7Sk Rugged… https://t.co/V86hCSEe0g,28
Wed Aug 16 18:34:11 +0000 2017,Scandalous EPA coverup of Gold King Mine spill 'cannot be ignored' https://t.co/85VaHP8am7,2
Wed Aug 16 18:30:34 +0000 2017,"No one is born hating another person because of the color of his skin or his background or his religion..." https://t.co/InZ58zkoAm,1561165
Wed Aug 16 18:29:24 +0000 2017,If President Trump represented the U.S. in the Olympics  we'd always win gold with his unstoppable skills.,1110
Wed Aug 16 18:22:26 +0000 2017,It's going to cost America three times as much to fix everything Trump will break and paint over all the gold.,58
Wed Aug 16 18:21:45 +0000 2017,@UniWatch @collegefund Now that's some burgundy and gold gear I can actually get behind.,0
Wed Aug 16 18:17:49 +0000 2017,MUSIC VIDEO Packages at https://t.co/viHZxfpDFc Onyx  Bronze  Silver  Platinum &amp; here is GOLD! Director 202.332.849… https://t.co/3npF7Y7ojf,0
Wed Aug 16 18:13:22 +0000 2017,#room #kitchen Gold Sequin Tablecloth Rectangle Style For Wedding/Party/Banqu ... https://t.co/1ybiT17NS5 https://t.co/rFZ5YusYnE,0
Wed Aug 16 18:05:03 +0000 2017,@swin24 +1,0
Wed Aug 16 18:04:36 +0000 2017,The vice doc is getting tons of play today. Have seen extended clips on some cable networks,3
Wed Aug 16 18:04:33 +0000 2017,@Hidden_Gold She is brilliance defined.,0
Wed Aug 16 18:02:40 +0000 2017,From 2016: "Slaves of gold fever  the hundreds of women sexually exploited in mining bars" [@Ojo_Publico] #peru… https://t.co/2f8MemF4sP,3
Wed Aug 16 18:01:04 +0000 2017,Levi's Stadium is the 1st US stadium to open w/ gold- LEED certification  thanks in part to biofiltration system https://t.co/7PJ9Lx23AB,1
Wed Aug 16 18:00:39 +0000 2017,Physical Swiss Gold (SGOL) Trading Near $123.94 Resistance Level https://t.co/XGk5BdzRxa,0
Wed Aug 16 18:00:26 +0000 2017,Levi's Stadium is the 1st US stadium to open w/ gold- LEED certification  thanks in part to biofiltration system https://t.co/QVAgmlu1Kg,0
Wed Aug 16 17:53:45 +0000 2017,.@Goldlink's "Crew" Is Certified Gold; Remix EP ft @NEWIMPRESSIONZ &amp;  @BackyardBand OTW https://t.co/vvDK0G25dd https://t.co/SQXxVo7OcE,1
Wed Aug 16 17:52:00 +0000 2017,@dlag1995 @AmericanU And where does that budget come from? Are they still hoarding that pot of gold or is it our tuition dollars,0
Wed Aug 16 17:51:02 +0000 2017,I entered a giveaway for a chance to win "Sumery Gold Fox Alloy Frame Sunglasses Women Glas..." by Sumery. https://t.co/1BuiHvdENV #giveaway,0
Wed Aug 16 17:47:34 +0000 2017,Today in 1896: Gold is discovered in the Yukon. A 1906 watch made from Alaskan gold: https://t.co/5Y0T73n7Sk Rugged… https://t.co/V86hCSEe0g,28
Wed Aug 16 17:46:14 +0000 2017,Damn. https://t.co/ciwe7dKJ0d,6
Wed Aug 16 17:38:56 +0000 2017,Rose Gold Earrings Iridescent Peacock MOP  Lavender Pearl &amp; Crystal #handmade https://t.co/b9txiSWWKb #jetteam https://t.co/r3pStyXauo,30
Wed Aug 16 17:38:30 +0000 2017,Wow! I just ETEVON  Women Rose Gold Watch Give Away . Save 20% off by entering code "Q8EZAL85". https://t.co/1J23ny5VcF #giveaway,0
Wed Aug 16 17:37:47 +0000 2017,Rose Gold Earrings Iridescent Peacock MOP  Lavender Pearl &amp; Crystal #handmade https://t.co/b9txiSWWKb #jetteam https://t.co/r3pStyXauo,30
Wed Aug 16 17:36:21 +0000 2017,Today in 1896: Gold is discovered in the Yukon. A 1906 watch made from Alaskan gold: https://t.co/5Y0T73n7Sk Rugged… https://t.co/V86hCSEe0g,28
Wed Aug 16 17:35:48 +0000 2017,Rose Gold Earrings Iridescent Peacock MOP  Lavender Pearl &amp; Crystal #handmade https://t.co/b9txiSWWKb #jetteam https://t.co/r3pStyXauo,30
Wed Aug 16 17:34:06 +0000 2017,"No one is born hating another person because of the color of his skin or his background or his religion..." https://t.co/InZ58zkoAm,1561165
Wed Aug 16 17:33:37 +0000 2017,Видео "Спиннер цвета Gold" (https://t.co/YNNrqymiEY) на @YouTube добавлено в плейлист.,0
Wed Aug 16 17:32:02 +0000 2017,Today in 1896: Gold is discovered in the Yukon. A 1906 watch made from Alaskan gold: https://t.co/5Y0T73n7Sk Rugged… https://t.co/V86hCSEe0g,28
Wed Aug 16 17:29:47 +0000 2017,Up for auction - Topps Men's Leopard Print Leather Yellow Gold 16mm Expansion Watch Band NOS #TOPPS https://t.co/ZEDXdzGAXh #watchbands,0
