Sun Jul 16 16:23:08 +0000 2017,#NFL Wire: Gold Cup: USA makes major roster moves  adds Bradley and Dempsey for final stage https://t.co/k4R6XYSXFL https://t.co/RIpFK6W6z5,0
Sun Jul 16 16:23:07 +0000 2017,#MLB Wire: Gold Cup: USA makes major roster moves  adds Bradley and Dempsey for final stage https://t.co/QU2xXS9cJ6 https://t.co/U6M4L9ildI,0
Sun Jul 16 16:22:41 +0000 2017,🇮🇹🇺🇸 #VespucciintheUS countdown 2⃣ days to Boston  #NaveVespucci bow&amp;stern decorated with gold foiled ornaments and… https://t.co/i8OpW5eS1i,18
Sun Jul 16 16:20:36 +0000 2017,Info:#Colloidal #gold is good4 #dogs as it helps ppl particularly4 #joint/#backproblems like canine hip #dysplasia: https://t.co/7ucPL3zzdF,0
Sun Jul 16 16:20:35 +0000 2017,Info: #Antiaging  #CancerPrevention n #AcneTreatment - all of these r benefits of #colloids: #silver #copper #gold https://t.co/7ucPL3zzdF,0
Sun Jul 16 16:19:06 +0000 2017,#NBA Wire: Gold Cup: USA makes major roster moves  adds Bradley and Dempsey for final stage https://t.co/a936LusbKv https://t.co/ztpVn6h90l,0
Sun Jul 16 16:14:08 +0000 2017,Handmade Rose Gold Earrings with Shell  Pearl Peacock &amp; Lavender Earrings  https://t.co/kf4vE2J0y1 #jetteam https://t.co/pvAQCPImMD,27
Sun Jul 16 16:04:24 +0000 2017,People leaking their own words to a free press is so elitist compared to a gold plated penthouse. https://t.co/wPNqX6OJyu,1074
Sun Jul 16 16:00:46 +0000 2017,Handmade Rose Gold Earrings with Shell  Pearl  Peacock &amp; Lavender Earrings  https://t.co/kf4vE2J0y1 https://t.co/pvAQCPImMD #jetteam,24
Sun Jul 16 16:00:29 +0000 2017,Capaldi didn't always get the stories he deserved  and had to spin gold out of a lot of straw. But he understood why #DoctorWho matters.,12
Sun Jul 16 16:00:21 +0000 2017,Overheard in session  "I like this guy  I hope he shares his presentation." That's gold! @MobyJeff #NNSTOY17 @NNSTOY https://t.co/e5YTaEy5co,3
Sun Jul 16 15:50:40 +0000 2017,Content Gold Mines https://t.co/YwGTUz85B8 https://t.co/ZUP5n08r3s,0
Sun Jul 16 15:48:20 +0000 2017,The ABC/Washington Post Poll  even though almost 40% is not bad at this time  was just about the most inaccurate poll around election time!,11902
Sun Jul 16 15:41:02 +0000 2017,@He_Has_Failed A hurricane hit Haiti hard. As a result  Hillary Clinton's brother literally owns a gold mine over t… https://t.co/IZFcP4XXpR,1
Sun Jul 16 15:40:42 +0000 2017,Capaldi didn't always get the stories he deserved  and had to spin gold out of a lot of straw. But he understood why #DoctorWho matters.,12
Sun Jul 16 15:35:36 +0000 2017,Handmade Rose Gold Earrings with Shell  Pearl Peacock &amp; Lavender Earrings  https://t.co/kf4vE2J0y1 #jetteam https://t.co/pvAQCPImMD,27
Sun Jul 16 15:34:31 +0000 2017,Handmade Rose Gold Earrings with Shell  Pearl Peacock &amp; Lavender Earrings  https://t.co/kf4vE2J0y1 #jetteam https://t.co/pvAQCPImMD,27
