Sun Jul 16 23:59:15 +0000 2017,Sheer gold https://t.co/9RsAvy9vJw,0
Sun Jul 16 23:55:26 +0000 2017,Handmade Rose Gold Earrings with Shell  Pearl Peacock &amp; Lavender Earrings  https://t.co/kf4vE2J0y1 #jetteam https://t.co/pvAQCPImMD,13
Sun Jul 16 23:55:03 +0000 2017,Handmade Rose Gold Earrings with Shell  Pearl Peacock &amp; Lavender Earrings  https://t.co/kf4vE2J0y1 #jetteam https://t.co/pvAQCPImMD,13
Sun Jul 16 23:48:57 +0000 2017,@Miss_Intention_ THIS IS GOLD IMCRYUGJFIFNFBFJG,0
Sun Jul 16 23:46:42 +0000 2017,"Only a cat of a different coat  that's all the truth I know. In a coat of gold or a coat of red  a Lion still has claws...",0
Sun Jul 16 23:45:31 +0000 2017,If President Trump represented the U.S. in the Olympics  we'd always win gold with his unstoppable skills.,1065
Sun Jul 16 23:41:51 +0000 2017,BREAKING: Gold &amp; Platinum History Made!!! Congratulations @KatyPerry. First artist EVER to earn THREE Diamond songs… https://t.co/6KJItFrWZj,4103
Sun Jul 16 23:27:39 +0000 2017,At the  public library  black  white  gold clothes of illusions were worn To show purity of intention as my damages will be given to me,0
Sun Jul 16 23:25:19 +0000 2017,ABV: 3.2% Color: Light gold Aroma: Barely there  light hops. Taste: Little taste... (Light) https://t.co/QpgXSn7A7I #photo,0
Sun Jul 16 23:21:01 +0000 2017,Oh the workouts  the food  the people  the city  and the life lessons taken away! #coachsummit2017... https://t.co/WBfKYbEWMI,0
Sun Jul 16 23:17:00 +0000 2017,All the new friends made! ❤️,0
Sun Jul 16 23:15:20 +0000 2017,All the little critters ready to pop out at you! I may have jumped a few times! 😂,0
Sun Jul 16 23:14:12 +0000 2017,New Orleans life,0
Sun Jul 16 23:03:30 +0000 2017,Ending Soon! 2 hours left... Vintage Enamel Sterling w/Gold Wash Spoon Frigast Denmark In Excellent Condition  https://t.co/kIeWqQEaps,0
Sun Jul 16 23:02:58 +0000 2017,looks like Trumps approval rating has dropped lower than the gold plated ballcock in his cistern,1
Sun Jul 16 23:00:53 +0000 2017,@Tony19542 I wouldn't watch that clown for all the gold in Fort Knox.,0
Sun Jul 16 23:00:31 +0000 2017,"Not famous enough" is code for "no gold diggers allowed around the athletes....also you're not famous enough" https://t.co/KAa2MPVoPr,151
Sun Jul 16 22:51:27 +0000 2017,🇮🇹🇺🇸 #VespucciintheUS countdown 2⃣ days to Boston  #NaveVespucci bow&amp;stern decorated with gold foiled ornaments and… https://t.co/i8OpW5eS1i,18
Sun Jul 16 22:50:55 +0000 2017,Secret Service spox disputes Sekulow's suggestion that the meeting participants would've been screened by USSS… https://t.co/57hDOEjTap,458
Sun Jul 16 22:36:27 +0000 2017,🇮🇹🇺🇸 #VespucciintheUS countdown 2⃣ days to Boston  #NaveVespucci bow&amp;stern decorated with gold foiled ornaments and… https://t.co/i8OpW5eS1i,18
Sun Jul 16 22:35:12 +0000 2017,2017 rappers:  look at my dick ay xans get me lit ayy glock in the whip AY boutta b rich AYY hand on her clit AYYY i fucked ur bitch AYEEE,79523
Sun Jul 16 22:32:36 +0000 2017,Joe Rogan Explaining Why He Won’t Perform For Colleges Is Gold https://t.co/Ndfbk0racw https://t.co/iAbkJ379Ti,11
Sun Jul 16 22:32:08 +0000 2017,Handmade Rose Gold Earrings with Shell  Pearl Peacock &amp; Lavender Earrings  https://t.co/kf4vE2J0y1 #jetteam https://t.co/pvAQCPImMD,27
Sun Jul 16 22:30:34 +0000 2017,🇮🇹🇺🇸 #VespucciintheUS countdown 2⃣ days to Boston  #NaveVespucci bow&amp;stern decorated with gold foiled ornaments and… https://t.co/i8OpW5eS1i,18
Sun Jul 16 22:30:23 +0000 2017,No wonder this tournaments a joke when you can call up and release players in the middle of it. #GoldCup2017   https://t.co/dJnJT2u9oL,0
Sun Jul 16 22:23:25 +0000 2017,Mid-Year’s Only Rock Song Award 🏆: @Harry_Styles’ #SignOfTheTimes Gold @ColumbiaRecords https://t.co/REZjj0liJv https://t.co/rkaTHXnvmH,1682
Sun Jul 16 22:19:11 +0000 2017,The Australian Foreign Minister's Response To Trump's Sexist Remark Is Absolute Gold https://t.co/0AiEAs2gvd,0
Sun Jul 16 22:16:50 +0000 2017,I FINALLY FOUND THE WHOLE VIDEO W/ THE GIF OF THAT SUPER HERO WOMAN https://t.co/YUAISpOwBS,10893
Sun Jul 16 22:09:45 +0000 2017,Mid-Year’s Only Rock Song Award 🏆: @Harry_Styles’ #SignOfTheTimes Gold @ColumbiaRecords https://t.co/REZjj0liJv https://t.co/rkaTHXnvmH,1682
Sun Jul 16 22:07:56 +0000 2017,"Not famous enough" is code for "no gold diggers allowed around the athletes....also you're not famous enough" https://t.co/KAa2MPVoPr,151
Sun Jul 16 22:07:49 +0000 2017,Bella3Designs Amber Elements Cha Cha Charm Bracelet. Elegant Luxe Showy in rich gold tone. Fits… https://t.co/xE8s1WDGjA,0
Sun Jul 16 22:06:20 +0000 2017,I liked a @YouTube video https://t.co/ogEFmsypfk Dragon Ball Super Episode 99 Review and Discussion. Gold or Garbage?,0
Sun Jul 16 22:00:32 +0000 2017,Gold shops: coming to a high street near you? https://t.co/A7p4T2f0aZ,0
Sun Jul 16 22:00:11 +0000 2017,Comfortable yet sophisticated silhouette &gt;&gt;&gt; https://t.co/ppTlUJXNKP  #teelieturner #shoes #footwear #shopping… https://t.co/uQsOrv4hK1,0
Sun Jul 16 21:58:41 +0000 2017,@MarkYusko . . . and $gold gets another moon bounce . . . https://t.co/3VPTQmbUdE,0
Sun Jul 16 21:55:41 +0000 2017,@ausomecookie @MamoudouNDiaye Why go in that room?Bc their privileged ass doesnt have a concept of their own mortal… https://t.co/PfQZinQeyx,0
Sun Jul 16 21:54:46 +0000 2017,@RyjectionIssues Gold,0
Sun Jul 16 21:53:55 +0000 2017,@hms0813 @holachola @Calltoart @PatriciaLKing1 @FrankHa54557821 @dawgfansteve64 @TrumpTiny_Gold @Snarkpants86… https://t.co/wAvSF67c0x,5
Sun Jul 16 21:52:01 +0000 2017,I just earned the 'Fields of Gold (Level 6)' badge on @untappd! https://t.co/kHIy4eh9Tm,0
Sun Jul 16 21:48:25 +0000 2017,@hms0813 @holachola @Calltoart @PatriciaLKing1 @FrankHa54557821 @dawgfansteve64 @TrumpTiny_Gold @Snarkpants86… https://t.co/wAvSF67c0x,5
Sun Jul 16 21:47:11 +0000 2017,✔ GOLD Comment for 17.7.2017 https://t.co/v7xjgYuwiZ  #forex | #forexsignals | #gold | #goldcomments | #xauusd,0
Sun Jul 16 21:44:00 +0000 2017,HillaryClinton can illegally get the questions to the Debate &amp; delete 33 000 emails but my son Don is being scorned by the Fake News Media?,33132
Sun Jul 16 21:43:22 +0000 2017,@holachola @hms0813 @Calltoart @PatriciaLKing1 @FrankHa54557821 @dawgfansteve64 @TrumpTiny_Gold @Snarkpants86… https://t.co/JequMavFr5,0
Sun Jul 16 21:30:49 +0000 2017,🇮🇹🇺🇸 #VespucciintheUS countdown 2⃣ days to Boston  #NaveVespucci bow&amp;stern decorated with gold foiled ornaments and… https://t.co/i8OpW5eS1i,18
Sun Jul 16 21:30:41 +0000 2017,#InTheNews - World Para-athletics Championships: Jonnie Peacock wins second T44 gold https://t.co/o7pxDIPn1K,0
Sun Jul 16 21:28:08 +0000 2017,Handmade Rose Gold Earrings with Shell  Pearl Peacock &amp; Lavender Earrings  https://t.co/kf4vE2J0y1 #jetteam https://t.co/pvAQCPImMD,27
Sun Jul 16 21:22:19 +0000 2017,The Collective by @CurrenSy_Spitta is gold I swear.. #jetlife,0
Sun Jul 16 21:20:06 +0000 2017,To our Gold Sponsor and one of our newest Board Members Maria Gomez  we are so inspired by your commitment to this organization and to women,0
Sun Jul 16 21:17:57 +0000 2017,"We have to make decisions and we can't make them if they're based on fear."  Really everyone  this book is gold beginning to end.,0
Sun Jul 16 21:17:23 +0000 2017,Vintage Metal Boot Red Paint with Gold Buttons Great Chippy Paint … https://t.co/LgAW30iuN6 #vintage #VintagePlanter https://t.co/4hCEmO7baU,2
Sun Jul 16 21:14:56 +0000 2017,@thompsonpat @errorinn That is the nerdiest joke I have seen in a long time  you win the gold!,0
Sun Jul 16 21:13:46 +0000 2017,🇮🇹🇺🇸 #VespucciintheUS countdown 2⃣ days to Boston  #NaveVespucci bow&amp;stern decorated with gold foiled ornaments and… https://t.co/i8OpW5eS1i,18
Sun Jul 16 21:12:28 +0000 2017,i'm so fucking pissed my drunk ass lost my gold rings like those shits were no cheap how am i that stupid,0
Sun Jul 16 21:09:39 +0000 2017,Vintage Metal Boot Red Paint with Gold Buttons Great Chippy Paint … https://t.co/LgAW30iuN6 #vintage #VintagePlanter https://t.co/4hCEmO7baU,2
Sun Jul 16 21:05:47 +0000 2017,At these banks  human milk turns ‘liquid gold’ https://t.co/tPykhfUmTk,1
Sun Jul 16 21:05:18 +0000 2017,A pop of gold and a lot of dangle. Polis for the weekend. https://t.co/i1MHj97DSQ,1
Sun Jul 16 21:01:40 +0000 2017,The Seven Biggest Lies Told (and Believed) about Gold https://t.co/d3QzfN9JvT,46
Sun Jul 16 20:55:45 +0000 2017,BREAKING: Arizona prisons admit massive noncompliance with @ACLU healthcare settlement; face millions in fines.… https://t.co/gKj1FjV02x,561
Sun Jul 16 20:49:47 +0000 2017,this is comedy gold https://t.co/MQL2VIb6Ur,0
Sun Jul 16 20:47:11 +0000 2017,A pop of gold and a lot of dangle. Polis for the weekend. https://t.co/i1MHj97DSQ,1
Sun Jul 16 20:43:46 +0000 2017,Mom thinks I'm handsome w my green eyes. My brother is thinner w gold eyes. She thinks we're both handsome in our o… https://t.co/6nPaSnAFts,3
Sun Jul 16 20:42:49 +0000 2017,This is GOLD https://t.co/I1QOrtSp3Y,1
Sun Jul 16 20:40:50 +0000 2017,Mom thinks I'm handsome w my green eyes. My brother is thinner w gold eyes. She thinks we're both handsome in our o… https://t.co/6nPaSnAFts,3
Sun Jul 16 20:40:08 +0000 2017,Handmade Rose Gold Earrings with Shell  Pearl Peacock &amp; Lavender Earrings  https://t.co/kf4vE2J0y1 #jetteam https://t.co/pvAQCPImMD,27
Sun Jul 16 20:34:40 +0000 2017,Mid-Year’s Only Rock Song Award 🏆: @Harry_Styles’ #SignOfTheTimes Gold @ColumbiaRecords https://t.co/REZjj0liJv https://t.co/rkaTHXnvmH,1682
Sun Jul 16 20:33:53 +0000 2017,This is gold. https://t.co/kOhH7rKCyP,0
Sun Jul 16 20:31:55 +0000 2017,Guzan is off the roster  that's fantastic but what are you taking Don Dwyer away from us Bruce?? https://t.co/BREIjWUCKE,0
Sun Jul 16 20:20:51 +0000 2017,Info: #Colloidal #gold enhances #mental ability  #focus and #mood n feelings of #despair  #anguish n #frustration: https://t.co/7ucPL3zzdF,0
Sun Jul 16 20:19:42 +0000 2017,This is GOLD https://t.co/I1QOrtSp3Y,1
Sun Jul 16 20:17:31 +0000 2017,Successful people solicit constructive  instructive feedback. It's like gold.,1
Sun Jul 16 20:11:08 +0000 2017,Handmade Rose Gold Earrings with Shell  Pearl Peacock &amp; Lavender Earrings  https://t.co/kf4vE2J0y1 #jetteam https://t.co/pvAQCPImMD,27
Sun Jul 16 20:01:37 +0000 2017,@TomLeiss https://t.co/LltxTeIQvK,0
Sun Jul 16 20:00:14 +0000 2017,At these banks  human milk turns ‘liquid gold’ https://t.co/tPykhfUmTk,1
Sun Jul 16 20:00:14 +0000 2017,RT maria0358: FoxNews ericbolling You and Fox are colluding with Russia while Trump is traveling and attending gold tournament at his go…,0
Sun Jul 16 20:00:02 +0000 2017,Thanks @influxdb and @aurotechinc for becoming Gold Sponsors of #DevOpsDaysDC  we appreciate your support! https://t.co/NqHbHBFnk1,0
Sun Jul 16 19:55:04 +0000 2017,#TeamArmy takes #WarriorGames GOLD! Congratulations on a tough but victorious game! @USArmy @armyWCT https://t.co/chspffo4sz,107
Sun Jul 16 19:53:42 +0000 2017,🇮🇹🇺🇸 #VespucciintheUS countdown 2⃣ days to Boston  #NaveVespucci bow&amp;stern decorated with gold foiled ornaments and… https://t.co/i8OpW5eS1i,18
Sun Jul 16 19:53:05 +0000 2017,Tim Howard  Michael Bradley  Clint Dempsey highlight U.S. arrivals at Gold Cup https://t.co/9n1fxxqFUP,1
Sun Jul 16 19:52:57 +0000 2017,My story about #USMNT roster moves ahead of Gold Cup knockout stage  https://t.co/px9VFVHaSq,4
Sun Jul 16 19:51:31 +0000 2017,#MichaelPhelps has used #marijuana  still has managed to win 21 gold medals; so much for #marijuana making you lazy https://t.co/Yv0xqiJo06,136
Sun Jul 16 19:50:06 +0000 2017,RT @Inc: 4 Strategies for Winning Any Competition  According to a 4-Time Olympic Gold Medalist https://t.co/IYRfCb0oee,0
Sun Jul 16 19:49:45 +0000 2017,Tim Howard  Michael Bradley  Clint Dempsey highlight U.S. arrivals at Gold Cup https://t.co/9n1fxxqFUP,1
Sun Jul 16 19:48:30 +0000 2017,This piece from Irwin Stelzer is solid gold: https://t.co/8jFrzWDOdU https://t.co/SVGPqH8zOz,3
Sun Jul 16 19:47:38 +0000 2017,@DBbeer_Katie Solid gold slippers from Claude Moore Summer Market Fair! https://t.co/GyELxgxogr,2
Sun Jul 16 19:47:24 +0000 2017,Prison https://t.co/UYQ0jpYGH8,60
Sun Jul 16 19:45:31 +0000 2017,"Here's chart 26 from my latest newsletter. It shows how a nation's FIFA ranking is positively correlated to inflation. Buy Gold.",0
Sun Jul 16 19:42:40 +0000 2017,Great day for #Lithuania as Henrikas Zustautas wins Men's 200 m. #gold at the #Canoe European Championships in Plovdid  Bulgaria.,2
Sun Jul 16 19:42:05 +0000 2017,I FINALLY FOUND THE WHOLE VIDEO W/ THE GIF OF THAT SUPER HERO WOMAN https://t.co/YUAISpOwBS,10893
Sun Jul 16 19:39:10 +0000 2017,Congrats to team USA winning gold over South Africa at the Maccabi Games. Shout out to former Renegade and current @therugbyclub Isaac Katz.,0
Sun Jul 16 19:33:33 +0000 2017,Capaldi didn't always get the stories he deserved  and had to spin gold out of a lot of straw. But he understood why #DoctorWho matters.,12
Sun Jul 16 19:31:02 +0000 2017,This piece from Irwin Stelzer is solid gold: https://t.co/8jFrzWDOdU https://t.co/SVGPqH8zOz,3
Sun Jul 16 19:30:38 +0000 2017,Enter This Arozzi #Gaming Chair  And #PS4 Gold #Giveaway #SGDQ2017 https://t.co/WTl7TBQy4k,0
Sun Jul 16 19:30:19 +0000 2017,BOGO SALE BUY 3 GET 2 FREE Twist Screw Nose Rings Body Jewelry Accessories. 4 Styles @ #LOVE {PM}♡  &gt; BUY NOW  ➤… https://t.co/s0Lled8a84,0
Sun Jul 16 19:24:15 +0000 2017,This piece from Irwin Stelzer is solid gold: https://t.co/8jFrzWDOdU https://t.co/SVGPqH8zOz,3
Sun Jul 16 19:22:58 +0000 2017,Listen to Au Gold by Marquet #np on #SoundCloud https://t.co/hDUhpUGoxh,23
Sun Jul 16 19:22:46 +0000 2017,This piece from Irwin Stelzer is solid gold: https://t.co/8jFrzWDOdU https://t.co/SVGPqH8zOz,3
Sun Jul 16 19:22:21 +0000 2017,Auction ending 6 hours Vintage Enamel Sterling w/Gold Wash Spoon Frigast Denmark In Excellent Condition  https://t.co/9kX41ICW9n via @eBay,0
Sun Jul 16 19:20:49 +0000 2017,[Gold for Ethiopia!] ለምለም ሃይሉ  በሴቶች 1500 ሜትር  ወርቅ ለኢትዮጵያ አስገኝታለች ------------- በኬንያ እየተካሄደ ባለው የዓለም ከ18 ዓመት በታች... https://t.co/ueoulmCobI,0
Sun Jul 16 19:18:14 +0000 2017,🇮🇹🇺🇸 #VespucciintheUS countdown 2⃣ days to Boston  #NaveVespucci bow&amp;stern decorated with gold foiled ornaments and… https://t.co/i8OpW5eS1i,18
Sun Jul 16 19:14:28 +0000 2017,My story about #USMNT roster moves ahead of Gold Cup knockout stage  https://t.co/px9VFVHaSq,4
Sun Jul 16 19:13:08 +0000 2017,The producer of Voyager's "golden record" looks back on four extraordinary decades of solar system exploration: https://t.co/MXb8QLdAzc,4
Sun Jul 16 19:12:32 +0000 2017,🇮🇹🇺🇸 #VespucciintheUS countdown 2⃣ days to Boston  #NaveVespucci bow&amp;stern decorated with gold foiled ornaments and… https://t.co/i8OpW5eS1i,18
Sun Jul 16 19:11:46 +0000 2017,Handmade Rose Gold Earrings with Shell  Pearl  Peacock &amp; Lavender Earrings  https://t.co/kf4vE2J0y1 https://t.co/pvAQCPImMD #jetteam,24
Sun Jul 16 19:07:54 +0000 2017,Travel to the Hindu god Vishnu’s temple at Angkor Wat where some say his spirit lives today. A #StoryOfGod mini mar… https://t.co/u9TnLF7gnR,28
Sun Jul 16 19:06:20 +0000 2017,18.6 miles for justice. Thank you to all of you who supported us. We couldn't have done this without you! #NRA2DOJ… https://t.co/TXesJOTOpy,104
Sun Jul 16 19:04:25 +0000 2017,A cave in Antarctica will house the first world library of archived glacier ice—to protect it from climate change. https://t.co/PLzACN2tO5,4
Sun Jul 16 19:01:46 +0000 2017,Handmade Rose Gold Earrings with Shell  Pearl  Peacock &amp; Lavender Earrings  https://t.co/kf4vE2J0y1 https://t.co/pvAQCPImMD #jetteam,24
Sun Jul 16 18:58:07 +0000 2017,a stand alone hulk movie with Mark Ruffalo would undoubtedly be gold :((,0
Sun Jul 16 18:57:46 +0000 2017,Handmade Rose Gold Earrings with Shell  Pearl  Peacock &amp; Lavender Earrings  https://t.co/kf4vE2J0y1 https://t.co/pvAQCPImMD #jetteam,24
Sun Jul 16 18:56:33 +0000 2017,My story about #USMNT roster moves ahead of Gold Cup knockout stage  https://t.co/px9VFVHaSq,4
Sun Jul 16 18:55:07 +0000 2017,C Leonard Egan  thank you for your Gold Sponsorship and for more helping women gain access to job training so that they can prosper! #LL2017,0
Sun Jul 16 18:54:37 +0000 2017,My story about #USMNT roster moves ahead of Gold Cup knockout stage  https://t.co/px9VFVHaSq,4
Sun Jul 16 18:52:24 +0000 2017,Listen to Au Gold by Marquet #np on #SoundCloud https://t.co/hDUhpUGoxh,23
Sun Jul 16 18:50:00 +0000 2017,Bruce Arena makes maximum number of roster changes to U.S. soccer team at Gold Cup https://t.co/DGXGo4fOUy,0
Sun Jul 16 18:49:16 +0000 2017,Hoses are razzmatazz camelliases are gold a gummy bear is dominating and so is my shoe,0
Sun Jul 16 18:48:57 +0000 2017,My story about #USMNT roster moves ahead of Gold Cup knockout stage  https://t.co/px9VFVHaSq,4
Sun Jul 16 18:43:46 +0000 2017,Handmade Rose Gold Earrings with Shell  Pearl  Peacock &amp; Lavender Earrings  https://t.co/kf4vE2J0y1 https://t.co/pvAQCPImMD #jetteam,24
Sun Jul 16 18:40:30 +0000 2017,"Not famous enough" is code for "no gold diggers allowed around the athletes....also you're not famous enough" https://t.co/KAa2MPVoPr,151
Sun Jul 16 18:36:37 +0000 2017,Ppl assume women don't spend it on the kids based on stereotypes of young  spiteful  gold digging baby mamas. Much… https://t.co/JQ5AD3TvIc,0
Sun Jul 16 18:24:36 +0000 2017,It was so great having @lzhernandez02 at #NCLR17 this year! https://t.co/OUWUNdslKs,4
Sun Jul 16 18:23:38 +0000 2017,🇮🇹🇺🇸 #VespucciintheUS countdown 2⃣ days to Boston  #NaveVespucci bow&amp;stern decorated with gold foiled ornaments and… https://t.co/i8OpW5eS1i,18
Sun Jul 16 18:23:06 +0000 2017,I'm guessing @JeffFlake is gonna regret having casually endorsed this dumpster fire. The attack ads with these quot… https://t.co/zYckSWpyMc,474
Sun Jul 16 18:20:31 +0000 2017,Info: #Surgeons used2 implant a #gold piece under #skin near an #inflamed joint like #knee or #elbow 4easing #pain: https://t.co/7ucPL3zzdF,0
Sun Jul 16 18:18:08 +0000 2017,Handmade Rose Gold Earrings with Shell  Pearl Peacock &amp; Lavender Earrings  https://t.co/kf4vE2J0y1 #jetteam https://t.co/pvAQCPImMD,27
Sun Jul 16 18:17:03 +0000 2017,Shop online for jewellery from Gold and Diamond jewellery brands.  Tune in to the latest fashion jewellery trends  https://t.co/K6Jj75iz2R,0
Sun Jul 16 18:16:54 +0000 2017,🇮🇹🇺🇸 #VespucciintheUS countdown 2⃣ days to Boston  #NaveVespucci bow&amp;stern decorated with gold foiled ornaments and… https://t.co/i8OpW5eS1i,18
Sun Jul 16 18:08:09 +0000 2017,If procrastination were an Olympic sport... I'd win gold every time...,0
Sun Jul 16 18:06:56 +0000 2017,I'm fine with podcasts as long as the host boils his conversation down into a tight  good story and publishes it in print or on the web.,41
Sun Jul 16 18:00:49 +0000 2017,I'm guessing @JeffFlake is gonna regret having casually endorsed this dumpster fire. The attack ads with these quot… https://t.co/zYckSWpyMc,474
Sun Jul 16 18:00:33 +0000 2017,Dempsey  Howard and Bradley among six United States changes for Gold Cup knockouts https://t.co/Eajz7wK2BA,0
Sun Jul 16 17:55:37 +0000 2017,Listen to Au Gold by Marquet #np on #SoundCloud https://t.co/hDUhpUGoxh,23
Sun Jul 16 17:44:38 +0000 2017,@bravenak @mjwatts1983 This thread is gold!,1
Sun Jul 16 17:43:46 +0000 2017,Handmade Rose Gold Earrings with Shell  Pearl  Peacock &amp; Lavender Earrings  https://t.co/kf4vE2J0y1 https://t.co/pvAQCPImMD #jetteam,24
Sun Jul 16 17:42:13 +0000 2017,"Not famous enough" is code for "no gold diggers allowed around the athletes....also you're not famous enough" https://t.co/KAa2MPVoPr,151
Sun Jul 16 17:38:49 +0000 2017,adventures in auto transcription https://t.co/immCA2d79p,0
Sun Jul 16 17:38:34 +0000 2017,Capaldi didn't always get the stories he deserved  and had to spin gold out of a lot of straw. But he understood why #DoctorWho matters.,12
Sun Jul 16 17:38:08 +0000 2017,Handmade Rose Gold Earrings with Shell  Pearl Peacock &amp; Lavender Earrings  https://t.co/kf4vE2J0y1 #jetteam https://t.co/pvAQCPImMD,27
Sun Jul 16 17:30:42 +0000 2017,Everything that glitters ain't gold.,1
Sun Jul 16 17:26:36 +0000 2017,"Not famous enough" is code for "no gold diggers allowed around the athletes....also you're not famous enough" https://t.co/KAa2MPVoPr,151
Sun Jul 16 17:18:39 +0000 2017,@DBbeer_Katie Solid gold slippers from Claude Moore Summer Market Fair! https://t.co/GyELxgxogr,2
Sun Jul 16 17:17:09 +0000 2017,.@whatwouldDOOdo I'm gonna miss you in green and gold but D.C. is a fun place to be. Glad I'll still get to see you pitch (almost) everyday,0
Sun Jul 16 17:12:20 +0000 2017,"Not famous enough" is code for "no gold diggers allowed around the athletes....also you're not famous enough" https://t.co/KAa2MPVoPr,151
Sun Jul 16 17:11:46 +0000 2017,Handmade Rose Gold Earrings with Shell  Pearl  Peacock &amp; Lavender Earrings  https://t.co/kf4vE2J0y1 https://t.co/pvAQCPImMD #jetteam,24
Sun Jul 16 17:11:39 +0000 2017,#Trumpelstiltskin: Imp-like creature who promises to turn your coal &amp; oil into gold in exchange for your children's future. Now the #POTUS.,5
Sun Jul 16 17:11:31 +0000 2017,"Not famous enough" is code for "no gold diggers allowed around the athletes....also you're not famous enough" https://t.co/KAa2MPVoPr,151
Sun Jul 16 17:11:04 +0000 2017,"Not famous enough" is code for "no gold diggers allowed around the athletes....also you're not famous enough" https://t.co/KAa2MPVoPr,151
Sun Jul 16 17:10:39 +0000 2017,"Not famous enough" is code for "no gold diggers allowed around the athletes....also you're not famous enough" https://t.co/KAa2MPVoPr,151
Sun Jul 16 17:10:29 +0000 2017,Capaldi didn't always get the stories he deserved  and had to spin gold out of a lot of straw. But he understood why #DoctorWho matters.,12
Sun Jul 16 17:10:19 +0000 2017,"Not famous enough" is code for "no gold diggers allowed around the athletes....also you're not famous enough" https://t.co/KAa2MPVoPr,151
Sun Jul 16 17:10:04 +0000 2017,"Not famous enough" is code for "no gold diggers allowed around the athletes....also you're not famous enough" https://t.co/KAa2MPVoPr,151
Sun Jul 16 17:09:15 +0000 2017,Open to best offers 1999-W $5 Gold Eagle With Unfinished Proof Die Error PCGS MS-69 Rare Coin  https://t.co/aEe8Q8KAqP via @eBay,0
Sun Jul 16 17:08:56 +0000 2017,Open to best offers 1999-W $10 Gold Eagle With Unfinished Proof Die Mint Error PCGS MS-69 Rare Coin  https://t.co/GmYacEmBb6 via @eBay,0
Sun Jul 16 17:08:56 +0000 2017,"Not famous enough" is code for "no gold diggers allowed around the athletes....also you're not famous enough" https://t.co/KAa2MPVoPr,151
Sun Jul 16 17:08:50 +0000 2017,Patina or Burnished Gold Metal &amp; Cord Necklace/Earrings! #patina #burnishedgold #necklace #earrings,0
Sun Jul 16 17:06:23 +0000 2017,"Not famous enough" is code for "no gold diggers allowed around the athletes....also you're not famous enough" https://t.co/KAa2MPVoPr,151
Sun Jul 16 17:05:53 +0000 2017,Sooo cute! I love the gold that's in this blush! https://t.co/b8YHOeeZfh,0
Sun Jul 16 17:05:33 +0000 2017,Open to best offers Lord Elgin 23 Jewels Vintage Pearl Watch Dial w/Gold Arrow Markers 28.37mm NOS #Elgin https://t.co/CMVvfLSshd via @eBay,0
Sun Jul 16 17:05:14 +0000 2017,Open to best offers 1931 Yugoslavia Ducat Gold Coin Alexander I Seldom Offered High Grade  https://t.co/kxM6hjM5ww via @eBay,0
Sun Jul 16 17:04:52 +0000 2017,Open to best offers 1882 Serbia Gold 20 Dinara Milan Obrenovich IV (Young Head) Hard To Find  https://t.co/9fNDjmlTc0 via @eBay,0
Sun Jul 16 17:01:02 +0000 2017,ANASTASIUS 491AD Authentic Ancient Byzantine GOLD Solidus Coin - NGC MS - i62468 https://t.co/IVhy6uvwWl https://t.co/U9Hz1XA1t8,0
Sun Jul 16 16:59:16 +0000 2017,Hoses are gold jasmines are burlywood sweets is Channing Tatum and so is the world,0
Sun Jul 16 16:53:14 +0000 2017,#Science https://t.co/sRR9TAtecy Pulmonary function and respiratory health of rural farmers and artisanal and small scale gold miners in G…,0
Sun Jul 16 16:51:36 +0000 2017,Arguing migrants hurt disadvantaged natives is “weak empirically” but “pure political gold” #LantRant https://t.co/PQ8Ls0z8kD,14
Sun Jul 16 16:48:11 +0000 2017,I liked the comedy movie Wagons East. There's no gold in them thar hills  I also Like the old movie EarthQuake https://t.co/XqynvhbBsm,0
Sun Jul 16 16:47:46 +0000 2017,Handmade Rose Gold Earrings with Shell  Pearl  Peacock &amp; Lavender Earrings  https://t.co/kf4vE2J0y1 https://t.co/pvAQCPImMD #jetteam,24
Sun Jul 16 16:46:45 +0000 2017,Capaldi didn't always get the stories he deserved  and had to spin gold out of a lot of straw. But he understood why #DoctorWho matters.,12
Sun Jul 16 16:45:50 +0000 2017,The swamp feels anything but drained -- more like remodeled into a gold-plated hot tub https://t.co/moPhBAWhMb,0
Sun Jul 16 16:44:08 +0000 2017,I'm guessing @JeffFlake is gonna regret having casually endorsed this dumpster fire. The attack ads with these quot… https://t.co/zYckSWpyMc,474
Sun Jul 16 16:33:39 +0000 2017,Mid-Year’s Only Rock Song Award 🏆: @Harry_Styles’ #SignOfTheTimes Gold @ColumbiaRecords https://t.co/REZjj0liJv https://t.co/rkaTHXnvmH,1682
Sun Jul 16 16:32:14 +0000 2017,#USMNT call up some big players for Wednesdays 1/4 final of the gold cup .@arlingtonsoccer https://t.co/6uCkLwVjiK,0
Sun Jul 16 16:30:08 +0000 2017,Mario Kart 8 Deluxe | Staff Ghost Race: Wii Warios Gold Mine 200cc: https://t.co/SLt27WuAWT via @YouTube,0
Sun Jul 16 16:24:17 +0000 2017,Noses are sea green bergamots are gold fruits is Kesha and so is  a cookie,0
