Wed Jun 13 23:25:58 +0000 2018,@TheBubbleBubble I think that the mining is out of control  and flooding the Markets...,0
Wed Jun 13 22:25:42 +0000 2018,Hard work pays.. Inbox us to join and mine your BTC. Thanks https://t.co/8jdu1KdSBX,0
Wed Jun 13 22:22:11 +0000 2018,Apple bans cryptocurrency mining apps on the App Store https://t.co/F9G3LCN9gZ https://t.co/g8uUl2heCQ,0
Wed Jun 13 21:28:35 +0000 2018,Russian #Government Website Infiltrated by Hackers to Mine #Cryptocurrencies BY: Shaurya Malwa… https://t.co/Vu1XshDibe,0
Wed Jun 13 19:45:07 +0000 2018,Handling mining security risks in LatAm https://t.co/Ag7BmYwBdO #best practices #risk management https://t.co/OykuT0A9fl,0
Wed Jun 13 17:48:33 +0000 2018,Apple Bans All Cryptocurrency Mining Applications from Its App Store  https://t.co/Jsay5wfLrW,1
Wed Jun 13 17:35:07 +0000 2018,Apple Bans All Cryptocurrency Mining Applications from Its App Store  https://t.co/Jsay5wfLrW,1
Wed Jun 13 17:09:32 +0000 2018,Cyptocurrency Mining Banned on Apple Iphones And Ipads https://t.co/HNvDJC7W9F via @@codecondoltd,0
Wed Jun 13 16:14:05 +0000 2018,&lt;b&gt;Blockchain&lt;/b&gt; 101 Ep 24 - How to mine Bitcoin https://t.co/DjX3mqP6ft source: Block Chain today same now&amp;#013;… https://t.co/bFZkutUsOa,0
Wed Jun 13 15:12:01 +0000 2018,The deposit remains open to the west and possibly to the northeast where a limited amount of drill testing has been… https://t.co/LzjRN08RKh,0
Wed Jun 13 15:08:01 +0000 2018,@katiet121 @elenochle @1ambecauseweare @Jordan_Sather_ @ScottAnthonyUSA @TheJordanRachel @therealroseanne… https://t.co/nlvYV8zV8X,0
Wed Jun 13 14:45:04 +0000 2018,HashByte’s New Renewable Powered Mining  Tackling the Industries Greatest Downfall and Pulling in Huge Profits!  https://t.co/QdcbJBV2ft,0
Wed Jun 13 13:41:57 +0000 2018,That is just one of the possibilities with mining https://t.co/Z7MgcgHYbx https://t.co/t2TOssZuuY administración,0
Wed Jun 13 13:11:00 +0000 2018,A new possibility in forcount | Forcount mining https://t.co/7A7Yet3xj4 You are ready for a revolution in the crypt… https://t.co/NRDFb8pc6v,0
Wed Jun 13 07:04:07 +0000 2018,#News via #FOX "Apple's App Store bans on-device cryptocurrency mining" https://t.co/McagNlSuHb https://t.co/tsgA3ACEMu,0
Wed Jun 13 06:46:37 +0000 2018,@MinhVuo43999033 @goa_mining @ox1d0 thanks for the recent retweets have an awesome day :),0
Wed Jun 13 05:17:05 +0000 2018,#Science - NASA says mining asteroids in space 'could earn Earth £75 billion'  Several ... https://t.co/F5XSMTpLei https://t.co/RxfEir7kHL,0
Wed Jun 13 03:45:19 +0000 2018,Japanese Police Investigate Cryptojacking Case Involving Coinhive Monero Mining Software  https://t.co/9cTUAgs3qK,0
Wed Jun 13 02:55:40 +0000 2018,If you have a laptop and want to make money in it while you casually use it... download our free BTC mining tool.… https://t.co/fD9jaTzYnE,0
Wed Jun 13 02:49:10 +0000 2018,Did u know mining ⛏ Bitcoin is still profitable? Get started today.  https://t.co/l22VI3zSh4  #bitcoin… https://t.co/OP5zA0HvcN,0
