Thu Nov 08 18:09:00 +0000 2018,Amazing vintage #truck #Repost @MackTrucks "Built 1955 to 1966  the Mack B80 series took on logging  mining  and ot… https://t.co/Ul5WBqU8nl,3
Thu Nov 08 17:53:01 +0000 2018,Amazing vintage #truck #Repost @MackTrucks "Built 1955 to 1966  the Mack B80 series took on logging  mining  and ot… https://t.co/Ul5WBqU8nl,3
Thu Nov 08 17:51:49 +0000 2018,Amazing vintage #truck #Repost @MackTrucks "Built 1955 to 1966  the Mack B80 series took on logging  mining  and ot… https://t.co/Ul5WBqU8nl,3
Thu Nov 08 17:15:24 +0000 2018,Yup I agree when the mining stock promoters themselves like Doug Casey believe mining stocks are scams and pieces o… https://t.co/qg5CJ6XmPs,1
Thu Nov 08 16:55:59 +0000 2018,AWS Mining Top Team (🇧🇷 ️️Brasil-USA ️🇺🇸️) Um Novo Conceito Em Investimentos   ➡️ Cadastro: https://t.co/qgQtixIsOZ… https://t.co/KYhybmoGVL,0
Thu Nov 08 16:00:01 +0000 2018,Whether you're using a smartphone or a computer  you could be effected by cuckoo mining. Read as ACAMSToday explain… https://t.co/1OomzJln8l,0
Thu Nov 08 16:00:00 +0000 2018,Intrusion attempts abusing misconfigured and exposed #Docker API ports to deploy #cryptocurrency-mining malware. https://t.co/ei2hNLB4D6,0
Thu Nov 08 15:41:58 +0000 2018,Yup I agree when the mining stock promoters themselves like Doug Casey believe mining stocks are scams and pieces o… https://t.co/qg5CJ6XmPs,1
Thu Nov 08 15:25:13 +0000 2018,@cryptominerkid @IMineBlocks_com What coin your mining?,0
Thu Nov 08 14:46:01 +0000 2018,Yukon getting lots of interest from the majors...why not Alaska? So much great mining potential? https://t.co/BLfz8R8vMf,0
Thu Nov 08 14:01:49 +0000 2018,Amazing vintage #truck #Repost @MackTrucks "Built 1955 to 1966  the Mack B80 series took on logging  mining  and ot… https://t.co/Ul5WBqU8nl,3
Thu Nov 08 13:42:54 +0000 2018,upon completion Ucore immediately becomes a revenue bearing company-a leader in nano technology for the mining busi… https://t.co/9d32hPMIaK,0
Thu Nov 08 11:30:48 +0000 2018,Energy cost of 'mining' bitcoin more than twice that of copper or gold | Technology | The Guardian https://t.co/UomQHauJn5,0
Thu Nov 08 08:34:25 +0000 2018,China’s Green Shift Makes Massive Profits for South African Mining Industry via /r/business https://t.co/8HxyQHIFTB,0
Thu Nov 08 00:43:48 +0000 2018,War: Bitcoin Cash Startup Launches Mining Pool to Attack Altcoins &amp; BCH Forks https://t.co/wymSwvu3m1 via @cryptocoinsnews,0
