Mon Oct 29 22:10:54 +0000 2018,Still My Fav! LOVE THIS ONE! #Wolf #MindSet #Popularcoin #Designer #Professional #Best #LetGetItOn… https://t.co/zALeK4NBOP,3
Mon Oct 29 20:21:50 +0000 2018,AWS Mining Top Team ⚒️ Equipe: Brasil-USA-Inglaterra-Portugal-Canada-Colombia  - Mineração de CriptoMoedas  - Um no… https://t.co/n5v2xIZb8D,0
Mon Oct 29 16:19:36 +0000 2018,Exactly. The issues are local. Yet  I just walked by a poll worker for Manny Diaz who was fear-mongering  telling a… https://t.co/w9FZKOV1mb,1
Mon Oct 29 15:54:47 +0000 2018,“Mining With No Special Equipment”: Token Uses Bitcoin Principles on Ethereum Blockchain https://t.co/9ZkqFoCWQy,0
Mon Oct 29 15:53:25 +0000 2018,Exactly. The issues are local. Yet  I just walked by a poll worker for Manny Diaz who was fear-mongering  telling a… https://t.co/w9FZKOV1mb,1
Mon Oct 29 13:47:22 +0000 2018,The Orange one is a despicable person in all senses.  Look how he took the news of Brazil’s terrible choice for new… https://t.co/BSPfAr2WlZ,1
Mon Oct 29 13:44:03 +0000 2018,The Orange one is a despicable person in all senses.  Look how he took the news of Brazil’s terrible choice for new… https://t.co/BSPfAr2WlZ,1
Mon Oct 29 12:07:24 +0000 2018,https://t.co/FD8PgCYlfj #JobSeek.us #Jobs #JobsIN ...oil  &amp; ; gas  power  &amp; ; process  environment and infrastructu… https://t.co/Vv7yTTCGHF,0
Mon Oct 29 02:22:01 +0000 2018,#Bolsonaro wants to steal #Amazon lands from #Indigenous Nations for mining. #FuckBolsonaro #Brazil🇧🇷… https://t.co/9ha5hLDVad,1
Mon Oct 29 01:30:17 +0000 2018,#Bolsonaro wants to steal #Amazon lands from #Indigenous Nations for mining. #FuckBolsonaro #Brazil🇧🇷… https://t.co/9ha5hLDVad,1
Mon Oct 29 01:10:03 +0000 2018,Still My Fav! LOVE THIS ONE! #Wolf #MindSet #Popularcoin #Designer #Professional #Best #LetGetItOn… https://t.co/zALeK4NBOP,3
