Wed Nov 14 23:52:26 +0000 2018,Moments before start of the conference Nov 9.  @ilyasut co-founder of @OpenAI  @Dr_Yaz Chief Investment Officer… https://t.co/rhzgPqUZ8t,2
Wed Nov 14 23:13:49 +0000 2018,The HDEA integrates optical transport  Layer 2 Ethernet functionality and open  programmable software control. Lear… https://t.co/sTxz0b0kqA,0
Wed Nov 14 22:54:07 +0000 2018,Friendly reminder that I’m still the worst investor in #bitcoin having bought in ~18k  And that my performance to d… https://t.co/HwqTUOfrVl,2
Wed Nov 14 22:20:59 +0000 2018,We work hard to help property owners maximize their return on #investment! We conduct interior surveys and send rep… https://t.co/W4wnkfqrsA,0
Wed Nov 14 22:16:05 +0000 2018,Friendly reminder that I’m still the worst investor in #bitcoin having bought in ~18k  And that my performance to d… https://t.co/HwqTUOfrVl,2
Wed Nov 14 21:13:39 +0000 2018,If you can not sustain the risk of your investment equaling zero  you have no business investing. There is no guara… https://t.co/LQVOBEmJRF,0
Wed Nov 14 20:47:29 +0000 2018,SoftBank invests $1.1B in View - a maker of  #IoT enabled smart windows that improve human health  views  and… https://t.co/RqmRmN2sRF,8
Wed Nov 14 20:16:14 +0000 2018,Moments before start of the conference Nov 9.  @ilyasut co-founder of @OpenAI  @Dr_Yaz Chief Investment Officer… https://t.co/rhzgPqUZ8t,2
Wed Nov 14 20:02:10 +0000 2018,Are you an investor? Then this #FREE investment manager might be for you! Choose your own #investments + M1 manages… https://t.co/RUuT4GjCPI,0
Wed Nov 14 19:30:11 +0000 2018,This might be the perfect solution for #investors. #FREE investment management + You choose your own #investments.… https://t.co/dZBErJodqJ,0
Wed Nov 14 19:21:58 +0000 2018,@CryptoWendyO A $20K investment in BTC today might yield your daughter $1M in 10 to 12 years.  It sounds ridiculous… https://t.co/syrDBVFj14,0
Wed Nov 14 19:01:18 +0000 2018,#SmartCities are designed to redefine citizen experience  deliver improved productivity through automation and deli… https://t.co/hOW3wM5YD3,0
Wed Nov 14 18:58:11 +0000 2018,Are you wondering if Robo-Advisors are a Scam? Get the Facts as we delve into this new #fintech investment manageme… https://t.co/4YMJg0Oatk,0
Wed Nov 14 18:36:10 +0000 2018,Women - there is an investment advisor just for you - includes career coaching + financial advisors! &gt; Read the Ell… https://t.co/CABzmmX0gb,0
Wed Nov 14 18:07:05 +0000 2018,A leading investment firm leverages intelligent #automation to complete time-sensitive projects quickly—while remai… https://t.co/Utt5XCamXa,0
Wed Nov 14 18:04:47 +0000 2018,Moments before start of the conference Nov 9.  @ilyasut co-founder of @OpenAI  @Dr_Yaz Chief Investment Officer… https://t.co/rhzgPqUZ8t,2
Wed Nov 14 18:00:49 +0000 2018,@AOLVentures New York  NY &amp; The Bay Area. A huge #kolegraffvclink Silicon Valle welcome to the Investment Arm… https://t.co/ORrIHr3bYS,0
Wed Nov 14 17:56:11 +0000 2018,The top robo-advisor by assets under management is Vanguard. Learn all about theVanguard Robo-Advisor in this Revie… https://t.co/Ox09VDZqSb,0
Wed Nov 14 17:34:12 +0000 2018,2 great #investment managers. Get the head-to-head breakdown of @Betterment vs. @WiseBanyan Comparison - #Invest To… https://t.co/hsT8RZCFKN,0
Wed Nov 14 17:11:06 +0000 2018,GUIDE | How can you justify investment in the tools you need? Speak management's language. Learn how to build a bus… https://t.co/x1ZkYqCqSu,0
Wed Nov 14 16:26:11 +0000 2018,Do you want low cost investment management? The 7 Main Differences Between Robo-Advisors Are...Fees  Features  Acco… https://t.co/2u7wbcwR8L,0
Wed Nov 14 15:47:48 +0000 2018,$ARYC 🇺🇸🇺🇸#tech #technology #fintech #blockchain #pennystock #pennystocks #SiliconValley #blockchaintechnology… https://t.co/AplYJkKrr4,8
Wed Nov 14 15:14:50 +0000 2018,Great chart of the day from @PitchBook re Corporate Venture Capital deals making up a larger share of overall inves… https://t.co/m6StUarHQC,5
Wed Nov 14 15:06:06 +0000 2018,Great chart of the day from @PitchBook re Corporate Venture Capital deals making up a larger share of overall inves… https://t.co/m6StUarHQC,5
Wed Nov 14 14:51:13 +0000 2018,Great chart of the day from @PitchBook re Corporate Venture Capital deals making up a larger share of overall inves… https://t.co/m6StUarHQC,5
Wed Nov 14 14:50:47 +0000 2018,Great chart of the day from @PitchBook re Corporate Venture Capital deals making up a larger share of overall inves… https://t.co/m6StUarHQC,5
Wed Nov 14 14:50:27 +0000 2018,Great chart of the day from @PitchBook re Corporate Venture Capital deals making up a larger share of overall inves… https://t.co/m6StUarHQC,5
Wed Nov 14 14:48:09 +0000 2018,Great chart of the day from @PitchBook re Corporate Venture Capital deals making up a larger share of overall inves… https://t.co/m6StUarHQC,5
Wed Nov 14 14:19:05 +0000 2018,Baidu leads $300M investment to bring its search smarts to elevator ads https://t.co/DLAnwDRNSF https://t.co/8PojrrbJhv,0
Wed Nov 14 13:25:43 +0000 2018,Read our latest blog post by @ferasa on '2 Steps to Maximize Your Investment in Google Marketing Platform'… https://t.co/n9BkuLvuWL,1
Wed Nov 14 12:30:14 +0000 2018,Silicon Valley Bank parent buys life science investment bank for $280M https://t.co/1TZRRRwDy1 https://t.co/8ll9qNIQFg,0
Wed Nov 14 07:46:57 +0000 2018,Dad’s Investment Reading Club 2018 https://t.co/n0qCsKTdoK,0
Wed Nov 14 07:17:07 +0000 2018,[EMEA LIVE] Welcome to #ServiceMaxAmsterdam! Today  attendees will hear new ideas and initiatives to #Maximise thei… https://t.co/6stROUFCld,0
Wed Nov 14 05:46:13 +0000 2018,When asked about my investment strategy: https://t.co/Ie9jpMR3iM,0
Wed Nov 14 05:44:30 +0000 2018,Overheard a kid interviewing for a position at the student run investment fund on campus.   When asked about the ‘t… https://t.co/tkvgZWWR9Y,1
Wed Nov 14 05:32:57 +0000 2018,Overheard a kid interviewing for a position at the student run investment fund on campus.   When asked about the ‘t… https://t.co/tkvgZWWR9Y,1
Wed Nov 14 05:08:07 +0000 2018,My latest post: 2 Steps to Maximize Your Investment in Google Marketing Platform' @googleanalytics… https://t.co/GB4L5BL4F0,2
Wed Nov 14 04:06:02 +0000 2018,@2HappyKittyz @Arborealgrassmn @colleenschlegel @Enjoneer01 @damnpamfromnamm @busywriting @NancyPelosi If a large c… https://t.co/A4HNkmM5SZ,0
Wed Nov 14 03:00:15 +0000 2018,Lynnbrook Group Announces Partnership with @Orbirental  - https://t.co/RzQOCjfxkK https://t.co/xXx7kBmoYi,0
Wed Nov 14 02:00:33 +0000 2018,Get expert real estate investment tips from Jim Kim  a mortgage agent  and Aaron Charles  a real estate agent  on h… https://t.co/wVEqy0tiMU,0
Wed Nov 14 01:56:07 +0000 2018,@KateClarkTweets Businesses in a growth period tend not 2 make profits. They tend to make land grabs. In WW’s case … https://t.co/kbBaiVrQ4L,0
Wed Nov 14 00:56:05 +0000 2018,Silicon Valley Bank parent buys life science investment bank for $280M https://t.co/3DooAPtZJB https://t.co/cBS3caioro,1
Wed Nov 14 00:24:52 +0000 2018,#PAL Network is a Singapore-based platform  built by #PolicyPal  offering unique blockchain-based insurance service… https://t.co/b2nMaF12fS,0
Wed Nov 14 00:24:38 +0000 2018,#PAL Network is a Singapore-based platform  built by #PolicyPal  offering unique blockchain-based insurance service… https://t.co/WewWkZMsrw,0
Wed Nov 14 00:24:19 +0000 2018,#PAL Network is a Singapore-based platform  built by #PolicyPal  offering unique blockchain-based insurance service… https://t.co/pOx96kMCrC,0
Wed Nov 14 00:24:01 +0000 2018,#PAL Network is a Singapore-based platform  built by #PolicyPal  offering unique blockchain-based insurance service… https://t.co/VYoziflnem,0
Wed Nov 14 00:00:21 +0000 2018,Silicon Valley Bank parent buys life science investment bank for $280M https://t.co/3DooAPtZJB https://t.co/cBS3caioro,1
