Thu Aug 23 23:59:42 +0000 2018,@albericie Which countries? They all allow unlimited carry forward for long term infrastructure investment,0
Thu Aug 23 23:15:42 +0000 2018,It was 10 years ago that @MicroFocus announced its acquisition of Liant Software adding PL/I modernization capabili… https://t.co/bGceheFYgI,0
Thu Aug 23 22:41:44 +0000 2018,Investment strategist on politics' impact on the markets Bull Market 🇺🇸  https://t.co/3GAoFIeGFI,5
Thu Aug 23 22:40:03 +0000 2018,Investment strategist on politics' impact on the markets Bull Market 🇺🇸  https://t.co/3GAoFIeGFI,5
Thu Aug 23 22:39:15 +0000 2018,Investment strategist on politics' impact on the markets Bull Market 🇺🇸  https://t.co/3GAoFIeGFI,5
Thu Aug 23 22:38:49 +0000 2018,Investment strategist on politics' impact on the markets Bull Market 🇺🇸  https://t.co/3GAoFIeGFI,5
Thu Aug 23 22:37:58 +0000 2018,Investment strategist on politics' impact on the markets Bull Market 🇺🇸  https://t.co/3GAoFIeGFI,5
Thu Aug 23 22:37:18 +0000 2018,Investment strategist on politics' impact on the markets Bull Market 🇺🇸  https://t.co/3GAoFIeGFI,5
Thu Aug 23 22:09:01 +0000 2018,Concerns exist over quality  racial disparities in digital-learning outcomes  and whether or not the return on inve… https://t.co/0dZFeGzwFR,0
Thu Aug 23 21:22:45 +0000 2018,Public infrastructure investment must privilege public well-being over profit  https://t.co/BBTEUA8ykb,4
Thu Aug 23 21:20:10 +0000 2018,Is it a smart investment to start a lifestyle business? Learn here https://t.co/o8cA9VT70N https://t.co/LlIcgVh1wb,0
Thu Aug 23 20:46:41 +0000 2018,"Top Investment Banks In Each Industry 2018" https://t.co/iUEpOHA6YO #investmentbanks #wallstreet #banking,0
Thu Aug 23 20:34:59 +0000 2018,Public infrastructure investment must privilege public well-being over profit  https://t.co/BBTEUA8ykb,4
Thu Aug 23 20:30:02 +0000 2018,#SDWAN solutions are designed to address problems regarding lack of visibility and low bandwidth  but it can be dif… https://t.co/NclGnJFOUu,0
Thu Aug 23 20:20:38 +0000 2018,The biggest scam right now in crypto are these “investment summits” where none of the presenters know the economics… https://t.co/LbeqiiEUSX,0
Thu Aug 23 20:18:02 +0000 2018,Public infrastructure investment must privilege public well-being over profit  https://t.co/BBTEUA8ykb,4
Thu Aug 23 20:03:31 +0000 2018,If you are looking at rental real estate as an investment option  be sure to consider these five things before you… https://t.co/BppLgWaLvb,0
Thu Aug 23 19:41:25 +0000 2018,@MarcKamhi1 @mneuwirth @ZekeJMiller Remember the housing crash  and a bunch of investment funds snatched up all tho… https://t.co/twMWnm5ubG,0
Thu Aug 23 19:01:22 +0000 2018,@SenWarren @DeniseShearin @BetsyDeVosED Investment in education is like investing for your future. In the future  y… https://t.co/kQExKdIfNg,0
Thu Aug 23 18:13:37 +0000 2018,Is it possible to have too much of a good thing? Here’s what you need to know about rebalancing your portfolio.… https://t.co/9zzbixJOLd,0
Thu Aug 23 17:57:44 +0000 2018,Trump holds roundtable on Foreign Investment Risk bill -- live stream https://t.co/VRgq597Uel,2
Thu Aug 23 17:56:49 +0000 2018,Trump holds roundtable on Foreign Investment Risk bill -- live stream https://t.co/VRgq597Uel,2
Thu Aug 23 17:50:14 +0000 2018,Investing Wisdom for Today's Market + Links from my posts for US News and World Report &amp; InvestorPlace about variou… https://t.co/rE7EQSQAHm,0
Thu Aug 23 17:38:28 +0000 2018,SaaS Strikes Back: Early-Stage VC Investment Snaps Years-Long Cold Streak https://t.co/nDGSbYvOVp,0
Thu Aug 23 17:35:26 +0000 2018,We are honored to welcome David Ku  CTO of AI +R @Microsoft to be @HYSTA Annual Conference's first keynote speaker… https://t.co/gOWRTQTHSt,0
Thu Aug 23 17:30:21 +0000 2018,Building your vocabulary is a personal investment. Tips on how to build your vocabulary. #KnowledgeisPower… https://t.co/QjY8x2JBtA,0
Thu Aug 23 17:05:11 +0000 2018,Business cash flows are divided into three categories  operational  financial  and investment. Learn how it's done: https://t.co/ctCLo7Sdyq,0
Thu Aug 23 15:57:07 +0000 2018,Collect moments. Not things.  We can make compelling portraits out of any occasion. It is an investment you will ne… https://t.co/MVpx8Oalqq,0
Thu Aug 23 15:49:45 +0000 2018,AgTech Investment Event -Technology has transformed the way food is produced  managed  &amp; distributed. Many startups… https://t.co/NPDfPr5sff,1
Thu Aug 23 14:49:03 +0000 2018,How does it make any sense for the Indian government to seek investment from UAE's sovereign wealth fund to build i… https://t.co/iV6sVpUU9h,0
Thu Aug 23 14:20:16 +0000 2018,Automate marketing to #vacationRental guests with Mailchimp and @Orbirental - https://t.co/h3aG5Z4N2i #automate… https://t.co/vRfxGn0QDI,0
Thu Aug 23 14:10:12 +0000 2018,Public infrastructure investment must privilege public well-being over profit  https://t.co/BBTEUA8ykb,4
Thu Aug 23 14:06:09 +0000 2018,Public infrastructure investment must privilege public well-being over profit  https://t.co/BBTEUA8ykb,4
Thu Aug 23 13:30:34 +0000 2018,According to Financial Services Technology Adoption and Investment Survey in 2017 by @Gartner_inc - more than 60% o… https://t.co/bLordZrfbn,0
Thu Aug 23 13:15:30 +0000 2018,@BeyondPricing Integrates  with @Orbirental's Innovative Vacation Rental Management Platform https://t.co/9ASyfZmnGD,0
Thu Aug 23 13:07:04 +0000 2018,Treasurers  get information about all of your cash  across locations  investment vehicles  countries  &amp; currencies.… https://t.co/qHv6YWvr4g,0
Thu Aug 23 13:05:03 +0000 2018,Got Phished?  Yes  it can happen to you or anyone at your firm. So how do you respond? Here's a great guide for Inv… https://t.co/zZUA72IfLl,0
Thu Aug 23 12:30:18 +0000 2018,Do Good + Build #Wealth with Best Socially Conscious #Investment Advisors - Funds and Robots… https://t.co/Z9172wLyI1,0
Thu Aug 23 06:22:05 +0000 2018,Hyundai leads $14.3M investment in Indian car rental startup Revv https://t.co/WMxJXafflu https://t.co/P0G8I3UoYG,0
Thu Aug 23 06:15:30 +0000 2018,We want to enforce your investment in Hillstone products with new technologies and improved capabilities. StoneOS p… https://t.co/rwfVGSJJag,3
Thu Aug 23 06:12:10 +0000 2018,Open source takes continued investment  and that must be subsidized somehow https://t.co/pT1silRVZt,0
Thu Aug 23 05:56:34 +0000 2018,Hence the reason @CathieDWood is my investment manager. I’m betting on her via @ARKInvest https://t.co/ioSzOv7sga,0
Thu Aug 23 03:09:57 +0000 2018,We want to enforce your investment in Hillstone products with new technologies and improved capabilities. StoneOS p… https://t.co/rwfVGSJJag,3
Thu Aug 23 02:20:02 +0000 2018,Looking for new biz opportunity or #investment?  This market is taking off.  Thx @FortuneMagazine… https://t.co/0Ksl3IAvDG,1
Thu Aug 23 02:20:01 +0000 2018,Looking for new biz opportunity or #investment?  This market is taking off.  Thx @FortuneMagazine… https://t.co/0Ksl3IAvDG,1
Thu Aug 23 01:59:18 +0000 2018,AgTech Investment Event -Technology has transformed the way food is produced  managed  &amp; distributed. Many startups… https://t.co/NPDfPr5sff,1
Thu Aug 23 00:27:09 +0000 2018,We want to enforce your investment in Hillstone products with new technologies and improved capabilities. StoneOS p… https://t.co/rwfVGSJJag,3
Thu Aug 23 00:23:05 +0000 2018,The 1st batch of 2018 HYSTA Annual Conference confirmed speakers https://t.co/aNHYG18p52 #SiliconValley #speaker… https://t.co/wDAB9hTQqU,0
Thu Aug 23 00:15:44 +0000 2018,8.28 Shenzhen-Seattle Investment Promotion Summit at @GrandHyattSea. Come and learn about why @Huawei  @BYDCompany … https://t.co/Y31sStK220,0
Thu Aug 23 00:13:01 +0000 2018,These are great: 5 Investment Tips That Drive Me Crazy https://t.co/wjGLIMSToU via @Frugal_Asian,0
Thu Aug 23 00:09:15 +0000 2018,HCL Careers | MN-Minneapolis: Need Technical Business Analyst  with Capital Markets and/or Investment Management exp https://t.co/FTlUHfrH0H,0
