Mon Dec 31 23:58:02 +0000 2018,@macplastics @CryptoVegemite @Nouriel @ldignan A) Sold and then bought back in later thinking could get back in a l… https://t.co/0fD9kfp8h6,0
Mon Dec 31 23:46:14 +0000 2018,An investment in knowledge always pays the best interest. — Benjamin Franklin #quote,0
Mon Dec 31 23:28:08 +0000 2018,Repeated practice is a high risk investment because the fittest approach of learning varies from one to one  and yo… https://t.co/XWDug8F4tE,1
Mon Dec 31 21:55:44 +0000 2018,Looking at these boats I could buy one if I really wanted to. Foolish investment for me right now next year I'll be ready,0
Mon Dec 31 21:50:20 +0000 2018,Is This Startup Ready For Investment? https://t.co/4TU0g68QYy https://t.co/lnzTOym8re,36
Mon Dec 31 20:48:11 +0000 2018,Are you an investor? Then this #FREE investment manager might be for you! Choose your own #investments + M1 manages… https://t.co/zNt8WFioxI,0
Mon Dec 31 19:47:32 +0000 2018,Repeated practice is a high risk investment because the fittest approach of learning varies from one to one  and yo… https://t.co/XWDug8F4tE,1
Mon Dec 31 19:18:52 +0000 2018,End the year with LOVE for our kids! A gift to FLY is an investment in the future of our community. Just go to… https://t.co/jo2kLrsL78,0
Mon Dec 31 19:13:14 +0000 2018,Arrayit web team adds the new December 31 2018 Chief Executive Officer Rene Schena Letter to ARYC Shareholders to o… https://t.co/SB4JkNNb8I,0
Mon Dec 31 18:44:11 +0000 2018,Women - there is an investment advisor just for you - includes career coaching + financial advisors! &gt; Read the Ell… https://t.co/cFiKXLyJ4Z,0
Mon Dec 31 18:35:23 +0000 2018,Every Chinese person I know of my parent's gen places real estate @ the top of their investment type. Wonder if thi… https://t.co/pIWjag44Yy,0
Mon Dec 31 17:59:43 +0000 2018,@tickin_clocks This March  all my money got stuck in some bad investment. I was heartbroken but I knew God had bett… https://t.co/Wg4ujEutS0,1
Mon Dec 31 17:56:49 +0000 2018,Dog walking app @WagWalking attacks even more serious investment https://t.co/Z9WgC3NSTt,0
Mon Dec 31 15:42:10 +0000 2018,I can't wait to share this new Robo-Advisor Selection Wizard. It helps you choose the best digital #investment mana… https://t.co/Dl9NdLCO9H,0
Mon Dec 31 14:07:51 +0000 2018,1903. Samuel Langely attempts his second manned flight an airplane. It failed  as did the first. https://t.co/HRu2ludArp #thisdayinspace,1
Mon Dec 31 12:15:30 +0000 2018,"It's important to remember that after the investment for these campaigns  you should also keep the initial engagem… https://t.co/JHIoSESDsR,0
Mon Dec 31 12:00:07 +0000 2018,Join us on 15 January in Copenhagen! Learn how to increase the value of your software investment with #MicroFocus… https://t.co/V39h0Csckd,0
Mon Dec 31 08:30:00 +0000 2018,#SMBs &amp; #startups  need a little investment to help your company grow to the next stage? SDI can help build a pitch… https://t.co/zteairweuE,0
Mon Dec 31 07:00:18 +0000 2018,#AGoodRead #LegalTech hits $1 billion investment as #lawyers embrace automation #Doctors can claim to be even more… https://t.co/RJ8tI3XS1y,0
Mon Dec 31 06:40:09 +0000 2018,We anticipate that the Elio STO will give investors a new kind of investment option while being structured with the… https://t.co/uDjGtlqdgo,0
Mon Dec 31 06:40:08 +0000 2018,- a digital token that is associated with the production of a motor vehicle - as well as the first digital token sa… https://t.co/bBwDN66VJ4,0
Mon Dec 31 06:40:02 +0000 2018,Elio intends to use the proceeds of the new investment to fund capital expenditures and repay certain outstanding d… https://t.co/fHjN1dPoQF,0
Mon Dec 31 04:10:01 +0000 2018,This is a reminder that tech startup valuations are sometimes based more on potential than proof of revenue  and… https://t.co/CAB6LHrJaU,0
Mon Dec 31 03:25:04 +0000 2018,China's investment in Nigeria could be neo-imperialism in disguise https://t.co/x19DL9jnh8,0
Mon Dec 31 00:03:00 +0000 2018,Concerned about #networksecurity? Have an audit coming up? See how this #Fortune500 insurance and financial firm re… https://t.co/rD0vxg31ag,0
