Sat Mar 10 23:22:31 +0000 2018,I TRADE BITCOIN and others HERE!  ✅KUCOIN is 100% OPEN!!!  CLICK ▶️ https://t.co/Ulm0EgFJ2J  ❌Binance  ❌Poloniex  ❌… https://t.co/2lqIeQbFY8,3
Sat Mar 10 21:28:03 +0000 2018,THE BEST BITCOIN EXCHANGE!  CLICK ▶️ https://t.co/jMA4HcAv0L     Move your trading to the #1 crypto exchange today!… https://t.co/Is710lhqeL,0
Sat Mar 10 19:22:03 +0000 2018,NEW WITH BITCOIN TRADING? BEST PLATFORM:  CLICK ▶️ https://t.co/Ulm0EgFJ2J  ✅KUCOIN ($btc #btc #bitcoin) #kcs… https://t.co/uZ25j1W4QF,0
Sat Mar 10 18:17:07 +0000 2018,I TRADE BITCOIN and others HERE!  ✅KUCOIN is 100% OPEN!!!  CLICK ▶️ https://t.co/Ulm0EgFJ2J  ❌Binance  ❌Poloniex  ❌… https://t.co/2lqIeQbFY8,3
Sat Mar 10 18:15:03 +0000 2018,I TRADE BITCOIN and others HERE!  ✅KUCOIN is 100% OPEN!!!  CLICK ▶️ https://t.co/Ulm0EgFJ2J  ❌Binance  ❌Poloniex  ❌… https://t.co/2lqIeQbFY8,3
Sat Mar 10 17:17:03 +0000 2018,✅Binance FINALLY OPEN again.... REGISTER NOW!!!   CLICK ▶️ https://t.co/jMA4HcAv0L     ❌Poloniex  ❌Bittrex    Move… https://t.co/Myywyc6nl8,0
Sat Mar 10 09:39:23 +0000 2018,Regardez ce que je viens de retrouver. C’est facilement l’une des meilleures vidéos de Twitter. Je suis toujours en… https://t.co/qJn9WSkNpI,9682
Sat Mar 10 09:23:03 +0000 2018,Want to trade a lambo?  CLICK ▶️ https://t.co/Ulm0EgFJ2J  ✅KUCOIN ($btc #btc #bitcoin) #kcs #kucoin ❌Poloniex  ❌Bit… https://t.co/6gEB3eBdrw,0
Sat Mar 10 08:41:03 +0000 2018,Want to trade $rpx #rpx online?  CLICK ▶️ https://t.co/Ulm0EgFJ2J  ✅KUCOIN ($btc #btc #bitcoin) #kcs #kucoin ❌Polon… https://t.co/4ZkIW4yXVJ,0
Sat Mar 10 06:56:18 +0000 2018,Hate to even say it  but is BCH the new store of value? It dips  it's volatile like the rest of crypto  but seems l… https://t.co/P1Bf4Fh5dY,0
Sat Mar 10 06:04:03 +0000 2018,✅Binance  ❌Poloniex  ❌Bittrex    Move all your trading to the NUMBER 1 crypto exchange 🚀  Receive a 50% discount on… https://t.co/rmMKyRxaSo,0
Sat Mar 10 03:46:03 +0000 2018,Want to make REAL MONEY on bitcoin trading?  CLICK here ▶️ https://t.co/Ulm0EgFJ2J  ✅KUCOIN ($btc #btc #bitcoin)… https://t.co/bUcNvUBatq,0
