Wed Apr 18 22:10:04 +0000 2018,IS BITCOIN a BUBBLE? NO FUCKING WAY make profit today!  CLICK  ▶️ https://t.co/Ulm0EgFJ2J  ✅JOIN NOW KUCOIN ore BIN… https://t.co/ccdNevAe0U,0
Wed Apr 18 22:02:58 +0000 2018,@simonbettison @ProfFaustus Strategies implemented are imperative. #BitcoinCash is on the right track by focusing o… https://t.co/0oYnAzhkyQ,0
Wed Apr 18 21:44:37 +0000 2018,Private Key never exposed on #BitcoinCash Patented DISTRIBUTED THRESHOLD BLINDED KEY SYSTEM could prevent another M… https://t.co/HbyaL7fQnc,16
Wed Apr 18 21:24:03 +0000 2018,Binance registrations closed? NOOO! Not with this link 🧐  CLICK ▶️  https://t.co/jMA4HcAv0L     Do like hundreds of… https://t.co/3rlReqyU9O,0
Wed Apr 18 21:22:02 +0000 2018,✅Binance is FINALLY OPENT again.... REGISTER NOW!!!   CLICK ▶️ https://t.co/jMA4HcAv0L     ❌Poloniex (#bitcoin) ❌Bi… https://t.co/IDDmJW7Kmz,0
Wed Apr 18 21:05:42 +0000 2018,@simonbettison @ProfFaustus The US market is #2 in exchange volume for Bitcon &amp; could change. US population is quit… https://t.co/A9DDCmtqRT,0
Wed Apr 18 20:19:03 +0000 2018,Qash / Quoine coin will rock in 2018!!! Top 5 coin???  ✅QRYPTOS (trade QASH here baby!)  🚀   Trade $qash #qash  CLI… https://t.co/ODgYmPcpAY,0
Wed Apr 18 19:39:03 +0000 2018,Qash / Quoine coin will dev rock in 2018!!!   ✅Qryptos (trade QASH here!)  🚀   Trade $qash #qash  CLICK ▶️… https://t.co/abXINVGEeL,0
Wed Apr 18 19:22:02 +0000 2018,ETH ore ETC coin trading?  ✅Binance (trade ETH and ETC here )  🚀   Trade $eth #etc  CLICK ▶️… https://t.co/SsVFgZUF8u,0
Wed Apr 18 18:39:03 +0000 2018,Become rich in bitcoin trading now!  CLICK here ▶️ https://t.co/Ulm0EgFJ2J  ✅KUCOIN ($btc #btc #bitcoin) #kcs… https://t.co/EDpJHqvGlK,0
Wed Apr 18 18:34:03 +0000 2018,QTUM is growing fast! Buy them today!!!   ✅Binance (trade QTUM here CLICK ▶️ https://t.co/jMA4HcAv0L     🚀   Trade… https://t.co/b0CPdvJPEp,0
Wed Apr 18 17:45:53 +0000 2018,$BCH $BCC  Sorry not sorry https://t.co/SGgluDyEAi,0
Wed Apr 18 15:33:03 +0000 2018,BITCOIN is a BUBBLE? NO WAY make HUGE profits!  CLICK  ▶️ https://t.co/Ulm0EgFJ2J  ✅JOIN NOW KUCOIN ore BINANCE ($b… https://t.co/yVmDwncn2D,0
Wed Apr 18 12:54:44 +0000 2018,LOOKING FOR BITCOIN EXCHANGE?  CLICK  ▶️ https://t.co/Ulm0EgFJ2J  ✅KUCOIN ($btc #btc #bitcoin)  ❌Poloniex  ❌Bittrex… https://t.co/hsv1BfHYYb,1
Wed Apr 18 12:00:35 +0000 2018,Bitcoin Cash Price Technical Analysis – BCH/USD Remains Range Bound https://t.co/6GBumVUQ3u,0
Wed Apr 18 11:11:03 +0000 2018,MAKE TONS OF MONEY WITH BITCOIN!!  ✅KUCOIN is 100% OPEN!!!  CLICK ▶️ https://t.co/Ulm0EgFJ2J  ❌Binance  ❌Poloniex… https://t.co/rHRmObkdrF,0
Wed Apr 18 10:54:35 +0000 2018,Private Key never exposed on #BitcoinCash Patented DISTRIBUTED THRESHOLD BLINDED KEY SYSTEM could prevent another M… https://t.co/HbyaL7fQnc,16
Wed Apr 18 09:31:02 +0000 2018,Private Key never exposed on #BitcoinCash Patented DISTRIBUTED THRESHOLD BLINDED KEY SYSTEM could prevent another M… https://t.co/HbyaL7fQnc,16
Wed Apr 18 08:58:03 +0000 2018,All crypto exchanges closed? NOWAY!  ✅KUCOIN is OPEN!!!  CLICK ▶️ https://t.co/Ulm0EgFJ2J  ❌Binance  ❌Poloniex  ❌Bi… https://t.co/WygoYwLZyQ,0
Wed Apr 18 08:38:36 +0000 2018,Private Key never exposed on #BitcoinCash Patented DISTRIBUTED THRESHOLD BLINDED KEY SYSTEM could prevent another M… https://t.co/HbyaL7fQnc,16
Wed Apr 18 08:34:51 +0000 2018,Private Key never exposed on #BitcoinCash Patented DISTRIBUTED THRESHOLD BLINDED KEY SYSTEM could prevent another M… https://t.co/HbyaL7fQnc,16
Wed Apr 18 08:21:21 +0000 2018,@TomHarpointner Yes it's unique to BCH due to patents pending owned by NChain EITC NCIP NCrypt NTrade all affiliate… https://t.co/FdjI2RYpYC,2
Wed Apr 18 08:11:58 +0000 2018,@TomHarpointner Yes it's unique to BCH due to patents pending owned by NChain EITC NCIP NCrypt NTrade all affiliate… https://t.co/FdjI2RYpYC,2
Wed Apr 18 08:09:03 +0000 2018,ETH ore ETC coin trading?  ✅Binance (trade ETH and ETC here )  🚀   Trade $eth #etc  CLICK ▶️… https://t.co/IanQ9JhrKj,0
Wed Apr 18 07:54:59 +0000 2018,Private Key never exposed on #BitcoinCash Patented DISTRIBUTED THRESHOLD BLINDED KEY SYSTEM could prevent another M… https://t.co/HbyaL7fQnc,16
Wed Apr 18 07:23:51 +0000 2018,Private Key never exposed on #BitcoinCash Patented DISTRIBUTED THRESHOLD BLINDED KEY SYSTEM could prevent another M… https://t.co/HbyaL7fQnc,16
Wed Apr 18 05:38:03 +0000 2018,NEW WITH BITCOIN TRADING? BEST PLATFORM:  CLICK ▶️ https://t.co/Ulm0EgFJ2J  ✅KUCOIN ($btc #btc #bitcoin) #kcs… https://t.co/2wjIzSdUmY,0
Wed Apr 18 04:23:18 +0000 2018,@cointastical @CoinText @cryptoEstus @eolio76 @ProfFaustus Thanks @cointastical. I plan to use @CoinText for casual… https://t.co/C6g8HqwfJw,0
Wed Apr 18 03:31:03 +0000 2018,✅Binance  ❌Poloniex  ❌Bittrex    Make more money with a crypto exchange today! 🚀  Receive a 50% discount on trading… https://t.co/cZLWSM4qPO,0
Wed Apr 18 02:31:02 +0000 2018,Want to trade $qlc #rqlc online?  CLICK ▶️ https://t.co/Ulm0EgFJ2J  ✅KUCOIN ($btc #btc #bitcoin)  ❌Poloniex  ❌Bittr… https://t.co/MDozw4ElfB,0
