Sun Jan 21 23:00:02 +0000 2018,https://t.co/b7qKN6sgrc @bitcoinbrllnt #blockchain #ethereum #litecoin https://t.co/4FqvqZJ7al https://t.co/sJnexUuvbO,0
Sun Jan 21 21:01:27 +0000 2018,Ether Legends presents “Babs” The Wingling Dragon  Ethereum based collectible trading card #digitalassets #Crypto… https://t.co/mAN28yri8k,2
Sun Jan 21 19:49:40 +0000 2018,Beyond market leader bitcoin (#BTC)  the rating agency will also issue grades for ethereum (#ETH)  Ripple’s #XRP  b… https://t.co/WNxCFwjwDy,0
Sun Jan 21 17:58:21 +0000 2018,@CryptoKitties will be at #ETHDenver! What are #cryptokitties you ask? It's a game that involves digital kitties  c… https://t.co/WbMNOOhxgj,8
Sun Jan 21 16:33:10 +0000 2018,The Bull And The Bear Case For Bitcoin  Ethereum  Ripple  Litecoin  And Other Cryptocurrencies… https://t.co/0OguFzAFXg,0
Sun Jan 21 16:17:30 +0000 2018,Alibaba setting up cloud mining? Thoughts? #Crypto #Ethereum #bitcoin  https://t.co/Cq8djFEdsW,0
Sun Jan 21 16:08:08 +0000 2018,New cryptocurrency STELLAR enjoys strong start to 2018 with 65% increases https://t.co/YfId6Bx8rP,0
Sun Jan 21 15:43:11 +0000 2018,The Bull And The Bear Case For Bitcoin  Ethereum  Ripple  Litecoin  And Other Cryptocurrencies https://t.co/L86KJAYhD9,0
Sun Jan 21 05:43:19 +0000 2018,Putting the Plunge in Bitcoin  Ethereum  Ripple  and Litecoin Into Perspective https://t.co/iIFXWgaWTt,0
Sun Jan 21 05:00:03 +0000 2018,@bitcoinbrllnt https://t.co/b7qKN6sgrc #cryptocurrencies #ethereum #crypto https://t.co/rWEFpL9uOE https://t.co/ihYMtpcAaw,0
Sun Jan 21 01:40:27 +0000 2018,Ethereum Q&amp;A: ICOs And Pyramid Schemes      with @aantonop   #Ethereum #ICO #CryptoNews  https://t.co/8rWshqwFLj,0
Sun Jan 21 00:43:25 +0000 2018,Bitcoin  Ethereum Lead Crypto Market Rebound on Saturday https://t.co/Uy3KsThW9P,0
