Sat Jun 16 15:25:17 +0000 2018,@The_TRON_Don @Docademic @OdysseyOCN @telcoin_team  https://t.co/z3xjxJjx5k,0
Sat Jun 16 13:00:35 +0000 2018,TRON Legacy Light Cycle LEGO Review #entertainment https://t.co/yACLMdBA3w,0
Sat Jun 16 12:27:34 +0000 2018,I added a video to a @YouTube playlist https://t.co/ExhOAgUXzo GTA 5 Checkerboard Outfits With Juggernaut Suits &amp; Tron Outfits (Dope,0
Sat Jun 16 04:09:08 +0000 2018,If Bitcoin isn’t a Security According to SEC  Which Coins are? : IOTA  EOS  Stellar Lumens  Litecoin and Tron… https://t.co/ol6D5l4LVy,2
Sat Jun 16 02:07:26 +0000 2018,I will say Kaufman stadium is really awesome  I loved it. So unique with the fountains. Also my best friend and hus… https://t.co/n5oMuYTWSM,0
Sat Jun 16 00:38:33 +0000 2018,If Bitcoin isn’t a Security According to SEC  Which Coins are? : IOTA  EOS  Stellar Lumens  Litecoin and Tron… https://t.co/ol6D5l4LVy,2
Sat Jun 16 00:38:07 +0000 2018,If Bitcoin isn’t a Security According to SEC  Which Coins are? : IOTA  EOS  Stellar Lumens  Litecoin and Tron… https://t.co/ol6D5l4LVy,2
