Thu Dec 27 23:17:42 +0000 2018,@mundanematt @YouTube I think the bitch ripped off "Tron".,0
Thu Dec 27 19:28:34 +0000 2018,When you trust God fully he will make your Table in front of Millions to witness.,44
Thu Dec 27 15:20:33 +0000 2018,Very entertaining sci-fi fantasy.  Underwater Star Wars meets Tron  with a dash of Tomb Raider. Fun humor  above pa… https://t.co/WsOGIALQXl,0
Thu Dec 27 11:24:03 +0000 2018,Crypto Whales Move Millions in XRP  Plus Bitcoin  Ethereum  Tron  Ripple  Litecoin  Bitcoin Cash  IOTA: Crypto News… https://t.co/AiTXaGoqGB,0
Thu Dec 27 06:19:35 +0000 2018,Man honestly TRON is underappreciated,0
Thu Dec 27 04:54:20 +0000 2018,Her: i only like country guys  Me: https://t.co/Kv35AMF5xE,1274
Thu Dec 27 02:56:51 +0000 2018,https://t.co/9YfWLDhgcj,0
