Wed May 02 23:21:28 +0000 2018,IOTA (MIOTA)  Cardano (ADA)  and TRON (TRX) Continue to Climb https://t.co/kqUB5OQMFp https://t.co/C6ytLyurgy,2
Wed May 02 22:33:46 +0000 2018,IOTA (MIOTA)  Cardano (ADA)  and TRON (TRX) Continue to Climb https://t.co/kqUB5OQMFp https://t.co/C6ytLyurgy,2
Wed May 02 22:09:40 +0000 2018,Ahria's latest TRX analysis from a couple of days ago! Best TA from a 5yr old. lol  #trx #tron #TRONIX  $tron $trx… https://t.co/BfALVKval0,1
Wed May 02 21:30:31 +0000 2018,IOTA (MIOTA)  Cardano (ADA)  and TRON (TRX) Continue to Climb https://t.co/kqUB5OQMFp https://t.co/C6ytLyurgy,2
Wed May 02 20:56:29 +0000 2018,Friend: “I’m pulling up”  *believes them and walks outside*  Me:  https://t.co/Cy13ChPJxT,27396
Wed May 02 18:31:45 +0000 2018,@badappleFFB Yes! He's excellent as well. Junkie XL and The Tron Legacy soundtrack (Daft Punk) are also favorites.,0
Wed May 02 18:22:25 +0000 2018,Gas is damn near $3. Don’t ask me to scoop you and take you no where. Walk and meet me halfway I might pick you up.… https://t.co/HK9aMWsdSO,26606
Wed May 02 08:36:25 +0000 2018,Tron Inspired LED Desk Lighting https://t.co/aT3DFWdjM7 https://t.co/rUqyfK9yNZ,0
Wed May 02 07:46:17 +0000 2018,SWAPCHANGE (500 SC) AIRDROP Token (250 SC TOKENS PER REFERRAL) #airdrop #bounty #BTC #xrp #freetoken #Crypto #ETH… https://t.co/GQQHv6P6E8,0
Wed May 02 05:49:48 +0000 2018,NEO  Stellar Lumens  Tron  Litecoin  EOS: #Technical Analysis for May 2  2018 https://t.co/03ZcowDACP https://t.co/FkJzz90TI3,2
Wed May 02 05:47:59 +0000 2018,NEO  Stellar Lumens  Tron  Litecoin  EOS: #Technical Analysis for May 2  2018 https://t.co/03ZcowDACP https://t.co/FkJzz90TI3,2
Wed May 02 05:47:26 +0000 2018,NEO  Stellar Lumens  Tron  Litecoin  EOS: #Technical Analysis for May 2  2018 https://t.co/03ZcowDACP https://t.co/FkJzz90TI3,2
Wed May 02 04:37:36 +0000 2018,#Thats90sShow 🎬 https://t.co/h6Ynn23fsu,10
Wed May 02 01:27:59 +0000 2018,Did I mention I took myself to prom ❤️ #prom2018 https://t.co/Dm9jNtaD0W,11380
Wed May 02 01:26:20 +0000 2018,Houston Outlaws Skins Giveaway!  Retweet and Follow to enter! 5 winners will receive 5 skins each! May 1st-May 7th!… https://t.co/vlmdu8bvA6,3299
Wed May 02 01:03:50 +0000 2018,@AaronCurry51 @WakeFB You were a beast,0
Wed May 02 00:33:46 +0000 2018,Ahria's latest TRX analysis from a couple of days ago! Best TA from a 5yr old. lol  #trx #tron #TRONIX  $tron $trx… https://t.co/BfALVKval0,1
