Mon Jan 07 22:32:04 +0000 2019,The Circuit 2.0 Longlseeves are now available  featuring the legendary Ferrari F40.   Peep the license plate 👀 https://t.co/ZrJAeEoQn2,70
Mon Jan 07 19:23:11 +0000 2019,i use shazam to find songs lmao  i refuse to let people know they are putting me on https://t.co/kSOB7X8wtQ,24699
Mon Jan 07 18:19:17 +0000 2019,Japan Explores Bitcoin and Crypto ETFs  New XRP Base Pairs Arrive  and Tron Tops Bitcoin SV to Become 9th Largest C… https://t.co/H6423CSoCS,0
Mon Jan 07 14:12:26 +0000 2019,When people looking at all the wonderful projects being built on #Tron but still fail to recognize or mention… https://t.co/BEZ8wAHO7q,12
Mon Jan 07 13:46:26 +0000 2019,@cyantist His character in Tron seemed liked the future of The Dude. "Don't mess with my zen man",0
Mon Jan 07 09:03:46 +0000 2019,BitTorrent Is Launching Its Own Cryptocurrency on the Tron Network https://t.co/yWnpZ5pw2E https://t.co/HlCvhUPsou,1
Mon Jan 07 08:58:39 +0000 2019,@DJA_Tron Someone you should look up .,0
Mon Jan 07 04:35:30 +0000 2019,When I see Jeff Bridges  I think of him as Kevin Flynn from TRON. https://t.co/M2AuNJO3N8,0
