Mon Feb 26 20:25:16 +0000 2018,LitePay May Bring a Lot More Positive Attention to Litecoin #BlockChain #Bitcoin #AllThingsCrypto https://t.co/25BT4Nm1XX,0
Mon Feb 26 17:37:39 +0000 2018,#fitpay $NXTD is also adding #ETHEREUM #Litecoin support to #flip next #pr,0
Mon Feb 26 17:03:51 +0000 2018,Fun playing poker last evening with fellow crypto currency enthusiasts and professionals  including Charlie Lee who… https://t.co/GyzKgVewPp,0
Mon Feb 26 16:36:29 +0000 2018,Finally an ALL-IN-ONE Crypto Exchange https://t.co/6s3Z3HwQJW  #bitcoin #ethereum #litecoin #crypto #altcoin,0
Mon Feb 26 16:07:14 +0000 2018,LITECOIN - “Near-Zero Payment Cost” #BlockChain #Bitcoin #AllThingsCrypto https://t.co/AycJaZWBa8,0
Mon Feb 26 15:27:28 +0000 2018,Litecoin Price Outperforms But Nears Key Resistance #BlockChain #Bitcoin #AllThingsCrypto https://t.co/IneJ8nNVDj,0
Mon Feb 26 10:38:07 +0000 2018,New MinCoin Mining Pool  https://t.co/8nTHWPYKNs  https://t.co/0g8AW1FMyq  #mincoin #MNC $MNC #altcoin #scrypt… https://t.co/c8TdwEQ7vq,4
