Wed Feb 07 23:09:01 +0000 2018,Our Token Sale begins in a week! Remember - do NOT send ETH until it has started  otherwise your transaction will f… https://t.co/YvsMvUoe4h,6
Wed Feb 07 23:05:22 +0000 2018,"Full Replay" Watch Now Yahoo Finance All Markets Summit: Crypto  February 7  2018    #XRP #BTC #BCH #LTC #ETH #XMR… https://t.co/CiDZhMtvrF,0
Wed Feb 07 21:58:47 +0000 2018,"My name is Craig Grant  and this is my ßitcoin wallet." https://t.co/VL9Cn028jP #crypto #ICOs $BTC $ETH $NEM $EOS,0
Wed Feb 07 20:57:38 +0000 2018,Hoshi “The Flurry” Mogoshi. 🌪🌪 Join us in our token sale #tokensale beginning Feb 15th to get your Elementeum (ELET… https://t.co/eVVZpGERbK,1
Wed Feb 07 16:11:49 +0000 2018,I've sold out of altcoins for the time being - just holding $ETH  $LTC  and $BTC. https://t.co/uT3uN4rqtf,0
Wed Feb 07 15:54:29 +0000 2018,Our Token Sale begins in a week! Remember - do NOT send ETH until it has started  otherwise your transaction will f… https://t.co/YvsMvUoe4h,6
Wed Feb 07 15:49:33 +0000 2018,South Korea  for one  became an important cryptocurrency trading hub in Q3 and Q4 – taking up much of the void left… https://t.co/Ct2lvJQkpF,0
Wed Feb 07 15:12:22 +0000 2018,Our Token Sale begins in a week! Remember - do NOT send ETH until it has started  otherwise your transaction will f… https://t.co/YvsMvUoe4h,6
Wed Feb 07 14:41:02 +0000 2018,Our Token Sale begins in a week! Remember - do NOT send ETH until it has started  otherwise your transaction will f… https://t.co/YvsMvUoe4h,6
Wed Feb 07 14:23:38 +0000 2018,Our Token Sale begins in a week! Remember - do NOT send ETH until it has started  otherwise your transaction will f… https://t.co/YvsMvUoe4h,6
Wed Feb 07 10:29:32 +0000 2018,Everything is an illusion  you can see what you want at any time.  #XRP #BTC #BCH #LTC #ETH #XMR #ADA #NEO #XEM… https://t.co/4UBireY856,1
Wed Feb 07 08:40:44 +0000 2018,Can you see me in #China? 你能在中國看到我嗎？  #XRP #BTC #BCH #LTC #ETH #XMR #ADA #NEO #XEM #XLM #MIOTA,1
Wed Feb 07 08:28:51 +0000 2018,Everything is an illusion  you can see what you want at any time.  #XRP #BTC #BCH #LTC #ETH #XMR #ADA #NEO #XEM… https://t.co/4UBireY856,1
Wed Feb 07 07:20:01 +0000 2018,Check out @ethstatus  the #Ethereum discovery tool. Status allows you to safely store ETH and other Ethereum crypto… https://t.co/Vs3EAVt8Ui,2
Wed Feb 07 07:19:49 +0000 2018,Check out @iam_preethi and her Medium article explaining the core components of #Ethereum. We are very excited to h… https://t.co/FHg8YihdUd,3
Wed Feb 07 05:56:07 +0000 2018,Early Highlights from Senate Banking Cryptocurrency Hearing  Clayton: All ICOs Are Securities — For Giancarlo  It’s… https://t.co/Mg1Nz3ZOYL,0
Wed Feb 07 04:40:28 +0000 2018,Just a thought: how many of you actually use BTC  ETH  and @Ripple XRP for anything other than betting? I don’t dis… https://t.co/erDyWBSa5Y,0
Wed Feb 07 02:06:10 +0000 2018,Ledger Hardware Wallets’ Vulnerability Exposes Clients To Risk [UPDATED]  @LedgerHQ provided additional information… https://t.co/eXgjmg1fW5,2
Wed Feb 07 01:54:48 +0000 2018,Virtual Currencies: The Oversight Role of the U.S. Securities and Exchange Commission and the U.S. Commodity Future… https://t.co/VlnTYPA2hw,1
Wed Feb 07 01:28:00 +0000 2018,Lol. English Motherfucker. Do you speak it?? What fraction of ETH would it take to fill up the Flux Capacitor? https://t.co/HCE81WdNUq,0
Wed Feb 07 00:52:55 +0000 2018,Congress Virtual Currency Meeting Actually a Positive?! My thoughts      With#@Crypto_Bobby   #XRP #BTC #BCH #LTC… https://t.co/ys7YU9NOxh,0
Wed Feb 07 00:47:43 +0000 2018,@altcointhoreau Lol I mean it's 5x from the 3x everyone was calling for weeks ago. Once my btc and eth pump ill be… https://t.co/lArBpC2RD0,0
Wed Feb 07 00:28:58 +0000 2018,Ledger Hardware Wallets’ Vulnerability Exposes Clients To Risk [UPDATED]  @LedgerHQ provided additional information… https://t.co/eXgjmg1fW5,2
Wed Feb 07 00:25:16 +0000 2018,Ledger Hardware Wallets’ Vulnerability Exposes Clients To Risk [UPDATED]  @LedgerHQ provided additional information… https://t.co/eXgjmg1fW5,2
Wed Feb 07 00:19:53 +0000 2018,Texas Issues Cease And Desist Orders To Cryptocurrency Lending Platforms   Texas officials targeting… https://t.co/Y6Gno1Js8S,0
