Mon Aug 06 22:03:47 +0000 2018,At Least One Member of Congress Owns as Much as $80 000 in Cryptocurrency     👉 https://t.co/V4hJId65pj  How Many i… https://t.co/zYgfUT4bER,0
Mon Aug 06 21:00:11 +0000 2018,https://t.co/FIteaELv5a @TCXhub #wearecrypto #BTC #BCN #ADA #DASH #MTC #ETN #ETH #ETC #EUNO #XGS #GOS #HNX #MIOTA… https://t.co/VOHLRpTt6z,4
Mon Aug 06 19:11:01 +0000 2018,Robinhood Adds Ethereum Classic to Crypto Trading App   👉 https://t.co/H6Q5VFyvQH  #BlockChainNews #BTC #BCH #LTC… https://t.co/akgpXBVsVS,0
Mon Aug 06 19:09:15 +0000 2018,Goldman Sachs Is Reportedly Weighing a Crypto Custody Service   👉 https://t.co/iCoya8Rdlc  #BlockChainNews #BTC… https://t.co/qMdEdtYoQo,0
Mon Aug 06 17:37:20 +0000 2018,Get to know the 6 new code proposals up for debate on ethereum:   👉 https://t.co/uEIKGAD9YM  #BlockChainNews #BTC… https://t.co/Ao3ZO7U9rf,0
Mon Aug 06 16:32:53 +0000 2018,https://t.co/FIteaELv5a @TCXhub #wearecrypto #BTC #BCN #ADA #DASH #MTC #ETN #ETH #ETC #EUNO #XGS #GOS #HNX #MIOTA… https://t.co/VOHLRpTt6z,4
Mon Aug 06 15:44:48 +0000 2018,https://t.co/FIteaELv5a @TCXhub #wearecrypto #BTC #BCN #ADA #DASH #MTC #ETN #ETH #ETC #EUNO #XGS #GOS #HNX #MIOTA… https://t.co/VOHLRpTt6z,4
Mon Aug 06 14:20:30 +0000 2018,Why Ripple XRP Can Reach $1 Sooner Than You Think     👉 https://t.co/SVffjgXa1U  New price increases more than poss… https://t.co/EYG9N2MPqw,1
Mon Aug 06 13:39:17 +0000 2018,Ripple (XRP) gradually cannibalizing Bitcoin’s (BTC) profitable real-world value      👉 https://t.co/Xk5dOulcmm  Wh… https://t.co/iZlT3KyM0L,0
Mon Aug 06 13:33:39 +0000 2018,Why Ripple XRP Can Reach $1 Sooner Than You Think     👉 https://t.co/SVffjgXa1U  New price increases more than poss… https://t.co/EYG9N2MPqw,1
Mon Aug 06 12:20:53 +0000 2018,https://t.co/FIteaELv5a @TCXhub #wearecrypto #BTC #BCN #ADA #DASH #MTC #ETN #ETH #ETC #EUNO #XGS #GOS #HNX #MIOTA… https://t.co/VOHLRpTt6z,4
Mon Aug 06 12:04:51 +0000 2018,https://t.co/FIteaELv5a @TCXhub #wearecrypto #BTC #BCN #ADA #DASH #MTC #ETN #ETH #ETC #EUNO #XGS #GOS #HNX #MIOTA… https://t.co/VOHLRpTt6z,4
Mon Aug 06 09:44:09 +0000 2018,#Laccoin #PREICO #Crowdsale #Bitcoin #Blockchain #Token #ETH #Ethereum #TokenSale https://t.co/m8ijSrZAfY,0
Mon Aug 06 09:31:54 +0000 2018,LipChain is a decentralized platform that allows surfers to find sponsors  participate in unofficial competitions a… https://t.co/F2uoMTpzNS,0
Mon Aug 06 08:23:06 +0000 2018,Bitcoin Price Eyes Comeback as 250 Million New #Tether Enter Circulation   👉 https://t.co/Wn33LkmV04  #USDT  which… https://t.co/9g1oLh4Api,1
Mon Aug 06 07:04:30 +0000 2018,Germany’s Second-Largest Stock Exchange ‘Creating an End-to-End Infrastructure for Digital Assets’  👉… https://t.co/0PnTzLCwHr,0
Mon Aug 06 06:52:12 +0000 2018,Bitcoin News On The Beach! What Makes Bitcoin Cash Special? 🚀      Independence Day &amp; Special Guests… https://t.co/uDXUrIV3J6,0
Mon Aug 06 03:39:05 +0000 2018,Dr. Seuss On Crypto  Do you dare to stay out?  Do you dare to go in? How much can you lose?  How much can you win?… https://t.co/uz5Lw0TkVm,0
Mon Aug 06 03:04:19 +0000 2018,A Look at Stylometry: Can We Uncover Satoshi Through Literary Quirks?      👉 https://t.co/Z4QpMdNAOi  Over the past… https://t.co/QBrxM0JJnC,0
Mon Aug 06 02:18:53 +0000 2018,Regarding the Forced Liquidation Incident on Jul 31  2018     👉 https://t.co/Xj4gOan0Ut  When the insurance fund ca… https://t.co/TOEc6nNu33,0
Mon Aug 06 02:14:48 +0000 2018,OKEx Forces $9 Million Liquidation on a Failed $413 Million Bitcoin Futures Trade     👉 https://t.co/1INHznhxA6  Th… https://t.co/d7mmJ4RsMx,0
Mon Aug 06 01:55:07 +0000 2018,Jamie Dimon  @JPMorgan Chase CEO     👉 https://t.co/wfPQApGdHM  ‘I Probably Shouldn’t Say Any More About Cryptocurr… https://t.co/UPpbCnL10q,0
Mon Aug 06 01:52:21 +0000 2018,👽https://t.co/FTIT9yuFvP ‘Forked’ to Launch Neutral  ‘Community-Maintained’ Bitcoin Website   👉… https://t.co/UnHUcTATPp,0
Mon Aug 06 01:44:09 +0000 2018,The Truth About Starbucks and Crypto Payments     👉 https://t.co/q4M52hd614  The exchange will convert digital asse… https://t.co/vGPho5vKYE,0
Mon Aug 06 00:52:32 +0000 2018,BEARS BATTLE BULLS AT $7000: WHERE WILL BITCOIN PRICE GO FROM HERE?     👉 https://t.co/UdNY5DoUas  Two models  they… https://t.co/3zNTf6SR9u,0
Mon Aug 06 00:36:50 +0000 2018,LIVE Bitcoin Q&amp;A from Boston MeetUp       with @ToneVays       #BlockChainNews #BTC #BCH #LTC #ETH #XLM #EOS #ADA… https://t.co/gBuHZgGYzO,0
Mon Aug 06 00:31:42 +0000 2018,Have they been behind driving the prices down  to cover their massive short positions? Or has the hidden short posi… https://t.co/ShQ6HFgsYT,0
Mon Aug 06 00:26:59 +0000 2018,Securities Exchange Commission to Review Behavior of Bitcoin Brokers   👉https://t.co/ey1dq1Djiw  Do they actually s… https://t.co/lUhuK8C2M7,0
