Wed Jul 04 23:20:53 +0000 2018,Get Yourself a Mustang  American Custom Car Builder Now Accepts Bitcoin  👉 https://t.co/6E8iD6NxUB  The company has… https://t.co/J0U1nzatLt,0
Wed Jul 04 22:21:28 +0000 2018,Shorting #eth and going long #btc is stupid.  Crypto moves in the same direction hand in hand.     👉🏼… https://t.co/0FJJ1HmKdW,0
Wed Jul 04 20:07:50 +0000 2018,It’s time people. In the spirit of throwing off the chains of one of the ultimate forms of centralized oppression (… https://t.co/nCMwuKOtdi,0
Wed Jul 04 19:14:18 +0000 2018,tokens by simply practicing their favorite sport  can become champions faster and contribute to cleaner oceans in… https://t.co/9fJTlOOUS2,2
Wed Jul 04 18:07:49 +0000 2018,@OguzSerdar @stefanobernardi @scott_lew_is Platforms such as @loomnetwork building side chains on top of Eth for Da… https://t.co/7h8OAO0qCH,0
Wed Jul 04 16:20:00 +0000 2018,The true story of our National Anthem. I GUARANTEE you  if you watch this video  you will never think of our Nation… https://t.co/BmRV5F401O,3
Wed Jul 04 16:19:40 +0000 2018,The true story of our National Anthem. I GUARANTEE you  if you watch this video  you will never think of our Nation… https://t.co/BmRV5F401O,3
Wed Jul 04 16:19:31 +0000 2018,The true story of our National Anthem. I GUARANTEE you  if you watch this video  you will never think of our Nation… https://t.co/BmRV5F401O,3
Wed Jul 04 16:11:15 +0000 2018,The true story of our National Anthem. I GUARANTEE you  if you watch this video  you will never think of our Nation… https://t.co/BmRV5F401O,3
Wed Jul 04 15:54:51 +0000 2018,How Does @Coinbase's New Custody Service Work   👉 https://t.co/KNGaWySOib  Having accepted its first deposit last w… https://t.co/7YBBaIHOqh,0
Wed Jul 04 15:47:38 +0000 2018,Bitcoin Remains On Hunt for $7K Despite Price Pullback  👉 https://t.co/ghCxPWg0dN  Clearly  the bullish momentum ha… https://t.co/moDStY1RwI,0
Wed Jul 04 15:43:30 +0000 2018,Skyfchain is launching a token sale to distribute the nodes of the SKYFchain  and to collect funds for the developm… https://t.co/O6k6mLRNgb,0
Wed Jul 04 15:42:37 +0000 2018,Crypto Exchanges Are Suddenly Being Censored In Iran    👉 https://t.co/2A42zYcaXB  A country whose people are most… https://t.co/NoGsxLPp26,0
Wed Jul 04 15:40:44 +0000 2018,tokens by simply practicing their favorite sport  can become champions faster and contribute to cleaner oceans in… https://t.co/9fJTlOOUS2,2
Wed Jul 04 15:39:27 +0000 2018,tokens by simply practicing their favorite sport  can become champions faster and contribute to cleaner oceans in… https://t.co/9fJTlOOUS2,2
Wed Jul 04 15:23:32 +0000 2018,#MEFYCoin #ICO #Blockchain #ETH #crypto https://t.co/Ojcptoe91e,0
Wed Jul 04 15:11:45 +0000 2018,#Bitcoin Rebounds From 2018 Low to Buoy Rivals #Ether  #Litecoin  👉 https://t.co/wwDYk1XZNZ  The largest… https://t.co/PZulO3EInd,2
Wed Jul 04 10:54:44 +0000 2018,Bitcoin Debate: Erik Voorhees vs. Peter Schiff  A debate series in NY (co-founded with Naomi Brockwell  and Gene Ep… https://t.co/azOtLbEMSO,0
Wed Jul 04 07:09:39 +0000 2018,Bitcoins Energy Consumption An Unsustainable Protocol   👉 https://t.co/2Ga43cBeNZ  Mass adoption of Bitcoin across… https://t.co/8afZfX9KSF,0
Wed Jul 04 06:29:31 +0000 2018,CNBC’s Brian Kelly Says Bullish News May Signal Bitcoin Price Rise  👉 https://t.co/0En7O01Uij  Talk of Institutiona… https://t.co/B1G2FQV7QH,0
Wed Jul 04 06:19:20 +0000 2018,Binance Halts All Trading Over Abnormal Crypto Transactions  👉 https://t.co/tuREgEpdz1  Syscoin a bitcoin fork prot… https://t.co/pBHJDtEtjZ,1
Wed Jul 04 06:19:00 +0000 2018,Binance Halts All Trading Over Abnormal Crypto Transactions  👉 https://t.co/tuREgEpdz1  Syscoin a bitcoin fork prot… https://t.co/pBHJDtEtjZ,1
Wed Jul 04 06:11:26 +0000 2018,Paul Krugman Trolls Ripple  Accidentally Making a Case for Bitcoin Cash  👉  https://t.co/IbnWBDO4c3  'For a cryptoc… https://t.co/xACAknwb3k,0
