Mon Dec 24 22:55:46 +0000 2018,$ETH 5-minute chart using the 200EMA over and over again.  This is about as technical as I have ever seen on such a… https://t.co/LdFVhb0XS3,0
Mon Dec 24 22:17:52 +0000 2018,Grabity Token is a project with a great future. If you want to invest your funds securely and in the future to make… https://t.co/OBqCpjHwDp,1
Mon Dec 24 22:06:19 +0000 2018,Grabity Token is a project with a great future. If you want to invest your funds securely and in the future to make… https://t.co/OBqCpjHwDp,1
Mon Dec 24 22:06:08 +0000 2018,Your system rewards users for sharing their data  and unlike the platforms today that collect  analyze and use this… https://t.co/SQnM7VhoDM,0
Mon Dec 24 22:05:54 +0000 2018,This company's growth prospects! The future lies in blockchain technology and ambitiYous ideas! Join now.… https://t.co/PxLFlA9LgQ,0
Mon Dec 24 22:05:39 +0000 2018,I did not see the project more interesting on the Internet. I watch with interest the development of affairs. I bel… https://t.co/TyfsKD5DK9,0
Mon Dec 24 16:05:54 +0000 2018,XRP has a 41B market cap ETH 15B so where's the gain!  Ethereum in Recovery Mode  Closes Gap on XRP with 18% Surge https://t.co/eQeGFjYcGo,8
Mon Dec 24 12:39:49 +0000 2018,Según información revelada por el BBVA  el préstamo de 150 millones de euros estará destinado a adquisiciones estra… https://t.co/aaPeZ2nCDr,0
Mon Dec 24 02:07:05 +0000 2018,Crypto Tidbits: Facebook May Launch Stablecoin  Ethereum Developer ConsenSys In Throes https://t.co/Hyuhjb5b2G https://t.co/fUDQ1kR8oc,0
Mon Dec 24 00:51:14 +0000 2018,@EthereumNetw @ethereumJoseph If Joe Lubin is the co-founder of #Ethereum  I’m the King of England!,0
