Fri Feb 16 23:22:53 +0000 2018,Meet Ankorus: The E*Trade Of Cryptocurrency https://t.co/py4xDfWRXS #bitcoin #cryptocurrency #ICO https://t.co/oC2jDW5EKc,3
Fri Feb 16 22:52:17 +0000 2018,Interview with CEO of RxEAL on RXL Token Sale. - https://t.co/ZcumUmMspf @rxealofficial via @TechBullion… https://t.co/jhuqTxwNw4,1
Fri Feb 16 22:52:00 +0000 2018,Interview with CEO of RxEAL on RXL Token Sale. - https://t.co/ZcumUmMspf @rxealofficial via @TechBullion… https://t.co/jhuqTxwNw4,1
Fri Feb 16 22:50:09 +0000 2018,Meet Ankorus: The E*Trade Of Cryptocurrency https://t.co/py4xDfWRXS #bitcoin #cryptocurrency #ICO https://t.co/oC2jDW5EKc,3
Fri Feb 16 22:49:43 +0000 2018,Meet Ankorus: The E*Trade Of Cryptocurrency https://t.co/py4xDfWRXS #bitcoin #cryptocurrency #ICO https://t.co/oC2jDW5EKc,3
Fri Feb 16 22:43:11 +0000 2018,Meet Ankorus: The E*Trade Of Cryptocurrency https://t.co/py4xDfWRXS #bitcoin #cryptocurrency #ICO https://t.co/oC2jDW5EKc,3
Fri Feb 16 22:17:03 +0000 2018,We are excited to announce our formal partnership between IconiqLab and the Crypto Virtual Summit. @iconiqlab is th… https://t.co/oqF0TZO0ze,1
Fri Feb 16 21:45:11 +0000 2018,A math formula from the 90s can help investors make smart bets on the exploding ICO market https://t.co/ooWPP2qWnT,0
Fri Feb 16 21:32:00 +0000 2018,Interview with the CEO of e-Pocket on the EPT Token Sale - https://t.co/hP0Iey2p27 @ePocket_AUS via @TechBullion… https://t.co/w65nzhIec7,0
Fri Feb 16 21:27:00 +0000 2018,Synthium Health! Digital Commerce in a Converging Healthcare World. - https://t.co/Fvn4fxIwvU @SynthiumHealth via… https://t.co/VgfhkE3ml3,0
Fri Feb 16 21:08:31 +0000 2018,This #Blockchain Company Allows You to Send &amp; Receive Energy Anywhere in the World (#ICO Open)… https://t.co/2UTsv7ANDA,1
Fri Feb 16 20:59:42 +0000 2018,What Every VC Should Know About Initial Coin Offerings ICO https://t.co/OurldlknJk,0
Fri Feb 16 20:51:13 +0000 2018,The Top 25 ICOs With the Highest Returns (Infographic) https://t.co/rJzZm5LzL9   #ico #cryptocurrency #bitcoin #ETH https://t.co/MfBqEAen4y,0
Fri Feb 16 20:50:08 +0000 2018,We are helping a San Diego startup hire Blockchain engineers and advisors. Ideally  you are located in Southern Cal… https://t.co/MBzhtKOtA5,0
Fri Feb 16 20:32:49 +0000 2018,Crypto-X (CWX) Airdrop 📢  Airdrop Steps: 1: Open the Referral Program top right corner 2: Fill the form and Registe… https://t.co/8sRsVMybAs,1
Fri Feb 16 20:24:42 +0000 2018,Bitsong AIRDROP #2 📢  #Bitsong round 2 is live!   1. Go to airdrop: https://t.co/I38syW06Hk 2. Click on: Join our a… https://t.co/5pfVl6lVHP,0
Fri Feb 16 20:15:03 +0000 2018,Q Wallet: 📢  Q Coin is the new cryptocurrency we can store and transfer securely. Get 100 Q Coins as a welcome bonu… https://t.co/krNFEilqVD,1
Fri Feb 16 19:53:29 +0000 2018,Free TATTI #Airdrop is Back! 📢  https://t.co/X2TtR0XeDf  Every TATTI has a value &amp; we are just getting started!… https://t.co/AQiiZd58lt,0
Fri Feb 16 19:19:00 +0000 2018,Interview with the CEO of Finamatrix Dr Lanz Chan on FIX Token. - https://t.co/o4VprhuaZB @finamatrix  via… https://t.co/8kE39NTmbA,0
Fri Feb 16 19:15:36 +0000 2018,@givewithnothing I’m excited for this one for sure. Do you have a tentative timeline for the ICO?,0
Fri Feb 16 18:41:01 +0000 2018,I️m gonna change the world y’all   What’s your Ico? https://t.co/dJeMqxEaiH https://t.co/UgJo4aSEzd,0
Fri Feb 16 17:11:07 +0000 2018,The Top 4 High-Growth Industries for Entrepreneurs in 2018 (Infographic) https://t.co/ljHkRii7xD #crypto #bitcoin… https://t.co/h7vsYkAzC2,1
Fri Feb 16 17:11:00 +0000 2018,Setcoin is a Verified Cryptocurrency from Inserviss  Powered by Blockchain. - https://t.co/MK031AP8Ee @setcoinsale… https://t.co/GNp1pgjsjD,0
Fri Feb 16 16:57:00 +0000 2018,Interview with CEO of Tap Coin on TTT Token Sale. - https://t.co/qtRE15kHw2 @Tap_Coin via @TechBullion #Blockchain… https://t.co/Y7UdRAb200,0
Fri Feb 16 16:55:02 +0000 2018,This #Blockchain Company Allows You to Send &amp; Receive Energy Anywhere in the World (#ICO Open)… https://t.co/2UTsv7ANDA,1
Fri Feb 16 16:11:11 +0000 2018,The Top 4 High-Growth Industries for Entrepreneurs in 2018 (Infographic) https://t.co/ljHkRii7xD #crypto #bitcoin… https://t.co/h7vsYkAzC2,1
Fri Feb 16 15:50:00 +0000 2018,Interview with CEO of P2p Solutions Foundation on P2PS Token Sale - https://t.co/7Yj72gDNHn  @P2Psf #Crypto #CEO #ICO #Interviews,0
Fri Feb 16 15:50:00 +0000 2018,How To Spend Bitcoin in Local Stores With Debit Card @Denaro_io https://t.co/LDPn2kqQNI @TechBullion #Blockchain… https://t.co/9oa5eOSn34,0
Fri Feb 16 15:49:00 +0000 2018,Win $50 000 Worth of Ethereum. @Denaro_io https://t.co/KEGPAFrwCG #Blockchain #Investors #ICO #airdrop #TokenSale #cryptocurrencies #Crypto,0
Fri Feb 16 15:46:00 +0000 2018,You Can Now Make Money By Sharing Selfies – Interview with the CEO of SELFLLERY on YOU Token Sale. @SELFLLERY… https://t.co/ZyjYO9J3l7,0
Fri Feb 16 15:34:00 +0000 2018,Interview with CEO of SnapCity on SNPT Token Sale. - https://t.co/3Kit4m74RQ @SnapCityReal via @TechBullion… https://t.co/cY4Bs8wdJH,0
Fri Feb 16 14:04:33 +0000 2018,@travelflexcoin ICO investors are losing money here TRF team! We want Binance! Not any other bullshit exchanges...,0
Fri Feb 16 12:51:20 +0000 2018,February 13 in Moscow  the IV International Conference on Financial Literacy and Financial Accessibility...  Read m… https://t.co/KZIPNvL63i,0
Fri Feb 16 12:48:57 +0000 2018,Support Pingvalue by joining our community: https://t.co/Hd9Z8sXPWz  #eth #ICO #TokenSale #blockchain #bitcoin… https://t.co/YjeQhyAURq,0
Fri Feb 16 12:47:36 +0000 2018,Go buy your ZED tokens now! 10 days left at 60% off!￼￼ #TradePlayz #ICO #cryptocurrency #blockchain #bitcointalk… https://t.co/QUvPrxMBbl,0
Fri Feb 16 12:46:49 +0000 2018,#Crypto #Blockchain #ICO #Crowdfunding #Cardstack #dApps https://t.co/tPaIcy5nNH,0
Fri Feb 16 12:31:29 +0000 2018,#Crypto #trading on the next level! Check @NapoleonXai for more infos! #ICO #TGE #NPX #CROWDSALE,0
Fri Feb 16 12:30:27 +0000 2018,#DEBITUM NETWORK  #ICO Leveraging Blockchain technology to secure and distribute fiat investments to the SME world.… https://t.co/M5Fj00PVoW,0
Fri Feb 16 12:29:30 +0000 2018,We are happy to bring to your notice that our ICO is now featured on https://t.co/pVu7lx4abN and here's the link fo… https://t.co/okU5ze16eE,0
Fri Feb 16 12:27:31 +0000 2018,Let bots trade for you! Check @NapoleonXai for more infos! #ICO #TGE #NPX #CROWDSALE,0
Fri Feb 16 11:41:44 +0000 2018,￼￼￼World #Champion and No. 1 discus thrower Andrius Gudzius joins as @Lympo_io #Ambassador ! ￼￼￼ ￼… https://t.co/G2QuBNxOZy,0
Fri Feb 16 11:41:14 +0000 2018,#Crypto #Blockchain #ICO #Crowdfunding #Cardstack #dApps https://t.co/DYpEM5yje4,0
Fri Feb 16 11:40:41 +0000 2018,We are happy to get into INVESTMENT &amp; INNOVATION IN EMERGING EUROPE report! Find our article on page 87.… https://t.co/q4L57EUuZU,0
Fri Feb 16 11:39:46 +0000 2018,Another publication about our achievements in Davos! https://t.co/AgmunJ5F3e  published about our trip to Davos Wor… https://t.co/UnVddrA0cJ,0
Fri Feb 16 11:35:47 +0000 2018,#Crypto #Blockchain #ICO #Crowdfunding #Cardstack #dApps https://t.co/VgSyHrHdSZ,0
Fri Feb 16 11:20:36 +0000 2018,#Crypto #Blockchain #ICO #Crowdfunding #Cardstack #dApps https://t.co/5NSoSvmPqY,0
Fri Feb 16 11:15:00 +0000 2018,#Crypto #Blockchain #ICO #Crowdfunding #Cardstack #dApps https://t.co/n6TVXaOypX,0
Fri Feb 16 10:38:52 +0000 2018,#ICO #P2PSF #Crypto #Altcoin #Blockchain https://t.co/bt6IZccu6t,0
Fri Feb 16 10:24:16 +0000 2018,#crowdsale! https://t.co/pRixwpCVzc  #debitumnetwork #ico #crypto https://t.co/vJ9cAfbLUk,0
Fri Feb 16 05:04:00 +0000 2018,Ellcrys: A Decentralized Version Control System For Building Open Source Software And Services. -… https://t.co/hz9vmiu7zT,0
Fri Feb 16 04:37:58 +0000 2018,#bitcoin #cryptocurrency #ICO #tokensale https://t.co/SQ7CS34GYv https://t.co/vcnlKXBlgi,0
Fri Feb 16 03:50:57 +0000 2018,ASTORGAME WEEK BONUSES Sale 29 Jan - 29 Apr  2018 Week 1 &amp; 2 - 40% Bonus  Week 3 &amp; 4 - 20% Bonus  Week 5 &amp; 6 - 10%… https://t.co/ozdwi1tspf,0
Fri Feb 16 03:41:00 +0000 2018,Marcel van Oost  Former CEO of Qantani and CEO of Fintechfans Talks about Token Sale for Fintechfans -… https://t.co/Ku94iBNv9o,0
Fri Feb 16 03:25:00 +0000 2018,How to invest in a Real Estate business built on Blockchain. https://t.co/hQcPXK3sin via @TechBullion #Blockchain… https://t.co/RGK5PEaiFZ,0
Fri Feb 16 03:21:45 +0000 2018,CREDITS ICO will start February 18th  09:00 UTC #credits #creditscoin https://t.co/TUDwAR32DG,0
Fri Feb 16 03:00:36 +0000 2018,GIMMER TOKEN SALE IS ON. Gimmer provides more accurate risk assessment with the Gimmer Risk Profile. Users will tra… https://t.co/NY2wzVvTU2,0
Fri Feb 16 01:38:31 +0000 2018,People are flipping the Telegram ICO for millions  even though it's not on sale yet https://t.co/8GuO38P11B via @qz,0
Fri Feb 16 00:48:31 +0000 2018,Tech/Law~ How to Value a Bitcoin Casino’s ICO - Bitcoin  cryptocurrencies  and ICO’s are all over the news lately.… https://t.co/uYVTWWmVlS,0
Fri Feb 16 00:43:59 +0000 2018,Will ICOs Survive the SEC Bloodbath? https://t.co/Ranf2Pa5AG #cryptocurrency #ico https://t.co/Z9j8K7UaUv,2
Fri Feb 16 00:35:14 +0000 2018,Will ICOs Survive the SEC Bloodbath? https://t.co/Ranf2Pa5AG #cryptocurrency #ico https://t.co/Z9j8K7UaUv,2
