Tue Jan 30 22:49:00 +0000 2018,Interview with CEO of RxEAL on RXL Token Sale. - https://t.co/ZcumUmMspf @rxealofficial via @TechBullion… https://t.co/LPpbYrBY7q,0
Tue Jan 30 22:28:05 +0000 2018,BIXToken Airdrop #2 is live join herehttps://docs.google.com/forms/d/e/1FAIpQLScYkSiw1Wl-mibzbF6JEURFCUQu5jfNWLNLng… https://t.co/jTYGlbrkws,0
Tue Jan 30 21:26:50 +0000 2018,The Putin ICO just got harder Facebook is banning all ads promoting cryptocurrencies - including bitcoin and ICOs  https://t.co/qzCLdoOTuq,0
Tue Jan 30 21:26:15 +0000 2018,How To Make Your ICO Securities Rules Compliant via Reg A+ &amp; Reg D Interactive Video | Manhattan Street Capital… https://t.co/ACfVrA6REa,4
Tue Jan 30 21:25:00 +0000 2018,Synthium Health! Digital Commerce in a Converging Healthcare World. - https://t.co/Fvn4fy07Uu @SynthiumHealth via… https://t.co/6hERlt9i8o,0
Tue Jan 30 21:18:28 +0000 2018,Top 10 Lending ICOs This Month | Internal Exchange vs External Exchange | ICO Coin Count Explained  In This Video W… https://t.co/CJ0ha6jU45,0
Tue Jan 30 21:18:19 +0000 2018,Top 10 Lending ICOs This Month | Internal Exchange vs External Exchange | ICO Coin Count Explained  In This Video W… https://t.co/R56XfwG8Ud,0
Tue Jan 30 21:17:12 +0000 2018,Top 10 Lending ICOs This Month | Internal Exchange vs External Exchange | ICO Coin Count Explained… https://t.co/JmvjTi5FZO,0
Tue Jan 30 20:43:43 +0000 2018,Facebook Bans Cryptocurrency  ICO Ads Because Of ‘Deceptive Promotional Practices’ https://t.co/xOCFWnMliE,0
Tue Jan 30 20:09:16 +0000 2018,Facebook is banning all ads for bitcoin  cryptocurrencies  and ICOs (FB) https://t.co/WCrwDPaqDy,0
Tue Jan 30 20:02:49 +0000 2018,@Bankeracom 6.2. LOANS AND SAVINGS  If Bankera is successful in obtaining the  relevant banking licenses  its opera… https://t.co/3cwcDoaCFK,0
Tue Jan 30 20:00:06 +0000 2018,@CrunchCrypto The ICO doesn't have the US listed under the country dropdown in the registration form 😭,0
Tue Jan 30 19:59:02 +0000 2018,Motherboard ♦ Facebook  the largest social media network on the planet  is banning all advertising having to do… https://t.co/tiuZL1Eo1v,0
Tue Jan 30 19:46:42 +0000 2018,6.2. LOANS AND SAVINGS  If Bankera is successful in obtaining the  relevant banking licenses  its operations will s… https://t.co/s2oM0zUNaP,0
Tue Jan 30 19:43:03 +0000 2018,@jb55 How did you get your ico listed on so many exchanges so quickly? Brovo.,0
Tue Jan 30 19:22:00 +0000 2018,Valorem is Adding More Value to the Crypto Market in 2018 - @ValoremF https://t.co/cEV442b9lr via @TechBullion… https://t.co/Obz8JIqwmV,0
Tue Jan 30 19:17:00 +0000 2018,Interview with the CEO of Finamatrix Dr Lanz Chan on FIX Token. - https://t.co/o4VprhLLR9 @finamatrix  via… https://t.co/xCGXDruPn8,0
Tue Jan 30 18:23:50 +0000 2018,Redvolution (REDV) is an awesome crypto-project  download their innovative and secure wallet on the chrome store… https://t.co/LE0fPlyopp,0
Tue Jan 30 17:26:19 +0000 2018,Free Airdrop and Tokens 📣 Join the #NKOR bounty program and earn tokens! It's easy and simple  what are you waiting… https://t.co/orhQxjI7UU,2
Tue Jan 30 17:14:00 +0000 2018,Decentralized Affiliate Platform Hoqu  Combines Performance-marketing Model with #Blockchain Technology – Interview… https://t.co/VplV3FPQU3,0
Tue Jan 30 17:08:00 +0000 2018,Setcoin is a Verified Cryptocurrency from Inserviss  Powered by Blockchain. - https://t.co/MK031B6JvM @setcoinsale… https://t.co/n8bCV1jlEj,0
Tue Jan 30 16:55:01 +0000 2018,Interview with CEO of Tap Coin on TTT Token Sale. - https://t.co/qtRE15kHw2 @Tap_Coin via @TechBullion #Blockchain… https://t.co/fI8KDBbWtv,0
Tue Jan 30 16:54:13 +0000 2018,The world's first cryptocurrency for charitable giving and good causes. https://t.co/htMcklo7ca @TechBullion… https://t.co/BhPTBAb7Ig,1
Tue Jan 30 16:53:49 +0000 2018,We stand beside the SEC and Chamber of Digital Commerce Token Alliance to insure safe and fair investing opportunit… https://t.co/qNXo7LfLac,206
Tue Jan 30 16:39:29 +0000 2018,The SEC has shut down another ICO — this time an alleged $600 million scam in Texas https://t.co/LMf5QoLxM7,0
Tue Jan 30 16:34:13 +0000 2018,The SEC has shut down another ICO — this time an alleged $600 million scam in Texas https://t.co/9QzulH2OtA,0
Tue Jan 30 15:48:00 +0000 2018,Interview with CEO of DAV Network on DAV Token Sale - https://t.co/nzbU6UgcSv @DAVNetwork #Crypto #CEO #ICO #Interviews,0
Tue Jan 30 15:31:00 +0000 2018,Interview with CEO of SnapCity on SNPT Token Sale. - https://t.co/3Kit4lPttg @SnapCityReal via @TechBullion… https://t.co/MAervbwGtm,0
Tue Jan 30 14:37:25 +0000 2018,SGPay - NEW AIRDROP 📢  #SGPay  telegram bot airdrop!  1. Go to https://t.co/vQzrcGlFPX 2. Follow instructions of te… https://t.co/0zM3l1T3s0,0
Tue Jan 30 14:07:36 +0000 2018,Earn 100 SIL (Silvarcoin) for free. 📣 Just sign up an account and you are done!!… https://t.co/d8WK43Dv7r,1
Tue Jan 30 12:31:09 +0000 2018,Monoclonal Antibody to CD34 (Clone: ICO-115)  For more details about this visit our website -… https://t.co/JNBmmdmiyx,0
Tue Jan 30 12:18:28 +0000 2018,@napoleonxaithat The crowdfunding platform for startups  #ICO #TGE #NPX #CROWDSALE,0
Tue Jan 30 11:42:23 +0000 2018,@NapoleonXai an intresting project #ICO ambitions to become the 1st algorithmic asset #NPX #CROWDSALE invest in presale get bonus 30%.. #TGE,0
Tue Jan 30 11:41:16 +0000 2018,Carphone Warehouse fined £400 000 for putting millions of customers’ Data included names  addresses  phone numbers … https://t.co/CiqITLaXcg,1
Tue Jan 30 11:02:54 +0000 2018,@ThePayPro so being that i got whitelisted 20 minutes after the ico initial bonus ended  im hoping that @ThePayPro… https://t.co/iz6ENFoqVk,0
Tue Jan 30 10:47:22 +0000 2018,Что мы знаем про прошедшие ICO и как регулировать будущие ICO https://t.co/lzYkTK6R7G,0
Tue Jan 30 09:30:02 +0000 2018,Interview with the CEO of e-Pocket on the EPT Token Sale - https://t.co/hP0Iey2p27 @ePocket_AUS via @TechBullion… https://t.co/BYljurKqu9,0
Tue Jan 30 09:14:34 +0000 2018,Carphone Warehouse fined £400 000 for putting millions of customers’ Data included names  addresses  phone numbers … https://t.co/CiqITLaXcg,1
Tue Jan 30 07:22:00 +0000 2018,Valorem is Adding More Value to the Crypto Market in 2018 - @ValoremF https://t.co/cEV442b9lr via @TechBullion… https://t.co/FW5ctiIirw,0
Tue Jan 30 06:56:18 +0000 2018,📣 Join the #Savedroid Bounty Program for free $SVD #FreeTokens https://t.co/blQbe96kRM   #ico #icos #token #tokens… https://t.co/ukRXxRf7g3,1
Tue Jan 30 06:50:20 +0000 2018,According to our plan to implement the system of analytics and signals  it is necessary to collect at least $500K … https://t.co/JYGJkhsuK0,0
Tue Jan 30 06:17:19 +0000 2018,*#TOKEN #AIRDROP* 📣 Still OPEN Receive FREE #HPT TOKENS Click https://t.co/7YeHHHKQ4y  HOUSEPANDA (HPT) World's 1st… https://t.co/COKxyKAjjS,0
Tue Jan 30 05:00:00 +0000 2018,Ellcrys: A Decentralized Version Control System For Building Open Source Software And Services. -… https://t.co/15CFNVYMSG,0
Tue Jan 30 04:58:26 +0000 2018,Ad networks should stop allowing ICO ads. They all seem so scammy.,0
Tue Jan 30 04:54:03 +0000 2018,@octonion How can I invest in this ICO?,0
Tue Jan 30 04:51:24 +0000 2018,#bitcoin #BitcoinCash #blockchaintechnology #blockchain #cryptocurrency #ethereum #litecoin #ico #investments… https://t.co/poUEqMnjJc,0
Tue Jan 30 03:38:00 +0000 2018,Marcel van Oost  Former CEO of Qantani and CEO of Fintechfans Talks about Token Sale for Fintechfans -… https://t.co/7wQiCM7Ipu,0
Tue Jan 30 03:17:06 +0000 2018,Bitfinite Coin (BFC) | Bitfintite ICO &amp; Exchange Will Moon...This Is Why | New 5k Bitfinite Loan… https://t.co/awoXJGrX8U,0
Tue Jan 30 03:13:11 +0000 2018,Bitfinite Coin (BFC) | Bitfintite ICO &amp; Exchange Will Moon...This Is Why | New 5k Bitfinite Loan  Bitfinite Coin is… https://t.co/evPlMHQjFv,0
Tue Jan 30 03:13:08 +0000 2018,Bitfinite Coin (BFC) | Bitfintite ICO &amp; Exchange Will Moon...This Is Why | New 5k Bitfinite Loan  Bitfinite Coin is… https://t.co/l45D3K8j1b,0
Tue Jan 30 03:03:10 +0000 2018,@CryptoFonz My favorite ICO and honestly my favorite use of Blockchain tech right now. Super stoked on this one.,0
Tue Jan 30 02:50:50 +0000 2018,@YS $HTML no ICO either,0
Tue Jan 30 01:02:35 +0000 2018,@CryptoGat hey man are you participating in the Legolas Exchange (LGO) ICO?,0
Tue Jan 30 00:31:10 +0000 2018,Go vote for @RobotCache to win their ICO Pitching Competition. https://t.co/NYRoIuvza8,1
Tue Jan 30 00:30:00 +0000 2018,Interview with the CEO of CEDEX  on the ICO and Token-Sale. https://t.co/WsZvxjUjEe @TechBullion #ico #blockchain #diamonds.,0
Tue Jan 30 00:20:23 +0000 2018,Meet Ankorus: The E*Trade Of Cryptocurrency https://t.co/py4xDfWRXS #bitcoin #cryptocurrency #ICO https://t.co/mwpi5a9fIj,3
