Sat Feb 10 23:17:21 +0000 2018,Are you ready for #LitePay?   https://t.co/KYT21wDsgu  When does LitePay launch? Where will LitePay be accepted?… https://t.co/kykYAiRyja,1
Sat Feb 10 23:01:02 +0000 2018,The IRS considers cryptocurrencies “property” similar to how it does for stocks or personal property. Which makes t… https://t.co/faYwEUUUKf,0
Sat Feb 10 21:50:45 +0000 2018,New post: "CryptoCelebs: Famous people who’ve bought the cryptocurrency craze" https://t.co/i3vCZWCoTa via digitaltrends,0
Sat Feb 10 21:46:40 +0000 2018,Take advantage of this crypto airdrop for 1000 FREE Gym Tokens! DL your #ETH based #Wallet. I recommend #MEW… https://t.co/HPbCM9K9YC,2
Sat Feb 10 21:41:36 +0000 2018,There is a lot of misunderstandings about #digitalassets  #cryptocurrency  and #blockchain. As the blockchain space… https://t.co/ON34bjqAME,0
Sat Feb 10 21:26:20 +0000 2018,Take advantage of this crypto airdrop for 1000 FREE Gym Tokens! DL your #ETH based #Wallet. I recommend #MEW… https://t.co/HPbCM9K9YC,2
Sat Feb 10 21:11:48 +0000 2018,5280 Fan Page is out! #newsletter #Denver #Colorado https://t.co/AFaXN7S9YT Stories via @FeldbergMt @bestdamnpennies #cryptocurrency #crypto,0
Sat Feb 10 21:04:22 +0000 2018,Nuclear Engineers Arrested for Mining Cryptocurrency Using Government Supercomputer | Crypto News https://t.co/bxuGgNw3EX,0
Sat Feb 10 20:11:09 +0000 2018,Bitcoin billionaires turn to millionaires as cryptocurrency world gets cold feet https://t.co/FzTko6HFZy,0
Sat Feb 10 19:51:18 +0000 2018,'Bitcoin price is pure speculation' Bank of Austria chief attacks popular cryptocurrency https://t.co/WgbIOKlshH,0
Sat Feb 10 19:27:47 +0000 2018,https://t.co/MKsueX5Bni - "An article I just posted today about Bitcoin and cryptocurrency. This space is still red… https://t.co/qZZ0zuul0u,0
Sat Feb 10 18:48:14 +0000 2018,Bitcoin billionaires to build island paradise where the elite cryptocurrency super-rich will be able to ... https://t.co/MgMULx3G7k,1
Sat Feb 10 18:46:30 +0000 2018,Bitcoin billionaires turn to millionaires as cryptocurrency world gets cold feet https://t.co/baDBRCZth8,0
Sat Feb 10 18:46:28 +0000 2018,Bitcoin billionaires to build island paradise where the elite cryptocurrency super-rich will be able to ... https://t.co/MgMULx3G7k,1
Sat Feb 10 18:19:14 +0000 2018,Man sues T-Mobile for allegedly failing to stop hackers from draining his cryptocurrency account https://t.co/BVUr1RKzpq,0
Sat Feb 10 17:51:40 +0000 2018,Cryptocurrency CRACKDOWN: World leaders to plan REGULATION of Bitcoin at G20 meeting https://t.co/lsxfZ8L17i,1
Sat Feb 10 17:51:21 +0000 2018,Cryptocurrency CRACKDOWN: World leaders to plan REGULATION of Bitcoin at G20 meeting https://t.co/lsxfZ8L17i,1
Sat Feb 10 17:30:06 +0000 2018,Complete Cryptocurrency lending script source code like Hextracoin   Goldgate or Bitconnect clone | Bitcoin | Block… https://t.co/QAgss0Kgfy,0
Sat Feb 10 17:29:03 +0000 2018,Here’s Proof That This Bitcoin Crash Is Far From The Worst The #Cryptocurrency Has Seen… https://t.co/DsNPVEJ2zM,0
Sat Feb 10 17:21:46 +0000 2018,#Bitcoin #Ethereum #Litecoin  Just curious and taking a POLL...  1️⃣ Have you invested in cryptocurrency or are you… https://t.co/AGNsJHUIJh,0
Sat Feb 10 15:48:06 +0000 2018,Another day another heist.  https://t.co/Yxyt8JsAHt,2
Sat Feb 10 15:33:16 +0000 2018,Another day another heist.  https://t.co/Yxyt8JsAHt,2
Sat Feb 10 15:28:21 +0000 2018,CRYPTOCURRENCY NEWS: HUGE Litecoin announcement – ‘gamechanger’ LitePay to launch in days  https://t.co/cqVoEoinlM,0
Sat Feb 10 15:28:20 +0000 2018,CRYPTOCURRENCY NEWS: HUGE Litecoin announcement – ‘gamechanger’ LitePay to launch in days  https://t.co/X4UKfQV4rJ,0
Sat Feb 10 15:14:22 +0000 2018,Earning #cryptocurrency for selling my stuff on @Listia! Join me using code "CZRNKL" for an extra 5 000 credits. I… https://t.co/7RltaIJxKi,0
Sat Feb 10 15:06:24 +0000 2018,Earning #cryptocurrency for selling my stuff on @Listia! Join me using code "CZRNKL" for an extra 5 000 credits. I… https://t.co/6RlGzh2CJM,0
Sat Feb 10 15:03:09 +0000 2018,South Korea doesn't intend to shut down cryptocurrency trading  says finance minister https://t.co/rGtZ026J7q,0
Sat Feb 10 15:01:41 +0000 2018,Earning #cryptocurrency for selling my stuff on @Listia! Join me using code "CZRNKL" for an extra 5 000 credits. I… https://t.co/Vxqdecdn7j,0
Sat Feb 10 14:50:38 +0000 2018,Earning #cryptocurrency for selling my stuff on @Listia! Join me using code "CZRNKL" for an extra 5 000 credits. I… https://t.co/zodDX6yB6q,0
Sat Feb 10 14:49:52 +0000 2018,#darstreet50 #crpto #index finished up strong up 22 percent from its lows earlier in the week. More after jump...… https://t.co/OJbszafO5T,2
Sat Feb 10 14:49:26 +0000 2018,#darstreet50 #crpto #index finished up strong up 22 percent from its lows earlier in the week. More after jump...… https://t.co/OJbszafO5T,2
Sat Feb 10 14:47:56 +0000 2018,#darstreet50 #crpto #index finished up strong up 22 percent from its lows earlier in the week. More after jump...… https://t.co/OJbszafO5T,2
Sat Feb 10 14:25:57 +0000 2018,BitGrail Cryptocurrency Exchange Becomes Insolvent After Losing $170 Million https://t.co/oXok1Unr1p,0
Sat Feb 10 14:25:44 +0000 2018,WHY RIPPLE (XRP) WILL SOON BE THE #1 CRYPTOCURRENCY – RIPPLE (XRP) TO $5 IN EARLY 2018! https://t.co/3tSnrDRsrv,0
Sat Feb 10 13:35:21 +0000 2018,#Cryptocurrency news: US TAX may be paid with #Bitcoin  #Ripple  or #Ethereum under new plans----&gt;  #xrp #btc #eth… https://t.co/2AIdk7gzCo,3
Sat Feb 10 08:37:06 +0000 2018,#Cryptocurrency news: US TAX may be paid with #Bitcoin  #Ripple  or #Ethereum under new plans----&gt;  #xrp #btc #eth… https://t.co/2AIdk7gzCo,3
Sat Feb 10 07:47:36 +0000 2018,FULCRUM News February Recap: FISA Memos  Cryptos  Restoration https://t.co/TBDbChyK5L #News #RealNews #TheTruth… https://t.co/2h6yWbVe6K,1
Sat Feb 10 07:46:11 +0000 2018,Bitcoin scammers are impersonating Elon Musk and Donald Trump on Twitter to steal cryptocurrency https://t.co/AhmVUmcGZP,0
Sat Feb 10 05:39:43 +0000 2018,An Insider’s Account Of Korea’s Clandestine #Bitcoin Trade  https://t.co/mWz9KSBL88  #SouthKorean officials say the… https://t.co/Syax42j1Mz,0
Sat Feb 10 05:39:05 +0000 2018,#trx #tron #troncoin #cryptocurrency #cryptocurrencies #altcoins https://t.co/JB97vPPSIl,0
Sat Feb 10 05:34:31 +0000 2018,US Senate Considers Bitcoin Legalization &amp; Regulation!!! https://t.co/LUucxg2TMU #News #RealNews #BreakingNews… https://t.co/cRCZKWqayM,8
Sat Feb 10 05:24:09 +0000 2018,Russia’s top bank to TRADE cryptocurrencies using shock loophole to get around Moscow law  https://t.co/FS9LRKCOHU,0
Sat Feb 10 05:07:24 +0000 2018,Is it just me or does anyone else see the correlation between an underperforming stock market and a huge increase i… https://t.co/ealK9vCXO6,0
Sat Feb 10 04:51:48 +0000 2018,Anarchist hacker Amir Taaki says #bitcoin’s boom means it’s on the verge of a collapse    https://t.co/zqECOeCL7F… https://t.co/Zw0qh1CImc,3
Sat Feb 10 04:14:04 +0000 2018,#Cryptocurrency news: US TAX may be paid with #Bitcoin  #Ripple  or #Ethereum under new plans----&gt;  #xrp #btc #eth… https://t.co/2AIdk7gzCo,3
Sat Feb 10 03:44:50 +0000 2018,😂😂😂 https://t.co/jprHG5UWbf https://t.co/vwjzYuJAQp,0
Sat Feb 10 03:37:07 +0000 2018,#litecoin #cryptocurrencies #cryptocurrency https://t.co/9SfBdDrEWw,1
Sat Feb 10 03:35:29 +0000 2018,#litecoin #cryptocurrencies #cryptocurrency https://t.co/9SfBdDrEWw,1
Sat Feb 10 03:17:12 +0000 2018,How Bitfinex  Tether are raising eyebrows in the cryptocurrency market https://t.co/bvHtj5yOuy,0
Sat Feb 10 03:15:07 +0000 2018,French and German officials called for an International Monetary Fund report on the financial stability ramificatio… https://t.co/7Wp76LtedI,0
Sat Feb 10 03:15:07 +0000 2018,Finance Ministers Want G20 Discussion Of #Cryptocurrency      https://t.co/RiKK2MvcYs  We believe there may be new… https://t.co/2ftMF9ahus,0
Sat Feb 10 03:00:19 +0000 2018,#Cryptocurrency news: US TAX may be paid with #Bitcoin  #Ripple  or #Ethereum under new plans----&gt;  #xrp #btc #eth… https://t.co/2AIdk7gzCo,3
Sat Feb 10 02:59:34 +0000 2018,China To Obstruct Cryptocurrency Websites Using ‘Great Firewall’ https://t.co/D0hpzfrrAB,0
Sat Feb 10 02:41:56 +0000 2018,Hong Kong Regulators Send Warnings to Non-Compliant Cryptocurrency Exchanges      https://t.co/84ExclBybG   Regulat… https://t.co/b0HiQNNB7F,1
Sat Feb 10 02:40:38 +0000 2018,Hong Kong Regulators Send Warnings to Non-Compliant Cryptocurrency Exchanges      https://t.co/84ExclBybG   Regulat… https://t.co/b0HiQNNB7F,1
Sat Feb 10 02:33:35 +0000 2018,Crypto Creeps Into U.S. Regulations  But Long Road Ahead    https://t.co/N8AW1opEJh  Currently  there are 1 384… https://t.co/YRaC98U2IO,0
Sat Feb 10 02:24:10 +0000 2018,@CFTC Chairman J. Christopher Giancarlo is the first high ranking regulator to show indication of support for… https://t.co/0kHHRjDpqQ,85
Sat Feb 10 02:21:39 +0000 2018,@davidgokhshtein @justinsuntron Follow me on #Steemit and here is a blog post about why I am bullish on $TRX for 20… https://t.co/4StBnVhuru,0
Sat Feb 10 02:20:59 +0000 2018,@justinsuntron Follow me on #Steemit and here is a blog post about why I am bullish on $TRX for 2018 #TRX https://t.co/vSmfqXq1cc,0
Sat Feb 10 02:10:04 +0000 2018,Bitfury Enters the Bitcoin Crime Fighting Business • Cryptocurrency decentral market headlines https://t.co/tC55ji3SdA,1
Sat Feb 10 01:10:35 +0000 2018,@CFTC Chairman J. Christopher Giancarlo is the first high ranking regulator to show indication of support for… https://t.co/0kHHRjDpqQ,85
Sat Feb 10 00:32:06 +0000 2018,Cryptocurrency Isn’t Actually A Currency https://t.co/F6FUMIrEhC https://t.co/1YKVO07H4o,0
Sat Feb 10 00:23:57 +0000 2018,China To Obstruct Cryptocurrency Websites Using ‘Great Firewall’ https://t.co/N8JQbkHMeh,0
Sat Feb 10 00:16:37 +0000 2018,Former Child Actor  Vows To Give Away $1B Of His Crypto Fortune       https://t.co/AxCebvabfM  Captivated by Bitcoi… https://t.co/KeJ6dEWMVK,0
