Tue Dec 26 23:27:05 +0000 2017,Financial team offers radically different view about value of bitcoin  report says https://t.co/Qx9VjC8JXv https://t.co/qy7NxSLphi,0
Tue Dec 26 23:21:35 +0000 2017,So @nezumi_h bought me one whole bitcoin for Christmas! https://t.co/BYCSXRBKaS,0
Tue Dec 26 23:09:12 +0000 2017,To which innovation hubs should people pay attention? @SteveCase calls out Baltimore (among others) for health tech… https://t.co/rQzTop6Ymz,5
Tue Dec 26 23:06:36 +0000 2017,Important Jargon in Bitcoin / Cryptocurrencies / Ethereum / Ripple etc. ⋆ Amrank Real Estate https://t.co/pxwdNmCwH3,0
Tue Dec 26 22:58:29 +0000 2017,New Evidence Emerges  Points to Possible Insider Trading at Coinbase |  Bitcoin news https://t.co/SJeEbQ11b0,0
Tue Dec 26 22:42:41 +0000 2017,@SJosephBurns I just listened to Mike Maloney's research video on blockchain vs. Hashgraph.  Hashgraph solves the e… https://t.co/EZH5R5RjMh,0
Tue Dec 26 22:37:26 +0000 2017,in case you wanted to know when the next bitcoin fork will be... https://t.co/Bax2XPgHCr,1
Tue Dec 26 22:33:00 +0000 2017,in case you wanted to know when the next bitcoin fork will be... https://t.co/Bax2XPgHCr,1
Tue Dec 26 22:24:14 +0000 2017,Bitcoin Cryptocurrency Offer! https://t.co/XvJZO7YYZJ,0
Tue Dec 26 22:24:08 +0000 2017,Bitcoin Blackbook https://t.co/f1Wz2udFkp https://t.co/IeVFUskQEa,0
Tue Dec 26 21:37:52 +0000 2017,Bitcoin dip to like 8k plz,0
Tue Dec 26 20:44:23 +0000 2017,Price Analysis  Dec. 26: Bitcoin  Ethereum  Bitcoin Cash  Ripple  IOTA  Litecoin  Dash https://t.co/Dhf4Co1zi0,0
Tue Dec 26 19:47:35 +0000 2017,To which innovation hubs should people pay attention? @SteveCase calls out Baltimore (among others) for health tech… https://t.co/rQzTop6Ymz,5
Tue Dec 26 19:12:57 +0000 2017,Bitcoin climbs back above $16 000  rallying more than 50 percent from Friday’s low https://t.co/YBxOqSOcQb,1
Tue Dec 26 19:01:44 +0000 2017,bitcoin back on track to rise after a yearly low.,0
Tue Dec 26 18:54:52 +0000 2017,@InvestorPlace @HowardLindzon https://t.co/MpUh45AJ13,0
Tue Dec 26 18:30:24 +0000 2017,The Sun Exchange funds solar installations with micro-investments and bitcoin - https://t.co/eBRIFPeen4 https://t.co/8m6Lj0f3Kc,0
Tue Dec 26 17:57:58 +0000 2017,The day Backpage fully integrates Bitcoin payments we will see a national economic boom comparable to that which fo… https://t.co/mcHNo1SiDP,0
Tue Dec 26 17:54:42 +0000 2017,Some apartment vacancies around Baltimore are accepting bitcoin as payment. A listing called vacancy fillers is lis… https://t.co/79zTAWXYDn,2
Tue Dec 26 17:54:07 +0000 2017,Some apartment vacancies around Baltimore are accepting bitcoin as payment. A listing called vacancy fillers is lis… https://t.co/79zTAWXYDn,2
Tue Dec 26 17:48:02 +0000 2017,Some apartment vacancies around Baltimore are accepting bitcoin as payment. A listing called vacancy fillers is lis… https://t.co/79zTAWXYDn,2
Tue Dec 26 17:20:05 +0000 2017,To which innovation hubs should people pay attention? @SteveCase calls out Baltimore (among others) for health tech… https://t.co/rQzTop6Ymz,5
Tue Dec 26 17:13:27 +0000 2017,To which innovation hubs should people pay attention? @SteveCase calls out Baltimore (among others) for health tech… https://t.co/rQzTop6Ymz,5
Tue Dec 26 16:59:52 +0000 2017,This one factor could determine how far bitcoin will drop https://t.co/84rxp8cWPC via @gadfly Follows bogus theory… https://t.co/4xcvcVwVaT,0
Tue Dec 26 16:59:16 +0000 2017,I demand to recieve 1 bitcoin from every non-black person who uses AAVE on here for retweets.,0
Tue Dec 26 16:50:59 +0000 2017,@el33th4xor Someone needs to spend his Bitcoin on a copy of Knuth.,1
Tue Dec 26 16:49:29 +0000 2017,@el33th4xor Someone needs to spend his Bitcoin on a copy of Knuth.,1
Tue Dec 26 16:48:12 +0000 2017,New Cryptocurrency Mining Bot Is Infesting Facebook Messenger - Bitcoin News https://t.co/FLC7ldgnqK,0
Tue Dec 26 15:52:25 +0000 2017,We now accept Bitcoin as a form of payment.https://t.co/82Czrz38Io #Bitcoin #Service #FootDoctor #Maryland #Feet… https://t.co/tatjOT2VMo,0
Tue Dec 26 15:48:29 +0000 2017,Bitcoin  because of massive borrowing  could crash the financial markets https://t.co/MSIBgHoVh0,0
Tue Dec 26 15:32:45 +0000 2017,@maxkeiser then they will use that 5 trillion usd and will start buying bitcoin and eth.....,0
Tue Dec 26 15:05:07 +0000 2017,To which innovation hubs should people pay attention? @SteveCase calls out Baltimore (among others) for health tech… https://t.co/rQzTop6Ymz,5
Tue Dec 26 14:31:01 +0000 2017,Ok so Southampton are Bitcoin,2
Tue Dec 26 14:22:33 +0000 2017,Ok so Southampton are Bitcoin,2
Tue Dec 26 14:21:59 +0000 2017,Ok so Southampton are Bitcoin,2
Tue Dec 26 13:00:13 +0000 2017,[#infographic] #economy #CyberSecurity #IoT #BigData #infosec #Analytics #Tech #technology #security #economics… https://t.co/BsBMsRn2F0,0
Tue Dec 26 12:47:50 +0000 2017,Ripple Price Technical Analysis – XRP/USD Downside Correction - Bitcoin Wiki https://t.co/j0TRdcdzI3,0
Tue Dec 26 09:47:28 +0000 2017,@AlbertarocksTA OK  I just watched this video!  OMG!  So  hashgraph is going to take the baton from bitcoin and blo… https://t.co/GtDimtTNLA,0
Tue Dec 26 04:17:25 +0000 2017,LENDO  #EBT #airdrop #Ether #Bitcoin #Cryptocoin #FreeToken #airdropalerts"  https://t.co/sYoY1AoH8a,0
Tue Dec 26 02:58:17 +0000 2017,First Atomic Swap Between Bitcoin Cash and Komodo Is a Success • r/btc https://t.co/R4qTtg589y,0
Tue Dec 26 02:54:11 +0000 2017,TechDisease: Coinbase may have given away its own Bitcoin Cash surprise https://t.co/DHDl6dgCSu,0
Tue Dec 26 02:48:21 +0000 2017,To make myself crystal clear: scamming and fraud are bad  and the government should jail fraudsters! Bitcoin and ot… https://t.co/tYGgXgcPnv,0
Tue Dec 26 02:20:18 +0000 2017,This Christmas set the record for most mentions of bitcoin from my family on any given night,0
Tue Dec 26 02:19:36 +0000 2017,@StBurnish 😄 not sure boss. Maybe 1 Bitcoin Cash?,0
Tue Dec 26 02:01:18 +0000 2017,@StBurnish 1 bitcoin 😊,0
Tue Dec 26 01:10:16 +0000 2017,That's great. Please tell the IRS while you're at it.. #crypto #BTC #xvg #iota #trx  https://t.co/EGjZUQSqhh,0
Tue Dec 26 01:07:23 +0000 2017,Morgan Stanley says the true price of bitcoin might be zero https://t.co/3Rb5KzCFrW via @clusterstock,0
Tue Dec 26 00:14:31 +0000 2017,Today  @PorterStansber &amp; @BuckSexton have an in-depth interview with David Stockman  former Director of the Office… https://t.co/7fX8apBYRx,6
