Tue Sep 26 21:50:43 +0000 2017,Through the Roadblock? #Bitcoin's Price Might Be Priming for a Boost https://t.co/wdl4iaUu80,0
Tue Sep 26 21:47:57 +0000 2017,111 #Altcoins To Be Traded in #Korea’s New Exchange As SK Passes China in #Bitcoin Trading https://t.co/zO8n3PuxwZ,0
Tue Sep 26 21:19:53 +0000 2017,What Happens to #Cryptocurrency When You Die? https://t.co/UQ7iiP4vHz,0
Tue Sep 26 20:35:18 +0000 2017,Jonathan Katz of @CollegeParkMC2 talks #Bitcoin vulnerabilities arising from Internet routing weaknesses. #infosec… https://t.co/zIeCISoLzt,1
Tue Sep 26 20:15:07 +0000 2017,Jonathan Katz of @CollegeParkMC2 talks #Bitcoin vulnerabilities arising from Internet routing weaknesses. #infosec… https://t.co/zIeCISoLzt,1
Tue Sep 26 14:23:42 +0000 2017,If you were #JamieDimon  you'd attack #Bitcoin  too. https://t.co/BcorlE7GDw  #cryptocurrencies #fintech $BTC,0
Tue Sep 26 13:07:25 +0000 2017,Prepare for an onslaught of national #cryptocurrencies. https://t.co/fqnbTCfzAI via @clusterstock #jcoin #Japan #bitcoin #fintech,1
Tue Sep 26 13:03:15 +0000 2017,Prepare for an onslaught of national #cryptocurrencies. https://t.co/fqnbTCfzAI via @clusterstock #jcoin #Japan #bitcoin #fintech,1
Tue Sep 26 12:36:19 +0000 2017,Look at this on eBay https://t.co/4rPjfyCLvY #nvidia #bitcoin #BitcoinCash #ethereum #Litecoin #computer #tablet #XboxOne #PS4 #gaming,0
Tue Sep 26 11:59:03 +0000 2017,Hong Kong Gripped by Cryptomania  #ICO Fever as #China #Bitcoin Ban Persists https://t.co/mRELgxjWlf,0
Tue Sep 26 11:58:08 +0000 2017,Patent Filling Suggests #Bitcoin Exchanges may be Monitored https://t.co/tOC1rVEmcu,0
Tue Sep 26 11:46:43 +0000 2017,Speculation is healthy; Rampant panic is not. Remember how far Bitcoin has come in a year. It is exciting to think… https://t.co/aEdjlxYsHI,0
Tue Sep 26 11:45:47 +0000 2017,The Man Starting the World’s Biggest #Crypto Fund Calls #Bitcoin a Bubble https://t.co/gBdfsP41vS,0
Tue Sep 26 11:22:03 +0000 2017,I was amused by Dimon's comments because his company's attitude toward digital assets contradicts his anti-bitcoin… https://t.co/LonBnh5d4a,0
Tue Sep 26 06:18:14 +0000 2017,If you can't beat 'em  join 'em... #bitcoin #cryptocurrencies #fintech https://t.co/9PAg1ebJcr,1
Tue Sep 26 04:37:56 +0000 2017,The Government Crackdown on Bitcoin - This post The Government Crackdown on Bitcoin appeared first on Daily Rec... https://t.co/V1fpY3zBdk,1
Tue Sep 26 03:26:05 +0000 2017,Solar  Bitcoin  and the Blockchain https://t.co/mUBSL5PTB6,0
Tue Sep 26 03:07:32 +0000 2017,What percentage of Bitcoin full nodes are operated by people whose main interest is tracing the source of Bitcoin transactions?,38
Tue Sep 26 02:51:54 +0000 2017,China has manipulated the price of Bitcoin for years. It's just logic: Damage the goods  Cheapen the price.  https://t.co/eN8tunra0v,0
Tue Sep 26 01:55:39 +0000 2017,#Venezuelan Hyperinflation Makes #Bitcoin An Ideal Way To Transact https://t.co/jkzl2eSxFB,0
Tue Sep 26 00:47:59 +0000 2017,The Government Crackdown on Bitcoin - This post The Government Crackdown on Bitcoin appeared first on Daily Rec... https://t.co/aDHq1RwplS,0
Tue Sep 26 00:04:13 +0000 2017,The Government Crackdown on Bitcoin - This post The Government Crackdown on Bitcoin appeared first on Daily Rec... https://t.co/V1fpY3zBdk,1
