Mon Sep 18 23:37:17 +0000 2017,$BTC $crypto $neo #Criptomonedas #bitcoin https://t.co/zUdyt5xyFF,0
Mon Sep 18 22:12:24 +0000 2017,@josepimpo @amonrax @ZenTraderMx @sancheezagustin Operar $BTC es de milenials.   Son los tulipanes del siglo XXI...,0
Mon Sep 18 21:25:00 +0000 2017,@paul_btc They should be asking themselves  'How much should I donate to the victims of #HurricaneHarvey and #HurricaneIrma ! 🤔💵❓,0
Mon Sep 18 20:23:58 +0000 2017,Trade $QTUM $LTC $BTC $ETH $STRAT $SC $XRP $STR $PINK $LDOGE ? We want you to win  join our family today by clickin… https://t.co/1fE8l1uF3Z,0
Mon Sep 18 19:52:08 +0000 2017,Well  nicely done! Already 35% in my initial invest on $QTUM in just 1 day!! Next target 360k-370k $BTC #Cryptos #cryptosignals #Bittrex,5
Mon Sep 18 19:31:14 +0000 2017,Y'all ready for this new $STRAT update? $Stratis $BTC https://t.co/ZdfbS2szEd,0
Mon Sep 18 17:53:54 +0000 2017,Well  nicely done! Already 35% in my initial invest on $QTUM in just 1 day!! Next target 360k-370k $BTC #Cryptos #cryptosignals #Bittrex,5
Mon Sep 18 17:44:06 +0000 2017,Court will begin tomorrow at BTC.  Detainees have been returned or are in the process of return to BTC. #HurricaneIrma,1
Mon Sep 18 17:43:56 +0000 2017,Court will begin tomorrow at BTC.  Detainees have been returned or are in the process of return to BTC. #HurricaneIrma,1
Mon Sep 18 16:46:23 +0000 2017,Glades  BTC  and Folkston are open and detainees have been returned. #HurricaneIrma,0
Mon Sep 18 13:49:09 +0000 2017,Uptrend confirmed and intact. #bullish #BTC https://t.co/NyLUYetAkX,0
Mon Sep 18 12:44:01 +0000 2017,@agurevich23 This was one of those comments that came just on time...Time to GET back to trading $BTC,0
Mon Sep 18 08:50:00 +0000 2017,Crypto shiller tweets be like: $NEO $OMG $PAY $TKN $ETC $DGB $LSK $BTC $GNT $WTF $OK $RDD $BCC $XVG $ltc $xrp $ark $btc $eth $omg $neo $dog,3
Mon Sep 18 08:15:24 +0000 2017,BTC-e renace como Wex  un exchange compatible con el modelo “Conoce tu cliente” https://t.co/oyUJ9VAPN8 https://t.co/W0D24nxVHZ,0
Mon Sep 18 02:18:00 +0000 2017,You put yo feelings in a btc boy that's a heartbreak,0
