Sun Jan 28 23:32:49 +0000 2018,Outside the Box: HP and Lenovo can be surprising winners from the boom in mining bitcoin… https://t.co/I0ZoN8oXFo,0
Sun Jan 28 21:51:29 +0000 2018,Preferred addresses for Toronto and Vancouver miners https://t.co/6tjn9TpvWg #mining https://t.co/wgnJvm0B2n,0
Sun Jan 28 21:46:39 +0000 2018,I entered a giveaway for a chance to win "Veddha 8 GPU Deluxe Model Stackable Mining Case R..." by Veddha. https://t.co/aDS3lhtztu #giveaway,0
Sun Jan 28 21:01:04 +0000 2018,#CryptoMining #Malware Epidemic: 55% of Businesses Affected Worldwide  Including YouTube https://t.co/trXAnjIKwT #CryptoCurrency,0
Sun Jan 28 20:03:51 +0000 2018,Crypto-Mining Malware Epidemic: 55% of Businesses Affected Worldwide  Including YouTube https://t.co/BbWrpKZbe1,0
Sun Jan 28 19:35:33 +0000 2018,InfoChip's #RFID tags are a top choice in industries like #mining  #energy  construction  &amp; #oilandgas. https://t.co/YWDc2adH72,0
Sun Jan 28 16:10:10 +0000 2018,POWER MINING POOL Get Paid Every 3 Days 7 days a week https://t.co/KX4CUtWjN9,0
Sun Jan 28 15:40:38 +0000 2018,#Mining #Bitcoin #Crypto #Cryptocurrency #MiningFarm #GranjadeMinado #Antminer #Avalon https://t.co/vgzXDS18ry,0
Sun Jan 28 15:35:16 +0000 2018,Uniquely identify your assets with an #RFID tag to improve decision making in the mining industry.,0
Sun Jan 28 14:16:15 +0000 2018,Another great conference by @DataDayTexas #ddtx18.  Had a great time presenting on Graph based entity resolution.… https://t.co/Do95qjF6fI,0
Sun Jan 28 06:24:46 +0000 2018,i looked up keyboard stands on craigslist and all i find is a bunch of people selling cryptocurrency mining rig frames,0
Sun Jan 28 04:43:32 +0000 2018,Mining GRLC because I believe in memes GRLC:GaeYZDjbSGa2mwWiKtxojipUfaa3XuUpys,0
Sun Jan 28 04:07:30 +0000 2018,Trump administration cancels detailed review of Obama-era mining ban near Minnesota wilderness https://t.co/a2TfLT5b17,0
Sun Jan 28 03:09:34 +0000 2018,Best Graphic Cards For Ethereum Mining? Ethereum is boosting the earning of Nvidia as well as AMD… https://t.co/EIbaqKo8e0,0
Sun Jan 28 02:11:55 +0000 2018,@notsofast To their credit  things like Nicehash are nice for temp market dislocations and for fundamental plays wi… https://t.co/rgb3PRVMg8,0
Sun Jan 28 02:04:36 +0000 2018,Power Mining Pool https://t.co/2fTafQig3Q,0
Sun Jan 28 01:24:35 +0000 2018,Best Graphic Cards For Ethereum Mining? Ethereum is boosting the earning of Nvidia as well as AMD… https://t.co/GPQkHw0OAN,3
