Fri Jan 04 23:51:36 +0000 2019,InfoChip's #RFID Nameplates allow for automating inspection and audit process for the mining industry  #construction  &amp; #oilfield assets.,0
Fri Jan 04 22:21:11 +0000 2019,みんなで素晴らしい週末を過ごしましょう！  #Bitzeny #mining #community #yay $ZNY $BELL $MONA $RVN https://t.co/BoqzR08Sdw,1
Fri Jan 04 21:21:30 +0000 2019,@pxs_espada Wasnt just 1 character leaked through data mining,0
Fri Jan 04 19:45:09 +0000 2019,An interesting look back on the history of Bitcoin and Blockchain on this  the tenth anniversary (January 3  2009-1… https://t.co/4VXjgIu566,1
Fri Jan 04 19:44:43 +0000 2019,An interesting look back on the history of Bitcoin and Blockchain on this  the tenth anniversary (January 3  2009-1… https://t.co/4VXjgIu566,1
Fri Jan 04 18:53:09 +0000 2019,I really like the project. Prospects for the development of a purely cosmic scale. I wish the developers good healt… https://t.co/ZqYj2KkYzQ,0
Fri Jan 04 18:53:02 +0000 2019,EtherCC is the best project I've ever seen on the Internet! Strong team and demanded product! We are all waiting fo… https://t.co/ecYeWiIH7k,0
Fri Jan 04 18:26:21 +0000 2019,The “Mine Yours” Tee comes from the thought of strenuous hours and intricacies dedicated to the mining of gems. You… https://t.co/Dpw57wZXx6,0
Fri Jan 04 15:46:14 +0000 2019,Sample Research Paper on Impacts of Mining in Mount Nimba https://t.co/vzmA6imBN6,0
Fri Jan 04 13:00:28 +0000 2019,¡Aprovecha nuestra oferta! GPU Sapphire RX470 Mining Edition a tan solo $235.00  que gracias a su memoria RAM de 4G… https://t.co/nVnj1Nbqam,0
Fri Jan 04 10:31:20 +0000 2019,i remember in 2012 reading an article about bitcoin and i thought to myself  wow  i want to set up a mining rig. pr… https://t.co/bXa15MbtHr,1
Fri Jan 04 09:47:59 +0000 2019,I see #China on top as a World Leader in Space and Innovative Astroid &amp; Planetary Mining in the near future. New En… https://t.co/wlj7X14sj8,0
Fri Jan 04 06:12:43 +0000 2019,@LynxSavageVR Nice!! I never did any mining when I played. Me and a couple of buddies would go into battles against… https://t.co/exgw00zo6N,0
Fri Jan 04 06:03:40 +0000 2019,"Los Angeles Accuses Weather Channel App of Covertly Mining User Data" by JENNIFER VALENTINO-DeVRIES and NATASHA SI… https://t.co/frNF9amexR,0
Fri Jan 04 04:37:21 +0000 2019,i remember in 2012 reading an article about bitcoin and i thought to myself  wow  i want to set up a mining rig. pr… https://t.co/bXa15MbtHr,1
Fri Jan 04 04:16:46 +0000 2019,Even though the market is Falling  we are making profits. Our position in KL a gold mining company has paid off han… https://t.co/UKpkWmfzJm,0
Fri Jan 04 04:00:05 +0000 2019,Excel Data Mining and Modeling for KPI Reporting https://t.co/2lbvBP8kQE,0
