Mon Feb 26 23:47:53 +0000 2018,$SPYR - Press Release - Bitcoin and other cryptocurrencies like Ripple  Ethereum  Litecoin  Monero and Neo as forms… https://t.co/Z6exqdPv7o,0
Mon Feb 26 22:15:50 +0000 2018,Stellar (XLM)  Monero (XMR)  and IOTA (MIOTA) Dig In - After a rough week last week  and a Sunday full of red  many… https://t.co/Zha6J7vpvU,0
Mon Feb 26 19:34:17 +0000 2018,How to Buy #MoneroXMR - January 2018 - https://t.co/iXswUrDGh5 #Investing #Cryptocurrency #Crypto #altcoin… https://t.co/Sbf0AJv3IY,0
Mon Feb 26 18:38:11 +0000 2018,Need a break from Monday already? Here's a blog post on the rise of popularity of #cryptojacking to take your mind… https://t.co/H7NPSURJ1s,0
Mon Feb 26 13:55:11 +0000 2018,Monero $XMR price: $287.59   QUICK! Sign up before Binance closes registration! 🤔 🙌    ➡️ https://t.co/JhPENhgzbK… https://t.co/FnJ57YD56R,0
Mon Feb 26 11:29:28 +0000 2018,I put together a list of beginner's guide articles I've written on various cryptoassets. The ones I've covered so f… https://t.co/8tTTuwebXG,2182
Mon Feb 26 08:14:15 +0000 2018,I put together a list of beginner's guide articles I've written on various cryptoassets. The ones I've covered so f… https://t.co/8tTTuwebXG,2182
Mon Feb 26 05:59:23 +0000 2018,Watch that Jenkins server you setup long time ago to run the pet projects... Hacker Group Makes $3 Million by Insta… https://t.co/qaH2wtIcGX,2
Mon Feb 26 04:44:24 +0000 2018,@braddwyer I should also say the privacy focused cryptos are being used as currency today  mostly Monero  and some Zcash.,0
Mon Feb 26 02:51:12 +0000 2018,@CryptoBabel Bitcoin is filled with anarchists. Either Bitcoin's name is overtaken by a clever centralized team or… https://t.co/c7iGBApl9x,0
Mon Feb 26 00:34:16 +0000 2018,Best GPU Configurations for #Mining #MoneroXMR: February 2018 - https://t.co/MiKUiyLeT5 #Cryptocurrency #Crypto… https://t.co/IFlUjzViNN,0
