Sun Apr 22 17:09:21 +0000 2018,How to use #Uphold #Cryptocurrency Platform. Why we prefer it over #Coinbase. See the link below. #ALTSEASON Fam… https://t.co/h4lSOjeERy,0
Sun Apr 22 16:41:22 +0000 2018,Shill me a good BTC-fiat onramp for US citizens that isnt Coinbase and has decent limits. Linked debit card a plus.,2
Sun Apr 22 13:33:10 +0000 2018,Shill me a good BTC-fiat onramp for US citizens that isnt Coinbase and has decent limits. Linked debit card a plus.,2
Sun Apr 22 13:28:33 +0000 2018,Shill me a good BTC-fiat onramp for US citizens that isnt Coinbase and has decent limits. Linked debit card a plus.,2
Sun Apr 22 13:05:58 +0000 2018,Crypto-Friendly CheapAir Asks Customers For Feedback On Switch Away From Coinbase https://t.co/0dJBUtiSZ0 https://t.co/IywxhCAtU8,0
Sun Apr 22 12:53:57 +0000 2018,@DjMunchie_MM4L Sign up to @coinbase @AbraGlobal and I’ll tune u in .,0
Sun Apr 22 12:13:54 +0000 2018,Today's lesson in "Not your keys? Not your coins!" https://t.co/EyZrtmmGdC,0
Sun Apr 22 12:13:44 +0000 2018,Today I got a call from my brother &amp; wanted to buy @DigiBytecoin with USD &amp; store #Digibyte on the hardware wallet.… https://t.co/ZA3frKQHkx,13
Sun Apr 22 06:08:50 +0000 2018,#WikiLeaks loses access to a key #cryptocurrency account | @Engadget @wikileaks https://t.co/iT3hNL3dML #crypto,0
Sun Apr 22 03:35:06 +0000 2018,@gregcobb77 Coinbase is the worst thing to happen.,0
Sun Apr 22 02:35:53 +0000 2018,Noch vor einem Jahr schien es unvorstellbar  dass Michigan  Wisconsin oder Pennsylvania für Donald Trump stimmen bi… https://t.co/vuHCz3onDG,0
