Wed Oct 10 22:47:38 +0000 2018,Would really like to see a 10/17 low $BTC_F #BTC #BTCUSD $BTCUSD #XBT $XBT_F #Crypto #CryptoCurrency #CryptoTrading… https://t.co/DrrHBz7xZk,0
Wed Oct 10 22:12:41 +0000 2018,Congress had a #Crypto Party as Industry heads go to Washington DC     "We all want a fair and orderly markets  we… https://t.co/EYDlHXqM7N,9
Wed Oct 10 20:00:12 +0000 2018,Buy BTC on Coinbase for now. https://t.co/4s0juJ8C7I,0
Wed Oct 10 19:43:49 +0000 2018,If you're not buying the $ZRX dips or at least holding a bag  knowing very well that the #Coinbase listing is immin… https://t.co/Bfhuc3BLFu,29
Wed Oct 10 19:09:10 +0000 2018,@BchDevcon @zquestz @coinbase @PermissionLessV @Epperly_li Is the video recording available?,0
Wed Oct 10 17:51:18 +0000 2018,If you're not buying the $ZRX dips or at least holding a bag  knowing very well that the #Coinbase listing is immin… https://t.co/Bfhuc3BLFu,29
Wed Oct 10 17:49:44 +0000 2018,proof @coinbase should be investigated for market manipulation.  CB only does things to increase the value of their… https://t.co/lrYTr6tAdT,0
Wed Oct 10 16:45:39 +0000 2018,@brian_armstrong @coinbase When new coins you've promised all year?,0
Wed Oct 10 16:39:21 +0000 2018,Just got done setting up my coinbase to receive digital currency dontations.   It was quick and easy.  https://t.co/laJHO6xvYu,0
Wed Oct 10 16:29:05 +0000 2018,Irony is Coinbase taking an entire week to clear my funds so I can finally invest in XRP,0
Wed Oct 10 15:03:16 +0000 2018,If you're not buying the $ZRX dips or at least holding a bag  knowing very well that the #Coinbase listing is immin… https://t.co/Bfhuc3BLFu,29
Wed Oct 10 14:42:46 +0000 2018,George thinks Coinbase  the #1 onboard exchange with its 14 million users  is nothing 🤦‍♂️ https://t.co/fyhzUbeomx,0
Wed Oct 10 11:40:31 +0000 2018,If you're not buying the $ZRX dips or at least holding a bag  knowing very well that the #Coinbase listing is immin… https://t.co/Bfhuc3BLFu,29
Wed Oct 10 11:07:07 +0000 2018,Coinbase confident Japan will let it sell cryptocurrency by 2019 https://t.co/0wNSzBDf9K,0
Wed Oct 10 06:21:48 +0000 2018,If you're not buying the $ZRX dips or at least holding a bag  knowing very well that the #Coinbase listing is immin… https://t.co/Bfhuc3BLFu,29
Wed Oct 10 02:29:31 +0000 2018,I just bought my first digital currency on Coinbase - try it! https://t.co/r6fESibayZ,0
Wed Oct 10 02:29:23 +0000 2018,Coinbase - Buy/Sell Digital Currency https://t.co/GsaxAMrwja,0
Wed Oct 10 01:44:21 +0000 2018,Is Coinbase Wallet Safe? - https://t.co/2P339gaUT9: https://t.co/aOcxe2Yyve via @YouTube,0
Wed Oct 10 01:35:14 +0000 2018,@keenanluther1 Lmao  though we’ll have to interact with Centralized entities with names Coinbase  Binance  KuCoin … https://t.co/YLwwOX8KXu,0
Wed Oct 10 00:38:27 +0000 2018,@Melt_Dem @circlepay Full spectrum services was the strategy of the banking sector  but this image is a signal of i… https://t.co/cO38AUVqvZ,0
Wed Oct 10 00:12:15 +0000 2018,If you're not buying the $ZRX dips or at least holding a bag  knowing very well that the #Coinbase listing is immin… https://t.co/Bfhuc3BLFu,29
