Sat Dec 01 22:07:13 +0000 2018,Yi dash cams  Kindle Paperwhite  and more are all discounted today: https://t.co/xzTVaj917J,0
Sat Dec 01 20:42:27 +0000 2018,The results are in big win by #teamyellow 8-3 and Mullane’s stat line was 0 goals 1 assist and dash 5  we did it fo… https://t.co/locMaGBxhe,0
Sat Dec 01 20:20:28 +0000 2018,proc logistic; model me = so_tired abstracts ddw_2019 last_minute_dash nine_more_hours getting_delirious academic_g… https://t.co/QYxACY98Vs,1
Sat Dec 01 19:07:13 +0000 2018,WT&amp;F: Leah Fowlkes wins the 200m dash with a new personal-best time of 24.13.,0
Sat Dec 01 17:02:51 +0000 2018,One of the Top Rated platforms to trade #Crypto ..Try it Now!  #trading #invest #bitcoin #dash #ethereum #litecoin… https://t.co/o7dLzwOoPJ,5
Sat Dec 01 16:55:04 +0000 2018,The Crypto Show: Ben Swann Isegoria  Bradley Zastrow Dash  Robin O'Connell Uphold And Bryan Courchesne DAiM… https://t.co/13ISG9wWsf,0
Sat Dec 01 16:51:38 +0000 2018,proc logistic; model me = so_tired abstracts ddw_2019 last_minute_dash nine_more_hours getting_delirious academic_g… https://t.co/QYxACY98Vs,1
Sat Dec 01 16:27:42 +0000 2018,Nice job @cfroio5.  Proud of your first place finish. #regispride #track #sprinter #dash. @ Reggie Lewis Track and… https://t.co/FGBwgMpTam,1
Sat Dec 01 16:00:08 +0000 2018,One of the Top Rated platforms to trade #Crypto ..Try it Now!  #trading #invest #bitcoin #dash #ethereum #litecoin… https://t.co/o7dLzwOoPJ,5
Sat Dec 01 15:59:47 +0000 2018,One of the Top Rated platforms to trade #Crypto ..Try it Now!  #trading #invest #bitcoin #dash #ethereum #litecoin… https://t.co/o7dLzwOoPJ,5
Sat Dec 01 15:59:36 +0000 2018,One of the Top Rated platforms to trade #Crypto ..Try it Now!  #trading #invest #bitcoin #dash #ethereum #litecoin… https://t.co/o7dLzwOoPJ,5
Sat Dec 01 15:59:09 +0000 2018,One of the Top Rated platforms to trade #Crypto ..Try it Now!  #trading #invest #bitcoin #dash #ethereum #litecoin… https://t.co/o7dLzwOoPJ,5
Sat Dec 01 15:58:56 +0000 2018,One of the Top Rated platforms to trade #Crypto ..Try it Now!  #trading #invest #bitcoin #dash #ethereum #litecoin… https://t.co/o7dLzwOoPJ,5
Sat Dec 01 14:50:20 +0000 2018,Giving a special someone something extraordinary=FAB. Dash #kantha #quilt #silk #cotton #heirloom #ethical… https://t.co/uBFK5BiuFj,0
Sat Dec 01 08:07:33 +0000 2018,The Yi Compact dash cam has 1080p  night vision  and more for just $25: https://t.co/7gTrhK45Ta,0
Sat Dec 01 05:42:59 +0000 2018,is dedede drum dash canon. cause I think someone said that dedede learned to teleport there,0
Sat Dec 01 04:11:02 +0000 2018,THANK YOU TO THE INDIVIDUALS IN CALIFORNIA WHO HACKED MY DOOR DASH ACCOUNT AND JUST SPENT $62.03 THAT I DIDN’T HAVE… https://t.co/kVUyK19bo2,1
Sat Dec 01 03:24:44 +0000 2018,If every time I’m coming to see you  I gotta stop and pick up somethings and you’ll “pay me back” I’m not coming. Use Door dash.,1
Sat Dec 01 02:45:36 +0000 2018,Can’t tell if the niiga in jail or college https://t.co/UugvuNZ4wH,21171
Sat Dec 01 02:03:44 +0000 2018,If every time I’m coming to see you  I gotta stop and pick up somethings and you’ll “pay me back” I’m not coming. Use Door dash.,1
Sat Dec 01 00:24:31 +0000 2018,Women film themselves driving with music in the background and don’t pay any mind to all the lights on their dash.… https://t.co/caZngi1T2a,1
Sat Dec 01 00:22:48 +0000 2018,I approve this message strongly.   #1 I need the President to do my introduction pronto/stat.  #2 I need Tiwa to da… https://t.co/SXQQDfurNh,1
Sat Dec 01 00:18:06 +0000 2018,Women film themselves driving with music in the background and don’t pay any mind to all the lights on their dash.… https://t.co/caZngi1T2a,1
