Mon Jan 07 22:06:40 +0000 2019,Today's dash of dystopia  from late 2013--a brain-dead pregnant woman in Texas kept on life support (against her pr… https://t.co/uOIE1RxBmN,0
Mon Jan 07 21:42:34 +0000 2019,@jeffphowe Why is it always the back right tire? Same problem on my dash,0
Mon Jan 07 21:40:17 +0000 2019,@dash_GTA Cool man I’ll be on later tonight,0
Mon Jan 07 21:30:13 +0000 2019,@dash_GTA Wanna play? I need 7 wins I’m close to platinum,0
Mon Jan 07 21:12:37 +0000 2019,Anil Dash on the biases of tech https://t.co/CmLTkAaeh7,0
Mon Jan 07 21:00:01 +0000 2019,for a dash of perspective  the hypothetical rich guy here would need to work 5 full time jobs at this rate to be re… https://t.co/1gebT0Ez8u,3
Mon Jan 07 20:51:35 +0000 2019,for a dash of perspective  the hypothetical rich guy here would need to work 5 full time jobs at this rate to be re… https://t.co/1gebT0Ez8u,3
Mon Jan 07 20:47:54 +0000 2019,for a dash of perspective  the hypothetical rich guy here would need to work 5 full time jobs at this rate to be re… https://t.co/1gebT0Ez8u,3
Mon Jan 07 20:42:30 +0000 2019,for a dash of perspective  the hypothetical rich guy here would need to work 5 full time jobs at this rate to be re… https://t.co/1gebT0Ez8u,3
Mon Jan 07 20:07:01 +0000 2019,This nigga at Chipotle must wanna get fired cuz why I get a tablespoon of meat and a dash of rice,0
Mon Jan 07 19:45:31 +0000 2019,@AntonioMbass BECAUSE THEYRE THE WORST. I hate them as much as I hate Red Hot Chili Peppers. And no matter how many… https://t.co/W4Vt9HnVxN,0
Mon Jan 07 19:23:54 +0000 2019,If you’re going to HIMSS in February and want to banter with CISOs from ⁦@UPMC⁩  ⁦@Wellforce⁩ and ⁦@TuftsMedicalCtr… https://t.co/9mC36buwcX,3
Mon Jan 07 18:04:54 +0000 2019,I added a video to a @YouTube playlist https://t.co/nfCBSRcVsu Driver accuses me of hit and run on dash cam,0
Mon Jan 07 17:45:25 +0000 2019,@angoraruth A pot in the morning with a dash of sugar &amp; almond milk  &amp; a large iced mocha with almond throughly the day 😇,0
Mon Jan 07 17:32:47 +0000 2019,In case you missed it  check out @lkalexandermn's and my #BeyondtheGrant Workbook presentation featuring some of th… https://t.co/aC0i9IDUYk,2
Mon Jan 07 16:51:17 +0000 2019,Maybe being an adult just means being low-grade stress nauseous like  all the time,4
Mon Jan 07 16:12:06 +0000 2019,If you’re going to HIMSS in February and want to banter with CISOs from ⁦@UPMC⁩  ⁦@Wellforce⁩ and ⁦@TuftsMedicalCtr… https://t.co/9mC36buwcX,3
Mon Jan 07 12:14:42 +0000 2019,I liked a @YouTube video https://t.co/I9e638YfRJ Dame Dash speaks on Aaliyah  Surviving R. Kelly  Roc a fella / Jay Z wanting Biggs,0
Mon Jan 07 04:32:10 +0000 2019,https://t.co/8xIrAsgzxw,0
Mon Jan 07 04:20:30 +0000 2019,https://t.co/pI4StxXxA6,0
Mon Jan 07 03:58:27 +0000 2019,this acceptance makes me hate the movie even more,0
Mon Jan 07 03:47:43 +0000 2019,Janelle Monáe IS DIVINE,0
Mon Jan 07 03:36:19 +0000 2019,the gays are just... better https://t.co/P4W896kgTl,3538
Mon Jan 07 03:13:02 +0000 2019,he knew he was getting this before the show and has NOTHING to say and is winging it all “yeah guy man good times”… https://t.co/ENIHSEUKat,0
Mon Jan 07 02:42:46 +0000 2019,Emergency Press Conference-  When Will Philly Accept Nick Foles? https://t.co/CVWNrQwhur,1481
Mon Jan 07 01:09:02 +0000 2019,Jay-z was a good topix for 10 pages. My mom got us tickets to see R.Kellu and Jay-Z and Jay Z bailed cuz of his all… https://t.co/E52CQrWtRx,0
Mon Jan 07 00:31:55 +0000 2019,me  a 13th century baddie  telling the local peasants how I transformed metal into gold https://t.co/LkkGaz7adh,1
Mon Jan 07 00:01:02 +0000 2019,When I play falco I like to dash dance carefully and strategically  weaving in and out of my opponents range to bai… https://t.co/TYMR6qmBJW,0
