Wed May 30 23:50:21 +0000 2018,Riding the volatile wave of cryptocurrency https://t.co/VsW5ugUA4i,0
Wed May 30 23:38:55 +0000 2018,“#Cryptocurrency trading app Taylor says all funds have been stolen in #cyberattack”: https://t.co/BI7XjLDlnq via @ZDNet,4
Wed May 30 22:37:14 +0000 2018,Retweeted Mike Magolnick (@magolnick):  Amazon Eyes Ethereum (ETH)  Partners With ConsenSys To Simplify Blockchain… https://t.co/le0UkziUNX,0
Wed May 30 22:00:56 +0000 2018,RT @antgrasso: The #Blockchain Use Cases. @Fisher85M via @antgrasso #bitcoin #ethereum #fintech #Insurtech #AI… https://t.co/U7V426NCje,1
Wed May 30 21:55:04 +0000 2018,Last week I was the first person to file a #SEC registration for #shares of a public company purchased with… https://t.co/rTZVgBzRJ1,0
Wed May 30 21:01:10 +0000 2018,@hgfernan Not-so-accurate predictions? Six months later and the Petro (cryptocurrency)  #XPD $XPD is not heading an… https://t.co/KuJoRzFH7i,0
Wed May 30 20:18:17 +0000 2018,BTC to GBP: List of Top Cryptocurrency Exchanges https://t.co/NyYZnXXOSq https://t.co/TmzWOSfMdP,0
Wed May 30 20:00:03 +0000 2018,Quick glance at the CRYPTO15 in action. Sign up here - https://t.co/MKNm1Pz0Db  #bitcoin #ETHEREUM  #cryptocurrency… https://t.co/eOSzswDyNT,0
Wed May 30 19:06:00 +0000 2018,Are you a #cryptocurrency #miner and don't know it? Help is on the way from one browser vendor. https://t.co/SmCeREIUbi,0
Wed May 30 17:40:24 +0000 2018,Blockchain investor punctures the cryptocurrency hype balloon https://t.co/qNSZ3XGSvl,0
Wed May 30 17:31:09 +0000 2018,Meet the @GoldmanSachs  -Backed #Fintech #Startup Aiming to Take Over North America #venturecapital… https://t.co/fXeGl17A38,1
Wed May 30 17:13:20 +0000 2018,People are so obsessed with trading cryptocurrencies that a hospital just launched a program to treat addictive beh… https://t.co/xFmzc4emXT,1
Wed May 30 17:09:40 +0000 2018,People are so obsessed with trading cryptocurrencies that a hospital just launched a program to treat addictive beh… https://t.co/xFmzc4emXT,1
Wed May 30 17:03:10 +0000 2018,Sounds interesting  but how are they going to address the discoverabilty problem? https://t.co/sRxpchRqir https://t.co/faXr5EZeBS,0
Wed May 30 17:01:14 +0000 2018,Meet the @GoldmanSachs  -Backed #Fintech #Startup Aiming to Take Over North America #venturecapital… https://t.co/fXeGl17A38,1
Wed May 30 16:54:00 +0000 2018,Cryptocurrency has become part of the mainstream financial services canon  but now government agencies have concern… https://t.co/531ZerTUD3,0
Wed May 30 16:41:11 +0000 2018,EOS Cryptocurrency Lacks Price Direction Ahead of Launch https://t.co/Bj4OEWRivk,0
Wed May 30 15:53:05 +0000 2018,I just read up on the Italian crisis and found myself thinking  “So liking the EU but not the Euro is like liking b… https://t.co/4OG8e0CWkb,5
Wed May 30 15:36:12 +0000 2018,Although a recovery may be in progress  it has been another rough week for #cryptocurrency markets as the total mar… https://t.co/jw7pgYUhHA,2
Wed May 30 15:29:48 +0000 2018,I just read up on the Italian crisis and found myself thinking  “So liking the EU but not the Euro is like liking b… https://t.co/4OG8e0CWkb,5
Wed May 30 15:08:03 +0000 2018,I just read up on the Italian crisis and found myself thinking  “So liking the EU but not the Euro is like liking b… https://t.co/4OG8e0CWkb,5
Wed May 30 15:01:00 +0000 2018,I just read up on the Italian crisis and found myself thinking  “So liking the EU but not the Euro is like liking b… https://t.co/4OG8e0CWkb,5
Wed May 30 14:56:34 +0000 2018,I just read up on the Italian crisis and found myself thinking  “So liking the EU but not the Euro is like liking b… https://t.co/4OG8e0CWkb,5
Wed May 30 14:56:13 +0000 2018,I just read up on the Italian crisis and found myself thinking  “So liking the EU but not the Euro is like liking b… https://t.co/4OG8e0CWkb,5
Wed May 30 13:58:53 +0000 2018,Ultra plans to use blockchain and cryptocurrency to disrupt game distribution https://t.co/DkHyrjG7If https://t.co/OID3vBYjMW,0
Wed May 30 11:36:40 +0000 2018,#GigTricks #GigTricksICO #ICO #Cryptocurrency #Blockchain https://t.co/5aN0fCoLWD,0
Wed May 30 11:36:26 +0000 2018,#GigTricks #GigTricksICO #ICO #Cryptocurrency #Blockchain https://t.co/VydDpbLnZv,0
Wed May 30 11:20:44 +0000 2018,Recent promising company in the field of cryptocurrency it technologies. It is a meaningful convenience to in vest… https://t.co/mo5GAqBpL9,1
Wed May 30 11:20:19 +0000 2018,Recent promising company in the field of cryptocurrency it technologies. It is a meaningful convenience to in vest… https://t.co/mo5GAqBpL9,1
Wed May 30 09:23:32 +0000 2018,Check out the new changes on https://t.co/ybDe8kinSY. Featured stores are now included + design refresh for Cryptoc… https://t.co/SOBTCAwsDO,5
Wed May 30 09:17:18 +0000 2018,Check out the new changes on https://t.co/ybDe8kinSY. Featured stores are now included + design refresh for Cryptoc… https://t.co/SOBTCAwsDO,5
Wed May 30 07:00:24 +0000 2018,Why is #cryptocurrency obsessed with Alice and Bob? by @mr_rigden https://t.co/IdsJ0zpnkG https://t.co/TlXf3wquNo,0
Wed May 30 06:50:12 +0000 2018,#savethetrees use cryptocurrency #paywithcrypto,0
