Mon Jul 23 13:19:17 +0000 2018,United States and New Zealand Meet Under Trade and Investment Framework Agreement https://t.co/xBfQBftTRt https://t.co/pD63z2afTZ,10
Mon Jul 23 13:19:16 +0000 2018,United States and New Zealand Meet Under Trade and Investment Framework Agreement https://t.co/xBfQBftTRt https://t.co/pD63z2afTZ,10
Mon Jul 23 13:18:23 +0000 2018,United States and New Zealand Meet Under Trade and Investment Framework Agreement https://t.co/xBfQBftTRt https://t.co/pD63z2afTZ,10
Mon Jul 23 13:17:43 +0000 2018,United States and New Zealand Meet Under Trade and Investment Framework Agreement https://t.co/xBfQBftTRt https://t.co/pD63z2afTZ,10
Mon Jul 23 13:17:16 +0000 2018,A Present-Tense Solution to Law Firms’ Short-Term Thinking @RoyWStrom https://t.co/F8JGgBwasz Allow partners to kee… https://t.co/cwAWOlKC96,3
Mon Jul 23 13:17:09 +0000 2018,United States and New Zealand Meet Under Trade and Investment Framework Agreement https://t.co/xBfQBftTRt https://t.co/pD63z2afTZ,10
Mon Jul 23 13:14:35 +0000 2018,Take a moment and read @SavetheChildren trustee Jennifer Garner share why investing in kids through high-quality… https://t.co/E98WTWD7on,15
Mon Jul 23 13:14:05 +0000 2018,Paying for college  rental scams  choosing an investment professional  saving for retirement. We will be covering i… https://t.co/XXXp8YfsUa,1
Mon Jul 23 13:12:12 +0000 2018,Can one of Trump's economists explain to him that the point of his tax cut was to increase the trade deficit?(Serio… https://t.co/2atPIuOCK2,7
Mon Jul 23 13:11:36 +0000 2018,"Recently  however  investment has been made in clarifying the composite attributes of social cohesion in the conte… https://t.co/UI92CtBhNo,0
Mon Jul 23 13:10:05 +0000 2018,Workplace design: is it really worth the investment? https://t.co/9Eu85C9fft,0
Mon Jul 23 13:09:52 +0000 2018,@kdziczek I know there have been scattered reports of companies postponing investment but have you’ve seen any arti… https://t.co/peaFOIuIJJ,0
Mon Jul 23 13:08:21 +0000 2018,Hello ladies and gentle men #banks can't pay you 40% within 15 days of investment why not join me and make 40%… https://t.co/xEwlmfyX73,0
Mon Jul 23 13:05:03 +0000 2018,Federal employees &amp; contractors are invited to be a part of the @MicroFocusGov Serena Federal User Group technical… https://t.co/mpczSxRe5X,0
Mon Jul 23 13:03:25 +0000 2018,We fully support the ARG @g20org Presidency priorities on the future of work. I am optimistic that we can harness t… https://t.co/lAQodBymc6,78
Mon Jul 23 13:02:54 +0000 2018,OPINION | Most business activity  including job creation &amp; investment  occurs independently of Washington… https://t.co/2DjFV9iUU3,2
Mon Jul 23 13:02:11 +0000 2018,Can one of Trump's economists explain to him that the point of his tax cut was to increase the trade deficit?(Serio… https://t.co/2atPIuOCK2,7
Mon Jul 23 13:02:00 +0000 2018,OPINION | Most business activity  including job creation &amp; investment  occurs independently of Washington… https://t.co/2DjFV9iUU3,2
Mon Jul 23 13:01:10 +0000 2018,Roundup of recent investments in #LegalTech companies @bobambrogi https://t.co/sDHJhpXAai Anyone have data on ROI o… https://t.co/y30alKbTvf,0
Mon Jul 23 13:00:19 +0000 2018,A report issued by the Natural Resources defense council calls for investment in public transportation infrastructu… https://t.co/OHpgUX8jhB,2
Mon Jul 23 12:58:57 +0000 2018,We fully support the ARG @g20org Presidency priorities on the future of work. I am optimistic that we can harness t… https://t.co/lAQodBymc6,78
Mon Jul 23 12:56:53 +0000 2018,As the Data Show  Higher Corporate Profits Mean Higher Investment (not) https://t.co/2gryuVAUMh https://t.co/WswNwRJBxu,295
Mon Jul 23 12:54:00 +0000 2018,If you know of assets – people  institutions  infrastructure - in black communities that’s worthy of investment  I… https://t.co/s2Zdd0DkOw,6
Mon Jul 23 12:53:56 +0000 2018,So-called 'Smart City' initiatives will attract technology investments of more than $81 billion globally in 2018  w… https://t.co/FKim1DvUCW,0
Mon Jul 23 12:46:32 +0000 2018,Great stuff from @toddjmoss &amp; Rob Mosbacher on how #theBUILDAct to modernize @opicgov is a 3x win: ‘it catalyzes in… https://t.co/xzjaBVQ3dg,5
Mon Jul 23 12:45:17 +0000 2018,#Portugal was apparently successful in implementing #gradualismo. The gvt cut back on public investment and public… https://t.co/HELkmBaSyg,0
Mon Jul 23 12:44:31 +0000 2018,“Official figures reviewed by the Journal show that Chinese-backed power plants were promised annual returns on inv… https://t.co/fiOX3nE1yU,15
Mon Jul 23 12:42:42 +0000 2018,Great stuff from @toddjmoss &amp; Rob Mosbacher on how #theBUILDAct to modernize @opicgov is a 3x win: ‘it catalyzes in… https://t.co/xzjaBVQ3dg,5
Mon Jul 23 12:42:00 +0000 2018,Until decision-makers embrace rules of #EnvironmentalDemocracy  trade &amp; investment policy will continue to unilater… https://t.co/ex8LisfJYj,0
Mon Jul 23 12:40:05 +0000 2018,. @Georgetown just adopted a new investment policy  which establishes #impactinvesting as one of four core prioriti… https://t.co/fTL7Pa4keF,0
Mon Jul 23 12:36:13 +0000 2018,Chilled camel milk  anyone? ⁦@mercycorps⁩ leveraged $6.5m in private investment w/ a $1.5m stake in 1st camel milk… https://t.co/N7yYWZujum,14
Mon Jul 23 12:34:21 +0000 2018,Let’s talk #nuclear: Global investment in nuclear power in 2017 declined by nearly 45% (to $17bn).,1
Mon Jul 23 12:34:01 +0000 2018,Let’s talk #nuclear: Global investment in nuclear power in 2017 declined by nearly 45% (to $17bn).,1
Mon Jul 23 12:33:34 +0000 2018,As the Data Show  Higher Corporate Profits Mean Higher Investment (not) https://t.co/2gryuVAUMh https://t.co/WswNwRJBxu,295
Mon Jul 23 12:33:23 +0000 2018,“If they can’t create an environment that is welcoming to foreign investment and supports it through a rules-based… https://t.co/PWZnnO9lBu,13
Mon Jul 23 12:25:09 +0000 2018,Do cryptocurrencies affect the average investor?  ICI's Marty Burns details the barriers to fund investment in such… https://t.co/kYntECcUhF,2
Mon Jul 23 12:23:29 +0000 2018,As the Data Show  Higher Corporate Profits Mean Higher Investment (not) https://t.co/2gryuVAUMh https://t.co/WswNwRJBxu,295
Mon Jul 23 12:22:52 +0000 2018,This is quite a dance to avoid talking about financial investment  lessening free time  importance inflation  publi… https://t.co/EiK1Bf0rQ4,0
Mon Jul 23 12:16:23 +0000 2018,As the Data Show  Higher Corporate Profits Mean Higher Investment (not) https://t.co/2gryuVAUMh https://t.co/WswNwRJBxu,295
Mon Jul 23 12:10:05 +0000 2018,Top 5 private investment destinations for #infrastructure in 2017?  - China 🇨🇳 - Indonesia 🇮🇩 - Mexico 🇲🇽 - Brazil… https://t.co/TkZqjpchBG,1120
Mon Jul 23 12:06:21 +0000 2018,Single-Family Offices Are On The Search For Internal Investment Talent https://t.co/fVh6DRX87P,0
Mon Jul 23 12:04:16 +0000 2018,This morning I met with Japanese DPM Taro Aso to discuss trade  investment and economic growth. https://t.co/xDDRblpwdL,75
Mon Jul 23 11:58:00 +0000 2018,Even a small U.S. investment in international #conservation goes a long way toward bolstering our country’s safety… https://t.co/Cf4E9khgnG,1
Mon Jul 23 11:52:20 +0000 2018,Good news!  Since the 2015 Paris Climate Agreement  #Bangladesh  #India  &amp; #Nepal have collectively added enough… https://t.co/tEOFWCy38l,48
Mon Jul 23 11:38:03 +0000 2018,Hosted a roundtable with U.S. companies in #Brazil to discuss investment  trade and other key economic issues. https://t.co/edXYZKscGB,62
Mon Jul 23 11:37:52 +0000 2018,Today I visited @itau and heard from many important Brazilian business leaders about investment and trade. https://t.co/NeCSuv0ws3,40
Mon Jul 23 11:37:12 +0000 2018,Enjoyed meeting with South African Finance Minister  Nhlanhla Nene. We discussed economic growth and investment. https://t.co/fy18Khldos,41
Mon Jul 23 11:36:10 +0000 2018,This morning I met with Japanese DPM Taro Aso to discuss trade  investment and economic growth. https://t.co/xDDRblpwdL,75
Mon Jul 23 11:30:45 +0000 2018,Unfortunately  I learned that unless you purchase investment grade diamonds  your jewels aren’t going to be worth m… https://t.co/oqKHWGvFFd,0
Mon Jul 23 11:30:42 +0000 2018,Cut federal investment in energy efficiency? That's what the US House has proposed. But the Senate's plan has no cu… https://t.co/Pb5D5T49ys,4
Mon Jul 23 11:30:18 +0000 2018,Do you have a #moai - a circle of people who support  uplift  inspire  encourage and console you as you pursue your… https://t.co/RUL0KOLnX5,0
Mon Jul 23 11:25:00 +0000 2018,We fully support the ARG @g20org Presidency priorities on the future of work. I am optimistic that we can harness t… https://t.co/lAQodBymc6,78
Mon Jul 23 11:23:24 +0000 2018,Today  @StateDept released its Investment Climate Statements for 2018. Economic officers at U.S. embassies &amp; missio… https://t.co/ED6iaQNHHx,124
Mon Jul 23 11:18:17 +0000 2018,Cuba moves toward striking changes to officially recognize private property  foreign investment https://t.co/RdJ0GQXksH,116
Mon Jul 23 11:11:52 +0000 2018,Here is your Monday morning newsletter  D.C. https://t.co/NU1Q93Tpq6,0
Mon Jul 23 11:11:01 +0000 2018,The wave of teacher walkouts this spring made it clear that educators don’t get paid appropriately for the job they… https://t.co/A0wrVbtcsI,26
Mon Jul 23 11:03:12 +0000 2018,@GemMarketSpace     A 21st century investment in yourself in future! I highly recommend this project,0
Mon Jul 23 11:02:33 +0000 2018,Q: What steps can you take to protect your investment accounts from a cyber-attack or identity theft?   A: https://t.co/EdabTr3cv0,11
Mon Jul 23 10:59:30 +0000 2018,This morning I met with Japanese DPM Taro Aso to discuss trade  investment and economic growth. https://t.co/xDDRblpwdL,75
Mon Jul 23 10:54:37 +0000 2018,@UMCcoinOfficial  #marketing #umc #umccoin    Look for investment - this company can be recommended  this company I want to recommend!,0
Mon Jul 23 10:54:05 +0000 2018,Is the renovation you are thinking about worth the investment?  Find out.  #AVA #AlexandriaLiving… https://t.co/gWfxkWGxRj,0
Mon Jul 23 10:53:52 +0000 2018,#EnergyEfficiency investment in 2017 rose to $236 billion! And this massive global energy efficiency investment acr… https://t.co/R4sGZ49kmH,6
Mon Jul 23 10:46:20 +0000 2018,@invishandle @TheVariableMan @realDonaldTrump @POTUS Then it would be a smart move-economically and security point… https://t.co/lpUGGJqAub,0
Mon Jul 23 10:38:07 +0000 2018,@apollochain #SolarEnergy #apollochain #NewEnergy  Each of us wants to earn  but does not know how!? Investment in… https://t.co/U04rx3LdRe,0
Mon Jul 23 10:37:00 +0000 2018,We fully support the ARG @g20org Presidency priorities on the future of work. I am optimistic that we can harness t… https://t.co/lAQodBymc6,78
Mon Jul 23 10:31:04 +0000 2018,"Foreign investment in aerospace  construction &amp; other sectors is at a record high. And traditional Portuguese indu… https://t.co/R1hwt0Rh3q,0
Mon Jul 23 10:24:40 +0000 2018,#DYK? 2017 was the most expensive year on record for damage from climate and weather disasters  with cumulative cos… https://t.co/Sw2ObF01GE,13
Mon Jul 23 10:23:08 +0000 2018,"@ShakyStu: @realDonaldTrump @ayrshirepost @TrumpTurnberry Nice move! Worth while investment. Can't wait to see how well it's finished!",12
Mon Jul 23 10:20:15 +0000 2018,"@ShakyStu: @realDonaldTrump @ayrshirepost @TrumpTurnberry Nice move! Worth while investment. Can't wait to see how well it's finished!",12
Mon Jul 23 10:20:01 +0000 2018,"@ShakyStu: @realDonaldTrump @ayrshirepost @TrumpTurnberry Nice move! Worth while investment. Can't wait to see how well it's finished!",12
Mon Jul 23 10:11:16 +0000 2018,New report identifies barriers and solutions to achieving #renewableenergy ⚡♻ targets in Côte d’Ivoire. Read it now… https://t.co/dPCknqfBrf,6
Mon Jul 23 10:05:04 +0000 2018,Leadership comes from investment in one’s personal resources and relationships to build a foundation of trust among… https://t.co/fmt1h8vP06,10
Mon Jul 23 10:02:51 +0000 2018,@attransparency Yes Moreno is traveling with a team of top level ministers looking to secure investment and busines… https://t.co/zahkH2f7Wb,3
Mon Jul 23 10:02:40 +0000 2018,Saudi Arabia plans to put $18 billion into new sovereign wealth investment funds to attract foreign firms as monarc… https://t.co/UCLOGKEScz,1
Mon Jul 23 09:57:20 +0000 2018,“If they can’t create an environment that is welcoming to foreign investment and supports it through a rules-based… https://t.co/PWZnnO9lBu,13
Mon Jul 23 09:54:45 +0000 2018,We fully support the ARG @g20org Presidency priorities on the future of work. I am optimistic that we can harness t… https://t.co/lAQodBymc6,78
Mon Jul 23 09:39:15 +0000 2018,New report identifies barriers and solutions to achieving #renewableenergy ⚡♻ targets in Côte d’Ivoire. Read it now… https://t.co/dPCknqfBrf,6
Mon Jul 23 09:28:17 +0000 2018,We fully support the ARG @g20org Presidency priorities on the future of work. I am optimistic that we can harness t… https://t.co/lAQodBymc6,78
Mon Jul 23 09:21:19 +0000 2018,"Summer is the most unequal time in America. We pour enormous amounts of resources in children learning but much of… https://t.co/ImrNaS1Jhe,7
Mon Jul 23 09:15:46 +0000 2018,Top 5 private investment destinations for #infrastructure in 2017?  - China 🇨🇳 - Indonesia 🇮🇩 - Mexico 🇲🇽 - Brazil… https://t.co/TkZqjpchBG,1120
Mon Jul 23 08:55:58 +0000 2018,@papacass84 There are abundant uses for US steel though. What if we used it to improve US infrastructure? Or if we… https://t.co/8P2u82PX7l,0
Mon Jul 23 08:32:17 +0000 2018,Chilled camel milk  anyone? ⁦@mercycorps⁩ leveraged $6.5m in private investment w/ a $1.5m stake in 1st camel milk… https://t.co/N7yYWZujum,14
Mon Jul 23 08:30:22 +0000 2018,This morning I met with Japanese DPM Taro Aso to discuss trade  investment and economic growth. https://t.co/xDDRblpwdL,75
Mon Jul 23 08:17:04 +0000 2018,Access to credit and investment in infrastructure can form a springboard for innovation across Africa. As more citi… https://t.co/ekpMZ4iCo0,73
Mon Jul 23 08:09:50 +0000 2018,Chinese foreign-direct investment into the U.S. fell into negative territory during the first five months of the ye… https://t.co/ti7t1UoGlb,3
Mon Jul 23 08:08:53 +0000 2018,Chinese foreign-direct investment into the U.S. fell into negative territory during the first five months of the ye… https://t.co/ti7t1UoGlb,3
Mon Jul 23 08:06:13 +0000 2018,Chinese foreign-direct investment into the U.S. fell into negative territory during the first five months of the ye… https://t.co/ti7t1UoGlb,3
Mon Jul 23 08:05:54 +0000 2018,Chinese foreign-direct investment into the U.S. fell into negative territory during the first five months of the ye… https://t.co/ti7t1UoGlb,3
Mon Jul 23 08:00:46 +0000 2018,Telegraph Income 10: the definitive list of our favourite income-producing investment funds  https://t.co/J4YJFrJhKt,0
Mon Jul 23 07:38:13 +0000 2018,Today  @StateDept releases the 2018 Investment Climate Statements. These reports analyze the conditions of over 170… https://t.co/XB6nYkVcjg,10
Mon Jul 23 07:37:16 +0000 2018,Today  @StateDept releases the 2018 Investment Climate Statements. These reports analyze the conditions of over 170… https://t.co/XB6nYkVcjg,10
Mon Jul 23 07:34:31 +0000 2018,"If ties between the West and Iran cannot be maintained and deepened  investment from Russia and China will no doub… https://t.co/2PkW17i0vk,4
Mon Jul 23 07:33:38 +0000 2018,@RANDCorporation "Chinese businesses are therefore likely to lose less overall than American businesses" maybe ther… https://t.co/aooRqoiuBF,0
Mon Jul 23 07:26:27 +0000 2018,In 2016  private sources contributed 90%+ of investment in #renewableenergy? This &amp; more in @WBG_PPP’s NEW RESEARCH… https://t.co/UQG9vIQuSE,24
Mon Jul 23 07:20:12 +0000 2018,Read how #renewableenergy goals translate into huge opportunity for the private sector in Côte d’Ivoire 🇨🇮… https://t.co/nQZYSNaiV6,14
Mon Jul 23 07:14:48 +0000 2018,China targets U.S. tech startups in investment loophole https://t.co/LTLBDTyL5m,5
Mon Jul 23 07:08:07 +0000 2018,“If they can’t create an environment that is welcoming to foreign investment and supports it through a rules-based… https://t.co/PWZnnO9lBu,13
Mon Jul 23 07:07:14 +0000 2018,Bitcoin Trading And Investment Company Ever! GROW YOUR BITCOIN WITH BTC RACE Please Visit on:… https://t.co/l2OeWcMTId,0
Mon Jul 23 07:06:43 +0000 2018,BTC Race is the first global bitcoin trading contract platform for individuals and businessman. We are doing pumpin… https://t.co/d6giGya3hD,1
Mon Jul 23 07:06:10 +0000 2018,Here you can earn 2% to 3% daily return according to your investment. Please Visit on: https://t.co/Ut2Gk8uDmU… https://t.co/Dao5ZxHCaj,0
Mon Jul 23 07:05:44 +0000 2018,BTC Race is the first global bitcoin trading contract platform for individuals and businessman. We are doing pumpin… https://t.co/d6giGya3hD,1
Mon Jul 23 07:04:32 +0000 2018,❇BTC RACE❇ https://t.co/r3jDQKju3J 💐 💐 Blasting Opportunity Paying Last One Year - Trading on Digital currencies &amp;… https://t.co/dBjg32YHek,0
Mon Jul 23 06:56:52 +0000 2018,This is decades old practice of #PPP It doesn’t even allow opposition candidates’ polling agents inside polling sta… https://t.co/Bo1ZJETxnP,80
Mon Jul 23 06:54:13 +0000 2018,Red  blue  orange: dyes are an integral part of the textile industry. Concerns about the environmental and health i… https://t.co/FLlCw30FU0,11
Mon Jul 23 06:52:35 +0000 2018,Red  blue  orange: dyes are an integral part of the textile industry. Concerns about the environmental and health i… https://t.co/FLlCw30FU0,11
Mon Jul 23 06:34:03 +0000 2018,RT @Rob_Harris_IoT: #Fintech adoption rates from around the globe.  #finance #digital #online #money #economy… https://t.co/B9tJK3RLR2,2
Mon Jul 23 06:18:21 +0000 2018,Read how #renewableenergy goals translate into huge opportunity for the private sector in Côte d’Ivoire 🇨🇮… https://t.co/nQZYSNaiV6,14
Mon Jul 23 06:18:06 +0000 2018,The decision to not make a decision is cowardly when dealing with someone operating in such obvious bad faith  and… https://t.co/3mvh4ux2ZR,0
Mon Jul 23 06:08:10 +0000 2018,This is decades old practice of #PPP It doesn’t even allow opposition candidates’ polling agents inside polling sta… https://t.co/Bo1ZJETxnP,80
Mon Jul 23 06:02:28 +0000 2018,We fully support the ARG @g20org Presidency priorities on the future of work. I am optimistic that we can harness t… https://t.co/lAQodBymc6,78
Mon Jul 23 06:01:08 +0000 2018,Big Tobacco Makes Its First Investment in the Marijuana Industry https://t.co/kPVyj46uC2,0
Mon Jul 23 05:51:54 +0000 2018,RT @Rob_Harris_IoT: #Fintech adoption rates from around the globe.  #finance #digital #online #money #economy… https://t.co/B9tJK3RLR2,2
Mon Jul 23 05:50:34 +0000 2018,Today  @StateDept released its Investment Climate Statements for 2018. Economic officers at U.S. embassies &amp; missio… https://t.co/ED6iaQNHHx,124
Mon Jul 23 05:47:00 +0000 2018,Ask yourself whether an investment in education will land you a better job in the future. https://t.co/oS7mGLGKwY https://t.co/Pe0OSn5oUg,1
Mon Jul 23 05:44:19 +0000 2018,#Fintech adoption rates from around the globe.  #finance #digital #online #money #economy #economics #investing… https://t.co/Qh9gIKDq0m,1
Mon Jul 23 05:34:44 +0000 2018,excellent investment https://t.co/mSY7WP4Twd,2
Mon Jul 23 05:30:32 +0000 2018,Headphones are a great investment. I got a pair of Audio Technica ATH M50x's. Next paycheck I'm getting an external dac.,0
Mon Jul 23 05:30:20 +0000 2018,The world has spent only $55 billion on conserving biodiversity  less than what has been spent on ice cream.… https://t.co/FM5rTH6w42,24
Mon Jul 23 05:29:35 +0000 2018,.@opicgov is committed to enhancing connectivity in Africa. Through the #OPICConnectAfrica investment iniative  OPI… https://t.co/UGXjCuFi69,4
Mon Jul 23 05:24:25 +0000 2018,Yes  #CoffeeWithACop happens at the @Starbucks in #Ferguson  https://t.co/24E4WJmS5I https://t.co/urjh4UvGoo,1
Mon Jul 23 05:21:26 +0000 2018,@spokanetom That seems to be very true  but investment would enlarge their economies and in turn grow their markets… https://t.co/lm23KbAgOe,0
Mon Jul 23 05:15:43 +0000 2018,$670 billion.  That's the amount of money #India needs to invest in #ElectricVehicles 🚗 to meet the country’s targe… https://t.co/obzS8Nn9xt,55
Mon Jul 23 05:14:45 +0000 2018,.@opicgov is committed to enhancing connectivity in Africa. Through the #OPICConnectAfrica investment iniative  OPI… https://t.co/UGXjCuFi69,4
Mon Jul 23 05:12:54 +0000 2018,“If they can’t create an environment that is welcoming to foreign investment and supports it through a rules-based… https://t.co/PWZnnO9lBu,13
Mon Jul 23 05:11:13 +0000 2018,“If they can’t create an environment that is welcoming to foreign investment and supports it through a rules-based… https://t.co/PWZnnO9lBu,13
Mon Jul 23 05:08:07 +0000 2018,A new @pewresearch study found the majority of Americans support science research. Nearly 80% say federal funding f… https://t.co/tvBFTfcy6N,14
Mon Jul 23 04:52:00 +0000 2018,#Fintech adoption rates from around the globe.  #finance #digital #online #money #economy #economics #investing… https://t.co/Qh9gIKDq0m,1
Mon Jul 23 04:50:22 +0000 2018,We fully support the ARG @g20org Presidency priorities on the future of work. I am optimistic that we can harness t… https://t.co/lAQodBymc6,78
Mon Jul 23 04:49:06 +0000 2018,Consulting News ~ Investment consulting arrangements under scrutiny https://t.co/eGCUoM2cME,0
Mon Jul 23 04:48:17 +0000 2018,Consulting News ~ Black Creek Investment Management Lowered Holding in Fti Consulting (FCN) by $16.97 Million … https://t.co/K4IAN7b4wj,0
Mon Jul 23 04:48:16 +0000 2018,“Official figures reviewed by the Journal show that Chinese-backed power plants were promised annual returns on inv… https://t.co/fiOX3nE1yU,15
Mon Jul 23 04:46:29 +0000 2018,This is decades old practice of #PPP It doesn’t even allow opposition candidates’ polling agents inside polling sta… https://t.co/Bo1ZJETxnP,80
Mon Jul 23 04:27:42 +0000 2018,We fully support the ARG @g20org Presidency priorities on the future of work. I am optimistic that we can harness t… https://t.co/lAQodBymc6,78
Mon Jul 23 04:19:00 +0000 2018,Read how #renewableenergy goals translate into huge opportunity for the private sector in Côte d’Ivoire 🇨🇮… https://t.co/nQZYSNaiV6,14
Mon Jul 23 03:59:33 +0000 2018,We fully support the ARG @g20org Presidency priorities on the future of work. I am optimistic that we can harness t… https://t.co/lAQodBymc6,78
Mon Jul 23 03:57:09 +0000 2018,excellent investment https://t.co/mSY7WP4Twd,2
Mon Jul 23 03:56:53 +0000 2018,excellent investment https://t.co/mSY7WP4Twd,2
Mon Jul 23 03:56:16 +0000 2018,We fully support the ARG @g20org Presidency priorities on the future of work. I am optimistic that we can harness t… https://t.co/lAQodBymc6,78
Mon Jul 23 03:51:33 +0000 2018,@mikethomas361 @tyillc I respect that opinion but have a hard time agreeing given that the US has not really tested… https://t.co/XQWLDviZuG,0
Mon Jul 23 03:48:33 +0000 2018,We fully support the ARG @g20org Presidency priorities on the future of work. I am optimistic that we can harness t… https://t.co/lAQodBymc6,78
Mon Jul 23 03:45:04 +0000 2018,Congratulations to the Goodwill Excel Center Adult Public Charter School Class of 2018! Thank you @SunTrust for you… https://t.co/oic2zgGpWq,5
Mon Jul 23 03:36:18 +0000 2018,This is decades old practice of #PPP It doesn’t even allow opposition candidates’ polling agents inside polling sta… https://t.co/Bo1ZJETxnP,80
Mon Jul 23 03:30:38 +0000 2018,"Low-income communities  minority populations  &amp; rural towns disproportionately deal with barriers to safe water."… https://t.co/eyj8Cxpqe6,11
Mon Jul 23 03:28:12 +0000 2018,@swatieyz Nah. But capital appreciated after mid-crisis investment. Paid dividends!,0
Mon Jul 23 03:26:31 +0000 2018,@socalmike_SD this isn’t based on valuation - it’s based on liquidity  also while we’re getting into the nitty-grit… https://t.co/HozZ0nYQio,0
Mon Jul 23 03:24:06 +0000 2018,This morning I met with Japanese DPM Taro Aso to discuss trade  investment and economic growth. https://t.co/xDDRblpwdL,75
Mon Jul 23 03:19:28 +0000 2018,Take a moment and read @SavetheChildren trustee Jennifer Garner share why investing in kids through high-quality… https://t.co/E98WTWD7on,15
Mon Jul 23 03:11:44 +0000 2018,This is decades old practice of #PPP It doesn’t even allow opposition candidates’ polling agents inside polling sta… https://t.co/Bo1ZJETxnP,80
