Mon Jul 23 23:14:35 +0000 2018,Did you know the World Bank Group is supporting 22 investment plans for climate-smart agriculture in 20 countries?… https://t.co/qFUjsSo7sc,2
Mon Jul 23 23:14:05 +0000 2018,Yes there are majority-black places with black median incomes are higher than the national average. I received more… https://t.co/5t9GQpWMMg,0
Mon Jul 23 23:08:03 +0000 2018,#Cuba's new constitution shows that change is coming to the island  just not rapidly or dramatically  WOLA's Geoff… https://t.co/nsNVMqaMCH,2
Mon Jul 23 23:05:38 +0000 2018,This is decades old practice of #PPP It doesn’t even allow opposition candidates’ polling agents inside polling sta… https://t.co/Bo1ZJETxnP,80
Mon Jul 23 23:03:40 +0000 2018,A group of investors from the United States will visit Egypt in October after Minister Nasr @MIICEgypt “reviewed th… https://t.co/aC8DGVWElu,3
Mon Jul 23 23:03:38 +0000 2018,@PenguinGreed69_  Heavy Borrowing From United States  Japanese Wealth  Corporations  Banks  Gov’t  2x 2013 USA Spen… https://t.co/KzXxv1yLUc,0
Mon Jul 23 23:03:32 +0000 2018,A group of investors from the United States will visit Egypt in October after Minister Nasr @MIICEgypt “reviewed th… https://t.co/aC8DGVWElu,3
Mon Jul 23 23:03:08 +0000 2018,Net inward investment into the US by multinational corporations—both foreign and American—has fallen almost to zero… https://t.co/4Ngy9rUPfo,56
Mon Jul 23 23:03:05 +0000 2018,Did you know the World Bank Group is supporting 22 investment plans for climate-smart agriculture in 20 countries?… https://t.co/qFUjsSo7sc,2
Mon Jul 23 23:02:22 +0000 2018,#Cuba's new constitution shows that change is coming to the island  just not rapidly or dramatically  WOLA's Geoff… https://t.co/nsNVMqaMCH,2
Mon Jul 23 23:00:58 +0000 2018,Did you know the World Bank Group is supporting 22 investment plans for climate-smart agriculture in 20 countries?… https://t.co/qFUjsSo7sc,2
Mon Jul 23 23:00:26 +0000 2018,#Cuba's new constitution shows that change is coming to the island  just not rapidly or dramatically  WOLA's Geoff… https://t.co/nsNVMqaMCH,2
Mon Jul 23 23:00:01 +0000 2018,California-based Hyperloop Transportation Tech. will help build a 10-km hyperloop in Guizhou Province  which has be… https://t.co/eAUkXjYaBa,0
Mon Jul 23 22:55:01 +0000 2018,China and LAC "must confront the legacy of past deals gone wrong and attempt to move beyond commodity-based trade … https://t.co/8QJVJJiFKc,5
Mon Jul 23 22:54:53 +0000 2018,United States and New Zealand Meet Under Trade and Investment Framework Agreement https://t.co/xBfQBftTRt https://t.co/pD63z2afTZ,10
Mon Jul 23 22:54:53 +0000 2018,The more than 8 000 Toyota team members at our Georgetown  Kentucky plant manufactured more than 550 000 vehicles i… https://t.co/omJwbMb923,5
Mon Jul 23 22:49:55 +0000 2018,@jeff_karr @scottlincicome It was this low in the years right after the financial crisis  when outlook was bleeker … https://t.co/oD1F2C3Ffj,0
Mon Jul 23 22:45:38 +0000 2018,The “Motor City” lives and dies by the automobile  and for decades it was on the decline. But recent Chinese invest… https://t.co/kZzp65wR0c,3
Mon Jul 23 22:44:13 +0000 2018,@tlq1958 @Comey If your own advisors tell you that every dollar in infrastructure spending can generate $3 and you… https://t.co/NW72VLrT6B,0
Mon Jul 23 22:35:05 +0000 2018,Read about the Majd Initiative  which aims to facilitate access to archaeological sites in Jordan  improve transpor… https://t.co/Y1Dp0yPAmi,0
Mon Jul 23 22:32:17 +0000 2018,My cousin @jakeleffew wrote a pretty great in-depth piece about urban investment and gentrification for the… https://t.co/4ipoh7Dd6Q,0
Mon Jul 23 22:22:57 +0000 2018,Yes  a corporate rate cut doesn't provide any reason for companies to just give money to workers.  Instead it provi… https://t.co/ZWRKRZzQsA,7
Mon Jul 23 22:19:52 +0000 2018,@DiracWinsAgain @Noahpinion @ebarcuzzi ok  assume monthly payment is same &amp; no move: at the end of 30 yrs  a renter… https://t.co/8u8hSeSB8u,0
Mon Jul 23 22:17:56 +0000 2018,.@Transport Chairman Bill Shuster releases infrastructure plan; includes highway trust fund solvency  infrastructur… https://t.co/AnKAGpNpDt,1
Mon Jul 23 22:17:43 +0000 2018,.@Transport Chairman Bill Shuster releases infrastructure plan; includes highway trust fund solvency  infrastructur… https://t.co/AnKAGpNpDt,1
Mon Jul 23 22:16:06 +0000 2018,Peter Thiel on Herd Behavior  Investment  and Trump https://t.co/H1mZLxjtHj,0
Mon Jul 23 22:13:15 +0000 2018,Yes  a corporate rate cut doesn't provide any reason for companies to just give money to workers.  Instead it provi… https://t.co/ZWRKRZzQsA,7
Mon Jul 23 22:12:54 +0000 2018,Net inward investment into the US by multinational corporations—both foreign and American—has fallen almost to zero… https://t.co/4Ngy9rUPfo,56
Mon Jul 23 22:09:46 +0000 2018,Cracking down on tax havens might be a bad idea:  "Exposed firms respond by reducing global investment and shifting… https://t.co/9DLEz6XdOE,1
Mon Jul 23 22:06:07 +0000 2018,A group of investors from the United States will visit Egypt in October after Minister Nasr @MIICEgypt “reviewed th… https://t.co/aC8DGVWElu,3
Mon Jul 23 22:01:22 +0000 2018,To everyone who I told the over/under on this Wilkie vote would be 2.5 "no" votes ...  This is a good time to remem… https://t.co/c91n8zYmfZ,1
Mon Jul 23 22:00:56 +0000 2018,"Official figures reviewed by the Journal show that Chinese-backed power plants were promised annual returns on inv… https://t.co/dkyCUH0FYn,2
Mon Jul 23 22:00:22 +0000 2018,Honda awaits go-ahead for EV investment perks https://t.co/aOjXOhexwM,0
Mon Jul 23 22:00:18 +0000 2018,What the Data is Telling us on EB-5 in South Korea and Vietnam: https://t.co/wvo4RuQy7n https://t.co/imFNv64qas,2
Mon Jul 23 21:58:21 +0000 2018,The @QualityJobsFund is a $100M investment in quality job creation. Learn more at https://t.co/q7BsZ5rQhU.… https://t.co/rhJ03i3juP,1
Mon Jul 23 21:56:22 +0000 2018,How Trump Is Repelling Foreign Investment - My update on the fast approaching post-American World Economy in Foreig… https://t.co/vRosM3DhRd,5
Mon Jul 23 21:55:54 +0000 2018,To everyone who I told the over/under on this Wilkie vote would be 2.5 "no" votes ...  This is a good time to remem… https://t.co/c91n8zYmfZ,1
Mon Jul 23 21:52:44 +0000 2018,Implementing a #fiduciary standard for investment advice must be a political decision. If Democrats take over the H… https://t.co/rzHxLmuWTI,0
Mon Jul 23 21:51:59 +0000 2018,What do the Trump tax cuts have to show for after six months? Investment below 2015 levels and declining real wages… https://t.co/81fyjkTWXG,0
Mon Jul 23 21:50:33 +0000 2018,The 2018 Investment Climate Statements from @StateDept show our country’s dedication to growing U.S. businesses and… https://t.co/5DrdzkPPof,9
Mon Jul 23 21:47:35 +0000 2018,The Wokini Iniative: A Strategic Investment to Better Serve the Dakota &amp; Lakota Residents of South Dakota was share… https://t.co/IZpN2ZT7vP,0
Mon Jul 23 21:45:00 +0000 2018,Net investment by multinationals in U.S. 'fallen almost to zero ' hurting growth. More here from @tradereporter: https://t.co/gkxHBCpQ3d,1
Mon Jul 23 21:39:59 +0000 2018,#Earlyed paves the way toward success. As a nation  we should follow the lead of Chicago and other cities that are… https://t.co/HomqWw3lDF,0
Mon Jul 23 21:34:05 +0000 2018,Peter Thiel on Herd Behavior  Investment  and Trump https://t.co/EQ48Jak0eU,0
Mon Jul 23 21:31:40 +0000 2018,How Urban Investment Patterns Fuel Healthcare Inequities via @planetizen &amp; @bcnuej https://t.co/o8ZHst7LSn,1
Mon Jul 23 21:31:12 +0000 2018,Cracking down on tax havens might be a bad idea:  "Exposed firms respond by reducing global investment and shifting… https://t.co/9DLEz6XdOE,1
Mon Jul 23 21:30:07 +0000 2018,How Urban Investment Patterns Fuel Healthcare Inequities via @planetizen &amp; @bcnuej https://t.co/o8ZHst7LSn,1
Mon Jul 23 21:27:03 +0000 2018,The @QualityJobsFund is a $100M investment in quality job creation. Learn more at https://t.co/q7BsZ5rQhU.… https://t.co/rhJ03i3juP,1
Mon Jul 23 21:25:54 +0000 2018,Cattle scene in Kingman. Talked to some locals who told me about a few other murals in this small town. Loving your… https://t.co/7vNW8kSKgT,0
Mon Jul 23 21:21:15 +0000 2018,Net inward investment into the US by multinational corporations—both foreign and American—has fallen almost to zero… https://t.co/4Ngy9rUPfo,56
Mon Jul 23 21:19:12 +0000 2018,Net inward investment into the US by multinational corporations—both foreign and American—has fallen almost to zero… https://t.co/4Ngy9rUPfo,56
Mon Jul 23 21:19:04 +0000 2018,Virtu Financial Cut Its Lockheed Martin (LMT) Position as Valuation Declined; United Parcel ... https://t.co/mUztorsd8C,0
Mon Jul 23 21:14:11 +0000 2018,Net inward investment into the US by multinational corporations—both foreign and American—has fallen almost to zero… https://t.co/4Ngy9rUPfo,56
Mon Jul 23 21:11:22 +0000 2018,Today  @StateDept released its Investment Climate Statements for 2018. Economic officers at U.S. embassies &amp; missio… https://t.co/ED6iaQNHHx,124
Mon Jul 23 21:11:03 +0000 2018,The in-depth expertise that specialized consultants provide is a valuable investment for your firm. To get the best… https://t.co/rTm6SKgah3,0
Mon Jul 23 21:09:42 +0000 2018,Google nearly doubles spending on capital projects as it continues major cloud investment https://t.co/oxilcWY2mt https://t.co/bXWPwCvGYn,0
Mon Jul 23 21:04:49 +0000 2018,New carbon tax / infrastructure investment legislation introduced by GOP @RepCurbelo https://t.co/mgAv2eNOcy,1
Mon Jul 23 21:03:20 +0000 2018,New carbon tax / infrastructure investment legislation introduced by GOP @RepCurbelo https://t.co/mgAv2eNOcy,1
Mon Jul 23 21:00:01 +0000 2018,Argentina is also opening up its skies to low-cost airlines to help boost the travel market -Yet the economy is str… https://t.co/FbAVqKc5RJ,0
Mon Jul 23 20:53:04 +0000 2018,Imposing 25% tariffs on the parts imported by DAA  which are then used to assemble the finished goods in the United… https://t.co/MwxDJGzQSV,0
Mon Jul 23 20:50:26 +0000 2018,@FrankDelfinPupo @PMPAnalogyKing @ezraklein Ezra tried to say/imply the admin. Lied about tax cut&amp;jobs act. They di… https://t.co/jAmou1g8xk,0
Mon Jul 23 20:49:44 +0000 2018,Top 5 private investment destinations for #infrastructure in 2017?  - China 🇨🇳 - Indonesia 🇮🇩 - Mexico 🇲🇽 - Brazil… https://t.co/TkZqjpchBG,1120
Mon Jul 23 20:47:00 +0000 2018,What if all of #philanthropy channeled more of its substantial investment gains into deepening support for… https://t.co/RhGC8HIlRj,0
Mon Jul 23 20:45:16 +0000 2018,@SadFndngFathers Where we do have closer comparisons (expanding bonus depreciation)  there is evidence of a positiv… https://t.co/NoTH6Gty5Z,0
Mon Jul 23 20:36:01 +0000 2018,Yes  a corporate rate cut doesn't provide any reason for companies to just give money to workers.  Instead it provi… https://t.co/ZWRKRZzQsA,7
Mon Jul 23 20:35:18 +0000 2018,@tschumacher04 also: the notion of public v. private goods  heterogeneity in returns to investment...,0
Mon Jul 23 20:34:30 +0000 2018,#Cuba's new constitution paves the way to gay marriage  a huge leap forward. But it's also clear that the governmen… https://t.co/fPPssghYvF,1
Mon Jul 23 20:34:19 +0000 2018,How Trump Is Repelling Foreign Investment - My update on the fast approaching post-American World Economy in Foreig… https://t.co/vRosM3DhRd,5
Mon Jul 23 20:33:30 +0000 2018,In April  I was with @RepAndreCarson in Indianapolis where we heard from the city’s Director of Public Works. It co… https://t.co/JnIcGjXD28,3
Mon Jul 23 20:33:28 +0000 2018,Ahhh so smart. @jenloving23 talking about using @Cisco awesome investment in locking up properties for then their b… https://t.co/ur2LxNHdTx,0
Mon Jul 23 20:28:43 +0000 2018,CEED Business Envoy in Chicago day 2 began w/ the amazing @riverbed meeting Kevin Drost  CSO. Later on we met inves… https://t.co/sibtPhj1LR,6
Mon Jul 23 20:28:40 +0000 2018,The “Motor City” lives and dies by the automobile  and for decades it was on the decline. But recent Chinese invest… https://t.co/kZzp65wR0c,3
Mon Jul 23 20:26:28 +0000 2018,The “Motor City” lives and dies by the automobile  and for decades it was on the decline. But recent Chinese invest… https://t.co/kZzp65wR0c,3
Mon Jul 23 20:23:31 +0000 2018,Last day to register to learn about 3 TOD investment opportunities in Cleveland!   https://t.co/4egWeDdXlC,0
Mon Jul 23 20:21:28 +0000 2018,The “Motor City” lives and dies by the automobile  and for decades it was on the decline. But recent Chinese invest… https://t.co/kZzp65wR0c,3
Mon Jul 23 20:17:38 +0000 2018,An increased duty on these products from China will impact our sales growth  undermine our ability to create a prof… https://t.co/edtkExNi12,0
Mon Jul 23 20:16:16 +0000 2018,Q: What steps can you take to protect your investment accounts from a cyber-attack or identity theft?   A: https://t.co/EdabTr3cv0,11
Mon Jul 23 20:10:44 +0000 2018,Since 2010  over 61% of all China’s construction contracts in Latin America and the Caribbean went to energy. https://t.co/qMjMt9XWBc,3
Mon Jul 23 20:09:57 +0000 2018,"Official figures reviewed by the Journal show that Chinese-backed power plants were promised annual returns on inv… https://t.co/dkyCUH0FYn,2
Mon Jul 23 20:07:24 +0000 2018,Since 2010  over 61% of all China’s construction contracts in Latin America and the Caribbean went to energy. https://t.co/qMjMt9XWBc,3
Mon Jul 23 20:05:08 +0000 2018,#Cuba's new constitution paves the way to gay marriage  a huge leap forward. But it's also clear that the governmen… https://t.co/fPPssghYvF,1
Mon Jul 23 20:04:15 +0000 2018,"Official figures reviewed by the Journal show that Chinese-backed power plants were promised annual returns on inv… https://t.co/dkyCUH0FYn,2
Mon Jul 23 20:04:14 +0000 2018,Yes  a corporate rate cut doesn't provide any reason for companies to just give money to workers.  Instead it provi… https://t.co/ZWRKRZzQsA,7
Mon Jul 23 20:03:01 +0000 2018,Q: What steps can you take to protect your investment accounts from a cyber-attack or identity theft?   A: https://t.co/EdabTr3cv0,11
Mon Jul 23 20:02:47 +0000 2018,@FrankDelfinPupo @PMPAnalogyKing @ezraklein LMAO u can't read anything but a fake news headline from LA Times. Read… https://t.co/S0lJ3rypWm,0
Mon Jul 23 20:01:54 +0000 2018,Take a moment and read @SavetheChildren trustee Jennifer Garner share why investing in kids through high-quality… https://t.co/E98WTWD7on,15
Mon Jul 23 20:01:01 +0000 2018,In the midst of conversations on border control and foreign aid  @USGLC president @LizSchrayer suggests that invest… https://t.co/d2HYX60nYk,1
Mon Jul 23 20:00:53 +0000 2018,Is Iowa's Investment in Pre-K Education Worthwhile? by @shanevanderhart via @CaffThoughts #preschool… https://t.co/5X71vLsALw,1
Mon Jul 23 20:00:35 +0000 2018,Is Iowa's Investment in Pre-K Education Worthwhile? by @shanevanderhart via @CaffThoughts #preschool… https://t.co/5X71vLsALw,1
Mon Jul 23 20:00:20 +0000 2018,During an @opicgov trip to promote investment in Africa  OPIC VP &amp; General Counsel Will Doffermyre visits Nairobi N… https://t.co/7mM0FSPEg8,0
Mon Jul 23 19:58:42 +0000 2018,Wondering if your emerging brand is ready for investors? FMI Emerge Mentor Elliot Begoun shares what he considers t… https://t.co/uOZCoVbD2G,0
Mon Jul 23 19:57:54 +0000 2018,Yes  a corporate rate cut doesn't provide any reason for companies to just give money to workers.  Instead it provi… https://t.co/ZWRKRZzQsA,7
Mon Jul 23 19:56:46 +0000 2018,Saudi Arabia seeks to revive foreign investment: https://t.co/hpPtJ2c0YT,0
Mon Jul 23 19:56:44 +0000 2018,Yes  a corporate rate cut doesn't provide any reason for companies to just give money to workers.  Instead it provi… https://t.co/ZWRKRZzQsA,7
Mon Jul 23 19:56:36 +0000 2018,1-Year Dividend Growth of 72.84!  Read about my latest  Dividend Growth Stock Buy:   Delta Airlines  Inc. (DAL)… https://t.co/Ty82t49Cs1,1
Mon Jul 23 19:56:35 +0000 2018,Are you getting into real estate #crowdfunding? Here's how to choose your first investment. #investing… https://t.co/83UADwk6pO,2
Mon Jul 23 19:56:15 +0000 2018,Highlighting #FarmTourism during the 2018 Ambassadors’ Tour: participants visit DOT-accredited Maribojoc Organic Fa… https://t.co/jWUaYYzMPi,9
Mon Jul 23 19:56:03 +0000 2018,1-Year Dividend Growth of 72.84!  Read about my latest  Dividend Growth Stock Buy:   Delta Airlines  Inc. (DAL)… https://t.co/Ty82t49Cs1,1
Mon Jul 23 19:54:30 +0000 2018,Hispasat cites inter-satellite links as pivotal for LeoSat investment https://t.co/dZycXMHPKa https://t.co/ltgQLJD3kw,2
Mon Jul 23 19:54:02 +0000 2018,Yes  a corporate rate cut doesn't provide any reason for companies to just give money to workers.  Instead it provi… https://t.co/ZWRKRZzQsA,7
Mon Jul 23 19:53:29 +0000 2018,‘For its own sake  Europe needs more domestic demand  above all more investment. One should not kid oneself about t… https://t.co/wgTyErPHwk,2
Mon Jul 23 19:50:14 +0000 2018,Are you getting into real estate #crowdfunding? Here's how to choose your first investment. #investing… https://t.co/83UADwk6pO,2
Mon Jul 23 19:47:44 +0000 2018,Yes  a corporate rate cut doesn't provide any reason for companies to just give money to workers.  Instead it provi… https://t.co/ZWRKRZzQsA,7
Mon Jul 23 19:47:18 +0000 2018,Net inward investment into the US by multinational corporations—both foreign and American—has fallen almost to zero… https://t.co/4Ngy9rUPfo,56
Mon Jul 23 19:47:18 +0000 2018,.@BillGates backs #Alzheimer’s diagnostics with new Diagnostics Accelerator venture fund https://t.co/mQuwZ2WCAP https://t.co/4SeDAGrROO,3
Mon Jul 23 19:46:40 +0000 2018,Yes! #TEACHer investment crucial to #EdTech. Thanks @edutopia https://t.co/fnBumayfOh,0
Mon Jul 23 19:46:29 +0000 2018,Great ❓ from audience member who is provider AND a landlord: How can I make a business case to a LL to protect thei… https://t.co/FeDtdz7fKB,1
Mon Jul 23 19:40:51 +0000 2018,Great ❓ from audience member who is provider AND a landlord: How can I make a business case to a LL to protect thei… https://t.co/FeDtdz7fKB,1
Mon Jul 23 19:35:00 +0000 2018,At this moment  US spending on investment is in decline  while transfers are skyrocketing.   https://t.co/wJO9gtRwF8 https://t.co/HzbLxEpb8V,0
Mon Jul 23 19:32:49 +0000 2018,74% of Americans want Congress to increase public transit investment  study finds https://t.co/cuHeBOYtdl,0
Mon Jul 23 19:32:09 +0000 2018,General Electric reconsiders investment in Lamu coal plant https://t.co/neEB2PFVNB via @TheStarKenya,2
Mon Jul 23 19:31:08 +0000 2018,Uncertainty about trade is a cost to Americans. Individuals are uncertain how bad trade policies will actually get.… https://t.co/QCyC6SFcN9,0
Mon Jul 23 19:27:07 +0000 2018,#Alberta’s incentive program is working to lure #petrochemical companies north of the 49th parallel. According to a… https://t.co/jxl0MxxTmU,5
Mon Jul 23 19:27:02 +0000 2018,Canadian officials and business leaders are anxious that Canada isn't a good place to do business anymore - because… https://t.co/KAhcUXuzWT,0
Mon Jul 23 19:21:24 +0000 2018,CPEC appears to be in trouble as an IMF bailout and the prospects of a PTI-led government would lead to calls for g… https://t.co/gPYooxNmt8,0
Mon Jul 23 19:18:16 +0000 2018,Do cryptocurrencies affect the average investor?  ICI's Marty Burns details the barriers to fund investment in such… https://t.co/kYntECcUhF,2
Mon Jul 23 19:17:39 +0000 2018,Do cryptocurrencies affect the average investor?  ICI's Marty Burns details the barriers to fund investment in such… https://t.co/kYntECcUhF,2
Mon Jul 23 19:17:23 +0000 2018,Because like "good" student loan debt  the benefits that were promised with the investment never materialized.   "6… https://t.co/cYu6poebpB,0
Mon Jul 23 19:17:20 +0000 2018,This is decades old practice of #PPP It doesn’t even allow opposition candidates’ polling agents inside polling sta… https://t.co/Bo1ZJETxnP,80
Mon Jul 23 19:12:57 +0000 2018,. @toddjmoss and MFAN Executive Committee member Rob Mosbacher call #theBUILDAct a “triple win: it catalyzes invest… https://t.co/Xf0L1VBuDV,0
Mon Jul 23 19:12:23 +0000 2018,Thanks to a $150 million “investment” from #taxpayers  Audi Field is the most expensive soccer stadium in American… https://t.co/AA5jZ2STJE,1
Mon Jul 23 19:11:51 +0000 2018,Some new #TaxCutsAndJobsAct data.   Investment growth is coming in strong  as predicted. https://t.co/BS5Q3mZhja,4
Mon Jul 23 19:10:04 +0000 2018,The US has long been the largest single recipient of FDI in the world  but Trump's hostility to globalization is di… https://t.co/XkpTGKdbpd,0
Mon Jul 23 19:09:36 +0000 2018,Money Education Is The Best Investment One Can Make #makemoneyonline  #inte https://t.co/yO64ezBMb8 https://t.co/skFhes9eRY,1
Mon Jul 23 19:09:09 +0000 2018,.@BillGates backs #Alzheimer’s diagnostics with new Diagnostics Accelerator venture fund https://t.co/mQuwZ2WCAP https://t.co/4SeDAGrROO,3
Mon Jul 23 19:07:50 +0000 2018,Net inward investment into the US by multinational corporations—both foreign and American—has fallen almost to zero… https://t.co/4Ngy9rUPfo,56
Mon Jul 23 19:07:18 +0000 2018,‘For its own sake  Europe needs more domestic demand  above all more investment. One should not kid oneself about t… https://t.co/wgTyErPHwk,2
Mon Jul 23 19:06:42 +0000 2018,Net inward investment into the US by multinational corporations—both foreign and American—has fallen almost to zero… https://t.co/4Ngy9rUPfo,56
Mon Jul 23 19:06:18 +0000 2018,The #BUILDAct passing the House last week was a major milestone in U.S. efforts to modernize development finance.… https://t.co/u3ga55bDoR,4
Mon Jul 23 19:03:36 +0000 2018,Money Education Is The Best Investment One Can Make #makemoneyonline  #inte https://t.co/yO64ezBMb8 https://t.co/skFhes9eRY,1
Mon Jul 23 19:01:42 +0000 2018,The #BUILDAct passing the House last week was a major milestone in U.S. efforts to modernize development finance.… https://t.co/u3ga55bDoR,4
Mon Jul 23 19:01:22 +0000 2018,#Alberta’s incentive program is working to lure #petrochemical companies north of the 49th parallel. According to a… https://t.co/jxl0MxxTmU,5
Mon Jul 23 19:00:55 +0000 2018,#Alberta’s incentive program is working to lure #petrochemical companies north of the 49th parallel. According to a… https://t.co/jxl0MxxTmU,5
Mon Jul 23 18:55:35 +0000 2018,We fully support the ARG @g20org Presidency priorities on the future of work. I am optimistic that we can harness t… https://t.co/lAQodBymc6,78
Mon Jul 23 18:55:31 +0000 2018,Net inward investment into the US by multinational corporations—both foreign and American—has fallen almost to zero… https://t.co/4Ngy9rUPfo,56
Mon Jul 23 18:48:13 +0000 2018,@bpisaacoff The witnesses' joint statement does call for greatly increasing investment in STEM education:… https://t.co/Lu2CKwsPyr,0
Mon Jul 23 18:46:24 +0000 2018,Net inward investment into the US by multinational corporations—both foreign and American—has fallen almost to zero… https://t.co/4Ngy9rUPfo,56
