Tue Oct 03 18:28:44 +0000 2017,Helium snapshot Oct 10th! Get your SPR ready for snapshot &amp; see you on the helium side ;) #Masternodes here we come… https://t.co/lZjkAsjIUm,0
Tue Oct 03 14:34:08 +0000 2017,Football notebook checks in with stingy Forest Park defense  cutting-edge helmets for St. Paul's:… https://t.co/4NwYq63wCe,1
Tue Oct 03 11:37:41 +0000 2017,#BTC/USD and #BTC/JPY Technical Analysis October 3 2017 https://t.co/YtmMy51PQF,0
Tue Oct 03 11:34:05 +0000 2017,Even if your btc is on a Trezor  correct? https://t.co/uk3sJ47rZZ,0
Tue Oct 03 02:24:35 +0000 2017,Day 7 has finally come!!! If you've enjoyed the GoPro Seven Day Vlog. Retweet &amp; like for a PART 2!! Subscribe 4 more https://t.co/BB0eCopXcE,138
Tue Oct 03 00:21:38 +0000 2017,WSJ: Goldman Sachs Planning Direct Bitcoin Trading https://t.co/1c15rC6gnW via @Cointelegraph $btc $eth $ltc #cryptocurrency,0
Tue Oct 03 00:04:23 +0000 2017,Who made the cut for this week's Football By The Numbers: https://t.co/FN96eVK1xR https://t.co/rAJOXMcr4E,10
