Sat Mar 03 22:27:23 +0000 2018,Just keep losing btc by the hour great,0
Sat Mar 03 20:24:48 +0000 2018,Here's hoping tat the #IRS is taking notes... https://t.co/4WO15kcd7M via @CoinDesk #bitcoin #BitcoinNews #cryptocurrency $BTC,36
Sat Mar 03 11:28:35 +0000 2018,You can now buy and sell Bitcoin internationally and cashout in Africa with CoinDirect #Bitcoin #BTC #XBT #Ethereum… https://t.co/M405pYqY9i,1
Sat Mar 03 02:38:32 +0000 2018,Do or die time for $BTC. Price headed towards 1) historic resistance 2) neckline of inverse h&amp;s pattern 3) bearish… https://t.co/nLbZPakilr,0
Sat Mar 03 02:15:49 +0000 2018,@VisionsOfVyas @MohammedAzamH @the_mundz go buy some to help $btc break through,0
Sat Mar 03 01:55:08 +0000 2018,21st Edition BTC Super 22 Preseason Team 2018  OL Mayowa Ajimatanrareje- Long Reach  Trenton Baker- Reservoir  Ben… https://t.co/l9SHWh7hc4,24
