Sat Sep 22 22:36:48 +0000 2018,Tron [TRX]’s Justin Sun shows his unwavering support for XRP and Ripple #XRP #XRPCommunity #ripple #xrpthestandard… https://t.co/Gm0B0Hfxmo,0
Sat Sep 22 22:25:08 +0000 2018,NEW Video: Ripple (XRP) What Exactly Happened On Friday September 21st? &amp; Tron Believes in Ripple XRP!   https://t.co/F5mgXx1oD7,0
Sat Sep 22 21:51:03 +0000 2018,Audi envisions a charging station for the electric era  celebrating the new all-electric Audi e-tron SUV in San Fra… https://t.co/HSxKT9yrJo,0
Sat Sep 22 14:05:38 +0000 2018,Electrifyingly fun to drive: the Audi e-tron #audi #audiworld https://t.co/Qnq3Z1LNMY,0
Sat Sep 22 13:55:08 +0000 2018,Altcoins soaring: Cardano  Tron  and Stellar (XLM) surge up to 18% - The Bitcoin News https://t.co/9IqIZEkCaw #ico,0
Sat Sep 22 05:12:57 +0000 2018,@justinsuntron Targets 🎯 DEC 2018 / $3.43 JUN 2019 / $93.6  IM IN $TRX #TRON $BTC #crypto https://t.co/fqR2p62j7a,2
Sat Sep 22 04:48:54 +0000 2018,@justinsuntron Targets 🎯 DEC 2018 / $3.43 JUN 2019 / $93.6  IM IN $TRX #TRON $BTC #crypto https://t.co/fqR2p62j7a,2
Sat Sep 22 04:46:47 +0000 2018,@justinsuntron Targets 🎯 DEC 2018 / $3.43 JUN 2019 / $93.6  IM IN $TRX #TRON $BTC #crypto https://t.co/fqR2p62j7a,2
Sat Sep 22 02:26:03 +0000 2018,Audi E-Tron vs. Jaguar I-Pace and Tesla Model X: How they compare on paper https://t.co/oJyHU8PCzC https://t.co/sCQ3tlH8dk,0
