Fri May 25 21:40:56 +0000 2018,Tron Airdrop 📢  https://t.co/SWwwESURJx You can get 2 $TRX for the first time  and you can get an additional 4 #TRX… https://t.co/6dnP5bWzzq,3
Fri May 25 21:39:52 +0000 2018,Tron Airdrop 📢  https://t.co/SWwwESURJx You can get 2 $TRX for the first time  and you can get an additional 4 #TRX… https://t.co/tgHMWgxxGJ,0
Fri May 25 17:09:20 +0000 2018,Which one of these projects will out preform?🤔 #bitcoin #btc #trx #tron #ethereum #eth #ltc #wan #wanchain #aion… https://t.co/FZvPr7qMdx,0
Fri May 25 13:35:11 +0000 2018,Let’s get a Sneijder super rare Trondog added to https://t.co/h7yDjX4duh!  @gameblockchain @gelert @sneijder101010… https://t.co/T9sAcWLXFZ,0
Fri May 25 03:55:46 +0000 2018,I can never catch a break😂😂😂 #bitcoin #btc #trx #tron #ethereum #eth #ltc $icx #litecoin #icon #icx #LTC #xlm… https://t.co/ttPp1edKH3,0
Fri May 25 03:27:29 +0000 2018,Tron Lambo ?? https://t.co/dmL29vHWZ7,0
