Sun Dec 02 23:58:09 +0000 2018,Unless  of course  the fertile land of Pakistani Punjab is converted into a giant pig farm to supply China's enormo… https://t.co/PPnrHIEF0T,1
Sun Dec 02 23:50:59 +0000 2018,Good ass investment to keep up with my water intake 😭👏🏾 https://t.co/E80osZgqbX,24926
Sun Dec 02 23:44:44 +0000 2018,Bitcoin is the first time I’ve seen ordinary people use their investment capital to make rich people richer. We do enough of that 9-5.,0
Sun Dec 02 23:44:13 +0000 2018,I am not preaching to the previously converted  but just saying "told ya". Paws &amp; Purrs before Prozac. Works better… https://t.co/2h437qSENV,0
Sun Dec 02 23:39:33 +0000 2018,See our latest #SanFrancisco  CA #job and click to apply: Investment Analyst - Multi Family Office -… https://t.co/Z2QACvjFNB,1
Sun Dec 02 23:36:02 +0000 2018,City's investment in psychotherapy and counseling contributes to effective opiate treatment https://t.co/xe3Q4nneDb… https://t.co/mnMMD859oN,0
Sun Dec 02 23:03:16 +0000 2018,@sarthakgh @quicklywilliam Already have an auto insurance investment :),0
Sun Dec 02 22:57:59 +0000 2018,@Klickedy @Aurorad @Greg_Palast @MiroWare @AriBerman The voting machines are made by GOP donors. It's just a fact … https://t.co/c4kGVDZ63E,0
Sun Dec 02 22:44:35 +0000 2018,there’s a fire in my building  lord please protect my top ramen cooker i paid 5 dollars for that &amp; it’s the best investment i’ve made 😢,0
Sun Dec 02 22:34:22 +0000 2018,Follow us for tips on how to get the most out of your investment strategy.,31
Sun Dec 02 22:09:04 +0000 2018,Microsoft Talks About Investing Aggressively in Butt Gaming and Content https://t.co/onOvfGuV9Z #cloud2butt,0
Sun Dec 02 21:58:42 +0000 2018,My random shower thought for today could be your early investment opportunity!  How about a sock company called "Fo… https://t.co/t71mskeXqE,0
Sun Dec 02 21:54:51 +0000 2018,“Quit when you’ll be mediocre  when the returns aren’t worth the investment  when you no longer think you’ll enjoy… https://t.co/gcRqQwFvMF,0
Sun Dec 02 21:37:32 +0000 2018,Yes  many of us need to change our mode of transportation  and all of us need to move our investment dollars out of… https://t.co/DkLxm5bFUc,0
Sun Dec 02 21:26:16 +0000 2018,See our latest #SanFrancisco  CA #job and click to apply: Senior Investment Product Development Professional Wells… https://t.co/GHN57B0Z4v,0
Sun Dec 02 21:09:35 +0000 2018,Why do journalists love the phrase “burn cash”? Used repeatedly describing startups and #Tesla. Investment and research spend buys assets.,1
Sun Dec 02 20:45:05 +0000 2018,Always be your biggest investment. https://t.co/Lz0iiHOO2w,31
Sun Dec 02 20:18:01 +0000 2018,For many years  #Investment #Banking has been an industry run by men  for men. With changes in the world economy  t… https://t.co/vN3ljrOp3a,0
Sun Dec 02 20:15:36 +0000 2018,@MitchellBlues @CNN Also lawsuits are incredibly expensive and may not even work. So the fact that it's immensely r… https://t.co/gEK8JPYLaq,0
Sun Dec 02 19:46:03 +0000 2018,Is this investment more about wrecking the insurance industry  and rule of law  and population control (public geno… https://t.co/DFXdIGqrLk,0
Sun Dec 02 19:11:39 +0000 2018,Unless  of course  the fertile land of Pakistani Punjab is converted into a giant pig farm to supply China's enormo… https://t.co/PPnrHIEF0T,1
Sun Dec 02 18:44:58 +0000 2018,@USCapGlobal Securities launches $10MM #equity #investment in @terniotoken  a scalable #blockchain company pioneeri… https://t.co/UGTx4Pg8O9,11
Sun Dec 02 18:38:51 +0000 2018,i still have remorse for the $300 DVF dress I bought for my 8th grade graduation that I only wore once and immediat… https://t.co/X5TgJrYsKM,0
Sun Dec 02 18:10:12 +0000 2018,Financial advisors are turning to @Addepar's investment platform to assuage #investors' fears about market volatili… https://t.co/KWTRnAUgpQ,0
Sun Dec 02 18:08:04 +0000 2018,Between the Federal Investment Tax Credit and state and local incentives  it can be hard to understand financial in… https://t.co/OAAk3CQDW7,3
Sun Dec 02 17:53:49 +0000 2018,Between the Federal Investment Tax Credit and state and local incentives  it can be hard to understand financial in… https://t.co/OAAk3CQDW7,3
Sun Dec 02 17:46:34 +0000 2018,Good ass investment to keep up with my water intake 😭👏🏾 https://t.co/E80osZgqbX,24926
Sun Dec 02 17:45:40 +0000 2018,Are reverse mortgages a good investment? https://t.co/iLesyEyKQv https://t.co/ehASNTcTp0,0
Sun Dec 02 17:24:00 +0000 2018,If you feel like you need to win every argument on the internet about an investment  it's probably time to sell sai… https://t.co/KELQON9yau,1
Sun Dec 02 17:09:01 +0000 2018,@poolsideconvooo @damnpamfromnamm and the #CIA front - Zapata Oil - a proven #CIA front then  the Savings and Loan… https://t.co/omqGV5PRqe,3
Sun Dec 02 17:08:29 +0000 2018,From @AFSCME’s President Lee Saunders to #DNC: We realized we could not do this alone. We hired local organizers to… https://t.co/BblsWaJwDn,14
Sun Dec 02 17:00:10 +0000 2018,Torn about taking on an investor? Read advice from experienced founders before you do anything further. https://t.co/I0izvZIFvm,0
Sun Dec 02 16:55:38 +0000 2018,BlockChannel:The second-largest stock exchange in the world is partnering with investment management firm VanEck to… https://t.co/DrsnGZrGkb,0
Sun Dec 02 16:34:02 +0000 2018,#ShutDownVanderbilt 📰🤬...... #EndOrganizedGenocide #ENDMENTALPOVERTY #vaccineskill #AmericaIsAPsychologicalDisorder… https://t.co/F0rxyAhOph,0
Sun Dec 02 16:26:55 +0000 2018,@JoeBudden I Sold my soul to the devil for a hs football career that tanked   bad investment,0
Sun Dec 02 16:25:55 +0000 2018,My Listing on Valencia Street featured on "At Home in Northern California" on ABC7 Great Investment Property! https://t.co/FZZl91VhZU,0
Sun Dec 02 16:04:35 +0000 2018,Investment giant BlackRock is planning to open a new hub with 1 000 employees in Atlanta.  https://t.co/oBdUf5WxEk via @WSJ,1
Sun Dec 02 15:30:28 +0000 2018,If you feel like you need to win every argument on the internet about an investment  it's probably time to sell sai… https://t.co/KELQON9yau,1
Sun Dec 02 14:58:00 +0000 2018,“Change is something we often fear  but if we focus optimistically on the opportunity instead of getting distracted… https://t.co/MejpEOeJ2D,0
Sun Dec 02 14:52:40 +0000 2018,Just learned Ghana held a Value Added Agriculture Expo in August. Agricultural development holds a lot of promise f… https://t.co/bPdO9fl5eF,0
Sun Dec 02 14:25:45 +0000 2018,X-Block secures $0.4 Million investment by Consensus Future Capital. CFC invests in early stage technology startups… https://t.co/A1n4OUXDj6,387
Sun Dec 02 14:21:24 +0000 2018,Roasting influencers is a better investment than paying them. Tell me I’m wrong.  https://t.co/BV95U5r2Ye,40
Sun Dec 02 13:54:31 +0000 2018,Early-stage VC firm  Bloomberg Beta puts its entire operating manual on GitHub #openinnovation #investments… https://t.co/7g9DoIGE8k,0
Sun Dec 02 13:26:16 +0000 2018,The steel tariff has triggered investment in steel production worth some $3.0 billion (not accounted for in most tr… https://t.co/TgdW9qc97E,7
Sun Dec 02 12:51:02 +0000 2018,@Investormint awards @BlockFI 5 out of 5 stars for their cryptoloans https://t.co/gpVwV2vvqA #makemoney #investing… https://t.co/FYGxwl6zFP,0
Sun Dec 02 12:51:02 +0000 2018,How to Achieve Financial Freedom! https://t.co/ZS89dyeW1B #forex #money #trader #stockmarket #cryptocurrency… https://t.co/AOUdnFQ8uI,0
Sun Dec 02 12:13:12 +0000 2018,Zach Ketchum our CEO of Program Management and the expert for cryptocurrency investment  has founded Blockchain lab… https://t.co/zXYHB1s4er,33
Sun Dec 02 11:45:31 +0000 2018,Roasting influencers is a better investment than paying them. Tell me I’m wrong.  https://t.co/BV95U5r2Ye,40
Sun Dec 02 11:21:28 +0000 2018,"Over half of the new tech startups in China are founded by women and 17% of partners at Chinese investment firms a… https://t.co/KV4RbDOH0s,3
Sun Dec 02 11:21:20 +0000 2018,Forrester Study: Predictions for 2019  the ebb and flow of VC dough https://t.co/wCoMpJPimg #Startup #VC #Funding… https://t.co/B8bNIqL8KE,1
Sun Dec 02 10:50:56 +0000 2018,Thanks @Blockchain_Expo for inviting our Investment Manager Kadeem Clarke to speak at the #STO #FiresideChat about… https://t.co/RLrwlhHS1p,2
Sun Dec 02 10:40:28 +0000 2018,@ErinBlaskie @TiEConCanada @LSPARKGlobal Here is the Investment Evaluation sheet we use at @VentureUniv when meetin… https://t.co/7Iqq18Q5Tj,2
Sun Dec 02 10:19:30 +0000 2018,Looking for investments for your #startup? UK remains the European leader in #investment with a 255 percent increas… https://t.co/XgtGtPgbwt,0
Sun Dec 02 09:58:41 +0000 2018,Good ass investment to keep up with my water intake 😭👏🏾 https://t.co/E80osZgqbX,24926
Sun Dec 02 08:45:28 +0000 2018,Zach Ketchum our CEO of Program Management and the expert for cryptocurrency investment  has founded Blockchain lab… https://t.co/zXYHB1s4er,33
Sun Dec 02 07:40:23 +0000 2018,Pokémon GO Maker Niantic Looks to Smartglasses Future with Investment in AR Display Maker DigiLens « Next Reality https://t.co/4CKrjFJUXW,7
Sun Dec 02 07:24:43 +0000 2018,Good ass investment to keep up with my water intake 😭👏🏾 https://t.co/E80osZgqbX,24926
Sun Dec 02 07:01:24 +0000 2018,Pokémon GO Maker Niantic Looks to Smartglasses Future with Investment in AR Display Maker DigiLens « Next Reality https://t.co/4CKrjFJUXW,7
Sun Dec 02 06:42:20 +0000 2018,.@PalantirTech just closed another investment according to the Galiano Group  same group who in the past few months… https://t.co/duX40LJtWD,1
Sun Dec 02 06:37:02 +0000 2018,Peninsula medical robotics company checks in $220 million investment https://t.co/I2fk2D1Zq7 https://t.co/yhUkzsPyBd,4
Sun Dec 02 06:05:30 +0000 2018,Zach Ketchum our CEO of Program Management and the expert for cryptocurrency investment  has founded Blockchain lab… https://t.co/zXYHB1s4er,33
Sun Dec 02 06:02:42 +0000 2018,Good ass investment to keep up with my water intake 😭👏🏾 https://t.co/E80osZgqbX,24926
Sun Dec 02 05:09:42 +0000 2018,BlockChannel:RT mylesgilsenan: Amazon Has Launched a New Service for Building Blockchains https://t.co/mZP7TivVCo v… https://t.co/Toz5QMbTQP,2
Sun Dec 02 04:56:45 +0000 2018,From @AFSCME’s President Lee Saunders to #DNC: We realized we could not do this alone. We hired local organizers to… https://t.co/BblsWaJwDn,14
Sun Dec 02 04:56:32 +0000 2018,This is urgent. We can’t wait around any longer for something to change. The ROI (return on investment) on autism i… https://t.co/KmgO89UCiZ,3
Sun Dec 02 04:49:44 +0000 2018,From @AFSCME’s President Lee Saunders to #DNC: We realized we could not do this alone. We hired local organizers to… https://t.co/BblsWaJwDn,14
Sun Dec 02 04:42:41 +0000 2018,I was recently looking for some new things and found out about the @0xProject  pretty interesting stuf  I fully end… https://t.co/DoYklzg3FJ,0
Sun Dec 02 04:40:00 +0000 2018,The simple act of writing a business plan can increase the odds of success! Our easy guide for freelancers will hel… https://t.co/a5vCd3hz5y,2
Sun Dec 02 04:31:13 +0000 2018,TEAR GAS  IT WOULD APPEAR  IS THE UP AND COMING INVESTMENT. .. Worst riot in a decade engulfs Paris; Macron vows ac… https://t.co/4AOwCVSIR8,0
Sun Dec 02 04:28:03 +0000 2018,Pokémon GO Maker Niantic Looks to Smartglasses Future with Investment in AR Display Maker DigiLens « Next Reality https://t.co/4CKrjFJUXW,7
Sun Dec 02 04:27:36 +0000 2018,@AdamSinger @jeetsidhu_ @alan8325 Welcome to every investment in human history.,0
Sun Dec 02 04:17:09 +0000 2018,The first order of business is to triangulate #VC’s location in the world of finance and investments.  Let’s start… https://t.co/vosrxtnNrv,0
Sun Dec 02 04:03:08 +0000 2018,This is urgent. We can’t wait around any longer for something to change. The ROI (return on investment) on autism i… https://t.co/KmgO89UCiZ,3
Sun Dec 02 03:53:25 +0000 2018,From @AFSCME’s President Lee Saunders to #DNC: We realized we could not do this alone. We hired local organizers to… https://t.co/BblsWaJwDn,14
Sun Dec 02 03:48:48 +0000 2018,The steel tariff has triggered investment in steel production worth some $3.0 billion (not accounted for in most tr… https://t.co/TgdW9qc97E,7
Sun Dec 02 03:47:49 +0000 2018,Roasting influencers is a better investment than paying them. Tell me I’m wrong.  https://t.co/BV95U5r2Ye,40
Sun Dec 02 03:23:30 +0000 2018,From @AFSCME’s President Lee Saunders to #DNC: We realized we could not do this alone. We hired local organizers to… https://t.co/BblsWaJwDn,14
Sun Dec 02 03:07:59 +0000 2018,Nine figure Series A investment rounds are rare.  But nine figures is how much the #fintech startup Oriente raised… https://t.co/aB8vHkOc4t,3
Sun Dec 02 03:07:19 +0000 2018,Nine figure Series A investment rounds are rare.  But nine figures is how much the #fintech startup Oriente raised… https://t.co/aB8vHkOc4t,3
Sun Dec 02 02:53:11 +0000 2018,Inevitable given that Uber's business model is to attract investment capital. https://t.co/yWEgPTbAsz,0
Sun Dec 02 02:38:53 +0000 2018,Students from 30 UK universities protest against investment in Israel occupation – Middle East Monitor https://t.co/GMcxHDjgJy,0
Sun Dec 02 02:09:52 +0000 2018,The U.S. should support their efforts if they want to resolve heavy migration issues . These countries have a futur… https://t.co/NzGE1g1ezM,0
Sun Dec 02 02:07:04 +0000 2018,Top Ten: Weekend roundup: Catalysts for a stronger market When to sell a beloved stock Tesla and GM: How to keep yo… https://t.co/cyZBypUsZ1,0
Sun Dec 02 02:00:51 +0000 2018,BlockChannel:The second-largest stock exchange in the world is partnering with investment management firm VanEck to… https://t.co/OdyrA8PL9J,0
Sun Dec 02 01:34:03 +0000 2018,Last minute Christmas shopping?  What to get the spouse who has everything?  How about a classic Batmobile... not o… https://t.co/vZQxGcdv1s,1
Sun Dec 02 01:28:55 +0000 2018,@SylerClayton @fouroctets I had to travel without it for the first time in months this week. It’s cold at home and… https://t.co/ktE5OfeGfn,0
Sun Dec 02 01:19:00 +0000 2018,The steel tariff has triggered investment in steel production worth some $3.0 billion (not accounted for in most tr… https://t.co/TgdW9qc97E,7
Sun Dec 02 01:14:17 +0000 2018,.@PalantirTech just closed another investment according to the Galiano Group  same group who in the past few months… https://t.co/duX40LJtWD,1
Sun Dec 02 01:02:50 +0000 2018,Between the Federal Investment Tax Credit and state and local incentives  it can be hard to understand financial in… https://t.co/OAAk3CQDW7,3
Sun Dec 02 01:02:00 +0000 2018,Tax breaks could spur investment in Oakland’s under-developed areas https://t.co/OcAqQhM73U https://t.co/lQtD8ufvcm,0
Sun Dec 02 01:01:16 +0000 2018,Learn more about my bitcoin investment at https://t.co/5ySYW8Jbrf. https://t.co/sRuk5bfVGt,0
Sun Dec 02 01:00:07 +0000 2018,How to choose an impact investment advisor.   Here are 8 questions to get you started. https://t.co/b57vVBFw0V,0
Sun Dec 02 00:32:41 +0000 2018,This is urgent. We can’t wait around any longer for something to change. The ROI (return on investment) on autism i… https://t.co/KmgO89UCiZ,3
Sun Dec 02 00:27:58 +0000 2018,From @AFSCME’s President Lee Saunders to #DNC: We realized we could not do this alone. We hired local organizers to… https://t.co/BblsWaJwDn,14
Sun Dec 02 00:27:18 +0000 2018,The steel tariff has triggered investment in steel production worth some $3.0 billion (not accounted for in most tr… https://t.co/TgdW9qc97E,7
Sun Dec 02 00:12:20 +0000 2018,In the chart below  we show the top five global markets for #SaaS investment (plus the rest of the world). Read the… https://t.co/xWyM4l9I3X,0
