Sun Dec 30 21:42:39 +0000 2018,@PleaseProtocol revolutionising the way people book travel online!  Join here https://t.co/5gEo3Qf8Le  Join Telegra… https://t.co/9AIF2AbQ1U,0
Sun Dec 30 21:40:56 +0000 2018,Forget the past  keep the lessons. #Alwaysforward #Inspiration #Motivation #EOSex @EOSexcom #ICO #EOS #EOSEXCHANGE #Bitcoin #Cryptocurrency,0
Sun Dec 30 21:40:12 +0000 2018,I may struggle but I will never quit. #NeverGiveUP #Motivation #Motivation #EOSex @EOSexcom #ICO #EOS #EOSEXCHANGE… https://t.co/0dWY0OWSX7,0
Sun Dec 30 21:39:22 +0000 2018,There are no mistakes in life only lessons learned. Cease the day! #Motivation #EOSex @EOSexcom #ICO #EOS… https://t.co/qGE8UItoyn,0
Sun Dec 30 19:02:09 +0000 2018,Leadership is the capacity to translate vision into reality.   #ico #tokensale #crowdsale #fundraising #tokens… https://t.co/0lO7nWU9ig,181
Sun Dec 30 17:41:38 +0000 2018,If it doesn't challenge you  it won't change you.  #ico #tokensale #crowdsale #fundraising #tokens #investors… https://t.co/zQw99gjxMj,183
Sun Dec 30 17:36:54 +0000 2018,@CryptoCobain (Dumps savings into ICO tracking bananas on a blockchain)  When moon sir?,0
Sun Dec 30 17:35:20 +0000 2018,Nothing great is ever achieved without great enduring.   https://t.co/g5hzl8KxjR  #ico #tokensale #crowdsale… https://t.co/IpV3pX18Bd,204
Sun Dec 30 17:29:30 +0000 2018,You don't have to have it all figured out to move forward.  https://t.co/g5hzl8KxjR  #ico #tokensale #crowdsale… https://t.co/20wufX1oJX,183
Sun Dec 30 17:20:46 +0000 2018,Even the weak become strong when they are united.  https://t.co/g5hzl8KxjR  #ico #tokensale #crowdsale #fundraising… https://t.co/bzOk2wdbyD,200
Sun Dec 30 17:00:54 +0000 2018,A silent night  a star above  a blessed gift of hope and love. A blessed Christmas to everyone!… https://t.co/uv22Vs0oHY,92
Sun Dec 30 16:52:36 +0000 2018,Silence is the sleep that nourishes wisdom.  https://t.co/g5hzl8KxjR  #ico #tokensale #crowdsale #fundraising… https://t.co/iHyLxzNkfc,169
Sun Dec 30 16:52:27 +0000 2018,There is no failure except in no longer trying.  https://t.co/g5hzl8KxjR   #ico #tokensale #crowdsale #fundraising… https://t.co/0nRn0DXp3W,173
Sun Dec 30 16:52:11 +0000 2018,A silent night  a star above  a blessed gift of hope and love. A blessed Christmas to everyone!… https://t.co/uv22Vs0oHY,92
Sun Dec 30 13:52:17 +0000 2018,It's the will  not the skill.  https://t.co/g5hzl8KxjR  #ico #tokensale #crowdsale #fundraising #tokens #airdrop… https://t.co/qglkkLne51,333
Sun Dec 30 13:06:53 +0000 2018,If it doesn't challenge you  it won't change you.  #ico #tokensale #crowdsale #fundraising #tokens #investors… https://t.co/zQw99gjxMj,183
Sun Dec 30 07:40:49 +0000 2018,We are not perfect. We make mistakes. We screw up. But then we learn and move forward.  #ico #tokensale #crowdsale… https://t.co/DhaIb2qK3c,130
Sun Dec 30 06:56:59 +0000 2018,4th Week Running at $0.0042 per LYQD token.   https://t.co/g5hzl8KxjR #ico #tokensale #crowdsale #fundraising… https://t.co/1xVz55qcVE,188
Sun Dec 30 06:45:33 +0000 2018,Even the weak become strong when they are united.  https://t.co/g5hzl8KxjR  #ico #tokensale #crowdsale #fundraising… https://t.co/bzOk2wdbyD,200
Sun Dec 30 00:17:09 +0000 2018,What do investors see in the eLYQD ICO? An open 3rd party review. 7 reasons to consider and take advantage of this… https://t.co/Oek9VOBgql,169
Sun Dec 30 00:17:04 +0000 2018,Silence is the sleep that nourishes wisdom.  https://t.co/g5hzl8KxjR  #ico #tokensale #crowdsale #fundraising… https://t.co/iHyLxzNkfc,169
