Fri Aug 18 23:54:51 +0000 2017,@XboxSupport I redeemed a 2day good trial and still can't use gold features like play online or party chat,0
Fri Aug 18 23:41:44 +0000 2017,@JamesGRickards But this is a symptom of too much liquidity and money sloshing around. Imagine what gold and silver… https://t.co/8VyeS032wl,0
Fri Aug 18 23:32:26 +0000 2017,This is fanfuckingtastic! The New Yorker pic is bonus gold! Thank you @darth ! https://t.co/aMNqcH8aPh,0
Fri Aug 18 23:19:28 +0000 2017,30s on your phone can win you a Gold VIP pass/hotel room for #FanCon Tweet your video to #MeetMeInBaltimore to ente… https://t.co/0rHzlJeK0B,4
Fri Aug 18 22:50:05 +0000 2017,If you have any of these records  you could be sitting on a gold mine https://t.co/mKhUm4UbBY https://t.co/IM3I6VjWrg,0
Fri Aug 18 22:25:24 +0000 2017,Knew this guy when. NGL  I'm going to mark out when he makes his way through the black and gold curtains. #baybay https://t.co/5JAQevECBf,0
Fri Aug 18 22:19:15 +0000 2017,@PiperPerabo @funder @RollingStone Gorka is Trump's three dollar bill to go along with his fake wineries and looks… https://t.co/nytYgg65Cu,0
Fri Aug 18 22:06:37 +0000 2017,Gold is on the line at War of the Worlds UK: Liverpool! Don't miss your chance to see these title matches LIVE:… https://t.co/Rb3i6Pk4yi,93
Fri Aug 18 21:38:21 +0000 2017,Income for African Americans fell in last decade  Census says | Cronkite News https://t.co/Z8emDOBYuG,45
Fri Aug 18 21:12:48 +0000 2017,I just added this to my closet on Poshmark: 14k gold dangle hook earrings. https://t.co/NfUKT4fyqN via @poshmarkapp #shopmycloset,0
Fri Aug 18 20:37:14 +0000 2017,And  BTW  a @CASEAdvance Circle of Excellence Gold winner. https://t.co/8o6XUlTQHB,0
Fri Aug 18 20:36:25 +0000 2017,That soda is pure gold man 😭😭 https://t.co/37dEQQ9SVp,1
Fri Aug 18 20:36:16 +0000 2017,That soda is pure gold man 😭😭 https://t.co/37dEQQ9SVp,1
Fri Aug 18 20:34:38 +0000 2017,@sportswcoleman @Twitter Gold jerry gold,0
Fri Aug 18 20:12:36 +0000 2017,30s on your phone can win you a Gold VIP pass/hotel room for #FanCon Tweet your video to #MeetMeInBaltimore to ente… https://t.co/0rHzlJeK0B,4
Fri Aug 18 20:03:06 +0000 2017,@youthinkmemad Defenders. Having to really analyze it makes me overtly critical at times. But...Weaver was gold from the start.,0
Fri Aug 18 19:55:30 +0000 2017,The equity markets and dollar shook off whatever bump Bannon leaving gave them. But gold hasn't rebounded.,0
Fri Aug 18 19:37:15 +0000 2017,@LiveFromTheFive I like the halo design  rose gold thanks.💅🏾,0
Fri Aug 18 19:34:16 +0000 2017,Better Buy: Hecla Mining Company vs. Royal #Gold  Inc https://t.co/m4rju2YKEd,0
Fri Aug 18 19:34:05 +0000 2017,California woman goes looking for #gold  finds gold and #diamond | Miami Herald https://t.co/hrYpMX1Twx,0
Fri Aug 18 19:31:01 +0000 2017,You Can Now Use a 24K Gold Foam Roller to Ease Your Sore Muscles  Dek:   $$$ spent on fitness is directly proporti… https://t.co/ntrx5P0nwV,0
Fri Aug 18 19:29:41 +0000 2017,My life's greatest work https://t.co/PTpFyH3yHz,18317
Fri Aug 18 19:04:34 +0000 2017,Ask my grandmother can use her amazon prime for a rose gold USB c adaptor for my MacBook gotta put my music files on there and edit them 😭,0
Fri Aug 18 18:49:18 +0000 2017,@PoeticMob 😂. I'm sure your still beautiful. If I remember your hair was short when we met. But idk. I got the memory of a gold fish,0
Fri Aug 18 18:46:12 +0000 2017,In case you missed it: Is it finally time to get back into $gold stocks? Read @DSjuggerud in @the__crux: https://t.co/2QvGmxJIt0,1
Fri Aug 18 18:34:55 +0000 2017,@JamesGRickards Every time Bitcoin makes a new high  the cheerleaders come out. But let's not BS each other either … https://t.co/PRwvaIpPKd,0
Fri Aug 18 18:31:24 +0000 2017,If you have any of these records  you could be sitting on a gold mine https://t.co/VH3qgJAfvr https://t.co/gU2i0d2Fq3,1
Fri Aug 18 18:21:17 +0000 2017,If you have any of these records  you could be sitting on a gold mine https://t.co/VH3qgJAfvr https://t.co/gU2i0d2Fq3,1
Fri Aug 18 17:50:28 +0000 2017,"For gold his sword the hireling ruffian draws  For gold the hireling judge distorts the laws; Wealth heaped on... https://t.co/ExQM6QFBsf,0
Fri Aug 18 17:47:07 +0000 2017,All gold everything! Stop by the Joce Jewels HQ's tonight to grab some gold on gold ;) @… https://t.co/syq3jFmeLn,0
Fri Aug 18 17:45:59 +0000 2017,.@Thycotic’s Secret Server honored as Gold winner in the 9th Annual Golden Bridge Awards® @goldenbridgeusa -… https://t.co/ZmxqSEYn06,0
Fri Aug 18 17:39:51 +0000 2017,I just added this to my closet on Poshmark: Diamond Stud Earrings in 14k white gold. https://t.co/acuPwDwtjL via @poshmarkapp #shopmycloset,0
Fri Aug 18 17:39:24 +0000 2017,I just added this to my closet on Poshmark: Gold hammered link dangle earrings.. https://t.co/chuAG5FCrF via @poshmarkapp #shopmycloset,0
Fri Aug 18 17:12:08 +0000 2017,platinum or gold with the ruby,0
Fri Aug 18 17:06:50 +0000 2017,How does Bannon out result in lower gold prices? https://t.co/8xO6fVGsMg,0
Fri Aug 18 16:44:37 +0000 2017,@historyinmoment It's amazing how the Gold Dagger &amp; Sheath is still in excellent condition after 3300 years.,0
Fri Aug 18 16:41:07 +0000 2017,30s on your phone can win you a Gold VIP pass/hotel room for #FanCon Tweet your video to #MeetMeInBaltimore to ente… https://t.co/0rHzlJeK0B,4
Fri Aug 18 16:22:29 +0000 2017,🍭Rock candy 🍭 quartz ring stacks #quartz #wirewrapped #rings #gold #blue #orange #clear… https://t.co/IlfncC5MIB,0
Fri Aug 18 15:55:17 +0000 2017,@FGMR https://t.co/AvMN9mJ3pf,0
Fri Aug 18 15:29:05 +0000 2017,I'm in there!!! Go time #AceDrucci @AceDrucci #gold #ep #Earotic https://t.co/5uPYw4t4IH,2
Fri Aug 18 14:59:17 +0000 2017,Gold is on the line at War of the Worlds UK: Liverpool! Don't miss your chance to see these title matches LIVE:… https://t.co/bHY1iJogVI,36
Fri Aug 18 14:03:41 +0000 2017,We're so proud to be taking home gold for Best Jam in Baltimore Magazine Best of Baltimore! Thank you @Baltimoremag… https://t.co/ZQcPM9lne9,0
Fri Aug 18 13:56:00 +0000 2017,Hope it's not a mimic...  Field of #gold dice from our treasure photo shoot.   #dice #dnd… https://t.co/P9MO8kBoSV,0
Fri Aug 18 13:45:05 +0000 2017,Talakhadze wins gold in Men's +105kg Weightlifting https://t.co/sfN2FyhACu #firefan https://t.co/NW2gqTnEJX,0
Fri Aug 18 13:33:15 +0000 2017,#Gold retakes $1 300 level for first time in 9 months https://t.co/kHC5Framja,0
Fri Aug 18 13:19:04 +0000 2017,Gry’s Gold Goyard Band.,0
Fri Aug 18 12:40:38 +0000 2017,@realDonaldTrump Stop deflecting lol! You're disgraceful and everyone knows it. Time to go back to your gold-plated… https://t.co/PtJmTcdjaQ,0
Fri Aug 18 12:39:16 +0000 2017,I think I stumped delivery code. Lol! Everything was fine until I started adding gold and then it added 2.5 grams for $3.60.,0
Fri Aug 18 12:23:14 +0000 2017,#Gold Prices Move Higher In Risk-Off Trade https://t.co/TpAHgLIOOH,0
Fri Aug 18 12:13:01 +0000 2017,Gold is on the line at War of the Worlds UK: Liverpool! Don't miss your chance to see these title matches LIVE:… https://t.co/bHY1iJogVI,36
Fri Aug 18 11:44:31 +0000 2017,The Gold Goyard Band.  Going be knocking for days.,0
Fri Aug 18 10:58:12 +0000 2017,Imma say it one more time Gold Goyard Belt ‼️🚨 https://t.co/epDLIF1Zc1,0
Fri Aug 18 10:11:15 +0000 2017,My pussy is a gold mine.,0
Fri Aug 18 08:50:58 +0000 2017,Similarities and differences between bit gold and Bitcoin  plus a great thread with many early ideas: https://t.co/MhhPQTiHEr,0
Fri Aug 18 08:49:10 +0000 2017,Ya'll are asleep and gold's at $1 300.,0
Fri Aug 18 08:31:32 +0000 2017,How he get those gold teeth on them mess up teeth I guess he won't tell that joke again https://t.co/UqpKwb5xNX,0
Fri Aug 18 05:34:37 +0000 2017,Why do niggas bathe in their gold chains??,0
Fri Aug 18 05:10:01 +0000 2017,I liked a @YouTube video https://t.co/bzoMYstqno Vegeta The Fresh Prince Of Gold-Hair,0
Fri Aug 18 05:03:12 +0000 2017,MSU's cheerleading team struck gold🥇at the @NCACheer1 camp🏕 📍in @MyrtleBeachesSC  📝👉🔗https://t.co/CTvDDhuDsn… https://t.co/OjgtWTTXbO,19
Fri Aug 18 04:26:42 +0000 2017,I stay seeing females say "a nigga with time ain't got no money" but the niggas with money &amp; no time aren't looking for gold diggers 🤷🏾‍♂️😂,1
Fri Aug 18 04:08:07 +0000 2017,Gold https://t.co/s4baVCxZEM,0
Fri Aug 18 03:08:24 +0000 2017,You know I'm a dreamer and my heart of gold,0
Fri Aug 18 02:11:03 +0000 2017,Donald #Trump isn’t the only factor behind 2017 #gold rally https://t.co/zroEWuSWDv,0
Fri Aug 18 02:08:12 +0000 2017,Gold Goyard belt.,0
Fri Aug 18 01:58:50 +0000 2017,This. You don't get a gold start for not being a racist. There's no Non-Racist White Person Prize. https://t.co/mObEMU0UM7,0
Fri Aug 18 01:58:43 +0000 2017,The Sacajawea gold coin is racist. She used and ate corn and corn is a Gold Color. #staywoke #satire #twogenders,0
Fri Aug 18 01:18:29 +0000 2017,RT if you love chicken wings 🤤 https://t.co/P6QpD7cqWJ,43955
Fri Aug 18 00:41:49 +0000 2017,@Gold_34_Heart https://t.co/Sv7aPWq5uu,0
Fri Aug 18 00:38:48 +0000 2017,I read GMO  Hussman  Howard Marks. All fantastic  But @MarkYusko QU letters are #gold  2nd to none! https://t.co/y5TAY4Or9V,0
