Sat Oct 14 23:45:44 +0000 2017,#MasonAW loving the gold and green bash! https://t.co/GqEZJw0rXF,0
Sat Oct 14 22:55:45 +0000 2017,Clearly I need to be arrested to get more work as a model lol  who wants they ass beat? https://t.co/WfAUqOe3sT,13414
Sat Oct 14 22:08:05 +0000 2017,Olympic figure skater Gracie Gold being treated for anxiety eating disorder https://t.co/AIiEhtVgGI,0
Sat Oct 14 20:37:42 +0000 2017,@HerthaBSC_EN Same stadium Jesse Owens won gold in front of Hitler,3
Sat Oct 14 20:33:03 +0000 2017,So a few things one can’t play online matches gold ran out. Having a team discussion Monday. And still doing physical therapy,0
Sat Oct 14 20:25:59 +0000 2017,My wish list is:  1.  Banana Cream Pie 2.  Coffee w/Cream &amp; Sugar 3.  VO Gold on the rocks.  #NationalDessertDay,0
Sat Oct 14 20:18:39 +0000 2017,Battling heinous Cancer  The chemo gives me BO. A burden to my children  And not a drop of VO.  *I so miss the gold… https://t.co/brsQ2znVlR,0
Sat Oct 14 18:35:45 +0000 2017,Have a gold run. JJS https://t.co/QemyrTtMW2,0
Sat Oct 14 17:50:21 +0000 2017,Even the rides are gold and black! #UMBCHomecoming https://t.co/zlQQop6v21,0
Sat Oct 14 17:32:22 +0000 2017,Today will be my chill day 😌 do my gold facial and my protein treatment on my hair and watch movies,0
Sat Oct 14 17:17:44 +0000 2017,Tasty gold - Drinking a Pittsburgh Brew'd #1: Golden Ale by @stbcbeer at @stbcbeer_pgh  — https://t.co/jz2VsvYs1b,0
Sat Oct 14 17:00:22 +0000 2017,how gold like. shaded sketch commission https://t.co/pYOMdI8zyE,2
Sat Oct 14 16:53:41 +0000 2017,Just Announced! NFSM wins 2017 MarCom Gold Award for Excellence! Nov/Dec issue out soon! https://t.co/vEkFKP2Icc,1
Sat Oct 14 16:51:24 +0000 2017,Dark skin women gold. Imma forever appreciate y’all,12
Sat Oct 14 16:30:09 +0000 2017,@HerthaBSC_EN Same stadium Jesse Owens won gold in front of Hitler,3
Sat Oct 14 15:36:31 +0000 2017,Hanging out at the #GreaterManifestation Community Health Fair this morning  come out to see us at 529 Gold Street. https://t.co/us0W8jYYuP,0
Sat Oct 14 14:48:01 +0000 2017,I just added this to my closet on Poshmark: RARE vintage evening bag Ivory and gold.. https://t.co/kl87PCJiDD via @poshmarkapp #shopmycloset,0
Sat Oct 14 14:40:18 +0000 2017,I just added this to my closet on Poshmark: Black and Gold Slide Mule. https://t.co/Mlur8jsDre via @poshmarkapp #shopmycloset,0
Sat Oct 14 14:16:03 +0000 2017,Mary J   an aloe &amp; gold face mask   laundry   featuring Sade....  How I am starting my morning off.,1
Sat Oct 14 14:02:36 +0000 2017,My pal @AJFrancis410 has a new video out for "Olympic Gold." I'm proud of him. He has multiple talents. I have none. https://t.co/TNigiRvR29,2
Sat Oct 14 14:00:45 +0000 2017,My pal @AJFrancis410 has a new video out for "Olympic Gold." I'm proud of him. He has multiple talents. I have none. https://t.co/TNigiRvR29,2
Sat Oct 14 13:59:12 +0000 2017,My pal @AJFrancis410 has a new video out for "Olympic Gold." I'm proud of him. He has multiple talents. I have none. https://t.co/TNigiRvR29,2
Sat Oct 14 13:57:13 +0000 2017,Dark skin women gold. Imma forever appreciate y’all,12
Sat Oct 14 13:50:11 +0000 2017,When Kanye and Jamie foxx dropped gold digger they had niggas in elementary school singing that shit then getting put on red 😂😂😂😂😂😂,3
Sat Oct 14 13:46:05 +0000 2017,I just added this to my closet on Poshmark: Black and Gold Flat Mules. https://t.co/1yRGrzUJXc via @poshmarkapp #shopmycloset,0
Sat Oct 14 13:45:32 +0000 2017,I just added this to my closet on Poshmark: Black flat mules with gold buckle. https://t.co/4v2FWKFUIr via @poshmarkapp #shopmycloset,0
Sat Oct 14 13:40:21 +0000 2017,Dark skin women gold. Imma forever appreciate y’all,12
Sat Oct 14 13:39:36 +0000 2017,Dark skin women gold. Imma forever appreciate y’all,12
Sat Oct 14 13:01:29 +0000 2017,Guerlain Palette Gold for Holiday 2017 https://t.co/j4LInNfFM4,0
Sat Oct 14 12:47:05 +0000 2017,When Kanye and Jamie foxx dropped gold digger they had niggas in elementary school singing that shit then getting put on red 😂😂😂😂😂😂,3
Sat Oct 14 12:43:35 +0000 2017,When Kanye and Jamie foxx dropped gold digger they had niggas in elementary school singing that shit then getting put on red 😂😂😂😂😂😂,3
Sat Oct 14 12:34:39 +0000 2017,When Kanye and Jamie foxx dropped gold digger they had niggas in elementary school singing that shit then getting put on red 😂😂😂😂😂😂,3
Sat Oct 14 11:47:52 +0000 2017,Dark skin women gold. Imma forever appreciate y’all,12
Sat Oct 14 10:22:18 +0000 2017,To seek help and acknowledge your health is at risk is a strength—not a weakness.   “Taking a step back and... https://t.co/Wp2APF6JaN,0
Sat Oct 14 10:14:35 +0000 2017,Dark skin women gold. Imma forever appreciate y’all,12
Sat Oct 14 09:25:44 +0000 2017,Dark skin women gold. Imma forever appreciate y’all,12
Sat Oct 14 09:25:27 +0000 2017,Dark skin women gold. Imma forever appreciate y’all,12
Sat Oct 14 08:26:31 +0000 2017,Dark skin women gold. Imma forever appreciate y’all,12
Sat Oct 14 08:21:21 +0000 2017,Dark skin women gold. Imma forever appreciate y’all,12
Sat Oct 14 08:19:37 +0000 2017,Dark skin women gold. Imma forever appreciate y’all,12
Sat Oct 14 05:03:36 +0000 2017,Maybe I'll just stay up and continuing spinning my ~*two gold gyms.,0
Sat Oct 14 03:00:53 +0000 2017,how about Korean beauty masks but gold? https://t.co/vGM97dLN2B,0
Sat Oct 14 02:39:09 +0000 2017,2 Days! Come check out our Black &amp; Gold Scrimmage this Saturday #GoDawgs #PackTheRAC https://t.co/4zV8ZsUhx5 https://t.co/mlEUHgJuff,2
Sat Oct 14 02:31:51 +0000 2017,Still fucking gold https://t.co/YjdJZsqNqk,0
Sat Oct 14 01:20:01 +0000 2017,Rock n roll trolls pay no toll gold,0
Sat Oct 14 01:19:40 +0000 2017,@pjd0014 @JeffLongBP You should be focusing on that Johnny Dickshot and RA Dickey late career breakout study I suggested. Gold!,0
Sat Oct 14 01:06:19 +0000 2017,If these photos were taken a half-second later they'd be entirely unspectacular. Instead  they're internet gold. https://t.co/GmzVfQolMJ,0
Sat Oct 14 00:03:33 +0000 2017,Parker was your parents into gold mining?  #GoldRush,0
