Wed Oct 25 23:55:28 +0000 2017,@2chainz"Gold Neckleace got Several;spaceship for vessel god blessing me fucking she devils;marking my temple walking high-dro-glyph".#3SN,0
Wed Oct 25 23:35:10 +0000 2017,Not one but TWO musical acts tomorrow at The World Famous Tailgate! No Green Jelly Beenz AND @AJFrancis410 will be… https://t.co/J1fZ7MMxIn,4
Wed Oct 25 23:27:35 +0000 2017,I liked a @YouTube video https://t.co/A47Ag6PvLQ Confronting Molly for being a GOLD DIGGER!! *exposed*,0
Wed Oct 25 23:26:43 +0000 2017,get you gold no spray tan🍯 https://t.co/7bqI0wk9Zo,35
Wed Oct 25 23:17:49 +0000 2017,Not one but TWO musical acts tomorrow at The World Famous Tailgate! No Green Jelly Beenz AND @AJFrancis410 will be… https://t.co/J1fZ7MMxIn,4
Wed Oct 25 22:20:01 +0000 2017,O accursed hunger of gold  to what dost thou not compel human hearts! – Virgil,0
Wed Oct 25 21:43:13 +0000 2017,This Gold 😂 https://t.co/gMCFctxfcE,0
Wed Oct 25 21:38:01 +0000 2017,@Jay_Flynn17 put sum gold in yo mouff,0
Wed Oct 25 21:12:25 +0000 2017,I just added this to my closet on Poshmark: Gold tone Napier choker collar necklace. https://t.co/RzdkBQtiid via @poshmarkapp #shopmycloset,0
Wed Oct 25 20:45:26 +0000 2017,@Katzip1 Oh lawd 😂😂 this is gold,0
Wed Oct 25 20:44:25 +0000 2017,The @TJMonticello Homepage has received a @W3Awards Gold! Congrats!! Check out the beautiful  award-winning site: https://t.co/X1IcFuRqBD.,2
Wed Oct 25 20:22:39 +0000 2017,The @TJMonticello Homepage has received a @W3Awards Gold! Congrats!! Check out the beautiful  award-winning site: https://t.co/X1IcFuRqBD.,2
Wed Oct 25 20:14:58 +0000 2017,21 Savage's 'Issa Album' Now Certified Gold https://t.co/CZs24kCwDy,0
Wed Oct 25 20:13:39 +0000 2017,#DiamondKMorningShow | News: Congrats @21savage's '#issa Album' Now Certified Gold https://t.co/AeJMus4eZv https://t.co/jRJphhWNsS,0
Wed Oct 25 20:10:26 +0000 2017,#Available  Statement Necklaces!!!!  Get ready for the holiday season with this beautiful gold glittery piece!!... https://t.co/jjXJq5gjE8,0
Wed Oct 25 20:02:37 +0000 2017,@GregoryG02 technically blue &amp; gold. i remember they went over it on the tour. pitt is gold and blue.,0
Wed Oct 25 19:58:08 +0000 2017,I just added this to my closet on Poshmark: RARE vintage evening bag Ivory and gold.. https://t.co/kl87PCJiDD via @poshmarkapp #shopmycloset,0
Wed Oct 25 19:56:18 +0000 2017,I just added this to my closet on Poshmark: Gold Heart Love Earrings. https://t.co/fcIWb7Zzvf via @poshmarkapp #shopmycloset,0
Wed Oct 25 19:48:46 +0000 2017,The collision of two neutron stars just produced 650 earth masses' worth of gold  silver and platinum https://t.co/u4Vn26cVwm,20
Wed Oct 25 19:07:38 +0000 2017,Connect w/ peers + tour the LEED Gold luxury apt building "The Pearl" @USGBCNCR's next #greenscene! @towercompanies https://t.co/L5Zy055yWm,0
Wed Oct 25 19:01:49 +0000 2017,Scientists Strike Gold With Cosmic Crash. https://t.co/pAM00zJ5AP,0
Wed Oct 25 18:42:24 +0000 2017,Shit. Less than two weeks left for me to make it out of silver and into gold. I can do this. I will do this. 💪🏻,0
Wed Oct 25 18:38:05 +0000 2017,ohhh god  will grier just refereed to wvu's colors as "gold &amp; blue" and probably just lost half the fanbase,0
Wed Oct 25 18:35:17 +0000 2017,I liked a @YouTube video https://t.co/VHql1PTQoT Bitcoin Just Split Again  Giving Rise To The Price Of Bitcoin Gold | CNBC,0
Wed Oct 25 18:19:15 +0000 2017,LMFAOOOOOOO this is gold! https://t.co/plrUumGiFF,0
Wed Oct 25 17:05:54 +0000 2017,This entire thread is gold  but "little cuttlefish of the Pasta Sea" speaks deep to my soul somehow. https://t.co/HqR0GdVkHE,1
Wed Oct 25 16:18:07 +0000 2017,capitalism is selling you a human birthright and labeling it a luxury https://t.co/ZLpUh12KY8,47041
Wed Oct 25 16:04:40 +0000 2017,The sports networks are all alike in their resentment for people like Lavar Ball. If he confirmed and was the “gold ole boy” they’d ❤️ him.,0
Wed Oct 25 15:41:35 +0000 2017,get you gold no spray tan🍯 https://t.co/7bqI0wk9Zo,35
Wed Oct 25 15:25:14 +0000 2017,Astronomers discover how gold was created https://t.co/JVof1oHjQz Not likely; if true  we would find the gold in big deposits  not small $$,0
Wed Oct 25 15:15:38 +0000 2017,#gold is at $1 277.50 this morning,0
Wed Oct 25 14:43:06 +0000 2017,Is Mawson Resources (TSX: MAW) the new Novo? https://t.co/oE1mwtPYqm,2
Wed Oct 25 13:45:47 +0000 2017,Oh  #bitcoingold. Down 66%.   https://t.co/k1BCZTW56d,3
Wed Oct 25 13:44:20 +0000 2017,Oh  #bitcoingold. Down 66%.   https://t.co/k1BCZTW56d,3
Wed Oct 25 13:43:51 +0000 2017,Oh  #bitcoingold. Down 66%.   https://t.co/k1BCZTW56d,3
Wed Oct 25 13:42:58 +0000 2017,Oh  #bitcoingold. Down 66%.   https://t.co/k1BCZTW56d,3
Wed Oct 25 13:33:35 +0000 2017,Is Mawson Resources (TSX: MAW) the new Novo? https://t.co/oE1mwtPYqm,2
Wed Oct 25 12:05:55 +0000 2017,I just added this to my closet on Poshmark: Black and Gold Flat Mules {sizes 6-10}. https://t.co/VWlq4VmHJx via @poshmarkapp #shopmycloset,0
Wed Oct 25 11:45:18 +0000 2017,@testudotimes Would love to see a "Gold Rush" jersey like the BB uniform. https://t.co/mWQDTKJ5wh,0
Wed Oct 25 11:10:10 +0000 2017,#Gold dips on speculation new Federal Reserve chief will be a hawk https://t.co/3I8QJdlsr9,0
Wed Oct 25 11:04:17 +0000 2017,Gold Dust Woman by Warren Haynes from Ashes &amp; Dust #NowPlaying,0
Wed Oct 25 11:04:13 +0000 2017,capitalism is selling you a human birthright and labeling it a luxury https://t.co/ZLpUh12KY8,47041
Wed Oct 25 10:26:11 +0000 2017,. @seis_matters The pot of money for Gold OA is starting to dry up  what will be impact on hybrid journals #force2017,1
Wed Oct 25 09:02:01 +0000 2017,. @seis_matters The pot of money for Gold OA is starting to dry up  what will be impact on hybrid journals #force2017,1
Wed Oct 25 09:01:21 +0000 2017,As soon as cash became available from EU for publishing gold #OpenAccess a great deal of papers got published in GoldOA journals #force2017,1
Wed Oct 25 09:00:38 +0000 2017,As soon as cash became available from EU for publishing gold #OpenAccess a great deal of papers got published in GoldOA journals #force2017,1
Wed Oct 25 07:52:16 +0000 2017,People come &amp; go so don’t even trip,2777
Wed Oct 25 06:41:52 +0000 2017,@them https://t.co/taSzYNxFDP,0
Wed Oct 25 06:40:44 +0000 2017,In the cut sir  in the cut. https://t.co/txQHq5VDSw,0
Wed Oct 25 05:56:09 +0000 2017,capitalism is selling you a human birthright and labeling it a luxury https://t.co/ZLpUh12KY8,47041
Wed Oct 25 05:17:41 +0000 2017,Going for the Gold 'cause I paid my penalties,0
Wed Oct 25 04:28:16 +0000 2017,I just added this to my closet on Poshmark: Whiting &amp; Davis gold mesh necklace scarf. https://t.co/8e4zkZnuWT via @poshmarkapp #shopmycloset,0
Wed Oct 25 03:53:41 +0000 2017,I liked a @YouTube video https://t.co/GmqsE8bOlF YouTube Adpocalypse + The Patreon Gold Rush! // Tube Talk | Lauren Mae Beauty,0
Wed Oct 25 03:43:47 +0000 2017,Baron Corbin's song is fucking gold.,0
Wed Oct 25 03:32:35 +0000 2017,New arrivals to the webstore! Logo necklace available in gold &amp; silver! https://t.co/ursZHNpjeq https://t.co/Icblkdqj83,473
Wed Oct 25 03:19:31 +0000 2017,S/o the fine bitties w the personality to match,3
Wed Oct 25 03:06:17 +0000 2017,Justin Turner's ginger-tinged world comes up gold again for Dodgers in Game 1 win https://t.co/lYLKs79ZMI https://t.co/GUXZoS9k8N,0
Wed Oct 25 02:50:13 +0000 2017,I just added this to my closet on Poshmark: Chanel runway gold white leather chain. https://t.co/pieHadv4u1 via @poshmarkapp #shopmycloset,0
Wed Oct 25 02:25:05 +0000 2017,My first album going gold.,0
Wed Oct 25 02:17:20 +0000 2017,Re-reading @Pierce_Brown Red Rising series in anticipation of the 4th book. Iron Gold! https://t.co/iiEmWBYZAV,0
Wed Oct 25 02:04:58 +0000 2017,capitalism is selling you a human birthright and labeling it a luxury https://t.co/ZLpUh12KY8,47041
Wed Oct 25 01:50:54 +0000 2017,@OriolesMemes Gold. Pure gold.,0
Wed Oct 25 01:31:01 +0000 2017,I'm in the process of creating an extensive services section. This one page took me 7 hours. Gold stars for typos https://t.co/l7k8YsEyZZ,0
Wed Oct 25 00:59:38 +0000 2017,I just earned the 'Fields of Gold (Level 4)' badge on @untappd! https://t.co/BTSYY6IzTy,0
Wed Oct 25 00:57:25 +0000 2017,Professor: *mentions el dorado* fuckboy: "the city of gold" NO SHIT SHUT UP,0
Wed Oct 25 00:05:03 +0000 2017,There’s a color you only see in fall: the autumn gold of changing leaves in the light of the setting sun. #poetry #micropoetry #micropoem,0
