Thu Apr 12 23:21:21 +0000 2018,Stellar list of Tech "Laws" by @davatron5000: https://t.co/GpHSTAVn6T Don't forget Bigg's Law  "More money  more problems.",1
Thu Apr 12 21:54:00 +0000 2018,Had a wonderful time chairing the inaugural #Biomaterial Technologies for #PrecisionMedicine session -… https://t.co/XeLmiWbgOA,3
Thu Apr 12 20:03:22 +0000 2018,Had a wonderful time chairing the inaugural #Biomaterial Technologies for #PrecisionMedicine session -… https://t.co/XeLmiWbgOA,3
Thu Apr 12 19:45:55 +0000 2018,Had a wonderful time chairing the inaugural #Biomaterial Technologies for #PrecisionMedicine session -… https://t.co/XeLmiWbgOA,3
Thu Apr 12 19:38:15 +0000 2018,Had a wonderful time chairing the inaugural #Biomaterial Technologies for #PrecisionMedicine session -… https://t.co/XeLmiWbgOA,3
Thu Apr 12 19:37:50 +0000 2018,That was a stellar AB for Schwarbs.  #CUBS,0
Thu Apr 12 18:14:29 +0000 2018,@riotwomennn @peenyweeny1218 A stellar choice just like the text of his clown car,0
Thu Apr 12 16:38:40 +0000 2018,Stellar list of Tech "Laws" by @davatron5000: https://t.co/GpHSTAVn6T Don't forget Bigg's Law  "More money  more problems.",1
Thu Apr 12 16:15:16 +0000 2018,Yes  is this the Istituto Agrario di San Michele all'Adige? I would like to enroll in one of your classes...  Two s… https://t.co/D9rY7Wk0lg,0
Thu Apr 12 05:50:04 +0000 2018,Creative Briefs in Action – Looking at 3 Stellar Landing Pages to Learn From! #bloggingtips https://t.co/erWtF91DEV… https://t.co/GNF1N9QNpO,0
Thu Apr 12 04:58:35 +0000 2018,@49ersOnMine @ChrisBiderman I actually never thought about this... I think for a 4-2-5 to be pulled off the d-line has to be stellar.,0
Thu Apr 12 01:30:15 +0000 2018,@CarlosThekid1 @criptocratas @Digi_Flo @dgb_chilling Stellar is very promising,0
Thu Apr 12 00:53:42 +0000 2018,@johnbearwithme With my whole heart I wish this was a true story. But it’s a delayed April Fool  right? Or an Onion… https://t.co/cYei482rtO,0
