Tue Mar 20 23:02:31 +0000 2018,One of the coolest booths at ShopTalk! This is some stellar in-store visual merchandising!! @perchexperience https://t.co/NWuqAgNq0u,0
Tue Mar 20 19:40:19 +0000 2018,We had a great time @CouttsandCo last night  celebrating #SportsBookAwards and 'The Greatest Comeback: The Story of… https://t.co/ppb0NOmxCN,3
Tue Mar 20 18:51:58 +0000 2018,StellarXplorers Advances to Nationals https://t.co/wzrYjKyS3o,0
Tue Mar 20 16:59:12 +0000 2018,One of the stellar attractions at the #DenverAutoShow is Super Car Way  which features some of the most expensive v… https://t.co/MiO4h1qg0S,0
Tue Mar 20 14:00:13 +0000 2018,I teach ambitious business women what it takes to have STELLAR #relationships for success in love  life &amp; biz! https://t.co/hhjwEyC1hk,0
Tue Mar 20 12:15:52 +0000 2018,We had a great time @CouttsandCo last night  celebrating #SportsBookAwards and 'The Greatest Comeback: The Story of… https://t.co/ppb0NOmxCN,3
Tue Mar 20 11:33:46 +0000 2018,We had a great time @CouttsandCo last night  celebrating #SportsBookAwards and 'The Greatest Comeback: The Story of… https://t.co/ppb0NOmxCN,3
Tue Mar 20 11:11:18 +0000 2018,We had a great time @CouttsandCo last night  celebrating #SportsBookAwards and 'The Greatest Comeback: The Story of… https://t.co/ppb0NOmxCN,3
Tue Mar 20 07:18:20 +0000 2018,Does mankind not have a stellar wang,0
Tue Mar 20 04:54:25 +0000 2018,Check this out what is new with @Stellar  Central Banks with IBM and Jed McCaleb will issue fiat cryptocurrency on… https://t.co/XBZqGHjpPI,0
Tue Mar 20 04:47:32 +0000 2018,Everyone should check this out. This is huge news for Cryptocurrency especially @Stellar. Kevin Rose interviews cry… https://t.co/BtTpv1UlN2,0
Tue Mar 20 04:41:17 +0000 2018,@Stellar to the moon https://t.co/tAkStkb1C1,0
Tue Mar 20 04:15:33 +0000 2018,@inforashilling actually  you might enjoy this read. I wrote it last year after arguing with a few of my members wh… https://t.co/edZkqt0Jxk,0
