Tue Oct 09 20:44:32 +0000 2018,does anyone do the "dash pass" with door dash? Is it worth it?,0
Tue Oct 09 15:48:35 +0000 2018,For sale dmv area  title here. V6 sonata no lights on dash. 4 brand new tires. Reliable&amp; low key. Dm me if u know a… https://t.co/D9livZVXRA,0
Tue Oct 09 15:27:11 +0000 2018,When I have kids  I’m going to take them to Disney World but lowkey it's going to be for me.,3426
Tue Oct 09 15:26:10 +0000 2018,@Harrison9871 @PlanetFitness @jenrun4donuts @TheSidebottom @Dash_of_Amy @runannierun @vampqueen1968 @Wegrynd_Chris… https://t.co/nQ4qnXqzL8,0
Tue Oct 09 14:00:19 +0000 2018,Door Dash delivers Chipotle in Baltimore,0
Tue Oct 09 11:27:14 +0000 2018,Good Morning.... do we have an update for Lee Daniels and Dame Dash’s money??,0
Tue Oct 09 07:19:32 +0000 2018,The Sunken Place Unites! Ben Carson  Candace Owens And Stacey Dash Speaking At A ‘Black Leadership Summit’ https://t.co/p8jZvmwzp9,1
Tue Oct 09 07:19:00 +0000 2018,The Sunken Place Unites! Ben Carson  Candace Owens And Stacey Dash Speaking At A ‘Black Leadership Summit’ https://t.co/p8jZvmwzp9,1
Tue Oct 09 01:44:19 +0000 2018,@HeffronDrive I just gotta say  it was SOOO good seeing you at the Peppermint. I would've totally let you keep hold… https://t.co/Zdq5T76ENs,0
Tue Oct 09 01:06:19 +0000 2018,@GovWalker Read the poem thed DASH it is very moving,0
