Thu Jun 28 23:42:45 +0000 2018,Dame Dash Steps To Lee Daniels About The $2 Million He Owes Him https://t.co/DQyB8meDTe via @YouTube,0
Thu Jun 28 19:32:49 +0000 2018,I liked a @YouTube video https://t.co/sk35d9tv49 Damon Dash pulls up on Lee Daniels and wants his 2 million dollars back,0
Thu Jun 28 18:09:07 +0000 2018,Tried out a peachy-purple eye look today mixing colors from my personalized @ColourPopCo palette  my @toofaced… https://t.co/eVaq77Atkh,0
Thu Jun 28 16:16:42 +0000 2018,What I like about Dame Dash is he never slandered Lee Daniels publicly after all these years. He ran into him on the humble and pressed him.,3
Thu Jun 28 15:38:44 +0000 2018,Anybody follow Dame Dash? I'm actually quite curious about how this Lee Daniels thing pans out. Lee gotta pay that… https://t.co/eoPlawQMGK,0
Thu Jun 28 14:51:14 +0000 2018,Me ; OMG I HAVE SO MUCH WORK TO DO IM SO OVERWHELMED   Also me; at work playing diner dash on my phone 😂😭 https://t.co/0HN66nA56w,0
Thu Jun 28 14:25:18 +0000 2018,Apparently #criminals still love #crypto. The smart ones are using #Monero  #Zcash or #Dash.… https://t.co/YuCHyBwNja,0
Thu Jun 28 10:41:14 +0000 2018,That’s some real shit stist😂🤘🏾 https://t.co/awxqsEEz5l,4
Thu Jun 28 10:32:22 +0000 2018,Watch: Dame Dash Rolled Up On Lee Daniels And Demanded The Money He Owes Him https://t.co/wQ9QYb7HkM,0
Thu Jun 28 06:49:54 +0000 2018,Watch: Dame Dash Rolled Up On Lee Daniels And Demanded The Money He Owes Him https://t.co/gNAYSRH1em,0
Thu Jun 28 03:47:32 +0000 2018,DASH HIM WEH. 🗣🗣 #QUEENSUGAR https://t.co/73JOPv389g,0
Thu Jun 28 03:34:19 +0000 2018,@originalblaha @samtripoli @punchdrunk @JohnnyWoodard Sam Triggered-Li #StillCantTakeAJoke,0
Thu Jun 28 03:11:29 +0000 2018,Again...they still havent hit rock bottom ...stay tuned https://t.co/tvig6nXERJ,0
Thu Jun 28 01:15:06 +0000 2018,Dame Dash Wants His 5 Million from Lee Daniels https://t.co/4A8hu0RLIw https://t.co/DZYcq0WGU5,0
Thu Jun 28 00:08:49 +0000 2018,Dame Dash to Lee Daniels: https://t.co/oPWZOXQIlf,29
