Tue Jun 05 19:15:32 +0000 2018,@pagedyer3 @Litecoin_MAD @DaddyCool1991 @johnkim77 @recon_Jake @Annunaki38 @TheRealBHuggins @d0c0il3rhodls… https://t.co/aNseGAJtZI,0
Tue Jun 05 17:48:25 +0000 2018,@HammerToe @XRPTrump @xrpfloki @thunderMimble @rbrtbrgnjn @fluffypony @contrasage @ApollotheHills @sjmaliz… https://t.co/6dRVImwNmn,0
Tue Jun 05 12:30:57 +0000 2018,Donate with LiteCoin https://t.co/EG1OpJqWZp,0
Tue Jun 05 04:49:23 +0000 2018,A Bubble Can Stay Inflated Longer Than You Can Stay Solvent. Or Can It...  https://t.co/3AKzz7a9Nx  #gold #silver… https://t.co/3zziNqhp9m,1
Tue Jun 05 04:47:16 +0000 2018,A Bubble Can Stay Inflated Longer Than You Can Stay Solvent. Or Can It...  https://t.co/3AKzz7a9Nx  #gold #silver… https://t.co/3zziNqhp9m,1
Tue Jun 05 03:46:37 +0000 2018,https://t.co/f3GUvk99Pc https://t.co/zccvnPU8QC  Ethereum  Ripple  Bitcoin Cash  EOS  Litecoin  Cardano  Stellar  I… https://t.co/RjhSvsN2YE,0
