Sun Jan 21 23:00:02 +0000 2018,https://t.co/b7qKN6sgrc @bitcoinbrllnt #blockchain #ethereum #litecoin https://t.co/4FqvqZJ7al https://t.co/sJnexUuvbO,0
Sun Jan 21 22:55:03 +0000 2018,We're selling https://t.co/DX01IA3oKL special price this week only 12 $LTC E-mail domains@venturetent(com) #coin #agency #crypto #litecoin,0
Sun Jan 21 22:00:03 +0000 2018,@bitcoinbrllnt https://t.co/b7qKN6sgrc #litecoin https://t.co/JAYsOb5E2B https://t.co/tjxD4UpO0Z,0
Sun Jan 21 19:49:40 +0000 2018,Beyond market leader bitcoin (#BTC)  the rating agency will also issue grades for ethereum (#ETH)  Ripple’s #XRP  b… https://t.co/WNxCFwjwDy,0
Sun Jan 21 16:33:10 +0000 2018,The Bull And The Bear Case For Bitcoin  Ethereum  Ripple  Litecoin  And Other Cryptocurrencies… https://t.co/0OguFzAFXg,0
Sun Jan 21 16:08:08 +0000 2018,New cryptocurrency STELLAR enjoys strong start to 2018 with 65% increases https://t.co/YfId6Bx8rP,0
Sun Jan 21 15:43:11 +0000 2018,The Bull And The Bear Case For Bitcoin  Ethereum  Ripple  Litecoin  And Other Cryptocurrencies https://t.co/L86KJAYhD9,0
Sun Jan 21 05:43:39 +0000 2018,I liked a @YouTube video https://t.co/2DVknji1m9 Keep An Eye On Litecoin | AltCoin With Big Year Ahead,0
Sun Jan 21 05:43:19 +0000 2018,Putting the Plunge in Bitcoin  Ethereum  Ripple  and Litecoin Into Perspective https://t.co/iIFXWgaWTt,0
Sun Jan 21 03:00:04 +0000 2018,https://t.co/b7qKN6sgrc @bitcoinbrllnt #bitcoin #blockchain #litecoin https://t.co/PDW65GO1Va https://t.co/EWU95BbdJy,0
Sun Jan 21 00:00:02 +0000 2018,@bitcoinbrllnt https://t.co/b7qKN6sgrc #crypto #litecoin #cryptocurrencies https://t.co/CwAkDpO4hR https://t.co/iyPKyGzNtq,0
