Sun May 20 20:17:42 +0000 2018,Lower-than-average snowpack in the West may spell trouble for keeping fish healthy in the coming summer months. https://t.co/PmO10MdrpJ,3
Sun May 20 19:31:19 +0000 2018,Lower-than-average snowpack in the West may spell trouble for keeping fish healthy in the coming summer months. https://t.co/PmO10MdrpJ,3
Sun May 20 17:33:41 +0000 2018,¯\_(ツ)_/¯ https://t.co/aQvL95Ni2R,12820
Sun May 20 16:48:00 +0000 2018,Lower-than-average snowpack in the West may spell trouble for keeping fish healthy in the coming summer months. https://t.co/PmO10MdrpJ,3
Sun May 20 15:03:59 +0000 2018,https://t.co/ILWnKtyO9r Price Watch: Bitcoin  Ethereum  Ripple  Bitcoin Cash and Litecoin Begin to Stabilize… https://t.co/RBWVusGKyH,0
Sun May 20 10:55:49 +0000 2018,At Ripple's Snoop Dogg Party  A Search for XRP  https://t.co/Cu2RKdupgp  Shared from my Google feed,0
Sun May 20 05:10:39 +0000 2018,Bidium official video: https://t.co/3zOwg8eaDO  via @YouTube #Bidium #bidiumofficial #Bitcointalk #bitcoins #etherium #Ripple,0
Sun May 20 05:10:20 +0000 2018,#Bidium #bidiumofficial #Bitcointalk #bitcoins #etherium #Ripple https://t.co/a6k6dEPzRB,0
Sun May 20 03:14:21 +0000 2018,Interplay of two sets of major sanctions -- Venezuela  Iran -- wld ripple across global oil markets | Sanctions on… https://t.co/RzN84CgbUB,1
Sun May 20 03:09:14 +0000 2018,Interplay of two sets of major sanctions -- Venezuela  Iran -- wld ripple across global oil markets | Sanctions on… https://t.co/RzN84CgbUB,1
Sun May 20 00:41:55 +0000 2018,To win again in Ohio  Democrats must articulate a progressive vision  not just focus on Republican failures. https://t.co/l4ujmZUDXL,2
