Tue Jul 10 22:04:16 +0000 2018,Top story: @StocksNCrypto: 'How have the current top 5 cryptocurrencies performed in 2018?  Bitcoin $BTC.X: -52.35%… https://t.co/bpys5usr3z,0
Tue Jul 10 20:10:13 +0000 2018,Sharing again for those who may have missed this over the holiday: my cover story on the ripple effects of the opio… https://t.co/4i7YZPfFFO,4
Tue Jul 10 19:51:46 +0000 2018,And breathe . . . https://t.co/Tx8hakhaox,0
Tue Jul 10 18:59:25 +0000 2018,I added a video to a @YouTube playlist https://t.co/lUv2SD2gQ8 The Ripple / XRP Rebranding,0
Tue Jul 10 18:23:11 +0000 2018,Ripple Street: Apply for a Kikkoman Kids’ Cooking Party https://t.co/KATvO5Zhh8,0
Tue Jul 10 18:16:48 +0000 2018,@haydentiff @SatoshiLite @JoelKatz @KennethVermeul3 @Ripple @bgarlinghouse My guess it was the Tiff way.,0
Tue Jul 10 17:59:34 +0000 2018,Looking forward to this Wednesday when my conversation with @emy_wng  Director of Joint Partnerships at @Ripple  go… https://t.co/5Wfa19WV30,15
Tue Jul 10 17:50:24 +0000 2018,My love handles ripple triumphantly as i once again pick the berries out of my salad without eating any of the greens,2
Tue Jul 10 17:25:30 +0000 2018,My love handles ripple triumphantly as i once again pick the berries out of my salad without eating any of the greens,2
Tue Jul 10 17:20:37 +0000 2018,My love handles ripple triumphantly as i once again pick the berries out of my salad without eating any of the greens,2
Tue Jul 10 16:43:49 +0000 2018,I liked a @YouTube video https://t.co/lUv2SD2gQ8 The Ripple / XRP Rebranding,0
Tue Jul 10 14:46:56 +0000 2018,Buddy Guy-Feels like Rain Led Zeppelin-When the Levee Breaks The Beatles-Fixing a Hole Barrett Strong (&amp; The Beatle… https://t.co/CqehIo5EwC,0
Tue Jul 10 14:40:17 +0000 2018,Inspiring story. The ripple of hope he sent out made a profound difference in a life and has managed to reach acros… https://t.co/I4coUp4rjb,0
Tue Jul 10 14:02:37 +0000 2018,CEO Of Ripple Confronted With Securities Fraud Lawsuit https://t.co/CDhc9MfEtR,0
Tue Jul 10 09:13:17 +0000 2018,In the year 9999 a quantum computer goes online called the godhead it's the apple with the byte back in it. When th… https://t.co/ntVJ0zYPUG,1
Tue Jul 10 06:05:50 +0000 2018,Ripple Rival Stellar Lumens (XLM) Co-Founder Jed McCaleb Makes Top 10 Blockchain Individuals https://t.co/eTBpmLN4yR via @bitcoinsguide,4
Tue Jul 10 03:37:35 +0000 2018,Weird. @Ripple sent this out and then deleted. 🤔 #xrpthestandard https://t.co/RjdhJmyJxW,1
Tue Jul 10 03:32:45 +0000 2018,NEW FP2020 RESOURCE! Rights-based #familyplanning programs have a greater ripple effect than almost any other devel… https://t.co/FOytujkg5i,6
Tue Jul 10 02:32:13 +0000 2018,Spent my entire evening in Southwest  shopping  dining  traveling all because I visited Audi Field. Proves the powe… https://t.co/fiHANh42td,0
Tue Jul 10 00:52:12 +0000 2018,Get on it @Ripple https://t.co/MdEubngDv3,0
Tue Jul 10 00:34:52 +0000 2018,Looking forward to this Wednesday when my conversation with @emy_wng  Director of Joint Partnerships at @Ripple  go… https://t.co/5Wfa19WV30,15
Tue Jul 10 00:20:40 +0000 2018,Understand your true divinity and power  you make such an impact here.  Let love control that impact  let it ripple throughout the universe.,0
