Wed Nov 21 23:22:00 +0000 2018,This #GivingTuesday  CFW will invest $10k in ONE innovative idea improving the lives of women + girls in Chicago. A… https://t.co/zwfQEn1LQm,0
Wed Nov 21 23:01:05 +0000 2018,With our smart ideas  stylish work  and successful communication  we will infuse your entire brand with an unified… https://t.co/y0Irn50H0M,0
Wed Nov 21 22:53:39 +0000 2018,Join the Robert Half Finance &amp; Accounting team! See our latest #job opening here: https://t.co/T2PBmGP22Z… https://t.co/3gf8hH35pS,0
Wed Nov 21 22:29:39 +0000 2018,@5ABIOmatic Oh that’s great. It was feeling like a big investment. Lol,0
Wed Nov 21 22:26:27 +0000 2018,Economists want foods to be cheap  If we can get housing to become as bad an investment as a car so much the better… https://t.co/SmnWi7dgMV,2
Wed Nov 21 22:12:44 +0000 2018,@lirael_abhorsen right; it's pretty obvious why anyone with an investment in the name "leftist" would be horrified/enraged!,0
Wed Nov 21 22:05:00 +0000 2018,We need to see a rapid turnaround in sentiment to end the year with any kind of real gains in business investment.,1
Wed Nov 21 21:59:46 +0000 2018,A D D   T O   C A R T ‘ABCs of Arbitrage 2018: Tax Rules for Investment of Bond Proceeds by Municipalities’ will he… https://t.co/1NEawQLZR5,0
Wed Nov 21 21:58:42 +0000 2018,@cryptoamd Well deserved man  wish I had more time for investment research right now  but my business is crackin an… https://t.co/IcKopBSCfB,0
Wed Nov 21 21:53:54 +0000 2018,Economists want foods to be cheap  If we can get housing to become as bad an investment as a car so much the better… https://t.co/SmnWi7dgMV,2
Wed Nov 21 21:50:28 +0000 2018,Mark Cuban says the best investment is to pay off your debt https://t.co/CXGYscf9OG,0
Wed Nov 21 21:49:28 +0000 2018,Back by popular demand. The semis after the selloff: value stocks or traps? $NVDA $MU $INTC $AMAT $LRCX $AMD https://t.co/Nlj104H5Hv,0
Wed Nov 21 21:48:36 +0000 2018,Economists want foods to be cheap  If we can get housing to become as bad an investment as a car so much the better… https://t.co/SmnWi7dgMV,2
Wed Nov 21 21:35:09 +0000 2018,Questions for these sorts of times: 1. Do you have a plan? 2. If so  have normal stock market losses derailed your… https://t.co/AmuEjVln5e,26
Wed Nov 21 21:30:26 +0000 2018,#SEC Division of #Investment Management Provides Updates to the Investment Company Reporting Modernization Frequent… https://t.co/YVB5qBWfxX,0
Wed Nov 21 21:29:53 +0000 2018,@TezukaInEnglish Black Jack is one of the few series I'd absolutely love a complete physical collection of. 💞  This… https://t.co/4EEiXbGhdw,0
Wed Nov 21 21:18:05 +0000 2018,Core durable goods data still weak  and showing the strain companies are feeling in the wake of tariffs. Hedging on… https://t.co/0ewKSmAtMf,5
Wed Nov 21 21:10:02 +0000 2018,US national security reviews to hit Chinese investment https://t.co/goo7pIHdwh https://t.co/rtPUMKWlRm,0
Wed Nov 21 20:53:04 +0000 2018,.@NancyPelosi @RepMarciaFudge @Clyburn didn't support @keithellison's #HR948: Common Sense Housing Investment Act o… https://t.co/WFfj1bIxqB,5
Wed Nov 21 20:52:44 +0000 2018,Permanent life insurance should never be purchased as an investment for the policyholder.  Start here:… https://t.co/cQCzJP0jyX,0
Wed Nov 21 20:51:13 +0000 2018,SAVE THE DATE!  This year for #GivingTuesday we are raising funds to support specialized tech and training programs… https://t.co/vrgzLAgkGd,0
Wed Nov 21 20:43:00 +0000 2018,Depressions  PTSD  criminal records &amp; stigma stand in the way of recovery for survivors of sex trafficking.  A $10k… https://t.co/lIvUWgQl31,0
Wed Nov 21 20:42:44 +0000 2018,.@NancyPelosi @RepMarciaFudge @Clyburn didn't support @keithellison's #HR948: Common Sense Housing Investment Act o… https://t.co/WFfj1bIxqB,5
Wed Nov 21 20:10:42 +0000 2018,I don't think it is that treatments aren't on the horizon @ginakolata but that obesity drugs aren't covered by insu… https://t.co/M6hXbLiXzE,0
Wed Nov 21 19:59:26 +0000 2018,Give the server at your favorite restaurant a 100% tip and the whole restaurant will treat you like Jay-Z walking i… https://t.co/vZSVLpaDpr,0
Wed Nov 21 19:41:40 +0000 2018,Core durable goods data still weak  and showing the strain companies are feeling in the wake of tariffs. Hedging on… https://t.co/0ewKSmAtMf,5
Wed Nov 21 19:40:05 +0000 2018,Tata Investment Corp gains 8% as board approves share buyback https://t.co/sxFHGgxcbO https://t.co/T2xObbensf,0
Wed Nov 21 19:35:45 +0000 2018,@RadicalCandorIL @BruceRauner What does it matter to him? He's a typical investment fund manager  he stops caring t… https://t.co/PxSknHgYaw,0
Wed Nov 21 19:35:31 +0000 2018,Uncertainty is holding back investment  says Nathan Sheets https://t.co/3ieyGcSQsL via @YouTube,0
Wed Nov 21 19:33:04 +0000 2018,@CJBECKR @awealthofcs @CFAinstitute Agreed - I was just saying your home is part of yor investable assets and there… https://t.co/d57jZNGj2K,0
Wed Nov 21 19:25:40 +0000 2018,@JulieDiCaro Oh my god I remember those days with my son wrestling in high school. Peanut butter and oranges ready… https://t.co/iWuWTGYa9a,0
Wed Nov 21 19:09:53 +0000 2018,DISCLAIMER: My exclusives ain't cheap. No one's should be. There are exceptions but don't expect them. Come with th… https://t.co/dyopIOy6o7,0
Wed Nov 21 18:58:52 +0000 2018,@business "Weaker-than-projected reports Wednesday on business investment  consumer confidence and the job market s… https://t.co/eWIRuIE3sW,0
Wed Nov 21 18:57:25 +0000 2018,As @ChiPubSchools struggles with enrollment declines  Daniel Anello of @KidsFirstChi calls for investment in local… https://t.co/ScxqbzZSxx,1
Wed Nov 21 18:55:52 +0000 2018,Return your investment within weeks via shorter sales cycle  higher customer engagement and conversion rates.… https://t.co/I6K567k7x6,2
Wed Nov 21 18:54:28 +0000 2018,Return your investment within weeks via shorter sales cycle  higher customer engagement and conversion rates.… https://t.co/I6K567k7x6,2
Wed Nov 21 18:54:05 +0000 2018,Return your investment within weeks via shorter sales cycle  higher customer engagement and conversion rates.… https://t.co/I6K567k7x6,2
Wed Nov 21 18:53:45 +0000 2018,Return your investment within weeks via shorter sales cycle  higher customer engagement and conversion rates.… https://t.co/EsRhZsEVpI,0
Wed Nov 21 18:53:45 +0000 2018,Return your investment within weeks via shorter sales cycle  higher customer engagement and conversion rates.… https://t.co/dNKhf26tVO,0
Wed Nov 21 18:45:00 +0000 2018,As @ChiPubSchools struggles with enrollment declines  Daniel Anello of @KidsFirstChi calls for investment in local… https://t.co/ScxqbzZSxx,1
Wed Nov 21 18:30:59 +0000 2018,Someone please explain what my ex-girlfriend's real estate investment trust has to do with hockey https://t.co/g5mHqU5Nfu,22
Wed Nov 21 18:30:47 +0000 2018,Secrets of the Temple:  How the Federal Reserve works. #FederalReserve https://t.co/QoAuCDrZJW,0
Wed Nov 21 18:13:21 +0000 2018,https://t.co/mO7fXBjh5X Best investment ever OMG!,0
Wed Nov 21 18:09:57 +0000 2018,Core durable goods data still weak  and showing the strain companies are feeling in the wake of tariffs. Hedging on… https://t.co/0ewKSmAtMf,5
Wed Nov 21 18:03:39 +0000 2018,Questions for these sorts of times: 1. Do you have a plan? 2. If so  have normal stock market losses derailed your… https://t.co/AmuEjVln5e,26
Wed Nov 21 18:01:32 +0000 2018,Should you invest in an existing hotel or new construction hotel? This blog compares the pros and cons of both inve… https://t.co/hnR9m9JGzb,0
Wed Nov 21 18:00:15 +0000 2018,Getting #deals done takes significant time and effort. Ongoing monitoring of each #investment is essential  and man… https://t.co/g7vr5mjN4A,0
Wed Nov 21 17:58:17 +0000 2018,this wig was really my best investment,0
Wed Nov 21 17:50:03 +0000 2018,US national security reviews to hit Chinese investment https://t.co/HoTD62EvBH https://t.co/jVKf2uXVyk,0
Wed Nov 21 17:40:19 +0000 2018,"It's time for leaders to step up their development investment game if they want more out of their people. They nee… https://t.co/zquf1HSEQk,0
Wed Nov 21 17:37:26 +0000 2018,Check out some of the top most expensive U.S. cities to rent! #UbiSearch #MedianRentalPrice #RentalProperty… https://t.co/wH0NfLwssD,0
Wed Nov 21 17:33:03 +0000 2018,Like #winemaking  #financial advising is an #investment and it takes time to be productive: https://t.co/pmsXsv8SrX,0
Wed Nov 21 17:13:39 +0000 2018,Core durable goods data still weak  and showing the strain companies are feeling in the wake of tariffs. Hedging on… https://t.co/0ewKSmAtMf,5
Wed Nov 21 17:10:21 +0000 2018,A big thank you to one of our biggest supporters @IAMJHUD we can’t say enough about your investment in schools and… https://t.co/tiqvYLztgk,2
Wed Nov 21 17:10:04 +0000 2018,Are you equipped to Navigate The Venture Capital Investment Class? Probably not. https://t.co/eWWbOQhOgH #venture-c… https://t.co/Dh1SWHRrub,0
Wed Nov 21 17:08:46 +0000 2018,Join us on November 29th for a glimpse into what goes into ensuring our clients understand the full value of their… https://t.co/dQxpnuFeuQ,0
Wed Nov 21 17:06:25 +0000 2018,The recent drop in oil prices represents another fly in the ointment as it has curbed investment in one of the few… https://t.co/V41EmLk33J,2
Wed Nov 21 17:06:00 +0000 2018,Here are the Chicago area’s top 5 multifamily investment sales of October https://t.co/7brUmAc40H,0
Wed Nov 21 16:50:05 +0000 2018,Looking back at the biggest omnibus bill in U.S. history  which passed earlier this year and included the long-awai… https://t.co/2zpDZdwomT,0
Wed Nov 21 16:35:36 +0000 2018,@None_Otha30 I lowkey need it! 7 nail clients and I’ll get my return on the investment 🤔,0
Wed Nov 21 16:33:25 +0000 2018,RT HIGH_TIMES_Mag: Greece Issues First Licenses to Produce Medical Cannabis. "Greece’s SYRIZA government believes t… https://t.co/bg9i2LtGI7,1
Wed Nov 21 16:25:05 +0000 2018,Bill Martin: High yield corporates  preferred securities  senior loans  investment grade corporates and emerging ma… https://t.co/MzPuyzwJJT,0
Wed Nov 21 16:20:16 +0000 2018,Honored and excited to be playing a role to help support this this dialogue between the investment community and go… https://t.co/rPUOEXb2Rf,1
Wed Nov 21 16:19:17 +0000 2018,The recent drop in oil prices represents another fly in the ointment as it has curbed investment in one of the few… https://t.co/V41EmLk33J,2
Wed Nov 21 16:17:48 +0000 2018,The recent drop in oil prices represents another fly in the ointment as it has curbed investment in one of the few… https://t.co/V41EmLk33J,2
Wed Nov 21 16:15:12 +0000 2018,#SEC Division of #Investment Management Provides Updates to the Investment Company Reporting Modernization Frequent… https://t.co/sAQD66UEU9,0
Wed Nov 21 16:14:27 +0000 2018,We need to see a rapid turnaround in sentiment to end the year with any kind of real gains in business investment.,1
Wed Nov 21 16:13:45 +0000 2018,Business investment is likely to soften according to @GrantThorntonUS chief economist @DianeSwonk  because “Tariffs… https://t.co/gedY5s818N,0
Wed Nov 21 16:12:33 +0000 2018,Honored and excited to be playing a role to help support this this dialogue between the investment community and go… https://t.co/rPUOEXb2Rf,1
Wed Nov 21 16:01:27 +0000 2018,It'd likely be a super-solid investment to put your money into whatever company makes the universal  plastic and ma… https://t.co/zyIoQOGQdn,0
Wed Nov 21 16:01:08 +0000 2018,RT HIGH_TIMES_Mag: Greece Issues First Licenses to Produce Medical Cannabis. "Greece’s SYRIZA government believes t… https://t.co/bg9i2LtGI7,1
Wed Nov 21 15:43:30 +0000 2018,#AI investment by industry!  The AI market is expected to reach USD 190.61 Billion by 2025 from USD 21.46 Billion i… https://t.co/afGFDA2Nmi,54
Wed Nov 21 15:42:00 +0000 2018,25 000 women are trafficked every year in Chicago. A $10k investment in @saltandlightCOA will help provide sex traf… https://t.co/WeZTlHE12j,0
Wed Nov 21 15:20:01 +0000 2018,Chengalpat la all theatres percentage basis daan..  All theatres will b Profit daan unless MG. No investment.  Idhu… https://t.co/4spwNGDuew,0
Wed Nov 21 15:16:28 +0000 2018,Electra ($ECA)  Conclusion:  In crypto  without traction or revenue  a token's speculative investment potential is… https://t.co/DGs0d532fg,0
Wed Nov 21 15:02:38 +0000 2018,@xchixm @RonColeman @TweetBrettMac Why should there be a soul to economics? “Soul” is subjective  which is how you… https://t.co/txaPAmImQT,2
Wed Nov 21 15:00:14 +0000 2018,Tata Investment Corp gains 8% as board approves share buyback https://t.co/o5M61oST2p https://t.co/pq9c316zdJ,0
Wed Nov 21 15:00:13 +0000 2018,Core durable goods data still weak  and showing the strain companies are feeling in the wake of tariffs. Hedging on… https://t.co/0ewKSmAtMf,5
Wed Nov 21 15:00:12 +0000 2018,@awealthofcs @CFAinstitute Agree with 95% of what you say but have to differ here - I'd view taxes  insurance as co… https://t.co/tXz7xDugE8,0
Wed Nov 21 14:55:57 +0000 2018,Core durable goods data still weak  and showing the strain companies are feeling in the wake of tariffs. Hedging on… https://t.co/0ewKSmAtMf,5
Wed Nov 21 14:43:01 +0000 2018,The markets have fallen back into the red on the year. How are you identifying investment opportunities &amp; researchi… https://t.co/v8uqsRzkA4,0
Wed Nov 21 14:40:46 +0000 2018,@xchixm @RonColeman @TweetBrettMac Why should there be a soul to economics? “Soul” is subjective  which is how you… https://t.co/txaPAmImQT,2
Wed Nov 21 14:38:31 +0000 2018,Purchase flight tickets from our tour operators for certain destinationusing Bitrace! The project is very serious a… https://t.co/1lGAdNBfw7,0
Wed Nov 21 14:32:08 +0000 2018,Lead Developer: Full Stack Developer – Wellesley  MA ‘ Job Description ‘ Eagle Investment Systems is currently seek… https://t.co/33UOx8JO6t,0
Wed Nov 21 14:26:13 +0000 2018,@xchixm @RonColeman @TweetBrettMac Why should there be a soul to economics? “Soul” is subjective  which is how you… https://t.co/txaPAmImQT,2
Wed Nov 21 14:12:02 +0000 2018,@Jessifer thanks  this semester I have tried to think of other things you posted and be more of a student advocate … https://t.co/kENwd8ZaFT,0
Wed Nov 21 14:06:39 +0000 2018,A lot of journalism is about low-income people  written to serve high-income people. How do we change that dynamic?… https://t.co/VPFJ8gqAug,32
Wed Nov 21 12:06:21 +0000 2018,Speaking of demand for cash……. Makes for a more selective investment outlook in 2019. AA #DriehausEM https://t.co/ycrxBNfrSh,11
Wed Nov 21 11:04:10 +0000 2018,Questions for these sorts of times: 1. Do you have a plan? 2. If so  have normal stock market losses derailed your… https://t.co/AmuEjVln5e,26
Wed Nov 21 09:57:36 +0000 2018,#Get your #investment returns to you in less than 4 #months. I only need 10 good #investors https://t.co/ElLdqy2Sp5,0
Wed Nov 21 09:42:34 +0000 2018,Questions for these sorts of times: 1. Do you have a plan? 2. If so  have normal stock market losses derailed your… https://t.co/AmuEjVln5e,26
Wed Nov 21 09:03:45 +0000 2018,One of the most fun ways to earn money without any investment. Know more: https://t.co/OCUPkQdnrc  #EarnHoney… https://t.co/7nJLd5kpua,1
Wed Nov 21 08:15:25 +0000 2018,Alibaba suffers rare 'down round' investment as Babytree's HK IPO prices low: sources https://t.co/1pksMcIHq7… https://t.co/3qvFfg8BsD,0
Wed Nov 21 08:10:47 +0000 2018,Private Equity Real Estate Funds Battle Challenges to Deploy Capital https://t.co/kGANlxf3QF #realestate #cre https://t.co/SSeH6o1d3s,0
Wed Nov 21 06:39:44 +0000 2018,Questions for these sorts of times: 1. Do you have a plan? 2. If so  have normal stock market losses derailed your… https://t.co/AmuEjVln5e,26
