Sat Jan 27 23:53:09 +0000 2018,Antioch hopes new Lovin Oven Cakery will spark investment downtown https://t.co/dGfFLS2sJc,0
Sat Jan 27 22:40:13 +0000 2018,Real estate investment ideas! Click to learn more! https://t.co/yEz3lqRHfz #Realtor #RealEstate #Investment #Agent… https://t.co/ZWQOmC1UEo,0
Sat Jan 27 22:01:03 +0000 2018,@CryptoBac @SecretOfCrypto Especially if you’re a child of privilege and your parents give you a massive investment,0
Sat Jan 27 22:00:17 +0000 2018,#VentureCapital deals and the real #investment #risks. One #Chicago story- Not all  #startups pass the valuation te… https://t.co/sImiRQmz0u,0
Sat Jan 27 21:39:23 +0000 2018,If you’re not following the @nyse Insta stories you need to. They just asked @arod investment advice,4
Sat Jan 27 21:39:23 +0000 2018,The earlier the investment  the greater the return. Download and use this graphic today for your early childhood de… https://t.co/SMaYxTWgtr,108
Sat Jan 27 21:29:18 +0000 2018,If you personalize losses  you can’t trade. I don’t see markets; I see risks  rewards  and money. Define your risk… https://t.co/J13I4odRIn,0
Sat Jan 27 21:15:23 +0000 2018,The earlier the investment  the greater the return. Download and use this graphic today for your early childhood de… https://t.co/SMaYxTWgtr,108
Sat Jan 27 21:13:19 +0000 2018,@CryptoCriedWolf thanks for the call out. You inspired me to get on kucoin. Original investment in $ocn is up 15%.   Thanks man!!!!! 🚀,7
Sat Jan 27 21:11:11 +0000 2018,@FutureAcid808 @alientomdotcom @Roland_US On the bright side. I’d rather lose a 300 investment over 3k.,1
Sat Jan 27 20:59:10 +0000 2018,@CryptoCriedWolf thanks for the call out. You inspired me to get on kucoin. Original investment in $ocn is up 15%.   Thanks man!!!!! 🚀,7
Sat Jan 27 20:52:23 +0000 2018,@CryptoCriedWolf thanks for the call out. You inspired me to get on kucoin. Original investment in $ocn is up 15%.   Thanks man!!!!! 🚀,7
Sat Jan 27 20:52:16 +0000 2018,@CryptoCriedWolf thanks for the call out. You inspired me to get on kucoin. Original investment in $ocn is up 15%.   Thanks man!!!!! 🚀,7
Sat Jan 27 20:52:12 +0000 2018,@CryptoCriedWolf thanks for the call out. You inspired me to get on kucoin. Original investment in $ocn is up 15%.   Thanks man!!!!! 🚀,7
Sat Jan 27 20:52:07 +0000 2018,What is the point of supporting a team like Liverpool? Like you can be the better team in 90% of your games but the… https://t.co/sotaO6OEiF,0
Sat Jan 27 20:52:02 +0000 2018,@CryptoCriedWolf thanks for the call out. You inspired me to get on kucoin. Original investment in $ocn is up 15%.   Thanks man!!!!! 🚀,7
Sat Jan 27 20:47:25 +0000 2018,Outcome Health CEO Rishi Shah stepping down as part of fraud settlement with investors that also includes $159 mill… https://t.co/8jIDsEiFbd,1
Sat Jan 27 20:45:28 +0000 2018,@CryptoCriedWolf thanks for the call out. You inspired me to get on kucoin. Original investment in $ocn is up 15%.   Thanks man!!!!! 🚀,7
Sat Jan 27 20:40:07 +0000 2018,Real estate investment ideas! Click to learn more! https://t.co/yEz3lqRHfz #Realtor #RealEstate #Investment #Agent… https://t.co/5jw6TYx5Wd,0
Sat Jan 27 20:32:29 +0000 2018,@adequateGF @1000lbbabydeer Houseboys are almost always a wise investment,0
Sat Jan 27 20:29:01 +0000 2018,This weekend on the Podcast we have @jcschwa14 arguing Arrieta doesn’t choke  @MatthewS_Aung arguing Darvish is wor… https://t.co/yLY9xGQZpU,6
Sat Jan 27 20:28:50 +0000 2018,This weekend on the Podcast we have @jcschwa14 arguing Arrieta doesn’t choke  @MatthewS_Aung arguing Darvish is wor… https://t.co/yLY9xGQZpU,6
Sat Jan 27 20:27:34 +0000 2018,This weekend on the Podcast we have @jcschwa14 arguing Arrieta doesn’t choke  @MatthewS_Aung arguing Darvish is wor… https://t.co/yLY9xGQZpU,6
Sat Jan 27 20:22:41 +0000 2018,See the most prevelant advocating of adjudication in a mother's resources is that  some are very imperative compone… https://t.co/wDTCFbWlEA,0
Sat Jan 27 20:16:15 +0000 2018,@FutureAcid808 @alientomdotcom @Roland_US On the bright side. I’d rather lose a 300 investment over 3k.,1
Sat Jan 27 20:15:27 +0000 2018,New Year  new investment objectives? Empower your portfolio to evolve with your life. https://t.co/u6JAbbvpr5 . https://t.co/LqkvaOv83Y,0
Sat Jan 27 20:08:05 +0000 2018,@jwsid @AmyWRecruiter Yeah I kinda agree  investment advice isn't really helpful unless you have much to invest. Ot… https://t.co/31Pio6wbQ7,0
Sat Jan 27 19:34:29 +0000 2018,@Kris__Nova I like: “What changes together stays together”. Not amazingly precise  though. Also  I like: “If tech a… https://t.co/kmz1YWGG1c,0
Sat Jan 27 19:18:09 +0000 2018,If a capricorn don't see you as an investment you not getting no money outta them.  A Taurus is lavish so they'll s… https://t.co/ggLZbP0x2f,2
Sat Jan 27 19:00:33 +0000 2018,Listen as Jesse Clem  co-founder and CEO of @Loquidity  talks #investing in #RealEstate  including potential advant… https://t.co/11L1lW2d7T,0
Sat Jan 27 19:00:01 +0000 2018,.@SpeakerRyan was rewarded with $500 000 in campaign $$$ from the Koch brothers for passing the #GOPTaxScam. Guess… https://t.co/K7N9RUzJFl,0
Sat Jan 27 18:40:53 +0000 2018,Real estate investment ideas! Click to learn more! https://t.co/yEz3lqRHfz #Realtor #RealEstate #Investment #Agent… https://t.co/dmqT4VFrXm,0
Sat Jan 27 18:34:23 +0000 2018,Want to earn an additional 40% of your investment on $BTC? Check out this website. This is for all you long term… https://t.co/wOnhGWOyId,0
Sat Jan 27 18:30:54 +0000 2018,If a capricorn don't see you as an investment you not getting no money outta them.  A Taurus is lavish so they'll s… https://t.co/ggLZbP0x2f,2
Sat Jan 27 18:24:38 +0000 2018,If a capricorn don't see you as an investment you not getting no money outta them.  A Taurus is lavish so they'll s… https://t.co/ggLZbP0x2f,2
Sat Jan 27 18:21:03 +0000 2018,Aries will spend some money ONLY when they like you. Sag niggas need coaxing. LIBRA IS TIIIIGHT AF. Capricorns will… https://t.co/ZfkzXiYqU1,0
Sat Jan 27 18:01:28 +0000 2018,Example BRRRR analysis step-by-step to show you how construction costs  income  and expenses factor into this real… https://t.co/ejO1LMa2BT,0
Sat Jan 27 17:59:03 +0000 2018,Goodness is the only investment that never fails. Henry David Thoreau https://t.co/q8QPloNAce,0
Sat Jan 27 17:50:16 +0000 2018,$200 Million in Funding  the largest #agtech investment to date  via @proverticalfarm https://t.co/uQACpgQnIG,0
Sat Jan 27 17:40:09 +0000 2018,#WhiteHouse Support for #CFIUS #Reform and Affirmation of U.S. Open Investment Policy / Senate Committee on… https://t.co/bYNHPXJ8tb,0
Sat Jan 27 17:28:26 +0000 2018,@WhatTheMicah Absolutely. I’d love Darvish  but ultimately I want the guy that gives them the best value for their investment.,0
Sat Jan 27 17:14:40 +0000 2018,Peter Thiel-Backed Firm Defies Jeff Sessions With Huge Weed Investment https://t.co/ZCTWMztZwT https://t.co/VMUbVZSZkx,27
Sat Jan 27 17:04:22 +0000 2018,@ShamusRider @FoxNews @JonScottFNC @HappeningNow It us a record setting national treasure. It broke all Atlantic Oc… https://t.co/kuuDyHFxUj,0
Sat Jan 27 17:00:04 +0000 2018,@SgtElzetta @AutoweekUSA True but Indycar racing brings unbelievably high amounts of revenue to the state each year… https://t.co/e9bm3pnZTH,0
Sat Jan 27 16:50:56 +0000 2018,@Kungfu_Elvis @dwarvenforge Yes! I definitely want to invest in the molds  it just becomes a time thing. It’ll be a… https://t.co/yHFZPGHd7o,0
Sat Jan 27 16:50:06 +0000 2018,Canaccord Genuity Beefs Up Cannabis Effort with U.S. Investment Banker Hire https://t.co/pCJuC0GJZ6 https://t.co/WZo1eD97mX,0
Sat Jan 27 16:46:10 +0000 2018,@TIME The 924 was considered "the poor man's Porsche" back in the 80's. That's why they're still much more affordab… https://t.co/TYAYiSlvIL,0
Sat Jan 27 16:38:03 +0000 2018,@caroljsroth You’re avoiding the real issue.  The wealth divide has never been worse.  “Capital investment” is a jo… https://t.co/13235Pt4dy,0
Sat Jan 27 16:35:05 +0000 2018,Investment grade corporate returns suffered amid the continued rise in the 10-year Treasury yield. https://t.co/MaTZLcgbRf,0
Sat Jan 27 16:24:22 +0000 2018,Outcome Health CEO Rishi Shah stepping down as part of fraud settlement with investors that also includes $159 mill… https://t.co/8jIDsEiFbd,1
Sat Jan 27 16:14:54 +0000 2018,getting my screen fixed was the best investment i’ve made this year by far :),0
Sat Jan 27 15:58:01 +0000 2018,LAD The Best Value Investment Stock \u2026 $LAD https://t.co/iu9sCLX5Pm,0
Sat Jan 27 15:44:59 +0000 2018,$SRMX $IFXY ADDED BIIIIIIIIIGLY!! Monday gonna be explosive  The investment world watched shares exit hands of the… https://t.co/SS4zGrSVAS,4
Sat Jan 27 15:40:34 +0000 2018,Real estate investment ideas! Click to learn more! https://t.co/yEz3lqRHfz #Realtor #RealEstate #Investment #Agent… https://t.co/6HTcxCS2SK,0
Sat Jan 27 15:38:12 +0000 2018,Tom Szabo  ein Investment-Stratege und Direktor von https://t.co/B1OUxaFrhS  investiert in Bergleuten mit unedlen M… https://t.co/6TBZ09gipi,0
Sat Jan 27 14:59:42 +0000 2018,U.S. Heads for 3% Growth Trifecta on Spending  Investment Punch https://t.co/HmIJ4bXgCE,1
Sat Jan 27 14:55:39 +0000 2018,If this were true it would be great. I’ll be there. I’m not missing out again. It’s worth a gamble  I believe I’m d… https://t.co/I00amcOJYo,0
Sat Jan 27 14:55:15 +0000 2018,MYST/BTC POTENTIAL PROFIT. \u2026 $MYSTBTC https://t.co/rbGDbk6Apt,0
Sat Jan 27 14:51:15 +0000 2018,MYST/BTC POTENTIAL PROFIT. \u2026 $MYSTBTC https://t.co/MT4NP0jpDl,0
Sat Jan 27 14:47:28 +0000 2018,On the way to meet a potential investor... #ShareThePositivity #Investor #Investment #ROI #Music… https://t.co/G2tkRG2kel,1
Sat Jan 27 14:46:10 +0000 2018,@IllimitableMan Nobody should be betting on it as an investment.  The value will gradually soften and the trade ran… https://t.co/fHP46Expsr,0
Sat Jan 27 14:41:44 +0000 2018,Plaintiff's attorneys: "It’s unfortunate that Mr. Rauner has insisted that it take place away from public view  but… https://t.co/3ZHIWF31Tm,4
Sat Jan 27 14:39:16 +0000 2018,Antioch hopes new Lovin Oven Cakery will spark investment downtown https://t.co/eF8d7oNNl1,0
Sat Jan 27 14:35:00 +0000 2018,Learn how an investment portfolio that combines office and multifamily properties works well together via… https://t.co/wKCTYgvEEF,0
Sat Jan 27 14:32:20 +0000 2018,#Boeing announces $300M employee-related and charitable investment as a result of #TaxReform legislation to support… https://t.co/xIZQAQMw1G,8012
Sat Jan 27 14:30:04 +0000 2018,Long term buy call @1\u2026 $DTBUSD https://t.co/AtB3NiTmyJ,0
Sat Jan 27 14:20:59 +0000 2018,POT/BTC POTENTIAL PROFIT 1\u2026 $POTBTC https://t.co/KGW8fukaWa,0
Sat Jan 27 14:04:18 +0000 2018,Waiting for your boss to give you the go-ahead to register for #c18lv? Build your personalized agenda before you re… https://t.co/YcayBAd0uR,4
Sat Jan 27 13:43:10 +0000 2018,Not a surprise. Tax incentives and cheap capital are driving investment  but high health care costs are driving a w… https://t.co/23WVaiwY1p,0
Sat Jan 27 13:42:27 +0000 2018,U.S. Heads for 3% Growth Trifecta on Spending  Investment Punch https://t.co/HmIJ4bXgCE,1
Sat Jan 27 13:40:45 +0000 2018,Not a surprise.  Tax incentives and cheap capital are driving investment  but high labor and benefit costs are driv… https://t.co/T3H0Gei4vW,0
Sat Jan 27 13:40:25 +0000 2018,Real estate investment ideas! Click to learn more! https://t.co/yEz3lqRHfz #Realtor #RealEstate #Investment #Agent… https://t.co/mcvTzHSm7S,0
Sat Jan 27 13:40:05 +0000 2018,@JonathanHoenig Interesting topic. So if you shouldn’t invest subjectively it’s all about objective investment eh?… https://t.co/QnZwJZOG8o,0
Sat Jan 27 13:29:57 +0000 2018,SHAREHOLDER ALERT: Pomerantz Law Firm Reminds Shareholders with Losses on their Investment in Philip Morris Interna… https://t.co/q9RktS4Mx0,0
Sat Jan 27 13:27:10 +0000 2018,Please RT #Bitcoin #Blockchain #cryptocurrency #crypto #money  https://t.co/vol4FPhqeA Best Bitcoin Investment Site… https://t.co/SWw8eldVtW,0
Sat Jan 27 13:26:48 +0000 2018,.@Mylo - how buying pop 'n' chips can boost your investment totals! https://t.co/dHFTX1YIyt   #entrepreneur… https://t.co/5itkWUhw6d,0
Sat Jan 27 13:21:58 +0000 2018,January Digest for MPNRF: Celgene's investment in MPNs  2 clinical trials &amp; remembering Bob https://t.co/c6yYxUocIA https://t.co/DoKFhM7uhX,1
Sat Jan 27 12:55:57 +0000 2018,Do you want to live above bills  and paycheck  do you want to be financially stable without  Financial crisis?Do yo… https://t.co/8E3KQY1oIN,0
Sat Jan 27 12:40:14 +0000 2018,Real estate investment ideas! Click to learn more! https://t.co/yEz3lqRHfz #Realtor #RealEstate #Investment #Agent… https://t.co/xRkBUJ7HY5,0
Sat Jan 27 11:50:27 +0000 2018,We work with Escoptions(one of the best broker you can find) and with a minimum investment of 500usd a profits of 4… https://t.co/2JzqEu4atm,0
Sat Jan 27 11:28:48 +0000 2018,I’m an outsider  so pardon my ignorance... but how does increasing salaries (a line item cost or investment) hurt r… https://t.co/yiNEoZbUki,7
Sat Jan 27 11:25:08 +0000 2018,Throw back to OG $TRX and $XVG sub 5 cent days. Watched them come up from 1 cent. Learned a lot about high volume c… https://t.co/2VU3ll3wuJ,8
Sat Jan 27 11:09:53 +0000 2018,@realDonaldTrump Investment in their own bottom line  asshole. I dare you to cough up hard facts on this ‘massive’… https://t.co/UylElZM6wM,0
Sat Jan 27 11:09:31 +0000 2018,Do you know that you can make profit of over $20 000 and more on binary&amp;bitcoin investment if you invest through th… https://t.co/MUiEY0AbNg,0
Sat Jan 27 10:54:36 +0000 2018,Rapunzl investment challenge with $20 000 in prizes coming soon  top performer takes home $5 000!!! https://t.co/73dhJLcrIp,4
Sat Jan 27 10:18:05 +0000 2018,The steel industry is calling on @POTUS to embrace strong Buy America requirements for infrastructure investment. R… https://t.co/fPUYrtLX3k,2
Sat Jan 27 10:04:55 +0000 2018,Your first step to stress free life starts here  Register to a life where you are your own boss. We offer account m… https://t.co/idBTpKI068,0
Sat Jan 27 09:40:40 +0000 2018,Real estate investment ideas! Click to learn more! https://t.co/yEz3lqRHfz #Realtor #RealEstate #Investment #Agent… https://t.co/prY8QKXfiq,0
Sat Jan 27 09:32:07 +0000 2018,#Politeia will be good for #Decred $DCR. It will be a breath of fresh air. The community needs a method to express… https://t.co/0OErQWqnOC,3
Sat Jan 27 08:54:18 +0000 2018,DB Corp - Investment View. $DBCORP https://t.co/N2X6oDpBEY,0
Sat Jan 27 08:24:05 +0000 2018,I’m an outsider  so pardon my ignorance... but how does increasing salaries (a line item cost or investment) hurt r… https://t.co/yiNEoZbUki,7
Sat Jan 27 08:06:34 +0000 2018,Throw back to OG $TRX and $XVG sub 5 cent days. Watched them come up from 1 cent. Learned a lot about high volume c… https://t.co/2VU3ll3wuJ,8
Sat Jan 27 08:03:06 +0000 2018,THE EVOLUTION OF ROBO-ADVISING REPORT: How automated investment products are disrupting and enhancing the wealth ma… https://t.co/O9vZB2LDKi,0
Sat Jan 27 08:00:40 +0000 2018,Thunder Launchpad to Help Tech Investment Take Off in Oklahoma - https://t.co/l56ZlJIi64 https://t.co/hGGeNEPPDy,0
Sat Jan 27 07:58:16 +0000 2018,World Merchants Ltd  is completing the broadest  most inclusive and cooperative global trade and investment consortium in 2017. JOIN US NOW!,2
Sat Jan 27 07:40:17 +0000 2018,Real estate investment ideas! Click to learn more! https://t.co/yEz3lqRHfz #Realtor #RealEstate #Investment #Agent… https://t.co/jUdigouxlk,0
Sat Jan 27 07:36:21 +0000 2018,Whether you’re considering slate with copper flashing or something a little more modest  a new roof is a major inve… https://t.co/LqVujpzXhT,0
Sat Jan 27 07:23:00 +0000 2018,I’m an outsider  so pardon my ignorance... but how does increasing salaries (a line item cost or investment) hurt r… https://t.co/yiNEoZbUki,7
Sat Jan 27 07:14:04 +0000 2018,Quality Systems (QSII) Upgraded at Zacks Investment Research https://t.co/SI03RL7n6Z #ENSW #ERP #CIO,0
Sat Jan 27 06:58:07 +0000 2018,@realDonaldTrump 🤦‍♂️ You did not bring any investment to the U.S.A. from Davos.,0
Sat Jan 27 06:51:23 +0000 2018,@JustOneAndDone @daohoaibac1 So between your initial ECA investment and coinsmarkets going down you didn't know ECA… https://t.co/7dmXdeAKcg,0
Sat Jan 27 06:46:55 +0000 2018,@TravisPixels @ChesterCheetah Wait enhance... If you jumble the letters it's icv and while that may look like nothi… https://t.co/2Q4WeusDkB,0
Sat Jan 27 06:30:57 +0000 2018,I’m an outsider  so pardon my ignorance... but how does increasing salaries (a line item cost or investment) hurt r… https://t.co/yiNEoZbUki,7
Sat Jan 27 06:02:39 +0000 2018,Q9. Blessed to find my soulmate. Dated 3 years  and I'm a faithful  good woman. Whenever he calls  I'm there. I've… https://t.co/0LxF4iiZEe,150
Sat Jan 27 05:58:17 +0000 2018,Investment Pick - SnowMan Logistics $SNOWMAN https://t.co/yum7NWOQwH,0
Sat Jan 27 05:53:20 +0000 2018,If you’re not following the @nyse Insta stories you need to. They just asked @arod investment advice,4
Sat Jan 27 05:52:01 +0000 2018,Investment Pick - Patel Logistics $PATINTLOG https://t.co/kkVf0bh594,0
Sat Jan 27 05:50:36 +0000 2018,I’m sold on positioning Chicago as a “hub for purposeful capitalism” Favorite @matsleder quote: “...I think the wor… https://t.co/SV51XLmQln,0
Sat Jan 27 05:47:13 +0000 2018,@brhodes He is seeking investment in America.  It couldn't be more clear. #MAGA,0
Sat Jan 27 05:36:57 +0000 2018,Eines der Hindernisse  die IT-Manager häufig auftreten  wenn sie versuchen IT Bewußsteinsbildung Initiativen umzuse… https://t.co/56ZZgvDxR4,0
Sat Jan 27 05:14:40 +0000 2018,FedEx will spend more than $3.2 Billion on wage increases  bonuses  pension funding  and capital investment as a... https://t.co/yqcjR2HiiF,0
Sat Jan 27 05:11:51 +0000 2018,@kittypawz11 Sounds like a great day. When you keep your trading portfolio 75% $BTC it's easy to walk away knowing… https://t.co/RQRjP5FxO9,0
Sat Jan 27 04:51:28 +0000 2018,I’m an outsider  so pardon my ignorance... but how does increasing salaries (a line item cost or investment) hurt r… https://t.co/yiNEoZbUki,7
Sat Jan 27 04:51:06 +0000 2018,If you’re not following the @nyse Insta stories you need to. They just asked @arod investment advice,4
Sat Jan 27 04:42:40 +0000 2018,Gov. Rauner investment involvement dispute continues - Blogs On Politics - Crain's Chicago Business… https://t.co/17VsfZwQRV,0
Sat Jan 27 04:40:12 +0000 2018,Real estate investment ideas! Click to learn more! https://t.co/yEz3lqRHfz #Realtor #RealEstate #Investment #Agent… https://t.co/cQvQu6kn7t,0
Sat Jan 27 04:12:40 +0000 2018,American Airlines CEO: Growth in our hubs creates connect... https://t.co/LoD5u6oyTq,0
Sat Jan 27 04:01:31 +0000 2018,US health IT investment skyrockets from to $7.1 billion https://t.co/p9heuABhwR via @HealthITNews,0
Sat Jan 27 03:56:54 +0000 2018,#Politeia will be good for #Decred $DCR. It will be a breath of fresh air. The community needs a method to express… https://t.co/0OErQWqnOC,3
Sat Jan 27 03:44:54 +0000 2018,Haven analyzes your spending and moves money into savings and investment accounts so you don’t have to. https://t.co/vFDC1SQyL1,0
Sat Jan 27 03:39:19 +0000 2018,#Politeia will be good for #Decred $DCR. It will be a breath of fresh air. The community needs a method to express… https://t.co/0OErQWqnOC,3
Sat Jan 27 03:36:00 +0000 2018,#Politeia will be good for #Decred $DCR. It will be a breath of fresh air. The community needs a method to express… https://t.co/0OErQWqnOC,3
Sat Jan 27 03:10:40 +0000 2018,Sellers are motivated to cut a deal in the winter months! Buyers- Now. Is. The. Time. To. Buy...... Don’t wait!… https://t.co/xl80LeM1bR,0
Sat Jan 27 03:02:01 +0000 2018,Secret Sauce: What makes their startup such a unique investment opportunity? What's their unfair advantage? Check i… https://t.co/iE9VETltoR,0
Sat Jan 27 02:53:19 +0000 2018,Peter Thiel-Backed Firm Defies Jeff Sessions With Huge Weed Investment https://t.co/ZCTWMztZwT https://t.co/VMUbVZSZkx,27
Sat Jan 27 02:26:44 +0000 2018,Plaintiff's attorneys: "It’s unfortunate that Mr. Rauner has insisted that it take place away from public view  but… https://t.co/3ZHIWF31Tm,4
Sat Jan 27 02:24:47 +0000 2018,Peter Thiel-Backed Firm Defies Jeff Sessions With Huge Weed Investment https://t.co/ZCTWMztZwT https://t.co/VMUbVZSZkx,27
Sat Jan 27 02:10:19 +0000 2018,So incredible. Out of #dazzlecon comes a proposed new investment vehicle for zebra companies. @AdamTheHutt created… https://t.co/SfoVDiKvVT,10
Sat Jan 27 02:07:08 +0000 2018,Plaintiff's attorneys: "It’s unfortunate that Mr. Rauner has insisted that it take place away from public view  but… https://t.co/3ZHIWF31Tm,4
Sat Jan 27 02:05:11 +0000 2018,@UnsleevedMedia Stop looking at Pauper as an investment and start thinking about it as a way to get low budget peop… https://t.co/elyUmWfGJo,0
Sat Jan 27 01:55:05 +0000 2018,#WhiteHouse Support for #CFIUS #Reform and Affirmation of U.S. Open Investment Policy / Senate Committee on… https://t.co/Eg66k6NGdn,0
Sat Jan 27 01:52:02 +0000 2018,@ThatGeeVirus Y’all been the best investment I’ve made in my life. My whole circle deserves the best that life can offer.,0
Sat Jan 27 01:48:43 +0000 2018,So incredible. Out of #dazzlecon comes a proposed new investment vehicle for zebra companies. @AdamTheHutt created… https://t.co/SfoVDiKvVT,10
Sat Jan 27 01:42:37 +0000 2018,You’ve got a guaranteed 8% Return on investment or a coin flip for negative -14 or positive +38 ... which scenario do you take?,0
Sat Jan 27 01:42:00 +0000 2018,@charliebilello Headline Q4 GDP number missed  but taking out the inventory drag (hurricane related) things are qui… https://t.co/0weVThd1Ot,2
Sat Jan 27 01:40:28 +0000 2018,Real estate investment ideas! Click to learn more! https://t.co/yEz3lqRHfz #Realtor #RealEstate #Investment #Agent… https://t.co/u2OYn6Ij7g,0
Sat Jan 27 01:39:52 +0000 2018,RT: Have friends looking to get in to crypto? Here is a video that I did  two hours long  but I helped 5 Whales int… https://t.co/4fB3sew8bq,21
Sat Jan 27 01:35:20 +0000 2018,Nice guys don’t always finish last  just more of a long term investment 😂 I’ve always been somewhat of a hopeless r… https://t.co/FIACmf4jqB,0
Sat Jan 27 01:29:14 +0000 2018,@andyfoster405 @michiganstateu Thanks for the reminder  my apologies!  I've researched the general topic a bit &amp; un… https://t.co/ANoIhae0N3,0
Sat Jan 27 01:14:06 +0000 2018,U.S. Heads for 3% Growth Trifecta on Spending  Investment Punch https://t.co/9N8wm70nJq,6
Sat Jan 27 01:09:53 +0000 2018,I guess a $500 000 cash on delivery arrangement was a pretty smart investment. They sure are good with money. https://t.co/UwLwO8b4V7,0
Sat Jan 27 01:01:44 +0000 2018,Former MLB all-star A-Rod breaks down a new $10 million investment https://t.co/jc0A9ElrqM,0
Sat Jan 27 01:01:12 +0000 2018,.@AISC #Steel Industry Calls on President to Embrace Strong #BuyAmerica Requirements for #Infrastructure Investment… https://t.co/FSd2DAFJv5,3
Sat Jan 27 01:00:00 +0000 2018,With a 100% autonomous system  NexusMind needed reliable  technical data that could aid in evaluating the worth of… https://t.co/Q6sEXUIsgX,0
Sat Jan 27 00:59:02 +0000 2018,If you’re not following the @nyse Insta stories you need to. They just asked @arod investment advice,4
Sat Jan 27 00:50:02 +0000 2018,Canaccord Genuity Beefs Up Cannabis Effort with U.S. Investment Banker Hire https://t.co/pSSoy0eZt2 https://t.co/Fi6JISlJla,0
Sat Jan 27 00:48:29 +0000 2018,What a 100-year-old shoe-shiner can teach you about Bitcoin - Rethink your cryptocurrency investment. Shoe-shiners… https://t.co/uQJiZA7FnM,0
Sat Jan 27 00:40:42 +0000 2018,Exclusive: U.S. gunmaker Remington turns to debt restructuring advisors - sources - (Reuters) - Remington Outdoor C… https://t.co/cyoZP5pxzM,1
Sat Jan 27 00:36:27 +0000 2018,@NexJql Oh--I missed the bit about 6.8%. Yes  that's about parity with investment expectations  so I don't think it… https://t.co/GaHmX3Whuz,0
Sat Jan 27 00:30:28 +0000 2018,Plaintiff's attorneys: "It’s unfortunate that Mr. Rauner has insisted that it take place away from public view  but… https://t.co/3ZHIWF31Tm,4
Sat Jan 27 00:29:46 +0000 2018,Plaintiff's attorneys: "It’s unfortunate that Mr. Rauner has insisted that it take place away from public view  but… https://t.co/3ZHIWF31Tm,4
Sat Jan 27 00:23:05 +0000 2018,RT: Have friends looking to get in to crypto? Here is a video that I did  two hours long  but I helped 5 Whales int… https://t.co/4fB3sew8bq,21
Sat Jan 27 00:21:07 +0000 2018,Peter Thiel-Backed Firm Defies Jeff Sessions With Huge Weed Investment https://t.co/ZCTWMztZwT https://t.co/VMUbVZSZkx,27
Sat Jan 27 00:18:00 +0000 2018,RT: Have friends looking to get in to crypto? Here is a video that I did  two hours long  but I helped 5 Whales int… https://t.co/4fB3sew8bq,21
Sat Jan 27 00:17:16 +0000 2018,„Backing jemand zu leben“ ist  wie Leapfrog Investment erstes Angebot von Jim Roth beschrieben wird  der Mitbegründ… https://t.co/ugWBRdGifc,0
Sat Jan 27 00:06:02 +0000 2018,Tauton  MA-based Bristol County Savings Bank  investment firm to merge divisions https://t.co/lPPDBJ0E86 https://t.co/1IJUSVAC1y,0
Sat Jan 27 00:04:28 +0000 2018,“The argument that should be made is [one that links] investment in children to growth in the economy "… https://t.co/QmThxDHdBm,1
Sat Jan 27 00:03:44 +0000 2018,It’s ease as ONE to FIVE #YourRealtor #LoveWhatYouDo #RealtyofChicago  https://t.co/AhCiIX13Tc 📈 #realestate 📈… https://t.co/qwSXGsSCnn,0
Sat Jan 27 00:03:44 +0000 2018,It’s ease as ONE to FIVE #YourRealtor #LoveWhatYouDo #RealtyofChicago  https://t.co/AhCiIX13Tc 📈 #realestate 📈… https://t.co/7hnxud5UvN,0
