Fri Oct 26 12:32:07 +0000 2018,Committee on Foreign Investment in the U.S. (#CFIUS) Pilot Program: New Mandatory Filings for Non-passive Foreign I… https://t.co/iENSvRvHvG,2
Fri Oct 26 12:30:33 +0000 2018,Major banks (JPMorgan Chase  Goldman Sachs  and Citigroup) are teaching investment bankers to code as artificial in… https://t.co/I7xlSWE3g2,0
Fri Oct 26 12:30:32 +0000 2018,Committee on Foreign Investment in the U.S. (#CFIUS) Pilot Program: New Mandatory Filings for Non-passive Foreign I… https://t.co/iENSvRvHvG,2
Fri Oct 26 12:30:09 +0000 2018,6 Deal-Breakers that Disqualify a Market for Real Estate Investment https://t.co/RuhMhXhKIF,0
Fri Oct 26 12:20:14 +0000 2018,LSE to go ahead with Saudi investment event | Financial Times https://t.co/oTGxBC6Mo0,0
Fri Oct 26 12:15:20 +0000 2018,Japan Banks  China Investment to Set Up $1.8 Billion Trade Fund - Bloomberg https://t.co/JKOwbVHXwa,0
Fri Oct 26 12:14:11 +0000 2018,Another reason to #invest in #Canada: import for your supply chain  export to new markets in Asia with the #CPTPP.… https://t.co/TYnl6Tvz1J,0
Fri Oct 26 11:45:02 +0000 2018,@pomospice ME TOO I used to go to the doctor every few months and get those fuckos cleared out but then I just boug… https://t.co/XaEsTBzWyd,0
Fri Oct 26 11:36:40 +0000 2018,Virtus Investment Partners Announces Financial Results for the Third Quarter 2018 https://t.co/2wGcaN1pZp… https://t.co/3i83PkTjgQ,0
Fri Oct 26 11:34:46 +0000 2018,JOB; Chicago IL USA - Investment Banking Analyst Intern - Mandarin Required Investment Banking Intern Our: Mandarin… https://t.co/V0EVT7bZRP,0
Fri Oct 26 11:23:05 +0000 2018,London-based #mobile payments and loyalty platform @yoyowallet has secured $30 million in a partnership agreement f… https://t.co/wsHKSrchQI,0
Fri Oct 26 11:14:31 +0000 2018,This was one of my favorite sessions at #MICIN -- The 10 Commandments of Investment Management @MohnishPabrai. I al… https://t.co/OZBjZhsYdI,2
Fri Oct 26 11:14:24 +0000 2018,Coming up next we'll bring in @spshoot for your weekend investment tips!  And stay tuned all morning long for your… https://t.co/xMxpqsoTC8,0
Fri Oct 26 11:12:55 +0000 2018,This was one of my favorite sessions at #MICIN -- The 10 Commandments of Investment Management @MohnishPabrai. I al… https://t.co/OZBjZhsYdI,2
Fri Oct 26 11:04:52 +0000 2018,Despite Trade War  China Opens Wallet For U.S. Exports Of Semiconductors  Pharma. #technology #pharmaceutical… https://t.co/fNLvWpULAh,6
Fri Oct 26 11:04:52 +0000 2018,Despite Trade War  China Opens Wallet For U.S. Exports Of Semiconductors  Pharma. #technology #pharmaceutical… https://t.co/fNLvWpULAh,6
Fri Oct 26 11:04:50 +0000 2018,Despite Trade War  China Opens Wallet For U.S. Exports Of Semiconductors  Pharma. #technology #pharmaceutical… https://t.co/fNLvWpULAh,6
Fri Oct 26 11:04:47 +0000 2018,Despite Trade War  China Opens Wallet For U.S. Exports Of Semiconductors  Pharma. #technology #pharmaceutical… https://t.co/fNLvWpULAh,6
Fri Oct 26 11:04:45 +0000 2018,Despite Trade War  China Opens Wallet For U.S. Exports Of Semiconductors  Pharma. #technology #pharmaceutical… https://t.co/fNLvWpULAh,6
Fri Oct 26 11:04:43 +0000 2018,Despite Trade War  China Opens Wallet For U.S. Exports Of Semiconductors  Pharma. #technology #pharmaceutical… https://t.co/fNLvWpULAh,6
Fri Oct 26 11:03:13 +0000 2018,Despite Trade War  China Opens Wallet For U.S. Exports Of Semiconductors  Pharma. #technology #pharmaceutical… https://t.co/fNLvWpULAh,6
Fri Oct 26 10:50:06 +0000 2018,Why do we allow ourselves to be convinced that we have to choose between developer-funded public open space or no p… https://t.co/IHpLrD8vAA,7
Fri Oct 26 10:32:37 +0000 2018,It was an honor to speak at the Morningstar Investment Conference - Mumbai! #MICIN https://t.co/DIWrfoC04f,0
Fri Oct 26 10:17:25 +0000 2018,I'd love to see a Harvard Business School case study on the payout on this $60 million investment.  Here in IL  the… https://t.co/LENkonV1AK,0
Fri Oct 26 09:15:22 +0000 2018,#Bitcoin #Ethereum #Litecoin #OdysseyOCN #Dogecoin #Ripple #Dash #Golem #Cardano #CureCoin #XEM #Monero #Zcash… https://t.co/VOJdtoVdN3,0
Fri Oct 26 08:46:20 +0000 2018,With SportsFix Token fans have unlimited access to a variety of products that will end up meeting their needs. Grea… https://t.co/lgcR0BuREa,0
Fri Oct 26 08:41:32 +0000 2018,I really love the vision of the team and the idea  which they are trying to implement. Stay tuned with us and don’t… https://t.co/TACI6iHXaM,0
Fri Oct 26 08:13:37 +0000 2018,CoStar's Earnings Are Off the Charts. Here's Why. https://t.co/7RQGzmovp9 #realestate #cre https://t.co/sOYWbk9J2Z,1
Fri Oct 26 08:11:50 +0000 2018,My 1st Investment Portfolio https://t.co/GxlGnV4e7S,0
Fri Oct 26 07:57:46 +0000 2018,Risk Discipline in #CRE Investing: Staying Cool When Others Are Losing Their Heads https://t.co/yhUteCQU4C… https://t.co/azvIhACDTb,0
Fri Oct 26 07:49:02 +0000 2018,How @Quuu_co positioned itself for #investment via @MatthewSpurr https://t.co/w95RqiXZEs #venturecapital https://t.co/DABj9BV2Kl,0
Fri Oct 26 07:00:25 +0000 2018,To be held in urban wealth fund. Broad based public ownership of city housing stock could incentivize more equitabl… https://t.co/izXPsBuJwJ,1
Fri Oct 26 04:40:14 +0000 2018,Ok @FUNDConference.   That. Was. FUN!  What an incredible mix of people who are passionate about making the world a… https://t.co/AfH2l7BHvG,1
Fri Oct 26 04:39:54 +0000 2018,Chicago’s startups continue to lead the nation in returns https://t.co/cg1ZnV5Mpy,2
Fri Oct 26 04:27:10 +0000 2018,Fixing Up An Investment: 1987 Trans Am GTA https://t.co/taXKNquwZN,0
Fri Oct 26 04:18:53 +0000 2018,Relativity Space Steps Closer to 3D Printing Complete Rocket with New Investment https://t.co/eO5RstqG6k… https://t.co/t6QsBOos0I,3
Fri Oct 26 03:50:02 +0000 2018,This Company Is Already Applying Machine Learning in Credit Card Fraud. Many more applications to come. Follow-on f… https://t.co/mNsSymRyYV,0
Fri Oct 26 03:39:00 +0000 2018,The reality is that Coinbase's success has a direct &amp; significant impact on cryptocurrency adoption and investment. https://t.co/eNBNQeBTVb,1
Fri Oct 26 03:30:02 +0000 2018,Investment Opportunity for Atlas Space  top 12 satellite category disruptor per Morgan Stanley   closing Oct. 31… https://t.co/NW5S5rYMdd,0
Fri Oct 26 03:26:37 +0000 2018,The reality is that Coinbase's success has a direct &amp; significant impact on cryptocurrency adoption and investment. https://t.co/eNBNQeBTVb,1
Fri Oct 26 03:07:16 +0000 2018,What a fantastic investment of time this week! Thank you @VMware for caring about your partners enough to bring us… https://t.co/DJImgl1hj7,1
Fri Oct 26 02:39:29 +0000 2018,.@LUnderwood630: ✅ Supports renewable energy ✅ Supports investment in public transit ✅ Supports safeguards to ensur… https://t.co/M6t21UfIop,4
Fri Oct 26 02:30:12 +0000 2018,Investment Strategy https://t.co/aqOPTqjC8c #venture-capital @vcapital_invest #VC https://t.co/25H0FPxPZT,0
Fri Oct 26 02:30:11 +0000 2018,Read about this Follow-on investment for us with a Machine Learning Company working with Fortune 1000 co's to stop… https://t.co/ZvI8OzK3Fc,0
Fri Oct 26 02:18:50 +0000 2018,Probably a great investment tbh https://t.co/DmII6E8nwL,0
Fri Oct 26 02:15:55 +0000 2018,I learn something new every day .... https://t.co/qYY1IhDHQD,0
Fri Oct 26 01:55:23 +0000 2018,@heatherkenny @JessicaValenti Source is a hiring manager friend at a financial investment firm. They now assess the… https://t.co/euSGs9N1kw,0
Fri Oct 26 01:41:39 +0000 2018,Ok @FUNDConference.   That. Was. FUN!  What an incredible mix of people who are passionate about making the world a… https://t.co/AfH2l7BHvG,1
Fri Oct 26 01:41:09 +0000 2018,To get the most out of their #innovation investments  companies must play from the same song sheet. @Accenture's ne… https://t.co/6XTLxugXYj,0
Fri Oct 26 01:39:10 +0000 2018,Buffet always said he could put his investment strategy in the newspaper and 99% of the people would never follow. I agree.,1
Fri Oct 26 01:32:12 +0000 2018,Buffet always said he could put his investment strategy in the newspaper and 99% of the people would never follow. I agree.,1
Fri Oct 26 01:31:23 +0000 2018,@EllenMignone "Collateral". Great cast  thick plot and nicely only four parts so it's not a huge investment.,0
Fri Oct 26 01:10:01 +0000 2018,Being able to write about controversial topics is a must for financial industry thought leaders in today's business… https://t.co/RbD6zkz1ux,0
Fri Oct 26 01:09:56 +0000 2018,Buying my weighted blanket was such a great investment tbh,0
Fri Oct 26 01:09:50 +0000 2018,#chicagostartups are leading the nation in exit multiple on invested capital over the last 5 yrs.  Simply put  inve… https://t.co/zpTujraFiK,6
Fri Oct 26 01:03:10 +0000 2018,Chicago Investment Properties At 30-50% Below Market Value  https://t.co/nCd1HQjBUE  Serious Buyers Only… https://t.co/LT6Mwf7Hh0,0
Fri Oct 26 01:01:00 +0000 2018,With a 100% autonomous system  NexusMind needed reliable  technical data that could aid in evaluating the worth of… https://t.co/x83cTTkHgK,0
Fri Oct 26 01:00:24 +0000 2018,Chicago Investment Properties At 30-50% Below Market Value  https://t.co/yow3g0DJNA  Serious Buyers Only… https://t.co/x6kplKLGz8,0
Fri Oct 26 01:00:00 +0000 2018,The Collaborative for #FrontierFinance works to drive more #ImpInv capital toward businesses in emerging markets. (… https://t.co/SbOAdcYYRH,1
Fri Oct 26 00:55:46 +0000 2018,@JOrtiz122482 Automate your investing. Design it so that a certain amount comes out of your bank on the days you ge… https://t.co/OjeJRow0Tp,0
Fri Oct 26 00:40:39 +0000 2018,Long-term care led all health care segments tracked by investment bankers in deals for the third quarter of 2018 an… https://t.co/hSeI7SubbL,1
Fri Oct 26 00:39:02 +0000 2018,#chicagostartups are leading the nation in exit multiple on invested capital over the last 5 yrs.  Simply put  inve… https://t.co/zpTujraFiK,6
Fri Oct 26 00:32:27 +0000 2018,Investment professionals: Don't 'bury the lead' when writing your investment letters. In this video … https://t.co/37Paasmftr,0
Fri Oct 26 00:16:15 +0000 2018,Michael Jordan Makes His Foray Into Esports With Startup Investment  https://t.co/8JzchZnKFg,0
Fri Oct 26 00:14:02 +0000 2018,Primus trade investment  withdrawals are made so easy that you can be secured https://t.co/muW0NW9QtL,0
Fri Oct 26 00:09:25 +0000 2018,@MainEventTV_AKA @sie_kensou77 @Such_the_Madman @Bloodiajinn @Spectpooheagles now Michael Jordan getting himself a… https://t.co/6swCwwtOz0,0
