Fri Oct 26 23:51:05 +0000 2018,Epic Raises $1.25 Billion In Investment Capital https://t.co/C22EWALiVz https://t.co/VSHWjPooZc,0
Fri Oct 26 23:50:02 +0000 2018,Are you equipped to Navigate The Venture Capital Investment Class? Probably not. https://t.co/lDp9qJRPvA #venture-c… https://t.co/cxCQAlIB3D,0
Fri Oct 26 23:33:27 +0000 2018,Investment Property Tax Deductions https://t.co/5UppjyGdCg What Uncle Sam gives  Uncle Sam takes away.… https://t.co/VnYRVIMA2j,0
Fri Oct 26 23:32:46 +0000 2018,Seven NFL picks just posted for subscribers.  18-7 (72.0%) +8.89u (+35.6% Return On Investment)  Venmo &gt;&gt;&gt; @ GlennL… https://t.co/W8pbKTEQJX,0
Fri Oct 26 23:30:12 +0000 2018,Investment Property Tax Deductions https://t.co/LF15ZYEv0y What Uncle Sam gives  Uncle Sam takes away.… https://t.co/JwF0LBfCk5,0
Fri Oct 26 23:30:05 +0000 2018,VCapital's braintrust looks at the emerging opportunity in venture capital investing for mere mortals… https://t.co/LCTevRGvoU,0
Fri Oct 26 23:27:47 +0000 2018,@RegalChicken @hiltzikm OK  he’s hit a number twice. You might want to read more than one number. Much of what’s pu… https://t.co/hJRErETXoQ,0
Fri Oct 26 23:24:42 +0000 2018,@HummingbirdRSO @KiranOpal @thecoalbaker @isgoodrum Ur looking at this through such radlib glasses that is funny: w… https://t.co/oSm2zcJ64v,0
Fri Oct 26 23:19:19 +0000 2018,Yeezy 500 mauve size 4.5 good investment or no ?,0
Fri Oct 26 23:00:31 +0000 2018,Read about this Follow-on investment for us with a Machine Learning Company working with Fortune 1000 co's to stop… https://t.co/wMLOoMTiss,0
Fri Oct 26 22:51:32 +0000 2018,Those trying to get the biggest return on their investment should have this installed ASAP. https://t.co/HhX3ZvjCV8 https://t.co/nEYUBZ5XOj,0
Fri Oct 26 22:49:25 +0000 2018,It’s a big difference from being a branded company vs a brand-led company. I wanna be brand-led. Takes a lot more i… https://t.co/dIbO6rTkd0,0
Fri Oct 26 22:49:25 +0000 2018,The person who buys DaVita stock is willing to sit back for many years as a growing  low risk earnings steam slowly… https://t.co/Ug9uc9UTns,0
Fri Oct 26 22:47:00 +0000 2018,.@WFC_Writing Founder and Head writer @ScottWentworth has 3 simple pieces of advice for investment professionals wh… https://t.co/3kR4PUxumA,0
Fri Oct 26 22:39:24 +0000 2018,Senior housing capital markets maintained a robust performance in 2018. See what factors are pushing asset valuatio… https://t.co/A5um0kR2Sp,2
Fri Oct 26 22:38:48 +0000 2018,[NEW POST]: Tokenized Agricultural Assets as a New Investment on - Smartlands + https://t.co/7TTzjbhPr0 #cryptocurrency #crypto,0
Fri Oct 26 22:30:03 +0000 2018,Artificial Intelligence and the Intelligent Investor. Insights from legendary VC Len Batterson on how he approaches… https://t.co/evRwsJXBSB,0
Fri Oct 26 22:30:02 +0000 2018,Investment Opportunity for Atlas Space  top 12 satellite category disruptor per Morgan Stanley   closing Oct. 31… https://t.co/66ZRv1aEXi,0
Fri Oct 26 22:20:02 +0000 2018,For this week  I focused on the new cultural and industrial investment that is helping to revitalize Pullman  one o… https://t.co/8tTLibGfdk,12
Fri Oct 26 22:19:46 +0000 2018,Creekside at Kilgore 36 BFR Investment Opportunity Buford GA #Buford #Georgia #CRE @svnic #Residential… https://t.co/yIapevNBZu,0
Fri Oct 26 22:18:46 +0000 2018,An investment in knowledge always pays the best interest.  Ben franklin,0
Fri Oct 26 22:15:53 +0000 2018,See our latest #Chicago  IL #job and click to apply: Senior Investment Banking Analyst - https://t.co/wxvGDVrv8e… https://t.co/7VeakuaoSY,0
Fri Oct 26 22:03:39 +0000 2018,I have about 6 passive income streams and after about a year  @turo has proven to be the worst. Not only does it ha… https://t.co/WkrSlT4fGV,0
Fri Oct 26 21:54:11 +0000 2018,The South Side community is receiving the investment it deserves  https://t.co/hDbTfQsOSD,5
Fri Oct 26 21:50:17 +0000 2018,The South Side community is receiving the investment it deserves  https://t.co/hDbTfQsOSD,5
Fri Oct 26 21:41:43 +0000 2018,The South Side community is receiving the investment it deserves  https://t.co/hDbTfQsOSD,5
Fri Oct 26 21:30:26 +0000 2018,This Company Is Already Applying Machine Learning in Credit Card Fraud. Many more applications to come. Follow-on f… https://t.co/c2wpOBbJQw,0
Fri Oct 26 21:30:01 +0000 2018,The South Side community is receiving the investment it deserves  https://t.co/hDbTfQsOSD,5
Fri Oct 26 21:13:23 +0000 2018,Sears Holding Corp Hired Evercore Investment Bank Board Director https://t.co/4TZiHhWIYB via @YouTube,0
Fri Oct 26 21:10:00 +0000 2018,Industry groups say #SEC's proposed #RegBI delivers on establishing a uniform best interest standard of care for pr… https://t.co/VlMPfnNIqQ,0
Fri Oct 26 21:07:54 +0000 2018,We're #hiring! Read about our latest #job opening here: Investment Banking Analyst - https://t.co/E9M59AOEXU… https://t.co/7wsG1fE01Y,0
Fri Oct 26 20:57:20 +0000 2018,Fresh off the press. Here’s another job opening at DePaul: Investment Manager in #Chicago  IL… https://t.co/N8o6hSc0mQ,0
Fri Oct 26 20:52:22 +0000 2018,@ThomasSadoski @flanaganfilm Is it worth the time investment? I’m always kinda concerned about the possibility of binging a bad show.,0
Fri Oct 26 20:50:02 +0000 2018,Are you equipped to Navigate The Venture Capital Investment Class? Probably not. https://t.co/5Z2ow61Dmh #venture-c… https://t.co/1PHePiCX9u,0
Fri Oct 26 20:47:27 +0000 2018,"Epic  Maker of Fortnite  Raises $1.25 Billion" by MICHAEL J. de la MERCED via NYT https://t.co/4blCEmDZBr,0
Fri Oct 26 20:45:50 +0000 2018,"Epic  Maker of Fortnite  Raises $1.25 Billion" by MICHAEL J. de la MERCED via NYT The New York Times https://t.co/p6Egxr7lFx,0
Fri Oct 26 20:33:03 +0000 2018,What if someone designed a baby bottle that distributed milk into a thinner layer? Doing that would expand the liqu… https://t.co/lWDuJubqHU,0
Fri Oct 26 20:30:20 +0000 2018,Artificial Intelligence and the Intelligent Investor. Insights from legendary VC Len Batterson on how he approaches… https://t.co/ouA1KddIhM,0
Fri Oct 26 20:20:05 +0000 2018,This Company Is Already Applying Machine Learning in Credit Card Fraud. Many more applications to come. Follow-on f… https://t.co/mNoKDUTuwC,0
Fri Oct 26 20:04:06 +0000 2018,RetFXPro Hearing: Former Hong Kong securities regulator gives China investment a ‘wide berth’… https://t.co/fC7Uja3wMV,0
Fri Oct 26 20:02:44 +0000 2018,@MasonLeschyna @alandrummond2 @DrJenGunter what's your investment here? Because the suspicion is that you're a gun… https://t.co/8o6NHk4sRo,0
Fri Oct 26 20:01:00 +0000 2018,Cloud monitoring provides insights that empower organizations to maximise the investment in #cloud applications to… https://t.co/zhV673fEpX,0
Fri Oct 26 20:00:40 +0000 2018,Are you equipped to Navigate The Venture Capital Investment Class? Probably not. https://t.co/TFne0JOBqS #venture-c… https://t.co/xQmRXjIBn9,0
Fri Oct 26 20:00:07 +0000 2018,Why a former Hong Kong securities regulator gives China investment a ‘wide berth’ today. https://t.co/bqAxbVNiQ5,0
Fri Oct 26 19:56:52 +0000 2018,@heyitsaesh @ItsJustKarla In some communities  for-profits are the primary provider of technical and career-oriente… https://t.co/MDgONb1o3l,0
Fri Oct 26 19:53:36 +0000 2018,We're excited to share that we're now integrated with Schwab Performance Technologies PortfolioCenter! This integra… https://t.co/7XdUUoPsEO,0
Fri Oct 26 19:50:02 +0000 2018,Read about this Follow-on investment for us with a Machine Learning Company working with Fortune 1000 co's to stop… https://t.co/gVQTUHgLIy,0
Fri Oct 26 19:30:33 +0000 2018,Artificial Intelligence and the Intelligent Investor. Insights from legendary VC Len Batterson on how he approaches… https://t.co/EiLR7ch24Y,0
Fri Oct 26 19:30:02 +0000 2018,Seeking global deals  Taiho swells its U.S.-based VC fund to $300M https://t.co/kwi51jUQST #global #VC #investment https://t.co/3X7ePCCepA,0
Fri Oct 26 19:17:24 +0000 2018,Uncertainty regarding tariffs and risk of further escalation of trade tensions have a price - hesitation to invest.… https://t.co/nbEBxvL210,10
Fri Oct 26 19:11:44 +0000 2018,A bad investment is better than no investment,0
Fri Oct 26 19:00:49 +0000 2018,Financial OR Investment Analyst for Family Foundation - Skokie  IL https://t.co/jHcYZ4SeyI,0
Fri Oct 26 18:58:49 +0000 2018,Don't put your organization at risk. 🙅‍♀️ Take these steps to optimize IT costs to drive spending and cost reductio… https://t.co/BNVXamAScn,0
Fri Oct 26 18:57:18 +0000 2018,"3 Ways to Create a Climate Change Investment Strategy" by PAUL SULLIVAN via NYT https://t.co/BimpGcVoqJ,0
Fri Oct 26 18:53:47 +0000 2018,Cetera Investment Management has released a new market commentary discussing the causes behind the recent market se… https://t.co/l85A7kfy51,1
Fri Oct 26 18:52:01 +0000 2018,We're #hiring! Click to apply: Investment Banking Analyst - https://t.co/T2PBmGP22Z #InvestmentBanking #Chicago  IL #Job #Jobs #CareerArc,0
Fri Oct 26 18:49:01 +0000 2018,Thanks @Ali_Wyne - good to see great @MacroPoloChina representation! I’d also recommend you check out my colleagues… https://t.co/vhO2Q9mPA7,1
Fri Oct 26 18:48:43 +0000 2018,For this week  I focused on the new cultural and industrial investment that is helping to revitalize Pullman  one o… https://t.co/8tTLibGfdk,12
Fri Oct 26 18:48:35 +0000 2018,For this week  I focused on the new cultural and industrial investment that is helping to revitalize Pullman  one o… https://t.co/8tTLibGfdk,12
Fri Oct 26 18:47:15 +0000 2018,28 bundles of hair only $650 😱(12-24in) 4 pieces of EACH LENGTH 💕 and a FREE LOGO DESIGN 😅 that's a great investmen… https://t.co/EoDIWJizyP,0
Fri Oct 26 18:45:08 +0000 2018,VCapital's braintrust looks at the emerging opportunity in venture capital investing for mere mortals… https://t.co/P6YMfcW1wX,0
Fri Oct 26 18:44:29 +0000 2018,Thanks @Ali_Wyne - good to see great @MacroPoloChina representation! I’d also recommend you check out my colleagues… https://t.co/vhO2Q9mPA7,1
Fri Oct 26 18:43:26 +0000 2018,To get the most out of their #innovation investments  companies must play from the same song sheet. @Accenture's ne… https://t.co/6XTLxugXYj,0
Fri Oct 26 18:40:06 +0000 2018,VCapital's braintrust looks at the emerging opportunity in venture capital investing for mere mortals… https://t.co/g33zuQlfq6,0
Fri Oct 26 18:38:23 +0000 2018,South Africa Investment Conference Session Mining https://t.co/UT3JcPPysE via @YouTube,0
Fri Oct 26 18:37:40 +0000 2018,Investment Summit to focus on Tourism https://t.co/mSmQ8rKlhg via @YouTube,0
Fri Oct 26 18:35:23 +0000 2018,SA Investment Summit to secure billions in cash injections https://t.co/4vfZ5tZC5e via @YouTube,0
Fri Oct 26 18:33:16 +0000 2018,For this week  I focused on the new cultural and industrial investment that is helping to revitalize Pullman  one o… https://t.co/8tTLibGfdk,12
Fri Oct 26 18:32:41 +0000 2018,Aspen Pharmacare on the 2018 Investment Conference https://t.co/lUnx9wPb4o via @YouTube,0
Fri Oct 26 18:30:42 +0000 2018,VCapital's braintrust looks at the emerging opportunity in venture capital investing for mere mortals… https://t.co/ySEk5wUEk1,0
Fri Oct 26 18:28:42 +0000 2018,Mining sector gets huge investment pledges https://t.co/HmfBmmMLqy via @YouTube,0
Fri Oct 26 18:24:55 +0000 2018,Its not every day that a new coffee shop makes news  but this is one with a mission in a neighborhood that's been l… https://t.co/vaImYal8DI,1
Fri Oct 26 18:23:25 +0000 2018,Websites  Social Media &amp; Email Marketing - “Those three avenues are where people are able to tell their story...”… https://t.co/LmB1zFDvAI,0
Fri Oct 26 18:21:46 +0000 2018,Women account for less that 17% of senior leaders in investment banking. #adtalemEDGE,0
Fri Oct 26 18:15:38 +0000 2018,Huge thanks to the generosity of @braintree for being our Career Services Guest Advisor this week! Your time with o… https://t.co/ZS3YOUbdS6,1
Fri Oct 26 18:15:26 +0000 2018,Huge thanks to the generosity of @braintree for being our Career Services Guest Advisor this week! Your time with o… https://t.co/ZS3YOUbdS6,1
Fri Oct 26 18:12:26 +0000 2018,Speaking at an EB-5 Seminar in Singapore on Nov 14. Here is the link to register as an attendee:   https://t.co/iezk5WJ7cw,0
Fri Oct 26 18:06:32 +0000 2018,Investment professionals: Don't 'bury the lead' when writing your investment letters. In this video … https://t.co/HelCqMQaWf,0
Fri Oct 26 18:05:03 +0000 2018,@Keubiko ...actually negative (as it assumes today's continual millions of investment in Waymo continues indefinitely for 15 years :) ).,0
Fri Oct 26 17:59:42 +0000 2018,Chicago’s startups continue to lead the nation in returns https://t.co/ljubdExkrG via @VentureBeat,0
Fri Oct 26 17:57:27 +0000 2018,You’re worth your investment. Don’t stop believing in your capabilities. #goalgetta https://t.co/j4LQsrcU0Q,1
Fri Oct 26 17:51:31 +0000 2018,For this week  I focused on the new cultural and industrial investment that is helping to revitalize Pullman  one o… https://t.co/8tTLibGfdk,12
Fri Oct 26 17:48:54 +0000 2018,@bradrobinson8 WHY would i rush a multi-million dollar investment back to face the Jets? The Jets!  I would rest hi… https://t.co/7T6fdLcw5Y,0
Fri Oct 26 17:48:00 +0000 2018,For this week  I focused on the new cultural and industrial investment that is helping to revitalize Pullman  one o… https://t.co/8tTLibGfdk,12
Fri Oct 26 17:45:45 +0000 2018,For this week  I focused on the new cultural and industrial investment that is helping to revitalize Pullman  one o… https://t.co/8tTLibGfdk,12
Fri Oct 26 17:40:04 +0000 2018,If you are looking opportunites for investment it is here #EndChain #ICO https://t.co/LBNPMYAF85,0
Fri Oct 26 17:29:19 +0000 2018,Saw a shirt for programmers that said "I turn coffee into code". They should make one for investment bankers that s… https://t.co/ICoGP1oiW4,0
Fri Oct 26 17:25:21 +0000 2018,Investment Opportunity for Atlas Space  top 12 satellite category disruptor per Morgan Stanley   closing Oct. 31… https://t.co/3qLJcNdDbm,1
Fri Oct 26 17:20:34 +0000 2018,For this week  I focused on the new cultural and industrial investment that is helping to revitalize Pullman  one o… https://t.co/8tTLibGfdk,12
Fri Oct 26 17:15:22 +0000 2018,How to Mobilize Private Capital for Climate Action https://t.co/zi7hMfrNmw,0
Fri Oct 26 17:15:17 +0000 2018,For this week  I focused on the new cultural and industrial investment that is helping to revitalize Pullman  one o… https://t.co/8tTLibGfdk,12
Fri Oct 26 17:12:55 +0000 2018,Uncertainty regarding tariffs and risk of further escalation of trade tensions have a price - hesitation to invest.… https://t.co/nbEBxvL210,10
Fri Oct 26 17:11:45 +0000 2018,For this week  I focused on the new cultural and industrial investment that is helping to revitalize Pullman  one o… https://t.co/8tTLibGfdk,12
Fri Oct 26 17:10:12 +0000 2018,According to stakeholders  there has been over $250 million in new investment in the neighborhood since the recessi… https://t.co/P0qB4VVVNp,0
Fri Oct 26 17:10:03 +0000 2018,Investment Opportunity for Atlas Space  top 12 satellite category disruptor per Morgan Stanley   closing Oct. 31… https://t.co/3qLJcNdDbm,1
Fri Oct 26 17:08:39 +0000 2018,For this week  I focused on the new cultural and industrial investment that is helping to revitalize Pullman  one o… https://t.co/8tTLibGfdk,12
Fri Oct 26 17:07:21 +0000 2018,For this week  I focused on the new cultural and industrial investment that is helping to revitalize Pullman  one o… https://t.co/8tTLibGfdk,12
Fri Oct 26 17:02:50 +0000 2018,@robertloerzel Tow trucks are a good investment.,0
Fri Oct 26 16:57:41 +0000 2018,Earnings season was supposed to save the day and reverse October’s downtrend. Should investors buy the dip or be pa… https://t.co/qmi3c7Vlib,0
Fri Oct 26 16:56:28 +0000 2018,Investing in sneakers can be a better investment than gold. here’s how. ✨✨✨  https://t.co/GshnNV8eiF https://t.co/9Gu0bumRm6,0
Fri Oct 26 16:49:49 +0000 2018,Uh oh  Eddie. "Two Sears board directors have hired investment bank Evercore to scrutinize deals that were led by f… https://t.co/Q6u1KFH2Iw,2
Fri Oct 26 16:46:58 +0000 2018,Meet Urooj Shakeel  Field Fellow in Leadership Investment and Communications. Urooj is a graduate student at SAIC i… https://t.co/Nv3RIjXMLl,0
Fri Oct 26 16:41:31 +0000 2018,@FormulaMoney When the entire market crashes  individual movements are correlated with the overall market correctio… https://t.co/Uij2YXzKwI,0
Fri Oct 26 16:31:50 +0000 2018,MGIC Investment Corporation adds Jodee Kozlak (Fmr Global SVP-HR  Alibaba/CHRO  Target) to Board $MTG #corpgov https://t.co/UxR8TyxodK,0
Fri Oct 26 16:31:28 +0000 2018,Envestnet adds Valerie Mosley (Fmr SVP/Investment Strategist  Wellington Management Company) to Board $ENV #corpgov https://t.co/0xYatbHr6C,0
Fri Oct 26 16:29:03 +0000 2018,Good counsel via @realAndyPaul at @TheSalesHouse "Buyers want sellers to help them make purchase decisions with the… https://t.co/eHx0gRpuIN,0
Fri Oct 26 16:28:44 +0000 2018,The @KhanGroupCHI investment philosophy is centered on identifying stable and risk averse real estate assets with s… https://t.co/kSVew4RzHJ,2
Fri Oct 26 16:25:26 +0000 2018,Buffered Return Enhanced Notes: Bad Investment Choice That Sounds Good https://t.co/gvjfU2vIjb #realestate #CRE https://t.co/cnSnip5qwo,0
Fri Oct 26 16:15:37 +0000 2018,I enrolled in the Immersive Data Science class (12 weeks) at @GA_Chicago). The class cost $14 400. No small investm… https://t.co/UYoBxDPZ3R,0
Fri Oct 26 16:12:06 +0000 2018,Q3 GDP: Investment - https://t.co/XrWj4XfOFV https://t.co/vHHAiJqTYL,0
Fri Oct 26 16:03:32 +0000 2018,@SecretaryAcosta @mschlapp @POTUS Everybody has their own take on these numbers; mine is they're pretty good; incre… https://t.co/37BHODnRw2,0
Fri Oct 26 16:03:06 +0000 2018,What if Corp dev teams weren’t banking and vc rejects and could put together an investment thesis and execution plan https://t.co/gMtJE8WnMs,0
Fri Oct 26 15:57:59 +0000 2018,Watch Real Estate for First Signs That Passive Has Grown Too Big https://t.co/x3bnlHY15H #realestate #cre https://t.co/sjaOS8MZrr,0
Fri Oct 26 15:55:28 +0000 2018,[NEW POST]: Decentraland...does anyone have it...good investment...why do you have it? + https://t.co/3hZ6kSm7oe #cryptocurrency #crypto,0
Fri Oct 26 15:41:20 +0000 2018,Uncertainty regarding tariffs and risk of further escalation of trade tensions have a price - hesitation to invest.… https://t.co/nbEBxvL210,10
Fri Oct 26 15:27:02 +0000 2018,Can the good ship IPO set sail in constantly shifting markets? #IPO https://t.co/3EBTd5Iif0,0
Fri Oct 26 15:26:02 +0000 2018,How Spending $20 000 on a Meeting was the Best Investment I've Ever Made - @adrobins via @inc |… https://t.co/cIgN42xjpV,0
Fri Oct 26 15:16:03 +0000 2018,@80386dx @759nelson @vyeroc @ShortonSense @sportsguy1492 @Apple But paying $1000 for an iPhone is not a terrible in… https://t.co/TrLwQUEVlb,0
Fri Oct 26 15:09:56 +0000 2018,@pattymo There is so little investment in their old licenses. Public domain now,0
Fri Oct 26 15:08:19 +0000 2018,Uncertainty regarding tariffs and risk of further escalation of trade tensions have a price - hesitation to invest.… https://t.co/nbEBxvL210,10
Fri Oct 26 15:03:31 +0000 2018,"We plan to take key learnings from FilmStruck to help shape future business decisions in the direct-to-consumer sp… https://t.co/G17cg4tWTj,0
Fri Oct 26 15:03:28 +0000 2018,Stephanie Link: While consumer was the bright spot within 3Q GDP the disappointment was Business Fixed Investment w… https://t.co/blEcviGNLH,1
Fri Oct 26 14:53:48 +0000 2018,Uh oh  Eddie. "Two Sears board directors have hired investment bank Evercore to scrutinize deals that were led by f… https://t.co/Q6u1KFH2Iw,2
Fri Oct 26 14:52:05 +0000 2018,Uncertainty regarding tariffs and risk of further escalation of trade tensions have a price - hesitation to invest.… https://t.co/nbEBxvL210,10
Fri Oct 26 14:48:38 +0000 2018,“While it is tempting to increase access to as many disadvantaged children as possible  providing access to quality… https://t.co/QbgmiSront,20
Fri Oct 26 14:46:37 +0000 2018,@smartlien_app @hellodivorce Makes me think about other businesses with fiduciary duties or a need to "firewall" pa… https://t.co/pYsDcEHCli,0
Fri Oct 26 14:43:22 +0000 2018,Uncertainty regarding tariffs and risk of further escalation of trade tensions have a price - hesitation to invest.… https://t.co/nbEBxvL210,10
Fri Oct 26 14:42:56 +0000 2018,Four Takeaways from the NYU Schack Institute’s Second National Symposium of Women in Real Estate… https://t.co/RcgBC5Hxxz,0
Fri Oct 26 14:38:51 +0000 2018,Uncertainty regarding tariffs and risk of further escalation of trade tensions have a price - hesitation to invest.… https://t.co/nbEBxvL210,10
Fri Oct 26 14:35:03 +0000 2018,Sad I will miss @haroldpollack who inspired me to write this. https://t.co/KNgpzNsOjb,0
Fri Oct 26 14:32:13 +0000 2018,Uncertainty regarding tariffs and risk of further escalation of trade tensions have a price - hesitation to invest.… https://t.co/nbEBxvL210,10
Fri Oct 26 14:30:14 +0000 2018,Investment Strategy https://t.co/FyjutNFu0E #venture-capital @vcapital_invest #VC https://t.co/h0JmtAuS6E,0
Fri Oct 26 14:29:03 +0000 2018,Earnings season was supposed to save the day and reverse October’s downtrend. Should investors buy the dip or be pa… https://t.co/JRSYRKH9bN,0
Fri Oct 26 14:28:05 +0000 2018,Earnings season was supposed to save the day and reverse October’s downtrend. Should investors buy the dip or be pa… https://t.co/SuZFSh8pPw,0
Fri Oct 26 14:26:28 +0000 2018,Earnings season was supposed to save the day and reverse October’s downtrend. Should investors buy the dip or be pa… https://t.co/VGO1WoECpM,0
Fri Oct 26 14:25:25 +0000 2018,Learning about #impactinvesting  a new model to blend investment strategies with values @QuantifiedVTS… https://t.co/gNQu96KFd1,0
Fri Oct 26 14:25:07 +0000 2018,Great to be part of this incredible community. Expect to see more new @lightbank companies soon and the current por… https://t.co/cEtgZ87iAt,1
Fri Oct 26 14:23:10 +0000 2018,Automakers are committing hundreds of billions to develop EV technology. They want a guarantee the market is going… https://t.co/HafW2J1DIe,0
Fri Oct 26 14:18:36 +0000 2018,Uncertainty regarding tariffs and risk of further escalation of trade tensions have a price - hesitation to invest.… https://t.co/nbEBxvL210,10
Fri Oct 26 14:10:43 +0000 2018,Angel Investment opportunities... for an IP (Intelectual Property) dAPP using Blockchain technology. We are offerin… https://t.co/3W6uCzaXV1,0
Fri Oct 26 14:10:34 +0000 2018,#chicagostartups are leading the nation in exit multiple on invested capital over the last 5 yrs.  Simply put  inve… https://t.co/zpTujraFiK,6
Fri Oct 26 14:06:20 +0000 2018,Earnings season was supposed to save the day and reverse October’s downtrend. Should investors buy the dip or be pa… https://t.co/KXLgOObg10,0
Fri Oct 26 14:05:56 +0000 2018,You’re worth your investment. Don’t stop believing in your capabilities. #goalgetta https://t.co/j4LQsrcU0Q,1
Fri Oct 26 14:04:50 +0000 2018,Uncertainty regarding tariffs and risk of further escalation of trade tensions have a price - hesitation to invest.… https://t.co/nbEBxvL210,10
Fri Oct 26 14:03:45 +0000 2018,Uncertainty regarding tariffs and risk of further escalation of trade tensions have a price - hesitation to invest.… https://t.co/nbEBxvL210,10
Fri Oct 26 13:54:43 +0000 2018,About ten years ago  I experienced my first real deal presentation to corporate executives. It was to substantiate… https://t.co/XI95ArllQf,0
Fri Oct 26 13:45:18 +0000 2018,The G.O.A.T. gets into the burgeoning esports industry.   https://t.co/Aczv3epFY6,0
Fri Oct 26 13:43:01 +0000 2018,Our newest features  Model Portfolios &amp; Custom Email Reports  are a few reasons why wealth advisors should learn mo… https://t.co/3HJy0jZo4o,0
Fri Oct 26 13:30:02 +0000 2018,This Company Is Already Applying Machine Learning in Credit Card Fraud. Many more applications to come. Follow-on f… https://t.co/B7tFqMohVb,0
Fri Oct 26 13:25:37 +0000 2018,The Collaborative for #FrontierFinance works to drive more #ImpInv capital toward businesses in emerging markets. (… https://t.co/SbOAdcYYRH,1
Fri Oct 26 13:25:15 +0000 2018,Why Digital Marketing Is an Essential Investment https://t.co/AzVwXHcikt #DigitalMarketing https://t.co/ElQIC8WAea,0
Fri Oct 26 13:10:05 +0000 2018,Read about this Follow-on investment for us with a Machine Learning Company working with Fortune 1000 co's to stop… https://t.co/mlEum4QSlh,0
Fri Oct 26 13:10:01 +0000 2018,The @KhanGroupCHI investment philosophy is centered on identifying stable and risk averse real estate assets with s… https://t.co/kSVew4RzHJ,2
Fri Oct 26 13:09:37 +0000 2018,The @KhanGroupCHI investment philosophy is centered on identifying stable and risk averse real estate assets with s… https://t.co/kSVew4RzHJ,2
Fri Oct 26 12:59:37 +0000 2018,Senior housing capital markets maintained a robust performance in 2018. See what factors are pushing asset valuatio… https://t.co/A5um0kR2Sp,2
Fri Oct 26 12:45:46 +0000 2018,Committee on Foreign Investment in the U.S. (#CFIUS) Pilot Program: New Mandatory Filings for Non-passive Foreign I… https://t.co/iENSvRvHvG,2
Fri Oct 26 12:45:43 +0000 2018,Peer into the crystal ball at #CRE in 2019 w/ Dr. Lawrence Yun &amp; Sean Snaith. Get insights on economic  demographic… https://t.co/MpBf1O3weO,8
Fri Oct 26 12:40:45 +0000 2018,Development of New Environment for Expanding Opportunities for Investment in Japanese and Chinese Securities Market… https://t.co/YOK60o6oVd,0
Fri Oct 26 12:37:55 +0000 2018,Are you using aerial photography to increase your property images? You should be. DM us to book. . . . . .… https://t.co/xg0O7LMefk,0
