Tue May 22 23:40:37 +0000 2018,“The one strategic investment that takes away the negative effect and adds a positive ripple effect.” |… https://t.co/DmO6LlqIVB,5
Tue May 22 23:39:32 +0000 2018,@readingoptional @V21collective @ehayot part of the problem for some who are not ignorant is the difference in time… https://t.co/wCVQGfC1Om,0
Tue May 22 23:34:22 +0000 2018,0/As new individuals pour into the crypto space  it’s often easy to make investment decisions based on misinformati… https://t.co/3f902bUcv7,4
Tue May 22 23:33:36 +0000 2018,See Which Companies Make Billions from Selling Weapons Around the World – Investment Watch Blog https://t.co/VVXsKhgylI,0
Tue May 22 23:30:01 +0000 2018,Is your organization capitalizing on the urban opportunity? Register for the SHN Urban Development Webinar to hear… https://t.co/IcyjftTbd3,0
Tue May 22 23:25:07 +0000 2018,Cannabis Data Provider BDS Analytics Secures $750K Investment from... https://t.co/QFg8IH4Fgv https://t.co/TQh1Hxrxx4,0
Tue May 22 22:50:23 +0000 2018,A bad bitch is a bill... A GOOD WOMAN IS AN INVESTMENT....💯💯💯💕,0
Tue May 22 22:50:10 +0000 2018,Creating a searchable @LinkedIn profile goes a long way toward positioning yourself as a thought leader in the fina… https://t.co/VvgGkQv4lZ,0
Tue May 22 22:45:16 +0000 2018,Tencent leads $50M investment in NewsDog  an app vying to be India's Toutiao https://t.co/2BHmQrQo6F https://t.co/Zdqstyp2KO,0
Tue May 22 22:44:33 +0000 2018,Tencent leads $50M investment in NewsDog  an app vying to be India's Toutiao - Tencent leads $50M... https://t.co/oBXx8afntF,0
Tue May 22 22:38:31 +0000 2018,What this makes me curious about is what if—WHAT IF  @Pizza_Suplex—they made a wrestling game that was multiplayer… https://t.co/xyJ2O7a5Mu,0
Tue May 22 22:36:57 +0000 2018,"Innovation isn't about the physical space  it's about a cultural transformation. You have to have CEO support for… https://t.co/XXHmIcOqiu,1
Tue May 22 22:24:39 +0000 2018,Find out which energy stocks you should be buying right now. $LONE $APC $WRD $RES $XOM $CVX $PXD $HAL $DK https://t.co/oMoI9r7Q1J,1
Tue May 22 22:24:39 +0000 2018,Find out which energy stocks you should be buying right now. $LONE $APC $WRD $RES $XOM $CVX $PXD $HAL $DK https://t.co/oMoI9r7Q1J,1
Tue May 22 22:19:12 +0000 2018,$LNG: Cheniere Energy makes positive final investment decision on Train 3 at the Corpus Christi liquefaction project https://t.co/qMLuYJ9VBb,0
Tue May 22 22:12:54 +0000 2018,See our latest #Chicago  IL #job and click to apply: Investment Banking Associate - FIG - https://t.co/nLhaD2FxYY… https://t.co/gGNCKwPu5q,0
Tue May 22 22:09:46 +0000 2018,So the rest of my Amazon GC's will be used for a microphone set that costs more than *gasp* Louboutin Shoes.  As an… https://t.co/jDAICxK3G5,0
Tue May 22 22:05:28 +0000 2018,"Innovation isn't about the physical space  it's about a cultural transformation. You have to have CEO support for… https://t.co/XXHmIcOqiu,1
Tue May 22 22:01:11 +0000 2018,Tomorrow we're hosting Venture  our first ever conference focused solely on venture investment in the built world.… https://t.co/1aobhdhtsv,1
Tue May 22 21:54:12 +0000 2018,For the record  #Chicago is as 1984 of a Law and Order city as it gets in America.   We don't need Law and Order ca… https://t.co/4B7BNmPRAa,0
Tue May 22 21:31:53 +0000 2018,The life expectancy of our children should NOT depend on their zip code. Via @SunbeamOKC CEO Jim Priest.… https://t.co/hHhFeMTRG0,1
Tue May 22 21:30:16 +0000 2018,The life expectancy of our children should NOT depend on their zip code. Via @SunbeamOKC CEO Jim Priest.… https://t.co/hHhFeMTRG0,1
Tue May 22 21:30:09 +0000 2018,A new episode of the podcast is out!  Discussing @firebase features  we conclude that Google's investment in people… https://t.co/5njuVN64gH,0
Tue May 22 21:20:07 +0000 2018,With his support for SB2339  Chicago's mayor doubles down on the wrong kind of investment in our neighborhoods -- t… https://t.co/Np7fQX8gKX,2
Tue May 22 21:16:21 +0000 2018,Very excited to welcome @ElieFinegold to the growing @MetaPropNYC family! Immediately adding value to our #PropTech… https://t.co/iFMbGsiqZC,1
Tue May 22 21:15:44 +0000 2018,Did you know? 98% of organizations report that a single hour of unplanned downtime could cost them $100 000.  But d… https://t.co/cVsHksAXuC,0
Tue May 22 21:09:00 +0000 2018,Kroger just made a huge digital leap forward with its’ investment/partnership w/ UK pure-play grocer  Ocado… https://t.co/TeabjSD6qN,5
Tue May 22 21:01:04 +0000 2018,Education is a better investment than the U.S. stock market  @WBG_Education says. https://t.co/iiBNlSr3lQ https://t.co/lIvTytBsNg,0
Tue May 22 21:00:09 +0000 2018,BlackRock Capital Investment CEO Michael Zugay Resigns https://t.co/QMPhUhdIXw https://t.co/YoyzxImLzC,0
Tue May 22 20:21:06 +0000 2018,Interviewed by @BBC on Chinese Investments in the US. "A lot of the reaction towards Chinese investment is to just… https://t.co/wZeZDFkOJn,2
Tue May 22 20:09:47 +0000 2018,Retweeted IL Legal Aid Online (@ILAO):  "These are challenging budget times  but civil legal aid is a smart investm… https://t.co/PW7lTEBiPJ,0
Tue May 22 20:09:44 +0000 2018,"These are challenging budget times  but civil legal aid is a smart investment for Illinois because it reduces the… https://t.co/EhI7SijTsT,5
Tue May 22 20:08:56 +0000 2018,U.S. Senate panel OKs bill to tighten foreign...: By Diane BartzWASHINGTON  May 22 (Reuters) - The U.S. Senate… https://t.co/WJvSTDubr1,0
Tue May 22 19:55:15 +0000 2018,Tomorrow we're hosting Venture  our first ever conference focused solely on venture investment in the built world.… https://t.co/1aobhdhtsv,1
Tue May 22 19:51:14 +0000 2018,@InvResDynamics A stable investment climate depends on a clear legal framework  respect for the rule of law and tra… https://t.co/ywQnimPXfd,0
Tue May 22 19:50:34 +0000 2018,#Follow @JhonStratman and #Retweet #win Welcome Bonus 0.05 #bitcoin NO DEPOSIT REQUIRED at https://t.co/SiTKmiDGBk… https://t.co/dIWt3vpEbJ,13
Tue May 22 19:48:03 +0000 2018,#Follow @JhonStratman and #Retweet #win Welcome Bonus 0.05 #bitcoin NO DEPOSIT REQUIRED at https://t.co/SiTKmiDGBk… https://t.co/dIWt3vpEbJ,13
Tue May 22 19:47:07 +0000 2018,Hanley Investment Completes Sale of LA Retail https://t.co/AjoehIuICA #realestate #CRE https://t.co/Ml6C6ZBmUL,0
Tue May 22 19:45:11 +0000 2018,U.S. stock buyback programs totaling about $183B in April-May Trim Tabs Investment Research. The buyback boom early… https://t.co/9wJ1r8etr4,0
Tue May 22 19:40:34 +0000 2018,Investment Accounting has never been easier. Discover a step-by-step process to running the accounts.… https://t.co/414RLKrXJZ,0
Tue May 22 19:35:45 +0000 2018,How moving to the Bay Area helped Kevin Durant grow one of the most wide-ranging investment portfolios in the NBA -… https://t.co/jVcvlR4lQA,0
Tue May 22 19:31:30 +0000 2018,Pretty good return on investment!! https://t.co/zSQkxxeX1P https://t.co/FWwacx1P3X,0
Tue May 22 19:21:51 +0000 2018,SIGN UP FOR A FREE TRIAL SUBSCRIPTION TO OUR INVESTMENT NEWSLETTER SERVICE SPECIALIZING IN STOCKS TRADING BELOW 5 D… https://t.co/5b213t7Pi0,0
Tue May 22 19:09:01 +0000 2018,Black people don’t have generational wealth because many of us are impulsive spenders who care more about keeping u… https://t.co/56mLWZ2EY4,0
Tue May 22 19:03:21 +0000 2018,Process for Evaluating a Prospective Investment Property https://t.co/YSdsQreLhI # 3 is a must... https://t.co/xATwSYI6Ji,0
Tue May 22 19:01:34 +0000 2018,Process for Evaluating a Prospective Investment Property https://t.co/DcyBtRCcoy # 3 is a must... https://t.co/dA76yo2GRe,0
Tue May 22 19:00:19 +0000 2018,Process for Evaluating a Prospective Investment Property https://t.co/xvHaZ7MZII # 3 is a must... https://t.co/Ctm8cNnVCL,0
Tue May 22 18:55:26 +0000 2018,This is def relevant to the convo around #NoCopAcademy as well. The police are treated as an inherently valid inves… https://t.co/acCraVExJ6,3
Tue May 22 18:53:35 +0000 2018,Worth a share if you have a minute: an investment opportunity we hope is worth your consideration. As our process d… https://t.co/yp1o9ImIwf,0
Tue May 22 18:40:32 +0000 2018,New to angel investing? Check out "A Primer on Angel Investment Portfolio Theory" on the @IrishAngels blog! https://t.co/b7yGOFJ96j,2
Tue May 22 18:39:27 +0000 2018,This is why we're talking about setting forth ordinances to promote investment in affordable housing as a bedrock o… https://t.co/gB4swB9ZXz,1
Tue May 22 18:38:49 +0000 2018,New to angel investing? Check out "A Primer on Angel Investment Portfolio Theory" on the @IrishAngels blog! https://t.co/b7yGOFJ96j,2
Tue May 22 18:29:01 +0000 2018,Cannabis Data Provider BDS Analytics Secures $750K Investment from... https://t.co/KE0z5zZETj https://t.co/rtqgeCTszH,0
Tue May 22 18:28:28 +0000 2018,Experts say the main use of corporate America’s tax savings will be takeovers and stock buybacks not capital invest… https://t.co/akqUXTUVZh,0
Tue May 22 18:21:36 +0000 2018,I have one of these inside my nightstand to make charging my various USB devices easier! A great investment! https://t.co/7cs8BFgofW,0
Tue May 22 18:21:14 +0000 2018,The father of the 401(k) says big changes are needed to the investment vehicle. More on that and other news and fea… https://t.co/FlyDhtjjBn,0
Tue May 22 18:15:16 +0000 2018,Clean Diesel Grant Opportunity  @AlphaBaking Featured in #DriveClean #Chicago Video  #GreenDrives Recap:… https://t.co/Fxb31wGZfN,3
Tue May 22 18:06:38 +0000 2018,Did you know TWO Catapult Alumni have pitched on @ABCSharkTank? @RentLikeAChamp and @packbackco got investment deal… https://t.co/QBrHn1Gbxi,1
Tue May 22 18:01:24 +0000 2018,3 years after completing a $155.6M investment at the same facility  Gerdau Special Steel N.A. is launching an addit… https://t.co/uXtJmxDkbe,0
Tue May 22 17:53:45 +0000 2018,#NASAA’s Announces Enforcement Sweep Targeting Fraudulent #ICOs and #Crypto-asset Investment Products: https://t.co/bzHyC0keY0,1
Tue May 22 17:53:27 +0000 2018,@TurkishMinuteTM What an awkward moment when your own occupation thinks you are a bad investment. Maybe Hamas will… https://t.co/yNxwUCeX2h,0
Tue May 22 17:42:38 +0000 2018,Love this story by @ElviaMalagon  about @tonikagj's #FoldedMap project  which explores segregation  economic invest… https://t.co/OIX6AH8dvf,2
Tue May 22 17:41:36 +0000 2018,btc investment trend $GBTC https://t.co/AC5vYCTsmZ,0
Tue May 22 17:30:24 +0000 2018,@BizMotivationTV It's a very worthwhile investment.,0
Tue May 22 17:27:41 +0000 2018,https://t.co/R7MuIUowQz | Statement on NASAA’s Announcement of Enforcement Sweep Targeting Fraudulent ICOs and Cryp… https://t.co/s9yMDGcWSN,0
Tue May 22 17:27:27 +0000 2018,https://t.co/R7MuIUowQz | Statement on NASAA’s Announcement of Enforcement Sweep Targeting Fraudulent ICOs and Cryp… https://t.co/hvOtoopxAc,0
Tue May 22 17:21:46 +0000 2018,#AAII Must read articles from the Weekly Digest https://t.co/wyE9JocAjN,0
Tue May 22 17:20:30 +0000 2018,This is def relevant to the convo around #NoCopAcademy as well. The police are treated as an inherently valid inves… https://t.co/acCraVExJ6,3
Tue May 22 17:10:28 +0000 2018,#NASAA’s Announces Enforcement Sweep Targeting Fraudulent #ICOs and #Crypto-asset Investment Products: https://t.co/bzHyC0keY0,1
Tue May 22 17:10:01 +0000 2018,BlackRock Capital Investment CEO Michael Zugay Resigns https://t.co/WlEmYlsMgR https://t.co/ZZgedERDm2,0
Tue May 22 17:02:58 +0000 2018,Love this story by @ElviaMalagon  about @tonikagj's #FoldedMap project  which explores segregation  economic invest… https://t.co/OIX6AH8dvf,2
Tue May 22 16:59:10 +0000 2018,This is def relevant to the convo around #NoCopAcademy as well. The police are treated as an inherently valid inves… https://t.co/acCraVExJ6,3
Tue May 22 16:57:51 +0000 2018,This is def relevant to the convo around #NoCopAcademy as well. The police are treated as an inherently valid inves… https://t.co/acCraVExJ6,3
Tue May 22 16:53:17 +0000 2018,Next U.S. Recession Seen Beginning in 2020: Zillow/Pulsenomics https://t.co/DwOL8yKmV4 #realestate #cre https://t.co/ksBH2xyC09,0
Tue May 22 16:50:12 +0000 2018,A bad bitch is a bill... A GOOD WOMAN IS AN INVESTMENT....💯💯💯💕,0
Tue May 22 16:50:12 +0000 2018,New to angel investing? Check out "A Primer on Angel Investment Portfolio Theory" on the @IrishAngels blog! https://t.co/b7yGOFJ96j,2
Tue May 22 16:48:53 +0000 2018,Continuous investment in sales training leads to higher net sales per employee. Today  from @KeypointIntel  steps f… https://t.co/ZtYM8PaWxo,3
Tue May 22 16:45:23 +0000 2018,The Basics of Real Estate Investment Trusts (REITs) https://t.co/38apaRvuHS,0
Tue May 22 16:45:22 +0000 2018,The Basics of Real Estate Investment Trusts (REITs) https://t.co/qqPN3wAMcD,0
Tue May 22 16:40:21 +0000 2018,Real estate investment ideas! Click to learn more! https://t.co/yEz3lqRHfz #Realtor #RealEstate #Investment #Agent… https://t.co/GW37GuAb7I,0
Tue May 22 16:39:18 +0000 2018,"Politicians will spend money to jail young people  while refusing to fund investment that might prevent crime in t… https://t.co/VXO8pFqSEh,12
Tue May 22 16:39:15 +0000 2018,I sense the $500 million investment in Trump org Indonesia project falling through suddenly... https://t.co/jCvv4AplVd,0
Tue May 22 16:30:13 +0000 2018,"#data is allowing people to enter the market in different way...We're seeing other companies fill the gaps we have… https://t.co/TZdphhAYWY,0
Tue May 22 16:29:58 +0000 2018,Are you located in #Chicago  IL and looking for a new career opportunity? Check out our latest opening for a Invest… https://t.co/4at2SjX1nA,0
Tue May 22 16:20:32 +0000 2018,Cannabis Data Provider BDS Analytics Secures $750K Investment from... https://t.co/0rEBavTstS https://t.co/4rN0CarkIC,0
Tue May 22 16:14:08 +0000 2018,Interviewed by @BBC on Chinese Investments in the US. "A lot of the reaction towards Chinese investment is to just… https://t.co/wZeZDFkOJn,2
Tue May 22 16:11:52 +0000 2018,Interviewed by @BBC on Chinese Investments in the US. "A lot of the reaction towards Chinese investment is to just… https://t.co/wZeZDFkOJn,2
Tue May 22 16:09:48 +0000 2018,"diversity isn’t something we hope God will bring to our churches apart from our own investment outside of those fo… https://t.co/aPYR0pfCrh,0
Tue May 22 16:08:48 +0000 2018,Clean Diesel Grant Opportunity  @AlphaBaking Featured in #DriveClean #Chicago Video  #GreenDrives Recap:… https://t.co/Fxb31wGZfN,3
Tue May 22 16:01:44 +0000 2018,@RyanEssain @StockTwits I guess it depends. Tokens are higher octane with shorter-dated timeframes  b-chain stocks… https://t.co/OMuAzcKdbu,0
Tue May 22 15:56:36 +0000 2018,Investment Firm of the Future https://t.co/9nJdUMvm06,0
Tue May 22 15:55:28 +0000 2018,Check out 33's top takeaways from the Chicago REIA (Chicago Real Estate Investment Association) event where the mul… https://t.co/R7981Pha9i,0
Tue May 22 15:55:25 +0000 2018,Check out 33's top takeaways from the Chicago REIA (Chicago Real Estate Investment Association) event where the mul… https://t.co/dtTERo9HXR,0
Tue May 22 15:49:41 +0000 2018,Clean Diesel Grant Opportunity  @AlphaBaking Featured in #DriveClean #Chicago Video  #GreenDrives Recap:… https://t.co/Fxb31wGZfN,3
Tue May 22 15:43:14 +0000 2018,Real-Estate Investment Report – April 2018  https://t.co/TKxrDv5QSc,1
Tue May 22 15:37:08 +0000 2018,This is why we're talking about setting forth ordinances to promote investment in affordable housing as a bedrock o… https://t.co/gB4swB9ZXz,1
Tue May 22 15:34:16 +0000 2018,An excellent overview of why Chicagoans are saying #NoCopAcademy to oppose the $95 million that @ChicagosMayor Rahm… https://t.co/EoMTpAIigo,18
Tue May 22 15:30:16 +0000 2018,A private investment firm in the #ChicagoLoop is seeking a #Controller to manage all accounting aspects of the firm… https://t.co/cYESYJ5R2a,0
Tue May 22 15:24:02 +0000 2018,Investment Consultant - Chicago  IL - North LaSalle - Fidelity Investments - Chicago  IL https://t.co/pJ8Gwuxdnl Jobs Chicago,0
Tue May 22 15:15:21 +0000 2018,Investing in Comic Books Can Be a Blast in More Ways than One: https://t.co/iIXZ0AYiH7 #comicbooks #investment #comics,0
Tue May 22 15:12:15 +0000 2018,@RepAdamSchiff Trump Folded Like A A Piece Of Paper When China Gave One Of Trump's Investment Overseas 1/2 Of Billi… https://t.co/LAPsTdRMSp,0
Tue May 22 15:05:25 +0000 2018,Clean Diesel Grant Opportunity  @AlphaBaking Featured in #DriveClean #Chicago Video  #GreenDrives Recap:… https://t.co/Fxb31wGZfN,3
Tue May 22 15:01:59 +0000 2018,Love this story by @ElviaMalagon  about @tonikagj's #FoldedMap project  which explores segregation  economic invest… https://t.co/OIX6AH8dvf,2
Tue May 22 14:50:48 +0000 2018,Headlines: City beginning rehabs of Belmont Blue  Jeff Park stations; Cook County commissioner says prevent carjack… https://t.co/2uzn9Fst8R,0
Tue May 22 14:47:02 +0000 2018,How @Quuu_co positioned itself for #investment via @MatthewSpurr https://t.co/CL37XDpgck #venturecapital https://t.co/Uq7gLq0Zxo,0
Tue May 22 14:44:16 +0000 2018,"These are challenging budget times  but civil legal aid is a smart investment for Illinois because it reduces the… https://t.co/EhI7SijTsT,5
Tue May 22 14:44:11 +0000 2018,Coin Laundry Net Lease Investment | 7.1% Cap Rate #Carrollton #Georgia #CRE @BullRealty #Retail… https://t.co/7vrFDOcnwg,0
Tue May 22 14:43:21 +0000 2018,And why is Amazon making this large of an investment? What are they going to do with a database like that? Amazon a… https://t.co/WsH5V7klkC,0
Tue May 22 14:34:35 +0000 2018,The legislation in Springfield that purports to address carjacking is more of the same: Once again  politicians wil… https://t.co/ign5zkyqBk,0
Tue May 22 14:34:03 +0000 2018,Cannabis Investment Funds Fuel BDS Analytics Expansion as Part of... https://t.co/PuIFv8M3ti @BDSAnalytics… https://t.co/bG63lQxxtK,0
Tue May 22 14:29:46 +0000 2018,@MerkSays whole time: while we talking about this I got some shit I wanna run past you under the investment act.,0
Tue May 22 14:20:13 +0000 2018,Did you know TWO Catapult Alumni have pitched on @ABCSharkTank? @RentLikeAChamp and @packbackco got investment deal… https://t.co/QBrHn1Gbxi,1
Tue May 22 14:14:32 +0000 2018,Thank you @BrandonforCook ... I wonder if a coordinated investment through the @ChicagosMayor @largelots program co… https://t.co/dqcUn05kGK,0
Tue May 22 14:06:43 +0000 2018,Exciting to see the halo effect of @Citi’s transformative investment. @CaraChicago can’t wait to dig in and get sta… https://t.co/8VG7sDJCDa,0
Tue May 22 14:03:20 +0000 2018,Part II: Its only a good investment if you knew when to buy https://t.co/CxGMSuS0XO,1
Tue May 22 13:59:36 +0000 2018,@DanielJHemel Just an article about investment in children: https://t.co/kwTAWqrvoI,0
Tue May 22 13:50:54 +0000 2018,On the other hand  investment in schools and mental health resources necessarily strengthen communities  and when y… https://t.co/vtGhOSogRt,0
Tue May 22 13:32:56 +0000 2018,This underlying notion was a driver in #CVC growth in 2017  and the follow through in 2018. Corporate venture capit… https://t.co/UFMdhm2DyB,0
Tue May 22 13:29:59 +0000 2018,"Politicians will spend money to jail young people  while refusing to fund investment that might prevent crime in t… https://t.co/VXO8pFqSEh,12
Tue May 22 13:27:06 +0000 2018,Operations Associate  |  Chicago Loop  |  Investment management firm | Focus on trade settlement and daily portfoli… https://t.co/kVI7mDDErb,0
Tue May 22 13:24:21 +0000 2018,"Politicians will spend money to jail young people  while refusing to fund investment that might prevent crime in t… https://t.co/VXO8pFqSEh,12
Tue May 22 13:23:58 +0000 2018,"Politicians will spend money to jail young people  while refusing to fund investment that might prevent crime in t… https://t.co/VXO8pFqSEh,12
Tue May 22 13:20:21 +0000 2018,#NoCopAcademy  because focusing on police training while actively rolling back community investment is like giving… https://t.co/W1mw8HWqqk,0
Tue May 22 13:11:41 +0000 2018,@ShaneSalmonson @SportCardCollec If your completing the set  it’s a $780 investment per year.,0
Tue May 22 13:11:38 +0000 2018,"Politicians will spend money to jail young people  while refusing to fund investment that might prevent crime in t… https://t.co/VXO8pFqSEh,12
Tue May 22 13:11:32 +0000 2018,"Politicians will spend money to jail young people  while refusing to fund investment that might prevent crime in t… https://t.co/VXO8pFqSEh,12
Tue May 22 13:11:20 +0000 2018,Thank you @PSIJ for publishing my article. Please read  share and join @ChiFdn4Women South Side Giving Circle as we… https://t.co/nHPmRCFlDs,2
Tue May 22 13:09:53 +0000 2018,@oriolesrise @ShaneSalmonson I’m thinking the complete opposite. Looking at the numbers  there could only be 2 500… https://t.co/NvKi9TtelF,0
Tue May 22 13:08:05 +0000 2018,Own A Napa Vineyard is a good investment for the future. The harvest from your vineyard will give you income in the… https://t.co/sN2tK6FaaX,0
Tue May 22 13:07:17 +0000 2018,"Politicians will spend money to jail young people  while refusing to fund investment that might prevent crime in t… https://t.co/VXO8pFqSEh,12
Tue May 22 13:07:10 +0000 2018,A new episode of the @thisoldapp podcast is out!  We discuss @firebase and why Google's investment in people  like… https://t.co/nCvsbJztVE,2
Tue May 22 13:07:08 +0000 2018,@JohnSTobey: While a mega company's success can create investment success  eventually size waters down percentage e… https://t.co/xmvAOsl26u,0
Tue May 22 12:50:01 +0000 2018,"Politicians will spend money to jail young people  while refusing to fund investment that might prevent crime in t… https://t.co/VXO8pFqSEh,12
Tue May 22 12:48:05 +0000 2018,Own A Napa Vineyard is a good investment for the future. The harvest from your vineyard will give you income in the… https://t.co/i97OXMtByN,0
Tue May 22 12:47:06 +0000 2018,Own A Napa Vineyard is a good investment for the future. The harvest from your vineyard will give you income in the… https://t.co/GL6Sd9ztgx,0
Tue May 22 12:40:10 +0000 2018,The big driver of healthcare investment in tech isn't Silicon Valley; It's the patient https://t.co/riAw7KFEQm #ptexp,0
Tue May 22 12:36:33 +0000 2018,A new episode of the @thisoldapp podcast is out!  We discuss @firebase and why Google's investment in people  like… https://t.co/nCvsbJztVE,2
Tue May 22 12:33:25 +0000 2018,Tencent leads $50M investment in NewsDog  an app vying to be India’s Toutiao https://t.co/R2CLVyrRLS,0
Tue May 22 12:32:01 +0000 2018,A new episode of the @thisoldapp podcast is out!  We discuss @firebase and why Google's investment in people  like… https://t.co/nCvsbJztVE,2
Tue May 22 12:30:35 +0000 2018,All those #vbucks purchases are creating a huge prize pool investment from @EpicGames - we have seen different appr… https://t.co/UQYRxyrBgd,0
Tue May 22 12:25:14 +0000 2018,"Politicians will spend money to jail young people  while refusing to fund investment that might prevent crime in t… https://t.co/VXO8pFqSEh,12
Tue May 22 12:19:26 +0000 2018,@ABC7Chicago Wow it’s almost like kids need stability and an overall investment in their educational experiences to perform well,0
Tue May 22 12:15:53 +0000 2018,@KerryKavanaugh Thank you so very much for your investment in this issue. It will raise awareness and bend the arc… https://t.co/olYrKmEBkX,0
Tue May 22 12:12:05 +0000 2018,The impact of technological progress on Wall  the topic of the presentation of  @MishaMalyshev1 MishaMalyshev CEO a… https://t.co/9dSOrqCovV,0
Tue May 22 11:39:39 +0000 2018,Continuous investment in sales training leads to higher net sales per employee. Today  from @KeypointIntel  steps f… https://t.co/ZtYM8PaWxo,3
Tue May 22 11:19:17 +0000 2018,@RTA_Chicago @Metra fare/transfer integration with @cta and increased off-peak frequency would be a good first step… https://t.co/ySeKEUfLbO,0
Tue May 22 09:58:18 +0000 2018,Because selling a white owned investment strategy in the name of black economic liberation is better? 🤔  Sit your a… https://t.co/uX5nekkrm9,0
Tue May 22 09:03:52 +0000 2018,TRX - TRON - Might be the \u2026 $TRXUSD https://t.co/UbDnbkbVqL,0
Tue May 22 07:59:25 +0000 2018,Cannabis Investment Funds Fuel BDS Analytics Expansion as Part of... https://t.co/cbmjB6SO78 @BDSAnalytics… https://t.co/pzhPPnfl0O,1
Tue May 22 06:41:23 +0000 2018,#Follow @JhonStratman and #Retweet #win Welcome Bonus 0.05 #bitcoin NO DEPOSIT REQUIRED at https://t.co/SiTKmiDGBk… https://t.co/dIWt3vpEbJ,13
Tue May 22 06:40:44 +0000 2018,#Follow @JhonStratman and #Retweet #win Welcome Bonus 0.05 #bitcoin NO DEPOSIT REQUIRED at https://t.co/SiTKmiDGBk… https://t.co/dIWt3vpEbJ,13
Tue May 22 06:30:30 +0000 2018,Woah. CME bans firm immediately  for 60-days  for all kinds of unusual activity. https://t.co/3HbIrOyrRT,5
Tue May 22 05:35:09 +0000 2018,CBC multiple awardee Chuan He  @UChicago @UChiChemistry @UChicagoPSD @uchicagonews   with the science behind Accent… https://t.co/jaXDTIw0Wx,5
Tue May 22 05:35:08 +0000 2018,@PatrickZircher Most of the issues I have with present comics are too few words per page and creative runs which en… https://t.co/qUx74hhSiL,0
Tue May 22 05:15:07 +0000 2018,I bought a mountain bike and people didn't know I was a biker and its like hell yeah I am  holla at ya boy I've bee… https://t.co/jOcXNNQbw8,0
Tue May 22 05:07:52 +0000 2018,Die hierin geäußerten Meinungen und Meinungen sind ausschließlich die des Autors und spiegeln nicht unbedingt die M… https://t.co/uPxIRRKUEf,0
Tue May 22 04:58:00 +0000 2018,Trade on Margin and make serious money! Trade up to 100x your investment! Exclusive link for 10% off your fees here… https://t.co/SktTc8DUcL,0
