Sat Oct 20 23:38:54 +0000 2018,UK firms near point of no return for Brexit contingency plans  CBI... https://t.co/COIVazA9SB,0
Sat Oct 20 23:38:36 +0000 2018,$ACBFF $TGODF Aurora Cannabis Books C$20.6 Million Gain on TGOD Investment. #PotStocks .  I am a fan of both stocks… https://t.co/TMt0aPIcbO,0
Sat Oct 20 23:34:53 +0000 2018,Lol us caps just like to play around until the stakes are high so we can feel like the investment in giving someone… https://t.co/7gN0FrPC1k,0
Sat Oct 20 23:30:29 +0000 2018,Investment Property Tax Deductions https://t.co/5UppjyGdCg What Uncle Sam gives  Uncle Sam takes away.… https://t.co/jbH3AkBjuU,0
Sat Oct 20 23:30:17 +0000 2018,Investment Property Tax Deductions https://t.co/LF15ZYEv0y What Uncle Sam gives  Uncle Sam takes away.… https://t.co/cS7kuDvYYM,0
Sat Oct 20 23:24:21 +0000 2018,Make a $30 investment today by becoming a independent travel agent! Get paid to book your own vacations!  Message m… https://t.co/mv6WXkeEoU,0
Sat Oct 20 23:24:01 +0000 2018,@sappho1996 Before making the investment i would try getting some tampons without applicators and see how you are w… https://t.co/upkmIPvbWN,0
Sat Oct 20 23:10:04 +0000 2018,Weekend recap: @SeniorCareInc and Fundamental Advisors announce $1 billion joint venture. By: @ASpankoNews   Read m… https://t.co/dQyk6bDUL5,0
Sat Oct 20 23:08:19 +0000 2018,Goldman Is Making Changes to Its Asia Investment Banking Leadership  https://t.co/LTCxuDCgqo,0
Sat Oct 20 23:05:00 +0000 2018,Multifamily vs. Single-Family Real Estate: Which is the Superior Investment? via @BiggerPockets https://t.co/xSptoMQ8kR,0
Sat Oct 20 22:50:04 +0000 2018,The best investment we can make in our future is to provide a strong foundation for success for every baby born in… https://t.co/lP1tx9Jx0B,0
Sat Oct 20 22:30:36 +0000 2018,"The budget includes almost $1 billion in investments to new schools  new annexes and maintenance to existing schoo… https://t.co/LftDNYOdsB,0
Sat Oct 20 22:30:07 +0000 2018,These customer service tips from @realtormag can help your agents be the “boots on the ground” for investors. https://t.co/BwZlKlSe7a,0
Sat Oct 20 22:24:00 +0000 2018,New AirChicago Founder+ Investment Opportunity is now Available. Your investment provides a 95% discount on MyJet E… https://t.co/3yMNXQSzlo,0
Sat Oct 20 22:09:55 +0000 2018,Honored &amp; humbled with much appreciation for @CAPFndn for their support and investment!! https://t.co/aJ0Eg8Tjax,3
Sat Oct 20 22:09:03 +0000 2018,Honored &amp; humbled with much appreciation for @CAPFndn for their support and investment!! https://t.co/aJ0Eg8Tjax,3
Sat Oct 20 22:07:29 +0000 2018,We're #hiring! Read about our latest #job opening here: Senior Investment Banking Analyst - https://t.co/wxvGDVrv8e… https://t.co/O7icEonWqa,0
Sat Oct 20 21:31:24 +0000 2018,Your investment in #BenefitChicago supports financing for #SmallBiz like @AutonomyWorks  @BeeLoveBuzz … https://t.co/K5PHHAOBdU,1
Sat Oct 20 21:15:46 +0000 2018,@chrisvogliano @MaryRussellRDN @chrisvogliano @JaniceGiddens are examples  like the other amazing @eatrightPRO Foun… https://t.co/d1ao0AlSeC,0
Sat Oct 20 21:13:20 +0000 2018,Did you know:  Mueller Russian witch hunt has cost taxpayers at least $20 million  What has America gotten for it’s… https://t.co/ZCQdPJBf2L,8600
Sat Oct 20 21:00:00 +0000 2018,Today on the blog: There’s no doubt that small businesses have some challenges attracting and retaining top talent.… https://t.co/lJNrX6hDG9,0
Sat Oct 20 20:59:32 +0000 2018,We're #hiring! Click to apply: Investment Banking Analyst - https://t.co/E9M59AOEXU #InvestmentBanking #Chicago  IL #Job #Jobs #CareerArc,0
Sat Oct 20 20:34:07 +0000 2018,Join us at the hangar for an informational Partner Briefing focused on the Founder+ Card investment opportunity. Ma… https://t.co/uwtYaivYRb,0
Sat Oct 20 20:17:00 +0000 2018,Private real estate investment fees can be confusing. Get a better understanding of where your money is going from… https://t.co/e1Sfya0ntj,0
Sat Oct 20 20:00:13 +0000 2018,Richelieu Dennis  founder of SheaMoisture and owner of Essence Magazine  recently announced the launch of a $100 mi… https://t.co/pnQas2wLhS,11
Sat Oct 20 19:42:50 +0000 2018,Loras ranks 4th in Iowa on return on investment. Drake  Iowa  and Iowa State finished ahead of @lorascollege #duhawkpowerhouse,1
Sat Oct 20 19:37:09 +0000 2018,Paylocity (NASDAQ:PCTY) Stock Rating Lowered by Zacks Investment Research https://t.co/IwsfXO1iib,0
Sat Oct 20 19:04:53 +0000 2018,I’m ready to make my second investment 💰,0
Sat Oct 20 19:02:17 +0000 2018,Global insecurity and new threats have created new areas of investment. https://t.co/vrGY4R6Py9,0
Sat Oct 20 18:50:25 +0000 2018,Although I am celebrating single  I have more self love than before  and I'm giving myself the gift of investment b… https://t.co/lUIpIvwDIo,0
Sat Oct 20 18:30:08 +0000 2018,@math_pitt @Popehat At $1.6B it’s a PEV investment,0
Sat Oct 20 18:04:50 +0000 2018,Agency represented ✔ Registered for acting classes ✔ Photoshoot booked ✔ (portfolio developing soon)  I'm turning 2… https://t.co/gkuuaGg6vQ,0
Sat Oct 20 17:59:29 +0000 2018,@A_W_Gordon we need better investment in our public transit systems across the US.,0
Sat Oct 20 17:52:36 +0000 2018,Now up on @crunchbasenews: Corporate Venture Investment Climbs Higher Throughout 2018  https://t.co/O8dXGZ01mE https://t.co/37aCj2gEjF,12
Sat Oct 20 17:50:02 +0000 2018,Neurovive Pharmaceutical AB (NEVPF: OTCQX International) | Edison Investment Research Limited: Edison issues outloo… https://t.co/CVsZ5m8OJl,0
Sat Oct 20 17:50:02 +0000 2018,Neurovive Pharmaceutical AB (NEVPF: OTCQX International) | Edison Investment Research Limited: Edison issues outloo… https://t.co/XzuMPoN7ez,0
Sat Oct 20 17:48:58 +0000 2018,Honored &amp; humbled with much appreciation for @CAPFndn for their support and investment!! https://t.co/aJ0Eg8Tjax,3
Sat Oct 20 17:41:38 +0000 2018,this is a hot and moody take but here goes: the minute people started seeing emotional investment as work that dese… https://t.co/ZPI13GZXIv,0
Sat Oct 20 17:30:45 +0000 2018,Connect to your purpose at DePaul University Investment Manager https://t.co/UaWCYB2M3t #DePaulU #Accounting… https://t.co/d3sR1upN3I,0
Sat Oct 20 17:22:21 +0000 2018,My bookie/priest says take Purdue and the +13 points over Ohio State.  Interesting #investment,0
Sat Oct 20 17:11:29 +0000 2018,Real Estate Investment Report – August 2018 https://t.co/0mKdlOHQot,0
Sat Oct 20 15:53:55 +0000 2018,@wood4888 @AndyMcCanse @FoxNews The Dimwits made a big zero investment into our infrastructure. All BO did in 8 yea… https://t.co/TgctRXyb29,0
Sat Oct 20 15:35:00 +0000 2018,@CryptoShillNye Thanks for the hard work and bringing us into the investment your making into yourself!,0
Sat Oct 20 15:18:34 +0000 2018,Ever since I was 21-22 I’ve been working on getting my family a house/investment property so everyone isn’t renting… https://t.co/FckBaimMC5,0
Sat Oct 20 15:16:19 +0000 2018,Peer into the crystal ball at #CRE in 2019 w/ Dr. Lawrence Yun &amp; Sean Snaith. Get insights on economic  demographic… https://t.co/IcYFRlvpJR,5
Sat Oct 20 15:15:08 +0000 2018,@ejkuehl TDA working with Blue Ocean  VinX wine futures investment. I know some people close to exchange products a… https://t.co/j34Fx20Zd4,0
Sat Oct 20 15:14:41 +0000 2018,Mary from Power Construction and James from ClubFit are powerhouse customers sharing their experience with our awar… https://t.co/au9e8ucDIU,2
Sat Oct 20 15:00:55 +0000 2018,Imagining America @ImaginingAmer this is a long term investment... it’s amazing what we’ve accomplished in this sho… https://t.co/r1klOZlubb,0
Sat Oct 20 15:00:09 +0000 2018,Eric Trump laughably tried to claim on Fox &amp; Friends that the Trump Organization has had zero investment ties to Ru… https://t.co/kMQLX4Td6X,234
Sat Oct 20 14:59:05 +0000 2018,Politics of sites shift over time. @lynnegoldstein shares how stakeholders &amp; interests in a project shift &amp; evolve… https://t.co/jvxkzoewel,2
Sat Oct 20 14:50:01 +0000 2018,The #futureofcities is governments and communities working together to secure our neighborhoods. Mass transit infra… https://t.co/uErLFnjydA,0
Sat Oct 20 14:30:47 +0000 2018,Please don’t ask me to borrow money without knowing in advance that I’m going to protect  secure  and insure my inv… https://t.co/7GTBM4hnPe,0
Sat Oct 20 14:24:48 +0000 2018,Politics of sites shift over time. @lynnegoldstein shares how stakeholders &amp; interests in a project shift &amp; evolve… https://t.co/jvxkzoewel,2
Sat Oct 20 14:08:07 +0000 2018,Honored &amp; humbled with much appreciation for @CAPFndn for their support and investment!! https://t.co/aJ0Eg8Tjax,3
Sat Oct 20 13:55:03 +0000 2018,Politics of sites shift over time. @lynnegoldstein shares how stakeholders &amp; interests in a project shift &amp; evolve… https://t.co/jvxkzoewel,2
Sat Oct 20 13:36:32 +0000 2018,Peer into the crystal ball at #CRE in 2019 w/ Dr. Lawrence Yun &amp; Sean Snaith. Get insights on economic  demographic… https://t.co/IcYFRlvpJR,5
Sat Oct 20 13:36:29 +0000 2018,THE NBA OWNS THE WNBA. THE WNBA HAS ALWAYS BEEN AN INVESTMENT. FUCK THE GLEAGUE. https://t.co/S4o5umpTzO,0
Sat Oct 20 13:33:09 +0000 2018,Just saying that my @wearfigs scrubs were 100% worth the investment. #nurselife #livinglavidanursing,0
Sat Oct 20 13:23:56 +0000 2018,Like kind exchange for real estate investor has to do with a normative belief that it is better for society to have… https://t.co/48ja624dz4,1
Sat Oct 20 13:14:32 +0000 2018,Peer into the crystal ball at #CRE in 2019 w/ Dr. Lawrence Yun &amp; Sean Snaith. Get insights on economic  demographic… https://t.co/IcYFRlvpJR,5
Sat Oct 20 13:05:34 +0000 2018,Peer into the crystal ball at #CRE in 2019 w/ Dr. Lawrence Yun &amp; Sean Snaith. Get insights on economic  demographic… https://t.co/IcYFRlvpJR,5
Sat Oct 20 13:05:14 +0000 2018,Peer into the crystal ball at #CRE in 2019 w/ Dr. Lawrence Yun &amp; Sean Snaith. Get insights on economic  demographic… https://t.co/IcYFRlvpJR,5
Sat Oct 20 13:02:40 +0000 2018,Google  Amazon  and Tesla are joining the home building business.  #innovation #technology #homebuilding #builders https://t.co/UUGJ2V3oeB,0
Sat Oct 20 13:00:12 +0000 2018,Peer into the crystal ball at #CRE in 2019 w/ Dr. Lawrence Yun &amp; Sean Snaith. Get insights on economic  demographic… https://t.co/IcYFRlvpJR,5
Sat Oct 20 12:55:43 +0000 2018,New job alert: Investment Banking Analyst- Technology https://t.co/HY9B3aEeoN,1
Sat Oct 20 12:49:04 +0000 2018,Chinese Companies Are Buying Up Closed Colleges. #china #uscollege #useducation #investment https://t.co/e0Y5jQrYjC,0
Sat Oct 20 12:47:24 +0000 2018,@Sempervive My 20 dollars wasn’t a great investment,0
Sat Oct 20 12:15:40 +0000 2018,The State of London Investment: Top of the Market or Temporary Blip? https://t.co/QD4eAxcGhj,0
Sat Oct 20 10:23:10 +0000 2018,This is a unique offer to invest in a very promising project  don’t miss this great opportunity of investment. I th… https://t.co/9pucnZu8PZ,0
Sat Oct 20 10:17:48 +0000 2018,who wants to give me a few thousand dollars so i can disappear in a puff of smoke and restart my life in another pl… https://t.co/GzWggYfVFK,1
Sat Oct 20 09:18:55 +0000 2018,What stocks should you buy (or stay away from) as rates rise? $BABA $PHM $KBH $NFLX $LEN You might be surprised: https://t.co/Q2IYVFBUUF,1
Sat Oct 20 06:36:35 +0000 2018,ROI.   RETURN ON INVESTMENT.  COVERSATION. IS SERIOUS https://t.co/tUgekZbxEZ,0
Sat Oct 20 06:09:08 +0000 2018,ZAMZAM successfull implements the development plan and successfully enters into transactions with large companies.… https://t.co/ipCaFLE0Rx,0
Sat Oct 20 05:31:16 +0000 2018,@sirDukeDevin -our investment in the future of our own country. We don’t kowtow to wealthy or powerful countries wi… https://t.co/UAqL9Bv879,0
Sat Oct 20 05:27:18 +0000 2018,... our investment in the future of our own country. We don’t kowtow to wealthy or powerful countries with weak mor… https://t.co/BtUE3Z6ag4,0
Sat Oct 20 04:59:36 +0000 2018,New job alert: Investment Banking Analyst- Technology https://t.co/HY9B3aEeoN,1
Sat Oct 20 04:50:20 +0000 2018,CDIAMONDCOIN  is a multifaceted platform with forward thinking crypto technology. I recommend to pay Your attention… https://t.co/1NbPWcrJq7,0
Sat Oct 20 04:30:47 +0000 2018,@Brasilmagic Trumps and Kushners are that dependent on Saudis' investment and/or bailout cash.,0
Sat Oct 20 04:29:46 +0000 2018,@BlockClubCHI Bad investment. It's on the low end. Death Valley. Mofos would be getting killed left and right. Wrong part of town to reopen.,0
Sat Oct 20 03:25:04 +0000 2018,Pupatella pizza chain gets $3.75M investment https://t.co/APThx30Qrr @PupatellaPizza  @flourgrrrl https://t.co/f2lzaU5YuH,0
Sat Oct 20 03:21:26 +0000 2018,@KiaJiLaw @SonLitecoin That's why you cash out your original investment and play with the house's money.,0
Sat Oct 20 03:17:43 +0000 2018,Difficult to take this as credible in any way. Avoid Saudi  Arabia as an investment location; but you knew that alr… https://t.co/AMb3kioogO,0
Sat Oct 20 02:59:38 +0000 2018,Why are lottery winnings taxed as income not capital gains? The ticket price is an investment in your state  no? #GeekQuestion,0
Sat Oct 20 02:41:59 +0000 2018,Chinese investment into Kenya is reportedly bringing racism and discrimination with it https://t.co/Mgd7boCuYm LOL,0
Sat Oct 20 02:30:15 +0000 2018,My co @BCBSIL's Kevin Cassidy - President of Employer Solutions - highlights the importance of employees seeing… https://t.co/Prl0Ma4ifC,2
Sat Oct 20 02:19:25 +0000 2018,@TaylorPearsonMe Did you find out what corps located in opp zones can get into? Probably can't just be pure investment cos?,0
Sat Oct 20 02:13:23 +0000 2018,@Zemedeneh @fitsumaregaa good but I hope EFRT don't have its hand in it or the stolen money find its way back throu… https://t.co/Nac9Nq1sG5,0
Sat Oct 20 02:11:27 +0000 2018,#Cryptocurrency Investment Portfolio IndiNode (XIND) https://t.co/EHNYAbA1la https://t.co/TCEqyLg2vZ,1
Sat Oct 20 02:03:50 +0000 2018,Please don't mess up the waffles - Honey Stinger Announces Equity Investment by Factory LLC - https://t.co/fOa5oICnbe -  @endurancewire,0
Sat Oct 20 01:34:02 +0000 2018,#Cryptocurrency Investment Portfolio IndiNode (XIND) https://t.co/EHNYAbA1la https://t.co/TCEqyLg2vZ,1
Sat Oct 20 01:32:14 +0000 2018,FundGuard Secures $4 Million in Seed Funding &amp; Launches Investment Management SaaS Platform https://t.co/MFgLbHTnCL https://t.co/TgZEihDAmb,0
Sat Oct 20 01:00:40 +0000 2018,Chicago Investment Properties At 30-50% Below Market Value  https://t.co/nCd1HQjBUE  Serious Buyers Only… https://t.co/mCSl2LwGvu,0
Sat Oct 20 01:00:08 +0000 2018,Chicago Investment Properties At 30-50% Below Market Value  https://t.co/yow3g0DJNA  Serious Buyers Only… https://t.co/ha3SrDv3sP,0
Sat Oct 20 00:23:38 +0000 2018,Shipping out a customer's wholesale bundle package. Package is only $500  for 16 pieces BUT you can resell and make… https://t.co/WPJKR9HkAy,2
Sat Oct 20 00:22:37 +0000 2018,They do this without showing visible investment in TweetDeck or other power-user features.,0
Sat Oct 20 00:22:26 +0000 2018,This is more than worth your 20 minute investment https://t.co/KZl2THrOEs,0
Sat Oct 20 00:21:50 +0000 2018,@Sir_Fahrenheit Good investment  Brian! We are now the proud owners of 5 tickets! (They only give us a billion doll… https://t.co/9pdJQ2enVm,0
Sat Oct 20 00:11:31 +0000 2018,And all the investment professionals were gathered around the 200dma- just wondering if we close above or below the… https://t.co/2daLCmDdG6,1
