Wed Aug 02 23:58:13 +0000 2017,This joke was gold fuck y'all,0
Wed Aug 02 23:36:02 +0000 2017,If these photos were taken a half-second later they'd be entirely unspectacular. Instead  they're internet gold. https://t.co/KKBRppdVX4,0
Wed Aug 02 23:26:04 +0000 2017,Hoop it up at the Gold Crown Field House in July! The Bill Hanzlik Basketball Camp is back and ready for action! 👑🏀… https://t.co/cTQszRPXAI,3
Wed Aug 02 23:15:51 +0000 2017,Just give Jesse Winker a Gold Glove already.,0
Wed Aug 02 23:15:05 +0000 2017,#WSOP 2014: #PhilIvey Wins 10th #Gold #Bracelet https://t.co/RVgahqxcLL,0
Wed Aug 02 23:06:37 +0000 2017,If these photos were taken a half-second later they'd be entirely unspectacular. Instead  they're internet gold. https://t.co/qTIpD1i3sK,0
Wed Aug 02 23:06:09 +0000 2017,If these photos were taken a half-second later they'd be entirely unspectacular. Instead  they're internet gold. https://t.co/NViGJUx2ym,0
Wed Aug 02 22:59:30 +0000 2017,@lucianwintrich Thank you for doubling down on this absolute stupidity. Comedy gold  baby!,0
Wed Aug 02 22:52:38 +0000 2017,@RMaxwellCTX It's gold. I may begin touring,0
Wed Aug 02 22:52:25 +0000 2017,UPDATE: MacMath had been injured for 3-4 weeks but played through it while Howard was at the Gold Cup. #Rapids96 https://t.co/Hdt9Y9fcQz,0
Wed Aug 02 22:47:50 +0000 2017,Something important is happening in Silverton on Friday. We can't tell you what it is. @JesseAPaul #GoldKingMine https://t.co/qnD6a2c5Pq,0
Wed Aug 02 22:33:45 +0000 2017,Thread. Absolute gold https://t.co/LfQxiqhOju,0
Wed Aug 02 22:29:46 +0000 2017,@_illdill_ Reddit gold,0
Wed Aug 02 22:21:01 +0000 2017,.@MediaMarcus reporting that Scott Pruitt will visit Durango  #GoldKingmine this week: https://t.co/rhzAg5nImE,1
Wed Aug 02 22:09:09 +0000 2017,This is pure gold. I like Mike's vision  his reflexes and professionalism https://t.co/Y4iKf4sHd0,1
Wed Aug 02 22:09:04 +0000 2017,You're More Valuable Than All the Gold/Money in Fort Knox #inspiration #WednesdayWisdom https://t.co/ZIiUBAsqm2 via @NNP_W_Light,0
Wed Aug 02 22:05:05 +0000 2017,Here’s a fun #summer activity! Learn about density while panning for #gold! Get your kit today - only $15 at… https://t.co/wRgHMkOEoQ,0
Wed Aug 02 21:40:52 +0000 2017,@GoldenKnights I would want the colors to be green and gold kind of mixed and blended all around,0
Wed Aug 02 21:27:17 +0000 2017,Have you considered shiny Gold Business Cards made from Real Stainless Steel? Check our latest article on Gold Kards https://t.co/Fyj9UpoOTZ,0
Wed Aug 02 21:24:33 +0000 2017,When i look in the mirror i see a four loko gold,18
Wed Aug 02 21:12:55 +0000 2017,When i look in the mirror i see a four loko gold,18
Wed Aug 02 21:04:42 +0000 2017,I adore watches and this gold @marcjacobsintl one is part of the #NSale right now! Make sure to… https://t.co/kBs07uhmj6,0
Wed Aug 02 21:04:13 +0000 2017,@CraigSeverson2 @kathymd999 @efCuomo @CNN @Acosta This from someone who voted for a supposed billionaire with gold… https://t.co/UNMOLLuRIE,0
Wed Aug 02 20:59:16 +0000 2017,RollingStone: Paul McCartney plays drums on a track on Foo Fighters' upcoming LP  'Concrete and Gold' … https://t.co/xwnRCJoHkB,0
Wed Aug 02 20:56:25 +0000 2017,.@MediaMarcus reporting that Scott Pruitt will visit Durango  #GoldKingmine this week: https://t.co/rhzAg5nImE,1
Wed Aug 02 20:51:43 +0000 2017,EPA chief Scott Pruitt to tour Gold King Mine with Cory Gardner this week amid… https://t.co/E1aR7fOc2S https://t.co/blEdrtBF4A,0
Wed Aug 02 20:49:24 +0000 2017,Happy birthday to me! Rose gold chrome nails!  Style inspo: le_babs  #treatyoself #rosegold… https://t.co/2UxLtoNfc7,0
Wed Aug 02 20:29:57 +0000 2017,When i look in the mirror i see a four loko gold,18
Wed Aug 02 20:29:22 +0000 2017,Don't miss Rob Gordon's account of what really happened at the Gold King Mine: https://t.co/Pwv1NeAmIF,0
Wed Aug 02 20:27:58 +0000 2017,No. Fiat currency is NOT "money."  Gold is money  anything else is credit https://t.co/Uvel2n3ya1,1
Wed Aug 02 20:27:04 +0000 2017,Aaron Carter - Fool's Gold [Pop] https://t.co/8ynOIyrbFJ,0
Wed Aug 02 20:24:48 +0000 2017,EPA Chief Scott Pruitt and Senator Cory Gardner to tour Gold King Mine site. https://t.co/Dt4H7SdVl9,0
Wed Aug 02 20:23:30 +0000 2017,Back home  emailing  errand running and enjoying a Cross of Gold from @revbrewchicago ! I had… https://t.co/TdCwyv3AUZ,1
Wed Aug 02 20:13:09 +0000 2017,EPA chief Scott Pruitt to tour Gold King Mine with Cory Gardner this week amid spill’s anniversary https://t.co/gCcWi9G7V9 #copolitics,0
Wed Aug 02 20:01:10 +0000 2017,EPA chief Scott Pruitt to tour Gold King Mine with Cory Gardner this week amid spill’s anniversary https://t.co/quRmpXQeFj,0
Wed Aug 02 19:44:54 +0000 2017,Love doughnuts? @HabitDispensary in Denver has "Blazed" doughnuts injected with Yolo Rum Gold. A match made in heav… https://t.co/mcv7cF7nGK,0
Wed Aug 02 19:39:36 +0000 2017,What Is The Criteria For Money? https://t.co/X9JsNPqdO5 via @aceloew #money #gold #silver #bitcoin #ethereum $BTC $BCC $ETH,0
Wed Aug 02 19:22:12 +0000 2017,I just added this to my closet on Poshmark: Boutique 9 Emlyn Ankle Boot Black &amp; Gold. https://t.co/4noUNbSRW6 via @poshmarkapp #shopmycloset,0
Wed Aug 02 19:19:05 +0000 2017,BREAKING: @EPAScottPruitt expected to tour #GoldKingMine site near Durango on Friday https://t.co/qAf2QRHwXL #copolitics @DurangoHerald,3
Wed Aug 02 19:16:08 +0000 2017,@CarolynCpcraig @JessicaHuseman Absolutely. They would have flipped. Trump clearly think anything not gold plated a… https://t.co/5MqDfsle5q,1
Wed Aug 02 19:15:51 +0000 2017,@CarolynCpcraig @JessicaHuseman Absolutely. They would have flipped. Trump clearly think anything not gold plated a… https://t.co/5MqDfsle5q,1
Wed Aug 02 19:13:26 +0000 2017,Listen to how these two protect their wealth  vaults for physical gold overseas and here  junk silver minted... https://t.co/oASz8MUvNj,0
Wed Aug 02 19:07:20 +0000 2017,I wanna dip that ass in gold 💯🏆,0
Wed Aug 02 19:03:08 +0000 2017,If you were plat last split and go 7-3 no your not getting put right back into plat. Be happy with gold  you have SIX MONTHS to grind.,0
Wed Aug 02 19:01:13 +0000 2017,@iamaroadtrip @bridgeteverett every line of hers in Lady Dynamite is GOLD,0
Wed Aug 02 18:55:26 +0000 2017,BREAKING: @EPAScottPruitt expected to tour #GoldKingMine site near Durango on Friday https://t.co/qAf2QRHwXL #copolitics @DurangoHerald,3
Wed Aug 02 18:55:17 +0000 2017,BREAKING: @EPAScottPruitt expected to tour #GoldKingMine site near Durango on Friday https://t.co/qAf2QRHwXL #copolitics @DurangoHerald,3
Wed Aug 02 18:50:13 +0000 2017,BREAKING: @EPAScottPruitt expected to tour #GoldKingMine site near Durango on Friday https://t.co/qAf2QRHwXL #copolitics @DurangoHerald,3
Wed Aug 02 18:45:59 +0000 2017,Clash Royale Hack Tool - Unlimited free Gems &amp; Gold! https://t.co/eq6Gv27Kgp,6
Wed Aug 02 18:45:02 +0000 2017,No. Fiat currency is NOT "money."  Gold is money  anything else is credit https://t.co/Uvel2n3ya1,1
Wed Aug 02 18:40:21 +0000 2017,must also include sugary marshmallow shapes: purple hats  gold gloves  purple jerseys  white baseballs. https://t.co/dIFRZBzhNN,0
Wed Aug 02 18:17:14 +0000 2017,Not enough tacky gold-plated crap in White House for Trump  hence Dump!,0
Wed Aug 02 18:17:01 +0000 2017,Wasn't gold  but I'll take bronze at the @DefendTheNorth 2017 For Honor 1v1s  along with 1st in the 2v2s… https://t.co/38xnjrQjif,4
Wed Aug 02 18:01:39 +0000 2017,Vape Kit i710 GOLD Vaporizer Kit Ships from USA FREE SHIPPING 510 threading - https://t.co/GP1LUaHJb9 via @eBid #eBid,2
Wed Aug 02 17:58:23 +0000 2017,My new fav YouTube couple is Olivia Gold and Will Got the Juice 😍😂,1
Wed Aug 02 17:55:58 +0000 2017,Check out Power Rangers Zeo Super Legends Gold Ranger *MINT* Action Figure https://t.co/wQ7h3UJ6ZY @eBay,1
Wed Aug 02 17:55:00 +0000 2017,"The @WhiteHouse is a dump! It needs more gold trim! That's class! TRUTH! " -President Dip Shit,0
Wed Aug 02 17:55:00 +0000 2017,My new fav YouTube couple is Olivia Gold and Will Got the Juice 😍😂,1
Wed Aug 02 17:49:27 +0000 2017,This is pure gold. I like Mike's vision  his reflexes and professionalism https://t.co/Y4iKf4sHd0,1
Wed Aug 02 17:48:57 +0000 2017,@zerohedge Erdogan encouraged the public rush into gold. Why would he want to end it?  Do some real analysis for on… https://t.co/4W1M5RlCLx,1
Wed Aug 02 17:43:26 +0000 2017,@zerohedge Gold is an asset  not consumable. Not a true contributor to a country's current account deficit.  It's a… https://t.co/74EgT7C9vs,2
Wed Aug 02 17:41:21 +0000 2017,@zerohedge Erdogan encouraged the public rush into gold. Why would he want to end it?  Do some real analysis for on… https://t.co/4W1M5RlCLx,1
Wed Aug 02 17:28:49 +0000 2017,@divinemadness As someone who know  Magnums come in gold wrappers.,0
Wed Aug 02 17:24:32 +0000 2017,Diamonds are forever - except when they're Lemon G live diamonds processed by @CRxConcentrates. Fresh gold from the… https://t.co/kEDnKhrRBR,1
Wed Aug 02 17:16:55 +0000 2017,Congratulations @ussoccer!!! The Gold Cup is home!!! #USAvJAM #GoldCup2017 #USA,1
Wed Aug 02 17:13:23 +0000 2017,Total damages from farmers  business owners and residents along the spill’s path have been estimated at $420M. https://t.co/kqRV9hMfJA,9
Wed Aug 02 16:34:36 +0000 2017,@ms_understood64 @JohnWDean @USATODAY When he announced pence as his running mate they were sitting on gold leaf th… https://t.co/JwvOuqhHBF,0
Wed Aug 02 16:32:34 +0000 2017,@JohnWDean @USATODAY What no gold bathroom fixtures? I refuse to be insulted like this.,0
Wed Aug 02 16:29:29 +0000 2017,Look into my soul  I bet all you'll see is gold,10
Wed Aug 02 16:16:41 +0000 2017,@DavidMoMoMoMo @JamesMacEachern @AOzborne @dontwantexcuses @GigaLiving @yescotland @hads_gh @CompoundAye… https://t.co/7GTrjY9fMX,0
Wed Aug 02 16:03:34 +0000 2017,#Data can bring #wealth in your company. Check out how: https://t.co/65MDuflJMP @oracle,0
Wed Aug 02 15:35:45 +0000 2017,Gold Futures Ease on Strong Equities Market https://t.co/xwKCjL5ycg https://t.co/giGgMUmmPE,0
Wed Aug 02 15:25:43 +0000 2017,@samuelbrasch Alternative snark: tinder profile gold right here,0
Wed Aug 02 15:18:08 +0000 2017,Shop Now: Deep Space Bracelet - Gold is available in my shop ✨  https://t.co/3ZkJXCWMbc https://t.co/QanC9ta6cq,0
Wed Aug 02 14:57:06 +0000 2017,@TrueFactsStated @PreetBharara Any word on whether 45's cell will have a gold-plated toilet?,0
Wed Aug 02 14:54:33 +0000 2017,DJT's Yelp review of the White House: "No gold toilets. None. Zero. Sad! Jerk chef undercooked my steak. Russian oligarchs weren't welcome.",0
Wed Aug 02 14:10:45 +0000 2017,There is $300 billion worth of #gold locked in the vaults of London https://t.co/njYKR0yrnX So now we know...,0
Wed Aug 02 14:08:48 +0000 2017,If there was an Olympic event for getting toothpaste on your shirt  I would take gold every year. 😑,0
Wed Aug 02 14:04:38 +0000 2017,This reply string is GOLD. Happy Wednesday  everyone. https://t.co/CcoKbznMnj,0
Wed Aug 02 13:58:42 +0000 2017,Maxwell; Green is Gold (#LEED) for #Zocalo - https://t.co/ryaaKFkHam via @CREJ92,0
Wed Aug 02 13:46:47 +0000 2017,This is gold @tacobell https://t.co/4eWES51M5h,0
Wed Aug 02 13:44:59 +0000 2017,says the weird man who craps on a gold toilet https://t.co/tDExujOxjr,0
Wed Aug 02 13:19:24 +0000 2017,This is pure gold. @SenCoryGardner isn't holding town halls or listening to the majority of his constituents but st… https://t.co/LVdjpHIAWW,2
Wed Aug 02 13:18:08 +0000 2017,Senator Sasse's Twitter sass is REAL the last couple days 😂 Clearly enjoying trolling the trolls and it's gold 👏🏽 https://t.co/cQtZntLMZW,0
Wed Aug 02 12:44:55 +0000 2017,These guys set the gold standard for NFL broadcasts and sport coats. https://t.co/A6jX1D0b5I,0
Wed Aug 02 12:38:43 +0000 2017,#Gold firm at 1267.40 (-0.25). #Silver 16.72 (+0.026). #Dollar lower. #Euro higher. #Stocks called higher. U.S. 10-year 2.27% (+2 bps).,0
Wed Aug 02 12:36:36 +0000 2017,Jennie from @denverswapshop makes it all seem so GOOD.  FULLMOON Earrings in Gold.  We CAN DO… https://t.co/g2gu27USmN,0
Wed Aug 02 12:19:42 +0000 2017,Electronic applications represent a significant amount of the United States’ annual #gold consumption. Learn more a… https://t.co/sBUjpUv8s9,1
Wed Aug 02 11:57:46 +0000 2017,The WH wasn't entirely hand dipped in shit looking gold  like a DQ cone  the gaudy awful President thinks it's a dump? Disrespectful POS,0
Wed Aug 02 11:51:16 +0000 2017,Susan #Maxwell - Green is Gold (#LEED)for #Zocalo - https://t.co/ryaaKFkHam via @CREJ92,0
Wed Aug 02 11:50:09 +0000 2017,@PokemonGo_Radio @PokemonGOPod "Niantic took a bath on Go Fest". Yes  a Dom Perignon bath in a tub made of gold. https://t.co/OEVTp9FTzG,0
Wed Aug 02 11:32:29 +0000 2017,#NP- “The Gold”: Manchester Orchestra,0
Wed Aug 02 11:27:24 +0000 2017,Give me the gold,0
Wed Aug 02 11:26:04 +0000 2017,When the colonizer arrive and see the walls covered with gold used to travel  they said: money give me that we have mirrors,1
Wed Aug 02 11:25:12 +0000 2017,Europe had beds made of gold,0
Wed Aug 02 11:24:32 +0000 2017,You need to add gold to understand https://t.co/bQkyw0ZI4p,0
Wed Aug 02 11:17:13 +0000 2017,Ay no there comes the ones who melt with that awful gold,0
Wed Aug 02 11:17:08 +0000 2017,Total damages from farmers  business owners and residents along the spill’s path have been estimated at $420M. https://t.co/kqRV9hMfJA,9
Wed Aug 02 11:15:54 +0000 2017,Total damages from farmers  business owners and residents along the spill’s path have been estimated at $420M. https://t.co/kqRV9hMfJA,9
Wed Aug 02 11:14:54 +0000 2017,Not if but when...Financial Shocks Hurt Americans Retirement Savings https://t.co/2aGulEK8a2 #financialwellness,0
Wed Aug 02 11:14:45 +0000 2017,The rich had marble and not gold,0
Wed Aug 02 11:10:55 +0000 2017,We had a machine to fish that doesn't kill the fish made of gold,0
Wed Aug 02 11:10:34 +0000 2017,Nets of gold,0
Wed Aug 02 11:10:24 +0000 2017,Then we had baskets of gold,0
Wed Aug 02 11:08:20 +0000 2017,No other metal allowed what gold,0
Wed Aug 02 11:07:35 +0000 2017,Total damages from farmers  business owners and residents along the spill’s path have been estimated at $420M. https://t.co/kqRV9hMfJA,9
Wed Aug 02 11:06:49 +0000 2017,To make notes on gold paper   To copy models   To copy instructions or books,0
Wed Aug 02 11:04:54 +0000 2017,We needed water in the room next to the bed and we were terrible  we made holes to use less gold https://t.co/tBq0e5cWbW,0
Wed Aug 02 10:59:56 +0000 2017,Gold would make your tables in that room you were visiting,0
Wed Aug 02 10:58:59 +0000 2017,No more boxes  no more tools  no more gold cups  other metals were harder,0
Wed Aug 02 10:57:21 +0000 2017,You got gold out of the city for every trip and you returned that,0
Wed Aug 02 10:56:51 +0000 2017,Without the gold  life looks like made of wood and stones,0
Wed Aug 02 10:56:04 +0000 2017,Total damages from farmers  business owners and residents along the spill’s path have been estimated at $420M. https://t.co/kqRV9hMfJA,9
Wed Aug 02 10:55:51 +0000 2017,Romans later would have it as tradition  take her gold and make her stuff,0
Wed Aug 02 10:55:11 +0000 2017,Here a pound  you got a pound of liquid gold and you had the molds ready,0
Wed Aug 02 10:52:01 +0000 2017,Then  regular houses had an oven for kitchen and for gold,0
Wed Aug 02 10:51:15 +0000 2017,Like needing a cell phone today. You had to carry your gold and have it once you arrived https://t.co/U6vEPxxVCb,0
Wed Aug 02 10:42:13 +0000 2017,At night  to sleep  the wind came cold and humid. A lamine of gold  was cheap and perfect,0
Wed Aug 02 10:41:10 +0000 2017,Total damages from farmers  business owners and residents along the spill’s path have been estimated at $420M. https://t.co/KO4Hpoy2EQ,0
Wed Aug 02 10:40:43 +0000 2017,In America  some had walls covered with gold https://t.co/kMIlAgkGMz,0
Wed Aug 02 10:38:59 +0000 2017,Romans changed other metals into gold,0
Wed Aug 02 10:37:43 +0000 2017,Total damages from farmers  business owners and residents along the spill’s path have been estimated at $420M. https://t.co/kqRV9hMfJA,9
Wed Aug 02 10:37:31 +0000 2017,You want gold  you lift rocks and gold is below,0
Wed Aug 02 10:36:29 +0000 2017,And king makes gold more ecplensive with his sickdcd of the light,0
Wed Aug 02 10:34:17 +0000 2017,Total damages from farmers  business owners and residents along the spill’s path have been estimated at $420M. https://t.co/kqRV9hMfJA,9
Wed Aug 02 10:33:54 +0000 2017,Then  let's make coins  of what  of plastic   Gold coins bring the gold,0
Wed Aug 02 10:33:14 +0000 2017,Because of the amounts possible to have  other metals were more searched. World didn't know electricity and gold properties,0
Wed Aug 02 10:32:01 +0000 2017,Gold was so abundant  it was like mud. You grabbed mud next to a river and put it in an oven with fire and gold cam… https://t.co/qdweasyGvX,0
Wed Aug 02 10:31:58 +0000 2017,Total damages from farmers  business owners and residents along the spill’s path have been estimated at $420M. https://t.co/kqRV9hMfJA,9
Wed Aug 02 10:30:20 +0000 2017,Instead of making a bar of gold,0
Wed Aug 02 10:30:12 +0000 2017,Total damages from farmers  business owners and residents along the spill’s path have been estimated at $420M. https://t.co/kqRV9hMfJA,9
Wed Aug 02 10:23:43 +0000 2017,Gold was the plastic of the past,0
Wed Aug 02 10:22:55 +0000 2017,We use gold for decoration and jewelry hahahahahaha,0
Wed Aug 02 10:22:21 +0000 2017,Then  if you ever go back to nature  you need the gold for the toilet 🚽,0
Wed Aug 02 10:22:01 +0000 2017,When i look in the mirror i see a four loko gold,18
Wed Aug 02 09:29:32 +0000 2017,Did you know that Malawi Gold is of significant #medicinal interest because it produces a portion of its #thc as it… https://t.co/IjezTDFcd4,2
Wed Aug 02 09:12:12 +0000 2017,When i look in the mirror i see a four loko gold,18
Wed Aug 02 07:55:30 +0000 2017,Golden #CO #USA - Billing Coordinator - Billing Coordinator Position Number 262093 Location Gold... https://t.co/v1fxEmsgCW #COLORADO #WORK,0
Wed Aug 02 07:47:04 +0000 2017,"When everyone is looking for gold  it's a good time to be in the pick and shovel business." ~Mark Twain #quote #quotes,0
Wed Aug 02 06:51:41 +0000 2017,Maxwell – Green is Gold for Zocalo https://t.co/dYwVWiplwh,0
Wed Aug 02 06:48:29 +0000 2017,@nuggets Hey nuggets  can the slogan be "Strike Gold" when we make the playoffs this year?,0
Wed Aug 02 06:44:12 +0000 2017,Maxwell – Green is Gold for Zocalo https://t.co/QahqD9P5SY https://t.co/qbpGYGYn49,0
Wed Aug 02 06:35:16 +0000 2017,Gold tings goal tings✨,1
Wed Aug 02 06:30:10 +0000 2017,Gold tings goal tings✨,1
Wed Aug 02 06:28:29 +0000 2017,#elderscrolls 1 #arena and Gold Piles. Get ready for some real treasure! https://t.co/vo5VmymiZd,3
Wed Aug 02 06:10:42 +0000 2017,@pelibruhh @rafaeltorresNBA @DigInDenver @seththomreese Same color scheme baby blue in my option soft but to each h… https://t.co/2l9ryFeRTe,0
Wed Aug 02 06:00:29 +0000 2017,"best junkrat in mexico" level 240 gold player,0
Wed Aug 02 05:51:49 +0000 2017,Utah sues over massive  multistate Gold King Mine spill https://t.co/K4NpoGU6DT https://t.co/Mw6rCu859e,0
Wed Aug 02 05:42:25 +0000 2017,@CandlestickWill Scot Rolen hit 280. That's when the 500 bombs comes in  without it no HOF. Plus zero MVP's/batting… https://t.co/OdG6XwlpwY,0
Wed Aug 02 05:40:30 +0000 2017,bitch you blow my high. that's like turning gold to bronze,0
Wed Aug 02 05:17:24 +0000 2017,Terrorists watch. This is @POTUS. He's being minded. He's got the gold codes  is Command  &amp; can override Control by… https://t.co/9soLAcBLFB,0
Wed Aug 02 05:17:08 +0000 2017,Smoking on gold thanks to @CRxConcentrates @NattyRems! ⬆️Give the homies a follow ⬆️ Shop @Marni420 glass rings on… https://t.co/cpXN5FHkrQ,0
Wed Aug 02 05:13:46 +0000 2017,I just added this to my closet on Poshmark: Boutique 9 Emlyn Ankle Boot Black &amp; Gold. https://t.co/4noUNbSRW6 via @poshmarkapp #shopmycloset,0
Wed Aug 02 05:01:24 +0000 2017,When i look in the mirror i see a four loko gold,18
Wed Aug 02 04:42:34 +0000 2017,Gold ⭐️ https://t.co/lo32F6xiqp,1
Wed Aug 02 04:42:22 +0000 2017,#elderscrolls 1 #arena and Gold Piles. Get ready for some real treasure! https://t.co/vo5VmymiZd,3
Wed Aug 02 04:41:44 +0000 2017,#elderscrolls 1 #arena and Gold Piles. Get ready for some real treasure! https://t.co/vo5VmymiZd,3
Wed Aug 02 04:28:15 +0000 2017,When i look in the mirror i see a four loko gold,18
Wed Aug 02 04:16:15 +0000 2017,@ChelseaClinton @normangoldman He prefers gold plated palaces much as any tin-horned dictator does.,0
Wed Aug 02 04:16:08 +0000 2017,Utah sues over massive  multistate #GoldKingMine spill https://t.co/KskPqn4cd3 #denver,0
Wed Aug 02 04:16:07 +0000 2017,Utah sues over massive  multistate Gold King Mine spill https://t.co/nfzVPJpca3,0
Wed Aug 02 04:14:00 +0000 2017,This shit is gold  you guys.,0
Wed Aug 02 04:13:12 +0000 2017,Utah sues over massive  multistate Gold King Mine spill https://t.co/1tHk2ICcrE,0
Wed Aug 02 04:08:30 +0000 2017,Gold teeth? That's your deff. Of a "real one". How i knw for Sure we weren't meant to be.,0
Wed Aug 02 04:01:29 +0000 2017,Happy Colorado Day!!  Check out these awesome ways to remember 141 years of history... gold-panning  horse-drawn... https://t.co/XCLFRbsOum,0
Wed Aug 02 03:54:38 +0000 2017,@MeninistTweet What happend to the black/gold one of this design? https://t.co/vbWXZ3vpUv,0
Wed Aug 02 03:37:33 +0000 2017,When i look in the mirror i see a four loko gold,18
Wed Aug 02 03:32:28 +0000 2017,When i look in the mirror i see a four loko gold,18
Wed Aug 02 03:29:12 +0000 2017,@rafaeltorresNBA @seththomreese I could def see myself getting the dark blue and the gold for my daughter and wife… https://t.co/UHzCVML5uL,0
Wed Aug 02 03:27:32 +0000 2017,Jennie from @denverswapshop make it all seem so GOOD.   FULLMOON Earrings in Gold.  We CAN DO… https://t.co/WPTUWYB6WG,0
Wed Aug 02 03:25:51 +0000 2017,Gold ⭐️ https://t.co/lo32F6xiqp,1
Wed Aug 02 03:10:22 +0000 2017,When i look in the mirror i see a four loko gold,18
Wed Aug 02 03:06:11 +0000 2017,#coloradoday beer - Drinking a Coors Extra Gold Lager by Coors Brewing Company - https://t.co/X3NJaPNkqd,0
Wed Aug 02 02:56:04 +0000 2017,When i look in the mirror i see a four loko gold,18
Wed Aug 02 02:55:16 +0000 2017,#Rolex #3155 #watch #movement #president #daydate #presidential #gold https://t.co/FTWBWNo4v6,0
Wed Aug 02 02:53:42 +0000 2017,When i look in the mirror i see a four loko gold,18
Wed Aug 02 02:53:23 +0000 2017,When i look in the mirror i see a four loko gold,18
Wed Aug 02 02:52:05 +0000 2017,When i look in the mirror i see a four loko gold,18
Wed Aug 02 02:49:55 +0000 2017,When i look in the mirror i see a four loko gold,18
Wed Aug 02 02:49:21 +0000 2017,Did you know that Malawi Gold is of significant #medicinal interest because it produces a portion of its #thc as it… https://t.co/IjezTDFcd4,2
Wed Aug 02 02:48:55 +0000 2017,When i look in the mirror i see a four loko gold,18
Wed Aug 02 02:46:49 +0000 2017,When i look in the mirror i see a four loko gold,18
Wed Aug 02 02:39:02 +0000 2017,When i look in the mirror i see a four loko gold,18
Wed Aug 02 02:38:28 +0000 2017,@bittergiantsfan Make it red and gold. @LevisStadium AKA  " Hotter than the face of the Sun Stadium". The stick was great for football.,0
Wed Aug 02 02:36:15 +0000 2017,@kurteichenwald @realDonaldTrump thinks it's a dump because everything isn't gold plated like his tacky ostentatious trump tower penthouse.,2
Wed Aug 02 02:18:32 +0000 2017,This business is nuts!! Bitcoin is more valuable than gold! Info here  https://t.co/KQs21y9uH4,0
Wed Aug 02 02:06:48 +0000 2017,First time not wearing gold hoops???? https://t.co/xuTriCA2JC,31
Wed Aug 02 02:03:41 +0000 2017,M.C. Times: M.C. Providence continues to have a booming economy after the rediscovery of gold in 2016,0
Wed Aug 02 02:02:41 +0000 2017,@steveagee Exactly. Trump thinks The White House is a dump b/c it's not dipped in gold leaf &amp; glitter like all his nouveau riche shitholes.,0
Wed Aug 02 02:00:18 +0000 2017,Did you know that Malawi Gold is of significant #medicinal interest because it produces a portion of its #thc as it… https://t.co/IjezTDFcd4,2
Wed Aug 02 01:55:39 +0000 2017,@thegarance No!  Can you imagine what he'd do with it?  You'd have to rename it The Glitter and Gold House.,0
Wed Aug 02 01:44:28 +0000 2017,♡Bid Now♡ $9 #Trifari #Vintage Red Enamel Cream Gold Tone Earrings Pierced #TrifariEarrings https://t.co/5FVV7J5kov via @eBay #ebay #auction,0
Wed Aug 02 01:28:43 +0000 2017,One of our past fly gals panning for gold 💛  📷: @kinseyanndurham #FlyFIsh #Buttery #LikeButterBaby #BrownTrout… https://t.co/d56tgY7i9K,2
Wed Aug 02 01:24:00 +0000 2017,Ending Now! ♡Bid Now♡ $17 #Vintage #CrownTrifari #ClipOnEarrings #BrushedGold #1950s  https://t.co/mPaJXeXLOD via… https://t.co/cGMoMz9Ns9,0
Wed Aug 02 01:12:24 +0000 2017,Trump thinks The White House is a dump b/c it's not dipped in gold leaf &amp; glitter like all his nouveau riche shitholes.,0
Wed Aug 02 01:11:20 +0000 2017,Awards season...for some. For the others? Read this: https://t.co/f9r3848rSd #edchat #teachers https://t.co/0isv38SzzX,0
