Sat Oct 14 23:50:27 +0000 2017,THIS TWEET IS GOLD https://t.co/isBCH9pKUC,0
Sat Oct 14 23:28:06 +0000 2017,#Mindhunter is David Fincher gold.,0
Sat Oct 14 23:15:03 +0000 2017,#WSOP 2014: #PhilIvey Wins 10th #Gold #Bracelet https://t.co/RVgahqxcLL,0
Sat Oct 14 21:53:32 +0000 2017,go cop that lo-fiction and friends tape. pure gold from start to finish https://t.co/yOViwzO7LB https://t.co/e5VDxYDuRo,2
Sat Oct 14 21:35:15 +0000 2017,go cop that lo-fiction and friends tape. pure gold from start to finish https://t.co/yOViwzO7LB https://t.co/e5VDxYDuRo,2
Sat Oct 14 21:24:52 +0000 2017,@wyoming492 @TracyRingolsby Gold... always! Never Brown ;),0
Sat Oct 14 21:16:04 +0000 2017,What’s more fun than growing small business gold? Ken Lain has a ‘green’ thumb for plants &amp; profits… https://t.co/SVkaCOIeMh,0
Sat Oct 14 20:49:31 +0000 2017,Raymond James Recommends Gold? https://t.co/CojmsAcb7L via @InvResDynamics $GLD $slv #gold #silver $JNUG $NUGT,4
Sat Oct 14 20:47:17 +0000 2017,Raymond James Recommends Gold? https://t.co/CojmsAcb7L via @InvResDynamics $GLD $slv #gold #silver $JNUG $NUGT,4
Sat Oct 14 20:27:59 +0000 2017,Raymond James Recommends Gold? https://t.co/CojmsAcb7L via @InvResDynamics $GLD $slv #gold #silver $JNUG $NUGT,4
Sat Oct 14 20:27:20 +0000 2017,Raymond James Recommends Gold? https://t.co/CojmsAcb7L via @InvResDynamics $GLD $slv #gold #silver $JNUG $NUGT,4
Sat Oct 14 20:19:45 +0000 2017,Like Talib I wanna snatch someone’s gold chain off their neck.,0
Sat Oct 14 19:23:35 +0000 2017,@McDonalds #Golden because #1 always gets gold. 🍟🏆,0
Sat Oct 14 19:09:56 +0000 2017,GABF Gold Gives Weldwerks Brewing Medianoche a Higher  Scarier Platform https://t.co/BxAwzqnLR5 #Denver https://t.co/4Q62c9nfdi,0
Sat Oct 14 18:51:49 +0000 2017,This picture is gold. https://t.co/eZSrdtaSMl,2
Sat Oct 14 18:39:31 +0000 2017,This picture is gold. https://t.co/eZSrdtaSMl,2
Sat Oct 14 18:28:30 +0000 2017,This picture is gold. https://t.co/eZSrdtaSMl,2
Sat Oct 14 18:18:41 +0000 2017,@thuhTYLER @RadioMoser GOLD.,0
Sat Oct 14 18:12:40 +0000 2017,There's gold in them there hills. #flyfish #explore #rigged&amp;ready 📷: @vince_chente_garcia7942  Get yours --&gt;… https://t.co/S23clYrrSp,1
Sat Oct 14 17:03:19 +0000 2017,Where else would you find two million worth of gold and silver in the sewers other the Switzerland all we get are nappys..whips and Greece,0
Sat Oct 14 17:00:01 +0000 2017,Gold and crispy https://t.co/ySIEn0WerO,0
Sat Oct 14 16:20:14 +0000 2017,There's gold in them there hills. #flyfish #explore #rigged&amp;ready 📷: @vince_chente_garcia7942  Get yours --&gt;… https://t.co/S23clYrrSp,1
Sat Oct 14 16:14:48 +0000 2017,@EmCanadem77 He thinks China will roll out the yuan-oil futures (non-gold-backed) contract shortly after the Party Congress...,0
Sat Oct 14 16:10:54 +0000 2017,What’s more fun than growing small business gold? Ken Lain has a ‘green’ thumb for plants &amp; profits… https://t.co/sSCQLbLeD2,0
Sat Oct 14 16:07:44 +0000 2017,Nothing gold can stay. 🔸,0
Sat Oct 14 15:55:00 +0000 2017,@RamsNFL The white on the helmets don't look good with the blue unis. Keep the gold on the helmets for those!,0
Sat Oct 14 15:10:36 +0000 2017,@Gold_Rush Not bad but highly unlikely you get 3000 oz,0
Sat Oct 14 15:04:11 +0000 2017,Fresh Picked: Tory Burch Satchel with Classic Leather  Gold-Tone Hardware  Optional Crossbody… https://t.co/rrnoX75eUT,0
Sat Oct 14 14:23:16 +0000 2017,Gracie Gold being treated for eating disorder  will skip Grand Prix season #news https://t.co/7IjWQ36kaA,0
Sat Oct 14 13:44:31 +0000 2017,Raymond James Recommends Gold? https://t.co/CojmsAcb7L via @InvResDynamics,0
Sat Oct 14 09:20:37 +0000 2017,🏅 Elizabeth Kerrigan wins the Gold Award  the highest achievement in Girl Scouting. https://t.co/pJwjBc53JM https://t.co/hYXKCZf6Xx,31
Sat Oct 14 06:00:54 +0000 2017,The Horror Stories are Real. Don’t Give Your Children a Smartphone https://t.co/jjJd5f3I95,0
Sat Oct 14 05:50:15 +0000 2017,Everyone is piling into the long side + retail is record short the VIX.  Can't see this ending well.... https://t.co/FGVU2nHqC1,1
Sat Oct 14 04:31:51 +0000 2017,  one gold toof ouchhhh https://t.co/1TMIgkfPSI,0
Sat Oct 14 04:15:37 +0000 2017,🏅 Elizabeth Kerrigan wins the Gold Award  the highest achievement in Girl Scouting. https://t.co/pJwjBc53JM https://t.co/hYXKCZf6Xx,31
Sat Oct 14 03:39:05 +0000 2017,Gold.  Lakewood Police —&gt; +50 awesome points. https://t.co/Ui9gk8sIDY,0
Sat Oct 14 03:19:05 +0000 2017,https://t.co/CIMVWIFw3d... https://t.co/LIVW07EqqV,0
Sat Oct 14 03:08:21 +0000 2017,I just added this to my closet on Poshmark: 📍Gold Choker Tassel Necklace. NWT!. https://t.co/SqYBxiinbU via @poshmarkapp #shopmycloset,0
Sat Oct 14 03:01:58 +0000 2017,Bloomberg just published a nice story by @myafrazier on Dollar General and Walmart  focusing on Decatur https://t.co/ozWFLxroFF,1
Sat Oct 14 02:41:02 +0000 2017,That. Was. Gold!,0
Sat Oct 14 02:34:29 +0000 2017,stranger things season 2 trailer was gold,0
Sat Oct 14 02:33:03 +0000 2017,U.S. Figure Skating Champion Gracie Gold Withdraws from Grand Prix Due to Depression  Anxiety and an Eating Disorder …,0
Sat Oct 14 02:08:12 +0000 2017,@ChrisRosie22 @ConnorWilsonLAS @dawgbone98 Some of us yearn for the funk  and have great friends in NYC that stumbl… https://t.co/WNxoUzkOI9,0
Sat Oct 14 02:01:43 +0000 2017,Soon I'll put up Ep. 7 of TERMINATION SHOCK. "In the dark future of Karaoke  there is only... a 4 000 pound solid gold Heisman trophy?",0
Sat Oct 14 01:48:07 +0000 2017,I want gold on my glove,0
Sat Oct 14 01:31:24 +0000 2017,#FBF to the time when @SethGreen's silent comedy made  a Broadway-style song comedy gold on @CW_CrazyXGF 😆 https://t.co/ezGRS1MGIn,0
Sat Oct 14 01:09:40 +0000 2017,So Yak just needs to no fade now that we’re a few games in and we’ll be gold!,0
Sat Oct 14 01:07:04 +0000 2017,All that glitters ain’t gold  all that shines bright ain’t a diamond.,0
Sat Oct 14 00:59:34 +0000 2017,@y3rrrqueenambby You can get all that back babes! I called my bank so fast! And they gave it all back! Screenshots are gold ;),5
Sat Oct 14 00:43:00 +0000 2017,@PamelaGeller Pamela you're a hero of MIND... gonads galore; I'd donate a gold mine to forever hear your MAPOGO ROAR ✌️🍀❤️,0
Sat Oct 14 00:28:09 +0000 2017,Gracie Gold being treated for eating disorder  will skip Grand Prix season #news https://t.co/Ze1VBudvJ8,0
