Sun Oct 08 23:37:11 +0000 2017,Strange GABF medals hanging out with @freetailbrewing 2017 Gold. In good company! #strangetail7 https://t.co/XGyur9O8fk,0
Sun Oct 08 23:15:04 +0000 2017,#WSOP 2014: #PhilIvey Wins 10th #Gold #Bracelet https://t.co/RVgahqxcLL,0
Sun Oct 08 23:09:31 +0000 2017,Title: Mountain Flowers  Materials: meininger acrylic paints  golden gel medium  pebeo moon Antique gold paints on 2…https://t.co/0haBk6X0Sf,0
Sun Oct 08 23:01:27 +0000 2017,@LGRed Does Mose always rock a sport coat?,0
Sun Oct 08 22:32:56 +0000 2017,@LGRed LOL! #Gold,0
Sun Oct 08 22:13:12 +0000 2017,Why Sci-Fi Novels Are the New Comic Books For Streaming TV https://t.co/il4AIZynL2 via @WIRED,0
Sun Oct 08 21:37:17 +0000 2017,this is gold https://t.co/ryWDnaWyvI,0
Sun Oct 08 21:21:24 +0000 2017,We’ll take Gold please 🏅 #BruisingA #drdmvp https://t.co/z3d7J8lHZ0,0
Sun Oct 08 21:21:01 +0000 2017,@mskayteegrace I do my best  gotta earn those gold coins u kno,0
Sun Oct 08 21:09:34 +0000 2017,@MollyJongFast @goldengateblond That's gold  Molly! Gold!,0
Sun Oct 08 21:02:18 +0000 2017,I just added this to my closet on Poshmark: Brilliance Gold bracelet. https://t.co/DiCeRpClHt via @poshmarkapp #shopmycloset,0
Sun Oct 08 20:27:34 +0000 2017,Typical pumpkin spice beer. My wife likes it more than me - Drinking a Ghoulish Gold @ Landlocked Ales - https://t.co/XHYx5y0K0M #photo,0
Sun Oct 08 19:52:18 +0000 2017,ETIENNE AIGNER SHOULDER BAG HANDBAG SOFT BRONZE 100% LEATHER GOLD BUCKLE MINT https://t.co/rGsVrKid5t,2
Sun Oct 08 19:52:18 +0000 2017,Is The World About To Take A "Gold Shower?" https://t.co/LKKtbh7Igm via @InvResDynamics,1
Sun Oct 08 19:41:20 +0000 2017,@heart_gold you're lit,1
Sun Oct 08 19:40:39 +0000 2017,@heart_gold you're lit,1
Sun Oct 08 19:22:55 +0000 2017,Is The World About To Take A "Gold Shower?" https://t.co/LKKtbh7Igm via @InvResDynamics,1
Sun Oct 08 18:45:45 +0000 2017,Every American will need 1.59 Troy .oz of #Gold in their lifetime &amp; many other #minerals. Learn more… https://t.co/rcDbjqBP56,10
Sun Oct 08 18:38:29 +0000 2017,@AdamCassella I hope this isn't true. I find it impossible to dislike a Tupac song. The moment that dudes voice hits the beat it's gold.,0
Sun Oct 08 18:22:07 +0000 2017,Kiiara - Gold (Official Video) https://t.co/pmq6Ap47RV via @YouTube,0
Sun Oct 08 18:05:17 +0000 2017,i WILL have a lil bottom gold grill one day ✨,0
Sun Oct 08 17:45:37 +0000 2017,I just added this to my closet on Poshmark: 📍Gold Choker Tassel Necklace. NWT!. https://t.co/SqYBxiinbU via @poshmarkapp #shopmycloset,0
Sun Oct 08 17:18:25 +0000 2017,@scotzineguides @thebestbond @AMarscapone Comedy gold  Vat is charged on and payable at the point of sale.  Richard… https://t.co/lXn1gLNaKZ,0
Sun Oct 08 17:16:17 +0000 2017,Healed septum upgraded to a solid gold continuous hoop from bodygems #mantra #mantratattoo… https://t.co/B3EnKpU6SC,0
Sun Oct 08 16:58:01 +0000 2017,@AmericanAir why did you stop priority boarding for gold? I am a million miler  seems there are no benefits,0
Sun Oct 08 16:57:09 +0000 2017,In honor of October being National Breast Cancer Awareness month  we are featuring Rocky Patel's pink and gold... https://t.co/mZjxvLuXGU,0
Sun Oct 08 16:38:51 +0000 2017,RingCentral: RingCentral Glip Wins Gold Stevie Award for Mobile Messaging. https://t.co/VVqRCeYrBR https://t.co/GkcxNNpGec,0
Sun Oct 08 16:38:11 +0000 2017,DND last night: Does anyone know why I have “dragon gold fish” written in my notes? DM death glare every time I investigate  for fish clues,0
Sun Oct 08 16:33:40 +0000 2017,@THICCYSMITHY Have you seen the curious case of Benjamin buttons now that's a solid gold certified fresh film,0
Sun Oct 08 16:32:28 +0000 2017,@jordanobi @gabekelley @samantha_gold My app boiz,0
Sun Oct 08 16:23:23 +0000 2017,You must learn to trust that there is a future waiting for you that is beyond what you might be able to grasp at this present moment.🙏🙌😁🇺🇸,9
Sun Oct 08 15:35:30 +0000 2017,Every American will need 1.59 Troy .oz of #Gold in their lifetime &amp; many other #minerals. Learn more… https://t.co/rcDbjqBP56,10
Sun Oct 08 15:22:04 +0000 2017,Every American will need 1.59 Troy .oz of #Gold in their lifetime &amp; many other #minerals. Learn more… https://t.co/rcDbjqBP56,10
Sun Oct 08 15:12:03 +0000 2017,@55mmbae @2Petty2Care Or does he treat you right tf his money got to do with treating you correct? Gold digging mfs,0
Sun Oct 08 14:17:52 +0000 2017,Every American will need 1.59 Troy .oz of #Gold in their lifetime &amp; many other #minerals. Learn more… https://t.co/rcDbjqBP56,10
Sun Oct 08 14:15:04 +0000 2017,Every American will need 1.59 Troy .oz of #Gold in their lifetime &amp; many other #minerals. Learn more… https://t.co/rcDbjqBP56,10
Sun Oct 08 12:58:43 +0000 2017,To all my genuine loving  friendly  positive  caring people on earth! STAY GOLD ✨   You’re the change! ✊🏼🌈♥️,0
Sun Oct 08 12:33:04 +0000 2017,Every American will need 1.59 Troy .oz of #Gold in their lifetime &amp; many other #minerals. Learn more… https://t.co/rcDbjqBP56,10
Sun Oct 08 12:31:50 +0000 2017,Every American will need 1.59 Troy .oz of #Gold in their lifetime &amp; many other #minerals. Learn more… https://t.co/rcDbjqBP56,10
Sun Oct 08 10:02:16 +0000 2017,Every time I clean the cat boxes I think  “Hey I would have been a great  Gold Panner in the 1840’s” and also “I hate cat shit”,5
Sun Oct 08 08:15:11 +0000 2017,Every time I clean the cat boxes I think  “Hey I would have been a great  Gold Panner in the 1840’s” and also “I hate cat shit”,5
Sun Oct 08 06:52:06 +0000 2017,Used to always want a Rollie now I want a new two tone gold Patek,0
Sun Oct 08 06:32:48 +0000 2017,This is gold #TomPetty https://t.co/g9b0oIiHFX,0
Sun Oct 08 06:30:52 +0000 2017,Made with 💛 : Gold Round Social Media Icons - Basic Pack https://t.co/I4bSwQLmhG,0
Sun Oct 08 06:19:26 +0000 2017,I'm about to just buy the gold Heihachi hat and paint that bitch white lmao,0
Sun Oct 08 05:33:24 +0000 2017,@ARGephart @Wasco_Leo @Castricone I get that but we have black on the jersey and grey on the helmet. Why not gold on the helmet.,0
Sun Oct 08 04:59:10 +0000 2017,One of the most feared defensive ends in the NFL has a heart of gold. https://t.co/LBV976woPD,0
Sun Oct 08 04:44:20 +0000 2017,Every time I clean the cat boxes I think  “Hey I would have been a great  Gold Panner in the 1840’s” and also “I hate cat shit”,5
Sun Oct 08 04:22:17 +0000 2017,I still need one of those red and gold pullovers from that hyfr video 💁🏽 @Drake,0
Sun Oct 08 04:04:53 +0000 2017,Every American will need 1.59 Troy .oz of #Gold in their lifetime &amp; many other #minerals. Learn more… https://t.co/rcDbjqBP56,10
Sun Oct 08 03:22:38 +0000 2017,#APDStealAlert: 2001 Gold Ford F250 Pickup - CO LIC LQP018 - IF SEEN DO NOT APPROACH  CALL 911,0
Sun Oct 08 03:20:56 +0000 2017,Our AMAZING Lauren  Chris  Head Brewer Kevin  and Greg accept #GOLD from Charlie! #gabf #redrockbrewing #beer… https://t.co/eKJEdLXogq,0
Sun Oct 08 03:15:52 +0000 2017,All that glitters IS gold in this case... Way to go Eureka Heights! https://t.co/RYMX5AGuup,0
Sun Oct 08 03:10:15 +0000 2017,Getting started beginning gold prospecting https://t.co/lThXQyung9,0
Sun Oct 08 03:09:02 +0000 2017,Life is a circle. Fill of fun and hidden treasures. Glittery  gold  and dark. Be the Journey. You got this. #art… https://t.co/J6XUS3u2BU,0
Sun Oct 08 03:01:03 +0000 2017,@Wasco_Leo @Castricone Doesn't match  no gold  look like grapes.,0
Sun Oct 08 02:55:22 +0000 2017,@Mdubscott lol sorry about your notifications blowing up.. that tweet was gold.  had to share it with the world.,0
Sun Oct 08 02:51:18 +0000 2017,Every American will need 1.59 Troy .oz of #Gold in their lifetime &amp; many other #minerals. Learn more… https://t.co/rcDbjqBP56,10
Sun Oct 08 02:35:03 +0000 2017,Every American will need 1.59 Troy .oz of #Gold in their lifetime &amp; many other #minerals. Learn more… https://t.co/rcDbjqBP56,10
Sun Oct 08 02:25:19 +0000 2017,👇 it’s me in my fancy gold face mask. https://t.co/ts8sCaxwyP,0
Sun Oct 08 01:57:42 +0000 2017,@Cortland22 Yup! I got difficult shots gold now so even putting a hand up don’t mean nothing,0
Sun Oct 08 01:50:19 +0000 2017,It comes waltzing in Flamboyant October Swathed in purple  pink and gold Undulating through the chaos of my existence,0
Sun Oct 08 01:29:22 +0000 2017,I live for scenic Autumn drives when the entire world is encased in gold. 😌🍁 https://t.co/yvYFshRsRH,0
Sun Oct 08 01:17:21 +0000 2017,For @CO_Symphony playing #Prince I dug into 80s closet for purple dress w/shoulder pads &amp; gold buttons  banana clip… https://t.co/9q7x6a9MF6,0
Sun Oct 08 01:06:33 +0000 2017,bathroom stalls for the powder nose  high heel shoes with the open toes  she's got a good time wrapped in gold for you  for you,0
Sun Oct 08 00:45:19 +0000 2017,Is The World About To Take A "Gold Shower?" https://t.co/LKKtbh7Igm via @InvResDynamics,4
Sun Oct 08 00:34:56 +0000 2017,Congrats @MoonRiverBrew for winning Gold 🥇 in Belgian-Style Witbier at #GABF2017 @GaBrewersGuild #GAbeer,3
Sun Oct 08 00:27:22 +0000 2017,Youngkingdave's latest ig post is absolute gold 🤣🤣,0
Sun Oct 08 00:10:45 +0000 2017,Glip: .RingCentral Glip Wins Gold Stevie Award for Mobile Messaging. https://t.co/VVqRCeYrBR https://t.co/tnH3j6Tq7f,0
