Fri Feb 02 23:05:41 +0000 2018,#moneymoney #moneytrees #getpaid #crypto #bitcoin #eth #XRP #NEO #ADA #POE #BNB #TRX #CARDANO #TRON #TNT #CND,0
Fri Feb 02 23:00:44 +0000 2018,Teenage Bitcoin Millionaire: “it’s Your own fault if you’re not a Millionaire in 10 years” https://t.co/53f3ThAEVW… https://t.co/1RIfhlcFaF,0
Fri Feb 02 18:35:31 +0000 2018,Selling my crypto some scandalous losses haha  Ripple 3.20 to 0.85 Tron 0.18 to 0.06 Quantstamp 0.73 to 0.37 Icon 9… https://t.co/cd2DMkf4W4,0
Fri Feb 02 13:05:14 +0000 2018,(Cardano Price Technical Analysis – ADA/USD to Decline Further?) has been published on Cryptoinews -… https://t.co/HpE5lyvHff,0
Fri Feb 02 06:32:34 +0000 2018,Bitcoin Litecoin  CRYPTOS DYING?! OR an opportunity to buy? #litecoin #Bitcoin #bitcoincrash #cryptos #cryptocurrencynews #cardano,0
Fri Feb 02 05:34:58 +0000 2018,What are you doing right now during the correction? Obviously the market isn't going to just magically dwindle away… https://t.co/9FnQLnwZs5,0
Fri Feb 02 05:32:59 +0000 2018,FedEx Flies Ahead with Blockchain Logistics Plans https://t.co/TxbqxKIaFd  #bitcoin #ethereum #ripple #stellar… https://t.co/NIJTjKydc4,0
Fri Feb 02 04:08:26 +0000 2018,Good buy in of #Cardano right now!  Currently at 4238 sats // I always encourage my followers to strengthen your po… https://t.co/9X6zQuZ9uN,0
Fri Feb 02 01:15:49 +0000 2018,Cryptocurrency Regulations in 2018: The World and the Fate of Cryptocurrency https://t.co/hpoc6dnuhK  #bitcoin… https://t.co/TC8rws7GZW,0
