Sat Jan 06 21:17:00 +0000 2018,Scary marijuana stats:  1. 88 000 deaths are annually attributed to excessive use.   2. Every day  30 people in the… https://t.co/Ddly0ECEnt,138999
Sat Jan 06 21:12:10 +0000 2018,buying crytpo (ill pay paypal or bank zelle transfer) for LTC ETH OR BTC Please DM ASAP,2
Sat Jan 06 21:06:22 +0000 2018,buying crytpo (ill pay paypal or bank zelle transfer) for LTC ETH OR BTC Please DM ASAP,2
Sat Jan 06 21:05:30 +0000 2018,buying crytpo (ill pay paypal or bank zelle transfer) for LTC ETH OR BTC Please DM ASAP,2
Sat Jan 06 19:15:32 +0000 2018,@PhotoVideo_Guru @_pivx @hackernoon @Dan_Jeffries1 It's incredibly low fee comparatively.  Past 24 fees below. Avg… https://t.co/7kIlO8Mx9d,0
Sat Jan 06 16:20:18 +0000 2018,This is enough for a Litecoin / Btrash flippening. Look out cryptoworld.  $btc $ltc $bch $eth https://t.co/OrB6spyxPl,0
Sat Jan 06 15:29:44 +0000 2018,@Dildeep96 Btc and eth trash networks that take days to make transactions  ripple centralized korean coin  lite and… https://t.co/t5NdjoFpaX,0
Sat Jan 06 15:21:32 +0000 2018,Amazing to see $Eth over $1 000!,0
Sat Jan 06 05:10:31 +0000 2018,Girls shoot their shot by adding you on snap then posting a bomb ass selfie right after waiting for you to comment,29517
Sat Jan 06 04:23:37 +0000 2018,Sold BTC today. Keeping LTC. Ramping up ETH now... https://t.co/t6GGOMcaXd,3
Sat Jan 06 04:07:15 +0000 2018,ETH has future? Think so.. https://t.co/YVP8QBQ5Lv,1
Sat Jan 06 03:58:22 +0000 2018,ETH has future? Think so.. https://t.co/YVP8QBQ5Lv,1
Sat Jan 06 03:23:54 +0000 2018,KIN exceeds the top 50 on Coin Base! Amazing growth  a strong start for KIN 2018  10BIL Market Cap? @kin_foundation… https://t.co/buMgyVpcbM,0
Sat Jan 06 03:02:53 +0000 2018,Oh and don't forget about #ETH. He's waking up soon too.,0
Sat Jan 06 02:35:18 +0000 2018,@EvanJordan @RiggsBarstool To take a step back and look at how over inflated everything is.  Once this pops only bt… https://t.co/cJMd9gj77g,0
Sat Jan 06 02:30:19 +0000 2018,@MartyBent @RiggsBarstool Marty your hate of eth blinds you.,0
