Sun Sep 16 22:07:33 +0000 2018,im gonna say it...touch id was much better than face id,109
Sun Sep 16 19:37:35 +0000 2018,I think you should invest in this project  and also support and be with it  since this project has very high potent… https://t.co/rp2DdUphZq,0
Sun Sep 16 19:37:06 +0000 2018,This Token applies blockchain technology to realise its token as a sYource of value  and to store information of va… https://t.co/0UwtykYdr2,0
Sun Sep 16 19:24:46 +0000 2018,An intresting and best oppurtunity for joining this awesome free invest project .  #W12 #Token #ETH #Ethereum,0
Sun Sep 16 17:37:32 +0000 2018,@Schwadle except gary condit  whom'eth @Real_LastName has exposed as the real 9/11 architect,0
Sun Sep 16 12:31:34 +0000 2018,im still really fucking sad about mac miller  doesn't feel real,357
Sun Sep 16 01:45:32 +0000 2018,Quick story about my grandmom norma that I got a tattoo of yesterday. When I was 14 I was 5'2  I hated it. She said… https://t.co/UOEdPJZrLe,368
