Wed Nov 21 21:06:57 +0000 2018,It costs $5k to mine 1 Bitcoin in many areas  therefore many miners are mining at a loss to keep the network secure.,2
Wed Nov 21 17:01:33 +0000 2018,ETH Mining Not Profitable  Miner Heats Home With ASIC Rigs https://t.co/FMSzdMHTH9 https://t.co/nXJ494WA6q,0
Wed Nov 21 08:54:00 +0000 2018,Stealthy Crypto-Mining Malware Evades Detection |#NymblSoft | Hire experienced #Cloud Architects  #Salesforce from… https://t.co/VXFE9ygUI4,0
Wed Nov 21 05:56:45 +0000 2018,@LSValue There might be mining ASICs (Bitmain's?) inside of those systems rather than GPUs.,0
Wed Nov 21 03:14:43 +0000 2018,I always tell people that bitcoin mining is the highest and greatest investment that gives profits on daily bases m… https://t.co/m4iSOG2cdq,1
Wed Nov 21 00:33:40 +0000 2018,It costs $5k to mine 1 Bitcoin in many areas  therefore many miners are mining at a loss to keep the network secure.,2
