Tue Aug 14 17:46:45 +0000 2018,Update Bitclub Network Compensation Dec 2018 BITCOIN mining 🔥 https://t.co/txqmPPSV4X via @YouTube,2
Tue Aug 14 17:41:50 +0000 2018,Update Bitclub Network Compensation Dec 2018 BITCOIN mining 🔥 https://t.co/txqmPPSV4X via @YouTube,2
Tue Aug 14 17:16:09 +0000 2018,Update Bitclub Network Compensation Dec 2018 BITCOIN mining 🔥 https://t.co/txqmPPSV4X via @YouTube,2
Tue Aug 14 16:27:04 +0000 2018,Possible IPO for Bitcoin Mining Giant Bitmain https://t.co/k3VTW01OWo,0
Tue Aug 14 16:11:05 +0000 2018,Possible IPO for Bitcoin Mining Giant Bitmain   https://t.co/obBUAxC8wY,0
Tue Aug 14 15:53:06 +0000 2018,When not mining bitcoins  I prefer to waste computer cycles on #kaggle - https://t.co/mT5M1iPVvz,0
Tue Aug 14 14:12:29 +0000 2018,“WHAT PREVENTS SEABED MINING FROM BEING FULLY OPERATIONAL” by @KryptonOcean https://t.co/wsolwVymTs,0
Tue Aug 14 13:45:19 +0000 2018,Irony (in a very good way): the Kentucky Coal Mining Museum switched to solar power last year.,0
Tue Aug 14 07:48:46 +0000 2018,#xzc #blockchain #cloud #mining @ The Rose https://t.co/rDtLdPhWvN,0
Tue Aug 14 07:25:25 +0000 2018,@RealMuckmaker Your comic is killer.  But #PenceKnew #TrumpRussia #treason included #Putin-supported #asbestos mini… https://t.co/pbC1tReueZ,0
Tue Aug 14 07:18:29 +0000 2018,Speaking of the Bank of Cyprus  which #WilburRoss headed to help launder Russian rubles from everywhere: remember T… https://t.co/O5DwtbHFGJ,3
Tue Aug 14 06:53:23 +0000 2018,“the mining of rare earth metals and disposal of our highly digital technologies destroys human habitats  replacing… https://t.co/MVXxvuXNlI,0
Tue Aug 14 02:29:51 +0000 2018,I'd you're concerned by: - exploding deficit - tax cut benefiting the wealthy - loss of healthcare protections  - h… https://t.co/LFWz89DbFP,0
