Tue Aug 21 23:41:07 +0000 2018,REWIND: Oxford FCU Leverages Data Mining  Boosts Auto Lending Nearly $800 000 @synergentcorp #creditunions ...… https://t.co/YAy2XBqTwk,1
Tue Aug 21 22:27:30 +0000 2018,REWIND: Oxford FCU Leverages Data Mining  Boosts Auto Lending Nearly $800 000 @synergentcorp #creditunions ...… https://t.co/YAy2XBqTwk,1
Tue Aug 21 22:13:10 +0000 2018,Mining Innovation Aims to Turn Utah Sands Into an Oil Patch https://t.co/vvoSxlOeCW https://t.co/M6pNIqL0UQ,0
Tue Aug 21 22:01:56 +0000 2018,"Mining Innovation Aims to Turn Utah Sands Into an Oil Patch" by CLIFFORD KRAUSS via NYT https://t.co/Zp5BvWZt8S #sandiego #ceo,0
Tue Aug 21 20:49:40 +0000 2018,That’s all Mueller could squeeze out of strip mining Cohen? How much money has been blown on this fishing expeditio… https://t.co/4do0thJaTE,0
Tue Aug 21 20:05:52 +0000 2018,Greetings from #KDD2018  the world's oldest data science conference  where the Motive team is learning about the la… https://t.co/a6etheU0qW,0
Tue Aug 21 19:10:07 +0000 2018,Schools Are Mining Students' Social Media Posts for Signs of Trouble https://t.co/kTggtFQ5Ei #tech,0
Tue Aug 21 18:54:43 +0000 2018,Asus' new motherboard can hold 20 GPUs for crypto-mining - Bitcoin and Crypto Currencies Guide https://t.co/ir3hL85p37,0
Tue Aug 21 18:05:59 +0000 2018,@Dark_Entity666 How?  It's mining and fishing.  Those days always seem to go by fast.,0
Tue Aug 21 17:02:49 +0000 2018,Asus' new motherboard can hold 20 GPUs for crypto-mining Asus’ new motherboard can hold 20 GPUs for crypto-mining T… https://t.co/W3tTMyWTib,0
Tue Aug 21 16:18:34 +0000 2018,HUNDREDS of coal mining jobs are now safe #MAGA https://t.co/DFxCNfoE4G,0
Tue Aug 21 16:02:01 +0000 2018,Should We Regulate Cryptocurrency Mining? https://t.co/8xu5NPTKd7 https://t.co/VKFebpceIq,0
Tue Aug 21 11:54:22 +0000 2018,Spent Monday as I thought I would ...debriefing Automation and dealing with The Biological Units.  Also tuning up t… https://t.co/3RCKYU2Acu,0
Tue Aug 21 10:13:17 +0000 2018,The Bitcoin Investment Scheme! Mine your Bitcoin for 3months and get Double the mining amount. Cheap right? Yeah!!!… https://t.co/5RDKsN32mT,3
Tue Aug 21 08:28:47 +0000 2018,China's lithium price decline is not the full picture to an industry surging https://t.co/fF6jzUMNRR via @mining,0
Tue Aug 21 06:52:51 +0000 2018,@RBReich 1. Moon  Mars and other places will be colonized. When they are  assets will be protected and land grab wi… https://t.co/9mRJoLwWW0,1
Tue Aug 21 06:52:44 +0000 2018,@RBReich 1. Moon  Mars and other places will be colonized. When they are  assets will be protected and land grab wi… https://t.co/9mRJoLwWW0,1
Tue Aug 21 05:05:46 +0000 2018,Akon &amp; Ai Weiwei Explore Crypto &amp; Bitcoin Mining Politics – BTC &amp; Cryptocurrency News https://t.co/YZnAoww8kY,0
Tue Aug 21 04:56:03 +0000 2018,@ianbremmer Funny how they completely missed (or sidestepped) China which is the 800lb gorilla of BTC holdings and mining,0
