Tue Aug 14 20:40:32 +0000 2018,BlockChannel:Cardano is already being labeled by some experts as a scalable solution to the inefficiencies created… https://t.co/ozVCFKO33u,0
Tue Aug 14 14:55:03 +0000 2018,Today we are announcing that we’re exploring the addition of the following assets to Coinbase: Cardano (ADA)  Basic… https://t.co/9CzAeBkh6s,4675
Tue Aug 14 12:37:18 +0000 2018,The Creator and Development Team Of Cardano (ADA) Drops a Series of Surprise Announcements – ADA Pay -… https://t.co/cqtpIJ708k,0
Tue Aug 14 12:27:48 +0000 2018,The #Crypto market is tanking across the board  reaching a 2018 low  so we thought a lot of people would find this… https://t.co/62dXb47ywo,1
Tue Aug 14 10:28:11 +0000 2018,It's going to be the greatest Blockchain Conference in Africa. We have @Akon   @IOHK_Charles (Co-founder of Ethereu… https://t.co/yIWbIJN0ex,1
Tue Aug 14 09:05:14 +0000 2018,The #Crypto market is tanking across the board  reaching a 2018 low  so we thought a lot of people would find this… https://t.co/62dXb47ywo,1
