Sun Nov 04 22:20:53 +0000 2018,#Cardano breaks horizontal support $ADA has performed a perfect re-test strategy over the last couple of days. Full… https://t.co/nuaGli7Zmj,1
Sun Nov 04 22:15:05 +0000 2018,#Cardano breaks horizontal support $ADA has performed a perfect re-test strategy over the last couple of days. Full… https://t.co/nuaGli7Zmj,1
Sun Nov 04 22:14:41 +0000 2018,#Cardano breaks horizontal support $ADA has performed a perfect re-test strategy over the last couple of days. Full… https://t.co/vUi4UfWLow,0
Sun Nov 04 20:01:12 +0000 2018,Cardano (ADA) and the Coinbase Listing: How Coinbase Could Affect ADA | Crypto Recorder https://t.co/nkDbaAq7kU,0
Sun Nov 04 15:10:46 +0000 2018,Cardano Price Moves up as new Exchange Taps ADA as its Base Currency https://t.co/v33gWOMRHm #bitcoin #bitcoinnews #btc #cryptocurrency,0
Sun Nov 04 06:37:11 +0000 2018,CARDANO (ADA) Expected Huge Growth In 2019—3 reasons https://t.co/lFYzdKLMrR https://t.co/OHd5bAzWlI,2
Sun Nov 04 06:17:29 +0000 2018,ADA will be on Coinbase soon   enough  which will increase   exposure to the masses. 2019 is   going to be an event… https://t.co/5RPuuWWaUQ,0
