Fri May 11 20:48:35 +0000 2018,⬆ +1 Companies show ‘delighted’ response to Ripple [XRP]’s xRapid pilot https://t.co/e4BaFF4w3L $XRP  #xrp… https://t.co/EjXN6YqTCf,0
Fri May 11 18:30:04 +0000 2018,New Music: The Cool Kids “Ripple” https://t.co/zYRGut27AF https://t.co/4lXs7CVphB,0
Fri May 11 17:29:07 +0000 2018,Pretty sure Ripple is officially the Nickel Back of Crypto.,7
Fri May 11 17:09:06 +0000 2018,#Bidium #bidiumofficial #Bitcointalk #bitcoins #etherium #Ripple https://t.co/yTiUpwaoDG,0
Fri May 11 17:01:31 +0000 2018,What the battle between Bitcoin and Ethereum can teach us about the power of being first to market: https://t.co/YNDRxzLI2M,0
Fri May 11 16:11:34 +0000 2018,Pretty sure Ripple is officially the Nickel Back of Crypto.,7
Fri May 11 13:40:12 +0000 2018,Ripple Announces Successful First Pilot Tests Using XRP Cryptocurrency  https://t.co/auLs2Vzkhp,0
Fri May 11 13:19:11 +0000 2018,Cryptocurrencies are getting slammed after a raid at South Korea's largest exchange https://t.co/hRHMxD4ulH https://t.co/TtySl2DoMJ,0
Fri May 11 12:37:54 +0000 2018,Ripple Reveals Results Of First Pilots Using XRP Cryptocurrency https://t.co/3c1NkeSLj6,0
Fri May 11 12:34:30 +0000 2018,@crypto_orcs I agree that this is behind most of the _excessive_ volatility when that happens specifiucally  but yo… https://t.co/BKShBjicsm,0
Fri May 11 12:00:01 +0000 2018,Pretty sure Ripple is officially the Nickel Back of Crypto.,7
Fri May 11 11:27:01 +0000 2018,Pretty sure Ripple is officially the Nickel Back of Crypto.,7
Fri May 11 08:32:44 +0000 2018,Here’s How Ripple Can Help Financial Institutions Save Up To 70% In Just 2 Minutes [https://t.co/cRxXSyJ9bp] ⬆ +2 (30 minutes ago),0
Fri May 11 04:50:01 +0000 2018,Ripple: XRP Pilot Cuts Payment Fees Up to 70%  https://t.co/6GNNgLGhoE,0
Fri May 11 04:40:09 +0000 2018,Ripple Cross-Border Payments Pilot: Financial Institutions Report Significant Time  Cost Savings  https://t.co/SI7kqngsOh,0
Fri May 11 03:10:03 +0000 2018,Ripple: XRP Payment Pilots Cut Fees by 40-70 Percent  https://t.co/6GNNgLGhoE,0
Fri May 11 03:01:30 +0000 2018,Pretty sure Ripple is officially the Nickel Back of Crypto.,7
Fri May 11 01:27:31 +0000 2018,New post in Breakout Crypto News: Ripple Cross-Border Payments Pilot: Financial Institutions Report Significant Tim… https://t.co/DhAOVmjbo1,0
Fri May 11 00:00:03 +0000 2018,Ripple Powers Korean Crypto Exchange Coinone for Blockchain Remittance  https://t.co/87gzlwn7oJ,0
