Fri Mar 30 22:00:09 +0000 2018,What is Ripple &amp;amp; What are the basics of Investing in XRP using Bitsane &amp;amp; CoinBase https://t.co/AdqxaSmLuH #odacrypto #Cryptocurrency,0
Fri Mar 30 21:33:41 +0000 2018,@DougPolkPoker The best indicator was when Doge pumped a lot near the end of the top. That was my clear wake up cal… https://t.co/buQ2P91ZhJ,0
Fri Mar 30 21:00:00 +0000 2018,What do you think the chances are of XRP replacing BTC? https://t.co/ZDFcNLzsSP #odacrypto #Cryptocurrency,0
Fri Mar 30 19:00:08 +0000 2018,Why do we fall? https://t.co/ISf31fP0fP #odacrypto #Cryptocurrency,0
Fri Mar 30 17:53:07 +0000 2018,It’s fantastic news and one helluva statement from @Ripple on who they are and what they stand for.   Doesn’t chang… https://t.co/SblzeFcspv,2
Fri Mar 30 17:42:13 +0000 2018,It’s fantastic news and one helluva statement from @Ripple on who they are and what they stand for.   Doesn’t chang… https://t.co/SblzeFcspv,2
Fri Mar 30 17:37:03 +0000 2018,It’s fantastic news and one helluva statement from @Ripple on who they are and what they stand for.   Doesn’t chang… https://t.co/SblzeFcspv,2
Fri Mar 30 16:31:12 +0000 2018,【暗号通貨】Ripple総合555 リップル【XRP】　これってインサイダー取引の証拠？ https://t.co/bXAUO7l9bM,0
Fri Mar 30 14:45:33 +0000 2018,WOW..this is amazing! Bravo @Ripple! #AllinForKids https://t.co/r7PQpjIWqB,0
Fri Mar 30 14:45:28 +0000 2018,Every single classroom project on @DonorsChoose was just funded – Happy #BestSchoolDay! Thank you to @Ripple for su… https://t.co/np2lCvNeZc,0
Fri Mar 30 13:08:44 +0000 2018,AWESOME News!   https://t.co/yNiqljCmfn,0
Fri Mar 30 10:53:13 +0000 2018,Ripple donates $29 million worth of XRP to an American public schools https://t.co/XCYUuKeWhm,0
Fri Mar 30 10:41:26 +0000 2018,What we're doing here will send a giant ripple through the universe. ? Steve Jobs,0
Fri Mar 30 09:12:51 +0000 2018,Top story: Every single teacher on a crowd-funding site just got their wishes f… https://t.co/MjQX3O2f62  see more https://t.co/gBCg2FypGt,0
Fri Mar 30 08:50:14 +0000 2018,Thank You @Ripple #EducationTakesYouPlaces https://t.co/5mdfWX9Yt7,0
Fri Mar 30 07:09:14 +0000 2018,A company donated $29 million in cryptocurrency to cover every single teacher request on a crowdfunding site https://t.co/DeDPbegYTZ,0
Fri Mar 30 07:01:48 +0000 2018,Breaking news: London Blocks exchange adds Ripple trading..awesome!! https://t.co/otFrYvBKfJ #odacrypto #Cryptocurrency,1
Fri Mar 30 07:00:14 +0000 2018,Breaking news: London Blocks exchange adds Ripple trading..awesome!! https://t.co/otFrYvBKfJ #odacrypto #Cryptocurrency,1
Fri Mar 30 03:00:07 +0000 2018,How to easily increase the XRP Price (GENIUS) https://t.co/nvCw4SzIyr #odacrypto #Cryptocurrency,0
Fri Mar 30 02:51:59 +0000 2018,[ NEWSLETTER PREMIUM] Manejo de las posiciones #bitcoin #etherium #iota #ripple https://t.co/nxKeDkyi4N https://t.co/SJ0ORmOLak,0
Fri Mar 30 01:00:31 +0000 2018,Did Uphold just eat Coinbase's lunch? 5min verification and debit card use to buy XRP direct?… https://t.co/1DAJzql5hT,0
Fri Mar 30 00:00:13 +0000 2018,Ripple at a Fintech event hosted by La Banque de France https://t.co/18fnNpMSHC #odacrypto #Cryptocurrency,0
