Tue Aug 07 23:21:34 +0000 2018,@C3_Nik @AlexCobb_ @digitalassetbuy @LogicDm It's kinda funny to see people freaking out... if you believe in what… https://t.co/rv763kZfmP,0
Tue Aug 07 22:08:30 +0000 2018,@Ripple What happen anyone told me anything ....? The price is going down ...!!!!!!,0
Tue Aug 07 19:29:19 +0000 2018,I could see ETC becoming the 5th best coin in months to come.  #btc #bitcoin #eth  #ethereum  #ltc  #litecoin #hodl… https://t.co/W6MQyGsfl6,0
Tue Aug 07 18:43:20 +0000 2018,Check out my classroom on @DonorsChoose! I'd love your help to bring my project to life. Please use promo code RIPP… https://t.co/KUNaUigemz,0
Tue Aug 07 17:10:34 +0000 2018,Here Is Ripple’s Summarized Plan of Making XRP and Ripple Products Great  https://t.co/SwuDBb79F1,0
Tue Aug 07 15:10:29 +0000 2018,We can't all be winners.   #btc #bitcoin #eth  #ethereum  #ltc  #litecoin #hodl #cryptocurrency  #cryptotrading… https://t.co/MWqmHKqGk9,0
Tue Aug 07 13:55:20 +0000 2018,Can Ripple (XRP) now hit the $7 valuation before the year ends? - Global Coin Report https://t.co/6cVcwinvVn #xrp,0
Tue Aug 07 13:31:24 +0000 2018,Check out my classroom on @DonorsChoose! I'd love your help to bring my project to life. Please use promo code RIPP… https://t.co/KUNaUigemz,0
Tue Aug 07 11:56:16 +0000 2018,PATRIOTS: ONE HIDDEN RIPPLE FROM IDEA SUPPRESSION by the INFO GIANTS..is FINANCIAL LOSSES!. Consider Shareholder an… https://t.co/plcnhbmJ8v,292
Tue Aug 07 11:53:07 +0000 2018,Crypto Trends Update: Tron Passes Bitcoin as Ripple Rivals Ethereum | The Daily Hodl https://t.co/9aAqFzBf9Q #trx,0
Tue Aug 07 11:47:02 +0000 2018,PATRIOTS: ONE HIDDEN RIPPLE FROM IDEA SUPPRESSION by the INFO GIANTS..is FINANCIAL LOSSES!. Consider Shareholder an… https://t.co/plcnhbmJ8v,292
Tue Aug 07 11:03:24 +0000 2018,Ripple’s XRP with Excitement Accepted at Bitcoin Superstore: The CEO’s Vision  https://t.co/JtuBKMNbVj,0
Tue Aug 07 10:30:19 +0000 2018,@Ripple @BillClinton Late April fools joke?! Wtf can’t be serious.,0
Tue Aug 07 07:50:35 +0000 2018,Bitcoin Suffers  Ripple Drops 5% as Crypto Market Continues Downward Trend   https://t.co/pJsdLorJ3I  #CryptoNews… https://t.co/fqVNvnQzzd,0
Tue Aug 07 05:03:23 +0000 2018,Banned from 4 platforms in one day. Hmmmmm 🤔. #Censorship Don't like how they operate @infowars.  However  this wil… https://t.co/gtoNUx4wEG,0
Tue Aug 07 04:32:07 +0000 2018,@boxmining @cryptomanran @LeeR912 @AlexCobb_ @Hodor7777 @BankXRP @XRPTrump @boxmining #xrp very well falls in… https://t.co/6cGMSL0NIq,0
Tue Aug 07 04:31:34 +0000 2018,PATRIOTS: ONE HIDDEN RIPPLE FROM IDEA SUPPRESSION by the INFO GIANTS..is FINANCIAL LOSSES!. Consider Shareholder an… https://t.co/plcnhbmJ8v,292
Tue Aug 07 01:55:14 +0000 2018,Why Ripple XRP Can Reach $1 Sooner Than You Think - Global Coin Report https://t.co/f5Ob9ERYLY #btc,0
Tue Aug 07 01:49:05 +0000 2018,PATRIOTS: ONE HIDDEN RIPPLE FROM IDEA SUPPRESSION by the INFO GIANTS..is FINANCIAL LOSSES!. Consider Shareholder an… https://t.co/plcnhbmJ8v,292
Tue Aug 07 01:48:25 +0000 2018,PATRIOTS: ONE HIDDEN RIPPLE FROM IDEA SUPPRESSION by the INFO GIANTS..is FINANCIAL LOSSES!. Consider Shareholder an… https://t.co/plcnhbmJ8v,292
Tue Aug 07 01:16:11 +0000 2018,Bitcoin  Ethereum  Ripple  Bitcoin Cash  EOS  Litecoin  Cardano  Stellar  IOTA  TRON: Price Analysis  August 06… https://t.co/18sJeERlBH,2
Tue Aug 07 01:09:01 +0000 2018,PATRIOTS: ONE HIDDEN RIPPLE FROM IDEA SUPPRESSION by the INFO GIANTS..is FINANCIAL LOSSES!. Consider Shareholder an… https://t.co/plcnhbmJ8v,292
