Thu Jul 13 23:58:29 +0000 2017,Can't wait for Mike and the Mad Dog 30 for 30. Two good guys who were the gold standard for sports talk radio..,0
Thu Jul 13 23:57:49 +0000 2017,Gold and platinum frisbee's on my wall  lookin' properly Sixteen bar nickle sell more copies than Kinko I be tossing and flossing my style,0
Thu Jul 13 23:57:03 +0000 2017,Why hasn't this officer been fired and prosecuted yet? https://t.co/Khy9ZGyl1t,1992
Thu Jul 13 23:56:32 +0000 2017,Download! Stream! #NiTuNiYo (Link In Bio) https://t.co/JDJsAcdJgs,465
Thu Jul 13 23:56:00 +0000 2017,@JBE_Zorg_ @TheRickWilson @cbn2 They are spray painted gold  mounted and hanging in Drumpfs office...,0
Thu Jul 13 23:54:59 +0000 2017,Mari-gold @ MoMA The Museum of Modern Art https://t.co/0DjPD1gC5v,0
Thu Jul 13 23:54:08 +0000 2017,Rose Gold✨ https://t.co/jXTDZ0OO7y,427
Thu Jul 13 23:54:08 +0000 2017,@MrsCheveley97 @DrMaizun @carola_barz @Olgaklib @Gold_zr @nannyfrench1 @nextforme @brunacnaves @ElaineDJewell Happy… https://t.co/BNHU7L2GNj,2
Thu Jul 13 23:53:39 +0000 2017,@mitchellvii Low budget. My gold shower 🚿 is better.,0
Thu Jul 13 23:53:26 +0000 2017,Liked on YouTube: YOUTUBE SENT ME THIS! (GOLD LIKE BUTTON) https://t.co/W1r1nTX6C1,0
Thu Jul 13 23:52:42 +0000 2017,Rose Gold✨ https://t.co/jXTDZ0OO7y,427
Thu Jul 13 23:52:27 +0000 2017,I will not buy any more gold chains  I will not buy any more gold chains  I will not buy any more gold chains  I will not buy any more gold,0
Thu Jul 13 23:52:00 +0000 2017,@lustforpurpose I have a gold fish !,0
Thu Jul 13 23:51:01 +0000 2017,My main career goal is to do a ted talk in a sick ass gold chain I bought with graphic design money.,0
Thu Jul 13 23:50:23 +0000 2017,You know someone is talking absolute crap when super pro @KirstenPowers gets animated. @JasonMillerinDC squirming= TV gold #theDNCsfault,0
Thu Jul 13 23:48:46 +0000 2017,McDonald's Is Giving Away A Gold Cone That Gets You Free Ice Cream For Life https://t.co/8ZWMAOY3HV https://t.co/fejFdN33E5,10
Thu Jul 13 23:47:11 +0000 2017,New Motorola Moto G5 (GSM Unlocked) Only $192.99 on eBay: https://t.co/WiebR8GYk6 #moto #motog5 #hellomotoworld… https://t.co/dhTbj619MJ,0
Thu Jul 13 23:46:55 +0000 2017,2017 Panini Gold Standard Football 6 Box Break  https://t.co/gxOAWGks4R #collect #thehobby #boxbreak #whodoyoucollect,0
Thu Jul 13 23:46:29 +0000 2017,Florian Picasso and the legend Thomas Gold come by the studio to talk about what it's like… https://t.co/DFM3FKJVHz,0
Thu Jul 13 23:46:24 +0000 2017,Please RT #beauty #makeup ##skincare L?Oreal Paris Gold Infallible Silkissime Eyeliner Review  Swatch  EOTD https://t.co/q0zxDXAMhA,0
Thu Jul 13 23:43:08 +0000 2017,Who gets gold stars for looking after your privacy? – Naked Security https://t.co/zFanNFbSbl,0
Thu Jul 13 23:41:00 +0000 2017,Is it weird that my favorite song on After the Gold Rush is Cripple Creek Ferry?,0
Thu Jul 13 23:40:14 +0000 2017,@heyoimjill Gold,0
Thu Jul 13 23:39:49 +0000 2017,Rose Gold✨ https://t.co/jXTDZ0OO7y,427
Thu Jul 13 23:38:16 +0000 2017,jamaica: Jamaica face tough test against Mexico in Gold Cup tonight: Action from the CONCACAF Gold Cup game betwee… https://t.co/IrdSdUJUDP,0
Thu Jul 13 23:36:24 +0000 2017,https://t.co/GqWje6pRet updates market on Metalla Royalty &amp; Streaming $MTA.cn #gold #silver #Royalty #Streaming… https://t.co/YtkA1tTSle,1
Thu Jul 13 23:36:11 +0000 2017,Rose gold wedding band  mens or womens wedding band  recycled 14k … https://t.co/dSgIG3zwOH #metalicious #UnisexBand https://t.co/776fHMRO08,0
Thu Jul 13 23:35:31 +0000 2017,Jamaica face tough test against Mexico in Gold Cup tonight: Action from the CONCACAF Gold Cup game between Curacao… https://t.co/A1WVdUYCRc,2
Thu Jul 13 23:35:31 +0000 2017,Rose Gold✨ https://t.co/jXTDZ0OO7y,427
Thu Jul 13 23:35:28 +0000 2017,Liquid Gold: A List Of The Benefits Of Juicing - https://t.co/hE1zDsGPdZ,1
Thu Jul 13 23:35:05 +0000 2017,Jamaica face tough test against Mexico in Gold Cup tonight: Action from the CONCACAF Gold Cup game between Curacao… https://t.co/A1WVdUYCRc,2
Thu Jul 13 23:35:01 +0000 2017,Suddenly not so interested in talking. https://t.co/PVgd0fyuUf,155
Thu Jul 13 23:33:43 +0000 2017,TOP STRATEGIST: Bitcoin will soar to over $20 000 by cannibalizing gold https://t.co/lVl7JL15Z9,81
Thu Jul 13 23:32:39 +0000 2017,.@DoveCameron sparkled on the #ESPYS2017 stage to present an award to @AaronRodgers12! https://t.co/qUVmSgCnTh,110
Thu Jul 13 23:32:36 +0000 2017,I just listened to Kesha's next new release "Woman" and WOW!  It's VERY much "Dirty Love" meets "Gold Trans Am".,13
Thu Jul 13 23:32:23 +0000 2017,Best Diamond Wedding Ring 2017 / 201814K white gold  flexible  8.0 mm wide … https://t.co/Jw6Q40xC3B https://t.co/oYzEaG2cmh,0
Thu Jul 13 23:31:47 +0000 2017,.@DoveCameron sparkled on the #ESPYS2017 stage to present an award to @AaronRodgers12! https://t.co/qUVmSgCnTh,110
Thu Jul 13 23:31:38 +0000 2017,The black satin GentsPlaybook Custom bomber with gold zippers worn by @AJBOUYE21 on @nflnetwork 🏆 https://t.co/txAki1pdAn,2
Thu Jul 13 23:31:31 +0000 2017,Rose Gold✨ https://t.co/jXTDZ0OO7y,427
Thu Jul 13 23:31:15 +0000 2017,Review: Hamlet Starring Oscar Isaac at the Public Theater.  Directed by Sam Gold https://t.co/jLBEcxuYvH https://t.co/I6PIlCZnNh,1
Thu Jul 13 23:30:21 +0000 2017,But for some reasons gold rings make me look so old. Only silver for now,0
Thu Jul 13 23:30:13 +0000 2017,The black satin GentsPlaybook Custom bomber with gold zippers worn by @AJBOUYE21 on @nflnetwork 🏆 https://t.co/txAki1pdAn,2
Thu Jul 13 23:30:03 +0000 2017,How @PublicLab's aerial photography project evolved into a global community of citizen scientists: https://t.co/VVg2QHt3O5,9
Thu Jul 13 23:29:49 +0000 2017,Gold and silver both look great on me I love mixing metals,0
Thu Jul 13 23:29:14 +0000 2017,Frank Giustra builds another gold producer https://t.co/a6r9LtTnBA,0
Thu Jul 13 23:28:56 +0000 2017,Rose Gold✨ https://t.co/jXTDZ0OO7y,427
Thu Jul 13 23:28:40 +0000 2017,Added to the SFM gamestop exclusive Rare Rock Candy Gold Chun-Li variant and mini pop Akuma from… https://t.co/vdUZAiA2MF,0
Thu Jul 13 23:28:37 +0000 2017,Give Yha my lucky rubber band for the BitchNDickuler Gold sparkle Boots! #sparkle #night https://t.co/NmofJxPPOM,0
Thu Jul 13 23:28:28 +0000 2017,Oh man  I've been trying to get my hands on this for idk how long at this point. Finally hit the jackpot! Some… https://t.co/WyMQ9D4iNA,1
Thu Jul 13 23:27:33 +0000 2017,It is also a fucking travesty that @IntotheBadlands didn't get a stunt nomination #emmys #notcool,0
Thu Jul 13 23:27:28 +0000 2017,Rose Gold✨ https://t.co/jXTDZ0OO7y,427
Thu Jul 13 23:27:15 +0000 2017,@gold_purple_red @JGoldLabel @The_Boobs @Mav3ricksZ @KingCJulian23 @MannyNeva77 @undisputed @MichaelEDyson Tell me… https://t.co/A0xnPHnLeY,0
Thu Jul 13 23:27:00 +0000 2017,Rose Gold✨ https://t.co/jXTDZ0OO7y,427
Thu Jul 13 23:27:00 +0000 2017,How @PublicLab's aerial photography project evolved into a global community of citizen scientists: https://t.co/VVg2QHt3O5,9
Thu Jul 13 23:26:58 +0000 2017,I put the pretty remix of Fools Gold over Tangled and it is the best thing I have ever done https://t.co/9ZjpbSo3bj,5408
Thu Jul 13 23:26:50 +0000 2017,@gold_purple_red @JGoldLabel @The_Boobs @Mav3ricksZ @KingCJulian23 @MannyNeva77 @undisputed @MichaelEDyson Lmao it'… https://t.co/AL3EG0KFPI,0
Thu Jul 13 23:26:21 +0000 2017,Rose Gold✨ https://t.co/jXTDZ0OO7y,427
Thu Jul 13 23:26:06 +0000 2017,It is an actual crime that Michael McKean didn't get an emmy nomination this morning for @BetterCallSaul #emmys #justletmepickallthenominees,0
Thu Jul 13 23:25:05 +0000 2017,Maryam Omidi turned her fascination with Soviet medical spas into a gorgeous work of photojournalism:… https://t.co/8h2tVO2hnt,5
Thu Jul 13 23:24:15 +0000 2017,Gold  Rates and the FOMC https://t.co/bzACbHChjC,2
Thu Jul 13 23:21:48 +0000 2017,The humming on this is GOLD https://t.co/xYjcLSdJo8,0
Thu Jul 13 23:20:45 +0000 2017,Our Gold Half Disc Earrings in @marieclairemag July 2017. Visit our New York flagship and shop the collection... https://t.co/WdAETka3fp,0
Thu Jul 13 23:19:56 +0000 2017,Looking for some soccer on TV this weekend?  There's Gold Cup  Friendlies and more.  Details from @First_Touch https://t.co/wXQUizId3O,0
Thu Jul 13 23:19:43 +0000 2017,Our Gold Half Disc Earrings in @marieclaire July 2017. Visit our New York flagship and shop the… https://t.co/uKZJ9DZfEd,0
