Fri Jul 07 23:59:53 +0000 2017,Mal : SharpShooter Grand Badge   HOF Mid range   gold catch and shoot Cash; gold tireless scorer   bronze Rebounder https://t.co/K0wCSKvwvi,0
Fri Jul 07 23:59:48 +0000 2017,Location is important to your business; it’s important to your advertising strategy  too https://t.co/gKSIniluvU https://t.co/vF5QzJlMC0,3
Fri Jul 07 23:58:23 +0000 2017,Devastated almost Platinum and AABA almost Gold. I need all my Badasses to kill the repeat button on Dev and bump AABA all summer. ❤️,3289
Fri Jul 07 23:58:12 +0000 2017,Devastated almost Platinum and AABA almost Gold. I need all my Badasses to kill the repeat button on Dev and bump AABA all summer. ❤️,3289
Fri Jul 07 23:57:26 +0000 2017,2003 Nike Dunk High Pro SB SUPREME WHITE VARSITY RED GOLD STARS SZ 8 https://t.co/wOOcLIVFFh,0
Fri Jul 07 23:56:51 +0000 2017,I put the pretty remix of Fools Gold over Tangled and it is the best thing I have ever done https://t.co/9ZjpbSo3bj,5285
Fri Jul 07 23:56:46 +0000 2017,Devastated almost Platinum and AABA almost Gold. I need all my Badasses to kill the repeat button on Dev and bump AABA all summer. ❤️,3289
Fri Jul 07 23:53:38 +0000 2017,Devastated just went gold in Canada 🇨🇦 🏆🏆🏆 keep the wallet hahaha . Thank you guys,567
Fri Jul 07 23:53:35 +0000 2017,Gold Peak &gt; Pure Leaf,0
Fri Jul 07 23:53:21 +0000 2017,Devastated almost Platinum and AABA almost Gold. I need all my Badasses to kill the repeat button on Dev and bump AABA all summer. ❤️,3289
Fri Jul 07 23:52:20 +0000 2017,#FASHION #NEW #DEALOFTHEDAY 20/20 Brand Fashion 2017 New Sunglasses Women Cat Eye Double Bridge Women Luxury…… https://t.co/8fBc9k03cA,0
Fri Jul 07 23:52:08 +0000 2017,Bezel Set 1.0ct. t.w. Diamond Eternity Ring Band 14kt.  Diamonds. White or Yellow Gold Bridal Ring https://t.co/rEcOPYDLxl,1
Fri Jul 07 23:50:22 +0000 2017,The action was excellently done  the story was well put together  &amp; Mr. @edgarwright's direction was spot on! I hope he gets Oscar gold!,0
Fri Jul 07 23:50:01 +0000 2017,Devastated almost Platinum and AABA almost Gold. I need all my Badasses to kill the repeat button on Dev and bump AABA all summer. ❤️,3289
Fri Jul 07 23:49:38 +0000 2017,20% Off Bangle Bracelet Gold Finish Bracelet&gt;https://t.co/v1yodygw5K @AodiliBangles Promo code NB5IYB85 https://t.co/t9ogjOa9uc #giveaway,0
Fri Jul 07 23:49:15 +0000 2017,McCarty savoring his opportunity as US opens Gold Cup... https://t.co/Wl5Luogjfi,0
Fri Jul 07 23:49:09 +0000 2017,Photoshoots  Canada vs French Guiana Gold Cup  CONCACAF Soccer Games July 7 to 26 2017 With 12… https://t.co/JojvrtT6fB,0
Fri Jul 07 23:48:36 +0000 2017,Devastated almost Platinum and AABA almost Gold. I need all my Badasses to kill the repeat button on Dev and bump AABA all summer. ❤️,3289
Fri Jul 07 23:46:57 +0000 2017,You can't help but laugh with that @Beauty_Strike glow. The Moroccan Gold Blush Stick Face / Cleopatra Body Highlig… https://t.co/jUKPSdLpxt,4
Fri Jul 07 23:46:05 +0000 2017,#amazon #fashion 10k White Gold Created Emerald and Created White Sapphire Ring  Size 7 $248 https://t.co/6YdpSnuXD6 https://t.co/Wh64StCOhI,0
Fri Jul 07 23:45:04 +0000 2017,USA vs. Panama  Gold Cup 2017: What to watch for https://t.co/igBEzw1R3C,1
