Thu Aug 10 23:59:56 +0000 2017,People who support transgender and nonbinary folks shouldn't expect gold stars for being a decent human being. 🙄,19
Thu Aug 10 23:59:34 +0000 2017,Meanwhile in the Gold Bar  Kandy Muse is sitting alone looking stunning after her win this week..... 📸 by:… https://t.co/WWKhY9VMx5,14
Thu Aug 10 23:58:48 +0000 2017,U.S. stocks are no longer as good as gold https://t.co/KyDIvPAZPF https://t.co/zAHZmDYIoT,30
Thu Aug 10 23:57:57 +0000 2017,.@TheRealKapG just scored the first gold plaque of his career https://t.co/bxz9bDHGvb https://t.co/RWXd16jE4Z,107
Thu Aug 10 23:57:45 +0000 2017,Don't Miss: 20% Off w/ Code - D9J56AFV&gt; Fashion Gold Flower Ring &gt; https://t.co/FVlbJfyShr @JoGray_Ring https://t.co/Iq5DBUUqxm #giveaway,0
Thu Aug 10 23:57:19 +0000 2017,KyptoGold/CryptoGold has one mining facility in Iceland &amp; one located in the USA Once I get the ok I will be... https://t.co/05ZCxeTWQ6,0
Thu Aug 10 23:57:01 +0000 2017,The Fed Has 6 200 Tons of Gold in a Manhattan Basement -- Or Does it? https://t.co/4WEbH7JDmd https://t.co/5kIEPjlbO8,0
Thu Aug 10 23:56:56 +0000 2017,How sad in America that only conservatives get investigated  fired  boycotted and attacked. Double standard  &amp; liberal silence is repulsive!,8369
Thu Aug 10 23:56:39 +0000 2017,RAY DALIO: Risks are rising  and everybody should put 5% to 10% of their money in gold https://t.co/VO3uMa0a4g https://t.co/Ihdnn1WUwY,7
Thu Aug 10 23:56:36 +0000 2017,RAY DALIO: Risks are rising  and everybody should put 5% to 10% of their money in gold https://t.co/VO3uMa0a4g https://t.co/Ihdnn1WUwY,7
Thu Aug 10 23:55:59 +0000 2017,RAY DALIO: Risks are rising  and everybody should put 5% to 10% of their money in gold https://t.co/OyahH7A3GE https://t.co/SGoDdvxPVI,1
Thu Aug 10 23:55:29 +0000 2017,RAY DALIO: Risks are rising  and everybody should put 5% to 10% of their money in gold https://t.co/VO3uMa0a4g https://t.co/Ihdnn1WUwY,7
Thu Aug 10 23:55:28 +0000 2017,#LDTPoll: Are you shocked that a judge appointed by Obama actually possesses the integrity to insist Clinton aides be held accountable?,1023
Thu Aug 10 23:55:20 +0000 2017,RAY DALIO: Risks are rising  and everybody should put 5% to 10% of their money in gold https://t.co/mFIA2Jit6s https://t.co/zlSiMD5nGs,1
Thu Aug 10 23:55:19 +0000 2017,RAY DALIO: Risks are rising  and everybody should put 5% to 10% of their money in gold https://t.co/OyahH7A3GE https://t.co/SGoDdvxPVI,1
Thu Aug 10 23:55:18 +0000 2017,RAY DALIO: Risks are rising  and everybody should put 5% to 10% of their money in gold https://t.co/VO3uMa0a4g https://t.co/Ihdnn1WUwY,7
Thu Aug 10 23:55:09 +0000 2017,Don't Miss: 20% Off Gold Plated Pave Diamonds Bracelet Wrist Band &gt;https://t.co/m8O5yMgBVV @TobertJewelry https://t.co/srJfP1bDZH #giveaway,0
Thu Aug 10 23:54:04 +0000 2017,HOT NEW #9: Moto E (4th Generation) - 16 GB - Unlocked (AT&amp;T/Sprint/T-Mobile/Verizon) - Fine Gold https://t.co/pEyJKmhWIt,0
Thu Aug 10 23:53:44 +0000 2017,i'm releasing a KS next month for a series of pins! they will be hard enamel &amp; gold metal! im very excited &amp; nervou… https://t.co/STI0TbJuuV,194
Thu Aug 10 23:50:38 +0000 2017,the ‘watch the throne’ cover was way more floral before riccardo tisci dipped it in gold 🌺 https://t.co/zyHc1dlT6A,1052
Thu Aug 10 23:50:32 +0000 2017,By popular demand  save 25% off the Beaba USA Babycook Baby Food Maker  Limited Edition in Rose Gold!… https://t.co/LD6tkF4krc,0
Thu Aug 10 23:49:57 +0000 2017,Rose gold  rose gold  rose gold.,0
Thu Aug 10 23:49:35 +0000 2017,How sad in America that only conservatives get investigated  fired  boycotted and attacked. Double standard  &amp; liberal silence is repulsive!,8369
Thu Aug 10 23:49:29 +0000 2017,How banks' latest gold rush--lending to wealthy clients--is gaining them trophy assets from art to rare wines https://t.co/aTUk33g1vW,48
Thu Aug 10 23:48:47 +0000 2017,i'm releasing a KS next month for a series of pins! they will be hard enamel &amp; gold metal! im very excited &amp; nervou… https://t.co/STI0TbJuuV,194
Thu Aug 10 23:48:26 +0000 2017,Now  Available!!!   Shimmer Eyeshadow Pen  Color: Gold  Price: $600.00  Here's how to… https://t.co/Kfa7mieZHU,1
Thu Aug 10 23:47:36 +0000 2017,Trinidad &amp; Tobago's Jereem RICHARDS takes BRONZE in Men's 200m FINAL behind Ramil GULIYEV/Turkey  GOLD &amp; Wayde VAN… https://t.co/y9L3EqNQY9,15
Thu Aug 10 23:45:08 +0000 2017,A good friend of mines has added a new product to her site give her some traffic please...Thanks in advance :)... https://t.co/xGGgc0Wm6d,1
Thu Aug 10 23:43:52 +0000 2017,i'm releasing a KS next month for a series of pins! they will be hard enamel &amp; gold metal! im very excited &amp; nervou… https://t.co/STI0TbJuuV,194
Thu Aug 10 23:43:47 +0000 2017,Dalio recommends gold as hedge against rising political risk https://t.co/dipbkBHes0 https://t.co/7W3Q6jKVNq,26
Thu Aug 10 23:43:28 +0000 2017,Nike Air Jordan 5 V Low Dunk From Above metallic gold white navy blue Size 11 https://t.co/XRf52Szoz6,0
Thu Aug 10 23:43:27 +0000 2017,Air Jordan 1 Retro High WINGS black metallic gold Size 14 https://t.co/9nBTyg1P83,0
Thu Aug 10 23:42:49 +0000 2017,14k Rose Gold Blue Diamond Engagement Ring  Fancy Wedding Ring 1.55 Carat Unique Halo Pave Certified Handmade https://t.co/OpXIBE7Z5z,0
Thu Aug 10 23:42:39 +0000 2017,14k Rose Gold Blue Diamond Engagement Ring  Fancy Wedding Ring 1.55 Carat Unique Halo Pave Certified Handmade https://t.co/I0sGNSu4Jo,0
Thu Aug 10 23:42:24 +0000 2017,@AaronMehta He "renovated" - which I assume means gold encrusted  AND he's gonna "do the nuclear" FIRST. I understa… https://t.co/ZGzWmDx9yb,0
Thu Aug 10 23:42:05 +0000 2017,@Hurstcules That RedletterMedia thing was gold btw,0
Thu Aug 10 23:41:29 +0000 2017,Today: Brooklyn  NY - Aug 10 at Gold Sounds https://t.co/xC8DwTwR8T,1
Thu Aug 10 23:39:28 +0000 2017,A very happy birthday to to the beautiful and wonderful  @CharlizeAfrica! A heart of gold  there are no words that describe your awesome!,0
Thu Aug 10 23:39:16 +0000 2017,Please note the fitting for Varsity Jackets has been moved to 8/23 7:30 to 8:30 pm at PP concession stand. https://t.co/qxi69fzsFz,0
Thu Aug 10 23:38:13 +0000 2017,Rose Gold Curve Wedding Band  Matching Diamond Wedding Ring  Anniversary Band  Pave Handmade 0.29 Carat https://t.co/DdTHWJdQB1,0
Thu Aug 10 23:38:03 +0000 2017,Rose Gold Curve Wedding Band  Matching Diamond Wedding Ring  Anniversary Band  Pave Handmade 0.29 Carat https://t.co/vDdYTkJXKV,0
Thu Aug 10 23:37:36 +0000 2017,Yellow Gold Diamond Stud Earrings  Solitaire Earrings  Bezel Set Earrings  0.50 Carat Certified Unique Handmade https://t.co/PEC5rqKGRV,0
Thu Aug 10 23:37:31 +0000 2017,Meanwhile in the Gold Bar  Kandy Muse is sitting alone looking stunning after her win this week..... 📸 by:… https://t.co/WWKhY9VMx5,14
Thu Aug 10 23:37:23 +0000 2017,Yellow Gold Diamond Stud Earrings  Solitaire Earrings  Bezel Set Earrings  0.50 Carat Certified Unique Handmade https://t.co/KvIohpBtVA,0
Thu Aug 10 23:37:06 +0000 2017,Vintage Style Diamond Stud Earrings  0.50 Carat Diamond Earrings  14K Black Gold Bezel Set Certified Unique Handmade https://t.co/jreDaTfQiO,0
Thu Aug 10 23:36:54 +0000 2017,Vintage Style Diamond Stud Earrings  0.50 Carat Diamond Earrings  14K Black Gold Bezel Set Certified Unique Handmade https://t.co/t2s87fExql,0
Thu Aug 10 23:36:23 +0000 2017,Vintage Style Diamond Stud Earrings  Bezel Set Earrings  14K Black Gold 0.70 Carat Certified Unique Handmade https://t.co/fCw7yFkozP,0
Thu Aug 10 23:36:20 +0000 2017,Someone throw a gold plated muzzle on the motherfucker,0
Thu Aug 10 23:36:12 +0000 2017,Vintage Style Diamond Stud Earrings  Bezel Set Earrings  14K Black Gold 0.70 Carat  https://t.co/Uexc8Dxmwi,0
Thu Aug 10 23:36:01 +0000 2017,Vintage Style Diamond Stud Earrings  Bezel Set Earrings  14K Black Gold 0.70 Carat Certified Unique Handmade https://t.co/Uexc8Dxmwi,0
Thu Aug 10 23:35:20 +0000 2017,Yellow Gold Diamond Stud Earrings  Bezel Set Earrings  0.70 Carat Certified Unique Handmade https://t.co/ttzu9AteUj,0
Thu Aug 10 23:35:17 +0000 2017,I wish all of you peace and so much love.,4124
Thu Aug 10 23:35:06 +0000 2017,Yellow Gold Diamond Stud Earrings  Bezel Set Earrings  0.70 Carat Certified Unique Handmade https://t.co/GF3hXmcKCN,0
Thu Aug 10 23:34:18 +0000 2017,@KekipiChaotic Sally Hansen insta dry gold and a turquoise nail art pen! Target has my shiiiiiiit,0
Thu Aug 10 23:34:05 +0000 2017,New for 2017! FUNBOY's new Metallic Seahorse pool float features rose gold a... - https://t.co/bp96aeY9qM,0
Thu Aug 10 23:33:19 +0000 2017,AUTHENTIC Nike PG 1 Paul George "The Bait" Obsidian Gold #  878627  417 Mens  https://t.co/MFy14TXf4p,0
Thu Aug 10 23:32:25 +0000 2017,This stuff is liquid gold. I love it. https://t.co/wbcKcKAox1,0
Thu Aug 10 23:30:58 +0000 2017,idk how much im gonna like the baller special but its gold so im using it,0
Thu Aug 10 23:30:25 +0000 2017,Meanwhile in the Gold Bar  Kandy Muse is sitting alone looking stunning after her win this week..... 📸 by:… https://t.co/WWKhY9VMx5,14
Thu Aug 10 23:29:01 +0000 2017,Fire and Brimstone . . . . . #art #beauty #gold #photo #photography #amateurphotography… https://t.co/JZj4zOxrAf,0
Thu Aug 10 23:28:10 +0000 2017,1980 INTER-GOLD LTEE JOHNSON MATTHEY &amp; MALLORY Edward VII 1 OZ ROUND COIN https://t.co/RK8nVwsTYz https://t.co/IaMYzg8z9K,0
Thu Aug 10 23:27:47 +0000 2017,For some  it's hard to believe a Federal Reserve vault really contains about 6 200 tons of gold https://t.co/bKPXfHzFl2,111
Thu Aug 10 23:27:39 +0000 2017,Kori Carter is the 3rd American woman to win gold in the 400m hurdles at Worlds.   Lashinda Demus in '11 &amp; Kim Batt… https://t.co/Ga1BWaAmRP,19
Thu Aug 10 23:27:09 +0000 2017,New: '309 GOLD ST. 11H BROOKLYNNY Shannon Francis $2494': https://t.co/M7tO6zFiAq,0
Thu Aug 10 23:27:08 +0000 2017,New: '309 GOLD ST. 18G BROOKLYNNY Shannon Francis $2994': https://t.co/dcghoLML2b,0
Thu Aug 10 23:24:54 +0000 2017,Trinidad &amp; Tobago's Jereem RICHARDS takes BRONZE in Men's 200m FINAL behind Ramil GULIYEV/Turkey  GOLD &amp; Wayde VAN… https://t.co/y9L3EqNQY9,15
Thu Aug 10 23:22:34 +0000 2017,People who support transgender and nonbinary folks shouldn't expect gold stars for being a decent human being. 🙄,19
Thu Aug 10 23:22:21 +0000 2017,@NBCSportsGold do I have access to NBC sports gold with @verizonfios ?,0
Thu Aug 10 23:22:16 +0000 2017,Sabrina Claudio has this temptress  trap you  seductive ass energy...the girl is gold.,1
Thu Aug 10 23:22:07 +0000 2017,For some  it's hard to believe a Federal Reserve vault really contains about 6 200 tons of gold https://t.co/bKPXfHzFl2,111
Thu Aug 10 23:21:58 +0000 2017,Devastated almost Platinum and AABA almost Gold. I need all my Badasses to kill the repeat button on Dev and bump AABA all summer. ❤️,3871
Thu Aug 10 23:21:46 +0000 2017,I water you  you water me.  We grow together.,14586
Thu Aug 10 23:20:58 +0000 2017,Now having Public SEX with Janet Jackson and hoping NOT to face a damn Indecency Charge..Here's an Example --&gt;  O O… https://t.co/1JxGu0ZJSO,0
Thu Aug 10 23:20:48 +0000 2017,The LINES are GOLD. https://t.co/W9SrsuKxvY,0
Thu Aug 10 23:20:34 +0000 2017,Gold hoops of all shapes and sizes are adorning cool-girl lobes everywhere. https://t.co/knjehcA4dT,22
Thu Aug 10 23:19:53 +0000 2017,All eyes are now on $1 300 gold https://t.co/5S5GVn9NFO,2
Thu Aug 10 23:17:15 +0000 2017,💗💗💗new arrival: 60s Girls Candy Pink Shift Dress with Gold Ball Buttons  7/8. Shop link in bio… https://t.co/2CkDs8CMSN,0
Thu Aug 10 23:17:02 +0000 2017,! GOLD ! Marc 'Dr. Doom' Faber says ‘we have a bubble in everything’ https://t.co/F8NIlMjoFK,0
Thu Aug 10 23:16:47 +0000 2017,People who support transgender and nonbinary folks shouldn't expect gold stars for being a decent human being. 🙄,19
Thu Aug 10 23:16:27 +0000 2017,Kori Carter is the 3rd American woman to win gold in the 400m hurdles at Worlds.   Lashinda Demus in '11 &amp; Kim Batt… https://t.co/Ga1BWaAmRP,19
Thu Aug 10 23:16:11 +0000 2017,I wonder where Jeff Sessions hides his pot of gold? There's no way he just leaves it at the end of some rainbow.,0
Thu Aug 10 23:14:55 +0000 2017,@AudenLhamo @Chuntzinski @pattymo This is gold. Thank you for posting.,0
Thu Aug 10 23:14:19 +0000 2017,The Fed Has 6200 Tons of Gold in a Manhattan Basement -- Or Does it? - Fox Business https://t.co/mfQlg8uJYv https://t.co/0emCeVDqDl,0
Thu Aug 10 23:14:18 +0000 2017,Sydney #Gold #Price Open: $1286.3 USD per oz 2017-08-11 09:00:52 EST,0
Thu Aug 10 23:13:59 +0000 2017,Twitter gold hahaha https://t.co/IYjk6We3R8,0
Thu Aug 10 23:11:52 +0000 2017,i'm releasing a KS next month for a series of pins! they will be hard enamel &amp; gold metal! im very excited &amp; nervou… https://t.co/STI0TbJuuV,194
Thu Aug 10 23:11:52 +0000 2017,@ArlnanGrande @LOHANTHONY LMFAOOOO THIS IS GOLD,0
Thu Aug 10 23:11:37 +0000 2017,@ipsy never fails to disappoint me with my glam bag - I got a mascara  brush  and eyeshadow all in this month's bag! 👛 Also  love the gold!😉,0
Thu Aug 10 23:11:10 +0000 2017,SB Intraday Update  • $AUDJPY • $DXY • $GBPJPY • #Gold • $USDCAD •  https://t.co/rPwCnFkDpz,0
Thu Aug 10 23:10:32 +0000 2017,Gold hoops of all shapes and sizes are adorning cool-girl lobes everywhere. https://t.co/knjehcA4dT,22
Thu Aug 10 23:10:24 +0000 2017,i'm releasing a KS next month for a series of pins! they will be hard enamel &amp; gold metal! im very excited &amp; nervou… https://t.co/STI0TbJuuV,194
Thu Aug 10 23:10:19 +0000 2017,#RiskFriday 👀 WATCH ES_F 2400 summer support / DX 93 / USDJPY 108.12 year low / GOLD 1295 year high / nice volatility 👏💣🎁 week candles..,0
Thu Aug 10 23:09:57 +0000 2017,Custom made rose gold canine fangs with pink sapphires. 🔥 https://t.co/JLLMhcPq5r 🌊 Please send all… https://t.co/eHYKIUeZed,0
Thu Aug 10 23:09:46 +0000 2017,Dalio recommends gold as hedge against rising political risk https://t.co/dipbkBHes0 https://t.co/7W3Q6jKVNq,26
Thu Aug 10 23:09:29 +0000 2017,U.S. stocks are no longer as good as gold https://t.co/KyDIvPAZPF https://t.co/zAHZmDYIoT,30
Thu Aug 10 23:08:26 +0000 2017,@Chzs_ lets play sometime when i buy gold :),0
Thu Aug 10 23:08:15 +0000 2017,Hot off winning gold  team 🇺🇸 Junior National Team turning up tonight. https://t.co/IOJ4da6ESk,1
Thu Aug 10 23:07:51 +0000 2017,This was the moment that pushed the 53% Nation over the edge https://t.co/Zs84oMwa5H,1289
Thu Aug 10 23:07:31 +0000 2017,i'm releasing a KS next month for a series of pins! they will be hard enamel &amp; gold metal! im very excited &amp; nervou… https://t.co/STI0TbJuuV,194
Thu Aug 10 23:06:51 +0000 2017,GUNDLACH: Gold's chart has 'one of the most bullish' patterns around https://t.co/HKPwlxB5Ps https://t.co/3AL34U6IMw,4
Thu Aug 10 23:04:19 +0000 2017,Thе Latest: Guliуev wins gold in 200 meters at wоrlds https://t.co/RsiwwU1Wlc,0
Thu Aug 10 23:04:16 +0000 2017,RAY DALIO: Risks are rising  and everybody needs to put 5% to 10% of their money in gold https://t.co/mFIA2Jit6s https://t.co/g3jsQu8rW7,6
Thu Aug 10 23:04:01 +0000 2017,NIKE AIR MAX 97 ULTRA 17 "ROSE GOLD" Available Now.  #allcitysneakers  . . . #nike #nikeshoes… https://t.co/wQ374ju92y,0
Thu Aug 10 23:03:40 +0000 2017,Nike Air Zoom Huarache 2K4 KB 309957-111 US Size 9.5 White Metallic Silver Gold https://t.co/kYiPe0YMQe,0
Thu Aug 10 23:03:33 +0000 2017,U.S. stocks are no longer as good as gold https://t.co/KyDIvPAZPF https://t.co/zAHZmDYIoT,30
Thu Aug 10 23:02:13 +0000 2017,Italian Sterling Silver and Rose Gold Panther Bracelet with Cubic Zircons https://t.co/6GULMLmVgw https://t.co/fewehkfOJg,0
Thu Aug 10 23:02:09 +0000 2017,#Bitcoin climbs to record  nearly three times the price of gold https://t.co/DJR8vSjMDV https://t.co/jtN047NI5v,0
Thu Aug 10 23:01:50 +0000 2017,Micro-Influencers: Marketing's Next Big Thing is Pure Gold for New Startups 👍🏼 via @foundr https://t.co/F32p0qSsGL https://t.co/OWRqYtziPB,0
Thu Aug 10 23:01:30 +0000 2017,First batch of eclipse postcards are out. Gold #risograph on black. https://t.co/FHJV5qiCxU https://t.co/aducSmdDPf,0
Thu Aug 10 23:00:59 +0000 2017,i'm releasing a KS next month for a series of pins! they will be hard enamel &amp; gold metal! im very excited &amp; nervou… https://t.co/STI0TbJuuV,194
Thu Aug 10 23:00:58 +0000 2017,I entered a giveaway for a chance to win "HEARTFEEL 23 pcs Mint Peach Glitter Gold Tissu..." by HEARTFEEL. https://t.co/RqA7J00o2U #giveaway,1
Thu Aug 10 23:00:19 +0000 2017,I entered a giveaway for a chance to win "HEARTFEEL 23 pcs Mint Peach Glitter Gold Tissu..." by HEARTFEEL. https://t.co/RqA7J00o2U #giveaway,1
Thu Aug 10 22:59:50 +0000 2017,Follow us on Twitter to see new products &amp; sales. Check out our products: https://t.co/3JtgvCIYdO #musthave #loveit… https://t.co/e22NGUykwk,0
Thu Aug 10 22:57:34 +0000 2017,Kori Carter is the 3rd American woman to win gold in the 400m hurdles at Worlds.   Lashinda Demus in '11 &amp; Kim Batt… https://t.co/Ga1BWaAmRP,19
Thu Aug 10 22:55:53 +0000 2017,GUNDLACH: Gold's chart has 'one of the most bullish' patterns around https://t.co/Gbpd2CLV5W https://t.co/Z4ZQHc55eM,5
Thu Aug 10 22:55:40 +0000 2017,lol  facts. https://t.co/zfzZU4TuT0,6016
Thu Aug 10 22:55:14 +0000 2017,Dollger Fashion Brand Designer Big Square Flat Top Sunglasses Women Men Mirror Glasses rose gold Frame Retro…… https://t.co/W1THzgblu0,0
Thu Aug 10 22:55:14 +0000 2017,Dollger Fashion Brand Designer Big Square Flat Top Sunglasses Women Men Mirror Glasses rose gold Frame Retro…… https://t.co/j6DOk4fxW4,0
Thu Aug 10 22:55:08 +0000 2017,GLOBAL MARKETS-North Korea talk drags stocks lower; gold  yen rise https://t.co/dymgJ3finS #forex,0
Thu Aug 10 22:54:13 +0000 2017,Hey  finally hit Gold in #Overwatch !!! I know it's not super great  but hey  i'm excited! Now to get to Plat.....,0
Thu Aug 10 22:53:44 +0000 2017,Miley's white and gold #TEAMMILEY outfit in the new promo for season 13 of 'The Voice' was designed by Christian Co… https://t.co/jw4pPM3UNw,18
Thu Aug 10 22:53:20 +0000 2017,NIKE AIR FORCE 1 07 MINI SWOOSH ROYAL BLUE GOLD FC BARCELONA 823511 404 SZ 9.5 https://t.co/tMXY7t5bl5,0
Thu Aug 10 22:53:19 +0000 2017,NIKE AIR FORCE 1 07 MINI SWOOSH ROYAL BLUE GOLD FC BARCELONA 823511 404 SZ 9 https://t.co/zueyzeFesN,0
Thu Aug 10 22:53:17 +0000 2017,NIKE AIR FORCE 1 07 MINI SWOOSH ROYAL BLUE GOLD FC BARCELONA 823511 404 SZ 8.5 https://t.co/rOsxycURI6,0
Thu Aug 10 22:52:15 +0000 2017,#JonathanDemme: Heart of Gold. Aug 4—24. https://t.co/CZuBCFVMQQ https://t.co/tspVdCxx9j,21
Thu Aug 10 22:52:06 +0000 2017,Dollger Fashion Brand Designer Big Square Flat Top Sunglasses Women Men Mirror Glasses rose gold Frame Retro…… https://t.co/vjDpdWYqO8,0
Thu Aug 10 22:52:00 +0000 2017,@BillGates household piped connections are the gold standard  not gimmicks for smelly pits. https://t.co/HdCkr16u2m,0
Thu Aug 10 22:51:35 +0000 2017,Kori Carter is the 3rd American woman to win gold in the 400m hurdles at Worlds.   Lashinda Demus in '11 &amp; Kim Batt… https://t.co/Ga1BWaAmRP,19
Thu Aug 10 22:51:24 +0000 2017,@ImSimplyWriting Every show I've watched on @bouncetv @BrownSugarApp have been just Pure Gold. Entertainment at its finest.,0
Thu Aug 10 22:51:12 +0000 2017,This thread though 😂. Pure gold 👌🏾 https://t.co/DVmGnvklMq,0
Thu Aug 10 22:51:10 +0000 2017,Yerra Solutions Wins Gold And Silver Stevie® Awards In 2017 International Business Awards https://t.co/unzcFQM6Hg,0
Thu Aug 10 22:51:09 +0000 2017,@LandauDave Your Trans-Atlantic accent is fucking gold  Chaaarrrlie. Easily the best guest on Cumia.,1
Thu Aug 10 22:50:49 +0000 2017,Market Extra: Dalio urges investors to buy gold to hedge against possible war wit... https://t.co/YA0QyyVzvD… https://t.co/44pmpR0Ecp,0
Thu Aug 10 22:50:17 +0000 2017,US Treasury Building's Green Investment Pays Off in LEED-Gold Rating | GreenBiz https://t.co/AFwVThBy57,0
Thu Aug 10 22:49:21 +0000 2017,Gold Dental Floss Tooth Badge Holder with Retractable Reel  #badgereel #dental https://t.co/fkpRk9SAmS via @Etsy,16
Thu Aug 10 22:48:24 +0000 2017,Very.  #tbt @ BLACK GOLD https://t.co/S0aXmPzSNS,0
Thu Aug 10 22:47:46 +0000 2017,Miley's white and gold #TEAMMILEY outfit in the new promo for season 13 of 'The Voice' was designed by Christian Co… https://t.co/jw4pPM3UNw,18
Thu Aug 10 22:46:36 +0000 2017,To be fair  I don't know any that accept gold https://t.co/yUbvAE08EQ,0
Thu Aug 10 22:45:30 +0000 2017,@LandauDave Your Trans-Atlantic accent is fucking gold  Chaaarrrlie. Easily the best guest on Cumia.,1
Thu Aug 10 22:45:11 +0000 2017,Gold necklace with crystal and faceted emerald color stone.  Signed by Roman. https://t.co/4ZaRCJ4ekQ https://t.co/VSkqdF6FpD,2
Thu Aug 10 22:45:09 +0000 2017,Paralympic gold medalist honored in Northport  Long Island https://t.co/BcZsEqDOo9 #abc7ny,0
Thu Aug 10 22:44:40 +0000 2017,Steeltime Gold Chains for both Men and Women . Shop https://t.co/o3fpRCpcnD today! . #Steeltime #Jewelry #Products…… https://t.co/mNW74XiMFD,0
Thu Aug 10 22:43:47 +0000 2017,Gold Prices May Shrug Off US CPI Data as Risk Appetite Collapses https://t.co/Xa9M6Ctwzw #currency,0
Thu Aug 10 22:43:32 +0000 2017,✔ GOLD Comment for 11.8.2017 https://t.co/r9EJTEa0PS  #forex | #gold | #goldcomments,0
Thu Aug 10 22:41:48 +0000 2017,Press-conference gold  courtesy of Jürgen Klopp. 😂 https://t.co/rydqsnpBhY,0
Thu Aug 10 22:41:43 +0000 2017,For some  it's hard to believe a Federal Reserve vault really contains about 6 200 tons of gold https://t.co/bKPXfHzFl2,111
Thu Aug 10 22:41:15 +0000 2017,October is really the best month in the world. I support this message. https://t.co/cq1C1uuwqI,10
Thu Aug 10 22:40:38 +0000 2017,@chigrl Seems like Gold is now the one hunting  and Peter Pan is on the menu....,0
Thu Aug 10 22:40:06 +0000 2017,I liked a @YouTube video https://t.co/D4NfhPyaMe Minecraft: STARDEW VALLEY | WE FOUND GOLD?! #11,1
Thu Aug 10 22:40:03 +0000 2017,Dalio recommends gold as hedge against rising political risk https://t.co/dipbkBHes0 https://t.co/7W3Q6jKVNq,26
Thu Aug 10 22:40:02 +0000 2017,Dalio recommends gold as hedge against rising political risk https://t.co/dipbkBHes0 https://t.co/7W3Q6jKVNq,26
Thu Aug 10 22:40:01 +0000 2017,News: Gold Prices May Shrug Off US CPI Data as Risk Appetite Collapses https://t.co/sdG6HDqRJh #Finance #Markets #News #FX #Forex,0
Thu Aug 10 22:38:53 +0000 2017,Meanwhile in the Gold Bar  Kandy Muse is sitting alone looking stunning after her win this week..... 📸 by:… https://t.co/WWKhY9VMx5,14
Thu Aug 10 22:38:26 +0000 2017,@royaIparrilla can't wait to lose my shit sunday morning @ the gold panel,0
Thu Aug 10 22:38:06 +0000 2017,Dalio recommends gold as hedge against rising political risk https://t.co/dipbkBHes0 https://t.co/7W3Q6jKVNq,26
Thu Aug 10 22:37:34 +0000 2017,play it til the end cus Jhené's part man 🙌🏾💘 https://t.co/xXgg5ZCBgO,1
Thu Aug 10 22:37:32 +0000 2017,.@TheRealKapG just scored the first gold plaque of his career https://t.co/bxz9bDHGvb https://t.co/RWXd16jE4Z,107
Thu Aug 10 22:37:22 +0000 2017,BITCH SIMMER DOWN. THIS AINT THE END. U GOT THROUGH EVERYTHING U DIDN'T THINK U WERE STRONG ENOUGH FOR. U GON GET THROUGH THIS.,1607
Thu Aug 10 22:37:03 +0000 2017,we need to off you to the islands and get you gold  no spray tans✨. https://t.co/LxEqzTMGYO,1
Thu Aug 10 22:36:29 +0000 2017,@aubreysitterson There's nothing ironic about buying a 12 pack of socks &amp; some gold bond in preparation for a summer tour  bro.,0
Thu Aug 10 22:36:28 +0000 2017,Amen 🙏🏽 https://t.co/ORcoLKU7li,0
Thu Aug 10 22:36:25 +0000 2017,@BrunoAmato_1 @MonopointAmy After years of sitting on a gold plated toilet seat  perhaps Donald has absorbed brain… https://t.co/9vyGhH2SGq,1
Thu Aug 10 22:35:06 +0000 2017,Chanel S/S 1995. https://t.co/YxumIXoLyA,3017
Thu Aug 10 22:34:52 +0000 2017,i'm releasing a KS next month for a series of pins! they will be hard enamel &amp; gold metal! im very excited &amp; nervou… https://t.co/STI0TbJuuV,194
Thu Aug 10 22:34:05 +0000 2017,I have a heart of gold but my temper bad 🤦🏾‍♀️,1
Thu Aug 10 22:33:24 +0000 2017,#confuseamovieorsitcom As Gold As It Gets https://t.co/BFzC0Q1vVf,1
Thu Aug 10 22:32:58 +0000 2017,Gold Dental Floss Tooth Badge Holder with Retractable Reel  #badgereel #dental https://t.co/fkpRk9SAmS via @Etsy,16
Thu Aug 10 22:32:13 +0000 2017,Nike Free Flyknit Chukka Pr Qs World Cup Edition Gold Purple Neon Multicolor https://t.co/yVNEhXcBBU https://t.co/a60qSWsB5j,0
Thu Aug 10 22:31:51 +0000 2017,@BrunoAmato_1 @MonopointAmy After years of sitting on a gold plated toilet seat  perhaps Donald has absorbed brain… https://t.co/9vyGhH2SGq,1
Thu Aug 10 22:31:07 +0000 2017,SONG PICK: Gold Class - Get Yours (Video) - https://t.co/Yvdv7aVzEn #goldclass #glamglarepick #goldclassmusic https://t.co/hYKhl3eFoz,0
Thu Aug 10 22:31:02 +0000 2017,Dude I ended this season trash I'm going to get placed in gold and have Jerry rea and smoke ba on my team smh,1
Thu Aug 10 22:30:01 +0000 2017,Get this man some gold! I voted for #SerBronn4MVP! Who's the #GoTMVP this week? Follow @AmazonChannels to see! https://t.co/ZfqO1EWudB,0
Thu Aug 10 22:29:45 +0000 2017,.@TheRealKapG just scored the first gold plaque of his career https://t.co/bxz9bDHGvb https://t.co/RWXd16jE4Z,107
Thu Aug 10 22:29:09 +0000 2017,On the move again  from Atlantic on the Metro Gold Line thru East LA #publictransportation https://t.co/LxpE3daprU,4
Thu Aug 10 22:28:49 +0000 2017,U.S. stocks are no longer as good as gold https://t.co/KyDIvPAZPF https://t.co/zAHZmDYIoT,30
Thu Aug 10 22:27:15 +0000 2017,Swarovski Blue and Gold Freckle Medium Necklace #5226096  RV 299.00 https://t.co/C3qCCWTBg6 https://t.co/yRtkUkH4DX,0
Thu Aug 10 22:26:40 +0000 2017,this gif is pure gold. https://t.co/m0Veyj8PBn,706
Thu Aug 10 22:26:20 +0000 2017,Got that Gold Paid Bid 😋🏆💙🐾 #IGYYGM https://t.co/lCtTslXxkc,0
