Thu Feb 15 23:50:45 +0000 2018,@_cingraham https://t.co/sPVYaRZGns,0
Thu Feb 15 23:36:39 +0000 2018,Is there a Squarespace template for mining bitcoin on someone’s computer?,4
Thu Feb 15 23:34:40 +0000 2018,Dwarf space mining game #DeepRockGalactic https://t.co/u8p0jBGRMU,0
Thu Feb 15 23:15:09 +0000 2018,How a couple of engineers got caught crypto-mining on office supercomputer https://t.co/iHpB84RFjy,0
Thu Feb 15 22:11:13 +0000 2018,An act before the Committee on Economic Development in the Big Apple would examine the potential for economic zones… https://t.co/gQ3RAMnV7H,2
Thu Feb 15 22:00:07 +0000 2018,Are you interested in Crypto Currency? https://t.co/lzknkZgs4y,0
Thu Feb 15 21:40:15 +0000 2018,An act before the Committee on Economic Development in the Big Apple would examine the potential for economic zones… https://t.co/gQ3RAMnV7H,2
Thu Feb 15 21:24:18 +0000 2018,What's so fucking funny is that #OnePlus  a CHINESE phone maker  actually got caught mining customers data. https://t.co/fF0JKX2zbx,0
Thu Feb 15 21:22:25 +0000 2018,@SynnaSlater @brooklinegirl Later I tell to you ... how to find hundreds like to him!  Reminder the film 5 yrs ago.… https://t.co/lixF2jLIxl,1
Thu Feb 15 21:22:15 +0000 2018,@SynnaSlater @brooklinegirl Later I tell to you ... how to find hundreds like to him!  Reminder the film 5 yrs ago.… https://t.co/lixF2jLIxl,1
Thu Feb 15 21:07:04 +0000 2018,New York Act Would Create Taskforce On Economic Zoning For Cryptocurrency Mining https://t.co/iC38y2x3ec https://t.co/5Zm2qtchZB,0
Thu Feb 15 21:04:34 +0000 2018,Russian Nuclear Scientists Got Busted Mining Bitcoin Using Their Work Supercomputers https://t.co/oVWfFCJzXV via @Futurism,0
Thu Feb 15 20:59:11 +0000 2018,Outdoor Industry &gt; Oil &amp; Mining. Meaning the future of our public lands is going to the lowest  dirtiest bidder.… https://t.co/sg4f8LuHt0,0
Thu Feb 15 20:15:13 +0000 2018,#Bitcoin energy use in Iceland set to overtake homes  says local firm via @BBC  "If Iceland took on all of the prop… https://t.co/gR5cZhFrS7,0
Thu Feb 15 20:12:59 +0000 2018,Can we take a moment to appreciate how Extremely Not Okay this is?  https://t.co/HLfnuqgisT,0
Thu Feb 15 20:12:08 +0000 2018,Trying to do a video looking at common XMR mining malware  but I can't get any of the malware samples to actually drop their miner D:,1
Thu Feb 15 20:11:42 +0000 2018,Trying to do a video looking at common XMR mining malware  but I can't get any of the malware samples to actually drop their miner D:,1
Thu Feb 15 20:09:57 +0000 2018,Icelandic Lawmaker Floats Bitcoin Mining Tax https://t.co/w5nt6vceC6 https://t.co/vHckdycGoj,2
Thu Feb 15 20:03:49 +0000 2018,Tech idea: Create a gym that monitors every weight  rep  and mile a member performs. The gym has its own cryptocurr… https://t.co/MchMpZVFo7,0
Thu Feb 15 19:44:49 +0000 2018,@yeahunoeme @JosueTeleman11 @PoliticalSense1 @BobRangel64 @chibearfan74_jr @suzzysmiles2 @absolutelyenuff… https://t.co/18T0am6Psr,1
Thu Feb 15 19:34:02 +0000 2018,45 Great Resources for Learning #Data Mining Concepts and Techniques  https://t.co/EVcmWIbkVX via @importio https://t.co/RSB4MiXiIn,0
Thu Feb 15 19:25:05 +0000 2018,45 Great Resources for Learning #Data Mining Concepts and Techniques  https://t.co/1z13NIqavq via @importio https://t.co/ICPC9M8o1q,0
Thu Feb 15 19:00:11 +0000 2018,A confluence of malware  botnets  and cyrpto-mining -- using malware to steal CPU resources to mine for cryptocurre… https://t.co/w6ARqk7SOw,0
Thu Feb 15 18:39:45 +0000 2018,EPA: Protect Bristol Bay From Open Pit Mining - Sign the Petition! https://t.co/wDepUMNH11 via @Change,2
Thu Feb 15 18:39:20 +0000 2018,@SSederstrom25 @replyall Bitcoin is a bubble  I do accept crypto currency as tribute however mining BTC is a waste… https://t.co/ID6yLqPuOX,1
Thu Feb 15 18:38:01 +0000 2018,EPA: Protect Bristol Bay From Open Pit Mining - Sign the Petition! https://t.co/wDepUMNH11 via @Change,2
Thu Feb 15 18:32:22 +0000 2018,Icelandic Lawmaker Floats Bitcoin Mining Tax https://t.co/w5nt6vceC6 https://t.co/vHckdycGoj,2
Thu Feb 15 18:23:19 +0000 2018,Today is William Pickering's birthday (1910-2004).  JPL Director for 24 years from 1954-1976  and led JPL into plan… https://t.co/QE0LmSYA37,7
Thu Feb 15 18:20:29 +0000 2018,@SSederstrom25 @replyall Bitcoin is a bubble  I do accept crypto currency as tribute however mining BTC is a waste… https://t.co/ID6yLqPuOX,1
Thu Feb 15 18:15:03 +0000 2018,right-wing  data-mining billionaire decamps to LA https://t.co/uLjCOr86ZX,0
Thu Feb 15 18:11:04 +0000 2018,Icelandic Lawmaker Floats Bitcoin Mining Tax https://t.co/w5nt6vceC6 https://t.co/vHckdycGoj,2
Thu Feb 15 17:28:22 +0000 2018,@woelfel @thurrott So if we're using a business PWA app that's running on unsigned .js codes  and we're inputting o… https://t.co/sBLevlAXlJ,0
Thu Feb 15 16:25:34 +0000 2018,Friends! There is new Aura bounty that pays you to run a full node and connect to the stats network  no mining requ… https://t.co/UT44uGgdtJ,0
Thu Feb 15 16:04:08 +0000 2018,"I believe that with the right marketplace of creators  brands can tell a great story and not need to go through pu… https://t.co/uCOxjj7dVO,0
Thu Feb 15 15:52:06 +0000 2018,45 Great Resources for Learning #Data Mining Concepts and Techniques  https://t.co/o79kuAHtXB via @importio https://t.co/8XcELyMMmZ,0
Thu Feb 15 15:47:28 +0000 2018,Nvidia may reveal dedicated ‘Turing’ cryptocurrency mining cards in March  https://t.co/epdvSHjjfC  $NVDA,3
Thu Feb 15 15:45:21 +0000 2018,Nvidia may reveal dedicated ‘Turing’ cryptocurrency mining cards in March  https://t.co/epdvSHjjfC  $NVDA,3
Thu Feb 15 15:42:50 +0000 2018,Nvidia may reveal dedicated ‘Turing’ cryptocurrency mining cards in March  https://t.co/epdvSHjjfC  $NVDA,3
Thu Feb 15 15:42:34 +0000 2018,Nvidia may reveal dedicated ‘Turing’ cryptocurrency mining cards in March  https://t.co/epdvSHjjfC  $NVDA,3
Thu Feb 15 15:41:50 +0000 2018,awww…thanks to you bit miners  SETI can't find little green/grey/whatever men https://t.co/kEqJyrkalt,0
Thu Feb 15 14:59:24 +0000 2018,Zambia:Lungu Appoints New Finance  Mining Ministers https://t.co/wPtiWlj2k0 https://t.co/EuLedXS1Vk,3
Thu Feb 15 14:57:56 +0000 2018,Zambia:Lungu Appoints New Finance  Mining Ministers https://t.co/wPtiWlj2k0 https://t.co/EuLedXS1Vk,3
Thu Feb 15 14:57:40 +0000 2018,Zambia:Lungu Appoints New Finance  Mining Ministers https://t.co/wPtiWlj2k0 https://t.co/EuLedXS1Vk,3
Thu Feb 15 14:08:27 +0000 2018,Mining Crypto Coins? This New App Lets You Mine 'Overwatch' Loot Boxes Instead https://t.co/sBMQSYEXVq https://t.co/RKR7OX8cs0,0
Thu Feb 15 13:16:01 +0000 2018,I wrote a post on how Ethereum works  explaining core components: State  accounts  transactions  blocks  gas  mining https://t.co/Imwue0IIto,880
Thu Feb 15 12:53:31 +0000 2018,18 gpu mining rig case via /r/BlockChain https://t.co/Q8Dravlc45,0
Thu Feb 15 11:02:18 +0000 2018,Cryptocurrency malware will pop up in ‘most unexpected places’ in 2018  researchers say https://t.co/uaHindP0Hd https://t.co/9yhaunlCGT,0
