Tue Jan 16 23:06:38 +0000 2018,Cryptocurrencies are crashing today. Bitcoin falls to below $10 000 on coinbase. This is a far fall from it’s high… https://t.co/ynNTBIGDyF,0
Tue Jan 16 22:52:39 +0000 2018,Bitcoin drops 28% below $10k on Coinbase; ethereum crashes 30% in 24 hours $BTC.X $GBTC $ETH.X $LTC.X $XRP.X $XRPBTC https://t.co/HPQ4ShCUuJ,0
Tue Jan 16 22:46:37 +0000 2018,What's next for Bitcoin? A great question from a great account @ForexLive  Follow  Retweet &amp; Repeat!  #Bitcoin… https://t.co/5GyUpvOCbT,2
Tue Jan 16 22:30:14 +0000 2018,What's next for Bitcoin? A great question from a great account @ForexLive  Follow  Retweet &amp; Repeat!  #Bitcoin… https://t.co/5GyUpvOCbT,2
Tue Jan 16 22:07:54 +0000 2018,@BMaaaaac @CryptoChoe @coinbase You can use debit card and it will be instant,0
Tue Jan 16 21:57:51 +0000 2018,What's next for Bitcoin? A great question from a great account @ForexLive  Follow  Retweet &amp; Repeat!  #Bitcoin… https://t.co/5GyUpvOCbT,2
Tue Jan 16 21:37:04 +0000 2018,Who is hodling for dear life? Or selling?   Retweet to help get lots of votes  #tron #trx #bitcoin #crypto #xrp… https://t.co/L0aL0S47sR,2
Tue Jan 16 20:02:13 +0000 2018,@brian_armstrong I'm not a Coinbase customer. Add XRP though and I'll join.,0
Tue Jan 16 19:28:25 +0000 2018,@coinbase I bought some $btc via credit card it's didn't show up on my transaction history did it went through or not?,0
Tue Jan 16 18:38:57 +0000 2018,Thread: "cryptocurrency trading is the milennial gambling addiction. This RT is not great blog post  but a provokin… https://t.co/7t1Kw7NV8t,1
Tue Jan 16 18:17:37 +0000 2018,Thread: "cryptocurrency trading is the milennial gambling addiction. This RT is not great blog post  but a provokin… https://t.co/7t1Kw7NV8t,1
Tue Jan 16 18:05:04 +0000 2018,I just bought my first digital currency on Coinbase - try it! https://t.co/5iWSdRjNHr,0
Tue Jan 16 15:03:19 +0000 2018,Coinbase Announces They Will No Longer Accept Deposits from Nationwide Bank https://t.co/9gHjqhNPlx,0
Tue Jan 16 12:37:57 +0000 2018,Just got an alert from Coinbase  BTC is under 12k!!!,1
Tue Jan 16 12:21:05 +0000 2018,I’ll say it again if the market crashes like it is now don’t I repeat DON’T run  but buy the #cryptocurrency you wa… https://t.co/lFUioSZ1rk,6
Tue Jan 16 11:55:01 +0000 2018,Just took advantage of the Dip.🤪 Bitcoin at $11 819.00 and Litecoin at $198.00🤪🚀🚀🚀 #Bitcoin #litecoin #coinbase… https://t.co/LrguG9m6mA,0
Tue Jan 16 08:46:08 +0000 2018,Just got an alert from Coinbase  BTC is under 12k!!!,1
