Wed Mar 14 22:28:13 +0000 2018,BITCOIN LATEST: Barclays' Coinbase partnership 'important step' to making cypto mainstream  https://t.co/WIWGC0vnnA,0
Wed Mar 14 15:35:09 +0000 2018,UK Coinbase Users Receive Faster Crypto-Fiat Transfers In First For Country https://t.co/oHDuqX7CpK,0
Wed Mar 14 14:21:07 +0000 2018,Coinbase Releases Tax Calculator But Many Users Will L... | News ⋆ Tech Talk https://t.co/L8xxgCoxpy,0
Wed Mar 14 13:05:32 +0000 2018,Coinbase Receives E-Money License For Fiat Activities From UK  Its ‘Biggest Market’ https://t.co/TJGwtNNvgK,0
Wed Mar 14 11:55:17 +0000 2018,Coinbase gets e-money license in the UK  will add Faster Payments to speed up fiat deposits https://t.co/7whgAm22JF https://t.co/orE1LDstLn,0
Wed Mar 14 09:28:38 +0000 2018,#AppleNews Barclays strikes banking deal with major cryptocurrency exchange Coinbase: The deal marks the first majo… https://t.co/pkThoy582T,1
Wed Mar 14 09:06:06 +0000 2018,#AppleNews Barclays strikes banking deal with major cryptocurrency exchange Coinbase: The deal marks the first majo… https://t.co/pkThoy582T,1
Wed Mar 14 09:06:05 +0000 2018,Barclays strikes banking deal with major cryptocurrency exchange Coinbase https://t.co/TnJnjCCte7 #AppleNews… https://t.co/hhTjnWVhlo,0
Wed Mar 14 06:06:08 +0000 2018,Coinbase Releases Tax Calculator But Many Users Will L... | News ⋆ Tech Talk https://t.co/FLPV942EC8,0
Wed Mar 14 05:54:10 +0000 2018,Barclays strikes payment deal with cryptocurrency exchange Coinbase in the UK https://t.co/c23TPzpwS6,0
