Mon Aug 13 22:22:16 +0000 2018,"Zinke’s actions recklessly grant gifts to energy and mining companies; damage public lands [...]; threaten public… https://t.co/2VdG7bXHiz,0
Mon Aug 13 18:45:17 +0000 2018,@ahryanhaywood Oh my god I suck at fishing lmaooo I love mining though lol,0
Mon Aug 13 18:03:00 +0000 2018,Cybercriminals Move from Ransomware Attacks to Crypto Mining https://t.co/7omx6k0Mrs via @SecurityHIT #healthcare,0
Mon Aug 13 16:24:09 +0000 2018,Cyber Criminals Profit from Crypto Mining Malware - CPO Magazine https://t.co/6YhIhrzHdg,0
Mon Aug 13 14:33:57 +0000 2018,If you fumbled through trading crypto in 2017-2018 you weren't the only one.  Bitmain  a multi billion dollar minin… https://t.co/zDkdursrrB,0
Mon Aug 13 11:00:51 +0000 2018,We carry #American made products serving the engineering  construction  agriculture  heavy manufacturing  mining in… https://t.co/G6J0DlYnuY,0
Mon Aug 13 05:51:19 +0000 2018,The wait continues for victims of Gold King mine spill | https://t.co/HBv2wdTujI https://t.co/C3aYo1UDDz,0
Mon Aug 13 05:47:18 +0000 2018,Bitmain Has More Than $570 Million in Bitcoin Cash Holdings     👉 https://t.co/4samOlAxx4  The ASIC mining giant ho… https://t.co/9zBAMxphq5,0
Mon Aug 13 03:45:21 +0000 2018,I liked a @YouTube video https://t.co/OmMhAxasMt Mining and Resistance in Dinétah,0
Mon Aug 13 03:28:12 +0000 2018,I think they might be unhappy that @SecretaryZinke keeps going around talking about how he's a "Teddy Roosevelt guy… https://t.co/AzVG16F4Sm,4
