Sun Feb 11 23:38:47 +0000 2018,Are you looking for resources to earn the #Mining in Society #meritbadge? Would you like to be a Mining in Society… https://t.co/F6jVu9lqMd,3
Sun Feb 11 23:30:39 +0000 2018,Did you know a multitude of #petroleum products are used in #hybrid cars? Learn more from our fact sheets!… https://t.co/aFkHHEUJlx,3
Sun Feb 11 23:25:03 +0000 2018,Get an overview of #sampling for #environmental purposes &amp; monitoring of environmental variables at #mining sites.… https://t.co/UAfwAT4HHn,0
Sun Feb 11 23:15:17 +0000 2018,Did you know a multitude of #petroleum products are used in #hybrid cars? Learn more from our fact sheets!… https://t.co/aFkHHEUJlx,3
Sun Feb 11 23:15:05 +0000 2018,Did you know a multitude of #petroleum products are used in #hybrid cars? Learn more from our fact sheets!… https://t.co/aFkHHEUJlx,3
Sun Feb 11 23:05:54 +0000 2018,Bitcoin Mining Comes To New York As Lawmakers Approve Power Allocation https://t.co/Rn60XbCA31,0
Sun Feb 11 22:05:32 +0000 2018,New post: "Adult content domains are home to half the sites using cryptomining malware" https://t.co/YhywDyfvR0 via digitaltrends,0
Sun Feb 11 21:54:59 +0000 2018,#Mining Professionals throughout the industry use #STEM subjects! These full color and double-sided #bookmarks intr… https://t.co/2bhKNKHrBS,1
Sun Feb 11 20:58:00 +0000 2018,Leaked @Interior memo reveals plans for steamrolling environmental reviews to up drilling &amp; mining on public lands… https://t.co/NTqsmep9SK,0
Sun Feb 11 20:19:16 +0000 2018,Are you looking for resources to earn the #Mining in Society #meritbadge? Would you like to be a Mining in Society… https://t.co/F6jVu9lqMd,3
Sun Feb 11 18:30:08 +0000 2018,#Mining Professionals throughout the industry use #STEM subjects! These full color and double-sided #bookmarks intr… https://t.co/2bhKNKHrBS,1
Sun Feb 11 18:08:30 +0000 2018,Are you looking for resources to earn the #Mining in Society #meritbadge? Would you like to be a Mining in Society… https://t.co/F6jVu9lqMd,3
Sun Feb 11 18:00:18 +0000 2018,Distributor Manager - Field #Sales/BD #Denver #CO #Jobs #Mining #Equipment #aggregates #crushing #crushers #screens  https://t.co/cqhBymKxOf,0
Sun Feb 11 17:05:05 +0000 2018,Are you looking for resources to earn the #Mining in Society #meritbadge? Would you like to be a Mining in Society… https://t.co/F6jVu9lqMd,3
Sun Feb 11 16:25:43 +0000 2018,Not surprised https://t.co/oRfyqfw9cj,0
Sun Feb 11 16:08:07 +0000 2018,Iceland to use more energy mining bitcoin than powering its homes this year https://t.co/jdOFQy9IE4,1
Sun Feb 11 15:47:07 +0000 2018,Iceland to use more energy mining bitcoin than powering its homes this year https://t.co/jdOFQy9IE4,1
Sun Feb 11 14:42:27 +0000 2018,How to make money mining bitcoin and other cryptocurrencies without knowing anything about it https://t.co/RMZmxivFPD,0
Sun Feb 11 13:40:14 +0000 2018,Technical #Support #Trainer - #Mining #Charlotte #SC #GA #Jobs #NC  #Training  #crushers #Engineering #travel  #Jobs https://t.co/JVbeXwwksh,0
Sun Feb 11 08:26:13 +0000 2018,Russian Scientists arrested for Mining Bitcoin at Nuclear Weapons Lab https://t.co/fr8gxe7wG8,0
Sun Feb 11 07:46:37 +0000 2018,Russians held for mining bitcoin at top nuclear weapons lab https://t.co/f6lrfvxEKl,0
Sun Feb 11 05:52:06 +0000 2018,@aroseblush Amen. Google  also. Data mining.,0
Sun Feb 11 03:51:21 +0000 2018,Bitcoin ARRESTS - Russian scientists found mining cryptocurrencies at 'TOP-SECRET' site https://t.co/u3pX91EQZG,0
Sun Feb 11 03:41:07 +0000 2018,Russians arrested for mining cryptocurrency at nuclear facility https://t.co/bCN49aXCwv,0
Sun Feb 11 00:41:00 +0000 2018,#Russian nuclear scientists arrested for ' #Bitcoin mining plot' https://t.co/5ZSELLKiSK,0
