Fri Jun 15 21:57:57 +0000 2018,AlphaPoint raises $15M Series A from Novogratz's Galaxy Digital to help build cryptocurrency exchanges  digitize as… https://t.co/zPdTdJrvwb,0
Fri Jun 15 21:56:20 +0000 2018,Do you want to be a key speaker at our event ? Fill out this Application TODAY for your chance !… https://t.co/erXuZuBrdn,2
Fri Jun 15 20:00:44 +0000 2018,Day 2 of #WhartonForum:  @AstridDoerner of @handelsblatt and Professor @kwerb discuss all things cryptocurrency. https://t.co/4CKsbnZiuF,0
Fri Jun 15 17:49:37 +0000 2018,Looking forward to connecting with the #Philly #blockchain community at Blockchain Bash on June 16!… https://t.co/LPejFurssi,1
Fri Jun 15 17:19:09 +0000 2018,Watch @ricecrypto talk shit for 26 minutes. Also if you're anywhere near #Denver on 6/27  join us for free at the… https://t.co/hKFY4lLqlD,0
Fri Jun 15 16:52:53 +0000 2018,ICYMI -&gt; Request Highlights Need For More Tax Guidance On Cryptocurrency via @forbes https://t.co/qJrHYGqTg1 #tax #crypto #bitcoin,4
Fri Jun 15 16:28:50 +0000 2018,Ummm...if this were to gain any traction at all  how dangerous would it be?  Steve Bannon is getting into cryptocur… https://t.co/agcFJ3C6Ip,0
Fri Jun 15 16:11:22 +0000 2018,Welcome to our #WhartonForum #tweetchat w/ @karenfinerman of @MetCapital &amp; @cnbcfastmoney.  Q1: You've just finishe… https://t.co/keUiexSLic,1
Fri Jun 15 16:07:10 +0000 2018,The Cryptocurrency Conundrum Part II: What We Know  and What We Don’t https://t.co/K0zg6GGJih,0
Fri Jun 15 16:06:33 +0000 2018,https://t.co/nfw7lJgkEZ https://t.co/RagwFEzLeO,0
Fri Jun 15 15:59:01 +0000 2018,Welcome to our #WhartonForum #tweetchat w/ @karenfinerman of @MetCapital &amp; @cnbcfastmoney.  Q1: You've just finishe… https://t.co/keUiexSLic,1
Fri Jun 15 15:54:09 +0000 2018,https://t.co/huyNJ5cGP7,586
Fri Jun 15 15:41:22 +0000 2018,The Cryptocurrency Conundrum Part II: What We Know  and What We Don’t https://t.co/Di9NvS2p20,0
Fri Jun 15 14:39:44 +0000 2018,Coinster Cryptocurrency Exchange WP Theme - https://t.co/nFy1pvoHhh - #Bitcoin https://t.co/J7Zjj9qDcd,0
Fri Jun 15 13:25:39 +0000 2018,Don’t forget to sign up for our #Airdrop #cryptocurrency  https://t.co/00saf5GsrE,6
Fri Jun 15 11:47:50 +0000 2018,Join our bouty program on: https://t.co/VfIDuMiKRe; and earn some serous cryptocurrency. Please also read our white… https://t.co/gV0luhOSiB,0
Fri Jun 15 11:41:28 +0000 2018,@Dek_iam @ponymom48 @peterdaou A "cryptocurrency investor and consultant" would write a response like that. Cryptoc… https://t.co/w3wnoU4DAP,0
Fri Jun 15 06:45:29 +0000 2018,What is Fry Egg? #Blockchain #cryptocurrency #TokenSale  https://t.co/31rICqJzf1,229
Fri Jun 15 05:13:36 +0000 2018,We’ve added a new partner to our ecosySTEM! Join us in welcoming @TheSciCheers #STEM #CryptoCurrency #stellar  https://t.co/NqIRppaKa5,7
Fri Jun 15 02:39:41 +0000 2018,@francispouliot_ The hypocrisy of liking one cryptocurrency for its censorship resistance and defiance to centraliz… https://t.co/C5vp3E3X9u,0
Fri Jun 15 00:39:20 +0000 2018,We’ve added a new partner to our ecosySTEM! Join us in welcoming @TheSciCheers #STEM #CryptoCurrency #stellar  https://t.co/NqIRppaKa5,7
