Wed Mar 14 22:41:09 +0000 2018,Block Header (Cryptocurrency) https://t.co/n1HBYIHOGK https://t.co/Rqbpk2ToCp,0
Wed Mar 14 22:39:44 +0000 2018,Litecoin is becoming more and more recognized as the best cryptocurrency for payments and gaining more and more att… https://t.co/6oPhbC74IM,4
Wed Mar 14 22:31:17 +0000 2018,Litecoin is becoming more and more recognized as the best cryptocurrency for payments and gaining more and more att… https://t.co/6oPhbC74IM,4
Wed Mar 14 22:24:39 +0000 2018,Litecoin is becoming more and more recognized as the best cryptocurrency for payments and gaining more and more att… https://t.co/6oPhbC74IM,4
Wed Mar 14 22:12:44 +0000 2018,Litecoin is becoming more and more recognized as the best cryptocurrency for payments and gaining more and more att… https://t.co/6oPhbC74IM,4
Wed Mar 14 22:02:22 +0000 2018,Litecoin is becoming more and more recognized as the best cryptocurrency for payments and gaining more and more att… https://t.co/6oPhbC74IM,4
Wed Mar 14 21:18:11 +0000 2018,@DylanTMicah just gave an awesome talk on how #UX is crucial in the widespread adoption of #blockchain solutions. S… https://t.co/OKm1bF4s6z,0
Wed Mar 14 21:00:56 +0000 2018,AirTM Taps Zcash for Improved Financial Freedom and Privacy - Some cryptocurrency enthusiasts are familiar with the… https://t.co/3qgrfrVW09,0
Wed Mar 14 20:59:21 +0000 2018,#Google will ban #cryptocurrency ads in June https://t.co/VJgF1Vb3gB,0
Wed Mar 14 20:40:04 +0000 2018,Google bans cryptocurrency advertising  bitcoin price slumps https://t.co/WMGtZiArjU,0
Wed Mar 14 19:51:06 +0000 2018,SEC Targets Cryptocurrency Hedge Funds In Probe https://t.co/uFypgHCzyw https://t.co/yNSM3gKLkl,0
Wed Mar 14 19:12:33 +0000 2018,Google to ban cryptocurrency and related advertisements https://t.co/HTAaBru78w,0
Wed Mar 14 18:15:52 +0000 2018,Cryptocurrency Scams  Ad Bans  and Negative Opinions. Is There A Light At The End Of The Crypto Tunnel? - It’s no p… https://t.co/HyWw6PSkpO,0
Wed Mar 14 18:14:53 +0000 2018,$IEGH IEG Holdings is not pursuing a cryptocurrency offering or any other cryptocurrency-related ventures at this t… https://t.co/1xNuOaEooL,0
Wed Mar 14 18:07:05 +0000 2018,Coinbase Introduces Cryptocurrency Tax Calculator https://t.co/FmYirvFZUo https://t.co/4ejDvgUHsD,0
Wed Mar 14 18:03:43 +0000 2018,Google looks to be set to ban cryptocurrency ads through AdWords starting June 2018: https://t.co/KooR42wsRw. They… https://t.co/Sl4XRtnLRz,0
Wed Mar 14 17:51:53 +0000 2018,https://t.co/L6k8bDVTXF #bitcoin #ethereum,0
Wed Mar 14 17:45:53 +0000 2018,@ethereum Check out Crypto101 to get tips on cryptocurrency  read articles  watch videos  and learn the lingo!… https://t.co/rBAxkzSQeK,1
Wed Mar 14 17:38:36 +0000 2018,https://t.co/bllBoz5Ggo #ethereum #cryptocurrency,0
Wed Mar 14 17:36:56 +0000 2018,TradeStation Now Offers Free Real-Time Cryptocurrency Pricing https://t.co/DPpxDJuR6l https://t.co/QA1HdSHbyk,0
Wed Mar 14 17:30:44 +0000 2018,Artificial Intelligence In The Works To Sniff Out ICO Scams #ai #artificialintelligence #ico #scams #bitcoin… https://t.co/TdgKFFZize,2
Wed Mar 14 17:26:11 +0000 2018,My @Forbes #businesstech roundup will get you caught up on the week's top stories  including @facebook job posts  a… https://t.co/3ZqtrnWvpl,5
Wed Mar 14 17:16:22 +0000 2018,Google Bans Advertising Related To Cryptocurrency Products https://t.co/z4YRwUh1Jv https://t.co/lO6xwfGIud,0
Wed Mar 14 17:12:19 +0000 2018,[#SEMrushStats] There is an extremely strong correlation between the #bitcoin exchange rate and the amount of relev… https://t.co/HUkVKMttHF,68
Wed Mar 14 17:09:15 +0000 2018,Bitcoin May Be Spared in Government Cryptocurrency Crackdown https://t.co/UkApEWMFcW https://t.co/pvZ2qQnnKU,0
Wed Mar 14 17:07:01 +0000 2018,Telegram Zero Day Let Hackers Mine Cryptocurrency  Drop Backdoors https://t.co/Bt1FKfF47X,0
Wed Mar 14 16:48:06 +0000 2018,Google will ban all cryptocurrency-related ads starting Jun 2018 (CNBC). https://t.co/EFvcXXif4X,0
Wed Mar 14 16:35:27 +0000 2018,Infographic – Cryptocurrency Project https://t.co/9EDbPoHrq0 https://t.co/BKbcebnYRg,0
Wed Mar 14 16:11:02 +0000 2018,Cryptocurrencies fall as Google announces ad ban https://t.co/Jn4yPXamaN,0
Wed Mar 14 16:01:03 +0000 2018,[#SEMrushStats] There is an extremely strong correlation between the #bitcoin exchange rate and the amount of relev… https://t.co/HUkVKMttHF,68
Wed Mar 14 15:20:55 +0000 2018,Artificial Intelligence In The Works To Sniff Out ICO Scams #ai #artificialintelligence #ico #scams #bitcoin… https://t.co/TdgKFFZize,2
Wed Mar 14 15:20:24 +0000 2018,Artificial Intelligence In The Works To Sniff Out ICO Scams #ai #artificialintelligence #ico #scams #bitcoin… https://t.co/TdgKFFZize,2
Wed Mar 14 15:15:11 +0000 2018,Bitcoin Price Craters Under $9 000 After Google Bans Cryptocurrency Ads https://t.co/JH5lCuHo80 https://t.co/iZawXsFI1j,1
Wed Mar 14 15:08:01 +0000 2018,$IEGH IEG Holdings further info on potential distribution: Investment Evolution Coin Ltd. is a Singapore incorporat… https://t.co/P3tOllZ5FC,0
Wed Mar 14 15:05:56 +0000 2018,Google will ban all cryptocurrency-related advertising https://t.co/CZuRbHhTUr,0
Wed Mar 14 15:05:21 +0000 2018,$IEGH IEG Holdings is not pursuing a cryptocurrency offering or any other cryptocurrency-related ventures at this t… https://t.co/ly2g88Sf8m,0
Wed Mar 14 15:01:17 +0000 2018,Low Volatility Crypto Minexcoin Launches MinexBank mobile app for iOS - MinexSystems  the developers responsible fo… https://t.co/BXFoA2QFki,0
Wed Mar 14 15:00:06 +0000 2018,Check out Talk about cryptocurrency and blockchain technology tonight at 9:00pm https://t.co/9UOJs0AFUh #PHL #Philly,0
Wed Mar 14 14:14:12 +0000 2018,How #Blockchain Could Change #Facebook And #SocialMedia Forever https://t.co/LeaAlqiPHE @SocialMediaHQ… https://t.co/XftR9xGNNk,0
Wed Mar 14 14:09:01 +0000 2018,ICYMI - Tesla's cloud account was hacked to run #crypto currency mining  exposed non-public data on @Tesla vehicles… https://t.co/rOH0eELarL,0
Wed Mar 14 14:04:33 +0000 2018,Funny  true  and sad... #blockchain #cryptocurrency https://t.co/S4cGYac9Op,0
Wed Mar 14 13:42:57 +0000 2018,Are your office computers mining cryptocurrency? https://t.co/iOnrBD55MP via @foxnews https://t.co/IVK6mxWNII,0
Wed Mar 14 13:28:13 +0000 2018,StartEngine expands its reach into cryptocurrency with first JOBS Act regulated ICO https://t.co/5UbXSGjQna,0
Wed Mar 14 13:27:12 +0000 2018,What Does “Hacking” Your Crypto Actually Mean? https://t.co/Y4UZK8NItU #bitcoin #btc #cryptocurrency… https://t.co/SnSFSYiTUB,1
Wed Mar 14 12:21:17 +0000 2018,There is growing convergence around the idea of a cryptocurrency self-regulatory organization  along the lines of F… https://t.co/vUdqWDSoF0,0
Wed Mar 14 12:07:02 +0000 2018,"next I wanna introduce you to someone who is making the world a better place - for all HUMANITY!" - MC of event fo… https://t.co/3BhugrqoGW,0
Wed Mar 14 12:06:47 +0000 2018,Google will ban all cryptocurrency-related advertising - https://t.co/a6r6Gbx2e0,1
Wed Mar 14 12:01:40 +0000 2018,Google will ban all cryptocurrency-related advertising #HODL ? #bubble  https://t.co/T2GROKyLRs,0
Wed Mar 14 12:01:27 +0000 2018,NEM Price Momentum Continues as $0.5 is Within Reach - As we have almost grown accustomed to these days  the crypto… https://t.co/uoOih2UvUO,0
Wed Mar 14 11:58:12 +0000 2018,@saxonwoodfunds @AdamDraper I wouldn't describe today's payments systems as digital money.  Ideally we could have a… https://t.co/wa0VpNCOgP,0
Wed Mar 14 11:09:18 +0000 2018,Google bans cryptocurrency adverts https://t.co/Fz7aFirWDe via @techradar https://t.co/Xw67PZmWqv,0
Wed Mar 14 10:59:06 +0000 2018,Qarnot unveils a #cryptocurrency heater for your home https://t.co/bTTJlV79dG,0
Wed Mar 14 10:29:05 +0000 2018,https://t.co/w92Q3oUJ6I is not for sale https://t.co/IYTLdvNWKT via @Verge,0
Wed Mar 14 10:15:04 +0000 2018,Google is banning all cryptocurrency-related ads https://t.co/3gyyHT8k6l https://t.co/e0Zp9aW6MB,0
Wed Mar 14 09:19:41 +0000 2018,Join our #crowdsale  and become a #VITizen of our ever growing community today! ONLY at https://t.co/b3T4qDAv9u !… https://t.co/hQrvMKQdkV,0
Wed Mar 14 06:31:20 +0000 2018,International Banking Study Calls Centralized Crypto Inevitable - A new report issued by an international banking g… https://t.co/mzsNnnLdyl,0
Wed Mar 14 06:16:07 +0000 2018,Unicorn Visions: Bitcoin's Startups Aren't Startups Anymore - Coinbase and Bitmain  each valued over $1 billion  ar… https://t.co/6gWS3RzOb8,0
Wed Mar 14 06:16:00 +0000 2018,HybridBlock: The Four-in-One Cryptocurrency Exchange/Education Ecosystem - Last week  I had the pleasure of intervi… https://t.co/u17PHZU5RB,0
Wed Mar 14 03:48:17 +0000 2018,Binance: Unveils Blockchain  New Exchange  &amp; BNB Token Upgrade? #bnb #token #binance #cryptonews #cryptocurrency… https://t.co/8RTX9VzjdH,0
Wed Mar 14 03:15:42 +0000 2018,Europe's Central Bank Touts Crypto As Underbanked Aid - A new opinion piece from European Central Bank officials di… https://t.co/WHWM3fnxwL,0
Wed Mar 14 03:00:35 +0000 2018,Price of Binance Coin Surges 25% Following Announcement - Following major declines in global trading volume  crypto… https://t.co/GMMVPhvHgB,0
Wed Mar 14 00:47:26 +0000 2018,World's Largest Crypto Exchange Binance To Launch Decentralized Trading Platform - Cryptocurrency exchange Binance… https://t.co/1XOb22bL6W,0
Wed Mar 14 00:33:26 +0000 2018,Bitcoin Proving Useful for Asian Remittance Companies - More companies seem to be embracing one of Bitcoin’s most u… https://t.co/n5ThHBrMnE,0
