Fri Oct 12 21:59:00 +0000 2018,Although the exact path is uncertain  the " #cryptocurrency market as a whole will be increasingly subject to regul… https://t.co/DR4qqQC1bp,0
Fri Oct 12 21:32:17 +0000 2018,Earning #cryptocurrency for selling my stuff on @Listia! Join me using code "CWSJMH" for an extra 25 XNK. I just li… https://t.co/En7lzX5ktz,0
Fri Oct 12 20:29:34 +0000 2018,#Bitcoin finally began to stabilize Friday  but not before the total #cryptocurrency market lost $18 billion of its… https://t.co/XmQCHS1fZ8,0
Fri Oct 12 19:11:12 +0000 2018,Winklevoss Twins' Gemini Crypto Exchange Gets Regulatory Green Light for Litecoin Trading #litecoinfam… https://t.co/WHPOyvJGeF,0
Fri Oct 12 18:30:52 +0000 2018,If you haven't recognized Cryptocurrency's resilience by this point then I don't really have anything to say to you… https://t.co/zp5mJty1Rh,1
Fri Oct 12 16:45:06 +0000 2018,Are #cryptocurrency investors becoming "victims of 'irrational exuberance?'" @DanielArayaXY writes about the curren… https://t.co/9yPZGvHWeo,0
Fri Oct 12 16:23:00 +0000 2018,#SRTcoin #bitcoin #ethereum #ICO #SRTGroup #cryptocurrency #icobench #ripple #eos https://t.co/OYudL5xD97,0
Fri Oct 12 15:23:44 +0000 2018,If you haven't recognized Cryptocurrency's resilience by this point then I don't really have anything to say to you… https://t.co/zp5mJty1Rh,1
Fri Oct 12 14:46:55 +0000 2018,Indian Cryptocurrency? India Is Considering The Possibility Of Issuing State Cryptocurrency #cryptocurrency… https://t.co/SkTONEZp01,1
Fri Oct 12 14:37:50 +0000 2018,Civil's token sale struggling is perhaps the best indicator the ICO boom is over. Whether Civil itself can overcome… https://t.co/bJuJ6Und30,1
Fri Oct 12 14:19:04 +0000 2018,Indian Cryptocurrency? India Is Considering The Possibility Of Issuing State Cryptocurrency #cryptocurrency… https://t.co/SkTONEZp01,1
Fri Oct 12 14:09:50 +0000 2018,Hackers hide cryptocurrency mining malware in Adobe Flash updates https://t.co/Cot8g6CwYP,1
Fri Oct 12 14:00:04 +0000 2018,Hackers hide cryptocurrency mining malware in Adobe Flash updates https://t.co/Cot8g6CwYP,1
Fri Oct 12 13:44:05 +0000 2018,Our Latest Google News Digest is Here‼️  ✅New SERP Features ✅Image Search Revamped ✅Google Feed Update ✅End of Cryp… https://t.co/ILxb552MzD,7
Fri Oct 12 11:42:00 +0000 2018,Over $6 billion was wiped off global #cryptocurrency markets in a day  led by #XRP and #ethereum as prices of digit… https://t.co/N86bL5Ws7S,0
Fri Oct 12 11:30:41 +0000 2018,#Cryptocurrency Price Ticker Widget &amp; Charts Pro for #WordPress https://t.co/JxdNS434Mu https://t.co/mbIMSiGOEJ,0
Fri Oct 12 11:09:24 +0000 2018,I made a new Twitter account focused on my passion for Cryptocurrencies and Blockchain technology.  Please reach ou… https://t.co/X2MYtUMLql,7
Fri Oct 12 05:39:12 +0000 2018,@FAMEONEcom Very interesting project! I advise You to invest in it. #Fameone #Crypto #Cryptocurrency #Blockchain #Ethereum,0
Fri Oct 12 05:38:51 +0000 2018,@FAMEONEcom The project looks interesting - good job! I haven't read the whole WP yet  but your team and board od a… https://t.co/n7VEWBkNho,0
Fri Oct 12 05:37:49 +0000 2018,FAMEONE The most interesting project to date! very much attracted someone else's attention! I'm a part of! And reco… https://t.co/EorWjK9VGd,0
Fri Oct 12 05:37:43 +0000 2018,An interesting trend every day more and more of my subscribers are interested in this project. And this is a good s… https://t.co/ggfdGzX9bG,0
Fri Oct 12 05:37:37 +0000 2018,There are many scammers among ICO companies  but this company is not  project is clear and team is working hard  le… https://t.co/drROuCqC4o,0
Fri Oct 12 05:37:31 +0000 2018,I am very confident that this company will occupy a leading position on the market! Don't miss this opportunity let… https://t.co/bTAmhW4efs,0
Fri Oct 12 05:37:26 +0000 2018,Don't miss your chance #ICO to earn profit from this great project. I believe you will succeed and you will turn th… https://t.co/LgnhNTU23l,0
Fri Oct 12 05:01:56 +0000 2018,This project is just the BOMB! One of the best to date! It is my great pleasure to participate and follow all the n… https://t.co/iK7rGq1ySv,0
Fri Oct 12 05:01:49 +0000 2018,Unique  amazing project! It will be a big success  and those who invest now - big profits soon!! #Miracletele… https://t.co/t0eht3EwVS,0
Fri Oct 12 05:01:43 +0000 2018,I advise everyone not to slow down and to join the project. I'm sure the project will be successful! #Miracletele… https://t.co/TaM5gGrUCm,0
Fri Oct 12 05:01:36 +0000 2018,Dear friends  investors you have a chance to make a successful investment this year! don't lose your chance! ! Join… https://t.co/mYZMgNqYaJ,0
Fri Oct 12 05:01:28 +0000 2018,This is a very good project  many prominent investors are glancing at the project and they will be contributing to… https://t.co/cP5a1UbNtR,0
Fri Oct 12 04:59:51 +0000 2018,This project significantly expands the bYoundaries of the familiar virtual reality! On this platform  the world for… https://t.co/MaGSr1EOJ5,0
Fri Oct 12 04:59:41 +0000 2018,You will be able to use your tokens to purchase many different products. purchase Timeshare for our Holiday; flight… https://t.co/kWTR18NsUc,0
Fri Oct 12 04:59:29 +0000 2018,Today there is a great urgency of development in this field! I participate in the ICO  and encourage everyone to pa… https://t.co/JG5Ynz7jEq,0
Fri Oct 12 04:42:52 +0000 2018,Be one of the first who will receive coins of this company! The surprising and perspective project. #ICO #RaysNetwork #cryptocurrency,0
Fri Oct 12 04:42:45 +0000 2018,The most interesting project to date! very much attracted someone else's attention! I'm a part of! And recommend to… https://t.co/N5iEUZ3GdF,0
Fri Oct 12 04:42:23 +0000 2018,Every day The number of users who want to invest in ICO is increasing and ICO is one of the best ways to invest. Im… https://t.co/kkFEN7wpc8,0
Fri Oct 12 04:42:14 +0000 2018,Tokens sold during the Pre-Sale phase RAYS NETWORK project -has been successfully distributed to the participants.… https://t.co/CnQjlpZSbB,0
Fri Oct 12 04:42:10 +0000 2018,This project includes a number of best things: great team  great product  great idea  great start! We need products… https://t.co/ZK8FDAh1R0,0
Fri Oct 12 03:47:51 +0000 2018,The #StockMarket Crashed  😮  #Cryptocurrency crashed at the same damn time smh 🤦🏽‍♀️,0
Fri Oct 12 02:25:00 +0000 2018,#PIVX Price Continues Uptrend as Other Coins Face Steep Declines  https://t.co/uGrzn3Ev6f  $PIVX #btc #crypto… https://t.co/kdpkPtCsNc,5
Fri Oct 12 01:49:28 +0000 2018,#litecoin is at $50.49 this is a good time to buy while it’s low.  #LitecoinFam #cryptocurrency #crypto https://t.co/sy6JDFAWtX,2
Fri Oct 12 01:12:25 +0000 2018,#litecoin is at $50.49 this is a good time to buy while it’s low.  #LitecoinFam #cryptocurrency #crypto https://t.co/sy6JDFAWtX,2
Fri Oct 12 00:45:22 +0000 2018,#PIVX Price Continues Uptrend as Other Coins Face Steep Declines  https://t.co/uGrzn3Ev6f  $PIVX #btc #crypto… https://t.co/kdpkPtCsNc,5
