Mon Dec 03 20:33:24 +0000 2018,It's Official! 26 French companies completes testing of #Chainlink Oracle  #blockchain in collaboration w/ KYC &amp;… https://t.co/pYjMX0AK3C,5
Mon Dec 03 18:29:05 +0000 2018,You Should Be Worried About Cryptocurrency Mining Malware https://t.co/QmZU91joHT https://t.co/EiVAOTKEs8,0
Mon Dec 03 18:27:11 +0000 2018,It's Official! 26 French companies completes testing of #Chainlink Oracle  #blockchain in collaboration w/ KYC &amp;… https://t.co/pYjMX0AK3C,5
Mon Dec 03 16:07:46 +0000 2018,Love the Monday update on @blockchain and @cryptocurrency from @_CryptoCurator on @anchor https://t.co/Dui3bDrkc9.… https://t.co/tHH3mut1mu,0
Mon Dec 03 15:56:30 +0000 2018,Recent Blockchain Bills in Wyoming are a great step towards regulatory progress. The ‘Special Purpose Depositary Ba… https://t.co/9aE7ETRfgC,1
Mon Dec 03 15:53:50 +0000 2018,Cure for insomnia. An IRS agent conducting a conference call re cryptocurrency.,0
Mon Dec 03 15:46:47 +0000 2018,Recent Blockchain Bills in Wyoming are a great step towards regulatory progress. The ‘Special Purpose Depositary Ba… https://t.co/9aE7ETRfgC,1
Mon Dec 03 15:20:20 +0000 2018,It's Official! 26 French companies completes testing of #Chainlink Oracle  #blockchain in collaboration w/ KYC &amp;… https://t.co/pYjMX0AK3C,5
Mon Dec 03 15:11:06 +0000 2018,It's Official! 26 French companies completes testing of #Chainlink Oracle  #blockchain in collaboration w/ KYC &amp;… https://t.co/pYjMX0AK3C,5
Mon Dec 03 14:59:32 +0000 2018,I'm not a smart man... but THIS guy is!  @Wharton Professor Kevin Werbach [@kwerb] wrote a book called "The Blockch… https://t.co/7DLXj3tKkm,3
Mon Dec 03 14:58:50 +0000 2018,I'm not a smart man... but THIS guy is!  @Wharton Professor Kevin Werbach [@kwerb] wrote a book called "The Blockch… https://t.co/7DLXj3tKkm,3
Mon Dec 03 14:19:39 +0000 2018,I'm not a smart man... but THIS guy is!  @Wharton Professor Kevin Werbach [@kwerb] wrote a book called "The Blockch… https://t.co/7DLXj3tKkm,3
Mon Dec 03 14:07:49 +0000 2018,I'm not a smart man... but THIS guy is!  @Wharton Professor Kevin Werbach [@kwerb] wrote a book called "The Blockch… https://t.co/7DLXj3tKkm,3
Mon Dec 03 13:52:46 +0000 2018,https://t.co/vUVn8qqwk9 #bitcoin will help redistribute wealth #economics #Africa #SouthAmerica #cryptocurrency,0
Mon Dec 03 13:48:25 +0000 2018,https://t.co/vKOudMKaP3 #bitcoin #cryptocurrency #gettingstartedwithcrypto #binance,0
Mon Dec 03 13:17:02 +0000 2018,Everything You Need to Know About Ethereum    Bitcoin might be leading the crypto arms race right now  but Ethereum… https://t.co/iDldz4h4sZ,0
Mon Dec 03 08:40:00 +0000 2018,Ohio Becomes The First State To Allow Taxpayers To Pay Tax Bills Using Cryptocurrency via @forbes… https://t.co/p84ayAAwVN,137
Mon Dec 03 01:44:25 +0000 2018,@CyborgBebop @Clbmchl just talk about cryptocurrency dude chicks love that,0
