Tue Oct 17 23:55:41 +0000 2017,@paul_btc @zaoyang Believe that was captured by "how to create". FWIW  bitcoin supply much more fixed than gold.,0
Tue Oct 17 23:55:35 +0000 2017,Gold Party Bus Delivers Donations to #CaliforniaWildfire Victims https://t.co/dqSwtOqO75 Via @KQEDnews https://t.co/kXxKnQfTKY,0
Tue Oct 17 23:55:34 +0000 2017,When in doubt  turn to the Twerkulator. https://t.co/3OLqxKq5nU,1
Tue Oct 17 23:55:15 +0000 2017,Karatbars is an amazing opportunity that makes buying gold affordable and accessable to all- https://t.co/9JYqUAxhpo https://t.co/hJdEBxsOn2,0
Tue Oct 17 23:54:11 +0000 2017,A stellar gold mine . . . perhaps the astronomical event of the year! https://t.co/rpi2jQDMwX,0
Tue Oct 17 23:51:19 +0000 2017,130 million years ago  two neutron stars collided and the debris from that cataclysm sprinkled the cosmos with gold. https://t.co/d1CySm5VPq,164
Tue Oct 17 23:45:12 +0000 2017,Karatbars provides the opportunity to buy gold &amp; hedge against inflation- https://t.co/9JYqUAxhpo https://t.co/JbkslunLUR,0
Tue Oct 17 23:43:51 +0000 2017,3 Reasons #Gold is Better than Bitcoin https://t.co/pFHBomRlV2 @newsinvesting,4
Tue Oct 17 23:36:38 +0000 2017,Mystery of small-time gold smugglers grows  https://t.co/HfoSro7eZT,0
Tue Oct 17 23:35:07 +0000 2017,When You Give a Loved One Gold  You’re Giving Something Born Among the Stars @LIGO  @NASAFermi  https://t.co/PiQrO4RomT @UCObservatories,0
Tue Oct 17 23:30:53 +0000 2017,@Mister_Nick_ @realDonaldTrump @NBCNews @CBSNews @ABC @CNN It's all gold!,0
Tue Oct 17 23:28:47 +0000 2017,https://t.co/WBR2XFKYRK via @YahooNews Yes  GOLD Discovered being Created in Deep Space! Not only Gold; but also Platinum  Uranium  etc.!,0
Tue Oct 17 23:26:03 +0000 2017,Why won't @CitiAustralia gold wealth team contact me. Filled-in details online  left message with call center... nothing! Why advertise?,0
Tue Oct 17 23:25:03 +0000 2017,So Warriors are getting their championship rings tonight and these gold-encrusted JBL headphones.… https://t.co/NhFSqhJKUu,0
Tue Oct 17 23:24:10 +0000 2017,This stunning solitaire is another of our signature designs: the Moondust in Argentium with 18K Gold and a 4mm... https://t.co/HcI0UhlY4c,0
Tue Oct 17 23:16:42 +0000 2017,Looking good in gold and white! 🏆  #DubNation https://t.co/kX7gX3zMnC,0
Tue Oct 17 23:16:04 +0000 2017,@MagicMarcus10 @KeanuChristian THIS IS GOLD,0
Tue Oct 17 23:10:25 +0000 2017,Global Gold Bullion is making gold ownership a possibility for everyone- https://t.co/9JYqUAxhpo https://t.co/zKiqLoZcoA,0
Tue Oct 17 23:06:05 +0000 2017,If you see these BUY them. You've struck Halloween GOLD. #raedunn #hocuspocus #halloween @tjmaxx https://t.co/8hJ4PIu5s2,0
Tue Oct 17 23:03:59 +0000 2017,If everyone knew the real value of GOLD  why is it that most people don't invest on it? - https://t.co/9JYqUAxhpo https://t.co/5i7KHhlY6S,0
Tue Oct 17 22:59:30 +0000 2017,7. Normal sunsets that look like watercolor paintings splashed in gold light  as opposed to the apocalyptic dying sun ones we're getting.,0
Tue Oct 17 22:57:26 +0000 2017,Astronomers strike cosmic gold! https://t.co/HoZN7ZAYe4 #GravitationalWaves https://t.co/UMiid8H2z7,4
Tue Oct 17 22:48:33 +0000 2017,gold Ferrari ???? https://t.co/E9DW3DM2uA,1
Tue Oct 17 22:46:26 +0000 2017,gold Ferrari ???? https://t.co/E9DW3DM2uA,1
Tue Oct 17 22:39:36 +0000 2017,I didn't get a photo of the gateway  which was beautiful and imposing iron and gold  or the garden which rivalled the Jardin du Luxemburg,0
Tue Oct 17 22:32:45 +0000 2017,BlockChannel:https://t.co/PHA2QFwKUh #bitcoin #hive https://t.co/4OJOa8tSQO,0
Tue Oct 17 22:30:41 +0000 2017,MacBook looking even sexier by the moment. Gotta get me some of that Rose Gold goodness,0
Tue Oct 17 22:28:15 +0000 2017,FOXNEWS 3:26pm Gold  Silver  and IRA Transfer Kits. EROSLANDCAPITAL'com ROD—61O-2OO“,0
Tue Oct 17 22:27:42 +0000 2017,Durant excited to wear gold shoes - ESPN Video #GoldenStateWarriors  https://t.co/xM5g0ARX7S https://t.co/qhMsncK3GG,0
Tue Oct 17 22:25:19 +0000 2017,Championship fitted 🏆 #DubNation https://t.co/NzGNr64LKt,1168
Tue Oct 17 22:20:05 +0000 2017,Gold vs fiat vs crypto https://t.co/ZRd1yBTKkT https://t.co/SBlKSvsxsr,3
Tue Oct 17 22:16:54 +0000 2017,Would there be enough gold to cover the amount of value in the system today based on the gold standard? Does your price of gold just inflate,0
Tue Oct 17 22:14:40 +0000 2017,Goldman says gold beats bitcoin as bank weighs fear and wealth  https://t.co/vtk7gz4bDZ,0
Tue Oct 17 22:13:34 +0000 2017,Global Gold Bullion is making gold ownership a possibility for everyone- https://t.co/9JYqUAxhpo https://t.co/EXwexUekYH,0
Tue Oct 17 22:13:32 +0000 2017,Did the gold sparkly crop top sell out? I've been checking the site for it since 5am but haven't seen it #CARLIBYBELxMISSGUIDED @Missguided,0
Tue Oct 17 22:11:17 +0000 2017,This Woman’s ‘Chinning’ Selfies Are Travel Instagram Gold https://t.co/qlkhtjEX5H #FITNESS AND #FOOD https://t.co/utFfD4vmIG,0
Tue Oct 17 22:10:23 +0000 2017,Sony Playstation 4 Pro Destiny 2 Gold Bundle (includes the Destiny 2 Season Pass) now down to $399.99 on Amazon… https://t.co/eCBg43tycs,70
Tue Oct 17 22:06:28 +0000 2017,Astronomers strike cosmic gold! https://t.co/HoZN7ZAYe4 #GravitationalWaves https://t.co/UMiid8H2z7,4
Tue Oct 17 22:05:45 +0000 2017,Everything I've read on there has been gold so far.,0
Tue Oct 17 22:03:06 +0000 2017,If anyone's looking for a present for the #spoonie in bed...https://t.co/klrpP7BNfX https://t.co/SWPJoIWm2D,0
Tue Oct 17 22:02:52 +0000 2017,Zuora: Turn Customer #Data into Winning #Subscriber Experiences ft VP Matt Darrow + Chief Data Scientist Carl Gold… https://t.co/eIYGp6M5q1,0
Tue Oct 17 22:02:48 +0000 2017,Astronomers strike cosmic gold! https://t.co/HoZN7ZAYe4 #GravitationalWaves https://t.co/UMiid8H2z7,4
Tue Oct 17 22:02:34 +0000 2017,Astronomers strike cosmic gold! https://t.co/HoZN7ZAYe4 #GravitationalWaves https://t.co/UMiid8H2z7,4
Tue Oct 17 22:02:02 +0000 2017,Astronomers strike cosmic gold! https://t.co/HoZN7ZAYe4 #GravitationalWaves https://t.co/UMiid8H2z7,4
Tue Oct 17 22:00:01 +0000 2017,Gold rush: Paddling into the historic Yukon. https://t.co/ERsny9gIdS https://t.co/cvcxnZjbvl,0
Tue Oct 17 21:59:34 +0000 2017,Chronicle's property of the week is a mid-century in Marin... Check out those views! https://t.co/BqFr8W1EYm,0
Tue Oct 17 21:59:21 +0000 2017,Chronicle's property of the week is a mid-century in Marin... Check out those views! https://t.co/IFfCURYHrv,0
Tue Oct 17 21:59:04 +0000 2017,Chronicle's property of the week is a mid-century in Marin... Check out those views! https://t.co/m5dbOe8FXa,0
Tue Oct 17 21:59:02 +0000 2017,Awol Erizku - Oh what a feeling  aw  fuck it  I want a trillion  2014 (Mixed media: basketball rims  24 karat gold… https://t.co/CuCTwnSptC,4
Tue Oct 17 21:58:33 +0000 2017,@zpolzpol7 @SUKnives @MYSTIC7 @trnrtips @PkmnMasterHolly @ReversalYouTube Dude it’s sponsored and non-sponsored gym… https://t.co/03Ib4d7cJh,0
Tue Oct 17 21:55:44 +0000 2017,CRISPR-Gold fixes Duchenne muscular dystrophy mutation in mice https://t.co/f4uguYEQ8w,34
Tue Oct 17 21:55:43 +0000 2017,Awol Erizku - Oh what a feeling  aw  fuck it  I want a trillion  2014 (Mixed media: basketball rims  24 karat gold… https://t.co/CuCTwnSptC,4
Tue Oct 17 21:54:52 +0000 2017,Awol Erizku - Oh what a feeling  aw  fuck it  I want a trillion  2014 (Mixed media: basketball rims  24 karat gold… https://t.co/CuCTwnSptC,4
Tue Oct 17 21:54:41 +0000 2017,@drschweitzer @MarketUrbanism didn't LA get smacked down over the equity impacts of the Gold Line?,0
Tue Oct 17 21:52:59 +0000 2017,@HP received first #SITES gold certification for sustainable landscaping in the WORLD!   So proud to be a part of t… https://t.co/Q2dGZ6ehDR,0
Tue Oct 17 21:50:19 +0000 2017,As a #socialselling rep the "Whose Viewed my Profile" pg. on @LinkedIn is a GOLD Mine! @GoVengreso… https://t.co/UoArEPcnnV,5
Tue Oct 17 21:48:03 +0000 2017,@MarketWatch @petenajarian Dow 23 000 is nice- but the Dow giveth and the Dow taketh away  Harvest some gains &amp; rei… https://t.co/6EJbJwTdfp,0
Tue Oct 17 21:44:09 +0000 2017,Android photographers: The Pixel 2 is the new gold standard  https://t.co/oHFglqNS9o https://t.co/GU7iA8OBlf,2
Tue Oct 17 21:43:23 +0000 2017,@SeanTwisters I just recently got two from Mike Bianco at Rose Gold's on Haight and did just a fantastic job. Great… https://t.co/sG7mXLTCvE,0
Tue Oct 17 21:42:54 +0000 2017,@IronmanPan Wait. Curly’s Gold... wasn’t that an Indiana Jones adventure?? 😉,0
Tue Oct 17 21:42:37 +0000 2017,Can't sleep!? Check out Blue Gold  a Sleep Story narrated by @stephenfry and written by @PhoebeRSmith! https://t.co/DKYDZj5j4x,4
Tue Oct 17 21:41:35 +0000 2017,As a #socialselling rep the "Whose Viewed my Profile" pg. on @LinkedIn is a GOLD Mine! @GoVengreso… https://t.co/UoArEPcnnV,5
Tue Oct 17 21:41:30 +0000 2017,The Pixel 2's camera is the new gold standard for Android photographers https://t.co/AKkC8l0Cff https://t.co/86fQaUiSWZ,6
Tue Oct 17 21:41:23 +0000 2017,Double Gold tasting tour starts today in San Francisco! With @CakebreadWines and many more @hawkerfareSF until 4pm!… https://t.co/wKc0w9xnlj,0
Tue Oct 17 21:41:10 +0000 2017,Analyst Places Bets On #Gold  And He’s Long https://t.co/95LxbcRmqn @kitconewsnow,2
Tue Oct 17 21:39:25 +0000 2017,#Gold Prices Below $1 300 On Renewed U.S. Dollar Strength  https://t.co/eUYfq9gdOn @kitconewsnow https://t.co/rSADAZy3UE,1
Tue Oct 17 21:37:21 +0000 2017,Sale...14K white flower daisy rose gold  coating 925 https://t.co/wYcoaHoJ7B via @Etsy,0
Tue Oct 17 21:36:33 +0000 2017,Our goal is simple. To assist you in acquiring Gold easily. Own a 999.99 24Karat Gold bullion! -… https://t.co/fbzOoRtKQq,0
Tue Oct 17 21:32:20 +0000 2017,Gold vs fiat vs crypto https://t.co/ZRd1yBTKkT https://t.co/SBlKSvsxsr,3
Tue Oct 17 21:30:02 +0000 2017,As a #socialselling rep the "Whose Viewed my Profile" pg. on @LinkedIn is a GOLD Mine! @GoVengreso… https://t.co/UoArEPcnnV,5
Tue Oct 17 21:29:42 +0000 2017,@_MaybeMel I just had a room of 500 people in this conference polled  Rold Gold* overwhelmingggg favorite,0
Tue Oct 17 21:27:27 +0000 2017,Nothing says authenticity like playing with a gold basketball while wearing a down vest. https://t.co/beHtizy9pC,1
Tue Oct 17 21:26:17 +0000 2017,Inside the Offshore Vault Where Gold Trades for Bitcoin https://t.co/4zLJ8TkMfB,0
Tue Oct 17 21:26:08 +0000 2017,FOXNEWS 2:24pm Gold  Silver  and IRA Transfer Kits. EROSLANDCAPI'IAL'com ROD—61O-2OO“,0
Tue Oct 17 21:21:28 +0000 2017,From this Bay Area team that reps the Blue &amp; Gold to another  good luck @Warriors on the season opener tonight! #DubNation #WarriorsGround,1
Tue Oct 17 21:16:35 +0000 2017,There’s bags of gold then there’s bags of bullshit,2
Tue Oct 17 21:15:33 +0000 2017,One of our featured winners pouring at the 2017 Double Gold tour is Sas Stewart  co-founder of  @Stonecutter_VT  Sp… https://t.co/A3sXMoqTuj,0
Tue Oct 17 21:11:45 +0000 2017,Global Gold Bullion is making gold ownership a possibility for everyone- https://t.co/9JYqUAxhpo https://t.co/NDwUIsDVa7,0
Tue Oct 17 21:05:17 +0000 2017,A Global Business that Changing the Future of Making Money by Bringing Gold to the Masses- https://t.co/9JYqUAxhpo https://t.co/1oDhV4nN04,0
Tue Oct 17 21:05:12 +0000 2017,If everyone knew the real value of GOLD  why is it that most people don't invest on it? - https://t.co/9JYqUAxhpo https://t.co/KTMLAHTaVI,0
Tue Oct 17 20:49:00 +0000 2017,This is one of the loveliest pieces I've read in a long time https://t.co/I8357zaKLN,0
Tue Oct 17 20:48:20 +0000 2017,Nothing says authenticity like playing with a gold basketball while wearing a down vest. https://t.co/beHtizy9pC,1
Tue Oct 17 20:44:11 +0000 2017,Karatbars provides the opportunity to buy gold &amp; hedge against inflation- https://t.co/9JYqUAxhpo https://t.co/Y6elYiHSU3,0
Tue Oct 17 20:39:10 +0000 2017,Psychic flapper and her scramble-powered grifter with a heart of gold friend Fake A Relationship only to Catch Feelings.,0
Tue Oct 17 20:37:08 +0000 2017,Even w/o hearing you can see Fincher directed Mindhunter pilot. His signature palette: heavy shadow  earthen gold … https://t.co/05fzHS54TT,0
Tue Oct 17 20:31:25 +0000 2017,Stars violently collide  forging gold and platinum #whatyoumissed https://t.co/3dN13Lkt6K https://t.co/3lg4W3fRdT,0
Tue Oct 17 20:19:46 +0000 2017,The Pixel 2's camera is the new gold standard for Android photographers https://t.co/RaacB6Qwfw https://t.co/Bdil3b8nbE,14
Tue Oct 17 20:14:21 +0000 2017,♬ Handsome Family - Gold ♬ https://t.co/fzgP9IRt2h #nowplaying,0
Tue Oct 17 20:11:45 +0000 2017,Global Gold Bullion is making gold ownership a possibility for everyone- https://t.co/9JYqUAxhpo https://t.co/rWN9ep80au,0
Tue Oct 17 20:11:22 +0000 2017,#BosparPR takes the gold -- twice! #BulldogAwards @BulldogReporter https://t.co/wIjwViHwcK https://t.co/cpaCaMwokV,9
Tue Oct 17 20:05:41 +0000 2017,@nellybrother lmao. There’s some gold in here. “I asked you to be my rave bae and you said yes.”,0
Tue Oct 17 20:05:19 +0000 2017,Pewter  brass  silver  gold. These are a few of my favorite things.,0
Tue Oct 17 20:03:58 +0000 2017,@Stevosaur more prestigious than "Gold Award" (highest GSA equiv.). Also GSA activities were tamer versions of what… https://t.co/uyBZ5xeBje,0
Tue Oct 17 19:57:33 +0000 2017,LOLOL the responses are pure gold https://t.co/uEHHSFaeMq,0
Tue Oct 17 19:51:29 +0000 2017,Centre taking steps to formalise gold trade  says Arun Jaitley  https://t.co/S3REXeOiN4,0
Tue Oct 17 19:51:14 +0000 2017,Gold vs fiat vs crypto https://t.co/ZRd1yBTKkT https://t.co/SBlKSvsxsr,3
Tue Oct 17 19:51:06 +0000 2017,The Pixel 2's camera is the new gold standard for Android photographers https://t.co/AKkC8l0Cff https://t.co/86fQaUiSWZ,6
Tue Oct 17 19:48:05 +0000 2017,Astronomers strike cosmic gold - literally. interesting article and interview https://t.co/apGZaMGQzc,1
