Mon Sep 11 23:56:44 +0000 2017,Gold chrome Maserati  https://t.co/Fn70GGAbZr,1
Mon Sep 11 23:55:09 +0000 2017,Karatbars is an amazing opportunity that makes buying gold affordable and accessable to all- https://t.co/9JYqUAxhpo https://t.co/0yp9ln1G73,0
Mon Sep 11 23:52:26 +0000 2017,Authorities: Gold miners at a bar bragged about slaughtering members of a reclusive Brazilian tribe https://t.co/qv51XHBLF8,0
Mon Sep 11 23:45:05 +0000 2017,Karatbars provides the opportunity to buy gold &amp; hedge against inflation- https://t.co/9JYqUAxhpo https://t.co/E4NA9gINke,0
Mon Sep 11 23:41:06 +0000 2017,#gold #bell #cycling #biking #bicycle accessory #messenger #courier #fashion #design #copenhagen… https://t.co/Fo8CNCHR4h,0
Mon Sep 11 23:24:09 +0000 2017,AI Software LLC Achieves #Microsoft #Gold Partnership for #ApplicationDevelopment https://t.co/X1hvpBOYNt… https://t.co/FsgqY7BTCy,1
Mon Sep 11 23:24:07 +0000 2017,Tragic and evil: Authorities: Gold miners at a bar bragged about slaughtering members of a reclusive Brazilian tribe https://t.co/ppn3lHCJhM,0
Mon Sep 11 23:23:51 +0000 2017,US Treasury Building's Green Investment Pays Off in LEED-Gold Rating | GreenBiz https://t.co/4CZx1Ztpdn,2
Mon Sep 11 23:23:13 +0000 2017,US Treasury Building's Green Investment Pays Off in LEED-Gold Rating | GreenBiz https://t.co/4CZx1Ztpdn,2
Mon Sep 11 23:23:04 +0000 2017,US Treasury Building's Green Investment Pays Off in LEED-Gold Rating | GreenBiz https://t.co/4CZx1Ztpdn,2
Mon Sep 11 23:20:47 +0000 2017,Proud to be the 1 924th backer on @BackerKit for Kickstarter Gold: Good Night ... | Thx @TimbuktuMag! https://t.co/rr1umSHfVA,1
Mon Sep 11 23:15:26 +0000 2017,Uncontacted tribe allegedly massacred by gold miners in Brazil https://t.co/3NuOelZolG via @HuffPost,0
Mon Sep 11 23:10:52 +0000 2017,I wanna curl my hair &amp; put some gold accessories in it 😍🤔,0
Mon Sep 11 23:02:13 +0000 2017,If everyone knew the real value of GOLD  why is it that most people don't invest on it? - https://t.co/9JYqUAxhpo https://t.co/ytdzteDXvX,0
Mon Sep 11 23:01:34 +0000 2017,How can Outreach transform the way you sell? Learn more from our customer @Builtio's experience! https://t.co/0xCxTOG8LE,3
Mon Sep 11 22:48:21 +0000 2017,"We all suffer together." Uh no you suffer in your bathtub full of gold you stupid prick #fuckdonaldtrump,2
Mon Sep 11 22:40:21 +0000 2017,Two Miami men convicted of laundering billions in Amazon gold https://t.co/q1kYvvx9Hi https://t.co/bFlhYevXOl,23
Mon Sep 11 22:37:21 +0000 2017,Video / screen share roll out is going well so we're bumping another 10% to a total of 40%.  Refresh your app and check if you got it!,1282
Mon Sep 11 22:33:43 +0000 2017,HORRIFYING | Uncontacted #Amazon tribe members reportedly massacred by gold miners in Brazil:… https://t.co/zTgQYSo8Tu,10
Mon Sep 11 22:31:36 +0000 2017,Authorities: Gold miners at a bar bragged about slaughtering members of a reclusive Brazilian tribe  https://t.co/axuucQQIiU,0
Mon Sep 11 22:30:09 +0000 2017,Oluce Atollo 238/OR #Tischleuchte in GOLD - #Design Vico #Magistretti https://t.co/fIboDFnfyR,0
Mon Sep 11 22:25:18 +0000 2017,@kashmeouside @jaykack King! Your body is worth rubies and gold!,0
Mon Sep 11 22:23:22 +0000 2017,Figure out who you are. Figure out what you are selling. Own it. Be it. And watch people appreciate you for it https://t.co/Yw1MU81hVK,1
Mon Sep 11 22:19:02 +0000 2017,3:18pm The Roses - Eternal Summers - Gold And Stone(Kanine),0
