Fri Oct 13 23:57:27 +0000 2017,"Meet me in Wyrmrest Accord with 1k gold and an open mind",1
Fri Oct 13 23:55:16 +0000 2017,Karatbars is an amazing opportunity that makes buying gold affordable and accessable to all- https://t.co/9JYqUAxhpo https://t.co/DoG0p62kmN,0
Fri Oct 13 23:47:08 +0000 2017,@angelpingz @YouTube i love her  please #boycottNFL fuck those terrorists #Blacklivesmatter terrorists SHE HAS MORE… https://t.co/4b12EtKsqx,0
Fri Oct 13 23:45:11 +0000 2017,Karatbars provides the opportunity to buy gold &amp; hedge against inflation- https://t.co/9JYqUAxhpo https://t.co/MqQXKW0YfS,0
Fri Oct 13 23:41:06 +0000 2017,@saintdank @mr_mocaine When "the dress" came out I was the only 1 out of 4 roommates who saw white/gold &amp;cried bc I… https://t.co/D8gvH47QWg,0
Fri Oct 13 23:21:07 +0000 2017,With a brushed-gold finish and slightly wavy weave  our Antonia Rolling Cart lends effortless… https://t.co/bKVML31Icj,1
Fri Oct 13 23:16:12 +0000 2017,Velvet Red  Black and Gold Patchwork Jacket. #KheGreen #Ethica by KheGreen  https://t.co/01zSBuoVOA via @Etsy,0
Fri Oct 13 23:10:16 +0000 2017,Global Gold Bullion is making gold ownership a possibility for everyone- https://t.co/9JYqUAxhpo https://t.co/OqQKIQdV4x,0
Fri Oct 13 23:09:18 +0000 2017,@emcgillivray @allisonveronica @Suzi_Quzi86 #incrediblewoman #4: @katiemccauley_ - heart of gold / cares deeply abo… https://t.co/fnZunk18JR,0
Fri Oct 13 23:06:08 +0000 2017,If you see these BUY them. You've struck Halloween GOLD. #raedunn #hocuspocus #halloween @tjmaxx https://t.co/8hJ4PIu5s2,0
Fri Oct 13 23:03:03 +0000 2017,If everyone knew the real value of GOLD  why is it that most people don't invest on it? - https://t.co/9JYqUAxhpo https://t.co/GhAmSk9h2b,0
Fri Oct 13 22:46:27 +0000 2017,@sarahcpr The replies are gold.,0
Fri Oct 13 22:44:22 +0000 2017,bullion = gold or silver valued by weight bouillon = broth #editing #spelling,0
Fri Oct 13 22:40:24 +0000 2017,How to Acquire the Highest Grade 999.9 GOLD BULLION in the World- https://t.co/9JYqUAxhpo https://t.co/Zg9YmuKvjV,0
Fri Oct 13 22:30:03 +0000 2017,Serving all the #fannypack goodness! Who doesn't love a little #fanny lol 😍 #wearitowt #handmade #handbags #leather #metallic #gold,0
Fri Oct 13 22:27:44 +0000 2017,@halibls Lol make sure you cop me a gold one.,1
Fri Oct 13 22:23:20 +0000 2017,Want to build a career as a #Filmmaker? Better understand markets  they can be gold mines. This workshop can help.… https://t.co/ipd6jqYq4c,2
Fri Oct 13 22:20:19 +0000 2017,Gold &amp; Silver Circle Induction Luncheon tickets are still available! Purchase here: https://t.co/3owcUdnI9f https://t.co/IPFnzbuOW3,0
Fri Oct 13 22:20:13 +0000 2017,@JustinList Nukes aren't happening go buy some gold too while you're at it.,0
Fri Oct 13 22:18:11 +0000 2017,Happy  hardworking  Hand &amp; Lock students! What a pleasure it has been to host @handandlocklondon for Tambour  Gold…… https://t.co/kPnoqzd1eq,1
Fri Oct 13 22:14:48 +0000 2017,@halibls Lol make sure you cop me a gold one.,1
Fri Oct 13 22:10:46 +0000 2017,https://t.co/gQQeKfmF1l A Gold Mine in Your Heart (1939)  Gene Autry  Autry  Marvin  Rose: Hillbilly,0
Fri Oct 13 22:10:26 +0000 2017,I wanna live good  so shit I sell dope. For a four finger ring  and one of them gold ropes. https://t.co/JDw6z4SmvD,0
Fri Oct 13 22:10:17 +0000 2017,Global Gold Bullion is making gold ownership a possibility for everyone- https://t.co/9JYqUAxhpo https://t.co/wc7QhvhpJH,0
Fri Oct 13 22:08:09 +0000 2017,If these photos were taken a half-second later they'd be entirely unspectacular. Instead  they're internet gold. https://t.co/vsTltbDCL5,0
Fri Oct 13 22:05:09 +0000 2017,Want to build a career as a #Filmmaker? Better understand markets  they can be gold mines. This workshop can help.… https://t.co/ipd6jqYq4c,2
Fri Oct 13 22:01:59 +0000 2017,@tenthpinMC about managing a #medicaldevice. Will we have #IoT connected devices which use fractional usage billing?https://t.co/na0eBhbdR6,1
Fri Oct 13 22:01:58 +0000 2017,@tenthpinMC about managing a #medicaldevice. Will we have #IoT connected devices which use fractional usage billing?https://t.co/na0eBhbdR6,1
Fri Oct 13 21:55:39 +0000 2017,Kirkland Lake Gold Ltd. (KL: null) | S&amp;P Dow Jones Indices Announces Changes to the S&amp;P/TSX Canadian Indices https://t.co/UYQO7SvAjL,0
Fri Oct 13 21:50:14 +0000 2017,I would rather die than see @NBowman53 in a uniform that isn't red and gold. DIE. @49ers @JohnLynch49ers,8
Fri Oct 13 21:43:34 +0000 2017,After the Gold Rush -- is #domaining on the decline? https://t.co/vAVR9GUvMT via @thedomains https://t.co/NDjLSHhV4Z,2
Fri Oct 13 21:43:08 +0000 2017,Plus Size Vintage JUDY HORNBY COUTURE Black and Gold Hand Painted Animal Print Chiffon Mermaid… https://t.co/6oaeV9FkPj,0
Fri Oct 13 21:42:41 +0000 2017,Brand New! Fashion-foward Hand-Hammered Gold Cuff Bracelet https://t.co/lJnfflYcq1 https://t.co/uilL3vj0rC,0
Fri Oct 13 21:35:10 +0000 2017,Our goal is simple. To assist you in acquiring Gold easily. Own a 999.99 24Karat Gold bullion! -… https://t.co/8cv6BhX8EX,0
Fri Oct 13 21:28:10 +0000 2017,Gold’s Gym expands to digital fitness with music-driven coaching app https://t.co/nEgSwVkPAG,0
Fri Oct 13 21:21:30 +0000 2017,Whoa - this jewelry store in the small Missouri town I grew up in updates this sign daily with the prices of gold … https://t.co/tNwMVnSolf,420
Fri Oct 13 21:20:25 +0000 2017,.@camillewhiting shares Mom Life Hack GOLD: 12 Tips to Survive a Toddler Outing! AD: https://t.co/7oZcv7ck7u… https://t.co/kCG378kkSt,0
Fri Oct 13 21:11:19 +0000 2017,Global Gold Bullion is making gold ownership a possibility for everyone- https://t.co/9JYqUAxhpo https://t.co/N7p16YricF,0
Fri Oct 13 21:06:03 +0000 2017,I CAN'T WAIT! ✨ https://t.co/NTcFiy6pXf,223
Fri Oct 13 21:02:56 +0000 2017,A Global Business that Changing the Future of Making Money by Bringing Gold to the Masses- https://t.co/9JYqUAxhpo https://t.co/L0i6ziQZpl,0
Fri Oct 13 21:02:53 +0000 2017,If everyone knew the real value of GOLD  why is it that most people don't invest on it? - https://t.co/9JYqUAxhpo https://t.co/SqqONGCCe3,0
Fri Oct 13 21:02:32 +0000 2017,https://t.co/9JYqUAxhpo- Our goal is simple. To assist you in acquiring Gold easily. https://t.co/OlJsTFffSa,0
Fri Oct 13 20:55:37 +0000 2017,Core Gold Inc. (CGLDF: OTCQX International) | CORE GOLD announces Closing of oversubscribed Private Placement https://t.co/DOjcnsGwdy,1
Fri Oct 13 20:49:53 +0000 2017,salute @NBowman53. going miss you in the red and gold.,0
Fri Oct 13 20:48:39 +0000 2017,Just Listed Chic #GURHAN “Jordan” 24K Gold Hammered Vermeil Oval Drop Earrings https://t.co/f58zRYSz6f https://t.co/CCSp5Ewik2,0
Fri Oct 13 20:44:11 +0000 2017,Karatbars provides the opportunity to buy gold &amp; hedge against inflation- https://t.co/9JYqUAxhpo https://t.co/yPHbKSvqxs,0
Fri Oct 13 20:30:29 +0000 2017,Damn! Not BOWMAN! 😥 ... Gonna miss seeing you in red &amp; gold @NBowman53! Good luck!,0
Fri Oct 13 20:28:54 +0000 2017,@akayjay you gotta keep the gold in a vault somewhere,0
Fri Oct 13 20:26:40 +0000 2017,Whoa - this jewelry store in the small Missouri town I grew up in updates this sign daily with the prices of gold … https://t.co/tNwMVnSolf,420
Fri Oct 13 20:25:20 +0000 2017,MX Gold Corp. (MXLGF: OTC Pink Current) | MX Gold signs LOI to Acquire Cryptocurrency/Blockchain Mining Company… https://t.co/MWeoK9s9Tc,0
Fri Oct 13 20:21:54 +0000 2017,Bleed Blue &amp; Gold.  #GoBears https://t.co/5ICqebRQLN,19
Fri Oct 13 20:15:57 +0000 2017,I like how eating fried chicken at the gold club is my new Friday lunch routine.,0
Fri Oct 13 20:10:29 +0000 2017,Global Gold Bullion is making gold ownership a possibility for everyone- https://t.co/9JYqUAxhpo https://t.co/R8bCQQ8N5e,0
Fri Oct 13 20:10:12 +0000 2017,Going Gold on Gameday https://t.co/naJAXjxDc5,45
Fri Oct 13 20:07:00 +0000 2017,When you see other brands still charge over $200 for a cashmere sweater even though global cashmere prices went dow… https://t.co/BBbuC2Ccd5,5
Fri Oct 13 20:06:54 +0000 2017,I would rather die than see @NBowman53 in a uniform that isn't red and gold. DIE. @49ers @JohnLynch49ers,8
Fri Oct 13 20:06:12 +0000 2017,strange week in #gold.  $30 pop in bullion no surprise.  But miners being flat to down was...,0
Fri Oct 13 20:01:49 +0000 2017,@Twonius Yeah the gold bugs are not any better.,0
Fri Oct 13 20:01:06 +0000 2017,Sibanye Gold Limited $SBGL could lower your stock returns. Scores only a 3 via Piotroski's F-Score… https://t.co/7RNjgJi3sA,0
Fri Oct 13 19:48:33 +0000 2017,@StarrKingGTU yes  “religious freedom” is a gold-plated license to discriminate.  that’s what religion’s all about.,0
Fri Oct 13 19:47:14 +0000 2017,I would rather die than see @NBowman53 in a uniform that isn't red and gold. DIE. @49ers @JohnLynch49ers,8
Fri Oct 13 19:42:29 +0000 2017,Included in our online Fall sale  20% off any order over $50 with code { FALL } Bear Head Gold Crown Canister.... https://t.co/coVtgxJ3BL,0
Fri Oct 13 19:33:59 +0000 2017,@valiantarmor That mindset is pure Gold.  ✊️,0
Fri Oct 13 19:30:49 +0000 2017,Someone should give me the money to put on a Give Your Money To Women convention. Speakers will be an array of gold digging heroes.,17
Fri Oct 13 19:28:47 +0000 2017,I would rather die than see @NBowman53 in a uniform that isn't red and gold. DIE. @49ers @JohnLynch49ers,8
Fri Oct 13 19:27:10 +0000 2017,I only buy gold in china town. 22k . Only built for cuban links. https://t.co/OywNgsNr41,1
Fri Oct 13 19:25:53 +0000 2017,I would rather die than see @NBowman53 in a uniform that isn't red and gold. DIE. @49ers @JohnLynch49ers,8
Fri Oct 13 19:23:31 +0000 2017,I only buy gold in china town. 22k . Only built for cuban links. https://t.co/OywNgsNr41,1
Fri Oct 13 19:23:14 +0000 2017,I would rather die than see @NBowman53 in a uniform that isn't red and gold. DIE. @49ers @JohnLynch49ers,8
Fri Oct 13 19:18:24 +0000 2017,sf49ers​.com &gt;&gt; Meet the 2017 Gold Rush Squad: Areli and Sarah https://t.co/AhlbTtPr6O,0
Fri Oct 13 19:17:36 +0000 2017,This new @Hersheys bar sounds too good to be true! https://t.co/KxjYMPKt6X,1
Fri Oct 13 19:16:40 +0000 2017,This new @Hersheys bar sounds too good to be true! https://t.co/KxjYMPKt6X,1
Fri Oct 13 19:12:41 +0000 2017,@Zyper Gold fish,0
Fri Oct 13 19:12:05 +0000 2017,Global gold prices set for first weekly gain in five weeks  https://t.co/ayAAptQLRp,0
Fri Oct 13 19:10:33 +0000 2017,OMG ... the comments are gold. #ArtistOfTheYear https://t.co/VPWxghV52S,0
Fri Oct 13 19:06:50 +0000 2017,Our goal is simple. To assist you in acquiring Gold easily. Own a 999.99 24Karat Gold bullion! -… https://t.co/EEPH1VQxk3,0
Fri Oct 13 19:06:07 +0000 2017,Time to order your last meal: #Alameda's Gold Coast Bistro and Bar closes Oct 15 after a 25 year run https://t.co/c6eTx2qSOW,0
Fri Oct 13 19:04:05 +0000 2017,That’ll make Montana  Craig  Lott  Rathman and Rice of 49ers greats who won’t retire in Red and Gold https://t.co/bqyC0oMCHq,0
Fri Oct 13 19:02:02 +0000 2017,I would rather die than see @NBowman53 in a uniform that isn't red and gold. DIE. @49ers @JohnLynch49ers,8
Fri Oct 13 19:01:14 +0000 2017,Cool Fold Formed Rose Gold-Tone Leaf Earrings Presented by #Etsy #Handmade #Copper https://t.co/79L7Ym47Ok https://t.co/5PaMu5gFnc,0
Fri Oct 13 19:00:31 +0000 2017,I would rather die than see @NBowman53 in a uniform that isn't red and gold. DIE. @49ers @JohnLynch49ers,8
Fri Oct 13 18:59:42 +0000 2017,FRI 10/13   Brick &amp; Mortar Music Hall presents:  NVO  Spyn Reset  Gold Minor 9:00 pm PDT (Doors: 8:00 pm)  Ages... https://t.co/VuUEOxc04x,0
Fri Oct 13 18:58:39 +0000 2017,I would rather die than see @NBowman53 in a uniform that isn't red and gold. DIE. @49ers @JohnLynch49ers,8
Fri Oct 13 18:57:11 +0000 2017,Top Hammered Rose Gold-tone Tear Drop Earring Showcased on #JohnSBrana #TearDropEarrings #Copper… https://t.co/yC5WtwRrad,0
Fri Oct 13 18:53:13 +0000 2017,go dumb dawg  I'm hyphy got my white tee and my stunnas on gold ones in  I can't go wrong.,0
Fri Oct 13 18:48:35 +0000 2017,SCB's Sheyla Conforte and Brian Romanelli discuss the design inspiration for The Sinclair  Chicago Gold Coast's... https://t.co/KrL4ZQ78FP,0
Fri Oct 13 18:33:53 +0000 2017,Not that different than USD off gold standard + the way the federal reserve works... https://t.co/mQD5dDrL65,0
Fri Oct 13 18:29:34 +0000 2017,Luxury Gold  Insight Vacations unveil their latest collections of escorted journeys https://t.co/Nqn0tMnibr #luxurytravel #travelgeniereg …,0
Fri Oct 13 18:25:32 +0000 2017,Bleed Blue &amp; Gold.  #GoBears https://t.co/5ICqebRQLN,19
Fri Oct 13 18:21:44 +0000 2017,After the Gold Rush -- is #domaining on the decline? https://t.co/vAVR9GUvMT via @thedomains https://t.co/NDjLSHhV4Z,2
Fri Oct 13 18:14:54 +0000 2017,Gold prices fall on muted demand  silver slides more  https://t.co/Gwt4PzwU87,0
Fri Oct 13 18:11:29 +0000 2017,Global Gold Bullion is making gold ownership a possibility for everyone- https://t.co/9JYqUAxhpo https://t.co/8Vsh3NHvWx,0
Fri Oct 13 18:06:53 +0000 2017,@JaredHuffman @NateGartrell @ICEgov cannot be trusted. This is a gold mine for them.,1
Fri Oct 13 18:06:24 +0000 2017,A Global Business that Changing the Future of Making Money by Bringing Gold to the Masses- https://t.co/9JYqUAxhpo https://t.co/edHeSaw9ow,0
Fri Oct 13 18:06:02 +0000 2017,How the returns of stocks  bonds  oil  &amp; gold have reacted to surprises from 3 macro forces: https://t.co/xUkl0mObLQ https://t.co/KulGiBvP9r,0
Fri Oct 13 18:06:00 +0000 2017,https://t.co/9JYqUAxhpo- Our goal is simple. To assist you in acquiring Gold easily. https://t.co/8erIVVaVlZ,0
Fri Oct 13 18:05:56 +0000 2017,Wait till like 4Am when I knew Reggae Gold was over,0
Fri Oct 13 18:05:20 +0000 2017,@ToeKnee2GX lmfaoo be up waiting for that call right after Reggae Gold let out at 4 am,0
Fri Oct 13 18:02:42 +0000 2017,@x0rz @theAJSingleton Gold is still crazy high after &gt;10years. When I bought gold it was $234/oz. Never went down.,0
Fri Oct 13 18:01:33 +0000 2017,The surprising story of Gold Rush-era #baseball for the #worldseries https://t.co/lxgxbxXqLQ #history,1
Fri Oct 13 17:54:14 +0000 2017,Karatbars provides the opportunity to buy gold &amp; hedge against inflation- https://t.co/9JYqUAxhpo https://t.co/ioHr6s8CqO,0
Fri Oct 13 17:49:30 +0000 2017,Attention-getting Twisted Rose Gold-Tone Cable Earrings Highlighted on #Etsy #Accessories #Copper… https://t.co/nxbMXmaAym,3
Fri Oct 13 17:49:03 +0000 2017,ߎ砥1$s by @TheTemptations1 on @PandoraMusic https://t.co/DYcPBWEXRH https://t.co/qf6ZfnRHlm,0
Fri Oct 13 17:47:16 +0000 2017,Bleed Blue &amp; Gold.  #GoBears https://t.co/5ICqebRQLN,19
Fri Oct 13 17:45:59 +0000 2017,Bleed Blue &amp; Gold.  #GoBears https://t.co/5ICqebRQLN,19
Fri Oct 13 17:42:28 +0000 2017,Reposting @weskusbokkie: Nitida Matriarch 🍾🏆🥂👌 @nitidawine @amorim_za @tajcapetown #nitida #Matriarch #beautiful… https://t.co/wOJMb7uhax,1
Fri Oct 13 17:42:08 +0000 2017,How to Acquire the Highest Grade 999.9 GOLD BULLION in the World- https://t.co/9JYqUAxhpo https://t.co/gDPfEUuDff,0
Fri Oct 13 17:33:40 +0000 2017,Whoa - this jewelry store in the small Missouri town I grew up in updates this sign daily with the prices of gold … https://t.co/tNwMVnSolf,420
Fri Oct 13 17:31:06 +0000 2017,Awesome Twisted Rose Gold-Tone Cable Earrings Listed by #Etsy #Accessories #7thAnniversary https://t.co/KDVJLHUQLp https://t.co/gdilt1z9zE,0
Fri Oct 13 17:26:53 +0000 2017,@ghost4rmafrica @rudeboypsquare Any amount you could..just like someone buying gold.. 1BTC is around $5700 now,0
Fri Oct 13 17:23:09 +0000 2017,@CarlBeijer @isikbreen @MattBruenig @tehzachatak @PplPolicyProj my preferred visualization is a "scroogeplot"  whic… https://t.co/0kJtm7BemO,0
Fri Oct 13 17:22:36 +0000 2017,Gold bullion: Cleared  reported trading in [London] exceeded $6.2 trillion last year. https://t.co/P9b0az0FHp via @BW,0
Fri Oct 13 17:08:46 +0000 2017,If everyone knew the real value of GOLD  why is it that most people don't invest on it? - https://t.co/9JYqUAxhpo https://t.co/DPRSKYzx4s,0
Fri Oct 13 17:08:04 +0000 2017,Reposting @weskusbokkie: Nitida Matriarch 🍾🏆🥂👌 @nitidawine @amorim_za @tajcapetown #nitida #Matriarch #beautiful… https://t.co/wOJMb7uhax,1
Fri Oct 13 17:04:49 +0000 2017,Gold! https://t.co/GzfvlzzHal,0
Fri Oct 13 16:57:30 +0000 2017,@JakeHurst69 @TuolumneHoney Gold. Gives a grander appearance  also more on point with honey color. Looks luxurious.,0
Fri Oct 13 16:53:50 +0000 2017,Thrilled to have @CyberArk  @AquaSecTeam  @accenture  @AvanadeInc as Gold Sponsors at #DockerCon EU! We're counting… https://t.co/BjC00r2iON,3
Fri Oct 13 16:51:55 +0000 2017,Check out @iamOliviaNoelle's new track "Made of Gold" featured on @FlauntMagazine! 💕 https://t.co/kBAik6NzAE,4
Fri Oct 13 16:48:33 +0000 2017,Lookin' good in gold! https://t.co/i6eEEfMYqL,0
Fri Oct 13 16:48:26 +0000 2017,After the Gold Rush -- is #domaining on the decline? https://t.co/vAVR9GUvMT via @thedomains https://t.co/NDjLSHhV4Z,2
Fri Oct 13 16:47:35 +0000 2017,@dcapodice @quraishi @avoidboringme I'm not really worried about that. Unless the folks behind Morocco have secret… https://t.co/jk5VhPFfYG,0
Fri Oct 13 16:41:11 +0000 2017,My flag red  green  and gold. Ion kno bout the rest of y'all,0
Fri Oct 13 16:38:43 +0000 2017,Ringling grads’ ‘In a Heartbeat’ gets gold at Student Academy Awards – Sarasota Herald-Tribune https://t.co/tdCvaT0dHL,0
Fri Oct 13 16:35:14 +0000 2017,Our goal is simple. To assist you in acquiring Gold easily. Own a 999.99 24Karat Gold bullion! -… https://t.co/Lr0FyjZ0nM,0
Fri Oct 13 16:31:08 +0000 2017,New! Bark Copper Cuff Bracelet  Rose Gold Womens Bracelets  Wide Copper Cuff  Statement Copper Cuff  Copper Brace… https://t.co/K7RbnaQpCO,0
Fri Oct 13 16:30:38 +0000 2017,A gold-flecked red-tailed black cockatoo  just 1 in a series of charismatic portraits by Leila Jeffreys:… https://t.co/nY31ADDcfa,13
Fri Oct 13 16:29:43 +0000 2017,@StockCats cc @OldTakesExposed #gold,0
Fri Oct 13 16:28:41 +0000 2017,If you think your account should be verified – let us know! Check out our article to learn what it takes to apply. https://t.co/J8MUNCC5bg,4684
Fri Oct 13 16:27:04 +0000 2017,!! My book has a UK home in badass feminist press @ViragoBooks &amp; editor @ailahahmed 🔮✨ Their site text SAYS IT ALL.… https://t.co/nGkvmlPPnh,2
Fri Oct 13 16:25:21 +0000 2017,The fate of our figurehead on the Blue and Gold Fleet’s Harbor Emperor remains in limbo https://t.co/p0tZd6YYxH,0
Fri Oct 13 16:24:10 +0000 2017,Thanks for the blue gold  @verified !,1
Fri Oct 13 16:19:54 +0000 2017,A gold-flecked red-tailed black cockatoo  just 1 in a series of charismatic portraits by Leila Jeffreys:… https://t.co/nY31ADDcfa,13
Fri Oct 13 16:07:29 +0000 2017,Style points coming in hot! Show your new avatar in WGT Golf Mobile on WGT Facebook &amp; you could win Gold MAX Balls:… https://t.co/7AayxqxaLA,1
Fri Oct 13 16:06:51 +0000 2017,the twelve gates were twelve pearls; every several gate was of one pearl: the street of the city was pure gold  as transparent glass.,0
Fri Oct 13 16:06:25 +0000 2017,A Global Business that Changing the Future of Making Money by Bringing Gold to the Masses- https://t.co/9JYqUAxhpo https://t.co/lGMxhiFnUT,0
Fri Oct 13 16:05:48 +0000 2017,Oxygen Not Included Oil update strikes black gold https://t.co/XDdeEXQbOU https://t.co/fTrtiJngIx,2
Fri Oct 13 16:04:17 +0000 2017,And the building of the wall of it was of jasper: and the city was pure gold  like unto clear glass. (Revelations 21:18),0
Fri Oct 13 16:00:42 +0000 2017,Style points coming in hot! Show your new avatar in WGT Golf Mobile on WGT Facebook &amp; you could win Gold MAX Balls:… https://t.co/7AayxqxaLA,1
Fri Oct 13 15:45:42 +0000 2017,A gold-flecked red-tailed black cockatoo  just 1 in a series of charismatic portraits by Leila Jeffreys:… https://t.co/nY31ADDcfa,13
Fri Oct 13 15:45:19 +0000 2017,Karatbars is an amazing opportunity that makes buying gold affordable and accessable to all- https://t.co/9JYqUAfG0O https://t.co/2hSzfZbQLM,0
Fri Oct 13 15:43:28 +0000 2017,29% OFF! Contemporary Hammered Rose Gold Tone Medium Tear Drop Earrings Featured on #Amazon #FreeShipping… https://t.co/dsvXuPkq07,2
Fri Oct 13 15:42:21 +0000 2017,@Highest_Tower @RamsNFL Y’all got rid of the gold horns?,0
Fri Oct 13 15:39:41 +0000 2017,@soccersource Yes and no. Remember how hard they were rolling thru the Gold Cup? Wheels fell off starting vs. Costa Rica.,0
Fri Oct 13 15:35:34 +0000 2017,Whoa - this jewelry store in the small Missouri town I grew up in updates this sign daily with the prices of gold … https://t.co/tNwMVnSolf,420
Fri Oct 13 15:32:47 +0000 2017,@JaredHuffman @NateGartrell @ICEgov cannot be trusted. This is a gold mine for them.,1
Fri Oct 13 15:26:28 +0000 2017,Gold tops $1 300  looks set for 1st weekly climb in 5 weeks: https://t.co/hHkCRqrCeR https://t.co/NDSgu3EICv,0
Fri Oct 13 15:20:50 +0000 2017,Bleed Blue &amp; Gold.  #GoBears https://t.co/5ICqebRQLN,19
Fri Oct 13 15:16:15 +0000 2017,The offset shop: Gold Standard offers one click access to carbon credits: Businesses and… https://t.co/SiRwrFsfFB,0
Fri Oct 13 15:09:06 +0000 2017,Someone should give me the money to put on a Give Your Money To Women convention. Speakers will be an array of gold digging heroes.,17
Fri Oct 13 15:08:32 +0000 2017,Oxygen Not Included Oil update strikes black gold https://t.co/XDdeEXQbOU https://t.co/fTrtiJngIx,2
Fri Oct 13 15:08:27 +0000 2017,sold another limited edition gold moon beauty; i’ll have another couple ready in the next week… https://t.co/rFs2rEEVnZ,0
Fri Oct 13 15:08:09 +0000 2017,Oxygen Not Included Oil update strikes black gold https://t.co/XDdeEXQbOU https://t.co/fTrtiJngIx,2
Fri Oct 13 15:04:51 +0000 2017,@funder Don't forget the giant cross on a gold chain around their necks. "Christian warriors"  blah blah blah...,0
Fri Oct 13 15:02:03 +0000 2017,#Gold clears key $1 300 line as consumer inflation reading misses mark https://t.co/MDmkOxqkzp @MarketWatch https://t.co/gGOhPmBpIz,0
Fri Oct 13 15:00:08 +0000 2017,Mr. Smith invested in 100 American Gold Eagle coins for his precious metals ira investment. Follow his journey: https://t.co/fjSBQlaQYl,0
Fri Oct 13 14:50:35 +0000 2017,A gold-flecked red-tailed black cockatoo  just 1 in a series of charismatic portraits by Leila Jeffreys:… https://t.co/nY31ADDcfa,13
Fri Oct 13 14:48:02 +0000 2017,The offset shop: Gold Standard offers one click access to carbon credits: Businesses and… https://t.co/oYUaGkz8qx,0
Fri Oct 13 14:47:55 +0000 2017,This EP by @CompuphonicMax is gold: https://t.co/0DI0ixNumI,0
Fri Oct 13 14:41:49 +0000 2017,Gold futures pushed above the key $1 300 level today after the latest reading on US inflation came in cooler than @ https://t.co/xdFkujyUtm,0
Fri Oct 13 14:37:33 +0000 2017,Whoa - this jewelry store in the small Missouri town I grew up in updates this sign daily with the prices of gold … https://t.co/tNwMVnSolf,420
Fri Oct 13 14:31:48 +0000 2017,“Not All That Glitters Is Gold  Don’t Be Deceived By Social Media”- Toyin Abraham https://t.co/VqT2UALIRX https://t.co/3Ds0Wlp4hw,0
Fri Oct 13 14:28:20 +0000 2017,How to Acquire the Highest Grade 999.9 GOLD BULLION in the World- https://t.co/9JYqUAxhpo https://t.co/vQQIe7vvip,0
Fri Oct 13 14:26:24 +0000 2017,Gold  silver trade trade in red on Friday morning  https://t.co/0vJmdrw13o,0
Fri Oct 13 14:25:15 +0000 2017,Karatbars is an amazing opportunity that makes buying gold affordable and accessable to all- https://t.co/9JYqUAxhpo https://t.co/Wa8qJmWFBV,0
Fri Oct 13 14:25:11 +0000 2017,Our goal is simple. To assist you in acquiring Gold easily. Own a 999.99 24Karat Gold bullion! -… https://t.co/1NeFSOww0h,0
Fri Oct 13 14:16:07 +0000 2017,Thrilled to have @CyberArk  @AquaSecTeam  @accenture  @AvanadeInc as Gold Sponsors at #DockerCon EU! We're counting… https://t.co/BjC00r2iON,3
Fri Oct 13 14:13:29 +0000 2017,Just Listed Eye-catching 10mm Wide Chased Nu Gold Cuff Bracelet Highlighted by #Amazon #FreeShipping… https://t.co/EpdHK4hDem,0
Fri Oct 13 14:10:23 +0000 2017,Karatbars provides the opportunity to buy gold &amp; hedge against inflation- https://t.co/9JYqUAxhpo https://t.co/KOc2XslcRd,0
Fri Oct 13 14:02:10 +0000 2017,If everyone knew the real value of GOLD  why is it that most people don't invest on it? - https://t.co/9JYqUAxhpo https://t.co/GANh45pekx,0
Fri Oct 13 13:25:50 +0000 2017,After the Gold Rush -- is #domaining on the decline? https://t.co/xrxxjzlpK9 via @thedomains https://t.co/rzj7krqgV7,0
Fri Oct 13 13:25:26 +0000 2017,MX Gold Corp. (MXLGF: OTC Pink Current) | MX Gold signs LOI to Acquire Cryptocurrency/Blockchain Mining Company… https://t.co/rHD2CfqeUi,0
Fri Oct 13 13:25:22 +0000 2017,Gold Reserve  Inc. (GDRZF: OTCQX International) | Gold Reserve Provides October Venezuela Update https://t.co/G0PccU5WTo,0
Fri Oct 13 13:05:15 +0000 2017,Someone should give me the money to put on a Give Your Money To Women convention. Speakers will be an array of gold digging heroes.,17
Fri Oct 13 13:01:11 +0000 2017,4 Misconceptions Cleared up by the Bitcoin Gold Team https://t.co/FPnEjRN5Oj,7
Fri Oct 13 12:50:10 +0000 2017,Our goal is simple. To assist you in acquiring Gold easily. Own a 999.99 24Karat Gold bullion! -… https://t.co/Rdsp7rcNFy,0
Fri Oct 13 12:15:15 +0000 2017,Karatbars is an amazing opportunity that makes buying gold affordable and accessable to all- https://t.co/9JYqUAxhpo https://t.co/UkUpFGsNbn,0
Fri Oct 13 12:03:24 +0000 2017,A gold-flecked red-tailed black cockatoo  just 1 in a series of charismatic portraits by Leila Jeffreys:… https://t.co/nY31ADDcfa,13
Fri Oct 13 12:01:47 +0000 2017,A Global Business that Changing the Future of Making Money by Bringing Gold to the Masses- https://t.co/9JYqUAxhpo https://t.co/62a9VaXJ4x,0
Fri Oct 13 11:56:10 +0000 2017,Karatbars provides the opportunity to buy gold &amp; hedge against inflation- https://t.co/9JYqUAxhpo https://t.co/lqtFk6cSu9,0
