Sun Oct 22 23:55:14 +0000 2017,Karatbars is an amazing opportunity that makes buying gold affordable and accessable to all- https://t.co/9JYqUAxhpo https://t.co/cMfCttxEpO,0
Sun Oct 22 23:52:49 +0000 2017,@LorenRaeDeJ @Victor_Cass @TheAtlantic my god  this is gold. gotta be the most traffic to victor's site since the "… https://t.co/60eQBQMD0t,0
Sun Oct 22 23:45:15 +0000 2017,Karatbars provides the opportunity to buy gold &amp; hedge against inflation- https://t.co/9JYqUAxhpo https://t.co/NhdgjxEGtQ,0
Sun Oct 22 23:43:35 +0000 2017,Visit Goldie👱‍♀️at the Prospector's Corner🏞️and try your luck with her gold pans.🍳#SundayFunday on… https://t.co/sh5EThPuaC,10
Sun Oct 22 23:42:14 +0000 2017,There is some solid (digital) gold in this thread https://t.co/JtQnP0QUMZ,1
Sun Oct 22 23:38:29 +0000 2017,There is some solid (digital) gold in this thread https://t.co/JtQnP0QUMZ,1
Sun Oct 22 23:33:30 +0000 2017,Visit Goldie👱‍♀️at the Prospector's Corner🏞️and try your luck with her gold pans.🍳#SundayFunday on… https://t.co/sh5EThPuaC,10
Sun Oct 22 23:10:24 +0000 2017,Global Gold Bullion is making gold ownership a possibility for everyone- https://t.co/9JYqUAxhpo https://t.co/wLyy9rCYqS,0
Sun Oct 22 23:08:12 +0000 2017,This is gold!  Liberal triggers....Oh how the snowflakes are so easily "Offended" nowadays haha  #Trump #MAGA… https://t.co/vwjL6J9XbD,1
Sun Oct 22 23:07:33 +0000 2017,presenter: “they’re replacing all the native grasses with gold mound lantana”  person in the crowd: “no!”… https://t.co/0in45ITTBK,0
Sun Oct 22 23:05:47 +0000 2017,Start sipping golden milk — it's liquid gold. https://t.co/VfxY5IP9mX,3
Sun Oct 22 23:04:02 +0000 2017,couples costume idea ❤️ https://t.co/xfVgRYtaZ9,22255
Sun Oct 22 23:02:51 +0000 2017,If everyone knew the real value of GOLD  why is it that most people don't invest on it? - https://t.co/9JYqUAxhpo https://t.co/j0JlZzKPXH,0
Sun Oct 22 23:01:33 +0000 2017,♬ Polished Chrome - Stay Gold ♬ https://t.co/uVq41i3Kx2 #nowplaying,0
Sun Oct 22 23:00:18 +0000 2017,Start sipping golden milk — it's liquid gold. https://t.co/VfxY5IP9mX,3
Sun Oct 22 22:58:03 +0000 2017,Start sipping golden milk — it's liquid gold. https://t.co/VfxY5IP9mX,3
Sun Oct 22 22:57:46 +0000 2017,@IHGService Sent you DM. This is the 2nd time this hotel has proved to be a dump. As an IHG Gold member  this prope… https://t.co/Dy4S9XjrMy,0
Sun Oct 22 22:56:44 +0000 2017,GOPs are smelting metal &amp; trying to change base metal into gold  because the billionaire kings wanted to be richer @ABCPolitics @FoxNews,0
Sun Oct 22 22:56:08 +0000 2017,GOPs are smelting metal &amp; trying to change base metal into gold  because the billionaire kings wanted to be richer @WhiteHouse  @CBSNews,0
Sun Oct 22 22:56:06 +0000 2017,Start sipping golden milk — it's liquid gold. https://t.co/VfxY5IP9mX,3
Sun Oct 22 22:50:32 +0000 2017,Awesome Twisted Rose Gold-Tone Cable Earrings Listed by #Etsy #Accessories #7thAnniversary https://t.co/KDVJLHUQLp https://t.co/gdilt1z9zE,2
Sun Oct 22 22:44:03 +0000 2017,Gold Market Update https://t.co/FUcygTAOrI,0
Sun Oct 22 22:40:27 +0000 2017,How to Acquire the Highest Grade 999.9 GOLD BULLION in the World- https://t.co/9JYqUAxhpo https://t.co/UgKVuCtezR,0
Sun Oct 22 22:37:19 +0000 2017,I just earned the 'Fields of Gold' badge on @untappd! https://t.co/rF5A5lWwd3,0
Sun Oct 22 22:33:43 +0000 2017,Sutro is playing Kanye West — Gold Digger — https://t.co/i4cRIeRhSs,0
Sun Oct 22 22:26:50 +0000 2017,Thanks to #CiviCRM partner and #CiviCon Canberra gold sponsor @agileware https://t.co/t1mSoiUUn1 for supporting AU'… https://t.co/1MnllxBUTQ,1
Sun Oct 22 22:25:08 +0000 2017,Unlike most modern #books  these rare #texts are decorated with #pearls  #diamonds  #sapphires and #emeralds. https://t.co/vCpWYLBdZG,8
Sun Oct 22 22:21:46 +0000 2017,Chic Chased Rose Gold-Tone Dangle Earrings Highlighted on #Etsy #Accessories #Copper https://t.co/r7pUJTxrg2 https://t.co/e2fRbPgMjz,1
Sun Oct 22 22:11:28 +0000 2017,Global Gold Bullion is making gold ownership a possibility for everyone- https://t.co/9JYqUAxhpo https://t.co/6RZXdAMBT5,0
Sun Oct 22 22:08:01 +0000 2017,Thanks to #CiviCRM partner and #CiviCon Canberra gold sponsor @agileware https://t.co/t1mSoiUUn1 for supporting AU'… https://t.co/1MnllxBUTQ,1
Sun Oct 22 22:07:31 +0000 2017,I made this little alter kit (it all fits inside the Tibetan gold box on the left)... It is based on many things t…… https://t.co/jUNL9H20rO,0
Sun Oct 22 22:01:48 +0000 2017,18 K Gold Solid bracelet  Part of set Stunning  so unique https://t.co/jduqR2NdB7 via @Etsy,0
Sun Oct 22 21:59:26 +0000 2017,Gargoyle with gold tooth 😬 https://t.co/XyBMbU4Ffx,1
Sun Oct 22 21:51:56 +0000 2017,@Expedia killing it! Almost 2 hours on hold!? And this is the gold members line! 😂😂 https://t.co/rFMgjLIQTq,0
Sun Oct 22 21:46:32 +0000 2017,This week's sponsors are Red Roses  Green Gold  Garcia's  and Dead &amp; Company!,0
Sun Oct 22 21:45:19 +0000 2017,NEW! Striking Hand-Chased Gold Tear Drop Earrings https://t.co/4x1kxti9jU https://t.co/qEkoBV7D5E,0
Sun Oct 22 21:39:46 +0000 2017,Gargoyle with gold tooth 😬 https://t.co/XyBMbU4Ffx,1
Sun Oct 22 21:36:20 +0000 2017,Our goal is simple. To assist you in acquiring Gold easily. Own a 999.99 24Karat Gold bullion! -… https://t.co/dKm3gCi3ye,0
Sun Oct 22 21:31:08 +0000 2017,Update on Bitcoin Gold: https://t.co/Nl6kCE7W7F,344
Sun Oct 22 21:28:48 +0000 2017,@s_riddling @CiraCorellia @FairlightEx @SnesTalks LETS GO MEGGGGGG WOOOOOOOOOOOO TAKE HOME THE GOLD BB LETS GOOOOOOOOOOOO,0
Sun Oct 22 21:21:00 +0000 2017,Treasure the love you receive above all. It will survive long after your gold and good health have vanished. - Og Mandino,0
Sun Oct 22 21:11:32 +0000 2017,Global Gold Bullion is making gold ownership a possibility for everyone- https://t.co/9JYqUAxhpo https://t.co/L7r3Mg7ONt,0
Sun Oct 22 21:04:43 +0000 2017,A Global Business that Changing the Future of Making Money by Bringing Gold to the Masses- https://t.co/9JYqUAxhpo https://t.co/TcLSoKKF4X,0
Sun Oct 22 21:04:38 +0000 2017,If everyone knew the real value of GOLD  why is it that most people don't invest on it? - https://t.co/9JYqUAxhpo https://t.co/UDR24DMOHU,0
Sun Oct 22 21:03:48 +0000 2017,https://t.co/9JYqUAxhpo- Our goal is simple. To assist you in acquiring Gold easily. https://t.co/yN6fkwEJZ8,0
Sun Oct 22 21:02:12 +0000 2017,Gold plated https://t.co/LwINaJOPXd,0
Sun Oct 22 20:58:53 +0000 2017,This new @Hersheys bar sounds too good to be true! https://t.co/KxjYMPKt6X,1
Sun Oct 22 20:54:14 +0000 2017,Update on Bitcoin Gold: https://t.co/Nl6kCE7W7F,344
Sun Oct 22 20:53:58 +0000 2017,Just listed...Lovely Victorian 9K rosy gold engraved band. US size 7.5. Beautiful leaf and scroll motif. 🍁🍂 Shop now!,0
Sun Oct 22 20:47:29 +0000 2017,@Starbucks I have tried to redeem my points and I’m a gold member - I feel sad that I wasn’t able to get my order b… https://t.co/p2PI7iun4m,0
Sun Oct 22 20:44:14 +0000 2017,Karatbars provides the opportunity to buy gold &amp; hedge against inflation- https://t.co/9JYqUAxhpo https://t.co/AvphQWl9dV,0
Sun Oct 22 20:36:44 +0000 2017,Pentagon Contradicts 45's  Gold✨Claims.Hadn't contacted all families. WH didn't have up-to-date list of the dead. https://t.co/x3OzADYR0R,16
Sun Oct 22 20:27:55 +0000 2017,White  pink &amp; gold watercolor baptism cake. #marleystreats #watercolorcake #customcake… https://t.co/NGKViDxVOJ,0
Sun Oct 22 20:19:01 +0000 2017,Thanks to @chatbox for being a Gold sponsor for SaaStr Annual ‘18! https://t.co/DthwPtZiRm https://t.co/wyIlgMETRC,0
Sun Oct 22 20:17:04 +0000 2017,playing video games after age 35 is a dumb waste of time but so is everything that isn't hoarding food  gold and weapons at this point,0
Sun Oct 22 20:15:08 +0000 2017,@SaucedoPro For me I love Horus's Egyptian themed gear  and the gold trim. Even his entrance gear coming out with t… https://t.co/Ed7Ua4x3Li,0
Sun Oct 22 20:10:26 +0000 2017,Global Gold Bullion is making gold ownership a possibility for everyone- https://t.co/9JYqUAxhpo https://t.co/VbHVTIU90o,0
Sun Oct 22 20:08:55 +0000 2017,SALE...925 Sterling Silver 14 K gold nature style with vines https://t.co/FnJPU1cal7 via @Etsy,0
Sun Oct 22 20:07:02 +0000 2017,@saurabhraajjain Wish u a very happy Tuesday my shona...u r innocence just looking at u one can know hw beautiful s… https://t.co/4PWjIsM77d,5
Sun Oct 22 19:52:59 +0000 2017,Update on Bitcoin Gold: https://t.co/Nl6kCE7W7F,344
Sun Oct 22 19:35:51 +0000 2017,ICYMI: Astronomers strike cosmic gold! https://t.co/HoZN7ZAYe4 #GravitationalWaves https://t.co/ZX5QHLcWXe,4
Sun Oct 22 19:33:13 +0000 2017,tfw I know the Opus Magnum solution but not prepared to program it without codegen  comments and source control (i.e. cheap gold p10n),0
Sun Oct 22 19:30:43 +0000 2017,More chic  less bones. Save up to 50% on our exclusive Black &amp; Gold Halloween Entertaining Collection.… https://t.co/seR6waAonP,1
Sun Oct 22 19:16:05 +0000 2017,This new @Hersheys bar sounds too good to be true! https://t.co/KxjYMPKt6X,1
Sun Oct 22 19:14:08 +0000 2017,Vintage Hand Embellished Beaded White Silver Gold Sweater https://t.co/InR88XP8JB via @Etsy,0
Sun Oct 22 19:13:50 +0000 2017,Have you heard ‘Love With A Hoe (Prod Che n Simonxgbeats)’ by Che on #SoundCloud? #np https://t.co/zuTglZVTK1,0
Sun Oct 22 19:06:38 +0000 2017,Our goal is simple. To assist you in acquiring Gold easily. Own a 999.99 24Karat Gold bullion! -… https://t.co/iMvrfTXGux,0
Sun Oct 22 19:04:54 +0000 2017,https://t.co/WJuB46iRqo https://t.co/HcS0rX8sxn,0
Sun Oct 22 19:04:11 +0000 2017,West Indian Wifey @ Reggae Gold XL https://t.co/nI6oW0CsJ0,0
Sun Oct 22 19:02:17 +0000 2017,Imma young nigga draped in gold I’m a dope nigga,0
Sun Oct 22 19:00:05 +0000 2017,More chic  less bones. Save up to 50% on our exclusive Black &amp; Gold Halloween Entertaining Collection.… https://t.co/seR6waAonP,1
Sun Oct 22 18:56:54 +0000 2017,@BeautyChickee u pay me gold too i appreciate it,0
Sun Oct 22 18:56:44 +0000 2017,@BeautyChickee wow u pay pam gold i’m proud,0
Sun Oct 22 18:52:10 +0000 2017,“I [wanted] to have that feeling...that ‘something bigger than you’ feeling” —@BrandiChastain  2 x Olympic gold medalist #USFCAalumni #USFCA,0
Sun Oct 22 18:51:00 +0000 2017,@ianbremmer It is because he’ll be living in Russia in a gold plated apartment,1
Sun Oct 22 18:49:26 +0000 2017,“I continue to be the best that I can be  because that fulfills me.” —@MJGold 13 x Olympic &amp; World Champ. gold medalist #USFCAalumni #USFCA,0
Sun Oct 22 18:39:38 +0000 2017,A gorgeous assortment of our gold ends from @piercerjohn! https://t.co/UmV8iaMHv6 https://t.co/eZrHq8L02c,0
Sun Oct 22 18:38:25 +0000 2017,I added a video to a @YouTube playlist https://t.co/3cfnV0opUD How to Make HEAVY 808 BASS in Ableton 9 Live | Compression for Grime,0
Sun Oct 22 18:34:05 +0000 2017,Turns out there is a real world reason #gold is valuable. #blockchain #explosions #neutronstar https://t.co/UiW5mnzazQ,0
Sun Oct 22 18:25:10 +0000 2017,@mozangeles31 @jacko2323 In search of gold?,0
Sun Oct 22 18:24:52 +0000 2017,https://t.co/zJ1nYly481 3 copies remain on gold splat variety. #Necrot https://t.co/DLvJXaxmPf,0
Sun Oct 22 18:12:32 +0000 2017,Global Gold Bullion is making gold ownership a possibility for everyone- https://t.co/9JYqUAxhpo https://t.co/reGSTZjZ8F,0
Sun Oct 22 18:11:13 +0000 2017,Environmental Engineer: Barrick Gold Corporation - Las Vegas  NV - Environmental  Civil… https://t.co/PbL84NROzh,0
Sun Oct 22 18:10:04 +0000 2017,@TheRickyDavila  https://t.co/IjMzgGY6Ex,50
Sun Oct 22 18:07:21 +0000 2017,Environmental Engineer: Barrick Gold Corporation - Las Vegas  NV - Environmental  Civil… https://t.co/qTFvDVjd9V,0
Sun Oct 22 18:06:38 +0000 2017,A Global Business that Changing the Future of Making Money by Bringing Gold to the Masses- https://t.co/9JYqUAxhpo https://t.co/J9KbTKnfR5,0
Sun Oct 22 18:05:07 +0000 2017,https://t.co/9JYqUAxhpo- Our goal is simple. To assist you in acquiring Gold easily. https://t.co/zdbLlxp3qo,0
Sun Oct 22 18:03:23 +0000 2017,@smokegood84 @PopeyesChicken I’ll go back my boyfriend be like it’s good NO IT’S NOT. I will walk to the drive thru… https://t.co/IcH7p5qyRa,0
Sun Oct 22 18:03:08 +0000 2017,@SiriusXMFantasy Bears D already at 28 points on ESPN in first half. IDP with Jackson is gold!,0
Sun Oct 22 18:00:49 +0000 2017,I have sparkly rose gold prosecco!  I'm in love.  #prosecco #glitter #rosegold #bubbles #sunday… https://t.co/WRH3RwXrGp,0
Sun Oct 22 17:54:14 +0000 2017,Karatbars provides the opportunity to buy gold &amp; hedge against inflation- https://t.co/9JYqUAxhpo https://t.co/5GcoUqhq3A,0
Sun Oct 22 17:48:40 +0000 2017,ICYMI: Astronomers strike cosmic gold! https://t.co/HoZN7ZAYe4 #GravitationalWaves https://t.co/ZX5QHLcWXe,4
Sun Oct 22 17:45:37 +0000 2017,ICYMI: #CRISPR-Gold fixes Duchenne muscular dystrophy mutation in mice https://t.co/hGrIoGX970 #InThisGen https://t.co/VTgb693H3V,11
Sun Oct 22 17:44:48 +0000 2017,ICYMI: Astronomers strike cosmic gold! https://t.co/HoZN7ZAYe4 #GravitationalWaves https://t.co/ZX5QHLcWXe,4
Sun Oct 22 17:42:50 +0000 2017,Update: We got a small grant to build this! Working on figuring out logistics to manage the team of people that hav… https://t.co/s7krre7JQ8,3103
Sun Oct 22 17:42:12 +0000 2017,How to Acquire the Highest Grade 999.9 GOLD BULLION in the World- https://t.co/9JYqUAxhpo https://t.co/bjJ0GqzFh0,0
Sun Oct 22 17:26:37 +0000 2017,ICYMI: Astronomers strike cosmic gold! https://t.co/HoZN7ZAYe4 #GravitationalWaves https://t.co/ZX5QHLcWXe,4
Sun Oct 22 17:20:20 +0000 2017,Smith gold family crest ring #Smith #FamilyCrest #CrestRing #Jewelry #Heraldry  https://t.co/ggvE7wtO0P https://t.co/V17TdFTpjA,0
Sun Oct 22 17:17:11 +0000 2017,This Nigga Had The ALL GOLD BLACK BERYY! I’m Done🐐🐐🐐 https://t.co/TDzFn8uZFP,0
