Wed Jan 31 21:16:59 +0000 2018,We've released our video Mission Statement! (Watch it here: https://t.co/Me1jERQai7) Small steps on a long journey.… https://t.co/kNX9qKmYhY,1
Wed Jan 31 20:59:33 +0000 2018,We've released our video Mission Statement! (Watch it here: https://t.co/Me1jERQai7) Small steps on a long journey.… https://t.co/kNX9qKmYhY,1
Wed Jan 31 17:55:58 +0000 2018,I believe in cryptocurrency as a platform (mostly BTC but also ETH) rather than cryptocurrency as point solution (X… https://t.co/V05uqFo3ov,0
Wed Jan 31 16:09:45 +0000 2018,What are your TRX holdings?  I continue to instill trust in the @Tronfoundation and all that it provides. Many repu… https://t.co/fsliWxoCyp,3
Wed Jan 31 12:34:13 +0000 2018,What are your TRX holdings?  I continue to instill trust in the @Tronfoundation and all that it provides. Many repu… https://t.co/fsliWxoCyp,3
Wed Jan 31 11:47:11 +0000 2018,What are your TRX holdings?  I continue to instill trust in the @Tronfoundation and all that it provides. Many repu… https://t.co/fsliWxoCyp,3
Wed Jan 31 11:22:39 +0000 2018,What are your TRX holdings?  I continue to instill trust in the @Tronfoundation and all that it provides. Many repu… https://t.co/fsliWxoCyp,3
Wed Jan 31 01:08:01 +0000 2018,Still unabashedly trying to buy friends! 10 000 GOS giveaway on Friday! Follow and retweet for your entry!… https://t.co/hHAqoYQgRl,5
Wed Jan 31 00:32:58 +0000 2018,Retweet for a chance at 10 000 GOS! Gossamer is celebrating its upcoming exchange listing. Will announce winner nex… https://t.co/WrWPkqyjua,2
