Mon Sep 18 23:56:52 +0000 2017,Vintage Micro Mosaic Pill Box Tiny Floral Mosaic Gold Tone https://t.co/xSUxlUngrY via @Etsy,0
Mon Sep 18 23:53:23 +0000 2017,gOLD https://t.co/fz3zS9T3R0,0
Mon Sep 18 23:52:40 +0000 2017,#Silver  Manipulation and the Paper Market. Is it Still A Rock-Solid Investment?  https://t.co/0a5lbhqp9j   #gold… https://t.co/uCm2YRiWQU,0
Mon Sep 18 23:52:10 +0000 2017,If I didn't already invest my net worth into Glenn Beck branded gold bars I would be soooo into this https://t.co/MgRusfTVA7,2
Mon Sep 18 23:42:35 +0000 2017,Congrats to our Thaddus Carr Dredgeoperations in Coraopolis  PA  on their Environmental Excellence Gold Award! https://t.co/ELIxxzw0iE,2
Mon Sep 18 23:42:27 +0000 2017,If she grabs your chain and says that she likes it  A. She really do and she's complimenting you or B. Fuckin gold digger,0
Mon Sep 18 23:42:16 +0000 2017,@kf what computer is that? I have a rose gold MacBook 💜,0
Mon Sep 18 23:35:28 +0000 2017,Gold Orchid Flower Bridal Earrings Matte Gold Long Pearl Drops Swarovski… https://t.co/oIEOf2FyjJ #etsymntt #jetteam https://t.co/gyg4mGyRUE,1
Mon Sep 18 23:30:18 +0000 2017,Our very first meeting will be next Thursday the 28th. Room 292 during gold lunch.,0
Mon Sep 18 23:28:18 +0000 2017,@gold_lilies @ktstutz @CewshReviews Mr. And Mrs. Smith but with humor and comedy of errors-esque shenanigans instea… https://t.co/upx3yoYQ4I,0
Mon Sep 18 23:26:39 +0000 2017,If life has treated you like trash and you still make an effort to be a good person  I appreciate you.   thank you,5615
Mon Sep 18 23:26:01 +0000 2017,You are loud as fuck  heart of gold  butter chicken babe &lt;3,0
Mon Sep 18 23:23:22 +0000 2017,if #bitcoin reaches the same market cap as gold (~$7T) it could hit $333K per coin.   Some people think this is true.  Do you?,0
Mon Sep 18 23:17:04 +0000 2017,wow i need olive lipstick now https://t.co/rP342UV0V5,60
Mon Sep 18 23:13:18 +0000 2017,@gold_lilies @ktstutz @CewshReviews we are all biding our time...,0
Mon Sep 18 23:09:39 +0000 2017,Females think everything a nigga say is lies but when he say that pussy good y'all believe dat wit da quickness 💀💀 https://t.co/qRJ9jw6ckG,10832
Mon Sep 18 23:05:56 +0000 2017,$771 Trillion Worth Of Gold Lies Hidden In The Ocean: Good Luck Getting It https://t.co/4RrmyPbdAb,0
Mon Sep 18 23:04:30 +0000 2017,Lord you know where I'm going  you know where I'm headed  I may be trying to find you  but I'm coming out pure gold. 🎶😌,0
Mon Sep 18 23:02:45 +0000 2017,If I didn't already invest my net worth into Glenn Beck branded gold bars I would be soooo into this https://t.co/MgRusfTVA7,2
Mon Sep 18 23:01:24 +0000 2017,Gold and Silver Stumble Ends – Special Edition   https://t.co/PpfJYcE9t4  #gold #PaperGold #dollar #silver https://t.co/A3IqpqTPn7,0
Mon Sep 18 22:52:35 +0000 2017,The gold rose. My heart. 😭 https://t.co/aD0XKJaOcU,0
Mon Sep 18 22:50:31 +0000 2017,Oak Lawn Band &amp; Black Gold  on parade!,0
Mon Sep 18 22:45:49 +0000 2017,@mariiahpapaya Rose gold. Do Rose gold,0
Mon Sep 18 22:39:25 +0000 2017,Season of #Conspiracy and Economics  https://t.co/hOuF6zTsL7  #TrilateralCommission #right-wing #gold https://t.co/ZcJJWt7bG4,0
Mon Sep 18 22:22:47 +0000 2017,If gold and silver were such a great investment  why are they so anxious to sell it every five minutes?,1
Mon Sep 18 22:21:48 +0000 2017,If gold and silver were such a great investment  why are they so anxious to sell it every five minutes?,1
Mon Sep 18 22:20:24 +0000 2017,Okay I'm going to sleep. I love bts. This album is gold. Goodnight.,1
Mon Sep 18 22:17:09 +0000 2017,Gold Orchid Flower Bridal Earrings Matte Gold Long Pearl Drops Swarovski… https://t.co/oIEOf2FyjJ #jetteam #etsymntt https://t.co/kNrBF6NnJB,10
Mon Sep 18 21:51:29 +0000 2017,A girl who's not friendly,0
Mon Sep 18 21:45:12 +0000 2017,"The Air Jordan XIII has been recreated with winter-inspired colorways: Golden Harvest and Elemental Gold. While... https://t.co/M4fkVI2daB,1
Mon Sep 18 21:44:51 +0000 2017,@IssaRae  you looked beautiful last night at the #EmmyAwards2017 you'll still be walking /gold this yr I know it #actorgoals #Blerd,0
Mon Sep 18 21:41:20 +0000 2017,"The Air Jordan XIII has been recreated with winter-inspired colorways: Golden Harvest and Elemental Gold. While... https://t.co/M4fkVI2daB,1
Mon Sep 18 21:32:15 +0000 2017,You should be embarrassed by your decision to get a gold Cadillac,0
Mon Sep 18 21:30:41 +0000 2017,@SenJohnMcCain W/o your gold-plated Senator or VA types of healthcare  under #GrahamCassidy  ur premium jumps &gt; 100… https://t.co/NyYcMacDXp,0
Mon Sep 18 21:24:50 +0000 2017,Congrats to our Thaddus Carr Dredgeoperations in Coraopolis  PA  on their Environmental Excellence Gold Award! https://t.co/ELIxxzw0iE,2
Mon Sep 18 21:15:02 +0000 2017,I need to cop some Vapor Maxes  some Royals  and the Gold Air Max '97s.,0
Mon Sep 18 21:13:53 +0000 2017,Vintage Gold Tone Floral Design Made In Japan Musical Jewelry https://t.co/WLmCYIecjv via @Etsy,0
Mon Sep 18 21:00:19 +0000 2017,If you are not reigning on this trial period on earth  how you think you can possibly reign with streets of gold?,0
Mon Sep 18 20:50:57 +0000 2017,OK  I guess Gary gets his Spurs  without the Spur Ride.  I can't tell if they are gold or silver though. https://t.co/4NwpX13FLh,0
Mon Sep 18 20:49:43 +0000 2017,Multi Strand Pearl Necklace  Gold Pearl Necklace  Ammonite Fossil Nautil… https://t.co/logUweZYB7 #jetteam #etsymntt https://t.co/j2LA4ISSp9,13
Mon Sep 18 20:42:20 +0000 2017,@mrsvaccaro Did you see DT's comment.  Asked about Jerry he said he could bring Mr. B his gold jacket!,1
Mon Sep 18 20:35:26 +0000 2017,Single Pearl on Gold Chain Bridesmaids Gift Sets Cranberry Red Drop Neck… https://t.co/2Ha3wnTpoR #jetteam #etsymntt https://t.co/k1n7JgcRh7,0
Mon Sep 18 20:34:18 +0000 2017,Speer .357 Sig 125gr Gold Dot Gel Test and Review https://t.co/iJAHUmBalu https://t.co/WhBHYYRG2A,0
Mon Sep 18 20:33:17 +0000 2017,Oh nothing I did will determine this. So stand down on gold from me.   For now. https://t.co/mEF91QRmbD,0
Mon Sep 18 20:33:11 +0000 2017,Gold Orchid Flower Bridal Earrings Matte Gold Long Pearl Drops Swarovski… https://t.co/oIEOf2FyjJ #jetteam #etsymntt https://t.co/kNrBF6NnJB,10
Mon Sep 18 20:32:46 +0000 2017,'80s excess Texas style https://t.co/bfbY9bSNuk,2
Mon Sep 18 20:30:09 +0000 2017,Happy Birthday @dbaker_theAPE !! Hope your day is good! If you ain't gold you ain't cold 😈💪🏾,1
Mon Sep 18 20:24:03 +0000 2017,This 18k White Gold Namaste Collection from @ScottKay offers a delicate solitaire design that reflects eternal bond… https://t.co/v6l1xZFKFg,0
Mon Sep 18 20:02:57 +0000 2017,@mychelle73 Receive from God.  After you have suffered a while  you come forth as gold.  Just glean.  Let's eat.,0
Mon Sep 18 19:56:07 +0000 2017,Congrats to our Thaddus Carr Dredgeoperations in Coraopolis  PA  on their Environmental Excellence Gold Award! https://t.co/ELIxxzw0iE,2
Mon Sep 18 19:49:00 +0000 2017,@SFerika A3b: Fb groups  Quora and Blog Comments are a gold mine too for coming up with topics 😎,0
Mon Sep 18 19:47:48 +0000 2017,Jeryl: yo no bebo  Comedy gold,1
Mon Sep 18 19:46:07 +0000 2017,Multi Strand Pearl Necklace  Gold Pearl Necklace  Ammonite Fossil Nautil… https://t.co/logUweZYB7 #jetteam #etsymntt https://t.co/j2LA4ISSp9,13
Mon Sep 18 19:35:57 +0000 2017,This season will be Gold #GoGoldenState https://t.co/4bQ3IVV9Lw,0
Mon Sep 18 19:33:09 +0000 2017,Multi Strand Pearl Necklace  Gold Pearl Necklace  Ammonite Fossil Nautil… https://t.co/logUweZYB7 #jetteam #etsymntt https://t.co/j2LA4ISSp9,13
Mon Sep 18 19:33:09 +0000 2017,Multi Strand Pearl Necklace  Gold Pearl Necklace  Ammonite Fossil Nautil… https://t.co/logUweZYB7 #jetteam #etsymntt https://t.co/j2LA4ISSp9,13
Mon Sep 18 19:33:08 +0000 2017,Multi Strand Pearl Necklace  Gold Pearl Necklace  Ammonite Fossil Nautil… https://t.co/logUweZYB7 #jetteam #etsymntt https://t.co/j2LA4ISSp9,13
Mon Sep 18 19:33:07 +0000 2017,Multi Strand Pearl Necklace  Gold Pearl Necklace  Ammonite Fossil Nautil… https://t.co/logUweZYB7 #jetteam #etsymntt https://t.co/j2LA4ISSp9,13
Mon Sep 18 19:32:54 +0000 2017,Need to bleach my hair again. Thinking of dying it rose gold.,0
Mon Sep 18 19:26:21 +0000 2017,Revealed: The Social Agents of Monetary Mayhem  #FederalReserveSystem #IncomeTax #dollar #gold… https://t.co/1N627Xtpnp,0
Mon Sep 18 19:20:15 +0000 2017,Happy Birthday @dbaker_theAPE !! Hope your day is good! If you ain't gold you ain't cold 😈💪🏾,1
Mon Sep 18 19:17:56 +0000 2017,I've heard about a place Not made by any man Gates of pearl  streets of gold Where the rescued love to dance… https://t.co/N7PdvDHYma,0
Mon Sep 18 19:13:08 +0000 2017,@kennedymayes_ You're gold,0
Mon Sep 18 19:06:27 +0000 2017,Printable Please Sign A Leaf Tree 8x10 Black and Gold Wedding Alternative Guest Book Sign #etsy #wedding… https://t.co/ibNrQnTxir,0
Mon Sep 18 19:05:32 +0000 2017,A beautiful white ceramic with gold trim small boy with seashell planter. Makes any seashell soap look amazing!… https://t.co/b6ikOdjTQz,0
Mon Sep 18 18:58:26 +0000 2017,Vintage HANDPAINTED W Ross 1957 Purple Clematis Porcelain Gold CANDY DISH #ebay https://t.co/n0OXw4Kw2e https://t.co/v0EpZguM8j,0
Mon Sep 18 18:56:00 +0000 2017,the bluetooth cut out on my phone and for a second everyone at the gym heard me listening to the Charlotte's Web audiobook,196
Mon Sep 18 18:51:48 +0000 2017,Watch this fantastic gold foil stencil reveal!  Artisan Enhancements Leaf &amp; Foil Size  Metallic Foil and a... https://t.co/aRW4MeObFg,1
Mon Sep 18 18:42:37 +0000 2017,And here is the Oak Lawn Band along with Black Gold Winterguard at the 2017 Dallas Pride Parade!! https://t.co/VkHmfIXaZL,1
Mon Sep 18 18:32:09 +0000 2017,Atlanta is gold. Donald Glover hit gold,0
Mon Sep 18 18:21:45 +0000 2017,I want a relationship where no matter how much we fight  you're not going anywhere at the end of the day. 💯,4794
Mon Sep 18 18:05:12 +0000 2017,'80s excess Texas style https://t.co/bfbY9bSNuk,2
Mon Sep 18 17:56:29 +0000 2017,Gorgeous TAHARI Black &amp; Gold Brocade Formal Cocktail Sleeveless TOP 12  https://t.co/ClmUs9i0UG https://t.co/XGjNMcZNWy,0
Mon Sep 18 17:48:52 +0000 2017,outta everything this gave my ass baby fever https://t.co/sm9kCB791h,16032
Mon Sep 18 17:45:18 +0000 2017,@KrisIsGross Last call gold,0
Mon Sep 18 17:31:45 +0000 2017,If I'm about you. I AM ABOUT YOU . PERIOD,21931
Mon Sep 18 17:31:20 +0000 2017,burned 394 calories doing 99 minutes of Zumba Gold followed by Chair Pilates #myfitnesspal,0
Mon Sep 18 17:23:35 +0000 2017,@ParsleyCarleton No kidding. Sometimes don't know why I spent $40k on white gold tiara for myself. Sure  I look fab… https://t.co/jnpcO8BpS9,0
Mon Sep 18 17:21:13 +0000 2017,Gold and Silver Plunge Ends  https://t.co/qReHJVLKbB   #gold #silver #dollar  #FederalReserve https://t.co/9IHto99sXZ,0
Mon Sep 18 17:16:44 +0000 2017,That loyalty more valuable than gold,4
Mon Sep 18 17:16:20 +0000 2017,Federal Reserve System's War on Honest Money  https://t.co/Z8qRob0pJj   #interestrate #FederalReserve #Gold… https://t.co/Io4cy3Vx4O,0
Mon Sep 18 17:15:18 +0000 2017,Gold Tone Squirrel Teal Czech Glass Bead Clip On Earrings: Jewelry https://t.co/JJE8aR25cL #delightjewelry… https://t.co/xcJUlvpH49,0
Mon Sep 18 17:12:14 +0000 2017,Multi Strand Pearl Necklace  Gold Pearl Necklace  Ammonite Fossil Nautil… https://t.co/logUweZYB7 #jetteam #etsymntt https://t.co/j2LA4ISSp9,13
Mon Sep 18 17:05:27 +0000 2017,Season of #Conspiracy and Economics  https://t.co/hOuF6zTsL7  #TrilateralCommission #right-wing #gold https://t.co/XTHS6PhY8Y,1
Mon Sep 18 17:02:57 +0000 2017,My pre-interview jam &lt;3 @CHVRCHES - Make Them Gold https://t.co/xrqb6CYGut via @YouTube,0
Mon Sep 18 17:01:42 +0000 2017,If I'm about you. I AM ABOUT YOU . PERIOD,21931
Mon Sep 18 17:01:14 +0000 2017,Multi Strand Pearl Necklace  Gold Pearl Necklace  Ammonite Fossil Nautil… https://t.co/logUweZYB7 #jetteam #etsymntt https://t.co/j2LA4ISSp9,13
Mon Sep 18 16:51:37 +0000 2017,BISTEC A LO POBRE https://t.co/s01WeeZLCN,0
Mon Sep 18 16:49:14 +0000 2017,Coral  cream and gold! Beautiful! Contact us today for amazing color options! How daring will… https://t.co/LfTxgIThGJ,0
Mon Sep 18 16:44:37 +0000 2017,Most Investors Won’t Be Buying Gold &amp; Silver until AFTER Big Gains Occur https://t.co/XFT8b39m5R https://t.co/BCQ1B0H2cO,0
Mon Sep 18 16:36:24 +0000 2017,#Repost thegoodnerremedy ・・・ Beauty by Earth Argan Oil is liquid gold. People will be asking you… https://t.co/wBJS6eoyv4,0
Mon Sep 18 16:35:28 +0000 2017,Multi Strand Pearl Necklace  Gold Pearl Necklace  Ammonite Fossil Nautil… https://t.co/logUweZYB7 #jetteam #etsymntt https://t.co/j2LA4ISSp9,13
Mon Sep 18 16:29:36 +0000 2017,@CPark0912 @jeffomski Gold. https://t.co/M9KR9WDxMF,0
Mon Sep 18 16:14:50 +0000 2017,Ah @LoniLove with the spare ribs joke is gold 👌👌👌 @TheRealDaytime #girlchat,0
Mon Sep 18 15:57:36 +0000 2017,THE PROGRESSION 😩😍🙌🏾 https://t.co/bh0mWB3VF1,54801
Mon Sep 18 15:48:58 +0000 2017,@_YonJohnsonBIL Lmaooo yes indeed   thanks to your page 😌 that sweet gold peak,0
Mon Sep 18 15:30:54 +0000 2017,NewsOneEnt&gt; ‘Rooting For Everybody Black:’ Issa Rae’s Reply To Emmys Reporter’s Question Is Gold https://t.co/qVWSmewcwE,0
Mon Sep 18 15:25:53 +0000 2017,For all you fine fashion jewelry lovers  here ya go! Grab one of these 14K gold &amp; diamond necklace for only $750!… https://t.co/wQpCJZppFX,0
Mon Sep 18 15:23:43 +0000 2017,Apparently drunk me does NOT like gold diggers.. https://t.co/oUMo3lHu2e,0
Mon Sep 18 15:19:28 +0000 2017,Watching a found footage horror movie  this one is about 3 documentarians looking for the dutch gold mine entrance.,0
Mon Sep 18 15:16:53 +0000 2017,Uncontacted Amazon tribe members 'killed then chopped up by gold miners'  https://t.co/SwEkbFaSzT,0
Mon Sep 18 15:16:34 +0000 2017,Authorities: Gold miners at a bar bragged about slaughtering members of a reclusive Brazilian tribe https://t.co/pJm0yh1AiE,0
Mon Sep 18 15:16:23 +0000 2017,'Uncontacted' Amazonian tribe allegedly massacred by gold prospectors in Brazil   https://t.co/VKTatAIzh2,0
Mon Sep 18 15:14:36 +0000 2017,Foo Fighters presenta en Barcelona los temas de su último disco  'Concrete and Gold' https://t.co/kpt9p2JjUs #Cultura,0
Mon Sep 18 15:11:57 +0000 2017,@J_Roll_It_Up How dud you get zeke   dez   donald   n von gold cards to power up ?,0
Mon Sep 18 15:10:59 +0000 2017,Surprised to see so many women swing between 'compliments' and derogatory remarks! Not speaking is gold!,0
Mon Sep 18 15:04:41 +0000 2017,I wanna dip that ass in gold,4
Mon Sep 18 14:59:47 +0000 2017,Dillon Gage's Walter Pehowich in today's #WSJ #PreciousMetals column. Article here:  https://t.co/0HK7xunLaz,0
Mon Sep 18 14:55:21 +0000 2017,Did you know that #BITCOIN rose over 1000 USD per coin in only 1 month? It's the new Gold! #DigitalCurrency… https://t.co/9IMj0lPoE5,0
Mon Sep 18 14:52:34 +0000 2017,#Silver  Manipulation and the Paper Market. Is it Still A Rock-Solid Investment?  https://t.co/0a5lbhqp9j   #gold… https://t.co/kBIaMXd0AK,0
Mon Sep 18 14:35:28 +0000 2017,Gold Orchid Flower Bridal Earrings Matte Gold Long Pearl Drops Swarovski… https://t.co/oIEOf2FyjJ #jetteam #etsymntt https://t.co/kNrBF6NnJB,10
Mon Sep 18 14:15:21 +0000 2017,I had no idea my dog was a super hero https://t.co/ubb3TpuEcS,66
Mon Sep 18 14:11:41 +0000 2017,I wanna dip that ass in gold,4
Mon Sep 18 14:09:50 +0000 2017,I wanna dip that ass in gold,4
Mon Sep 18 14:08:45 +0000 2017,#PreciousMetals only Palladium trending up this a.m.: #Gold @ $1312.60  #Silver @$17.37  #Platinum @$966.50 … https://t.co/htUikZZQ41,0
Mon Sep 18 14:04:19 +0000 2017,I wanna dip that ass in gold,4
Mon Sep 18 14:03:18 +0000 2017,Can anyone tell me if @MarcusScribner and @LenaWaithe we're wearing the same tux last night? Loving the gold and black! #DCPublicSchools,0
Mon Sep 18 14:02:28 +0000 2017,Gold and Silver Stumble Ends – Special Edition   https://t.co/PpfJYcE9t4  #gold #PaperGold #dollar #silver https://t.co/ojfp97l3f4,0
Mon Sep 18 14:01:44 +0000 2017,#Conspiracy : New World Money – One World Government Video   #IMF #gold #dollar #SDR  https://t.co/4kyjLMFGMj,0
Mon Sep 18 13:59:00 +0000 2017,I wanna dip that ass in gold,4
Mon Sep 18 13:47:54 +0000 2017,Good new stuff from Foo Fighters #NowPlaying Concrete and Gold by Foo Fighters https://t.co/yMyDL09sy3,0
Mon Sep 18 13:45:50 +0000 2017,@RealJack @blackjweston I've never seen a gold ball hurt dough.... she's already dimpled,0
Mon Sep 18 13:44:44 +0000 2017,@michaelirvin88 Mike I love the Cowboys. Dez Bryant is not you. You went against the best and would always win.  You earned that Gold jacket,0
Mon Sep 18 13:39:47 +0000 2017,💛 https://t.co/A2D8JEOr88,0
Mon Sep 18 13:39:28 +0000 2017,Season of #Conspiracy and Economics  https://t.co/hOuF6zTsL7  #TrilateralCommission #right-wing #gold https://t.co/XTHS6PhY8Y,1
Mon Sep 18 13:38:54 +0000 2017,@mrsvaccaro Did you see DT's comment.  Asked about Jerry he said he could bring Mr. B his gold jacket!,1
Mon Sep 18 13:38:41 +0000 2017,I added a video to a @YouTube playlist https://t.co/gpiheeBVQ1 2 🐃 BUFFALO GOLD HANDPAYS!!! 💰💰 @ River Rock and Graton,0
Mon Sep 18 13:38:16 +0000 2017,I added a video to a @YouTube playlist https://t.co/raVOqjhiIb ★MY BEST WIN★ BUFFALO GOLD slot machine HUGE BONUS WIN!,0
Mon Sep 18 13:29:53 +0000 2017,put some gold lil hoops in my ear or nose,0
Mon Sep 18 13:25:59 +0000 2017,A thread of me snatching edges. 1. Texas Tech 90s Cypher https://t.co/uQP3MpwRZC,14076
Mon Sep 18 13:17:22 +0000 2017,There's $771 Trillion worth of Gold in the ocean .... y'all lets rally some money together for the sake of getting piss drunk rich,0
Mon Sep 18 13:13:32 +0000 2017,@hwilliams35 @Jagricol This is gold.,0
Mon Sep 18 13:04:43 +0000 2017,"In the Amazon  a Catastrophic Gold Rush Looms" by CHRIS FELICIANO ARNOLD via NYT https://t.co/KD05ToJrZh #Catholic,0
Mon Sep 18 12:52:29 +0000 2017,Gorgeous ST JOHN Black Knit GOLD Sequin PAILLETTE Tank Shell S M #deals #ebay   https://t.co/x7CDr0ycrr https://t.co/KxUgQvL9Nv,3
Mon Sep 18 12:49:26 +0000 2017,Gorgeous ST JOHN Black Knit GOLD Sequin PAILLETTE Tank Shell S M #deals #ebay   https://t.co/x7CDr0ycrr https://t.co/KxUgQvL9Nv,3
Mon Sep 18 12:32:03 +0000 2017,Kevin Hart made a family-friendly mobile game - Kevin Hart cultivates a brand of relentless positivity. The com... https://t.co/VPokQkrmx1,0
Mon Sep 18 11:29:17 +0000 2017,.@TracesCA has announced his debut EP 'Heart of Gold' will be out Oct. 10 on @dinealonemusic &gt;&gt; https://t.co/zAv5WCcGjS,0
Mon Sep 18 10:59:56 +0000 2017,Black Sapphire and Diamond Ring in 18 Karat Two Tone Gold | https://t.co/v0xqSIvprj https://t.co/bWXydhTtqr https://t.co/7igfQoQfqX,6
Mon Sep 18 10:53:20 +0000 2017,Okay I'm going to sleep. I love bts. This album is gold. Goodnight.,1
Mon Sep 18 10:49:12 +0000 2017,Will the Fed Eventually Cause a Global Economic Collapse?  https://t.co/nOkjgn0oTE   #TheFed  #TheElite #Economic C… https://t.co/sLja5zp45U,0
Mon Sep 18 10:47:07 +0000 2017,TIP OF THE DAY; God is with you &amp; everything is going to be alright. Don't give up  keep pushing you'll be walking into your blessings soon✨,19012
Mon Sep 18 09:38:19 +0000 2017,This album is gOLD,0
Mon Sep 18 09:25:49 +0000 2017,Like I loved it  it was comedic gold but I'm also just really salty.,0
Mon Sep 18 09:03:14 +0000 2017,Money Tree  Gold and One World Money  https://t.co/SSDuK8PTUn  #gold #SDR #OneWorldMoney #savings https://t.co/peIaSAdf3i,0
Mon Sep 18 08:29:14 +0000 2017,Beautiful tattoo portrait of Malcolm X done by local female artist and owner of Gold Dust Tattoos &amp; Fine Art  ... https://t.co/NnMOuqIr9u,0
Mon Sep 18 08:21:37 +0000 2017,AmTrav a2b Platform Wins Gold Magellan Award for 2017 - Markets Insider  AmTrav a2b Platform Wins Gold Magellan Aw… https://t.co/8Uq7lKKXWu,0
Mon Sep 18 08:16:23 +0000 2017,Federal Reserve System's War on Honest Money  https://t.co/Z8qRob0pJj   #interestrate #FederalReserve #Gold… https://t.co/9hAv9zaLUl,0
Mon Sep 18 07:35:04 +0000 2017,Gold Peak Tea Or Honest Leaf Tea Just $0.75 At CVS!  https://t.co/gkweMWLVMV https://t.co/12TVX4lBll,0
Mon Sep 18 07:04:22 +0000 2017,If we date I'll take you to Mexico in December,1094
Mon Sep 18 06:50:07 +0000 2017,To Jesus you're more valuable than Gold. God wouldn't have created you if He didn't value you,0
Mon Sep 18 06:39:22 +0000 2017,Single Pearl on Gold Chain Bridesmaids Gift Sets Montana Blue Drop Neckl… https://t.co/1lvVBh0clM #jetteam #etsymntt https://t.co/9rNY0nj7Ag,1
Mon Sep 18 06:35:26 +0000 2017,Single Pearl on Gold Chain Bridesmaids Gift Sets Montana Blue Drop Neckl… https://t.co/1lvVBh0clM #jetteam #etsymntt https://t.co/9rNY0nj7Ag,1
Mon Sep 18 06:13:21 +0000 2017,@BeautyChickee payed me gold  then started drowning my sorry ass in dust  wow  I'm sad,0
Mon Sep 18 06:11:45 +0000 2017,While the US slept  Maile &amp; Emma sparkled in Japan! Congrats!  #Repost @flogymnastics Maile O'Keefe earned gold tod… https://t.co/jxWiU17ZQd,28
Mon Sep 18 05:52:31 +0000 2017,#Silver  Manipulation and the Paper Market. Is it Still A Rock-Solid Investment?  https://t.co/0a5lbhqp9j   #gold… https://t.co/HXJ50GE8hE,0
Mon Sep 18 05:14:47 +0000 2017,While the US slept  Maile &amp; Emma sparkled in Japan! Congrats!  #Repost @flogymnastics Maile O'Keefe earned gold tod… https://t.co/jxWiU17ZQd,28
Mon Sep 18 05:02:02 +0000 2017,@BeautyChickee THANK YOU FOR PAYING ME GOLD  YOU JUST MADE ME ACTUALLY HAPPY  NOT WHERE I PRETEND IM HAPPY W A SMILE 😭,0
Mon Sep 18 05:01:48 +0000 2017,Gold and Silver Stumble Ends – Special Edition   https://t.co/PpfJYcE9t4  #gold #PaperGold #dollar #silver https://t.co/TEuT1xzCVC,0
Mon Sep 18 04:58:11 +0000 2017,this gotta be the ugliest shit ever. https://t.co/Niw2L56Ls2,7192
Mon Sep 18 04:55:23 +0000 2017,Here's the story of Concrete and Gold...https://t.co/ZJkzSlppnF,0
Mon Sep 18 04:41:28 +0000 2017,MLM Is An Online Goldmine Generate 50+ Leads Per Day. Increase Your Cashflow 10-fold. https://t.co/fn7Ea31ipw,0
Mon Sep 18 04:40:00 +0000 2017,i lowkey thought gold diggers weren't an actual thing  then i met one and was shook,0
Mon Sep 18 04:39:20 +0000 2017,Season of #Conspiracy and Economics  https://t.co/hOuF6zTsL7  #TrilateralCommission #right-wing #gold https://t.co/4PusWriHup,0
Mon Sep 18 04:37:17 +0000 2017,@das_smruti Don't worry about stupid cards..Just concentrate on buying my gift.. I could really use some gold ones👍🏼 https://t.co/q7cJRuMYuc,0
Mon Sep 18 04:34:31 +0000 2017,@Smills_ @BUFootball Temple could use some tapestry  some green and gold tapestry,0
Mon Sep 18 04:27:08 +0000 2017,Revealed: The Social Agents of Monetary Mayhem  #FederalReserveSystem #IncomeTax #dollar #gold… https://t.co/SybN7r6w9U,1
Mon Sep 18 04:26:18 +0000 2017,Revealed: The Social Agents of Monetary Mayhem  #FederalReserveSystem #IncomeTax #dollar #gold… https://t.co/SybN7r6w9U,1
Mon Sep 18 04:16:53 +0000 2017,Free standard delivery for 12 months just £11* Interflora https://t.co/fc5gD8j6LL,1
Mon Sep 18 04:16:01 +0000 2017,Free standard delivery for 12 months just £11* Interflora https://t.co/fc5gD8j6LL,1
Mon Sep 18 04:04:52 +0000 2017,@SexualGif SKSSKSKSKSKJSHDS,0
Mon Sep 18 03:59:01 +0000 2017,What happens on FaceTime?,0
Mon Sep 18 03:58:50 +0000 2017,@143lizbeth QUITTTTTTT YOUR FUCKING JOB,1
Mon Sep 18 03:56:36 +0000 2017,I have to stop buying so much gold it's getting expensive 😭🙄,0
Mon Sep 18 03:47:45 +0000 2017,This is gold 😂😂😂😂😂😂😂 https://t.co/2EpkWQ7CP1,0
Mon Sep 18 03:46:32 +0000 2017,While the US slept  Maile &amp; Emma sparkled in Japan! Congrats!  #Repost @flogymnastics Maile O'Keefe earned gold tod… https://t.co/jxWiU17ZQd,28
Mon Sep 18 03:35:14 +0000 2017,May God calm your heart &amp; give you peace. Rest easy knowing God is working everything out.,1942
Mon Sep 18 03:32:58 +0000 2017,King Harry O x (Gold Link Crew Remix) Music Video Screwed Version https://t.co/rcZ5AOOX9l via @YouTube,0
Mon Sep 18 03:31:17 +0000 2017,My grandmother doesn't always post on Facebook  but when she does  it's gold. https://t.co/6aGyCh2sPt,0
Mon Sep 18 03:19:45 +0000 2017,Was it? Or does fool's gold Falcons simply add to the sadness when they inevitability fall apart down the stretch?? https://t.co/EUuQKnMsyN,0
Mon Sep 18 03:18:02 +0000 2017,@TayStern Like hell ever get a gold jacket😂,0
Mon Sep 18 02:44:57 +0000 2017,@PoeyJost Don’t touch that episode of television gold.,0
Mon Sep 18 02:26:20 +0000 2017,New! Exquisite 5mm Wide Twisted Gold Tone Cuff Bracelet Listed on #HandmadeAtAmazon #GoldBracelets… https://t.co/iAmmGMNIgU,0
Mon Sep 18 02:25:53 +0000 2017,I only want to kiss it if it's gold♡ my second competition  and I placed 1st!! https://t.co/jHRg7VcqbS,0
Mon Sep 18 02:23:05 +0000 2017,GOLD DIGGER EXPERIMENT IN ROBLOX *THEY LEAVE ME* https://t.co/CaSVRQ1IQq,5
Mon Sep 18 02:21:19 +0000 2017,Gold and Silver Plunge Ends  https://t.co/qReHJVLKbB   #gold #silver #dollar  #FederalReserve https://t.co/8yWuwsA2el,0
Mon Sep 18 02:19:07 +0000 2017,Freshman B took 2nd in Gold Bracket at the Frisco tournament! Love coaching these girls! @lionettevball @McKISDAth… https://t.co/8ZQ3Vp26x5,4
Mon Sep 18 01:51:25 +0000 2017,Want a gold necklace with my initial  brad's  and an S or N for baby😍,0
Mon Sep 18 01:34:51 +0000 2017,We've known each other since season 1 when we were silver/gold  nice to see us become good friends and start playing again thanks to LO,0
Mon Sep 18 01:32:53 +0000 2017,Black Sapphire and Diamond Ring in 18 Karat Two Tone Gold | https://t.co/v0xqSIvprj https://t.co/bWXydhTtqr https://t.co/7igfQoQfqX,6
Mon Sep 18 01:32:43 +0000 2017,Treat your friends like gold and you'll never be poor✨,1
Mon Sep 18 01:24:01 +0000 2017,Black Sapphire and Diamond Ring in 18 Karat Two Tone Gold | https://t.co/v0xqSIvprj https://t.co/bWXydhTtqr https://t.co/7igfQoQfqX,6
Mon Sep 18 01:23:29 +0000 2017,Ari Gold. My guy,0
