Mon Oct 09 23:52:51 +0000 2017,I want a gold grill for my bottom teeth,0
Mon Oct 09 23:42:40 +0000 2017,Single Pearl on Gold Chain Bridesmaids Gift Sets Montana Blue Drop Neckl… https://t.co/1lvVBgIBue #jetteam #etsymntt https://t.co/IripEmPms6,16
Mon Oct 09 23:42:39 +0000 2017,Single Pearl on Gold Chain Bridesmaids Gift Sets Montana Blue Drop Neckl… https://t.co/1lvVBgIBue #jetteam #etsymntt https://t.co/IripEmPms6,16
Mon Oct 09 23:42:38 +0000 2017,Single Pearl on Gold Chain Bridesmaids Gift Sets Montana Blue Drop Neckl… https://t.co/1lvVBgIBue #jetteam #etsymntt https://t.co/IripEmPms6,16
Mon Oct 09 23:37:08 +0000 2017,Not today Satan https://t.co/DMhoKrXaLq,0
Mon Oct 09 23:36:31 +0000 2017,@jude_gold When's the next NGIS pod? I'm dying over here!,0
Mon Oct 09 23:23:55 +0000 2017,Pac is hyped.,0
Mon Oct 09 23:22:05 +0000 2017,For a limited time buy  1 @Team_Optimum Gold Standard 100% Whey and get 1 50% OFF! https://t.co/uMuZ9xS1iD…,0
Mon Oct 09 23:20:58 +0000 2017,Step into some  savings with this ECCO shoe Gold Box. https://t.co/jdHRknu8tx https://t.co/tmylT0jmZs,0
Mon Oct 09 23:20:19 +0000 2017,To @PrincePeterNYC We changed your neg narrative at the @dallascowboys game.💪🏼Like @ddlovato #sorryNOTsorry… https://t.co/CazSgVRFoQ,554
Mon Oct 09 23:20:02 +0000 2017,Black and gold nails https://t.co/gZOkV69MLP,0
Mon Oct 09 23:18:41 +0000 2017,just want y’all to remember this white and gold https://t.co/yK0qMYOLyy,0
Mon Oct 09 23:08:48 +0000 2017,@_rone There is too many  holy hell this is gold  it’s got to be “female disease”  so vague  so perfect,0
Mon Oct 09 23:04:19 +0000 2017,For IMFCoin to be a stronger alternative in a "race to debase" fiat world  wouldn't it need reserves in gold &amp; BTC?… https://t.co/07EY99PQTP,25
Mon Oct 09 23:01:18 +0000 2017,I liked a @YouTube video https://t.co/H9bRmUPn6Z Ormus Review - After 2 years - Monoatomic Gold Experience,0
Mon Oct 09 22:59:17 +0000 2017,@OverTheMonster They should keep Reed. Pitchers who can throw strikes are worth their weight in gold.Keep Moreland… https://t.co/H0W5z4FAJr,0
Mon Oct 09 22:59:11 +0000 2017,slide in my dm,0
Mon Oct 09 22:57:20 +0000 2017,How come no one ever told me that Sesame Street was a treasure trove of puns? They're pure gold! #friendsdontletfriendsmisspuns,0
Mon Oct 09 22:52:42 +0000 2017,They should have put that fur on a gold gown.,0
Mon Oct 09 22:46:03 +0000 2017,@OhhhSaint we winnin the SB,0
Mon Oct 09 22:40:45 +0000 2017,"All that Is Gold does not Glitter; not all those who wander are lost.." #egypt #YOLO #lifeadventures #dreamteam https://t.co/k7HNOJSXlT,1
Mon Oct 09 22:17:29 +0000 2017,#farmerswalks @ Gold's Gym https://t.co/eS4WRqI8b9,0
Mon Oct 09 21:44:38 +0000 2017,took this one super late after i got back from a vacation and wanted to take a photo. i love the vibe this pic give… https://t.co/VVvU9KLDVR,1
Mon Oct 09 21:36:47 +0000 2017,Green Tourmaline Yellow Gold Ring | https://t.co/v0xqSIvprj https://t.co/vCl11talKc https://t.co/wj7dLYckcZ,5
Mon Oct 09 21:33:18 +0000 2017,You have to go through the fire in order to become the gold,4
Mon Oct 09 21:32:27 +0000 2017,Single Pearl on Gold Chain Bridesmaids Gift Sets Montana Blue Drop Neckl… https://t.co/1lvVBgIBue #jetteam #etsymntt https://t.co/IripEmPms6,16
Mon Oct 09 21:32:26 +0000 2017,Single Pearl on Gold Chain Bridesmaids Gift Sets Montana Blue Drop Neckl… https://t.co/1lvVBgIBue #jetteam #etsymntt https://t.co/IripEmPms6,16
Mon Oct 09 21:27:31 +0000 2017,Single Pearl on Gold Chain Bridesmaids Gift Sets Montana Blue Drop Neckl… https://t.co/1lvVBgIBue #jetteam #etsymntt https://t.co/IripEmPms6,16
Mon Oct 09 21:27:30 +0000 2017,Single Pearl on Gold Chain Bridesmaids Gift Sets Montana Blue Drop Neckl… https://t.co/1lvVBgIBue #jetteam #etsymntt https://t.co/IripEmPms6,16
Mon Oct 09 21:23:30 +0000 2017,my pussy glitter is gold,0
Mon Oct 09 21:11:10 +0000 2017,took this one super late after i got back from a vacation and wanted to take a photo. i love the vibe this pic give… https://t.co/VVvU9KLDVR,1
Mon Oct 09 21:03:11 +0000 2017,The fact that I have to load my photos and videos in my gallery via wifi is so annoying,0
Mon Oct 09 20:56:05 +0000 2017,other than this my response game usually A1 @xofficial_maiaa https://t.co/90qSm0AIi2,1
Mon Oct 09 20:51:03 +0000 2017,Escapate conmigo,0
Mon Oct 09 20:44:50 +0000 2017,Single Pearl on Gold Chain Bridesmaids Gift Sets Montana Blue Drop Neckl… https://t.co/1lvVBgIBue #jetteam #etsymntt https://t.co/IripEmPms6,16
Mon Oct 09 20:43:55 +0000 2017,Single Pearl on Gold Chain Bridesmaids Gift Sets Montana Blue Drop Neckl… https://t.co/1lvVBgIBue #jetteam #etsymntt https://t.co/IripEmPms6,16
Mon Oct 09 20:41:30 +0000 2017,MLM Is An Online Goldmine Generate 50+ Leads Per Day. Increase Your Cashflow 10-fold. https://t.co/fn7Ea31ipw,0
Mon Oct 09 20:35:21 +0000 2017,Single Pearl on Gold Chain Bridesmaids Gift Sets Montana Blue Drop Neckl… https://t.co/1lvVBgIBue #jetteam #etsymntt https://t.co/IripEmPms6,16
Mon Oct 09 20:25:45 +0000 2017,You have to go through the fire in order to become the gold,4
Mon Oct 09 20:25:20 +0000 2017,Macys is trippen $26 for sum fake gold hoops???? BOIIIIII,0
Mon Oct 09 20:23:13 +0000 2017,Now playing Gold Rush by Charlie Wilson; Snoop Dogg!,0
Mon Oct 09 20:19:50 +0000 2017,Talked to my friend @SienaMBB coach  Jimmy Patsos today &amp; he loves his freshman  6-8 Prince Oduro. Young man helped Canada win U-19 Gold. 🇨🇦,29
Mon Oct 09 20:03:30 +0000 2017,@JoseD89344985 AND your gold which is why buying it is a waste of worthless money.,0
Mon Oct 09 20:01:28 +0000 2017,I need a new gold chain in my life,0
Mon Oct 09 19:59:46 +0000 2017,@MizHaley Haha. This is gold! 😂😂😂,0
Mon Oct 09 19:49:38 +0000 2017,@Gold_Kindness @brook196 @TIME Are you dense? I told you I'm not watching.  How badly does it bother you that the N… https://t.co/x8or3s8eQY,0
Mon Oct 09 19:48:22 +0000 2017,@Gold_Kindness @USMC_SSDD OIC  in your deranged little mind  you think the VP loses his 1st amendment rights becaus… https://t.co/xLSfla9RCb,0
Mon Oct 09 19:43:33 +0000 2017,In this phase you will understand that true gold does not glitter love does not judge &amp; kindness will be divine - @ruffydfire #ARebelSumary,0
Mon Oct 09 19:38:57 +0000 2017,As of 15:32 it took almost 4 ounces of gold to buy one bitcoin! https://t.co/MMssJaS2x1,0
Mon Oct 09 19:36:42 +0000 2017,@aolsupporthelp trying to help friend with display name change on email of aol gold,0
Mon Oct 09 19:35:21 +0000 2017,Gorgeous ST JOHN Black Knit GOLD Sequin PAILLETTE Tank Shell S M #deals #ebay   https://t.co/x7CDr0ycrr https://t.co/itvSv7phPN,0
Mon Oct 09 19:33:53 +0000 2017,A heartfelt THANK YOU to everyone who sponsored  volunteered and attended Sydney's Band of Gold Golf Tournament and/or Gala this weekend!,0
Mon Oct 09 19:31:58 +0000 2017,Can't decide if I want all gold nails or do something with gold blue and red for my Halloween Wonder Woman nails 🤔,0
Mon Oct 09 19:30:34 +0000 2017,Proud to have @Zurich as a gold sponsor at the 37th IRMI Construction Risk Conference! https://t.co/S1bgtV0SeE #IRMI2017,0
Mon Oct 09 19:23:38 +0000 2017,@asymmetricalpha @astruzynski Yes as I had said this morning that /GC (gold future) has 5ma cross 10ma on 15 minute… https://t.co/BqoJJxA0dH,0
Mon Oct 09 19:04:44 +0000 2017,👇👇👇👇 #Gold #oil #OOTT https://t.co/muYaXNVDe3,0
Mon Oct 09 19:01:38 +0000 2017,Found out not only did my cousin steal my iPad but she also stole all my gold jewelry and sweaters 🙃🙃 can’t trust people for shit,0
Mon Oct 09 19:01:04 +0000 2017,@Scaramucci Before he killed natives on an island for gold they didn't have.,0
Mon Oct 09 19:01:02 +0000 2017,#peacock #obsessed @ Hilton Anatole Dallas Texas  Organo Gold Vip Super Saturday https://t.co/pglPLQfyzo,0
Mon Oct 09 18:44:50 +0000 2017,@fuckitpotato i play more OW now . first 15 games i only lost only one &amp; got gold 2320 . then played with friends and went down to 1700 lol,0
Mon Oct 09 18:43:37 +0000 2017,@Liberienne why you attacking everyone,0
Mon Oct 09 18:43:23 +0000 2017,Oh my god.  The bitching from done fans is going to be fucking gold!  https://t.co/UX69bOM10K,0
Mon Oct 09 18:39:43 +0000 2017,@brook196 @Gold_Kindness @TIME Wide awake bud. And using my first amendment rights to NOT watch NFL until these spo… https://t.co/XFNIqrjhCI,0
Mon Oct 09 18:39:34 +0000 2017,@01splcheck They were told everything they did and said was gold even when it was 💩!,0
Mon Oct 09 18:39:19 +0000 2017,@143lizbeth q u i t,1
Mon Oct 09 18:37:21 +0000 2017,New! Bark Rose Gold-Tone Cuff Bracelet Highlighted on #Etsy #FreeShipping #7thAnniversary https://t.co/XH3alrDpxj https://t.co/6n963nrAKs,1
Mon Oct 09 18:36:03 +0000 2017,is black a color?,0
Mon Oct 09 18:35:00 +0000 2017,If Ads Don't Work  Can Publishers Strike Subscription Gold? - https://t.co/YbOaDKqjSq,0
Mon Oct 09 18:33:53 +0000 2017,@Gold_Kindness @USMC_SSDD Sure liberals have the right to disrespect our anthem  flag  and everything soldiers serv… https://t.co/tshtRibIJb,0
Mon Oct 09 18:31:18 +0000 2017,@thatcurliegyal @Desmond_palochi @lonestfeels @juvonwolfee so y’all fightin or ?,0
Mon Oct 09 18:28:52 +0000 2017,This is gold!! 🤘🏻💕 https://t.co/VyU3RLi3n7,0
Mon Oct 09 18:24:13 +0000 2017,Rock on  gold dust woman,0
Mon Oct 09 18:23:39 +0000 2017,this is the goofiest dude on the internet lmfaoooooo https://t.co/GTbagGDuZ4,5
Mon Oct 09 18:23:21 +0000 2017,This was one of those moments that was gold from start to finish.  Hearing from these guys and… https://t.co/Lb2ts8KGA1,0
Mon Oct 09 18:22:55 +0000 2017,You have to go through the fire in order to become the gold,4
Mon Oct 09 18:16:09 +0000 2017,GOLD by BROCKHAMPTON https://t.co/8XqigEkIIV,0
Mon Oct 09 18:05:32 +0000 2017,Just night putting with #HRHardball : Fool's Gold – The "Passive" Candidate https://t.co/WdIYX4RQP6,0
Mon Oct 09 17:41:41 +0000 2017,@JamieMoranUK Agreed. You should check out the GT Sport beta thread. Some comedy. Make a negative post with pics  g… https://t.co/kalkXA4oxE,0
Mon Oct 09 17:37:51 +0000 2017,"Don't gain the world and lose your soul  wisdom is better than silver or gold"  ~ Robert Nesta "Bob" Marley https://t.co/Jy0GmeX3CR,33
Mon Oct 09 17:36:14 +0000 2017,@stang289 Because of modern day consumerism. These people are worked hard and paid low wages for diamonds and gold… https://t.co/W451iDmI0m,0
Mon Oct 09 17:31:24 +0000 2017,"Don't gain the world and lose your soul  wisdom is better than silver or gold"  ~ Robert Nesta "Bob" Marley https://t.co/Jy0GmeX3CR,33
Mon Oct 09 17:29:58 +0000 2017,Bitcoin: The New Gold or the Currency of the Future? - All The Internet Of Things https://t.co/HcesAQpaNN via @rightrelevance thanks @theiot,0
Mon Oct 09 17:26:16 +0000 2017,New Story: JV Gold Football-28 Mesquite Poteet-7 https://t.co/fGWSHBZP15 https://t.co/xZcv0f1qGn,0
Mon Oct 09 17:24:59 +0000 2017,5- the seven sisters controlled every aspect of the industry and forced their pricing system on the world. Has nothing to do with gold,1
Mon Oct 09 17:24:50 +0000 2017,THIS IS PURE GOLD LMFAO https://t.co/BiSX7Kpurx,0
