Wed Nov 01 23:58:34 +0000 2017,Kept telling myself that I would listen to this once I got the chance  and now I’m glad I️ did. Gold Manzi  Gold.… https://t.co/yE1Vl0zphv,2
Wed Nov 01 23:53:53 +0000 2017,Kept telling myself that I would listen to this once I got the chance  and now I’m glad I️ did. Gold Manzi  Gold.… https://t.co/yE1Vl0zphv,2
Wed Nov 01 23:42:19 +0000 2017,Some parents need to be nailed to an upside down cross  doused with that black gold  &amp; without hesitation..give me… https://t.co/kSPhAcrI9e,0
Wed Nov 01 23:30:05 +0000 2017,I just added this to my closet on Poshmark: Gold Leaf Pedant 32” Necklace. https://t.co/mjbuYSGugf via @poshmarkapp #shopmycloset,0
Wed Nov 01 23:28:17 +0000 2017,Vintage Button Push Pins https://t.co/OmXlPjvAb0 via @EtsySocial #etsymntt #etsyspecialt #Vintage Button #Push Pins https://t.co/7jmOMs6MZi,34
Wed Nov 01 23:23:41 +0000 2017,Save up to 30% off  Tickle Me Elmo  Play-Doh  and BB-8 with this Amazon Gold Box. https://t.co/duIHzFooIC https://t.co/NeVqdMZ9Ri,0
Wed Nov 01 23:12:32 +0000 2017,Vintage Button Push Pins https://t.co/OmXlPjvAb0 via @EtsySocial #etsymntt #etsyspecialt #Vintage Button #Push Pins https://t.co/7jmOMs6MZi,34
Wed Nov 01 23:07:58 +0000 2017,Vintage Button Push Pins https://t.co/OmXlPjvAb0 via @EtsySocial #etsymntt #etsyspecialt #Vintage Button #Push Pins https://t.co/7jmOMs6MZi,34
Wed Nov 01 22:52:54 +0000 2017,God    This new month  may it be a reminder of new beginnings  open doors  &amp; opportunities. May I finish out the year strong  as I flourish.,5110
Wed Nov 01 22:49:53 +0000 2017,Great Whites want the gold back 😻🥇 https://t.co/shus5remay,156
Wed Nov 01 22:40:11 +0000 2017,LIQUID GOLD DE VIDA DIVINA ACEITES ESENCIALES PARA LA PIEL https://t.co/T1X70GSiaH,0
Wed Nov 01 22:28:13 +0000 2017,@AllyyyMayyyy @Pluckers @HERNANMTV Bakers gold have my heart!,0
Wed Nov 01 22:28:06 +0000 2017,Vintage Button Push Pins https://t.co/OmXlPjvAb0 via @EtsySocial #etsymntt #etsyspecialt #Vintage Button #Push Pins https://t.co/7jmOMs6MZi,34
Wed Nov 01 22:26:40 +0000 2017,Website GOLD for ELA Teachers https://t.co/0dzSuXKA4S #edchat #edtech,22
Wed Nov 01 22:01:06 +0000 2017,@Ssnyder1835 Booster Gold 4 Life,0
Wed Nov 01 21:56:31 +0000 2017,@gold_purple_red my compa! Haaay https://t.co/MaU88ak3NH,0
Wed Nov 01 21:55:37 +0000 2017,@corbydavidson @badkaratemovie @dfwticket That "Snake on the Loose" segment was radio gold! Clits  dicks  and chicks - playin to the demo!!,0
Wed Nov 01 21:46:01 +0000 2017,Water more important than the gold,0
Wed Nov 01 21:32:32 +0000 2017,🛍️#Giveaway! Every ticket holder enters to win this Lindsey J Gold Bracelet! It could be you!! Tickets:… https://t.co/9Z68w1x43W,0
Wed Nov 01 21:30:36 +0000 2017,JP Cooper - Colour Me In Gold | Mahogany Session https://t.co/JIr46u5tcW   Happy birthday to this beautiful man 😍❤️😘,1
Wed Nov 01 21:28:36 +0000 2017,Vintage Button Push Pins https://t.co/OmXlPjvAb0 via @EtsySocial #etsymntt #etsyspecialt #Vintage Button #Push Pins https://t.co/7jmOMs6MZi,34
Wed Nov 01 21:19:53 +0000 2017,Silk Evening Bag - https://t.co/yX6wU5Y67p via @EtsySocial #etsymntt #etsyspecialt #Evening Bag #Singed Flower https://t.co/nkcSHwT38C,5
Wed Nov 01 21:18:58 +0000 2017,Silk #Afterfive #bags #purses @RTDNR @HandmadeForum https://t.co/ySHeXhe712  #etsyspecialt #estymntt #etsysocial https://t.co/85kZUhoEe0,4
Wed Nov 01 21:18:42 +0000 2017,Today's Shell Shocker: @Thermaltake Toughpower  Grand RGB 850W 80PLUS GOLD PS-TPG-0850FPCGUS-R  $109.99…,0
Wed Nov 01 21:18:25 +0000 2017,Isn’t she lovely... lilac spinel  diamonds and 18K rose gold. 😍❤️😍#lilacspinel #lilacspinelring… https://t.co/De9l3CDYcs,0
Wed Nov 01 21:01:50 +0000 2017,How to Transform Funny Stories into Comedy Writing Gold #writing #authors https://t.co/v8OufhsW2F,1
Wed Nov 01 21:00:41 +0000 2017,Silk #Afterfive #bags #purses @RTDNR @HandmadeForum https://t.co/ySHeXhe712  #etsyspecialt #estymntt #etsysocial https://t.co/85kZUhoEe0,6
Wed Nov 01 20:59:35 +0000 2017,Silk #Afterfive #bags #purses @RTDNR @HandmadeForum https://t.co/ySHeXhe712  #etsyspecialt #estymntt #etsysocial https://t.co/85kZUhoEe0,6
Wed Nov 01 20:59:27 +0000 2017,Silk #Afterfive #bags #purses @RTDNR @HandmadeForum https://t.co/ySHeXhe712  #etsyspecialt #estymntt #etsysocial https://t.co/85kZUhoEe0,6
Wed Nov 01 20:58:58 +0000 2017,I added a video to a @YouTube playlist https://t.co/fCHOU4XJj7 1.20 carat Three Stone Emerald Yellow Gold Engagement Ring,0
Wed Nov 01 20:58:19 +0000 2017,TIP OF THE DAY; U dont have to understand what God is doing  U just have to trust He's leading you somewhere far greater than U could image✨,8673
Wed Nov 01 20:57:47 +0000 2017,this is gold. https://t.co/hKeRWUTb1a,8
Wed Nov 01 20:56:06 +0000 2017,Silk #Afterfive #bags #purses @RTDNR @HandmadeForum https://t.co/ySHeXhe712  #etsyspecialt #estymntt #etsysocial https://t.co/85kZUhoEe0,6
Wed Nov 01 20:55:16 +0000 2017,Girl Scout with autism plants garden to feed homeless  earn Gold Award https://t.co/xjWrLij54x via @bgdailynews,1
Wed Nov 01 20:54:48 +0000 2017,Silk #Afterfive #bags #purses @RTDNR @HandmadeForum https://t.co/ySHeXhe712  #etsyspecialt #estymntt #etsysocial https://t.co/85kZUhoEe0,6
Wed Nov 01 20:54:03 +0000 2017,Silk #Afterfive #bags #purses @RTDNR @HandmadeForum https://t.co/ySHeXhe712  #etsyspecialt #estymntt #etsysocial https://t.co/85kZUhoEe0,6
Wed Nov 01 20:52:07 +0000 2017,Girl Scout with autism plants garden to feed homeless  earn Gold Award https://t.co/xjWrLij54x via @bgdailynews,1
Wed Nov 01 20:42:48 +0000 2017,this is gold. https://t.co/hKeRWUTb1a,8
Wed Nov 01 20:40:14 +0000 2017,this is gold. https://t.co/hKeRWUTb1a,8
Wed Nov 01 20:38:15 +0000 2017,Vintage Button Push Pins https://t.co/OmXlPjvAb0 via @EtsySocial #etsymntt #etsyspecialt #Vintage Button #Push Pins https://t.co/7jmOMs6MZi,34
Wed Nov 01 20:34:03 +0000 2017,This is Gold https://t.co/LmM6tGa5E8,1
Wed Nov 01 20:28:24 +0000 2017,This is pure gold https://t.co/MnCiSXWbTp,0
Wed Nov 01 20:27:34 +0000 2017,Vintage Button Push Pins https://t.co/OmXlPjvAb0 via @EtsySocial #etsymntt #etsyspecialt #Vintage Button #Push Pins https://t.co/7jmOMs6MZi,34
Wed Nov 01 20:23:38 +0000 2017,How to Transform Funny Stories into Comedy Writing Gold #writing #authors https://t.co/v8OufhsW2F,1
Wed Nov 01 20:18:24 +0000 2017,Vintage Button Push Pins https://t.co/OmXlPjvAb0 via @EtsySocial #etsymntt #etsyspecialt #Vintage Button #Push Pins https://t.co/7jmOMs6MZi,34
Wed Nov 01 20:15:25 +0000 2017,@Ssnyder1835 Swamp Thing  Animal Man  the Question  Booster Gold,0
Wed Nov 01 20:12:45 +0000 2017,Gold Orchid Flower Bridal Earrings Matte Gold Long Pearl Drops Swarovski… https://t.co/oIEOf2X9Ij #jetteam #etsymntt https://t.co/d8vnGlmLcK,29
Wed Nov 01 20:11:50 +0000 2017,New massage therapist at work just worked on me for 10 minutes and made my back feel like gold 😱😬,0
Wed Nov 01 19:59:13 +0000 2017,Vintage Button Push Pins https://t.co/OmXlPjvAb0 via @EtsySocial #etsymntt #etsyspecialt #Vintage Button #Push Pins https://t.co/7jmOMs6MZi,34
Wed Nov 01 19:55:10 +0000 2017,Proud to have Old Republic Contractors Insurance Group  Inc. as a gold sponsor at the 37th IRMI CRC! https://t.co/S1bgtV0SeE #IRMI2017,0
Wed Nov 01 19:50:49 +0000 2017,This is also GOLD! Stylin’ and profiling’ at such a young age!! Kid’ll be strutting in no time! #Woo https://t.co/AUFrrucn9u,0
Wed Nov 01 19:49:22 +0000 2017,Vintage Button Push Pins https://t.co/OmXlPjvAb0 via @EtsySocial #etsymntt #etsyspecialt #Vintage Button #Push Pins https://t.co/7jmOMs6MZi,34
Wed Nov 01 19:49:08 +0000 2017,Vintage Button Push Pins https://t.co/OmXlPjvAb0 via @EtsySocial #etsymntt #etsyspecialt #Vintage Button #Push Pins https://t.co/7jmOMs6MZi,34
Wed Nov 01 19:43:03 +0000 2017,Vintage Button Push Pins https://t.co/OmXlPjvAb0 via @EtsySocial #etsymntt #etsyspecialt #Vintage Button #Push Pins https://t.co/7jmOMs6MZi,34
Wed Nov 01 19:36:09 +0000 2017,“Push me to the Rezz  all my Zeds are dead.”,19
Wed Nov 01 19:32:18 +0000 2017,We not gonna skip a season cause you lonely i got outfits to show off 😌 https://t.co/1rCRvdG8pC,4884
Wed Nov 01 19:28:43 +0000 2017,It's that drop top Phantom chop  all gold Rolly tock @BobbyJakkrit,0
Wed Nov 01 19:22:49 +0000 2017,@Fly_Goldie A vacation is as good as gold! DM us w/ #SWAgift for a special treat to help with your next get away! ^SC,0
Wed Nov 01 19:15:42 +0000 2017,This is gold. https://t.co/Y9j3wICTUO,0
Wed Nov 01 19:15:11 +0000 2017,Vintage Button Push Pins https://t.co/OmXlPjvAb0 via @EtsySocial #etsymntt #etsyspecialt #Vintage Button #Push Pins https://t.co/7jmOMs6MZi,34
Wed Nov 01 19:14:00 +0000 2017,@knublackent The new album is Gold my fiends. https://t.co/rrNM26zuHK,0
Wed Nov 01 19:12:56 +0000 2017,Emma Malabuyo's off to represent Team USA in Japan after a stellar Championships(Gold-Floor; Silver-AllAround &amp; Bar… https://t.co/nK5fh0em0J,9
Wed Nov 01 19:12:47 +0000 2017,While the US slept  Maile &amp; Emma sparkled in Japan! Congrats!  #Repost @flogymnastics Maile O'Keefe earned gold tod… https://t.co/jxWiU17ZQd,33
Wed Nov 01 18:58:21 +0000 2017,Website GOLD for ELA Teachers https://t.co/0dzSuXKA4S #edchat #edtech,22
Wed Nov 01 18:44:27 +0000 2017,The Turnover Chain is so Miami Hurricanes. But is their record fool's gold? - Washington Post https://t.co/4eQCosEQ0E,0
Wed Nov 01 18:35:58 +0000 2017,We love a working gold standard couple #TheFlash #WestAllen this season vs. last https://t.co/uQulA6RfqJ,23
Wed Nov 01 18:30:05 +0000 2017,"Don't gain the world and lose your soul  wisdom is better than silver or gold"  ~ Robert Nesta "Bob" Marley https://t.co/Jy0GmeX3CR,42
Wed Nov 01 18:12:31 +0000 2017,ONLY $9.69 for White Gold Plated Double Love Heart Necklace w/ Code 3JX6XH8L https://t.co/rrn3wcBYcu https://t.co/akg0vXORwJ #giveaway,0
Wed Nov 01 18:10:27 +0000 2017,One of my best selling photos. Isn't she lovely? Gold Angel Bokeh by Squint  https://t.co/4l63aazf4w #DayofTheDead… https://t.co/x7pHe2dAJ7,1
Wed Nov 01 18:10:13 +0000 2017,One of my best selling photos. Isn't she lovely? Gold Angel Bokeh by Squint  https://t.co/4l63aazf4w #DayofTheDead… https://t.co/x7pHe2dAJ7,1
Wed Nov 01 18:02:08 +0000 2017,A guy with a gun enters a bar.  "Who the fuck had sex with my wife?" he snarled.  A voice was heard "You don't have enough bullets  mate!" 😂,22
Wed Nov 01 17:58:28 +0000 2017,@Cruhster_ I got a slightly longer one but here https://t.co/Jg40WCwLP1,0
Wed Nov 01 17:56:33 +0000 2017,Gorgeous ST JOHN Black Knit GOLD Sequin PAILLETTE Tank Shell S M #deals #ebay   https://t.co/x7CDr0ycrr https://t.co/FOQujrJmUU,0
Wed Nov 01 17:53:46 +0000 2017,Listen to Live It Up (remix)ft D-Lyght  Alloutmitch  Lil joe by Gold Sand Records #np on #SoundCloud https://t.co/pQzGeMZm6p,0
Wed Nov 01 17:49:45 +0000 2017,It's okay to take a step back. To reevaluate yourself  your surroundings  the people who are in your circle.,797
Wed Nov 01 17:40:11 +0000 2017,Green and Gold!  It's napkin time for the Holidays!  #Giveyourbestgift #thoughtfulgiving #shoplocal… https://t.co/Nx3OyxaDY2,0
Wed Nov 01 17:29:47 +0000 2017,@angiesingss Is that you on Bury Me In Gold?,0
Wed Nov 01 17:17:46 +0000 2017,Who sang vocals on Bury Me in Gold? @BIGKRIT @TeamBigKRIT_K4L @BIGSANT @MultiAlumni,0
Wed Nov 01 17:13:53 +0000 2017,Copper $JJC doji inside its upper gap. If this turns into hanging man  &amp; 50-day MA doesn't hold  we could get our F… https://t.co/feYpTMiRqI,0
Wed Nov 01 17:07:09 +0000 2017,Available now from @HarleyButlerTC is this set of four white &amp; gold napkin rings from @JohnRichardColl. Get yours!… https://t.co/APrTvGVwpC,0
Wed Nov 01 16:59:06 +0000 2017,Amazing Cups for all occasions!  Try our Frost Flex in Gold or Silver!  #cupsforChristmas #HolidayGifts… https://t.co/cg5fWQFSHN,0
Wed Nov 01 16:55:55 +0000 2017,Single Pearl on Gold Chain Bridesmaids Gift Sets Montana Blue Drop Neckl… https://t.co/1lvVBgIBue #etsymntt #jetteam https://t.co/DUgYEXqbPr,34
Wed Nov 01 16:36:58 +0000 2017,🚨🚨🚨OPPORTUNITY🚨🚨🚨   Amazon invites you to our Fort Worth hiring event!   Click here https://t.co/2yB5SiFYDj... https://t.co/06xbj0PWXC,0
Wed Nov 01 16:36:57 +0000 2017,Wow. Lots of gold in here. Thanks @RyanHoliday https://t.co/G5BOeZiwex,0
Wed Nov 01 16:33:41 +0000 2017,Sometimes you have to lose nearly everything to focus your attention on what’s most important  even if you’re a clo… https://t.co/Z7aD5Tb9nJ,3
Wed Nov 01 16:31:47 +0000 2017,@GenXTraveler A6: Of all the jazz I liked central park. Not everything that glitters is gold. Why I didn't like NY… https://t.co/WwfODk4qyx,0
Wed Nov 01 16:23:21 +0000 2017,Sometimes you have to lose nearly everything to focus your attention on what’s most important  even if you’re a clo… https://t.co/Z7aD5Tb9nJ,3
Wed Nov 01 16:22:50 +0000 2017,Sometimes you have to lose nearly everything to focus your attention on what’s most important  even if you’re a clo… https://t.co/Z7aD5Tb9nJ,3
Wed Nov 01 16:20:48 +0000 2017,AKA she knows she not a long term artist   and has hit a gold mine for child support . 🤷🏻‍♂️ https://t.co/bopJ3Ytuoo,0
Wed Nov 01 16:14:43 +0000 2017,@turnthepge THIS IS GOLD!!!!,1
Wed Nov 01 16:09:05 +0000 2017,@turnthepge THIS IS GOLD!!!!,1
Wed Nov 01 16:00:21 +0000 2017,Sometimes even our Texas gold standard  Whataburger  gets things wrong. https://t.co/Nt08zl6d8L,1
Wed Nov 01 15:55:12 +0000 2017,It is health that is real wealth and not pieces of gold and silver. Gandhi #warrior360way,0
Wed Nov 01 15:55:08 +0000 2017,Sometimes even our Texas gold standard  Whataburger  gets things wrong. https://t.co/Nt08zl6d8L,1
Wed Nov 01 15:48:14 +0000 2017,and what fulfillment is really like and where to find it. soul of gold,0
Wed Nov 01 15:43:22 +0000 2017,@TEEJAYWILLIAMS8 @housewivesguy Thank you Tyler!!! LOVED my @eseazenabor Gold Gown!! #RHOD 🔥🔥🔥🔥🔥🔥,1
Wed Nov 01 15:31:34 +0000 2017,Gold Tip  Bee Stinger Shooter Wins Para-World Championship in Beijing https://t.co/RLDu2BsOgM https://t.co/HFinLQDqwr,0
