Mon Sep 18 01:23:29 +0000 2017,RT and follow to win this galley of HAVEN  which has a new title  a new cover  and is 100% shapeshifter gold. I lov… https://t.co/KDt7uVlpOa,39
Mon Sep 18 01:17:41 +0000 2017,@KoosJansen @johnny_1205 @Smaulgld can traders move gold from SGE to SGEI or the money has to be generated in the SGEI? Thanks,0
Mon Sep 18 01:11:09 +0000 2017,Alec Baldwin scores Emmy gold for roasting Trump on 'SNL' https://t.co/MJQSlP8J4D #news https://t.co/GUxtlNwS2a,0
Mon Sep 18 01:01:24 +0000 2017,Gold Peak Tea Or Honest Leaf Tea Just $0.75 At CVS!  https://t.co/gkweMWLVMV https://t.co/Pfncfe3Ao9,0
Mon Sep 18 01:00:07 +0000 2017,@MarquetteKing Gold trim like the raiders when y'all move to Vegas,0
Mon Sep 18 00:51:07 +0000 2017,If everything was dipped in gold  then baby  it would never grow.. Everything sweet ain't sugar coated.,0
Mon Sep 18 00:43:47 +0000 2017,All that glitters ain't gold,1
Mon Sep 18 00:43:40 +0000 2017,The new @foofighters Concrete and Gold is legit. #ofcourse #expectnothingless,0
Mon Sep 18 00:38:00 +0000 2017,Are you out of your mind? @Ronnie2K @NBA2K https://t.co/fCU0IR6kK1,2027
Mon Sep 18 00:29:26 +0000 2017,While the US slept  Maile &amp; Emma sparkled in Japan! Congrats!  #Repost @flogymnastics Maile O'Keefe earned gold tod… https://t.co/jxWiU17ZQd,28
Mon Sep 18 00:12:11 +0000 2017,Rose Gold Bridal Shower Candy Apples.  Congratulations ADRIENNE! #sugarlicious #coveredinsugar #candyapples #Rosegold #cottoncandy,0
Mon Sep 18 00:01:55 +0000 2017,how could you hate gold jacket Witt. https://t.co/rSsbUPCgwr,1
