Sat Sep 30 23:52:40 +0000 2017,#Silver  Manipulation and the Paper Market. Is it Still A Rock-Solid Investment?  https://t.co/0a5lbhqp9j   #gold… https://t.co/7P3vWqMy9u,0
Sat Sep 30 23:46:22 +0000 2017,I Was Born With A Pure Heart Of Gold Then Got Rebellious. Hot Headed Turnt My Heart Cold❄....If You Carrying Burden… https://t.co/NlRWCMZxUt,0
Sat Sep 30 23:46:04 +0000 2017,We all Gold here💯🔥💰💰💰,0
Sat Sep 30 23:42:24 +0000 2017,Inked and flatted. Now to decide where I go from there. Do I wanna just fake beveled gold? Kinda do... Also gotta s… https://t.co/Y8ZYIWFOrS,0
Sat Sep 30 23:29:11 +0000 2017,Gold Pearl Bracelet Multi Strand Gold Cuff Ammonite Nautilus Shell Clasp… https://t.co/cMi78jNS5w #etsymntt #jetteam https://t.co/UKbfNrJnPv,35
Sat Sep 30 23:19:24 +0000 2017,@iim_riskyy I pulled 87 Harrison last week from gold tier 2 rewards,0
Sat Sep 30 23:15:58 +0000 2017,Royal &amp; Gold https://t.co/K0uCGdJnop,3975
Sat Sep 30 23:15:24 +0000 2017,Holy shit. A 44lb chunk of gold. Someone tell me how much this is worth. At the ironstone winery museum  murphys  n… https://t.co/B22QcJQ3UQ,0
Sat Sep 30 23:14:44 +0000 2017,Bitcoin lessons from the California gold rush https://t.co/HiB1BgwRwb via @CIOonline #bitcoin #blockchain #innovation #mining #crypto,1
Sat Sep 30 23:13:52 +0000 2017,Bitcoin lessons from the California gold rush https://t.co/HiB1BgwRwb via @CIOonline #bitcoin #blockchain #innovation #mining #crypto,1
Sat Sep 30 23:12:51 +0000 2017,La Thick Madame Boutique. Kimono sweater will be available in gold and rose gold in sizes 1x-2x https://t.co/2uRzvJAD1E,0
Sat Sep 30 23:01:40 +0000 2017,I think Si Woo took gold in the sauce-off today @NoLayingUp @TronCarterNLU https://t.co/ZqGDUMIOK7,0
Sat Sep 30 23:01:15 +0000 2017,Gold and Silver Stumble Ends – Special Edition   https://t.co/PpfJYcE9t4  #gold #PaperGold #dollar #silver https://t.co/dtO1ebXnGy,0
Sat Sep 30 22:52:29 +0000 2017,@SeanPayton could we please stop wearing the black uniform pants?  We play much better  and get many more wins  when we wear the gold pants.,0
Sat Sep 30 22:49:12 +0000 2017,Will the Fed Eventually Cause a Global Economic Collapse?  https://t.co/nOkjgn0oTE   #TheFed  #TheElite #Economic C… https://t.co/nKmmHQ3V5r,0
Sat Sep 30 22:46:10 +0000 2017,Listen to Reloaded by Gold Sand Records #np on #SoundCloud #download the now for free https://t.co/E0p0OvVNoT,0
Sat Sep 30 22:45:43 +0000 2017,Listen to 1 Day At A Time by Gold Sand Records #np on #SoundCloud https://t.co/1C7zBRcraY,0
Sat Sep 30 22:45:41 +0000 2017,My family should be the narrative  of a @tylerperry production. 🤦🏽‍♂️🤷🏽‍♂️ This is gold.,0
Sat Sep 30 22:45:28 +0000 2017,Listen to Take A L by Gold Sand Records #np on #SoundCloud https://t.co/OqqKZvxcNk,0
Sat Sep 30 22:45:19 +0000 2017,Listen to Without A Cause by Gold Sand Records #np on #SoundCloud https://t.co/LPeWr6mj8X,0
Sat Sep 30 22:42:18 +0000 2017,Listen to Kill A Hater ft Steeve Money by Gold Sand Records #np on #SoundCloud https://t.co/DGFJpbpckU,0
Sat Sep 30 22:41:54 +0000 2017,Listen to OU WI by Gold Sand Records #np on #SoundCloud https://t.co/VS2r3U1Cz8,0
Sat Sep 30 22:41:42 +0000 2017,Listen to Bang Bang by Gold Sand Records #np on #SoundCloud https://t.co/10OWD6Cymr,0
Sat Sep 30 22:41:24 +0000 2017,Listen to Day Ones by Gold Sand Records #np on #SoundCloud https://t.co/AQqNcI4yll,0
Sat Sep 30 22:41:12 +0000 2017,Listen to Love 2 Hate by Gold Sand Records #np on #SoundCloud https://t.co/238jJffSpY,0
Sat Sep 30 22:40:57 +0000 2017,Listen to Claiming A Murder ft The Mula Gang by Gold Sand Records #np on #SoundCloud https://t.co/jem8bU5reu,0
Sat Sep 30 22:40:50 +0000 2017,Listen to Live It Up (remix)ft D-Lyght  Alloutmitch  Lil joe by Gold Sand Records #np on #SoundCloud https://t.co/pQzGeMZm6p,0
Sat Sep 30 22:40:41 +0000 2017,Listen to Cash Money Flowing by Gold Sand Records #np on #SoundCloud https://t.co/pbUUUjBEDn,0
Sat Sep 30 22:40:33 +0000 2017,Listen to 5 Angels by Gold Sand Records #np on #SoundCloud https://t.co/Nc5zJO3lX8,0
Sat Sep 30 22:40:23 +0000 2017,Listen to Met Kow Sou Kote by Gold Sand Records #np on #SoundCloud https://t.co/Kb0NIdFIEw,0
Sat Sep 30 22:39:55 +0000 2017,Listen to I Just Wanna See ft Lil Ricco Montana &amp; Jay Montana by Gold Sand Records #np on #SoundCloud https://t.co/M6rzy9m5QH,0
Sat Sep 30 22:39:25 +0000 2017,Season of #Conspiracy and Economics  https://t.co/hOuF6zTsL7  #TrilateralCommission #right-wing #gold https://t.co/2vvncC64wM,0
Sat Sep 30 22:33:29 +0000 2017,you know your broke when you are willing to spend the gold dollars in public while the cashier looks at you like you are the worst,0
Sat Sep 30 22:32:28 +0000 2017,Amen brother. But not worse than the turnover gold chain. https://t.co/N5P0PDIjmf,0
Sat Sep 30 22:30:50 +0000 2017,#Rainbow I captured the other day while I was working for me pot of gold. #Nature #NaturesBeauty… https://t.co/VIRBEFPKvM,0
Sat Sep 30 22:30:39 +0000 2017,#Rainbow I captured the other day while I was working for me pot of gold. #Nature #NaturesBeauty… https://t.co/VIRBEFy9Ee,0
Sat Sep 30 22:25:11 +0000 2017,Twitter is World of Warcraft and Russian Bots are Chinese Gold Farmers.  The parallels are kind of striking.,0
Sat Sep 30 22:22:53 +0000 2017,DALLAS FALL OPEN CHAMP ✨🥇✨  Congrats to Jimmy Melendez on winning his Finals match 3-0 and taking Gold today!… https://t.co/Wx1hmwlrEg,0
Sat Sep 30 22:17:51 +0000 2017,DALLAS FALL OPEN CHAMP ✨🥇✨  Congrats to Christopher L West on winning his Finals match and taking Gold today!   Nic… https://t.co/0L4Htj3e32,0
Sat Sep 30 22:09:05 +0000 2017,「VOLARE ROSE GOLD」a collaboration with @KLASSE14_JAPAN! use GLOOMY14 at https://t.co/lX6oItQOsL for 12% off!… https://t.co/8nZkmX3Wfk,160
Sat Sep 30 22:05:05 +0000 2017,We have this 1.60 CTW 14k Yellow Gold Wedding Band available. It's beautiful! 😇💍💎 All the details:… https://t.co/6fTFKYoUla,0
Sat Sep 30 21:56:59 +0000 2017,Having another female feel special in any type of way https://t.co/ta5H7Iij1b,51409
Sat Sep 30 21:53:32 +0000 2017,Gold Flower Bridal Earrings Long Pearl Drops Dogwood Flowers Swarovski P… https://t.co/V3Es7tyWbh #jetteam #etsymntt https://t.co/E5POPIu6zv,23
Sat Sep 30 21:40:50 +0000 2017,Isaac Hayes' #cadillac w/ refrigerator  television  and #24carat gold exterior. #isaachayes https://t.co/RmjBcmz7SF,0
Sat Sep 30 21:38:37 +0000 2017,hi   gibson guitars  fans   i like sg  guitar with    gold pickups with marshall amps.  hi   @JimmyPage  and this    is @realnike  .,0
Sat Sep 30 21:36:34 +0000 2017,Single Pearl on Gold Chain Bridesmaids Gift Sets Montana Blue Drop Neckl… https://t.co/1lvVBgIBue #etsymntt #jetteam https://t.co/8Y0JTt0Y6H,23
Sat Sep 30 21:33:09 +0000 2017,@Starbucks just lost a Gold Status customer. #neveragain #sogross #youhadonejob #isthisajoke https://t.co/uDZAqbGnp1,0
Sat Sep 30 21:26:04 +0000 2017,Gold Pearl Bracelet Multi Strand Gold Cuff Ammonite Nautilus Shell Clasp… https://t.co/cMi78jNS5w #etsymntt #jetteam https://t.co/UKbfNrJnPv,35
Sat Sep 30 21:25:22 +0000 2017,@NateSilver538 Writing that this violates both Ockham's Razor and Hanlon's Razor was journalistic gold.,0
Sat Sep 30 21:20:13 +0000 2017,DALLAS FALL OPEN CHAMP ✨🥇✨  Congrats to Karem Caldera on winning 3 matches and taking Gold in her Blue Belt debut!… https://t.co/cjZUTCLISz,0
Sat Sep 30 21:13:47 +0000 2017,DALLAS FALL OPEN CHAMP ✨🥇✨  Congrats to Damian Kells on winning 2 matches and taking Gold in his Brown Belt debut!… https://t.co/I5bJE73lKy,0
Sat Sep 30 21:13:30 +0000 2017,Gold Pearl Bracelet Multi Strand Gold Cuff Ammonite Nautilus Shell Clasp… https://t.co/cMi78jNS5w #etsymntt #jetteam https://t.co/UKbfNrJnPv,35
Sat Sep 30 21:03:11 +0000 2017,Money Tree  Gold and One World Money  https://t.co/SSDuK8PTUn  #gold #SDR #OneWorldMoney #savings https://t.co/JxZpTbm2Kz,0
Sat Sep 30 21:00:05 +0000 2017,Benghazi hero shuts down Hillary Clinton with fiery response after she urges Trump to send aid to Puerto Rico https://t.co/1Vy8nziG0B,357
Sat Sep 30 20:34:35 +0000 2017,@BrendanSchaub @OntarioImprov @Onnit @FighterNtheKid @AverageJoeArt Shit my pants podcast w Rogan was lol gold.,0
Sat Sep 30 20:27:54 +0000 2017,@gold_acer123 I love the upper left XD,0
Sat Sep 30 20:15:44 +0000 2017,3 season gold combo pass for a bill bruh,0
Sat Sep 30 20:13:40 +0000 2017,I'm Infatuated with the idea of Me and Her full of Gold...  Just shining Together But🤷🏾‍♂️🤦🏾‍♂️ TRUST ISSUES,0
Sat Sep 30 20:07:47 +0000 2017,Baylor white &amp; gold helmets are pure ice ❄️,0
Sat Sep 30 20:00:42 +0000 2017,Any volunteers to clean up this mess🙌#gas #highlife #boojielungz #hiphop #california #wakeandbake #goodmorning… https://t.co/ZCOO2d0B5O,0
Sat Sep 30 19:56:54 +0000 2017,A fun chat about #banking #innovation with the best title ever! 'Selling Banking Shovels In The Digital Gold Rush' https://t.co/w5r9zmtdaP,3
Sat Sep 30 19:48:06 +0000 2017,Just went through 2 years of your media to find this gold throwback https://t.co/Q8myrt6Z3k,0
Sat Sep 30 19:33:39 +0000 2017,@the_gold_finch agreed. I'd honestly adopt all of them if I could. Always happy to give them a good home.,0
Sat Sep 30 19:33:36 +0000 2017,Buckle up! Amazon is hosting a Britax car  seat gold box today. Find this and many more deals!…,0
Sat Sep 30 19:30:44 +0000 2017,@politix_news This group is right wing pot of gold - "keep-them-dumb" &amp; entertained is the job trump does best,0
Sat Sep 30 19:30:32 +0000 2017,@the_gold_finch daawww such beautiful puppers,0
Sat Sep 30 19:17:46 +0000 2017,Another win in the books! Way to go FCD Gold! @ Classic League Soccer Assoc https://t.co/iqcJWgz89p,0
Sat Sep 30 19:12:27 +0000 2017,Gold Orchid Flower Bridal Earrings Matte Gold Long Pearl Drops Swarovski… https://t.co/oIEOf2X9Ij #jetteam #etsymntt https://t.co/t6OF9jxe9U,35
Sat Sep 30 19:12:27 +0000 2017,Gold Orchid Flower Bridal Earrings Matte Gold Long Pearl Drops Swarovski… https://t.co/oIEOf2X9Ij #jetteam #etsymntt https://t.co/t6OF9jxe9U,35
Sat Sep 30 19:05:10 +0000 2017,Gold Pearl Bracelet Multi Strand Gold Cuff Ammonite Nautilus Shell Clasp… https://t.co/cMi78jNS5w #etsymntt #jetteam https://t.co/UKbfNrJnPv,35
Sat Sep 30 19:04:01 +0000 2017,Gold Pearl Bracelet Multi Strand Gold Cuff Ammonite Nautilus Shell Clasp… https://t.co/cMi78jNS5w #etsymntt #jetteam https://t.co/UKbfNrJnPv,35
Sat Sep 30 19:00:40 +0000 2017,When you get curved but get the gold posterizer badge on 2k https://t.co/gzgz7PQdSv,0
Sat Sep 30 18:33:41 +0000 2017,@EfrainOlivares6 Yo tengo una pero creo que no tiene gold,0
Sat Sep 30 18:32:43 +0000 2017,@johnklingberg is this the sort of gold we should be expecting from you on insta now  klinger? https://t.co/2hmGiWEP6H,35
Sat Sep 30 18:30:34 +0000 2017,Talons Up 🦅 https://t.co/jpWfhIZesm,0
Sat Sep 30 18:29:39 +0000 2017,@PghSportsNow Larry Fitzgerald they ain't.  This passing game falls apart against anyone with a pass rush.   We are… https://t.co/E65YPmDkos,0
Sat Sep 30 18:27:36 +0000 2017,This thread is gold. https://t.co/oQfdlKmjTg,0
