Fri Oct 06 23:50:49 +0000 2017,Which 10 countries are best positioned to go #Cashless? #banking #fintech #bitcoin @MikeQuindazzi https://t.co/qxxIkfIUaN,55
Fri Oct 06 23:41:38 +0000 2017,If it looks like a bubble  swims like bubble and quacks like a bubble... #bitcoin,1
Fri Oct 06 23:40:24 +0000 2017,SEC Obtains Final Judgment Against GAW Miners CEO Josh Garza in $9 Million Fraud https://t.co/N01twhOjuE #bitcoin #crypto,3
Fri Oct 06 23:40:09 +0000 2017,ECB Considers “Legal Restraints” Against #Bitcoin Says Council Member https://t.co/TgE10MyIsF,3
Fri Oct 06 23:28:23 +0000 2017,If it looks like a bubble  swims like bubble and quacks like a bubble... #bitcoin,1
Fri Oct 06 23:25:50 +0000 2017,@First_Bitcoin  sorry this didn’t come through earlier. Use social media to keep your shareholders informed! https://t.co/0LNrUuMopE,0
Fri Oct 06 23:21:42 +0000 2017,During the tech boom  adding "dotcom" to a name sent the stock soaring; now it's "blockchain." https://t.co/RPmFkuXMQk,1
Fri Oct 06 23:07:12 +0000 2017,Humans Die. Cryptocurrencies Don't. A companion article to my presentation today at #HCPP17. https://t.co/09XOgX5VmL #bitcoin #ethereum,19
Fri Oct 06 22:50:21 +0000 2017,https://t.co/IfCIitGpNg,0
Fri Oct 06 22:32:14 +0000 2017,Update on the Bitcoin SegWit2x hard fork https://t.co/ulxRdOJ09o #bitcoin,0
Fri Oct 06 22:27:16 +0000 2017,The latest The Blockchain (database) Daily! https://t.co/LncNWtUy12 #bitcoin,2
Fri Oct 06 21:58:17 +0000 2017,Bitcoin resistance might be to much! $BTCUSD https://t.co/7DGwMs6htW,0
Fri Oct 06 21:50:51 +0000 2017,Which 10 countries are best positioned to go #Cashless? #banking #fintech #bitcoin @MikeQuindazzi https://t.co/qxxIkfIUaN,55
Fri Oct 06 21:49:29 +0000 2017,OKEx Responds to Bitcoin Theft  Says Exchange is Safe https://t.co/q1Ho34XeU1 https://t.co/v3VFAQBAiJ,5
Fri Oct 06 21:44:08 +0000 2017,Sweden Poised to Become Leading Scandinavian Cashless Society through Bitcoin https://t.co/murkUb7nwv https://t.co/upKzKwtqEH,14
Fri Oct 06 21:43:58 +0000 2017,What  Jamie? Bitcoin Price Regains Pre-FUD $4 400 Heights  NEO Jumps 15% https://t.co/APXYEIjjE4 https://t.co/jlStCJZ7OU,4
Fri Oct 06 21:43:49 +0000 2017,Report: Goldman Sachs Considering Bitcoin Services for Clients https://t.co/Jn2LSe0KhJ https://t.co/8CLGPlfk37,7
Fri Oct 06 21:43:17 +0000 2017,OKEx Responds to Bitcoin Theft  Says Exchange is Safe https://t.co/q1Ho34XeU1 https://t.co/v3VFAQBAiJ,5
Fri Oct 06 21:43:12 +0000 2017,Bitcoin Fees Chasing Businesses Away  Dash  Litecoin Benefit https://t.co/KAWdcKUVVq https://t.co/IXhzAGsBbB,4
Fri Oct 06 21:39:41 +0000 2017,y'all no offense but bitcoin is so dumb. It's so... inaccessible. like it's another one of those things wypipo in the middle class do,0
Fri Oct 06 20:33:55 +0000 2017,Where The Jobs Are: Blockchain Tech Spreads Beyond Bitcoin | CNBC https://t.co/wGCw2Hiohq via @YouTube https://t.co/mMqWcvQiI4,0
Fri Oct 06 20:23:35 +0000 2017,DANGER! China Capital Regulation Will Cause a Bitcoin Crash! https://t.co/UhCFZxdekt via @YouTube https://t.co/mMqWcw7U6E,0
Fri Oct 06 20:22:17 +0000 2017,171005 Social Bitcoin FIX https://t.co/HR8PERsVCo via @YouTube https://t.co/mMqWcvQiI4,0
Fri Oct 06 20:00:44 +0000 2017,Uncovering facts on #blockchain https://t.co/wrPdBL39rY  #bitcoin #cryptocurrency #finance #Entrepreneur #economy… https://t.co/JvK5K2Lo1r,10
Fri Oct 06 19:55:07 +0000 2017,Bitcoin: Why Fidelity Is Mining Ethereum | Fortune https://t.co/nsp7WtA8VT,0
Fri Oct 06 19:50:42 +0000 2017,Which 10 countries are best positioned to go #Cashless? #banking #fintech #bitcoin @MikeQuindazzi https://t.co/qxxIkfIUaN,55
