Sat Jun 23 23:59:51 +0000 2018,The left leads us to believe they speak “truth to power” when in reality they just speak lies to attain power,467
Sat Jun 23 23:58:45 +0000 2018,Did you know:   There were 2 890 murders in May in Mexico  roughly 93 per day.   Mexico also has some of the strict… https://t.co/NEubcMbLcx,10447
Sat Jun 23 23:51:06 +0000 2018,Is Bitcoin the Future  or an Echo of a Failed Past? - The Wall Street Journal https://t.co/0axPYUtHsW,0
Sat Jun 23 23:44:03 +0000 2018,Bitcoin Magazine’s Week in Review: Fortunes and Fallacies https://t.co/nwjdR7mcON https://t.co/pcuaFmCGpE,0
Sat Jun 23 23:17:42 +0000 2018,I liked a @YouTube video https://t.co/52n6X9d8eP Bitcoin Is Crashing (And That's A GOOD THING!),0
Sat Jun 23 23:05:04 +0000 2018,Analyst Predicts Bitcoin Price Rebound Above $10 000 by 2019 https://t.co/yBj1cp2YW5 https://t.co/mD3HwmscBf,2
Sat Jun 23 22:41:17 +0000 2018,#blockchain #fintech #finance #federalreserve #centralbank #crypto   Via @BTCTN US Federal Reserve Launches Cryptoc… https://t.co/MIkc6GHytJ,0
Sat Jun 23 22:32:42 +0000 2018,how many bear market crashes since #bitcoin launched in 2009:  #crypto #binance #coinbase #blockchain #bitcoin #cryptocurrency #trading,0
Sat Jun 23 22:26:14 +0000 2018,everyone lost so much money in this bear market  but all they had to do was hodl  these cycles happen to… https://t.co/EH8CEBHvTY,0
Sat Jun 23 22:07:39 +0000 2018,My prediction of the bitcoin future while then next months $BTCUSD https://t.co/n1T2e7yqDp,0
Sat Jun 23 21:59:02 +0000 2018,BCC(BCH)/USDT Where we\u2026 $BCCUSDT https://t.co/6rRxAByPcg,0
Sat Jun 23 21:44:05 +0000 2018,Blockchain Is Not Just Bitcoin @InsideSources https://t.co/RGvPuSIaXl #blockchain @evankirstel @MikeQuindazzi… https://t.co/5bvYTy3oK7,24
Sat Jun 23 21:35:33 +0000 2018,Bitcoin Price Analysis $BTCUSD https://t.co/yKvIdebuou,0
Sat Jun 23 21:23:32 +0000 2018,Cought up with @CharlieShrem at @nasdaq to talk about Bitcoin Mt. Gox trade by #NobuakiKobayashi and much more.. wa… https://t.co/s4GsQeXrHq,40
Sat Jun 23 21:14:08 +0000 2018,Bitcoin Fractal Playing Out $XBTUSD https://t.co/61HGcv0JOp,1
Sat Jun 23 20:32:45 +0000 2018,Earn extra doing gigs at Gigapp!  #freelancers #gigs #blockchain #cryptocurrency #bitcoin #fintech https://t.co/VE50G0go2V,67
Sat Jun 23 20:32:37 +0000 2018,Earn extra doing gigs at Gigapp!  #freelancers #gigs #blockchain #cryptocurrency #bitcoin #fintech https://t.co/VE50G0go2V,67
Sat Jun 23 20:32:12 +0000 2018,Gigapp  secure and transparent transactions on the blockchain  #blockchain #Gigapp #gigeconomy #fintech #bitcoin… https://t.co/JsqS31i5Ak,68
Sat Jun 23 20:29:55 +0000 2018,Bitcoin is making a higher 100-day low $BTCUSD https://t.co/MhIYwxEmvr,0
Sat Jun 23 20:22:40 +0000 2018,This is classic “anchoring effect”. Guy won the lottery investing in Bitcoin early. Now thinks that’s how all inves… https://t.co/IjbGZM99Rj,1
Sat Jun 23 20:20:22 +0000 2018,Bitcoin energy usage Mythbusters! #BTC #Cryptocurrency #bitcoin #cryptotrading https://t.co/O6wN7WecnU,0
Sat Jun 23 20:17:26 +0000 2018,Bitcoin is making a higher 100-day low $BTCUSD https://t.co/EmJj7lGaul,0
Sat Jun 23 20:12:23 +0000 2018,Bitcoin is making a higher 100-day low $BTCUSD https://t.co/gbp2lZkxBs,0
Sat Jun 23 20:09:45 +0000 2018,Bitcoin is making a higher 100-day low $BTCUSD https://t.co/jUBD9ie9JE,0
Sat Jun 23 20:06:41 +0000 2018,Bitcoin is making a higher 100-day low $BTCUSD https://t.co/c5OC6cNVFk,0
Sat Jun 23 20:05:43 +0000 2018,Like the butterfly effect  emergent properties are hard to measure because they take time to develop. The meta-supe… https://t.co/pe1YhTxztl,0
Sat Jun 23 20:05:42 +0000 2018,Why do people feel this way? First  when something seems to good to be true  it usually is. The bubble &amp; subsequent… https://t.co/eiJxdNm7Wn,0
Sat Jun 23 20:02:19 +0000 2018,Still waiting for Chinese New Year to end so that my bags can moon. $btc #cryptotrading $eth #Bitcoin,0
Sat Jun 23 19:58:21 +0000 2018,The Bitcoin-Culture Invasion: T-Shirts  Hats  Candles  Mugs  and More - https://t.co/sc6omdCLTE https://t.co/LEs5msn7mw,0
Sat Jun 23 19:57:40 +0000 2018,Bitcoin logarithmic chart Elliott waves $BLX https://t.co/Oun0mdSNN0,0
Sat Jun 23 19:57:04 +0000 2018,Bitcoin is making a higher 100-day low $BTCUSD https://t.co/iZVl1gR1YQ,0
Sat Jun 23 19:55:50 +0000 2018,Look what's up: Bitcoin Prices Extend Losses  Hit New 2018 Low https://t.co/Yi9Blkgsxv via @AJBCSurveys #trending… https://t.co/ZLa3iWhRTs,0
Sat Jun 23 19:53:36 +0000 2018,Der Jäger (jogo Eletrônico) - Wikipedia  Buch Enciclopèdia bitcoin usb - https://t.co/QdO5oFWYuA,0
Sat Jun 23 19:36:52 +0000 2018,Really wish this cryptocurrency future would get on with it and become mainstream already. My bank was closed at 1… https://t.co/DyQ3wPr69t,0
Sat Jun 23 19:35:49 +0000 2018,Bitcoin is making a higher 100-day low $BTCUSD https://t.co/W8rIAE6nXW,0
Sat Jun 23 19:31:49 +0000 2018,@DollarVigilante My daughter is planning a lemonade stand this summer. She'll be accepting Bitcoin! 😁,0
Sat Jun 23 19:27:27 +0000 2018,Bitcoin Cash Long on 30 m\u2026 $BCCUSD https://t.co/wwEnQsKyWJ,0
Sat Jun 23 19:02:43 +0000 2018,The bitcoin trade we talked about on tuesdays @CNBCFuturesNow hit its target today.,1
Sat Jun 23 18:50:12 +0000 2018,Bitcoin Weekly Projection Into \u2026 $BTCUSD https://t.co/cdglSD2yz4,0
Sat Jun 23 18:50:02 +0000 2018,This is classic “anchoring effect”. Guy won the lottery investing in Bitcoin early. Now thinks that’s how all inves… https://t.co/IjbGZM99Rj,1
Sat Jun 23 18:40:25 +0000 2018,Blockchain Is Not Just Bitcoin @InsideSources https://t.co/RGvPuSIaXl #blockchain @evankirstel @MikeQuindazzi… https://t.co/5bvYTy3oK7,24
Sat Jun 23 18:40:03 +0000 2018,traits of the 80%:  - have no patience - panic sell - don't understand R/R - try to trade every move - use too many… https://t.co/S3ozDuMT22,0
Sat Jun 23 18:39:32 +0000 2018,The Game of Charts- Bitcoin  not\u2026 $BTCUSD https://t.co/5x1PqKkZXI,1
Sat Jun 23 18:20:12 +0000 2018,Bitcoin to hit 300\u2026 $BTCUSD https://t.co/RodSvtMheF,0
Sat Jun 23 18:09:00 +0000 2018,UPDATED + IMPROVED 2018-19 BITCOIN\u2026 $BTCUSD https://t.co/wSr9Oo0whp,1
Sat Jun 23 18:06:22 +0000 2018,On Dec 17th the CME allowed specs to short Bitcoin  and it's down ~70% since. The game is over. Central banks will… https://t.co/oZ7lIZapQX,2
Sat Jun 23 17:55:19 +0000 2018,#Cryptocurrency scam workshop in #Chicago organized by @FTC Monday June 25th hosted by @DePaulU… https://t.co/FM8Rxevdup,0
Sat Jun 23 17:40:46 +0000 2018,21e800: Bitcoin  Satoshi and the Mystery Twitter Is Obsessing Over via @coindesk https://t.co/qe7GsClKLo via @investitute,25
Sat Jun 23 17:33:25 +0000 2018,I liked a @YouTube video https://t.co/lXzxYUKYd6 Trading Bitcoin - Big Drop from $6 800 to $6100  New Yearly Low Incoming!,0
Sat Jun 23 17:25:29 +0000 2018,@ZacharyMcClure Bitcoin has had so many damn funerals  🙄,0
Sat Jun 23 17:16:38 +0000 2018,#bitcoin $5 625 next (Update)Y/N $BTCUSD https://t.co/3g51TVSmUP,0
Sat Jun 23 17:10:21 +0000 2018,Bitcoin Price Analysis: Is It Over? - https://t.co/b6hiHCi9bp https://t.co/XYayYY9yyt,0
Sat Jun 23 16:59:04 +0000 2018,Ripple ist wieder ein Neuling in der Welt der Kryptowährung. Nicht nur das  sondern auch einer der besten in der Br… https://t.co/wkaeBCHKmK,0
Sat Jun 23 16:52:57 +0000 2018,When blockchain was introduced in 2009  it quickly proved it could secure purchases by computer enthusiasts  networ… https://t.co/FluSQ6yZ86,1
Sat Jun 23 16:45:16 +0000 2018,Blockchain Is Not Just Bitcoin @InsideSources https://t.co/RGvPuSIaXl #blockchain @evankirstel @MikeQuindazzi… https://t.co/5bvYTy3oK7,24
Sat Jun 23 16:40:08 +0000 2018,When blockchain was introduced in 2009  it quickly proved it could secure purchases by computer enthusiasts  networ… https://t.co/FluSQ6yZ86,1
Sat Jun 23 16:34:45 +0000 2018,Hey   have you ever thought that you can buy a #lambo shorting #bitcoin not just buying it ? #Crypto,0
Sat Jun 23 16:34:12 +0000 2018,Bitcoin все  на дно $BTCUSDT https://t.co/GSvog55Kao,0
Sat Jun 23 16:28:37 +0000 2018,Bitcoin fractal $BTCUSD https://t.co/LYmPyhWpFr,0
Sat Jun 23 16:24:57 +0000 2018,Finally  an understandable guide to blockchain technology that is focused on healthcare! Download it for free!… https://t.co/VbjQNYgxAq,1
Sat Jun 23 16:20:03 +0000 2018,Bitcoin 2018 Predict\u2026 $BTCUSD https://t.co/PCxJNXA52v,0
Sat Jun 23 16:18:28 +0000 2018,Bitcoin 2019 Predictions  $BTCUSD https://t.co/t67fu89izF,0
Sat Jun 23 16:12:20 +0000 2018,3 Reasons Why ‘This Is Not the Funeral For Bitcoin ’ According to Brian Kelly - https://t.co/30u2UuJOgg https://t.co/GxK6q1DSJv,0
Sat Jun 23 16:10:05 +0000 2018,Finally  an understandable guide to blockchain technology that is focused on healthcare! Download it for free!… https://t.co/VbjQNYgxAq,1
Sat Jun 23 16:09:58 +0000 2018,Attention!  Bitcoin triangle BULLBACK $BTCUSD https://t.co/8Pof59J3uU,0
Sat Jun 23 16:04:24 +0000 2018,CNBC Holds “Funeral” For Bitcoin  Brian Kelly Says Bitcoin is Still Not Dead - https://t.co/SfQE4B2nMa https://t.co/vWMvHfSD81,0
Sat Jun 23 16:00:22 +0000 2018,Attention!  Bitcoin triangle BULL turn $BTCUSD https://t.co/cj1WNxOu4j,0
Sat Jun 23 15:58:23 +0000 2018,@cryptobiatch @WhalePanda People holding to Bitcoin as an investment like they have mommy issues lol,0
Sat Jun 23 15:57:29 +0000 2018,Attention - Long awaited Bi\u2026 $BTCUSD https://t.co/OIP0i9hofv,0
Sat Jun 23 15:53:29 +0000 2018,Top 11 Decentralized Cryptocurrency Exchanges (plus a tool to aggregate them I haven’t tried yet...homework for ton… https://t.co/WHkH41vpia,21
Sat Jun 23 15:51:23 +0000 2018,Bitcoin Short  $BTCUSD https://t.co/gyx7Du6d72,0
Sat Jun 23 15:41:02 +0000 2018,Quantum Bitcoin: An Anonymous and Distributed Currency Secured by the No-Cloning Theorem of Quantum Mechanics https://t.co/llmChrdKrZ,0
Sat Jun 23 15:39:58 +0000 2018,Bitcoin BTC 1 Hr Technical Analysis $BTCUSD https://t.co/0VZqOoMZdG,0
Sat Jun 23 15:27:05 +0000 2018,Tether Manipulation Pushed Up Bitcoin's Price  Researchers Find |  https://t.co/q9zZTWqfLw https://t.co/fmBKgXbn4z,0
Sat Jun 23 15:25:11 +0000 2018,Blockchain Is Not Just Bitcoin @InsideSources https://t.co/RGvPuSIaXl #blockchain @evankirstel @MikeQuindazzi… https://t.co/5bvYTy3oK7,24
Sat Jun 23 15:13:12 +0000 2018,#Bitcoin is already in retail &amp; #Restaurants so it was only a matter of time the #cryptocurrency took on… https://t.co/xrMEluLcCE,0
Sat Jun 23 15:00:22 +0000 2018,Bitcoin bearish but \u2026 $ETHUSD https://t.co/KuTJB6KdX5,0
Sat Jun 23 14:57:59 +0000 2018,Bitcoin cash will lead th\u2026 $BCHUSD https://t.co/WzBgzI0Dt1,0
