Fri Nov 23 18:02:09 +0000 2018,Boston Scientific backs BTG offer with £3.3bn bridge loan https://t.co/isH3EMWxDs by @loanjunkie,1
Fri Nov 23 16:54:21 +0000 2018,(Freestyle Intro) ft  BTG Nuski  BMG Tanna  BMG Spazz https://t.co/8iQ1E2erDW via @YouTube. Go check it out!!! Like Nd subscribe,0
Fri Nov 23 16:54:01 +0000 2018,Short sale volume(not short interest) for $BTG on 2018-11-21 is 67%. https://t.co/HTZFvCuLUR $HL 64% $MUX 48% $CDE 47%,0
Fri Nov 23 15:42:55 +0000 2018,The only valid sale is Savage X Fenty.   Everyone else can BTG bc y’all are being cheap.,0
Fri Nov 23 13:56:38 +0000 2018,Pressure Defense or Split 🤔 #BTGBasketball #PlayoffReady 🏀🏀🏀 @ Brooklyn  New York https://t.co/tKP7b2deow,0
Fri Nov 23 09:03:26 +0000 2018,@CalvinAyre Hire me as marketing manager and I’ll create #BSVPay for you like I did with $BTG and $BCD. I will make… https://t.co/dV8gEV0c4m,0
Fri Nov 23 05:32:45 +0000 2018,Our Final Announcement of the day: We have heard from many of you in the community lately about joining BTG - So he… https://t.co/y36tGBpfgE,25
Fri Nov 23 05:09:36 +0000 2018,Our Final Announcement of the day: We have heard from many of you in the community lately about joining BTG - So he… https://t.co/y36tGBpfgE,25
Fri Nov 23 04:59:26 +0000 2018,Every day we see so many talented and hardworking individuals chasing their dreams - Today we are thankful followin… https://t.co/EQnGrDFQIO,15
Fri Nov 23 03:16:18 +0000 2018,Every day we see so many talented and hardworking individuals chasing their dreams - Today we are thankful followin… https://t.co/EQnGrDFQIO,15
Fri Nov 23 00:37:26 +0000 2018,(screaming) uh oh  the french part in psycho killer comes to town i ain't got time for that now,1
