Thu Nov 08 23:30:02 +0000 2018,Check out X-Cash https://t.co/OesaSqfVZf New #cryptocurrency Join the Discord Channel here https://t.co/zI5pnkDlaj… https://t.co/16MTYUkiWH,1
Thu Nov 08 23:24:10 +0000 2018,Check out X-Cash https://t.co/OesaSqfVZf New #cryptocurrency Join the Discord Channel here https://t.co/zI5pnkDlaj… https://t.co/16MTYUkiWH,1
Thu Nov 08 23:18:31 +0000 2018,X-CASH Mining Pool  https://t.co/Ih1aCje1Up  Location - #USA - #Dallas TX 💯 SSD Dedicated Server ⛏ Dedicated T1 Con… https://t.co/LapBhdck49,0
Thu Nov 08 23:00:01 +0000 2018,Do you want to know more about blockchain and cryptocurrencies? Here are a few books to help you gain knowledge.… https://t.co/HJdxrbsUBZ,0
Thu Nov 08 22:50:00 +0000 2018,JP Morgan's Ethereum [ETH] based blockchain Quorum to tokenize gold bars https://t.co/Q1fsCuVjz9 #cryptocurrency… https://t.co/BLLlbg1xs0,0
Thu Nov 08 21:40:00 +0000 2018,Bitcoin Wiki-Wikipedia of Blockchain https://t.co/ekiY012WkU #cryptocurrency #blockchain #ai #bitcoin #ethereum,0
Thu Nov 08 21:30:36 +0000 2018,RT coindesk "Do you own a #cryptocurrency other than #bitcoin?  More from the MarketWatch/#CoinDesk sentiment study… https://t.co/hmpQlU0u1K,0
Thu Nov 08 21:00:41 +0000 2018,A quick comparison of crypto trading and forex trading for all interested investors. #cryptocurrency #Forex https://t.co/OlC8k2ozoa,0
Thu Nov 08 19:58:07 +0000 2018,bitcoin and blockchain in Las Vegas - World Crypto Con https://t.co/D9FKImco9o #cryptocurrency #blockchain #ai #bitcoin #ethereum,1
Thu Nov 08 19:21:16 +0000 2018,The crypto acquisitions this year in the midst of all the volatility.  #cryptocurrency  https://t.co/OXDC9pJfoT,0
Thu Nov 08 19:20:04 +0000 2018,bitcoin and blockchain in Las Vegas - World Crypto Con https://t.co/D9FKImco9o #cryptocurrency #blockchain #ai #bitcoin #ethereum,1
Thu Nov 08 17:13:24 +0000 2018,https://t.co/EQ7t9osR4h  #cryptocurrency #cryptocurrencies #bitcoin #bitcoinnews #btc #ethereum #eth,0
Thu Nov 08 16:58:32 +0000 2018,eToro rolls out its cryptocurrency wallet for Android and iOS https://t.co/mhO9CQjF2z,0
Thu Nov 08 16:35:02 +0000 2018,Google CEO's Son Adopts Crypto  Mines Ethereum (ETH) https://t.co/yikU73wn19 #cryptocurrency #blockchain #ai #bitcoin #ethereum,0
Thu Nov 08 15:58:04 +0000 2018,SEC charges EtherDelta founder with running unregistered securities exchange https://t.co/wfFhC4l6kG,0
Thu Nov 08 15:53:21 +0000 2018,BizTV SPECIAL -- Watch #Blockchain Superstars this Sat  Nov 10 @ 3pm ET. This cutting-edge #Business &amp; Information… https://t.co/NvDKO5caq3,0
Thu Nov 08 15:42:54 +0000 2018,The biggest news story today in cryptocurrency is that DEX's are being shut down.  But this story is more fun so le… https://t.co/3RbGrAXNEp,0
Thu Nov 08 15:33:04 +0000 2018,Interestingly  renowned cryptocurrency and blockchain expert Dr. Corey Petty weighs in on an updated opinion on Rog… https://t.co/RkyYcUXbxh,0
Thu Nov 08 15:28:13 +0000 2018,Hackers hide cryptocurrency mining malware in Windows installation files https://t.co/DC83LC8liR,0
Thu Nov 08 15:09:53 +0000 2018,When arguing a logical point  one technique you can use is to empty our your hotel mini-bar while justifying drug s… https://t.co/j3ry8D9jQM,0
Thu Nov 08 15:03:33 +0000 2018,#FINANCEX #FNX #cryptocurrency #ICO #blockchain #tokensale #ETH #BTC @FNX https://t.co/UAxkTTYz2n,0
Thu Nov 08 15:01:11 +0000 2018,Great technical solution  great team. Success is imminent I believe in the idea and implementation of the project.… https://t.co/hMakV6NUk5,0
Thu Nov 08 15:00:56 +0000 2018,The crypto acquisitions this year in the midst of all the volatility.  #cryptocurrency  https://t.co/OXDC9pJfoT,0
Thu Nov 08 14:48:32 +0000 2018,FAMEONE Token brilliant idea of the project! It is necessary to participate in order not to miss the opportunity!… https://t.co/aB41XmxdCp,0
Thu Nov 08 14:15:01 +0000 2018,Vitalik Buterin is Not Stepping Away from Ethereum https://t.co/uz5HLCSABs #cryptocurrency #blockchain #ai #bitcoin #ethereum,0
Thu Nov 08 14:10:21 +0000 2018,https://t.co/BCq6UfiS5m Cryptocurrency  Blockchain–It appears the ongoing bearish market of 2018 is finally having… https://t.co/Vd4KpAuX5h,0
Thu Nov 08 13:36:11 +0000 2018,"There are so many opportunities to learn for FREE. There is no excuse. You have to take advantage. Here is a list… https://t.co/tqVHAWYRBG,8
Thu Nov 08 13:33:18 +0000 2018,Researcher behind Monero’s crypto system awarded prestigious prize https://t.co/dauwem7mXk,0
Thu Nov 08 13:10:02 +0000 2018,Bitcoin and Blockchain https://t.co/Vw7OSoahU6 #cryptocurrency #blockchain #ai #bitcoin #ethereum,0
Thu Nov 08 12:00:22 +0000 2018,Final Thoughts: Ethereum Devcon4 &amp; Ethereum 2.0 (Serenity) https://t.co/mEPLGJsuKM #cryptocurrency #blockchain #ai #bitcoin #ethereum,0
Thu Nov 08 11:54:24 +0000 2018,For a long time I have been watching the development of the project and my friends too. Interesting project...… https://t.co/wpBrskENvy,0
Thu Nov 08 11:54:06 +0000 2018,This is undoubtedly the most excellent project on the market from the existing ones. I tell everyone about you and… https://t.co/otzrichYLO,0
Thu Nov 08 10:30:15 +0000 2018,Bitcoin  Ethereum  Ripple  Bitcoin Cash  EOS  Stellar  Litecoin  Cardano  Monero  TRON: Price Analysis  November 2… https://t.co/iJdkrDiSEi,0
Thu Nov 08 09:54:39 +0000 2018,Earn an abundant bonus  because BlockAIp Token is a great opportunity for you to invest in cryptocurrency.… https://t.co/u9oyy2tSMe,1
Thu Nov 08 09:54:22 +0000 2018,Earn an abundant bonus  because BlockAIp Token is a great opportunity for you to invest in cryptocurrency.… https://t.co/u9oyy2tSMe,1
Thu Nov 08 09:42:29 +0000 2018,Blinked is a social media recommendation platform run by a group of qualified individuals  which grants users up to… https://t.co/4lpG3WOetR,0
Thu Nov 08 09:41:58 +0000 2018,#Blinked #ICO #marketplace #cryptocurrency #TokenSale #Crypto #blockchain #socialnetwork #smallbusiness… https://t.co/0HFTW48LKf,0
Thu Nov 08 09:35:43 +0000 2018,The very good project.   leverages blockchain technology in two manners Read more WP. It is very interesting to obs… https://t.co/Uv3HfRCNeC,0
Thu Nov 08 09:35:19 +0000 2018,A must watch project with a fresh concept that is worth to contribute with. Its have big future! You make smart and… https://t.co/DhdeTUrdjN,0
Thu Nov 08 09:34:31 +0000 2018,#@Socialbitether #bitether #BTR #Bitether #growbitether#ICO #blockchain #cryptocurrency #cryptoworld https://t.co/Xveg1ag25V,0
Thu Nov 08 09:34:15 +0000 2018,#@Socialbitether #bitether #BTR #Bitether #growbitether#ICO #blockchain #cryptocurrency #cryptoworld https://t.co/bxlK5ycTOQ,0
Thu Nov 08 09:34:05 +0000 2018,#@Socialbitether #bitether #BTR #Bitether #growbitether#ICO #blockchain #cryptocurrency #cryptoworld https://t.co/wUQuRdFwTa,0
Thu Nov 08 09:33:55 +0000 2018,FINANCEX EXCHANGE If you look closely  it seems to me that this is a very promising and interesting campaign.… https://t.co/hry4bLdbpR,0
Thu Nov 08 09:33:07 +0000 2018,FAMEONE is a wonderful project that brings real benefits to people all over the world  I am happy to be a part of t… https://t.co/JnnY1CnY5L,0
Thu Nov 08 09:31:18 +0000 2018,I really like this company  an extraordinary attitude is a great project!. Join now.. #Gric #Griccoin #Agric… https://t.co/6Q229kZhLs,0
Thu Nov 08 09:30:15 +0000 2018,#Gric #Griccoin #Agric #Farmpartner #ICO #blockchain #cryptocurrency #cryptomoney #crypto #cryptoworld https://t.co/IN8iQfC666,0
Thu Nov 08 09:30:07 +0000 2018,#Gric #Griccoin #Agric #Farmpartner #ICO #blockchain #cryptocurrency #cryptomoney #crypto #cryptoworld https://t.co/nISkIrAQWR,0
Thu Nov 08 09:29:59 +0000 2018,#Gric #Griccoin #Agric #Farmpartner #ICO #blockchain #cryptocurrency #cryptomoney #crypto #cryptoworld https://t.co/tJA8bK4u87,0
Thu Nov 08 09:28:54 +0000 2018,An excellent project is not the right word! I hope that this platform will have the popularity of crypto currency … https://t.co/3hwcmjYjhY,0
Thu Nov 08 09:26:42 +0000 2018,This looks special project with really promising potential. It will be very interesting for everyone. Best of luck… https://t.co/NrBFHbXhPo,0
Thu Nov 08 09:26:12 +0000 2018,I joined this project FAMEONE Token because it have a great team  partners and goals. Join now..   #Fameone #ICO… https://t.co/WXoPjefAq0,0
Thu Nov 08 09:23:17 +0000 2018,What can I say about the project? The project is really interesting. And unlike other similar there are many new pr… https://t.co/9KeUUPZs5O,0
Thu Nov 08 09:09:48 +0000 2018,Awesome team! it's a really perspective project! Team doing the best  success for sure! ... #ICO #FINANCEX #FNX… https://t.co/b4Dui5SifR,0
Thu Nov 08 09:08:58 +0000 2018,Great project! See what a professional team I think he has more future! Good opportunity to earn money by investing… https://t.co/wZpWYRJT4T,0
Thu Nov 08 09:00:26 +0000 2018,I am glad to see honest information on the project. Despite all difficulties which have affected team it is clear t… https://t.co/svlOdbxbLT,0
Thu Nov 08 08:44:59 +0000 2018,The developers did a good job on this project a great idea which is good for investiruya and investors I would like… https://t.co/ItJq5DB93r,0
Thu Nov 08 08:12:07 +0000 2018,It's Grand! I like the idea behind this project  I can only wish the dev success in MPCX. #MPCXP #Cryptocurrency… https://t.co/45dwou6MEB,0
Thu Nov 08 08:00:12 +0000 2018,The cryptocurrency market finds some stability post the mid-term elections in the US. #cryptocurrency  https://t.co/8g29MH3z5I,0
Thu Nov 08 06:53:10 +0000 2018,Be one of the first who will receive coins of this company! The surprising and perspective project. #Fameone #ICO… https://t.co/3d75GqOBBY,0
Thu Nov 08 05:20:58 +0000 2018,The QUICKCOIN platform gauges the interest level of the user about a topic based on the sum of the scores for Corre… https://t.co/pbEV1JXqil,0
Thu Nov 08 05:14:22 +0000 2018,Blink Holiday power marketing  which will be the beginning of decentralized Advertising sale Administration.… https://t.co/SIhQzJugFr,1
Thu Nov 08 05:14:16 +0000 2018,#Blinked #ICO #marketplace #cryptocurrency #TokenSale #Crypto #blockchain #socialnetwork #smallbusiness… https://t.co/B95PeY4duJ,1
Thu Nov 08 05:13:46 +0000 2018,Blink Holiday power marketing  which will be the beginning of decentralized Advertising sale Administration.… https://t.co/SIhQzJugFr,1
Thu Nov 08 05:13:38 +0000 2018,#Blinked #ICO #marketplace #cryptocurrency #TokenSale #Crypto #blockchain #socialnetwork #smallbusiness… https://t.co/B95PeY4duJ,1
Thu Nov 08 04:46:07 +0000 2018,#Blockchain &amp; #Bitcoin   #FinTech #IoT #SmartCity #startups #APIs #Security Fisher85M ravikikan mclynd #DataScience… https://t.co/cXekoSBGOd,8
Thu Nov 08 04:37:47 +0000 2018,The $PMB Token is heading to Wall Street. Tmrw (11/8)  financial executives and cryptocurrency influencers welcome… https://t.co/kfCD9ugE3u,2
Thu Nov 08 03:56:13 +0000 2018,"There are so many opportunities to learn for FREE. There is no excuse. You have to take advantage. Here is a list… https://t.co/tqVHAWYRBG,8
Thu Nov 08 03:46:03 +0000 2018,#FINANCEX #FNX #cryptocurrency #ICO #blockchain #tokensale #ETH #BTC @FNX https://t.co/TcFaqwGmtD,0
Thu Nov 08 03:45:39 +0000 2018,Given the projection of these principles into the increasing trading volume of the FAME token  an uptrend in the va… https://t.co/7secYxo5Cl,0
Thu Nov 08 03:30:36 +0000 2018,#FINANCEX #FNX #cryptocurrency #ICO #blockchain #tokensale #ETH #BTC @FNX https://t.co/A76GfHynYK,0
Thu Nov 08 03:30:11 +0000 2018,FAMEONE holders can reant a car using FAMEONE in certain Mediterranean countries  purchase flight tickets from FAME… https://t.co/xzIKG0Oxmf,0
Thu Nov 08 02:39:08 +0000 2018,Blockchain: More than Cryptocurrency: https://t.co/8wUE0CVzv4 via @ParksAssociates,1
Thu Nov 08 02:10:01 +0000 2018,Canada's first bitcoin-backed lender https://t.co/EVO55O1Qmu #cryptocurrency #blockchain #ai #bitcoin #ethereum,0
Thu Nov 08 01:00:21 +0000 2018,The cybercrime police of California place highest priority on sim swapping in its fight against cryptocurrency frau… https://t.co/sc9sjTvh1j,0
Thu Nov 08 00:30:15 +0000 2018,Satoshi Nakamoto's Bitcoin whitepaper turns 10 today. Happy Anniversary  blockchain! https://t.co/t27ewgq2oC… https://t.co/EfiRA0idmB,0
