Thu Dec 27 21:26:08 +0000 2018,This is what you want to see to call this a legitimate potential bottom in #Bitcoin Textbook inverse head and shoul… https://t.co/2XURuM2YPK,1
Thu Dec 27 21:25:56 +0000 2018,@PeterLBrandt @NassarInvesting @HoagsIV @GlobalProTrader @PeterSchiff @coindesk @mBTCPizpie @AdamMancini4… https://t.co/H3JWCi7hzj,0
Thu Dec 27 21:16:44 +0000 2018,Tax season is coming up. Don’t forget you can utilize those Bitcoin loses to offset your other gains. https://t.co/kZB3TiD2b1,0
Thu Dec 27 19:36:01 +0000 2018,Tax season is coming up. Don’t forget you can utilize those Bitcoin loses to offset your other gains.,0
Thu Dec 27 19:17:44 +0000 2018,@OTC_Bitcoin    Seems like this recent(last 15 minutes) DIP is just what you were saying you wanted to see happen..… https://t.co/bPKJsAqzjn,0
Thu Dec 27 19:10:07 +0000 2018,Remember Bitcoin? Some Investors Might Want to Forget https://t.co/WHOGRPwOhS https://t.co/RzebFTOEiD,0
Thu Dec 27 18:42:40 +0000 2018,Remember Bitcoin? Some investors might want to forget https://t.co/kGUgRYOX3P  Some investors: https://t.co/wFof97hgxv,0
Thu Dec 27 14:34:18 +0000 2018,If it's retroactive this would really save those people who got absolutely destroyed by trading their bitcoin at th… https://t.co/RHV6De29Re,0
Thu Dec 27 12:24:56 +0000 2018,#crypto #cryptocurrency #altcoins #bitcoin #altcoin #ethereum #xrpthestandard #cryptocurrencies… https://t.co/lLyF8XB2vu,0
Thu Dec 27 12:13:10 +0000 2018,#Bitcoin Exchange Giant #Huobi Announces Post-Christmas Layoffs https://t.co/PVTMjUpHRT,0
Thu Dec 27 10:09:18 +0000 2018,"Remember Bitcoin? Some Investors Might Want to Forget" by NELLIE BOWLES via NYT https://t.co/gF1HFFHT20 https://t.co/t0DF3Kzg2Q,0
Thu Dec 27 10:08:04 +0000 2018,"Remember Bitcoin? Some Investors Might Want to Forget" by NELLIE BOWLES via NYT https://t.co/gF1HFFHT20 https://t.co/5Y5ZOQNaIq,0
Thu Dec 27 03:05:16 +0000 2018,Wine Retailer to Buy Majority Stake in Japanese Bitcoin Exchange for $30M https://t.co/bDEfVOcE03 https://t.co/fMEmwuokDX,0
Thu Dec 27 01:33:06 +0000 2018,Is investing in Bitcoin a good idea for $$$? Follow me to find out! https://t.co/Dy7fcOrO5A,26
Thu Dec 27 00:43:48 +0000 2018,15 #Bitcoin  #Litecoin  Ethereum &amp; Altcoins WordPress Plugins - https://t.co/rPvEJKPZe3 - #Altcoin #TopPlugins https://t.co/gmkrS9mIlj,0
