Tue Jan 30 16:48:30 +0000 2018,LOOOOOOOOOOOOOOOOOOOOOL YALL ARE FOOLS  ZanMan Trippin - Bitcoin (Official Music Video) https://t.co/uL4UN1nbuk via @YouTube,0
Tue Jan 30 16:34:51 +0000 2018,*bitcoin has one good day after a month of slow and steady decline*  every online publication: experts say bitcoin… https://t.co/15SXl4q7ZG,0
Tue Jan 30 16:30:12 +0000 2018,Bitcoin futures the gayest shit to happen to crypto bitcoin be correcting every week now,0
Tue Jan 30 16:29:16 +0000 2018,I can make peace with high fees of #Bitcoin   personally. I can't make peace with the fact that #BTC is losing out… https://t.co/1vCEQFLg38,0
Tue Jan 30 16:29:07 +0000 2018,"Kodak’s Dubious Blockchain Gamble" by KEVIN ROOSE via NYT https://t.co/Tu4scBW1TS https://t.co/8YdfPjOpAo,0
Tue Jan 30 16:19:41 +0000 2018,Good going Richard. If she has your money  she won't ever need bitcoin anyhow. She will be diseased before Crypto t… https://t.co/VFQmdhtL7x,0
Tue Jan 30 16:14:21 +0000 2018,@Crypto_Bitlord &gt;still owning bitcoin in 2018,0
Tue Jan 30 15:51:22 +0000 2018,I added a video to a @YouTube playlist https://t.co/cMBItnOIAH Should You Invest in Bitcoin  Litecoin  Ethereum  Waves  or any,0
Tue Jan 30 15:42:54 +0000 2018,What's in your wallet? Is it Bitcoin? Are we stupid for not investing in Bitcoin? Follow me for the latest on Bitco… https://t.co/VjVHmHbngM,23
Tue Jan 30 15:28:47 +0000 2018,@padresj Bitcoin is a pyramid scheme. You either got in at the beginning or you get to be the sucker who pays those… https://t.co/USPgNWDwWX,0
Tue Jan 30 15:27:46 +0000 2018,Have you thought about investing in Bitcoin? Is it a wise investment? What are the risks? Follow me for my thoughts… https://t.co/69o9Js5M27,31
Tue Jan 30 15:07:39 +0000 2018,@lolatlala If anyone says “bitcoin” stuff them in a locker,0
Tue Jan 30 14:54:54 +0000 2018,The #HOQU Project has attended the Coin Agenda Summit  #Bitcoin &amp; #DigitalCurrency Investors Conference on January 7–8 in Las Vegas. 🇺🇸,0
Tue Jan 30 14:29:24 +0000 2018,Over 1 Million People in Line for Robinhood’s #Bitcoin Trading App https://t.co/16sWMJixly via @BTCTN,0
Tue Jan 30 14:07:36 +0000 2018,@CryptoTopak exaggerated or complete fabricated news of partnerships  read multiple instances where vitalik picks t… https://t.co/X3vbKAX3Lx,0
Tue Jan 30 13:59:27 +0000 2018,The latest The Dr Sarah Ullman Daily! https://t.co/kChH52w402 #bitcoin #news,0
Tue Jan 30 13:33:26 +0000 2018,Brands implementing #blockchain today hope to capture #Bitcoin magic.  But magic is hard to replicate.… https://t.co/BbRRBWo6QW,4
Tue Jan 30 13:30:12 +0000 2018,Why You Should Be Skeptical Of #Blockchain  Despite The #Bitcoin #Hype | IBT https://t.co/93SfY47kR5,0
Tue Jan 30 13:26:02 +0000 2018,Bitcoin boom to give AMD earnings a boost  says MKM Partners - https://t.co/ELC1jLQpiL,0
Tue Jan 30 13:16:02 +0000 2018,#Bitcoin: A #cheatsheet for professionals #cryptocurrency | TechRepublic https://t.co/ZQYznSsSUF,0
Tue Jan 30 13:08:02 +0000 2018,Weiss Rating Firm Rates Bitcoin and gets Hacked https://t.co/NwhXDWkgd4 by @Askcyber01 https://t.co/rOXTjfN472,0
Tue Jan 30 12:58:12 +0000 2018,Yes  Bitcoin Crashed. But Another Big Cryptocurrency is Pushing Record Highs Again https://t.co/vS9nHByZQs https://t.co/VV8Bau6dUL,0
Tue Jan 30 12:29:30 +0000 2018,‘Without this bitcoin price would collapse’ https://t.co/MKGlbfE67i,0
Tue Jan 30 12:12:23 +0000 2018,Bitcoin exchange robbed by real-life bank robbers with real-life guns via CyberHire - https://t.co/6EqZ88Fz3e #cybersecurity,0
Tue Jan 30 12:05:46 +0000 2018,What's all the Bitcoin hype about? Well  it has to do with being a volatile currency. Could that mean more $$$? Fol… https://t.co/8UYEKxrRu8,28
Tue Jan 30 12:02:09 +0000 2018,Why the Bitcoin Boom Will End in Tears https://t.co/27zfNLeidG https://t.co/gWuhDMW7fG,0
Tue Jan 30 12:02:07 +0000 2018,Why the Bitcoin Boom Will End in Tears https://t.co/QCeDHAXGJG https://t.co/lMe7GzlFYx,0
Tue Jan 30 11:54:42 +0000 2018,The Shift: Kodak’s Dubious Blockchain Gamble https://t.co/VNsgUJICSW #BitcoinCurrency #ComputersandtheInternet… https://t.co/0CcURiksNI,0
Tue Jan 30 11:48:33 +0000 2018,Bitcoin Going Down and Volumetric Analysis Principles - https://t.co/ggvx6qXnMB,0
Tue Jan 30 11:42:15 +0000 2018,Absolutely true. But even those uses are still complicated  uncertain stories today. E.g. here's what the crypto ec… https://t.co/WmlxZRX8Aw,0
Tue Jan 30 11:23:54 +0000 2018,Wie 50 Cent plötzlich Bitcoin-Millionär wurde https://t.co/z23HmhoYOU https://t.co/QogJEqnf6J,0
Tue Jan 30 11:23:05 +0000 2018,What Bitcoin Can Teach You about Marketing | Ep. #548 https://t.co/h8nBqZZSPK #makemoneyonline,0
Tue Jan 30 11:18:59 +0000 2018,Total of all bets 25 082 864 Doge OR 15.3 Bitcoin or 951 Litecoin or 143 Ethereum or $166 447 USD   25082864 DOGE →… https://t.co/GNbNHLAthF,0
Tue Jan 30 10:29:59 +0000 2018,What's in your wallet? Is it Bitcoin? Are we stupid for not investing in Bitcoin? Follow me for the latest on Bitco… https://t.co/VjVHmHbngM,23
Tue Jan 30 10:08:13 +0000 2018,"Kodak’s Dubious Blockchain Gamble" by KEVIN ROOSE via NYT https://t.co/FdHNozBUlC https://t.co/Ev9OWawiyr,0
Tue Jan 30 10:08:06 +0000 2018,"Kodak’s Dubious Blockchain Gamble" by KEVIN ROOSE via NYT https://t.co/FdHNozBUlC https://t.co/8JuRNaQJuR,0
Tue Jan 30 09:10:10 +0000 2018,Is Bitcoin in your wallet? Are we stupid for not investing in Bitcoin? $$$ Follow me to find out! https://t.co/3fhEUusd4S,33
Tue Jan 30 08:09:21 +0000 2018,RT britz: “Bitcoin” by nntaleb /it may just be the continued evolution and expansion of #Wirearchy… https://t.co/zWz0B0dmkz,0
Tue Jan 30 07:59:14 +0000 2018,I separated the Satoshi Whitepaper so it can be coherently tweeted in sections. Tweet to protest  tweet to celebrat… https://t.co/RC2Zq23q57,1
Tue Jan 30 07:48:42 +0000 2018,I separated the Satoshi Whitepaper so it can be coherently tweeted in sections. Tweet to protest  tweet to celebrat… https://t.co/RC2Zq23q57,1
Tue Jan 30 07:38:03 +0000 2018,Big plans coming.. stay tuned 😎 $cmpco #campuscoin #cmpco #bitcoin #btc #crypto #cryptocurrency #ethereum #eth… https://t.co/yh1LHAakgD,8
Tue Jan 30 06:41:00 +0000 2018,I added a video to a @YouTube playlist https://t.co/JFu8FkpMyP Top 3 Bitcoin Debit Cards,0
Tue Jan 30 06:15:37 +0000 2018,Bitfury Enters Bitcoin Crime-Fighting Business with Crystal Launch - After years of working with clients who were l… https://t.co/uic9lRJCYQ,0
Tue Jan 30 05:00:32 +0000 2018,my favorite portion of the #bitcoin #satoshi #whitepaper $btc  it TRULY is metaphorical at the moment in #BTC histo… https://t.co/hxwPLN3z8V,0
Tue Jan 30 04:55:55 +0000 2018,7 pcs BITCOIN CRYPTOCURRENCY Sticker Decal Orange Black White Vinyl BTC | eBay https://t.co/bQiNMXgnnL,0
Tue Jan 30 04:32:43 +0000 2018,South Korea resumes crypto trading in few hours. Buy Volume $$$ #crypto #cryptocurrency #cryptonews #bitcoin #btc… https://t.co/Jk9Srrsavc,10
Tue Jan 30 04:19:39 +0000 2018,WIN A FREE $20 to #Amazon! ➡the #giveaway link is in our pinned tweet!⬅ #SoundCloud #Music #bitcoin #twitch… https://t.co/1DAqiuu0cK,90
Tue Jan 30 04:19:25 +0000 2018,Check out our #Amazon egiftcard #giveaway going on now 👉link is in our pinned tweet!!👈 #giveaways #Competition… https://t.co/5UVEX4DbPM,99
Tue Jan 30 04:19:21 +0000 2018,WIN A FREE $20 to #Amazon! ➡the #giveaway link is in our pinned tweet!⬅ #SoundCloud #Music #bitcoin #twitch… https://t.co/1DAqiuu0cK,90
Tue Jan 30 04:08:38 +0000 2018,Bitcoin cloud mining HashNest movie : From sand to bitcoin https://t.co/BHBSN1ufBD,2
Tue Jan 30 04:04:37 +0000 2018,New Vid  Get Excited Pals!  https://t.co/qFSgplnXiZ  #Litecoin #litecoinmillionaire #LTC #LTC2018 #LTCUSDT… https://t.co/aFPFIX82m9,0
Tue Jan 30 03:58:27 +0000 2018,Bitcoin cloud mining HashNest movie : From sand to bitcoin https://t.co/BHBSN1ufBD,2
Tue Jan 30 03:47:02 +0000 2018,I liked a @YouTube video https://t.co/wV9YVuL6Yg 10 best places to buy bitcoin with a credit debit card or PayPal in USA 2018,0
Tue Jan 30 03:41:00 +0000 2018,me right before i buy $10 in bitcoin: https://t.co/m4PvUvAIXE,2
Tue Jan 30 03:39:25 +0000 2018,me right before i buy $10 in bitcoin: https://t.co/m4PvUvAIXE,2
Tue Jan 30 03:37:41 +0000 2018,Bitcoin cloud mining HashNest movie : From sand to bitcoin https://t.co/BHBSN1ufBD,2
Tue Jan 30 03:36:25 +0000 2018,me right before i buy $10 in bitcoin: https://t.co/m4PvUvAIXE,2
Tue Jan 30 03:12:14 +0000 2018,Where do I go to mine some bitcoin?,0
Tue Jan 30 03:06:47 +0000 2018,South Korea resumes crypto trading in few hours. Buy Volume $$$ #crypto #cryptocurrency #cryptonews #bitcoin #btc… https://t.co/Jk9Srrsavc,10
Tue Jan 30 01:47:18 +0000 2018,you guys heard of Bitcoin  right? well look out for Titcoin! Cryptocurrency girls can earn or pay for goods by flas… https://t.co/NNOH9MHCs0,0
Tue Jan 30 01:46:42 +0000 2018,Bubble or not  #Bitcoin is paying off my student loans https://t.co/jHnRKLG8em,0
Tue Jan 30 01:32:12 +0000 2018,South Korea resumes crypto trading in few hours. Buy Volume $$$ #crypto #cryptocurrency #cryptonews #bitcoin #btc… https://t.co/Jk9Srrsavc,10
Tue Jan 30 01:29:16 +0000 2018,Blame #bitcoin’s crash on these sharp new players https://t.co/NoD6tUA2i4,0
Tue Jan 30 01:27:30 +0000 2018,Bubble  Bubble  Fraud and Trouble https://t.co/pgkwfM0jnf,0
Tue Jan 30 01:21:06 +0000 2018,Buy bitcoin.  Shit's about to hit the fan. The same dude that couldn't keep a casino in New Jersey afloat while lau… https://t.co/8SMOs6GQT6,0
Tue Jan 30 00:49:59 +0000 2018,South Korea resumes crypto trading in few hours. Buy Volume $$$ #crypto #cryptocurrency #cryptonews #bitcoin #btc… https://t.co/Jk9Srrsavc,10
Tue Jan 30 00:46:53 +0000 2018,8) Linguistic experts studied several potential creators and noted that Szabo’s writing and Satoshi's emails/blog p… https://t.co/KLyJjyutBE,0
Tue Jan 30 00:46:52 +0000 2018,7) Many references in the White Paper to "we " insinuating more than one creator. Like others have suggested  it ma… https://t.co/NdfMTOyAi3,0
Tue Jan 30 00:46:51 +0000 2018,5) A year passes and Szabo is still quiet about Bitcoin on his blog -- mind you  Bitcoin went up ~20x in this perio… https://t.co/MpXceYzoS9,0
Tue Jan 30 00:46:50 +0000 2018,The "@NickSzabo4 Is Almost Certainly Satoshi Nakamoto" Thread:  1) When Bitcoin was released in 2009  Szabo became… https://t.co/KL1gBrA44e,0
Tue Jan 30 00:37:37 +0000 2018,South Korea resumes crypto trading in few hours. Buy Volume $$$ #crypto #cryptocurrency #cryptonews #bitcoin #btc… https://t.co/Jk9Srrsavc,10
Tue Jan 30 00:34:33 +0000 2018,South Korea resumes crypto trading in few hours. Buy Volume $$$ #crypto #cryptocurrency #cryptonews #bitcoin #btc… https://t.co/Jk9Srrsavc,10
Tue Jan 30 00:26:39 +0000 2018,South Korea resumes crypto trading in few hours. Buy Volume $$$ #crypto #cryptocurrency #cryptonews #bitcoin #btc… https://t.co/Jk9Srrsavc,10
Tue Jan 30 00:26:03 +0000 2018,Bout to bump “Bank Account” and invest in Bitcoin lmao y’all lames can’t relate.,1
Tue Jan 30 00:18:00 +0000 2018,#Binance volume down 80% since it’s peak of 10B. Still number 1 exchange  but the question is  where has the volume… https://t.co/iqiO5Wmjqt,0
Tue Jan 30 00:15:11 +0000 2018,South Korea resumes crypto trading in few hours. Buy Volume $$$ #crypto #cryptocurrency #cryptonews #bitcoin #btc… https://t.co/Jk9Srrsavc,10
Tue Jan 30 00:04:17 +0000 2018,South Korea resumes crypto trading in few hours. Buy Volume $$$ #crypto #cryptocurrency #cryptonews #bitcoin #btc… https://t.co/Jk9Srrsavc,10
Tue Jan 30 00:00:39 +0000 2018,Brands implementing #blockchain today hope to capture #Bitcoin magic.  But magic is hard to replicate.… https://t.co/BbRRBWo6QW,4
Tue Jan 30 00:00:05 +0000 2018,Brands implementing #blockchain today hope to capture #Bitcoin magic.  But magic is hard to replicate.… https://t.co/BbRRBWo6QW,4
