Tue Jan 30 23:13:39 +0000 2018,Facebook Bans Ads for Bitcoin and Other Cryptocurrencies https://t.co/VcxQho1EIP #VirtualCurrency #BitcoinCurrency… https://t.co/MtNwyp49dh,0
Tue Jan 30 23:08:01 +0000 2018,Weiss Rating Firm Rates Bitcoin and gets Hacked https://t.co/WzVPT7rdqz by @Askcyber01 https://t.co/EMqhLgA6at,0
Tue Jan 30 23:05:13 +0000 2018,#Facebook Bans All #Bitcoin and #Cryptocurrency Ads https://t.co/TPpcDRLfBZ,0
Tue Jan 30 23:04:18 +0000 2018,#SOTU fact alert: Use the new iPhone app FactStream for live fact-checking from @factcheckdotorg  @PolitiFact &amp;… https://t.co/8auQjLu90m,2
Tue Jan 30 23:02:49 +0000 2018,🚨ENDS IN 2 DAYS🚨 win a #FREE $20 to #Amazon in our #giveaway! ➡the link is in our pinned tweet!!!⬅ #fashion #win… https://t.co/96fXCApQoY,47
Tue Jan 30 22:45:05 +0000 2018,Facebook bans ads promoting #cryptocurrencies to thwart 'deceptive and misleading advertising practices' @Recode… https://t.co/VHWTVR4SUO,0
Tue Jan 30 22:44:17 +0000 2018,what’s the conversion factor for dining dollars to bitcoin,0
Tue Jan 30 22:28:59 +0000 2018,🚨ENDS IN 2 DAYS🚨 win a #FREE $20 to #Amazon in our #giveaway! ➡the link is in our pinned tweet!!!⬅ #fashion #win… https://t.co/96fXCApQoY,47
Tue Jan 30 22:26:57 +0000 2018,“Super bowl Squares with Bitcoin — A better way to run your 2018 super bowl pool” by Daniel Nakhla https://t.co/mplZ36mQBg,0
Tue Jan 30 22:17:40 +0000 2018,🚨ENDS IN 2 DAYS🚨 win a #FREE $20 to #Amazon in our #giveaway! ➡the link is in our pinned tweet!!!⬅ #fashion #win… https://t.co/96fXCApQoY,47
Tue Jan 30 22:03:36 +0000 2018,"Facebook Bans Ads for Bitcoin and Other Cryptocurrencies" by SHEERA FRENKEL via NYT https://t.co/e8vtCzglBJ https://t.co/1FbW2C2ZM5,0
Tue Jan 30 22:03:30 +0000 2018,"Facebook Bans Ads for Bitcoin and Other Cryptocurrencies" by SHEERA FRENKEL via NYT https://t.co/e8vtCzglBJ https://t.co/n4e6qxUw6L,0
Tue Jan 30 22:01:41 +0000 2018,#Facebook Bans #Cryptocurrency Ads https://t.co/jPfY4VuuFa via @BTCTN,0
Tue Jan 30 22:00:29 +0000 2018,🚨ENDS IN 2 DAYS🚨 win a #FREE $20 to #Amazon in our #giveaway! ➡the link is in our pinned tweet!!!⬅ #fashion #win… https://t.co/96fXCApQoY,47
Tue Jan 30 21:55:16 +0000 2018,That feeling when your #whitepaper is sent to the editor and you get the revised copy back. Chase your #blockchain… https://t.co/R9kcHrqwZg,0
Tue Jan 30 21:50:43 +0000 2018,"They vote with their CPU power  expressing their acceptance of valid blocks by working on extending them and rejec… https://t.co/qfoXCmcXHV,0
Tue Jan 30 21:50:28 +0000 2018,"Nodes can leave and rejoin the network at will  accepting the proof-of-work chain as proof of what happened while… https://t.co/2PiIqqsZoz,0
Tue Jan 30 21:49:47 +0000 2018,"To solve this  we proposed a peer-to-peer network using proof-of-work to record a public history of transactions t… https://t.co/XnBYbYDe9F,0
Tue Jan 30 21:49:12 +0000 2018,"Solving for P less than 0.1%:" #crytocurrency #blockchain #bitcoin #bitcoinCash https://t.co/NT0lYUSXBM,0
Tue Jan 30 21:48:48 +0000 2018,"Running some results  we can see the probability drop off exponentially with 'z'." #crytocurrency #blockchain… https://t.co/QBnUuYkw9h,0
Tue Jan 30 21:48:07 +0000 2018,"Converting to C code..." #crytocurrency #blockchain #bitcoin #bitcoinCash https://t.co/outM0N0KLW,0
Tue Jan 30 21:47:40 +0000 2018,"Rearranging to avoid summing the infinite tail of the distribution..." #crytocurrency #blockchain #bitcoin… https://t.co/U1enn82Y6u,0
Tue Jan 30 21:47:16 +0000 2018,"To get the probability the attacker could still catch up now  we multiply the Poisson density for each amount of p… https://t.co/lQJzOOGnzy,0
Tue Jan 30 21:46:29 +0000 2018,"The recipient waits until the transaction has been added to a block and zz blocks have been linked after it."… https://t.co/zHlEeXNhlg,0
Tue Jan 30 21:46:16 +0000 2018,"Once the transaction is sent  the dishonest sender starts working in secret on a parallel chain containing an alte… https://t.co/keMlbFEvkS,0
Tue Jan 30 21:46:03 +0000 2018,"This prevents the sender from preparing a chain of blocks ahead of time by working on it continuously until he is… https://t.co/IzByv1IDYy,0
Tue Jan 30 21:45:48 +0000 2018,"The receiver generates a new key pair and gives the public key to the sender shortly before signing."… https://t.co/PrB6KSP0Ru,0
Tue Jan 30 21:45:00 +0000 2018,"We now consider how long the recipient of a new transaction needs to wait before being sufficiently certain the se… https://t.co/l5l7mcvt08,0
Tue Jan 30 21:44:37 +0000 2018,"With the odds against him  if he doesn't make a lucky lunge forward early on  his chances become vanishingly small… https://t.co/H1dJ8PmRkk,0
Tue Jan 30 21:44:24 +0000 2018,"Given our assumption that p&gt;qp&gt;q  the probability drops exponentially as the number of blocks the attacker has to… https://t.co/NFri0x9B4T,0
Tue Jan 30 21:44:01 +0000 2018,🚨ENDS IN 2 DAYS🚨 win a #FREE $20 to #Amazon in our #giveaway! ➡the link is in our pinned tweet!!!⬅ #fashion #win… https://t.co/96fXCApQoY,47
Tue Jan 30 21:42:14 +0000 2018,"The probability of an attacker catching up from a given deficit is analogous to a Gambler's Ruin problem."… https://t.co/G0s9ghdPM9,0
Tue Jan 30 21:41:58 +0000 2018,"The success event is the honest chain being extended by one block  increasing its lead by +1  and the failure even… https://t.co/FyQ27o88ar,0
Tue Jan 30 21:41:49 +0000 2018,🚨ENDS IN 2 DAYS🚨 win a #FREE $20 to #Amazon in our #giveaway! ➡the link is in our pinned tweet!!!⬅ #fashion #win… https://t.co/96fXCApQoY,47
Tue Jan 30 21:41:44 +0000 2018,"An attacker can only try to change one of his own transactions to take back money he recently spent. The race betw… https://t.co/3A5FEifDwP,0
Tue Jan 30 21:41:26 +0000 2018,"...such as creating value out of thin air or taking money that never belonged to the attacker. Nodes are not going… https://t.co/A32tZ9L2RW,0
Tue Jan 30 21:41:11 +0000 2018,"We consider the scenario of an attacker trying to generate an alternate chain faster than the honest chain. Even i… https://t.co/RmrqYQm1kS,0
Tue Jan 30 21:40:31 +0000 2018,"As an additional firewall  a new key pair should be used for each transaction to keep them from being linked to a… https://t.co/IGYUwlKTH7,0
Tue Jan 30 21:40:05 +0000 2018,"This is similar to the level of information released by stock exchanges  where the time and size of individual tra… https://t.co/ipFtXGmbtf,0
Tue Jan 30 21:38:54 +0000 2018,"The traditional banking model achieves a level of privacy by limiting access to information to the parties involve… https://t.co/fkbiCGUQCE,0
Tue Jan 30 21:38:45 +0000 2018,Are we stupid for not investing in Bitcoin? Follow to find out! https://t.co/HEZRxaFkpU,22
Tue Jan 30 21:37:55 +0000 2018,"It should be noted that fan-out  where a transaction depends on several transactions  and those transactions depen… https://t.co/zpokYmuszX,0
Tue Jan 30 21:37:36 +0000 2018,"Normally there will be either a single input from a larger previous transaction or multiple inputs combining small… https://t.co/dZTUkWlhEV,0
Tue Jan 30 21:36:44 +0000 2018,"Although it would be possible to handle coins individually  it would be unwieldy to make a separate transaction fo… https://t.co/9fTe7ZFwWM,0
Tue Jan 30 21:36:19 +0000 2018,"Businesses that receive frequent payments will probably still want to run their own nodes for more independent sec… https://t.co/znKAQGHnNo,0
Tue Jan 30 21:36:05 +0000 2018,"One strategy to protect against this would be to accept alerts from network nodes when they detect an invalid bloc… https://t.co/8BNZgBTmk9,0
Tue Jan 30 21:34:48 +0000 2018,"...the simplified method can be fooled by an attacker's fabricated transactions for as long as the attacker can co… https://t.co/xgoasOy8kL,0
Tue Jan 30 21:34:27 +0000 2018,"As such  the verification is reliable as long as honest nodes control the network  but is more vulnerable if the n… https://t.co/8F0gfINiOn,0
Tue Jan 30 21:32:15 +0000 2018,"He can't check the transaction for himself  but by linking it to a place in the chain  he can see that a network n… https://t.co/MFFEffooKg,0
Tue Jan 30 21:29:56 +0000 2018,"It is possible to verify payments without running a full network node." #crytocurrency #blockchain #bitcoin #bitcoinCash,0
Tue Jan 30 21:29:56 +0000 2018,🚨ENDS IN 2 DAYS🚨 win a #FREE $20 to #Amazon in our #giveaway! ➡the link is in our pinned tweet!!!⬅ #fashion #win… https://t.co/96fXCApQoY,47
Tue Jan 30 21:29:43 +0000 2018,"With computer systems typically selling with 2GB of RAM as of 2008  and Moore's Law predicting current growth of 1… https://t.co/LTOy6dyU5t,0
Tue Jan 30 21:29:25 +0000 2018,"A block header with no transactions would be about 80 bytes. If we suppose blocks are generated every 10 minutes … https://t.co/9rT6bEc7hO,0
Tue Jan 30 21:29:05 +0000 2018,#crytocurrency #blockchain #bitcoin #bitcoinCash https://t.co/mDOvlniks7,0
Tue Jan 30 21:28:45 +0000 2018,A million bitcoin isn’t cool. You know what’s cool? Dignity.,0
Tue Jan 30 21:24:44 +0000 2018,🚨ENDS IN 2 DAYS🚨 win a #FREE $20 to #Amazon in our #giveaway! ➡the link is in our pinned tweet!!!⬅ #fashion #win… https://t.co/96fXCApQoY,47
Tue Jan 30 21:24:37 +0000 2018,🚨ENDS IN 2 DAYS🚨 win a #FREE $20 to #Amazon in our #giveaway! ➡the link is in our pinned tweet!!!⬅ #fashion #win… https://t.co/96fXCApQoY,47
Tue Jan 30 21:24:36 +0000 2018,"Once the latest transaction in a coin is buried under enough blocks  the spent transactions before it can be disca… https://t.co/d2fWIi7GBy,0
Tue Jan 30 21:24:19 +0000 2018,"He ought to find it more profitable to play by the rules  such rules that favour him with more new coins than ever… https://t.co/KR5NEauk2W,0
Tue Jan 30 21:23:56 +0000 2018,"If a greedy attacker is able to assemble more CPU power than all the honest nodes  he would have to choose between… https://t.co/tCfhNH3ZtB,0
Tue Jan 30 21:23:14 +0000 2018,"Once a predetermined number of coins have entered circulation  the incentive can transition entirely to transactio… https://t.co/eOM2gbA4Aj,0
Tue Jan 30 21:22:54 +0000 2018,"The incentive can also be funded with transaction fees. If the output value of a transaction is less than its inpu… https://t.co/4DS1y3wLiV,0
Tue Jan 30 21:22:31 +0000 2018,"The steady addition of a constant of amount of new coins is analogous to gold miners expending resources to add go… https://t.co/56IHH64QZM,0
Tue Jan 30 21:22:17 +0000 2018,"This adds an incentive for nodes to support the network  and provides a way to initially distribute coins into cir… https://t.co/0MuWIfTPGz,0
Tue Jan 30 21:18:37 +0000 2018,Facebook is banning all ads promoting cryptocurrencies — including bitcoin and ICOs - https://t.co/GkHoezrnNl,0
Tue Jan 30 21:18:15 +0000 2018,"New transaction broadcasts do not necessarily need to reach all nodes. As long as they reach many nodes  they will… https://t.co/sop3OWDQT9,0
Tue Jan 30 21:18:01 +0000 2018,"The tie will be broken when the next proof-of-work is found and one branch becomes longer; the nodes that were wor… https://t.co/vuR4wpVHbD,0
Tue Jan 30 21:17:41 +0000 2018,"...some nodes may receive one or the other first. In that case  they work on the first one they received  but save… https://t.co/v8TAq61Q7A,0
Tue Jan 30 21:17:03 +0000 2018,"Nodes always consider the longest chain to be the correct one and will keep working on extending it. If two nodes… https://t.co/lvoRden7ux,0
Tue Jan 30 21:16:47 +0000 2018,"Nodes express their acceptance of the block by working on creating the next block in the chain  using the hash of… https://t.co/oSQyGoOYGg,0
Tue Jan 30 21:16:02 +0000 2018,"4. When a node finds a proof-of-work  it broadcasts the block to all nodes. 5. Nodes accept the block only if all… https://t.co/b8iujuSbKW,0
Tue Jan 30 21:15:35 +0000 2018,"The steps to run the network are as follows: .1 New transactions are broadcast to all nodes. .2 Each node collects… https://t.co/mkEmPS7G7r,0
Tue Jan 30 21:14:50 +0000 2018,"We will show later that the probability of a slower attacker catching up diminishes exponentially as subsequent bl… https://t.co/V1vVA2QWbw,0
Tue Jan 30 21:13:28 +0000 2018,"Proof-of-work is essentially one-CPU-one-vote. The majority decision is represented by the longest chain  which ha… https://t.co/BlNUXYSR9d,0
Tue Jan 30 21:12:00 +0000 2018,"The proof-of-work also solves the problem of determining representation in majority decision making. If the majori… https://t.co/uLymnHveiq,0
Tue Jan 30 21:07:13 +0000 2018,I never thought Bitcoin was a good investment. But now that this nitwit @paulkrugman agrees with me  I’m not so sur… https://t.co/KAVzRkrdqP,0
Tue Jan 30 21:05:42 +0000 2018,"To implement a distributed timestamp server on a peer-to-peer basis  we will need to use a proof-of-work system si… https://t.co/O84yERqQiU,0
Tue Jan 30 20:57:22 +0000 2018,"The payee needs proof that at the time of each transaction  the majority of nodes agreed it was the first received… https://t.co/Ac3j62Hc6J,0
Tue Jan 30 20:49:22 +0000 2018,🚨ENDS IN 2 DAYS🚨 win a #FREE $20 to #Amazon in our #giveaway! ➡the link is in our pinned tweet!!!⬅ #fashion #win… https://t.co/96fXCApQoY,47
Tue Jan 30 20:44:49 +0000 2018,Tether (USDT) is a $2.2b mkt cap.  Bitcoin is $170b. The coin mkt is $500b.  Think about the difference of scale on… https://t.co/GQQfJnexJO,6
Tue Jan 30 20:44:04 +0000 2018,🚨ENDS IN 2 DAYS🚨 win a #FREE $20 to #Amazon in our #giveaway! ➡the link is in our pinned tweet!!!⬅ #fashion #win… https://t.co/96fXCApQoY,47
Tue Jan 30 20:41:28 +0000 2018,🚨ENDS IN 2 DAYS🚨 win a #FREE $20 to #Amazon in our #giveaway! ➡the link is in our pinned tweet!!!⬅ #fashion #win… https://t.co/96fXCApQoY,47
Tue Jan 30 20:40:44 +0000 2018,"To accomplish this without a trusted party  transactions must be publicly announced  and we need a system for part… https://t.co/Eaun0Z9hZF,0
Tue Jan 30 20:39:55 +0000 2018,🚨ENDS IN 2 DAYS🚨 win a #FREE $20 to #Amazon in our #giveaway! ➡the link is in our pinned tweet!!!⬅ #fashion #win… https://t.co/96fXCApQoY,47
Tue Jan 30 20:38:55 +0000 2018,"The only way to confirm the absence of a transaction is to be aware of all transactions. In the mint based model … https://t.co/g0SpH8aHCT,0
Tue Jan 30 20:38:25 +0000 2018,"We need a way for the payee to know that the previous owners did not sign any earlier transactions. For our purpos… https://t.co/KOBkK6ICNa,0
Tue Jan 30 20:37:39 +0000 2018,"The problem with this solution is that the fate of the entire money system depends on the company running the mint… https://t.co/MV0FD4kVva,0
Tue Jan 30 20:37:27 +0000 2018,"After each transaction  the coin must be returned to the mint to issue a new coin  and only coins issued directly… https://t.co/S2OkVS3yT3,0
Tue Jan 30 20:37:12 +0000 2018,"The problem of course is the payee can't verify that one of the owners did not double-spend the coin. A common sol… https://t.co/5aXJfIRuFW,0
Tue Jan 30 20:36:59 +0000 2018,"A payee can verify the signatures to verify the chain of ownership." #crytocurrency #blockchain #bitcoin… https://t.co/o9KstoXubM,0
Tue Jan 30 20:35:52 +0000 2018,"We define an electronic coin as a chain of digital signatures. Each owner transfers the coin to the next by digita… https://t.co/K3SJ0NcDq5,0
Tue Jan 30 20:35:21 +0000 2018,"The system is secure as long as honest nodes collectively control more CPU power than any cooperating group of att… https://t.co/ESwPFxeyA3,0
Tue Jan 30 20:35:06 +0000 2018,"In this paper  we propose a solution to the double-spending problem using a peer-to-peer distributed timestamp ser… https://t.co/vtm5Q3CzEL,0
Tue Jan 30 20:34:21 +0000 2018,"Transactions that are computationally impractical to reverse would protect sellers from fraud  and routine escrow… https://t.co/NOGg3dFSV5,0
Tue Jan 30 20:34:08 +0000 2018,Facebook Bans Bitcoin Ads Weeks After Mark Zuckerberg Praised Crypto https://t.co/2GBpBMJoXn https://t.co/ZmtYw8PAeT,0
Tue Jan 30 20:34:08 +0000 2018,"What is needed is an electronic payment system based on cryptographic proof instead of trust  allowing any two wil… https://t.co/GvuLutm948,0
Tue Jan 30 20:34:06 +0000 2018,Facebook Bans Bitcoin Ads Weeks After Mark Zuckerberg Praised Crypto https://t.co/D2qujHAJFU https://t.co/PFERgLcIbQ,0
Tue Jan 30 20:33:53 +0000 2018,"These costs and payment uncertainties can be avoided in person by using physical currency  but no mechanism exists… https://t.co/mO6eSuFRqQ,0
Tue Jan 30 20:33:44 +0000 2018,🚨ENDS IN 2 DAYS🚨 win a #FREE $20 to #Amazon in our #giveaway! ➡the link is in our pinned tweet!!!⬅ #fashion #win… https://t.co/96fXCApQoY,47
Tue Jan 30 20:33:37 +0000 2018,"With the possibility of reversal  the need for trust spreads. Merchants must be wary of their customers  hassling… https://t.co/JOKR8aHddY,0
Tue Jan 30 20:33:08 +0000 2018,🚨ENDS IN 2 DAYS🚨 win a #FREE $20 to #Amazon in our #giveaway! ➡the link is in our pinned tweet!!!⬅ #fashion #win… https://t.co/96fXCApQoY,47
Tue Jan 30 20:32:58 +0000 2018,"..it still suffers from the inherent weaknesses of the trust based model. Completely non-reversible transactions a… https://t.co/8tdXYEoWW7,0
Tue Jan 30 20:32:57 +0000 2018,@brennandunn @thomasfuchs products are like bitcoin? brb stealing rightmessage in a totally untraceable way 🤔,0
Tue Jan 30 20:32:41 +0000 2018,"Commerce on the Internet has come to rely almost exclusively on financial institutions serving as trusted third pa… https://t.co/O1w0N5Rhxg,0
Tue Jan 30 20:32:38 +0000 2018,🚨ENDS IN 2 DAYS🚨 win a #FREE $20 to #Amazon in our #giveaway! ➡the link is in our pinned tweet!!!⬅ #fashion #win… https://t.co/96fXCApQoY,47
Tue Jan 30 20:32:24 +0000 2018,"Messages are broadcast on a best effort basis  and nodes can leave and rejoin the network at will  accepting the l… https://t.co/3YmlshVyol,0
Tue Jan 30 20:31:32 +0000 2018,"The longest chain not only serves as proof of the sequence of events witnessed  but proof that it came from the la… https://t.co/PbMJHimTQW,0
Tue Jan 30 20:31:17 +0000 2018,🚨ENDS IN 2 DAYS🚨 win a #FREE $20 to #Amazon in our #giveaway! ➡the link is in our pinned tweet!!!⬅ #fashion #win… https://t.co/96fXCApQoY,47
Tue Jan 30 20:31:16 +0000 2018,"The network timestamps transactions by hashing them into an ongoing chain of hash-based proof-of-work  forming a r… https://t.co/ZOI0R1O2Sv,0
Tue Jan 30 20:30:50 +0000 2018,"... but the main benefits are lost if a trusted third party is still required to prevent double-spending. We propo… https://t.co/rSwflsm2oV,0
Tue Jan 30 20:29:03 +0000 2018,🚨ENDS IN 2 DAYS🚨 win a #FREE $20 to #Amazon in our #giveaway! ➡the link is in our pinned tweet!!!⬅ #fashion #win… https://t.co/96fXCApQoY,47
Tue Jan 30 20:27:54 +0000 2018,"A purely peer-to-peer version of electronic cash would allow online payments to be sent directly from one party to… https://t.co/0pDonbhy03,0
Tue Jan 30 20:23:39 +0000 2018,🚨ENDS IN 2 DAYS🚨 win a #FREE $20 to #Amazon in our #giveaway! ➡the link is in our pinned tweet!!!⬅ #fashion #win… https://t.co/96fXCApQoY,47
Tue Jan 30 20:19:04 +0000 2018,🚨ENDS IN 2 DAYS🚨 win a #FREE $20 to #Amazon in our #giveaway! ➡the link is in our pinned tweet!!!⬅ #fashion #win… https://t.co/96fXCApQoY,47
Tue Jan 30 20:15:58 +0000 2018,Bitcoin price - live updates and latest news on the volatile cryptocurrency https://t.co/7sC9DnZUFa,0
Tue Jan 30 20:04:59 +0000 2018,🚨ENDS IN 2 DAYS🚨 win a #FREE $20 to #Amazon in our #giveaway! ➡the link is in our pinned tweet!!!⬅ #fashion #win… https://t.co/96fXCApQoY,47
Tue Jan 30 20:04:53 +0000 2018,🚨ENDS IN 2 DAYS🚨 win a #FREE $20 to #Amazon in our #giveaway! ➡the link is in our pinned tweet!!!⬅ #fashion #win… https://t.co/96fXCApQoY,47
Tue Jan 30 20:04:43 +0000 2018,🚨ENDS IN 2 DAYS🚨 win a #FREE $20 to #Amazon in our #giveaway! ➡the link is in our pinned tweet!!!⬅ #fashion #win… https://t.co/96fXCApQoY,47
Tue Jan 30 20:04:30 +0000 2018,🚨ENDS IN 2 DAYS🚨 win a #FREE $20 to #Amazon in our #giveaway! ➡the link is in our pinned tweet!!!⬅ #fashion #win… https://t.co/96fXCApQoY,47
Tue Jan 30 20:04:05 +0000 2018,🚨ENDS IN 2 DAYS🚨 win a #FREE $20 to #Amazon in our #giveaway! ➡the link is in our pinned tweet!!!⬅ #fashion #win… https://t.co/96fXCApQoY,47
Tue Jan 30 19:57:45 +0000 2018,U.S. Regulators Send #Tether and #Bitfinex Subpoenas https://t.co/kaMjNNsGNi via @BTCTN,0
Tue Jan 30 19:56:30 +0000 2018,🚨ENDS IN 2 DAYS🚨 win a #FREE $20 to #Amazon in our #giveaway! ➡the link is in our pinned tweet!!!⬅ #fashion #win… https://t.co/96fXCApQoY,47
Tue Jan 30 19:55:55 +0000 2018,Bitcoin Battered On Report Bitfinex  Tether Were Subpoenaed Last Month | Zero Hedge https://t.co/mYcryQ2i5h,0
Tue Jan 30 19:53:01 +0000 2018,🚨ENDS IN 2 DAYS🚨 win a #FREE $20 to #Amazon in our #giveaway! ➡the link is in our pinned tweet!!!⬅ #fashion #win… https://t.co/96fXCApQoY,47
Tue Jan 30 19:52:53 +0000 2018,🚨ENDS IN 2 DAYS🚨 win a #FREE $20 to #Amazon in our #giveaway! ➡the link is in our pinned tweet!!!⬅ #fashion #win… https://t.co/96fXCApQoY,47
Tue Jan 30 19:52:35 +0000 2018,🚨ENDS IN 2 DAYS🚨 win a #FREE $20 to #Amazon in our #giveaway! ➡the link is in our pinned tweet!!!⬅ #fashion #win… https://t.co/96fXCApQoY,47
Tue Jan 30 19:52:07 +0000 2018,🚨ENDS IN 2 DAYS🚨 win a #FREE $20 to #Amazon in our #giveaway! ➡the link is in our pinned tweet!!!⬅ #fashion #win… https://t.co/96fXCApQoY,47
Tue Jan 30 19:48:40 +0000 2018,Facebook Bans #Bitcoin  #ICO Ads | Zero Hedge https://t.co/qolhvbIWoq,0
Tue Jan 30 19:46:29 +0000 2018,🚨ENDS IN 2 DAYS🚨 win a #FREE $20 to #Amazon in our #giveaway! ➡the link is in our pinned tweet!!!⬅ #fashion #win… https://t.co/96fXCApQoY,47
Tue Jan 30 19:44:25 +0000 2018,🚨ENDS IN 2 DAYS🚨 win a #FREE $20 to #Amazon in our #giveaway! ➡the link is in our pinned tweet!!!⬅ #fashion #win… https://t.co/96fXCApQoY,47
Tue Jan 30 19:17:53 +0000 2018,🚨ENDS IN 2 DAYS🚨 win a #FREE $20 to #Amazon in our #giveaway! ➡the link is in our pinned tweet!!!⬅ #fashion #win… https://t.co/96fXCApQoY,47
Tue Jan 30 19:17:30 +0000 2018,🚨ENDS IN 2 DAYS🚨 win a #FREE $20 to #Amazon in our #giveaway! ➡the link is in our pinned tweet!!!⬅ #fashion #win… https://t.co/96fXCApQoY,47
Tue Jan 30 19:16:36 +0000 2018,🚨ENDS IN 2 DAYS🚨 win a #FREE $20 to #Amazon in our #giveaway! ➡the link is in our pinned tweet!!!⬅ #fashion #win… https://t.co/96fXCApQoY,47
Tue Jan 30 19:16:25 +0000 2018,Tether (USDT) is a $2.2b mkt cap.  Bitcoin is $170b. The coin mkt is $500b.  Think about the difference of scale on… https://t.co/GQQfJnexJO,6
Tue Jan 30 19:15:21 +0000 2018,🚨ENDS IN 2 DAYS🚨 win a #FREE $20 to #Amazon in our #giveaway! ➡the link is in our pinned tweet!!!⬅ #fashion #win… https://t.co/96fXCApQoY,47
Tue Jan 30 19:14:54 +0000 2018,🚨ENDS IN 2 DAYS🚨 win a #FREE $20 to #Amazon in our #giveaway! ➡the link is in our pinned tweet!!!⬅ #fashion #win… https://t.co/96fXCApQoY,47
Tue Jan 30 19:14:40 +0000 2018,🚨ENDS IN 2 DAYS🚨 win a #FREE $20 to #Amazon in our #giveaway! ➡the link is in our pinned tweet!!!⬅ #fashion #win… https://t.co/96fXCApQoY,47
Tue Jan 30 19:14:21 +0000 2018,🚨ENDS IN 2 DAYS🚨 win a #FREE $20 to #Amazon in our #giveaway! ➡the link is in our pinned tweet!!!⬅ #fashion #win… https://t.co/96fXCApQoY,47
Tue Jan 30 19:13:55 +0000 2018,🚨ENDS IN 2 DAYS🚨 win a #FREE $20 to #Amazon in our #giveaway! ➡the link is in our pinned tweet!!!⬅ #fashion #win… https://t.co/96fXCApQoY,47
Tue Jan 30 19:13:11 +0000 2018,Tether (USDT) is a $2.2b mkt cap.  Bitcoin is $170b. The coin mkt is $500b.  Think about the difference of scale on… https://t.co/GQQfJnexJO,6
Tue Jan 30 19:09:36 +0000 2018,Are you a Bitcoin investor? You're going to love my Bitcoin news! https://t.co/HAFkEiuqlh,18
Tue Jan 30 19:07:20 +0000 2018,Are we stupid for not investing in Bitcoin? $$Bitcoin$$: I discuss what you need to know! https://t.co/MezyhKGkKG,29
Tue Jan 30 19:05:02 +0000 2018,Tether (USDT) is a $2.2b mkt cap.  Bitcoin is $170b. The coin mkt is $500b.  Think about the difference of scale on… https://t.co/GQQfJnexJO,6
Tue Jan 30 19:03:12 +0000 2018,Tether (USDT) is a $2.2b mkt cap.  Bitcoin is $170b. The coin mkt is $500b.  Think about the difference of scale on… https://t.co/GQQfJnexJO,6
Tue Jan 30 19:03:03 +0000 2018,Tether (USDT) is a $2.2b mkt cap.  Bitcoin is $170b. The coin mkt is $500b.  Think about the difference of scale on… https://t.co/GQQfJnexJO,6
Tue Jan 30 18:56:15 +0000 2018,@bitcoin_fox @iamjosephyoung They still operate within the us. Exchanges like Hitbtc  binance etc all offer service… https://t.co/9FgzQMR9U7,0
Tue Jan 30 18:30:06 +0000 2018,How to file your income taxes on bitcoin in 2018 https://t.co/6fazZszLTU,0
Tue Jan 30 18:19:43 +0000 2018,From 50 Cent To Bitcoin Millionaire  Biggest Theft In History JUST Happe... https://t.co/gwGVbOcIRc via @YouTube,0
Tue Jan 30 18:18:23 +0000 2018,Max Keiser Major Bitcoin Revelation! And Russian Meddling In Mexican Ele... https://t.co/vQ1FkFrlBQ via @YouTube,0
Tue Jan 30 17:34:25 +0000 2018,Should you invest $$$ into Bitcoin? Will Bitcoin be a money $$$ making $$$ machine? Follow me for the latest Bitcoi… https://t.co/o6OCobWNHQ,243
Tue Jan 30 17:32:57 +0000 2018,@SdotYoung it said certain states. I’m not sure what it will be. Cashapp his a link to but and sell bitcoin.,0
Tue Jan 30 17:11:55 +0000 2018,Should you invest $$$ into Bitcoin? Will Bitcoin be a money $$$ making $$$ machine? Follow me for the latest Bitcoi… https://t.co/o6OCobWNHQ,243
