Sun Oct 28 23:50:55 +0000 2018,Foreigners are paying the Trumps. Americans are paying the Trumps. Trump Inc. is expanding overseas. Kushner Inc. i… https://t.co/QRcN5KawoP,0
Sun Oct 28 23:37:10 +0000 2018,Natural products are uniquely positioned to manage CHRONIC INFLAMMATION through actions to rebalance gene expressio… https://t.co/nvOVBtbpv4,10
Sun Oct 28 23:30:30 +0000 2018,Another day another deposit  Westland Storage the worlds greatest Real Estate Investment Tea.lm. Go check them out.… https://t.co/9pNPdNio50,0
Sun Oct 28 23:24:04 +0000 2018,Fresh Investment Is Invigorating Many Northeast U.S. Ski Resorts https://t.co/s7WIBlW85q #news https://t.co/B00DVJs219,0
Sun Oct 28 23:20:12 +0000 2018,U.S. Economy Flashes Signs It’s Downhill From Here - WSJ Business investment grew at an 11.5% rate in Q1 w/gains ac… https://t.co/5XOjC5Ud7R,13
Sun Oct 28 23:15:04 +0000 2018,booted up sf5 and man nabbing this monitor was a good investment.,0
Sun Oct 28 23:12:59 +0000 2018,U.S. Economy Flashes Signs It’s Downhill From Here - WSJ Business investment grew at an 11.5% rate in Q1 w/gains ac… https://t.co/5XOjC5Ud7R,13
Sun Oct 28 23:08:38 +0000 2018,“The US needs to remain the world reserve currency... and this can only happen if the Fed normalizes its monetary p… https://t.co/46Q8rVliZp,3
Sun Oct 28 23:08:28 +0000 2018,How Saudi Arabia became an investment wasteland - Business Insider https://t.co/q6fNDp5UZn,1
Sun Oct 28 23:04:22 +0000 2018,#VoteRepublican to make your investment go back up! #Winning #WalkAway #WWG1WGA https://t.co/FPlywIkehL,0
Sun Oct 28 23:03:53 +0000 2018,@middydj @jrdnvns They are trying to clean his image.. he benefits from the prison industrial complex  one example… https://t.co/PKAgxJBlYL,0
Sun Oct 28 22:47:52 +0000 2018,U.S. Economy Flashes Signs It’s Downhill From Here - WSJ Business investment grew at an 11.5% rate in Q1 w/gains ac… https://t.co/5XOjC5Ud7R,13
Sun Oct 28 22:46:17 +0000 2018,U.S. Economy Flashes Signs It’s Downhill From Here - WSJ Business investment grew at an 11.5% rate in Q1 w/gains ac… https://t.co/5XOjC5Ud7R,13
Sun Oct 28 22:15:33 +0000 2018,U.S. Economy Flashes Signs It’s Downhill From Here - WSJ Business investment grew at an 11.5% rate in Q1 w/gains ac… https://t.co/5XOjC5Ud7R,13
Sun Oct 28 22:06:23 +0000 2018,U.S. Economy Flashes Signs It’s Downhill From Here - WSJ Business investment grew at an 11.5% rate in Q1 w/gains ac… https://t.co/5XOjC5Ud7R,13
Sun Oct 28 22:04:40 +0000 2018,Saudi Arabia’s crown prince  Mohammed bin Salman  received a standing ovation as he made an unannounced appearance… https://t.co/Ed2TiIZDBi,70
Sun Oct 28 21:56:30 +0000 2018,U.S. Economy Flashes Signs It’s Downhill From Here - WSJ Business investment grew at an 11.5% rate in Q1 w/gains ac… https://t.co/5XOjC5Ud7R,13
Sun Oct 28 21:43:40 +0000 2018,U.S. Economy Flashes Signs It’s Downhill From Here - WSJ Business investment grew at an 11.5% rate in Q1 w/gains ac… https://t.co/5XOjC5Ud7R,13
Sun Oct 28 21:37:59 +0000 2018,U.S. Economy Flashes Signs It’s Downhill From Here - WSJ Business investment grew at an 11.5% rate in Q1 w/gains ac… https://t.co/5XOjC5Ud7R,13
Sun Oct 28 21:32:52 +0000 2018,U.S. Economy Flashes Signs It’s Downhill From Here - WSJ Business investment grew at an 11.5% rate in Q1 w/gains ac… https://t.co/5XOjC5Ud7R,13
Sun Oct 28 21:30:04 +0000 2018,U.S. Economy Flashes Signs It’s Downhill From Here - WSJ Business investment grew at an 11.5% rate in Q1 w/gains ac… https://t.co/5XOjC5Ud7R,13
Sun Oct 28 21:03:02 +0000 2018,Unlock the Power of Facebook Advertising with the Help of Facebook Ads Experts – S6FQ https://t.co/jLVyfCa0RK… https://t.co/jL61RoSbOX,0
Sun Oct 28 21:03:02 +0000 2018,Facebook Ads From Unknown Backer Take Aim at Brexit Plan https://t.co/zpA9gb0bkg #facebookads #leadgeneration #seo… https://t.co/G2iiVYsejX,0
Sun Oct 28 20:39:02 +0000 2018,REI News - Real Estate Investment Firm https://t.co/MTTodRFMns https://t.co/4MyKMiadnl,0
Sun Oct 28 19:57:07 +0000 2018,One  two  and three year mechanical breakdown protection plans are available. Pricing depends on year  make  model … https://t.co/XSDVKdLMgB,0
Sun Oct 28 19:25:26 +0000 2018,@EpsilonTheory As a longtime computer guy  I knew that a long time ago. I did not understand why Warren Buffett tho… https://t.co/UkNvQb1egF,0
Sun Oct 28 19:15:48 +0000 2018,SEO Services  SEO Company in Gurgaon https://t.co/rHPmDQ5DB9 #seo #startup #facebookads #ppc #leadgeneration #ppl #investment,1
Sun Oct 28 18:37:39 +0000 2018,How Saudi Arabia became an investment wasteland - Business Insider https://t.co/q6fNDp5UZn,1
Sun Oct 28 18:15:05 +0000 2018,#Investment in a #property is a matter of much research. #Marcus &amp; #Millichap is one of the most top rated real est… https://t.co/HtOm50cDpZ,0
Sun Oct 28 18:13:07 +0000 2018,Don’t show up for people when you care. Show up so that you will start caring. Your heart always follows your investment.,2
Sun Oct 28 18:03:16 +0000 2018,SEO Services  SEO Company in Gurgaon https://t.co/rHPmDQ5DB9 #seo #startup #facebookads #ppc #leadgeneration #ppl #investment,1
Sun Oct 28 18:03:16 +0000 2018,This Week: Facebook Ads Restrictions  Vivid Visuals for Social Media &amp; Using Content Marketing to Make Competition… https://t.co/pIQoHxWFMF,0
Sun Oct 28 17:06:26 +0000 2018,“The US needs to remain the world reserve currency... and this can only happen if the Fed normalizes its monetary p… https://t.co/46Q8rVliZp,3
Sun Oct 28 17:02:30 +0000 2018,“The US needs to remain the world reserve currency... and this can only happen if the Fed normalizes its monetary p… https://t.co/46Q8rVliZp,3
Sun Oct 28 16:52:25 +0000 2018,“The US needs to remain the world reserve currency... and this can only happen if the Fed normalizes its monetary p… https://t.co/46Q8rVliZp,3
Sun Oct 28 16:10:21 +0000 2018,The key to success in any investment is periodic investments over a long time,0
Sun Oct 28 15:54:50 +0000 2018,Your heart always follows your investment. @tphnorth #TPHNorth,3
Sun Oct 28 15:03:57 +0000 2018,Do you manage your own investment portfolio or do you have a professional adviser? What has worked best for you? by… https://t.co/z5A0ws6Cli,0
Sun Oct 28 15:03:05 +0000 2018,t3n SEO-Check: Warum Wordpress-SEO kein Selbstläufer ist https://t.co/0HE7V36ep7 #investment #facebookads #ppl #seo… https://t.co/BuSGzrt9RO,0
Sun Oct 28 15:03:05 +0000 2018,Facebook Ads introduit l'optimisation de la rétention des utilisateurs pour les applis https://t.co/UDR0S5PAK5… https://t.co/sU3dyr1mvX,0
Sun Oct 28 14:55:26 +0000 2018,Your heart always follows your investment. @tphnorth #TPHNorth,3
Sun Oct 28 14:55:12 +0000 2018,Don’t show up for people when you care. Show up so that you will start caring. Your heart always follows your investment.,2
Sun Oct 28 14:54:21 +0000 2018,Your heart always follows your investment. @tphnorth #TPHNorth,3
Sun Oct 28 14:09:00 +0000 2018,To build psychological ownership  companies must use at least one of three factors: control  investment of self and… https://t.co/JFW8TGP09m,0
Sun Oct 28 14:01:46 +0000 2018,How freaking cute is this #Calcifer #cosplay from #howlsmovingcastle? Seriously! I love it! I don’t know this lady’… https://t.co/A0mRUSkjZj,0
Sun Oct 28 13:31:03 +0000 2018,@MattGlazer @CM_Renteria I enjoy getting mail for all the Houston races  living in Dallas it is really a good inves… https://t.co/VmQaIu90Fk,0
Sun Oct 28 13:20:01 +0000 2018,Investment Property 101 https://t.co/QySy9meXge,0
Sun Oct 28 12:43:48 +0000 2018,Top Unique Lead Generation Strategies That Are Proven to Work In 2018 https://t.co/yGlCsn8MHr #leadgeneration #ppc… https://t.co/r4XVPrn09S,1
Sun Oct 28 12:03:22 +0000 2018,Top Unique Lead Generation Strategies That Are Proven to Work In 2018 https://t.co/yGlCsn8MHr #leadgeneration #ppc… https://t.co/r4XVPrn09S,1
Sun Oct 28 11:59:07 +0000 2018,Hey Abrams Investment Group  Thanks for the follow! How can we do business together? https://t.co/8BDBF2YjrK,0
Sun Oct 28 11:09:51 +0000 2018,This project is developing and it shYould be a great reason for investment.Personally  my opinion this project has… https://t.co/pSBxu4XFXK,0
Sun Oct 28 10:37:22 +0000 2018,Dear friends  investors You have a chance to make a successful investment this year! Participate  to get many benef… https://t.co/CKRiz4DE91,0
Sun Oct 28 09:30:46 +0000 2018,SEO Consultant Options https://t.co/BuRxpoxus8 #ppc #facebookads #leadgeneration #investment #seo #startup #ppl,1
Sun Oct 28 09:03:18 +0000 2018,SEO Consultant Options https://t.co/BuRxpoxus8 #ppc #facebookads #leadgeneration #investment #seo #startup #ppl,1
Sun Oct 28 07:46:44 +0000 2018,This is the best company for your investment! Great Project. Welcome to the future. Recommend. #BlokBiz #BlokBiz.io #ICO,0
Sun Oct 28 07:10:31 +0000 2018,Natural products are uniquely positioned to manage CHRONIC INFLAMMATION through actions to rebalance gene expressio… https://t.co/nvOVBtbpv4,10
Sun Oct 28 06:52:06 +0000 2018,https://t.co/K5coh7FtRm Real estate investment #instadaily,0
Sun Oct 28 06:49:20 +0000 2018,These Indian cities are hotspots for investment in real estate https://t.co/xRVNqhzKfv,0
Sun Oct 28 06:20:21 +0000 2018,Promo Code Reddit Emery Eps Usa Seo Emery Eps Usa Seo March – Awesome Usa Seo https://t.co/7ZaZO0dc6u #ppc… https://t.co/mFZIV1kuKh,1
Sun Oct 28 06:05:52 +0000 2018,Natural products are uniquely positioned to manage CHRONIC INFLAMMATION through actions to rebalance gene expressio… https://t.co/nvOVBtbpv4,10
Sun Oct 28 06:03:16 +0000 2018,Promo Code Reddit Emery Eps Usa Seo Emery Eps Usa Seo March – Awesome Usa Seo https://t.co/7ZaZO0dc6u #ppc… https://t.co/mFZIV1kuKh,1
Sun Oct 28 05:06:39 +0000 2018,5 home package:  Trenton New Jersey investment property   "section8-tenants" &lt;cash cow&gt;; $365 000.00 Serious Buyers… https://t.co/x984IhWmAT,0
Sun Oct 28 04:57:04 +0000 2018,nah forreal  greatest investment this year https://t.co/Q9rAAfDWFH,2
Sun Oct 28 04:56:45 +0000 2018,nah forreal  greatest investment this year https://t.co/Q9rAAfDWFH,2
Sun Oct 28 04:56:33 +0000 2018,nah forreal  greatest investment this year https://t.co/Q9rAAfDWFH,2
Sun Oct 28 04:27:04 +0000 2018,Beto O’Rourke wants to invest in health care  public education  and immigration reform because America’s investment… https://t.co/ijlFLhf8Ps,1254
Sun Oct 28 03:03:19 +0000 2018,The Definitive Guide to Facebook Ads https://t.co/lpmGVgRMPI #investment #ppc #startup #facebookads #leadgeneration #ppl #seo,0
Sun Oct 28 02:28:28 +0000 2018,I hope i never make an investment as bad as Snapchat ever again. Omfg.,0
Sun Oct 28 01:16:59 +0000 2018,@BornABadass2 @tedcruz @GOP Trump has been tougher on Putin than Obama  I’d say he made the wrong investment. Lol,0
Sun Oct 28 00:25:27 +0000 2018,Thank you  Chad for inviting me to the 4est Kickoff event!  This is an excellent event for the startup community to… https://t.co/WdpnZLqLfX,0
Sun Oct 28 00:03:18 +0000 2018,4 SEO Blogs to Learn About Different Aspects of SEO https://t.co/JlmPYps2hb #investment #ppl #startup #facebookads #seo #ppc #leadgeneration,0
