Wed Dec 19 23:48:30 +0000 2018,@FONZILLAH @DetroitMade94 Every car loses value when driven off the parking lot lol. I know people driving an older… https://t.co/d5d3ZjPXiv,0
Wed Dec 19 23:44:56 +0000 2018,@jimsciutto Putin pulling the strings. Their investment in buying Trump is paying off.,0
Wed Dec 19 23:14:43 +0000 2018,@JoyceWhiteVance Looks like Russia's investment is paying off.,0
Wed Dec 19 23:02:31 +0000 2018,@CNN He's running out of time. Putin wants return on his investment before Trum is impeached.,0
Wed Dec 19 22:14:41 +0000 2018,“The U.S. must produce better war-fighting solutions  faster  with a greater return on investment than anyone who m… https://t.co/fZF8z8zAVr,0
Wed Dec 19 22:10:09 +0000 2018,🐽 Ready to build your STAX? @NGPF partnered with McKinney to create this "investment game that lets you grow your w… https://t.co/B8dtCAyS1D,1
Wed Dec 19 22:09:36 +0000 2018,https://t.co/ti7HItF6og Early investors in some of the biggest companies in the world  like Facebook  Amazon  Walma… https://t.co/ISfDX0OwaC,0
Wed Dec 19 22:01:03 +0000 2018,🐽 Ready to build your STAX? @NGPF partnered with McKinney to create this "investment game that lets you grow your w… https://t.co/B8dtCAyS1D,1
Wed Dec 19 21:52:31 +0000 2018,Fear is based on what we know about ourselves.  #leadership #fear #fearless #sales #fintech #success  #investment  #focus  #power,0
Wed Dec 19 21:42:29 +0000 2018,"Whether you're selling your home  purchasing your first home  or planning to stay put for a while  there is value… https://t.co/qunuqZDbZT,3
Wed Dec 19 21:32:08 +0000 2018,@TaraMartinEDU @dbc_inc @burgessdave @burgess_shelley @BethHouf @JayBilly2 @tishrich @tamaraletter @AnnickRauch… https://t.co/GfsTCgmzCo,4
Wed Dec 19 21:06:50 +0000 2018,Indicators &amp; market conditions suggest that growth has peaked and debt cycle is reversing. How you protect your dow… https://t.co/mIHjwt9Rld,0
Wed Dec 19 21:06:44 +0000 2018,@TaraMartinEDU @dbc_inc @burgessdave @burgess_shelley @BethHouf @JayBilly2 @tishrich @tamaraletter @AnnickRauch… https://t.co/GfsTCgmzCo,4
Wed Dec 19 21:02:06 +0000 2018,@TaraMartinEDU @dbc_inc @burgessdave @burgess_shelley @BethHouf @JayBilly2 @tishrich @tamaraletter @AnnickRauch… https://t.co/GfsTCgmzCo,4
Wed Dec 19 21:00:25 +0000 2018,Will investment in multimodal transport help quell issues with driver and capacity shortages? Upcoming legislation… https://t.co/ZOwc6sHyFe,0
Wed Dec 19 20:37:47 +0000 2018,Cryptocurrency vs. Private Real Estate Lending: Which is the More Secure Investment?  https://t.co/n72DmC8cwT… https://t.co/Fr5dZuQATi,0
Wed Dec 19 20:10:59 +0000 2018,@RackRunnaDinky Getting the bread the easy part! The hard part is the investment  at least for me!,0
Wed Dec 19 20:01:29 +0000 2018,From financing to disposition and everything in between  the key components of an effective SFR investment strategy… https://t.co/njVRe9srwR,0
Wed Dec 19 19:51:28 +0000 2018,Dream Global Real Estate Investment Trust declares CAD 0.06667 dividend - Seeking Alpha https://t.co/AD64WGrJM9,0
Wed Dec 19 19:30:00 +0000 2018,Do you know how much risk you’re comfortable with? Would you rather be reading or skydiving right now? https://t.co/5aMHmrdMuJ,0
Wed Dec 19 19:21:44 +0000 2018,That pee tape was a great Russian investment. https://t.co/qmENp91QLw,0
Wed Dec 19 18:04:24 +0000 2018,Even a cave man knows a smart investment opportunity when he sees one! https://t.co/5zXuKhu4C8,0
Wed Dec 19 17:47:37 +0000 2018,https://t.co/qDg5oHRxMI How NOT to Think About Your Portfolio’s Performance. #the30ygrind #investingforcowards,0
Wed Dec 19 17:29:16 +0000 2018,International Tourism and Investment Conference (ITIC) announces its 2019 conference in London https://t.co/5krk47prtO #news,0
Wed Dec 19 16:43:34 +0000 2018,Urban Land Institute's Ed Walter talks with me about the future of commercial real estate investing.… https://t.co/CHSEysPLGs,0
Wed Dec 19 16:18:19 +0000 2018,Everything you always wanted to know about housing*   (*but were afraid to ask)  "Remodeling is the least cyclical… https://t.co/W43dU2lVOk,3
Wed Dec 19 16:17:37 +0000 2018,Everything you always wanted to know about housing*   (*but were afraid to ask)  "Remodeling is the least cyclical… https://t.co/W43dU2lVOk,3
Wed Dec 19 16:13:42 +0000 2018,Everything you always wanted to know about housing*   (*but were afraid to ask)  "Remodeling is the least cyclical… https://t.co/W43dU2lVOk,3
Wed Dec 19 16:07:28 +0000 2018,Investors are potentially making two mistakes right now. First  Bank of America reported last week that investors d… https://t.co/uCRPjEPZec,0
Wed Dec 19 16:01:04 +0000 2018,Financial experts claim that #lifeinsurance should not be positioned as an 'investment strategy'.  However  here ar… https://t.co/it8hjdArM6,0
Wed Dec 19 16:00:34 +0000 2018,Everything you always wanted to know about housing*   (*but were afraid to ask) "Remodeling is the least cyclical p… https://t.co/PlEttnDQ9x,0
Wed Dec 19 16:00:34 +0000 2018,Everything you always wanted to know about housing*   (*but were afraid to ask)  "Remodeling is the least cyclical… https://t.co/W43dU2lVOk,3
Wed Dec 19 15:56:57 +0000 2018,#trading #stockmarket #money #investment #ny #fl #la #dallas #markets #TSX #TMX #nasdaq #nyse #bloomberg #investing… https://t.co/wka7vPSAhb,0
Wed Dec 19 15:47:53 +0000 2018,https://t.co/BSA1wq5A8B Have you ever considered ditching your human investment advisor and going with an online au… https://t.co/RCeRpoU2Xr,0
Wed Dec 19 15:31:14 +0000 2018,Industrial real estate investment in Edmonton ramped up in 2018 - Edmonton Sun https://t.co/mvrjhuq3PH,0
Wed Dec 19 15:09:58 +0000 2018,#Silas #Capital Invests in #ILIA #Beauty https://t.co/nQV6RNbyhU #personalcare #cosmetics #investment #VC #VentureCapital,0
Wed Dec 19 15:02:46 +0000 2018,I have yet to see a school that has successfully addressed the challenges associated with poverty  ELLs  special ne… https://t.co/ArPCiVx4Gm,18
Wed Dec 19 15:00:01 +0000 2018,State and Local Investment Gets Lift From Rising Revenues https://t.co/epf2TUCEXi,0
Wed Dec 19 14:39:39 +0000 2018,I have yet to see a school that has successfully addressed the challenges associated with poverty  ELLs  special ne… https://t.co/ArPCiVx4Gm,18
Wed Dec 19 14:10:06 +0000 2018,If you've ever lost money on a real estate investment  or are worried about it. Here is what you can do to avoid it https://t.co/QFEt76cTvK,0
Wed Dec 19 13:47:54 +0000 2018,I have yet to see a school that has successfully addressed the challenges associated with poverty  ELLs  special ne… https://t.co/ArPCiVx4Gm,18
Wed Dec 19 13:11:30 +0000 2018,I have yet to see a school that has successfully addressed the challenges associated with poverty  ELLs  special ne… https://t.co/ArPCiVx4Gm,18
Wed Dec 19 13:01:23 +0000 2018,It's getting close to Christmas!  I don't know about you but this time of year makes for the most magical of home d… https://t.co/htBuGmlDxS,0
Wed Dec 19 12:34:10 +0000 2018,I have yet to see a school that has successfully addressed the challenges associated with poverty  ELLs  special ne… https://t.co/ArPCiVx4Gm,18
Wed Dec 19 11:56:08 +0000 2018,ALLURA: Honerva is attacking all of the multiple realities--! MY BRAIN: Ope  there it is. They introduced the conce… https://t.co/RqKt7EsUV3,2
Wed Dec 19 11:46:14 +0000 2018,JPMorgan Downgrades Washington Real Estate Investment Trust (WRE) to Underweight - https://t.co/lxhchRCEvn https://t.co/z0i3uAhMGB,0
Wed Dec 19 09:31:19 +0000 2018,@ProfFaustus @Andreas51997639 @DespacitoDorian @malaikat5 @CalvinAyre @river_tp Investors in Google stock are not r… https://t.co/uOTCc4EyOi,0
Wed Dec 19 08:42:33 +0000 2018,I have yet to see a school that has successfully addressed the challenges associated with poverty  ELLs  special ne… https://t.co/ArPCiVx4Gm,18
Wed Dec 19 08:25:17 +0000 2018,Instagram Ads vs. Facebook Ads https://t.co/044GK7XFsI #startup #ppl #leadgeneration #facebookads #seo #ppc #investment,0
Wed Dec 19 08:06:39 +0000 2018,Bentall Kennedy and GreenOak Real Estate Announce Merger to Form Bentall GreenOak  Global Real Estate Investment Pl… https://t.co/k6Ts5schUB,0
Wed Dec 19 07:22:51 +0000 2018,5 Real Estate Video Marketing Lead Generation Ideas https://t.co/WjYKp0DWkn #investment #facebookads #startup #ppc #leadgeneration #seo #ppl,2
Wed Dec 19 06:15:25 +0000 2018,You can spend a lot of money on real estate agent websites. Read this to make sure you maximize your investment by… https://t.co/siN2qcypGL,2
Wed Dec 19 05:54:14 +0000 2018,ALLURA: Honerva is attacking all of the multiple realities--! MY BRAIN: Ope  there it is. They introduced the conce… https://t.co/RqKt7EsUV3,2
Wed Dec 19 05:44:03 +0000 2018,For individuals ready to expand their investment property holdings  Caliber is your answer. Unlimited properties. D… https://t.co/KF6ZvaE6PF,1
Wed Dec 19 04:55:15 +0000 2018,Gold Coast online lead generation strategies https://t.co/lOB30fr6Ol #leadgeneration #ppl #facebookads #investment #startup #ppc #seo,2
Wed Dec 19 04:55:14 +0000 2018,Optimizing Facebook Ads for Success https://t.co/vfbHHVP5e3 #facebookads #startup #investment #ppl #ppc #leadgeneration #seo,1
Wed Dec 19 04:47:18 +0000 2018,ALLURA: Honerva is attacking all of the multiple realities--! MY BRAIN: Ope  there it is. They introduced the conce… https://t.co/RqKt7EsUV3,2
Wed Dec 19 04:42:12 +0000 2018,Optimizing Facebook Ads for Success https://t.co/vfbHHVP5e3 #facebookads #startup #investment #ppl #ppc #leadgeneration #seo,1
Wed Dec 19 04:40:31 +0000 2018,Gold Coast online lead generation strategies https://t.co/lOB30fr6Ol #leadgeneration #ppl #facebookads #investment #startup #ppc #seo,2
Wed Dec 19 04:36:13 +0000 2018,Gold Coast online lead generation strategies https://t.co/lOB30fr6Ol #leadgeneration #ppl #facebookads #investment #startup #ppc #seo,2
Wed Dec 19 04:21:25 +0000 2018,@EliLake @WSJ Yeah  I think playing word-jujitsu in defense of a guy who exfiltrated a political dissident to Turke… https://t.co/GNEIYC1oLz,0
Wed Dec 19 02:52:21 +0000 2018,I have been blessed with the opportunity to start selling @thehairshield ! To my weave and wig wearers this is the… https://t.co/Mguc3oCUaW,4
Wed Dec 19 02:22:08 +0000 2018,I have yet to see a school that has successfully addressed the challenges associated with poverty  ELLs  special ne… https://t.co/ArPCiVx4Gm,18
Wed Dec 19 02:21:36 +0000 2018,Please share  retweet  screenshot..whatever you have to do! This is a great investment that Id love for everyone to… https://t.co/WGnx9C9Ogf,1
Wed Dec 19 02:15:51 +0000 2018,I have been blessed with the opportunity to start selling @thehairshield ! To my weave and wig wearers this is the… https://t.co/Mguc3oCUaW,4
Wed Dec 19 01:31:19 +0000 2018,"U.S.  Supporting Mexico’s Plan  Will Invest $5.8 Billion in Central America" https://t.co/ObHhKDvTkn https://t.co/hcp6vMRvmw,0
Wed Dec 19 01:21:51 +0000 2018,I have yet to see a school that has successfully addressed the challenges associated with poverty  ELLs  special ne… https://t.co/ArPCiVx4Gm,18
Wed Dec 19 01:13:19 +0000 2018,I have yet to see a school that has successfully addressed the challenges associated with poverty  ELLs  special ne… https://t.co/ArPCiVx4Gm,18
Wed Dec 19 00:16:02 +0000 2018,"Pharma Industry Returns on R&amp;D Investment Hit 9-Year Low" by REUTERS via NYT https://t.co/gFNUGRpESp,0
