Fri Oct 26 23:03:58 +0000 2018,Evolving Investment Governance Models – Driving Better Outcomes https://t.co/9fXxpKVNPv https://t.co/nsGVX0NK71,0
Fri Oct 26 22:36:51 +0000 2018,@Chris14982795 @FIFAWWC FIFA is a nonprofit organization and their mission is to grow the game throughout the world… https://t.co/BU9Oe6zQpp,1
Fri Oct 26 22:15:32 +0000 2018,We strongly believe over 30 years of experience  $170 M dollars of higher yield #investment offerings since 2014  i… https://t.co/46F9b2IVMs,0
Fri Oct 26 21:57:59 +0000 2018,Made another investment today 🙏🏾,0
Fri Oct 26 21:56:02 +0000 2018,80% of enterprises have #AI in production. Looking to expand your AI investment? Come visit us at Gartner Symposium… https://t.co/yXLmNEQYEw,0
Fri Oct 26 21:21:13 +0000 2018,@Chris14982795 @FIFAWWC FIFA is a nonprofit organization and their mission is to grow the game throughout the world… https://t.co/BU9Oe6zQpp,1
Fri Oct 26 21:03:18 +0000 2018,Getting My Facebook Ads To Work https://t.co/EHgDnbxvos #startup #ppl #facebookads #investment #ppc #leadgeneration #seo,0
Fri Oct 26 21:02:01 +0000 2018,#amazing #openhouse #dfwopenhouses #dfwrealtor #realtor #realestate #agent #greghollandrealestate #rogershealy… https://t.co/0Lp5EQ8XuL,0
Fri Oct 26 20:44:07 +0000 2018,"Epic  Maker of Fortnite  Raises $1.25 Billion" by MICHAEL J. de la MERCED via NYT The New York Times https://t.co/nlnPp6CIl1,0
Fri Oct 26 20:43:20 +0000 2018,The only sure investment is a piece of LAND.  Never depreciate like a car or a washing machine. https://t.co/sDU4DTrvJG,0
Fri Oct 26 20:26:35 +0000 2018,Retail Investment Sale or Development property in Fort Worth. Corner Lot at Riverside and Berry. Lighted intersecti… https://t.co/RBbdrX6TNd,0
Fri Oct 26 20:21:35 +0000 2018,@LosoRozay Great investment,0
Fri Oct 26 20:18:49 +0000 2018,An amazing announcement in @dallasnews yesterday about #SouthernDallasThrives — @Fritolay and @UnitedWayDallas are… https://t.co/T84nKHvkjl,0
Fri Oct 26 19:15:09 +0000 2018,Today's research proves our bodies need sleep. Humans are not made to continuously function without sleep  because… https://t.co/NCHTRHq7ML,0
Fri Oct 26 19:06:51 +0000 2018,Good investment decisions and strong marketing plans will keep this from being a fad.  Crops take root in unlikely… https://t.co/r17OudaXJ6,3
Fri Oct 26 18:56:57 +0000 2018,Maybe Artificial Intelligence is for real since MIT commits $1 billion for a new college! https://t.co/6lgqggbTd9 b… https://t.co/phLkjTZuU0,0
Fri Oct 26 18:51:09 +0000 2018,"3 Ways to Create a Climate Change Investment Strategy" by PAUL SULLIVAN via NYT The New York Times https://t.co/zkDI1guPKm,0
Fri Oct 26 18:50:37 +0000 2018,"3 Ways to Create a Climate Change Investment Strategy" by PAUL SULLIVAN via NYT The New York Times https://t.co/40ppkvTkp7,0
Fri Oct 26 18:27:19 +0000 2018,"3 Ways to Create a Climate Change Investment Strategy" by PAUL SULLIVAN via NYT https://t.co/fNT5JxndQZ,0
Fri Oct 26 18:26:06 +0000 2018,Fellow panelist @isaacfaz advised students to not let tuition costs  discourage them from pursuing a career in law.… https://t.co/we3gO5NNH0,2
Fri Oct 26 18:20:16 +0000 2018,"3 Ways to Create a Climate Change Investment Strategy" by PAUL SULLIVAN via NYT https://t.co/NtzNWxeOQw,0
Fri Oct 26 18:16:09 +0000 2018,Fellow panelist @isaacfaz advised students to not let tuition costs  discourage them from pursuing a career in law.… https://t.co/we3gO5NNH0,2
Fri Oct 26 18:12:34 +0000 2018,Fellow panelist @isaacfaz advised students to not let tuition costs  discourage them from pursuing a career in law.… https://t.co/we3gO5NNH0,2
Fri Oct 26 18:01:37 +0000 2018,Get the Best Return on Your Investment in Home Improvements! #ClickHere #DBest18 #Lantana #FlowerMound #DoubleOak… https://t.co/jeoXDwJhWU,0
Fri Oct 26 17:28:23 +0000 2018,Washington Real Estate Investment 2018 Q3 - Results - Earnings Call Slides https://t.co/lPv46sWFYp,0
Fri Oct 26 17:28:16 +0000 2018,Follow this link to watch our meeting last night with Neil Aggarwal of Property Financing to talk about Joe Boston… https://t.co/WHJSXNO0SN,0
Fri Oct 26 17:11:27 +0000 2018,Investment is not only volatile  it is the key motor of the economy's prosperity because it has a snowball effect,0
Fri Oct 26 17:08:50 +0000 2018,Darrell Cronk  president of Wells Fargo Investment Institute  discusses Wednesday’s #equity market downturn and his… https://t.co/OiR7bS4q3D,0
Fri Oct 26 16:53:47 +0000 2018,Real Estate Investor Financing - Real Estate Investment Firm https://t.co/277iFTRU1x https://t.co/qBxCuBJibU,1
Fri Oct 26 16:53:44 +0000 2018,@EnergyCredit1 The properties they bought from Devon were declining very  very fast. Probably from lack of investme… https://t.co/9a3jGnXWDz,0
Fri Oct 26 16:53:04 +0000 2018,Real Estate Investor Financing - Real Estate Investment Firm https://t.co/277iFTRU1x https://t.co/qBxCuBJibU,1
Fri Oct 26 16:37:23 +0000 2018,We’ve been looking at a group of call centers as investment because they’re building health  education to help indi… https://t.co/AoNjmZFfkv,0
Fri Oct 26 16:36:26 +0000 2018,Listening to a great panel on upstream PE investment strategies. Rapidly growing interest in backing cash-generativ… https://t.co/APsUPeB9ZL,1
Fri Oct 26 16:30:55 +0000 2018,We work with real estate investors to help them refinance into lower interest rates  adjust the terms of their loan… https://t.co/KsDdyolu8C,0
Fri Oct 26 16:25:29 +0000 2018,Listening to a great panel on upstream PE investment strategies. Rapidly growing interest in backing cash-generativ… https://t.co/APsUPeB9ZL,1
Fri Oct 26 16:22:35 +0000 2018,Venture Capital Investment in Blockchain Up Nearly 300 Percent in 2018 https://t.co/J4KMiBmTm3,13
Fri Oct 26 15:50:52 +0000 2018,Beto O’Rourke wants to invest in health care  public education  and immigration reform because America’s investment… https://t.co/ijlFLhf8Ps,1255
Fri Oct 26 15:45:19 +0000 2018,@AintShitEv6 But he’s a top 10 pick. I understand you want to win but you gotta secure your investment by letting him play &amp; make mistakes.,0
Fri Oct 26 15:18:04 +0000 2018,Paying off debt may not be the sexiest or most exciting way to spend your money  but it has the best guaranteed ret… https://t.co/qVwRyrZwFr,0
Fri Oct 26 15:08:14 +0000 2018,Four Takeaways from the NYU Schack Institute's Second National Symposium of Women in Real Estate https://t.co/FrAjKD6l0g,0
Fri Oct 26 14:57:38 +0000 2018,Earnings season was supposed to save the day and reverse October’s downtrend. Should investors buy the dip or be pa… https://t.co/fvpgPwPEJD,0
Fri Oct 26 14:49:21 +0000 2018,Earnings season was supposed to save the day and reverse October’s downtrend. Should investors buy the dip or be pa… https://t.co/65bAZrhFod,0
Fri Oct 26 14:46:35 +0000 2018,Dallas Fix and Flip or Buy and Hold - Real Estate Investment Firm https://t.co/Bh42boLLVm https://t.co/YkZZQ862B0,1
Fri Oct 26 14:46:02 +0000 2018,Dallas Fix and Flip or Buy and Hold - Real Estate Investment Firm https://t.co/Bh42boLLVm https://t.co/YkZZQ862B0,1
Fri Oct 26 14:32:11 +0000 2018,Looking for an investment property? Consider this: https://t.co/Vbc92C8BjQ,0
Fri Oct 26 14:31:31 +0000 2018,Earnings season was supposed to save the day and reverse October’s downtrend. Should investors buy the dip or be pa… https://t.co/JRK44lje53,0
Fri Oct 26 14:12:59 +0000 2018,Big  bold innovations going at @SVPDallas #bigBANGtx . Kudos to @viveksankaran in the investment in @CityOfDallas.… https://t.co/ORAHJ6nup6,0
Fri Oct 26 14:10:48 +0000 2018,Earnings season was supposed to save the day and reverse October’s downtrend. Should investors buy the dip or be pa… https://t.co/zXGuuv3hf4,0
Fri Oct 26 14:05:29 +0000 2018,Earnings season was supposed to save the day and reverse October’s downtrend. Should investors buy the dip or be pa… https://t.co/dGPhiRjOwP,0
Fri Oct 26 13:59:06 +0000 2018,https://t.co/QC4xs6V9fg If U.S. Markets Slide into a Recession  Cryptocurrency Could Provide an Investment Alternative,0
Fri Oct 26 13:57:32 +0000 2018,https://t.co/WQ6aLoTVmT Did you know that you can invest in Bitcoin (BTC) and other crypto assets with that spare c… https://t.co/pH5A7tWSdk,0
Fri Oct 26 13:57:04 +0000 2018,Those trying to get the biggest return on their investment should have this installed ASAP. https://t.co/IH7YScTNf7 https://t.co/SrHHXDpRNG,0
Fri Oct 26 13:20:09 +0000 2018,RT coindesk "We're happy to welcome Hu Liang to #ConsensusInvest. Hu Liang is the founder and CEO of OmniEX  the in… https://t.co/DAIbYdBfEH,0
Fri Oct 26 13:07:36 +0000 2018,Mediterranean investment risky but providing new niches https://t.co/5I8v5J6OUu #news https://t.co/s95MCbdULC,0
Fri Oct 26 12:30:32 +0000 2018,More Development News: New Commissary Kitchen Concept  a $2 million investment. Revolving Kitchen will offer 25 pri… https://t.co/bQXGwpkssg,0
Fri Oct 26 12:03:27 +0000 2018,Discount Coupons Emery Eps Usa Seo 2018 – Awesome Usa Seo https://t.co/N8rnnq9GPH #investment #leadgeneration… https://t.co/xPxqY7R08P,0
Fri Oct 26 10:38:00 +0000 2018,@DBC_IO Dear friends  investors you have a chance to make a successful investment this year! don't lose your chance… https://t.co/772KqjP9xl,0
Fri Oct 26 10:34:17 +0000 2018,An investment in knowledge pays the best interest. more information stay in touch with us: #OnlineShoppingEngine… https://t.co/v7fykhOluX,0
Fri Oct 26 09:29:49 +0000 2018,Venture Capital Investment in Blockchain Up Nearly 300 Percent in 2018 https://t.co/J4KMiBmTm3,13
Fri Oct 26 08:25:47 +0000 2018,Is Your Organization Ready To Mitigate Culture Risk in M&amp;A Deals? @BrinkNewsNow @mercer #BRINKNews #Boardroom… https://t.co/uKgBmOjoMb,0
Fri Oct 26 08:20:29 +0000 2018,A new $3 billion round of investment led by SoftBank has crowned China’s Bytedance the world’s most valuable startu… https://t.co/LjFG0SrJ8h,0
Fri Oct 26 08:19:11 +0000 2018,A new $3 billion round of investment led by SoftBank has crowned China’s Bytedance the world’s most valuable startu… https://t.co/ykn7XJylsh,0
Fri Oct 26 08:06:11 +0000 2018,Reposting @tomdanger: @Regran_ed from @urbanteachnyc -  A well rounded life is necessary! 🙏🏼 .  #urbanteachnyc #Nyc… https://t.co/mSSCRBGcMf,0
Fri Oct 26 07:49:59 +0000 2018,Barrick-Randgold Sets Bar for Future Gold Mergers - https://t.co/945Xx2WHOU https://t.co/1AMj4Kb3zy,0
Fri Oct 26 07:09:23 +0000 2018,Venture Capital Investment in Blockchain Up Nearly 300 Percent in 2018 https://t.co/J4KMiBmTm3,13
Fri Oct 26 07:03:24 +0000 2018,RT magolnick "Venture Capital Investment in Blockchain Up Nearly 300 Percent in 2018 https://t.co/ayAL2eSaYj",0
Fri Oct 26 07:02:05 +0000 2018,Venture Capital Investment in Blockchain Up Nearly 300 Percent in 2018 https://t.co/J4KMiBmTm3,13
Fri Oct 26 06:45:54 +0000 2018,There is not much time left for everyone who is looking for good and reliable investment possibility  #multichanexchange #mce #ico,0
Fri Oct 26 06:02:53 +0000 2018,dịch vụ seo backlink https://t.co/xhqIxR6T10 #investment #seo #facebookads #ppl #startup #leadgeneration #ppc,0
Fri Oct 26 03:45:29 +0000 2018,Good investment decisions and strong marketing plans will keep this from being a fad.  Crops take root in unlikely… https://t.co/r17OudaXJ6,3
Fri Oct 26 03:37:59 +0000 2018,First 6 items up on amazon! After fees  shipping ect  I will make 8x my investment 💁🏻‍♀️,0
Fri Oct 26 03:15:04 +0000 2018,https://t.co/sIqgVvBwZW,0
Fri Oct 26 03:02:58 +0000 2018,Facebook ads para afiliados 3.0 No Further a Mystery https://t.co/rPYVqFtK07 #startup #leadgeneration #ppc #seo… https://t.co/mZdBlOnArV,0
Fri Oct 26 00:54:06 +0000 2018,Real Estate Investor Financing - Real Estate Investment Firm https://t.co/277iFTRU1x,0
Fri Oct 26 00:33:57 +0000 2018,Bought a subscription or whatever to quizlet right before my test today and it was a good investment. Thank you qui… https://t.co/PSjz6vnZlH,0
Fri Oct 26 00:21:12 +0000 2018,Whether it’s a sailboat or a security  it’s hard to admit when an investment is no longer paying off – and even har… https://t.co/SiZr5xYI18,0
Fri Oct 26 00:06:32 +0000 2018,Intro to SpyFu: A Digital Marketing  SEO  and PPC Tool – Semalt – Brosius Cieguides Chamonix… https://t.co/y8pjDjeRRT,1
Fri Oct 26 00:03:24 +0000 2018,Get yourself a real one...best investment you'll ever make I promise,162
Fri Oct 26 00:02:54 +0000 2018,Intro to SpyFu: A Digital Marketing  SEO  and PPC Tool – Semalt – Brosius Cieguides Chamonix… https://t.co/y8pjDjeRRT,1
Fri Oct 26 00:02:22 +0000 2018,Get yourself a real one...best investment you'll ever make I promise,162
