Sat Sep 29 22:35:46 +0000 2018,@fiondavision Wasn't @brockpierce  a "sidekick" back then? My son works in investment management and very familiar… https://t.co/0Y3kz5Fe9w,0
Sat Sep 29 22:18:34 +0000 2018,@skipatrol80 @esadah @AynRandPaulRyan @brithume @JeffFlake @BetoORourke Do you even know what socialism is???Stop w… https://t.co/zAbIhpaxEG,0
Sat Sep 29 22:02:00 +0000 2018,#OntheMarket: Grocery-Anchored Retail Center in Roswell  Georgia   https://t.co/weOv9vprlu  #HFFListings… https://t.co/hPbjtAGtBc,1
Sat Sep 29 21:27:47 +0000 2018,This investment in our culture and the world will not be forgotten in eternity. Only saw 3 hours of the… https://t.co/jU0HIWBnId,0
Sat Sep 29 21:03:25 +0000 2018,Facebook Ads Updates and New Instagram Features : Social Media Examiner https://t.co/jxoTEy9XE9 #ppl… https://t.co/53k3SQohjJ,0
Sat Sep 29 20:32:00 +0000 2018,@RabiaBaluch DMG was trying to bring in the 'investment' for Pakistan ..🤣,0
Sat Sep 29 20:15:11 +0000 2018,#OntheMarket: Grocery-Anchored Retail Center in Roswell  Georgia   https://t.co/weOv9vprlu  #HFFListings… https://t.co/hPbjtAGtBc,1
Sat Sep 29 19:44:55 +0000 2018,@garrisonbros I am interested to hear why your whiskey is expensive? VC investment perhaps? There is lots of great… https://t.co/QJVEBJ0n2e,0
Sat Sep 29 19:41:17 +0000 2018,Yo bendayhoes  house opens at 3pm today. Missed ya'll last week  so come say hi  Come by and let's talk about why F… https://t.co/q9KOVpO7uS,1
Sat Sep 29 19:10:19 +0000 2018,This portable battery was a damn good investment.,0
Sat Sep 29 18:40:28 +0000 2018,You Your Biggest Investment 👑💰 https://t.co/QjkkMG2eaC,0
Sat Sep 29 18:23:39 +0000 2018,Yo bendayhoes  house opens at 3pm today. Missed ya'll last week  so come say hi  Come by and let's talk about why F… https://t.co/q9KOVpO7uS,1
Sat Sep 29 18:02:51 +0000 2018,Why Facebook Ads Are Still Essential to Your E-Commerce Marketing Strategy https://t.co/K6Ee3yTXk0 #investment… https://t.co/tZds0eweYs,0
Sat Sep 29 17:58:09 +0000 2018,#OntheMarket: Development/Repositioning Opportunity in Miami's Wynwood District https://t.co/uSB8G0u0vq… https://t.co/24CTVp4zP4,1
Sat Sep 29 17:09:00 +0000 2018,...the greatest pleasures are those born of labor and investment.   @KSPrior,0
Sat Sep 29 16:49:05 +0000 2018,You can’t expect fulfillment without investment!,0
Sat Sep 29 16:26:27 +0000 2018,#money #millions #wealthy#millionairemindset #businesswomen#investment #billionaire #millionairelifestyle#entrepren… https://t.co/QMydnjnD8U,0
Sat Sep 29 15:45:36 +0000 2018,Facebook’s security breach shows even significant security investment might not help: First… https://t.co/66wAlFw4zp,0
Sat Sep 29 15:10:12 +0000 2018,#OntheMarket: Development/Repositioning Opportunity in Miami's Wynwood District https://t.co/uSB8G0u0vq… https://t.co/24CTVp4zP4,1
Sat Sep 29 15:09:02 +0000 2018,@theycallmetex Looks like it wants to resume the uptrend. You can tell this stock has a lot of institutional invest… https://t.co/vkqvjLNF2M,0
Sat Sep 29 15:02:52 +0000 2018,On-Page SEO Concepts  Definitions: Guide to Basic SEO Concepts https://t.co/1yPRrC6AAs #startup #seo #ppc… https://t.co/RcOrXVVWtU,0
Sat Sep 29 14:57:21 +0000 2018,@ChristiCraddick Oh sweetie  it’s not Republican leadership driving investment in urban environments  but they are… https://t.co/gB7Om26PGD,0
Sat Sep 29 14:26:23 +0000 2018,Had so much fun last night. It's hard to quit smash when there are bunch of great people around. Good luck… https://t.co/RjvspZjLzf,0
Sat Sep 29 14:05:41 +0000 2018,@ErinBoudoin It's just a relationship investment. Like I'm getting that hoodie back any way lmao,0
Sat Sep 29 13:47:04 +0000 2018,Today's air conditioning systems are built to last. However  there's a lot you can do to ensure you get the most fr… https://t.co/1D4juSC57f,0
Sat Sep 29 13:30:20 +0000 2018,Very Good team  amazing project. I wish You best on I think that this project has a strong team  which has experien… https://t.co/i43uhpM6tu,0
Sat Sep 29 13:24:48 +0000 2018,The basic reason behind any financial investment is to get a reasonable return.,0
Sat Sep 29 13:12:39 +0000 2018,Quick update on my book. #1 Best Seller and #1 New Release in the Investment Portfolio Management category and in o… https://t.co/XwbwcZ7XOY,1
Sat Sep 29 12:45:29 +0000 2018,President Signs Spending Bill. After passage by both the Senate and House  today Pres Trump  signed the mini omnibu… https://t.co/vhPZh1lFsO,6
Sat Sep 29 12:02:50 +0000 2018,SEO Services – Exactly What Does an SEO Company Offer? https://t.co/09uAfIPRd4 #ppc #leadgeneration #seo… https://t.co/Fo2ZYfTrBD,0
Sat Sep 29 11:16:44 +0000 2018,I just joined #WeiDex #IEO #TokenSale #startup #BountyCampaign #Investment #Cryptocurrency #Blockchain #Exchange… https://t.co/Qh3p2as5N4,0
Sat Sep 29 09:03:36 +0000 2018,SEO Services in Delhi  Best SEO Company in Delhi NCR https://t.co/0DJpvdKuCP #facebookads #investment #seo #ppl… https://t.co/Dp6h0SzlHp,0
Sat Sep 29 07:57:50 +0000 2018,Dear friends  investors you have a chance to make a successful investment this year! don't lose your chance! ! Join now. #UbexAI,0
Sat Sep 29 06:36:44 +0000 2018,One of the newest types of financial technologies  aimed at helping the world's first financial institution meet th… https://t.co/jmErzLIsv6,0
Sat Sep 29 06:30:32 +0000 2018,The best investment of your time is not goals  projects  or accomplishments—but people.… https://t.co/dGmKiEXhOE,13
Sat Sep 29 06:02:54 +0000 2018,Facebook Ads Discriminate Against Women Job-seekers According To ACLU https://t.co/3tEeI9eK0Y #ppc #startup #seo… https://t.co/AYahULQ9eZ,0
Sat Sep 29 06:02:03 +0000 2018,I know this will b a good investment  so I’m sticking w it,0
Sat Sep 29 05:46:49 +0000 2018,An investment in a woman is a direct investment in our nation.  BECOME A NATION BUILDER #VWEC #veteranwomensec https://t.co/OjcvQ5SKuP,0
Sat Sep 29 04:52:16 +0000 2018,@AliceLinahan @williamstodd78 @Lori4DISD @robshearer @Commit2Dallas @EarlyMattersDFW @JBPritzker @heckmanequation T… https://t.co/mTHyCKiVQC,4
Sat Sep 29 04:16:35 +0000 2018,Another awesome SALE find! These OTK boots are on super sale with STOCKUP18 at checkout. These also rarely go on sa… https://t.co/L4d2slThM1,0
Sat Sep 29 03:02:51 +0000 2018,WHY I Love Day Trading And What My Skill For Facebook Ads Taught Me In This Market https://t.co/21bODESIlw… https://t.co/deyFoxtQRJ,0
Sat Sep 29 02:52:55 +0000 2018,@CapitalLecter @ad8871 @riddlejT4 @JustGamblingFTW @Quantrarian1 Good point. This is already a classic workout. May… https://t.co/Da4DqkQqgl,0
Sat Sep 29 02:47:29 +0000 2018,This is an awesome piece: Seth Klarman’s 20 Investment Lessons from 2008 --https://t.co/RH1JGFAXlW https://t.co/H7UY9L87Jj,45
Sat Sep 29 02:05:01 +0000 2018,This is an awesome piece: Seth Klarman’s 20 Investment Lessons from 2008 --https://t.co/RH1JGFAXlW https://t.co/H7UY9L87Jj,45
Sat Sep 29 02:02:58 +0000 2018,There's really nothing subjective about observing that public school teachers  public defenders  and social workers… https://t.co/DCpbIme6wp,1
Sat Sep 29 02:00:18 +0000 2018,Amazon Joins Forces With Plant Prefab  a Smart Housing Startup  #houseimprovement https://t.co/s1Nn3HFpxQ https://t.co/b1yZtaxK04,0
Sat Sep 29 01:52:46 +0000 2018,There's really nothing subjective about observing that public school teachers  public defenders  and social workers… https://t.co/DCpbIme6wp,1
Sat Sep 29 01:25:19 +0000 2018,All the real ones stayed  and that’s fucking incredible. Anyone who has ever truly meant the words “I love you” or… https://t.co/4PHu2M7Rqd,0
Sat Sep 29 01:02:34 +0000 2018,Interesting to see how the candidates in tonight's #TxGovDebate are handling social media versus how @BetoORourke a… https://t.co/v6SGBYNU9w,1
Sat Sep 29 01:00:42 +0000 2018,Locking down housing costs is not only a good way to say money  it can be a good investment too. https://t.co/RzBuoOlyMq,0
Sat Sep 29 00:59:36 +0000 2018,Interesting to see how the candidates in tonight's #TxGovDebate are handling social media versus how @BetoORourke a… https://t.co/v6SGBYNU9w,1
Sat Sep 29 00:30:19 +0000 2018,Urgent! Investment partners wanted for deeply discounted properties! Call: (817) 405-3229 https://t.co/6bBdtWosZR,0
Sat Sep 29 00:21:48 +0000 2018,How to evaluate your first multifamily investment! https://t.co/z9SvoNWS62 #realestate #property… https://t.co/4hWzw3PcVG,3
Sat Sep 29 00:21:08 +0000 2018,How to evaluate your first multifamily investment! https://t.co/z9SvoNWS62 #realestate #property… https://t.co/4hWzw3PcVG,3
Sat Sep 29 00:20:57 +0000 2018,How to evaluate your first multifamily investment! https://t.co/z9SvoNWS62 #realestate #property… https://t.co/4hWzw3PcVG,3
Sat Sep 29 00:20:08 +0000 2018,How to evaluate your first multifamily investment! https://t.co/z9SvoNWS62 #realestate #property… https://t.co/4hWzw3PcVG,3
Sat Sep 29 00:03:46 +0000 2018,We understand that an #HVAC unit can be a big investment for you  so it's essential to keep it well maintained. https://t.co/ciXR6BqNMv,1
Sat Sep 29 00:03:20 +0000 2018,5 Easy Facts About facebook ads para afiliadios 3.0 Described https://t.co/NV3iSQTUlT #ppc #facebookads #startup… https://t.co/tmYJBppZRZ,0
Sat Sep 29 00:00:49 +0000 2018,We understand that an #HVAC unit can be a big investment for you  so it's essential to keep it well maintained. https://t.co/ciXR6BqNMv,1
