Wed Jan 10 23:55:41 +0000 2018,@RipsterER Our new investment and how it came to be. :),0
Wed Jan 10 23:40:45 +0000 2018,Congrats @JohnJTough and the @InvenergyFF team on leading the investment in @nozominetworks.  Can't wait to see what you all build together!,0
Wed Jan 10 23:39:05 +0000 2018,Facebook ads figures don't match census data https://t.co/oWR1Tj11rJ #facebookads #ppl #startup #seo #investment #leadgeneration #ppc,0
Wed Jan 10 23:11:29 +0000 2018,I favorited a YouTube video -- Investment Basics : How to Invest in Green Energy Companies http://youtu.be/xl-Qpd1Kw-A?a,0
Wed Jan 10 22:59:01 +0000 2018,@chriswise68 hi  did you get in on the investment with Luca?,0
Wed Jan 10 22:36:26 +0000 2018,Started just 6 weeks ago with a 2K investment dove in to the crazy world of crypto absorbing everything we could an… https://t.co/ZK5IJPPQmf,0
Wed Jan 10 22:25:30 +0000 2018,@AvgAndy @Sola5Gal My "investment" in https://t.co/1wF3O2ZNld did not pay off. :),0
Wed Jan 10 22:01:51 +0000 2018,@dannyosmond777 @HotspurRelated I think it would be a decent investment. Low risk.,0
Wed Jan 10 21:34:00 +0000 2018,For all of the #crypto = security talk  how is the Kodak Kashminer not a security? Its Howey case w/ #bitcoin minin… https://t.co/MZRyg9BY1t,0
Wed Jan 10 21:01:21 +0000 2018,With BearCom Preventive Maintenance Plans our customers can rest easy knowing that their #investment is protected a… https://t.co/Gh3s0o3OF6,0
Wed Jan 10 20:56:02 +0000 2018,🏠 "#Dallas falls to no. 5 for #realestate #investment prospects but still has the secret sauce" via @Bisnow… https://t.co/U1kfRgSxP0,0
Wed Jan 10 20:44:06 +0000 2018,Whoa! 16 investment hacks you didn't know about. Look's like the cat is out of bag. https://t.co/iJAaSOfRtH https://t.co/uef8pJUug1,0
Wed Jan 10 20:42:15 +0000 2018,FDI relaxation for real estate brokerages to boost investment: Experts https://t.co/D10YMFNNj7,0
Wed Jan 10 20:39:06 +0000 2018,Top 10 Reasons Your Facebook Ads Aren't Generating Real Estate Leads https://t.co/MRCwtlTHvg #facebookads… https://t.co/T0bQUfgXZo,0
Wed Jan 10 20:29:54 +0000 2018,Condo Close to SMU Offers Great Investment Potential  #dallasrealestate #condo   https://t.co/9rFFoy9PoN,0
Wed Jan 10 20:26:07 +0000 2018,From The Vista: Is Cryptocurrency the Next Big Deal? https://t.co/iwQsaN2ePx,0
Wed Jan 10 19:49:51 +0000 2018,Best investment is self investment https://t.co/lOibkJqBEA,0
Wed Jan 10 19:34:11 +0000 2018,How to Maximize Your IT Service Management Investment https://t.co/ONe3qmBZwB https://t.co/mKE2PJB7xU,0
Wed Jan 10 19:25:24 +0000 2018,I made the biggest Investment of my life...ME,0
Wed Jan 10 19:24:01 +0000 2018,The bottom line is #ethics pays; in market share  profits  reputation  customer satisfaction and  in the end run  l… https://t.co/nHudirGCSX,0
Wed Jan 10 19:14:33 +0000 2018,Our new PxP platform proves we are putting our money where our mouth is #BePrescient https://t.co/IZrCtzewZZ,0
Wed Jan 10 19:07:04 +0000 2018,Why one Boston investment firm wants a merger every year - Boston Business Journal https://t.co/gLvXQmD3Kl,0
Wed Jan 10 19:05:32 +0000 2018,@bigfendi We can respect that and we get it but for some artist investment is also a  sacrifice no one wants to pay… https://t.co/318juxMFXZ,0
Wed Jan 10 19:00:14 +0000 2018,How can you make sure an impending divorce doesn't break the bank? How to manage the implications of divorce. https://t.co/5e2Dht0oFM,0
Wed Jan 10 18:48:29 +0000 2018,Have you contacted your congressional reps to implore them to #SaveTitleII ? Have you shared with others the import… https://t.co/hT9dJVrDSk,3
Wed Jan 10 18:43:21 +0000 2018,Have you contacted your congressional reps to implore them to #SaveTitleII ? Have you shared with others the import… https://t.co/hT9dJVrDSk,3
Wed Jan 10 18:35:08 +0000 2018,@TechTitansTexas an interesting read about angel investment in Texas. #AngelInvestor #Texas #TechTitans  https://t.co/Ut8ApLLH1E,0
Wed Jan 10 18:18:09 +0000 2018,@wvhooligan I thought Guillén was treated unfairly and should have been playing much more than Harris last year. I… https://t.co/pynkxGSHJe,0
Wed Jan 10 18:15:56 +0000 2018,You make your own investment decisions  but how familiar are you with the products? Take our short quiz. https://t.co/WIKa4KcB4P,0
Wed Jan 10 18:15:44 +0000 2018,Our #SEO service can get your site ranking higher in Google and you'll see a huge return on your investment!,0
Wed Jan 10 18:12:56 +0000 2018,You face sequence of returns risk. Know what it is? #investing #investmentrisk https://t.co/TCWqaoB5cL,0
Wed Jan 10 18:08:05 +0000 2018,Cox CEO: Investment is the key to staying competitive https://t.co/gMOWNwvjAc,0
Wed Jan 10 17:56:43 +0000 2018,Kohl's Corporation Sales Soar  While Bon-Ton Spirals Towards Bankruptcy https://t.co/UHgsh3aUHT,0
Wed Jan 10 17:39:04 +0000 2018,How to run your first successful Facebook Ads campaign (Resources included) https://t.co/k0qWPmTXh9 #facebookads… https://t.co/xUnuYakBFe,0
Wed Jan 10 17:25:29 +0000 2018,New Skift Research Report: Venture Investment Trends and Startup Opportunities in Travel 2018 - Skift  Skift  New S… https://t.co/pQZRAgcfKa,0
Wed Jan 10 17:00:37 +0000 2018,Check out the latest on the country’s economic outlook  class B workforce #housingmarket dynamics and investment ca… https://t.co/03ibu91Qgb,1
Wed Jan 10 16:53:47 +0000 2018,@TheRoyalPosts Because they have a dream. To reap USA benefits without putting any investment in this country,0
Wed Jan 10 16:42:27 +0000 2018,TerrellGroup @Terrell_Group   Fed's Bullard Says Tax Overhaul May Light Fire Under Investment… https://t.co/ux9BHNkTjR,0
Wed Jan 10 16:40:20 +0000 2018,I would say A&amp;M definitely upgraded their coaching staff. Making sure that Jimbo investment has everything he needs.,0
Wed Jan 10 16:33:26 +0000 2018,@PeteVlastelica @MLG @overwatchleague Pretty exciting day! I think everyone has their eyes on this season. Largest… https://t.co/38j5ibt9GV,0
Wed Jan 10 16:14:01 +0000 2018,Pfizer  pocketing a big tax cut from Trump  will end investment in Alzheimer's and Parkinson's research… https://t.co/Et5N6FlBjv,2
Wed Jan 10 16:11:58 +0000 2018,Have you contacted your congressional reps to implore them to #SaveTitleII ? Have you shared with others the import… https://t.co/hT9dJVrDSk,3
Wed Jan 10 16:10:15 +0000 2018,Have you contacted your congressional reps to implore them to #SaveTitleII ? Have you shared with others the import… https://t.co/hT9dJVrDSk,3
Wed Jan 10 16:03:59 +0000 2018,@333Wisdom it’s not an expense it’s an investment my guy @nathandiazaron,0
Wed Jan 10 15:48:10 +0000 2018,And every day. . . . #homebuyers #housebuyers #dallashomebuyers #sellfast #dallashomes #webuyhouses #sellyourhome… https://t.co/DLd7jL1u0G,0
Wed Jan 10 15:43:39 +0000 2018,Pfizer  pocketing a big tax cut from Trump  will end investment in Alzheimer's and Parkinson's research… https://t.co/Et5N6FlBjv,2
Wed Jan 10 15:36:55 +0000 2018,How can investors protect their portfolios against downside risk? Chief investment strategist Brent Schutte tells… https://t.co/hJNIql5PEo,0
Wed Jan 10 15:30:38 +0000 2018,Register for the #SIChallenge and help solve some of the world's most pressing issues through sustainable investmen… https://t.co/RcvYRWorto,0
Wed Jan 10 15:29:01 +0000 2018,"To know thyself is to love thyself" 3 Self-Investment Tips Most Life Coaches Won't Tell You… https://t.co/s3eJUyRivK,0
Wed Jan 10 15:19:32 +0000 2018,Pfizer  pocketing a big tax cut from Trump  will end investment in Alzheimer's and Parkinson's research… https://t.co/Et5N6FlBjv,2
Wed Jan 10 15:02:31 +0000 2018,How to Run an Effective Facebook Ads Campaign https://t.co/pOtTD0nt3i #ppc #seo #leadgeneration #ppl #investment #facebookads #startup,3
Wed Jan 10 14:39:08 +0000 2018,Facebook Ads Feature: Customize Creative Assets by Placement https://t.co/1sQHUQO3Zq #facebookads #ppl… https://t.co/iqV9rCxNtV,0
Wed Jan 10 14:30:34 +0000 2018,Is the VIX Being Gamed? A Sudden Swoon Has Traders Talking Again https://t.co/wSupMkyy6F via @markets#valuation… https://t.co/skMIisEVxG,0
Wed Jan 10 14:30:33 +0000 2018,Blockchain: Positive Changes for the Financial Services Industry https://t.co/MEZ0qsoZ80,0
Wed Jan 10 14:30:33 +0000 2018,Blockchain: Positive Changes for the Financial Services Industry https://t.co/1NGUdm6kek,0
Wed Jan 10 13:58:19 +0000 2018,"Exclusive-Unregulated British Firm Draws Asian Investors" by REUTERS via NYT https://t.co/FH4LXqgTHF,0
Wed Jan 10 13:55:43 +0000 2018,Cabinet approves 49% foreign investment in Air India under approval route - Economic Times  Economic Times  Cabinet… https://t.co/ItzNU1akOF,0
Wed Jan 10 13:10:04 +0000 2018,What’s your investment strategy? How to Survive a Stock Market Bubble (bulls outnumber bears by the most since 2010… https://t.co/X8Knk46DLI,0
Wed Jan 10 12:45:36 +0000 2018,New Skift Research Report: Venture Investment Trends and Startup ... - Skift  Skift  New Skift Research Report: Ven… https://t.co/a3tduWDHHW,0
Wed Jan 10 12:28:05 +0000 2018,An investment in knowledge always pays the best interest. --Benjamin Franklin-- #motivateme #surrenderhere https://t.co/OPhzYI64uC,1
Wed Jan 10 12:17:25 +0000 2018,What&amp;#8217;s Blowing Up the Bitcoin Bubble? https://t.co/8GpkdzqiGV,0
Wed Jan 10 11:43:21 +0000 2018,The Art of Crafting Successful Facebook Ads #semrushchat https://t.co/bOlVrD1BgG #ppc #investment #ppl #startup… https://t.co/nl0zTTCXTa,1
Wed Jan 10 11:39:04 +0000 2018,Studi Kasus Iklan  Biaya Pemasangan Iklan Di Facebook Ads https://t.co/5VqQfYKLxg #startup #ppc #facebookads… https://t.co/bLMXZkg90T,0
Wed Jan 10 11:10:06 +0000 2018,An investment in knowledge always pays the best interest. --Benjamin Franklin-- #motivateme #surrenderhere https://t.co/OPhzYI64uC,1
Wed Jan 10 08:42:15 +0000 2018,Good or bad?! Leading indicator of healthcare cost skyrocketing but maybe also source of innovation and investment?! https://t.co/B6K7qhbGcf,0
Wed Jan 10 08:39:04 +0000 2018,How to Optimize Your Facebook Ads: A Proven Approach : Social Media Examiner https://t.co/rYZajis6P7… https://t.co/9I8gogY6dN,0
Wed Jan 10 07:57:45 +0000 2018,@realDonaldTrump @luv69 @chuckwoolerly @markyoungtruth Do that mean the public schools&amp;children in this nation will… https://t.co/PvJNStw0mr,0
Wed Jan 10 05:48:46 +0000 2018,Seagate Stock Rises 12�20After Reported Investment In Ripple https://t.co/p0kvngkmaJ,0
Wed Jan 10 05:40:25 +0000 2018,I️ have an interview tomorrow with an incredible investment company  I praaaaay I get this position  I want to fina… https://t.co/I9T59fS5X2,1
Wed Jan 10 05:39:05 +0000 2018,Feds weigh disclosure requirement for Facebook ads https://t.co/6CdVKuDs33 #ppl #facebookads #investment #startup #ppc #seo #leadgeneration,0
Wed Jan 10 05:36:41 +0000 2018,Ain’t no send some nudes bihh it’s more like send some FUNDS I’m trying to flip it with we call an INVESTMENT in my damn self!,0
Wed Jan 10 05:26:07 +0000 2018,Ok first things first  download the app called scholly by @MyScholly. They have an amazing app of tailoring you to… https://t.co/184fiAvftN,0
Wed Jan 10 05:04:02 +0000 2018,I️ have an interview tomorrow with an incredible investment company  I praaaaay I get this position  I want to fina… https://t.co/I9T59fS5X2,1
Wed Jan 10 04:25:18 +0000 2018,@danielcrosby You’re a BTC believer now!? I just hit 100x on a 3 month old ICO investment. This is totally sustainable  right? 😬,0
Wed Jan 10 04:12:49 +0000 2018,Since when did sending troops into Eritrea to intimidate Sudan &amp; Ethiopia become 'bilateral trade &amp; investment'? https://t.co/52bXYgkzLm,2
Wed Jan 10 03:55:12 +0000 2018,Pfizer  pocketing a big tax cut from Trump  will end investment in Alzheimer's and Parkinson's research https://t.co/lj8ELuHXBC,0
Wed Jan 10 03:51:58 +0000 2018,As part of #Axxess' continuing investment in the #homehealth care industry  we are proud to introduce "Fresh Air".… https://t.co/K4yt5u9kGG,6
Wed Jan 10 03:30:03 +0000 2018,Moving? Need to sell your house? Call 214-444-9385 . . . #homebuyers #housebuyers #dallashomes #webuyhouses… https://t.co/OGOtdaCxZU,0
Wed Jan 10 03:05:47 +0000 2018,Since when did sending troops into Eritrea to intimidate Sudan &amp; Ethiopia become 'bilateral trade &amp; investment'? https://t.co/52bXYgkzLm,2
Wed Jan 10 02:51:47 +0000 2018,#Libya's crude #oil production has been resilient despite all odds.  However  Libya cannot maintain this level of p… https://t.co/nU6i84w4Ag,20
Wed Jan 10 02:43:35 +0000 2018,Why Your Teeth Are a Good Investment in Yourself https://t.co/RurILaC9m3,0
Wed Jan 10 02:39:05 +0000 2018,3 Ways You Should Be Using Facebook Ads to Grow Your Upper Cervical Practice Right Now https://t.co/fOl2pWzGIL… https://t.co/OQuogte8qR,0
Wed Jan 10 02:16:12 +0000 2018,Why Your Teeth Are a Good Investment in Yourself https://t.co/JJVTwoxlA5,2
Wed Jan 10 00:56:16 +0000 2018,Bezos  like Jobs invests his money into other businesses and fledgeling businesses.   Some of them pay off big.… https://t.co/wkXD9XesHs,0
Wed Jan 10 00:54:51 +0000 2018,Decided it was time to get new sneakers so I bought a pair for running in and a pair for work. I'm on my feet const… https://t.co/P0cXCGooVF,0
Wed Jan 10 00:41:13 +0000 2018,HFF announces sale of 5757 Woodway in Houston’s Galleria area https://t.co/e3JzF3aeOe   #hffdealsdone #houston #CRE… https://t.co/dVFHE6nWK7,1
Wed Jan 10 00:41:07 +0000 2018,HFF announces sale of transit-oriented mixed-use property near Denver https://t.co/TcHuADoi6L   #hffdealsdone… https://t.co/fwJ6CZJGld,1
Wed Jan 10 00:41:04 +0000 2018,HFF announces sale of Village at Bear Creek in Lakewood  Colorado https://t.co/lJbQpypTW3 #apartments #multifamily… https://t.co/TwdIG96gJL,1
Wed Jan 10 00:26:24 +0000 2018,@Thom_Hartmann   On the topic of student debt  you often cite the GI bill as the example of returned investment (7:… https://t.co/BGt1RLlnkz,0
Wed Jan 10 00:15:31 +0000 2018,#dailyfact: From 2011-2016  there have been more than 1 441 FDI projects in Texas  translating into the creation of… https://t.co/nuCP22bu7V,5
Wed Jan 10 00:00:28 +0000 2018,Philanthropy? Social Investment? No not at all. Pay for Success has potential for the worst kind of greed. Read up… https://t.co/Xd8sJlbnHK,1
