Wed Feb 07 20:57:38 +0000 2018,Hoshi “The Flurry” Mogoshi. 🌪🌪 Join us in our token sale #tokensale beginning Feb 15th to get your Elementeum (ELET… https://t.co/eVVZpGERbK,1
Wed Feb 07 19:30:01 +0000 2018,I just joined what I think could be 2018’s most exciting #ICO. #PlazaSystems is developing a “freedom lifestyle” ba… https://t.co/w0cTd4WY7H,0
Wed Feb 07 15:44:24 +0000 2018,Do you want to succeed? you will help #credits with a long experience of work #creditscoin #ICO #credits,0
Wed Feb 07 15:40:41 +0000 2018,@AltOne_Crypto @Missconsin @CryptoMojoMojo Sounds like a new ICO is born. It's a decentralized tinder like platform… https://t.co/ZQl06xWzyX,0
Wed Feb 07 11:13:22 +0000 2018,The creator of the future @NapoleonXai #ICO #NPX #CROWDSALE #TGE,0
Wed Feb 07 10:53:49 +0000 2018,The NaPoleonX ICO and the corresponding token creation process are organized around smart contracts running on Ethe… https://t.co/uX4HugIhh6,0
Wed Feb 07 08:35:37 +0000 2018,Kodak Delays Cryptocurrency ICO As Short Interest In Stock Surges  https://t.co/EHxzDkkfmU,0
Wed Feb 07 03:06:19 +0000 2018,What #ICO are you watching for Feb?  Been a wild month with the #cryptocrash  I am very curious how it will effect… https://t.co/vl3XFkM7Al,4
Wed Feb 07 01:51:04 +0000 2018,Havven is having a free token airdrop! Sign up before registration closes: https://t.co/josNxm730P  #airdrop… https://t.co/TZRPzbKChn,0
Wed Feb 07 01:19:55 +0000 2018,SEC Chair Jay Clayton: "I believe every ICO I've seen is a security... You can call it a coin but if it functions a… https://t.co/l82EnacKdp,0
