Mon Nov 12 21:54:32 +0000 2018,Salt has followed me since the ico i love it! https://t.co/NYqYo9YoVn,0
Mon Nov 12 16:26:51 +0000 2018,One of the most promising CO this quarter: Rubidium Token . Join the CO now!!! #Fameone #ICO #Crypto… https://t.co/hPLsd8RTWd,0
Mon Nov 12 16:23:42 +0000 2018,Colorado securities commissioner signs four more ICO cease and desist orders https://t.co/aiWqNYlyEr via @denbizjournal,0
Mon Nov 12 09:03:23 +0000 2018,SAFeth #SAFeth #ICO #PreSale is Open 🚀 0 ETH = 50 SAF 0.25 ETH = 325 SAF 0.5 ETH = 650 SAF 1 ETH = 1300 SAF   👉Addr… https://t.co/GSP1YDISLb,0
Mon Nov 12 08:39:43 +0000 2018,Colorado securities commissioner signs four more ICO cease and desist orders https://t.co/azstrJLXLu,0
Mon Nov 12 07:18:06 +0000 2018,You have a wonderful day today  my friend  because you found out about . It will change your life in the best way… https://t.co/pHl26DWZEl,1
Mon Nov 12 07:17:17 +0000 2018,You have a wonderful day today  my friend  because you found out about . It will change your life in the best way… https://t.co/pHl26DWZEl,1
Mon Nov 12 07:11:18 +0000 2018,It’s only one week left until the official launch of our #ICO and we have prepared a special blog post with all the… https://t.co/ZiZFq19Uhq,0
Mon Nov 12 07:10:02 +0000 2018,investment issues  filters financial criminal activities such as scam ICOs  money laundering  terrorism and black m… https://t.co/vyD5oEW76T,0
Mon Nov 12 07:09:48 +0000 2018,#BlokBiz #BlokBiz.io #ICO https://t.co/1zEVeYqlNQ,0
Mon Nov 12 05:16:02 +0000 2018,This project is just the BOMB! One of the best to date! It is my great pleasure to participate and follow all the n… https://t.co/MpSDmTUapw,0
