Tue Jul 10 17:14:00 +0000 2018,Bitcoin Brief - Swiss Exchange  CBOE ETF  ICO's Die Quick  Liquid Assets And BTC Privacy       with @ToneVays… https://t.co/Yvy4uPglDp,0
Tue Jul 10 15:46:20 +0000 2018,#Yumerium #ICO #bounty #ICOTOP #cryptocurrency #bitcoin #business #investing #blockchain #crypto #btc #ethereum… https://t.co/6I9cmRNO7F,0
Tue Jul 10 06:54:42 +0000 2018,CryptoCarz ICO Review (part 2) https://t.co/0BqrLZz3YQ via @YouTube,0
Tue Jul 10 06:53:53 +0000 2018,CryptoCarz ICO Review https://t.co/TzcBudfbZF via @YouTube,0
Tue Jul 10 06:48:11 +0000 2018,Media Protocol ICO Review (part 2) https://t.co/XOhAUhnBuE via @YouTube,0
Tue Jul 10 06:47:54 +0000 2018,Media Protocol ICO Review (part 1) https://t.co/KTkC6DWx13 via @YouTube,0
Tue Jul 10 04:43:47 +0000 2018,industry standard cryptocurrency. Thanks to its’ ease of use  acceptance  flexibility and transparency. #autoblock #ICO #TheAutoBlockICO,0
Tue Jul 10 04:43:34 +0000 2018,#autoblock #ICO #TheAutoBlockICO https://t.co/83rM9lyJoh,0
Tue Jul 10 04:41:36 +0000 2018,introduce CINDX that simplifies your transaction system with blockchain-based technology.  #CINDX #ICO,0
Tue Jul 10 04:40:34 +0000 2018,We just published a new article: "Want People to Disable Adblockers on Your Website?   #ICO #ETHL #ETHLIMITED,0
Tue Jul 10 04:24:08 +0000 2018,The project is constantly attracting growing interest as a global audience and investors! The project has very ambi… https://t.co/VuKQ0FSSAd,0
Tue Jul 10 04:22:06 +0000 2018,#ICO #MVID #Monvid https://t.co/Gqe4zsltZN,0
Tue Jul 10 04:21:00 +0000 2018,A large number of intermediaries between the targeted Client and business inevitably leads to an increase in operat… https://t.co/kAFMAG8RXq,0
