Sun Oct 14 19:41:39 +0000 2018,@cryptogeordie @bitninjasupply @RonnieMoas @TourDeCrypto @BBButchers I wanted to treat the team to a nice steak din… https://t.co/f2Odh9sQnV,0
Sun Oct 14 16:35:00 +0000 2018,XMRig Cryptocurrency Miner Camouflages Itself as a Flash Updater https://t.co/Qa48zQbwwt via @serghei,0
Sun Oct 14 16:17:50 +0000 2018,ERC20 smart contract terms will control the release of   to provide decentralized management of supply and support… https://t.co/M7CWswYaZx,0
Sun Oct 14 16:16:44 +0000 2018,FinanceX are creating an interexchange network between countries supporting their fiat! FNX token will be exposed t… https://t.co/t3SfdtQi7f,0
Sun Oct 14 16:14:48 +0000 2018,This is a great project so quickly join and do not let you regret it. Great work of developers will give the result… https://t.co/MYZ5a3LYGu,0
Sun Oct 14 15:54:27 +0000 2018,CAREON ERC20 (Ethereum) platform is develop for interaction between researchers  developer and hybrid vehicle manuf… https://t.co/zZfYbuz26t,0
Sun Oct 14 15:29:05 +0000 2018,Opinion: Cryptocurrency and Wealth Redistribution https://t.co/n4fmvyevwo https://t.co/uqG57NG3rM,0
Sun Oct 14 14:09:28 +0000 2018,Looking forward to meeting the guys of @TourDeCrypto - @mrjberlin &amp; @poloskyxx3  @BlakeRizzo24  @RonnieMoas today!… https://t.co/1G8Jx0pnhk,1
Sun Oct 14 13:55:04 +0000 2018,Colorectal Cancer Survivors Benefit From Changing Lifestyle Behaviors   #oncopower = Oncology blockchain  #Cancer… https://t.co/bLKguiq1o9,8
Sun Oct 14 13:49:30 +0000 2018,Looking forward to meeting the guys of @TourDeCrypto - @mrjberlin &amp; @poloskyxx3  @BlakeRizzo24  @RonnieMoas today!… https://t.co/1G8Jx0pnhk,1
Sun Oct 14 13:41:03 +0000 2018,Colorectal Cancer Survivors Benefit From Changing Lifestyle Behaviors   #oncopower = Oncology blockchain  #Cancer… https://t.co/bLKguiq1o9,8
Sun Oct 14 13:06:26 +0000 2018,Boxing Legend Manny Pacquiao’s Cryptocurrency Could Launch This Year https://t.co/aDTk8ykT4n https://t.co/yAO5R7jsxE,1
Sun Oct 14 12:08:52 +0000 2018,Waiting to go #LIVE on @FOX26Houston with @DeneigeFOX26  @hawctalk  @BlakeRizzo24  @mrjberlin &amp; @poloskyxx3!  We’re… https://t.co/kCvIHOiPzg,77
Sun Oct 14 09:24:07 +0000 2018,Boxing Legend Manny Pacquiao’s Cryptocurrency Could Launch This Year https://t.co/aDTk8ykT4n https://t.co/yAO5R7jsxE,1
Sun Oct 14 06:02:30 +0000 2018,Critical Mass: Tesla's Twitter Trouble. Plus: SEC Sends Cryptocurrency Cases Soaring - https://t.co/vvJ6K1Wkrr https://t.co/vjjrVlqMtF,0
