Sat Apr 21 20:24:05 +0000 2018,"You may not have millions to invest but that doesn't mean you can't learn a thing or two from Musk's investment st… https://t.co/wTLmqc80S6,0
Sat Apr 21 20:09:35 +0000 2018,Learn how to make the most out of your Campaign Investment 📊📈 - https://t.co/WapGRg6kna https://t.co/TxepT49qRF,2759
Sat Apr 21 20:07:34 +0000 2018,We're #hiring! Click to apply: Head of Midcorporate Banking and Foreign Direct Investment - https://t.co/czFKndw9so… https://t.co/gNRQi4b9DU,0
Sat Apr 21 20:05:17 +0000 2018,- Learn how to make the most out of your Campaign Investment 📊📈-www.socialcxn.com https://t.co/RLKeD52x3P,2967
Sat Apr 21 19:59:41 +0000 2018,Gargoyle Investment Advisor Raised Stake in Merck &amp; Co (MRK) by $358 456 as Market Valuation Declined; Intel (INTC)… https://t.co/Ahe80lIs46,0
Sat Apr 21 19:57:38 +0000 2018,Kamunting Street Capital Management LP Position in Amazon Com (AMZN) Lowered by $19.61 Million as Stock Price Rose;… https://t.co/TqJ4FwUtX0,0
Sat Apr 21 19:56:46 +0000 2018,Legg Mason Asset Management Japan Stake in Everest Re Group LTD (RE) Has Increased by $640 900; Devon Energy Corp.… https://t.co/JsHUzv6skT,0
Sat Apr 21 19:54:00 +0000 2018,Morgan Stanley India Investment Fund Inc (NYSE:IIF)  2017 Q4 Institutional Investor Sentiment Stea...,0
Sat Apr 21 19:52:48 +0000 2018,Morgan Stanley India Investment Fund Inc (NYSE:IIF) Institutional Investors Sentime...,0
Sat Apr 21 19:49:03 +0000 2018,Learn how to make the most out of your Campaign Investment 📊📈 - https://t.co/WapGRg6kna https://t.co/TxepT49qRF,2759
Sat Apr 21 19:38:12 +0000 2018,Are the majority of these symptoms of Wall Street investment product pitches?  Thanks for the sad but true smile 😀… https://t.co/uURPf7Vapt,0
Sat Apr 21 19:34:12 +0000 2018,Vipshop Hldgs LTD (VIPS) Stake Maintained by Flowering Tree Investment Management Pte L...,0
Sat Apr 21 19:33:18 +0000 2018,Flowering Tree Investment Management Pte LTD Upped Its Vipshop Hldgs LTD (VIPS) Position by $8.62 Million; Shares Ro...,0
Sat Apr 21 19:29:16 +0000 2018,In an effort to reduce cancer risks  we’ve been requesting a 2nd set of turnout gear since ‘15. We are happy to rep… https://t.co/9MMPyZNUHH,29
Sat Apr 21 19:27:05 +0000 2018,Gilead Sciences (GILD) Shares Rose While Sterneck Capital Management Cut Stake; Mariner Investment Group Cut Eqt Mi… https://t.co/P7WAxxYGV0,0
Sat Apr 21 19:23:06 +0000 2018,Home Depot (HD) Shareholder Cipher Capital LP Increased Its Stake by $5.48 Million; 2U (TWOU) Market Value Rose Whi… https://t.co/0hh71hprSq,0
Sat Apr 21 19:21:23 +0000 2018,Uss Investment Management LTD Has Lifted Its Stake in Fidelity National Financial (FNF) by $6.16 Million; Makaira P… https://t.co/IIOEyUMxP3,0
Sat Apr 21 19:15:03 +0000 2018,Tenet Healthcare (THC) Position Has Lifted by Davidson Kempner Capital Management Lp; Facebook (FB) Valuation Decli… https://t.co/XznyjkBmzk,0
Sat Apr 21 18:56:00 +0000 2018,“Green investing generates returns” - @FT  “We are now telling investors that they don’t always have to sacrifice r… https://t.co/M3WiuP4ydx,1
Sat Apr 21 18:32:58 +0000 2018,“Green investing generates returns” - @FT  “We are now telling investors that they don’t always have to sacrifice r… https://t.co/M3WiuP4ydx,1
Sat Apr 21 18:26:07 +0000 2018,@Unnecesarean In this Congress it is hard to sustain attention for any public health issue.  I think the comparison… https://t.co/fRZcQxYB6l,0
Sat Apr 21 18:15:01 +0000 2018,“We’ve designed our webinar series to build our customer’s skills and familiarity with the platform so they can tak… https://t.co/JXsHtdzvp5,0
Sat Apr 21 18:13:43 +0000 2018,Learn how to make the most out of your Campaign Investment 📊📈 - https://t.co/WapGRg6kna https://t.co/TxepT49qRF,2759
Sat Apr 21 17:59:37 +0000 2018,- Learn how to make the most out of your Campaign Investment 📊📈-www.socialcxn.com https://t.co/RLKeD52x3P,2967
Sat Apr 21 17:54:30 +0000 2018,Tencent is the biggest fish in the $22 billion game investment pond #tencent #games @DigiCapitalist https://t.co/CbE1ALARAL,4
Sat Apr 21 17:48:07 +0000 2018,Tencent is the biggest fish in the $22 billion game investment pond #tencent #games @DigiCapitalist https://t.co/CbE1ALARAL,4
Sat Apr 21 17:42:21 +0000 2018,Want to work at Wells Fargo? We're #hiring in #Boston  MA! Click for details: https://t.co/b8djmlZA9r… https://t.co/LM6CSWnwEw,0
Sat Apr 21 17:31:51 +0000 2018,Amf Pensionsforsakring Ab Has Decreased Its Position in First Rep Bk San Francisco C (FRC) by $5.54 Million; As New… https://t.co/ZsZukXukmo,0
Sat Apr 21 17:30:46 +0000 2018,New Senior Investment Group Inc. (SNR) EPS Estimated At $0....,0
Sat Apr 21 17:30:07 +0000 2018,As Disney Walt Co (DIS) Stock Declined  Fisher Asset Management Has Trimmed Its Stake; Penobscot Investment Managem… https://t.co/5HPtIBMxkm,0
Sat Apr 21 17:28:05 +0000 2018,Tencent is the biggest fish in the $22 billion game investment pond #tencent #games @DigiCapitalist https://t.co/CbE1ALARAL,4
Sat Apr 21 17:27:19 +0000 2018,@Diddy aye boss how does being the Knicks president and CEO sound like? Make the smart investment now! You won’t regret it!!,0
Sat Apr 21 17:26:02 +0000 2018,Tencent is the biggest fish in the $22 billion game investment pond #tencent #games @DigiCapitalist https://t.co/CbE1ALARAL,4
Sat Apr 21 17:25:54 +0000 2018,2018 #top 100 #venture #capitalists https://t.co/kAc6HxjSHa via @cbinsights #CBInsights #VentureCapital #VC… https://t.co/XKKkQN9p0B,1
Sat Apr 21 17:21:24 +0000 2018,Glg Has Lowered Its Stake in Aetna New (AET) as Stock Value Declined; As Hanesbrands  (HBI) Market Value Declined … https://t.co/dDbUNPqtwu,0
Sat Apr 21 17:20:53 +0000 2018,The Tiny Soccer Club Fighting For Survival Against A New York Investment Fund https://t.co/CpjLJgjKIM,1
Sat Apr 21 17:13:26 +0000 2018,The Tiny Soccer Club Fighting For Survival Against A New York Investment Fund https://t.co/CpjLJgjKIM,1
Sat Apr 21 17:12:40 +0000 2018,Wafra Investment Advisory Group Has Cut Stake in United Health Group (UNH) as Stock Value Declined; Hudson Bay Capi… https://t.co/No1NpkV5l2,0
Sat Apr 21 17:09:07 +0000 2018,@Riders_First @MBTA @KeolisBoston @marty_walsh @RepKClark @SenWarren @SenMarkey The answer is MORE investment. Buil… https://t.co/Lmrci8tfd1,0
Sat Apr 21 17:06:14 +0000 2018,Finally Time For Investors To Sell? RBC Capital Downgrades RioCan Real Estate ate Investment Trust (RIOCF)  With $26.5 Targ...,0
Sat Apr 21 17:05:33 +0000 2018,- Learn how to make the most out of your Campaign Investment 📊📈-www.socialcxn.com https://t.co/RLKeD52x3P,2967
Sat Apr 21 17:04:48 +0000 2018,RBC Capital Has Decided To Downgrade RioCan Real Estate ate Investment Trust (RIOCF) Shar...,0
Sat Apr 21 17:01:52 +0000 2018,@mekncl I loved the game from 1988-2010. It's tough for diehards to understand the game doesn't play well on TV. Al… https://t.co/g5Pe03Gm1K,0
Sat Apr 21 16:49:01 +0000 2018,@harvardgop opens by touting their tax bill. Dems know that CEOs themselves have admitted they won’t use their gain… https://t.co/6AQKcX0TZA,0
Sat Apr 21 16:47:19 +0000 2018,Brandes Investment Partners LP Has Decreased Stake in Bank New York Mellon Corp (BK) by $3.04 Million as Stock Declin...,0
Sat Apr 21 16:46:09 +0000 2018,As Bank New York Mellon Corp (BK) Share Value Declined  Shareholder Brandes Investment Partners LP Has Cut Holdi...,0
Sat Apr 21 16:45:09 +0000 2018,Embraer S A (ERJ) Position Held by Brandes Investment Partners ...,0
Sat Apr 21 16:44:17 +0000 2018,Brandes Investment Partners LP Position In Embraer S A (ERJ) Was Has Increas...,0
Sat Apr 21 16:42:46 +0000 2018,Is Ericsson - ADS each representing 1 underlying Class B share (NASDAQ:ERIC) Now a Good Investment? Cowen \u0026 Co. Upgrades Sto...,0
Sat Apr 21 16:40:17 +0000 2018,Ironwood Investment Management Has Cut Barnes Group (B) Stake by $315 000; Market Value Declined; Jpmorgan Chase &amp;… https://t.co/6DCHjtZn4M,0
Sat Apr 21 16:40:07 +0000 2018,SEC proposes new rules for how investment professionals treat their investor clients. Read more  and learn how to c… https://t.co/SAxxbKWvH0,0
Sat Apr 21 16:11:19 +0000 2018,A total-return approach can help manage risk and may offer additional sources of fixed income return. See our inves… https://t.co/aP9jvVcPRh,10
Sat Apr 21 16:06:42 +0000 2018,- Learn how to make the most out of your Campaign Investment 📊📈-www.socialcxn.com https://t.co/RLKeD52x3P,2967
Sat Apr 21 16:01:42 +0000 2018,@ScipioAcheronus I mean  hell  I can just say it on Twitter - the truth is that spot REC prices and short-term forw… https://t.co/zzXwO4V9a9,0
Sat Apr 21 15:59:51 +0000 2018,As Polaris Inds (PII) Valuation Declined  Tiemann Investment Advisors Has Cut by $319 300 Its Position; As Tjx Comp… https://t.co/yhoti6csIy,0
Sat Apr 21 15:59:29 +0000 2018,KJ has faults but to get that rag tag squad of league 2 players anywhere near the top six be another couple of year… https://t.co/hFjQQY50oV,0
Sat Apr 21 15:56:37 +0000 2018,@BofA_News launches #global #digital #disbursements in #collaboration with @PayPal - #US #commercial #clients can n… https://t.co/YyTJh14MX3,1
Sat Apr 21 15:48:02 +0000 2018,What is Internal Rate of Return (IRR) and why is it an important metric to measure investment performance?… https://t.co/Mv9x2n7R7A,0
Sat Apr 21 15:43:50 +0000 2018,6 factors that could lead to more investment in #Industry40 #4IR technologies  via @MikeQuindazzi  #AI #Robotics… https://t.co/X45Zjk3zPf,124
Sat Apr 21 15:39:18 +0000 2018,Thank you so much @ComcastNBCUCI for bringing us together today  your generous investment in @CityYear and  today … https://t.co/su6r5ceisS,5
Sat Apr 21 15:30:17 +0000 2018,Zhekun (Chester) Xiong plans to... https://t.co/mMXDHGGJff,2
Sat Apr 21 15:26:28 +0000 2018,Join the Santander team! See our latest #job opening here: https://t.co/DoutJtJmAR #InvestmentBanking #dorchester  MA #Hiring #CareerArc,0
Sat Apr 21 15:19:53 +0000 2018,- Learn how to make the most out of your Campaign Investment 📊📈-www.socialcxn.com https://t.co/RLKeD52x3P,2967
Sat Apr 21 15:12:06 +0000 2018,In only six years  investment in #AI ventures leaped 1 800%  from $282 million in 2011 to more than $5 billion in 2… https://t.co/tcWSDNHq7V,20
Sat Apr 21 15:09:25 +0000 2018,Shifting business models from CAPEX to OPEX means channelling investment into #digitaltransformation.  #bigdata… https://t.co/F3s9ja7Ygd,0
Sat Apr 21 15:07:37 +0000 2018,Deriving a good risk-adjusted #valuation for a #startup involves many components - the exit realities  the financin… https://t.co/d6SZMD2wig,1
Sat Apr 21 15:06:04 +0000 2018,Learn how to make the most out of your Campaign Investment 📊📈 - https://t.co/WapGRg6kna https://t.co/TxepT49qRF,2759
Sat Apr 21 15:01:05 +0000 2018,[Video] How familiar are you with the Federal Reserve? Here’s a quick history. #fed #federalreserve #fedpolicy https://t.co/pFBpVWb51x,0
Sat Apr 21 15:00:19 +0000 2018,Thank you so much @ComcastNBCUCI for bringing us together today  your generous investment in @CityYear and  today … https://t.co/su6r5ceisS,5
Sat Apr 21 14:59:20 +0000 2018,Thank you so much @ComcastNBCUCI for bringing us together today  your generous investment in @CityYear and  today … https://t.co/su6r5ceisS,5
Sat Apr 21 14:52:49 +0000 2018,@nullriver Ahhh sorry 😐 doh...true...That was def an investment in time lol,0
Sat Apr 21 14:51:51 +0000 2018,Thank you so much @ComcastNBCUCI for bringing us together today  your generous investment in @CityYear and  today … https://t.co/su6r5ceisS,5
Sat Apr 21 14:51:20 +0000 2018,Zhekun (Chester) Xiong plans to... https://t.co/mMXDHGGJff,2
Sat Apr 21 14:51:09 +0000 2018,Thank you so much @ComcastNBCUCI for bringing us together today  your generous investment in @CityYear and  today … https://t.co/su6r5ceisS,5
Sat Apr 21 14:39:18 +0000 2018,Learn how to make the most out of your Campaign Investment 📊📈 - https://t.co/WapGRg6kna https://t.co/TxepT49qRF,2759
Sat Apr 21 14:38:28 +0000 2018,As Hollyfrontier Corp (HFC) Valuation Declined  Spark Investment Management LLC Boosted Its Positi...,0
Sat Apr 21 14:37:29 +0000 2018,6 factors that could lead to more investment in #Industry40 #4IR technologies  via @MikeQuindazzi  #AI #Robotics… https://t.co/X45Zjk3zPf,124
Sat Apr 21 14:37:25 +0000 2018,Hollyfrontier Corp (HFC) Share Price Declined While Spark Investment Management LLC Increased by $12.96 Million Its Sta...,0
Sat Apr 21 14:30:44 +0000 2018,Forget about Facebook. What about investment governance? https://t.co/QKMyhbhOx4 via @DailyFintech https://t.co/oqTCkO6KZ9,1
Sat Apr 21 14:22:19 +0000 2018,It's been a crucial week for Gladstone Investment Corporation (NASDAQ:GAIN); here's what analysts have to sa...,0
Sat Apr 21 14:20:54 +0000 2018,In an effort to reduce cancer risks  we’ve been requesting a 2nd set of turnout gear since ‘15. We are happy to rep… https://t.co/9MMPyZNUHH,29
Sat Apr 21 14:20:27 +0000 2018,As Accenture LTD (ACN) Market Value Declined  Haverford Trust Company Has Cut by $1.23 Million Its Stake; Johnson &amp;… https://t.co/uI1FQWD8D5,0
Sat Apr 21 14:19:48 +0000 2018,As Faro Technologies (FARO) Market Value Rose  Nj State Employees Deferred Compensation Plan Has Cut Its Holding by… https://t.co/LTjcbcGl6p,0
Sat Apr 21 14:19:41 +0000 2018,@TheLeadCNN @MichaelAvenatti Seattle Times: Avenatti's investment company has over 50 fraud lawsuits filed against… https://t.co/upU0SjQEnW,1
Sat Apr 21 14:18:44 +0000 2018,American Trust Investment Advisors Has Decreased Its Ipg Photonics (IPGP) Holding by $303 880; Cyrusone Com (CONE)… https://t.co/obgLM9Gh1v,0
Sat Apr 21 14:16:43 +0000 2018,Your next Volvo might have a Mercedes engine - Roadshow https://t.co/DAmdL1Avrz,0
Sat Apr 21 14:13:10 +0000 2018,Herald Investment Management LTD Increased Its Position in Attunity LTD (ATTU) by $4.20 Milli...,0
Sat Apr 21 14:12:25 +0000 2018,As Cinemark Holdings (CNK) Shares Rose  Shareholder Mawer Investment Management LTD Has Trimmed Its Position; Ameri… https://t.co/cmPb7tchvp,0
Sat Apr 21 14:12:11 +0000 2018,As Attunity LTD (ATTU) Stock Price Rose  Herald Investment Management LTD Has Boosted Its Positi...,0
Sat Apr 21 14:06:47 +0000 2018,Amerisourcebergen Corp (ABC) Holder Guyasuta Investment Advisors INC Has Trimmed Stake by $8.24 Million as Market Value Declin...,0
Sat Apr 21 14:06:00 +0000 2018,Guyasuta Investment Advisors INC Cut Stake in Amerisourcebergen Corp (ABC) by $8.24 Million as Market Value Declin...,0
Sat Apr 21 14:05:02 +0000 2018,Deriving a good risk-adjusted #valuation for a #startup involves many components - the exit realities  the financin… https://t.co/d6SZMD2wig,1
Sat Apr 21 13:58:36 +0000 2018,Jpmorgan Chase &amp; Company Maintains Stake in Corcept Therapeutics (CORT); General Cable Del Ne (BGC) Stock Price Dec… https://t.co/00xBjMuAQs,0
Sat Apr 21 13:54:56 +0000 2018,River Road Asset Management Raised World Fuel Services Corporatio (INT) Position by $587 440; Polaris Inds (PII) Sh… https://t.co/yPT6bwn3NZ,0
Sat Apr 21 13:54:28 +0000 2018,As At&amp;T  (T) Stock Declined  Vantage Investment Advisors Decreased Its Position; Crosslink Capital Has Cut Holding… https://t.co/PGncEkXKTz,0
Sat Apr 21 13:53:09 +0000 2018,As Celgene (CELG) Shares Declined  Shareholder Premier Asset Managment Has Trimmed Its Position by $1.57 Million; W… https://t.co/KS6Yaw4Z4k,0
Sat Apr 21 13:50:01 +0000 2018,Where Top Sovereign Wealth Funds Are Making Healthcare Bets https://t.co/nh2v7J2KUu,0
Sat Apr 21 13:48:46 +0000 2018,Learn how to make the most out of your Campaign Investment 📊📈 - https://t.co/WapGRg6kna https://t.co/TxepT49qRF,2759
Sat Apr 21 13:46:50 +0000 2018,We're thrilled to support Drug Story Theater with a $250k investment to expand this innovative peer education progr… https://t.co/RhQQmuQgC8,83
Sat Apr 21 13:43:24 +0000 2018,Infrastructure finance investment #TCNE2018 @TranspoCampNE https://t.co/cg72N7MXTV,0
Sat Apr 21 13:42:23 +0000 2018,Norwegian Cruise Line Hldgs (NCLH) Holder Mig Capital Decreased Stake by $12.61 Million; Reinsurance Group Amer (RG… https://t.co/5UXwviwfNr,0
Sat Apr 21 13:38:10 +0000 2018,We're thrilled to support Drug Story Theater with a $250k investment to expand this innovative peer education progr… https://t.co/RhQQmuQgC8,83
Sat Apr 21 13:33:52 +0000 2018,Costar Corp (CSGP) Shares Rose While Granahan Investment Management INC Cut Its Position by $5.27 Milli...,0
Sat Apr 21 13:33:05 +0000 2018,Forget about Facebook. What about investment governance? https://t.co/QKMyhbhOx4 via @DailyFintech https://t.co/oqTCkO6KZ9,1
Sat Apr 21 13:32:38 +0000 2018,Granahan Investment Management INC Has Trimmed Its Holding in Costar Corp (CSGP) as Market Valuation Ro...,0
Sat Apr 21 13:31:43 +0000 2018,As Advance Auto Parts  (AAP) Share Value Rose  Zuckerman Investment Group Has Upped by $673 299 Its Stake; As Genwo… https://t.co/4xfTAxh0sH,0
Sat Apr 21 13:31:23 +0000 2018,Granahan Investment Management INC Raised Echo Global Logistics (ECHO) Holding by $3.80 Milli...,0
Sat Apr 21 13:30:58 +0000 2018,Apple (AAPL) Shareholder Sigma Investment Counselors Has Trimmed Stake by $793 793; Fifth Third Bancorp Has Trimmed… https://t.co/1YMhkjI5hQ,0
Sat Apr 21 13:30:16 +0000 2018,Echo Global Logistics (ECHO) Shareholder Granahan Investment Management INC Boosted Its Sta...,0
Sat Apr 21 13:29:03 +0000 2018,Kayne Anderson Rudnick Investment Management LLC Has Cut Stake in Patterson Companies (PDCO) by $5.61 Milli...,0
Sat Apr 21 13:27:51 +0000 2018,Patterson Companies (PDCO) Share Value Declined While Kayne Anderson Rudnick Investment Management LLC Cut Sta...,0
Sat Apr 21 13:26:37 +0000 2018,Kayne Anderson Rudnick Investment Management LLC Has Boosted Position in Autohome INC (ATHM) as Market Value Ro...,0
Sat Apr 21 13:26:30 +0000 2018,In only six years  investment in #AI ventures leaped 1 800%  from $282 million in 2011 to more than $5 billion in 2… https://t.co/tcWSDNHq7V,20
Sat Apr 21 13:26:03 +0000 2018,Zhekun (Chester) Xiong plans to... https://t.co/mMXDHGGJff,2
Sat Apr 21 13:24:59 +0000 2018,Autohome INC (ATHM) Share Price Rose While Kayne Anderson Rudnick Investment Management LLC Has Upped Sta...,0
Sat Apr 21 13:24:50 +0000 2018,Microsoft (MSFT) Holder Investment Partners LTD Has Lifted Holding; Fukoku Mutual Life Insurance Company Has Booste… https://t.co/M2JXWhHQnB,0
Sat Apr 21 13:22:44 +0000 2018,As Schlumberger LTD (SLB) Stock Declined  J-P Marvel Investment Advisors Trimmed Position by $3.06 Million; Abiomed… https://t.co/SjZW3BUZYN,0
Sat Apr 21 13:22:10 +0000 2018,Visa Class A (V) Holder Edmp Cut Its Holding by $446 400 as Market Value Rose; Cim Investment Mangement Lowered Hom… https://t.co/ECSZex8iFQ,0
Sat Apr 21 13:21:06 +0000 2018,Wells Fargo &amp; Co (WFC) Valuation Declined While High Pointe Capital Management Boosted by $339 000 Its Stake; Sfe I… https://t.co/OeZbIRVKOi,0
Sat Apr 21 13:17:32 +0000 2018,In an effort to reduce cancer risks  we’ve been requesting a 2nd set of turnout gear since ‘15. We are happy to rep… https://t.co/9MMPyZNUHH,29
Sat Apr 21 13:12:04 +0000 2018,We're thrilled to support Drug Story Theater with a $250k investment to expand this innovative peer education progr… https://t.co/RhQQmuQgC8,83
Sat Apr 21 13:11:36 +0000 2018,We're thrilled to support Drug Story Theater with a $250k investment to expand this innovative peer education progr… https://t.co/RhQQmuQgC8,83
Sat Apr 21 13:10:00 +0000 2018,https://t.co/bkghOjREw6 Procter &amp; Gamble Sinks  Now Worst-Performing Dow Stock of 2018 https://t.co/C5PB4lUrjQ https://t.co/lbZu0Xv3bU,0
Sat Apr 21 13:05:13 +0000 2018,Learn how to make the most out of your Campaign Investment 📊📈 - https://t.co/WapGRg6kna https://t.co/TxepT49qRF,2759
Sat Apr 21 12:57:02 +0000 2018,We're thrilled to support Drug Story Theater with a $250k investment to expand this innovative peer education progr… https://t.co/RhQQmuQgC8,83
Sat Apr 21 12:56:18 +0000 2018,- Learn how to make the most out of your Campaign Investment 📊📈-www.socialcxn.com https://t.co/RLKeD52x3P,2967
Sat Apr 21 12:55:09 +0000 2018,- Learn how to make the most out of your Campaign Investment 📊📈-www.socialcxn.com https://t.co/RLKeD52x3P,2967
Sat Apr 21 12:53:42 +0000 2018,We're thrilled to support Drug Story Theater with a $250k investment to expand this innovative peer education progr… https://t.co/RhQQmuQgC8,83
Sat Apr 21 12:50:18 +0000 2018,today's stats : 1 new follower  7 new unfollowers  6461 non-followers. found via https://t.co/Cn9tFV4wmQ,0
Sat Apr 21 12:46:50 +0000 2018,We're thrilled to support Drug Story Theater with a $250k investment to expand this innovative peer education progr… https://t.co/RhQQmuQgC8,83
Sat Apr 21 12:28:15 +0000 2018,In only six years  investment in #AI ventures leaped 1 800%  from $282 million in 2011 to more than $5 billion in 2… https://t.co/tcWSDNHq7V,20
Sat Apr 21 12:05:11 +0000 2018,Tips for navigating the #VC investment roller coaster @hackernoon https://t.co/Gq6XxzKZuD #earlystageinvesting https://t.co/rb2bewsOTc,0
Sat Apr 21 11:54:04 +0000 2018,Congrats @gemhq for continuing and coordination of innovation products! @winkelspecht beware the trap of the over-A… https://t.co/h51D0nwjhE,0
Sat Apr 21 11:50:05 +0000 2018,Learn how to make the most out of your Campaign Investment 📊📈 - https://t.co/WapGRg6kna https://t.co/TxepT49qRF,2759
Sat Apr 21 11:48:32 +0000 2018,KBW Keeps a “Buy” Rating on State Street (STT) and $111.0000 Target; Nwq Investment ... https://t.co/lf0PmqwQ68… https://t.co/NZtHLXT00O,0
Sat Apr 21 11:38:36 +0000 2018,This is the motto of every crypto related investment “advisor” on twitter https://t.co/QZ8bo4WX41,1
Sat Apr 21 11:19:22 +0000 2018,6 factors that could lead to more investment in #Industry40 #4IR technologies  via @MikeQuindazzi  #AI #Robotics… https://t.co/X45Zjk3zPf,124
Sat Apr 21 11:04:01 +0000 2018,https://t.co/bkghOjREw6 10 Weekend Reads https://t.co/BThLrHrFvY https://t.co/7chKDxALMJ,0
Sat Apr 21 11:03:21 +0000 2018,Fidus Investment Corporation (FDUS) EPS Estimated At $0....,0
Sat Apr 21 11:02:11 +0000 2018,Fidus Investment Corporation (FDUS) Analysts See $0.38 E...,0
Sat Apr 21 10:55:42 +0000 2018,Nordea Investment Management Ab Lowered Its Position in Amgen (AMGN) by $79.54 Milli...,0
Sat Apr 21 10:55:18 +0000 2018,As Roper Technologies Com (ROP) Shares Rose  Holder Horizon Investments Has Boosted Its Holding; Alibaba Group Hldg… https://t.co/y6uXL2J28x,0
Sat Apr 21 10:54:42 +0000 2018,Nordea Investment Management Ab Has Cut Amgen (AMGN) Position by $79.54 Million as Valuation Declin...,0
Sat Apr 21 10:53:42 +0000 2018,Nordea Investment Management Ab Holds Stake in Cvs Health (CV...,0
Sat Apr 21 10:52:49 +0000 2018,Cvs Health (CVS) Holding Held by Nordea Investment Management ...,0
Sat Apr 21 10:47:37 +0000 2018,Northstar Investment Advisors Trimmed Emerson Electric Company (EMR) Position by $8.03 Million; Market Value Declin… https://t.co/ilJlBkUqym,0
Sat Apr 21 10:45:16 +0000 2018,Time Warner INC (TWX) Holder Public Sector Pension Investment Board Lowered Stake by $33.02 Milli...,0
Sat Apr 21 10:44:14 +0000 2018,Public Sector Pension Investment Board Has Decreased Its Holding in Time Warner INC (TWX) as Share Value Ro...,0
Sat Apr 21 10:43:09 +0000 2018,As Csx Corp (Put) (CSX) Market Valuation Declined  Public Sector Pension Investment Board Increased Its Stake by $324.50 Milli...,0
Sat Apr 21 10:42:07 +0000 2018,As Csx Corp (Put) (CSX) Share Value Declined  Public Sector Pension Investment Board Has Increased Its Holding by $324.50 Milli...,0
Sat Apr 21 10:41:01 +0000 2018,Korea Investment Corp Holding in Bank Of America Corporation (BAC) Decreased as Market Valuation Declin...,0
Sat Apr 21 10:39:36 +0000 2018,Bank Of America Corporation (BAC) Market Valuation Declined While Korea Investment Corp Has Trimmed Holding by $1.99 Billi...,0
Sat Apr 21 10:38:33 +0000 2018,Apple INC (AAPL) Shareholder Korea Investment Corp Has Boosted Stake by $13.08 Milli...,0
Sat Apr 21 10:37:56 +0000 2018,United Continental Holding (UAL) Shareholder Pioneer Investment Management Upped Its Position by $22.91 Million as… https://t.co/IuSPWCmxJm,0
Sat Apr 21 10:37:22 +0000 2018,Korea Investment Corp Increased Its Apple INC (AAPL) Position by $13.08 Milli...,0
Sat Apr 21 10:33:46 +0000 2018,Graphic Packaging (GPK) Shareholder National Investment Services Lifted Its Holding; Select Equity Group LP Increas… https://t.co/xhRQ0fpYNx,0
Sat Apr 21 10:26:19 +0000 2018,Home Depot (HD) Market Valuation Declined While Lbmc Investment Advisors Increased Its Stake; Transdigm Group (TDG)… https://t.co/PzEHGuThEx,0
Sat Apr 21 10:23:49 +0000 2018,Optimum Investment Advisors Has Trimmed Its Position in At&amp;T (T) as Shares Declined; As Costamare (CMRE) Stock Rose… https://t.co/igSnxiZrem,0
Sat Apr 21 10:18:08 +0000 2018,Learn how to make the most out of your Campaign Investment 📊📈 - https://t.co/WapGRg6kna https://t.co/TxepT49qRF,2759
Sat Apr 21 10:13:13 +0000 2018,- Learn how to make the most out of your Campaign Investment 📊📈-www.socialcxn.com https://t.co/RLKeD52x3P,2967
Sat Apr 21 10:07:25 +0000 2018,Deroy &amp; Devereaux Private Investment Counsel Trimmed Position in Merck &amp; Co (MRK) by $13.61 Million as Valuation De… https://t.co/NNm1PkBFiG,0
Sat Apr 21 10:05:10 +0000 2018,A large emphasis and time investment in training Chi Sao exercise emphasizes positioning to dominate the centerline.,0
Sat Apr 21 10:00:01 +0000 2018,Private equity investment trends and opportunities in healthcare https://t.co/CVjNV32lEV,0
Sat Apr 21 09:43:38 +0000 2018,Gateway Investment Advisers Has Decreased Stake in Paychex (PAYX) by $2.67 Million; As Nike Cl B (NKE) Market Value… https://t.co/VhsU5jcmS0,0
Sat Apr 21 09:37:59 +0000 2018,Mountain Lake Investment Management Lowered Holding in Capital Sr Living (CSU) by $585 000 as Market Valuation Decl… https://t.co/dR4m2TE37S,0
Sat Apr 21 09:20:03 +0000 2018,Crawford Investment Counsel Continues to Hold Stake in Metlife (MET); Medtronic Plc (MDT) Position Maintained by Parthenon L...,0
Sat Apr 21 09:18:06 +0000 2018,Seabridge Investment Advisors Has Cut Cyrusone  (CONE) Holding by $350 814; Lvm Capital Management LTD Has Cut Its… https://t.co/NAtcfYzg8v,0
Sat Apr 21 09:13:48 +0000 2018,Jensen Investment Management Increases Position in Coca Cola Co (KO); As Jpmorgan Chase &amp; Co (JPM) Share Value Rose… https://t.co/C42spFRAec,0
Sat Apr 21 09:09:48 +0000 2018,Obermeyer Wood Investment Counsel Lllp Boosted Stake in Crown Castle Intl New (CCI) by $336 663 as Stock Value Rose… https://t.co/jeSSXk4T2C,0
Sat Apr 21 09:07:50 +0000 2018,Learn how to implement Influencer Marketing  and to make the most out of the investment  📊📲- https://t.co/pfKHs3U6qP https://t.co/bxl7lF6Q4y,61
Sat Apr 21 08:59:36 +0000 2018,City Of London Investment Group Plc Insider Sale for 3 240 Shares of The Korea Fund  Inc. (NYSE:K...,0
Sat Apr 21 08:56:28 +0000 2018,@TheLeadCNN @MichaelAvenatti Seattle Times: Avenatti's investment company has over 50 fraud lawsuits filed against… https://t.co/upU0SjQEnW,1
Sat Apr 21 08:48:25 +0000 2018,Learn how to make the most out of your Campaign Investment 📊📈 - https://t.co/WapGRg6kna https://t.co/TxepT49qRF,2759
Sat Apr 21 08:12:37 +0000 2018,In only six years  investment in #AI ventures leaped 1 800%  from $282 million in 2011 to more than $5 billion in 2… https://t.co/tcWSDNHq7V,20
Sat Apr 21 08:10:26 +0000 2018,We're thrilled to support Drug Story Theater with a $250k investment to expand this innovative peer education progr… https://t.co/RhQQmuQgC8,83
Sat Apr 21 07:41:40 +0000 2018,Learn how to make the most out of your Campaign Investment 📊📈 - https://t.co/WapGRg6kna https://t.co/TxepT49qRF,2759
Sat Apr 21 07:06:11 +0000 2018,BrightSphere Investment Group plc (BSIG) EPS Estimated At $0....,0
Sat Apr 21 07:05:35 +0000 2018,Analysts See $0.46 EPS for BrightSphere Investment Group plc (BSI...,0
Sat Apr 21 06:24:53 +0000 2018,In only six years  investment in #AI ventures leaped 1 800%  from $282 million in 2011 to more than $5 billion in 2… https://t.co/tcWSDNHq7V,20
Sat Apr 21 05:46:40 +0000 2018,Learn how to make the most out of your Campaign Investment 📊📈 - https://t.co/WapGRg6kna https://t.co/TxepT49qRF,2759
Sat Apr 21 05:08:54 +0000 2018,6 factors that could lead to more investment in #Industry40 #4IR technologies  via @MikeQuindazzi  #AI #Robotics… https://t.co/X45Zjk3zPf,124
Sat Apr 21 05:00:41 +0000 2018,- Learn how to make the most out of your Campaign Investment 📊📈-www.socialcxn.com https://t.co/RLKeD52x3P,2967
Sat Apr 21 04:31:23 +0000 2018,In an effort to reduce cancer risks  we’ve been requesting a 2nd set of turnout gear since ‘15. We are happy to rep… https://t.co/9MMPyZNUHH,29
Sat Apr 21 04:31:14 +0000 2018,@Sorcyress That wheelbarrow was a good investment indeed,0
Sat Apr 21 04:13:32 +0000 2018,Learn how to make the most out of your Campaign Investment 📊📈 - https://t.co/WapGRg6kna https://t.co/TxepT49qRF,2759
Sat Apr 21 04:12:45 +0000 2018,$0.47 EPS Expected for Two Harbors Investment Corp. (TW...,0
Sat Apr 21 04:11:31 +0000 2018,EPS for Two Harbors Investment Corp. (TWO) Expected At $0....,0
Sat Apr 21 03:52:05 +0000 2018,@nytimes Bigger thing is the secrecy and lying  not the money.  So what  if they won a lottery or investment paid o… https://t.co/X410Rgtpn0,0
Sat Apr 21 03:29:33 +0000 2018,@SaysSimonson It can. But quickly would crowd out private investment,0
Sat Apr 21 03:17:17 +0000 2018,- Learn how to make the most out of your Campaign Investment 📊📈-www.socialcxn.com https://t.co/RLKeD52x3P,2967
Sat Apr 21 02:27:00 +0000 2018,South Korea will consider injecting funds into GM Korea for investment: Yonhap https://t.co/D2yr8N5q0p https://t.co/TKjvdM1VEa,0
Sat Apr 21 02:13:54 +0000 2018,6 factors that could lead to more investment in #Industry40 #4IR technologies  via @MikeQuindazzi  #AI #Robotics… https://t.co/X45Zjk3zPf,124
Sat Apr 21 01:48:47 +0000 2018,In an effort to reduce cancer risks  we’ve been requesting a 2nd set of turnout gear since ‘15. We are happy to rep… https://t.co/9MMPyZNUHH,29
Sat Apr 21 01:44:33 +0000 2018,In an effort to reduce cancer risks  we’ve been requesting a 2nd set of turnout gear since ‘15. We are happy to rep… https://t.co/9MMPyZNUHH,29
Sat Apr 21 01:42:30 +0000 2018,My issues w/ respect to tax cut: How much investment will it spur? How much will the deficit increase? How much out… https://t.co/Gk5vsoaho4,12
Sat Apr 21 01:21:58 +0000 2018,Learn how to make the most out of your Campaign Investment 📊📈 - https://t.co/WapGRg6kna https://t.co/TxepT49qRF,2759
Sat Apr 21 00:50:33 +0000 2018,Learn how to make the most out of your Campaign Investment 📊📈 - https://t.co/WapGRg6kna https://t.co/TxepT49qRF,2759
Sat Apr 21 00:50:29 +0000 2018,- Learn how to make the most out of your Campaign Investment 📊📈-www.socialcxn.com https://t.co/RLKeD52x3P,2967
Sat Apr 21 00:38:00 +0000 2018,Monmouth Real Estate Investment Corporation (MNR) Analysts See $0.22 E...,0
Sat Apr 21 00:35:01 +0000 2018,EPS for Monmouth Real Estate Investment Corporation (MNR) Expected At $0....,0
Sat Apr 21 00:32:38 +0000 2018,Malden approved for Opportunity Zone for long term investment eligibility....  Opening new channels to attract priv… https://t.co/X28cn8HzP9,5
Sat Apr 21 00:25:14 +0000 2018,In only six years  investment in #AI ventures leaped 1 800%  from $282 million in 2011 to more than $5 billion in 2… https://t.co/tcWSDNHq7V,20
Sat Apr 21 00:11:54 +0000 2018,The #WhiteSox are signing Machado and Harper next off-season. A $1 billion investment. White Sox World Series Champs 2020.,0
Sat Apr 21 00:11:28 +0000 2018,In only six years  investment in #AI ventures leaped 1 800%  from $282 million in 2011 to more than $5 billion in 2… https://t.co/tcWSDNHq7V,20
Sat Apr 21 00:01:05 +0000 2018,@DrIanWeissman Encouraging to see this investment with regard to #neurological disease. #Alzheimers and #ALS are hi… https://t.co/Pe2WIbpiWT,1
