Sat Apr 21 21:52:46 +0000 2018,We all know #cycling is a health investment. But did you know bike-friendly cities can save millions annually while… https://t.co/mdpyduaJNm,2
Sat Apr 21 21:50:27 +0000 2018,We all know #cycling is a health investment. But did you know bike-friendly cities can save millions annually while… https://t.co/mdpyduaJNm,2
Sat Apr 21 21:50:06 +0000 2018,We all know #cycling is a health investment. But did you know bike-friendly cities can save millions annually while… https://t.co/mdpyduaJNm,2
Sat Apr 21 21:46:31 +0000 2018,- Learn how to make the most out of your Campaign Investment 📊📈-www.socialcxn.com https://t.co/RLKeD52x3P,2967
Sat Apr 21 21:31:07 +0000 2018,Let us help you turn a $10 000 investment into a multi-million dollar return in new product and revenue opportuniti… https://t.co/aPDZELP4Ea,0
Sat Apr 21 21:28:40 +0000 2018,Learn how to make the most out of your Campaign Investment 📊📈 - https://t.co/WapGRg6kna https://t.co/TxepT49qRF,2759
Sat Apr 21 21:19:27 +0000 2018,Unlike the State  the Corporation was a network one joined willingly  through investment or employment; this enable… https://t.co/roaEcSSzsA,0
Sat Apr 21 21:18:23 +0000 2018,- Learn how to make the most out of your Campaign Investment 📊📈-www.socialcxn.com https://t.co/RLKeD52x3P,2967
Sat Apr 21 21:01:51 +0000 2018,That's an opportunity. Even if it required "training" the service for solid month for which types to deliver  it wo… https://t.co/QSTFYsQn8M,0
Sat Apr 21 20:39:43 +0000 2018,EU investment fund closes door on UK tech start-ups https://t.co/O8EIlDfCpB,0
Sat Apr 21 20:33:48 +0000 2018,Thank you so much @ComcastNBCUCI for bringing us together today  your generous investment in @CityYear and  today … https://t.co/su6r5ceisS,5
Sat Apr 21 20:28:32 +0000 2018,A total-return approach can help manage risk and may offer additional sources of fixed income return. See our inves… https://t.co/aP9jvVcPRh,10
Sat Apr 21 20:27:16 +0000 2018,Tencent is the biggest fish in the $22 billion game investment pond #tencent #games @DigiCapitalist https://t.co/CbE1ALARAL,4
Sat Apr 21 20:26:00 +0000 2018,Senior IMS Developer: Senior IMS Developer Can do WebEx Job Description: This position is for a Senior Developer wo… https://t.co/h9OSLynPKs,0
