Mon Mar 19 22:21:17 +0000 2018,5 must follow people in #Crypto &amp; why  @Naval - Deep  insightful  power player. @NeerajKA - Legislation news  prett… https://t.co/OaJtGgOhpf,3
Mon Mar 19 20:07:46 +0000 2018,Bitcoin  Ethereum  Bitcoin Cash  Ripple  Stellar  Litecoin  Cardano  NEO  EOS: Price Analysis  March 16 https://t.co/k8cb3Y1Mu1,1
Mon Mar 19 16:15:46 +0000 2018,5 must follow people in #Crypto &amp; why  @Naval - Deep  insightful  power player. @NeerajKA - Legislation news  prett… https://t.co/OaJtGgOhpf,3
Mon Mar 19 15:57:06 +0000 2018,5 must follow people in #Crypto &amp; why  @Naval - Deep  insightful  power player. @NeerajKA - Legislation news  prett… https://t.co/OaJtGgOhpf,3
Mon Mar 19 15:18:22 +0000 2018,5 must follow people in #Crypto &amp; why  @Naval - Deep  insightful  power player. @NeerajKA - Legislation news  prett… https://t.co/OaJtGgOhpf,3
Mon Mar 19 15:05:10 +0000 2018,Bitcoin  Ethereum  Bitcoin Cash  Ripple  Stellar  Litecoin  Cardano  NEO  EOS: Price Analysis  March 16 https://t.co/k8cb3Y1Mu1,1
Mon Mar 19 12:11:22 +0000 2018,Litecoin Price Analysis: LTC/USD Recovers Sharply From $135 @EtherWorldNews https://t.co/XzvyPi8VcG,0
Mon Mar 19 05:54:07 +0000 2018,This is a great mapping of a possible scenario with #Ltc #litecoin A trusted source of mine put this together howev… https://t.co/ASKo3FPRsF,1
Mon Mar 19 05:52:54 +0000 2018,This is a great mapping of a possible scenario with #Ltc #litecoin A trusted source of mine put this together howev… https://t.co/ASKo3FPRsF,1
Mon Mar 19 00:43:37 +0000 2018,ICYMI: Bitcoin  Ethereum  Bitcoin Cash  Ripple  Stellar  Litecoin  Cardano  NEO  EOS: Price Analysis  Feb. 26… https://t.co/f1rQFvydoR,0
