Tue Feb 27 14:16:25 +0000 2018,Okay  car charting  coming right up... just a little. I want to #DayTrade my girl $LTC again. She’s ready to rock … https://t.co/I0Pm9WGzyw,0
Tue Feb 27 12:54:44 +0000 2018,With the announcement of one $400M acquisition  a cryptocurrency giant is born in Boston.  #cryptocurrencynews… https://t.co/Ui3P4x1tDQ,1
Tue Feb 27 11:58:30 +0000 2018,@SatoshiLite @flappening HA! That’s a F***ING laugh dude. As we see your LitePay launch fell on its face. There’s a… https://t.co/7F0N09TEMK,0
Tue Feb 27 10:15:42 +0000 2018,Bitcoin  Ethereum  Bitcoin Cash  Ripple  Stellar  Litecoin  Cardano  NEO  EOS: Price Analysis  Feb. 26… https://t.co/22XX29JsLX,0
Tue Feb 27 01:46:46 +0000 2018,Wouldn't it be great if you could subsidize your wi-fi costs!? Soon you will be able to... #WiFi #Gossamer #Bitcoin… https://t.co/BKGcsgdxAX,2
Tue Feb 27 00:50:11 +0000 2018,I liked a @YouTube video https://t.co/lWIwaNNkHT Bitcoin Holds Strong! Litecoin Moves  Circle + Poloniex + Goldman  Swiss Crypto ,0
