Tue Mar 06 19:55:07 +0000 2018,Tron (TRX)  Litecoin (LTC) &amp; VeChain Thor (VET) (VEN) Updates https://t.co/kKOjZpYR1N https://t.co/scG6mttIce,0
Tue Mar 06 18:07:26 +0000 2018,Cryptocurrency news roundup  March 4  2018 https://t.co/dNR9zO03rs #bitcoin #cryptocurrency #litecoin #ltc #btc… https://t.co/q6mO8G6vqx,2
Tue Mar 06 17:13:29 +0000 2018,Cryptocurrency news roundup  March 4  2018 https://t.co/dNR9zO03rs #bitcoin #cryptocurrency #litecoin #ltc #btc… https://t.co/q6mO8G6vqx,2
Tue Mar 06 14:28:47 +0000 2018,Litecoin Could Hit $1 500 This Year https://t.co/kxy0uLTccf,0
Tue Mar 06 07:03:35 +0000 2018,IOTA is currently testing key support once again for the third time. View our analysis now. #bitcoin… https://t.co/VZyGjLhT52,0
Tue Mar 06 06:24:43 +0000 2018,@LitePayInc Received your email "update". It doesn't say anything new. Would like to know how many merchants are no… https://t.co/Gj8FjcmEFT,0
Tue Mar 06 03:13:44 +0000 2018,Now you can support EasyProgramming with #Bitcoin  #Litecoin  or Stellar Lumens (#XLM). Should I add others?… https://t.co/JnLm0K2PKs,0
