Thu Feb 22 22:53:15 +0000 2018,DASH RITE LADIES GET YOUR JUST DUE💯🤜🤛🏿  @MissUSAHockey @TeamUSA https://t.co/PF5oAn0HYT U.S. women forge new legacy… https://t.co/Am5quVb7N8,0
Thu Feb 22 22:31:42 +0000 2018,The U.S. Election Assistance Commission is an agency that helps states protect their elections from cyber attacks.… https://t.co/JmXKcoa2Xb,486
Thu Feb 22 22:13:06 +0000 2018,Rice cooker or boiling it. Onions and mrs dash of any flavor is always goooddd https://t.co/bAO7BnaIeH,2
Thu Feb 22 22:09:27 +0000 2018,Geometry Dash Sub Zero #3 | POWER TRIP - THIS LEVEL DROVE US NUTS: https://t.co/ES2z8gYJAT via @YouTube,0
Thu Feb 22 22:02:02 +0000 2018,Rice cooker or boiling it. Onions and mrs dash of any flavor is always goooddd https://t.co/bAO7BnaIeH,2
Thu Feb 22 21:54:32 +0000 2018,Rice cooker or boiling it. Onions and mrs dash of any flavor is always goooddd https://t.co/bAO7BnaIeH,2
Thu Feb 22 21:30:40 +0000 2018,Scenes from @MissCross206 5th grade at @WeAreNorwood using Dash on #DLDay @OfficialDLDay @delcoSTEM @ISD_technology… https://t.co/lfPUxHlxdO,1
Thu Feb 22 21:22:59 +0000 2018,@Dash__0 @TheNBABulletin Yeah In 5 years😂,0
Thu Feb 22 21:20:55 +0000 2018,Scale up  speed up: Join us at Dash in July! https://t.co/cNhPqpm7X3,0
Thu Feb 22 21:19:19 +0000 2018,Marco Rubio decided to attend this town hall and is taking these hits not because he cares or is somehow empathetic… https://t.co/Z72MVEpqoU,1615
Thu Feb 22 21:18:48 +0000 2018,New Geometry Dash video coming later today HYPE,0
Thu Feb 22 20:23:45 +0000 2018,Scenes from @MissCross206 5th grade at @WeAreNorwood using Dash on #DLDay @OfficialDLDay @delcoSTEM @ISD_technology… https://t.co/lfPUxHlxdO,1
Thu Feb 22 18:57:03 +0000 2018,I’ll ain’t forget how y’all did Dame Dash during his breakfast club interview. He was dropping game the whole inter… https://t.co/kJoZHbj7jV,0
Thu Feb 22 13:10:13 +0000 2018,Join us in Cherry Hill at 1pm today to learn about evidence-based DASH diet recommendations in partnership with Sho… https://t.co/iNYOUTKzWD,0
Thu Feb 22 07:01:22 +0000 2018,I die a little bit whenever cmbyn gifsets are on my dash and not tagged,0
Thu Feb 22 06:58:59 +0000 2018,Geometry Dash - Sector 13 100% GAMEPLAY Online (F3lixsram) HARD DEMON: https://t.co/eVvNX7BGFP via @YouTube,0
Thu Feb 22 06:56:03 +0000 2018,I added a video to a @YouTube playlist https://t.co/eVvNX7BGFP Geometry Dash - Sector 13 100% GAMEPLAY Online (F3lixsram) HARD DEMON,0
Thu Feb 22 03:57:20 +0000 2018,@kylecassidy Add a dash button for champagne  and you’ve got a party. https://t.co/kThkJgbSVs,0
Thu Feb 22 03:54:12 +0000 2018,I love that amazon will let me add a dash button for a Cavalry Saber so I can reorder without effort when I run low.,0
Thu Feb 22 03:33:50 +0000 2018,Brett Lieblich sharing Dash's story at @PhilaPACT tonight! https://t.co/e6gkjLQO8I,3
Thu Feb 22 02:49:56 +0000 2018,Big Dipper I jus get it n dash,0
Thu Feb 22 01:34:00 +0000 2018,No one wants a girl that's nice all the time. Have to mix it with a dash of asshole. Just a dash though.,0
Thu Feb 22 00:52:43 +0000 2018,Brett Lieblich sharing Dash's story at @PhilaPACT tonight! https://t.co/e6gkjLQO8I,3
Thu Feb 22 00:51:37 +0000 2018,Brett Lieblich sharing Dash's story at @PhilaPACT tonight! https://t.co/e6gkjLQO8I,3
Thu Feb 22 00:50:19 +0000 2018,Brett Lieblich sharing Dash's story at @PhilaPACT tonight! https://t.co/e6gkjLQO8I,3
