Fri Jun 08 21:30:12 +0000 2018,There are various industries that our records and #informationmanagement solutions have been implemented. Whether y… https://t.co/jKu7vwWtzC,0
Fri Jun 08 19:30:10 +0000 2018,What life is like in the coal-mining boomtowns of Appalachia https://t.co/fx7Rz7rnLh https://t.co/WK2mnMn3mt,0
Fri Jun 08 19:10:08 +0000 2018,WOOD MACKENZIE (UK): Wood Mackenzie is a consultancy group  serving the following sectors globally: Energy Chemical… https://t.co/HKwBmUeUkK,1
Fri Jun 08 18:17:42 +0000 2018,"LinkedIn is by far the most powerful tool for your business and career." ~ @LewisHowes Check out the Top 10… https://t.co/l5wusN0wUs,0
Fri Jun 08 18:11:09 +0000 2018,Are you jealous still? It is a power thing  and a trust thing. #nothiringsheltervolunteers #fraud #mining #wrongfuldeaths,0
Fri Jun 08 17:55:39 +0000 2018,@Redfin I guess I could try mining by repeatedly signing up for an account 😕 Please also include an option to displ… https://t.co/q6XhM3I2Tz,0
Fri Jun 08 16:53:53 +0000 2018,Don't let WA become a coal mining state! Send a comment to @ecologywa today to stop the Black Diamond mine:… https://t.co/iStdDBDA5j,0
Fri Jun 08 16:53:35 +0000 2018,News media advocates consider the idea of mining a journalist’s records for sources to be an intrusion on First Amendment freedoms~NYT,0
Fri Jun 08 12:29:11 +0000 2018,New on eBay US &gt;&gt; #4094 #deals #deal 1200W Breakout Board W Button for HP PSU GPU Mining Ethereum+12... https://t.co/Flmi3AtlLm,0
Fri Jun 08 09:50:15 +0000 2018,Mining simulator legendary hat giveaway!                                                Rules:… https://t.co/VDaN0J8xn5,9
Fri Jun 08 09:20:14 +0000 2018,#Bitmain  one of the earliest manufacturers to bring #Bitcoin #mining chips to market is now in competition with so… https://t.co/3YodBbhMBI,0
Fri Jun 08 08:38:52 +0000 2018,@Nagrolaz we are mining diamonds,0
Fri Jun 08 03:34:48 +0000 2018,Bob Murray  CEO of the largest coal mining company in the US  personally drafted at least six executive orders for… https://t.co/PqSNu0BV9r,0
