Sun Nov 11 21:31:00 +0000 2018,Rainforest destruction from gold mining hits all-time high in Peru https://t.co/PeZjPgueEH,0
Sun Nov 11 20:27:32 +0000 2018,As Brazil’s Far Right Leader Threatens the Amazon  One Tribe Pushes Back   via @NYTimes https://t.co/x3cPKGDUAY,0
Sun Nov 11 18:25:37 +0000 2018,Finnish Mining Manufacturer Metso Receives Favorable Court Decision in China on IP Rights via ⁦@World_Highways⁩… https://t.co/lTi4wyWmsJ,0
Sun Nov 11 15:39:36 +0000 2018,As Brazil’s Far Right Leader Threatens the Amazon  One Tribe Pushes Back  via @nytimes https://t.co/o2Rm3G6apL,0
Sun Nov 11 15:17:19 +0000 2018,I liked a @YouTube video https://t.co/VdJNMWqEOh How Much Can You Make Mining Bitcoin With 6X 1080 Ti Beginners Guide,0
Sun Nov 11 14:54:41 +0000 2018,@realDonaldTrump If you want proper funding  stop defunding national parks and forests. Stop selling lands to priva… https://t.co/FuF7kJ5p7V,0
Sun Nov 11 12:59:16 +0000 2018,https://t.co/3Xyad5dVji,0
Sun Nov 11 10:26:08 +0000 2018,Comparison of open source software suites for data mining https://t.co/G5IkM5oxjw,18
Sun Nov 11 06:10:28 +0000 2018,Comparison of open source software suites for data mining https://t.co/G5IkM5oxjw,18
Sun Nov 11 03:48:19 +0000 2018,@FortniteGame the First Downer mining tool glitches all the time  never stopping its swinging sound. I can't hear p… https://t.co/CKyyAZ4SEn,1
Sun Nov 11 02:55:47 +0000 2018,Nick Fury is just hanging out in his mine  mining  which I guess is what you do when SHIELD puts you to pasture.,0
