Thu Nov 01 23:52:01 +0000 2018,Quick insights from Addy on the latest in #Cryptocurrency Mining! LEARN MORE: https://t.co/iy4pqB6lx0,0
Thu Nov 01 20:57:32 +0000 2018,Check out what I found on eBay &gt;&gt; #7288 #currency #mining Bitmain Antminer L3+ Miner In Hand Ready T... https://t.co/Mynp6z7dzo,0
Thu Nov 01 19:15:23 +0000 2018,Quick insights from Addy on the latest in #Cryptocurrency Mining! LEARN MORE: https://t.co/iy4pqB6lx0,0
Thu Nov 01 18:35:12 +0000 2018,.@F5Labs researchers encountered a strange behavior where malicious requests were originating from legitimate… https://t.co/qLn2EERfEI,1
Thu Nov 01 17:44:18 +0000 2018,GOD do i have enough time to do this mining leve. who can say https://t.co/MpcoYCVeh0,0
Thu Nov 01 17:20:06 +0000 2018,.@F5Labs researchers encountered a strange behavior where malicious requests were originating from legitimate… https://t.co/qLn2EERfEI,1
Thu Nov 01 16:26:21 +0000 2018,Time to go 💎 mining with the v5 Hollow Point. Which to dab first though? Top left is 99.1% pure THCA  below it is 9… https://t.co/Tw42h3gR21,0
Thu Nov 01 15:59:11 +0000 2018,@brysgo Faster *useful* compute has been driven by AI more than Bitcoin  and more by AI and science. A huge portion… https://t.co/0v5bHiWFpd,0
Thu Nov 01 14:34:55 +0000 2018,@brysgo “Through any means” is not a morally acceptable strategy or side effect to justify higher demand for powerf… https://t.co/xWFQAwPFpl,0
Thu Nov 01 13:30:39 +0000 2018,Idea: refugee credits like carbon credits. For every person your military or arms sales kill on foreign soil  you a… https://t.co/xYm9hOLMCy,10
Thu Nov 01 13:28:47 +0000 2018,Idea: refugee credits like carbon credits. For every person your military or arms sales kill on foreign soil  you a… https://t.co/xYm9hOLMCy,10
Thu Nov 01 12:12:29 +0000 2018,Check out what I found on eBay &gt;&gt; #7614 #mining #USA Mining Motherboard 6 GPU+6x PCI-E Extender Rise... https://t.co/wrPM0PUyFd,0
Thu Nov 01 10:03:30 +0000 2018,Idea: refugee credits like carbon credits. For every person your military or arms sales kill on foreign soil  you a… https://t.co/xYm9hOLMCy,10
Thu Nov 01 08:45:55 +0000 2018,and since the network is intentionally designed to do approximately constant work per unit wall-clock time  that wi… https://t.co/F4mya9jyS3,11
Thu Nov 01 08:17:40 +0000 2018,If you have an @ObeliskTechHQ  no changes are required for the @SiaTechHQ fork tomorrow!  All the nodes are upgrade… https://t.co/J2ydwZnELo,9
Thu Nov 01 08:17:27 +0000 2018,ConsenSys blockchain studio acquires Planetary Resources asteroid mining venture https://t.co/rbFlWopXek,4
Thu Nov 01 07:44:59 +0000 2018,and since the network is intentionally designed to do approximately constant work per unit wall-clock time  that wi… https://t.co/F4mya9jyS3,11
Thu Nov 01 03:51:22 +0000 2018,@smileyborg I certainly hope we can convince the mining community to set profits aside for the environment more eff… https://t.co/YtqRrEl0dA,0
Thu Nov 01 03:44:46 +0000 2018,@smileyborg When you say it’s not inherently required for it to exist  is that because they can rewrite the rules a… https://t.co/ljthznx5YZ,0
Thu Nov 01 02:52:34 +0000 2018,Idea: refugee credits like carbon credits. For every person your military or arms sales kill on foreign soil  you a… https://t.co/xYm9hOLMCy,10
Thu Nov 01 02:12:15 +0000 2018,Introduction to Machine Learning / Data Mining https://t.co/IEnXCrHJEn,10
Thu Nov 01 00:33:27 +0000 2018,Battle over phosphate mining roils small Fla. town https://t.co/bV34Nggp0z via @YouTube,0
Thu Nov 01 00:20:55 +0000 2018,As the top signatories of the fork since January  we're excited to welcome Obelisk miners mining at our Sia pool. I… https://t.co/F5raMCI5Ka,3
