Thu Nov 01 21:32:44 +0000 2018,I am very thankful to the team because You created a very exciting idea and am deeply impressed by the team's goals… https://t.co/vOaBDDV0m3,0
Thu Nov 01 21:21:34 +0000 2018,Very interesting project ! I advise you to invest in it. Join now... #ICODESICO #DESICO #DESI #ethereum #bitcoin… https://t.co/ATXRykfdZW,0
Thu Nov 01 21:21:28 +0000 2018,Wonderful  interesting  thought out. Friends study. The guys did a great job. I'm with you! #ICODESICO #DESICO… https://t.co/9KIUAKQvm5,0
Thu Nov 01 21:21:22 +0000 2018,A huge variety of services can be purchased by investors for tokens of DESICO Investments company  because DESICO I… https://t.co/0ZULIq9vp0,0
Thu Nov 01 21:21:07 +0000 2018,Time flies too fast  for this never in life there is nothing to be missed. I would recommend you to join this    as… https://t.co/d8stVH9EvA,0
Thu Nov 01 21:20:43 +0000 2018,#ICODESICO #DESICO #DESI #ethereum #bitcoin #cryptocurrency #tokensale https://t.co/ZnYmYtXeCq,0
Thu Nov 01 21:20:39 +0000 2018,#ICODESICO #DESICO #DESI #ethereum #bitcoin #cryptocurrency #tokensale https://t.co/cnehzJhW9o,0
Thu Nov 01 21:20:33 +0000 2018,#ICODESICO #DESICO #DESI #ethereum #bitcoin #cryptocurrency #tokensale https://t.co/AfKuYxR2U4,0
Thu Nov 01 21:20:29 +0000 2018,#ICODESICO #DESICO #DESI #ethereum #bitcoin #cryptocurrency #tokensale https://t.co/1dnyNZK0xg,0
Thu Nov 01 21:00:33 +0000 2018,Probably the last time you will see Ethereum under $200 What a steal... $Eth https://t.co/kCGpb00S7R,0
Thu Nov 01 16:39:58 +0000 2018,BEYOND RESEARCH: MORGAN STANLEY #CRYPTO: Morgan Stanley Is Discussing Several Different Institutional #Bitcoin And… https://t.co/JiEkSahbIz,0
Thu Nov 01 14:56:42 +0000 2018,#crypto #bitcoin #cryptocurrency #blockchain #btc #ethereum #litecoin #bitcoinmining #bitcoins #cryptocurrencies… https://t.co/PAV16yWjAJ,1
Thu Nov 01 13:38:08 +0000 2018,#crypto #bitcoin #cryptocurrency #blockchain #btc #ethereum #litecoin #bitcoinmining #bitcoins #cryptocurrencies… https://t.co/PAV16yWjAJ,1
Thu Nov 01 11:47:18 +0000 2018,A clear look at #blockchain!  Via @bizblockchainhq  https://t.co/oPDE1tm6lJ  #fintech #finance #tech #bitcoin… https://t.co/l2hMlKIJ2Z,4
Thu Nov 01 11:26:07 +0000 2018,A clear look at #blockchain!  Via @bizblockchainhq  https://t.co/oPDE1tm6lJ  #fintech #finance #tech #bitcoin… https://t.co/l2hMlKIJ2Z,4
Thu Nov 01 11:18:43 +0000 2018,A clear look at #blockchain!  Via @bizblockchainhq  https://t.co/oPDE1tm6lJ  #fintech #finance #tech #bitcoin… https://t.co/l2hMlKIJ2Z,4
Thu Nov 01 10:44:18 +0000 2018,A clear look at #blockchain!  Via @bizblockchainhq  https://t.co/oPDE1tm6lJ  #fintech #finance #tech #bitcoin… https://t.co/l2hMlKIJ2Z,4
Thu Nov 01 10:41:55 +0000 2018,A clear look at #blockchain!  Via @bizblockchainhq  https://t.co/oPDE1tm6lJ  #fintech #finance #tech #bitcoin… https://t.co/l2hMlKIJ2Z,4
Thu Nov 01 01:49:27 +0000 2018,A core component of Helbiz is the payment system itself  made possible through new second layer payment and convers… https://t.co/WFiHSNKkun,0
