Fri Mar 16 21:50:42 +0000 2018,Is ethereum the wave  🌊 now or,0
Fri Mar 16 17:42:40 +0000 2018,Seems pretty accurate to me..😂😂 $btc $xmr $eth $ncash $xrp #ethereum #cryptocurrency #bitcoin #blockchain #mtgox https://t.co/owjw0N50Zu,0
Fri Mar 16 07:58:08 +0000 2018,🔥 Tunisia Racing F1 City - Housing Area 🔥 For more: https://t.co/dMxwEV787G    #bitrace #bitcoin #cryptocurrency… https://t.co/0JjjoIQvsG,0
Fri Mar 16 07:45:30 +0000 2018,#TheAbyss joined @token2049 as a Silver Partner! It is the largest digital asset event in Asia that starts on March… https://t.co/zy6naTBCZt,0
Fri Mar 16 03:23:33 +0000 2018,Brock Pierce: No Longer Partnered With EOS Project #brockpierce #eos #ethereum #bitcoin #cryptonews… https://t.co/RoJus7W2Xo,1
Fri Mar 16 03:07:17 +0000 2018,Blockchain Will Bring Trust And Transparency #blockchain #georgelevy #future #bitcoin #ethereum #crypto… https://t.co/t7QuPS34lI,2
Fri Mar 16 01:02:06 +0000 2018,Google's Advertisement Ban Is Bullish  Not Bearish  For Bitcoin  Ripple  Ethereum  And Litecoin… https://t.co/mVoqUNgDmd,0
