Wed Mar 07 22:36:56 +0000 2018,Crypto Sanctum: “Infused” Meals Got Crypto Experts Stoned!  https://t.co/OEpOUtPFwv #bitcoin #cryptocurrency… https://t.co/NqYBZWMFaN,0
Wed Mar 07 21:00:45 +0000 2018,Google Searches for All Cryptocurrencies Decline Significantly - It seems overall interest in various cryptocurrenc… https://t.co/IhfIPORUcg,0
Wed Mar 07 19:28:46 +0000 2018,How the term ‘blockchain’ is (at least) as much a marketing as a technical term https://t.co/eM92ppAgCF via @Verge,0
Wed Mar 07 19:14:14 +0000 2018,Can Anything Replace Ethereum? https://t.co/W6MUP70Q10 https://t.co/BLzjV8r6gK,0
Wed Mar 07 19:10:06 +0000 2018,‘Blockchain’ is meaningless https://t.co/PZD7TL9deM,0
Wed Mar 07 15:35:19 +0000 2018,Speaking Opportunities at Miami #Blockchain Event by @CloudEXPO | #Bitcoin #FinTech #Ethereum #Crypto #Ripple |… https://t.co/NiucMfLneT,20
Wed Mar 07 12:01:52 +0000 2018,Ethereum Price Drops Below $800 as Bears Take Control - The cryptocurrency markets are always evolving in many diff… https://t.co/9zBt0wb3yQ,0
Wed Mar 07 10:05:18 +0000 2018,What Is Byzantium Hard Fork In Ethereum? https://t.co/z59M2NwR73 https://t.co/SCP1fiwifN,0
Wed Mar 07 07:30:02 +0000 2018,ICO is now LIVE. Learn more about the attractive offers  bonus and referral commissions: https://t.co/aCIvbycF2g… https://t.co/NIDm4jorpv,1
Wed Mar 07 07:20:39 +0000 2018,ICO is now LIVE. Learn more about the attractive offers  bonus and referral commissions: https://t.co/aCIvbycF2g… https://t.co/NIDm4jorpv,1
Wed Mar 07 01:35:06 +0000 2018,#BITRACE ICO  Amount Raised : $1 532 225 USD Last Chance To Get 20% BONUS Buy your BITRACE Token :… https://t.co/FwKta5LnXo,0
