Sun Nov 11 20:58:45 +0000 2018,Tune in Today to #THOSEBAXTERS Syndicated Radio Show on Phoenix Arizona's #1 Gospel Station Stellar Award Winner Go… https://t.co/iQZUxsUS7K,0
Sun Nov 11 17:52:45 +0000 2018,Huge props to team @edukosmiami for a killer brunch! Great to have you guys in the hood. Amazing @SlimPickensCo… https://t.co/kXTQZOE0ax,0
Sun Nov 11 17:15:00 +0000 2018,Something that very few seem to remember or consider  when Trump declared his loss of a billion dollars…we ‘all’ go… https://t.co/ILHNXsQI9n,1
Sun Nov 11 17:12:06 +0000 2018,Something that very few seem to remember or consider  when Trump declared his loss of a billion dollars…we ‘all’ go… https://t.co/ILHNXsQI9n,1
Sun Nov 11 14:42:04 +0000 2018,When the Big 12 wins a game in the playoffs w those awesome offenses and stellar defenses holla at me https://t.co/0a2mljaTqa,5
Sun Nov 11 14:24:47 +0000 2018,When the Big 12 wins a game in the playoffs w those awesome offenses and stellar defenses holla at me https://t.co/0a2mljaTqa,5
Sun Nov 11 14:23:55 +0000 2018,When the Big 12 wins a game in the playoffs w those awesome offenses and stellar defenses holla at me https://t.co/0a2mljaTqa,5
Sun Nov 11 14:23:23 +0000 2018,When the Big 12 wins a game in the playoffs w those awesome offenses and stellar defenses holla at me https://t.co/0a2mljaTqa,5
Sun Nov 11 14:22:09 +0000 2018,When the Big 12 wins a game in the playoffs w those awesome offenses and stellar defenses holla at me https://t.co/0a2mljaTqa,5
Sun Nov 11 12:24:57 +0000 2018,Blockchain запускает раздачу токенов Stellar https://t.co/PUQ0XzJOQi,0
Sun Nov 11 12:23:38 +0000 2018,&lt;b&gt;Blockchain&lt;/b&gt; запускает раздачу токенов Stellar https://t.co/PUQ0XzJOQi source: Block Chain today same now&amp;#013… https://t.co/qNnr6vinoB,0
Sun Nov 11 12:02:18 +0000 2018,#Stellar $xlm daily trend analysis The high of the wedge is 6956.7333 and the low of the wedge is 5844.4625. The do… https://t.co/U4FTfAKCCn,0
Sun Nov 11 05:02:44 +0000 2018,READY NA KAMI PARA SA HIMIG HANDOG 2018! #HimigHandog2018Sugarol https://t.co/wCQJkI7wrE,52
Sun Nov 11 03:53:23 +0000 2018,Isa dalawa tatlo puro hikab na ako hahahaa  #HimigHandog2018Sugarol,14
Sun Nov 11 02:06:17 +0000 2018,With the  incredible Penny Arcade at Versailles on Calle Ocho after her stellar Longing Last Longer MCD Arts Lab la… https://t.co/gY0ItsdTXn,2
Sun Nov 11 02:00:55 +0000 2018,With the  incredible Penny Arcade at Versailles on Calle Ocho after her stellar Longing Last Longer MCD Arts Lab la… https://t.co/gY0ItsdTXn,2
