Thu Dec 13 21:48:15 +0000 2018,We exceeded the state percent increase provided to @MDCPS and then added compensation adjustments up to 22.75% to e… https://t.co/XkommEF67x,1
Thu Dec 13 19:04:20 +0000 2018,We exceeded the state percent increase provided to @MDCPS and then added compensation adjustments up to 22.75% to e… https://t.co/XkommEF67x,1
Thu Dec 13 18:43:04 +0000 2018,Watched True Romance last night  absolutely stellar cast but was pleasantly surprised by the @Chase_Winovich cameo… https://t.co/YNjMcbiNxb,0
Thu Dec 13 17:39:44 +0000 2018,This week has been less than stellar for @POTUS. https://t.co/3jxMiCE8qc,0
Thu Dec 13 17:12:20 +0000 2018,BREAKING: #MariaButina pleads guilty to conspiring with an American to act at the direction of Russian  Alexander T… https://t.co/OcIhiuibsd,117
Thu Dec 13 15:00:33 +0000 2018,We would like to thank Italian tenor Franco Corso and his stellar band of international musicians and Maralago  for… https://t.co/mzEP6BJciI,0
Thu Dec 13 13:00:46 +0000 2018,We would like to thank Italian tenor Franco Corso and his stellar band of international musicians and Maralago  for… https://t.co/LlCryelBou,0
Thu Dec 13 06:31:40 +0000 2018,If you don’t listen to one other thing today - hear this!!!!!!!👀👀👀👀👀 https://t.co/y3CIG1vYb8,185
Thu Dec 13 05:50:44 +0000 2018,THE FAVOURITE and VOX LUX are still stellar films upon second and third viewing respectively. Who needs to watch ne… https://t.co/CSCe7J4Hnt,0
Thu Dec 13 03:56:07 +0000 2018,"Ruby Rose is perfect as Batwoman." Her performance was less than stellar. Pretty much boring and flat to me. No ch… https://t.co/WOTXwUqbha,0
