Wed Mar 07 20:22:23 +0000 2018,Didn't get enough of the movies with last night's Oscars? The Miami Film Festival's got you covered with more than… https://t.co/xgmh7XH2EO,2
Wed Mar 07 18:29:49 +0000 2018,I get to produce stellar experiences for people everyday. I get to tell the story that resonates… https://t.co/EOK3nYIcUM,0
Wed Mar 07 14:46:01 +0000 2018,People only share Good content.  What is good content? Long form? Well written?  Learn how to create compelling con… https://t.co/PfHgU9F64V,0
Wed Mar 07 11:52:29 +0000 2018,@ercwl Yes  this is called majority consensus  and its how Ripple and Stellar work (they use a supermajority though),0
Wed Mar 07 05:08:59 +0000 2018,Days since all time high(in USD)  percentage down since  Bitcoin: 79 days  45% Ethereum: 51  42% Ripple: 61  76% Bi… https://t.co/7BskeyYBKZ,0
Wed Mar 07 01:19:27 +0000 2018,Stellar...and each one got better https://t.co/yeHMeMfAPf,0
