Thu Sep 13 20:31:01 +0000 2018,@dohodl @TruthRaiderHQ @litecoin @SatoshiLite His feelings are hurt or hes btrash supporter,0
Thu Sep 13 19:01:02 +0000 2018,Ethereum (ETH)  Litecoin (LTC)  and Monero (XMR) Rise from the Ashes https://t.co/1zGtnL4Rtx https://t.co/UG8wQn3LF5,0
Thu Sep 13 15:04:56 +0000 2018,Crypto Transactions per second (TPS) Visa 24 000 tps PayPal  193  Ripple  1 500 tps  4 seconds to confirm. Stellar… https://t.co/YkmA7if9F5,3
Thu Sep 13 10:48:40 +0000 2018,Litecoin $LTC is valued at: $53.33   We verified that Binance is accepting new users! 💎 😍    ➡️… https://t.co/BxJ8Etnf97,0
Thu Sep 13 09:04:03 +0000 2018,Litecoin $LTC is valued at: $52.89   Binance registration is now OPEN for limited time! 🤔 💰    ➡️… https://t.co/WBK8yZdS11,0
Thu Sep 13 00:52:59 +0000 2018,Crypto Transactions per second (TPS) Visa 24 000 tps PayPal  193  Ripple  1 500 tps  4 seconds to confirm. Stellar… https://t.co/YkmA7if9F5,3
