Sun Apr 29 12:53:53 +0000 2018,Remember  I do not want #ltc to go down  I just want to be full of coins to go to the moon  be ready #Ripple #Dash… https://t.co/lQrDi7ncvb,2
Sun Apr 29 12:49:59 +0000 2018,Remember  I do not want #ltc to go down  I just want to be full of coins to go to the moon  be ready #Ripple #Dash… https://t.co/lQrDi7ncvb,2
Sun Apr 29 12:36:44 +0000 2018,Remember  I do not want #ltc to go down  I just want to be full of coins to go to the moon  be ready #Ripple #Dash… https://t.co/lQrDi7ncvb,2
Sun Apr 29 08:51:01 +0000 2018,As there are people who still believe that in 6 days we go to 1k? But are they fine from the head? You have to be r… https://t.co/jYLLZbYgPC,1
Sun Apr 29 08:36:46 +0000 2018,As there are people who still believe that in 6 days we go to 1k? But are they fine from the head? You have to be r… https://t.co/jYLLZbYgPC,1
Sun Apr 29 06:27:09 +0000 2018,Some technical analyzes think like my whale  it's funny ... #Ripple #Dash #Monero #ETH #LTC #NEO #EOS #Crypto… https://t.co/pujPRFqQdk,0
