Sun Apr 29 17:57:22 +0000 2018,Don't you find it odd that this so called "experts" call #Bcash &amp; #Litecoin a game changer for fast cheap transacti… https://t.co/sL6WKhsFru,91
Sun Apr 29 17:45:59 +0000 2018,Don't you find it odd that this so called "experts" call #Bcash &amp; #Litecoin a game changer for fast cheap transacti… https://t.co/sL6WKhsFru,91
Sun Apr 29 16:47:07 +0000 2018,#Litecoin Payments are Quietly Starting to Catch On https://t.co/rlPu0B4QSN,0
Sun Apr 29 16:19:54 +0000 2018,Interview: Ben Semchee and Jsnip4  March 7  2018 #Litecoin #Coinbase #DigitalCurrencyGroup #ExchangeUnion #nasdaq… https://t.co/28JAu2LQM7,0
Sun Apr 29 15:43:34 +0000 2018,"Grab it with every hand you have and every one you can get a hold of." $ltc #litecoin https://t.co/E3XAyQjFYL https://t.co/r1iJWRnHNg,0
Sun Apr 29 14:45:36 +0000 2018,EMA and CCI\u2026 $LTCUSD https://t.co/QSEKaIOtyr,0
Sun Apr 29 14:42:54 +0000 2018,Next Possible Litecoin Bu\u2026 $LTCUSD https://t.co/PVkd0692R0,1
Sun Apr 29 14:34:48 +0000 2018,Next Possible Litecoin Bu\u2026 $LTCUSD https://t.co/PVkd0692R0,1
Sun Apr 29 13:58:43 +0000 2018,Торговый план: LTCUSD (Litecoin)  $LTCUSD https://t.co/tEZEJ281E7,1
Sun Apr 29 13:48:13 +0000 2018,Торговый план: LTCUSD (Litecoin)  $LTCUSD https://t.co/tEZEJ281E7,1
Sun Apr 29 13:45:50 +0000 2018,Today's Trading Plan: LTCUSD (Litecoin) $LTCUSD https://t.co/GhPRlZBcG9,0
Sun Apr 29 11:44:48 +0000 2018,Charlie Lee on Selling His Litecoin: ‘It Just Feels Like It’s Not the Right Decision’ - https://t.co/abODGa9fyO https://t.co/urLYpi5Wrs,0
Sun Apr 29 09:46:37 +0000 2018,Charlie Lee: ‘To make Litecoin More Decentralized  Eventually I Would Step Away’ https://t.co/23bRvL2OT8 https://t.co/ZPQkaIWmYK,0
Sun Apr 29 08:08:31 +0000 2018,Litecoin (LTCBTC) $LTCBTC https://t.co/baea60zzSy,0
Sun Apr 29 08:07:56 +0000 2018,No stops for litecoin :C\u2026 $LTCETH https://t.co/61NJVslpgN,0
Sun Apr 29 06:14:22 +0000 2018,Don't you find it odd that this so called "experts" call #Bcash &amp; #Litecoin a game changer for fast cheap transacti… https://t.co/sL6WKhsFru,91
Sun Apr 29 06:06:26 +0000 2018,Don't you find it odd that this so called "experts" call #Bcash &amp; #Litecoin a game changer for fast cheap transacti… https://t.co/sL6WKhsFru,91
Sun Apr 29 06:05:24 +0000 2018,Don't you find it odd that this so called "experts" call #Bcash &amp; #Litecoin a game changer for fast cheap transacti… https://t.co/sL6WKhsFru,91
Sun Apr 29 06:02:21 +0000 2018,The Bermuda Triang\u2026 $LTCUSD https://t.co/ez5wTgNIwH,0
Sun Apr 29 00:41:10 +0000 2018,I liked a @YouTube video https://t.co/YR3Kdcqp5e CRYPTO: BITCOIN &amp; ALTCOIN PRICE PREDICTION! CRYPTOCURRENCY LITECOIN ETHEREUM XRP,0
