Mon Jun 04 23:36:29 +0000 2018,Multiple sources confirm that $xrp is the next coin to be listed in coinbase. #paradex,0
Mon Jun 04 23:10:05 +0000 2018,Cryptocurrency Exchange Giant Coinbase is Officially Launching in Japan  https://t.co/vLaUMcX7HJ,0
Mon Jun 04 22:30:28 +0000 2018,Coinbase Unveils Plans to Enter the Japanese Market  https://t.co/JqatyFmFNr,0
Mon Jun 04 21:05:08 +0000 2018,Coinbase Co-Founder Fred Ehrsam Teams up with Sequoia Partner for New Crypto Fund  https://t.co/XZ0ir7XE9u,0
Mon Jun 04 20:15:04 +0000 2018,Crypto Startup Coinbase Names CEO for Japanese Subsidiary  https://t.co/nck7mdbzkO,0
Mon Jun 04 19:40:13 +0000 2018,Coinbase Announces Japanese Expansion Plans  https://t.co/bazHhdT7Ax,0
Mon Jun 04 18:20:11 +0000 2018,Kon’nichiwa! Coinbase Setting Up New Office in Japan  https://t.co/VprxCchMRx,0
Mon Jun 04 14:55:10 +0000 2018,Leading US Crypto Exchange Coinbase to Expand to Japanese Market  https://t.co/rIGVSSNrgA,0
Mon Jun 04 08:27:56 +0000 2018,Resolve Transactional Status Errors on Coinbase Account Call +1-800-509-3075 #coinbasehelplinenumber… https://t.co/jlP3c3ZIFr,0
Mon Jun 04 06:36:18 +0000 2018,@ThinkingCrypto1 @yoshitaka_kitao @Ripple @Hodor7777 @AlexCobb_ @MichaelSuppo @ModernInvest No #coinbase  #xrp #ripple,0
Mon Jun 04 05:08:26 +0000 2018,Coinbase maintenance tomorrow night. Could this be the #Tron addition @justinsuntron was mentioning earlier? We sha… https://t.co/rRgmPlBr1G,2
