Wed Jul 25 22:15:00 +0000 2018,Thank you @Ripple for being a part of our efforts at the 2018 #SVEdSummit on Aug 17!,0
Wed Jul 25 14:02:01 +0000 2018,Ripple $XRP price: $0.455885   Binance registration is ONLINE! We JUST checked! 😊 🙌    ➡️ https://t.co/1MGT8sIMN8… https://t.co/RyJ7OKxk0l,0
Wed Jul 25 05:43:11 +0000 2018,non-gfgc people suddenly starting to say speep is probably one of my favorite ripple effects of my family.  so powerful  absolute legends,0
Wed Jul 25 02:44:38 +0000 2018,XRP Technical Analysis: XRP Price is “Bitcoin Proof” Says Wirex CEO   #Bitcoin #Ripple #Litecoin  https://t.co/fUmZks8z4Z,1
Wed Jul 25 02:35:36 +0000 2018,XRP Technical Analysis: XRP Price is “Bitcoin Proof” Says Wirex CEO   #Bitcoin #Ripple #Litecoin  https://t.co/fUmZks8z4Z,1
Wed Jul 25 01:51:08 +0000 2018,@mdudas @bgarlinghouse @Ripple Why do you think the coin’s purpose is a scam? Honest question here,0
