Tue Jul 17 22:13:27 +0000 2018,The company behind a Kodak-branded crypto-currency mining rig  which was shown to the press at CES and seen as a sc… https://t.co/jCHCqGO9Ry,1
Tue Jul 17 22:12:42 +0000 2018,The company behind a Kodak-branded crypto-currency mining rig  which was shown to the press at CES and seen as a sc… https://t.co/jCHCqGO9Ry,1
Tue Jul 17 17:24:02 +0000 2018,@TobaccoToken @coinology101 @notsofast Coming from someone whos worked with several ICOs  you can create websites a… https://t.co/fu2IPOrSkw,0
Tue Jul 17 16:57:17 +0000 2018,Just realized that the first company I worked at  ICO (Innovative Computer) might be the reason all these Crypto Br… https://t.co/XCvJPsFdmo,0
Tue Jul 17 15:44:52 +0000 2018,Cryptocurrency Made Easy.  https://t.co/P5aDXd5x8R #crypto #cryptocurrency #blockchain #ico #preico #tokens… https://t.co/xpwRqDGzO1,66
Tue Jul 17 14:33:50 +0000 2018,Attention only 1 day to buy takens with 40% discount  https://t.co/LNR4NSGdSI https://t.co/mRR2m2g73o,1145
Tue Jul 17 11:45:32 +0000 2018,Really revolutionary project. After reading it  you can see a great idea  a professional team of developers. I am s… https://t.co/1QU5CkE2td,0
Tue Jul 17 05:47:48 +0000 2018,암호화폐에 투기질하는 개돼지들의 수준이다.   https://t.co/Jnp8ZiPYnt,0
