Sat Apr 28 22:55:26 +0000 2018,Very proud of my colleague and IRL friend @ScalpelMomma on her presentation @societyofBAS #SBAS2018 .   Sorry to ha… https://t.co/63PSjqaiQh,0
Sat Apr 28 19:34:33 +0000 2018,Is this group stellar? No. But can’t say Ozzie didn’t try to completely overhaul the receivers this offseason. At l… https://t.co/BL8vZzbBKk,0
Sat Apr 28 16:20:44 +0000 2018,"Bitcoin  Ethereum  Bitcoin Cash  Ripple  Stellar  Litecoin  Cardano  IOTA  EOS: Price Analysis  April 28"… https://t.co/uYzuJOcXdy,0
Sat Apr 28 15:43:31 +0000 2018,@thatgirlNita Aahhh yay I’m so happy you’re still coming!! 💖 I’ve got your book! sad to miss the girls though! hope… https://t.co/jH9ZSdfWZj,0
Sat Apr 28 13:05:02 +0000 2018,Winding down stellar career  Kocher leads Terps into Big Ten golf championships at BCC https://t.co/uryAUYjEdO https://t.co/Qg2foBEJjL,2
Sat Apr 28 13:04:43 +0000 2018,Winding down stellar career  Kocher leads Terps into Big Ten golf championships at BCC https://t.co/uryAUYjEdO https://t.co/Qg2foBEJjL,2
Sat Apr 28 12:01:17 +0000 2018,We all knew that anyway.  Keep up the stellar work @realDonaldTrump   #MAGA https://t.co/2eeQDM6o0U,2
Sat Apr 28 04:47:06 +0000 2018,Join me in the Dissidia player's prayer:  "Please don't be Stellar Fulcrum or Alexandria.",0
