Fri Sep 14 21:00:18 +0000 2018,BVS: stellar diving Stern save keeps it 0-1 at the half vs. @BoysLatinSchool. #StriveOn #PositiveExpectations,0
Fri Sep 14 20:15:10 +0000 2018,Proud of our stellar resident @Jalbouta  Learning About evidence based practice at Oxford! https://t.co/tlb3h1e5yB,0
Fri Sep 14 18:26:12 +0000 2018,The editing is also stellar. There’s some super creative and mind boggling stuff. There’s an amazing scene where tw… https://t.co/WwneiUADIJ,0
Fri Sep 14 17:11:49 +0000 2018,Listen out for me today at 11amPT as guest on @Praise98FM's "Lady @CharmaineLive Show" for my "The Pulse of Enterta… https://t.co/ob78WveSCc,0
Fri Sep 14 15:35:10 +0000 2018,Listen out for me today at 11amPT as guest on @Praise98FM's "Lady @CharmaineLive Show" for my "The Pulse of Enterta… https://t.co/WYF7YfpdoB,0
Fri Sep 14 12:39:54 +0000 2018,Stars have relentless stellar winds  which spread dust and metals across the universe. Sometimes  when stars plow t… https://t.co/NA719CySgx,9
Fri Sep 14 12:16:05 +0000 2018,Stars have relentless stellar winds  which spread dust and metals across the universe. Sometimes  when stars plow t… https://t.co/NA719CySgx,9
Fri Sep 14 09:00:16 +0000 2018,Stars have relentless stellar winds  which spread dust and metals across the universe. Sometimes  when stars plow t… https://t.co/NA719CySgx,9
Fri Sep 14 04:52:01 +0000 2018,Listen out for me tomorrow  Friday   at 11amPT as guest on @Praise98FM's "Lady @CharmaineLive Show" for my "The Pul… https://t.co/clNZaaTDW6,1
Fri Sep 14 01:12:52 +0000 2018,Stars have relentless stellar winds  which spread dust and metals across the universe. Sometimes  when stars plow t… https://t.co/NA719CySgx,9
Fri Sep 14 00:16:46 +0000 2018,tropical depression paul sound like one of them indie band portland niggas https://t.co/gbXF29OWdT,31
