Thu Feb 15 22:11:51 +0000 2018,Indeed  although Andrew Breitbart's legacy wasn't too stellar before Bannon and Mercer  tbh. https://t.co/F4MORrhEVT,0
Thu Feb 15 21:41:30 +0000 2018,I can’t say enough how much @morganapple ‘s stellar first book  Other People’s Comfort Keeps Me Up at Night  help f… https://t.co/3UphR1kSwu,1
Thu Feb 15 20:46:47 +0000 2018,Join #AlexandersTavern for another awesomely FUNNY &amp; free #Comedy Night on Feb. 24th. This stellar line up features… https://t.co/MLYGSdHmm3,3
Thu Feb 15 20:32:12 +0000 2018,Join #AlexandersTavern for another awesomely FUNNY &amp; free #Comedy Night on Feb. 24th. This stellar line up features… https://t.co/MLYGSdHmm3,3
Thu Feb 15 20:00:47 +0000 2018,Join #AlexandersTavern for another awesomely FUNNY &amp; free #Comedy Night on Feb. 24th. This stellar line up features… https://t.co/MLYGSdHmm3,3
Thu Feb 15 19:59:02 +0000 2018,Join #AlexandersTavern for another awesomely FUNNY &amp; free #Comedy Night on Feb. 24th. This stellar line up features… https://t.co/MLYGSdHmm3,3
Thu Feb 15 18:14:52 +0000 2018,Listen out for me tomorrow  Friday  at 11amPT as guest on @Praise98FM's "Lady Charmaine Live" Show (@Charmainelive)… https://t.co/zyluudJno7,0
Thu Feb 15 17:56:05 +0000 2018,Essential Phone Arrives in Three New Limited Colors: Ocean Depths  Stellar Gray  and Copper Black https://t.co/9RN4jvlINN,0
Thu Feb 15 06:08:06 +0000 2018,alright you caught me. i joined the urban gaming club because in my heart of hearts I know I'd make a fucking stellar Jigsaw,1
Thu Feb 15 04:03:24 +0000 2018,alright you caught me. i joined the urban gaming club because in my heart of hearts I know I'd make a fucking stellar Jigsaw,1
Thu Feb 15 02:37:14 +0000 2018,Just noticed The Homer Fund only has 252 followers?? Let’s get this to 10 000 or more. Please retweet and FOLLOW. S… https://t.co/YzipJ6V1Xa,202
