Fri Jul 13 19:25:40 +0000 2018,Issias Afeworki’s visit will be a real test for Abiy Ahmed’s statesmanship  whether he is capable to make stern neg… https://t.co/fqJ6rVlLeb,2
Fri Jul 13 18:32:58 +0000 2018,Issias Afeworki’s visit will be a real test for Abiy Ahmed’s statesmanship  whether he is capable to make stern neg… https://t.co/fqJ6rVlLeb,2
Fri Jul 13 16:36:34 +0000 2018,This gives the Right a new chance to vigorously condemn a hostile foreign power attacking us. It lays the ground wo… https://t.co/67IKJ8jCdL,0
Fri Jul 13 15:55:20 +0000 2018,Watch for my interviewed with 3x Stellar nominated organist PJ Morgan (BET Honors  Yolanda Adams) about his new sol… https://t.co/VKSh2NfFh0,2
Fri Jul 13 15:29:47 +0000 2018,Watch for my interviewed with 3x Stellar nominated organist PJ Morgan (BET Honors  Yolanda Adams) about his new sol… https://t.co/VKSh2NfFh0,2
Fri Jul 13 14:56:35 +0000 2018,@ericalayser Ticketmaster was $60 after fees. It's the last one and a stellar lineup,0
Fri Jul 13 14:37:07 +0000 2018,@criscyborg @sirloin16 @terrybizzell @Amanda_Leoa @DrinkBODYARMOR The fans want to see this stellar match up. Shoul… https://t.co/2hMZ5Cmdx6,0
Fri Jul 13 02:48:05 +0000 2018,Watch for my interviewed with 3x Stellar nominated organist PJ Morgan (BET Honors  Yolanda Adams) about his new sol… https://t.co/VKSh2NfFh0,2
Fri Jul 13 00:31:01 +0000 2018,'Thank You' @TheGarden for booking this event...  We look forward to making history at The World’s Most Famous Aren… https://t.co/M2bUepJSS6,1093
