Wed Apr 11 23:49:30 +0000 2018,We Will Never Unite Moors  Hebrews  RBG. $100 Investment With 250K Gain https://t.co/1nzrSUCmk5 https://t.co/gPfQ3AsiQO,0
Wed Apr 11 23:04:07 +0000 2018,Exquisite Restoration Showcases $2M Newport Mansion in Vintage Glory | Take a Look 》https://t.co/VCgLDaBBg8… https://t.co/FGD8pU5Ywj,0
Wed Apr 11 22:40:52 +0000 2018,Proud to announce the opening of #TelemundoCenter  the new home of @Telemundo. It’s a reflection of our commitment… https://t.co/n9JI2VIFuP,75
Wed Apr 11 22:33:00 +0000 2018,Palm Beach County is competing with Georgia for 215 jobs and a $100.4 million investment from an aerospace firm https://t.co/6kcLUlGkZi,1
Wed Apr 11 22:21:14 +0000 2018,Facebook ads can prove tricky. In order to boost the final return on investment  companies need to take into consid… https://t.co/GRErgbofkD,0
Wed Apr 11 22:04:28 +0000 2018,$AUAU.V $AUXXF An attractive investment for exploration success  with a quality exploration team working in a low p… https://t.co/80R2ujaZ0v,0
Wed Apr 11 21:55:09 +0000 2018,Go deep into the investors mind to really understand how they analyze startups for #investment.   RSVP for our inve… https://t.co/IJ6mhi7Fsn,0
Wed Apr 11 21:30:56 +0000 2018,Review a summary of our April issue of Investment Strategy Quarterly: https://t.co/iqtK3qO7eR . https://t.co/qbGRBUP1F8,0
Wed Apr 11 21:19:47 +0000 2018,It inspires us to see this level of investment in Miami's working artists. A big boost for Miami artists… https://t.co/IFQd07zyqn,0
Wed Apr 11 20:30:40 +0000 2018,Life is working every second of the day for you  it is worth it with the highest return on investment #leadership… https://t.co/n8mRlog37P,0
Wed Apr 11 20:24:32 +0000 2018," “Okan Tower” was conceived as an architectural expression associated with the Client’s country of origin  Turkey … https://t.co/wieuwnm6I4,0
Wed Apr 11 19:46:21 +0000 2018,Telemundo Center is the new global headquarters for the Spanish-language TV giant. Located at Northwest 117th Place… https://t.co/0gRrMw3nj3,0
Wed Apr 11 19:10:13 +0000 2018,4 Benefits of Owning an Offshore Company https://t.co/Y5zZSeyTMk @kravitzlaw - Dedicated to our Clients… https://t.co/iEXzwWjgqS,0
Wed Apr 11 19:01:56 +0000 2018,Proud to announce the opening of #TelemundoCenter  the new home of @Telemundo. It’s a reflection of our commitment… https://t.co/n9JI2VIFuP,75
Wed Apr 11 19:01:12 +0000 2018,This is the one that you all look forward to! Take your real estate investing to the next level this summer with th… https://t.co/TZYL5zZLjp,0
Wed Apr 11 18:55:37 +0000 2018,Bankorus caters to cryptocurrency millionaires with an AI-based investment platform #entrepreneur https://t.co/iloj7xqajA,3
Wed Apr 11 18:52:17 +0000 2018,#jobs4u #jobs Managing Director Of Investment Banking Own A Franchise https://t.co/Y0ZlqB5BjW #MIA #miami #FL,0
Wed Apr 11 18:38:18 +0000 2018,Bitcoinvest The Bitcoin Investment Experts - Made in Germany https://t.co/0Q8EM6b1aI  -     retweet     -… https://t.co/4gIMlvivpE,0
Wed Apr 11 18:35:29 +0000 2018,Bankorus caters to cryptocurrency millionaires with an AI-based investment platform #entrepreneur https://t.co/iloj7xqajA,3
Wed Apr 11 18:33:20 +0000 2018,All these ultra luxury towers offer exceptional service  state of the art amenities and a solid investment.  This i… https://t.co/vEz8fXmwmT,0
Wed Apr 11 18:01:11 +0000 2018,Bankorus caters to cryptocurrency millionaires with an AI-based investment platform #entrepreneur https://t.co/iloj7xqajA,3
Wed Apr 11 17:38:13 +0000 2018,Visionary or just protecting his investment?  https://t.co/3HkDpFeCCC,0
Wed Apr 11 16:19:55 +0000 2018,There are hundreds of Exchange Traded Funds available. Should you invest in them? #ETFs https://t.co/5G7H5aEpb3,0
Wed Apr 11 15:48:39 +0000 2018,That sweet cinnamon smell isn’t fresh snickerdoodles; It’s this calming #DIY air freshener! - Great tip from… https://t.co/GFZWkztcUf,0
Wed Apr 11 15:37:58 +0000 2018,There are tons of investment opportunities as Miami keeps on evolving and developing. We only go up from here! We s… https://t.co/REG0Tx4Ssx,0
Wed Apr 11 15:32:47 +0000 2018,Florida's population  economy are growing! More than 430 000 people moved to the Sunshine State in just one year  a… https://t.co/j3oZBC5TG6,2
Wed Apr 11 15:13:31 +0000 2018,Proud to announce the opening of #TelemundoCenter  the new home of @Telemundo. It’s a reflection of our commitment… https://t.co/n9JI2VIFuP,75
Wed Apr 11 15:02:19 +0000 2018,2012 WTO ruled that China was discriminating against foreign payment card companies  no U.S. firm has yet been gran… https://t.co/yk8vjyeCLD,0
Wed Apr 11 14:58:53 +0000 2018,Canada Pension Plan Investment acquires NEP-Und Can Optng W&amp;S Port(6) for US$1264M - https://t.co/KdgniP2n0N #GoogleAlerts,0
Wed Apr 11 14:53:55 +0000 2018,Follow our forecast step by step for the whole week  where your investment grows in an assured manner @Btchapo… https://t.co/XnqS9HfOhn,0
Wed Apr 11 14:37:52 +0000 2018,Follow our forecast step by step for the whole week  where your investment grows in an assured manner… https://t.co/eepF6XP6bP,0
Wed Apr 11 14:30:27 +0000 2018,Buying a home can seem intimidating . So many requirements for such a big investment. However  there’s no need to f… https://t.co/xPnZ4Zpk4q,0
Wed Apr 11 14:18:11 +0000 2018,Even if you don't care about historical preservation or afterschool art programs or museums or holocaust memorials … https://t.co/k6oMqASKQ1,9
Wed Apr 11 14:09:36 +0000 2018,@SpeakerBoehner @AcreageCannabis Haha! @SpeakerBoehner you really think that we that stupid huh? Where’s the pot in… https://t.co/wP6tKGdhM0,0
Wed Apr 11 13:59:23 +0000 2018,@Canadiangunner @Gunner what does that mean for BLOK? I assume if they sell even just at market WITH their 66% bonu… https://t.co/2RlIFIYhvb,0
Wed Apr 11 13:57:31 +0000 2018,@Canadiangunner LOL  @gunner you're trolling now man. Why is it material for BLOK? A $750k investment into one of t… https://t.co/uNcQNXFYJ2,0
Wed Apr 11 13:36:06 +0000 2018,@rsm @FixMetroMDT @theunderlinemia For working class folks who can't afford Brickell  decent trains are vital. Trai… https://t.co/AyxEyrzpmg,2
Wed Apr 11 13:35:05 +0000 2018,@rsm @FixMetroMDT @theunderlinemia For working class folks who can't afford Brickell  decent trains are vital. Trai… https://t.co/AyxEyrzpmg,2
Wed Apr 11 13:21:36 +0000 2018,Even if you don't care about historical preservation or afterschool art programs or museums or holocaust memorials … https://t.co/k6oMqASKQ1,9
Wed Apr 11 13:05:30 +0000 2018,BA3 Capital offers exclusive investment opportunities for discerning clients that open the doors to superior return… https://t.co/Fd672QNIML,0
Wed Apr 11 13:00:01 +0000 2018,Do you want to see how your investment grows? accept my advice and you will see how your investment grows every wee… https://t.co/523rwFKw7G,0
Wed Apr 11 12:32:17 +0000 2018,Bitcoinvest The Bitcoin Investment Experts - Made in Germany https://t.co/0Q8EM6b1aI  -     retweet     -… https://t.co/EFo2U5Ajvk,0
Wed Apr 11 12:05:25 +0000 2018,Wise investment?  Or a bubble about to burst? https://t.co/trXZsDTU89,0
Wed Apr 11 11:39:52 +0000 2018,Watch this short video from #T32018 to learn how @Fidelity Institutional is adding new tech to WealthscapeSM  its a… https://t.co/VTYhKbCy6p,1
Wed Apr 11 11:27:25 +0000 2018,There are certain standards and controls of contributing on every one of  the wares while you are doing effective w… https://t.co/BXBsheTNKy,0
Wed Apr 11 11:24:47 +0000 2018,machtcoin lending! small investment  big profits#MachtCoin #MCH #cryptocurrency #taskhttps://register.machtcoin.co/reffnode/rick,0
Wed Apr 11 11:10:06 +0000 2018,3 Ways #BigData Can Influence Decision-Making for Organizations  👉Real-time Data to Improve Customer Engagement &amp; R… https://t.co/i5zKeCVa70,1
Wed Apr 11 11:01:07 +0000 2018,Unfiltered and Unbiased. WE Family Offices Daily Investment Commentary https://t.co/Sjcm5saE9S,0
Wed Apr 11 10:29:09 +0000 2018,Rosberg reveals Formula E investment  will drive the series' new car:  https://t.co/kNXx1gpNb8,14
Wed Apr 11 10:17:08 +0000 2018,On-demand laundry cleaning startup Zipjet secures 7-figure investment from Henkel Ventures and BSH https://t.co/mwpKnflTvq #funding,0
Wed Apr 11 10:16:17 +0000 2018,On-demand laundry cleaning startup Zipjet secures 7-figure investment from Henkel Ventures and BSH https://t.co/mwpKnflTvq #startups,0
Wed Apr 11 09:30:36 +0000 2018,Simple Financial Advisor Tips for your Next Investment  https://t.co/Uv3Cw17H0v,0
Wed Apr 11 08:53:49 +0000 2018,China pledges to allow more foreign investment in financial sector by year-end - https://t.co/16YjBufayd,0
Wed Apr 11 08:44:13 +0000 2018,Relativity Space Steps Closer to 3D Printing Complete Rocket with ...: - Relativity Space… https://t.co/taaZnryY0c,0
Wed Apr 11 07:22:17 +0000 2018,Insurance giant Allianz confirms $35M investment in Asian ride-sharing unicorn Go-Jek https://t.co/LnJN6LNcZY Let´s… https://t.co/FTxL93oVIw,0
Wed Apr 11 07:08:18 +0000 2018,Bitcoinvest The Bitcoin Investment Experts - Made in Germany https://t.co/0Q8EM6b1aI  -     retweet     -… https://t.co/dbqHNKso4v,0
Wed Apr 11 07:04:07 +0000 2018,Chinese investment in the United States dropped 36% last year. And that was before a trade fight erupted between th… https://t.co/rJrZAhebAJ,0
Wed Apr 11 06:57:14 +0000 2018,"Online Retailer ASOS Ups Investment as Sales Grow 27 Percent" by REUTERS via NYT https://t.co/WhcN1yRJ7H,0
Wed Apr 11 05:07:52 +0000 2018,Proud to announce the opening of #TelemundoCenter  the new home of @Telemundo. It’s a reflection of our commitment… https://t.co/n9JI2VIFuP,75
Wed Apr 11 02:58:50 +0000 2018,US #stocks holding trend. #Tech stocks maintaining their leadership position. #Zuckerberg testimony is lifting the… https://t.co/5WiwxKEJHP,2
Wed Apr 11 02:06:59 +0000 2018,US #stocks holding trend. #Tech stocks maintaining their leadership position. #Zuckerberg testimony is lifting the… https://t.co/5WiwxKEJHP,2
Wed Apr 11 01:29:04 +0000 2018,investment https://t.co/S12h3zGDAF,0
Wed Apr 11 01:16:02 +0000 2018,CBS has announced an upcoming increase in its investment in original series  in order to boost the number of subscr… https://t.co/wTpOwZzEjN,0
Wed Apr 11 01:06:18 +0000 2018,Bitcoinvest The Bitcoin Investment Experts - Made in Germany https://t.co/0Q8EM6b1aI  -     retweet     -… https://t.co/7u2uxIFGnl,0
Wed Apr 11 00:34:50 +0000 2018,@kurosixx You see it in single-player stuff if there's a skill ceiling to it. So Dark Souls  Monster Hunter- things… https://t.co/tRjbMU5K49,0
