Tue Jun 19 23:50:49 +0000 2018,@derose @TokenHash Isn’t a social contract as old as humanity? “I won’t kill you if you don’t kill me”. My investme… https://t.co/OselTaV3QA,0
Tue Jun 19 23:45:36 +0000 2018,@scottspiegel12 @TokenHash I mean  I like that we can change Bitcoin's construction in response to need. If your in… https://t.co/rdzHRz9WhW,0
Tue Jun 19 22:40:31 +0000 2018,Knight Frank Newcastle completes £9.25m industrial investment deals https://t.co/92kEhvEpNG #industrial,0
Tue Jun 19 22:20:42 +0000 2018,We’re grabbing the attention of global brands and diverse investment from all over the world. #FutureCity… https://t.co/a5HWEoqFcY,5
Tue Jun 19 22:10:13 +0000 2018,“Four years and a Brazilian investment of more than one billion dollars later  the zone that promised to turn Cuba… https://t.co/sRiQBDcvTV,7
Tue Jun 19 21:46:00 +0000 2018,With uphold  hold funds in the currency of your choice  for a long term investment  safe keeping or everyday use.   #p2p #decentralization,0
Tue Jun 19 21:30:00 +0000 2018,Wells Fargo Investment Institute provides key highlights from the #FederalReserve meeting:  https://t.co/id1y74BemV,0
Tue Jun 19 21:00:09 +0000 2018,US and Canada regulators launch 'Operation Crypto-Sweep' to police #cryptocurrency investment schemes. https://t.co/gIYp0y5182,0
Tue Jun 19 20:57:22 +0000 2018,We're #hiring! Click to apply: WM Senior Investment Strategist (LO) 4 - https://t.co/lVnstJx8MS #InvestmentBanking… https://t.co/WPJIeQQVhu,0
Tue Jun 19 20:54:09 +0000 2018,9 things that lose their value as soon as you buy them https://t.co/rEBp9JsV2N #investing,1
Tue Jun 19 20:48:03 +0000 2018,La Universidad Torcuato Di Tella obtiene el @CFAinstitute Investment Foundations Academic Program @UTDiTella… https://t.co/TM8keffyMB,3
Tue Jun 19 20:43:34 +0000 2018,9 things that lose their value as soon as you buy them https://t.co/rEBp9JsV2N #investing,1
Tue Jun 19 20:43:03 +0000 2018,Investors still have a risk seeking bias with outperformance from $IPO and $IWM. Cyclical sectors like $XLY also ou… https://t.co/MfOsfRyZbA,0
Tue Jun 19 20:35:53 +0000 2018,La Universidad Torcuato Di Tella obtiene el @CFAinstitute Investment Foundations Academic Program @UTDiTella… https://t.co/TM8keffyMB,3
Tue Jun 19 20:34:35 +0000 2018,La Universidad Torcuato Di Tella obtiene el @CFAinstitute Investment Foundations Academic Program @UTDiTella… https://t.co/TM8keffyMB,3
Tue Jun 19 20:31:00 +0000 2018,La Universidad Torcuato Di Tella obtiene el @CFAinstitute Investment Foundations Academic Program @UTDiTella… https://t.co/TM8keffyMB,3
Tue Jun 19 20:02:40 +0000 2018,Investment properties in South Florida are HOT! Be the first to get the inside scoop on off market deals. Click the… https://t.co/BkMCUXwCcf,0
Tue Jun 19 19:51:40 +0000 2018,Real Estate Co-Investment Partnership Clubs For Family Offices – Forbes https://t.co/wgw7rkoPsx,0
Tue Jun 19 19:26:48 +0000 2018,@olgaNYC1211 Excellent investment by Putin  perhaps the best purchase of all time,0
Tue Jun 19 19:20:12 +0000 2018,Chicks with new booties refuse to sit down....that investment real AF...she gonna walk around 🤣😂🤣,0
Tue Jun 19 19:12:33 +0000 2018,It’s so easy for Mfs to quit cuz they ain’t invested in shit wen you’ve made a significant investment u stay consis… https://t.co/0xLmmvkJ7K,1
Tue Jun 19 19:12:21 +0000 2018,It’s so easy for Mfs to quit cuz they ain’t invested in shit wen you’ve made a significant investment u stay consis… https://t.co/0xLmmvkJ7K,1
Tue Jun 19 19:09:16 +0000 2018,Made a 💰 off of a $3 Facebook investment. Work smarter not harder.,0
Tue Jun 19 18:30:01 +0000 2018,Don’t worry people  the immigration process isn’t TOTALLY opaque  convoluted  and exclusive. For just the small pri… https://t.co/mFh9zpCKHF,12
Tue Jun 19 18:28:35 +0000 2018,HHS Takes First Step to Spur Health IT Innovation  Investment https://t.co/syA2iVsrxU https://t.co/DoKGli7vFR,0
Tue Jun 19 18:08:46 +0000 2018,So  yes  I do like milk  and if I can make money with a milk-related investment  that's a nice bonus https://t.co/XPNooSYcYr,1
Tue Jun 19 17:51:50 +0000 2018,Customer Experience Investment - It's not Just Bricks and Mortar https://t.co/N3JrPkE8uY https://t.co/MyqxSeCxvU,0
Tue Jun 19 17:27:13 +0000 2018,Want to see if the promoter or offeror of your exciting token sale/investment opportunity has been named as a defen… https://t.co/M3YjknpD4W,16
Tue Jun 19 17:23:28 +0000 2018,Investment property #UnderContract https://t.co/WAECYXisIN,0
Tue Jun 19 16:50:09 +0000 2018,The entire system is sustainably solar powered  where after a couple years the solar panels pay off the cost of inv… https://t.co/Omnl5JJz4v,0
Tue Jun 19 16:46:44 +0000 2018,@CoolStoryWill Lmfao what?!!!!!!!! that’s a whole investment,0
Tue Jun 19 16:45:57 +0000 2018,Don’t worry people  the immigration process isn’t TOTALLY opaque  convoluted  and exclusive. For just the small pri… https://t.co/mFh9zpCKHF,12
Tue Jun 19 16:30:42 +0000 2018,Your home is your biggest investment  so don’t you want to keep it protected? Avoid these #insurance mistakes:… https://t.co/A9WOLDVwdD,0
Tue Jun 19 16:23:31 +0000 2018,Types of Tax Lien Properties Investment  https://t.co/0Tgpyu3zeA #taxliens #Taxlieninvesting https://t.co/rLQ6c1WASs,0
Tue Jun 19 16:17:38 +0000 2018,⁦@Apple⁩ has been great for #Cork employment and #Ireland economy. Thank you for the investment in our country!… https://t.co/KoEBhraVJs,0
Tue Jun 19 15:52:51 +0000 2018,Don’t worry people  the immigration process isn’t TOTALLY opaque  convoluted  and exclusive. For just the small pri… https://t.co/mFh9zpCKHF,12
Tue Jun 19 15:45:00 +0000 2018,A new #investment plan for a new #retirement  https://t.co/3HFSg7Ionb,0
Tue Jun 19 15:43:20 +0000 2018,Why Getting a Tax Accountant Before Investing in Real Estate is Important https://t.co/bmiMa9SHZ7 #realestate … https://t.co/kCxgxC6fxA,0
Tue Jun 19 15:38:56 +0000 2018,Don’t worry people  the immigration process isn’t TOTALLY opaque  convoluted  and exclusive. For just the small pri… https://t.co/mFh9zpCKHF,12
Tue Jun 19 15:33:40 +0000 2018,Don’t worry people  the immigration process isn’t TOTALLY opaque  convoluted  and exclusive. For just the small pri… https://t.co/mFh9zpCKHF,12
Tue Jun 19 15:27:40 +0000 2018,@lakelandgov Mayor Bill Mutz discusses the need for an investment in human capital during an Open House hosted by C… https://t.co/AvkFpp1kYA,0
Tue Jun 19 15:25:55 +0000 2018,2171 NW 21st Terrace Fort Lauderdale  FL 33311  USAhttps://www.miamiwholesalehomes.net/property/2171-nw-21st-terrac… https://t.co/eCAgHoaCbU,0
Tue Jun 19 15:21:27 +0000 2018,Are you ready to buy or sell a home? If you want someone you can trust with the buying  selling  renting  and inves… https://t.co/dkLUohOQdN,0
Tue Jun 19 14:56:51 +0000 2018,Don’t worry people  the immigration process isn’t TOTALLY opaque  convoluted  and exclusive. For just the small pri… https://t.co/mFh9zpCKHF,12
Tue Jun 19 14:20:02 +0000 2018,Rise of the machines: @InvestmentWeek predicts #artificialintelligence will replace 45% of portfolio management rol… https://t.co/dHjmYLMmSg,0
Tue Jun 19 14:13:02 +0000 2018,#Science - Space catapult startup gets $40 MILLION investment from Google and Airbus  A ... https://t.co/t4tzLWG1A1 https://t.co/qF3mRwddqA,0
Tue Jun 19 14:09:44 +0000 2018,Check out our most recent newsletter! https://t.co/sK3ZJgtcHI https://t.co/WrVWaplQ5b,0
Tue Jun 19 14:03:26 +0000 2018,Don’t worry people  the immigration process isn’t TOTALLY opaque  convoluted  and exclusive. For just the small pri… https://t.co/mFh9zpCKHF,12
Tue Jun 19 14:01:03 +0000 2018,Raise Your @Genesys Game: Drive Value from Your #IVR and #CX Investment via @Appfoundry Blog https://t.co/GBvUsZ6e9g https://t.co/BZJkmiANiK,0
Tue Jun 19 13:17:04 +0000 2018,3 billionaires from Dubai  a 30-CEO delegation from Qatar  investors from China &amp; India  more than 70 African leade… https://t.co/3z1jcG8ecU,0
Tue Jun 19 13:11:27 +0000 2018,“We continue to attract global investment and drive a diverse community” @FrancisSuarez opens  Invest Miami confere… https://t.co/LjbteRym0F,2
Tue Jun 19 13:06:14 +0000 2018,Don’t worry people  the immigration process isn’t TOTALLY opaque  convoluted  and exclusive. For just the small pri… https://t.co/mFh9zpCKHF,12
Tue Jun 19 12:57:45 +0000 2018,Don’t worry people  the immigration process isn’t TOTALLY opaque  convoluted  and exclusive. For just the small pri… https://t.co/mFh9zpCKHF,12
Tue Jun 19 12:55:20 +0000 2018,“We continue to attract global investment and drive a diverse community” @FrancisSuarez opens  Invest Miami confere… https://t.co/LjbteRym0F,2
Tue Jun 19 12:52:57 +0000 2018,“We continue to attract global investment and drive a diverse community” @FrancisSuarez opens  Invest Miami confere… https://t.co/LjbteRym0F,2
Tue Jun 19 12:48:50 +0000 2018,"We are becoming global in our investment pool and our city is becoming more diverse."  @CityofMiami @FrancisSuarez… https://t.co/jOumJFr5pE,0
Tue Jun 19 12:37:27 +0000 2018,“Four years and a Brazilian investment of more than one billion dollars later  the zone that promised to turn Cuba… https://t.co/sRiQBDcvTV,7
Tue Jun 19 12:37:04 +0000 2018,Don’t worry people  the immigration process isn’t TOTALLY opaque  convoluted  and exclusive. For just the small pri… https://t.co/mFh9zpCKHF,12
Tue Jun 19 12:36:00 +0000 2018,the  Kochs’ conglomerate  is a major producer of gasoline and asphalt  and  also makes seatbelts  tires and other a… https://t.co/K7LlGB6mLN,0
Tue Jun 19 12:35:52 +0000 2018,REIT- Real Estate Investment Trust. This can happen to you! https://t.co/86B5yFtsz6,0
Tue Jun 19 12:33:21 +0000 2018,Don’t worry people  the immigration process isn’t TOTALLY opaque  convoluted  and exclusive. For just the small pri… https://t.co/mFh9zpCKHF,12
Tue Jun 19 12:30:53 +0000 2018,Don’t worry people  the immigration process isn’t TOTALLY opaque  convoluted  and exclusive. For just the small pri… https://t.co/mFh9zpCKHF,12
Tue Jun 19 12:30:21 +0000 2018,Unfiltered and Unbiased. WE Family Offices Daily Investment Commentary https://t.co/mgSgYs2x8y,0
Tue Jun 19 12:14:24 +0000 2018,In a 17-page memo this week  billionaire Howard Marks the co-chairman of investment firm Oaktree Capital Group LLC… https://t.co/WHmGlQH0KI,0
Tue Jun 19 11:11:58 +0000 2018,&amp; it don’t have to be a bunch of money but most actually spend money to make more money .. it’s called investment 😌… https://t.co/rfH2Qjb2xZ,0
Tue Jun 19 09:45:06 +0000 2018,Your goal is to become the best you can be in the real estate investment world. A large part of that is educating y… https://t.co/23CJnk6BUf,0
Tue Jun 19 09:07:25 +0000 2018,The power industry needs to invest $14.5 trillion by 2040 to meet global demand for electricity https://t.co/LGuZNJxNT2 by BIAUS,0
Tue Jun 19 08:43:45 +0000 2018,“Four years and a Brazilian investment of more than one billion dollars later  the zone that promised to turn Cuba… https://t.co/sRiQBDcvTV,7
Tue Jun 19 08:29:59 +0000 2018,🔴 🔴 Multifamily Deal - 7.5% Cape Rate in Broward &amp; $145K duplex in Miami-Dade. Investment opportunity. - https://t.co/q1C33UX3Tf,0
Tue Jun 19 07:47:48 +0000 2018,Unique half acre waterfront lot 2 blocks from the Ocean #realestate #realtor #luxury#investment #design #forsale… https://t.co/1e8NZGnr8V,1
Tue Jun 19 07:31:35 +0000 2018,Building the digital investment bank of the future – Interview with Simona Vaitkune  CEO of Fast Invest https://t.co/2B45WBFNFG #startups,0
Tue Jun 19 07:29:39 +0000 2018,Building the digital investment bank of the future – Interview with Simona Vaitkune  CEO of Fast Invest https://t.co/2B45WBFNFG #investing,0
Tue Jun 19 04:17:52 +0000 2018,Looking for a #zen #relax #travel stay in #tulum #mexico ? Checkout https://t.co/ZpDmCUXtfQ natural reserve residen… https://t.co/jU603S7pOR,5
Tue Jun 19 03:57:07 +0000 2018,Over 50% of the world's population is below the age of 30  and 90% of them live in #EmergingMarkets. @IFC_org and… https://t.co/MCJSLL7tNP,0
Tue Jun 19 02:29:58 +0000 2018,“Four years and a Brazilian investment of more than one billion dollars later  the zone that promised to turn Cuba… https://t.co/sRiQBDcvTV,7
Tue Jun 19 02:29:21 +0000 2018,“Four years and a Brazilian investment of more than one billion dollars later  the zone that promised to turn Cuba… https://t.co/sRiQBDcvTV,7
Tue Jun 19 02:02:03 +0000 2018,Tryna hit 6 figures in this investment account. After that  everything else gon take care of itself.,0
