Fri Apr 13 22:27:56 +0000 2018,Closing day in Virginia! Congratulations sandrab214 on your beautiful investment property… https://t.co/3g9N2wOI4j,0
Fri Apr 13 22:06:00 +0000 2018,Grey adds to its Midwest investment with opening of Cincinnati office https://t.co/c0RhKn1kYd,0
Fri Apr 13 21:57:30 +0000 2018,Community Policing is a long term investment. @MPD_PAL mentors over 800 kids a year. The future of our community is… https://t.co/46xHJVeUBw,9
Fri Apr 13 20:42:43 +0000 2018,@LMartinezBODEGA Yea  and the pay off is greater. Another thing about the timing is investment groups are opening u… https://t.co/6H9oS5wDF1,0
Fri Apr 13 20:13:24 +0000 2018,Bitcoinvest The Bitcoin Investment Experts - Made in Germany https://t.co/0Q8EM6b1aI  -     retweet     -… https://t.co/mu7GDPCdXD,0
Fri Apr 13 19:14:01 +0000 2018,When you invest in me your life gets better. DO YOU KNOW WHO I AM??? #royal #investment… https://t.co/oDuWZPkBMy,0
Fri Apr 13 19:06:44 +0000 2018,“South Florida is a top-tier U.S. industrial real estate market and the stats back it up. South Florida’s populatio… https://t.co/EPOu07i1wb,3
Fri Apr 13 19:00:07 +0000 2018,You can get the most out of your next real estate investment with the help of the new tax law. Check out these tips… https://t.co/bQmTbOHTpA,0
Fri Apr 13 18:59:17 +0000 2018,“South Florida is a top-tier U.S. industrial real estate market and the stats back it up. South Florida’s populatio… https://t.co/EPOu07i1wb,3
Fri Apr 13 18:57:05 +0000 2018,“South Florida is a top-tier U.S. industrial real estate market and the stats back it up. South Florida’s populatio… https://t.co/EPOu07i1wb,3
Fri Apr 13 18:55:00 +0000 2018,“South Florida is a top-tier U.S. industrial real estate market and the stats back it up. South Florida’s populatio… https://t.co/EPOu07i1wb,3
Fri Apr 13 18:40:46 +0000 2018,Looks like nice breakout! Heard they will be in Scottsdale for big investment conference maybe they will get permit… https://t.co/phvFfErOPy,0
Fri Apr 13 18:37:28 +0000 2018,What's the average American's tax rate? https://t.co/YLXWvZ5EM2 @kravitzlaw - Dedicated to our Clients ⚖️ #taxes… https://t.co/H4YrhMHOl7,0
Fri Apr 13 17:55:25 +0000 2018,Until yesterday our forecast had left a gain on investment of 17.25% in predicted Cryptocurrency. I am at your serv… https://t.co/Zba9m1plO1,0
Fri Apr 13 17:50:47 +0000 2018,Until yesterday our forecast had left a gain on investment of 17.25% in predicted Cryptocurrency. I am at your serv… https://t.co/MJOKyNt7Er,0
Fri Apr 13 17:47:50 +0000 2018,Until yesterday our forecast had left a gain on investment of 17.25% in predicted Cryptocurrency. I am at your serv… https://t.co/WttEHo5LBM,0
Fri Apr 13 17:37:45 +0000 2018,HCM City to promote trade  investment in Cuba https://t.co/W8yxReK58j,0
Fri Apr 13 17:21:44 +0000 2018,We are a full service real estate  management  and maintenance firm who specialize in commercial and residential in… https://t.co/VeAxvmWYuD,0
Fri Apr 13 16:57:58 +0000 2018,TGIF! 👷‍♀️👷‍♂️✨✨ . #davilaland #homeinspection #landsurveyors #miamirealestate #engineer #houselogic #HomeOwner… https://t.co/7F3M7hl9us,0
Fri Apr 13 16:08:14 +0000 2018,Alternative Assets Becoming Next Big Thing in Asia Property Investing https://t.co/gI11bmUfav,0
Fri Apr 13 16:08:03 +0000 2018,Buying a House? Here's Some Advice You'll Hear... and Should Totally Ignore | Find Out 》https://t.co/vVXSPL4WqK… https://t.co/DIucroOyYf,0
Fri Apr 13 15:40:00 +0000 2018,Just Listed! Centrally located duplex in Shenandoah.  1910 SW 16 Ave | $499 000 Great investment opportunity! Back… https://t.co/e8ZKIAC7VD,0
Fri Apr 13 15:35:55 +0000 2018,Breakfast with these savvy business guys @WeingartenRlty #RealEstate #investment #networking https://t.co/b8Dgn50rfk,0
Fri Apr 13 15:23:31 +0000 2018,SpaceX is about to raise $507 million in a new funding  according to investment filings https://t.co/RjGl9zHYMr #funding,0
Fri Apr 13 14:42:49 +0000 2018,Markets gave up early morning gains after Big Banks beat earnings estimates. Love the gain  not the investment!!!!,0
Fri Apr 13 14:32:01 +0000 2018,Colorado Big Thompson River project users get boost in water thanks to deep snowpack https://t.co/pwD01fl0sh #investing,0
Fri Apr 13 14:23:56 +0000 2018,E2 students pitching to the Investment Panel at @RoyalCaribbean #Hustle https://t.co/gT2OGHIpOG,0
Fri Apr 13 14:17:00 +0000 2018,Allow me to "find a chic space you will love" for lifestyle  investment  additional residence or… https://t.co/52MSX5lfUk,0
Fri Apr 13 13:48:05 +0000 2018,What is FIRPTA? https://t.co/s0ZrqxG1fJ @Kravitzlaw - Dedicated to our Clients ⚖️ #titlecompany #business… https://t.co/by2WKguShU,0
Fri Apr 13 13:41:39 +0000 2018,@IfollowJesus10 Lmao I know how to invest money who says my car is an investment? I buy nice cars to driveeee them so stick to your Kia 😎,0
Fri Apr 13 13:12:12 +0000 2018,Rising Home Prices Push Borrowers Deeper Into Debt | Read More 》https://t.co/RXIL1CyJCO #RealtyBuzz #realestate… https://t.co/8HV0hJ3jRr,0
Fri Apr 13 13:00:03 +0000 2018,Do you want to see how your investment grows? accept my advice and you will see how your investment grows every wee… https://t.co/bxzl75kCTY,0
Fri Apr 13 12:30:22 +0000 2018,Bitcoinvest The Bitcoin Investment Experts - Made in Germany https://t.co/0Q8EM6b1aI  -     retweet     -… https://t.co/D24nGIM3Y6,0
Fri Apr 13 12:28:50 +0000 2018,#JPMorgan #profit just below forecast on weak #investment #banking https://t.co/ceivI07VxP #news #tigroto,0
Fri Apr 13 12:28:11 +0000 2018,Here are the key points from the memo JPMorgan's investment bank chief just sent to staff https://t.co/TcgAPG0BkD https://t.co/zoqTvqoLyw,0
Fri Apr 13 12:03:06 +0000 2018,Hiring a wedding video editor is the single-most important investment you will make on your wedding day. The goal i… https://t.co/piwjDzuyh3,0
Fri Apr 13 12:01:15 +0000 2018,Unfiltered and Unbiased. WE Family Offices Daily Investment Commentary https://t.co/14n8la196X,0
Fri Apr 13 11:56:17 +0000 2018,Read the weekly investment strategy commentary from Chief Investment Strategist Jeff Saut. https://t.co/GgWpYEsnnZ,0
Fri Apr 13 11:14:06 +0000 2018,@cdmtoken One of the best company  where you invest your money💰. Buy CDM tokens. And also receive dividend on your… https://t.co/py5iHU8Wt3,1
Fri Apr 13 10:02:00 +0000 2018,Gary C.Hampton  investment product specialist en @followMFS:”La correlación entre la #rentavariable y la #deuda… https://t.co/IkPyvxUMyC,0
Fri Apr 13 10:01:35 +0000 2018,Advance Residence Investment : Notice Concerning Debt Financing and Repayment of Loan #financiar… https://t.co/b9i2vZyRuT,0
Fri Apr 13 09:19:51 +0000 2018,The best investment on earth is earth 🌎 #realestate . . . #investorslife #bitcoin #investorswanted #southflorida… https://t.co/lPAny3g2Wu,0
Fri Apr 13 09:16:57 +0000 2018,Man don’t know why I ever bought a computer online literally the worst investment I’ve ever made in my life.,0
Fri Apr 13 08:09:37 +0000 2018,@cdmtoken One of the best company  where you invest your money💰. Buy CDM tokens. And also receive dividend on your… https://t.co/py5iHU8Wt3,1
Fri Apr 13 04:54:24 +0000 2018,U.S TO DETAIL TARIFF LIST ON $100 BLN IMPORTS FROM CHINA AS EARLY AS NEXT WEEK  MULL BAN OF CHINESE INVESTMENT IN THE U.S  WSJ SAYS,3
Fri Apr 13 02:53:31 +0000 2018,Jurors in #NewJersey award $117m in a #lawsuit that claims Johnson &amp; Johnson’s talcum powder products caused an inv… https://t.co/cl1zsvh915,0
Fri Apr 13 02:28:15 +0000 2018,U.S TO DETAIL TARIFF LIST ON $100 BLN IMPORTS FROM CHINA AS EARLY AS NEXT WEEK  MULL BAN OF CHINESE INVESTMENT IN THE U.S  WSJ SAYS,3
Fri Apr 13 01:27:36 +0000 2018,"By making imports more expensive or driving people to more expensive US-made goods  businesses would see costs inc… https://t.co/mdDDrmNwOt,0
Fri Apr 13 00:39:01 +0000 2018,Community Policing is a long term investment. @MPD_PAL mentors over 800 kids a year. The future of our community is… https://t.co/46xHJVeUBw,9
Fri Apr 13 00:36:38 +0000 2018,New version of @DcryptInc investment platform has been released with some major new features! Includes the ability… https://t.co/iS2D2XIJ5h,1
Fri Apr 13 00:19:20 +0000 2018,THE EVOLUTION OF ROBO-ADVISING REPORT: How automated investment products are disrupting and enhancing the wealth ma… https://t.co/bH7ego99jF,0
Fri Apr 13 00:15:00 +0000 2018,Community Policing is a long term investment. @MPD_PAL mentors over 800 kids a year. The future of our community is… https://t.co/46xHJVeUBw,9
Fri Apr 13 00:14:57 +0000 2018,EB-5 investors and their immediate family can live  work and go to school in the U.S. on their conditional green ca… https://t.co/jdUbPRsIxO,1
Fri Apr 13 00:13:00 +0000 2018,New version of @DcryptInc investment platform has been released with some major new features! Includes the ability… https://t.co/iS2D2XIJ5h,1
