Tue Oct 16 22:27:44 +0000 2018,What is your favorite platform for buying bitcoin that you recommend to people brand new to crypto?,9
Tue Oct 16 22:27:06 +0000 2018,A new study reveals that DLT could work for US equity markets  process over 100 million transactions per day:… https://t.co/XCNLTX6dpK,19
Tue Oct 16 22:25:50 +0000 2018,Bitcoin's recovery from three-week lows has kept a key long-term moving average support intact. https://t.co/VXas7EAe1T,77
Tue Oct 16 22:23:53 +0000 2018,@TheCryptoLark Just Bitcoin,0
Tue Oct 16 22:23:09 +0000 2018,Ukraine set to launch state based cryptocurrency.  #nvestweekly #bitcoinnews #bitcoin #Coinbase #ukraine… https://t.co/vMbKa4jcNL,0
Tue Oct 16 22:22:27 +0000 2018,@hodlonaut The beauty of the black hole never ceases to amaze.,0
Tue Oct 16 22:22:24 +0000 2018,The market is very tightly wound and ready for a move. Bitcoin's current consolidation pattern  known as a descendi… https://t.co/VX7vaj3p9N,0
Tue Oct 16 22:21:22 +0000 2018,A new study reveals that DLT could work for US equity markets  process over 100 million transactions per day:… https://t.co/XCNLTX6dpK,19
Tue Oct 16 22:21:10 +0000 2018,If China were to weaponize bitcoin  what would they gain?  Am I missing something? Wouldn't it break everyone's tru… https://t.co/j2aNsk0yku,0
Tue Oct 16 22:20:16 +0000 2018,Forget Buying Bitcoin: 19 Better Investment Opportunities | Cheapism https://t.co/I5hzU407sf,0
Tue Oct 16 22:19:31 +0000 2018,Fresh on the market  the industry’s newest batch of stablecoins is having trouble striking a price balance.Amidst n… https://t.co/mymXwOHqWE,0
Tue Oct 16 22:18:41 +0000 2018,ICYMI: @Nouriel says #bitcoin's resilience at $6k reflects a temporary safe-haven trade that will ultimately get dr… https://t.co/lUir4kGKax,8
Tue Oct 16 22:17:39 +0000 2018,The Fed (private banks) are robbing you via inflation every second of every day. Their ship will surely collapse be… https://t.co/N1ESxgDWGX,1
Tue Oct 16 22:17:20 +0000 2018,Will you watch NBA games? and When  #NBA   #poll #vote #question #survey  #WorldFoodDay #NationalBossDay… https://t.co/thOPiRGjpJ,1
Tue Oct 16 22:17:05 +0000 2018,Bitcoin Cash BCH Current Price: $456 519 1 Hour: -0.07 % | 24 Hours: -0.01 % | 7 Days: -11.46 % #bch #bitcoin cash,0
Tue Oct 16 22:16:51 +0000 2018,Will you watch NBA games? and When  #NBA   #poll #vote #question #survey  #WorldFoodDay #NationalBossDay… https://t.co/thOPiRGjpJ,1
Tue Oct 16 22:16:49 +0000 2018,Be apart of this movement when #Bitcoin &amp; #Litecoin change the game in the currency space! Join the #LitecoinFam! R… https://t.co/2Ks3YjApXH,91
Tue Oct 16 22:16:34 +0000 2018,Bitcoin Price Analysis: Bitcoin Consolidation Forecasts $3 500 Move - https://t.co/FsMVUdHTz3              A strong… https://t.co/kjc71XJ03O,0
Tue Oct 16 22:14:14 +0000 2018,this aarp mag definition of bitcoin is amazing?? https://t.co/5xr1I7of35,4105
Tue Oct 16 22:10:24 +0000 2018,【币圈行情】10-16：稳定币“不稳定”？泰达币波动致币圈地震，深陷丑闻风波  https://t.co/ZYFhDRAVKv  #usdt #tether #cryptonews #bitcoin #blockchain https://t.co/uF8dKO7mzw,1
Tue Oct 16 22:10:15 +0000 2018,【币圈行情】10-16：稳定币“不稳定”？泰达币波动致币圈地震，深陷丑闻风波  https://t.co/ZYFhDRAVKv  #usdt #tether #cryptonews #bitcoin #blockchain https://t.co/uF8dKO7mzw,1
Tue Oct 16 22:10:05 +0000 2018,Bitcoin BTC Current Price: $6.585 883 1 Hour: - | 24 Hours: 0.35 % | 7 Days: -0.63 % #btc #bitcoin,0
Tue Oct 16 22:09:57 +0000 2018,Fidelity Investments launches crypto platform for institutions called Fidelity Digital Assets… https://t.co/3V7w1Aqbhd,141
Tue Oct 16 22:09:22 +0000 2018,Humans of Bitcoin: Entrevista con José de EatBCH  https://t.co/7xyBXO7FiY,0
Tue Oct 16 22:03:51 +0000 2018,"How to send an Email" (1984)  https://t.co/EyLXU5dt2f Thirty years from now  "How to send #Bitcoin" videos will feel similar.,74
Tue Oct 16 22:03:08 +0000 2018,Coinbase adds up its first ERC 20 Token   #nvestweekly #bitcoinnews #cryptocurrency #bitcoin #Coinbase #ethereum… https://t.co/01gZ4td8jd,0
Tue Oct 16 22:03:05 +0000 2018,Re-listening to @pmarca’s EconTalk  where he’s   -bullish on bitcoin (compared it to innovations of the PC)  -predi… https://t.co/cWq0VOtvdW,0
Tue Oct 16 22:02:59 +0000 2018,昙花一现的大涨后，市场仍在沉闷 https://t.co/HFYCfhXuBY #Bitcoin #BTC #BCH #EOS #ETH #LTC #ADA #NEO #XMR #XLM #XRP #tether… https://t.co/iPAggcNdHA,1
Tue Oct 16 22:02:44 +0000 2018,The price of Bitcoin vs USD is $6 576.39 at 4:59 pm. Follow the prices of various cryptocurrencies across different… https://t.co/GIbzCfXN5B,0
Tue Oct 16 22:02:32 +0000 2018,China's Bitcoin Dominance Is Worrying Trump's White House -- which we know but I’m sharing because ⁦@ForbesCrypto⁩… https://t.co/Eb0itsMAaY,19
Tue Oct 16 22:00:39 +0000 2018,Monica’s Restaurant in Pompton Lakes  NJ now Accepting Bitcoin/Litecoin for Payment. #LTCEastcostteam is having din… https://t.co/zhdc8Nu2k7,15
Tue Oct 16 22:00:35 +0000 2018,Bitcoin  Ethereum  Ripple  Bitcoin Cash  EOS  Stellar  Litecoin  Cardano  Monero  TRON: Price Analysis  October 15… https://t.co/EPC6jM5dox,0
Tue Oct 16 22:00:19 +0000 2018,Monica’s Restaurant in Pompton Lakes  NJ now Accepting Bitcoin/Litecoin for Payment. #LTCEastcostteam is having din… https://t.co/zhdc8Nu2k7,15
Tue Oct 16 22:00:07 +0000 2018,Trump’s Trade Tariffs on Chinese Imports to Hit Mining Manufacturers Hard — https://t.co/lEbLPhZDiw  Follow us ツ… https://t.co/8YbyD9cPhw,0
Tue Oct 16 21:58:04 +0000 2018,Global Market 17.10.18 #goodlife #cryptocurrency #cryptolifestyle #bitcoinmining #bitcoin #Crypto #Cryptocurrency… https://t.co/YFH7ctjlN9,0
Tue Oct 16 21:56:23 +0000 2018,China is a threat to the Bitcoin network says new report - https://t.co/AjQOJ2LN0P new study published by researche… https://t.co/plRdZ9Sxl8,0
Tue Oct 16 21:54:35 +0000 2018,Monica’s Restaurant in Pompton Lakes  NJ now Accepting Bitcoin/Litecoin for Payment. #LTCEastcostteam is having din… https://t.co/zhdc8Nu2k7,15
Tue Oct 16 21:47:09 +0000 2018,Coinbase  2016: "There's nothing Bitcoin can do that Ethereum can't."  Counterpoint: I can run a full bitcoin node.… https://t.co/mDzwkgxkEH,10
Tue Oct 16 21:44:23 +0000 2018,Fidelity Investments launches crypto platform for institutions called Fidelity Digital Assets… https://t.co/3V7w1Aqbhd,141
Tue Oct 16 21:43:42 +0000 2018,Odds are he’s correct  2019 will be the year of the Institutional 💰  https://t.co/wDpzQzF1Yy  #bitcoin #ethereum… https://t.co/O5cgcufQRx,0
Tue Oct 16 21:43:24 +0000 2018,Yes  Tiffany  I operate a network of fake accounts for a token that isn’t affiliated with the entity which created… https://t.co/Cx8oUF0hT9,2
Tue Oct 16 21:42:51 +0000 2018,My Senate Testimony highlighted the national security risks deriving from China controlling 80% of Bitcoin mining.… https://t.co/urWo0nvcez,36
Tue Oct 16 21:42:32 +0000 2018,#BITCOIN EXPLODES? TETHER DUMPS? TRUMP TALKS XRP RIPPLE? #Binance Coinbase #Bakkt David Beckham NBA IBM… https://t.co/BvCSCtgwiu,1
Tue Oct 16 21:42:10 +0000 2018,#BITCOIN EXPLODES? TETHER DUMPS? TRUMP TALKS XRP RIPPLE? #Binance Coinbase #Bakkt David Beckham NBA IBM… https://t.co/BvCSCtgwiu,1
Tue Oct 16 21:41:30 +0000 2018,Fidelity Investments launches crypto platform for institutions called Fidelity Digital Assets… https://t.co/3V7w1Aqbhd,141
Tue Oct 16 21:41:08 +0000 2018,Fidelity's newly announced cryptocurrency spin-off will offer institutional access to bitcoin and ethereum custody … https://t.co/LokbkBYiaW,26
Tue Oct 16 21:40:28 +0000 2018,@nbougalis @brian_armstrong Distraction is @coinbase adding #zrx meanwhile they had 8B profit on bear market   manipulating bitcoin price !,0
Tue Oct 16 21:40:07 +0000 2018,Bitcoin Price Intraday Analysis: BTC/USD Holds $6 400 Floor https://t.co/mFVxYa2lqV https://t.co/ge4tACcc3b,0
Tue Oct 16 21:39:27 +0000 2018,Coinbase  2016: "There's nothing Bitcoin can do that Ethereum can't."  Counterpoint: I can run a full bitcoin node.… https://t.co/mDzwkgxkEH,10
Tue Oct 16 21:38:45 +0000 2018,What is #BitCoin? | BCN – BitClub Corporate https://t.co/F6tl5qDsMt https://t.co/gALiyVg5pG,2
Tue Oct 16 21:38:35 +0000 2018,Just bought a pair of Cole Haan’s with BTC.. don’t say I never did anything to stimulate the Bitcoin economy,3
Tue Oct 16 21:38:32 +0000 2018,It may be a good sign that people aren't spending their bitcoin https://t.co/Uf7FmoUEDL,25
Tue Oct 16 21:37:55 +0000 2018,Coinbase  2016: "There's nothing Bitcoin can do that Ethereum can't."  Counterpoint: I can run a full bitcoin node.… https://t.co/mDzwkgxkEH,10
Tue Oct 16 21:37:31 +0000 2018,CAPRE CANADIAN DIGITAL TRANSFORMATION &amp; GREEN ENERGY INNOVATION SUMMIT tomorrow 10/17 in #Montreal. #digitization… https://t.co/wA9KVJ4e8v,2
Tue Oct 16 21:37:05 +0000 2018,Coinbase  2016: "There's nothing Bitcoin can do that Ethereum can't."  Counterpoint: I can run a full bitcoin node.… https://t.co/mDzwkgxkEH,10
Tue Oct 16 21:36:57 +0000 2018,CAPRE CANADIAN DIGITAL TRANSFORMATION &amp; GREEN ENERGY INNOVATION SUMMIT tomorrow 10/17 in #Montreal. #digitization… https://t.co/wA9KVJ4e8v,2
Tue Oct 16 21:36:53 +0000 2018,ICYMI: @Nouriel says #bitcoin's resilience at $6k reflects a temporary safe-haven trade that will ultimately get dr… https://t.co/lUir4kGKax,8
Tue Oct 16 21:35:23 +0000 2018,Cointext Launches Bitcoin Cash SMS Wallet in Argentina and Turkey https://t.co/M0iZHGish7,1
Tue Oct 16 21:35:20 +0000 2018,Cointext Launches Bitcoin Cash SMS Wallet in Argentina and Turkey https://t.co/CyaF2SocMH https://t.co/e4TiEk8JTv,0
Tue Oct 16 21:34:22 +0000 2018,ICYMI: @Nouriel says #bitcoin's resilience at $6k reflects a temporary safe-haven trade that will ultimately get dr… https://t.co/lUir4kGKax,8
Tue Oct 16 21:34:11 +0000 2018,Odds are he’s correct   https://t.co/PaJRytO2hf  #bitcoin #ethereum #cryptocurrency #litecoin #ripple #investing… https://t.co/CwFnhCbzQI,0
Tue Oct 16 21:34:00 +0000 2018,Former Commodity Futures Commission Chairman Gary Gensler  who helmed the organization from mid-2009 to early 2014 … https://t.co/c1MmqwZOP5,1
Tue Oct 16 21:32:43 +0000 2018,A new study reveals that DLT could work for US equity markets  process over 100 million transactions per day:… https://t.co/XCNLTX6dpK,19
Tue Oct 16 21:32:07 +0000 2018,White House Considers Ripple as a Foil to China’s Bitcoin Dominance https://t.co/pKDD8cd6ZP https://t.co/CQy1TvbBUd,0
Tue Oct 16 21:31:35 +0000 2018,ICYMI: @Nouriel says #bitcoin's resilience at $6k reflects a temporary safe-haven trade that will ultimately get dr… https://t.co/lUir4kGKax,8
Tue Oct 16 21:31:21 +0000 2018,It may be a good sign that people aren't spending their bitcoin https://t.co/Uf7FmoUEDL,25
Tue Oct 16 21:30:41 +0000 2018,Bitcoin Cash [BCH] developers close to adding privacy to BCH transactions | Source: @CryptoAmb https://t.co/TolJn04God,0
Tue Oct 16 21:29:02 +0000 2018,1/ Great morning for a tweetstorm updating the latest on the interaction of #WallSt &amp; #bitcoin  drinking coffee fro… https://t.co/GhD6hn4S7s,66
Tue Oct 16 21:24:06 +0000 2018,Cointext Launches Bitcoin Cash SMS Wallet in Argentina and Turkey https://t.co/0d4NndkUWc https://t.co/FFlkgVUfmz,0
Tue Oct 16 21:23:06 +0000 2018,Fidelity Investments launches crypto platform for institutions called Fidelity Digital Assets… https://t.co/3V7w1Aqbhd,141
Tue Oct 16 21:22:59 +0000 2018,Coinbase  2016: "There's nothing Bitcoin can do that Ethereum can't."  Counterpoint: I can run a full bitcoin node.… https://t.co/mDzwkgxkEH,10
Tue Oct 16 21:22:37 +0000 2018,Coinbase  2016: "There's nothing Bitcoin can do that Ethereum can't."  Counterpoint: I can run a full bitcoin node.… https://t.co/mDzwkgxkEH,10
Tue Oct 16 21:22:36 +0000 2018,Just bought a pair of Cole Haan’s with BTC.. don’t say I never did anything to stimulate the Bitcoin economy,3
Tue Oct 16 21:22:20 +0000 2018,Monica’s Restaurant in Pompton Lakes  NJ now Accepting Bitcoin/Litecoin for Payment. #LTCEastcostteam is having din… https://t.co/zhdc8Nu2k7,15
Tue Oct 16 21:20:31 +0000 2018,Cointext began offering its new SMS-based bitcoin cash wallet service on Oct. 15 in Turkey and Argentina  two count… https://t.co/e1o7KHvBt5,0
Tue Oct 16 21:18:56 +0000 2018,Bitcoin with archetype theme.  #bitcoin #cryptocurrency #cryptoart #blockchain https://t.co/THH0xfnZBM,0
Tue Oct 16 21:18:19 +0000 2018,@ferdousbhai @Caesar_Skiba If you’re interested in funding a project that helps Bitcoin check out https://t.co/F4hyMvVHU3 ! 🙏🙌,0
Tue Oct 16 21:17:14 +0000 2018,Monica’s Restaurant in Pompton Lakes  NJ now Accepting Bitcoin/Litecoin for Payment. #LTCEastcostteam is having din… https://t.co/zhdc8Nu2k7,15
Tue Oct 16 21:17:06 +0000 2018,Bitcoin Cash BCH Current Price: $456 827 1 Hour: 0.17 % | 24 Hours: 0.18 % | 7 Days: -11.42 % #bch #bitcoin cash,0
Tue Oct 16 21:16:38 +0000 2018,A 'Herd of Institutional Investors' are Moving Into Crypto. https://t.co/wohkQEZxvE #crypto #cryptotrading #cryptocurrencies,2
Tue Oct 16 21:15:56 +0000 2018,1/ Mass adoption of Bitcoin is inevitable,502
Tue Oct 16 21:14:41 +0000 2018,Monica’s Restaurant in Pompton Lakes  NJ now Accepting Bitcoin/Litecoin for Payment. #LTCEastcostteam is having din… https://t.co/zhdc8Nu2k7,15
Tue Oct 16 21:14:21 +0000 2018,Coinbase  2016: "There's nothing Bitcoin can do that Ethereum can't."  Counterpoint: I can run a full bitcoin node.… https://t.co/mDzwkgxkEH,10
Tue Oct 16 21:13:07 +0000 2018,13/ ...and when the losses hit someday  no fiduciary will be able to claim they weren’t warned! Plaintiffs attorney… https://t.co/YwyzfnETJh,9
Tue Oct 16 21:12:33 +0000 2018,CAPRE CANADIAN DIGITAL TRANSFORMATION &amp; GREEN ENERGY INNOVATION SUMMIT tomorrow 10/17 in #Montreal. #digitization… https://t.co/wA9KVJ4e8v,2
Tue Oct 16 21:11:45 +0000 2018,1/ 5 years of blockchain and decentralization hype and  aside from Bitcoin  there has not been a single useful product.,54
Tue Oct 16 21:11:09 +0000 2018,Bitcoin Needs a Boost at $6700  Hedge Fund Manager Explains Why 2019 Going to be Big for Crypto Market… https://t.co/Q2NRg0d8si,0
Tue Oct 16 21:10:23 +0000 2018,Bitcoin BTC Current Price: $6.587 574 1 Hour: 0.14 % | 24 Hours: 0.38 % | 7 Days: -0.60 % #btc #bitcoin,1
Tue Oct 16 21:10:05 +0000 2018,Bitcoin BTC Current Price: $6.587 574 1 Hour: 0.14 % | 24 Hours: 0.38 % | 7 Days: -0.60 % #btc #bitcoin,1
Tue Oct 16 21:09:41 +0000 2018,Coinbase  2016: "There's nothing Bitcoin can do that Ethereum can't."  Counterpoint: I can run a full bitcoin node.… https://t.co/mDzwkgxkEH,10
Tue Oct 16 21:07:33 +0000 2018,#BITCOIN TĂNG TRƯỞNG THẦN TỐC – USDT GIẢM MẠNH – CHUYỆN GÌ ĐANG XẢY RA ?? https://t.co/ICw26NpDib,2
Tue Oct 16 21:07:07 +0000 2018,Monica’s Restaurant in Pompton Lakes  NJ now Accepting Bitcoin/Litecoin for Payment. #LTCEastcostteam is having din… https://t.co/zhdc8Nu2k7,15
Tue Oct 16 21:06:49 +0000 2018,Coinbase  2016: "There's nothing Bitcoin can do that Ethereum can't."  Counterpoint: I can run a full bitcoin node.… https://t.co/mDzwkgxkEH,10
Tue Oct 16 21:05:21 +0000 2018,@NewYorkCoinNYC @nycoincommunity @Bitcoin @LitecoinProject I have 20 000 000 NYC coins  what's going to happen to t… https://t.co/aiLFxESp9i,0
Tue Oct 16 21:05:06 +0000 2018,TD Ameritrade has rolled out a virtual reality tool to give investors exposure to popular stock &amp; options exchanges… https://t.co/RbL3bxWaJl,1
Tue Oct 16 21:05:00 +0000 2018,Coinbase  2016: "There's nothing Bitcoin can do that Ethereum can't."  Counterpoint: I can run a full bitcoin node.… https://t.co/mDzwkgxkEH,10
Tue Oct 16 21:04:38 +0000 2018,Trending on #CAPRE: THE JOURNEY TO #5G: THERE WILL BE STOPS ALONG THE WAY TO AUTONOMOUS Cars #technology #ai… https://t.co/j9FGR1hN74,1
Tue Oct 16 21:04:10 +0000 2018,Fan of horror fiction? Well  horror fiction is a fan of #bitcoin. Discover this #crypto easter egg by @RL_Stine in… https://t.co/OSgIGTDTVk,4
Tue Oct 16 21:03:19 +0000 2018,Just bought a pair of Cole Haan’s with BTC.. don’t say I never did anything to stimulate the Bitcoin economy,3
Tue Oct 16 21:03:14 +0000 2018,What is your favorite platform for buying bitcoin that you recommend to people brand new to crypto?,9
Tue Oct 16 21:02:37 +0000 2018,That's unbelievable! I'm in crypto for three months but this is the first one that really makes me believe in it. D… https://t.co/z7094xTSid,0
Tue Oct 16 21:02:36 +0000 2018,Mike Novogratz: Institutions Will Get Into Bitcoin In Q1-Q2 2019 Bringing "New Highs" #Fed #USA #crypto #BTC… https://t.co/DNFXZE83YL,0
Tue Oct 16 21:02:35 +0000 2018,China's Bitcoin Dominance Is Worrying Trump's White House -- which we know but I’m sharing because ⁦@ForbesCrypto⁩… https://t.co/Eb0itsMAaY,19
Tue Oct 16 21:01:38 +0000 2018,Robinhood Revenue Data Insights Reveal High-Speed Traders Account for Nearly Half - Bitcoin Exchange Guide https://t.co/QXlHgfL2oc,0
Tue Oct 16 21:01:17 +0000 2018,What a peachy ICO-project I've come across last weekend. You need to check this out! #AVL #AvailCom #AVLtoken… https://t.co/9oaEWgyrl0,0
Tue Oct 16 21:00:44 +0000 2018,UPDATE: took out first supply zone lets go $btc #bitcoin #bullcase https://t.co/8HT9N1WROM,0
Tue Oct 16 21:00:27 +0000 2018,4/ Bitcoin already has some quantum resistance. If you only use Bitcoin addresses once (the recommended practice) … https://t.co/pPmVA4YDI4,0
Tue Oct 16 21:00:21 +0000 2018,#HongKong Should not Ban but Regulate #Crypto #Trading  Says #Securities and #Futures Commission Chairman… https://t.co/p2BCv2HMRs,0
Tue Oct 16 20:59:59 +0000 2018,Just bought a pair of Cole Haan’s with BTC.. don’t say I never did anything to stimulate the Bitcoin economy,3
Tue Oct 16 20:59:32 +0000 2018,@jchervinsky Thx Jake! Any firm marketing that clients can buy #bitcoin thru a stock broker or 401k deserves to be… https://t.co/UPhBDzIggW,3
Tue Oct 16 20:59:29 +0000 2018,Trending on #CAPRE: THE JOURNEY TO #5G: THERE WILL BE STOPS ALONG THE WAY TO AUTONOMOUS Cars #technology #ai… https://t.co/j9FGR1hN74,1
Tue Oct 16 20:59:28 +0000 2018,$BTC volume spike. 164 coin print at $6462.53.  $BTCUSD #BTCUSD #BTC #Bitcoin #coinbase #gdax,0
Tue Oct 16 20:58:27 +0000 2018,Fidelity Investments launches crypto platform for institutions called Fidelity Digital Assets… https://t.co/3V7w1Aqbhd,141
Tue Oct 16 20:58:11 +0000 2018,1/ Great morning for a tweetstorm updating the latest on the interaction of #WallSt &amp; #bitcoin  drinking coffee fro… https://t.co/GhD6hn4S7s,66
Tue Oct 16 20:57:39 +0000 2018,@mcuban: “While others talk about what someone else might create  Musk goes out and does it. As a true entrepreneur… https://t.co/iwEwBtjGYk,47
Tue Oct 16 20:57:27 +0000 2018,In Defense of @ElonMusk: The Tesla and SpaceX maestro is under attack for bad tweets  production woes  and strange… https://t.co/aFUzjjbnx5,820
Tue Oct 16 20:56:15 +0000 2018,I’m thinking this is big news. I’m just saying. 😄 #crypto #cryptocurrency #cryptotwitter #bitcoin  https://t.co/isgixhQQ1a,90
Tue Oct 16 20:54:06 +0000 2018,A new study reveals that DLT could work for US equity markets  process over 100 million transactions per day:… https://t.co/XCNLTX6dpK,19
Tue Oct 16 20:52:39 +0000 2018,A crypto entrepreneur had to teach his alma mater how to accept his $10 000 gift https://t.co/XgyWIM2aOv,9
Tue Oct 16 20:52:23 +0000 2018,Just heard the moderator of a #STYT panel refer to direct investment in Bitcoin as purchasing "physical Bitcoin" and no one said anything,0
Tue Oct 16 20:52:00 +0000 2018,A new study reveals that DLT could work for US equity markets  process over 100 million transactions per day:… https://t.co/XCNLTX6dpK,19
Tue Oct 16 20:51:36 +0000 2018,Bitpay Anuncia Soporte De Stablecoins Para Liquidación De Comerciantes  https://t.co/8Hh7Pt5z28,0
Tue Oct 16 20:51:16 +0000 2018,Cryptocurrency Market Regulation Updates and Need for Remediation Protocols https://t.co/fGv1n91GU1 #wsj #nytimes… https://t.co/k1cbnMW4Kg,5
Tue Oct 16 20:50:32 +0000 2018,New Bitcoin auto mining free earn 0 00018 #btc per day No investment https://t.co/KThzSHB3vA https://t.co/F7OuolTgYm,1
Tue Oct 16 20:50:05 +0000 2018,New Bitcoin auto mining free earn 0 00018 #btc per day No investment https://t.co/KThzSHB3vA https://t.co/F7OuolTgYm,1
Tue Oct 16 20:49:45 +0000 2018,@Solipsistic_God @PizzaSkunk Ew. Gross. I'm not looking in ANYONE'S Bitcoin pouch.,0
Tue Oct 16 20:49:23 +0000 2018,Monica’s Restaurant in Pompton Lakes  NJ now Accepting Bitcoin/Litecoin for Payment. #LTCEastcostteam is having din… https://t.co/zhdc8Nu2k7,15
Tue Oct 16 20:48:13 +0000 2018,My Senate Testimony highlighted the national security risks deriving from China controlling 80% of Bitcoin mining.… https://t.co/urWo0nvcez,36
Tue Oct 16 20:47:08 +0000 2018,My Senate Testimony highlighted the national security risks deriving from China controlling 80% of Bitcoin mining.… https://t.co/urWo0nvcez,36
Tue Oct 16 20:44:10 +0000 2018,My Senate Testimony highlighted the national security risks deriving from China controlling 80% of Bitcoin mining.… https://t.co/urWo0nvcez,36
Tue Oct 16 20:44:06 +0000 2018,.@BillyBambrough What is this? Was @CoryTV involved in pitching this story to you? We’re you compensated in any way… https://t.co/sXoFFDW1zt,9
Tue Oct 16 20:43:49 +0000 2018,1/ Great morning for a tweetstorm updating the latest on the interaction of #WallSt &amp; #bitcoin  drinking coffee fro… https://t.co/GhD6hn4S7s,66
Tue Oct 16 20:43:31 +0000 2018,This ⁦@CaitlinLong_⁩ talk provided me with some awesome new perspective on #bitcoin and #cryptocurrency in general.… https://t.co/SNvlnpbwYF,12
Tue Oct 16 20:43:18 +0000 2018,Fidelity Investments launches crypto platform for institutions called Fidelity Digital Assets… https://t.co/3V7w1Aqbhd,141
Tue Oct 16 20:43:04 +0000 2018,This ⁦@CaitlinLong_⁩ talk provided me with some awesome new perspective on #bitcoin and #cryptocurrency in general.… https://t.co/SNvlnpbwYF,12
Tue Oct 16 20:42:45 +0000 2018,Fidelity has revealed its plan to launch Fidelity Digital Asset Services  LLC  a trading platform focused on instit… https://t.co/UWhj5LCMzY,226
Tue Oct 16 20:42:42 +0000 2018,A new study reveals that DLT could work for US equity markets  process over 100 million transactions per day:… https://t.co/XCNLTX6dpK,19
Tue Oct 16 20:41:04 +0000 2018,#bitcoin generator must read!!! https://t.co/E48KZ4oodg https://t.co/wkmGtIVTBW,2
Tue Oct 16 20:40:29 +0000 2018,Monica’s Restaurant in Pompton Lakes  NJ now Accepting Bitcoin/Litecoin for Payment. #LTCEastcostteam is having din… https://t.co/zhdc8Nu2k7,15
Tue Oct 16 20:40:11 +0000 2018,I want to say a good word for to this ICO-project as they are doing magnificent job. I can't describe it to you eno… https://t.co/r4qAslKUPl,0
Tue Oct 16 20:38:53 +0000 2018,Stop being lost in reverie! Be wise and check this interesting ICO! #ICO #Crowdsale #Bitcoin #Blockchain #Token… https://t.co/dbN87n0qWx,0
Tue Oct 16 20:38:28 +0000 2018,Monica’s Restaurant in Pompton Lakes  NJ now Accepting Bitcoin/Litecoin for Payment. #LTCEastcostteam is having din… https://t.co/zhdc8Nu2k7,15
Tue Oct 16 20:38:22 +0000 2018,Lack of correlation to traditional asset classes is an important reason why #crypto is rapidly becoming an institut… https://t.co/YaBJqGpPR6,0
Tue Oct 16 20:38:04 +0000 2018,Bitcoin Price Intraday Analysis: BTC/USD Holds $6 400 Floor  https://t.co/s7UIS1pEeB,0
Tue Oct 16 20:36:01 +0000 2018,The bitcoin-to-dollar exchange rate is holding above 6400-fiat as it goes towards testing major resistance hurdles… https://t.co/z1BMIvfDrj,0
Tue Oct 16 20:35:43 +0000 2018,A new study reveals that DLT could work for US equity markets  process over 100 million transactions per day:… https://t.co/XCNLTX6dpK,19
Tue Oct 16 20:35:30 +0000 2018,This ⁦@CaitlinLong_⁩ talk provided me with some awesome new perspective on #bitcoin and #cryptocurrency in general.… https://t.co/SNvlnpbwYF,12
Tue Oct 16 20:35:15 +0000 2018,Monica’s Restaurant in Pompton Lakes  NJ now Accepting Bitcoin/Litecoin for Payment. #LTCEastcostteam is having din… https://t.co/zhdc8Nu2k7,15
Tue Oct 16 20:34:51 +0000 2018,$BTC volume spike. 159 coin print at $6448.27.  $BTCUSD #BTCUSD #BTC #Bitcoin #coinbase #gdax,0
Tue Oct 16 20:34:01 +0000 2018,@DecentralizTech @ApollotheHills @rootvegetable3 @HammerToe @JoelKatz @XRPTrump @Paisan26849860 @thoridan… https://t.co/8quXfQhdd8,0
Tue Oct 16 20:30:32 +0000 2018,@DecentralizTech @HammerToe @JoelKatz @ApollotheHills @XRPTrump @Paisan26849860 @thoridan @stuart_xrp @Vadius7… https://t.co/UIrCh3Q28I,0
Tue Oct 16 20:30:31 +0000 2018,What they won’t discuss at a Senate hearing: when BTC inevitably destroys the USD  all USD-denominated debt becomes… https://t.co/D0cBTxGfgw,98
Tue Oct 16 20:30:20 +0000 2018,Monica’s Restaurant in Pompton Lakes  NJ now Accepting Bitcoin/Litecoin for Payment. #LTCEastcostteam is having din… https://t.co/zhdc8Nu2k7,15
Tue Oct 16 20:29:31 +0000 2018,Bitcoin is a financial revolution  but it didn’t appear out of nowhere. It stands on the shoulders of digital money… https://t.co/xuuqDO3uVm,31
Tue Oct 16 20:29:19 +0000 2018,@lopp @CaitlinLong_ We already did: it’s called Bitcoin BCH,4
Tue Oct 16 20:29:13 +0000 2018,I’m thinking this is big news. I’m just saying. 😄 #crypto #cryptocurrency #cryptotwitter #bitcoin  https://t.co/isgixhQQ1a,90
Tue Oct 16 20:29:00 +0000 2018,Binance Abre Plataforma De Intercambio Fiat A Cripto En Uganda  https://t.co/z8M5ex9JEQ,0
Tue Oct 16 20:28:34 +0000 2018,The NBA is BACK #NBA #NBATwitter   #detroitbasketball #teamiseverything #heretheycome #hornets30 #fearthedeer… https://t.co/APPC6GCcHU,0
Tue Oct 16 20:28:28 +0000 2018,My Senate Testimony highlighted the national security risks deriving from China controlling 80% of Bitcoin mining.… https://t.co/urWo0nvcez,36
