Tue Oct 23 22:31:32 +0000 2018,I'm going to add "Stealer of Trading Joy" to my profile. Has a dash of panache that I appreciate https://t.co/fwx2xhJOhv,2
Tue Oct 23 22:10:02 +0000 2018,I'm going to add "Stealer of Trading Joy" to my profile. Has a dash of panache that I appreciate https://t.co/fwx2xhJOhv,2
Tue Oct 23 22:08:49 +0000 2018,Trading Bitcoin w/ Venzen &amp; Willy Woo - Bear Market?       With @ToneVays  @Woonomic  @Venzen       #BlockChainNews… https://t.co/e3Wv0pim2X,0
Tue Oct 23 22:01:13 +0000 2018,Breaking: Crypto Giants Coinbase and Circle Launch Digital Dollar ‘USDC’ 👉👉 https://t.co/90iFpXzwt6  /By Josiah Wil… https://t.co/R9ftNHPfB4,0
Tue Oct 23 21:53:01 +0000 2018,Norway Bitcoin Investor Murder: Suspect Arrested in France 👉👉 https://t.co/6J20xajoxf  /By Josiah Wilmoth… https://t.co/gFz93OOCfC,0
Tue Oct 23 21:21:20 +0000 2018,My white friends  never put your nasty ass feet on my dash board  or out of my window!,0
Tue Oct 23 21:10:42 +0000 2018,Deals From iClever: Wall Outlet With USB Ports For $9.99  10W Fast Wireless Charger For $11.89 -… https://t.co/VxH6piTbfV,0
Tue Oct 23 18:57:37 +0000 2018,In Two Years The Market Could Be Worth $2 Trillion 👉👉 https://t.co/2XLe19Wti8  /By  Robert Johnson  #BlockChainNews… https://t.co/vcIpJR3GKU,0
Tue Oct 23 17:26:40 +0000 2018,@KyleClark Don't go down this rabbit hole Kyle.  Next thing you know you're in to Youtube Russian dash cams and the… https://t.co/KIoPjGfbnf,0
Tue Oct 23 17:18:30 +0000 2018,Public Comments on VanEck/SolidX Bitcoin ETF: Informed  Informative  Empathetic  All-Around Mensch  👉👉… https://t.co/kbeOc1CU10,0
Tue Oct 23 15:41:10 +0000 2018,That bitch got 125 on the dash,0
Tue Oct 23 14:56:38 +0000 2018,Roscoe Dash’s music wasn’t appreciated enough,0
Tue Oct 23 03:38:49 +0000 2018,Interested in how you can spend crypto? @wirexapp offers debit cards linked to Visa AND has been accredited by the… https://t.co/M2mOjppDoN,1
Tue Oct 23 03:01:37 +0000 2018,Interested in how you can spend crypto? @wirexapp offers debit cards linked to Visa AND has been accredited by the… https://t.co/M2mOjppDoN,1
Tue Oct 23 02:58:49 +0000 2018,Both Democrats and Republicans both agree on the potential of cryptocurrency for politics -- via @ForbesCrypto… https://t.co/mdS4Yl8iS8,0
Tue Oct 23 02:13:01 +0000 2018,How @Binance is Legitimizing the Crypto Market by Eliminating Money Laundering 👉👉 https://t.co/q3pouuqwt2  /By Jose… https://t.co/1VI5q4Mqi1,0
