Thu Nov 01 22:06:10 +0000 2018,Add a dash of sunshine to your big day with #sunflowers! They pose as the perfect choice for your fall #wedding.  L… https://t.co/TJ0oA5l7dD,0
Thu Nov 01 21:52:16 +0000 2018,@PatrickRenna You could clock my 40 yard dash with a sundial. Dont feel bad sir.,0
Thu Nov 01 21:09:11 +0000 2018,anthurium doing its thing... | juicy fruity combo paired with a dash is desert wild by our girl aliagonzo giving us… https://t.co/b0UAiZOYmw,0
Thu Nov 01 20:47:34 +0000 2018,Bitcoin Price Intraday Analysis: $BTCUSD Recovers amid Downside Vulnerability 👉👉 https://t.co/WNNEUa7QvT   /By Yash… https://t.co/W6oieBh4Dt,0
Thu Nov 01 19:30:48 +0000 2018,Imagine Michael Myers running a 4.54 40 yard dash https://t.co/GmH25Nga3N,0
Thu Nov 01 17:35:29 +0000 2018,Japanese Financial Giant SBI to Use Ripple (XRP) Extensively With R3 👉👉 https://t.co/6QpztPFAUQ  /By Joseph Young… https://t.co/LGmdUbY1Jx,0
Thu Nov 01 17:31:10 +0000 2018,Coinsource Obtains First Bit License To Operate Bitcoin ATM In New York 👉👉 https://t.co/TSAccP5Ymv  /By P. H. Mador… https://t.co/0xCmjXVJK4,0
Thu Nov 01 16:30:21 +0000 2018,@Rasko_Dash True. I actually overslept my alarm this morning and missed breakfast. I eat breakfast now  I'm a machine.,0
Thu Nov 01 14:52:16 +0000 2018,A Week Of Satoshi Pt. 3: Big Bitcoin Moments (2008 – 2013) 👉👉 https://t.co/vxb5lPFGic  /By Liam J Kelly… https://t.co/PXf0Qx6CcR,0
Thu Nov 01 14:40:24 +0000 2018,A Week of Satoshi Pt. 2: A Faceless Response to the Power of Centralization 👉👉 https://t.co/8RbnufnCzC   /By Aisshw… https://t.co/o56T2IRHhI,0
Thu Nov 01 14:37:26 +0000 2018,A Week of Satoshi Pt.1: The Cultural and Economic Birthplace of Bitcoin 👉👉 https://t.co/8x0sZILh6y  /By Shaurya Mal… https://t.co/mcdcLGIZxm,0
Thu Nov 01 14:32:38 +0000 2018,Canadian Regulators Warn Investors To Defraud Crypto Companies 👉👉 https://t.co/NZVew2c11Z   /By Ogwu Osaemezu Emman… https://t.co/1ZFt1lPBSG,0
Thu Nov 01 14:15:50 +0000 2018,Goldman Sachs Onboarding Clients for Bitcoin Derivatives  Insiders Say 👉 👉 https://t.co/xu1Y82fV8T  /By OSATO AVAN-… https://t.co/6YKHawVkAB,0
Thu Nov 01 14:11:06 +0000 2018,Hong Kong Crypto Exchange Will Be Subject To Stricter Regulatory Scrutiny 👉👉 https://t.co/SC44HbDEKM  /By OSATO AVA… https://t.co/vTlgtHi1YI,0
Thu Nov 01 14:00:03 +0000 2018,Binance Freezes WEX Accounts Caught Moving Possibly Stolen Funds 👉👉 https://t.co/D7NmVpnNvn  /By P. H. Madore… https://t.co/RtW1ci9KWH,0
Thu Nov 01 13:58:03 +0000 2018,Hong Kong Reveals Regulatory Framework for Crypto Exchanges  Funds 👉👉 https://t.co/vwrYzhy2Mh  /By Jimmy Aki… https://t.co/IlgW5enaB4,0
Thu Nov 01 13:53:40 +0000 2018,Korean Crypto Giant Bithumb Makes US Foray And Secure Token Exchange Exchanges  👉👉https://t.co/t2OHdZH5TB  /By Gere… https://t.co/RQc1MsiIBv,0
Thu Nov 01 13:03:14 +0000 2018,I'd consider eating a stranger's pizza too after 24 hours of camping in the cold. @EricLupher7 covering the mad das… https://t.co/TTn3h9mzEM,0
Thu Nov 01 11:44:12 +0000 2018,Have you heard ‘Murad Mahmudov: The Ultimate Bitcoin Argument’ by Off the Chain on #SoundCloud? #np @APompliano… https://t.co/Wij4lkAuRX,6
Thu Nov 01 06:33:34 +0000 2018,Coinbase Valuation Hits $8 Billion Following $300 Million Investment 👉👉 https://t.co/DxaUKAQeXQ  /By Zachary… https://t.co/9gvMA0RBBE,0
Thu Nov 01 05:52:34 +0000 2018,@MollyBOfficial I went in my unicorn onesie and my daughter dressed as rainbow dash. My heart melts for how much fu… https://t.co/sLk6EUfHKX,0
Thu Nov 01 05:31:07 +0000 2018,@JeffreeStar We did! My daughter here let me do her makeup for rainbow dash. Not the best because she was squirmy b… https://t.co/9OCluaBktM,0
Thu Nov 01 05:29:34 +0000 2018,Bitcoin Trading Frequency Has Increased By 50% Since April 2018 👉👉 https://t.co/mv6XmHHJxU  /By Zachary  SegWit &amp; t… https://t.co/M0oLu2nP8x,1
Thu Nov 01 05:28:22 +0000 2018,Bitcoin Trading Frequency Has Increased By 50% Since April 2018 👉👉 https://t.co/mv6XmHHJxU  /By Zachary  SegWit &amp; t… https://t.co/M0oLu2nP8x,1
Thu Nov 01 04:20:32 +0000 2018,@cemcostello Wait. Why are you hyphenating em dash?!,0
Thu Nov 01 04:14:52 +0000 2018,Ex-Bitcoin Skeptic Ron Paul Says Crypto Could Prevent Recession 👉👉 https://t.co/rGGlBl0Wxq  /By Samantha Chang… https://t.co/iG0q0uiNsA,1
Thu Nov 01 03:31:15 +0000 2018,Former Fed Chair Janet Yellen Is Now a Bitcoin Owner 👉👉 https://t.co/sbPxbl0FXy   /By Nikhilesh De  #BlockChainNews… https://t.co/vnz2ejc80v,0
Thu Nov 01 03:22:49 +0000 2018,Cryptocurrencies are now a new institutional investment class  rather than a fully developed electronic cash  a Mor… https://t.co/ex6v2wbK9S,0
Thu Nov 01 02:57:33 +0000 2018,Bitcoin Bear Market May Last For 18 Months: Bitcoin CEO 👉👉 https://t.co/aHQmE5ujrj  /By Samantha Chang… https://t.co/CPfcrHNS0R,1
Thu Nov 01 02:25:46 +0000 2018,@Well_Versed_ I have the 7/11 app  pretty sure its door dash who they use. either way I get free delivery almost everytime,0
Thu Nov 01 01:29:39 +0000 2018,XRP Theft: Australian Woman Docked for Stealing $450 000 Worth of Ripple Cryptocurrency  👉👉 https://t.co/oG0pvkzupf… https://t.co/xXl2cr02Vy,1
Thu Nov 01 00:50:03 +0000 2018,Programming Bitcoin: Learn How to Program Bitcoin from Scratch 1st Edition by @JimmySong (Author)  👉👉… https://t.co/d530GOBZCY,0
