Thu Feb 08 23:41:00 +0000 2018,Find out more at dlbx -  #ethereum #litecoin #ripple #dash #monero #dogecoin #nem #dlbx #nxt #peercoin #potcoin… https://t.co/rCzvLixHtc,0
Thu Feb 08 20:55:57 +0000 2018,I added a video to a @YouTube playlist https://t.co/1KG5AVNLbk Brad Garlinghouse CEO  Ripple At Yahoo Finance All Markets Summit.,0
Thu Feb 08 20:37:13 +0000 2018,First Associates is a proud sponsor of SFIG Vegas. Contact us if you would like to schedule a meeting at the event… https://t.co/GflVFIWZYc,1
Thu Feb 08 20:37:03 +0000 2018,First Associates is a proud sponsor of SFIG Vegas. Contact us if you would like to schedule a meeting at the event… https://t.co/GflVFIWZYc,1
Thu Feb 08 19:09:43 +0000 2018,Ripple Effect of Being an Author: https://t.co/7Px2RvYOEX via @YouTube,0
Thu Feb 08 19:08:53 +0000 2018,I added a video to a @YouTube playlist https://t.co/7Px2RvYOEX Ripple Effect of Being an Author,0
Thu Feb 08 19:05:18 +0000 2018,TUNE IN to this episode of #WhatIsYourWHATWednesday: Over 100 000 people have now downloaded What Is Your WHAT? Dis… https://t.co/J0Z2eTBLdv,0
Thu Feb 08 17:42:28 +0000 2018,Hey Crypto fam what do people think about @officialmcafee. Heard he's spreading FUD about @binance_2017 this mornin… https://t.co/4ukfTZm0y7,1
Thu Feb 08 17:38:19 +0000 2018,Hey Crypto fam what do people think about @officialmcafee. Heard he's spreading FUD about @binance_2017 this mornin… https://t.co/4ukfTZm0y7,1
Thu Feb 08 17:34:54 +0000 2018,The Tribute video ripple effects are staggering here IMO https://t.co/Q6BL6Y91Tv,0
Thu Feb 08 16:27:06 +0000 2018,CRYPTO INSIDER: Prices rise despite being called 'Ponzi schemes' by World Bank president https://t.co/jwp22KdDPK,0
Thu Feb 08 16:19:13 +0000 2018,Learn more about crypto at dlbx - #ethereum #litecoin #ripple #dash #monero #dogecoin #nem #dlbx #nxt #peercoin… https://t.co/LdUJl7q1CO,1
Thu Feb 08 16:13:10 +0000 2018,Learn more about crypto at dlbx - #ethereum #litecoin #ripple #dash #monero #dogecoin #nem #dlbx #nxt #peercoin… https://t.co/LdUJl7q1CO,1
Thu Feb 08 14:46:10 +0000 2018,Invite your friends into SAY Telegram community to get 5 000 SAY for FREE! Limited time only!   First come first se… https://t.co/YdqRy5N9ZS,0
Thu Feb 08 13:23:08 +0000 2018,Ripple CEO: #Crypto can't live outside regulatory framework https://t.co/GOax1ep18j,0
Thu Feb 08 12:31:44 +0000 2018,Ripple $XRP price: $0.780957   We verified that Binance is accepting new users! 🤑 💎    ➡️ https://t.co/8bxd1YvcGR… https://t.co/h9QiyLYIA5,0
Thu Feb 08 09:47:31 +0000 2018,@GiaAllemandFDN have you looked at the ripple effect of poor #PMDD treatment in our #pmddpeeps lives? It caused a tsunami in mine. 😳🙁,0
Thu Feb 08 09:07:09 +0000 2018,Cryptocurrencies are rising despite the World Bank president calling the market a Ponzi scheme https://t.co/eTXGgDXkM8,0
Thu Feb 08 08:41:47 +0000 2018,I was not holding my breath on this one  the #xrparmy is strong.  #xrp #xrpthestandard #ripple https://t.co/S4QL93LiGt,2
Thu Feb 08 07:25:10 +0000 2018,https://t.co/OqP674xqtT @Ripple $xrp,0
Thu Feb 08 06:33:20 +0000 2018,@Forbes And yet plenty of Chinese companies are moving forward with #Ripple 😏,0
Thu Feb 08 06:05:26 +0000 2018,Ripple Price Technical Analysis – XRP/USD Could Retest $0.5000 https://t.co/B1io2HVABE,0
Thu Feb 08 05:20:53 +0000 2018,@rouzierdorce @YahooFinance @coindesk @writenolan How is ripple a scam when the company has partnerships with big f… https://t.co/XhyrK6Cucv,0
Thu Feb 08 03:42:00 +0000 2018,If i was competing against bitcoin what would i do? I would buy a fuck ton of bitcoins. Ripple has been competing w… https://t.co/ezscUT4J3H,0
Thu Feb 08 03:27:14 +0000 2018,I was not holding my breath on this one  the #xrparmy is strong.  #xrp #xrpthestandard #ripple https://t.co/S4QL93LiGt,2
Thu Feb 08 03:25:21 +0000 2018,I was not holding my breath on this one  the #xrparmy is strong.  #xrp #xrpthestandard #ripple https://t.co/S4QL93LiGt,2
Thu Feb 08 02:55:15 +0000 2018,Ripple Dethrones Ethereum  Now #2 Cryptocurrency Behind Bitcoin https://t.co/4KdTDWRbhG,0
Thu Feb 08 02:07:35 +0000 2018,All this talk of #China banning #crypto.  Meanwhile #ripple is busy partnering with massive e-commerce and remittan… https://t.co/GMsDxE5zfI,0
Thu Feb 08 01:47:59 +0000 2018,@bgarlinghouse Congratulations @Ripple 🎉👏🌍 another milestone reached. This is all very impressive and exciting. Mad… https://t.co/8xxhE30XWv,0
