Wed Aug 01 23:33:30 +0000 2018,X-Wing: Wave 2 (Resistance and First Order). Full fledged factions. New ships include RZ2 A-Wing  Mining Guild TIE Fighter,0
Wed Aug 01 16:53:46 +0000 2018,Federal mine safety agency holding input meetings around US BECKLEY  https://t.co/OGjDD0vopR. (AP) â€” The federal… https://t.co/5NIyfb4JVF,0
Wed Aug 01 15:57:22 +0000 2018,Beverage Turned Bitcoin Mining Company Long Blockchain Moves into Loyalty Market https://t.co/36AiMqEBQV,0
Wed Aug 01 15:52:19 +0000 2018,https://t.co/9DUerg6MQy,0
Wed Aug 01 15:32:21 +0000 2018,Looking forward to the future of cars  which is of course Go-Karts https://t.co/RKeckBK6K3,0
Wed Aug 01 14:00:00 +0000 2018,As promised  another shot from the GunsmokeRP server!  The landscape is very detailed  and even includes some reall… https://t.co/5QzgGirkNK,0
Wed Aug 01 13:20:08 +0000 2018,Nice name  @trendlabs. We're #Incredibles fans  too. :-)  New Underminer Exploit Kit Delivers Bootkit and Cryptocur… https://t.co/rtxagkD3eO,0
Wed Aug 01 11:11:44 +0000 2018,Google Bans Cryptocurrency Mining Apps from Play Store | 4 Minute Crypto News: https://t.co/MZ7BBMZKyh via @YouTube,0
Wed Aug 01 10:52:13 +0000 2018,Check out what I found on eBay &gt;&gt; #9711 #currency #Save BIOSTAR AMD Radeon RX 580 8GB GDDR5 MINING C... https://t.co/h3Mnh8y0Za,0
Wed Aug 01 10:44:42 +0000 2018,Federal mine safety agency holding input meetings around US BECKLEY  https://t.co/OGjDD0vopR. (AP) â€” The federal… https://t.co/2NNs7vpiB8,0
Wed Aug 01 10:27:38 +0000 2018,Federal mine safety agency holding input meetings around US The federal agency that oversees mining safety is holdi… https://t.co/CKRw6hZkBT,0
Wed Aug 01 10:15:39 +0000 2018,Get wired up! Schneider Electric NAM is hiring for Solution Architect - Mining  Metals &amp; Minerals Segment. Learn mo… https://t.co/7tuJX9Ybog,1
Wed Aug 01 06:58:00 +0000 2018,Love the way the farm glows when the lights are off 👀💚  $ETH $ZEC $LTC $BTC #mining365 #nmt #neominetech #Mining… https://t.co/6JB6nB26BB,1
Wed Aug 01 03:03:42 +0000 2018,Bitcoin mining!!!! Join now 1btc=$8 199.20 With affordable amount of investment  you can earn 1btc in 3weeks. https://t.co/SvCdLnGrBG,0
Wed Aug 01 03:03:24 +0000 2018,Bitcoin mining!!!! Join now 1btc=$8 199.20 With affordable amount of investment  you can earn 1btc in 3weeks. https://t.co/ZZiDcdYemH,0
Wed Aug 01 03:02:40 +0000 2018,Bitcoin mining!!!! Join now 1btc=$8 199.20 With affordable amount of investment  you can earn 1btc in 3weeks. https://t.co/5Fn1vcVLjO,0
Wed Aug 01 02:10:39 +0000 2018,Get wired up! Schneider Electric NAM is hiring for Solution Architect - Mining  Metals &amp; Minerals Segment. Learn mo… https://t.co/7tuJX9Ybog,1
