Wed Dec 05 19:42:04 +0000 2018,Bitcoin mining is necessary  not wasteful  and even superior to the alternatives.   Read everything here and in thi… https://t.co/K5A3wy70lq,0
Wed Dec 05 18:47:26 +0000 2018,Bitcoin Mining Rig-Maker Holds 'Fire-Sale' After Hash-Rate Collapses Again | Zero Hedge https://t.co/OLaHc5bohv,0
Wed Dec 05 16:24:11 +0000 2018,I would love to try this #internalaudit #processmining #datavisualization https://t.co/X3JWhUfrd0,0
Wed Dec 05 15:15:35 +0000 2018,In our project a very important role is played by stable energy consumption. Mining of the cryptocurrency ensures c… https://t.co/qgYuwuBJrW,0
Wed Dec 05 10:28:34 +0000 2018,Surveying is not dying out  but rather branching into other streams. #GeoShack #Mining #LandSurveying… https://t.co/HGRlFp6f5J,1
Wed Dec 05 06:54:01 +0000 2018,#bitcoin mining map https://t.co/bKanRSs1yL paypal green dot not working,0
Wed Dec 05 03:26:06 +0000 2018,Surveying is not dying out  but rather branching into other streams. #GeoShack #Mining #LandSurveying… https://t.co/HGRlFp6f5J,1
Wed Dec 05 00:37:01 +0000 2018,The @Coinmine One. Plug &amp; play mining  lightning node  staking and more. This device can run anywhere with WiFi and… https://t.co/5cS6mjqBvI,3
Wed Dec 05 00:31:50 +0000 2018,The @Coinmine One. Plug &amp; play mining  lightning node  staking and more. This device can run anywhere with WiFi and… https://t.co/JJ5PZ6b0RD,1
Wed Dec 05 00:30:06 +0000 2018,Email us @ https://t.co/OHHpWvEREN if you are looking for power deals for your #cryptomining operations  #bitcoin … https://t.co/QuBVpXW7ef,0
Wed Dec 05 00:09:05 +0000 2018,Data Mining Book – Chapter Download https://t.co/u3e2OOXB0r,0
