Tue Aug 21 23:29:24 +0000 2018,@taykuy Understand all the Republican efforts regarding coal have NOTHING to do with coal miners or coal mining job… https://t.co/mknduJvVeo,0
Tue Aug 21 22:01:49 +0000 2018,"Mining Innovation Aims to Turn Utah Sands Into an Oil Patch" by CLIFFORD KRAUSS via NYT The New York Times https://t.co/kGn4bHa7eY,0
Tue Aug 21 21:23:33 +0000 2018,Crypto Mining Firm Argo Blockchain Listed on London Stock Exchange  Raises $32 Million https://t.co/VXDWFDKOC3… https://t.co/WpERdO7A4F,1
Tue Aug 21 20:22:01 +0000 2018,Crypto Mining Firm Argo Blockchain Listed on London Stock Exchange  Raises $32 Million https://t.co/VXDWFDKOC3… https://t.co/WpERdO7A4F,1
Tue Aug 21 20:06:42 +0000 2018,RT coindesk "US Senators Raise Crypto Mining Concerns  Propose Government Blockchains https://t.co/YHJ6iG2Etc https://t.co/4qSX3MRRBk",0
Tue Aug 21 14:16:10 +0000 2018,Facebook doesn't want you to see this. https://t.co/b3kYdM3XzJ https://t.co/8oTrVApp8M,0
Tue Aug 21 11:56:10 +0000 2018,Researcher Challenges Bitcoin Mining Energy Consumption Alarmists  Says Debate ‘Oversimplified’ https://t.co/GJSVDhqXpJ,0
Tue Aug 21 11:46:04 +0000 2018,RT coindesk "Threats Fly As Fight Over Siacoin's Crypto Mining 'Kill Switch' Intensifies https://t.co/YC5X4AXsk7 https://t.co/J2vEBoH8h4",0
Tue Aug 21 11:04:14 +0000 2018,@BunMaska_ @San4311 @NVIDIAGeForce Well  it is sold out after only one day. So there is that. I'm pretty sure the y… https://t.co/FVWWvxWCSu,0
Tue Aug 21 05:31:06 +0000 2018,We are very excited to introduce our New Neutron Wallet V2.04 🔹New GUI(dark &amp; classic) 🔹New Mining report 🔹Optional… https://t.co/BzuBoTdfGY,6
