Wed Aug 29 22:19:05 +0000 2018,We are very excited to introduce our New Neutron Wallet V2.04 🔹New GUI(dark &amp; classic) 🔹New Mining report 🔹Optional… https://t.co/BzuBoTdfGY,11
Wed Aug 29 21:22:13 +0000 2018,Check out what I found on eBay &gt;&gt; #7470 #Save #mining EVGA GeForce GTX 980 Ti 6GB Superclocked Gamin... https://t.co/Rx9J0YVCFj,0
Wed Aug 29 17:05:29 +0000 2018,RT coindesk "Crypto Mining Attacks Soar in First Half of 2018 https://t.co/HUEjIZz8gO https://t.co/iOwDyLZHqM",0
Wed Aug 29 16:33:10 +0000 2018,@fustbariclation @CamSemantics No. It runs locally for the simulation. Nodes are modeled since it's not multi threa… https://t.co/N7kYILXlp8,0
Wed Aug 29 10:20:07 +0000 2018,Why Your Identity Must Now Be Verified To Buy ASIC Miners https://t.co/nM6SjZcIqQ https://t.co/tsqtQPUVET,0
Wed Aug 29 09:23:00 +0000 2018,We are very excited to introduce our New Neutron Wallet V2.04 🔹New GUI(dark &amp; classic) 🔹New Mining report 🔹Optional… https://t.co/BzuBoTdfGY,11
