Fri Feb 23 23:43:56 +0000 2018,Support for #Dart and #Flutter in Visual Studio Code just continues to get better  thanks to heavy investment from… https://t.co/wf5OfJTN48,2
Fri Feb 23 23:29:18 +0000 2018,Support for #Dart and #Flutter in Visual Studio Code just continues to get better  thanks to heavy investment from… https://t.co/wf5OfJTN48,2
Fri Feb 23 23:28:57 +0000 2018,Time to do some research on where your investment company is putting your 401k money. Call your investment firm and… https://t.co/PNaeCGceVl,0
Fri Feb 23 23:28:42 +0000 2018,Support for #Dart and #Flutter in Visual Studio Code just continues to get better  thanks to heavy investment from… https://t.co/wf5OfJTN48,2
Fri Feb 23 23:00:28 +0000 2018,I take profits along the way so a downswing doesn’t hurt that bad. I often take my original investment out once it… https://t.co/8UkBvMiBtc,0
Fri Feb 23 22:58:59 +0000 2018,Mortgage rates are beginning to rise.  Lock in on a home this year! #Elevate #Seattle #realestate #investment… https://t.co/auK6g3AzOg,0
Fri Feb 23 22:58:59 +0000 2018,Mortgage rates are beginning to rise.  Lock in on a home this year! #Elevate #Seattle #realestate #investment… https://t.co/6Cta4IR4WS,0
Fri Feb 23 22:58:53 +0000 2018,@icterid I know. There are investment companies that only do ethical investing. Stocks friendly to the environment  workers rights  etc.,1
Fri Feb 23 22:52:46 +0000 2018,Invest in what you know. We're an angel investment service built by doctors  for doctors. Join for free! https://t.co/vMNFfsqy00,15
Fri Feb 23 22:38:34 +0000 2018,Art investment #okvideo https://t.co/XZMrucKICy,2
Fri Feb 23 22:38:18 +0000 2018,Warren Buffet makes the key point about a decision like Gartman’s investment in Riot in this way: “Risk comes from… https://t.co/nKMMJmdfTZ,4
Fri Feb 23 22:29:12 +0000 2018,The Economic Support For Culture The UK Will Lose With Brexit:   Around 1 385 arts and cultural projects received a… https://t.co/rCA3xeFD9h,1
Fri Feb 23 22:04:07 +0000 2018,The Economic Support For Culture The UK Will Lose With Brexit:   Around 1 385 arts and cultural projects received a… https://t.co/rCA3xeFD9h,1
Fri Feb 23 21:44:27 +0000 2018,@washingtonpost why don't we all have lawyers and accountants making our investment decisions?,0
Fri Feb 23 21:44:21 +0000 2018,For people with a 401(k) retirement plan  make sure to call your investors and demand investment of your retirement… https://t.co/PiH8SMsCo7,0
Fri Feb 23 21:42:28 +0000 2018,@danpfeiffer Also for people with a 401(k) retirement plan  make sure to call your investors and demand investment… https://t.co/toJf6DkMv6,0
Fri Feb 23 21:05:06 +0000 2018,"There is a huge amount of support for that scale of investment and there is a lot of momentum building " -… https://t.co/QJ74JytB0l,0
Fri Feb 23 20:00:06 +0000 2018,Major takeaway from #ICNY18: The future for #RealEstate #tech investments is bright &amp; thriving.… https://t.co/VtRkwvrqEH,0
Fri Feb 23 19:08:38 +0000 2018,This is a great opportunity to pitch your startup and earn some investment action. https://t.co/pfKoBWzw5p,0
Fri Feb 23 18:40:13 +0000 2018,Why @LUIPrize and other funders are embracing #landrights to fight poverty: https://t.co/wWQKo3tSgt @TimHanstad… https://t.co/z7iMuVmvrf,0
Fri Feb 23 18:24:15 +0000 2018,If we all threw our problems in a pile and saw everyone else's  we'd grab ours back. #growth #motivation… https://t.co/cspru4dYel,0
Fri Feb 23 18:23:14 +0000 2018,Art investment #okvideo https://t.co/XZMrucKICy,2
Fri Feb 23 18:13:11 +0000 2018,Investment advisor Financial Engines cut costs by 90% by moving their core platform to a serverless architecture po… https://t.co/PcdlWGrnbk,9
Fri Feb 23 18:02:01 +0000 2018,Art investment #okvideo https://t.co/XZMrucKICy,2
Fri Feb 23 17:47:00 +0000 2018,Mazor Robotics Flips to Profitability https://t.co/Iq7xfRE6EH via .@madisondotcom #RoboticSurgery #Health #Robotics #Stocks .@MazorRobotics,0
Fri Feb 23 17:45:18 +0000 2018,Investment with Impact: Our 2017 Year in Review: https://t.co/NZ4SXKSbgL #landrights #womensland https://t.co/Y3fccJBq3C,0
Fri Feb 23 17:25:08 +0000 2018,In 2005  Birmann was fined the equivalent of $91 million by Brazilian regulators for bilking shareholders of an inv… https://t.co/3KyB2krRcU,0
Fri Feb 23 17:25:08 +0000 2018,Taurus was founded 77 years ago.  It earns roughly two-thirds of its gun revenue in the United States. 87 percent o… https://t.co/b6Yuq6KVId,0
Fri Feb 23 17:20:56 +0000 2018,*Opens @polina_marinova's newsletter*  *SCREAMS*  https://t.co/wROKxvTVgf,2
Fri Feb 23 17:18:17 +0000 2018,*Opens @polina_marinova's newsletter*  *SCREAMS*  https://t.co/wROKxvTVgf,2
Fri Feb 23 16:59:42 +0000 2018,@M1ke_Sun It’ll be a shock to your system  so I very much support this investment,0
Fri Feb 23 16:37:07 +0000 2018,Home buyers have a way to fund the down payment on a home purchase  and this doesn't require borrowing more. The Ri… https://t.co/R3P5KYKmMn,0
Fri Feb 23 16:33:24 +0000 2018,It’s about the money  but it’s not really about the money.  Currency is a world wide symbol of independence  power … https://t.co/pusNLusppP,0
Fri Feb 23 16:26:49 +0000 2018,*Opens @polina_marinova's newsletter*  *SCREAMS*  https://t.co/wROKxvTVgf,2
Fri Feb 23 16:23:37 +0000 2018,This sounds like a great idea. And for $129  a sound investment. https://t.co/JKBVexJVi5,0
Fri Feb 23 16:18:54 +0000 2018,The New Tax Law Has Made It a Great Time to Invest in Real Estate. Here's How to Get the Most From Your Investment.… https://t.co/5f6DpRsWHh,0
Fri Feb 23 16:06:52 +0000 2018,The New Tax Law Has Made It a Great Time to Invest in Real Estate. Here's How to Get the Most From Your Investment. https://t.co/jT5c7VG4cJ,0
Fri Feb 23 15:27:34 +0000 2018,@StevenLoi Yeah. The nice thing is they are allowing investment in growth to accommodate  both real estate and pub transport.,0
Fri Feb 23 14:58:40 +0000 2018,The ROI of converting class-B buildings to class-A buildings: https://t.co/P8yN9zhc5M #multifamily https://t.co/LZTiTfDwZp,0
Fri Feb 23 14:57:18 +0000 2018,Why StateCoins/Kleptocurrency is a bad idea &amp; bad investment: They are likely to have at most just ONE of these thr… https://t.co/Jh2pskbrey,0
Fri Feb 23 14:25:31 +0000 2018,Hypergiant Launches Investment Fund and AI Solutions Incubator https://t.co/ohq7JHuu8d https://t.co/Ovb6OpzB1l,0
Fri Feb 23 13:19:05 +0000 2018,@doumenzi What credible investment analyst actually values $BABA based on book equity?,0
Fri Feb 23 13:17:38 +0000 2018,Learning is the single best investment of our time that we can make. Knowledge is the new money. https://t.co/QBlOjtOqmS,1
Fri Feb 23 12:26:45 +0000 2018,Exclusive: Investment star Alan Howard’s comeback hits headwind   #SwampWatch #MyPresident #LockHerUp #MAGA… https://t.co/6N3k7N9CtM,0
Fri Feb 23 12:05:55 +0000 2018,Investment advisor Financial Engines cut costs by 90% by moving their core platform to a serverless architecture po… https://t.co/PcdlWGrnbk,9
Fri Feb 23 11:42:04 +0000 2018,Investment advisor Financial Engines cut costs by 90% by moving their core platform to a serverless architecture po… https://t.co/mlcNi3Wz0K,0
Fri Feb 23 11:27:58 +0000 2018,#Hedgefunds Employ #AI To Redefine The #trading Business https://t.co/wSFrs6fizE via @digitalistmag  #finance… https://t.co/ugFSf8f8sR,2
Fri Feb 23 11:07:03 +0000 2018,@anneapplebaum @MalcolmNance And his enormous debt to #Russian and #Chinese investment banks and dubious investors… https://t.co/yDdyA5fYCf,0
Fri Feb 23 10:59:05 +0000 2018,China prosecuting tycoon who considered Kushner investment https://t.co/cRTZUFaXQZ,0
Fri Feb 23 10:57:29 +0000 2018,Our $1 billion clean energy investment fund @btenergy is moving full steam ahead. This is where we will focus our i… https://t.co/Z6tF8tenQY,1015
Fri Feb 23 10:34:26 +0000 2018,RT @borealsongbird: Canada is aiming to protect at least 17% of its lands by 2020  but doing so will require a larg… https://t.co/U6W1Tixmdi,6
Fri Feb 23 09:00:20 +0000 2018,Jeff Bezos' $42 000 000 investment yields fruit https://t.co/iZEs54o6Dz,1
Fri Feb 23 08:40:54 +0000 2018,Thank you @Pitchbook for recognizing us as the most active investor in female founded #startups in #Seattle !… https://t.co/DPAasX6iZF,13
Fri Feb 23 08:39:58 +0000 2018,Thank you @Pitchbook for recognizing us as the most active investor in female founded #startups in #Seattle !… https://t.co/DPAasX6iZF,13
Fri Feb 23 08:25:26 +0000 2018,Edgemoor Investment Advisors Inc. Trims Stake in #Boeing Co (NYSE:BA) - The Ledger Gazette : https://t.co/PmFzlyyZWW,0
Fri Feb 23 08:04:19 +0000 2018,Watch out for this investment hogwash https://t.co/Moe1B5IN0Q,0
Fri Feb 23 08:04:16 +0000 2018,China prosecuting tycoon who considered Kushner investment https://t.co/iSgyqBpGtM,0
Fri Feb 23 06:09:00 +0000 2018,Silicon Valley Explores A New Investment: Your Home https://t.co/zqRVPTAA09,0
Fri Feb 23 05:33:22 +0000 2018,Get a hands-on demo and learn how to get more from Sage and your spend management investment with eRequester. Join… https://t.co/wD2ei88Njb,1
Fri Feb 23 04:35:57 +0000 2018,Arrowgrass Capital Partners LP Decreased #Boeing Co (Put) (BA) Position by $6.74 Million as Market Valuation Rose .… https://t.co/UxLCZoxZKe,0
Fri Feb 23 03:36:23 +0000 2018,Investment advisor Financial Engines cut costs by 90% by moving their core platform to a serverless architecture po… https://t.co/PcdlWGrnbk,9
Fri Feb 23 03:19:28 +0000 2018,Investment advisor Financial Engines cut costs by 90% by moving their core platform to a serverless architecture po… https://t.co/PcdlWGrnbk,9
Fri Feb 23 02:13:42 +0000 2018,Invest in what you know. We're an angel investment service built by doctors  for doctors. Join for free! https://t.co/vMNFfsqy00,15
Fri Feb 23 02:11:49 +0000 2018,Want an exciting career in #realestate with a dynamic global investment firm? Call us today to inquire! NAREIG.us http://t.co/85A6tUz5uU,3
Fri Feb 23 01:46:59 +0000 2018,Jeff Bezos' $42 000 000 investment yields fruit https://t.co/iZEs54o6Dz,1
Fri Feb 23 01:37:05 +0000 2018,@cgeneral19 No  what would be the death is- the @MannKindCorp execs playing musical chair  and not focusing on the… https://t.co/rxdZbbd3v2,0
Fri Feb 23 01:12:48 +0000 2018,Investment Governance Approval Boards PMOs Project Plans Milestones Burndown charts Velocity  Performance Reviews a… https://t.co/X3uWEFgghk,1
Fri Feb 23 01:08:02 +0000 2018,Historically  the U.S. has dedicated only about 1 percent of the federal budget to foreign aid. Even that small inv… https://t.co/tLkd2DRbdg,78
Fri Feb 23 00:33:53 +0000 2018,Invest in what you know. We're an angel investment service built by doctors  for doctors. Join for free! https://t.co/vMNFfsqy00,15
Fri Feb 23 00:17:52 +0000 2018,Investment Governance Approval Boards PMOs Project Plans Milestones Burndown charts Velocity  Performance Reviews a… https://t.co/X3uWEFgghk,1
Fri Feb 23 00:00:41 +0000 2018,U.S. arrests operator of shuttered bitcoin investment platform #weexchange #bitcoin #hack https://t.co/lhSohUw2dl,0
