Thu Jun 07 23:53:47 +0000 2018,Communications -  https://t.co/4njHMHJ8hj Transportation is a sound investment.,0
Thu Jun 07 23:12:46 +0000 2018,Get financial advice first  then investment advice  says Morningstar's Christine Benz https://t.co/wSMexumivt,0
Thu Jun 07 23:06:04 +0000 2018,We are honored to be at today's @ChildrnAlliance Voices for Children lunch! The message of the event is about build… https://t.co/lYxhLPcA3J,0
Thu Jun 07 23:04:15 +0000 2018,Interested in a #job in #Seattle  WA? This could be a great fit: https://t.co/zy0yTX5u9I #Sales #Hiring #CareerArc,0
Thu Jun 07 23:00:08 +0000 2018,You're describing what it means to be a supporter. The amount of work that it takes to  even  just practice with ou… https://t.co/c5b92a6WUx,1
Thu Jun 07 22:46:29 +0000 2018,@demokopat Plis it's money I need for self-investment.,0
Thu Jun 07 22:39:21 +0000 2018,"Internet service providers spent millions of dollars lobbying the Federal Communications Commission to end net neu… https://t.co/AIBqkfUq2C,2
Thu Jun 07 22:25:02 +0000 2018,Kudos @LisaDMyers on such a wise investment https://t.co/67Voi3lRPW,0
Thu Jun 07 22:20:39 +0000 2018,Why @randfish avoided VC and made his investment documents public for new Seattle startup SparkToro  which just rai… https://t.co/eKIcEbKUO0,0
Thu Jun 07 22:19:34 +0000 2018,@fancysandwiches Cost per lead  that's amazing investment. What kind of phone. I want to do a real product that sells leads for $0.25/each,0
Thu Jun 07 22:00:52 +0000 2018,Mike takes a look at his own #Investment strategy from a mile high view: https://t.co/RUMLVJMbHx #podcast,0
Thu Jun 07 22:00:37 +0000 2018,Mike takes a look at his own #Investment strategy from a mile high view: https://t.co/5lqO0Nxxwk #podcast,0
Thu Jun 07 21:44:29 +0000 2018,It is always exciting when you find yourself in the @seattletimes! https://t.co/P4nhsbVedn   Thanks for the great c… https://t.co/CDWTnAq6aJ,4
Thu Jun 07 21:19:19 +0000 2018,Jeff Bezos has a significant seed donation from his family  and a strong professional network from his investment days.,1
Thu Jun 07 21:14:45 +0000 2018,Bloomberg Philanthropies and partners have announced a $70 million  investment in the American Cities Climate Chall… https://t.co/Yhbkd5NvM9,0
Thu Jun 07 21:09:57 +0000 2018,Why Rand Fishkin avoided VC and made his investment documents public for new startup SparkToro https://t.co/H1naUUoUDS,4
Thu Jun 07 20:31:27 +0000 2018,@jonrog1 Question is: Do they also look at the industry failure rate? 🤔  If you have a monster hit game  the $ are… https://t.co/tk5fTiGbQP,0
Thu Jun 07 20:14:41 +0000 2018,Grateful to @ProfOsinbajo for his initiative in convening the National Economic Council on investment in people—and… https://t.co/vZ70pEUZ2k,2816
Thu Jun 07 20:07:38 +0000 2018,Why Rand Fishkin avoided VC and made his investment documents public for new startup SparkToro https://t.co/H1naUUoUDS,4
Thu Jun 07 20:01:09 +0000 2018,Japan’s Gumi launches $30 million global blockchain investment fund #entrepreneur https://t.co/twOwUvbnMz (Want thi… https://t.co/MUkhERwFX8,0
Thu Jun 07 19:54:31 +0000 2018,CRUSH your investment goals with Hillstone Capital 😇😎 Your best days are ahead! #growth #motivation #hustlehard… https://t.co/vTpd62uyRm,0
Thu Jun 07 19:46:32 +0000 2018,Why Rand Fishkin avoided VC and made his investment documents public for new startup SparkToro https://t.co/H1naUUoUDS,4
Thu Jun 07 19:46:01 +0000 2018,Why Rand Fishkin avoided VC and made his investment documents public for new startup SparkToro https://t.co/H1naUUoUDS,4
Thu Jun 07 19:32:02 +0000 2018,Don’t forget ladies tomorrow night! This event will be life transforming.   Husbands  do all you can to help your w… https://t.co/y5cxqt3mXO,0
Thu Jun 07 19:25:01 +0000 2018,@WerderKyle a 27-year-old with 40 in 70 in a better league seems like a really good signing for a $10m investment,0
Thu Jun 07 19:16:33 +0000 2018,We are honored to be at today's @ChildrnAlliance Voices for Children lunch! The message of the event is about build… https://t.co/lYxhLPcA3J,0
Thu Jun 07 19:00:46 +0000 2018,Philadelphia may serve as a national model on fighting childhood obesity. @ImpactSP2 tells us what we can all learn… https://t.co/YbpzYmKe0o,1
Thu Jun 07 18:48:33 +0000 2018,"Internet service providers spent millions of dollars lobbying the Federal Communications Commission to end net neu… https://t.co/AIBqkfUq2C,2
Thu Jun 07 18:45:45 +0000 2018,The company offers a great profit in replacing your investment! #Velox @Velox_Coin https://t.co/kIWPrDvklu,0
Thu Jun 07 18:20:23 +0000 2018,Find out why AI and IoT are leading the charge in Enterprise-level investments in 2018: https://t.co/SHjL50fqRs… https://t.co/H7Z2krlQ4D,1
Thu Jun 07 18:13:28 +0000 2018,@robzon @WeathermanIam @brucefenton Ironically  based on the reasoning he lays out against Ravencoin  early investm… https://t.co/YVJxwBZu4G,0
Thu Jun 07 18:09:25 +0000 2018,"Boeing says Kittyhawk’s software will support the development of a traffic management system that allows piloted a… https://t.co/wt6IbywXnC,2
Thu Jun 07 18:03:23 +0000 2018,Masonry Saw Cutting Equipment Market 2018 by manufacturers  Investment Feasibility  cost ... #Masonry https://t.co/MhdAFQZblR,0
Thu Jun 07 18:00:54 +0000 2018,"Boeing says Kittyhawk’s software will support the development of a traffic management system that allows piloted a… https://t.co/wt6IbywXnC,2
Thu Jun 07 18:00:01 +0000 2018,Find out why AI and IoT are leading the charge in Enterprise-level investments in 2018: https://t.co/SHjL50fqRs… https://t.co/H7Z2krlQ4D,1
Thu Jun 07 17:52:46 +0000 2018,Why Rand Fishkin avoided VC and made his investment documents public for new startup SparkToro https://t.co/dpFyozvQKj via @GeekWire,0
Thu Jun 07 17:52:04 +0000 2018,If you have funding  or if you're an established organization  you need to understand that you get what you pay for… https://t.co/L4PexW0kbb,0
Thu Jun 07 17:43:02 +0000 2018,Why Rand Fishkin avoided VC and made his investment documents public for new startup SparkToro https://t.co/H1naUUoUDS,4
Thu Jun 07 17:31:12 +0000 2018,"Internet service providers spent millions of dollars lobbying the Federal Communications Commission to end net neu… https://t.co/AIBqkfUq2C,2
Thu Jun 07 17:28:06 +0000 2018,"Fotiadis' third major client was the Silk Road Group  a Tbilisi-based private investment company led by CEO George… https://t.co/a9VZGZFcvG,0
Thu Jun 07 17:27:07 +0000 2018,Can you recommend anyone for this #job? Investment Consultant - Lynnwood  WA - https://t.co/JvtdDQsiOe #Finance… https://t.co/8E2SRsFcsv,0
Thu Jun 07 17:26:15 +0000 2018,.@ELROLONW also speculates the transfer fee would be between 4-5 million. That  in addition to his salary  would ce… https://t.co/vPnYEzWZQS,1
Thu Jun 07 17:26:07 +0000 2018,Plus Investment USA Spends $32.5MM for Chromer Building on Downtown Seattle Development Site -… https://t.co/lBERvDBfxz,0
Thu Jun 07 17:08:44 +0000 2018,.@ELROLONW also speculates the transfer fee would be between 4-5 million. That  in addition to his salary  would ce… https://t.co/vPnYEzWZQS,1
Thu Jun 07 16:32:10 +0000 2018,An important reminder as we head toward @theGFF replenishment: “It’s not just a smart investment  it’s also sustain… https://t.co/eZUNK4QIfn,7
Thu Jun 07 16:20:46 +0000 2018,Buffett and Dimon urge end to quarterly profit forecasts. And they're right. Long term investment can really help a… https://t.co/IklUpuLkXr,0
Thu Jun 07 16:03:30 +0000 2018,@MrHodl @GARY_J_poker @brucefenton @ArminVanBitcoin @WeathermanIam @busybosscrypto @fluffypony @SatoshiLite Your cr… https://t.co/BWO88Xz3CM,0
Thu Jun 07 16:00:27 +0000 2018,"You being belligerently unconvinced of something isn't an area of emotional investment for me. Hence  no argument.… https://t.co/626tFnye6u,0
Thu Jun 07 15:50:44 +0000 2018,This single investment in a single tech company which is “aggressively hiring” in Seattle is alone double what Seat… https://t.co/DkFD2Ku2Vm,3
Thu Jun 07 15:46:58 +0000 2018,This single investment in a single tech company which is “aggressively hiring” in Seattle is alone double what Seat… https://t.co/DkFD2Ku2Vm,3
Thu Jun 07 15:45:48 +0000 2018,This single investment in a single tech company which is “aggressively hiring” in Seattle is alone double what Seat… https://t.co/DkFD2Ku2Vm,3
Thu Jun 07 15:40:00 +0000 2018,@SenTomCotton How does it create more jobs? Your link doesn't address that. Or were you just making that up?  Also … https://t.co/n1JRqmbOab,0
Thu Jun 07 15:29:25 +0000 2018,BofA is tapping the brakes on risk  prompting some bankers to leave the investment bank https://t.co/YI8ub9mIud via @markets,0
Thu Jun 07 15:28:56 +0000 2018,@skamille I agree with this thread  though I'm frustrated by what I think is lack of investment and value in verbal… https://t.co/qJYkRuIicY,0
Thu Jun 07 15:00:05 +0000 2018,To push forward the real estate industry  JLL has created a $100 million investment fund for real estate technology… https://t.co/Qoili4kHih,0
Thu Jun 07 14:44:58 +0000 2018,These investment apps that get you like 0.16% returns are sooooo dumb.,0
Thu Jun 07 14:28:41 +0000 2018,@benchrisseb @DiversityAndCmx When is the last time that investment paid off? Also  wasnt nostalgia and investment… https://t.co/ZJWqId9SrX,0
Thu Jun 07 14:26:23 +0000 2018,2 days from @WTIA and @IVinvents' panel about flipping the startup investment model to catapult ideas into reality… https://t.co/mnjdxBYptF,4
Thu Jun 07 14:18:09 +0000 2018,@gobackto2008 The part of this I actually consider bad will be lack of investment in domestic solar production so w… https://t.co/g5daIfUdhQ,0
Thu Jun 07 14:17:46 +0000 2018,2 days from @WTIA and @IVinvents' panel about flipping the startup investment model to catapult ideas into reality… https://t.co/mnjdxBYptF,4
Thu Jun 07 13:26:04 +0000 2018,@billy_barnes Those are the ones! We had those as a kid  too. And then they became my customer. Joked with my mom t… https://t.co/4ERasgFWJh,0
Thu Jun 07 13:15:43 +0000 2018,Ethiopia to allow private investment in key state owned enterprises. https://t.co/OsWR2CU70F,1
Thu Jun 07 07:41:28 +0000 2018,Idea for #EPA head #Pruitt. Instead of using gov aids to check out his Chick-Fil-A investment  let's put him in cag… https://t.co/ee9cZHesHw,3
Thu Jun 07 07:30:41 +0000 2018,As a person who grew up poor from a poor family  I feel like not learning/not having access to the secret magic kno… https://t.co/V2U5mnxM7L,8
Thu Jun 07 07:16:00 +0000 2018,Climate Adaptation Finance Update: Banks  Stakeholders Link Investment Decisions with Climate Change Uncertainties… https://t.co/FRWwjgmZqT,0
Thu Jun 07 05:35:01 +0000 2018,@transitrunner I'll even pay for these hypothetical future giant printing costs. Well worth the investment IMO.,0
Thu Jun 07 05:00:18 +0000 2018,Satya Nadella announces $75 million investment in computer science education [hashtags] - https://t.co/IKqyDfsdMy https://t.co/rK0iZ8FAIf,0
Thu Jun 07 04:56:38 +0000 2018,Ethiopia to allow private investment in key state owned enterprises. https://t.co/OsWR2CU70F,1
Thu Jun 07 04:35:04 +0000 2018,Amazon reportedly ups India investment by $2 billion https://t.co/pb1AeKUoOT https://t.co/smyvInBxxy,1
Thu Jun 07 03:47:13 +0000 2018,Not too bad today. Got trapped this morning   but got out and rode the wave 🌊   $SPY Puts -31% $SPY Calls +85%   IM… https://t.co/EQ2jolMfKy,0
Thu Jun 07 03:26:29 +0000 2018,Qumulo’s technology is designed to work in local data centers or in the cloud. Right now  it is compatible with Ama… https://t.co/H7vUWT8nIg,1
Thu Jun 07 03:25:58 +0000 2018,Qumulo’s technology is designed to work in local data centers or in the cloud. Right now  it is compatible with Ama… https://t.co/H7vUWT8nIg,1
Thu Jun 07 03:01:18 +0000 2018,Japan’s Gumi launches $30 million global blockchain investment fund #entrepreneur https://t.co/h2CkX7PEmW (via Twit… https://t.co/wgA4oGlwve,0
Thu Jun 07 03:01:14 +0000 2018,Japan’s Gumi launches $30 million global blockchain investment fund #entrepreneur https://t.co/FdrDPKpPtG,0
Thu Jun 07 02:21:05 +0000 2018,An important reminder as we head toward @theGFF replenishment: “It’s not just a smart investment  it’s also sustain… https://t.co/eZUNK4QIfn,7
Thu Jun 07 02:00:17 +0000 2018,Best Interest or Disinterest—How Should We Label the Duties of an Investment Adviser? https://t.co/PtkAJCTS6Q via @perkinscoiellp,0
Thu Jun 07 01:39:47 +0000 2018,Qumulo’s technology is designed to work in local data centers or in the cloud. Right now  it is compatible with Ama… https://t.co/HqdzHExl7K,0
Thu Jun 07 01:37:23 +0000 2018,Seattle-based blockchain venture capital firm Pitha announced the filing of the very first Schedule 13D SEC filing… https://t.co/FB5JVHl03G,9
Thu Jun 07 01:19:20 +0000 2018,$SHLD still a bad investment. https://t.co/Q1Ti62Zndz,0
Thu Jun 07 00:05:52 +0000 2018,Tomorrow is the last free AngelMD Insider webinar where our investment team showcases current and upcoming investme… https://t.co/zCLbzA3RJr,3
