Mon May 21 23:42:53 +0000 2018,Trump’s investment paying off. - Supreme Court Decision Delivers Blow To Workers’ Rights - NPR https://t.co/kpBlMrgmKj,0
Mon May 21 23:36:47 +0000 2018,Apple Inc.’s support of the project may help "highlight the fact that corporate #sustainability is a well-rounded i… https://t.co/qatEmZFPBy,1
Mon May 21 23:20:53 +0000 2018,Apple Inc.’s support of the project may help "highlight the fact that corporate #sustainability is a well-rounded i… https://t.co/qatEmZFPBy,1
Mon May 21 23:18:10 +0000 2018,@somesheep A metric to me could be the result of asking them  or some movement of a metric as evidence of "that wor… https://t.co/R2GdvELSHa,0
Mon May 21 23:13:24 +0000 2018,The USA feels like one big condo association. We are in serious need of major repairs  but we can’t get quorum beca… https://t.co/aOHfLffW6m,0
Mon May 21 23:07:51 +0000 2018,Imp't prob we know too well.Issue needs to move from conversation to investment.Critical space where… https://t.co/5h0FLZAkUm,2
Mon May 21 23:02:53 +0000 2018,Imp't prob we know too well.Issue needs to move from conversation to investment.Critical space where… https://t.co/5h0FLZAkUm,2
Mon May 21 23:00:49 +0000 2018,K4NW &amp; @Element8Angels  5th Annual Impact Investment Forum. We will hear from fund managers &amp; lessons they learned … https://t.co/eZEdFyXpxl,1
Mon May 21 23:00:41 +0000 2018,@ all the guys that slide in my DMs on LinkedIn: My plan  like most women on there   is to make more money than you… https://t.co/Bts3Wvknqs,1
Mon May 21 22:41:05 +0000 2018,@ all the guys that slide in my DMs on LinkedIn: My plan  like most women on there   is to make more money than you… https://t.co/Bts3Wvknqs,1
Mon May 21 22:26:34 +0000 2018,Kaiser Permanente Announces $200MM Impact Investment  Partners with U.S. Mayors and CEOs to Address Housing Stabili… https://t.co/YrjvPCIHW7,0
Mon May 21 22:23:45 +0000 2018,Deja has experience working with blockchain and cryptocurrency security  and we're always curious about what the fu… https://t.co/lLvXYq0W7y,1
Mon May 21 22:01:34 +0000 2018,@OriginalMtGArt They are amazing! The satisfying clink of dropping a handful of treasure tokens on the table from a… https://t.co/K3jy40MYvO,0
Mon May 21 21:58:31 +0000 2018,I think the idea that "the economy" is men building stuff and operating capital equipment while (male) managers mak… https://t.co/ImJ0Zf6EIs,1
Mon May 21 21:46:51 +0000 2018,Women in the workforce  investment  and the surge in inflation in the 70s https://t.co/vgEWYniLVj https://t.co/BiVRRxrt0s,4
Mon May 21 21:45:01 +0000 2018,Women in the workforce  investment  and the surge in inflation in the 70s https://t.co/vgEWYniLVj https://t.co/BiVRRxrt0s,4
Mon May 21 21:35:19 +0000 2018,I think the idea that "the economy" is men building stuff and operating capital equipment while (male) managers mak… https://t.co/ImJ0Zf6EIs,1
Mon May 21 21:30:48 +0000 2018,Just wanted to reiterate that the causal structure is all wrong for the investment-led story. Women start joining t… https://t.co/Q1Lzp67jOQ,0
Mon May 21 21:26:35 +0000 2018,This lot is zoned Tacoma-T-Transitional  ready for your commercial  multi family  townhome SFR projects etc. No set… https://t.co/660eWAJDW1,0
Mon May 21 21:15:04 +0000 2018,The victims of 1 in 3 pedestrian deaths in Austin are homeless- could housing them save their lives? https://t.co/DE7EY7DCmD,0
Mon May 21 20:54:18 +0000 2018,Interesting to watch Epic's investment in Fortnite as an esport. It has probably the best shot yet at becoming a br… https://t.co/1OpErOyLdH,0
Mon May 21 20:50:18 +0000 2018,The SEC’s Fiduciary Rule Proposal — Implications for Investment Advisers (Part 4) https://t.co/lhyB4rqmP9 via @perkinscoiellp,0
Mon May 21 20:36:25 +0000 2018,K4NW &amp; @Element8Angels  5th Annual Impact Investment Forum. We will hear from fund managers &amp; lessons they learned … https://t.co/eZEdFyXpxl,1
Mon May 21 20:24:32 +0000 2018,@o_a_k_e_n_f_o_l Well  my primary interest has always been storytelling  but with a novel or a film you only get to… https://t.co/RGrAFVkwBe,0
Mon May 21 20:19:25 +0000 2018,The @urbaninstitute just released a new analysis of Opportunity Zones. Relatively few of the areas now eligible for… https://t.co/FmntnQdKQA,0
Mon May 21 20:17:19 +0000 2018,If you enjoy making money 24/7/365 then I would highly suggest picking up some $DEAL PC and mobile staking wallet a… https://t.co/5eKQoP1cv0,21
Mon May 21 20:04:04 +0000 2018,eToro Study: Ripple (XRP) Is the Most Popular Investment  New Male Investors Dominate Crypto Market… https://t.co/3MmBqMi6KQ,0
Mon May 21 19:44:24 +0000 2018,"Even more than what’s on the surface or what’s underneath the hood of your website  there’s one facet..."… https://t.co/Vy0UQqNhRV,0
Mon May 21 19:43:04 +0000 2018,@dangolant @kwuchu i wouldn't necessarily say they're *wrong*  but if you're talking about investment-to-uptime rat… https://t.co/fIRLlWIZWs,0
Mon May 21 19:31:39 +0000 2018,@glassbottommeg Hmm but what if the game is 100k+ words with branching choices across about 7 files. They can all b… https://t.co/xoNv5Nb66P,0
Mon May 21 19:22:37 +0000 2018,@Be_LikeIKE Great investment.,0
Mon May 21 19:18:19 +0000 2018,It's really only a good investment for Fullstream when I think about it. At least he would see SOME return on his investment.,0
Mon May 21 19:08:48 +0000 2018,Women in the workforce  investment  and the surge in inflation in the 70s https://t.co/vgEWYniLVj https://t.co/BiVRRxrt0s,4
Mon May 21 19:06:53 +0000 2018,Women in the workforce  investment  and the surge in inflation in the 70s https://t.co/vgEWYniLVj https://t.co/BiVRRxrt0s,4
Mon May 21 19:05:22 +0000 2018,Women in the workforce  investment  and the surge in inflation in the 70s https://t.co/vgEWYniLVj https://t.co/BiVRRxrt0s,4
Mon May 21 18:50:34 +0000 2018,@SchineHausen Welrod is definitely a good investment I just can't help but feel you'll get more milage out of anoth… https://t.co/ycXLTDIwwN,0
Mon May 21 18:41:44 +0000 2018,@SeattleiteJenn Especially the older we get it  i find that the hardest part is time investment. It takes awhile to… https://t.co/jBmKLAtf6F,0
Mon May 21 18:24:03 +0000 2018,For the Perfect Social-Impact Investment  Look No Further Than Cannabis - Entrepreneur https://t.co/JjhBfDi5L5 https://t.co/yRrxtYu2QL,0
Mon May 21 17:15:42 +0000 2018,I personally can't stand Fortnite  it's not my cup of tea. But this investment by Epic Games into its esports scene… https://t.co/9R0328mRE5,0
Mon May 21 17:15:16 +0000 2018,It's important to build an #impact #investment business that matters https://t.co/xKpXTE3IOg .@CapriaVC with its de… https://t.co/YdH4iLZfsD,0
Mon May 21 17:11:26 +0000 2018,Venture capital firm and #RChain Co-op ecosystem member Pithia has joined forces with local blockchain economy plat… https://t.co/AZsBYyu46l,2
Mon May 21 17:10:39 +0000 2018,If you enjoy making money 24/7/365 then I would highly suggest picking up some $DEAL PC and mobile staking wallet a… https://t.co/5eKQoP1cv0,21
Mon May 21 17:05:50 +0000 2018,Proud to receive an Investment award on behalf of @engieinsight employees! Rewarding our passion for sustainability! https://t.co/lsGWtwOslx,3
Mon May 21 16:58:23 +0000 2018,Kaiser Permanente Announces $200 Million Investment to Address Housing Stability https://t.co/U4dRsUoz5F #BeKP https://t.co/YwMihvn6R8,0
Mon May 21 16:46:57 +0000 2018,An investment in knowledge always pays the best interest. -- Benjamin Franklin,0
Mon May 21 16:26:16 +0000 2018,#SIF18 is set for NYC on Wednesday. Top seafood execs will mix and mingle with leading private equity and investmen… https://t.co/tnRx2j68VI,1
Mon May 21 16:11:16 +0000 2018,#SIF18 is set for NYC on Wednesday. Top seafood execs will mix and mingle with leading private equity and investmen… https://t.co/tnRx2j68VI,1
Mon May 21 15:57:00 +0000 2018,[Video] Agent Jane Bond wants you to know about the basics of the #bond #market. https://t.co/mMnadZ3D4M,0
Mon May 21 15:43:10 +0000 2018,Find out if you're cut out for an investment property. https://t.co/hnEzGOHH27 https://t.co/YnT5p3hopA,0
Mon May 21 15:39:45 +0000 2018,Proud to be investing in the future of #affordablehousing: Kaiser Permanente announces $200 million impact investme… https://t.co/RbruYuxn7Q,0
Mon May 21 15:22:11 +0000 2018,4 companies plan to bring new jobs  investment to state https://t.co/C7LfWlWqH5,0
Mon May 21 14:35:36 +0000 2018,My peers spend $80k in college on $40k careers. Dont frame your scam as an investment.,0
Mon May 21 14:33:15 +0000 2018,The Four Major Investment Errors To Avoid #Investing https://t.co/4d8Do2nRTs,0
Mon May 21 11:52:11 +0000 2018,For the Perfect Social-Impact Investment  Look No Further Than Cannabis https://t.co/qwUyxhuMEj,0
Mon May 21 11:35:36 +0000 2018,I read the news of the crypto world. Many companies see the prospect of ICO as an additional source of investment i… https://t.co/7Yn9PCeRzP,0
Mon May 21 11:29:38 +0000 2018,Congress and Trump are running out of time to fix a $100-billion investment in the sky  NASA auditor says… https://t.co/amJowzTj8v,0
Mon May 21 10:30:14 +0000 2018,Millions of smallholder cocoa farmers (primarily in W. Africa) collectively produce 7.2 million metric tons of… https://t.co/oCjgV7YuIN,7
Mon May 21 08:48:09 +0000 2018,If you enjoy making money 24/7/365 then I would highly suggest picking up some $DEAL PC and mobile staking wallet a… https://t.co/5eKQoP1cv0,21
Mon May 21 08:13:15 +0000 2018,If you enjoy making money 24/7/365 then I would highly suggest picking up some $DEAL PC and mobile staking wallet a… https://t.co/5eKQoP1cv0,21
Mon May 21 04:56:43 +0000 2018,If you enjoy making money 24/7/365 then I would highly suggest picking up some $DEAL PC and mobile staking wallet a… https://t.co/5eKQoP1cv0,21
Mon May 21 04:17:48 +0000 2018,@hakannakah627 For me the investment of limited water and energy resources to produce certain food products (beef … https://t.co/uPcUrxP1l7,0
Mon May 21 03:36:23 +0000 2018,@washingtonpost What's the rate of return on their "investment" with Devil Don? We'll see in November. #BlueWave2018,0
Mon May 21 03:31:04 +0000 2018,🍦 That mirror was a great investment 🍦  https://t.co/MpaZKu01dL,0
Mon May 21 03:02:20 +0000 2018,1885 Ventures is the investment arm for one of Seattle's oldest merchant families.  That launched their first ventu… https://t.co/5EjkyhoruB,0
Mon May 21 03:01:54 +0000 2018,If you enjoy making money 24/7/365 then I would highly suggest picking up some $DEAL PC and mobile staking wallet a… https://t.co/5eKQoP1cv0,21
Mon May 21 03:00:32 +0000 2018,If you enjoy making money 24/7/365 then I would highly suggest picking up some $DEAL PC and mobile staking wallet a… https://t.co/5eKQoP1cv0,21
Mon May 21 02:45:01 +0000 2018,Michael Cohen payments put spotlight on New York investment firm linked to Russian billionaire… https://t.co/qUrOmk8siY,0
Mon May 21 02:43:00 +0000 2018,@TessFowler Okay  @TessFowler   glad I took your recommendation. A+  amazing and delightful and... surprisingly emo… https://t.co/O7nzJS4gim,0
Mon May 21 02:06:26 +0000 2018,If you enjoy making money 24/7/365 then I would highly suggest picking up some $DEAL PC and mobile staking wallet a… https://t.co/5eKQoP1cv0,21
Mon May 21 01:47:07 +0000 2018,If you enjoy making money 24/7/365 then I would highly suggest picking up some $DEAL PC and mobile staking wallet a… https://t.co/5eKQoP1cv0,21
Mon May 21 01:45:14 +0000 2018,The AngelMD Q1 2018 Medtech Investment Report is now available. (Note: the Q2 report will include a lot of addition… https://t.co/0jZeOQ2AaN,4
Mon May 21 01:39:35 +0000 2018,If you enjoy making money 24/7/365 then I would highly suggest picking up some $DEAL PC and mobile staking wallet a… https://t.co/5eKQoP1cv0,21
Mon May 21 01:10:45 +0000 2018,If you enjoy making money 24/7/365 then I would highly suggest picking up some $DEAL PC and mobile staking wallet a… https://t.co/5eKQoP1cv0,21
Mon May 21 00:34:18 +0000 2018,Only a few days left until the PoE Symposium on May 23! 😁 Come and learn about applications of sustainability in va… https://t.co/feaOmUi0ij,0
