Sun Jul 29 22:51:54 +0000 2018,When you tell people to back in all the way to dock  . And they expect you to haul 100lb of furniture  with 20 feet… https://t.co/eqTbfH92vQ,0
Sun Jul 29 21:30:53 +0000 2018,Work at @citiopen is Done making a mad dash to @londonsavoy performance did YOU Beat Me There?  #artist… https://t.co/bHRmd8Ldmj,0
Sun Jul 29 20:23:38 +0000 2018,@LAM_Barrett The em dash rules — indeed  it is the best punctuation mark that exists — and you should never hold back.,0
Sun Jul 29 20:20:10 +0000 2018,Making butterbeer &amp; clotted cream recipes with a dash of booze  because my wife is worth it. #PotterHead,0
Sun Jul 29 20:13:18 +0000 2018,Yoooo o0omar415 how many time did @playboijai have to fix his ponytail last night? 😂 #DrunkPonytailProblems 💙 7-29-… https://t.co/QRcoKWVuw4,0
Sun Jul 29 19:29:48 +0000 2018,anyone else require an em dash jar when they're writing to keep said writing from devolving into what is basically… https://t.co/R2C0fTuOTL,0
Sun Jul 29 19:03:23 +0000 2018,Keep a backup plan... 😜,0
Sun Jul 29 18:34:19 +0000 2018,Tell your friends when they’re not smelling fresh! Dawg it was so many funky hoes in the club last night! 🤮🤢,0
Sun Jul 29 18:30:08 +0000 2018,Steve Mnuchin. Useful tool of Putin. Corrupt plutocrat. Worst Treasury Secretary ever. https://t.co/MV3PxvzeVa,2754
Sun Jul 29 18:29:40 +0000 2018,REMINDER: Melania Trump is in the US illegally as a result of illegally accepting money for “modeling” prior to obt… https://t.co/102u58nzpb,1362
Sun Jul 29 18:21:48 +0000 2018,Sunday cleaning is done! Now I’m hungry...,0
Sun Jul 29 18:15:35 +0000 2018,NEW: NYT uncovers Kavanaugh played key role as Staff Secretary in Bush's controversial "signing statements" where h… https://t.co/ZTh2DnvcqG,6935
Sun Jul 29 13:43:36 +0000 2018,It's a great time to be a corporate criminal. https://t.co/32Xg8THhby https://t.co/DhZHZZPyFx,40
Sun Jul 29 13:41:00 +0000 2018,You want better coverage  don’t lock kids in cages like animals. https://t.co/5ZdXutlljY,1012
Sun Jul 29 13:40:39 +0000 2018,let's just say that this is NOT a consensus view among the top Republicans on the Hill  also  as a PR matter  you d… https://t.co/2zeqaaJHl0,257
Sun Jul 29 12:56:23 +0000 2018,strong 4.1% growth under Trump in Q2 of 2018 would rank as 5th strongest Q of Obama presidency  —5.1% Q2 2014 —4.9%… https://t.co/Twr58P7bmH,26852
Sun Jul 29 12:56:18 +0000 2018,Well well! This DC On the Run concert with Jay-Z and Beyoncé is very Presidential.  Former President Obama and the… https://t.co/4gvt3FF326,1681
Sun Jul 29 12:44:39 +0000 2018,Sex-Trafficking Victim: I Was Recruited At Mar-A-Lago By Jeffrey Epstein https://t.co/GfOprlmVdX via @highbrow_nobrow,323
Sun Jul 29 12:44:35 +0000 2018,Dropping to $8.49 per bushel  soybean prices marked a ten-year low this month. https://t.co/ta3kf2KmQ8 https://t.co/aFYRNwN1x2,420
Sun Jul 29 12:15:01 +0000 2018,Also had a MOE of +/- dot dot dash dash dot STOP,0
Sun Jul 29 09:42:42 +0000 2018,Proto Retro digipak cd info here: https://t.co/0G1hsDLoXm,5
Sun Jul 29 09:37:47 +0000 2018,Scully is racing against the clock in a mad dash to the middle of nowhere to put an end to psychic babies.,0
Sun Jul 29 09:23:00 +0000 2018,If I’m up at 6:45am  I’ve been up for 24hours,0
Sun Jul 29 09:05:02 +0000 2018,It’s always a LIT situation when we link up!!! o0omar415 https://t.co/7JFL8jTjYe,0
Sun Jul 29 07:13:01 +0000 2018,@FGCFlash This reminds me of 3S. Charge buffering to be able to dash  then headbutt.  Not saying this is a positive… https://t.co/FGHpdVjNpJ,0
Sun Jul 29 05:11:18 +0000 2018,Cavan bir nefer Meksiya kocmek istedi kerpickesen qoca dash qarishiq varyoxunu malaladi,0
Sun Jul 29 04:38:42 +0000 2018,Proto Retro digipak cd info here: https://t.co/0G1hsDLoXm,5
Sun Jul 29 04:31:11 +0000 2018,“The DeWitt factory has scaled back about 80 percent of its production capacity and is moving around 90 tons of mon… https://t.co/nqMVGUJAaZ,55
Sun Jul 29 03:36:09 +0000 2018,Make sure you are familiarizing yourself with some of the new terms:  Kremlin Annex: formerly the White House  Komp… https://t.co/4i6u8H594p,2474
Sun Jul 29 03:32:37 +0000 2018,"Two Russian nationals living in Trump Tower III in Florida were arrested for running a high-end prostitution ring.… https://t.co/MOC5Xu5a2z,45
Sun Jul 29 03:27:16 +0000 2018,*my writing process*  me: this seems like a good place to put a comma  other me: no clint  put an em dash...  me: b… https://t.co/CRKelrCxsS,856
Sun Jul 29 03:04:25 +0000 2018,Proto Retro digipak cd info here: https://t.co/0G1hsDLoXm,5
Sun Jul 29 02:22:04 +0000 2018,Proto Retro digipak cd info here: https://t.co/0G1hsDLoXm,5
Sun Jul 29 02:17:35 +0000 2018,Proto Retro digipak cd info here: https://t.co/0G1hsDLoXm,5
Sun Jul 29 02:15:03 +0000 2018,@skullface And just a dash of goose blood,0
Sun Jul 29 02:11:55 +0000 2018,Trump Jr. claims GDP growth never hit 2 percent under Obama — it did 15 times https://t.co/8f1EtJFA8O https://t.co/HpunBcOybT,3070
Sun Jul 29 01:56:11 +0000 2018,#NVWG Team Challenge is new at the 38th National Veterans Wheelchair Games. This event includes swimming  powerlift… https://t.co/NQ8k1levF6,11
Sun Jul 29 01:16:04 +0000 2018,Nation-States don’t stop at phishing. They keep going until they get what they’re after.  Remember that.,16
Sun Jul 29 01:10:30 +0000 2018,Anti-Trump White House protests show no signs of stopping as they near two-week mark https://t.co/E1ZK9hBLcQ,239
Sun Jul 29 01:09:35 +0000 2018,Last night’s GOP-only request for Judge Kavanaugh's records is an attempt to evade transparency. Whether afraid his… https://t.co/xvSo09BIf0,2126
Sun Jul 29 00:58:57 +0000 2018,@SadistHailey @CaseyExplosion Colonialism and imperialism  and a dash of hating that trans women helped repeal the 8th amendment.,1
Sun Jul 29 00:23:29 +0000 2018,I added a video to a @YouTube playlist https://t.co/kFwUpS95Kc Extended Dash Dancing! (Smash Wii U/3DS),0
