Thu Aug 23 23:16:06 +0000 2018,Use this promo to become a driver for Door Dash with no cost and no commitment. https://t.co/yFdneFCSkg https://t.co/ofhDtg9hJk,0
Thu Aug 23 22:50:45 +0000 2018,Car Dashboard Camera Sony Sensor 1080P Full HD 140 Wide Angle Dash Cam 2” Display With 4 Infrared Lights  Parking M… https://t.co/S2ALeWG7wa,0
Thu Aug 23 22:14:43 +0000 2018,Trump to Fox: "flipping almost ought to be illegal. 30-40 years I've been watching flippers"  32 years ago  crime b… https://t.co/2D06FflkyT,6255
Thu Aug 23 21:57:47 +0000 2018,Everyone look under your chairs.  You get Gambit  and you get Gambit!  Gambit will be live for 24 hours starting Se… https://t.co/sVdij8EabE,309
Thu Aug 23 21:45:05 +0000 2018,ICYMI: they are closing polling places in black parts of Georgia to prevent @staceyabrams from getting elected Gove… https://t.co/HG5vrE2tw8,2354
Thu Aug 23 21:44:30 +0000 2018,Important reminder from @SenFeinstein: The committee has received 0 documents from the nonpartisan National Archive… https://t.co/N6uKtn2UT5,424
Thu Aug 23 21:37:19 +0000 2018,So weird that it appears Trump knew in advance about those hacked Podesta emails.  Seems so similar to the hacking… https://t.co/q0uDi0Vidi,341
Thu Aug 23 21:17:37 +0000 2018,Last votes! Mad dash to the airport. #jetfumes,0
Thu Aug 23 21:17:34 +0000 2018,.@RudyGiuliani if there’s a “revolt” over Trump’s impeachment  it would be a battle of *dozens* of Trumpers vs the… https://t.co/mQVfrQmK3C,80
Thu Aug 23 21:14:28 +0000 2018,@NAChristakis She communicates with aliens? Where in Malta is this skull-filled cave? Talk about a havey-cavey stor… https://t.co/WJnOGoLVek,0
Thu Aug 23 21:01:22 +0000 2018,@AugensteinWTOP @DotDashDC Great song &amp; harmony! Another future classic by Dot Dash! Love it!,0
Thu Aug 23 20:34:43 +0000 2018,can i order dick on door dash,0
Thu Aug 23 20:02:38 +0000 2018,Fine  like a ticket on the dash. ✨ https://t.co/tvRP7d1hvb,3
Thu Aug 23 20:01:49 +0000 2018,After mass shootings  the victims' families beg for sensible gun reform but Republicans say the tragedy shouldn't b… https://t.co/XVjxS2jVck,15579
Thu Aug 23 19:57:04 +0000 2018,@Malcobain I agree!!!!,0
Thu Aug 23 19:42:36 +0000 2018,@olddash Are you doing okay Dash?,0
Thu Aug 23 19:33:05 +0000 2018,Fine  like a ticket on the dash. ✨ https://t.co/tvRP7d1hvb,3
Thu Aug 23 19:27:30 +0000 2018,@Malcobain I seen it on Facebook lol I need answers ....,0
Thu Aug 23 19:25:14 +0000 2018,Really happy with draw for. My pick and my A team.  Keeks seeds are buzzernetsu Konty and Pushniacku before Pea-poj… https://t.co/EceDljwr4P,0
Thu Aug 23 19:07:24 +0000 2018,What is a soft top?,0
Thu Aug 23 18:54:07 +0000 2018,Intern's Dash To Break News Of Manafort Conviction Wins Internet https://t.co/zcSSgGwL5F https://t.co/ERlMZdayIq,0
Thu Aug 23 18:42:03 +0000 2018,Intern's Dash To Break News Of Manafort Conviction Wins Internet https://t.co/MuntQhT4ws,0
Thu Aug 23 18:36:04 +0000 2018,Intern's Dash To Break News Of Manafort Conviction Wins Internet https://t.co/8lbUrrdoHt,0
Thu Aug 23 18:34:46 +0000 2018,@b_r_i_t_n_e_y__ @JoshTheMedic I mean maybe  but it's not a canon outfit  and it's associated with RE4. She's meant… https://t.co/oz8qicdePz,0
Thu Aug 23 18:06:07 +0000 2018,@muhmentions I tweeted about door dash getting my order wrong  but I wasn't angry and KFC gave me a free meal so IDK.,0
Thu Aug 23 18:02:35 +0000 2018,@Mista_Dash Where you going,0
Thu Aug 23 17:42:34 +0000 2018,Fine  like a ticket on the dash. ✨ https://t.co/tvRP7d1hvb,3
Thu Aug 23 17:41:46 +0000 2018,Fine  like a ticket on the dash. ✨ https://t.co/tvRP7d1hvb,3
Thu Aug 23 17:02:10 +0000 2018,I need one more wild ass night before the summer is over!!!! Go out with a BANG!!!!!,1
Thu Aug 23 16:53:12 +0000 2018,Yes My type of hoe!!! https://t.co/dyKKtiKabU,1
Thu Aug 23 16:51:16 +0000 2018,@__SeannK Go to sleep hoe!,0
Thu Aug 23 16:49:14 +0000 2018,The final album of @bts_bighit’s #LoveYourself series  #LoveYourselfAnswer  comes out THIS WEEK #NewMusicFriday &amp; f… https://t.co/3ZE0IQnANQ,159070
Thu Aug 23 16:42:45 +0000 2018,pay attention to who actually takes your feelings into consideration,8368
Thu Aug 23 16:39:06 +0000 2018,@PullmanPolice do you have any dash cam video of the chase through pullman on 8/22. Post it on YouTube @KREMjen,0
Thu Aug 23 16:29:36 +0000 2018,The final album of @bts_bighit’s #LoveYourself series  #LoveYourselfAnswer  comes out THIS WEEK #NewMusicFriday &amp; f… https://t.co/3ZE0IQnANQ,159070
Thu Aug 23 16:09:14 +0000 2018,I need a birthday speedo for my trip!!!,0
Thu Aug 23 16:08:25 +0000 2018,@UrFavorite_Ex Just lay back and go for that ride!!! lol,0
Thu Aug 23 16:03:09 +0000 2018,DASH is expanding the Student Free Rides program! Beginning in September  students from T.C. Williams  Bishop Ireto… https://t.co/VzsHYqWg7Z,0
Thu Aug 23 15:56:49 +0000 2018,Cookout gone be LIT!!!!!,0
Thu Aug 23 15:56:38 +0000 2018,Birthday in 2 weeks... Flight BOOKED!!!!!,0
Thu Aug 23 15:46:16 +0000 2018,@Malcobain You got it buddy!,0
Thu Aug 23 15:36:13 +0000 2018,@KREMjen I got some dash cam video but not impressive bc it all pass in front from left to right. No head on action videos,0
Thu Aug 23 15:05:03 +0000 2018,https://t.co/hj7SqOSIpj,0
Thu Aug 23 14:52:15 +0000 2018,@UrFavorite_Ex They never stopped wearing them. I have seen them all summer up here!,0
Thu Aug 23 14:42:21 +0000 2018,@iamdi3go Okay!,0
Thu Aug 23 14:41:32 +0000 2018,@OhOkata @dash_bandy Fuck cancer! Good for you!,0
Thu Aug 23 14:39:02 +0000 2018,LMAOOOO I am super weak!!!,0
Thu Aug 23 14:33:26 +0000 2018,@iamdi3go LMAO put some down underwear on...,0
Thu Aug 23 14:23:30 +0000 2018,Good Morning Virgos!!! https://t.co/0JvdSgkFZq,0
Thu Aug 23 14:22:36 +0000 2018,@angelcwells @dleonard1991 @TooTallDerr @LosGeez @ProFootballTalk In 2008  Collins was a game manager w/ the Titans… https://t.co/RazSvA64aA,0
Thu Aug 23 14:21:22 +0000 2018,I’ll FOREVER keep it classy!! Good luck with finding another ME!,0
Thu Aug 23 14:18:04 +0000 2018,@_jusphotogenic That's good friend.,0
Thu Aug 23 14:17:37 +0000 2018,Be careful who you trust &amp; tell your problems to.. Everyone who smiles @ you is NOT your friend✌🏼💯,5
Thu Aug 23 14:14:36 +0000 2018,A lot of us need to learn how to be THANKFUL!!!! Life is too short!,0
Thu Aug 23 14:13:46 +0000 2018,@_jusphotogenic You gone try it friend?,0
Thu Aug 23 14:03:52 +0000 2018,I miss my non-sex cleanses... no sex for a year was very refreshing!!!,0
Thu Aug 23 14:00:03 +0000 2018,Stop asking for dick you can’t take !!!!!!,0
Thu Aug 23 13:44:39 +0000 2018,The Greatest Advantage Of Telling The Truth Is That You Don't Have To Remember What You Said.,2
Thu Aug 23 13:26:39 +0000 2018,@hotstuff91 VIRGO SEASON!!!!!!!,0
Thu Aug 23 13:19:57 +0000 2018,Cloud Mining. Bitcoin. Ethereum. Litecoin. Bitcoin Cash. Dogecoin. Ripple. Dash. Golem. Cardano. CureCoin. XEM. Mon… https://t.co/ZAsWdA7x1k,1
Thu Aug 23 13:09:31 +0000 2018,#VirgoSeason,2
Thu Aug 23 12:26:25 +0000 2018,@DrDash7 Good morning Dr. Dash. ^MS,0
Thu Aug 23 11:58:57 +0000 2018,We’re entering the final dash and maybe just maybe we’ll get some kind of announcement of a pre-deal with Mexico fr… https://t.co/qx0iVqut71,0
Thu Aug 23 08:54:18 +0000 2018,Bitcoin Trading And Investment Company Ever! GROW YOUR BITCOIN WITH BTC RACE Please Visit on:… https://t.co/iqBnbUA0AR,0
Thu Aug 23 08:54:08 +0000 2018,BTC Race is the first global bitcoin trading contract platform for individuals and businessman.We are doing pumping… https://t.co/XTLirq7WOz,1
Thu Aug 23 08:53:40 +0000 2018,Here you can earn 2% to 3% daily return according to your investment. Please Visit on: https://t.co/Ut2Gk8d1Yk… https://t.co/reCRivc0pq,0
Thu Aug 23 08:53:10 +0000 2018,BTC Race is the first global bitcoin trading contract platform for individuals and businessman.We are doing pumping… https://t.co/XTLirq7WOz,1
Thu Aug 23 06:41:39 +0000 2018,I liked a @YouTube video https://t.co/HRpWTZ8hIl JEV PLAYS GEOMETRY DASH DEMON LEVELS,0
Thu Aug 23 05:46:41 +0000 2018,~ When God made Eugene Choi:  ▪tons of intellect and wisdom ▪2 spoons of sarcasm hmm.. ▪tad bit of handsomeness  "o… https://t.co/XdWiSxRuTG,13
Thu Aug 23 05:32:48 +0000 2018,A healthy diet and lifestyle are your best defense in the fight against #heartdisease. Chop up some fruits and vege… https://t.co/ykZLhtI3tT,4
Thu Aug 23 05:00:51 +0000 2018,@MichaelAvenatti Busy sewing their jewels into their clothing for the mad dash to the Cayman islands before they are arrested is my guess.,0
Thu Aug 23 04:36:34 +0000 2018,@soledadobrien Oh! Oh! Spencer calls it "white genocide". But again  when it's done to ppl who are not white  say m… https://t.co/YzyoZlccCt,0
Thu Aug 23 03:54:02 +0000 2018,Anti-Trump billboard erected in New Jersey: "Our leader the idiot" https://t.co/gaZpA3x1wx https://t.co/Vss5uKQmWH,625
Thu Aug 23 03:49:58 +0000 2018,Cloud Mining. Bitcoin. Ethereum. Litecoin. Bitcoin Cash. Dogecoin. Ripple. Dash. Golem. Cardano. CureCoin. XEM. Mon… https://t.co/NCRwj15WHc,0
Thu Aug 23 03:30:36 +0000 2018,Gus has a slideshow on the dash showing selfies with all his past riders https://t.co/eGTGcvsDgM,0
Thu Aug 23 02:58:47 +0000 2018,Dame Dash gave us paid in full. I don’t ever wanna hear dame slander again.,0
Thu Aug 23 02:54:37 +0000 2018,~ When God made Eugene Choi:  ▪tons of intellect and wisdom ▪2 spoons of sarcasm hmm.. ▪tad bit of handsomeness  "o… https://t.co/XdWiSxRuTG,13
Thu Aug 23 02:29:59 +0000 2018,Manafort &amp; Cohen both lied about their finances &amp; cheated the IRS. Can you imagine what #DonTheCon must be hiding i… https://t.co/4KaPIOJk6L,8181
Thu Aug 23 02:01:05 +0000 2018,GOP operative sounds apocalyptic warning on midterms: 'The Republican Party looks like a criminal enterprise' https://t.co/ESvFwyjbGH,3009
Thu Aug 23 02:00:34 +0000 2018,For the first time  The Fact Checker labels statements by a politician to be a lie. https://t.co/wOFliDgeyh,544
Thu Aug 23 01:55:19 +0000 2018,As Trump scandals metastasize  congressional Republicans adopt a familiar  cowardly silence.   https://t.co/P3J4VgANOJ,344
Thu Aug 23 01:55:13 +0000 2018,Joining @Lawrence for @TheLastWord. If the GOP is not going to use control of Congress to hold Trump accountable  I know some folks who can.,289
Thu Aug 23 01:55:00 +0000 2018,NEW: Trump calls this White House defender ‘wonderful.’ He was fired from his previous job for sexual harassment. https://t.co/D4s8sfO2fw,633
Thu Aug 23 01:49:26 +0000 2018,If prosecutors are saying Trump Org paid  it would mean Trump lied in his May 2018 disclosure (see below) and faile… https://t.co/fyQffPdVgu,408
Thu Aug 23 01:48:28 +0000 2018,Wow: Manafort and Konstantin Kilimnik were sent to Kyrgyzstan in 2005 on Deripaska's dime  where they promoted Russ… https://t.co/43MmHLmKu5,1790
Thu Aug 23 01:46:03 +0000 2018,I interviewed Paul's father  Ron Paul  the day I resigned from RT. I can say with certainty Ron Paul was used to fu… https://t.co/2bc2FWACXz,4698
Thu Aug 23 01:44:14 +0000 2018,👇👇👇👇👇👇👇👇👇👇👇👇👇👇👇👇👇👇👇👇👇👇 https://t.co/g3rYWipohd,55
Thu Aug 23 01:39:12 +0000 2018,It's long past time for Republicans to get serious about election security and join Democrats in the fight to prote… https://t.co/hNE8QFwG4x,220
Thu Aug 23 01:00:09 +0000 2018,I'M LOOKING FOR A FOREVER HOME.   Will you help me in my search by sharing my post? It will show me how much you ca… https://t.co/6H9n3ATkZo,0
Thu Aug 23 00:27:58 +0000 2018,And no  I do not use the em dash too much--though I do use her a lot--I just really love the em dash  that's all.,0
Thu Aug 23 00:26:59 +0000 2018,My first and truest loves is that of the em dash--she is a beautiful punctuation.,0
Thu Aug 23 00:04:10 +0000 2018,Ducking questions in DC  ducking questions in Vegas. Republicans really don’t want to talk about Michael Cohen. https://t.co/5cbR8fD7xT,27
