Sat Sep 29 23:09:11 +0000 2018,...How she got it? I ain’t never get to ask. I just knew that she was fine like a ticket on the dash,0
Sat Sep 29 22:52:12 +0000 2018,U.S  Canada are pushing to reach a deal before the Trump administration releases the text of Nafta 2.0 to Congress… https://t.co/P01tJlCLjX,13
Sat Sep 29 22:49:56 +0000 2018,AMTI has launched a new map showing oil and gas blocks in the South China Sea. Find block name  operator  stakehold… https://t.co/AWnzcuQdWd,21
Sat Sep 29 22:25:49 +0000 2018,AMTI has launched a new map showing oil and gas blocks in the South China Sea. Find block name  operator  stakehold… https://t.co/AWnzcuQdWd,21
Sat Sep 29 22:15:44 +0000 2018,New @AsiaMTI Map Launch! You can now explore every oil and gas block in the South China  including info on operator… https://t.co/EwFqh5YXeA,44
Sat Sep 29 21:55:10 +0000 2018,One hand doing the DASH okayyyyy😂 ready to get back to jersey and that parkwayyyy https://t.co/vTqFo5QdXH,0
Sat Sep 29 21:34:10 +0000 2018,@AfricanaCarr .@AfricanaCarr 1961 Florida A &amp; M. Undefeated. Played everyone (including Deacon Jones' S.C. State te… https://t.co/17Qjv2wKpa,0
Sat Sep 29 21:29:26 +0000 2018,U.S  Canada are pushing to reach a deal before the Trump administration releases the text of Nafta 2.0 to Congress… https://t.co/P01tJlCLjX,13
Sat Sep 29 21:22:42 +0000 2018,Lt. Col. Patrick Schreiber  a retired Kansas Army officer  has lost his fight in federal court over his adopted dau… https://t.co/s9LJxwADwF,421
Sat Sep 29 21:18:06 +0000 2018,@Steejo I think on board dash cams should be standard. But not ti the point that big bro can tap into your system...,0
Sat Sep 29 21:03:20 +0000 2018,U.S  Canada are pushing to reach a deal before the Trump administration releases the text of Nafta 2.0 to Congress… https://t.co/P01tJlCLjX,13
Sat Sep 29 21:00:50 +0000 2018,@BabyDukaCPH is live with Dash #indiegame check out the s#tream and join his #discord https://t.co/IvdMOLILzP… https://t.co/qKm0rlCwj9,2
Sat Sep 29 20:59:25 +0000 2018,For The Culture with Baker airs tomorrow @dash_radio on Dash Hip Hop X 12pmET/9amPT,1
Sat Sep 29 20:54:34 +0000 2018,For The Culture with Baker airs tomorrow @dash_radio on Dash Hip Hop X 12pmET/9amPT,1
Sat Sep 29 20:28:48 +0000 2018,I can't stand half of you. I love beer. The clintons are conspiring against me. I *love* beer. I don't have a drink… https://t.co/rBGLzTQ3Uq,26984
Sat Sep 29 20:20:11 +0000 2018,The Democrats asked for more time to examine a last-minute allegation. The Republicans  in an unprecedented move  r… https://t.co/hMgXNLSbgm,2194
Sat Sep 29 19:55:03 +0000 2018,In the 1990’s  he pored over the lascivious details of Clinton’s infidelities. Now it's happening to him.… https://t.co/N2kaH8U1at,395
Sat Sep 29 19:50:16 +0000 2018,@BabyDukaCPH is live with Dash #indiegame check out the s#tream and join his #discord https://t.co/IvdMOLILzP… https://t.co/qKm0rlCwj9,2
Sat Sep 29 19:49:00 +0000 2018,📢 https://t.co/IldnXg2ugG,0
Sat Sep 29 19:45:18 +0000 2018,@BabyDukaCPH is live with Dash #indiegame check out the s#tream and join his #discord https://t.co/IvdMOLILzP… https://t.co/qKm0rlCwj9,2
Sat Sep 29 19:24:24 +0000 2018,The Senate through history has been able to rise to the occasion as the conscience of the nation. I hope it will ha… https://t.co/LROsNVYKQo,2928
Sat Sep 29 19:03:23 +0000 2018,AMTI has launched a new map showing oil and gas blocks in the South China Sea. Find block name  operator  stakehold… https://t.co/AWnzcuQdWd,21
Sat Sep 29 19:00:06 +0000 2018,AMTI has launched a new map showing oil and gas blocks in the South China Sea. Find block name  operator  stakehold… https://t.co/AWnzcuQdWd,21
Sat Sep 29 18:55:39 +0000 2018,@QdaQue The way this game has gone its about time a dash of luck came our way,0
Sat Sep 29 18:40:34 +0000 2018,Lorber: Says it's not a zero sum game. Focus on prioritizing values of schools and social services  support public… https://t.co/V8JQFpXM9t,0
Sat Sep 29 18:28:28 +0000 2018,Don't let the @StateDept get away with trying to slip this under the radar:  https://t.co/XznSarn9Na,356
Sat Sep 29 18:19:56 +0000 2018,DJ Dash on the 1s and 2s @TMAtalks fundraiser today! Bring your dancing shoes if you plan on stopping by today! Tim… https://t.co/LLS4VhIHA0,0
Sat Sep 29 18:06:25 +0000 2018,“Not every business can embrace a quirkier approach to campaigns. But add a dash of whimsy where relevant...”… https://t.co/qQ6LBGNn9N,0
Sat Sep 29 18:04:37 +0000 2018,New @AsiaMTI Map Launch! You can now explore every oil and gas block in the South China  including info on operator… https://t.co/EwFqh5YXeA,44
Sat Sep 29 17:53:46 +0000 2018,A majority of Americans oppose Kavanaugh—The @GOP backs him  A majority of Americans oppose Trump—The GOP backs him… https://t.co/HbhC6gDSxi,3217
Sat Sep 29 17:49:07 +0000 2018,forwardmanagement_ent dance auditions today!!!! @ Iverson Mall https://t.co/aXUEp44GQL,1
Sat Sep 29 17:47:58 +0000 2018,Federal judge allows 200 Congressional Dems to proceed w/ a lawsuit against @realDonaldTrump  alleging Trump is vio… https://t.co/Aj3zcvbHSV,1604
Sat Sep 29 17:45:11 +0000 2018,Pelosi: If Kavanaugh lied under oath  he is unfit to serve on his current DC court https://t.co/Ele2uYqn1o https://t.co/D77YRrf8Vy,365
Sat Sep 29 17:43:32 +0000 2018,Judge green lights congressional Democrats' emoluments lawsuit against Trump - ABC News https://t.co/BXIgYMzyUj (via @ABC),3
Sat Sep 29 17:28:06 +0000 2018,I really just spent 50 dollars ordering Cheesecake Factory on Door Dash like my level of spoiled is ridiculous,0
Sat Sep 29 17:10:30 +0000 2018,Watch me do the walk Watch me do my dash Let me talk my talk  Let my haters crash  -Yungkell 2k18,0
Sat Sep 29 17:09:27 +0000 2018,These two states represent our best opportunities to flip seats and take back the Senate. Donate now to help us win!,70
Sat Sep 29 17:08:31 +0000 2018,I have to remind myself that I can’t deal with everyone the same. Some people just ain’t worth shit!,3
Sat Sep 29 17:06:55 +0000 2018,From civil servants to organizers  the young people I met in Amsterdam today are doing the hard work of change. And… https://t.co/mlAp2SRZlP,7200
Sat Sep 29 17:06:07 +0000 2018,This is HUGE.  Emoluments cases now moving in MD AND DC fed. courts.  Kudos @SenBlumenthal @RepJerryNadler… https://t.co/VbPoboX8on,2252
Sat Sep 29 17:01:51 +0000 2018,AMTI has launched a new map showing oil and gas blocks in the South China Sea. Find block name  operator  stakehold… https://t.co/AWnzcuQdWd,21
Sat Sep 29 17:01:10 +0000 2018,The ACLU announced that it is opposing Brett Kavanaugh's nomination to the US Supreme Court -- this is only the fou… https://t.co/ew4G8IuFwY,691
Sat Sep 29 16:36:32 +0000 2018,Why only now I download door dash,0
Sat Sep 29 16:23:05 +0000 2018,https://t.co/ILWnKtQpy1 Bitcoin  Ethereum  Ripple  Bitcoin Cash  EOS  Stellar  Litecoin  Cardano  Monero  Dash: Pri… https://t.co/yhmJxvvgHz,0
Sat Sep 29 16:10:54 +0000 2018,A lot of credit tonight on twitter for @amyklobuchar -- well deserved  absolutely.  But not enough kudos for a quie… https://t.co/TqDYmDlsRi,5229
Sat Sep 29 15:35:07 +0000 2018,Leland Keyser counsel letter to Judiciary Cmte: “Keyser does not refute..Ford's account..However  the simple and un… https://t.co/mlYPy4IXAu,176
Sat Sep 29 15:18:48 +0000 2018,TODAY TODAY ‼️‼️‼️‼️ https://t.co/rZoRqitpzM,0
Sat Sep 29 15:11:52 +0000 2018,In a 2016 opinion  Brett Kavanaugh wrote that polygraphs are a good way to assess credibility. Dr. Ford passed… https://t.co/e1JSPAf6Gp,44
Sat Sep 29 14:58:39 +0000 2018,Flashback: When Justice Sonia Sotomayor was nominated by President Obama  the conservative media complained that sh… https://t.co/os0FhWGd6U,2657
Sat Sep 29 14:30:23 +0000 2018,New @AsiaMTI Map Launch! You can now explore every oil and gas block in the South China  including info on operator… https://t.co/EwFqh5YXeA,44
Sat Sep 29 14:09:38 +0000 2018,U.S  Canada are pushing to reach a deal before the Trump administration releases the text of Nafta 2.0 to Congress… https://t.co/P01tJlCLjX,13
Sat Sep 29 14:03:08 +0000 2018,U.S  Canada are pushing to reach a deal before the Trump administration releases the text of Nafta 2.0 to Congress… https://t.co/P01tJlCLjX,13
Sat Sep 29 14:02:01 +0000 2018,U.S  Canada are pushing to reach a deal before the Trump administration releases the text of Nafta 2.0 to Congress… https://t.co/P01tJlCLjX,13
Sat Sep 29 13:49:46 +0000 2018,New @AsiaMTI Map Launch! You can now explore every oil and gas block in the South China  including info on operator… https://t.co/EwFqh5YXeA,44
Sat Sep 29 13:41:04 +0000 2018,https://t.co/2zfGyC5lSF,0
Sat Sep 29 13:33:54 +0000 2018,More Americans voted for a Democrat for Senate (in total vote) and President (in popular vote) in 2016. So whatever… https://t.co/11vQxtgMpx,2545
Sat Sep 29 13:28:34 +0000 2018,New @AsiaMTI Map Launch! You can now explore every oil and gas block in the South China  including info on operator… https://t.co/EwFqh5YXeA,44
Sat Sep 29 13:15:57 +0000 2018,New @AsiaMTI Map Launch! You can now explore every oil and gas block in the South China  including info on operator… https://t.co/EwFqh5YXeA,44
Sat Sep 29 13:14:27 +0000 2018,New @AsiaMTI Map Launch! You can now explore every oil and gas block in the South China  including info on operator… https://t.co/EwFqh5YXeA,44
Sat Sep 29 13:14:21 +0000 2018,GO! @aoth_alx Kids Dash at Fort Hunt Park! Amazing 5k event  #artsALX #runforthearts #funrun #familyfriendly… https://t.co/FMNBPTiBTs,0
Sat Sep 29 13:12:17 +0000 2018,GO! @aoth_alx Kids Dash at Fort Hunt Park! Amazing 5k event  #artsALX #runforthearts #funrun #familyfriendly… https://t.co/9kO6CuFUGP,0
Sat Sep 29 13:01:56 +0000 2018,AMTI has launched a new map showing oil and gas blocks in the South China Sea. Find block name  operator  stakehold… https://t.co/AWnzcuQdWd,21
Sat Sep 29 12:55:23 +0000 2018,Divorce your Republican husbands.,17838
Sat Sep 29 12:53:28 +0000 2018,AMTI has launched a new map showing oil and gas blocks in the South China Sea. Find block name  operator  stakehold… https://t.co/AWnzcuQdWd,21
Sat Sep 29 12:51:05 +0000 2018,Steve Lamb- 1964 &amp; 1965 ACC Champion in the 400m dash- “They were the best four years of my life!” Lamb commented a… https://t.co/sZqNLvL7Wt,3
Sat Sep 29 12:47:46 +0000 2018,AMTI has launched a new map showing oil and gas blocks in the South China Sea. Find block name  operator  stakehold… https://t.co/AWnzcuQdWd,21
Sat Sep 29 12:46:21 +0000 2018,AMTI has launched a new map showing oil and gas blocks in the South China Sea. Find block name  operator  stakehold… https://t.co/AWnzcuQdWd,21
Sat Sep 29 12:44:41 +0000 2018,AMTI has launched a new map showing oil and gas blocks in the South China Sea. Find block name  operator  stakehold… https://t.co/AWnzcuQdWd,21
Sat Sep 29 12:24:22 +0000 2018,AMTI has launched a new map showing oil and gas blocks in the South China Sea. Find block name  operator  stakehold… https://t.co/AWnzcuQdWd,21
Sat Sep 29 12:22:07 +0000 2018,AMTI has launched a new map showing oil and gas blocks in the South China Sea. Find block name  operator  stakehold… https://t.co/AWnzcuQdWd,21
