Sun Jan 21 23:58:57 +0000 2018,Win FREE Titanium BAR tokens! We're giving away BAR to three lucky winners... Enter to Win &amp; Join the Titanium Revo… https://t.co/x57xBZjcVx,966
Sun Jan 21 23:58:56 +0000 2018,Doing a $NEO and $ETH giveaway 🎉 contest ends 2/1/18. 5 winners will be selected &amp; win a choice of $300 NEO/ETH 📈… https://t.co/TDGqNs2rVj,785
Sun Jan 21 23:55:20 +0000 2018,Bitcoin (BTC) Morning Update: Why a completion of the Wedge Pattern coul... https://t.co/CFJSjwva9b via @YouTube,0
Sun Jan 21 23:51:57 +0000 2018,Doing a $NEO and $ETH giveaway 🎉 contest ends 2/1/18. 5 winners will be selected &amp; win a choice of $300 NEO/ETH 📈… https://t.co/TDGqNs2rVj,785
Sun Jan 21 23:49:04 +0000 2018,Win FREE Titanium BAR tokens! We're giving away BAR to three lucky winners... Enter to Win &amp; Join the Titanium Revo… https://t.co/x57xBZjcVx,966
Sun Jan 21 23:47:34 +0000 2018,Bitcoin price: BTC plummets as Indian banks shut down cryptocurrency trading accounts https://t.co/cBWiYsgCIu - $BTC,4
Sun Jan 21 23:43:24 +0000 2018,Doing a $NEO and $ETH giveaway 🎉 contest ends 2/1/18. 5 winners will be selected &amp; win a choice of $300 NEO/ETH 📈… https://t.co/TDGqNs2rVj,785
