Mon Oct 01 22:16:25 +0000 2018,KuCoin Blockchain Assets Exchange are launching a new listing promotion together with @Docademic! 885 000 MTC+6 BTC… https://t.co/aYW7F0Oe0h,1
Mon Oct 01 18:09:23 +0000 2018,The company is developing rapidly and improving  it has a great future  I recommend everyone to invest in this comp… https://t.co/UjxAjqRNvO,0
Mon Oct 01 18:09:15 +0000 2018,An excellent project from a very promising team  the guys are really engaged in the project and its development and… https://t.co/nVaoLaujAI,0
Mon Oct 01 18:09:09 +0000 2018,The goodness is the best security! Maybe i am wrong or i am too right! Or  the most values are stored in goodness … https://t.co/g1Qu42n0VG,0
Mon Oct 01 18:09:01 +0000 2018,This is a great project so quickly join and do not let you regret it. Great work of developers will give the result… https://t.co/iqyOcGNwNj,0
Mon Oct 01 18:08:53 +0000 2018,Dear friends  investors you have a chance to make a successful investment this year! don't lose your chance! ! Join… https://t.co/HzosiqI833,0
Mon Oct 01 17:30:43 +0000 2018,I hope they stay true to their word. I'm in it for crypto not ICO's. I love #lindacoin V3. It's an amazing wallet!… https://t.co/HsoHdZDflM,0
Mon Oct 01 16:52:21 +0000 2018,The data is generated in conjunction with Scores will tell stories and identify opportunities in a way that has nev… https://t.co/x8APifXWUx,0
Mon Oct 01 16:52:00 +0000 2018,A great start  great development. Everyone can make money! I am happy to be among the participants of project!… https://t.co/ys4c22gfYA,0
Mon Oct 01 16:47:26 +0000 2018,Amazing figures and more to go...this is going amazing and successful ICO. #faceforward #Alfaenzo #blockchain,0
Mon Oct 01 15:37:37 +0000 2018,This project is one of the most creative and revolutionary among all the others! Happy to look after him. Good luck… https://t.co/Awg9XsMBvq,0
Mon Oct 01 15:36:21 +0000 2018,A team with highly qualified specialists. People are now more willing to share or contribute #ICO  creating an abun… https://t.co/oWes0X6Kxe,0
Mon Oct 01 15:31:20 +0000 2018,#capverto #ico https://t.co/CLrxMCLf6u,0
Mon Oct 01 15:31:08 +0000 2018,#capverto #ico https://t.co/IXzvhpz2Bw,0
Mon Oct 01 15:29:07 +0000 2018,Papusha Rocket TOKEN A great project which requires a field of blockchain technology! The innovative project begins… https://t.co/4UPwu6pgrv,0
Mon Oct 01 15:27:30 +0000 2018,#Papusha #ICO #Crowdsale #Bitcoin #Blockchain #Token #ETH #Ethereum #TokenSale https://t.co/6PlSME9Zh6,0
Mon Oct 01 15:27:21 +0000 2018,#Papusha #ICO #Crowdsale #Bitcoin #Blockchain #Token #ETH #Ethereum #TokenSale https://t.co/HJ4eZB88Pc,0
Mon Oct 01 15:25:46 +0000 2018,The Leaxcoin token is mined not by cryptographic hashing  but by solving questions from which #ICO Scores can be de… https://t.co/oMtfU3eqaE,0
Mon Oct 01 15:24:43 +0000 2018,#leaxcoin #ICO https://t.co/Ojw2IrBCll,0
Mon Oct 01 15:24:34 +0000 2018,#leaxcoin #ICO https://t.co/biqeTn8PDg,0
Mon Oct 01 15:24:24 +0000 2018,#leaxcoin #ICO https://t.co/Jy011V8NCq,0
Mon Oct 01 15:09:17 +0000 2018,#FINANCEX #FNX #cryptocurrency #ICO #blockchain #tokensale #ETH #BTC @FNX https://t.co/IEzmvjGBVk,0
Mon Oct 01 14:03:31 +0000 2018,Card is beneficial for both employers and employees. Employers can discover best candidates based on their #ICO sco… https://t.co/orL8Sogjmz,0
Mon Oct 01 14:02:52 +0000 2018,#ICO Card Token it's a breakthrough in Block chain! hurry us becomes more every day. #ICO #REMCO #REMITTANCE,0
Mon Oct 01 14:02:04 +0000 2018,An ICO makes bold claims withYout an economic plan or roadmap to support it  it’s best to avoid investing. Further … https://t.co/riGlDHNVGR,0
Mon Oct 01 14:01:19 +0000 2018,A unique company with phenomenal and innovative approach to their work. I have long been studying the cryptocurrenc… https://t.co/WuD3vHUQkU,0
Mon Oct 01 13:55:13 +0000 2018,A unique company with phenomenal and innovative approach to their work. I have long been studying the cryptocurrenc… https://t.co/wOX5nUrq7V,0
Mon Oct 01 13:54:32 +0000 2018,The developers did a good job on this project a great idea which is good for investiruya and investors I wYould lik… https://t.co/jrtV3h9Emp,0
Mon Oct 01 13:53:32 +0000 2018,@FAMEONEcom The most interesting project to date! very much attracted someone else's attention! I'm a part of! And… https://t.co/ei36oyqfUR,0
Mon Oct 01 13:53:26 +0000 2018,RT coindesk "Despite the big drops in ether prices since late last year  ICO projects haven't lost money on average… https://t.co/uAKFFXdlRs,0
Mon Oct 01 13:53:20 +0000 2018,The most interesting project to date! very much attracted someone else's attention! I'm a part of! And recommend to… https://t.co/1WzvksnnYf,0
Mon Oct 01 13:52:34 +0000 2018,Card is beneficial for both employers and employees. Employers can discover best candidates based on their #ICO sco… https://t.co/XPGnyCtHDm,0
Mon Oct 01 13:51:58 +0000 2018,This may save You some money. Do You think that the startup is using the top Escrow service . And if it’s not  it c… https://t.co/5GcgnHJQoU,0
Mon Oct 01 13:51:05 +0000 2018,#ICO The project has excellent prospects. An excellent team was assembled  which has a clear idea of the future of… https://t.co/MDsN1IGscM,0
Mon Oct 01 13:50:25 +0000 2018,#ico It is very hard to find a good project in Your days. Good luck guys! Very promising.   https://t.co/u13eZYRNig  #LESFEX EXCHANGE,0
Mon Oct 01 13:49:27 +0000 2018,This may save You some money. Do You think that the startup is using the top Escrow service . And if it’s not  it c… https://t.co/y1bEGwdEOG,0
Mon Oct 01 13:40:27 +0000 2018,@SCAVOTech @bitcointalk @Bitcoin @ethereum @Raisex4 @StocksExchangeR @EtherDelta @ForkDelta @hitbtc @coingecko… https://t.co/6g4mFvuM4t,1
Mon Oct 01 13:40:20 +0000 2018,People tell about their impressions about the company and share Your observations. Everyone will be interested to k… https://t.co/tcu7GTQTF8,0
Mon Oct 01 13:39:57 +0000 2018,This project is developing and it shYould be a great reason for investment.Personally  my opinion this project has… https://t.co/siyRcMI0qx,0
Mon Oct 01 13:39:21 +0000 2018,come to a successful journey  i wish You all the best to Your all the future events as well. me and my crypt audien… https://t.co/Al9cJMQHmH,0
Mon Oct 01 13:38:10 +0000 2018,Very interesting project  I advise to see .#WPP ENERGY #ico,0
Mon Oct 01 13:36:22 +0000 2018,A unique company with phenomenal and innovative approach to their work. I have long been studying the cryptocurrenc… https://t.co/SEoq9F9RvO,0
Mon Oct 01 13:32:42 +0000 2018,Card has come to a successful jYourney. A unique company with phenomenal and innovative approach to their work.… https://t.co/54xSk2XvSm,0
Mon Oct 01 13:31:53 +0000 2018,@SCAVOTech @bitcointalk @Bitcoin @ethereum @Raisex4 @StocksExchangeR @EtherDelta @ForkDelta @hitbtc @coingecko… https://t.co/6g4mFvuM4t,1
Mon Oct 01 13:31:31 +0000 2018,Don't miss it guys  very good team and have a bright future in there. Invest  trust and just believe with.… https://t.co/5tYjjj6zXV,0
Mon Oct 01 13:30:16 +0000 2018,#ico It is very hard to find a good project in Your days. Good luck guys! Very promising. #TMONEY,0
Mon Oct 01 13:26:01 +0000 2018,Participate at #ICO to get many benefits with this project  cause its developed by very professional team. #EverLife #AvatarAI.,0
Mon Oct 01 13:25:07 +0000 2018,#ICO The project has excellent prospects. An excellent team was assembled  which has a clear idea of the future of… https://t.co/xGY1IDcOZy,0
Mon Oct 01 12:35:50 +0000 2018,The very good project. leverages blockchain technology in two manners Read more WP. It is very interesting to obser… https://t.co/CWb6YJGuNI,0
Mon Oct 01 12:34:37 +0000 2018,Coinolix exchange presents a wide range of cryptocurrency and tokens. And also Faster Trading  which processes thou… https://t.co/QlNykm9YUR,0
Mon Oct 01 12:33:25 +0000 2018,Crypkart is a one-of-a-kind P2P Fiat/Crypto exchange which primarily aims on filling the gap that our predecessors… https://t.co/i6ZYzrDUe8,0
Mon Oct 01 12:30:44 +0000 2018,I believe in this ICO-project and I will suggest it to everybody who is fascinated with crypto. Trust me  this prod… https://t.co/CNwHVJwWTs,0
Mon Oct 01 12:21:59 +0000 2018,"Friends! Hurry to join!   Hats the best and the most interesting bounty that i have been ever joining! Thanks a lo… https://t.co/m6C7wXNp36,0
Mon Oct 01 12:20:28 +0000 2018,Blokbiz a good investment backup with real product. I'm support this project  because promissing project.. #BlokBiz #BlokBiz.io #ICO,0
Mon Oct 01 12:20:09 +0000 2018,#BlokBiz #BlokBiz.io #ICO https://t.co/DuZWV4wiyu,0
Mon Oct 01 12:18:42 +0000 2018,You can earn good profit. Because we know how to find how to #Invest your money. Revolutionary project FAMEONE. Don… https://t.co/VlXnWTvqvK,0
Mon Oct 01 11:59:48 +0000 2018,project includes a number of best things: great team  great product  great idea  great start! We need products and… https://t.co/cXSvnnXLrF,0
Mon Oct 01 11:50:00 +0000 2018,A strong team is the key to successful business! This project is exactly the structure that combines a brilliant an… https://t.co/43WmIpwTdS,0
Mon Oct 01 11:47:08 +0000 2018,#sishub #anonymity #tokensale #ico #STEEL #STEELmessenger #infosec https://t.co/rkdHP4YCKV,0
Mon Oct 01 11:45:30 +0000 2018,#Sarf #ICO https://t.co/uBJpNXXycf,0
Mon Oct 01 11:45:26 +0000 2018,#Sarf #ICO https://t.co/ZAnw4zdC1r,0
Mon Oct 01 11:44:08 +0000 2018,The biggest project with a strong team. I really loved to be a part of this great project.I'm sure this project wil… https://t.co/ewM8UvhyWe,0
Mon Oct 01 11:41:39 +0000 2018,This excellent company  an interesting concept  excellent work of all staff. Good luck. #Scavo #TokenSale #ICO #Bitcoin #investors #Ethereum,0
Mon Oct 01 11:40:47 +0000 2018,@SCAVOTech @gjnardoni @Ultranotecoin @CriptoNoticias @_BitcoinVietnam @NewsAltcoin @icolistbase @ICOchecker… https://t.co/ZFv7wRES5N,0
Mon Oct 01 11:40:18 +0000 2018,#Scavo #TokenSale #ICO #Bitcoin #investors #Ethereum https://t.co/qe42c9KRse,0
Mon Oct 01 11:26:22 +0000 2018,#sishub #anonymity #tokensale #ico #STEEL #STEELmessenger #infosec https://t.co/gvOS9INRFo,0
Mon Oct 01 11:25:45 +0000 2018,KALC Team will reward our partipants for your support!  Get more info on our telegram!   #ico #volt #KALC #eth,0
Mon Oct 01 11:25:35 +0000 2018,#ico #volt #KALC #eth https://t.co/ayabE4Oyr7,0
Mon Oct 01 11:23:28 +0000 2018,#FINANCEX #FNX #cryptocurrency #ICO #blockchain #tokensale #ETH #BTC @FNX https://t.co/yqWewWMZgO,0
Mon Oct 01 11:21:42 +0000 2018,Ladies and gentlemens. When I first saw this project on the Internet  I thought. What a good project You definitely… https://t.co/d55Uz9kmsc,0
Mon Oct 01 11:21:37 +0000 2018,#blockchain #ethereum #daico #smartcontract #CryptoScamStop #blockchain #ethereum #daico #smartcontract… https://t.co/pSiQz0WnQI,0
Mon Oct 01 11:17:54 +0000 2018,I'm with you. Good luck to everyone involved in the development of the project! A little more and the moon.… https://t.co/eEIMmQKWWn,0
Mon Oct 01 11:15:01 +0000 2018,CINDX has been named as one of the 10 the most promising blockchain project to take part in Pitch Competition at   #CINDX #ICO,0
Mon Oct 01 10:34:53 +0000 2018,I am introducing a new project that will succeed and make big profits. #FINANCEX #FNX #cryptocurrency #ICO #blockchain #tokensale #ETH #BTC,0
Mon Oct 01 10:32:41 +0000 2018,Great project with great possibilities . I am happy to participate   in my opinion this project is very good and wi… https://t.co/nTcQQNpoI6,0
Mon Oct 01 08:58:00 +0000 2018,FAMEONE an extraordinary venture! consistently we hear extraordinary news from this project. I'm soo glad to join a… https://t.co/YAiE42GpGu,0
Mon Oct 01 08:38:58 +0000 2018,#UniFox #cryptocurrency rather than going to the bank and exchanging their money with local currency #ICO UniFox Token,0
Mon Oct 01 08:38:47 +0000 2018,I advise everyone to join this project and you will understand that you have not missed the opportunity to be a lea… https://t.co/wGIKo2Vzsd,0
Mon Oct 01 08:37:02 +0000 2018," Why should you trust in machine learning and not your gut? Lightning speed decisions. The near-unlimited computat… https://t.co/3JM1qWyGz6,0
Mon Oct 01 08:35:19 +0000 2018,An interesting project  the team has many plans  this company is definitely waiting for great success  I advise eve… https://t.co/xfgKnZ0c8f,0
Mon Oct 01 08:31:02 +0000 2018,The best project ever. I have checked out every detail and infos. They look like pretty impressive. I have also che… https://t.co/7egbTPcoMw,1
Mon Oct 01 08:28:53 +0000 2018,The best project ever. I have checked out every detail and infos. They look like pretty impressive. I have also che… https://t.co/7egbTPcoMw,1
Mon Oct 01 08:27:32 +0000 2018,Blokbiz a good investment backup with real product. I'm support this project  because promissing project.. #BlokBiz #BlokBiz.io #ICO,0
Mon Oct 01 08:11:42 +0000 2018,@FAMEONEcom This project has a good growth dynamics  I wish the company to continue to work on creating new partner… https://t.co/B7QfwlO8Cz,0
Mon Oct 01 08:11:09 +0000 2018,I did not see the project more interesting on the Internet. I watch with interest the development of affairs. I bel… https://t.co/HnMNoH5pru,0
Mon Oct 01 08:08:20 +0000 2018,THAT REWARDS You FOR YouR #ICO! Very promising and useful project  have time to participate !   #ICO… https://t.co/fZCmovbBu9,0
Mon Oct 01 07:58:26 +0000 2018,A rapidly growing company. Good luck to the project team! #w12 #daico #presale #blockchain #daofund #altcoin #cryptocurrency #ico,0
Mon Oct 01 07:57:43 +0000 2018,eLYQD Token is a project with a great future. If you want to invest your funds securely and in the future to make a… https://t.co/xYpa9zP6dS,0
Mon Oct 01 07:57:01 +0000 2018,Very Good Investment ICO Right Now Almost Reach Softcap . Do not miss your chance and have time to take part in the… https://t.co/MaUhQMiO2L,0
Mon Oct 01 07:50:47 +0000 2018,Don't miss Your chance to earn profit from this great project. I believe You will succeed and You will turn the wor… https://t.co/Jup4yQ6N22,0
Mon Oct 01 07:49:54 +0000 2018,@SCAVOTech @gjnardoni @Ultranotecoin @CriptoNoticias @_BitcoinVietnam @NewsAltcoin @icolistbase @ICOchecker… https://t.co/EhTXtuzTaI,0
Mon Oct 01 07:49:28 +0000 2018,Cool project with interesting team management. This ico has already closed. I think it will be great project.… https://t.co/p7vAN6YksV,0
Mon Oct 01 07:47:29 +0000 2018,One of the most promising and successful projects to date! Join now.. #RealtyReturns #RRT #RealtyReturns_ICO #ico #blockchain #ethereum,0
Mon Oct 01 07:46:50 +0000 2018,Advertisers use BEATRĪX tokens to advertise thrYough Your platform  and gain access to Your bot free market data. #BEATRIX #ICO,0
Mon Oct 01 06:58:33 +0000 2018,is a promising project with tangible benefits and lots of positive difference I recommend investors to try invest h… https://t.co/an6f38HRSV,0
Mon Oct 01 06:57:56 +0000 2018,#Sarf #ICO https://t.co/zlwQcg8q4q,0
Mon Oct 01 06:57:53 +0000 2018,#Sarf #ICO https://t.co/iTGdpojER9,0
Mon Oct 01 06:57:07 +0000 2018,#SCAVO #TokenSale #AI #ICO #TokenSale #Bitcoin #investors #Ethereum @SCAVOTech  This project looks very good and promising!!!,0
Mon Oct 01 06:56:10 +0000 2018,#Scavo #TokenSale #ICO #Bitcoin #investors #Ethereum https://t.co/fsOCmkjYxm,0
Mon Oct 01 06:55:04 +0000 2018,BRAVO Pay is a great project about Tip or Pay  changing the way we pay. Featured on ABC’s Shark Tank. Come on join… https://t.co/oLblG6VIgM,0
Mon Oct 01 06:53:51 +0000 2018,#TimeMoney CEO Oskars Dombrava in Blockchain Conference St.Petersburg presenting Time Money and new way how… https://t.co/3ttkhqqC0q,0
Mon Oct 01 06:51:57 +0000 2018,Virtual Rehab project is very promising and I hope it will be useful for many people in the near future. I wish you… https://t.co/q2e94Ze1ge,0
Mon Oct 01 06:45:47 +0000 2018,#sishub #anonymity #tokensale #ico #STEEL #STEELmessenger #infosec https://t.co/g9g7wnrdYL,0
Mon Oct 01 06:43:30 +0000 2018,The process is coming to an end  great job guys! Success is achieved and all who have had time to buy tokens MODULE… https://t.co/CUHuyrdADz,0
Mon Oct 01 05:52:46 +0000 2018,#sishub #anonymity #tokensale #ico #STEEL #STEELmessenger #infosec https://t.co/qlQgZhO9qf,1
Mon Oct 01 05:43:37 +0000 2018,FinanceX CEO Peter Dinh and CTO Henry Ng discussed blockchain with leaders of Blockchain Association in Indonesia.… https://t.co/0GQqfJeThO,0
Mon Oct 01 05:43:04 +0000 2018,I see that its development and long-term features and it will go further in the future and I think it will have one… https://t.co/woMjhHnR2P,0
Mon Oct 01 05:42:48 +0000 2018,@FAMEONEcom Very Good team  amazing project. I wish You best on ICO.,0
Mon Oct 01 05:29:53 +0000 2018,In this video  they'll give you a guide on Kucoin's website functions and any other kinds of stuff relating to the… https://t.co/AHQiuKMSR2,0
Mon Oct 01 05:24:57 +0000 2018,Hey guys check this out! In this video  they'll teach you the way on how to deposit on kucoin.  You may visit this… https://t.co/ILCVOfDw0A,0
Mon Oct 01 05:24:10 +0000 2018,I've got some news to share with you guys! In this video  they'll teach you the way on how to deposit on kucoin.  Y… https://t.co/F1H7lDffjx,0
Mon Oct 01 05:15:01 +0000 2018,CarVertical is the first global and decentralized car history registry. It has an undervalued token called CV  but… https://t.co/OiDUilWd5u,0
Mon Oct 01 05:14:22 +0000 2018,CarVertical is the first global and decentralized car history registry. It has an undervalued token called CV  but… https://t.co/vYwpRGUuXA,0
Mon Oct 01 04:33:44 +0000 2018,#sishub #anonymity #tokensale #ico #STEEL #STEELmessenger #infosec https://t.co/qlQgZhO9qf,1
Mon Oct 01 04:33:14 +0000 2018,That's one of the best ICO I've seen for a long time. That's actually elegant project. Don't miss this #Platio,0
Mon Oct 01 04:32:31 +0000 2018,More Imagine a platform that will connect you to others  institution  and your assets. It's become as your passport… https://t.co/TVNWBYxl5c,0
Mon Oct 01 04:32:20 +0000 2018,#ico #volt #KALC #eth https://t.co/0KUKpDr8KX,0
Mon Oct 01 04:28:50 +0000 2018,this project is indeed very hands on and aware of what will be the easy way to gain not for just money but for the… https://t.co/u4WsJkcuB4,0
Mon Oct 01 04:28:16 +0000 2018,#BlokBiz #BlokBiz.io #ICO https://t.co/6laHa7RdE9,0
Mon Oct 01 04:27:45 +0000 2018,After reviewing the project information. I believe the project will soon reach its goal  if implemented to achieve… https://t.co/OL809XzueB,0
Mon Oct 01 04:25:56 +0000 2018,#blockchain #ethereum #daico #smartcontract #CryptoScamStop #blockchain #ethereum #daico #smartcontract… https://t.co/8FdjCV0wgB,0
Mon Oct 01 04:22:21 +0000 2018,Another step into the future  a Very promising project  taking into consideration the universal growth of kryptonyt… https://t.co/zfc7f7Mn6s,0
Mon Oct 01 04:19:38 +0000 2018,The project was developed by a group of people interested in block-chain technology and ICO. The project is built o… https://t.co/HOujVdptWu,0
Mon Oct 01 04:18:56 +0000 2018,The whole history of transactions is recorded on the blockchain which guarantees transparency of trade history #CINDX #ICO,0
Mon Oct 01 02:54:21 +0000 2018,Debitum Network is a global blockchain based financing system that offers an array of reliable and secured services… https://t.co/cXjNY7dpYe,0
Mon Oct 01 02:53:00 +0000 2018,DebitumNetwork endeavors to provide the greatest service to their users and partners. They are offering an earning… https://t.co/rADFubZRur,0
Mon Oct 01 02:51:44 +0000 2018,DebitumNetwork endeavors to provide the greatest service to their users and partners. They are offering an earning… https://t.co/xZLwp9kXiv,0
Mon Oct 01 02:50:21 +0000 2018,Debitum Network is a global blockchain based financing system that offers an array of reliable and secured services… https://t.co/p5uJ9hXNZI,0
Mon Oct 01 02:38:52 +0000 2018,KuCoin Blockchain Assets Exchange are launching a new listing promotion together with @Docademic! 885 000 MTC+6 BTC… https://t.co/f9ItMbyUTk,0
Mon Oct 01 02:38:00 +0000 2018,KuCoin Blockchain Assets Exchange are launching a new listing promotion together with @Docademic! 885 000 MTC+6 BTC… https://t.co/aYW7F0Oe0h,1
Mon Oct 01 02:17:23 +0000 2018,#BlokBiz #BlokBiz.io #ICO https://t.co/W8cqTIWSSK,0
Mon Oct 01 02:17:02 +0000 2018,We are currently working on our Leax Wallet for desktops  so you can have it on your Windows  Mac and Linux OS!  #leaxcoin #ICO,1
Mon Oct 01 02:16:23 +0000 2018,Along with the expanding cryptocurrency and blockchain industry comes blockchain jobs  and at the moment demand is… https://t.co/PW6P0pUuzQ,0
Mon Oct 01 02:16:09 +0000 2018,We are currently working on our Leax Wallet for desktops  so you can have it on your Windows  Mac and Linux OS!  #leaxcoin #ICO,1
Mon Oct 01 02:15:58 +0000 2018,#leaxcoin #ICO https://t.co/0gVJEqoJlk,0
Mon Oct 01 02:15:45 +0000 2018,#leaxcoin #ICO https://t.co/gudNVntKlx,0
