Sun Jan 28 21:07:24 +0000 2018,@GlobeKPD They haven’t forgotten about him getting Dotckin in the gotchkins last year... his waving will only endea… https://t.co/SQ25gaKjGA,1
Sun Jan 28 21:06:41 +0000 2018,@GlobeKPD They haven’t forgotten about him getting Dotckin in the gotchkins last year... his waving will only endea… https://t.co/SQ25gaKjGA,1
Sun Jan 28 18:59:56 +0000 2018,Kudos to @CruiseNorwegian for stellar customer service &amp; going above and beyond for these 90 yr old lovebirds… https://t.co/MBzVRKYM8I,0
Sun Jan 28 17:24:02 +0000 2018,How To Build Stellar Product Messaging for #SaaS Companies - via @linktexting https://t.co/REsLUjVwjq https://t.co/Q7dvR84DdS,0
Sun Jan 28 13:15:30 +0000 2018,Some of the best tips in the region will be tried once again this week (along with some stellar fries and meatballs… https://t.co/QJRLgB22dX,0
Sun Jan 28 10:15:10 +0000 2018,@kaitlinefree He arguably got the second worst trip behind Stellar Wind. Exceeded my expectations and I actually th… https://t.co/zoU0MoPfeR,0
Sun Jan 28 08:35:55 +0000 2018,That match was *chef's kiss*. Stellar work from all four guys.,0
Sun Jan 28 08:20:39 +0000 2018,5 Star: Michael B. "I have used Executive more than a few times and they have always done stellar body work..."...,0
Sun Jan 28 04:34:07 +0000 2018,Follow &amp; retweet for a chance at our 10 000 GOS giveaway! Gossamer is celebrating its upcoming exchange listings.… https://t.co/6sNWXkztWO,4
Sun Jan 28 03:58:11 +0000 2018,Retweet for a chance at 10 000 GOS! Gossamer is celebrating its upcoming exchange listing. Will announce winner nex… https://t.co/WrWPkqyjua,0
Sun Jan 28 03:13:31 +0000 2018,$39 million ICO chooses Stellar over Ethereum  but Why? #Startups https://t.co/jjVUwGZEI9,0
Sun Jan 28 01:12:20 +0000 2018,Giving away 10 000 GOS! Gossamer is celebrating its upcoming exchange listings. Follow &amp; retweet for a chance to wi… https://t.co/qttHteNOY7,6
Sun Jan 28 01:02:44 +0000 2018,Follow &amp; retweet for a chance at our 10 000 GOS giveaway! Gossamer is celebrating its upcoming exchange listings.… https://t.co/6sNWXkztWO,4
Sun Jan 28 00:41:36 +0000 2018,Follow &amp; retweet for a chance at our 10 000 GOS giveaway! Gossamer is celebrating its upcoming exchange listings.… https://t.co/6sNWXkztWO,4
Sun Jan 28 00:28:26 +0000 2018,Follow &amp; retweet for a chance at our 10 000 GOS giveaway! Gossamer is celebrating its upcoming exchange listings.… https://t.co/6sNWXkztWO,4
Sun Jan 28 00:01:24 +0000 2018,Follow &amp; retweet for a chance at our 10 000 GOS giveaway! Gossamer is celebrating its upcoming exchange listings.… https://t.co/6sNWXkztWO,4
