Sat Apr 14 22:30:53 +0000 2018,Good fun weekend on @NBCSportsSoccer with the #punditexchange. Enjoyed listening to @The2RobbiesNBC with @arlowhite… https://t.co/LlrkZ4hN82,0
Sat Apr 14 17:55:28 +0000 2018,@realscientists 99% Invisible  Amicus  and Criminal are stellar productions.,0
Sat Apr 14 15:52:45 +0000 2018,Great interview with two of our stellar developers  Kay and Amit! https://t.co/cE4PM7nNSq,5
Sat Apr 14 15:08:51 +0000 2018,After a tough couple points  Kaitlyn makes a stellar catch to reel in a hard fought point 🎣🎣🎣,0
Sat Apr 14 09:21:49 +0000 2018,Empowering Your Leadership Career Path: Perception on 4/26 is going to be STELLAR. Our fabulous panelists include:… https://t.co/xZ6rqogL7G,3
Sat Apr 14 08:30:00 +0000 2018,Signals suggest black hole emits a jet of energy proportional to the stellar material it gobbles up.… https://t.co/9liMXjDSeu,55
Sat Apr 14 02:12:53 +0000 2018,It’s striking how taking military action turns normal people with critical thinking skills into giddy teenagers. It… https://t.co/3rI31d43Ar,0
Sat Apr 14 01:40:42 +0000 2018,Me: I really enjoy talking to ______ I should message them so we can talk more!  My Brain: Why would they want to t… https://t.co/xHWDJtIlbw,43650
Sat Apr 14 01:38:33 +0000 2018,We're getting galactic with our "Give Me Some #Space" playlist. Senior Editor @corissa_haury shares 11 tracks to ki… https://t.co/wRU2h8Dq0W,4
Sat Apr 14 01:23:10 +0000 2018,I am crossing this retrograde finish line a broken shell of what once was a stellar Gemini https://t.co/Ig6ocobYSJ,0
Sat Apr 14 01:17:48 +0000 2018,but this year the twitter coverage of camws has been completely stellar — well done and thank you to everyone tweet… https://t.co/nboA1eUjcY,1
Sat Apr 14 01:05:52 +0000 2018,Red Sox fans — bored by this less-than-stellar showing from Baltimore — are now starting a "Yankees Suck" chant here at Fenway.,1
Sat Apr 14 01:01:51 +0000 2018,Red Sox fans — bored by this less-than-stellar showing from Baltimore — are now starting a "Yankees Suck" chant here at Fenway.,1
