Fri Jan 26 19:24:06 +0000 2018,"When a song is deeply felt in one's gut the words resonate within your soul making your vocals a vacuum of stellar power!" -Fancy J London,55
Fri Jan 26 19:13:45 +0000 2018,@fcukthisguy @richarddeitsch @xRMFCx It's known throughout the industry that it's the most coveted timeslot to be t… https://t.co/kBieJ3lClL,0
Fri Jan 26 19:02:15 +0000 2018,And of course Stripe is an investor in Stellar https://t.co/VIdtTl8uA3,0
Fri Jan 26 18:51:10 +0000 2018,@KimmyLizzie @Robertpwatkins @HayleyErin Still. He went there. Plus he has never been known for his stellar judgmen… https://t.co/BoqXuFQBGg,0
Fri Jan 26 18:44:31 +0000 2018,Can’t beat the new set up! #stellar daily swing #investinyourfuture #cryptocurrencynews… https://t.co/i2u7Hlbv95,0
Fri Jan 26 18:42:56 +0000 2018,Can’t beat the new set up  waiting for #stellar daily swing #investinyourfuture #microsoft… https://t.co/niE3kxRx0V,0
Fri Jan 26 17:17:34 +0000 2018,Instead of going for a run I just ate s half pound of bacon. Stellar example of good health.,0
Fri Jan 26 16:54:47 +0000 2018,This is stellar advice for anyone  tbh. https://t.co/u1r5zHExOu,3
Fri Jan 26 15:17:19 +0000 2018,This is stellar advice for anyone  tbh. https://t.co/u1r5zHExOu,3
Fri Jan 26 15:14:27 +0000 2018,This is stellar advice for anyone  tbh. https://t.co/u1r5zHExOu,3
Fri Jan 26 15:14:11 +0000 2018,This is stellar advice for anyone  tbh. https://t.co/u1r5zHExOu,3
Fri Jan 26 15:07:26 +0000 2018,@winningwriters @lithub Zen in the Art of Writing is a truly stellar book!,0
Fri Jan 26 12:38:57 +0000 2018,Amazing afternoon of skiing at Snowbird. Now back to the stellar science at #KStumor Metabolism. https://t.co/dLlp25tx9Z,2
Fri Jan 26 12:13:24 +0000 2018,Gayle King just used the phrase "attorneys general"  and I wanted to jump into the TV and high five her for that stellar grammar.,0
Fri Jan 26 07:54:54 +0000 2018,Crypto Market Down 30% this week is this a good tiime to buy #BTC &amp; #ETH now. View our in-depth anaktsis now. #XVG… https://t.co/Q1tmnOSYky,0
Fri Jan 26 05:18:24 +0000 2018,@RyanNewYork Sure. I'm not saying they're in the same level... She jumped to Senator on her husband's coattails and… https://t.co/TRgdvD0l5c,0
Fri Jan 26 05:07:49 +0000 2018,Join us for the @indiaconf2018 on 10th and 11th Feb at @Harvard. We have a stellar line-up of speakers and are look… https://t.co/j3bL4wRtqt,36
Fri Jan 26 03:54:32 +0000 2018,@geoffjohns @DCComics Happy birthday  man! Congrats on another stellar issue of Doomsday Clock!,0
Fri Jan 26 03:06:54 +0000 2018,Stellar Climbs Close To 20% As Positive News Continues  @Forbes https://t.co/bs4kK87Voi  #StellarLumens #Stellar… https://t.co/Oq36ChAh4a,2
Fri Jan 26 01:22:18 +0000 2018,@DougDrachmanMD @SCAI Great #SCAIFirst #CHIP event last night  thanks @DougDrachmanMD and @SCAI! Stellar case prese… https://t.co/hbLFx8ZawP,1
Fri Jan 26 01:17:05 +0000 2018,After one period of play in Ottawa  #Sens lead #NHLBruins 1-0 despite out-shooting Ottawa 20-7. Great period and so… https://t.co/I2f94RMotT,1
Fri Jan 26 01:16:47 +0000 2018,After one period of play in Ottawa  #Sens lead #NHLBruins 1-0 despite out-shooting Ottawa 20-7. Great period and so… https://t.co/I2f94RMotT,1
Fri Jan 26 00:58:43 +0000 2018,A round of applause for @ldforry. Cheers to a stellar career in public service  and best wishes for a marvelous nex… https://t.co/um2keaBqjP,0
Fri Jan 26 00:19:42 +0000 2018,@AmyLucenta I just did! It was a toughy for me between two. But  ultimately  it came down to not the design of a VE… https://t.co/Ak7Exxl2lZ,0
Fri Jan 26 00:09:01 +0000 2018,https://t.co/VLVhYQmX12,0
