Sat Oct 27 22:23:55 +0000 2018,@DavidShares Paypal  huh  Well thjere's always $bitcoin  $BCH is bitcoin cash,0
Sat Oct 27 12:11:53 +0000 2018,le genre de message dont j'ai besoin dans ma vie ❤️ https://t.co/UUScjZ0gLK,4574
Sat Oct 27 11:49:05 +0000 2018,I found the real reason why $BTC is so stable! Listen to the very end!  $BCH  otoh  is $cash https://t.co/hCusktPSp0,0
Sat Oct 27 10:00:37 +0000 2018,Doing a $NEO and $ETH giveaway 🎉 contest ends 2/1/18. 5 winners will be selected &amp; win a choice of $300 NEO/ETH 📈… https://t.co/TDGqNs2rVj,979
Sat Oct 27 05:05:20 +0000 2018,@BitcoinCom @bitsko_xt @BitcoinCashA @eatBCH @eatBCH_SS @eatBCH_VE @BCHmeetups Great cause. Many people will hear about $BCH,0
Sat Oct 27 04:04:22 +0000 2018,Coinbase cuts staff   Coinbase Trading Volume Hits 52-Week Low in Q3 #TETHER #IOTA #XMR #Litecoin #BCH… https://t.co/CDP1mJeKcI,1
