Sat May 12 23:36:00 +0000 2018,#PORNOGAY Getting Stuffed With A Big Cock - Marcus by Beef Cake Hunter   [FULLVID] https://t.co/6n4A0FEjvQ https://t.co/ahXmvhlgKC,757
Sat May 12 21:01:23 +0000 2018,Doing a $NEO and $ETH giveaway 🎉 contest ends 2/1/18. 5 winners will be selected &amp; win a choice of $300 NEO/ETH 📈… https://t.co/TDGqNs2rVj,1060
Sat May 12 20:53:01 +0000 2018,BUYING $BTC HERE IS LIKE SHORTING THE US DOLLAR. WE ARE ON THE VERGE OF A MAJOR MOVE HERE.  $OMG $EXP $STEEM $ZRX… https://t.co/C2I4apNosI,1
Sat May 12 20:51:16 +0000 2018,$STR IS NOW UP 11 PERCENT IN THE LAST 24 HRS.  $OMG $EXP $STEEM $ZRX $FCT $GAS  $STORJ $ETH $CVC  $SYS $LBC $DGB… https://t.co/sEOym3FTcR,1
Sat May 12 20:50:08 +0000 2018,THE DOLLAR IS ON THE VERGE OF CRASHING AGAINST $BTC. HIGHER PRICES ARE COMING.  $OMG $EXP $STEEM $ZRX $FCT $GAS… https://t.co/4CqVLflDR2,1
Sat May 12 20:47:48 +0000 2018,HUGE BATTLE BETWEEN LONGS AND SHORTS AT 8500 BTC. I HAVE A FEELING SHORTS WILL RETREAT HERE SOON.  $OMG $EXP $STEEM… https://t.co/LC7Hn63ceq,1
Sat May 12 20:28:30 +0000 2018,Doing a $NEO and $ETH giveaway 🎉 contest ends 2/1/18. 5 winners will be selected &amp; win a choice of $300 NEO/ETH 📈… https://t.co/TDGqNs2rVj,1060
Sat May 12 20:22:15 +0000 2018,Doing a $NEO and $ETH giveaway 🎉 contest ends 2/1/18. 5 winners will be selected &amp; win a choice of $300 NEO/ETH 📈… https://t.co/TDGqNs2rVj,1060
Sat May 12 20:18:46 +0000 2018,MONEY IS JUST WAITING TO POUR INTO CRYPTO. IF YOU DONT HAVE CRYPTO  GET IT.  $OMG $EXP $STEEM $ZRX $FCT $GAS… https://t.co/oFRjgfMKkT,0
Sat May 12 20:17:13 +0000 2018,TRUMP WANTS A WEAKER DOLLAR. WE SHALL GET A WEAKER DOLLAR.  $OMG $EXP $STEEM $ZRX $FCT $GAS  $STORJ $ETH $CVC  $SYS… https://t.co/TYIGzLyTRX,0
Sat May 12 20:16:09 +0000 2018,EVERY INVESTOR SHOULD HAVE AT LEAST 10% EXPOSURE TO CRYPTO IN THEIR PORTFOLIOS.  $OMG $EXP $STEEM $ZRX $FCT $GAS… https://t.co/Iwy3bi4YoO,1
Sat May 12 20:15:40 +0000 2018,IT IS IRRESPONSIBLE NOT TO HAVE EXPOSURE TO CRYPTO  $OMG $EXP $STEEM $ZRX $FCT $GAS  $STORJ $ETH $CVC  $SYS $LBC… https://t.co/i7IvZzAPmx,1
Sat May 12 20:12:56 +0000 2018,EVERY AMERICAN SHOULD HAVE EXPOSURE TO CRYPTO.  $OMG $EXP $STEEM $ZRX $FCT $GAS  $STORJ $ETH $CVC  $SYS $LBC $DGB… https://t.co/QujKChwWC5,1
Sat May 12 20:11:34 +0000 2018,THE ARTIFICIAL PROPPING UP OF THE DOLLAR WILL END. GOT CRYPTO?  $OMG $EXP $STEEM $ZRX $FCT $GAS  $STORJ $ETH $CVC… https://t.co/B46RIrbLV4,1
Sat May 12 20:10:53 +0000 2018,THE US DOLLAR IS ON THE VERGE OF COLLAPSE. NOTHING CAN STOP THE FLOODGATES.  $OMG $EXP $STEEM $ZRX $FCT $GAS… https://t.co/1UuhdGkPrj,3
Sat May 12 20:05:16 +0000 2018,Doing a $NEO and $ETH giveaway 🎉 contest ends 2/1/18. 5 winners will be selected &amp; win a choice of $300 NEO/ETH 📈… https://t.co/TDGqNs2rVj,1060
Sat May 12 20:01:00 +0000 2018,BCH Down Ahead of Next Week’s Bitcoin Cash Network Upgrade #bitcoin #cryptocurrency https://t.co/0Nglhvxoxj https://t.co/IL0WDjfUOh,0
Sat May 12 19:59:54 +0000 2018,8500 IS ALMOST HERE. WE WONT SEE THAT PRICE AGAIN. 8600 WILL COME FAST. OFF TO THE RACES.  $OMG $EXP $STEEM $ZRX… https://t.co/jkgkVhQnTT,1
Sat May 12 19:58:26 +0000 2018,WE ARE SEEING SHORTS SCRAMBLING FOR COVERS. THIS WILL GET WORSE IN THE NEXT 24 HOURS.  $OMG $EXP $STEEM $ZRX $FCT… https://t.co/vAPY3Sysvn,0
Sat May 12 19:56:15 +0000 2018,DO NOT SELL FOR PENNIES. HOLD FOR DOLLARS. EVERYTHING WILL BE UP 15-20 PERCENT TOMORROW.  $OMG $EXP $STEEM $ZRX… https://t.co/oTraKB3cTb,1
Sat May 12 19:55:08 +0000 2018,ANYONE WHO BOUGHT $BTC UNDER 8500 WILL HAVE DONE WELL. JUST HODL.  $OMG $EXP $STEEM $ZRX $FCT $GAS  $STORJ $ETH… https://t.co/4DyZwebkaA,1
Sat May 12 19:54:15 +0000 2018,THE EFFECT OF REGAINING 8500 MASSIVE PARADIGM SHIFT HUGE SHORT COVERING HIGHER PRICES  $OMG $EXP $STEEM $ZRX $FCT… https://t.co/J9cQP9Fmzw,0
Sat May 12 19:48:27 +0000 2018,$BCH IS STILL DOWN 400 FROM RECENT HIGHS. THE REVERSAL WILL CATCH EVERYONE OFF GUARD.  $OMG $EXP $STEEM $ZRX $FCT… https://t.co/LLoFXShjJa,1
Sat May 12 19:43:05 +0000 2018,HUGE PARADIGM SHIFT GOING TO HAPPEN IN CRYPTO  8500 WILL BE HUGE.  $OMG $EXP $STEEM $ZRX $FCT $GAS  $STORJ $ETH… https://t.co/plJ5K86O7e,1
Sat May 12 19:39:41 +0000 2018,$REP IS STILL 30 DOLLARS OFF ITS RECENT HIGH.  TALK ABOUT VOLATILITY.  $OMG $EXP $STEEM $ZRX $FCT $GAS  $STORJ $ETH… https://t.co/YJj5FYWfO4,1
Sat May 12 19:38:26 +0000 2018,$XMR UNDER 200 IS A NO-BRAINER. UNDERVALUED MARKET CAP.  $OMG $EXP $STEEM $ZRX $FCT $GAS  $STORJ $ETH $CVC  $SYS… https://t.co/SHARAcCMbC,1
Sat May 12 19:36:06 +0000 2018,$ETH NEVER SHOULD HAVE TRADED UNDER 675 ANYTHING LOWER WAS A PURE GIFT TO BUYERS.  $OMG $EXP $STEEM $ZRX $FCT $GAS… https://t.co/Qj7o6ESg7k,1
Sat May 12 19:34:07 +0000 2018,THE REASON I HAVE LOWERED MY END OF YEAR $BTC TARGET TO 17 000 IS SIMPLE. THIS IS A NO-BRAINER.  $OMG $EXP $STEEM… https://t.co/UbQz383eBX,1
Sat May 12 19:32:41 +0000 2018,ONCE $BTC REGAINS CONTROL OF 8500  IT WILL NEVER SEE THAT AGAIN.  THIS WAS A ONCE IN A LIFETIME OPPORTUNITY.  $OMG… https://t.co/I7oWm6vqFR,1
Sat May 12 19:30:45 +0000 2018,$ETC IS RUBBING UP AGAINST ITS DOWNTREND LINE. IT IS DOWN 7 DOLLARS FROM RECENT HIGH. UPSIDE.  $OMG $EXP $STEEM… https://t.co/v3BVPHuDpx,1
Sat May 12 19:27:53 +0000 2018,$DASH WANTS 400 SHORTLY. THE MARKET CAP IS RELATIVELY LOW.  A LOT OF UPSIDE HERE FOR LONG TERM HOLDERS.  $OMG $EXP… https://t.co/sO5Kvl20WD,0
Sat May 12 19:26:16 +0000 2018,THIS MAY BE $LTC 'S TIME TO SHINE. IT HAS UNDERPERFORMED IN THE LAST BULL MARKET. 140'S ARE LOOKING PROMISING.… https://t.co/zTz1q51Bri,0
Sat May 12 19:25:16 +0000 2018,EOS REMINDS ME A LOT OF ETH IN EARLY 2017. MY PRICE TARGET IS 30 IN THE NEXT MONTH.  $OMG $EXP $STEEM $ZRX $FCT… https://t.co/FeqMJvAqgH,0
Sat May 12 19:23:49 +0000 2018,ANYONE STILL REMEMBER THE ZEC PRICE TARGET OF 65 000 ?  SHORTS WILL GET CRUSHED.  $OMG $EXP $STEEM $ZRX $FCT $GAS… https://t.co/aSgJfRTJ5D,0
Sat May 12 19:22:09 +0000 2018,LAST WARNING TO SHORTS: COVER BEFORE WE REACH 8500 THERE IS MUCH PAIN AHEAD FOR YOU.  $OMG $EXP $STEEM $ZRX $FCT… https://t.co/rdNMxCKrXr,0
Sat May 12 19:20:00 +0000 2018,#GAYVID Polishing Beefcake Edward by Beef Cake Hunter   [LINK] https://t.co/2KPSb9Z89z https://t.co/J8q5i5BeKo,419
Sat May 12 19:19:10 +0000 2018,AT BTC 8500 SHORTS KNOW THAT THEY WILL HAVE LOST CONTROL OF PRICES. WE ARE HEADED MUCH HIGHER.  $OMG $EXP $STEEM… https://t.co/C09WOdouo8,0
Sat May 12 19:18:23 +0000 2018,BTC 8400 IS COMING FAST. BTC 8500 WILL COME FASTER.  $OMG $EXP $STEEM $ZRX $FCT $GAS  $STORJ $ETH $CVC  $SYS $LBC… https://t.co/EFmPtUZs81,0
Sat May 12 19:17:04 +0000 2018,8500 WILL BE THE LINE IN THE SAND. SHORTS WILL BE FORCED TO COVER AT HIGHER PRICES.  $OMG $EXP $STEEM $ZRX $FCT… https://t.co/TWe9CRmjrf,0
Sat May 12 19:16:15 +0000 2018,$BCH IS SHOWING GREAT RELATIVE STRENGTH HERE.  $OMG $EXP $STEEM $ZRX $FCT $GAS  $STORJ $ETH $CVC  $SYS $LBC $DGB… https://t.co/Jd5tHcdvap,0
Sat May 12 19:10:04 +0000 2018,THE BEARS ARE SLOWLY LOSING CONTROL OF PRICES. THEY WILL HAVE MISSED THE OPPORTUNITIES TO COVER POSITIONS.   $OMG… https://t.co/dY1dEQS0YF,2
Sat May 12 19:08:36 +0000 2018,THE NEXT 24 HOURS WILL BE TELLING. MANY ALTS WILL BE UP 15-20 PERCENT AGAINST BTC. IMHO  $OMG $EXP $STEEM $ZRX $FCT… https://t.co/8rsChu3Pa7,0
Sat May 12 19:04:02 +0000 2018,ALTS ARE SHOWING GOOD RELATIVE STRENGTH VS. BTC  $OMG $EXP $STEEM $ZRX $FCT $GAS  $STORJ $ETH $CVC  $SYS $LBC $DGB… https://t.co/fQg92LuA5X,0
Sat May 12 18:59:47 +0000 2018,THIS IS STILL AN OPPORTUNITY OF A LIFETIME AT THESE LEVELS.  $OMG $EXP $STEEM $ZRX $FCT $GAS  $STORJ $ETH $CVC… https://t.co/hBJRPaxdNI,0
Sat May 12 18:58:16 +0000 2018,#PORNOGAY Getting Stuffed With A Big Cock - Marcus by Beef Cake Hunter   [FULLVID] https://t.co/6n4A0FEjvQ https://t.co/ahXmvhlgKC,757
Sat May 12 18:57:39 +0000 2018,#PORNOGAY Getting Fucked With A Straight Guy - Raymond by Beef Cake Hunter   [FULLVID] https://t.co/CxNZvrbI0I https://t.co/IA5gJoNaTc,310
Sat May 12 18:57:19 +0000 2018,#PORNOGAY Flavor Cum Shot - Harry Tequila by Beef Cake Hunter   [FULLVID] https://t.co/8dfqvJDDku https://t.co/hx64lawwgw,267
Sat May 12 18:51:57 +0000 2018,THIS IS A NEW BULL MARKET. WE ARE JUST STARTING .   $OMG $EXP $STEEM $ZRX $FCT $GAS  $STORJ $ETH $CVC  $SYS $LBC… https://t.co/bQmlrmzbgd,0
Sat May 12 18:49:17 +0000 2018,Doing a $NEO and $ETH giveaway 🎉 contest ends 2/1/18. 5 winners will be selected &amp; win a choice of $300 NEO/ETH 📈… https://t.co/TDGqNs2rVj,1060
Sat May 12 18:46:52 +0000 2018,Doing a $NEO and $ETH giveaway 🎉 contest ends 2/1/18. 5 winners will be selected &amp; win a choice of $300 NEO/ETH 📈… https://t.co/TDGqNs2rVj,1060
Sat May 12 18:46:16 +0000 2018,BULLS WILL REGAIN CONTROL OF 8500 HERE SHORTLY. THIS IS THE LAST OPPORTUNITY TO BUY CHEAP CRYPTO  $OMG $EXP $STEEM… https://t.co/VFOJ9h4v3c,0
Sat May 12 18:42:47 +0000 2018,IF YOU MISSED THE LAST RUN UP IN $BTC NOW IS THE TIME TO ACCUMULATE.  $OMG $EXP $STEEM $ZRX $FCT $GAS  $STORJ $ETH… https://t.co/NkAnJ3mXWS,1
Sat May 12 18:13:04 +0000 2018,@justicemate BTC and BCH are both inferior to hundreds maybe thousands of faster projects with better utility and less brand hijacking,0
Sat May 12 11:56:49 +0000 2018,Тестируем Новые Уровни. Обзор BitCoin BTC  Ripple XRP  BitCoinCash BCH  LiteCoin LTC: https://t.co/jn2m9A1rql,1
Sat May 12 11:54:09 +0000 2018,Тестируем Новые Уровни. Обзор BitCoin BTC  Ripple XRP  BitCoinCash BCH  LiteCoin LTC: https://t.co/jn2m9A1rql,1
Sat May 12 10:46:23 +0000 2018,@a3456gf @00rabbitmilk00 @cryptokita Bitcoin Core is a desktop node app compatible with the original Bitcoin networ… https://t.co/S64sp4kp6S,0
Sat May 12 10:29:29 +0000 2018,SHORT SELLERS WILL BE COVERING THEIR POSITIONS AT A LOSS AT MUCH HIGHER PRICES.  $OMG $EXP $STEEM $ZRX $FCT $GAS… https://t.co/IqGmYDs3ma,1
Sat May 12 10:28:50 +0000 2018,WE WILL SEE MORE ACTION LIKE WE SAW IN  $REP ALTCOINS ARE JUST WAITING TO EXPLODE UPWARD.  $OMG $EXP $STEEM $ZRX… https://t.co/K4LsjtN6Ph,0
Sat May 12 10:27:15 +0000 2018,BOTH $EOS AND $ZRX LOOK LIKE THEY COULD DOUBLE IN THE VERY SHORT TO MEDIUM TERM (NEXT 20 DAYS)  $OMG $EXP $STEEM… https://t.co/kZX62B9OXo,0
Sat May 12 10:25:30 +0000 2018,$CVC IS STILL STRONG HERE. WE WILL SEE MUCH HIGHER PRICES NEXT WEEK.  $OMG $EXP $STEEM $ZRX $FCT $GAS  $STORJ $ETH… https://t.co/fvJPeuFa9F,0
Sat May 12 10:19:56 +0000 2018,IT IS NOT FAR FETCHED TO BELIEVE THAT THE TOTAL MARKET CAP OF ALL CRYPTOS WILL NOT BE 1 TRILLION BY EOY.  $OMG $EXP… https://t.co/QBEqGGDfxY,0
Sat May 12 10:19:00 +0000 2018,REMEMBER -- GOLD HAS A MARKET CAP OF 7 TRILLION. BITCOIN IS GOLD 2.0 MUCH HIGHER PRICES ARE COMING.  $OMG $EXP… https://t.co/QP2TGxWEH8,0
Sat May 12 10:16:24 +0000 2018,THIS RALLY IS GOING TO HAVE LEGS. I DO NOT SEE ANY REASON WE CANNOT HIT 1 TRILLION MARKET CAP BY EOY.  $OMG $EXP… https://t.co/qjYvOV0CEq,0
Sat May 12 10:14:20 +0000 2018,THE MISTAKE MOST TRADERS HAVE IS TRYING TO TIME THE BOTTOM. YOU CAN'T TIME IT EXACTLY.  $OMG $EXP $STEEM $ZRX $FCT… https://t.co/27jCFndBqv,0
Sat May 12 10:11:17 +0000 2018,MY TARGET FOR SUNDAY MORNING IS 9K BTC.  $OMG $EXP $STEEM $ZRX $FCT $GAS  $STORJ $ETH $CVC  $SYS $LBC $DGB $GNT… https://t.co/L5oFUU9I5m,0
Sat May 12 10:10:39 +0000 2018,BULLS ARE NOW RECLAIMING THE 8500 TERRITORY. HIGHER PRICES ARE COMING.  $OMG $EXP $STEEM $ZRX $FCT $GAS  $STORJ… https://t.co/2i0BcwxwWW,3
Sat May 12 10:09:44 +0000 2018,THE GOOD NEWS IS THAT THE RALLY HAS ONLY JUST BEGUN.   $OMG $EXP $STEEM $ZRX $FCT $GAS  $STORJ $ETH $CVC  $SYS $LBC… https://t.co/7TDHkxajTS,0
Sat May 12 10:02:59 +0000 2018,MASSIVE AMOUNTS OF CAPITAL IS NOW ENTERING THE MARKET SCRAMBLING TO OBTAIN CRYPTO POSITIONS.  $OMG $EXP $STEEM $ZRX… https://t.co/SSPXKkWkVM,0
Sat May 12 10:00:00 +0000 2018,WE HAVE LIFTOFF  FOLKS.  $OMG $EXP $STEEM $ZRX $FCT $GAS  $STORJ $ETH $CVC  $SYS $LBC $DGB $GNT $STRAT $BURST $ARDR… https://t.co/rIqvV4QJkP,0
Sat May 12 09:59:31 +0000 2018,PEOPLE WHO SOLD AT THE LOW GOT REKT.  PEOPLE WHO HOLD STRONG WIN.  $OMG $EXP $STEEM $ZRX $FCT $GAS  $STORJ $ETH… https://t.co/CU0AJjhlW7,0
Sat May 12 09:58:46 +0000 2018,MASSIVE SHORT SQUEEZE. RULE NUMBER 1: NEVER SHORT CRYPTO RULE NUMBER 2: DON'T USE MARGIN.  $OMG $EXP $STEEM $ZRX… https://t.co/5j8E5ml4G5,0
Sat May 12 09:58:13 +0000 2018,BTC 8500 IS RIGHT HERE. WE ARE NOW IN CONTROL. BEARS ARE RETREATING HARD HERE.  $OMG $EXP $STEEM $ZRX $FCT $GAS… https://t.co/7TDk8Yjz1i,0
Sat May 12 09:57:42 +0000 2018,WE HAVE SURVIVED THE GREAT CRYPTO PANIC.  LONG TERM HOLDERS ARE GOING TO BE REWARDED.  $OMG $EXP $STEEM $ZRX $FCT… https://t.co/tcAVF0Isje,0
Sat May 12 09:57:05 +0000 2018,MASSIVE AMOUNTS OF MONEY IS POURING INTO CRYPTO RIGHT HERE. THIS WILL CONTINUE INTO THE WEEKEND.  $OMG $EXP $STEEM… https://t.co/reGk4SA9ir,0
Sat May 12 09:56:16 +0000 2018,THIS IS A GLOBAL GENERATIONAL BOOM. IT DOES NOT HAVE GEOGRAPHICAL BOUNDARIES. NEVER BEFORE IN HISTORY.  $OMG $EXP… https://t.co/W2EMzxmXC1,0
Sat May 12 09:55:31 +0000 2018,1 TRILLION DOLLAR MARKET CAP BY YEAR END IS DEFINITELY FEASIBLE  $OMG $EXP $STEEM $ZRX $FCT $GAS  $STORJ $ETH $CVC… https://t.co/1NdtJBeAIP,0
Sat May 12 09:54:54 +0000 2018,EVERY MAN WOMAN AND CHILD SHOULD HAVE A CRYPTO ACCOUNT.   THIS IS CRUCIAL.  $OMG $EXP $STEEM $ZRX $FCT $GAS  $STORJ… https://t.co/4AYxBJooIO,0
Sat May 12 09:53:26 +0000 2018,THE BEAR MARKET IS OVER. WE ARE IN ALTCOIN SEASON NOW.  $OMG $EXP $STEEM $ZRX $FCT $GAS  $STORJ $ETH $CVC  $SYS… https://t.co/YNUeFHIuCa,0
Sat May 12 09:52:44 +0000 2018,WE WILL SEE MORE WAVES OF BUYERS COMING BACK IN. PATIENCE.  $OMG $EXP $STEEM $ZRX $FCT $GAS  $STORJ $ETH $CVC  $SYS… https://t.co/GDMuEoLLju,0
Sat May 12 09:51:15 +0000 2018,I BELIEVE THAT BIG INSTITUTIONAL MONEY IS STARTING TO FLOOD INTO CRYPTO RIGHT NOW. HOLD   $OMG $EXP $STEEM $ZRX… https://t.co/ttx3kwNitW,0
Sat May 12 09:49:37 +0000 2018,BY SUNDAY MORNING EVERYTHING SHOULD BE UP 15-20 PERCENT FROM HERE. MARK THESE WORDS.  $OMG $EXP $STEEM $ZRX $FCT… https://t.co/hzbmKiT4nU,0
Sat May 12 09:46:49 +0000 2018,MONEY IS NOW FLOODING INTO CRYPTO.  $OMG $EXP $STEEM $ZRX $FCT $GAS  $STORJ $ETH $CVC  $SYS $LBC $DGB $GNT $STRAT… https://t.co/cDwNEJZpLC,0
Sat May 12 09:46:31 +0000 2018,THIS MARKET CAN TURN ON A DIME. VERY WISE TO HAVE EXPOSURE WHEN WE HAVE LIFTOFF.  $OMG $EXP $STEEM $ZRX $FCT $GAS… https://t.co/9M9OP78d82,0
Sat May 12 09:33:04 +0000 2018,WEIGHTED HEAVILY IN $ARDR $CVC $ZRX.  THESE 3 ARE SHOWING GREAT RELATIVE STRENGTH HERE.  $OMG $EXP $STEEM $ZRX $FCT… https://t.co/ez8x6SASWV,3
Sat May 12 09:14:11 +0000 2018,Still waiting for the perfect time to dump my $BCH   or should I say #shitCoinCash. RIP bitches   nice try  but we are #united. $BTC $XVG,0
Sat May 12 09:05:40 +0000 2018,$ZRX UPTREND STILL PERFECTLY INTACT. THIS ONE SHOULD DOUBLE IN THE NEXT FEW MONTHS.   $OMG $EXP $STEEM $ZRX $FCT… https://t.co/V3UWkqpilY,0
