Mon Oct 02 23:53:15 +0000 2017,$DXY Turnaround Tuesday Candidates Gold  USDJPY  DXY  SPX "Don't Isolate  Collaborate!" Intelligence gathering at i… https://t.co/xb891MxLX3,1
Mon Oct 02 23:33:32 +0000 2017,APMEX Gold and Silver Buying Review https://t.co/hV2z2HZ6uR,0
Mon Oct 02 23:27:30 +0000 2017,The true alchemists do not change lead into gold; they change the world into words. – William H. Gass,1
Mon Oct 02 23:09:17 +0000 2017,"How I met your mother" is absolute gold 🙏🏼,8
Mon Oct 02 23:01:41 +0000 2017,Hailey Geftman Gold is a vile  disgusting creature. This has gone too far.,0
Mon Oct 02 22:45:05 +0000 2017,Olympic champion Gabby Douglas shares how family  faith  and gymnastics keeps her humble. https://t.co/hUckvy5j4N,1
Mon Oct 02 22:44:41 +0000 2017,Olympic champion Gabby Douglas shares how family  faith  and gymnastics keeps her humble. https://t.co/hUckvy5j4N,1
Mon Oct 02 22:20:18 +0000 2017,#Litecoin adopted #SegregatedWitness &amp; the #LightningNetwork https://t.co/EeOloiwX8W #fintech #blockchain #crypto #payments #iot #ledger,0
Mon Oct 02 22:16:50 +0000 2017,"How I met your mother" is absolute gold 🙏🏼,8
Mon Oct 02 21:46:40 +0000 2017,"How I met your mother" is absolute gold 🙏🏼,8
Mon Oct 02 21:30:40 +0000 2017,#Gold #nanoparticles: most promising research is in #treatment of #cancer https://t.co/qTgUaXOeb3 #medtech #nano… https://t.co/bBh2iIP01W,0
Mon Oct 02 21:30:23 +0000 2017,Right wingers who condemn Hayley Geftman Gold &amp; embrace alex jones and pat robertson have #zeroCredibility. All three are wrong.,0
Mon Oct 02 21:22:06 +0000 2017,Find out who took home gold at the 2017 Pacific Paddle Games! #supconnect #ppg2017  Learn: https://t.co/KfR6GGd39S https://t.co/2F6PtYj5uj,1
Mon Oct 02 21:21:51 +0000 2017,Happy Tweet:  Kindness is good gold in the bank.  You can count on good returns.  - Sally Huss,0
Mon Oct 02 21:11:08 +0000 2017,Hayley Geftman-Gold is an example of a truely disturbed moron!!! https://t.co/AsmFJ805p2,1
Mon Oct 02 21:11:01 +0000 2017,Check out the scoop on @NPR: The Taming Of The Brew: How Sour Beer Is Driving A Microbial Gold Rush https://t.co/XOw8ReOZCi; #stayhungry,0
Mon Oct 02 21:08:56 +0000 2017,Hayley Geftman-Gold is an example of a truely disturbed moron!!! https://t.co/AsmFJ805p2,1
Mon Oct 02 20:50:20 +0000 2017,https://t.co/74ErdZgSqB "Luxury Gifts" Most Expensive 24kt Gold Gifts in World #Gift https://t.co/CfbmL3hRWI,0
Mon Oct 02 20:50:16 +0000 2017,also the gold bar too so I can recruit Sorn,0
Mon Oct 02 20:46:02 +0000 2017,👏👏 100% clean energy + gold -level 🚴 status https://t.co/T9Ikd8W1EZ,0
Mon Oct 02 20:44:28 +0000 2017,This is what the gays see when they look at a vagina https://t.co/KQKBQtsaaF,6599
Mon Oct 02 20:43:53 +0000 2017,keep a gold chain on my wrist,3
Mon Oct 02 20:43:38 +0000 2017,keep a gold chain on my wrist,3
Mon Oct 02 20:43:17 +0000 2017,keep a gold chain on my wrist,3
Mon Oct 02 20:43:10 +0000 2017,keep a gold chain on my wrist,3
Mon Oct 02 20:40:55 +0000 2017,@Mark_T_Willard @ohrnberger Rivers would look really good in purple &amp; gold. Flight to Minneapolis can't be much longer than drive to Carson,0
Mon Oct 02 20:37:54 +0000 2017,True Ambergris White Gold oil 3ml  Oceanic &amp; fresh this https://t.co/sIYwwIr1Hg via @Etsy,0
Mon Oct 02 20:32:45 +0000 2017,LMAOOOO RICK AND MORTY IS GOLD https://t.co/tT3M7KCbIq,9380
Mon Oct 02 20:25:49 +0000 2017,The hotel the shooter was in from my photo of the iHeart stage last week. Very sad now 😔 I had even said "wow what… https://t.co/IHBvOW4yKM,0
Mon Oct 02 20:25:06 +0000 2017,Antique Waltham Gold-Filled 1903 Pocket Watch by https://t.co/InvgIt8iJq via @Etsy,0
Mon Oct 02 20:20:37 +0000 2017,Acapulco Gold  https://t.co/Qh4yqlzkKP @ San Diego  California https://t.co/jVWguLp02U,0
Mon Oct 02 20:20:29 +0000 2017,#BITSHARES: what other #cryptocurrency #exchange allows trade in #gold &amp; #silver https://t.co/vtsbT0A7IS @bitshares #crypto #currencies,0
Mon Oct 02 20:13:46 +0000 2017,Hayley Geftman-Gold was fired from CBS.  GOOD! https://t.co/6ONjejBOhu,0
Mon Oct 02 20:05:03 +0000 2017,I was quoted in this article re:@thinkchulavista's new commitmnt to pursue gold level Bike Friendly Community status https://t.co/dzbR0ILJnP,0
Mon Oct 02 19:55:07 +0000 2017,$DXY Turnaround Tuesday Candidates Gold  USDJPY  DXY  SPX "Don't Isolate  Collaborate!" Intelligence gathering at i… https://t.co/xb891MxLX3,1
Mon Oct 02 19:30:32 +0000 2017,APMEX Gold and Silver Buying Review https://t.co/Hxnkg2Jl4P,0
Mon Oct 02 19:10:43 +0000 2017,@MarketWatch Cashless to me means giving gold more value and depleting the petrol dollar. Perfect strategy for many… https://t.co/LN8zWsIwe5,0
Mon Oct 02 18:38:17 +0000 2017,"How I met your mother" is absolute gold 🙏🏼,8
Mon Oct 02 18:24:12 +0000 2017,"How I met your mother" is absolute gold 🙏🏼,8
Mon Oct 02 18:22:33 +0000 2017,"How I met your mother" is absolute gold 🙏🏼,8
Mon Oct 02 18:22:22 +0000 2017,"How I met your mother" is absolute gold 🙏🏼,8
Mon Oct 02 18:22:09 +0000 2017,"How I met your mother" is absolute gold 🙏🏼,8
Mon Oct 02 18:21:19 +0000 2017,Mood all October https://t.co/5BVuH1VpHQ,1851
Mon Oct 02 18:20:51 +0000 2017,Since it's finally October I’m bringing back this iconic Tiffany Pollard moment😭 https://t.co/tG784pxgP6,2083
Mon Oct 02 18:20:25 +0000 2017,I didn’t live up to my full potential as a baby 😂 https://t.co/zqBUtqG7lp,7961
Mon Oct 02 18:20:22 +0000 2017,#Bitcoin does not need #Litecoin as much as #LTC needs #BTC https://t.co/EeOloiwX8W #fintech #blockchain #crypto #ethereum #payments #iot,0
Mon Oct 02 18:19:36 +0000 2017,The greatest commercial of all time 😭 https://t.co/SBQo7ylzCG,3895
Mon Oct 02 18:19:08 +0000 2017,When October hits and these start coming on &gt; https://t.co/o6wyq6IICk,7990
Mon Oct 02 18:15:19 +0000 2017,All that glitters isn't gold!  🙏🏽 @zacharye @BGR #deals #mobile  https://t.co/ReXbuBFmnM,0
Mon Oct 02 18:12:13 +0000 2017,"If I begged you from my knees   and said "pretty please?" Would you do my rose gold clit piercing for free......pretty please  baby...?",0
Mon Oct 02 17:58:03 +0000 2017,Find out who took home gold at the 2017 Pacific Paddle Games! #supconnect #ppg2017  Learn: https://t.co/KfR6GGd39S https://t.co/2F6PtYj5uj,1
Mon Oct 02 17:58:02 +0000 2017,Find out who took home gold at the 2017 Pacific Paddle Games! #supconnect #ppg2017  Learn: https://t.co/fUh2bVULSX https://t.co/hPSwV6GLbY,0
Mon Oct 02 17:53:40 +0000 2017,I liked a @YouTube video https://t.co/3so8Yb4pQS GOLD DIGGER PRANK PART 29!!! BF EXPOSES GF!!! | UDY Pranks,1
Mon Oct 02 17:42:36 +0000 2017,@1MoralUniverse @TgGRA @KurtSchlichter How do you define "bogus source " Mike? I've spent 30 years in academia  the… https://t.co/geyOX7jziB,0
Mon Oct 02 17:29:31 +0000 2017,Topaz Ring; 18k White Gold Blue Topaz Ring; Blue Topaz Ring; Sterling Sil… https://t.co/IN9Cnj6fIU #Etsy #SilverRing https://t.co/cLEsGFJKpQ,2
Mon Oct 02 17:18:22 +0000 2017,#freeRivers You would look great in Jaguars teal &amp; gold #gojags #sdtojax https://t.co/EafVXHCfW1,0
Mon Oct 02 17:17:00 +0000 2017,@justinsknight This is gold,0
Mon Oct 02 16:57:45 +0000 2017,i am not ashamed to admit i love GOD  because without him i am nothing.❤️,14350
Mon Oct 02 16:54:08 +0000 2017,@TheBrandonMorse @CBS Haley Gold is a horrible person. And so are you if you tolerate this.,0
Mon Oct 02 16:52:57 +0000 2017,@Jmalco @ChristineStins6 @nwarikoo I'm sorry the official colors of the Saint's are Black and "OLD Gold." You know old like #Tired #wornout,1
Mon Oct 02 16:52:05 +0000 2017,Gold Price Hits 6-Week Dollar Low as Euro Falls After Catalonia Vote https://t.co/XZYUTmwMIF,0
Mon Oct 02 16:42:51 +0000 2017,Saudi Billionaire Turki bin Abdullah's Gold Car Collection https://t.co/DmY5ugZpF9 https://t.co/RlfSrh2MTS,0
Mon Oct 02 16:19:38 +0000 2017,Rose gold Mercedes SLS  https://t.co/UYa06lR77r,0
Mon Oct 02 16:19:22 +0000 2017,Only silver? Girl  you should go for the gold. https://t.co/xjoU8fdRLc,2
Mon Oct 02 16:17:01 +0000 2017,Worst flight EVER. After boarding  a man deplaned when he learned his son was killed in the Las Vegas shootings. My heart breaks for him.,2951
Mon Oct 02 16:13:00 +0000 2017,The capitalists rob the planet  rip it open for oil and gold  and leave us with nothing but labor.,0
Mon Oct 02 15:51:52 +0000 2017,#GlobalView Wkly! #Commodities #News: #BaseMetal #PreciousMetals #Energy #Mining https://t.co/zGibPmd86C #gold… https://t.co/1JIw7q55bM,1
Mon Oct 02 15:15:30 +0000 2017,"#Gold #nanoparticles are unprecedented in their information content ”-- #HanadiSleiman #nano #science #technology… https://t.co/ct2XsajkGh,0
Mon Oct 02 15:09:12 +0000 2017,Check us out on ETSY for custom BUTT plugs!😈 . . Fox Tail Butt Plug (Gold) $19.99 . . Follow @mycustomplug We sell…… https://t.co/vahBRwGc5j,1
Mon Oct 02 15:03:53 +0000 2017,@gold_purple_purple I am acquiring difficulties justifying the cost tag vs . frequent PS4 … @gold_purple_purple I&amp;#39m acquiring difficul,0
Mon Oct 02 15:01:38 +0000 2017,Heading to San Antonio today for #SAFeSummit! Who's going? Let me know so we can meet up. https://t.co/d0xxTA18mk,0
Mon Oct 02 15:01:24 +0000 2017,Heading to San Antonio today for #SAFeSummit! Who's going? Let me know so we can meet up. https://t.co/kdi4DKYWs1,0
Mon Oct 02 14:46:09 +0000 2017,Winter is coming🌬❄☃️ DOUBLE TAP if youre ready for cuddle season😈 . . Fox Tail Butt Plug (Gold) $19.99 . . Follow …… https://t.co/bVzPIQx8pE,0
Mon Oct 02 14:35:28 +0000 2017,https://t.co/KoYDAp8dOW "Gold Lamps" Trending in Hollywood #Retweet #Trending https://t.co/Vt6OWLxJXv,0
Mon Oct 02 14:31:42 +0000 2017,PAVOI 14K Rose Gold Plated Thin Bar White Opal Necklace 16-18″ https://t.co/1iWI5Dr3WB,0
Mon Oct 02 14:25:26 +0000 2017,#Scientists can #recycle #CO2 by using #gold #nanoparticles. https://t.co/wUI3JnONVg #nano #science #particles… https://t.co/GjsgM1Rtse,0
