Sat Jan 05 22:46:14 +0000 2019,I liked a @YouTube video https://t.co/eYgrf2zkXi NIM: Bitcoin Logo  Markets Green  TRON Is Garbage  XRP Army  Stocks &amp; Anonymous,0
Sat Jan 05 22:23:55 +0000 2019,Went 5-3 in the challenge for top 32ish. Punted v KCI and may have punted against dredge  I'll post the picture lat… https://t.co/sPcVlfLlKl,0
Sat Jan 05 22:22:48 +0000 2019,Lowering the corporate tax rate to 21%  which is lower than it's been since 1938  is a lot more radical than taxing… https://t.co/oLTPg9oH1Y,1977
Sat Jan 05 22:16:57 +0000 2019,Seriously. Listen to the Tron Legacy score as you do errands. You’ll never feel more important.,0
Sat Jan 05 22:05:01 +0000 2019,i can’t stop watching this https://t.co/JAJ40TSs6q,33022
Sat Jan 05 18:21:47 +0000 2019,@cryptomocho Don’t know if it’s coincidence or not  but I’ve been using Tron a lot recently and it’s a pleasure. Tr… https://t.co/MN38zERidb,0
Sat Jan 05 16:14:22 +0000 2019,@deodat_adomako Your head tron. God go ask you 😂,0
Sat Jan 05 12:00:50 +0000 2019,Tronscan Malware Alert From Ledger #tron #trx #ledger 🤨 https://t.co/FhVUe9MuD5,1
Sat Jan 05 11:59:17 +0000 2019,Tronscan Malware Alert From Ledger #tron #trx #ledger 🤨 https://t.co/FhVUe9MuD5,1
Sat Jan 05 08:04:12 +0000 2019,Audi Is Making A Welcome Return To Super Bowl Advertising To Tout New E-Tron https://t.co/6ayUwZtSfC,0
Sat Jan 05 06:04:10 +0000 2019,@thefetztizzle @MikeHan36064472 @mishalederman @DavidJDAprile @CryptoGuyInZA @sesameseed_SR @Tronfoundation… https://t.co/5E32Zk7sY4,0
Sat Jan 05 05:39:10 +0000 2019,@MikeHan36064472 @thefetztizzle @mishalederman @DavidJDAprile @CryptoGuyInZA @sesameseed_SR @Tronfoundation… https://t.co/vg8BDjjw41,0
Sat Jan 05 03:11:03 +0000 2019,Poppy Live Event Tickets  Multiple Dates | Eventbrite #tron #trx $trx #poppy #poppypos #troncard #grid #sfo… https://t.co/uUnmCA4MGm,6
Sat Jan 05 03:06:06 +0000 2019,Poppy Live Event Tickets  Multiple Dates | Eventbrite #tron #trx $trx #poppy #poppypos #troncard #grid #sfo… https://t.co/uUnmCA4MGm,6
Sat Jan 05 00:39:01 +0000 2019,Does this mean all the characters in TRON are freaking out right now? #MAGfest https://t.co/WjvO1vyi2P,0
