Tue Sep 25 19:07:07 +0000 2018,https://t.co/GetcXc2u1M,0
Tue Sep 25 16:48:00 +0000 2018,Ripple Effect As National Grid Lockout Enters Third Month https://t.co/7VOED92J25,1
Tue Sep 25 16:42:54 +0000 2018,@Reverend_Ripple IF this is true  I would not be surprised that part of the deal is actually asking him to liquidat… https://t.co/5Bx2nm2lYu,0
Tue Sep 25 15:38:22 +0000 2018,Ripple Effect As National Grid Lockout Enters Third Month https://t.co/7VOED92J25,1
Tue Sep 25 15:32:22 +0000 2018,Trade  Buy or Sell #bitcoin #Ethereum #bitcoingold #Ripple #Zcash #dash #BitcoinCash &amp; #StellarLumens Plus deposit… https://t.co/x3A8OVLJ34,4
Tue Sep 25 14:23:34 +0000 2018,Imagine your ripple effect #MoreWomenMustWrite #Bosslady #WomenInBusiness #KeepWriting https://t.co/V0cpZUCmWp,0
Tue Sep 25 14:02:16 +0000 2018,There’s a ripple effect to losing trust  it doesn’t stop at customers  it’s partners  employees  investors etc..… https://t.co/yZs1Q75tlp,1
Tue Sep 25 13:28:11 +0000 2018,Weak Volumes: Ripple Tanks 15% as Crypto Market Deletes $13 Billion https://t.co/UQYGjRktTF #crypto #blockchain… https://t.co/G9VzAAAYIr,1
Tue Sep 25 13:27:36 +0000 2018,Weak Volumes: Ripple Tanks 15% as Crypto Market Deletes $13 Billion https://t.co/UQYGjRktTF #crypto #blockchain… https://t.co/G9VzAAAYIr,1
Tue Sep 25 13:20:04 +0000 2018,There’s a ripple effect to losing trust  it doesn’t stop at customers  it’s partners  employees  investors etc..… https://t.co/yZs1Q75tlp,1
Tue Sep 25 12:53:51 +0000 2018,"Iowa farmers could lose up to $2.2 billion from the U.S.'s trade wars  a new study shows  and those losses would r… https://t.co/OFfUi0b0mK,1
Tue Sep 25 11:33:51 +0000 2018,"Rise. You can't be neutral on a moving train." ~ #BeAVoter #PearlJam #ZINN   https://t.co/OB2CmINNIL 📸:… https://t.co/4eAdfipnva,3
Tue Sep 25 10:30:07 +0000 2018,What's behind the rise of #Ripple's #XRP: https://t.co/wp7qWQohYe,0
Tue Sep 25 10:12:04 +0000 2018,Ripple $XRP https://t.co/v5yBZ6XBn1,1
Tue Sep 25 10:08:52 +0000 2018,#XRP made huge leaps this past week – how new partnerships &amp; anticipation may be behind the bulls' eagerness:… https://t.co/cFU2kluN2f,6
Tue Sep 25 10:08:04 +0000 2018,Ripple (XRP) Erases Over 40% Gains ($9.5 Billion) as Top Coins Fall; What’s Next? https://t.co/1HeSU3Z8Vy #crypto… https://t.co/DNnSQGFUpF,1
Tue Sep 25 10:07:39 +0000 2018,Ripple (XRP) Erases Over 40% Gains ($9.5 Billion) as Top Coins Fall; What’s Next? https://t.co/1HeSU3Z8Vy #crypto… https://t.co/DNnSQGFUpF,1
Tue Sep 25 10:07:32 +0000 2018,Ripple $XRP https://t.co/v5yBZ6XBn1,1
Tue Sep 25 09:37:06 +0000 2018,Ripple’s partner SBI Remit collaborates with Japanese digital exchange to advance African businesses… https://t.co/pH3sZrnEBf,1
Tue Sep 25 09:36:15 +0000 2018,Ripple’s partner SBI Remit collaborates with Japanese digital exchange to advance African businesses… https://t.co/pH3sZrnEBf,1
Tue Sep 25 08:06:32 +0000 2018,Ripple’s Co-Founder Chris Larsen speaks about “creation of Internet of Value” https://t.co/tqt8AAiTuY #blockchain… https://t.co/ooiSRwJknD,1
Tue Sep 25 08:06:06 +0000 2018,Ripple’s Co-Founder Chris Larsen speaks about “creation of Internet of Value” https://t.co/tqt8AAiTuY #blockchain… https://t.co/ooiSRwJknD,1
Tue Sep 25 06:17:25 +0000 2018,$XRP Ripple XRP community hawkish towards Hive list - https://t.co/1QrJ1tRSnz,0
Tue Sep 25 06:16:22 +0000 2018,$XRP A newly found Ripple (XRP) connection leads to the president Trump - https://t.co/HrueH4POGT,0
Tue Sep 25 04:05:05 +0000 2018,Ripple’s Chris Larsen says globalization is “not a bad thing” https://t.co/hGgBiUW1TM #blockchain #cryptocurrency… https://t.co/6zq7bqYg05,1
Tue Sep 25 04:04:36 +0000 2018,Ripple’s Chris Larsen says globalization is “not a bad thing” https://t.co/hGgBiUW1TM #blockchain #cryptocurrency… https://t.co/6zq7bqYg05,1
Tue Sep 25 02:11:16 +0000 2018,$xrp #xrpthestandard...the standard of greed.  it's a security  and you fools have been helping this guy dump while… https://t.co/55Ymx4vtMv,2
Tue Sep 25 02:03:18 +0000 2018,$xrp #xrpthestandard...the standard of greed.  it's a security  and you fools have been helping this guy dump while… https://t.co/55Ymx4vtMv,2
Tue Sep 25 02:00:03 +0000 2018,$xrp #xrpthestandard...the standard of greed.  it's a security  and you fools have been helping this guy dump while… https://t.co/55Ymx4vtMv,2
Tue Sep 25 00:21:30 +0000 2018,#XRP made huge leaps this past week – how new partnerships &amp; anticipation may be behind the bulls' eagerness:… https://t.co/cFU2kluN2f,6
