Mon Jan 22 23:48:01 +0000 2018,Let's talk #Cryptocurrency in Overtown-Join @BlackTechWeek Jan 23 from 7-9pm @Tribe  for a fireside chat &amp; live-tap… https://t.co/GJ4MnnvmaG,1
Mon Jan 22 23:34:28 +0000 2018,6 Industries #Blockchain Will Disrupt In 2018 …https://t.co/JV5Xxbm896… #IoT #machinelearning #healthcare #fintech… https://t.co/JmIIqvH91e,4
Mon Jan 22 23:34:00 +0000 2018,6 Industries #Blockchain Will Disrupt In 2018 …https://t.co/JV5Xxbm896… #IoT #machinelearning #healthcare #fintech… https://t.co/JmIIqvH91e,4
Mon Jan 22 23:31:08 +0000 2018,6 Industries #Blockchain Will Disrupt In 2018 …https://t.co/JV5Xxbm896… #IoT #machinelearning #healthcare #fintech… https://t.co/JmIIqvH91e,4
Mon Jan 22 23:30:05 +0000 2018,6 Industries #Blockchain Will Disrupt In 2018 …https://t.co/JV5Xxbm896… #IoT #machinelearning #healthcare #fintech… https://t.co/JmIIqvH91e,4
Mon Jan 22 23:29:11 +0000 2018,6 Industries #Blockchain Will Disrupt In 2018 …https://t.co/JV5Xxbm896… #IoT #machinelearning #healthcare #fintech… https://t.co/JmIIqvH91e,4
Mon Jan 22 23:08:36 +0000 2018,South Korea's Cryptocurrency Crackdown Isn't Stopping This Bitcoin Exchange's Launch https://t.co/RXvr2W98bz https://t.co/VCsBujtceC,0
Mon Jan 22 23:03:02 +0000 2018,I found this article for you: - https://t.co/OcCYGaNbyX,0
Mon Jan 22 22:48:06 +0000 2018,#HODLing and #Patience are probably the two hardest skills to develop as a #Cryptocurrency investor.  Never sell du… https://t.co/jNaDi7FsaH,4
Mon Jan 22 22:47:40 +0000 2018,You should never buy high and sell low. We always BUY LOW and SELL HIGH to make the most money. Lets keep an eye on… https://t.co/C3x9hDuxDx,1
Mon Jan 22 22:44:48 +0000 2018,Bitcoin and other cryptocurrencies have become reliant on social media popularity. https://t.co/YK2rQ7zeVW via @WeRSM,1
Mon Jan 22 22:31:03 +0000 2018,Let's see how that plays out and its impact on the market $BTC $ETH $ICX $TRX $NEO #cryptocurrency #crypto https://t.co/bqUCKZDn0W,1
Mon Jan 22 22:28:23 +0000 2018,Let's see how that plays out and its impact on the market $BTC $ETH $ICX $TRX $NEO #cryptocurrency #crypto https://t.co/bqUCKZDn0W,1
Mon Jan 22 22:04:41 +0000 2018,“Bitcoin” by @nntaleb “. . . Bitcoin is an excellent idea. It fulfills the needs of the complex system  not because… https://t.co/E6so5Dexu7,0
Mon Jan 22 21:35:11 +0000 2018,KFC hops on the cryptocurrency craze with the #Bitcoin Bucket of chicken. https://t.co/UoyreIjZju via @WeRSM,0
Mon Jan 22 21:03:21 +0000 2018,Bitcoin and other cryptocurrencies have become reliant on social media popularity. https://t.co/YK2rQ7zeVW via @WeRSM,1
Mon Jan 22 20:59:07 +0000 2018,how to protect from cryptocurrency mining | operamini add's cryptomining blocker for smartphone's… https://t.co/9DdwmZ2kuc,0
Mon Jan 22 20:39:34 +0000 2018,The latest https://t.co/wOqHVt1ezo! https://t.co/Z1ykIiwRnn #fintech #cryptocurrency,0
Mon Jan 22 20:32:00 +0000 2018,Let's talk #Cryptocurrency in Overtown-Join @BlackTechWeek Jan 23 from 7-9pm @Tribe  for a fireside chat &amp; live-tap… https://t.co/GJ4MnnvmaG,1
Mon Jan 22 20:31:28 +0000 2018,I have an Article published in @IBTimes today on the #crypto price #bubble:  https://t.co/zY75MXchID,3
Mon Jan 22 20:22:29 +0000 2018,I have an Article published in @IBTimes today on the #crypto price #bubble:  https://t.co/zY75MXchID,3
Mon Jan 22 20:21:38 +0000 2018,A quote from one of the world's richest on when the time to buy is. It's not during the #AllTimeHigh  but when the… https://t.co/4gCeGCUFDR,2
Mon Jan 22 19:45:13 +0000 2018,When it comes to taxes it is GOOD to avoid  but BAD to evade.   Curious about how taxes will work this year with… https://t.co/WwVKwM94Mt,1
Mon Jan 22 19:30:54 +0000 2018,China’s Alibaba Quietly Launches Cryptocurrency Mining Platform https://t.co/D6N9dJZyRO,4
Mon Jan 22 19:30:14 +0000 2018,When it comes to taxes it is GOOD to avoid  but BAD to evade.   Curious about how taxes will work this year with… https://t.co/WwVKwM94Mt,1
Mon Jan 22 19:13:54 +0000 2018,I have an Article published in @IBTimes today on the #crypto price #bubble:  https://t.co/zY75MXchID,3
