Mon Mar 12 19:30:38 +0000 2018,@GrahamBarfield But his yards-after-contact are not as stellar. Rashaad Penny says hi.,0
Mon Mar 12 19:15:27 +0000 2018,And yes  you can report folk threatening others. It might not work  because twitter is less than stellar on this st… https://t.co/fxefFpqCjl,0
Mon Mar 12 19:13:29 +0000 2018,Stellar! We are working on a similar concept for age 30+ women's recreational leagues. #SoccerWomenPLAY… https://t.co/zRFSbn9BsC,0
Mon Mar 12 14:53:05 +0000 2018,Stellar https://t.co/mQBOgTucfr,16
Mon Mar 12 03:14:04 +0000 2018,#americanidol is back! Yay! Let’s make it a stellar year guys! #itsagirlsyear #hahajustkiddingthisisidol #wgwg,0
Mon Mar 12 02:31:48 +0000 2018,An iconic moment in modern day history https://t.co/LZtZzz3XHy,4007
