Wed Nov 14 21:46:08 +0000 2018,Join the Steem team at our NY location! Now hiring: Carpet Cleaning Technician https://t.co/4wcAnZZDK5… https://t.co/C1UjZUBzHU,0
Wed Nov 14 21:41:28 +0000 2018,Always use @Quora but have never been rewarded by their platform? Check out @musing_io built on the @SteemNetwork!… https://t.co/pyZgeYntT1,0
Wed Nov 14 17:42:47 +0000 2018,Fantasy Flashback Fall started With E'steem: The Sands of Time: https://t.co/k71VgTbwv6  @TheHeroBiz  cover is so A… https://t.co/IF5kC9DwAW,2
Wed Nov 14 17:29:41 +0000 2018,Fantasy Flashback Fall started With E'steem: The Sands of Time: https://t.co/k71VgTbwv6  @TheHeroBiz  cover is so A… https://t.co/IF5kC9DwAW,2
Wed Nov 14 01:19:19 +0000 2018,#RT @realnedscott: It was great to have some face-to-face time with the Steem community last week at SteemFest! https://t.co/MUPuknH2Ov,0
Wed Nov 14 01:12:17 +0000 2018,Getting a business going on Steem: 100 Steem Business Plan Competition! https://t.co/2fTzsVUjIy,11
Wed Nov 14 01:09:58 +0000 2018,The devilish diva is a demon no more in this POWERFUL E'steem Series story! https://t.co/kpuuL6E9uf YOU WILL GET THE FEELS FROM THIS STORY!,1
