Wed Jul 18 20:56:05 +0000 2018,Vlogger @thespenceryan and I discuss how creators can monetize their process and their product with #Steem: https://t.co/LxHhzQGBaw,3
Wed Jul 18 20:40:40 +0000 2018,We've just put out all the official details on our #steem voting whitelist. If you're a blockchain-based community… https://t.co/RS0C5VzIMt,1
Wed Jul 18 20:07:56 +0000 2018,Vlogger @thespenceryan and I discuss how creators can monetize their process and their product with #Steem: https://t.co/LxHhzQGBaw,3
Wed Jul 18 18:56:58 +0000 2018,We've just put out all the official details on our #steem voting whitelist. If you're a blockchain-based community… https://t.co/RS0C5VzIMt,1
Wed Jul 18 16:29:08 +0000 2018,Duplicate skilled traders automatically with Bitcoin! 💰💰  I copy "wangzai888". Do you?  ➡️ https://t.co/ccugf6Avn2… https://t.co/zSmCc9wicm,0
Wed Jul 18 15:16:07 +0000 2018,Vlogger @thespenceryan and I discuss how creators can monetize their process and their product with #Steem: https://t.co/LxHhzQGBaw,3
Wed Jul 18 14:57:49 +0000 2018,The devilish diva helps a lost little girl home in this FREE E'steem series adventure! https://t.co/F6gXOoCB9q,0
Wed Jul 18 14:46:22 +0000 2018,Vlogger @thespenceryan and I discuss how creators can monetize their process and their product with #Steem: https://t.co/LxHhzQGBaw,3
Wed Jul 18 13:23:04 +0000 2018,Duplicate successful traders automatically with Bitcoin! 💰💰  I copy "wangzai888". Do you?  ➡️… https://t.co/yrzUOGsIi3,0
Wed Jul 18 07:40:08 +0000 2018,Buy/Sell Bitcoin volatility with up to 100x Leverage at Bitmex! 💰🎉  Receive a 10% Fee Discount:  ▶️… https://t.co/KooVJcJMGQ,0
Wed Jul 18 06:09:15 +0000 2018,Buy/Sell Bitcoin moves with up to 100x Leverage at Bitmex! 💰🎉  Receive a 10% Fee Rebate:  ▶️… https://t.co/XvNFFcydbm,0
Wed Jul 18 04:57:18 +0000 2018,Buy/Sell Bitcoin changes with up to 100x Leverage at Bitmex! 💰🎉  Get a 10% Fee Rebate:  ▶️ https://t.co/95MQjPMtzE… https://t.co/HiZHXwEIJp,0
Wed Jul 18 01:26:43 +0000 2018,@liviusa Here are a few:  1. Lightning (just like Email its a series of protocols w/ a collection of apps speaking… https://t.co/KJ6qr7oo1w,0
