Thu Jun 07 21:25:42 +0000 2018,Community  I leave you the link in #Steemit of my new publication - Comunidad  les dejo el link de mi nueva publica… https://t.co/EtkX8y0JXE,0
Thu Jun 07 17:23:07 +0000 2018,The devilish diva is a demon no more in this POWERFUL E'steem Series story!  https://t.co/H28G10TqV0 YOU WILL GET THE FEELS FROM THIS STORY!,0
Thu Jun 07 15:55:02 +0000 2018,The #steem #blockchain provides tools for creative empowerment unlike anything we've seen in the internet era. Here… https://t.co/5CGfEY37bb,0
Thu Jun 07 12:02:53 +0000 2018,Based on a back of the envelope calc  Steem will acquire more than 1 000 000 new users in the next 6 months  as man… https://t.co/d6pXLeWERl,7
Thu Jun 07 07:37:03 +0000 2018,Binance registration is ONLINE Register link and BONUS ➡ https://t.co/dz5fzy0xia 🚀 06/07 03:37 $WETF $OFED $PKD… https://t.co/1RIIHfUAeh,0
Thu Jun 07 03:24:11 +0000 2018,Based on a back of the envelope calc  Steem will acquire more than 1 000 000 new users in the next 6 months  as man… https://t.co/d6pXLeWERl,7
Thu Jun 07 01:24:24 +0000 2018,Calling everyone out on what video to make next week  already have 2 projects in the works and 1 interview pending.… https://t.co/R20xtT0aGJ,1
Thu Jun 07 00:49:26 +0000 2018,Calling everyone out on what video to make next week  already have 2 projects in the works and 1 interview pending.… https://t.co/R20xtT0aGJ,1
Thu Jun 07 00:01:43 +0000 2018,$steem up much?,0
