Fri Jul 13 16:30:57 +0000 2018,Pondering what E'steem's new nickname will be post Ascencion.  Should I call her the Aspiring angel or Hell's Aspiring Angel?,0
Fri Jul 13 16:30:14 +0000 2018,The devilish diva is a demon no more in this POWERFUL E'steem Series story! https://t.co/kpuuL6E9uf YOU WILL GET THE FEELS FROM THIS STORY!,0
Fri Jul 13 16:18:17 +0000 2018,The devilish diva helps a lost little girl find her way home in this FREE E'steem Series adventure! https://t.co/F6gXOoCB9q,0
Fri Jul 13 16:17:38 +0000 2018,The devilish diva goes undercover to stop a cookie crook in this FREE E'steem series adventure! https://t.co/h3f8pt2YJn,0
Fri Jul 13 14:20:33 +0000 2018,@IllustratorMan @sallirichardson New blog up about Bill Walko's AWESOME E'steem: The Sands of Time Cover: https://t.co/C2ebtpUMb3,0
Fri Jul 13 14:20:20 +0000 2018,New blog up about @TheHeroBiz AWESOME E'steem: The Sands of Time Cover: https://t.co/C2ebtpUMb3,0
Fri Jul 13 13:01:50 +0000 2018,Long/Short Bitcoin moves with up to 100x Leverage at Bitmex! 💰🎉  Get a 10% Fee Discount:  ▶️… https://t.co/DVy8EOzgRv,0
Fri Jul 13 08:15:03 +0000 2018,Replicate lucrative traders automatically with Bitcoin! 💰💰  I copy "wangzai888". Do you?  ➡️… https://t.co/UXHr6NUSvo,0
Fri Jul 13 08:12:47 +0000 2018,For a brief period EOS  Bitshares  and Steem all occupied the top three spots for the most active public blockchain… https://t.co/I4lNi5XSAd,48
