Fri Jul 06 22:26:19 +0000 2018,#Cybersecurity #mining #Ransomware #virus https://t.co/hkBnDx7x7c,1
Fri Jul 06 22:25:13 +0000 2018,#Cybersecurity #mining #Ransomware #virus https://t.co/hkBnDx7x7c,1
Fri Jul 06 21:01:30 +0000 2018,This infamous trojan is now giving criminals the ability to infect victims either with a #ransomware cryptor or a m… https://t.co/qj03uBD8Of,2
Fri Jul 06 21:01:03 +0000 2018,This infamous trojan is now giving criminals the ability to infect victims either with a #ransomware cryptor or a m… https://t.co/qj03uBD8Of,2
Fri Jul 06 19:46:08 +0000 2018,This infamous trojan is now giving criminals the ability to infect victims either with a #ransomware cryptor or a m… https://t.co/qj03uBD8Of,2
Fri Jul 06 17:56:37 +0000 2018,Text mining is one of the most common use cases of @RapidMiner. Check out this new webinar with @sgenzer on using R… https://t.co/c9xdWFM2FG,9
Fri Jul 06 17:24:19 +0000 2018,Uranium mining in the Grand Canyon watershed? Not if we can help it.   You can help protect this iconic place — sig… https://t.co/27dzws4Gug,1
Fri Jul 06 17:04:04 +0000 2018,See why 2018 is already the year of #cryptocurrency mining #malware  replacing #ransomware as a top threat. https://t.co/LCz1VT6Rzh,0
Fri Jul 06 17:03:53 +0000 2018,#Rakhni Trojan now able to deploy #cryptocurrency mining #malware  finds @Kaspersky https://t.co/FS8shQrn5F via @ZDNet,0
Fri Jul 06 16:22:23 +0000 2018,Unlucky dip: This malware delivers either #ransomware or #cryptocurrency mining software to your PC… https://t.co/GQfFDlK4ZY,2
Fri Jul 06 16:21:25 +0000 2018,Unlucky dip: This malware delivers either #ransomware or #cryptocurrency mining software to your PC… https://t.co/GQfFDlK4ZY,2
Fri Jul 06 16:20:56 +0000 2018,Unlucky dip: This malware delivers either #ransomware or #cryptocurrency mining software to your PC… https://t.co/GQfFDlK4ZY,2
Fri Jul 06 16:12:19 +0000 2018,Your smart fridge is doing what? https://t.co/Hb6hYvVVkL,0
Fri Jul 06 14:19:28 +0000 2018,@olivierjanss The big blockers own Bitcoin dot com  @ Bitcoin  r/btc  appear on CNBC  and have millions of follower… https://t.co/Mn5Y7USOQo,1
Fri Jul 06 13:08:08 +0000 2018,@olivierjanss The big blockers own Bitcoin dot com  @ Bitcoin  r/btc  appear on CNBC  and have millions of follower… https://t.co/Mn5Y7USOQo,1
Fri Jul 06 05:40:31 +0000 2018,DANGER! Congress is about to vote on legislation to strip and eliminate the Endangered Species Act and Marine Mamma… https://t.co/zvex7THVRS,1183
Fri Jul 06 05:00:42 +0000 2018,URGENT: Trump is trying to hand over Grand Staircase-Escalante National Monument to a Canadian mining company. Sign… https://t.co/s9lJ070FJq,0
Fri Jul 06 03:27:50 +0000 2018,Learn key steps of #DataWrangling — importing data into R  tidying data  string processing  HTML parsing  working w… https://t.co/IOIrxDdHet,2
Fri Jul 06 01:09:20 +0000 2018,@benjaminwittes If mining bitcoin constitutes creating a work under DMCA  transferring the bitcoin as you described… https://t.co/QWkFUVnwKH,0
