Sun Nov 25 22:34:43 +0000 2018,@Tr0llyTr0llFace Do you have any proof that XRP has rented ASIC mining?  No?  Lot of miners shutting down  you woul… https://t.co/84zohfUZ15,0
Sun Nov 25 21:01:16 +0000 2018,Check out MattBenati in this 90-Second #Video Nugget where he shares exactly how he uses #EmailMarketing to elimina… https://t.co/JDWr6xxIAH,0
Sun Nov 25 20:45:37 +0000 2018,Love to see ppl claim Bitcoin can't go to zero because "they'll buy it all at $0.0000001" but not...explain how the… https://t.co/BrZu6IWlbs,0
Sun Nov 25 20:30:06 +0000 2018,Top 5 domains Big Data analytics helps to transform https://t.co/EUrB3qxjX8,0
Sun Nov 25 17:41:33 +0000 2018,See that land off to the right. The part that sparkles in the morning sun  sacred to Native Americans? At 6am on Fr… https://t.co/kqHNEwu1u0,548
Sun Nov 25 16:51:43 +0000 2018,Can we all agree to stop including word clouds in posts/articles on "text mining"?  If they must be included  the s… https://t.co/QXPSn5k1el,0
Sun Nov 25 16:14:59 +0000 2018,60 percent of the world’s deposit of #cobalt comes from #Congo in #Africa. #Greentechnology #Electriccars… https://t.co/ngXW6SXz7t,0
Sun Nov 25 14:59:33 +0000 2018,It is a true moonshot but worth it! $4 Billion Moon Water Mining Operation for $2.4 Billion Per Year Business https://t.co/Td2G7DI6hT,0
Sun Nov 25 13:11:41 +0000 2018,How the Space Mining Industry Came Down to Earth https://t.co/du7DbH85lG,0
Sun Nov 25 12:31:42 +0000 2018,@CryptoTANL1 Test net 2.0 in 10 days with real mining support.,0
Sun Nov 25 11:25:20 +0000 2018,The Economist | The seas are lovely  dark and deep via @TheEconomist https://t.co/5XEecgNcy0,0
Sun Nov 25 11:01:27 +0000 2018,Reply email mining produces sales-ready leads directly from the target accounts you're already engaging.… https://t.co/8iCCrNxtb7,0
Sun Nov 25 07:12:04 +0000 2018,Interview: https://t.co/HA8FUHnz4L’s Alejandro de la Torre on Bitcoin  Crypto Mining  &amp; Whether Satoshi is Female… https://t.co/3BFBB2P0nn,0
Sun Nov 25 06:34:04 +0000 2018,See that land off to the right. The part that sparkles in the morning sun  sacred to Native Americans? At 6am on Fr… https://t.co/kqHNEwu1u0,548
