Wed Apr 11 23:10:16 +0000 2018,Bitcoin  Ethereum  Bitcoin Cash  Ripple  Stellar  Litecoin  Cardano  NEO  EOS: Price Analysis  April 11… https://t.co/Hm7BkkfQBG,0
Wed Apr 11 23:04:00 +0000 2018,Ethereum Q&amp;A: Smart contract platforms https://t.co/qtdabvwVtp #cryptocurrency #blockchain #ai #bitcoin #ethereum #bitqy,0
Wed Apr 11 20:22:43 +0000 2018,Ethereum Market Cap Achieves $51.90 Billion (ETH) https://t.co/2IQBota3gz #cryptocurrency #blockchain #ai #bitcoin #ethereum #bitqy,1
Wed Apr 11 20:22:01 +0000 2018,Ethereum Market Cap Achieves $51.90 Billion (ETH) https://t.co/2IQBota3gz #cryptocurrency #blockchain #ai #bitcoin #ethereum #bitqy,1
Wed Apr 11 20:09:40 +0000 2018,@APompliano @ethereum,0
Wed Apr 11 18:46:15 +0000 2018,Bitcoin  Ethereum  Bitcoin Cash  Ripple  Stellar  Litecoin  Cardano  NEO  EOS: Price Analysis  April 11 https://t.co/mG4CbXGOSh,0
Wed Apr 11 17:46:31 +0000 2018,Coinbase Launches a PayPal Like Plugin For Ethereum  Bitcoin  Bitcoin Cash and Litecoin https://t.co/sOJSrs4VWX… https://t.co/Qp4culZ6YM,3
Wed Apr 11 17:44:25 +0000 2018,Coinbase Launches a PayPal Like Plugin For Ethereum  Bitcoin  Bitcoin Cash and Litecoin https://t.co/sOJSrs4VWX… https://t.co/Qp4culZ6YM,3
Wed Apr 11 17:39:24 +0000 2018,Coinbase Launches a PayPal Like Plugin For Ethereum  Bitcoin  Bitcoin Cash and Litecoin https://t.co/sOJSrs4VWX… https://t.co/Qp4culZ6YM,3
Wed Apr 11 17:38:06 +0000 2018,Coinbase Launches a PayPal Like Plugin For Ethereum  Bitcoin  Bitcoin Cash and Litecoin https://t.co/sOJSrs4VWX… https://t.co/Qp4culZ6YM,3
Wed Apr 11 16:09:22 +0000 2018,What caused the decline of #Ether by more than 70% of its value since its historical peak on January 14  2018? -… https://t.co/IgsPFtadZK,1
Wed Apr 11 15:30:32 +0000 2018,What caused the decline of #Ether by more than 70% of its value since its historical peak on January 14  2018? -… https://t.co/IgsPFtadZK,1
Wed Apr 11 14:40:02 +0000 2018,Bitcoin  Ethereum Grow 18% On The Week  Markets In Green https://t.co/2jH7MFW1iM #cryptocurrency #blockchain #ai #bitcoin #ethereum #bitqy,0
Wed Apr 11 13:30:02 +0000 2018,Don’t wanna miss a thing? Watch Vladimir Kurochkin  the president of #TheAbyss  presenting the project at the recen… https://t.co/MrEH8MnHcB,0
Wed Apr 11 13:26:49 +0000 2018,This is undYoubtedly the most excellent project on the market from the existing ones. I tell everyone about You and… https://t.co/NNArC1NWzI,0
Wed Apr 11 13:11:50 +0000 2018,Datareum airdrop is also ongoing  we are airdropping 16.6 million tokens. #tokens #BTC #EOS #Airdrops #freetoken… https://t.co/a7X2lvSqfc,0
Wed Apr 11 13:05:01 +0000 2018,'Blockchain' is a meaningless term https://t.co/UUaOxmo5LG #cryptocurrency #blockchain #ai #bitcoin #ethereum #bitqy,0
Wed Apr 11 10:49:10 +0000 2018,Revolutional #ICO project in exchange sphere Don't wait  just hit and registered Yourself with#AKAIITO  #ICO… https://t.co/6Qf9i6iNvm,1
Wed Apr 11 10:05:14 +0000 2018,Revolutional #ICO project in exchange sphere Don't wait  just hit and registered Yourself with#AKAIITO  #ICO… https://t.co/6Qf9i6iNvm,1
Wed Apr 11 07:25:08 +0000 2018,What is #BlockChain?  #fintech #CryptoCurrency #AI #ML #IoT #IoE #Bitcoin #Crypto #BigData #DLT #CyberSecurity #BTC… https://t.co/0qwUjefgq0,57
Wed Apr 11 06:04:25 +0000 2018,The future of payments with #Blockchain  #Bitcoin #Fintech #AI #IoT #SaaS #SMM #Bigdata #digital #Ethereum… https://t.co/wEsceJviXn,21
Wed Apr 11 03:18:06 +0000 2018,#bitcoin #btc #eth #coinbase #millionaire #ethereum #usd #binaryoptions #cryptocurrency #blockchain #trading… https://t.co/wMiCphftjz,0
Wed Apr 11 03:17:43 +0000 2018,#bitcoin #btc #eth #coinbase #millionaire #ethereum #usd #binaryoptions #cryptocurrency #blockchain #trading… https://t.co/jdahmmIOpo,0
Wed Apr 11 02:58:23 +0000 2018,Strong team with a great project. Love to be a part of this movement and wishing a successful to all team members a… https://t.co/G20psWjxij,0
Wed Apr 11 01:07:24 +0000 2018,ETH-BTC Ethereum Price Update on Request by the Audience on the LIVEstream on Twitch https://t.co/ZYKjFRiePN,0
Wed Apr 11 00:29:26 +0000 2018,Tomorrow is our first general meeting at the SLC 2.303 from 7-9pm! The first 5 people will receive a free Ethereum… https://t.co/dURKbbs61d,0
Wed Apr 11 00:15:42 +0000 2018,12 de mayo 2018 Bitcoin &amp; Ethereum Crypto Summit #BECS Estaremos presentes en la #Conferencia. Noahs Event Center.… https://t.co/8XFhziaQYl,4
Wed Apr 11 00:15:21 +0000 2018,12 de mayo 2018 Bitcoin &amp; Ethereum Crypto Summit #BECS Estaremos presentes en la #Conferencia. Noahs Event Center.… https://t.co/8XFhziaQYl,4
