Wed May 16 23:33:59 +0000 2018,We have the ability to accept payments via multiple cryptocurrencies including Bitcoin  Bitcoin Cash  Ethereum  and… https://t.co/XMEyCH49mn,4
Wed May 16 23:04:00 +0000 2018,How secure is blockchain really? https://t.co/EPebdJM4VS #cryptocurrency #blockchain #ai #bitcoin #ethereum #bitqy,0
Wed May 16 21:39:26 +0000 2018,It's a technical type of day. #binance #cryptocurrency #cryptocurrencies #bitcoin #ethereum #btc #litecoin #ltc… https://t.co/3kDe4jd4Xk,0
Wed May 16 21:05:09 +0000 2018,Lack Of Bitcoin At Consensus  Ethereum Alliance News And HTC Has A Bitcoin/ Ethereum Phone  By The Modern Investor  https://t.co/ICxdyWMFox,0
Wed May 16 20:22:00 +0000 2018,How the ethereum blockchain saved this China #MeToo letter from censor https://t.co/5bmnk8b7A0 #cryptocurrency… https://t.co/U1F8DjgSgz,0
Wed May 16 19:49:16 +0000 2018,@AriDavidPaul @nic__carter jps_ makes a pretty compelling case it could be viewed as a synthetic put -- your though… https://t.co/UQjktSIUr4,0
Wed May 16 19:36:01 +0000 2018,I'm very happy to share that the BECS Bitcoin + Ethereum Crypto  Summit was a HUGE success! We have secured a title… https://t.co/lgLQBBmdGI,2
Wed May 16 19:34:41 +0000 2018,I'm very happy to share that the BECS Bitcoin + Ethereum Crypto  Summit was a HUGE success! We have secured a title… https://t.co/lgLQBBmdGI,2
Wed May 16 19:06:00 +0000 2018,This is one of the best articles about the real use applications of the blockchain in the art industry. For any art… https://t.co/9RFenjQy7f,0
Wed May 16 17:38:03 +0000 2018,Cardano (ADA) &amp; Ethereum (ETH) Soar https://t.co/t3vfbavSVn #cryptocurrency #blockchain #ai #bitcoin #ethereum #bitqy,0
Wed May 16 17:20:09 +0000 2018,I'm very happy to share that the BECS Bitcoin + Ethereum Crypto  Summit was a HUGE success! We have secured a title… https://t.co/lgLQBBmdGI,2
Wed May 16 16:47:50 +0000 2018,We need to promote creative minds and protect the creativity. Ideas come from imagination! #art #artwork #artworks… https://t.co/HPoLVxcfl9,0
Wed May 16 16:19:10 +0000 2018,TD Ameritrade Put An Actual Ad on the Bitcoin Blockchain https://t.co/9yTwtfTUoi #cryptocurrency #blockchain #ai #bitcoin #ethereum #bitqy,0
Wed May 16 16:05:52 +0000 2018,#Crypto #bitcoin #cryptocurrency #btc #blockchain #ethereum #eth #love #market #news #business #Currency #trading… https://t.co/IHcyCudQq7,2
Wed May 16 14:52:23 +0000 2018,Proof of Work  or  Proof of Stake ? That is the question.  #cryptocurrency #Consensus2018 #ProofofWork… https://t.co/W6aXsla9Aa,0
Wed May 16 14:40:00 +0000 2018,Ethereum more Decentralized Than Bitcoin? https://t.co/OeriRHhnwS #cryptocurrency #blockchain #ai #bitcoin #ethereum #bitqy,0
Wed May 16 14:15:11 +0000 2018,Enterprise Ethereum Alliance Unveils Common Blockchain Standards https://t.co/q2sOXDUgaO,0
Wed May 16 14:14:30 +0000 2018,Ethereum Futures Watch: CME Group Says It’s Gauging Client Interest https://t.co/rWerB60hDl,0
Wed May 16 13:46:34 +0000 2018,Enterprise Ethereum Alliance Releases Client Specifications To Facilitate Interoperability https://t.co/so5URlwuId,0
Wed May 16 13:05:01 +0000 2018,How One Woman Found Opportunity in Blockchain https://t.co/UjHRIJFjTz #cryptocurrency #blockchain #ai #bitcoin #ethereum #bitqy,0
Wed May 16 11:51:34 +0000 2018,This is very important achievement by your project. You can improve this rating with your team and your dediction.g… https://t.co/cgYct4QqDT,0
Wed May 16 11:49:13 +0000 2018,a project that will succeed in the future with the hard work of the team. #moneytoken #IMT #ICO #Crowdsale #Bitcoin… https://t.co/DIp2jxnYfN,0
Wed May 16 11:41:12 +0000 2018,HTC Announces ‘Exodus ’ New Smartphone for Decentralized Bitcoin and Ethereum Apps https://t.co/KOCaU8h9j7,0
Wed May 16 08:56:32 +0000 2018,#ICO #Crowdsale #Bitcoin #Blockchain #Token #ETH #Ethereum #TokenSale https://t.co/SbP0EFsgcl,0
Wed May 16 08:42:23 +0000 2018,#moneytoken #IMT #ICO #Crowdsale #Bitcoin #Blockchain #Token #ETH #Ethereum # https://t.co/jCVKQNhyL0,1
Wed May 16 08:29:31 +0000 2018,: #TRIWER #TRW #TriwerDelivery #Ethereum # Bitcoin #Blockchain https://t.co/lFOOFFvgLA,0
Wed May 16 08:20:46 +0000 2018,#EQUI  #VentureCapital #ether #ethereum #bitcoin #cryptocurrency #ICO  #tokensale # https://t.co/8Hn7zY9oMM,0
Wed May 16 07:56:24 +0000 2018,Kimera is a good project with a revolutionary idea. Kimera platform will power decentralized knowledge sharing netw… https://t.co/jwPUwUCiq3,0
Wed May 16 06:57:02 +0000 2018,#Ethereum  #Bitcoin  #Blockchain https://t.co/OzaxCzVwuN,0
Wed May 16 06:45:23 +0000 2018,#TriwerDelivery  #Ethereum  #Blockchain https://t.co/hwyhkMEGbd,0
Wed May 16 06:33:22 +0000 2018,#TriwerDelivery  #Ethereum #Bitcoin  #Blockchain https://t.co/oV8nAhXd0H,0
Wed May 16 06:19:47 +0000 2018,#Ethereum  #Bitcoin  #Blockchain https://t.co/vudPZEvDXd,0
Wed May 16 04:45:06 +0000 2018,#Ethereum  #Bitcoin  #Blockchain https://t.co/npVZAb8WUU,0
Wed May 16 03:01:48 +0000 2018,If you are interested in Finance and passive income  then ICO is a great way to implement this idea  join us!… https://t.co/yfiRclUOdb,0
Wed May 16 02:52:09 +0000 2018,The company is developing rapidly and improving  it has a great future  I recommend everyone to invest in this comp… https://t.co/E0slxVCZoK,0
Wed May 16 02:20:59 +0000 2018,Casper: What Is Known About The New Ethereum’s Network Upgrade?  Let’s see what is known about “possibly the most s… https://t.co/PI3dDflVYQ,0
Wed May 16 01:03:15 +0000 2018,CME in Partnership With UK Exchange Launches Ethereum Index https://t.co/GVD9FhYkoc,0
Wed May 16 00:54:11 +0000 2018,Ethereum (ETH/USD) Technical Analysis (May 16  2018) https://t.co/HnZ3kGO90y,0
Wed May 16 00:09:21 +0000 2018,#Crypto #bitcoin #cryptocurrency #btc #blockchain #ethereum #eth #love  #market #news #business #Currency #trading… https://t.co/MMbGsri9SM,1
Wed May 16 00:05:00 +0000 2018,Move Over Ethereum: RSK to Enable Smart Contracts on Bitcoin Blockchain https://t.co/yD5tUPjnEt,0
