Thu Jan 18 23:46:37 +0000 2018,@DiaryofaMadeMan I tried to get in! It was a disaster. Very poorly executed. I ended up having to go to stellar ter… https://t.co/U9lJDa8yoN,0
Thu Jan 18 23:02:12 +0000 2018,Yes  you CAN publish a book that reads like a traditionally published book. But you need a stellar editorial team:… https://t.co/FmwSmJB2xT,0
Thu Jan 18 19:17:01 +0000 2018,How To Build Stellar Product Messaging for #SaaS Companies - via @linktexting https://t.co/3oeN7W9J6l https://t.co/Xlmx9VRJ2G,0
Thu Jan 18 18:44:19 +0000 2018,Newsweek's servers were photographed. that's some stellar preservation of evidence. Lol https://t.co/sHEETUaI25,0
Thu Jan 18 17:46:24 +0000 2018,Special Congratulations to @_genemoore on his Stellar award nomination! https://t.co/JZjCtTyv8u,0
Thu Jan 18 06:41:22 +0000 2018,I am still going to do those character drawings through out the week- I was just very busy today and received some… https://t.co/gBEKoolp9i,0
Thu Jan 18 04:19:10 +0000 2018,Forrest Whitley of the Astros is the No. 2-ranked RHP pitching prospect in baseball https://t.co/eABDLzHdNJ,75
Thu Jan 18 03:23:56 +0000 2018,@SHPawdcast I’m amazed at how much Tulane has improved over last year.  Dunleavy’s doing a stellar job.,0
