Thu Dec 20 23:44:42 +0000 2018,I hope y’all are going!! Caught them here and it was stellar! https://t.co/hOxujKbjM9,0
Thu Dec 20 21:20:44 +0000 2018,$NKE beats on Q2 revenue and EPS.   EPS: $0.52 vs $0.45 exp Rev: $9.37b vs $9.16b exp  Hopefully we get some holida… https://t.co/fn9izOfj5B,0
Thu Dec 20 21:09:55 +0000 2018,From the @ChicagoReader comes this stellar review of @bayankochicago  #Ravenswood's hottest new restaurant!  Learn… https://t.co/KTi5sosQja,1
Thu Dec 20 20:51:54 +0000 2018,Another great show in the can. Listen and learn! Kudos to @itastesound for some stellar artwork! https://t.co/22Q3QLEbva,0
Thu Dec 20 20:50:36 +0000 2018,with the help of a stellar colleague  we were able to piece together:  standing up a read only domain controller… https://t.co/eAoULhCoF1,0
Thu Dec 20 20:50:03 +0000 2018,Turns out @LaurenceWHolmes was right again. A Clan Called Wu is stellar.,0
Thu Dec 20 20:46:29 +0000 2018,From the @ChicagoReader comes this stellar review of @bayankochicago  #Ravenswood's hottest new restaurant!  Learn… https://t.co/KTi5sosQja,1
Thu Dec 20 20:15:23 +0000 2018,@Falthiere THANK U DIRK URS ARE STELLAR TOO 😭😭,0
Thu Dec 20 19:55:27 +0000 2018,Wrestling World Champion J'den Cox @MATrix_8692 joins us on today's episode. We talk about him being world champ  h… https://t.co/O4Z1vysCK1,7
Thu Dec 20 19:36:02 +0000 2018,Our project zenith goal is to be an NFC wristband used by them all. #Stellar #Bitcoin #Ethereum #Ripple @StellarOrg… https://t.co/u1xk00E1SW,6
Thu Dec 20 19:24:47 +0000 2018,The rumors are true. We’re adding Stellar &amp; we’ve got $125M worth of XLM to give away. Claim yours here! https://t.co/HDEyosuys3,0
Thu Dec 20 19:20:06 +0000 2018,Given you (stellar) coverage of the Flyover... shouldn't the mayor name it after you?  :) https://t.co/jBPHZQxhr8,0
Thu Dec 20 18:36:24 +0000 2018,Agreed! Calvados and slivovica too. My favorite local restaurant has a stellar brandy selection. https://t.co/hGbEoZTgLY,0
Thu Dec 20 18:22:16 +0000 2018,Our project zenith goal is to be an NFC wristband used by them all. #Stellar #Bitcoin #Ethereum #Ripple @StellarOrg… https://t.co/u1xk00E1SW,6
Thu Dec 20 18:06:11 +0000 2018,Chicago House Music had a stellar year.  We are home to some of the most incredible talent and this year was no dif… https://t.co/lHsxqMfu8G,0
Thu Dec 20 17:54:22 +0000 2018,@JerryDunleavy I think we need to ask ourselves why so many talented and gifted and resourceful people get suicidal… https://t.co/ev8sFKAmxg,0
Thu Dec 20 17:08:57 +0000 2018,This didn`t take much to :) 🚀 #Stellar $XLM https://t.co/UxNlEXVcf7,0
Thu Dec 20 17:01:06 +0000 2018,@DominicBolden94 Prove to me that this is nothing more than a pump and dump penny scam with 1.5 billion worthless s… https://t.co/gERca4jZfH,0
Thu Dec 20 15:24:04 +0000 2018,Our project zenith goal is to be an NFC wristband used by them all. #Stellar #Bitcoin #Ethereum #Ripple @StellarOrg… https://t.co/u1xk00E1SW,6
Thu Dec 20 15:09:32 +0000 2018,Our project zenith goal is to be an NFC wristband used by them all. #Stellar #Bitcoin #Ethereum #Ripple @StellarOrg… https://t.co/u1xk00E1SW,6
Thu Dec 20 12:29:49 +0000 2018,Not a stellar year from many of us  work-wise. A story from @neilhimself has consistently helped me feel better  an… https://t.co/VgSPu3S5iV,0
Thu Dec 20 11:40:06 +0000 2018,Crypto Market Update: Stratis (STRAT)  Stellar (XLM)  Bitcoin Cash  ADA Price Analysis - https://t.co/SnOoXDwAiw https://t.co/8BQAibLfTv,0
Thu Dec 20 06:19:58 +0000 2018,Our project zenith goal is to be an NFC wristband used by them all. #Stellar #Bitcoin #Ethereum #Ripple @StellarOrg… https://t.co/u1xk00E1SW,6
Thu Dec 20 05:59:30 +0000 2018,Our project zenith goal is to be an NFC wristband used by them all. #Stellar #Bitcoin #Ethereum #Ripple @StellarOrg… https://t.co/u1xk00E1SW,6
Thu Dec 20 05:09:08 +0000 2018,Our project zenith goal is to be an NFC wristband used by them all. #Stellar #Bitcoin #Ethereum #Ripple @StellarOrg… https://t.co/u1xk00E1SW,6
Thu Dec 20 04:58:04 +0000 2018,BOOM. So proud of these guys. Accomplished a stellar product in less than a year with like 10 people.  A product I'… https://t.co/Qimcp5r7cz,2
Thu Dec 20 03:39:44 +0000 2018,Some beautiful images from @adlerplanet's stellar (haha) collection.  Let's Imagine the Moon! https://t.co/uQgxQj2vSM,5
Thu Dec 20 02:36:35 +0000 2018,Relaxing after a stellar day. Received both Team and Division MVP at work today for the 2018 year  which is humblin… https://t.co/ahzQmWUNXn,0
Thu Dec 20 02:35:45 +0000 2018,@realedc30 @theWellRedMage @GeekWithThat @joelethrailkill @Limitless5e @SethTrav @BILB0FR4GGINS @goldenagenerd… https://t.co/j5GmOyZnmj,0
Thu Dec 20 02:19:03 +0000 2018,Some beautiful images from @adlerplanet's stellar (haha) collection.  Let's Imagine the Moon! https://t.co/uQgxQj2vSM,5
Thu Dec 20 02:06:49 +0000 2018,These 28 Brilliant Books by Black Authors Are the Standouts in What Was a Stellar Year in Black Literature https://t.co/QDeR4gemm7,5
Thu Dec 20 02:04:55 +0000 2018,Wilson play been stellar this season. He been having great games all year and is responsible for the Seahawks(8-6)b… https://t.co/JCiJJvA0Vo,0
Thu Dec 20 01:53:54 +0000 2018,Thanks for the stellar review! A tag from #Tags4Tails is an "awesome stocking stuffer." https://t.co/r4hk5LWFzh,0
Thu Dec 20 01:30:00 +0000 2018,While Corey Crawford’s injury opened the door for Collin Delia to join the Hawks  the latter's consistently stellar… https://t.co/jNpMl3AIFh,0
