Wed Jun 06 22:45:35 +0000 2018,SEC's Clayton: 'Come See Us' If You Want to Do an ICO https://t.co/BXQPBzPYGi https://t.co/jYbcKjMdBW,1
Wed Jun 06 22:45:22 +0000 2018,SEC's Clayton: 'Come See Us' If You Want to Do an ICO https://t.co/BXQPBzPYGi https://t.co/jYbcKjMdBW,1
Wed Jun 06 17:19:19 +0000 2018,ICO Azbit Announces Public Sale of AZS Security Tokens https://t.co/NVl8oX4MtX https://t.co/YkKa7gH0s4,0
Wed Jun 06 16:58:18 +0000 2018,Who is the best on transaction speed ? Litecoin or Bitcoin ? #cryptoexchange #altcoinalerts #cryptofacto… https://t.co/jL6ckZ1uaF,0
Wed Jun 06 13:15:20 +0000 2018,Former #NBA Commissioner #David_Stern Backs Sports Streaming ICO https://t.co/7vWKmPzV7d https://t.co/AAMNklUe63,0
Wed Jun 06 12:50:11 +0000 2018,France could be 1st EU country to create rules for digital-asset offerings not anchored in past security laws https://t.co/ElXWWWlbuE,0
Wed Jun 06 11:52:11 +0000 2018,#GigTricks #GigTricksICO #ICO #Cryptocurrency #Blockchain https://t.co/PLvgyuWloo,0
Wed Jun 06 11:52:07 +0000 2018,#GigTricks #GigTricksICO #ICO #Cryptocurrency #Blockchain https://t.co/n5Ukcnkpuq,0
Wed Jun 06 11:51:07 +0000 2018,#ico #volt #volttech #eth https://t.co/jZsHMZNEoV,0
Wed Jun 06 11:47:19 +0000 2018,Be one of the first who will receive coins of this company! The surprising and perspective project. #ICO #Diro #DiroToken #DiroLabs,0
Wed Jun 06 11:27:02 +0000 2018,Korea's Unique Ability To Make Its Reverse #ICO Fad Permanent: Expert Take https://t.co/hlPzbKAcgE https://t.co/5WhOiksHmL,1
Wed Jun 06 11:25:52 +0000 2018,Korea's Unique Ability To Make Its Reverse #ICO Fad Permanent: Expert Take https://t.co/hlPzbKAcgE https://t.co/5WhOiksHmL,1
Wed Jun 06 11:05:47 +0000 2018,This project will grow up very fast! Hurry  Join now.  https://t.co/rJRrbwVV3q   #Crypto #Blockchain… https://t.co/TD7FLbGvfi,0
Wed Jun 06 11:05:13 +0000 2018,There are thousands of ICOs like Kimera  even going on right now   but unfortunately  most of them are scams or fak… https://t.co/hdaKLRKYwY,0
Wed Jun 06 11:02:34 +0000 2018,Powering decentralized blockchain sharing networks. Good luck to everyone involved in the development of the projec… https://t.co/vRhgMuj0gJ,0
Wed Jun 06 11:01:26 +0000 2018,I'm inspired! A very seriYous approach to implementation. A team with highly qualified specialists. Success is immi… https://t.co/Yr6wgpi6Mh,0
Wed Jun 06 07:23:46 +0000 2018,A huge variety of services can be purchased by investors for tokens of https://t.co/SafEGfCR2r Investments company … https://t.co/a5EKXbOeZw,0
Wed Jun 06 07:21:54 +0000 2018,A great team that has done a lot of work to improve our future. I really like this project and join.  #GREENISH… https://t.co/QRPReSZXbE,0
Wed Jun 06 07:12:38 +0000 2018,Powering decentralized blockchain Global Risk Exchange sharing networks. Don't miss Your chance to earn profit from… https://t.co/Oh6y8GqGL1,0
Wed Jun 06 07:10:45 +0000 2018,A very interesting idea! I'm sure it will be in great demand! I am sure  that everything will work out as the proje… https://t.co/2xwiPINbH2,0
Wed Jun 06 07:07:40 +0000 2018,Kimera  You don't know what to do in your free time? Look at this interesting  project.  #KimeraAGI #AI #ICO… https://t.co/ZrKMajXLkh,0
Wed Jun 06 07:05:56 +0000 2018,CERTORE  an extraordinary venture! consistently we hear extraordinary news from this project. I'm soo glad to join… https://t.co/w65hq19518,0
Wed Jun 06 06:55:58 +0000 2018,Meet the excellent overview of the Iagon platform  which can globally improve the effectiveness of digital advertis… https://t.co/qWDQzZj44R,0
Wed Jun 06 06:49:28 +0000 2018,Very promising project  hard team. Good luck on ICO. Donn't miss Your time!joined right now.… https://t.co/vv9j4USS4E,0
Wed Jun 06 06:47:23 +0000 2018,The project is just a bomb  the guys are working for glory. A very interesting project that will bring great benefi… https://t.co/gNAgxpSC4i,0
Wed Jun 06 04:45:45 +0000 2018,#MB8Coin #ICO #BTC #ETH #Youtube https://t.co/NXKtbM1UnV,0
Wed Jun 06 04:44:22 +0000 2018,The most interesting project to date! very much attracted someone else's attention! I'm a part of! #TYDO #trading #terminal #ico #preico,0
Wed Jun 06 01:30:08 +0000 2018,We're Waiting for ICO Bubble to Pop: Head of Binance's $1 Billion Fund https://t.co/D6BSeEGC90,0
Wed Jun 06 00:57:36 +0000 2018,Me  thinking about that night I was gonna drop $20 on Bitcoin ICO but instead went out and blew $150 on a Saturday… https://t.co/K5jqisibnh,0
Wed Jun 06 00:14:19 +0000 2018,Former NBA Commissioner David Stern Backs Sports Streaming ICO https://t.co/w3SyHGM2RJ https://t.co/yGSiSCUvz4,0
