Wed Sep 26 17:15:49 +0000 2018,Venture ecosystem: businesses can engage our ecosystem of consultants  accelerators  and venture funds to increase… https://t.co/NLK6WQ61U1,0
Wed Sep 26 17:04:36 +0000 2018,The team has done their job splendidly! This project is not only professionally made  but also absolutely breaking… https://t.co/EAlwgys65c,0
Wed Sep 26 16:54:53 +0000 2018,Based on the CBNT Token operating system  content creators  viewers  and the CBNT community will become stakeholder… https://t.co/bFAEYX7TT5,0
Wed Sep 26 16:52:08 +0000 2018,#ICO   This project is very interesting for seriYous investment! Join now.. #W12,0
Wed Sep 26 16:48:54 +0000 2018,#sishub #anonymity #tokensale #ico #STEEL #STEELmessenger #infosec https://t.co/ulaH8WXbin,0
Wed Sep 26 16:48:02 +0000 2018,Do you know the benefits of living in the Dominican Republic? One of the most important reasons is the low cost of… https://t.co/rp8vXrckLB,0
Wed Sep 26 16:44:42 +0000 2018,The data is generated in conjunction with #ICO Scores will tell stories and identify opportunities in a way that ha… https://t.co/9RyhXHcw3z,1
Wed Sep 26 16:43:34 +0000 2018,The data is generated in conjunction with #ICO Scores will tell stories and identify opportunities in a way that ha… https://t.co/9RyhXHcw3z,1
Wed Sep 26 16:36:05 +0000 2018,GTN tokens Holders - Will be co-owners of equipment purchased with funds collected after the ICO  and will receive… https://t.co/wIZkUR8apC,0
Wed Sep 26 16:34:23 +0000 2018,What's good in #Securix? Their  goal is to make Blockchain and cryptographic technology simple and accessible to a… https://t.co/gOogR2CMz2,0
Wed Sep 26 16:30:18 +0000 2018,The traditional real estate investing market is antiquated. The times of needing large  onhand capital reserves to… https://t.co/W8F2DOL8GE,0
Wed Sep 26 16:28:31 +0000 2018,#Sarf #ICO https://t.co/7hxh7Xv80W,0
Wed Sep 26 16:27:28 +0000 2018,The first important step in this case is to validate data from primary sources. The encrypted mechanism is used by… https://t.co/h3SFnu7BlX,0
Wed Sep 26 16:26:05 +0000 2018,Our whitepaper has been published &amp; we're proud to release it to the public. Download it  sign up for our whitelist… https://t.co/1jwsBSZrNC,0
Wed Sep 26 16:23:25 +0000 2018,Finding good partners is the key to success in anything: in business  in marriage and  especially  in investing… https://t.co/AibWSshARE,0
Wed Sep 26 16:20:35 +0000 2018,#tmoneyio The key to the success of this project lies in an excellent idea and a  super team of developers. If you… https://t.co/6eOZJ4ZkaL,0
Wed Sep 26 16:03:32 +0000 2018,#everlife_ai #ico #btc #eth Our Chief Architect  Fredrik W Engberg representing https://t.co/9h5nUKUeid     at the… https://t.co/RW6rVF2wDp,0
Wed Sep 26 13:34:32 +0000 2018,This is really a very prospective and very interesting project. Those who are looking for where to invest money  ta… https://t.co/g0CP0aFlAR,0
Wed Sep 26 13:32:44 +0000 2018,"Friends! Trecento Join new innovative project  which is best decentralized sharing network.  @TrecentoBC #ICO… https://t.co/LvE3K9gOgQ,0
Wed Sep 26 13:19:19 +0000 2018,I jokingly talked about a #cryptocurrency just for #plasticsurgery about a year ago. It's real!!! https://t.co/pR8nWE23Gh,0
Wed Sep 26 04:07:30 +0000 2018,I represent to your attention the company  which has huge goals and plans. The coolest and most modern ICO. The mai… https://t.co/Xak17M52yv,0
Wed Sep 26 04:07:04 +0000 2018,https://t.co/e9VvMmz8GX    https://t.co/uFSvbF2xKH   #EyeGlobNet  #ICO  #Blockchain  #eyehealthcare #cryptocurrency… https://t.co/SyyR2wKbQj,0
Wed Sep 26 04:06:04 +0000 2018,Cool project with interesting team management. This ico has already closed. I think it will be great project.… https://t.co/FzGDDVJ5gx,0
Wed Sep 26 04:05:32 +0000 2018,Extraordinary venture! It's very good that the project has received such a great publicity arYound the world. #ICO #REMCO #REMITTANCE,0
Wed Sep 26 04:05:06 +0000 2018,Very interesting idea  good team of professionals  I am in ICO for sure! #ico #Crypkart #Crypkartexchange,1
Wed Sep 26 04:04:47 +0000 2018,Very interesting idea  good team of professionals  I am in ICO for sure! #ico #Crypkart #Crypkartexchange,1
Wed Sep 26 04:03:19 +0000 2018,The  KALC creates an incentive for getting #ICO and usage of the substantial educational subjects and the device; m… https://t.co/iuULdiMbeo,0
Wed Sep 26 03:59:53 +0000 2018,#ICO I alone cannot change the world  but together we can!!! Join now in this project! #ICO #zamzambank #Zamzam… https://t.co/FndQ3zMIIr,0
Wed Sep 26 03:58:23 +0000 2018,The cryptocurrency allows to feel more freely. And this project allows to sell the knowledge for cryptocurrency wor… https://t.co/NytVMv8W9P,0
Wed Sep 26 03:58:12 +0000 2018,FINANCEX EXCHANGE holders can reant a car using FINANCEX EXCHANGE in certain Mediterranean countries  purchase flig… https://t.co/9Jdxrg8cOq,0
Wed Sep 26 03:57:52 +0000 2018,This is one of the best ico that ive ever seen and have a unique idea. https://t.co/wNhePszXEb  #Fameone #ICO… https://t.co/8Cge6xV3yG,1
Wed Sep 26 03:57:00 +0000 2018,Really like how Your team works! We can see all the latest updates and to follow the development of the project.… https://t.co/2EmIyczdpQ,0
Wed Sep 26 03:56:39 +0000 2018,This is one of the best ico that ive ever seen and have a unique idea. https://t.co/wNhePszXEb  #Fameone #ICO… https://t.co/8Cge6xV3yG,1
Wed Sep 26 03:55:00 +0000 2018,Another step into the future  a Very promising project  taking into  consideration the universal growth of kryptony… https://t.co/JWrvhekQtD,0
Wed Sep 26 03:54:00 +0000 2018,Very promising project  I highly recommend that you look at this project. #KryptoSEA #ico,0
Wed Sep 26 03:48:27 +0000 2018,#ICO   Don't miss the opportunity to invest a project like this! Great project! Join now...🔥🔥🔥 #neogame… https://t.co/RIVaKZYm3K,0
Wed Sep 26 03:46:53 +0000 2018,Dear friends  investors you have a chance to make a successful investment this year! don't lose your chance! ! Join… https://t.co/CnTL2bakOG,0
Wed Sep 26 03:45:03 +0000 2018,ICO which will blow up the market according to experts and I also agree with them. So get your money and join a rel… https://t.co/54jmmgllep,0
Wed Sep 26 03:41:50 +0000 2018,I'm surprised that there are people who are not familiar with this project. Hurry to get acquainted  the project is… https://t.co/enpSJqLXIe,0
Wed Sep 26 03:41:14 +0000 2018,This project suits You if You dream of getting rich! I have been investing in ICO for a long time and I can confide… https://t.co/SXii3xvhQI,0
Wed Sep 26 03:38:23 +0000 2018,This project includes a number of best things: great team  great product  great idea  great start! We need products… https://t.co/PXUwb9rszX,0
Wed Sep 26 03:37:15 +0000 2018,UniFox ICO live now!  I advise everyone to consider this project. #UniFox #cryptocurrency #bitcoin #cryptocurrency #blockchain #crypto #ico,0
Wed Sep 26 03:33:27 +0000 2018,You think about big money  but do not know where to make money? This is a unique offer to invest in a very promisin… https://t.co/PifCEHePmF,0
Wed Sep 26 03:28:15 +0000 2018,https://t.co/8SdNQdYkoK is an interesting #ICO that stands out from the crowd. Their target is one of the sacred co… https://t.co/17b8VvSOK2,0
Wed Sep 26 03:26:51 +0000 2018,Soon we will have ICO. Join us  participate and contribute! Together  we will bring the price of our tokens up. #TMONEY,0
Wed Sep 26 03:25:32 +0000 2018,Great company.After reading all the information about this promising project realized that he has a great future. I… https://t.co/qycbtovBvc,0
Wed Sep 26 03:24:23 +0000 2018,The developers did a good job on this project a great idea which is good for investiruya and investors I would like… https://t.co/GD0Z4b6Z9w,0
Wed Sep 26 03:19:57 +0000 2018,Be one of the first who will receive coins of this company!   The surprising and perspective project. #ICO $VRH #VR #AI #Blockchain,0
Wed Sep 26 03:18:29 +0000 2018,Gain insights into Your audiences at the #ICO level with  LOCALTRADE introduces Partners Earn Tokens feature! You c… https://t.co/IFntsVYgBX,0
Wed Sep 26 03:17:38 +0000 2018,https://t.co/e9VvMmQJyv    https://t.co/uFSvbFk8Cf   #EyeGlobNet  #ICO  #Blockchain  #eyehealthcare #cryptocurrency… https://t.co/nNvZ9226fF,0
Wed Sep 26 03:15:48 +0000 2018,This is the perfect spot to join this growing community. The learning's and assistance for all is a powerful one. T… https://t.co/0I7H6EesxX,0
Wed Sep 26 03:12:18 +0000 2018,Great technical solution  great team. Success is imminent I believe in the idea and implementation of the project.… https://t.co/Rv8Mu0s3FP,0
Wed Sep 26 03:10:12 +0000 2018,Advertisers use #ICO to advertise through our platform  and gain access to our bot free market data.  @TrecentoBC… https://t.co/PB2gc8Tegz,0
