Sun Oct 14 16:58:45 +0000 2018,You are thinking and looking for yourself an investment opportunity. It is fortunate to have come to you at this mo… https://t.co/EI9Sxdc5N8,0
Sun Oct 14 16:46:49 +0000 2018,@DBC_IO This is a good  interesting project with a strong team. Thanks to the professional activities of the team m… https://t.co/K5hIKoWqYy,0
Sun Oct 14 16:29:03 +0000 2018,Why is that possible to give such high potential ICO-project? These guys have done their ICO with a soul. It will b… https://t.co/KU4fzxrHpZ,0
Sun Oct 14 16:16:44 +0000 2018,FinanceX are creating an interexchange network between countries supporting their fiat! FNX token will be exposed t… https://t.co/t3SfdtQi7f,0
Sun Oct 14 16:14:48 +0000 2018,This is a great project so quickly join and do not let you regret it. Great work of developers will give the result… https://t.co/MYZ5a3LYGu,0
Sun Oct 14 16:04:25 +0000 2018,A secure network to ensure privacy and decentralization of all data and all information relevant to vulnerable popu… https://t.co/u7DZmiRMR6,0
Sun Oct 14 15:54:27 +0000 2018,CAREON ERC20 (Ethereum) platform is develop for interaction between researchers  developer and hybrid vehicle manuf… https://t.co/zZfYbuz26t,0
Sun Oct 14 03:24:09 +0000 2018,I never researched penny stocks for gems and I have to admit I’m not interested in researching ICO’s and new coins for gems either.,0
