Mon Dec 31 19:52:30 +0000 2018,ALCEDO is a blockchain powered #ICO sharing platform which enables consumers and experts to prove their #ICO in man… https://t.co/4lD9t7QZVM,0
Mon Dec 31 19:38:32 +0000 2018,People invest in cryptocurrencies  in their technology and think about the future  they want to contribute to a bri… https://t.co/KHDbAZh8GO,0
Mon Dec 31 19:08:12 +0000 2018,The interesting project with great concept and solid team. Become part of an excellent team and a strong project… https://t.co/eZURHGTJtH,0
Mon Dec 31 19:06:43 +0000 2018,#SmartContractChain #SmartContractChain.io #ICO #SCC https://t.co/NvHuiOrqkA,0
Mon Dec 31 19:05:27 +0000 2018,Have time to invest in Future Energy wonderful project!There's very little time left! https://t.co/ZhyuwcgPH0 #MetaMorphPro #METM #ICO,0
Mon Dec 31 19:01:34 +0000 2018,PETL Token project is very serious and reliable for investment. The company has already implemented many successful… https://t.co/0Kvq5WLw6r,0
Mon Dec 31 17:06:27 +0000 2018,Join LYFE today  this company has high ratings  excellent staff and competent programmers! #ICO #LyfeICO #Lyfe   @lyfetoken,0
Mon Dec 31 12:36:43 +0000 2018,It is very hard to find a good project in Your days. Good luck guys! Very promising #ICO. #DOGE  #BTG  #TUSD  #DAI  #TPAY,0
Mon Dec 31 12:32:10 +0000 2018,Very interesting project  I advise to see #ICO @aqua_intel #ICO,0
Mon Dec 31 12:32:03 +0000 2018,Thank you all for creating the AQX best community! Your social channels are growing with incredible pace. We truly… https://t.co/eQQpLSPKf9,0
Mon Dec 31 12:31:56 +0000 2018,Applies blockchain technology to realise its as a sYource of value  and to store information of value to all users… https://t.co/kV64jb7GtL,0
Mon Dec 31 00:22:11 +0000 2018,Good project. I like the concept of MitoshiCryptoLotto project. It waiting for financial success. If you want to pa… https://t.co/U92icLXXs2,0
